{
  "comments": [
    "I hava a plugin that runs a Job (which I have configured for testing purposes)\nto fail with an IStatus.ERROR (via setJobStatus in its progress monitor). The\nsecond job that is run (and fails with an ERROR status) causes Eclipse to go\ninto an infinite loop reporting a NullPointerException as shown in the .log file\nexcerpt below. One must stop the Eclipse process (e.g. via Windows Task\nManager), closing the workspace does not stop the process.\n\nThe only workaround I\u0027ve found in my code is to change all job return ERROR\nstatus values to WARNING.\n\nThe code works correctly in 3.1M7 and fails in 3.1RC2 and RC3 (we just discovered\nthis today). In RC3, the NPE occurs in JobErrorDialog.refresh() because the\n\"dialogArea\"\nfield is null, but the \"dialog\" field of the ErrorNotificationManager is not null.\nTracing throguh the logic my program executed, the key difference seems to be in\nErrorNotificationManager.openErrorDialog -- in M7 the \"dialog\" field was cleared\nwhile\nin RC3 it is not. Since I have no insight into the rationale for the changes, I\u0027ll\nleave it to the Eclipse developers to analyze further, but this should point you to\na likely piece of code. \n\n!SESSION 2005-06-21 13:03:15.343 -----------------------------------------------\neclipse.buildId\u003dI20050617-1618\njava.version\u003d1.4.2_07\njava.vendor\u003dSun Microsystems Inc.\nBootLoader constants: OS\u003dwin32, ARCH\u003dx86, WS\u003dwin32, NL\u003den_US\nCommand-line arguments:  -os win32 -ws win32 -arch x86\n\n!ENTRY org.eclipse.ui 4 4 2005-06-21 13:04:22.375\n!MESSAGE Unhandled event loop exception\n\n!ENTRY org.eclipse.ui 4 0 2005-06-21 13:04:22.375\n!MESSAGE Failed to execute runnable (java.lang.NullPointerException)\n!STACK 0\norg.eclipse.swt.SWTException: Failed to execute runnable\n(java.lang.NullPointerException)\n\tat org.eclipse.swt.SWT.error(SWT.java:2940)\n\tat org.eclipse.swt.SWT.error(SWT.java:2863)\n\tat org.eclipse.swt.widgets.Synchronizer.runAsyncMessages(Synchronizer.java:121)\n\tat org.eclipse.swt.widgets.Display.runAsyncMessages(Display.java:3047)\n\tat org.eclipse.swt.widgets.Display.readAndDispatch(Display.java:2706)\n\tat org.eclipse.ui.internal.Workbench.runEventLoop(Workbench.java:1699)\n\tat org.eclipse.ui.internal.Workbench.runUI(Workbench.java:1663)\n\tat org.eclipse.ui.internal.Workbench.createAndRunWorkbench(Workbench.java:367)\n\tat org.eclipse.ui.PlatformUI.createAndRunWorkbench(PlatformUI.java:143)\n\tat org.eclipse.ui.internal.ide.IDEApplication.run(IDEApplication.java:103)\n\tat\norg.eclipse.core.internal.runtime.PlatformActivator$1.run(PlatformActivator.java:226)\n\tat org.eclipse.core.runtime.adaptor.EclipseStarter.run(EclipseStarter.java:376)\n\tat org.eclipse.core.runtime.adaptor.EclipseStarter.run(EclipseStarter.java:163)\n\tat sun.reflect.NativeMethodAccessorImpl.invoke0(Native Method)\n\tat sun.reflect.NativeMethodAccessorImpl.invoke(NativeMethodAccessorImpl.java:39)\n\tat\nsun.reflect.DelegatingMethodAccessorImpl.invoke(DelegatingMethodAccessorImpl.java:25)\n\tat java.lang.reflect.Method.invoke(Method.java:324)\n\tat org.eclipse.core.launcher.Main.invokeFramework(Main.java:334)\n\tat org.eclipse.core.launcher.Main.basicRun(Main.java:278)\n\tat org.eclipse.core.launcher.Main.run(Main.java:973)\n\tat org.eclipse.core.launcher.Main.main(Main.java:948)\nCaused by: java.lang.NullPointerException\n\tat org.eclipse.ui.internal.progress.JobErrorDialog.refresh(JobErrorDialog.java:96)\n\tat\norg.eclipse.ui.internal.progress.ErrorNotificationManager$2.runInUIThread(ErrorNotificationManager.java:113)\n\tat org.eclipse.ui.progress.UIJob$1.run(UIJob.java:93)\n\tat org.eclipse.swt.widgets.RunnableLock.run(RunnableLock.java:35)\n\tat org.eclipse.swt.widgets.Synchronizer.runAsyncMessages(Synchronizer.java:118)\n\t... 18 more\n\n!ENTRY org.eclipse.ui 4 4 2005-06-21 13:04:22.375\n!MESSAGE Unhandled event loop exception\n\n!ENTRY org.eclipse.ui 4 0 2005-06-21 13:04:22.391\n!MESSAGE Failed to execute runnable (java.lang.NullPointerException)\n!STACK 0\norg.eclipse.swt.SWTException: Failed to execute runnable\n(java.lang.NullPointerException)\n\tat org.eclipse.swt.SWT.error(SWT.java:2940)\n\tat org.eclipse.swt.SWT.error(SWT.java:2863)\n\tat org.eclipse.swt.widgets.Synchronizer.runAsyncMessages(Synchronizer.java:121)\n\tat org.eclipse.swt.widgets.Display.runAsyncMessages(Display.java:3047)\n\tat org.eclipse.swt.widgets.Display.readAndDispatch(Display.java:2706)\n\tat org.eclipse.ui.internal.Workbench.runEventLoop(Workbench.java:1699)\n\tat org.eclipse.ui.internal.Workbench.runUI(Workbench.java:1663)\n\tat org.eclipse.ui.internal.Workbench.createAndRunWorkbench(Workbench.java:367)\n\tat org.eclipse.ui.PlatformUI.createAndRunWorkbench(PlatformUI.java:143)\n\tat org.eclipse.ui.internal.ide.IDEApplication.run(IDEApplication.java:103)\n\tat\norg.eclipse.core.internal.runtime.PlatformActivator$1.run(PlatformActivator.java:226)\n\tat org.eclipse.core.runtime.adaptor.EclipseStarter.run(EclipseStarter.java:376)\n\tat org.eclipse.core.runtime.adaptor.EclipseStarter.run(EclipseStarter.java:163)\n\tat sun.reflect.NativeMethodAccessorImpl.invoke0(Native Method)\n\tat sun.reflect.NativeMethodAccessorImpl.invoke(NativeMethodAccessorImpl.java:39)\n\tat\nsun.reflect.DelegatingMethodAccessorImpl.invoke(DelegatingMethodAccessorImpl.java:25)\n\tat java.lang.reflect.Method.invoke(Method.java:324)\n\tat org.eclipse.core.launcher.Main.invokeFramework(Main.java:334)\n\tat org.eclipse.core.launcher.Main.basicRun(Main.java:278)\n\tat org.eclipse.core.launcher.Main.run(Main.java:973)\n\tat org.eclipse.core.launcher.Main.main(Main.java:948)\nCaused by: java.lang.NullPointerException\n\tat org.eclipse.ui.internal.progress.JobErrorDialog.refresh(JobErrorDialog.java:96)\n\tat\norg.eclipse.ui.internal.progress.ErrorNotificationManager$2.runInUIThread(ErrorNotificationManager.java:113)\n\tat org.eclipse.ui.progress.UIJob$1.run(UIJob.java:93)\n\tat org.eclipse.swt.widgets.RunnableLock.run(RunnableLock.java:35)\n\tat org.eclipse.swt.widgets.Synchronizer.runAsyncMessages(Synchronizer.java:118)\n\t... 18 more\n\n!ENTRY org.eclipse.ui 4 4 2005-06-21 13:04:22.391\n!MESSAGE Unhandled event loop exception\n\n!ENTRY org.eclipse.ui 4 0 2005-06-21 13:04:22.391\n!MESSAGE Failed to execute runnable (java.lang.NullPointerException)\n!STACK 0\norg.eclipse.swt.SWTException: Failed to execute runnable\n(java.lang.NullPointerException)\n\tat org.eclipse.swt.SWT.error(SWT.java:2940)\n\tat org.eclipse.swt.SWT.error(SWT.java:2863)\n\tat org.eclipse.swt.widgets.Synchronizer.runAsyncMessages(Synchronizer.java:121)\n\tat org.eclipse.swt.widgets.Display.runAsyncMessages(Display.java:3047)\n\tat org.eclipse.swt.widgets.Display.readAndDispatch(Display.java:2706)\n\tat org.eclipse.ui.internal.Workbench.runEventLoop(Workbench.java:1699)\n\tat org.eclipse.ui.internal.Workbench.runUI(Workbench.java:1663)\n\tat org.eclipse.ui.internal.Workbench.createAndRunWorkbench(Workbench.java:367)\n\tat org.eclipse.ui.PlatformUI.createAndRunWorkbench(PlatformUI.java:143)\n\tat org.eclipse.ui.internal.ide.IDEApplication.run(IDEApplication.java:103)\n\tat\norg.eclipse.core.internal.runtime.PlatformActivator$1.run(PlatformActivator.java:226)\n\tat org.eclipse.core.runtime.adaptor.EclipseStarter.run(EclipseStarter.java:376)\n\tat org.eclipse.core.runtime.adaptor.EclipseStarter.run(EclipseStarter.java:163)\n\tat sun.reflect.NativeMethodAccessorImpl.invoke0(Native Method)\n\tat sun.reflect.NativeMethodAccessorImpl.invoke(NativeMethodAccessorImpl.java:39)\n\tat\nsun.reflect.DelegatingMethodAccessorImpl.invoke(DelegatingMethodAccessorImpl.java:25)\n\tat java.lang.reflect.Method.invoke(Method.java:324)\n\tat org.eclipse.core.launcher.Main.invokeFramework(Main.java:334)\n\tat org.eclipse.core.launcher.Main.basicRun(Main.java:278)\n\tat org.eclipse.core.launcher.Main.run(Main.java:973)\n\tat org.eclipse.core.launcher.Main.main(Main.java:948)\nCaused by: java.lang.NullPointerException\n\tat org.eclipse.ui.internal.progress.JobErrorDialog.refresh(JobErrorDialog.java:96)\n\tat\norg.eclipse.ui.internal.progress.ErrorNotificationManager$2.runInUIThread(ErrorNotificationManager.java:113)\n\tat org.eclipse.ui.progress.UIJob$1.run(UIJob.java:93)\n\tat org.eclipse.swt.widgets.RunnableLock.run(RunnableLock.java:35)\n\tat org.eclipse.swt.widgets.Synchronizer.runAsyncMessages(Synchronizer.java:118)\n\t... 18 more\n\n!ENTRY org.eclipse.ui 4 4 2005-06-21 13:04:22.391\n!MESSAGE Unhandled event loop exception\n\n\n\n\n\n\n\n\n\norg.eclipse.ui.internal.progress.ErrorNotificationManager\n\nM7\n\n\n    private IStatus openErrorDialog(String title, String msg, final ErrorInfo\nerrorInfo) {\n        IWorkbench workbench \u003d PlatformUI.getWorkbench();\n\n        //Abort on shutdown\n        if (workbench instanceof Workbench\n                \u0026\u0026 ((Workbench) workbench).isClosing())\n            return Status.CANCEL_STATUS;\n        dialog \u003d new JobErrorDialog(ProgressManagerUtil.getNonModalShell(),\ntitle, msg, errorInfo, IStatus.OK\n                | IStatus.INFO | IStatus.WARNING | IStatus.ERROR);\n        try {\n\t        dialog.open();\n        } finally {\n            dialog \u003d null;\n            clearAllErrors();\n        }\n        return Status.OK_STATUS;\n    }\n\n\nRC3\n\n    private IStatus openErrorDialog(String title, String msg, final ErrorInfo\nerrorInfo) {\n        IWorkbench workbench \u003d PlatformUI.getWorkbench();\n\n        //Abort on shutdown\n        if (workbench instanceof Workbench\n                \u0026\u0026 ((Workbench) workbench).isClosing())\n            return Status.CANCEL_STATUS;\n        dialog \u003d new JobErrorDialog(ProgressManagerUtil.getNonModalShell(),\ntitle, msg, errorInfo, IStatus.OK\n                | IStatus.INFO | IStatus.WARNING | IStatus.ERROR);\n        \n        dialog.open();\n        return Status.OK_STATUS;\n    }\n\n\norg.eclipse.ui.internal.progress.JobErrorDialog\n    void refresh() {\n    \t\n    \tif(AUTOMATED_MODE)//Nothing to refresh if we never opened it\n    \t\treturn;\n    \t\n        if (isMultipleJobErrors()) {\n            if (jobListViewer \u003d\u003d null \u0026\u0026 !dialogArea.isDisposed()) {\t\u003c\u003d\u003d\u003d\u003d NPE\nhere due to dialogArea \u003d\u003d null\n\t            // The job list doesn\u0027t exist so create it.\n\t            setMessage(ProgressMessages.JobErrorDialog_MultipleErrorsMessage); \n\t           \ngetShell().setText(ProgressMessages.JobErrorDialog_MultipleErrorsTitle); \n\t            createJobListArea((Composite)dialogArea);\n\t            showDetailsArea();\n            }\n\t        refreshJobList();\n        }\n        updateEnablements();\n    }",
    "Do you have an example to show this? I whipped one up myself and can\u0027t replicate\nthis.\n\nThe interesting part of this is the run method of an action which looks like this:\n\n\tJob job1 \u003d new Job(\"Job 1\"){\n\t\t\tprotected org.eclipse.core.runtime.IStatus\nrun(org.eclipse.core.runtime.IProgressMonitor monitor) {\n\t\t\t\treturn new Status(IStatus.ERROR,\"Test 1\",IStatus.ERROR,\"First error\", new\nNullPointerException());\n\t\t\t};\n\t\t};\n\t\t\n\t\tJob job2 \u003d new Job(\"Job 2\"){\n\t\t\tprotected org.eclipse.core.runtime.IStatus\nrun(org.eclipse.core.runtime.IProgressMonitor monitor) {\n\t\t\t\treturn new Status(IStatus.ERROR,\"Test 2\",IStatus.ERROR,\"Second error\", new\nNullPointerException());\n\t\t\t};\n\t\t};\n\t\t\n\t\tjob1.schedule();\n\t\tjob2.schedule();\n\nWhen I do this the dialog comes up fine.\n\nThe only way I could see this happen is if the asyncExec of the job that\nrefreshes runs in the middle of dialog opening.\n\nThe only change in this area since M7 was to not open the dialog in\nAUTOMATED_MODE which happens when test suites run.\n\nIf you could give me some details of your test plug-in that would be very helpful.",
    "When we can replicate this I think this implementation of refresh() should solve\nthe issue\n\n\n    \t\n    \tif(AUTOMATED_MODE)//Nothing to refresh if we never opened it\n    \t\treturn;\n    \t\n    \t//If we are in the process of creating or tearing down do nothing\n    \tif(dialogArea \u003d\u003d null \u0026\u0026 dialogArea.isDisposed())\n    \t\treturn;\n    \t\n        if (isMultipleJobErrors()) {\n        \t\n            if (jobListViewer \u003d\u003d null ) {\n\t            // The job list doesn\u0027t exist so create it.\n\t            setMessage(ProgressMessages.JobErrorDialog_MultipleErrorsMessage); \n\t           \ngetShell().setText(ProgressMessages.JobErrorDialog_MultipleErrorsTitle); \n\t            createJobListArea((Composite)dialogArea);\n\t            showDetailsArea();\n            }\n\t        refreshJobList();\n        }\n        updateEnablements();\n    ",
    "Created an attachment (id\u003d23719)\nZip file of my example\n\nHere is the example plug-in I whipped up. It first creates 100 jobs with errors\nand then 100  jobs with NPEs. In both cases the dialog caught them all.",
    "I have managed to replicate the infinite loop by adding a throw\nNullPointerException() i nthe refresh method so even if I can\u0027t replicate you\ncase I would like to add in the code below.",
    "Created an attachment (id\u003d23722)\nPatch\n",
    "Fixed in build \u003e20050522",
    "My appologies - I spent the morning trying to come up with a simple test case \nfinally tracked the issue down to a coding error in my plugin -- one of my \nteam created an implementation of IStatus (instead of simply extending Status) \nand defined the \"matches\" method as:\n\tpublic boolean matches(int severityMask) {\n\t\treturn (severityMask \u003d\u003d mStatusCode);\n\t}\nThis causes ErrorDiaglog.shouldDisplay() to always return \"false\", which in \nturn leads to ErrorDialog.open() never calling super.open() which ultimately \nleft ErrorNotificationManager with a non-null \"dialog\" field \nwhose \"dialogArea\" field was null.\n\nYou can duplicate my original observation by setting a breakpoint in \nStatus.matches() and changing the severityMask parameter value to 0. I \nverified this using code equivalent to your original test case.\n\nThanks very much for looking into the issue (and now having code in place that \nguards against really stupid coding errors).",
    "I just tried build N20050622-0010 and can still duplicate the NPE loop that I \noriginally reported. However, since (with your assistance) I determined that \nthe issue was really a coding error in my plugin, I\u0027m comfortable with you \nsimply closing this bug report and treating it as \"user error\". Sorry for \nsending you on a wild chase in the closing days of the release.",
    "This won\u0027t be in until build 20050623 - you can load the workbench from HEAD to\ntry it out. And thanks for letting us know - if this sort of thing is possible\nwe want to be protected.",
    "Approved at PMC meeting 20050623",
    "I verified that in build 20050623-0010 I can no longer duplicate the problem \nand believe that this is fix is fine, especially considering the 3.1 release \ndate.\n\nA \"side effect\" of the fix appears to be that once IStatus.matches() returns \nfalse (see my comment 7 for how this happened originally and how to reproduce) \nduring the job termination process, NO subsequent job failure messages are \nreported, even with a \"correctly coded\" imlementation of IStatus.matches(). \nSince the problem is unlikely to come up in a \"real-world\" situation in the \nabsence of a plugin coding error like mine, this is unlikely to cause much \nconfusion to users, but is something to keep in mind \"just in case\" someone \nreports that job error completion dialogs aren\u0027t being shown...\n\nThanks VERY much for the quick turnaround to prevent the infinite loop in \nEclipse and (by virture of your example) assisting me in locating my erroneous \ncode.",
    "Marking verified (thanks Kenneth)",
    "Not sure if I should open a new defect for this or not, but I am experiencing problems with the error dialog when multiple jobs finish with errors.\n\nI am not seeing any NPEs (because of the previous fix), but I am failing to see the error dialog.  In addition, an error icon is being displayed in the status area, but no error dialog will open when the icon is pressed.  Furthermore, any subsequent job errors fail to produce any effect within the UI (with animations turned on I can see the animation the first time a job errors).\n\nAfter a bit of debugging and tracing through the code, I found a cause similar to the original, dialogArea.isDisposed() \u003d\u003d true.  My suspicion is that the parent shell used for the error dialog is that of the jobs progress dialog (retrieved via ProgressManagerUtil.getDefaultParent()).  When the jobs progress dialog closes (upon completion of the jobs), the parent shell for the error dialog gets disposed, which causes the error dialog\u0027s shell to be disposed, which prevents the error dialog from being displayed (ever again as it turns out).\n\nI suspect the reason you had difficulty reproducing the original error was because your jobs finished prior to the jobs progress dialog being displayed.\n\nI\u0027m not quite sure what an appropriate fix for this problem might be.  Perhaps a dispose listener could be registered with the parent shell used to create the error dialog.  When that shell gets disposed, close the error dialog appropriately.  (I\u0027m guessing you can\u0027t simply close the dialog since that would also clear the errors being tracked by the dialog.)\n\nPlease let me know if you need more details.\n\nThanks,\nRob",
    "Below is a patch for ErrorNotificationManager.  I don\u0027t think this is a complete solution, but it does leave the errors intact and appropriately treats the error dialog as closed.  (Note, that the dialog was not closed; the shell in which the dialog being displayed was disposed.  Perhaps a better solution would be to have the progress dialog block until the error dialog is closed.)\n\nHere\u0027s a possible solution (work around):\nIndex: ErrorNotificationManager.java\n\u003d\u003d\u003d\u003d\u003d\u003d\u003d\u003d\u003d\u003d\u003d\u003d\u003d\u003d\u003d\u003d\u003d\u003d\u003d\u003d\u003d\u003d\u003d\u003d\u003d\u003d\u003d\u003d\u003d\u003d\u003d\u003d\u003d\u003d\u003d\u003d\u003d\u003d\u003d\u003d\u003d\u003d\u003d\u003d\u003d\u003d\u003d\u003d\u003d\u003d\u003d\u003d\u003d\u003d\u003d\u003d\u003d\u003d\u003d\u003d\u003d\u003d\u003d\u003d\u003d\u003d\u003d\nRCS file: /cvsroot/eclipse/org.eclipse.ui.workbench/Eclipse UI/org/eclipse/ui/internal/progress/ErrorNotificationManager.java,v\nretrieving revision 1.13\ndiff -u -r1.13 ErrorNotificationManager.java\n--- ErrorNotificationManager.java\t5 Aug 2005 17:56:06 -0000\t1.13\n+++ ErrorNotificationManager.java\t24 Jan 2006 23:12:56 -0000\n@@ -25,6 +25,9 @@\n import org.eclipse.core.runtime.jobs.Job;\n import org.eclipse.jface.resource.ImageDescriptor;\n import org.eclipse.jface.resource.JFaceResources;\n+import org.eclipse.swt.events.DisposeEvent;\n+import org.eclipse.swt.events.DisposeListener;\n+import org.eclipse.swt.widgets.Shell;\n import org.eclipse.ui.IWorkbench;\n import org.eclipse.ui.PlatformUI;\n import org.eclipse.ui.internal.ExceptionHandler;\n@@ -152,9 +155,16 @@\n         if (workbench instanceof Workbench\n                 \u0026\u0026 ((Workbench) workbench).isClosing())\n             return Status.CANCEL_STATUS;\n-        dialog \u003d new JobErrorDialog(ProgressManagerUtil.getDefaultParent(), title, msg, errorInfo, IStatus.OK\n+        final Shell shell \u003d ProgressManagerUtil.getDefaultParent();\n+        dialog \u003d new JobErrorDialog(shell, title, msg, errorInfo, IStatus.OK\n                 | IStatus.INFO | IStatus.WARNING | IStatus.ERROR);\n         \n+        shell.addDisposeListener(new DisposeListener(){\n+        \tpublic void widgetDisposed(DisposeEvent event) {\n+        \t\tdialog \u003d null;\n+        \t}\n+        });\n+        \n         dialog.open();\n         return Status.OK_STATUS;\n     }\n",
    "Thanks for your input Rob. This sounds like a different problem - I have logged 125150 for this issue. I will close this one again so that we don\u0027t get mixed up as to what we need to fix.",
    "Verified in 20060113-1200"
  ],
  "commentCreationDates": [
    "2005-06-21T23:18:06+02:00",
    "2005-06-22T13:08:55+02:00",
    "2005-06-22T13:15:19+02:00",
    "2005-06-22T13:26:35+02:00",
    "2005-06-22T13:39:35+02:00",
    "2005-06-22T14:37:29+02:00",
    "2005-06-22T16:54:35+02:00",
    "2005-06-22T19:15:21+02:00",
    "2005-06-22T19:37:38+02:00",
    "2005-06-22T19:48:39+02:00",
    "2005-06-22T20:01:28+02:00",
    "2005-06-23T15:58:14+02:00",
    "2005-06-23T20:59:00+02:00",
    "2006-01-24T22:47:19+01:00",
    "2006-01-24T23:14:59+01:00",
    "2006-01-25T13:27:05+01:00",
    "2006-02-13T19:54:37+01:00"
  ],
  "traces": [
    {
      "exceptionType": "org.eclipse.swt.SWTException",
      "message": "Failed to execute runnable (java.lang.NullPointerException)",
      "elements": [
        {
          "method": "org.eclipse.swt.SWT.error",
          "source": "SWT.java:2940"
        },
        {
          "method": "org.eclipse.swt.SWT.error",
          "source": "SWT.java:2863"
        },
        {
          "method": "org.eclipse.swt.widgets.Synchronizer.runAsyncMessages",
          "source": "Synchronizer.java:121"
        },
        {
          "method": "org.eclipse.swt.widgets.Display.runAsyncMessages",
          "source": "Display.java:3047"
        },
        {
          "method": "org.eclipse.swt.widgets.Display.readAndDispatch",
          "source": "Display.java:2706"
        },
        {
          "method": "org.eclipse.ui.internal.Workbench.runEventLoop",
          "source": "Workbench.java:1699"
        },
        {
          "method": "org.eclipse.ui.internal.Workbench.runUI",
          "source": "Workbench.java:1663"
        },
        {
          "method": "org.eclipse.ui.internal.Workbench.createAndRunWorkbench",
          "source": "Workbench.java:367"
        },
        {
          "method": "org.eclipse.ui.PlatformUI.createAndRunWorkbench",
          "source": "PlatformUI.java:143"
        },
        {
          "method": "org.eclipse.ui.internal.ide.IDEApplication.run",
          "source": "IDEApplication.java:103"
        },
        {
          "method": "org.eclipse.core.internal.runtime.PlatformActivator$1.run",
          "source": "PlatformActivator.java:226"
        },
        {
          "method": "org.eclipse.core.runtime.adaptor.EclipseStarter.run",
          "source": "EclipseStarter.java:376"
        },
        {
          "method": "org.eclipse.core.runtime.adaptor.EclipseStarter.run",
          "source": "EclipseStarter.java:163"
        },
        {
          "method": "sun.reflect.NativeMethodAccessorImpl.invoke0",
          "source": "Native Method"
        },
        {
          "method": "sun.reflect.NativeMethodAccessorImpl.invoke",
          "source": "NativeMethodAccessorImpl.java:39"
        },
        {
          "method": "sun.reflect.DelegatingMethodAccessorImpl.invoke",
          "source": "DelegatingMethodAccessorImpl.java:25"
        },
        {
          "method": "java.lang.reflect.Method.invoke",
          "source": "Method.java:324"
        },
        {
          "method": "org.eclipse.core.launcher.Main.invokeFramework",
          "source": "Main.java:334"
        },
        {
          "method": "org.eclipse.core.launcher.Main.basicRun",
          "source": "Main.java:278"
        },
        {
          "method": "org.eclipse.core.launcher.Main.run",
          "source": "Main.java:973"
        },
        {
          "method": "org.eclipse.core.launcher.Main.main",
          "source": "Main.java:948"
        }
      ],
      "causedBy": {
        "exceptionType": "java.lang.NullPointerException",
        "elements": [
          {
            "method": "org.eclipse.ui.internal.progress.JobErrorDialog.refresh",
            "source": "JobErrorDialog.java:96"
          },
          {
            "method": "org.eclipse.ui.internal.progress.ErrorNotificationManager$2.runInUIThread",
            "source": "ErrorNotificationManager.java:113"
          },
          {
            "method": "org.eclipse.ui.progress.UIJob$1.run",
            "source": "UIJob.java:93"
          },
          {
            "method": "org.eclipse.swt.widgets.RunnableLock.run",
            "source": "RunnableLock.java:35"
          },
          {
            "method": "org.eclipse.swt.widgets.Synchronizer.runAsyncMessages",
            "source": "Synchronizer.java:118"
          }
        ],
        "number": 0,
        "commentIndex": 0
      },
      "number": 0,
      "commentIndex": 0,
      "bugId": "101152",
      "date": "2005-06-21T23:18:06+02:00",
      "product": "Platform",
      "component": "UI",
      "severity": "major"
    },
    {
      "exceptionType": "org.eclipse.swt.SWTException",
      "message": "Failed to execute runnable (java.lang.NullPointerException)",
      "elements": [
        {
          "method": "org.eclipse.swt.SWT.error",
          "source": "SWT.java:2940"
        },
        {
          "method": "org.eclipse.swt.SWT.error",
          "source": "SWT.java:2863"
        },
        {
          "method": "org.eclipse.swt.widgets.Synchronizer.runAsyncMessages",
          "source": "Synchronizer.java:121"
        },
        {
          "method": "org.eclipse.swt.widgets.Display.runAsyncMessages",
          "source": "Display.java:3047"
        },
        {
          "method": "org.eclipse.swt.widgets.Display.readAndDispatch",
          "source": "Display.java:2706"
        },
        {
          "method": "org.eclipse.ui.internal.Workbench.runEventLoop",
          "source": "Workbench.java:1699"
        },
        {
          "method": "org.eclipse.ui.internal.Workbench.runUI",
          "source": "Workbench.java:1663"
        },
        {
          "method": "org.eclipse.ui.internal.Workbench.createAndRunWorkbench",
          "source": "Workbench.java:367"
        },
        {
          "method": "org.eclipse.ui.PlatformUI.createAndRunWorkbench",
          "source": "PlatformUI.java:143"
        },
        {
          "method": "org.eclipse.ui.internal.ide.IDEApplication.run",
          "source": "IDEApplication.java:103"
        },
        {
          "method": "org.eclipse.core.internal.runtime.PlatformActivator$1.run",
          "source": "PlatformActivator.java:226"
        },
        {
          "method": "org.eclipse.core.runtime.adaptor.EclipseStarter.run",
          "source": "EclipseStarter.java:376"
        },
        {
          "method": "org.eclipse.core.runtime.adaptor.EclipseStarter.run",
          "source": "EclipseStarter.java:163"
        },
        {
          "method": "sun.reflect.NativeMethodAccessorImpl.invoke0",
          "source": "Native Method"
        },
        {
          "method": "sun.reflect.NativeMethodAccessorImpl.invoke",
          "source": "NativeMethodAccessorImpl.java:39"
        },
        {
          "method": "sun.reflect.DelegatingMethodAccessorImpl.invoke",
          "source": "DelegatingMethodAccessorImpl.java:25"
        },
        {
          "method": "java.lang.reflect.Method.invoke",
          "source": "Method.java:324"
        },
        {
          "method": "org.eclipse.core.launcher.Main.invokeFramework",
          "source": "Main.java:334"
        },
        {
          "method": "org.eclipse.core.launcher.Main.basicRun",
          "source": "Main.java:278"
        },
        {
          "method": "org.eclipse.core.launcher.Main.run",
          "source": "Main.java:973"
        },
        {
          "method": "org.eclipse.core.launcher.Main.main",
          "source": "Main.java:948"
        }
      ],
      "causedBy": {
        "exceptionType": "java.lang.NullPointerException",
        "elements": [
          {
            "method": "org.eclipse.ui.internal.progress.JobErrorDialog.refresh",
            "source": "JobErrorDialog.java:96"
          },
          {
            "method": "org.eclipse.ui.internal.progress.ErrorNotificationManager$2.runInUIThread",
            "source": "ErrorNotificationManager.java:113"
          },
          {
            "method": "org.eclipse.ui.progress.UIJob$1.run",
            "source": "UIJob.java:93"
          },
          {
            "method": "org.eclipse.swt.widgets.RunnableLock.run",
            "source": "RunnableLock.java:35"
          },
          {
            "method": "org.eclipse.swt.widgets.Synchronizer.runAsyncMessages",
            "source": "Synchronizer.java:118"
          }
        ],
        "number": 0,
        "commentIndex": 0
      },
      "number": 1,
      "commentIndex": 0,
      "bugId": "101152",
      "date": "2005-06-21T23:18:06+02:00",
      "product": "Platform",
      "component": "UI",
      "severity": "major"
    },
    {
      "exceptionType": "org.eclipse.swt.SWTException",
      "message": "Failed to execute runnable (java.lang.NullPointerException)",
      "elements": [
        {
          "method": "org.eclipse.swt.SWT.error",
          "source": "SWT.java:2940"
        },
        {
          "method": "org.eclipse.swt.SWT.error",
          "source": "SWT.java:2863"
        },
        {
          "method": "org.eclipse.swt.widgets.Synchronizer.runAsyncMessages",
          "source": "Synchronizer.java:121"
        },
        {
          "method": "org.eclipse.swt.widgets.Display.runAsyncMessages",
          "source": "Display.java:3047"
        },
        {
          "method": "org.eclipse.swt.widgets.Display.readAndDispatch",
          "source": "Display.java:2706"
        },
        {
          "method": "org.eclipse.ui.internal.Workbench.runEventLoop",
          "source": "Workbench.java:1699"
        },
        {
          "method": "org.eclipse.ui.internal.Workbench.runUI",
          "source": "Workbench.java:1663"
        },
        {
          "method": "org.eclipse.ui.internal.Workbench.createAndRunWorkbench",
          "source": "Workbench.java:367"
        },
        {
          "method": "org.eclipse.ui.PlatformUI.createAndRunWorkbench",
          "source": "PlatformUI.java:143"
        },
        {
          "method": "org.eclipse.ui.internal.ide.IDEApplication.run",
          "source": "IDEApplication.java:103"
        },
        {
          "method": "org.eclipse.core.internal.runtime.PlatformActivator$1.run",
          "source": "PlatformActivator.java:226"
        },
        {
          "method": "org.eclipse.core.runtime.adaptor.EclipseStarter.run",
          "source": "EclipseStarter.java:376"
        },
        {
          "method": "org.eclipse.core.runtime.adaptor.EclipseStarter.run",
          "source": "EclipseStarter.java:163"
        },
        {
          "method": "sun.reflect.NativeMethodAccessorImpl.invoke0",
          "source": "Native Method"
        },
        {
          "method": "sun.reflect.NativeMethodAccessorImpl.invoke",
          "source": "NativeMethodAccessorImpl.java:39"
        },
        {
          "method": "sun.reflect.DelegatingMethodAccessorImpl.invoke",
          "source": "DelegatingMethodAccessorImpl.java:25"
        },
        {
          "method": "java.lang.reflect.Method.invoke",
          "source": "Method.java:324"
        },
        {
          "method": "org.eclipse.core.launcher.Main.invokeFramework",
          "source": "Main.java:334"
        },
        {
          "method": "org.eclipse.core.launcher.Main.basicRun",
          "source": "Main.java:278"
        },
        {
          "method": "org.eclipse.core.launcher.Main.run",
          "source": "Main.java:973"
        },
        {
          "method": "org.eclipse.core.launcher.Main.main",
          "source": "Main.java:948"
        }
      ],
      "causedBy": {
        "exceptionType": "java.lang.NullPointerException",
        "elements": [
          {
            "method": "org.eclipse.ui.internal.progress.JobErrorDialog.refresh",
            "source": "JobErrorDialog.java:96"
          },
          {
            "method": "org.eclipse.ui.internal.progress.ErrorNotificationManager$2.runInUIThread",
            "source": "ErrorNotificationManager.java:113"
          },
          {
            "method": "org.eclipse.ui.progress.UIJob$1.run",
            "source": "UIJob.java:93"
          },
          {
            "method": "org.eclipse.swt.widgets.RunnableLock.run",
            "source": "RunnableLock.java:35"
          },
          {
            "method": "org.eclipse.swt.widgets.Synchronizer.runAsyncMessages",
            "source": "Synchronizer.java:118"
          }
        ],
        "number": 0,
        "commentIndex": 0
      },
      "number": 2,
      "commentIndex": 0,
      "bugId": "101152",
      "date": "2005-06-21T23:18:06+02:00",
      "product": "Platform",
      "component": "UI",
      "severity": "major"
    }
  ],
  "groupId": "101152",
  "bugId": "101152",
  "date": "2005-06-21T23:18:06+02:00",
  "product": "Platform",
  "component": "UI",
  "severity": "major"
}