{
  "comments": [
    "One of our builders was throwing \"ResourceException\" when trying to create a \nfolder.  I\u0027m not 100% sure why (it was at a customer site).  However, this \nexception stopped Eclipse from being able to start up.  Manually creating the \nfolder on the filesystem solved the problem (by eliminating the \nResourceException).\n\nThe throws clause of the build method in IncrementalProjectBuilder allows \nthrowing CoreException (and therefore ResourceException).  Therefore I figured \nthat the inability to startup in this situation was a bug in the platform.  I \nincluded the log from the entire session.\n\n!SESSION Jun 17, 2005 14:36:32.58 ----------------------------------------------\n\neclipse.buildId\u003dunknown\n\njava.version\u003d1.4.2_05\n\njava.vendor\u003dSun Microsystems Inc.\n\nBootLoader constants: OS\u003dwin32, ARCH\u003dx86, WS\u003dwin32, NL\u003den_US\n\nCommand-line arguments: -Xms384M -Xmx512M\n\n \n\n!ENTRY org.eclipse.core.runtime 4 2 Jun 17, 2005 14:36:32.58\n\n!MESSAGE Problems occurred when invoking code from plug-\nin: \"org.eclipse.core.runtime\".\n\n!STACK 1\n\norg.eclipse.core.internal.resources.ResourceException: Could not create folder: \nC:\\new-world\\fpgaload\\Release.\n\n            at org.eclipse.core.internal.localstore.FileSystemStore.writeFolder\n(FileSystemStore.java:406)\n\n            at \norg.eclipse.core.internal.localstore.FileSystemResourceManager.write\n(FileSystemResourceManager.java:807)\n\n            at org.eclipse.core.internal.resources.Folder.internalCreate\n(Folder.java:170)\n\n            at org.eclipse.core.internal.resources.Folder.create\n(Folder.java:101)\n\n            at org.eclipse.core.internal.resources.Folder.create\n(Folder.java:119)\n\n            at \ncom.timesys.ide.cdev.managedbuilder.GnuMakefileGenerator.createDirectory\n(GnuMakefileGenerator.java:788)\n\n            at \ncom.timesys.ide.kernel.modules.TwoSixLKMMakefileGenerator.doRegenerate\n(TwoSixLKMMakefileGenerator.java:62)\n\n            at \ncom.timesys.ide.cdev.managedbuilder.TSMakefileGenerator.regenerateMakefiles\n(TSMakefileGenerator.java:236)\n\n            at \ncom.timesys.ide.cdev.managedbuilder.internal.GeneratedMakefileBuilder.fullBuild\n(GeneratedMakefileBuilder.java:398)\n\n            at \ncom.timesys.ide.cdev.managedbuilder.internal.GeneratedMakefileBuilder.build\n(GeneratedMakefileBuilder.java:278)\n\n            at org.eclipse.core.internal.events.BuildManager$2.run\n(BuildManager.java:570)\n\n            at org.eclipse.core.internal.runtime.InternalPlatform.run\n(InternalPlatform.java:616)\n\n            at org.eclipse.core.runtime.Platform.run(Platform.java:747)\n\n            at org.eclipse.core.internal.events.BuildManager.basicBuild\n(BuildManager.java:159)\n\n            at org.eclipse.core.internal.events.BuildManager.basicBuild\n(BuildManager.java:251)\n\n            at org.eclipse.core.internal.events.BuildManager.basicBuild\n(BuildManager.java:204)\n\n            at org.eclipse.core.internal.events.BuildManager$1.run\n(BuildManager.java:231)\n\n            at org.eclipse.core.internal.runtime.InternalPlatform.run\n(InternalPlatform.java:616)\n\n            at org.eclipse.core.runtime.Platform.run(Platform.java:747)\n\n            at org.eclipse.core.internal.events.BuildManager.basicBuild\n(BuildManager.java:234)\n\n            at org.eclipse.core.internal.events.BuildManager.basicBuildLoop\n(BuildManager.java:270)\n\n            at org.eclipse.core.internal.events.BuildManager.build\n(BuildManager.java:299)\n\n            at org.eclipse.core.internal.events.AutoBuildJob.doBuild\n(AutoBuildJob.java:155)\n\n            at org.eclipse.core.internal.events.AutoBuildJob.run\n(AutoBuildJob.java:212)\n\n            at org.eclipse.core.internal.jobs.Worker.run(Worker.java:66)\n\n!SUBENTRY 1 org.eclipse.core.resources 4 272 Jun 17, 2005 14:36:32.58\n\n!MESSAGE Could not create folder: C:\\new-world\\fpgaload\\Release.\n\n!SUBENTRY 1 org.eclipse.core.resources 4 272 Jun 17, 2005 14:36:32.58\n\n!MESSAGE Could not create folder: C:\\new-world\\fpgaload\\Release.\n\n \n\n!ENTRY org.eclipse.core.resources 4 75 Jun 17, 2005 14:36:32.73\n\n!MESSAGE Errors during build.\n\n!SUBENTRY 1 com.timesys.ide.cdev 2 75 Jun 17, 2005 14:36:32.73\n\n!MESSAGE Errors running builder \"TimeStorm Makefile Builder\" on project \nfpgaload.\n\n!SUBENTRY 1 org.eclipse.core.resources 4 272 Jun 17, 2005 14:36:32.73\n\n!MESSAGE Could not create folder: C:\\new-world\\fpgaload\\Release.\n\n \n\n!ENTRY org.eclipse.core.runtime 4 2 Jun 17, 2005 14:41:48.165\n\n!MESSAGE Problems occurred when invoking code from plug-\nin: \"org.eclipse.core.runtime\".\n\n!STACK 1\n\norg.eclipse.core.internal.resources.ResourceException: Could not create folder: \nC:\\new-world\\fpgaload\\Release.\n\n            at org.eclipse.core.internal.localstore.FileSystemStore.writeFolder\n(FileSystemStore.java:406)\n\n            at \norg.eclipse.core.internal.localstore.FileSystemResourceManager.write\n(FileSystemResourceManager.java:807)\n\n            at org.eclipse.core.internal.resources.Folder.internalCreate\n(Folder.java:170)\n\n            at org.eclipse.core.internal.resources.Folder.create\n(Folder.java:101)\n\n            at org.eclipse.core.internal.resources.Folder.create\n(Folder.java:119)\n\n            at \ncom.timesys.ide.cdev.managedbuilder.GnuMakefileGenerator.createDirectory\n(GnuMakefileGenerator.java:788)\n\n            at \ncom.timesys.ide.kernel.modules.TwoSixLKMMakefileGenerator.doRegenerate\n(TwoSixLKMMakefileGenerator.java:62)\n\n            at \ncom.timesys.ide.cdev.managedbuilder.TSMakefileGenerator.regenerateMakefiles\n(TSMakefileGenerator.java:236)\n\n            at \ncom.timesys.ide.cdev.managedbuilder.internal.GeneratedMakefileBuilder.fullBuild\n(GeneratedMakefileBuilder.java:398)\n\n            at \ncom.timesys.ide.cdev.managedbuilder.internal.GeneratedMakefileBuilder.build\n(GeneratedMakefileBuilder.java:278)\n\n            at org.eclipse.core.internal.events.BuildManager$2.run\n(BuildManager.java:570)\n\n            at org.eclipse.core.internal.runtime.InternalPlatform.run\n(InternalPlatform.java:616)\n\n            at org.eclipse.core.runtime.Platform.run(Platform.java:747)\n\n            at org.eclipse.core.internal.events.BuildManager.basicBuild\n(BuildManager.java:159)\n\n            at org.eclipse.core.internal.events.BuildManager.basicBuild\n(BuildManager.java:251)\n\n            at org.eclipse.core.internal.events.BuildManager.basicBuild\n(BuildManager.java:204)\n\n            at org.eclipse.core.internal.events.BuildManager$1.run\n(BuildManager.java:231)\n\n            at org.eclipse.core.internal.runtime.InternalPlatform.run\n(InternalPlatform.java:616)\n\n            at org.eclipse.core.runtime.Platform.run(Platform.java:747)\n\n            at org.eclipse.core.internal.events.BuildManager.basicBuild\n(BuildManager.java:234)\n\n            at org.eclipse.core.internal.events.BuildManager.basicBuildLoop\n(BuildManager.java:270)\n\n            at org.eclipse.core.internal.events.BuildManager.build\n(BuildManager.java:299)\n\n            at org.eclipse.core.internal.resources.Workspace.build\n(Workspace.java:198)\n\n            at org.eclipse.ui.actions.GlobalBuildAction$1.run\n(GlobalBuildAction.java:182)\n\n            at org.eclipse.core.internal.jobs.Worker.run(Worker.java:66)\n\n!SUBENTRY 1 org.eclipse.core.resources 4 272 Jun 17, 2005 14:41:48.165\n\n!MESSAGE Could not create folder: C:\\new-world\\fpgaload\\Release.\n\n!SUBENTRY 1 org.eclipse.core.resources 4 272 Jun 17, 2005 14:41:48.165\n\n!MESSAGE Could not create folder: C:\\new-world\\fpgaload\\Release.\n\n \n\n!ENTRY org.eclipse.ui 4 0 Jun 17, 2005 14:41:48.181\n\n!MESSAGE Build problems\n\n!SUBENTRY 1 org.eclipse.core.resources 4 75 Jun 17, 2005 14:41:48.181\n\n!MESSAGE Errors during build.\n\n!SUBENTRY 2 com.timesys.ide.cdev 2 75 Jun 17, 2005 14:41:48.181\n\n!MESSAGE Errors running builder \"TimeStorm Makefile Builder\" on project \nfpgaload.\n\n!SUBENTRY 2 org.eclipse.core.resources 4 272 Jun 17, 2005 14:41:48.181\n\n!MESSAGE Could not create folder: C:\\new-world\\fpgaload\\Release.",
    "An exception thrown by a builder will not cause the startup to fail.  The stack\ntrace shown above is from a background builder thread - an exception in this\nthread should not affect the startup sequence. I suspect some other error is\noccuring that is causing the startup to fail. Does the timestamp of that error\nmatch the time when the startup failure occurred?  Are there any other errors in\nthe log file?",
    "(In reply to comment #1)\nThat is the entire log for the session.  Unfortunately this came through our \nsupport line, and was never reproduced here.  According to the report, once the \nuser created the directory \"C:\\new-world\\fpgaload\\Release\", the product \nstarted.  Because of that I assumed the exception was related to the startup \nproblem.  I guess it may have just been coincidence.  Other than that, I don\u0027t \nhave any additional data to add.  Sorry.\n\n",
    "Ok, please reopen if you have a reproducible case that can give us more insight."
  ],
  "commentCreationDates": [
    "2005-06-22T18:58:09+02:00",
    "2005-06-27T22:12:51+02:00",
    "2005-06-27T22:22:12+02:00",
    "2005-06-30T22:25:45+02:00"
  ],
  "traces": [
    {
      "exceptionType": "org.eclipse.core.internal.resources.ResourceException",
      "message": "Could not create folder:  C:\\new-world\\fpgaload\\Release.",
      "elements": [
        {
          "method": "org.eclipse.core.internal.localstore.FileSystemStore.writeFolder",
          "source": "FileSystemStore.java:406"
        },
        {
          "method": "org.eclipse.core.internal.localstore.FileSystemResourceManager.write",
          "source": "FileSystemResourceManager.java:807"
        },
        {
          "method": "org.eclipse.core.internal.resources.Folder.internalCreate",
          "source": "Folder.java:170"
        },
        {
          "method": "org.eclipse.core.internal.resources.Folder.create",
          "source": "Folder.java:101"
        },
        {
          "method": "org.eclipse.core.internal.resources.Folder.create",
          "source": "Folder.java:119"
        },
        {
          "method": "com.timesys.ide.cdev.managedbuilder.GnuMakefileGenerator.createDirectory",
          "source": "GnuMakefileGenerator.java:788"
        },
        {
          "method": "com.timesys.ide.kernel.modules.TwoSixLKMMakefileGenerator.doRegenerate",
          "source": "TwoSixLKMMakefileGenerator.java:62"
        },
        {
          "method": "com.timesys.ide.cdev.managedbuilder.TSMakefileGenerator.regenerateMakefiles",
          "source": "TSMakefileGenerator.java:236"
        },
        {
          "method": "com.timesys.ide.cdev.managedbuilder.internal.GeneratedMakefileBuilder.fullBuild",
          "source": "GeneratedMakefileBuilder.java:398"
        },
        {
          "method": "com.timesys.ide.cdev.managedbuilder.internal.GeneratedMakefileBuilder.build",
          "source": "GeneratedMakefileBuilder.java:278"
        },
        {
          "method": "org.eclipse.core.internal.events.BuildManager$2.run",
          "source": "BuildManager.java:570"
        },
        {
          "method": "org.eclipse.core.internal.runtime.InternalPlatform.run",
          "source": "InternalPlatform.java:616"
        },
        {
          "method": "org.eclipse.core.runtime.Platform.run",
          "source": "Platform.java:747"
        },
        {
          "method": "org.eclipse.core.internal.events.BuildManager.basicBuild",
          "source": "BuildManager.java:159"
        },
        {
          "method": "org.eclipse.core.internal.events.BuildManager.basicBuild",
          "source": "BuildManager.java:251"
        },
        {
          "method": "org.eclipse.core.internal.events.BuildManager.basicBuild",
          "source": "BuildManager.java:204"
        },
        {
          "method": "org.eclipse.core.internal.events.BuildManager$1.run",
          "source": "BuildManager.java:231"
        },
        {
          "method": "org.eclipse.core.internal.runtime.InternalPlatform.run",
          "source": "InternalPlatform.java:616"
        },
        {
          "method": "org.eclipse.core.runtime.Platform.run",
          "source": "Platform.java:747"
        },
        {
          "method": "org.eclipse.core.internal.events.BuildManager.basicBuild",
          "source": "BuildManager.java:234"
        },
        {
          "method": "org.eclipse.core.internal.events.BuildManager.basicBuildLoop",
          "source": "BuildManager.java:270"
        },
        {
          "method": "org.eclipse.core.internal.events.BuildManager.build",
          "source": "BuildManager.java:299"
        },
        {
          "method": "org.eclipse.core.internal.events.AutoBuildJob.doBuild",
          "source": "AutoBuildJob.java:155"
        },
        {
          "method": "org.eclipse.core.internal.events.AutoBuildJob.run",
          "source": "AutoBuildJob.java:212"
        },
        {
          "method": "org.eclipse.core.internal.jobs.Worker.run",
          "source": "Worker.java:66"
        }
      ],
      "number": 0,
      "commentIndex": 0,
      "bugId": "101292",
      "date": "2005-06-22T18:58:09+02:00",
      "product": "Platform",
      "component": "Resources",
      "severity": "normal"
    },
    {
      "exceptionType": "org.eclipse.core.internal.resources.ResourceException",
      "message": "Could not create folder:  C:\\new-world\\fpgaload\\Release.",
      "elements": [
        {
          "method": "org.eclipse.core.internal.localstore.FileSystemStore.writeFolder",
          "source": "FileSystemStore.java:406"
        },
        {
          "method": "org.eclipse.core.internal.localstore.FileSystemResourceManager.write",
          "source": "FileSystemResourceManager.java:807"
        },
        {
          "method": "org.eclipse.core.internal.resources.Folder.internalCreate",
          "source": "Folder.java:170"
        },
        {
          "method": "org.eclipse.core.internal.resources.Folder.create",
          "source": "Folder.java:101"
        },
        {
          "method": "org.eclipse.core.internal.resources.Folder.create",
          "source": "Folder.java:119"
        },
        {
          "method": "com.timesys.ide.cdev.managedbuilder.GnuMakefileGenerator.createDirectory",
          "source": "GnuMakefileGenerator.java:788"
        },
        {
          "method": "com.timesys.ide.kernel.modules.TwoSixLKMMakefileGenerator.doRegenerate",
          "source": "TwoSixLKMMakefileGenerator.java:62"
        },
        {
          "method": "com.timesys.ide.cdev.managedbuilder.TSMakefileGenerator.regenerateMakefiles",
          "source": "TSMakefileGenerator.java:236"
        },
        {
          "method": "com.timesys.ide.cdev.managedbuilder.internal.GeneratedMakefileBuilder.fullBuild",
          "source": "GeneratedMakefileBuilder.java:398"
        },
        {
          "method": "com.timesys.ide.cdev.managedbuilder.internal.GeneratedMakefileBuilder.build",
          "source": "GeneratedMakefileBuilder.java:278"
        },
        {
          "method": "org.eclipse.core.internal.events.BuildManager$2.run",
          "source": "BuildManager.java:570"
        },
        {
          "method": "org.eclipse.core.internal.runtime.InternalPlatform.run",
          "source": "InternalPlatform.java:616"
        },
        {
          "method": "org.eclipse.core.runtime.Platform.run",
          "source": "Platform.java:747"
        },
        {
          "method": "org.eclipse.core.internal.events.BuildManager.basicBuild",
          "source": "BuildManager.java:159"
        },
        {
          "method": "org.eclipse.core.internal.events.BuildManager.basicBuild",
          "source": "BuildManager.java:251"
        },
        {
          "method": "org.eclipse.core.internal.events.BuildManager.basicBuild",
          "source": "BuildManager.java:204"
        },
        {
          "method": "org.eclipse.core.internal.events.BuildManager$1.run",
          "source": "BuildManager.java:231"
        },
        {
          "method": "org.eclipse.core.internal.runtime.InternalPlatform.run",
          "source": "InternalPlatform.java:616"
        },
        {
          "method": "org.eclipse.core.runtime.Platform.run",
          "source": "Platform.java:747"
        },
        {
          "method": "org.eclipse.core.internal.events.BuildManager.basicBuild",
          "source": "BuildManager.java:234"
        },
        {
          "method": "org.eclipse.core.internal.events.BuildManager.basicBuildLoop",
          "source": "BuildManager.java:270"
        },
        {
          "method": "org.eclipse.core.internal.events.BuildManager.build",
          "source": "BuildManager.java:299"
        },
        {
          "method": "org.eclipse.core.internal.resources.Workspace.build",
          "source": "Workspace.java:198"
        },
        {
          "method": "org.eclipse.ui.actions.GlobalBuildAction$1.run",
          "source": "GlobalBuildAction.java:182"
        },
        {
          "method": "org.eclipse.core.internal.jobs.Worker.run",
          "source": "Worker.java:66"
        }
      ],
      "number": 1,
      "commentIndex": 0,
      "bugId": "101292",
      "date": "2005-06-22T18:58:09+02:00",
      "product": "Platform",
      "component": "Resources",
      "severity": "normal"
    }
  ],
  "groupId": "101292",
  "bugId": "101292",
  "date": "2005-06-22T18:58:09+02:00",
  "product": "Platform",
  "component": "Resources",
  "severity": "normal"
}