{
  "comments": [
    "Using Eclipse 3.1 RC3\n\nWhen I try to start some ant build configurations that were working with RC2, I\nget a dialog that says \"Java Virtual Machine Launcher (Dialog title): Could not\nfind the main class. Program will exit. (Dialog content)\" and the following\nexception is logged:\n\njava.net.SocketTimeoutException: Accept timed out\n\tat java.net.PlainSocketImpl.socketAccept(Native Method)\n\tat java.net.PlainSocketImpl.accept(PlainSocketImpl.java:384)\n\tat java.net.ServerSocket.implAccept(ServerSocket.java:450)\n\tat java.net.ServerSocket.accept(ServerSocket.java:421)\n\tat\norg.eclipse.ant.internal.ui.launchConfigurations.RemoteAntBuildListener$ServerConnection.run(RemoteAntBuildListener.java:97)\n\nI\u0027ve tried invoking these from the context menu \"Run as...\" on the build.xml\nfile, from the favourites, or by choosing from the External Tools dialog where\nthese configurations are defined.",
    "\n\n*** This bug has been marked as a duplicate of 101150 ***"
  ],
  "commentCreationDates": [
    "2005-06-23T19:35:48+02:00",
    "2005-06-23T19:43:58+02:00"
  ],
  "traces": [
    {
      "exceptionType": "java.net.SocketTimeoutException",
      "message": "Accept timed out",
      "elements": [
        {
          "method": "java.net.PlainSocketImpl.socketAccept",
          "source": "Native Method"
        },
        {
          "method": "java.net.PlainSocketImpl.accept",
          "source": "PlainSocketImpl.java:384"
        },
        {
          "method": "java.net.ServerSocket.implAccept",
          "source": "ServerSocket.java:450"
        },
        {
          "method": "java.net.ServerSocket.accept",
          "source": "ServerSocket.java:421"
        },
        {
          "method": "org.eclipse.ant.internal.ui.launchConfigurations.RemoteAntBuildListener$ServerConnection.run",
          "source": "RemoteAntBuildListener.java:97"
        }
      ],
      "number": 0,
      "commentIndex": 0,
      "bugId": "101505",
      "duplicateId": "101150",
      "date": "2005-06-23T19:35:48+02:00",
      "product": "Platform",
      "component": "Ant",
      "severity": "normal"
    }
  ],
  "groupId": "101224",
  "bugId": "101505",
  "duplicateId": "101150",
  "date": "2005-06-23T19:35:48+02:00",
  "product": "Platform",
  "component": "Ant",
  "severity": "normal"
}