{
  "comments": [
    "While generating report in pdf format the following exception is occurred.\nWe are using jdk 1.5\njboss 4.0 app server\nbirt version : birt-runtime-1.0.zip\nwe are storing the generated report in the server itself.\n\nuser\\2\\corona\\generatedreports\\test4pdffff_2005_02_07_08_12_13.pdf\n20:12:14,109 INFO  [STDOUT] Jul 2, 2005 8:12:14 PM \norg.eclipse.birt.report.engine.content.impl.MasterPageContent initSim\npleMasterPage\nINFO: The property HeaderHeight is not set. Use Default 1 cm.\n20:12:14,437 INFO  [STDOUT] Jul 2, 2005 8:12:14 PM \norg.eclipse.birt.report.engine.content.impl.MasterPageContent initSim\npleMasterPage\nINFO: The property FooterHeight is not set. Use default 1 cm.\n20:12:14,984 INFO  [STDOUT] line 1 column 1 - Warning: inserting \nmissing \u0027title\u0027 element\n20:12:15,250 INFO  [STDOUT] Jul 2, 2005 8:12:15 PM \norg.eclipse.birt.report.data.oda.jdbc.JDBCDriverManager loadDriverExt\nensions\nINFO: Found JDBC driverinfo extension: \ndriverClass\u003dsun.jdbc.odbc.JdbcOdbcDriver, connectionFactory\u003dnull\n20:12:15,578 INFO  [STDOUT] Jul 2, 2005 8:12:15 PM \norg.eclipse.birt.report.data.oda.jdbc.JDBCDriverManager loadDriverExt\nensions\nINFO: Found JDBC driverinfo extension: \ndriverClass\u003dorg.apache.derby.jdbc.EmbeddedDriver, connectionFactory\u003dnull\n20:12:15,906 INFO  [STDOUT] Jul 2, 2005 8:12:15 PM \norg.eclipse.birt.report.data.oda.jdbc.JDBCDriverManager loadAndRegist\nerDriver\nINFO: Loading JDBC driver class: oracle.jdbc.driver.OracleDriver\n20:12:16,250 INFO  [STDOUT] Jul 2, 2005 8:12:16 PM \norg.eclipse.birt.report.data.oda.jdbc.JDBCDriverManager loadAndRegist\nerDriver\nINFO: Loaded JDBC driver class in class path: oracle.jdbc.driver.OracleDriver\n20:12:16,593 WARN  [JARDeployer] Failed to add deployable jar: \nfile:/C:/RR/Jboss/server/default/tmp/deploy/tmp59063repor\nt59062.fo\njava.util.zip.ZipException: error in opening zip file\n        at java.util.zip.ZipFile.open(Native Method)\n        at java.util.zip.ZipFile.\u003cinit\u003e(ZipFile.java:204)\n        at java.util.jar.JarFile.\u003cinit\u003e(JarFile.java:132)\n        at java.util.jar.JarFile.\u003cinit\u003e(JarFile.java:70)\n        at org.jboss.deployment.SubDeployerSupport.processNestedDeployments\n(SubDeployerSupport.java:285)\n        at org.jboss.deployment.SubDeployerSupport.init\n(SubDeployerSupport.java:183)\n        at org.jboss.deployment.MainDeployer.init(MainDeployer.java:828)\n        at org.jboss.deployment.MainDeployer.deploy(MainDeployer.java:765)\n        at org.jboss.deployment.MainDeployer.deploy(MainDeployer.java:738)\n        at sun.reflect.GeneratedMethodAccessor47.invoke(Unknown Source)\n        at sun.reflect.DelegatingMethodAccessorImpl.invoke\n(DelegatingMethodAccessorImpl.java:25)\n        at java.lang.reflect.Method.invoke(Method.java:585)\n        at org.jboss.mx.interceptor.ReflectedDispatcher.invoke\n(ReflectedDispatcher.java:144)\n        at org.jboss.mx.server.Invocation.dispatch(Invocation.java:80)\n        at org.jboss.mx.interceptor.AbstractInterceptor.invoke\n(AbstractInterceptor.java:122)\n        at org.jboss.mx.server.Invocation.invoke(Invocation.java:74)\n        at org.jboss.mx.interceptor.ModelMBeanOperationInterceptor.invoke\n(ModelMBeanOperationInterceptor.java:131)\n        at org.jboss.mx.server.Invocation.invoke(Invocation.java:74)\n        at org.jboss.mx.server.AbstractMBeanInvoker.invoke\n(AbstractMBeanInvoker.java:249)\n        at org.jboss.mx.server.MBeanServerImpl.invoke(MBeanServerImpl.java:642)\n        at org.jboss.mx.util.MBeanProxyExt.invoke(MBeanProxyExt.java:177)\n        at $Proxy8.deploy(Unknown Source)\n        at org.jboss.deployment.scanner.URLDeploymentScanner.deploy\n(URLDeploymentScanner.java:305)\n        at org.jboss.deployment.scanner.URLDeploymentScanner.scan\n(URLDeploymentScanner.java:481)\n        at \norg.jboss.deployment.scanner.AbstractDeploymentScanner$ScannerThread.doScan\n(AbstractDeploymentScanner.java:20\n4)\n        at \norg.jboss.deployment.scanner.AbstractDeploymentScanner$ScannerThread.loop\n(AbstractDeploymentScanner.java:215)\n\n        at \norg.jboss.deployment.scanner.AbstractDeploymentScanner$ScannerThread.run\n(AbstractDeploymentScanner.java:194)\n20:12:20,343 INFO  [STDOUT] Jul 2, 2005 8:12:20 PM \norg.apache.avalon.framework.logger.Jdk14Logger info\nINFO: Using org.apache.xerces.parsers.SAXParser as SAX2 Parser\n20:12:20,796 INFO  [STDOUT] Jul 2, 2005 8:12:20 PM \norg.eclipse.birt.report.engine.emitter.fop.FOP loadFOPConfig\nINFO: Cannot find the default config: \nfile:/C:/RR/Jboss/server/default/lib/fop.xml\n20:12:22,109 INFO  [STDOUT] Jul 2, 2005 8:12:22 PM \norg.apache.avalon.framework.logger.Jdk14Logger info\nINFO: Using org.apache.xerces.parsers.SAXParser as SAX2 Parser\n20:12:22,125 INFO  [STDOUT] Jul 2, 2005 8:12:22 PM \norg.apache.avalon.framework.logger.Jdk14Logger info\nINFO: building formatting object tree\n20:12:22,125 INFO  [STDOUT] Jul 2, 2005 8:12:22 PM \norg.apache.avalon.framework.logger.Jdk14Logger info\nINFO: setting up fonts\n20:12:22,218 INFO  [STDOUT] Jul 2, 2005 8:12:22 PM \norg.apache.avalon.framework.logger.Jdk14Logger error\nSEVERE: property - \"text-transform\" is not implemented yet.\n20:12:22,234 INFO  [STDOUT] Jul 2, 2005 8:12:22 PM \norg.apache.avalon.framework.logger.Jdk14Logger error\nSEVERE: Error in letter-spacing property value \u0027normal\u0027: \norg.apache.fop.fo.expr.PropertyException: No conversion defined\n\n20:12:22,234 INFO  [STDOUT] Jul 2, 2005 8:12:22 PM \norg.apache.avalon.framework.logger.Jdk14Logger error\nSEVERE: property - \"word-spacing\" is not implemented yet.\n20:12:22,234 INFO  [STDOUT] Jul 2, 2005 8:12:22 PM \norg.apache.avalon.framework.logger.Jdk14Logger error\nSEVERE: property - \"text-transform\" is not implemented yet.\n20:12:22,234 INFO  [STDOUT] Jul 2, 2005 8:12:22 PM \norg.apache.avalon.framework.logger.Jdk14Logger error\nSEVERE: Error in letter-spacing property value \u0027normal\u0027: \norg.apache.fop.fo.expr.PropertyException: No conversion defined\n\n20:12:22,234 INFO  [STDOUT] Jul 2, 2005 8:12:22 PM \norg.apache.avalon.framework.logger.Jdk14Logger error\nSEVERE: property - \"word-spacing\" is not implemented yet.\n20:12:22,250 INFO  [STDOUT] Jul 2, 2005 8:12:22 PM \norg.apache.avalon.framework.logger.Jdk14Logger error\nSEVERE: Error in column-width property value \u002733.3%\u0027: \norg.apache.fop.fo.expr.PropertyException: No conversion defined\n20:12:22,250 INFO  [STDOUT] Jul 2, 2005 8:12:22 PM \norg.apache.avalon.framework.logger.Jdk14Logger error\nSEVERE: Error in column-width property value \u002733.3%\u0027: \norg.apache.fop.fo.expr.PropertyException: No conversion defined\n20:12:22,250 INFO  [STDOUT] Jul 2, 2005 8:12:22 PM \norg.apache.avalon.framework.logger.Jdk14Logger error\nSEVERE: Error in column-width property value \u002733.3%\u0027: \norg.apache.fop.fo.expr.PropertyException: No conversion defined\n20:12:22,250 INFO  [STDOUT] Jul 2, 2005 8:12:22 PM \norg.apache.avalon.framework.logger.Jdk14Logger error\nSEVERE: Error in column-width property value \u002733.3%\u0027: \norg.apache.fop.fo.expr.PropertyException: No conversion defined\n20:12:22,250 INFO  [STDOUT] Jul 2, 2005 8:12:22 PM \norg.apache.avalon.framework.logger.Jdk14Logger error\nSEVERE: Error in column-width property value \u002733.4%\u0027: \norg.apache.fop.fo.expr.PropertyException: No conversion defined\n20:12:22,281 INFO  [STDOUT] Jul 2, 2005 8:12:22 PM \norg.apache.avalon.framework.logger.Jdk14Logger info\nINFO: [1]\n20:12:22,296 INFO  [STDOUT] Jul 2, 2005 8:12:22 PM \norg.apache.avalon.framework.logger.Jdk14Logger error\nSEVERE: At least one of minimum, optimum, or maximum IPD must be specified on \ntable.\n20:12:22,312 INFO  [STDOUT] Jul 2, 2005 8:12:22 PM \norg.apache.avalon.framework.logger.Jdk14Logger error\nSEVERE: At least one of minimum, optimum, or maximum IPD must be specified on \ntable.\n20:12:22,328 INFO  [STDOUT] Jul 2, 2005 8:12:22 PM \norg.apache.avalon.framework.logger.Jdk14Logger info\nINFO: area contents overflows area in line SHIPPMENT_ID\n20:12:22,328 INFO  [STDOUT] Jul 2, 2005 8:12:22 PM \norg.apache.avalon.framework.logger.Jdk14Logger info\nINFO: area contents overflows area in line ORDER_SHIP_DATE\n20:12:22,437 INFO  [STDOUT] Jul 2, 2005 8:12:22 PM \norg.apache.avalon.framework.logger.Jdk14Logger info\nINFO: Parsing of document complete, stopping renderer\n20:12:22,437 INFO  [STDOUT] Jul 2, 2005 8:12:22 PM \norg.eclipse.birt.data.engine.impl.DataEngineImpl shutdown\nINFO: Data engine shuts down\n\n20:12:25,140 WARN  [JARDeployer] Failed to add deployable jar: \nfile:/C:/RR/Jboss/server/default/tmp/deploy/tmp59064repor\nt59062.fo\njava.util.zip.ZipException: error in opening zip file\n        at java.util.zip.ZipFile.open(Native Method)\n        at java.util.zip.ZipFile.\u003cinit\u003e(ZipFile.java:204)\n        at java.util.jar.JarFile.\u003cinit\u003e(JarFile.java:132)\n        at java.util.jar.JarFile.\u003cinit\u003e(JarFile.java:70)\n        at org.jboss.deployment.SubDeployerSupport.processNestedDeployments\n(SubDeployerSupport.java:285)\n        at org.jboss.deployment.SubDeployerSupport.init\n(SubDeployerSupport.java:183)\n        at org.jboss.deployment.MainDeployer.init(MainDeployer.java:828)\n        at org.jboss.deployment.MainDeployer.deploy(MainDeployer.java:765)\n        at org.jboss.deployment.MainDeployer.deploy(MainDeployer.java:738)\n        at sun.reflect.GeneratedMethodAccessor47.invoke(Unknown Source)\n        at sun.reflect.DelegatingMethodAccessorImpl.invoke\n(DelegatingMethodAccessorImpl.java:25)\n        at java.lang.reflect.Method.invoke(Method.java:585)\n        at org.jboss.mx.interceptor.ReflectedDispatcher.invoke\n(ReflectedDispatcher.java:144)\n        at org.jboss.mx.server.Invocation.dispatch(Invocation.java:80)\n        at org.jboss.mx.interceptor.AbstractInterceptor.invoke\n(AbstractInterceptor.java:122)\n        at org.jboss.mx.server.Invocation.invoke(Invocation.java:74)\n        at org.jboss.mx.interceptor.ModelMBeanOperationInterceptor.invoke\n(ModelMBeanOperationInterceptor.java:131)\n        at org.jboss.mx.server.Invocation.invoke(Invocation.java:74)\n        at org.jboss.mx.server.AbstractMBeanInvoker.invoke\n(AbstractMBeanInvoker.java:249)\n        at org.jboss.mx.server.MBeanServerImpl.invoke(MBeanServerImpl.java:642)\n        at org.jboss.mx.util.MBeanProxyExt.invoke(MBeanProxyExt.java:177)\n        at $Proxy8.deploy(Unknown Source)\n        at org.jboss.deployment.scanner.URLDeploymentScanner.deploy\n(URLDeploymentScanner.java:305)\n        at org.jboss.deployment.scanner.URLDeploymentScanner.scan\n(URLDeploymentScanner.java:463)\n        at \norg.jboss.deployment.scanner.AbstractDeploymentScanner$ScannerThread.doScan\n(AbstractDeploymentScanner.java:20\n4)\n        at \norg.jboss.deployment.scanner.AbstractDeploymentScanner$ScannerThread.loop\n(AbstractDeploymentScanner.java:215)\n\n        at \norg.jboss.deployment.scanner.AbstractDeploymentScanner$ScannerThread.run\n(AbstractDeploymentScanner.java:194)",
    "Did you deploy the birt runtime as a War file? Please provide detailed info.",
    "Add test coverage of engine on JBOSS",
    "\n\n*** This bug has been marked as a duplicate of 102633 ***"
  ],
  "commentCreationDates": [
    "2005-07-04T12:25:46+02:00",
    "2005-07-06T00:24:36+02:00",
    "2005-07-23T03:24:16+02:00",
    "2005-08-15T10:54:28+02:00"
  ],
  "traces": [
    {
      "exceptionType": "java.util.zip.ZipException",
      "message": "error in opening zip file",
      "elements": [
        {
          "method": "java.util.zip.ZipFile.open",
          "source": "Native Method"
        },
        {
          "method": "java.util.zip.ZipFile.\u003cinit\u003e",
          "source": "ZipFile.java:204"
        },
        {
          "method": "java.util.jar.JarFile.\u003cinit\u003e",
          "source": "JarFile.java:132"
        },
        {
          "method": "java.util.jar.JarFile.\u003cinit\u003e",
          "source": "JarFile.java:70"
        },
        {
          "method": "org.jboss.deployment.SubDeployerSupport.processNestedDeployments",
          "source": "SubDeployerSupport.java:285"
        },
        {
          "method": "org.jboss.deployment.SubDeployerSupport.init",
          "source": "SubDeployerSupport.java:183"
        },
        {
          "method": "org.jboss.deployment.MainDeployer.init",
          "source": "MainDeployer.java:828"
        },
        {
          "method": "org.jboss.deployment.MainDeployer.deploy",
          "source": "MainDeployer.java:765"
        },
        {
          "method": "org.jboss.deployment.MainDeployer.deploy",
          "source": "MainDeployer.java:738"
        },
        {
          "method": "sun.reflect.GeneratedMethodAccessor47.invoke",
          "source": "Unknown Source"
        },
        {
          "method": "sun.reflect.DelegatingMethodAccessorImpl.invoke",
          "source": "DelegatingMethodAccessorImpl.java:25"
        },
        {
          "method": "java.lang.reflect.Method.invoke",
          "source": "Method.java:585"
        },
        {
          "method": "org.jboss.mx.interceptor.ReflectedDispatcher.invoke",
          "source": "ReflectedDispatcher.java:144"
        },
        {
          "method": "org.jboss.mx.server.Invocation.dispatch",
          "source": "Invocation.java:80"
        },
        {
          "method": "org.jboss.mx.interceptor.AbstractInterceptor.invoke",
          "source": "AbstractInterceptor.java:122"
        },
        {
          "method": "org.jboss.mx.server.Invocation.invoke",
          "source": "Invocation.java:74"
        },
        {
          "method": "org.jboss.mx.interceptor.ModelMBeanOperationInterceptor.invoke",
          "source": "ModelMBeanOperationInterceptor.java:131"
        },
        {
          "method": "org.jboss.mx.server.Invocation.invoke",
          "source": "Invocation.java:74"
        },
        {
          "method": "org.jboss.mx.server.AbstractMBeanInvoker.invoke",
          "source": "AbstractMBeanInvoker.java:249"
        },
        {
          "method": "org.jboss.mx.server.MBeanServerImpl.invoke",
          "source": "MBeanServerImpl.java:642"
        },
        {
          "method": "org.jboss.mx.util.MBeanProxyExt.invoke",
          "source": "MBeanProxyExt.java:177"
        }
      ],
      "number": 0,
      "commentIndex": 0,
      "bugId": "102636",
      "duplicateId": "102633",
      "date": "2005-07-04T12:25:46+02:00",
      "product": "BIRT",
      "component": "Report Viewer",
      "severity": "major"
    },
    {
      "exceptionType": "java.util.zip.ZipException",
      "message": "error in opening zip file",
      "elements": [
        {
          "method": "java.util.zip.ZipFile.open",
          "source": "Native Method"
        },
        {
          "method": "java.util.zip.ZipFile.\u003cinit\u003e",
          "source": "ZipFile.java:204"
        },
        {
          "method": "java.util.jar.JarFile.\u003cinit\u003e",
          "source": "JarFile.java:132"
        },
        {
          "method": "java.util.jar.JarFile.\u003cinit\u003e",
          "source": "JarFile.java:70"
        },
        {
          "method": "org.jboss.deployment.SubDeployerSupport.processNestedDeployments",
          "source": "SubDeployerSupport.java:285"
        },
        {
          "method": "org.jboss.deployment.SubDeployerSupport.init",
          "source": "SubDeployerSupport.java:183"
        },
        {
          "method": "org.jboss.deployment.MainDeployer.init",
          "source": "MainDeployer.java:828"
        },
        {
          "method": "org.jboss.deployment.MainDeployer.deploy",
          "source": "MainDeployer.java:765"
        },
        {
          "method": "org.jboss.deployment.MainDeployer.deploy",
          "source": "MainDeployer.java:738"
        },
        {
          "method": "sun.reflect.GeneratedMethodAccessor47.invoke",
          "source": "Unknown Source"
        },
        {
          "method": "sun.reflect.DelegatingMethodAccessorImpl.invoke",
          "source": "DelegatingMethodAccessorImpl.java:25"
        },
        {
          "method": "java.lang.reflect.Method.invoke",
          "source": "Method.java:585"
        },
        {
          "method": "org.jboss.mx.interceptor.ReflectedDispatcher.invoke",
          "source": "ReflectedDispatcher.java:144"
        },
        {
          "method": "org.jboss.mx.server.Invocation.dispatch",
          "source": "Invocation.java:80"
        },
        {
          "method": "org.jboss.mx.interceptor.AbstractInterceptor.invoke",
          "source": "AbstractInterceptor.java:122"
        },
        {
          "method": "org.jboss.mx.server.Invocation.invoke",
          "source": "Invocation.java:74"
        },
        {
          "method": "org.jboss.mx.interceptor.ModelMBeanOperationInterceptor.invoke",
          "source": "ModelMBeanOperationInterceptor.java:131"
        },
        {
          "method": "org.jboss.mx.server.Invocation.invoke",
          "source": "Invocation.java:74"
        },
        {
          "method": "org.jboss.mx.server.AbstractMBeanInvoker.invoke",
          "source": "AbstractMBeanInvoker.java:249"
        },
        {
          "method": "org.jboss.mx.server.MBeanServerImpl.invoke",
          "source": "MBeanServerImpl.java:642"
        },
        {
          "method": "org.jboss.mx.util.MBeanProxyExt.invoke",
          "source": "MBeanProxyExt.java:177"
        }
      ],
      "number": 1,
      "commentIndex": 0,
      "bugId": "102636",
      "duplicateId": "102633",
      "date": "2005-07-04T12:25:46+02:00",
      "product": "BIRT",
      "component": "Report Viewer",
      "severity": "major"
    }
  ],
  "groupId": "102633",
  "bugId": "102636",
  "duplicateId": "102633",
  "date": "2005-07-04T12:25:46+02:00",
  "product": "BIRT",
  "component": "Report Viewer",
  "severity": "major"
}