{
  "comments": [
    "Overview:\n---------\n    When launching a unit test either in run mode or debug mode (mostly debug\nmode) I get the following error message:\n    An internal error occurred during: \"Launching\".\n\nSteps to reproduce:\n-------------------\n    1. Create a junit unit test for a source java file\n    2. Set one or more breakpoints in the test file\n    3. Make sure your compiler and debug settings are restored to default\n    4. Also make sure you are using java 5.0\n    5. Now, right clilck on the test file; on the menu that pops up go to \"Debug\nAs...\". This brings a sub menu, choose JUnit-Test\n    6. Mine is set to change to Debug perspective (hopefully this should not\nmatter since the error happens prior to switching perspective)\n\nActual Result:\n--------------\n    I get \"An internal error occurred during: \"Launching\". When refering to the\nerror log (using Window \u003e show view \u003e Error Log \u003e double click on the error\nitem), the stack trace is:\n\njava.lang.NoSuchMethodError:\norg.eclipse.debug.internal.core.DebugCoreMessages.getString(Ljava/lang/String;)Ljava/lang/String;\nat\norg.eclipse.jdt.internal.junit.launcher.JUnitBaseLaunchConfiguration.existsProblems(JUnitBaseLaunchConfiguration.java:433)\nat\norg.eclipse.jdt.internal.junit.launcher.JUnitBaseLaunchConfiguration.finalLaunchCheck(JUnitBaseLaunchConfiguration.java:220)\nat\norg.eclipse.debug.internal.core.LaunchConfiguration.launch(LaunchConfiguration.java:578)\nat\norg.eclipse.debug.internal.core.LaunchConfiguration.launch(LaunchConfiguration.java:515)\nat\norg.eclipse.debug.internal.ui.DebugUIPlugin.buildAndLaunch(DebugUIPlugin.java:733)\nat org.eclipse.debug.internal.ui.DebugUIPlugin$6.run(DebugUIPlugin.java:931)\nat org.eclipse.core.internal.jobs.Worker.run(Worker.java:76)\n\nExpected Results:\n-----------------\n    The test should launch and execution should suspend at the breakpoint\nwaiting for user action\n\nBuild Date and Platform:\n------------------------\neclipse.buildId\u003dI20050627-1435\njava.version\u003d1.5.0_03\njava.vendor\u003dSun Microsystems Inc.\nBootLoader constants: OS\u003dwin32, ARCH\u003dx86, WS\u003dwin32, NL\u003den_US\nCommand-line arguments:  -os win32 -ws win32 -arch x86 -clean -data c:\\apps\\modules",
    "Created an attachment (id\u003d24402)\nError log from current session\n",
    "Here is the eclipse launch command line parameters:\nC:\\eclipse\\eclipse.exe -clean -data c:\\apps\\modules -vm\nC:\\jdk1.5.0_03\\jre\\bin\\javaw -vmargs -Xmx384M\n-Djava.endorsed.dirs\u003dC:\\tools\\jboss-4.0.2\\lib\\endorsed",
    "I believe you have the wrong version of the org.eclipse.jdt.junit plug-in in \nyour SDK installation. The line numbers in the given stack trace do not match \nthose that are in the 3.1 release (there are only 212 lines in the \nJUnitBaseLaunchConfiguration.java file that exists in 3.1).",
    "I am not sure how that happened since, I removed the previous installation of\neclipse and reinstalled it on to a fresh directory. More over the weird part is,\nit works for the firt couple of times and then starts creating problems. In any\ncase, since you pointed out the problem, can you please suggest how I can\nreplace with the right version of that plugin?",
    "I would suggest to create a clean installation from the 3.1 download. Then \nstart your workspace with the \"-clean\" option.",
    "Please refer to my command line parameters, I already use \"-clean\" option and as\nI mentioned earlier it was on a clean install I had this problem. It is possible\nthere was some residual information that got transferred thru\u0027 the workspace\nbecause for both the (new and old) installations I used the same workspace and\neffectively the same the .metadata directory. I was trying to find if there was\nan alternate way of just taking care of the junit part. Thanks anyway."
  ],
  "commentCreationDates": [
    "2005-07-06T22:39:55+02:00",
    "2005-07-06T22:42:38+02:00",
    "2005-07-06T22:47:41+02:00",
    "2005-07-21T05:21:12+02:00",
    "2005-07-22T04:06:52+02:00",
    "2005-07-22T04:25:20+02:00",
    "2005-07-22T22:32:37+02:00"
  ],
  "traces": [
    {
      "exceptionType": "java.lang.NoSuchMethodError",
      "message": "org.eclipse.debug.internal.core.DebugCoreMessages.getString(Ljava/lang/String;)Ljava/lang/String;",
      "elements": [
        {
          "method": "org.eclipse.jdt.internal.junit.launcher.JUnitBaseLaunchConfiguration.existsProblems",
          "source": "JUnitBaseLaunchConfiguration.java:433"
        },
        {
          "method": "org.eclipse.jdt.internal.junit.launcher.JUnitBaseLaunchConfiguration.finalLaunchCheck",
          "source": "JUnitBaseLaunchConfiguration.java:220"
        },
        {
          "method": "org.eclipse.debug.internal.core.LaunchConfiguration.launch",
          "source": "LaunchConfiguration.java:578"
        },
        {
          "method": "org.eclipse.debug.internal.core.LaunchConfiguration.launch",
          "source": "LaunchConfiguration.java:515"
        },
        {
          "method": "org.eclipse.debug.internal.ui.DebugUIPlugin.buildAndLaunch",
          "source": "DebugUIPlugin.java:733"
        },
        {
          "method": "org.eclipse.debug.internal.ui.DebugUIPlugin$6.run",
          "source": "DebugUIPlugin.java:931"
        },
        {
          "method": "org.eclipse.core.internal.jobs.Worker.run",
          "source": "Worker.java:76"
        }
      ],
      "number": 0,
      "commentIndex": 0,
      "bugId": "102937",
      "date": "2005-07-06T22:39:55+02:00",
      "product": "Platform",
      "component": "Debug",
      "severity": "major"
    }
  ],
  "groupId": "102937",
  "bugId": "102937",
  "date": "2005-07-06T22:39:55+02:00",
  "product": "Platform",
  "component": "Debug",
  "severity": "major"
}