{
  "comments": [
    "I cannot use any of the views included with core tools 1.2.0 from the website. \nI get this error in the log:\n\n!ENTRY org.eclipse.osgi 2005-07-09 14:24:07.695\n!MESSAGE An error occurred while automatically activating bundle\norg.eclipse.core.tools (93).\n!STACK 0 \norg.osgi.framework.BundleException: The activator\norg.eclipse.core.tools.CoreToolsPlugin for bundle org.eclipse.core.tools is invalid\n        at\norg.eclipse.osgi.framework.internal.core.AbstractBundle.loadBundleActivator(AbstractBundle.java:151)\n        at\norg.eclipse.osgi.framework.internal.core.BundleContextImpl.start(BundleContextImpl.java:965)\n        at\norg.eclipse.osgi.framework.internal.core.BundleHost.startWorker(BundleHost.java:321)\n        at\norg.eclipse.osgi.framework.internal.core.AbstractBundle.start(AbstractBundle.java:266)\n        at\norg.eclipse.core.runtime.adaptor.EclipseClassLoader.findLocalClass(EclipseClassLoader.java:116)\n        at\norg.eclipse.osgi.framework.internal.core.BundleLoader.findLocalClass(BundleLoader.java:337)\n        at\norg.eclipse.osgi.framework.internal.core.SingleSourcePackage.loadClass(SingleSourcePackage.java:37)\n        at\norg.eclipse.osgi.framework.internal.core.BundleLoader.findClass(BundleLoader.java:386)\n        at\norg.eclipse.osgi.framework.internal.core.BundleLoader.findClass(BundleLoader.java:350)\n        at\norg.eclipse.osgi.framework.adaptor.core.AbstractClassLoader.loadClass(AbstractClassLoader.java:78)\n\n\nI first tried to get the core tools plugin from the update site below, but it\nwas a much older version.  However, it did not work either, and gave an error\nsimilar to the one shown above.\n  http://dev.eclipse.org/viewcvs/index.cgi/%7Echeckout%7E/platform-core-home/updates\n\nIf I get org.eclipse.core.tools from CVS, it seems to work OK in a runtime\nworkspace.",
    "\n\n*** This bug has been marked as a duplicate of 102454 ***"
  ],
  "commentCreationDates": [
    "2005-07-09T20:24:41+02:00",
    "2005-07-11T13:05:37+02:00"
  ],
  "traces": [
    {
      "exceptionType": "org.osgi.framework.BundleException",
      "message": "The activator org.eclipse.core.tools.CoreToolsPlugin for bundle org.eclipse.core.tools is invalid",
      "elements": [
        {
          "method": "org.eclipse.osgi.framework.internal.core.AbstractBundle.loadBundleActivator",
          "source": "AbstractBundle.java:151"
        },
        {
          "method": "org.eclipse.osgi.framework.internal.core.BundleContextImpl.start",
          "source": "BundleContextImpl.java:965"
        },
        {
          "method": "org.eclipse.osgi.framework.internal.core.BundleHost.startWorker",
          "source": "BundleHost.java:321"
        },
        {
          "method": "org.eclipse.osgi.framework.internal.core.AbstractBundle.start",
          "source": "AbstractBundle.java:266"
        },
        {
          "method": "org.eclipse.core.runtime.adaptor.EclipseClassLoader.findLocalClass",
          "source": "EclipseClassLoader.java:116"
        },
        {
          "method": "org.eclipse.osgi.framework.internal.core.BundleLoader.findLocalClass",
          "source": "BundleLoader.java:337"
        },
        {
          "method": "org.eclipse.osgi.framework.internal.core.SingleSourcePackage.loadClass",
          "source": "SingleSourcePackage.java:37"
        },
        {
          "method": "org.eclipse.osgi.framework.internal.core.BundleLoader.findClass",
          "source": "BundleLoader.java:386"
        },
        {
          "method": "org.eclipse.osgi.framework.internal.core.BundleLoader.findClass",
          "source": "BundleLoader.java:350"
        },
        {
          "method": "org.eclipse.osgi.framework.adaptor.core.AbstractClassLoader.loadClass",
          "source": "AbstractClassLoader.java:78"
        }
      ],
      "number": 0,
      "commentIndex": 0,
      "bugId": "103256",
      "duplicateId": "102454",
      "date": "2005-07-09T20:24:41+02:00",
      "product": "Platform",
      "component": "Runtime",
      "severity": "normal"
    }
  ],
  "groupId": "102454",
  "bugId": "103256",
  "duplicateId": "102454",
  "date": "2005-07-09T20:24:41+02:00",
  "product": "Platform",
  "component": "Runtime",
  "severity": "normal"
}