{
  "comments": [
    "Hi,\n\n            I?m currently running Version: 4.0.1\n\nBuild id: 2005.06.22 of window builder pro, on Eclipse Platform\n\nVersion: 3.1.0\n\nBuild id: I20050513-1415.  (Sorry cutting and pasting here).\n\n \n\nMicrosoft Windows XP [Version 5.1.2600]\n\n \n\njava version \"1.5.0_02\"\n\nJava(TM) 2 Runtime Environment, Standard Edition (build 1.5.0_02-b09)\n\nJava HotSpot(TM) Client VM (build 1.5.0_02-b09, mixed mode, sharing)\n\n \n\n \n\nI have a Swing project where there is some encryption/decryption being done.  \nIn JDK 1.4x it works just fine, however when running in debug, using 1.5.0_2, \nthe NoSuchAlgorithm Exception arises while running this code.\n\n \n\n    try\n\n    {\n\n        keyCipher \u003d Cipher.getInstance(\"DES/ECB/NoPadding\");\n\n        dataCipher \u003d Cipher.getInstance(\"DES/ECB/NoPadding\");\n\n    }\n\n    catch (NoSuchAlgorithmException ex)\n\n    {\n\n      ex.printStackTrace();\n\n        throw new Exception(\"Invalid Object Reference 2\");\n\n    }\n\n    catch (NoSuchPaddingException ex)\n\n    {\n\n        throw new Exception(\"Invalid Object Reference 3\");\n\n    }\n\n    catch(Exception ex)\n\n    {\n\n        ex.printStackTrace();\n\n        throw new Exception(\"Invalid Object Reference 3.5\");\n\n        \n\n    }\n\n \n\n \n\njava.security.NoSuchAlgorithmException: Cannot find any provider supporting \nDES/ECB/NoPadding\n\n      at javax.crypto.Cipher.getInstance(DashoA12275)\n\n      at com.ilmn.file.enc.IlmnEncodedFile.decrypt(IlmnEncodedFile.java:248)\n\n      at com.ilmn.file.enc.DMAP.load(DMAP.java:176)\n\n      at com.ilmn.file.enc.DMAP.\u003cinit\u003e(DMAP.java:114)\n\n      at com.ilmn.labmgr.PnlProduct$3.run(PnlProduct.java:263)\n\njava.lang.Exception: Invalid Object Reference 2\n\n      at com.ilmn.file.enc.IlmnEncodedFile.decrypt(IlmnEncodedFile.java:254)\n\n      at com.ilmn.file.enc.DMAP.load(DMAP.java:176)\n\n      at com.ilmn.file.enc.DMAP.\u003cinit\u003e(DMAP.java:114)\n\n      at com.ilmn.labmgr.PnlProduct$3.run(PnlProduct.java:263)\n\njava.lang.Exception: Invalid Object Reference 2\n\n      at com.ilmn.file.enc.IlmnEncodedFile.decrypt(IlmnEncodedFile.java:254)\n\n      at com.ilmn.file.enc.DMAP.load(DMAP.java:176)\n\n      at com.ilmn.file.enc.DMAP.\u003cinit\u003e(DMAP.java:114)\n\n      at com.ilmn.labmgr.PnlProduct$3.run(PnlProduct.java:263)\n\n \n\n \n\n \n\nMy initial thought was the jre was not able to find a provider for that \nparticular cipher type.  I worked with security and settings for a while until \nI attempted to manually set up my bootsrap entry for debug.  When I did this, \nby only assigning rt.jar, jsse.jar and jce.jar, everything worked fine.",
    "Sample works ok for me on 1.4.2 and 1.5.0. Can you add more details? have you \nmodified the bootpath? can you attach a sample project that demonstrates the \nproblem?",
    "Marking as works for me without further steps/example to reproduce."
  ],
  "commentCreationDates": [
    "2005-07-22T23:36:14+02:00",
    "2005-07-23T15:52:29+02:00",
    "2005-07-29T15:59:55+02:00"
  ],
  "traces": [
    {
      "exceptionType": "java.security.NoSuchAlgorithmException",
      "message": "Cannot find any provider supporting  DES/ECB/NoPadding",
      "elements": [
        {
          "method": "javax.crypto.Cipher.getInstance",
          "source": "DashoA12275"
        },
        {
          "method": "com.ilmn.file.enc.IlmnEncodedFile.decrypt",
          "source": "IlmnEncodedFile.java:248"
        },
        {
          "method": "com.ilmn.file.enc.DMAP.load",
          "source": "DMAP.java:176"
        },
        {
          "method": "com.ilmn.file.enc.DMAP.\u003cinit\u003e",
          "source": "DMAP.java:114"
        },
        {
          "method": "com.ilmn.labmgr.PnlProduct$3.run",
          "source": "PnlProduct.java:263"
        }
      ],
      "number": 0,
      "commentIndex": 0,
      "bugId": "104894",
      "date": "2005-07-22T23:36:14+02:00",
      "product": "Platform",
      "component": "Debug",
      "severity": "normal"
    },
    {
      "exceptionType": "java.lang.Exception",
      "message": "Invalid Object Reference 2",
      "elements": [
        {
          "method": "com.ilmn.file.enc.IlmnEncodedFile.decrypt",
          "source": "IlmnEncodedFile.java:254"
        },
        {
          "method": "com.ilmn.file.enc.DMAP.load",
          "source": "DMAP.java:176"
        },
        {
          "method": "com.ilmn.file.enc.DMAP.\u003cinit\u003e",
          "source": "DMAP.java:114"
        },
        {
          "method": "com.ilmn.labmgr.PnlProduct$3.run",
          "source": "PnlProduct.java:263"
        }
      ],
      "number": 1,
      "commentIndex": 0,
      "bugId": "104894",
      "date": "2005-07-22T23:36:14+02:00",
      "product": "Platform",
      "component": "Debug",
      "severity": "normal"
    },
    {
      "exceptionType": "java.lang.Exception",
      "message": "Invalid Object Reference 2",
      "elements": [
        {
          "method": "com.ilmn.file.enc.IlmnEncodedFile.decrypt",
          "source": "IlmnEncodedFile.java:254"
        },
        {
          "method": "com.ilmn.file.enc.DMAP.load",
          "source": "DMAP.java:176"
        },
        {
          "method": "com.ilmn.file.enc.DMAP.\u003cinit\u003e",
          "source": "DMAP.java:114"
        },
        {
          "method": "com.ilmn.labmgr.PnlProduct$3.run",
          "source": "PnlProduct.java:263"
        }
      ],
      "number": 2,
      "commentIndex": 0,
      "bugId": "104894",
      "date": "2005-07-22T23:36:14+02:00",
      "product": "Platform",
      "component": "Debug",
      "severity": "normal"
    }
  ],
  "groupId": "104894",
  "bugId": "104894",
  "date": "2005-07-22T23:36:14+02:00",
  "product": "Platform",
  "component": "Debug",
  "severity": "normal"
}