{
  "comments": [
    "There are two ways to add an existing project to the workspace - File \u003e New \u003e\nProject and Import \u003e Existing project into workspace - but only one way to add\nan existing folder to the workspace as a project - File \u003e New \u003e Project.\n\nWhile this makes perfect sense to the implementation, it is counter-intuitive to\nthe user who just wants to work on some existing files in Eclipse that the user\nshould \"create\" a project to do it. The behavior is a bit unlike any other\ncreation wizard in that it does not refuse to create a resource if it already\nexists. Moreover, it seems a bit odd to the same user that Import does not work,\nsince the folder represents a \"project\" to the user. Import is an odd choice of\nnames for this operation; odd enough that the dialog must inform the user that\nthe project will not actually be copied into the workspace. The Import path\nprovides no way to give an existing project a different name in the workspace.\nFinally, using Edit \u003e Delete to remove a project from the workspace is very\ncounter-intuitive, and kinda scary.\n\nThe differences between New and Import could be resolved by extending the Import\nwizard to deal with the folder-not-a-project case by treating it the same, i.e.,\nconverting the folder to a project if need be and adding the option to give the\nproject another name in the workspace.\n\nAlternatively, the whole business of adding/removing projects could (and I think\nshould) be extracted from New and Import and become independent menu items,\ne.g., Add Project and Remove Project. Add project would work like the\nalready-existing-folder case does in New; Remove Project would work like Edit \u003e\nDelete for projects. The \"delete\" functionality could be removed from Edit \u003e\nDelete. Instead, a dialog could advise the user to use Remove Project.",
    "Counterintuitive is putting it mildly; it makes no sense whatsoever. It also doesn\u0027t work.\n\nWhen specifying a relative path (which would make the most sense, since it keeps the projects portable!), I\u0027m getting:\n\norg.eclipse.core.internal.resources.ResourceException: Invalid project description.\n        at org.eclipse.core.internal.resources.Project.checkDescription(Project.java:172)\n        at org.eclipse.core.internal.resources.Project.setDescription(Project.java:966)\n        at org.eclipse.core.internal.resources.Project.setDescription(Project.java:1010)\n        at org.eclipse.jdt.internal.ui.wizards.buildpaths.BuildPathsBlock.addJavaNature(BuildPathsBlock.java:662)\n        at org.eclipse.jdt.ui.wizards.JavaCapabilityConfigurationPage.configureJavaProject(JavaCapabilityConfigurationPage.java:253)\n        at org.eclipse.jdt.internal.ui.wizards.JavaProjectWizardSecondPage.updateProject(JavaProjectWizardSecondPage.java:237)\n        at org.eclipse.jdt.internal.ui.wizards.JavaProjectWizardSecondPage$1.run(JavaProjectWizardSecondPage.java:130)\n        at org.eclipse.ui.actions.WorkspaceModifyDelegatingOperation.execute(WorkspaceModifyDelegatingOperation.java:68)\n        at org.eclipse.ui.actions.WorkspaceModifyOperation$1.run(WorkspaceModifyOperation.java:101)\n        at org.eclipse.core.internal.resources.Workspace.run(Workspace.java:1737)\n        at org.eclipse.ui.actions.WorkspaceModifyOperation.run(WorkspaceModifyOperation.java:113)\n        at org.eclipse.jface.operation.ModalContext$ModalContextThread.run(ModalContext.java:113)\n\nIf I specify an absolute path, I\u0027m getting:\n\n!MESSAGE /home/gback/apache-tomcat-6.0.10/webapps/eb/src overlaps the location of another project: src\n~\nwhich is intriguing considering /home/gback/apache-tomcat-6.0.10/webapps/eb/src is the folder I want to import into the project \u0027src\u0027, and it\u0027s not the location of \"another project\", it\u0027s just a folder in my filesystem I\u0027d like to import!\n\n"
  ],
  "commentCreationDates": [
    "2005-07-29T21:27:47+02:00",
    "2007-03-28T04:59:45+02:00"
  ],
  "traces": [
    {
      "exceptionType": "org.eclipse.core.internal.resources.ResourceException",
      "message": "Invalid project description.",
      "elements": [
        {
          "method": "org.eclipse.core.internal.resources.Project.checkDescription",
          "source": "Project.java:172"
        },
        {
          "method": "org.eclipse.core.internal.resources.Project.setDescription",
          "source": "Project.java:966"
        },
        {
          "method": "org.eclipse.core.internal.resources.Project.setDescription",
          "source": "Project.java:1010"
        },
        {
          "method": "org.eclipse.jdt.internal.ui.wizards.buildpaths.BuildPathsBlock.addJavaNature",
          "source": "BuildPathsBlock.java:662"
        },
        {
          "method": "org.eclipse.jdt.ui.wizards.JavaCapabilityConfigurationPage.configureJavaProject",
          "source": "JavaCapabilityConfigurationPage.java:253"
        },
        {
          "method": "org.eclipse.jdt.internal.ui.wizards.JavaProjectWizardSecondPage.updateProject",
          "source": "JavaProjectWizardSecondPage.java:237"
        },
        {
          "method": "org.eclipse.jdt.internal.ui.wizards.JavaProjectWizardSecondPage$1.run",
          "source": "JavaProjectWizardSecondPage.java:130"
        },
        {
          "method": "org.eclipse.ui.actions.WorkspaceModifyDelegatingOperation.execute",
          "source": "WorkspaceModifyDelegatingOperation.java:68"
        },
        {
          "method": "org.eclipse.ui.actions.WorkspaceModifyOperation$1.run",
          "source": "WorkspaceModifyOperation.java:101"
        },
        {
          "method": "org.eclipse.core.internal.resources.Workspace.run",
          "source": "Workspace.java:1737"
        },
        {
          "method": "org.eclipse.ui.actions.WorkspaceModifyOperation.run",
          "source": "WorkspaceModifyOperation.java:113"
        },
        {
          "method": "org.eclipse.jface.operation.ModalContext$ModalContextThread.run",
          "source": "ModalContext.java:113"
        }
      ],
      "number": 0,
      "commentIndex": 1,
      "bugId": "105603",
      "date": "2007-03-28T04:59:45+02:00",
      "product": "Platform",
      "component": "IDE",
      "severity": "enhancement"
    }
  ],
  "groupId": "105603",
  "bugId": "105603",
  "date": "2005-07-29T21:27:47+02:00",
  "product": "Platform",
  "component": "IDE",
  "severity": "enhancement"
}