{
  "comments": [
    "I have written a standalone application to load an EAR file and got the \nexception below. My program is like:\n\nCommonarchiveFactory factory \u003d CommonarchiveFactoryImpl.getActiveFactory();\nEARFile anEarFile \u003d factory.openEARFile(anEarFilePath);\nanEarFile.getDeploymentDescriptor();\nanEarFile.rollUpRoles(); // Got exception\n\nException in thread \"main\" \norg.eclipse.jst.j2ee.commonarchivecore.internal.excep\ntion.DeploymentDescriptorLoadException: IWAE0022E Exception occurred loading \ndep\nloyment descriptor for module \"CurrentTimeWeb.war\" in EAR \nfile \"TechnologySample\ns.ear\"\n!Stack_trace_of_nested_exce!\norg.eclipse.jst.j2ee.commonarchivecore.internal.exception.DeploymentDescriptorL\no\nadException: WEB-INF/web.xml\n!Stack_trace_of_nested_exce!\norg.eclipse.jst.j2ee.commonarchivecore.internal.exception.ResourceLoadException\n:\n IWAE0007E Could not load resource \"WEB-INF/web.xml\" in \narchive \"CurrentTimeWeb.\nwar\"\n!Stack_trace_of_nested_exce!\nWrapped exception\njava.net.ConnectException: Connection refused: connect\n        at org.apache.crimson.parser.Parser2.fatal(Unknown Source)\n        at org.apache.crimson.parser.Parser2.externalParameterEntity(Unknown \nSou\nrce)\n        at org.apache.crimson.parser.Parser2.maybeDoctypeDecl(Unknown Source)\n        at org.apache.crimson.parser.Parser2.parseInternal(Unknown Source)\n        at org.apache.crimson.parser.Parser2.parse(Unknown Source)\n        at org.apache.crimson.parser.XMLReaderImpl.parse(Unknown Source)\n        at org.apache.crimson.jaxp.DocumentBuilderImpl.parse(Unknown Source)\n        at javax.xml.parsers.DocumentBuilder.parse(Unknown Source)\n        at \norg.eclipse.wst.common.internal.emf.utilities.DOMUtilities.loadDocume\nnt(DOMUtilities.java:546)\n        at \norg.eclipse.wst.common.internal.emf.resource.EMF2DOMRenderer.loadDocu\nment(EMF2DOMRenderer.java:72)\n        at org.eclipse.wst.common.internal.emf.resource.EMF2DOMRenderer.doLoad\n(E\nMF2DOMRenderer.java:60)\n        at \norg.eclipse.wst.common.internal.emf.resource.TranslatorResourceImpl.b\nasicDoLoad(TranslatorResourceImpl.java:141)\n        at \norg.eclipse.wst.common.internal.emf.resource.CompatibilityXMIResource\nImpl.doLoad(CompatibilityXMIResourceImpl.java:173)\n        at org.eclipse.emf.ecore.resource.impl.ResourceImpl.load\n(ResourceImpl.ja\nva:977)\n        at org.eclipse.emf.ecore.resource.impl.ResourceImpl.load\n(ResourceImpl.ja\nva:832)\n        at \norg.eclipse.wst.common.internal.emf.resource.TranslatorResourceImpl.l\noad(TranslatorResourceImpl.java:382)\n        at org.eclipse.emf.ecore.resource.impl.ResourceSetImpl.demandLoad\n(Resour\nceSetImpl.java:249)\n        at org.eclipse.emf.ecore.resource.impl.ResourceSetImpl.demandLoadHelper\n(\nResourceSetImpl.java:264)\n        at org.eclipse.emf.ecore.resource.impl.ResourceSetImpl.getResource\n(Resou\nrceSetImpl.java:349)\n        at \norg.eclipse.jst.j2ee.commonarchivecore.internal.strategy.LoadStrategy\nImpl.getMofResource(LoadStrategyImpl.java:335)\n        at \norg.eclipse.jst.j2ee.commonarchivecore.internal.impl.ArchiveImpl.getM\nofResource(ArchiveImpl.java:881)\n        at \norg.eclipse.jst.j2ee.commonarchivecore.internal.impl.ModuleFileImpl.g\netDeploymentDescriptorResource(ModuleFileImpl.java:264)\n        at \norg.eclipse.jst.j2ee.commonarchivecore.internal.strategy.XmlBasedImpo\nrtStrategyImpl.primLoadDeploymentDescriptor(XmlBasedImportStrategyImpl.java:39)\n        at \norg.eclipse.jst.j2ee.commonarchivecore.internal.strategy.War22ImportS\ntrategyImpl.loadDeploymentDescriptor(War22ImportStrategyImpl.java:87)\n        at \norg.eclipse.jst.j2ee.commonarchivecore.internal.strategy.War22ImportS\ntrategyImpl.importMetaData(War22ImportStrategyImpl.java:81)\n        at \norg.eclipse.jst.j2ee.commonarchivecore.internal.impl.WARFileImpl.getD\neploymentDescriptor(WARFileImpl.java:152)\n        at \norg.eclipse.jst.j2ee.commonarchivecore.internal.impl.WARFileImpl.getS\ntandardDeploymentDescriptor(WARFileImpl.java:318)\n        at \norg.eclipse.jst.j2ee.commonarchivecore.internal.impl.EARFileImpl.getD\neploymentDescriptor(EARFileImpl.java:337)\n        at \norg.eclipse.jst.j2ee.commonarchivecore.internal.impl.EARFileImpl.getD\neploymentDescriptor(EARFileImpl.java:346)\n        at \norg.eclipse.jst.j2ee.commonarchivecore.internal.impl.EARFileImpl.roll\nUpRoles(EARFileImpl.java:827)\n        at \norg.eclipse.jst.j2ee.commonarchivecore.internal.impl.EARFileImpl.roll\nUpRoles(EARFileImpl.java:816)\n        at TestCommonArchiveRollupRoles.testRoleupRoles\n(TestCommonArchiveRollupR\noles.java:48)\n        at TestCommonArchiveRollupRoles.main\n(TestCommonArchiveRollupRoles.java:1\n9)\nWrapped by\norg.eclipse.emf.common.util.WrappedException: External entity not \nfound: \"http:/\n/java.sun.com/dtd/web-app_2_3.dtd\".\n        at \norg.eclipse.wst.common.internal.emf.resource.EMF2DOMRenderer.loadDocu\nment(EMF2DOMRenderer.java:79)\n        at org.eclipse.wst.common.internal.emf.resource.EMF2DOMRenderer.doLoad\n(E\nMF2DOMRenderer.java:60)\n        at \norg.eclipse.wst.common.internal.emf.resource.TranslatorResourceImpl.b\nasicDoLoad(TranslatorResourceImpl.java:141)\n        at \norg.eclipse.wst.common.internal.emf.resource.CompatibilityXMIResource\nImpl.doLoad(CompatibilityXMIResourceImpl.java:173)\n        at org.eclipse.emf.ecore.resource.impl.ResourceImpl.load\n(ResourceImpl.ja\nva:977)\n        at org.eclipse.emf.ecore.resource.impl.ResourceImpl.load\n(ResourceImpl.ja\nva:832)\n        at \norg.eclipse.wst.common.internal.emf.resource.TranslatorResourceImpl.l\noad(TranslatorResourceImpl.java:382)\n        at org.eclipse.emf.ecore.resource.impl.ResourceSetImpl.demandLoad\n(Resour\nceSetImpl.java:249)\n        at org.eclipse.emf.ecore.resource.impl.ResourceSetImpl.demandLoadHelper\n(\nResourceSetImpl.java:264)\n        at org.eclipse.emf.ecore.resource.impl.ResourceSetImpl.getResource\n(Resou\nrceSetImpl.java:349)\n        at \norg.eclipse.jst.j2ee.commonarchivecore.internal.strategy.LoadStrategy\nImpl.getMofResource(LoadStrategyImpl.java:335)\n        at \norg.eclipse.jst.j2ee.commonarchivecore.internal.impl.ArchiveImpl.getM\nofResource(ArchiveImpl.java:881)\n        at \norg.eclipse.jst.j2ee.commonarchivecore.internal.impl.ModuleFileImpl.g\netDeploymentDescriptorResource(ModuleFileImpl.java:264)\n        at \norg.eclipse.jst.j2ee.commonarchivecore.internal.strategy.XmlBasedImpo\nrtStrategyImpl.primLoadDeploymentDescriptor(XmlBasedImportStrategyImpl.java:39)\n        at \norg.eclipse.jst.j2ee.commonarchivecore.internal.strategy.War22ImportS\ntrategyImpl.loadDeploymentDescriptor(War22ImportStrategyImpl.java:87)\n        at \norg.eclipse.jst.j2ee.commonarchivecore.internal.strategy.War22ImportS\ntrategyImpl.importMetaData(War22ImportStrategyImpl.java:81)\n        at \norg.eclipse.jst.j2ee.commonarchivecore.internal.impl.WARFileImpl.getD\neploymentDescriptor(WARFileImpl.java:152)\n        at \norg.eclipse.jst.j2ee.commonarchivecore.internal.impl.WARFileImpl.getS\ntandardDeploymentDescriptor(WARFileImpl.java:318)\n        at \norg.eclipse.jst.j2ee.commonarchivecore.internal.impl.EARFileImpl.getD\neploymentDescriptor(EARFileImpl.java:337)\n        at \norg.eclipse.jst.j2ee.commonarchivecore.internal.impl.EARFileImpl.getD\neploymentDescriptor(EARFileImpl.java:346)\n        at \norg.eclipse.jst.j2ee.commonarchivecore.internal.impl.EARFileImpl.roll\nUpRoles(EARFileImpl.java:827)\n        at \norg.eclipse.jst.j2ee.commonarchivecore.internal.impl.EARFileImpl.roll\nUpRoles(EARFileImpl.java:816)\n        at TestCommonArchiveRollupRoles.testRoleupRoles\n(TestCommonArchiveRollupR\noles.java:48)\n        at TestCommonArchiveRollupRoles.main\n(TestCommonArchiveRollupRoles.java:1\n9)",
    "We will give this priority tomorrow",
    "Fixed...\n\nAdded logic to the resolver to register local copy only if it can be found at\nregistration time.",
    "The JUnit \"org.eclipse.jst.j2ee.archive.test.WarFileTests\" covers this failure\nexecuted as a headless non-plugin junit.",
    "Closing."
  ],
  "commentCreationDates": [
    "2005-08-05T15:05:20+02:00",
    "2005-08-09T04:34:07+02:00",
    "2005-08-09T17:59:17+02:00",
    "2005-08-16T02:37:28+02:00",
    "2006-09-26T16:03:05+02:00"
  ],
  "traces": [
    {
      "exceptionType": "java.net.ConnectException",
      "message": "Connection refused: connect",
      "elements": [
        {
          "method": "org.apache.crimson.parser.Parser2.fatal",
          "source": "Unknown Source"
        },
        {
          "method": "org.apache.crimson.parser.Parser2.externalParameterEntity",
          "source": "Unknown  Sou rce"
        },
        {
          "method": "org.apache.crimson.parser.Parser2.maybeDoctypeDecl",
          "source": "Unknown Source"
        },
        {
          "method": "org.apache.crimson.parser.Parser2.parseInternal",
          "source": "Unknown Source"
        },
        {
          "method": "org.apache.crimson.parser.Parser2.parse",
          "source": "Unknown Source"
        },
        {
          "method": "org.apache.crimson.parser.XMLReaderImpl.parse",
          "source": "Unknown Source"
        },
        {
          "method": "org.apache.crimson.jaxp.DocumentBuilderImpl.parse",
          "source": "Unknown Source"
        },
        {
          "method": "javax.xml.parsers.DocumentBuilder.parse",
          "source": "Unknown Source"
        },
        {
          "method": "org.eclipse.wst.common.internal.emf.utilities.DOMUtilities.loadDocument",
          "source": "DOMUtilities.java:546"
        },
        {
          "method": "org.eclipse.wst.common.internal.emf.resource.EMF2DOMRenderer.loadDocument",
          "source": "EMF2DOMRenderer.java:72"
        },
        {
          "method": "org.eclipse.wst.common.internal.emf.resource.EMF2DOMRenderer.doLoad",
          "source": "E MF2DOMRenderer.java:60"
        },
        {
          "method": "org.eclipse.wst.common.internal.emf.resource.TranslatorResourceImpl.basicDoLoad",
          "source": "TranslatorResourceImpl.java:141"
        },
        {
          "method": "org.eclipse.wst.common.internal.emf.resource.CompatibilityXMIResourceImpl.doLoad",
          "source": "CompatibilityXMIResourceImpl.java:173"
        },
        {
          "method": "org.eclipse.emf.ecore.resource.impl.ResourceImpl.load",
          "source": "ResourceImpl.ja va:977"
        },
        {
          "method": "org.eclipse.emf.ecore.resource.impl.ResourceImpl.load",
          "source": "ResourceImpl.ja va:832"
        },
        {
          "method": "org.eclipse.wst.common.internal.emf.resource.TranslatorResourceImpl.load",
          "source": "TranslatorResourceImpl.java:382"
        },
        {
          "method": "org.eclipse.emf.ecore.resource.impl.ResourceSetImpl.demandLoad",
          "source": "Resour ceSetImpl.java:249"
        },
        {
          "method": "org.eclipse.emf.ecore.resource.impl.ResourceSetImpl.demandLoadHelper",
          "source": " ResourceSetImpl.java:264"
        },
        {
          "method": "org.eclipse.emf.ecore.resource.impl.ResourceSetImpl.getResource",
          "source": "Resou rceSetImpl.java:349"
        },
        {
          "method": "org.eclipse.jst.j2ee.commonarchivecore.internal.strategy.LoadStrategyImpl.getMofResource",
          "source": "LoadStrategyImpl.java:335"
        },
        {
          "method": "org.eclipse.jst.j2ee.commonarchivecore.internal.impl.ArchiveImpl.getMofResource",
          "source": "ArchiveImpl.java:881"
        },
        {
          "method": "org.eclipse.jst.j2ee.commonarchivecore.internal.impl.ModuleFileImpl.getDeploymentDescriptorResource",
          "source": "ModuleFileImpl.java:264"
        },
        {
          "method": "org.eclipse.jst.j2ee.commonarchivecore.internal.strategy.XmlBasedImportStrategyImpl.primLoadDeploymentDescriptor",
          "source": "XmlBasedImportStrategyImpl.java:39"
        },
        {
          "method": "org.eclipse.jst.j2ee.commonarchivecore.internal.strategy.War22ImportStrategyImpl.loadDeploymentDescriptor",
          "source": "War22ImportStrategyImpl.java:87"
        },
        {
          "method": "org.eclipse.jst.j2ee.commonarchivecore.internal.strategy.War22ImportStrategyImpl.importMetaData",
          "source": "War22ImportStrategyImpl.java:81"
        },
        {
          "method": "org.eclipse.jst.j2ee.commonarchivecore.internal.impl.WARFileImpl.getDeploymentDescriptor",
          "source": "WARFileImpl.java:152"
        },
        {
          "method": "org.eclipse.jst.j2ee.commonarchivecore.internal.impl.WARFileImpl.getStandardDeploymentDescriptor",
          "source": "WARFileImpl.java:318"
        },
        {
          "method": "org.eclipse.jst.j2ee.commonarchivecore.internal.impl.EARFileImpl.getDeploymentDescriptor",
          "source": "EARFileImpl.java:337"
        },
        {
          "method": "org.eclipse.jst.j2ee.commonarchivecore.internal.impl.EARFileImpl.getDeploymentDescriptor",
          "source": "EARFileImpl.java:346"
        },
        {
          "method": "org.eclipse.jst.j2ee.commonarchivecore.internal.impl.EARFileImpl.rollUpRoles",
          "source": "EARFileImpl.java:827"
        },
        {
          "method": "org.eclipse.jst.j2ee.commonarchivecore.internal.impl.EARFileImpl.rollUpRoles",
          "source": "EARFileImpl.java:816"
        },
        {
          "method": "TestCommonArchiveRollupRoles.testRoleupRoles",
          "source": "TestCommonArchiveRollupR oles.java:48"
        },
        {
          "method": "TestCommonArchiveRollupRoles.main",
          "source": "TestCommonArchiveRollupRoles.java:1 9"
        }
      ],
      "number": 0,
      "commentIndex": 0,
      "bugId": "106153",
      "date": "2005-08-05T15:05:20+02:00",
      "product": "Web Tools",
      "component": "jst.j2ee",
      "severity": "critical"
    },
    {
      "exceptionType": "org.eclipse.emf.common.util.WrappedException",
      "message": "External entity not  found: \"http:/ /java.sun.com/dtd/web-app_2_3.dtd\".",
      "elements": [
        {
          "method": "org.eclipse.wst.common.internal.emf.resource.EMF2DOMRenderer.loadDocument",
          "source": "EMF2DOMRenderer.java:79"
        },
        {
          "method": "org.eclipse.wst.common.internal.emf.resource.EMF2DOMRenderer.doLoad",
          "source": "E MF2DOMRenderer.java:60"
        },
        {
          "method": "org.eclipse.wst.common.internal.emf.resource.TranslatorResourceImpl.basicDoLoad",
          "source": "TranslatorResourceImpl.java:141"
        },
        {
          "method": "org.eclipse.wst.common.internal.emf.resource.CompatibilityXMIResourceImpl.doLoad",
          "source": "CompatibilityXMIResourceImpl.java:173"
        },
        {
          "method": "org.eclipse.emf.ecore.resource.impl.ResourceImpl.load",
          "source": "ResourceImpl.ja va:977"
        },
        {
          "method": "org.eclipse.emf.ecore.resource.impl.ResourceImpl.load",
          "source": "ResourceImpl.ja va:832"
        },
        {
          "method": "org.eclipse.wst.common.internal.emf.resource.TranslatorResourceImpl.load",
          "source": "TranslatorResourceImpl.java:382"
        },
        {
          "method": "org.eclipse.emf.ecore.resource.impl.ResourceSetImpl.demandLoad",
          "source": "Resour ceSetImpl.java:249"
        },
        {
          "method": "org.eclipse.emf.ecore.resource.impl.ResourceSetImpl.demandLoadHelper",
          "source": " ResourceSetImpl.java:264"
        },
        {
          "method": "org.eclipse.emf.ecore.resource.impl.ResourceSetImpl.getResource",
          "source": "Resou rceSetImpl.java:349"
        },
        {
          "method": "org.eclipse.jst.j2ee.commonarchivecore.internal.strategy.LoadStrategyImpl.getMofResource",
          "source": "LoadStrategyImpl.java:335"
        },
        {
          "method": "org.eclipse.jst.j2ee.commonarchivecore.internal.impl.ArchiveImpl.getMofResource",
          "source": "ArchiveImpl.java:881"
        },
        {
          "method": "org.eclipse.jst.j2ee.commonarchivecore.internal.impl.ModuleFileImpl.getDeploymentDescriptorResource",
          "source": "ModuleFileImpl.java:264"
        },
        {
          "method": "org.eclipse.jst.j2ee.commonarchivecore.internal.strategy.XmlBasedImportStrategyImpl.primLoadDeploymentDescriptor",
          "source": "XmlBasedImportStrategyImpl.java:39"
        },
        {
          "method": "org.eclipse.jst.j2ee.commonarchivecore.internal.strategy.War22ImportStrategyImpl.loadDeploymentDescriptor",
          "source": "War22ImportStrategyImpl.java:87"
        },
        {
          "method": "org.eclipse.jst.j2ee.commonarchivecore.internal.strategy.War22ImportStrategyImpl.importMetaData",
          "source": "War22ImportStrategyImpl.java:81"
        },
        {
          "method": "org.eclipse.jst.j2ee.commonarchivecore.internal.impl.WARFileImpl.getDeploymentDescriptor",
          "source": "WARFileImpl.java:152"
        },
        {
          "method": "org.eclipse.jst.j2ee.commonarchivecore.internal.impl.WARFileImpl.getStandardDeploymentDescriptor",
          "source": "WARFileImpl.java:318"
        },
        {
          "method": "org.eclipse.jst.j2ee.commonarchivecore.internal.impl.EARFileImpl.getDeploymentDescriptor",
          "source": "EARFileImpl.java:337"
        },
        {
          "method": "org.eclipse.jst.j2ee.commonarchivecore.internal.impl.EARFileImpl.getDeploymentDescriptor",
          "source": "EARFileImpl.java:346"
        },
        {
          "method": "org.eclipse.jst.j2ee.commonarchivecore.internal.impl.EARFileImpl.rollUpRoles",
          "source": "EARFileImpl.java:827"
        },
        {
          "method": "org.eclipse.jst.j2ee.commonarchivecore.internal.impl.EARFileImpl.rollUpRoles",
          "source": "EARFileImpl.java:816"
        },
        {
          "method": "TestCommonArchiveRollupRoles.testRoleupRoles",
          "source": "TestCommonArchiveRollupR oles.java:48"
        },
        {
          "method": "TestCommonArchiveRollupRoles.main",
          "source": "TestCommonArchiveRollupRoles.java:1 9"
        }
      ],
      "number": 1,
      "commentIndex": 0,
      "bugId": "106153",
      "date": "2005-08-05T15:05:20+02:00",
      "product": "Web Tools",
      "component": "jst.j2ee",
      "severity": "critical"
    }
  ],
  "groupId": "106153",
  "bugId": "106153",
  "date": "2005-08-05T15:05:20+02:00",
  "product": "Web Tools",
  "component": "jst.j2ee",
  "severity": "critical"
}