{
  "comments": [
    "Hi,\ni have a big project(1700 classes) in eclipse, for that a have set up some junit\ntests. after compiling all sources i run one of the junit tests and get this\nexception:\n\n!MESSAGE Exception occurred executing command line.\n!STACK 0\njava.io.IOException: java.io.IOException: Cannot allocate memory\n        at java.lang.UNIXProcess.\u003cinit\u003e(UNIXProcess.java:143)\n        at java.lang.Runtime.execInternal(Native Method)\n        at java.lang.Runtime.exec(Runtime.java:566)\n        at org.eclipse.debug.core.DebugPlugin.exec(DebugPlugin.java:746)\n        at org.eclipse.jdt.launching.AbstractVMRunner.exec(AbstractVMRunner.java:70)\n        at\norg.eclipse.jdt.internal.launching.StandardVMRunner.run(StandardVMRunner.java:241)\n        at\norg.eclipse.jdt.internal.junit.launcher.JUnitBaseLaunchConfiguration.launch(JUnitBaseLaunchConfiguration.java:85)\n        at\norg.eclipse.debug.internal.core.LaunchConfiguration.launch(LaunchConfiguration.java:590)\n        at\norg.eclipse.debug.internal.core.LaunchConfiguration.launch(LaunchConfiguration.java:515)\n        at\norg.eclipse.debug.internal.ui.DebugUIPlugin.buildAndLaunch(DebugUIPlugin.java:733)\n        at org.eclipse.debug.internal.ui.DebugUIPlugin$6.run(DebugUIPlugin.java:931)\n        at org.eclipse.core.internal.jobs.Worker.run(Worker.java:76)\n\nI can restart eclipse and i\u0027m able to start 1 or 2 junit tests, but then i get\nthis exception again.\n \nMy system: Debian Linux, Kernel 2.6.11, 1GB RAM, AMD 2200XP\nEclipse: Version: 3.1.0, Build id: I20050627-1435\n\nI\u0027m starting eclipse like that: \n$ECLIPSE_HOME/eclipse -vm $JAVA_HOME/bin/java -data $HOME/workspace_eclipse/\n-vmargs -Xms512M -Xmx768M\n\nI also set up a test in the configuration panel with the JVM-Arguments -Xms256M\n-Xmx512M. This test also broke with the exception above.\n\nMaybe it is a bug, i can\u0027t find something about this problem in the community.\n\nhenrik",
    "Have you tried running your test with specifying memory management options on\nthe vm args? (I saw that you specified -Xms512M -Xmx768M)\n",
    "(In reply to comment #1)\n\u003e Have you tried running your test with specifying memory management options on\n\u003e the vm args? (I saw that you specified -Xms512M -Xmx768M)\n\u003e \n\nI tried running the tests with the two vm options: -Xms384M -Xmx512M.\nYesterday i noticed that i also will get this exception if i run a java\napplication from the configuration panel. ",
    "Darin, any ideas?"
  ],
  "commentCreationDates": [
    "2005-08-09T22:29:03+02:00",
    "2005-08-09T23:46:05+02:00",
    "2005-08-10T10:32:58+02:00",
    "2006-03-23T16:19:10+01:00"
  ],
  "traces": [
    {
      "exceptionType": "java.io.IOException",
      "message": "Cannot allocate memory",
      "elements": [
        {
          "method": "java.lang.UNIXProcess.\u003cinit\u003e",
          "source": "UNIXProcess.java:143"
        },
        {
          "method": "java.lang.Runtime.execInternal",
          "source": "Native Method"
        },
        {
          "method": "java.lang.Runtime.exec",
          "source": "Runtime.java:566"
        },
        {
          "method": "org.eclipse.debug.core.DebugPlugin.exec",
          "source": "DebugPlugin.java:746"
        },
        {
          "method": "org.eclipse.jdt.launching.AbstractVMRunner.exec",
          "source": "AbstractVMRunner.java:70"
        },
        {
          "method": "org.eclipse.jdt.internal.launching.StandardVMRunner.run",
          "source": "StandardVMRunner.java:241"
        },
        {
          "method": "org.eclipse.jdt.internal.junit.launcher.JUnitBaseLaunchConfiguration.launch",
          "source": "JUnitBaseLaunchConfiguration.java:85"
        },
        {
          "method": "org.eclipse.debug.internal.core.LaunchConfiguration.launch",
          "source": "LaunchConfiguration.java:590"
        },
        {
          "method": "org.eclipse.debug.internal.core.LaunchConfiguration.launch",
          "source": "LaunchConfiguration.java:515"
        },
        {
          "method": "org.eclipse.debug.internal.ui.DebugUIPlugin.buildAndLaunch",
          "source": "DebugUIPlugin.java:733"
        },
        {
          "method": "org.eclipse.debug.internal.ui.DebugUIPlugin$6.run",
          "source": "DebugUIPlugin.java:931"
        },
        {
          "method": "org.eclipse.core.internal.jobs.Worker.run",
          "source": "Worker.java:76"
        }
      ],
      "number": 0,
      "commentIndex": 0,
      "bugId": "106555",
      "date": "2005-08-09T22:29:03+02:00",
      "product": "Platform",
      "component": "Runtime",
      "severity": "normal"
    }
  ],
  "groupId": "106555",
  "bugId": "106555",
  "date": "2005-08-09T22:29:03+02:00",
  "product": "Platform",
  "component": "Runtime",
  "severity": "normal"
}