{
  "comments": [
    "The following code generates a NullPointerException. It seems to be because the\nmethod has no return type.\n\npublic class Test {\n  public static void main(String[] args) {\n    String source \u003d \"public class Foo { bar() {}}\";\n    CompilationUnit unit \u003d AST.parseCompilationUnit(source.toCharArray());\n  }\n}\n\njava.lang.NullPointerException\n  at org.eclipse.jdt.core.dom.ASTConverter.convertType(ASTConverter.java:457)\n  at org.eclipse.jdt.core.dom.ASTConverter.convert(ASTConverter.java:545)\n  at org.eclipse.jdt.core.dom.ASTConverter.convert(ASTConverter.java:163)\n  at org.eclipse.jdt.core.dom.ASTConverter.convert(ASTConverter.java:70)\n  at org.eclipse.jdt.core.dom.AST.parseCompilationUnit(AST.java:310)\n  at Test.main(Test.java:17)\nException in thread \"main\"",
    "The return type of the method declaration is null and I am trying to convert a null type. This led to a \nNPE. Now I ignore the conversion of the return type if it is null. This means that the return type of \nthe method will be void if you asked for it.\nIf you asked for binding, then you will get an error \nreported in the compilation unit\u0027s messages collection. The message is \"Return type for the \nmethod is missing\". I think this is perfectly acceptable.\nFixed and released in HEAD."
  ],
  "commentCreationDates": [
    "2002-03-06T20:39:23+01:00",
    "2002-03-07T16:16:40+01:00"
  ],
  "traces": [
    {
      "exceptionType": "java.lang.NullPointerException",
      "elements": [
        {
          "method": "org.eclipse.jdt.core.dom.ASTConverter.convertType",
          "source": "ASTConverter.java:457"
        },
        {
          "method": "org.eclipse.jdt.core.dom.ASTConverter.convert",
          "source": "ASTConverter.java:545"
        },
        {
          "method": "org.eclipse.jdt.core.dom.ASTConverter.convert",
          "source": "ASTConverter.java:163"
        },
        {
          "method": "org.eclipse.jdt.core.dom.ASTConverter.convert",
          "source": "ASTConverter.java:70"
        },
        {
          "method": "org.eclipse.jdt.core.dom.AST.parseCompilationUnit",
          "source": "AST.java:310"
        },
        {
          "method": "Test.main",
          "source": "Test.java:17"
        }
      ],
      "number": 0,
      "commentIndex": 0,
      "bugId": "10898",
      "date": "2002-03-06T20:39:23+01:00",
      "product": "JDT",
      "component": "Core",
      "severity": "normal"
    }
  ],
  "groupId": "10898",
  "bugId": "10898",
  "date": "2002-03-06T20:39:23+01:00",
  "product": "JDT",
  "component": "Core",
  "severity": "normal"
}