{
  "comments": [
    "In the AST of this code :\n\nclass A {\n  void test() {\n    char x;\n    x \u003d (char)3;\n  }\n}\n\ncall resolveTypeBinding() on the CastExpression object throws a\nNullPoitnerException :\n\njava.lang.NullPointerException\n at\norg.eclipse.jdt.core.dom.DefaultBindingResolver.resolveExpressionType(DefaultBindingResolver.java:318)\n at\norg.eclipse.jdt.core.dom.DefaultBindingResolver.resolveExpressionType(DefaultBindingResolver.java:379)\n at org.eclipse.jdt.core.dom.Expression.resolveTypeBinding(Expression.java:75)\nI made these changes in my host for fix the problem, but I don\u0027t think that is\nthe right solution (DefaultBindingResolver::resolveExpressionType(Expression\nexpression)):\n\n  } else if (expression instanceof CastExpression) {\n    return ((CastExpression) expression).getType().resolveBinding();\n//  org.eclipse.jdt.internal.compiler.ast.CastExpression castExpression \u003d\n//(org.eclipse.jdt.internal.compiler.ast.CastExpression).this.newAstToOldAst.get(expression);\n//  return this.getTypeBinding(castExpression.castTb);\n  } else if (expression instanceof StringLiteral) {",
    "Your fix is not quite what I did, but it could work too. I missed the record(...) in the \nconvert(CastExpression) in the ASTConverter. The get for the hashtable should never return \nnull.\nFixed and released in HEAD."
  ],
  "commentCreationDates": [
    "2002-03-11T21:08:10+01:00",
    "2002-03-11T22:40:29+01:00"
  ],
  "traces": [
    {
      "exceptionType": "java.lang.NullPointerException",
      "elements": [
        {
          "method": "org.eclipse.jdt.core.dom.DefaultBindingResolver.resolveExpressionType",
          "source": "DefaultBindingResolver.java:318"
        },
        {
          "method": "org.eclipse.jdt.core.dom.DefaultBindingResolver.resolveExpressionType",
          "source": "DefaultBindingResolver.java:379"
        },
        {
          "method": "org.eclipse.jdt.core.dom.Expression.resolveTypeBinding",
          "source": "Expression.java:75"
        }
      ],
      "number": 0,
      "commentIndex": 0,
      "bugId": "11129",
      "date": "2002-03-11T21:08:10+01:00",
      "product": "JDT",
      "component": "Core",
      "severity": "normal"
    }
  ],
  "groupId": "11129",
  "bugId": "11129",
  "date": "2002-03-11T21:08:10+01:00",
  "product": "JDT",
  "component": "Core",
  "severity": "normal"
}