{
  "comments": [
    "We have a Swing wrapper class which has a instance level boolean.  This class\nalso has an inner class.  When the inner class tries to access the parent class,\nit gets null references to anything in the parent class (including \u0027this\u0027). \nThis should be allowed.  It worked in previous 2.x versions of eclipse using a\nvariety of JREs.\n\nWhile debugging and evaluating the boolean in question, we get an entry in the\n.log file and the error: Exception processing async thread queue\n\nThis is repeatable with any number of different JREs (IBM 1.4.2, IBM 1.4.1, SUN\n1.5.1...).\n\nIDE info:\neclipse platform Version: 3.0.2.1, Build id: 200503110845.\nJDT Version: 3.0.2, Build id: 200503110845\n\nExample code: \n\nimport javax.swing.JTextField;\nimport javax.swing.text.Document;\n\npublic class OuterClass {\n    \n    //private boolean isSet;\n    //private boolean isSet \u003d false;\n    public boolean isSet \u003d false;\n    \n    public OuterClass() {\n        \n    }\n    \n    public class InnerClass extends JTextField {\n        public InnerClass(int columns){\n            super(columns);\n        }\n        public void setDocument(Document value) {\n            super.setDocument(value);\n\n            //runtime nullpointer happens here                       \n            //error Exception processing async thread queue\n\n            //System.out.println(\"isSet\u003d\"+isSet);\n\n            if (!isSet) { \n                fireActionPerformed();\n            }\n        }\n    }\n\n    private void doSomething() {\n        isSet \u003d true;\n        JTextField textField \u003d new InnerClass(10);\n        textField.setText(\"\");\n        isSet \u003d false;        \n    }\n    \n    public static void main(String[] args) {\n        OuterClass outerClass \u003d new OuterClass();\n        outerClass.doSomething();\n    }\n}\n\n\nThe contents of the .log file:\n\n!ENTRY org.eclipse.jdt.debug 4 120 Oct 17, 2005 21:35:16.325\n!MESSAGE Exception processing async thread queue\n!SUBENTRY 1 org.eclipse.jdt.debug 4 120 Oct 17, 2005 21:35:16.325\n!MESSAGE Exception processing async thread queue\n!STACK 0\njava.lang.ClassCastException:\norg/eclipse/jdt/internal/debug/core/model/JDINullValue incompatible with\norg/eclipse/jdt/internal/debug/core/model/JDIObjectValue\n\tat\norg.eclipse.jdt.internal.debug.core.model.JDIObjectValue.getEnclosingObject(Unknown\nSource)\n\tat\norg.eclipse.jdt.internal.debug.eval.ast.instructions.PushThis.execute(Unknown\nSource)\n\tat org.eclipse.jdt.internal.debug.eval.ast.engine.Interpreter.execute(Unknown\nSource)\n\tat\norg.eclipse.jdt.internal.debug.eval.ast.engine.ASTEvaluationEngine$1$EvaluationRunnable.run(Unknown\nSource)\n\tat org.eclipse.jdt.internal.debug.core.model.JDIThread.runEvaluation(Unknown\nSource)\n\tat\norg.eclipse.jdt.internal.debug.eval.ast.engine.ASTEvaluationEngine$EvalRunnable.run(Unknown\nSource)\n\tat org.eclipse.jdt.internal.debug.core.model.JDIThread$ThreadJob.run(Unknown\nSource)\n\tat org.eclipse.core.internal.jobs.Worker.run(Unknown Source)",
    "Moving to Debug.",
    "This has been fixed in 3.1\n\n*** This bug has been marked as a duplicate of 76990 ***"
  ],
  "commentCreationDates": [
    "2005-10-18T05:40:50+02:00",
    "2005-10-18T10:48:51+02:00",
    "2005-10-18T17:27:22+02:00"
  ],
  "traces": [
    {
      "exceptionType": "java.lang.ClassCastException",
      "message": "org/eclipse/jdt/internal/debug/core/model/JDINullValue incompatible with org/eclipse/jdt/internal/debug/core/model/JDIObjectValue",
      "elements": [
        {
          "method": "org.eclipse.jdt.internal.debug.core.model.JDIObjectValue.getEnclosingObject",
          "source": "Unknown Source"
        },
        {
          "method": "org.eclipse.jdt.internal.debug.eval.ast.instructions.PushThis.execute",
          "source": "Unknown Source"
        },
        {
          "method": "org.eclipse.jdt.internal.debug.eval.ast.engine.Interpreter.execute",
          "source": "Unknown Source"
        },
        {
          "method": "org.eclipse.jdt.internal.debug.eval.ast.engine.ASTEvaluationEngine$1$EvaluationRunnable.run",
          "source": "Unknown Source"
        },
        {
          "method": "org.eclipse.jdt.internal.debug.core.model.JDIThread.runEvaluation",
          "source": "Unknown Source"
        },
        {
          "method": "org.eclipse.jdt.internal.debug.eval.ast.engine.ASTEvaluationEngine$EvalRunnable.run",
          "source": "Unknown Source"
        },
        {
          "method": "org.eclipse.jdt.internal.debug.core.model.JDIThread$ThreadJob.run",
          "source": "Unknown Source"
        },
        {
          "method": "org.eclipse.core.internal.jobs.Worker.run",
          "source": "Unknown Source"
        }
      ],
      "number": 0,
      "commentIndex": 0,
      "bugId": "112888",
      "duplicateId": "76990",
      "date": "2005-10-18T05:40:50+02:00",
      "product": "JDT",
      "component": "Debug",
      "severity": "blocker"
    }
  ],
  "groupId": "76990",
  "bugId": "112888",
  "duplicateId": "76990",
  "date": "2005-10-18T05:40:50+02:00",
  "product": "JDT",
  "component": "Debug",
  "severity": "blocker"
}