{
  "comments": [
    "The reason I submitted this under JDT Core is because the message that causes \nthis comes originally from there (actually JDT Launching).\n\nI switched from IBM Java 1.3.0 to the new IBM Java 1.3.1. I installed it in a \nnew directory.\n\nWhen I started Eclipse with the new VM, the JRE_LIB still pointed to the old \none, it didn\u0027t switch to the one I started Eclipse with, which is what I had \nexpected it to do. So I removed the old JVM directory (renamed it really) and \nnow Eclipse won\u0027t start. I get the following in the .log file which then \nprevents Eclipse from coming up. It goes down then (though Eclipse.exe doesn\u0027t \nsense this and it stays up until I get task manager to kill it).\n\nThe first few lines of the .log output are:\n\n2 org.eclipse.core.runtime 2 Problems occurred when invoking code from plug-in: \norg.eclipse.core.runtime.\njava.lang.IllegalArgumentException: Duplicate VM: 0\n\tat org.eclipse.jdt.launching.AbstractVMInstallType.createVMInstall\n(AbstractVMInstallType.java:81)\n\tat org.eclipse.jdt.launching.JavaRuntime.detectVMConfiguration\n(JavaRuntime.java:447)\n\tat org.eclipse.jdt.launching.JavaRuntime.getDefaultVMInstall\n(JavaRuntime.java:251)\n\tat org.eclipse.jdt.launching.JavaRuntime.initializeJREVariables\n(JavaRuntime.java:556)\n\tat org.eclipse.jdt.internal.ui.JavaPlugin$1.run(JavaPlugin.java:200)\n\tat org.eclipse.core.internal.resources.Workspace.run\n(Workspace.java:1232)\n\tat org.eclipse.jdt.internal.ui.JavaPlugin.startup(JavaPlugin.java:204)\n\tat org.eclipse.core.internal.plugins.PluginDescriptor$1.run\n(PluginDescriptor.java:701)\n\tat org.eclipse.core.internal.runtime.InternalPlatform.run\n(InternalPlatform.java:817)\n\tat \norg.eclipse.core.internal.plugins.PluginDescriptor.internalDoPluginActivation\n(PluginDescriptor.java:713)\n\tat org.eclipse.core.internal.plugins.PluginDescriptor.doPluginActivation\n(PluginDescriptor.java:184)\n\tat org.eclipse.core.internal.plugins.PluginClassLoader.activatePlugin\n(PluginClassLoader.java:52)\n\tat \norg.eclipse.core.internal.plugins.PluginClassLoader.findClassParentsSelf\n(PluginClassLoader.java(Compiled Code))\n\tat org.eclipse.core.internal.boot.DelegatingURLClassLoader.loadClass\n(DelegatingURLClassLoader.java(Compiled Code))\n\nThere are then several more traces as this one causes other plugins to fail and \neventually causes Eclipse to fail and then exit.\n\nI\u0027ll attach the entire log for you.\n\nThanks",
    "Created an attachment (id\u003d468)\nThe .log file from the error.\n",
    "I think I now understand why when both JVM\u0027s were existing it didn\u0027t \nautomatically change the JRE_LIB to the jvm that eclipse was started with. If \nit did do the change then a complete recompile is needed because it sees it as \na different JDK.\n\nBut if the old JDK is gone, it really should switch it and not throw an \nexception and not come up.\n\nThanks",
    "launching is now contributed by Debug",
    "\n\n*** This bug has been marked as a duplicate of 12204 ***"
  ],
  "commentCreationDates": [
    "2002-03-13T18:44:00+01:00",
    "2002-03-13T18:44:41+01:00",
    "2002-03-13T18:52:12+01:00",
    "2002-03-19T16:43:08+01:00",
    "2002-03-28T18:26:07+01:00"
  ],
  "traces": [
    {
      "exceptionType": "java.lang.IllegalArgumentException",
      "message": "Duplicate VM: 0",
      "elements": [
        {
          "method": "org.eclipse.jdt.launching.AbstractVMInstallType.createVMInstall",
          "source": "AbstractVMInstallType.java:81"
        },
        {
          "method": "org.eclipse.jdt.launching.JavaRuntime.detectVMConfiguration",
          "source": "JavaRuntime.java:447"
        },
        {
          "method": "org.eclipse.jdt.launching.JavaRuntime.getDefaultVMInstall",
          "source": "JavaRuntime.java:251"
        },
        {
          "method": "org.eclipse.jdt.launching.JavaRuntime.initializeJREVariables",
          "source": "JavaRuntime.java:556"
        },
        {
          "method": "org.eclipse.jdt.internal.ui.JavaPlugin$1.run",
          "source": "JavaPlugin.java:200"
        },
        {
          "method": "org.eclipse.core.internal.resources.Workspace.run",
          "source": "Workspace.java:1232"
        },
        {
          "method": "org.eclipse.jdt.internal.ui.JavaPlugin.startup",
          "source": "JavaPlugin.java:204"
        },
        {
          "method": "org.eclipse.core.internal.plugins.PluginDescriptor$1.run",
          "source": "PluginDescriptor.java:701"
        },
        {
          "method": "org.eclipse.core.internal.runtime.InternalPlatform.run",
          "source": "InternalPlatform.java:817"
        },
        {
          "method": "org.eclipse.core.internal.plugins.PluginDescriptor.internalDoPluginActivation",
          "source": "PluginDescriptor.java:713"
        },
        {
          "method": "org.eclipse.core.internal.plugins.PluginDescriptor.doPluginActivation",
          "source": "PluginDescriptor.java:184"
        },
        {
          "method": "org.eclipse.core.internal.plugins.PluginClassLoader.activatePlugin",
          "source": "PluginClassLoader.java:52"
        },
        {
          "method": "org.eclipse.core.internal.plugins.PluginClassLoader.findClassParentsSelf",
          "source": "PluginClassLoader.java(Compiled Code)"
        },
        {
          "method": "org.eclipse.core.internal.boot.DelegatingURLClassLoader.loadClass",
          "source": "DelegatingURLClassLoader.java(Compiled Code)"
        }
      ],
      "number": 0,
      "commentIndex": 0,
      "bugId": "11288",
      "duplicateId": "12204",
      "date": "2002-03-13T18:44:00+01:00",
      "product": "JDT",
      "component": "Debug",
      "severity": "normal"
    }
  ],
  "groupId": "12204",
  "bugId": "11288",
  "duplicateId": "12204",
  "date": "2002-03-13T18:44:00+01:00",
  "product": "JDT",
  "component": "Debug",
  "severity": "normal"
}