{
  "comments": [
    "I can use cvs command with extssh option just fine. When i use Eclipse to connect to my CVS repository \nusing extssh i get the following exception\nCVS communication error: org.eclipse.team.internal.ccvs.ssh2.CVSSSH2ServerConnection\n$SSH2IOException: Connection reset.\nNot able to troubleshoot beyond this. If this is not a bug and a setup issue, what should i be looking for.",
    "I have not seen this problem before. A connection reset usually means that the \nserver closed the connection for some reason. Can others connect to the server \nin queston usin Eclipse?",
    "Awaiting response from reporter. Please reopen with requested information.",
    "I can connect to the same CVS host from my network at home. From the office network at work it keeps \ngiving me that error. No other user can connect to that host from the office network either. I suspect its \nthe corporate firewall (Checkpoint). However as noted earlier, i can ssh into the host w/o issues and even \nuse command line cvs. \n ",
    "I agree that it is probably the firewall. Unfortunately, with out a \nreproducable scenario, there is not much I can do. I\u0027m copying Ymnk, the \nprovider of the Jsch SSH client used by Eclipse, in case he has any insight on \nthis.",
    "If there is anything i can do to turn debugging on the Jsch SSH client, i would be happy to do so and \nprovide the logs here.",
    "Got the same error today...\n\nEclipse Version: 3.1.2\nBuild id: M20060118-1600\nOn Win XP/Prof. SP2\n\nAlready existing CVS server, just wanted to explore its Head again... Other CVS apps, eg. WinCVS or SmartCVS are working without any probs...\n\nRegards, Lars\n\n\nHere is the exception:\n\n!ENTRY org.eclipse.team.cvs.ui 4 0 2006-03-02 14:40:20.241\n!MESSAGE Could not connect to :extssh:xxx@xxx.xxx.xxx:/home/cvsroot: CVS\ncommunication error: org.eclipse.team.internal.ccvs.ssh2.CVSSSH2ServerConnection\n$SSH2IOException: Connection reset\n!STACK 1\norg.eclipse.team.internal.ccvs.core.connection.CVSCommunicationException[-6]: or\ng.eclipse.team.internal.ccvs.ssh2.CVSSSH2ServerConnection$SSH2IOException: Conne\nction reset\n        at org.eclipse.team.internal.ccvs.ssh2.CVSSSH2ServerConnection.internalO\npen(CVSSSH2ServerConnection.java:193)\n        at org.eclipse.team.internal.ccvs.ssh2.CVSSSH2ServerConnection.open(CVSS\nSH2ServerConnection.java:107)\n        at org.eclipse.team.internal.ccvs.core.connection.Connection.open(Connec\ntion.java:128)\n        at org.eclipse.team.internal.ccvs.core.connection.CVSRepositoryLocation.\ncreateConnection(CVSRepositoryLocation.java:494)\n        at org.eclipse.team.internal.ccvs.core.connection.CVSRepositoryLocation.\nopenConnection(CVSRepositoryLocation.java:735)\n        at org.eclipse.team.internal.ccvs.core.client.Session.open(Session.java:\n149)\n        at org.eclipse.team.internal.ccvs.core.resources.RemoteFolderMemberFetch\ner.performUpdate(RemoteFolderMemberFetcher.java:95)\n        at org.eclipse.team.internal.ccvs.ui.operations.FetchMembersOperation$In\nternalRemoteFolderMemberFetcher.performUpdate(FetchMembersOperation.java:69)\n        at org.eclipse.team.internal.ccvs.core.resources.RemoteFolderMemberFetch\ner.fetchMembers(RemoteFolderMemberFetcher.java:62)\n        at org.eclipse.team.internal.ccvs.core.resources.RemoteFolderMemberFetch\ner.fetchMembers(RemoteFolderMemberFetcher.java:53)\n        at org.eclipse.team.internal.ccvs.ui.operations.FetchMembersOperation.ex\necute(FetchMembersOperation.java:107)\n        at org.eclipse.team.internal.ccvs.ui.operations.CVSOperation.run(CVSOper\nation.java:79)\n        at org.eclipse.team.internal.ccvs.ui.model.CVSTagElement.fetchDeferredCh\nildren(CVSTagElement.java:134)\n        at org.eclipse.ui.progress.DeferredTreeContentManager$1.run(DeferredTree\nContentManager.java:192)\n        at org.eclipse.core.internal.jobs.Worker.run(Worker.java:76)\nCaused by: com.jcraft.jsch.JSchException: Session.connect: java.net.SocketExcept\nion: Connection reset\n        at com.jcraft.jsch.Session.connect(Unknown Source)\n        at com.jcraft.jsch.Session.connect(Unknown Source)\n        at org.eclipse.team.internal.ccvs.ssh2.JSchSession.createSession(JSchSes\nsion.java:486)\n        at org.eclipse.team.internal.ccvs.ssh2.JSchSession.getSession(JSchSessio\nn.java:435)\n        at org.eclipse.team.internal.ccvs.ssh2.CVSSSH2ServerConnection.internalO\npen(CVSSSH2ServerConnection.java:122)\n        ... 14 more\n!SUBENTRY 1 org.eclipse.team.cvs.core 4 -6 2006-03-02 14:40:20.281\n!MESSAGE Could not connect to :extssh:xxx@xxx.xxx.xxx:/home/cvsroot: CVS\ncommunication error: org.eclipse.team.internal.ccvs.ssh2.CVSSSH2ServerConnection\n$SSH2IOException: Connection reset\n!STACK 0\norg.eclipse.team.internal.ccvs.ssh2.CVSSSH2ServerConnection$SSH2IOException: Con\nnection reset\n        at org.eclipse.team.internal.ccvs.ssh2.CVSSSH2ServerConnection.internalO\npen(CVSSSH2ServerConnection.java:193)\n        at org.eclipse.team.internal.ccvs.ssh2.CVSSSH2ServerConnection.open(CVSS\nSH2ServerConnection.java:107)\n        at org.eclipse.team.internal.ccvs.core.connection.Connection.open(Connec\ntion.java:128)\n        at org.eclipse.team.internal.ccvs.core.connection.CVSRepositoryLocation.\ncreateConnection(CVSRepositoryLocation.java:494)\n        at org.eclipse.team.internal.ccvs.core.connection.CVSRepositoryLocation.\nopenConnection(CVSRepositoryLocation.java:735)\n        at org.eclipse.team.internal.ccvs.core.client.Session.open(Session.java:\n149)\n        at org.eclipse.team.internal.ccvs.core.resources.RemoteFolderMemberFetch\ner.performUpdate(RemoteFolderMemberFetcher.java:95)\n        at org.eclipse.team.internal.ccvs.ui.operations.FetchMembersOperation$In\nternalRemoteFolderMemberFetcher.performUpdate(FetchMembersOperation.java:69)\n        at org.eclipse.team.internal.ccvs.core.resources.RemoteFolderMemberFetch\ner.fetchMembers(RemoteFolderMemberFetcher.java:62)\n        at org.eclipse.team.internal.ccvs.core.resources.RemoteFolderMemberFetch\ner.fetchMembers(RemoteFolderMemberFetcher.java:53)\n        at org.eclipse.team.internal.ccvs.ui.operations.FetchMembersOperation.ex\necute(FetchMembersOperation.java:107)\n        at org.eclipse.team.internal.ccvs.ui.operations.CVSOperation.run(CVSOper\nation.java:79)\n        at org.eclipse.team.internal.ccvs.ui.model.CVSTagElement.fetchDeferredCh\nildren(CVSTagElement.java:134)\n        at org.eclipse.ui.progress.DeferredTreeContentManager$1.run(DeferredTree\nContentManager.java:192)\n        at org.eclipse.core.internal.jobs.Worker.run(Worker.java:76)\nCaused by: com.jcraft.jsch.JSchException: Session.connect: java.net.SocketExcept\nion: Connection reset\n        at com.jcraft.jsch.Session.connect(Unknown Source)\n        at com.jcraft.jsch.Session.connect(Unknown Source)\n        at org.eclipse.team.internal.ccvs.ssh2.JSchSession.createSession(JSchSes\nsion.java:486)\n        at org.eclipse.team.internal.ccvs.ssh2.JSchSession.getSession(JSchSessio\nn.java:435)\n        at org.eclipse.team.internal.ccvs.ssh2.CVSSSH2ServerConnection.internalO\npen(CVSSSH2ServerConnection.java:122)\n        ... 14 more\n",
    "(In reply to comment #3)\n\u003e I can connect to the same CVS host from my network at home. From the office\n\u003e network at work it keeps \n\u003e giving me that error. No other user can connect to that host from the office\n\u003e network either. I suspect its \n\u003e the corporate firewall (Checkpoint). \n\nCan you telnet from the office to CVS host?\nI mean that\n  $ telnet cvs_host_address 22\nand then getting respose like,\n\n  Trying cvs_host_address...\n  Connected to cvs_host_address.\n  Escape character is \u0027^]\u0027.\n  SSH-1.99-OpenSSH_3.1p1\n\nIf you don\u0027t have them, you can not use extssh without porxy support.\n\n\u003e However as noted earlier, i can ssh into the host w/o issues and even \n\u003e use command line cvs. \nAt that time, had Checkpoint been allready installed? \n",
    "(In reply to comment #6)\n\u003e Got the same error today...\n\u003e Eclipse Version: 3.1.2\n\u003e Build id: M20060118-1600\n\u003e On Win XP/Prof. SP2\n\u003e Already existing CVS server, just wanted to explore its Head again... \n\nIs this problem reproducible?\n\n\u003e Other CVS apps, eg. WinCVS or SmartCVS are working without any probs...\n\nAre those apps using ext(ssh) or pserver?\n"
  ],
  "commentCreationDates": [
    "2005-10-19T00:02:16+02:00",
    "2005-10-19T14:28:04+02:00",
    "2005-11-01T02:17:27+01:00",
    "2005-11-01T02:49:18+01:00",
    "2005-11-01T13:21:23+01:00",
    "2005-11-01T14:06:11+01:00",
    "2006-03-02T14:05:31+01:00",
    "2006-04-07T04:10:59+02:00",
    "2006-04-07T04:15:44+02:00"
  ],
  "traces": [
    {
      "exceptionType": "g.eclipse.team.internal.ccvs.ssh2.CVSSSH2ServerConnection$SSH2IOException",
      "message": "Conne ction reset",
      "elements": [
        {
          "method": "org.eclipse.team.internal.ccvs.ssh2.CVSSSH2ServerConnection.internalOpen",
          "source": "CVSSSH2ServerConnection.java:193"
        },
        {
          "method": "org.eclipse.team.internal.ccvs.ssh2.CVSSSH2ServerConnection.open",
          "source": "CVSS SH2ServerConnection.java:107"
        },
        {
          "method": "org.eclipse.team.internal.ccvs.core.connection.Connection.open",
          "source": "Connec tion.java:128"
        },
        {
          "method": "org.eclipse.team.internal.ccvs.core.connection.CVSRepositoryLocation.createConnection",
          "source": "CVSRepositoryLocation.java:494"
        },
        {
          "method": "org.eclipse.team.internal.ccvs.core.connection.CVSRepositoryLocation.openConnection",
          "source": "CVSRepositoryLocation.java:735"
        },
        {
          "method": "org.eclipse.team.internal.ccvs.core.client.Session.open",
          "source": "Session.java: 149"
        },
        {
          "method": "org.eclipse.team.internal.ccvs.core.resources.RemoteFolderMemberFetcher.performUpdate",
          "source": "RemoteFolderMemberFetcher.java:95"
        },
        {
          "method": "org.eclipse.team.internal.ccvs.ui.operations.FetchMembersOperation$InternalRemoteFolderMemberFetcher.performUpdate",
          "source": "FetchMembersOperation.java:69"
        },
        {
          "method": "org.eclipse.team.internal.ccvs.core.resources.RemoteFolderMemberFetcher.fetchMembers",
          "source": "RemoteFolderMemberFetcher.java:62"
        },
        {
          "method": "org.eclipse.team.internal.ccvs.core.resources.RemoteFolderMemberFetcher.fetchMembers",
          "source": "RemoteFolderMemberFetcher.java:53"
        },
        {
          "method": "org.eclipse.team.internal.ccvs.ui.operations.FetchMembersOperation.execute",
          "source": "FetchMembersOperation.java:107"
        },
        {
          "method": "org.eclipse.team.internal.ccvs.ui.operations.CVSOperation.run",
          "source": "CVSOper ation.java:79"
        },
        {
          "method": "org.eclipse.team.internal.ccvs.ui.model.CVSTagElement.fetchDeferredChildren",
          "source": "CVSTagElement.java:134"
        },
        {
          "method": "org.eclipse.ui.progress.DeferredTreeContentManager$1.run",
          "source": "DeferredTree ContentManager.java:192"
        },
        {
          "method": "org.eclipse.core.internal.jobs.Worker.run",
          "source": "Worker.java:76"
        }
      ],
      "causedBy": {
        "exceptionType": "com.jcraft.jsch.JSchException",
        "message": "Session.connect: java.net.SocketExcept ion: Connection reset",
        "elements": [
          {
            "method": "com.jcraft.jsch.Session.connect",
            "source": "Unknown Source"
          },
          {
            "method": "com.jcraft.jsch.Session.connect",
            "source": "Unknown Source"
          },
          {
            "method": "org.eclipse.team.internal.ccvs.ssh2.JSchSession.createSession",
            "source": "JSchSes sion.java:486"
          },
          {
            "method": "org.eclipse.team.internal.ccvs.ssh2.JSchSession.getSession",
            "source": "JSchSessio n.java:435"
          },
          {
            "method": "org.eclipse.team.internal.ccvs.ssh2.CVSSSH2ServerConnection.internalOpen",
            "source": "CVSSSH2ServerConnection.java:122"
          }
        ],
        "number": 0,
        "commentIndex": 0
      },
      "number": 0,
      "commentIndex": 6,
      "bugId": "113013",
      "date": "2006-03-02T14:05:31+01:00",
      "product": "Platform",
      "component": "CVS",
      "severity": "major"
    },
    {
      "exceptionType": "org.eclipse.team.internal.ccvs.ssh2.CVSSSH2ServerConnection$SSH2IOException",
      "message": "Con nection reset",
      "elements": [
        {
          "method": "org.eclipse.team.internal.ccvs.ssh2.CVSSSH2ServerConnection.internalOpen",
          "source": "CVSSSH2ServerConnection.java:193"
        },
        {
          "method": "org.eclipse.team.internal.ccvs.ssh2.CVSSSH2ServerConnection.open",
          "source": "CVSS SH2ServerConnection.java:107"
        },
        {
          "method": "org.eclipse.team.internal.ccvs.core.connection.Connection.open",
          "source": "Connec tion.java:128"
        },
        {
          "method": "org.eclipse.team.internal.ccvs.core.connection.CVSRepositoryLocation.createConnection",
          "source": "CVSRepositoryLocation.java:494"
        },
        {
          "method": "org.eclipse.team.internal.ccvs.core.connection.CVSRepositoryLocation.openConnection",
          "source": "CVSRepositoryLocation.java:735"
        },
        {
          "method": "org.eclipse.team.internal.ccvs.core.client.Session.open",
          "source": "Session.java: 149"
        },
        {
          "method": "org.eclipse.team.internal.ccvs.core.resources.RemoteFolderMemberFetcher.performUpdate",
          "source": "RemoteFolderMemberFetcher.java:95"
        },
        {
          "method": "org.eclipse.team.internal.ccvs.ui.operations.FetchMembersOperation$InternalRemoteFolderMemberFetcher.performUpdate",
          "source": "FetchMembersOperation.java:69"
        },
        {
          "method": "org.eclipse.team.internal.ccvs.core.resources.RemoteFolderMemberFetcher.fetchMembers",
          "source": "RemoteFolderMemberFetcher.java:62"
        },
        {
          "method": "org.eclipse.team.internal.ccvs.core.resources.RemoteFolderMemberFetcher.fetchMembers",
          "source": "RemoteFolderMemberFetcher.java:53"
        },
        {
          "method": "org.eclipse.team.internal.ccvs.ui.operations.FetchMembersOperation.execute",
          "source": "FetchMembersOperation.java:107"
        },
        {
          "method": "org.eclipse.team.internal.ccvs.ui.operations.CVSOperation.run",
          "source": "CVSOper ation.java:79"
        },
        {
          "method": "org.eclipse.team.internal.ccvs.ui.model.CVSTagElement.fetchDeferredChildren",
          "source": "CVSTagElement.java:134"
        },
        {
          "method": "org.eclipse.ui.progress.DeferredTreeContentManager$1.run",
          "source": "DeferredTree ContentManager.java:192"
        },
        {
          "method": "org.eclipse.core.internal.jobs.Worker.run",
          "source": "Worker.java:76"
        }
      ],
      "causedBy": {
        "exceptionType": "com.jcraft.jsch.JSchException",
        "message": "Session.connect: java.net.SocketExcept ion: Connection reset",
        "elements": [
          {
            "method": "com.jcraft.jsch.Session.connect",
            "source": "Unknown Source"
          },
          {
            "method": "com.jcraft.jsch.Session.connect",
            "source": "Unknown Source"
          },
          {
            "method": "org.eclipse.team.internal.ccvs.ssh2.JSchSession.createSession",
            "source": "JSchSes sion.java:486"
          },
          {
            "method": "org.eclipse.team.internal.ccvs.ssh2.JSchSession.getSession",
            "source": "JSchSessio n.java:435"
          },
          {
            "method": "org.eclipse.team.internal.ccvs.ssh2.CVSSSH2ServerConnection.internalOpen",
            "source": "CVSSSH2ServerConnection.java:122"
          }
        ],
        "number": 0,
        "commentIndex": 0
      },
      "number": 1,
      "commentIndex": 6,
      "bugId": "113013",
      "date": "2006-03-02T14:05:31+01:00",
      "product": "Platform",
      "component": "CVS",
      "severity": "major"
    }
  ],
  "groupId": "113013",
  "bugId": "113013",
  "date": "2005-10-19T00:02:16+02:00",
  "product": "Platform",
  "component": "CVS",
  "severity": "major"
}