{
  "comments": [
    "!SESSION Oct 18, 2005 16:21:19.851 ---------------------------------------------\neclipse.buildId\u003dM200409161125\njava.fullversion\u003dJ2RE 1.4.2 IBM J9 2.2 Linux amd64-64 j9xa64142-20041210 (JIT\nenabled)\nJ9VM - 20041208_2100_LHdSMr\nJIT  - r7_level20041130_1809\nBootLoader constants: OS\u003dlinux, ARCH\u003dx86, WS\u003dgtk, NL\u003den_US\n\n!ENTRY org.eclipse.osgi Oct 18, 2005 16:21:19.853\n!MESSAGE Application error\n!STACK 1\njava.lang.UnsatisfiedLinkError:\n/export/filer-bin/eclipse/test/eclipse/plugins/org.eclipse.swt.gtk_3.0.1/os/linux/x86/libswt-pi-gtk-3063.so\n(/export/filer-bin/eclipse/test/eclipse/plugins/org.eclipse.swt.gtk_3.0.1/os/linux/x86/libswt-pi-gtk-3063.so:\ncannot open shared object file:No such file or directory)\n        at java.lang.ClassLoader.loadLibrary(ClassLoader.java:924)\n        at java.lang.ClassLoader.loadLibraryWithClassLoader(ClassLoader.java:886)\n        at java.lang.System.loadLibrary(System.java:429)\n        at org.eclipse.swt.internal.Library.loadLibrary(Library.java:100)\n        at org.eclipse.swt.internal.gtk.OS.\u003cclinit\u003e(OS.java:19)\n        at java.lang.Class.initializeImpl(Native Method)\n        at java.lang.Class.initialize(Class.java:352)\n        at org.eclipse.swt.internal.Converter.wcsToMbcs(Converter.java:63)\n        at org.eclipse.swt.internal.Converter.wcsToMbcs(Converter.java:54)\n        at org.eclipse.swt.widgets.Display.\u003cclinit\u003e(Display.java:118)\n        at java.lang.Class.initializeImpl(Native Method)\n        at java.lang.Class.initialize(Class.java:352)\n        at org.eclipse.ui.internal.Workbench.createDisplay(Workbench.java:268)\n        at org.eclipse.ui.PlatformUI.createDisplay(PlatformUI.java:153)\n        at\norg.eclipse.ui.internal.ide.IDEApplication.createDisplay(IDEApplication.java:122)\n        at org.eclipse.ui.internal.ide.IDEApplication.run(IDEApplication.java:72)\n        at\norg.eclipse.core.internal.runtime.PlatformActivator$1.run(PlatformActivator.java:335)\n       at\norg.eclipse.core.runtime.adaptor.EclipseStarter.run(EclipseStarter.java:273)\n        at\norg.eclipse.core.runtime.adaptor.EclipseStarter.run(EclipseStarter.java:129)\n        at sun.reflect.NativeMethodAccessorImpl.invoke0(Native Method)\n        at\nsun.reflect.NativeMethodAccessorImpl.invoke(NativeMethodAccessorImpl.java:85)\n        at\nsun.reflect.NativeMethodAccessorImpl.invoke(NativeMethodAccessorImpl.java:58)\n        at\nsun.reflect.DelegatingMethodAccessorImpl.invoke(DelegatingMethodAccessorImpl.java:60)\n       at java.lang.reflect.Method.invoke(Method.java:391)\n        at org.eclipse.core.launcher.Main.basicRun(Main.java:185)\n        at org.eclipse.core.launcher.Main.run(Main.java:704)\n        at org.eclipse.core.launcher.Main.main(Main.java:688)",
    "Created an attachment (id\u003d28458)\nlog_photran.txt\n\nlog_photran.txt",
    "apologies... moved too quickly.",
    "Your VM is for the amd64-64 architecture, but you are using the x86 version of\nEclipse.\n\nAll of the following must match:  VM, Eclipse, GTK+.  Either all-x86 or\nall-x86-64.  Anything else will cause a failure to resolve the dependencies.\n\n*** This bug has been marked as a duplicate of 85699 ***"
  ],
  "commentCreationDates": [
    "2005-10-19T19:28:33+02:00",
    "2005-10-19T19:30:34+02:00",
    "2005-10-19T19:48:43+02:00",
    "2005-10-19T20:15:04+02:00"
  ],
  "traces": [
    {
      "exceptionType": "java.lang.UnsatisfiedLinkError",
      "message": "/export/filer-bin/eclipse/test/eclipse/plugins/org.eclipse.swt.gtk_3.0.1/os/linux/x86/libswt-pi-gtk-3063.so (/export/filer-bin/eclipse/test/eclipse/plugins/org.eclipse.swt.gtk_3.0.1/os/linux/x86/libswt-pi-gtk-3063.so: cannot open shared object file:No such file or directory)",
      "elements": [
        {
          "method": "java.lang.ClassLoader.loadLibrary",
          "source": "ClassLoader.java:924"
        },
        {
          "method": "java.lang.ClassLoader.loadLibraryWithClassLoader",
          "source": "ClassLoader.java:886"
        },
        {
          "method": "java.lang.System.loadLibrary",
          "source": "System.java:429"
        },
        {
          "method": "org.eclipse.swt.internal.Library.loadLibrary",
          "source": "Library.java:100"
        },
        {
          "method": "org.eclipse.swt.internal.gtk.OS.\u003cclinit\u003e",
          "source": "OS.java:19"
        },
        {
          "method": "java.lang.Class.initializeImpl",
          "source": "Native Method"
        },
        {
          "method": "java.lang.Class.initialize",
          "source": "Class.java:352"
        },
        {
          "method": "org.eclipse.swt.internal.Converter.wcsToMbcs",
          "source": "Converter.java:63"
        },
        {
          "method": "org.eclipse.swt.internal.Converter.wcsToMbcs",
          "source": "Converter.java:54"
        },
        {
          "method": "org.eclipse.swt.widgets.Display.\u003cclinit\u003e",
          "source": "Display.java:118"
        },
        {
          "method": "java.lang.Class.initializeImpl",
          "source": "Native Method"
        },
        {
          "method": "java.lang.Class.initialize",
          "source": "Class.java:352"
        },
        {
          "method": "org.eclipse.ui.internal.Workbench.createDisplay",
          "source": "Workbench.java:268"
        },
        {
          "method": "org.eclipse.ui.PlatformUI.createDisplay",
          "source": "PlatformUI.java:153"
        },
        {
          "method": "org.eclipse.ui.internal.ide.IDEApplication.createDisplay",
          "source": "IDEApplication.java:122"
        },
        {
          "method": "org.eclipse.ui.internal.ide.IDEApplication.run",
          "source": "IDEApplication.java:72"
        },
        {
          "method": "org.eclipse.core.internal.runtime.PlatformActivator$1.run",
          "source": "PlatformActivator.java:335"
        },
        {
          "method": "org.eclipse.core.runtime.adaptor.EclipseStarter.run",
          "source": "EclipseStarter.java:273"
        },
        {
          "method": "org.eclipse.core.runtime.adaptor.EclipseStarter.run",
          "source": "EclipseStarter.java:129"
        },
        {
          "method": "sun.reflect.NativeMethodAccessorImpl.invoke0",
          "source": "Native Method"
        },
        {
          "method": "sun.reflect.NativeMethodAccessorImpl.invoke",
          "source": "NativeMethodAccessorImpl.java:85"
        },
        {
          "method": "sun.reflect.NativeMethodAccessorImpl.invoke",
          "source": "NativeMethodAccessorImpl.java:58"
        },
        {
          "method": "sun.reflect.DelegatingMethodAccessorImpl.invoke",
          "source": "DelegatingMethodAccessorImpl.java:60"
        },
        {
          "method": "java.lang.reflect.Method.invoke",
          "source": "Method.java:391"
        },
        {
          "method": "org.eclipse.core.launcher.Main.basicRun",
          "source": "Main.java:185"
        },
        {
          "method": "org.eclipse.core.launcher.Main.run",
          "source": "Main.java:704"
        },
        {
          "method": "org.eclipse.core.launcher.Main.main",
          "source": "Main.java:688"
        }
      ],
      "number": 0,
      "commentIndex": 0,
      "bugId": "113115",
      "duplicateId": "85699",
      "date": "2005-10-19T19:28:33+02:00",
      "product": "Platform",
      "component": "SWT",
      "severity": "blocker"
    }
  ],
  "groupId": "85699",
  "bugId": "113115",
  "duplicateId": "85699",
  "date": "2005-10-19T19:28:33+02:00",
  "product": "Platform",
  "component": "SWT",
  "severity": "blocker"
}