{
  "comments": [
    "After I changed the sourcepath of some entries in my projectfile .project, I\ncouldn\u0027t open the project anymore.\nThe syntax seems correct to me and the errormessage is meaningless.\nIn any case, even when some syntax error does exist, the errormessage should be\nmore accurate.",
    "Created an attachment (id\u003d28801)\nMy .project file\n",
    "Created an attachment (id\u003d28802)\nError message when opening the project\n",
    "Moving to Platform Resources for comment",
    "Is there more information in the error log file? (workspace/.metadata/.log)  The\n.project file should not be edited by hand, it is a machine generated file for\nstoring project metadata.",
    "Yep, apparently the \"Document root element is missing\"\nMight this have been because the file was saved as text and not UTF-8 ?\n\nError log showed :\n\n!ENTRY org.eclipse.core.resources 4 567 2005-10-26 14:00:16.477\n!MESSAGE Workspace restored, but some problems occurred.\n!SUBENTRY 1 org.eclipse.core.resources 4 567 2005-10-26 14:00:16.477\n!MESSAGE Failed to read the project description file (.project) for\nATFM_DEV_11.  The file has been changed on disk, and it now contains invalid\ninformation.  The project will not function properly until the description\nfile is restored to a valid state.\n\n\n!ENTRY org.eclipse.core.resources 4 567 2005-10-26 14:00:39.510\n!MESSAGE Failure occurred reading .project file.\n!SUBENTRY 1 org.eclipse.core.resources 4 567 2005-10-26 14:00:39.510\n!MESSAGE Document root element is missing.\n!STACK 0\norg.xml.sax.SAXParseException: Document root element is missing.\n        at org.apache.crimson.parser.Parser2.fatal(Parser2.java:3339)\n        at org.apache.crimson.parser.Parser2.fatal(Parser2.java:3327)\n        at org.apache.crimson.parser.Parser2.parseInternal(Parser2.java:635)\n        at org.apache.crimson.parser.Parser2.parse(Parser2.java:333)\n        at org.apache.crimson.parser.XMLReaderImpl.parse(XMLReaderImpl.java:448)\n        at javax.xml.parsers.SAXParser.parse(SAXParser.java:345)\n        at\norg.eclipse.core.internal.resources.ProjectDescriptionReader.read(ProjectDescriptionReader.java:504)\n        at\norg.eclipse.core.internal.resources.ProjectDescriptionReader.read(ProjectDescriptionReader.java:532)\n        at\norg.eclipse.core.internal.localstore.FileSystemResourceManager.read(FileSystemResourceManager.java:575)\n        at\norg.eclipse.core.internal.resources.SaveManager.restoreMetaInfo(SaveManager.java:767)\n        at\norg.eclipse.core.internal.resources.SaveManager.restore(SaveManager.java:674)\n        at org.eclipse.core.internal.resources.Project.open(Project.java:805)\n        at org.eclipse.core.internal.resources.Project.open(Project.java:839)\n        at\norg.eclipse.ui.actions.OpenResourceAction.invokeOperation(OpenResourceAction.java:88)\n        at org.eclipse.ui.actions.WorkspaceAction.execute(WorkspaceAction.java:133)\n        at\norg.eclipse.ui.actions.WorkspaceAction$2.runInWorkspace(WorkspaceAction.java:424)\n        at\norg.eclipse.core.internal.resources.InternalWorkspaceJob.run(InternalWorkspaceJob.java:38)\n        at org.eclipse.core.internal.jobs.Worker.run(Worker.java:76)\n!SUBENTRY 1 org.eclipse.core.resources 2 567 2005-10-26 14:00:39.510\n!MESSAGE Document root element is missing.\n!STACK 0\norg.xml.sax.SAXParseException: Document root element is missing.\n        at org.apache.crimson.parser.Parser2.fatal(Parser2.java:3339)\n        at org.apache.crimson.parser.Parser2.fatal(Parser2.java:3327)\n        at org.apache.crimson.parser.Parser2.parseInternal(Parser2.java:635)\n        at org.apache.crimson.parser.Parser2.parse(Parser2.java:333)\n        at org.apache.crimson.parser.XMLReaderImpl.parse(XMLReaderImpl.java:448)\n        at javax.xml.parsers.SAXParser.parse(SAXParser.java:345)\n        at\norg.eclipse.core.internal.resources.ProjectDescriptionReader.read(ProjectDescriptionReader.java:504)\n        at\norg.eclipse.core.internal.resources.ProjectDescriptionReader.read(ProjectDescriptionReader.java:532)\n        at\norg.eclipse.core.internal.localstore.FileSystemResourceManager.read(FileSystemResourceManager.java:575)\n        at\norg.eclipse.core.internal.resources.SaveManager.restoreMetaInfo(SaveManager.java:767)\n        at\norg.eclipse.core.internal.resources.SaveManager.restore(SaveManager.java:674)\n        at org.eclipse.core.internal.resources.Project.open(Project.java:805)\n        at org.eclipse.core.internal.resources.Project.open(Project.java:839)\n        at\norg.eclipse.ui.actions.OpenResourceAction.invokeOperation(OpenResourceAction.java:88)\n        at org.eclipse.ui.actions.WorkspaceAction.execute(WorkspaceAction.java:133)\n        at\norg.eclipse.ui.actions.WorkspaceAction$2.runInWorkspace(WorkspaceAction.java:424)\n        at\norg.eclipse.core.internal.resources.InternalWorkspaceJob.run(InternalWorkspaceJob.java:38)\n        at org.eclipse.core.internal.jobs.Worker.run(Worker.java:76)\n\n\n!ENTRY org.eclipse.ui.ide 4 4 2005-10-26 14:00:39.670\n!MESSAGE Problems occurred opening the selected resources.\n!SUBENTRY 1 org.eclipse.core.resources 4 567 2005-10-26 14:00:39.670\n!MESSAGE Failed to read the project description file (.project) for\nATFM_DEV_11.  The file has been changed on disk, and it now contains invalid\ninformation.  The project will not function properly until the description\nfile is restored to a valid state.\n!SESSION 2005-10-26 14:02:18.993\n-----------------------------------------------\neclipse.buildId\u003dI20050627-1435\njava.version\u003d1.4.2_01\njava.vendor\u003dSun Microsystems Inc.\nBootLoader constants: OS\u003dwin32, ARCH\u003dx86, WS\u003dwin32, NL\u003den_US\nFramework arguments:  eclipse.exe\nCommand-line arguments:  -os win32 -ws win32 -arch x86 eclipse.exe\n\n\n!ENTRY org.eclipse.core.resources 4 567 2005-10-26 14:02:33.33\n!MESSAGE Failure occurred reading .project file.\n!SUBENTRY 1 org.eclipse.core.resources 4 567 2005-10-26 14:02:33.33\n!MESSAGE Document root element is missing.\n!STACK 0\norg.xml.sax.SAXParseException: Document root element is missing.\n        at org.apache.crimson.parser.Parser2.fatal(Parser2.java:3339)\n        at org.apache.crimson.parser.Parser2.fatal(Parser2.java:3327)\n        at org.apache.crimson.parser.Parser2.parseInternal(Parser2.java:635)\n        at org.apache.crimson.parser.Parser2.parse(Parser2.java:333)\n        at org.apache.crimson.parser.XMLReaderImpl.parse(XMLReaderImpl.java:448)\n        at javax.xml.parsers.SAXParser.parse(SAXParser.java:345)\n        at\norg.eclipse.core.internal.resources.ProjectDescriptionReader.read(ProjectDescriptionReader.java:504)\n        at\norg.eclipse.core.internal.resources.ProjectDescriptionReader.read(ProjectDescriptionReader.java:532)\n        at\norg.eclipse.core.internal.localstore.FileSystemResourceManager.read(FileSystemResourceManager.java:575)\n        at\norg.eclipse.core.internal.resources.SaveManager.restoreMetaInfo(SaveManager.java:767)\n        at\norg.eclipse.core.internal.resources.SaveManager.restore(SaveManager.java:674)\n        at org.eclipse.core.internal.resources.Project.open(Project.java:805)\n        at org.eclipse.core.internal.resources.Project.open(Project.java:839)\n        at\norg.eclipse.ui.actions.OpenResourceAction.invokeOperation(OpenResourceAction.java:88)\n        at org.eclipse.ui.actions.WorkspaceAction.execute(WorkspaceAction.java:133)\n        at\norg.eclipse.ui.actions.WorkspaceAction$2.runInWorkspace(WorkspaceAction.java:424)\n        at\norg.eclipse.core.internal.resources.InternalWorkspaceJob.run(InternalWorkspaceJob.java:38)\n        at org.eclipse.core.internal.jobs.Worker.run(Worker.java:76)\n!SUBENTRY 1 org.eclipse.core.resources 2 567 2005-10-26 14:02:33.33\n!MESSAGE Document root element is missing.\n!STACK 0\norg.xml.sax.SAXParseException: Document root element is missing.\n        at org.apache.crimson.parser.Parser2.fatal(Parser2.java:3339)\n        at org.apache.crimson.parser.Parser2.fatal(Parser2.java:3327)\n        at org.apache.crimson.parser.Parser2.parseInternal(Parser2.java:635)\n        at org.apache.crimson.parser.Parser2.parse(Parser2.java:333)\n        at org.apache.crimson.parser.XMLReaderImpl.parse(XMLReaderImpl.java:448)\n        at javax.xml.parsers.SAXParser.parse(SAXParser.java:345)\n        at\norg.eclipse.core.internal.resources.ProjectDescriptionReader.read(ProjectDescriptionReader.java:504)\n        at\norg.eclipse.core.internal.resources.ProjectDescriptionReader.read(ProjectDescriptionReader.java:532)\n        at\norg.eclipse.core.internal.localstore.FileSystemResourceManager.read(FileSystemResourceManager.java:575)\n        at\norg.eclipse.core.internal.resources.SaveManager.restoreMetaInfo(SaveManager.java:767)\n        at\norg.eclipse.core.internal.resources.SaveManager.restore(SaveManager.java:674)\n        at org.eclipse.core.internal.resources.Project.open(Project.java:805)\n        at org.eclipse.core.internal.resources.Project.open(Project.java:839)\n        at\norg.eclipse.ui.actions.OpenResourceAction.invokeOperation(OpenResourceAction.java:88)\n        at org.eclipse.ui.actions.WorkspaceAction.execute(WorkspaceAction.java:133)\n        at\norg.eclipse.ui.actions.WorkspaceAction$2.runInWorkspace(WorkspaceAction.java:424)\n        at\norg.eclipse.core.internal.resources.InternalWorkspaceJob.run(InternalWorkspaceJob.java:38)\n        at org.eclipse.core.internal.jobs.Worker.run(Worker.java:76)",
    "I noticed the .project file has a UTF-8 byte order mark. Did you edit it with\nNotepad and aved as Unicode? The XML parser you are using (Crimson) chokes with\nthem. IIRC, Xerces (the XML parser in IBM JDKs/JREs and in Sun\u0027s JDK 1.5.*)\nwould handle it properly.",
    "I altered the file using UltraEdit.\nIt\u0027s not unlikely its original format was changed ... .\nFrom previous XLM Java coding, I seem to recall a similar text/UTF error.\nPretty stupid kind of problem.\nHow would this be best dealt with ?",
    "That explains it - thanks Rafael.\n\nSolution: don\u0027t edit the .project file by hand.",
    "To revert this, you have to open the .project file and save it back using an\nordinary encoding (Cp1252, default for Windows in English). Notepad will do the\ntrick, for instance. Open it, and Save as... with the same name but change the\nencoding to be Ansi. "
  ],
  "commentCreationDates": [
    "2005-10-26T18:03:22+02:00",
    "2005-10-26T18:04:10+02:00",
    "2005-10-26T18:05:13+02:00",
    "2005-10-26T18:10:37+02:00",
    "2005-10-26T18:33:38+02:00",
    "2005-10-27T19:30:01+02:00",
    "2005-10-27T19:58:49+02:00",
    "2005-10-27T20:22:52+02:00",
    "2005-10-27T20:26:35+02:00",
    "2005-10-27T21:58:31+02:00"
  ],
  "traces": [
    {
      "exceptionType": "org.xml.sax.SAXParseException",
      "message": "Document root element is missing.",
      "elements": [
        {
          "method": "org.apache.crimson.parser.Parser2.fatal",
          "source": "Parser2.java:3339"
        },
        {
          "method": "org.apache.crimson.parser.Parser2.fatal",
          "source": "Parser2.java:3327"
        },
        {
          "method": "org.apache.crimson.parser.Parser2.parseInternal",
          "source": "Parser2.java:635"
        },
        {
          "method": "org.apache.crimson.parser.Parser2.parse",
          "source": "Parser2.java:333"
        },
        {
          "method": "org.apache.crimson.parser.XMLReaderImpl.parse",
          "source": "XMLReaderImpl.java:448"
        },
        {
          "method": "javax.xml.parsers.SAXParser.parse",
          "source": "SAXParser.java:345"
        },
        {
          "method": "org.eclipse.core.internal.resources.ProjectDescriptionReader.read",
          "source": "ProjectDescriptionReader.java:504"
        },
        {
          "method": "org.eclipse.core.internal.resources.ProjectDescriptionReader.read",
          "source": "ProjectDescriptionReader.java:532"
        },
        {
          "method": "org.eclipse.core.internal.localstore.FileSystemResourceManager.read",
          "source": "FileSystemResourceManager.java:575"
        },
        {
          "method": "org.eclipse.core.internal.resources.SaveManager.restoreMetaInfo",
          "source": "SaveManager.java:767"
        },
        {
          "method": "org.eclipse.core.internal.resources.SaveManager.restore",
          "source": "SaveManager.java:674"
        },
        {
          "method": "org.eclipse.core.internal.resources.Project.open",
          "source": "Project.java:805"
        },
        {
          "method": "org.eclipse.core.internal.resources.Project.open",
          "source": "Project.java:839"
        },
        {
          "method": "org.eclipse.ui.actions.OpenResourceAction.invokeOperation",
          "source": "OpenResourceAction.java:88"
        },
        {
          "method": "org.eclipse.ui.actions.WorkspaceAction.execute",
          "source": "WorkspaceAction.java:133"
        },
        {
          "method": "org.eclipse.ui.actions.WorkspaceAction$2.runInWorkspace",
          "source": "WorkspaceAction.java:424"
        },
        {
          "method": "org.eclipse.core.internal.resources.InternalWorkspaceJob.run",
          "source": "InternalWorkspaceJob.java:38"
        },
        {
          "method": "org.eclipse.core.internal.jobs.Worker.run",
          "source": "Worker.java:76"
        }
      ],
      "number": 0,
      "commentIndex": 5,
      "bugId": "113844",
      "date": "2005-10-27T19:30:01+02:00",
      "product": "Platform",
      "component": "Resources",
      "severity": "normal"
    },
    {
      "exceptionType": "org.xml.sax.SAXParseException",
      "message": "Document root element is missing.",
      "elements": [
        {
          "method": "org.apache.crimson.parser.Parser2.fatal",
          "source": "Parser2.java:3339"
        },
        {
          "method": "org.apache.crimson.parser.Parser2.fatal",
          "source": "Parser2.java:3327"
        },
        {
          "method": "org.apache.crimson.parser.Parser2.parseInternal",
          "source": "Parser2.java:635"
        },
        {
          "method": "org.apache.crimson.parser.Parser2.parse",
          "source": "Parser2.java:333"
        },
        {
          "method": "org.apache.crimson.parser.XMLReaderImpl.parse",
          "source": "XMLReaderImpl.java:448"
        },
        {
          "method": "javax.xml.parsers.SAXParser.parse",
          "source": "SAXParser.java:345"
        },
        {
          "method": "org.eclipse.core.internal.resources.ProjectDescriptionReader.read",
          "source": "ProjectDescriptionReader.java:504"
        },
        {
          "method": "org.eclipse.core.internal.resources.ProjectDescriptionReader.read",
          "source": "ProjectDescriptionReader.java:532"
        },
        {
          "method": "org.eclipse.core.internal.localstore.FileSystemResourceManager.read",
          "source": "FileSystemResourceManager.java:575"
        },
        {
          "method": "org.eclipse.core.internal.resources.SaveManager.restoreMetaInfo",
          "source": "SaveManager.java:767"
        },
        {
          "method": "org.eclipse.core.internal.resources.SaveManager.restore",
          "source": "SaveManager.java:674"
        },
        {
          "method": "org.eclipse.core.internal.resources.Project.open",
          "source": "Project.java:805"
        },
        {
          "method": "org.eclipse.core.internal.resources.Project.open",
          "source": "Project.java:839"
        },
        {
          "method": "org.eclipse.ui.actions.OpenResourceAction.invokeOperation",
          "source": "OpenResourceAction.java:88"
        },
        {
          "method": "org.eclipse.ui.actions.WorkspaceAction.execute",
          "source": "WorkspaceAction.java:133"
        },
        {
          "method": "org.eclipse.ui.actions.WorkspaceAction$2.runInWorkspace",
          "source": "WorkspaceAction.java:424"
        },
        {
          "method": "org.eclipse.core.internal.resources.InternalWorkspaceJob.run",
          "source": "InternalWorkspaceJob.java:38"
        },
        {
          "method": "org.eclipse.core.internal.jobs.Worker.run",
          "source": "Worker.java:76"
        }
      ],
      "number": 1,
      "commentIndex": 5,
      "bugId": "113844",
      "date": "2005-10-27T19:30:01+02:00",
      "product": "Platform",
      "component": "Resources",
      "severity": "normal"
    },
    {
      "exceptionType": "org.xml.sax.SAXParseException",
      "message": "Document root element is missing.",
      "elements": [
        {
          "method": "org.apache.crimson.parser.Parser2.fatal",
          "source": "Parser2.java:3339"
        },
        {
          "method": "org.apache.crimson.parser.Parser2.fatal",
          "source": "Parser2.java:3327"
        },
        {
          "method": "org.apache.crimson.parser.Parser2.parseInternal",
          "source": "Parser2.java:635"
        },
        {
          "method": "org.apache.crimson.parser.Parser2.parse",
          "source": "Parser2.java:333"
        },
        {
          "method": "org.apache.crimson.parser.XMLReaderImpl.parse",
          "source": "XMLReaderImpl.java:448"
        },
        {
          "method": "javax.xml.parsers.SAXParser.parse",
          "source": "SAXParser.java:345"
        },
        {
          "method": "org.eclipse.core.internal.resources.ProjectDescriptionReader.read",
          "source": "ProjectDescriptionReader.java:504"
        },
        {
          "method": "org.eclipse.core.internal.resources.ProjectDescriptionReader.read",
          "source": "ProjectDescriptionReader.java:532"
        },
        {
          "method": "org.eclipse.core.internal.localstore.FileSystemResourceManager.read",
          "source": "FileSystemResourceManager.java:575"
        },
        {
          "method": "org.eclipse.core.internal.resources.SaveManager.restoreMetaInfo",
          "source": "SaveManager.java:767"
        },
        {
          "method": "org.eclipse.core.internal.resources.SaveManager.restore",
          "source": "SaveManager.java:674"
        },
        {
          "method": "org.eclipse.core.internal.resources.Project.open",
          "source": "Project.java:805"
        },
        {
          "method": "org.eclipse.core.internal.resources.Project.open",
          "source": "Project.java:839"
        },
        {
          "method": "org.eclipse.ui.actions.OpenResourceAction.invokeOperation",
          "source": "OpenResourceAction.java:88"
        },
        {
          "method": "org.eclipse.ui.actions.WorkspaceAction.execute",
          "source": "WorkspaceAction.java:133"
        },
        {
          "method": "org.eclipse.ui.actions.WorkspaceAction$2.runInWorkspace",
          "source": "WorkspaceAction.java:424"
        },
        {
          "method": "org.eclipse.core.internal.resources.InternalWorkspaceJob.run",
          "source": "InternalWorkspaceJob.java:38"
        },
        {
          "method": "org.eclipse.core.internal.jobs.Worker.run",
          "source": "Worker.java:76"
        }
      ],
      "number": 2,
      "commentIndex": 5,
      "bugId": "113844",
      "date": "2005-10-27T19:30:01+02:00",
      "product": "Platform",
      "component": "Resources",
      "severity": "normal"
    },
    {
      "exceptionType": "org.xml.sax.SAXParseException",
      "message": "Document root element is missing.",
      "elements": [
        {
          "method": "org.apache.crimson.parser.Parser2.fatal",
          "source": "Parser2.java:3339"
        },
        {
          "method": "org.apache.crimson.parser.Parser2.fatal",
          "source": "Parser2.java:3327"
        },
        {
          "method": "org.apache.crimson.parser.Parser2.parseInternal",
          "source": "Parser2.java:635"
        },
        {
          "method": "org.apache.crimson.parser.Parser2.parse",
          "source": "Parser2.java:333"
        },
        {
          "method": "org.apache.crimson.parser.XMLReaderImpl.parse",
          "source": "XMLReaderImpl.java:448"
        },
        {
          "method": "javax.xml.parsers.SAXParser.parse",
          "source": "SAXParser.java:345"
        },
        {
          "method": "org.eclipse.core.internal.resources.ProjectDescriptionReader.read",
          "source": "ProjectDescriptionReader.java:504"
        },
        {
          "method": "org.eclipse.core.internal.resources.ProjectDescriptionReader.read",
          "source": "ProjectDescriptionReader.java:532"
        },
        {
          "method": "org.eclipse.core.internal.localstore.FileSystemResourceManager.read",
          "source": "FileSystemResourceManager.java:575"
        },
        {
          "method": "org.eclipse.core.internal.resources.SaveManager.restoreMetaInfo",
          "source": "SaveManager.java:767"
        },
        {
          "method": "org.eclipse.core.internal.resources.SaveManager.restore",
          "source": "SaveManager.java:674"
        },
        {
          "method": "org.eclipse.core.internal.resources.Project.open",
          "source": "Project.java:805"
        },
        {
          "method": "org.eclipse.core.internal.resources.Project.open",
          "source": "Project.java:839"
        },
        {
          "method": "org.eclipse.ui.actions.OpenResourceAction.invokeOperation",
          "source": "OpenResourceAction.java:88"
        },
        {
          "method": "org.eclipse.ui.actions.WorkspaceAction.execute",
          "source": "WorkspaceAction.java:133"
        },
        {
          "method": "org.eclipse.ui.actions.WorkspaceAction$2.runInWorkspace",
          "source": "WorkspaceAction.java:424"
        },
        {
          "method": "org.eclipse.core.internal.resources.InternalWorkspaceJob.run",
          "source": "InternalWorkspaceJob.java:38"
        },
        {
          "method": "org.eclipse.core.internal.jobs.Worker.run",
          "source": "Worker.java:76"
        }
      ],
      "number": 3,
      "commentIndex": 5,
      "bugId": "113844",
      "date": "2005-10-27T19:30:01+02:00",
      "product": "Platform",
      "component": "Resources",
      "severity": "normal"
    }
  ],
  "groupId": "113844",
  "bugId": "113844",
  "date": "2005-10-26T18:03:22+02:00",
  "product": "Platform",
  "component": "Resources",
  "severity": "normal"
}