{
  "comments": [
    "Using the I20051101 build (on both Tue, 1 Nov 2005 -- 18:43 (+0300) and on Tue, \n1 Nov 2005 -- 21:11 (+0300)), the following Exception occurs when I try to \ncreate a Web project.\n\njava.lang.Error: Unresolved compilation problem:\n        The method bridge() is undefined for the type RuntimeManager\n\n        at org.eclipse.jst.server.core.FacetUtil.getRuntime(FacetUtil.java:60)\n        at org.eclipse.jst.j2ee.project.facet.J2EEComponentCreationFacetOperatio\nn.setRuntime(J2EEComponentCreationFacetOperation.java:48)\n        at org.eclipse.jst.j2ee.internal.web.archive.operations.WebComponentCrea\ntionFacetOperation.execute(WebComponentCreationFacetOperation.java:53)\n        at org.eclipse.wst.common.frameworks.internal.datamodel.ExtendableOperat\nionImpl.doExecute(ExtendableOperationImpl.java:161)\n        at org.eclipse.wst.common.frameworks.internal.datamodel.ExtendableOperat\nionImpl$1.run(ExtendableOperationImpl.java:129)\n        at org.eclipse.core.internal.resources.Workspace.run(Workspace.java:1719\n)\n        at org.eclipse.core.internal.resources.Workspace.run(Workspace.java:1739\n)\n        at org.eclipse.wst.common.frameworks.internal.datamodel.ExtendableOperat\nionImpl.execute(ExtendableOperationImpl.java:135)\n        at org.eclipse.wst.common.frameworks.internal.OperationManager$2.run(Ope\nrationManager.java:267)\n        at org.eclipse.core.internal.resources.Workspace.run(Workspace.java:1719\n)\n        at org.eclipse.core.internal.resources.Workspace.run(Workspace.java:1739\n)\n        at org.eclipse.wst.common.frameworks.internal.OperationManager.runOperat\nion(OperationManager.java:279)\n        at org.eclipse.wst.common.frameworks.internal.OperationManager.runOperat\nionsUntilStopped(OperationManager.java:225)\n        at org.eclipse.wst.common.frameworks.internal.OperationManager.runOperat\nions(OperationManager.java:130)\n        at org.eclipse.wst.common.frameworks.internal.datamodel.ui.DataModelWiza\nrd$WizardOperationManager.access$0(DataModelWizard.java:1)\n        at org.eclipse.wst.common.frameworks.internal.datamodel.ui.DataModelWiza\nrd$1.run(DataModelWizard.java:281)\n        at org.eclipse.jface.operation.ModalContext.runInCurrentThread(ModalCont\next.java:346)\n        at org.eclipse.jface.operation.ModalContext.run(ModalContext.java:291)\n        at org.eclipse.jface.wizard.WizardDialog.run(WizardDialog.java:830)\n        at org.eclipse.wst.common.frameworks.internal.datamodel.ui.DataModelWiza\nrd$WizardOperationManager.runOperations(DataModelWizard.java:285)\n        at org.eclipse.wst.common.frameworks.internal.ui.PageGroupManager.runAll\nRemainingOperations(PageGroupManager.java:223)\n        at org.eclipse.wst.common.frameworks.internal.datamodel.ui.DataModelWiza\nrd.performFinish(DataModelWizard.java:146)\n        at org.eclipse.jface.wizard.WizardDialog.finishPressed(WizardDialog.java\n:676)\n        at org.eclipse.jface.wizard.WizardDialog.buttonPressed(WizardDialog.java\n:349)\n        at org.eclipse.jface.dialogs.Dialog$2.widgetSelected(Dialog.java:556)\n        at org.eclipse.swt.widgets.TypedListener.handleEvent(TypedListener.java:\n90)\n        at org.eclipse.swt.widgets.EventTable.sendEvent(EventTable.java:66)\n        at org.eclipse.swt.widgets.Widget.sendEvent(Widget.java:843)\n        at org.eclipse.swt.widgets.Display.runDeferredEvents(Display.java:3080)\n        at org.eclipse.swt.widgets.Display.readAndDispatch(Display.java:2713)\n        at org.eclipse.jface.window.Window.runEventLoop(Window.java:809)\n        at org.eclipse.jface.window.Window.open(Window.java:787)\n        at org.eclipse.ui.actions.NewWizardAction.run(NewWizardAction.java:181)\n        at org.eclipse.ui.actions.NewWizardDropDownAction.run(NewWizardDropDownA\nction.java:174)\n        at org.eclipse.jface.action.Action.runWithEvent(Action.java:996)\n        at org.eclipse.jface.action.ActionContributionItem.handleWidgetSelection\n(ActionContributionItem.java:538)\n        at org.eclipse.jface.action.ActionContributionItem.access$2(ActionContri\nbutionItem.java:488)\n        at org.eclipse.jface.action.ActionContributionItem$6.handleEvent(ActionC\nontributionItem.java:441)\n        at org.eclipse.swt.widgets.EventTable.sendEvent(EventTable.java:66)\n        at org.eclipse.swt.widgets.Widget.sendEvent(Widget.java:843)\n        at org.eclipse.swt.widgets.Display.runDeferredEvents(Display.java:3080)\n        at org.eclipse.swt.widgets.Display.readAndDispatch(Display.java:2713)\n        at org.eclipse.ui.internal.Workbench.runEventLoop(Workbench.java:1699)\n        at org.eclipse.ui.internal.Workbench.runUI(Workbench.java:1663)\n        at org.eclipse.ui.internal.Workbench.createAndRunWorkbench(Workbench.jav\na:367)\n        at org.eclipse.ui.PlatformUI.createAndRunWorkbench(PlatformUI.java:143)\n        at org.eclipse.ui.internal.ide.IDEApplication.run(IDEApplication.java:10\n3)\n        at org.eclipse.core.internal.runtime.PlatformActivator$1.run(PlatformAct\nivator.java:226)\n        at org.eclipse.core.runtime.adaptor.EclipseStarter.run(EclipseStarter.ja\nva:376)\n        at org.eclipse.core.runtime.adaptor.EclipseStarter.run(EclipseStarter.ja\nva:163)\n        at sun.reflect.NativeMethodAccessorImpl.invoke0(Native Method)\n        at sun.reflect.NativeMethodAccessorImpl.invoke(NativeMethodAccessorImpl.\njava:39)\n        at sun.reflect.DelegatingMethodAccessorImpl.invoke(DelegatingMethodAcces\nsorImpl.java:25)\n        at java.lang.reflect.Method.invoke(Method.java:324)\n        at org.eclipse.core.launcher.Main.invokeFramework(Main.java:334)\n        at org.eclipse.core.launcher.Main.basicRun(Main.java:278)\n        at org.eclipse.core.launcher.Main.run(Main.java:973)\n        at org.eclipse.core.launcher.Main.main(Main.java:948)",
    "There was a change in the facet support, and Konstantin has already fixed this\nin HEAD. Will close this bug when this is tagged for an I-build.",
    "Since this just due to a compilation problem, I\u0027ll verify that\u0027s it\u0027s fixed in \nthe next I build and then close this bug.",
    "Changes released to I-build.",
    "Verified by Kathy in the I20051102 build.",
    "Closing."
  ],
  "commentCreationDates": [
    "2005-11-01T20:58:39+01:00",
    "2005-11-01T21:08:51+01:00",
    "2005-11-01T21:33:32+01:00",
    "2005-11-01T21:37:41+01:00",
    "2005-11-02T22:50:53+01:00",
    "2005-12-13T15:18:07+01:00"
  ],
  "traces": [
    {
      "exceptionType": "java.lang.Error",
      "message": "Unresolved compilation problem:         The method bridge() is undefined for the type RuntimeManager",
      "elements": [
        {
          "method": "org.eclipse.jst.server.core.FacetUtil.getRuntime",
          "source": "FacetUtil.java:60"
        },
        {
          "method": "org.eclipse.jst.j2ee.project.facet.J2EEComponentCreationFacetOperation.setRuntime",
          "source": "J2EEComponentCreationFacetOperation.java:48"
        },
        {
          "method": "org.eclipse.jst.j2ee.internal.web.archive.operations.WebComponentCreationFacetOperation.execute",
          "source": "WebComponentCreationFacetOperation.java:53"
        },
        {
          "method": "org.eclipse.wst.common.frameworks.internal.datamodel.ExtendableOperationImpl.doExecute",
          "source": "ExtendableOperationImpl.java:161"
        },
        {
          "method": "org.eclipse.wst.common.frameworks.internal.datamodel.ExtendableOperationImpl$1.run",
          "source": "ExtendableOperationImpl.java:129"
        },
        {
          "method": "org.eclipse.core.internal.resources.Workspace.run",
          "source": "Workspace.java:1719 "
        },
        {
          "method": "org.eclipse.core.internal.resources.Workspace.run",
          "source": "Workspace.java:1739 "
        },
        {
          "method": "org.eclipse.wst.common.frameworks.internal.datamodel.ExtendableOperationImpl.execute",
          "source": "ExtendableOperationImpl.java:135"
        },
        {
          "method": "org.eclipse.wst.common.frameworks.internal.OperationManager$2.run",
          "source": "Ope rationManager.java:267"
        },
        {
          "method": "org.eclipse.core.internal.resources.Workspace.run",
          "source": "Workspace.java:1719 "
        },
        {
          "method": "org.eclipse.core.internal.resources.Workspace.run",
          "source": "Workspace.java:1739 "
        },
        {
          "method": "org.eclipse.wst.common.frameworks.internal.OperationManager.runOperation",
          "source": "OperationManager.java:279"
        },
        {
          "method": "org.eclipse.wst.common.frameworks.internal.OperationManager.runOperationsUntilStopped",
          "source": "OperationManager.java:225"
        },
        {
          "method": "org.eclipse.wst.common.frameworks.internal.OperationManager.runOperations",
          "source": "OperationManager.java:130"
        },
        {
          "method": "org.eclipse.wst.common.frameworks.internal.datamodel.ui.DataModelWizard$WizardOperationManager.access$0",
          "source": "DataModelWizard.java:1"
        },
        {
          "method": "org.eclipse.wst.common.frameworks.internal.datamodel.ui.DataModelWizard$1.run",
          "source": "DataModelWizard.java:281"
        },
        {
          "method": "org.eclipse.jface.operation.ModalContext.runInCurrentThread",
          "source": "ModalCont ext.java:346"
        },
        {
          "method": "org.eclipse.jface.operation.ModalContext.run",
          "source": "ModalContext.java:291"
        },
        {
          "method": "org.eclipse.jface.wizard.WizardDialog.run",
          "source": "WizardDialog.java:830"
        },
        {
          "method": "org.eclipse.wst.common.frameworks.internal.datamodel.ui.DataModelWizard$WizardOperationManager.runOperations",
          "source": "DataModelWizard.java:285"
        },
        {
          "method": "org.eclipse.wst.common.frameworks.internal.ui.PageGroupManager.runAllRemainingOperations",
          "source": "PageGroupManager.java:223"
        },
        {
          "method": "org.eclipse.wst.common.frameworks.internal.datamodel.ui.DataModelWizard.performFinish",
          "source": "DataModelWizard.java:146"
        },
        {
          "method": "org.eclipse.jface.wizard.WizardDialog.finishPressed",
          "source": "WizardDialog.java :676"
        },
        {
          "method": "org.eclipse.jface.wizard.WizardDialog.buttonPressed",
          "source": "WizardDialog.java :349"
        },
        {
          "method": "org.eclipse.jface.dialogs.Dialog$2.widgetSelected",
          "source": "Dialog.java:556"
        },
        {
          "method": "org.eclipse.swt.widgets.TypedListener.handleEvent",
          "source": "TypedListener.java: 90"
        },
        {
          "method": "org.eclipse.swt.widgets.EventTable.sendEvent",
          "source": "EventTable.java:66"
        },
        {
          "method": "org.eclipse.swt.widgets.Widget.sendEvent",
          "source": "Widget.java:843"
        },
        {
          "method": "org.eclipse.swt.widgets.Display.runDeferredEvents",
          "source": "Display.java:3080"
        },
        {
          "method": "org.eclipse.swt.widgets.Display.readAndDispatch",
          "source": "Display.java:2713"
        },
        {
          "method": "org.eclipse.jface.window.Window.runEventLoop",
          "source": "Window.java:809"
        },
        {
          "method": "org.eclipse.jface.window.Window.open",
          "source": "Window.java:787"
        },
        {
          "method": "org.eclipse.ui.actions.NewWizardAction.run",
          "source": "NewWizardAction.java:181"
        },
        {
          "method": "org.eclipse.ui.actions.NewWizardDropDownAction.run",
          "source": "NewWizardDropDownA ction.java:174"
        },
        {
          "method": "org.eclipse.jface.action.Action.runWithEvent",
          "source": "Action.java:996"
        },
        {
          "method": "org.eclipse.jface.action.ActionContributionItem.handleWidgetSelection",
          "source": "ActionContributionItem.java:538"
        },
        {
          "method": "org.eclipse.jface.action.ActionContributionItem.access$2",
          "source": "ActionContri butionItem.java:488"
        },
        {
          "method": "org.eclipse.jface.action.ActionContributionItem$6.handleEvent",
          "source": "ActionC ontributionItem.java:441"
        },
        {
          "method": "org.eclipse.swt.widgets.EventTable.sendEvent",
          "source": "EventTable.java:66"
        },
        {
          "method": "org.eclipse.swt.widgets.Widget.sendEvent",
          "source": "Widget.java:843"
        },
        {
          "method": "org.eclipse.swt.widgets.Display.runDeferredEvents",
          "source": "Display.java:3080"
        },
        {
          "method": "org.eclipse.swt.widgets.Display.readAndDispatch",
          "source": "Display.java:2713"
        },
        {
          "method": "org.eclipse.ui.internal.Workbench.runEventLoop",
          "source": "Workbench.java:1699"
        },
        {
          "method": "org.eclipse.ui.internal.Workbench.runUI",
          "source": "Workbench.java:1663"
        },
        {
          "method": "org.eclipse.ui.internal.Workbench.createAndRunWorkbench",
          "source": "Workbench.jav a:367"
        },
        {
          "method": "org.eclipse.ui.PlatformUI.createAndRunWorkbench",
          "source": "PlatformUI.java:143"
        },
        {
          "method": "org.eclipse.ui.internal.ide.IDEApplication.run",
          "source": "IDEApplication.java:10 3"
        },
        {
          "method": "org.eclipse.core.internal.runtime.PlatformActivator$1.run",
          "source": "PlatformAct ivator.java:226"
        },
        {
          "method": "org.eclipse.core.runtime.adaptor.EclipseStarter.run",
          "source": "EclipseStarter.ja va:376"
        },
        {
          "method": "org.eclipse.core.runtime.adaptor.EclipseStarter.run",
          "source": "EclipseStarter.ja va:163"
        },
        {
          "method": "sun.reflect.NativeMethodAccessorImpl.invoke0",
          "source": "Native Method"
        },
        {
          "method": "sun.reflect.NativeMethodAccessorImpl.invoke",
          "source": "NativeMethodAccessorImpl. java:39"
        },
        {
          "method": "sun.reflect.DelegatingMethodAccessorImpl.invoke",
          "source": "DelegatingMethodAcces sorImpl.java:25"
        },
        {
          "method": "java.lang.reflect.Method.invoke",
          "source": "Method.java:324"
        },
        {
          "method": "org.eclipse.core.launcher.Main.invokeFramework",
          "source": "Main.java:334"
        },
        {
          "method": "org.eclipse.core.launcher.Main.basicRun",
          "source": "Main.java:278"
        },
        {
          "method": "org.eclipse.core.launcher.Main.run",
          "source": "Main.java:973"
        },
        {
          "method": "org.eclipse.core.launcher.Main.main",
          "source": "Main.java:948"
        }
      ],
      "number": 0,
      "commentIndex": 0,
      "bugId": "114644",
      "date": "2005-11-01T20:58:39+01:00",
      "product": "Web Tools",
      "component": "jst.server",
      "severity": "blocker"
    }
  ],
  "groupId": "114644",
  "bugId": "114644",
  "date": "2005-11-01T20:58:39+01:00",
  "product": "Web Tools",
  "component": "jst.server",
  "severity": "blocker"
}