{
  "comments": [
    "3.2 M3\n\nJust found this one in the log after formatting some cus. Can\u0027t provide more \ndetainled steps.\n\norg.eclipse.jface.util.Assert$AssertionFailedException: Assertion failed:\n        at org.eclipse.jface.util.Assert.isTrue(Assert.java:180)\n        at org.eclipse.jface.util.Assert.isTrue(Assert.java:165)\n        at \norg.eclipse.ui.internal.texteditor.quickdiff.compare.rangedifferencer.RangeDiff\nerencer.findDifferencesUkkone\n(RangeDifferencer.java:167)\n        at \norg.eclipse.ui.internal.texteditor.quickdiff.compare.rangedifferencer.RangeDiff\nerencer.findDifferences(Range\nifferencer.java:79)\n        at \norg.eclipse.ui.internal.texteditor.quickdiff.compare.rangedifferencer.RangeDiff\nerencer.findRanges(RangeDiffe\nencer.java:221)\n        at \norg.eclipse.ui.internal.texteditor.quickdiff.compare.rangedifferencer.RangeDiff\nerencer.findRanges(RangeDiffe\nencer.java:206)\n        at \norg.eclipse.ui.internal.texteditor.quickdiff.DocumentLineDiffer.handleChanged\n(DocumentLineDiffer.java:929)\n        at \norg.eclipse.ui.internal.texteditor.quickdiff.DocumentLineDiffer.documentChanged\n(DocumentLineDiffer.java:762)\n        at org.eclipse.jface.text.AbstractDocument.doFireDocumentChanged2\n(AbstractDocument.java:729)\n        at org.eclipse.jface.text.AbstractDocument.doFireDocumentChanged\n(AbstractDocument.java:692)\n        at org.eclipse.jface.text.AbstractDocument.doFireDocumentChanged\n(AbstractDocument.java:677)\n        at org.eclipse.jface.text.AbstractDocument.fireDocumentChanged\n(AbstractDocument.java:754)\n        at org.eclipse.jface.text.AbstractDocument.replace\n(AbstractDocument.java:1112)\n        at \norg.eclipse.jdt.internal.ui.javaeditor.PartiallySynchronizedDocument.replace\n(PartiallySynchronizedDocument.j\nva:111)\n        at org.eclipse.jface.text.AbstractDocument.replace\n(AbstractDocument.java:1119)\n        at \norg.eclipse.jdt.internal.ui.javaeditor.PartiallySynchronizedDocument.replace\n(PartiallySynchronizedDocument.j\nva:102)\n        at org.eclipse.text.edits.ReplaceEdit.performDocumentUpdating\n(ReplaceEdit.java:81)\n        at org.eclipse.text.edits.TextEdit.traverseDocumentUpdating\n(TextEdit.java:860)\n        at org.eclipse.text.edits.TextEdit.traverseDocumentUpdating\n(TextEdit.java:853)\n        at org.eclipse.text.edits.TextEditProcessor.executeDo\n(TextEditProcessor.java:185)\n        at org.eclipse.text.edits.TextEdit.dispatchPerformEdits\n(TextEdit.java:700)\n        at org.eclipse.text.edits.TextEditProcessor.performEdits\n(TextEditProcessor.java:153)\n        at org.eclipse.text.edits.TextEdit.apply(TextEdit.java:672)\n        at org.eclipse.text.edits.TextEdit.apply(TextEdit.java:696)\n        at \norg.eclipse.jdt.internal.ui.text.comment.CommentFormattingStrategy.format\n(CommentFormattingStrategy.java:103\n\n        at \norg.eclipse.jface.text.formatter.MultiPassContentFormatter.formatSlave\n(MultiPassContentFormatter.java:220)\n        at \norg.eclipse.jface.text.formatter.MultiPassContentFormatter.formatSlaves\n(MultiPassContentFormatter.java:267)\n        at org.eclipse.jface.text.formatter.MultiPassContentFormatter.format\n(MultiPassContentFormatter.java:143)\n        at org.eclipse.jdt.ui.actions.FormatAllAction.doFormat\n(FormatAllAction.java:337)\n        at org.eclipse.jdt.ui.actions.FormatAllAction.access$1\n(FormatAllAction.java:322)\n        at org.eclipse.jdt.ui.actions.FormatAllAction$2.run\n(FormatAllAction.java:419)\n        at org.eclipse.ui.internal.UILockListener.doPendingWork\n(UILockListener.java:150)\n        at org.eclipse.ui.internal.UISynchronizer$1.run(UISynchronizer.java:36)\n        at org.eclipse.swt.widgets.RunnableLock.run(RunnableLock.java:35)\n        at org.eclipse.swt.widgets.Synchronizer.runAsyncMessages\n(Synchronizer.java:123)\n        at org.eclipse.swt.widgets.Display.runAsyncMessages(Display.java:3213)\n        at org.eclipse.swt.widgets.Display.readAndDispatch(Display.java:2859)\n        at org.eclipse.jface.operation.ModalContext$ModalContextThread.block\n(ModalContext.java:153)\n        at org.eclipse.jface.operation.ModalContext.run(ModalContext.java:303)\n        at org.eclipse.jface.dialogs.ProgressMonitorDialog.run\n(ProgressMonitorDialog.java:453)\n        at org.eclipse.ui.internal.progress.ProgressMonitorJobsDialog.run\n(ProgressMonitorJobsDialog.java:261)\n        at org.eclipse.ui.internal.progress.ProgressManager$3.run\n(ProgressManager.java:866)\n        at org.eclipse.swt.custom.BusyIndicator.showWhile\n(BusyIndicator.java:69)\n        at org.eclipse.ui.internal.progress.ProgressManager.busyCursorWhile\n(ProgressManager.java:900)\n        at org.eclipse.ui.internal.progress.ProgressManager.busyCursorWhile\n(ProgressManager.java:876)\n        at org.eclipse.ui.internal.progress.ProgressManager.run\n(ProgressManager.java:1075)\n        at org.eclipse.jdt.ui.actions.FormatAllAction.runOnMultiple\n(FormatAllAction.java:300)\n        at org.eclipse.jdt.ui.actions.FormatAllAction.run\n(FormatAllAction.java:276)\n        at org.eclipse.jdt.ui.actions.SelectionDispatchAction.dispatchRun\n(SelectionDispatchAction.java:222)\n        at org.eclipse.jdt.ui.actions.SelectionDispatchAction.run\n(SelectionDispatchAction.java:198)\n        at org.eclipse.jface.action.Action.runWithEvent(Action.java:996)\n        at \norg.eclipse.jface.action.ActionContributionItem.handleWidgetSelection\n(ActionContributionItem.java:544)\n        at org.eclipse.jface.action.ActionContributionItem.access$2\n(ActionContributionItem.java:494)\n        at org.eclipse.jface.action.ActionContributionItem$5.handleEvent\n(ActionContributionItem.java:406)\n        at org.eclipse.swt.widgets.EventTable.sendEvent(EventTable.java:66)\n        at org.eclipse.swt.widgets.Widget.sendEvent(Widget.java:896)\n        at org.eclipse.swt.widgets.Display.runDeferredEvents(Display.java:3236)\n        at org.eclipse.swt.widgets.Display.readAndDispatch(Display.java:2856)\n        at org.eclipse.ui.internal.Workbench.runEventLoop(Workbench.java:1774)\n        at org.eclipse.ui.internal.Workbench.runUI(Workbench.java:1738)\n        at org.eclipse.ui.internal.Workbench.createAndRunWorkbench\n(Workbench.java:376)\n        at org.eclipse.ui.PlatformUI.createAndRunWorkbench(PlatformUI.java:143)\n        at org.eclipse.ui.internal.ide.IDEApplication.run\n(IDEApplication.java:106)\n        at org.eclipse.core.internal.runtime.PlatformActivator$1.run\n(PlatformActivator.java:226)\n        at org.eclipse.core.runtime.adaptor.EclipseStarter.run\n(EclipseStarter.java:376)\n        at org.eclipse.core.runtime.adaptor.EclipseStarter.run\n(EclipseStarter.java:165)\n        at sun.reflect.NativeMethodAccessorImpl.invoke0(Native Method)\n        at sun.reflect.NativeMethodAccessorImpl.invoke\n(NativeMethodAccessorImpl.java:85)\n        at sun.reflect.NativeMethodAccessorImpl.invoke\n(NativeMethodAccessorImpl.java:58)\n        at sun.reflect.DelegatingMethodAccessorImpl.invoke\n(DelegatingMethodAccessorImpl.java:60)\n        at java.lang.reflect.Method.invoke(Method.java:391)\n        at org.eclipse.core.launcher.Main.invokeFramework(Main.java:338)\n        at org.eclipse.core.launcher.Main.basicRun(Main.java:282)\n        at org.eclipse.core.launcher.Main.run(Main.java:977)\n        at org.eclipse.core.launcher.Main.main(Main.java:952)",
    "This expression failed:\n\nIRangeComparator left, right...\n\nAssert.isTrue(right.getClass().equals(left.getClass()));\n\n\nFunny - there are only three IRangeComparator implementation in eclipse:\n\n- DocEquivalenceComparator (the only one being used)\n- DocLineComparator (not used - I just deleted it)\n- SequenceComparator (only in a test plug-in)\n\nSo... no idea how this expression can become false - it never has in about two\nyears.\n\nClosing as remind - we need a reproducable case.\n\n",
    "Oops, I misread the line numbers... its another assert within the ukkonen\nalgorithm that fails. We haven\u0027t touched that algorithm in years - leaving as\nremind.",
    "Get rid of deprecated state.",
    "."
  ],
  "commentCreationDates": [
    "2005-11-07T16:58:25+01:00",
    "2005-11-07T17:27:56+01:00",
    "2005-11-07T17:30:11+01:00",
    "2007-06-22T15:59:28+02:00",
    "2007-06-22T16:04:41+02:00"
  ],
  "traces": [
    {
      "exceptionType": "org.eclipse.jface.util.Assert$AssertionFailedException",
      "message": "Assertion failed:",
      "elements": [
        {
          "method": "org.eclipse.jface.util.Assert.isTrue",
          "source": "Assert.java:180"
        },
        {
          "method": "org.eclipse.jface.util.Assert.isTrue",
          "source": "Assert.java:165"
        },
        {
          "method": "org.eclipse.ui.internal.texteditor.quickdiff.compare.rangedifferencer.RangeDifferencer.findDifferencesUkkone",
          "source": "RangeDifferencer.java:167"
        },
        {
          "method": "org.eclipse.ui.internal.texteditor.quickdiff.compare.rangedifferencer.RangeDifferencer.findDifferences",
          "source": "Range ifferencer.java:79"
        },
        {
          "method": "org.eclipse.ui.internal.texteditor.quickdiff.compare.rangedifferencer.RangeDifferencer.findRanges",
          "source": "RangeDiffe encer.java:221"
        },
        {
          "method": "org.eclipse.ui.internal.texteditor.quickdiff.compare.rangedifferencer.RangeDifferencer.findRanges",
          "source": "RangeDiffe encer.java:206"
        },
        {
          "method": "org.eclipse.ui.internal.texteditor.quickdiff.DocumentLineDiffer.handleChanged",
          "source": "DocumentLineDiffer.java:929"
        },
        {
          "method": "org.eclipse.ui.internal.texteditor.quickdiff.DocumentLineDiffer.documentChanged",
          "source": "DocumentLineDiffer.java:762"
        },
        {
          "method": "org.eclipse.jface.text.AbstractDocument.doFireDocumentChanged2",
          "source": "AbstractDocument.java:729"
        },
        {
          "method": "org.eclipse.jface.text.AbstractDocument.doFireDocumentChanged",
          "source": "AbstractDocument.java:692"
        },
        {
          "method": "org.eclipse.jface.text.AbstractDocument.doFireDocumentChanged",
          "source": "AbstractDocument.java:677"
        },
        {
          "method": "org.eclipse.jface.text.AbstractDocument.fireDocumentChanged",
          "source": "AbstractDocument.java:754"
        },
        {
          "method": "org.eclipse.jface.text.AbstractDocument.replace",
          "source": "AbstractDocument.java:1112"
        },
        {
          "method": "org.eclipse.jdt.internal.ui.javaeditor.PartiallySynchronizedDocument.replace",
          "source": "PartiallySynchronizedDocument.j va:111"
        },
        {
          "method": "org.eclipse.jface.text.AbstractDocument.replace",
          "source": "AbstractDocument.java:1119"
        },
        {
          "method": "org.eclipse.jdt.internal.ui.javaeditor.PartiallySynchronizedDocument.replace",
          "source": "PartiallySynchronizedDocument.j va:102"
        },
        {
          "method": "org.eclipse.text.edits.ReplaceEdit.performDocumentUpdating",
          "source": "ReplaceEdit.java:81"
        },
        {
          "method": "org.eclipse.text.edits.TextEdit.traverseDocumentUpdating",
          "source": "TextEdit.java:860"
        },
        {
          "method": "org.eclipse.text.edits.TextEdit.traverseDocumentUpdating",
          "source": "TextEdit.java:853"
        },
        {
          "method": "org.eclipse.text.edits.TextEditProcessor.executeDo",
          "source": "TextEditProcessor.java:185"
        },
        {
          "method": "org.eclipse.text.edits.TextEdit.dispatchPerformEdits",
          "source": "TextEdit.java:700"
        },
        {
          "method": "org.eclipse.text.edits.TextEditProcessor.performEdits",
          "source": "TextEditProcessor.java:153"
        },
        {
          "method": "org.eclipse.text.edits.TextEdit.apply",
          "source": "TextEdit.java:672"
        },
        {
          "method": "org.eclipse.text.edits.TextEdit.apply",
          "source": "TextEdit.java:696"
        }
      ],
      "number": 0,
      "commentIndex": 0,
      "bugId": "115342",
      "date": "2005-11-07T16:58:25+01:00",
      "product": "JDT",
      "component": "Text",
      "severity": "normal"
    }
  ],
  "groupId": "115342",
  "bugId": "115342",
  "date": "2005-11-07T16:58:25+01:00",
  "product": "JDT",
  "component": "Text",
  "severity": "normal"
}