{
  "comments": [
    "Build: I20051130-1215\n\nI found several of these errors in my log after a morning of work.  I don\u0027t know if there were any side-effects, but I also noticed some cases today where the editor was reporting an error but the compiler was not (complaining of referenced classes not existing). Closing and reopening the editor solved that problem. I don\u0027t know if that\u0027s related or not, but thought I\u0027d mention it.\n\njava.util.ConcurrentModificationException: concurrent access to HashMap attempted by Thread[Worker-3,5,main]\n\tat java.util.HashMap.onExit(HashMap.java:223)\n\tat java.util.HashMap.transfer(HashMap.java:558)\n\tat java.util.HashMap.resize(HashMap.java:541)\n\tat java.util.HashMap.addEntry(HashMap.java:901)\n\tat java.util.HashMap.put(HashMap.java:474)\n\tat java.util.HashSet.add(HashSet.java:206)\n\tat org.eclipse.jdt.internal.core.JavaModel.getTarget(JavaModel.java:372)\n\tat org.eclipse.jdt.internal.core.builder.NameEnvironment.computeClasspathLocations(NameEnvironment.java:97)",
    "Created an attachment (id\u003d31055)\nLog file\n\n",
    "Closing as a dup of bug 114571.\nPlease reopen if you get it again with next integration build.\n\n*** This bug has been marked as a duplicate of 114571 ***"
  ],
  "commentCreationDates": [
    "2005-12-02T19:11:42+01:00",
    "2005-12-02T19:12:03+01:00",
    "2005-12-02T19:18:23+01:00"
  ],
  "traces": [
    {
      "exceptionType": "java.util.ConcurrentModificationException",
      "message": "concurrent access to HashMap attempted by Thread[Worker-3,5,main]",
      "elements": [
        {
          "method": "java.util.HashMap.onExit",
          "source": "HashMap.java:223"
        },
        {
          "method": "java.util.HashMap.transfer",
          "source": "HashMap.java:558"
        },
        {
          "method": "java.util.HashMap.resize",
          "source": "HashMap.java:541"
        },
        {
          "method": "java.util.HashMap.addEntry",
          "source": "HashMap.java:901"
        },
        {
          "method": "java.util.HashMap.put",
          "source": "HashMap.java:474"
        },
        {
          "method": "java.util.HashSet.add",
          "source": "HashSet.java:206"
        },
        {
          "method": "org.eclipse.jdt.internal.core.JavaModel.getTarget",
          "source": "JavaModel.java:372"
        },
        {
          "method": "org.eclipse.jdt.internal.core.builder.NameEnvironment.computeClasspathLocations",
          "source": "NameEnvironment.java:97"
        }
      ],
      "number": 0,
      "commentIndex": 0,
      "bugId": "119081",
      "duplicateId": "114571",
      "date": "2005-12-02T19:11:42+01:00",
      "product": "JDT",
      "component": "Core",
      "severity": "normal"
    }
  ],
  "groupId": "114571",
  "bugId": "119081",
  "duplicateId": "114571",
  "date": "2005-12-02T19:11:42+01:00",
  "product": "JDT",
  "component": "Core",
  "severity": "normal"
}