{
  "comments": [
    "Build 20020319\norg.eclipse.jdt.launching.j9 20020212\n\nThis version of the j9 launching plugin is out of date. When attempting to use \nit, I get the following exceptions:\nLog: Thu Mar 21 10:41:46 CET 2002\n4 org.eclipse.debug.ui 5013 Exception occurred while launching.\njava.lang.AbstractMethodError\n        at \norg.eclipse.jdt.internal.launching.JavaLocalApplicationLaunchConfigurationDelega\nte.launch(JavaLocalApplicationLaunchConfigurationDelegate.java:88)\n        at org.eclipse.debug.internal.core.LaunchConfiguration.launch\n(LaunchConfiguration.java:137)\n        at \norg.eclipse.debug.internal.ui.launchConfigurations.LaunchConfigurationDialog$8.r\nun(LaunchConfigurationDialog.java:1746)\n        at org.eclipse.jface.operation.ModalContext$ModalContextThread.run\n(ModalContext.java:98)\nLog: Thu Mar 21 11:19:08 CET 2002\n4 org.eclipse.pde 0 Launch failed. See log for details.\njava.lang.NoSuchMethodError\n        at org.eclipse.jdt.internal.launching.j9.J9DebugVMRunner.run\n(J9DebugVMRunner.java:90)\n        at org.eclipse.pde.internal.launcher.WorkbenchLauncherDelegate.doLaunch\n(WorkbenchLauncherDelegate.java:131)\n        at \norg.eclipse.pde.internal.launcher.WorkbenchLauncherWizard.delegateLaunch\n(WorkbenchLauncherWizard.java:129)\n        at org.eclipse.pde.internal.launcher.WorkbenchLauncherWizard.access$0\n(WorkbenchLauncherWizard.java:116)\n        at org.eclipse.pde.internal.launcher.WorkbenchLauncherWizard$1.run\n(WorkbenchLauncherWizard.java:77)\n        at org.eclipse.jface.operation.ModalContext$ModalContextThread.run\n(ModalContext.java:98)",
    "Please make a new J9 plugin available on our web page.",
    "Added the latest to the webpage.",
    "Please verify (darin w)",
    "Verified. This plug-in is (also) now available in the dev.eclipse.org \nrepository."
  ],
  "commentCreationDates": [
    "2002-03-21T11:29:35+01:00",
    "2002-03-21T13:41:30+01:00",
    "2002-03-21T19:19:01+01:00",
    "2002-03-21T19:19:16+01:00",
    "2002-03-22T14:41:03+01:00"
  ],
  "traces": [
    {
      "exceptionType": "java.lang.AbstractMethodError",
      "elements": [
        {
          "method": "org.eclipse.jdt.internal.launching.JavaLocalApplicationLaunchConfigurationDelegate.launch",
          "source": "JavaLocalApplicationLaunchConfigurationDelegate.java:88"
        },
        {
          "method": "org.eclipse.debug.internal.core.LaunchConfiguration.launch",
          "source": "LaunchConfiguration.java:137"
        },
        {
          "method": "org.eclipse.debug.internal.ui.launchConfigurations.LaunchConfigurationDialog$8.run",
          "source": "LaunchConfigurationDialog.java:1746"
        },
        {
          "method": "org.eclipse.jface.operation.ModalContext$ModalContextThread.run",
          "source": "ModalContext.java:98"
        }
      ],
      "number": 0,
      "commentIndex": 0,
      "bugId": "12012",
      "date": "2002-03-21T11:29:35+01:00",
      "product": "JDT",
      "component": "Debug",
      "severity": "critical"
    },
    {
      "exceptionType": "java.lang.NoSuchMethodError",
      "elements": [
        {
          "method": "org.eclipse.jdt.internal.launching.j9.J9DebugVMRunner.run",
          "source": "J9DebugVMRunner.java:90"
        },
        {
          "method": "org.eclipse.pde.internal.launcher.WorkbenchLauncherDelegate.doLaunch",
          "source": "WorkbenchLauncherDelegate.java:131"
        },
        {
          "method": "org.eclipse.pde.internal.launcher.WorkbenchLauncherWizard.delegateLaunch",
          "source": "WorkbenchLauncherWizard.java:129"
        },
        {
          "method": "org.eclipse.pde.internal.launcher.WorkbenchLauncherWizard.access$0",
          "source": "WorkbenchLauncherWizard.java:116"
        },
        {
          "method": "org.eclipse.pde.internal.launcher.WorkbenchLauncherWizard$1.run",
          "source": "WorkbenchLauncherWizard.java:77"
        },
        {
          "method": "org.eclipse.jface.operation.ModalContext$ModalContextThread.run",
          "source": "ModalContext.java:98"
        }
      ],
      "number": 1,
      "commentIndex": 0,
      "bugId": "12012",
      "date": "2002-03-21T11:29:35+01:00",
      "product": "JDT",
      "component": "Debug",
      "severity": "critical"
    }
  ],
  "groupId": "12012",
  "bugId": "12012",
  "date": "2002-03-21T11:29:35+01:00",
  "product": "JDT",
  "component": "Debug",
  "severity": "critical"
}