{
  "comments": [
    "We have the need to have a fragment whose host is org.eclipse.swt.  With this fragment built and in the eclipse\\plugins directory I could no longer \"Run as SWT...\" but with it loaded in my workspace I didn\u0027t have any issues.  The exception thrown with it built and in the plugin directory is:\n\njava.lang.UnsatisfiedLinkError: no swt-win32-3139 in java.library.path\n\tat java.lang.ClassLoader.loadLibrary(Unknown Source)\n\tat java.lang.Runtime.loadLibrary0(Unknown Source)\n\tat java.lang.System.loadLibrary(Unknown Source)\n\tat org.eclipse.swt.internal.Library.loadLibrary(Library.java:123)\n\tat org.eclipse.swt.internal.win32.OS.\u003cclinit\u003e(OS.java:18)\n\tat org.eclipse.swt.widgets.Display.\u003cclinit\u003e(Display.java:125)\n\tat CComboTesting.run(CComboTesting.java:16)\n\tat CComboTesting.main(CComboTesting.java:43)\n\nThe problem is that when the JVM is being invoked my plugin is being loaded as the java.library.path fragment:\n\n \"C:\\Program Files\\Java\\j2re1.4.2_07\\bin\\javaw.exe\" \"-Djava.library.path\u003dc:/Program Files/eclipse/plugins/com.bedrock.swt_1.0.0.jar/os/win32/x86\"...\n\nI tracked this down to org.eclipse.pde.internal.ui.launcher.SWTLaunchConfiguration.findFragment():\n\nBundleDescription[] fragments \u003d desc.getFragments();\nif (fragments.length \u003e 0) {\n     return fragments[0];\n}\n\nThe call to desc.getFragments() is returning the correct fragments but the code above just takes the first and since my plugin ID comes before org.eclipse.swt alphabetically it was chosen as the fragment that contains the system libraries.\n\nThe workaround I employed was to rename my fragment so that it came after org.eclipse.swt.",
    "same root cause.\n\n*** This bug has been marked as a duplicate of 113240 ***"
  ],
  "commentCreationDates": [
    "2005-12-12T16:49:52+01:00",
    "2005-12-12T17:02:06+01:00"
  ],
  "traces": [
    {
      "exceptionType": "java.lang.UnsatisfiedLinkError",
      "message": "no swt-win32-3139 in java.library.path",
      "elements": [
        {
          "method": "java.lang.ClassLoader.loadLibrary",
          "source": "Unknown Source"
        },
        {
          "method": "java.lang.Runtime.loadLibrary0",
          "source": "Unknown Source"
        },
        {
          "method": "java.lang.System.loadLibrary",
          "source": "Unknown Source"
        },
        {
          "method": "org.eclipse.swt.internal.Library.loadLibrary",
          "source": "Library.java:123"
        },
        {
          "method": "org.eclipse.swt.internal.win32.OS.\u003cclinit\u003e",
          "source": "OS.java:18"
        },
        {
          "method": "org.eclipse.swt.widgets.Display.\u003cclinit\u003e",
          "source": "Display.java:125"
        },
        {
          "method": "CComboTesting.run",
          "source": "CComboTesting.java:16"
        },
        {
          "method": "CComboTesting.main",
          "source": "CComboTesting.java:43"
        }
      ],
      "number": 0,
      "commentIndex": 0,
      "bugId": "120394",
      "duplicateId": "113240",
      "date": "2005-12-12T16:49:52+01:00",
      "product": "PDE",
      "component": "UI",
      "severity": "normal"
    }
  ],
  "groupId": "113240",
  "bugId": "120394",
  "duplicateId": "113240",
  "date": "2005-12-12T16:49:52+01:00",
  "product": "PDE",
  "component": "UI",
  "severity": "normal"
}