{
  "comments": [
    "0329 nightly Win32\nI hit save on my Java code, and received the following differing exceptions.\nThe first is from my window (stdout/stderr).  The second is fron the .log\n\njava.lang.ClassCastException: \norg.eclipse.jdt.internal.ui.javaeditor.Compilation\nUnitDocumentProvider$ProblemAnnotation\n        at \norg.eclipse.ui.texteditor.AbstractMarkerAnnotationModel.removeAnnotat\nions(AbstractMarkerAnnotationModel.java:317)\n        at \norg.eclipse.jdt.internal.ui.javaeditor.CompilationUnitDocumentProvide\nr$CompilationUnitMarkerAnnotationModel.beginReporting\n(CompilationUnitDocumentPro\nvider.java:190)\n        at \norg.eclipse.jdt.internal.ui.text.java.JavaReconcilingStrategy.reconci\nle(JavaReconcilingStrategy.java:64)\n        at \norg.eclipse.jdt.internal.ui.text.java.JavaReconcilingStrategy.reconci\nle(JavaReconcilingStrategy.java:88)\n        at org.eclipse.jface.text.reconciler.MonoReconciler.process\n(MonoReconcil\ner.java:66)\n        at \norg.eclipse.jface.text.reconciler.AbstractReconciler$BackgroundThread\n.run(AbstractReconciler.java:153)\nSave Failed\n\n-------------------------------------------------------------------------------\nLog: Sun Mar 31 10:23:35 EST 2002\n2 org.eclipse.ui 0 Save Failed\njava.lang.ClassCastException: \norg.eclipse.jdt.internal.ui.javaeditor.CompilationUnitDocumentProvider$ProblemA\nnnotation\n        at \norg.eclipse.ui.texteditor.AbstractMarkerAnnotationModel.removeAnnotations\n(AbstractMarkerAnnotationModel.java:317)\n        at \norg.eclipse.jdt.internal.ui.javaeditor.CompilationUnitDocumentProvider$Compilat\nionUnitMarkerAnnotationModel.beginReporting\n(CompilationUnitDocumentProvider.java:190)\n        at \norg.eclipse.jdt.internal.ui.javaeditor.CompilationUnitDocumentProvider.doSaveDo\ncument(CompilationUnitDocumentProvider.java:367)\n        at org.eclipse.ui.texteditor.AbstractDocumentProvider.saveDocument\n(AbstractDocumentProvider.java:361)\n        at org.eclipse.ui.texteditor.AbstractTextEditor$9.execute\n(AbstractTextEditor.java:1685)\n        at org.eclipse.ui.actions.WorkspaceModifyOperation$1.run\n(WorkspaceModifyOperation.java:64)\n        at org.eclipse.core.internal.resources.Workspace.run\n(Workspace.java:1343)\n        at org.eclipse.ui.actions.WorkspaceModifyOperation.run\n(WorkspaceModifyOperation.java:78)\n        at org.eclipse.ui.texteditor.AbstractTextEditor.performSaveOperation\n(AbstractTextEditor.java:1703)\n        at \norg.eclipse.jdt.internal.ui.javaeditor.CompilationUnitEditor.performSaveOperati\non(CompilationUnitEditor.java:569)\n        at org.eclipse.jdt.internal.ui.javaeditor.CompilationUnitEditor.doSave\n(CompilationUnitEditor.java:617)\n        at org.eclipse.ui.internal.EditorManager$9.run(EditorManager.java:811)\n        at org.eclipse.jface.operation.ModalContext.runInCurrentThread\n(ModalContext.java:296)\n        at org.eclipse.jface.operation.ModalContext.run(ModalContext.java:249)\n        at org.eclipse.jface.dialogs.ProgressMonitorDialog.run\n(ProgressMonitorDialog.java:335)\n        at org.eclipse.ui.internal.EditorManager.runProgressMonitorOperation\n(EditorManager.java:689)\n        at org.eclipse.ui.internal.EditorManager.saveEditor\n(EditorManager.java:816)\n        at org.eclipse.ui.internal.WorkbenchPage.saveEditor\n(WorkbenchPage.java:1481)\n        at org.eclipse.ui.internal.SaveAction.run(SaveAction.java:32)\n        at org.eclipse.jface.action.Action.runWithEvent(Action.java:590)\n        at \norg.eclipse.jface.action.ActionContributionItem.handleWidgetSelection\n(ActionContributionItem.java:407)\n        at org.eclipse.jface.action.ActionContributionItem.handleWidgetEvent\n(ActionContributionItem.java:361)\n        at org.eclipse.jface.action.ActionContributionItem.access$0\n(ActionContributionItem.java:352)\n        at \norg.eclipse.jface.action.ActionContributionItem$ActionListener.handleEvent\n(ActionContributionItem.java:47)\n        at org.eclipse.swt.widgets.EventTable.sendEvent(EventTable.java\n(Compiled Code))\n        at org.eclipse.swt.widgets.Widget.notifyListeners(Widget.java(Compiled \nCode))\n        at org.eclipse.swt.widgets.Display.runDeferredEvents(Display.java\n(Compiled Code))\n        at org.eclipse.swt.widgets.Display.readAndDispatch(Display.java:1208)\n        at org.eclipse.ui.internal.Workbench.runEventLoop(Workbench.java:755)\n        at org.eclipse.ui.internal.Workbench.run(Workbench.java:738)\n        at org.eclipse.core.internal.boot.InternalBootLoader.run\n(InternalBootLoader.java:777)\n        at org.eclipse.core.boot.BootLoader.run(BootLoader.java:319)\n        at java.lang.reflect.Method.invoke(Native Method)\n        at org.eclipse.core.launcher.Main.basicRun(Main.java:196)\n        at org.eclipse.core.launcher.Main.run(Main.java:555)\n        at org.eclipse.core.launcher.Main.main(Main.java:396)",
    "this is a nightly build problem. The latest code from jface.text is not merged \ninto eclipse.ui\nYou have to wait for the next intergration build. "
  ],
  "commentCreationDates": [
    "2002-03-31T16:23:56+02:00",
    "2002-04-01T12:59:19+02:00"
  ],
  "traces": [
    {
      "exceptionType": "java.lang.ClassCastException",
      "message": "org.eclipse.jdt.internal.ui.javaeditor.Compilation UnitDocumentProvider$ProblemAnnotation",
      "elements": [
        {
          "method": "org.eclipse.ui.texteditor.AbstractMarkerAnnotationModel.removeAnnotations",
          "source": "AbstractMarkerAnnotationModel.java:317"
        },
        {
          "method": "org.eclipse.jdt.internal.ui.javaeditor.CompilationUnitDocumentProvider$CompilationUnitMarkerAnnotationModel.beginReporting",
          "source": "CompilationUnitDocumentPro vider.java:190"
        },
        {
          "method": "org.eclipse.jdt.internal.ui.text.java.JavaReconcilingStrategy.reconcile",
          "source": "JavaReconcilingStrategy.java:64"
        },
        {
          "method": "org.eclipse.jdt.internal.ui.text.java.JavaReconcilingStrategy.reconcile",
          "source": "JavaReconcilingStrategy.java:88"
        },
        {
          "method": "org.eclipse.jface.text.reconciler.MonoReconciler.process",
          "source": "MonoReconcil er.java:66"
        },
        {
          "method": "org.eclipse.jface.text.reconciler.AbstractReconciler$BackgroundThread.run",
          "source": "AbstractReconciler.java:153"
        }
      ],
      "number": 0,
      "commentIndex": 0,
      "bugId": "12522",
      "date": "2002-03-31T16:23:56+02:00",
      "product": "JDT",
      "component": "UI",
      "severity": "normal"
    },
    {
      "exceptionType": "java.lang.ClassCastException",
      "message": "org.eclipse.jdt.internal.ui.javaeditor.CompilationUnitDocumentProvider$ProblemA nnotation",
      "elements": [
        {
          "method": "org.eclipse.ui.texteditor.AbstractMarkerAnnotationModel.removeAnnotations",
          "source": "AbstractMarkerAnnotationModel.java:317"
        },
        {
          "method": "org.eclipse.jdt.internal.ui.javaeditor.CompilationUnitDocumentProvider$CompilationUnitMarkerAnnotationModel.beginReporting",
          "source": "CompilationUnitDocumentProvider.java:190"
        },
        {
          "method": "org.eclipse.jdt.internal.ui.javaeditor.CompilationUnitDocumentProvider.doSaveDocument",
          "source": "CompilationUnitDocumentProvider.java:367"
        },
        {
          "method": "org.eclipse.ui.texteditor.AbstractDocumentProvider.saveDocument",
          "source": "AbstractDocumentProvider.java:361"
        },
        {
          "method": "org.eclipse.ui.texteditor.AbstractTextEditor$9.execute",
          "source": "AbstractTextEditor.java:1685"
        },
        {
          "method": "org.eclipse.ui.actions.WorkspaceModifyOperation$1.run",
          "source": "WorkspaceModifyOperation.java:64"
        },
        {
          "method": "org.eclipse.core.internal.resources.Workspace.run",
          "source": "Workspace.java:1343"
        },
        {
          "method": "org.eclipse.ui.actions.WorkspaceModifyOperation.run",
          "source": "WorkspaceModifyOperation.java:78"
        },
        {
          "method": "org.eclipse.ui.texteditor.AbstractTextEditor.performSaveOperation",
          "source": "AbstractTextEditor.java:1703"
        },
        {
          "method": "org.eclipse.jdt.internal.ui.javaeditor.CompilationUnitEditor.performSaveOperation",
          "source": "CompilationUnitEditor.java:569"
        },
        {
          "method": "org.eclipse.jdt.internal.ui.javaeditor.CompilationUnitEditor.doSave",
          "source": "CompilationUnitEditor.java:617"
        },
        {
          "method": "org.eclipse.ui.internal.EditorManager$9.run",
          "source": "EditorManager.java:811"
        },
        {
          "method": "org.eclipse.jface.operation.ModalContext.runInCurrentThread",
          "source": "ModalContext.java:296"
        },
        {
          "method": "org.eclipse.jface.operation.ModalContext.run",
          "source": "ModalContext.java:249"
        },
        {
          "method": "org.eclipse.jface.dialogs.ProgressMonitorDialog.run",
          "source": "ProgressMonitorDialog.java:335"
        },
        {
          "method": "org.eclipse.ui.internal.EditorManager.runProgressMonitorOperation",
          "source": "EditorManager.java:689"
        },
        {
          "method": "org.eclipse.ui.internal.EditorManager.saveEditor",
          "source": "EditorManager.java:816"
        },
        {
          "method": "org.eclipse.ui.internal.WorkbenchPage.saveEditor",
          "source": "WorkbenchPage.java:1481"
        },
        {
          "method": "org.eclipse.ui.internal.SaveAction.run",
          "source": "SaveAction.java:32"
        },
        {
          "method": "org.eclipse.jface.action.Action.runWithEvent",
          "source": "Action.java:590"
        },
        {
          "method": "org.eclipse.jface.action.ActionContributionItem.handleWidgetSelection",
          "source": "ActionContributionItem.java:407"
        },
        {
          "method": "org.eclipse.jface.action.ActionContributionItem.handleWidgetEvent",
          "source": "ActionContributionItem.java:361"
        },
        {
          "method": "org.eclipse.jface.action.ActionContributionItem.access$0",
          "source": "ActionContributionItem.java:352"
        },
        {
          "method": "org.eclipse.jface.action.ActionContributionItem$ActionListener.handleEvent",
          "source": "ActionContributionItem.java:47"
        },
        {
          "method": "org.eclipse.swt.widgets.EventTable.sendEvent",
          "source": "EventTable.java (Compiled Code)"
        },
        {
          "method": "org.eclipse.swt.widgets.Widget.notifyListeners",
          "source": "Widget.java(Compiled  Code)"
        },
        {
          "method": "org.eclipse.swt.widgets.Display.runDeferredEvents",
          "source": "Display.java (Compiled Code)"
        },
        {
          "method": "org.eclipse.swt.widgets.Display.readAndDispatch",
          "source": "Display.java:1208"
        },
        {
          "method": "org.eclipse.ui.internal.Workbench.runEventLoop",
          "source": "Workbench.java:755"
        },
        {
          "method": "org.eclipse.ui.internal.Workbench.run",
          "source": "Workbench.java:738"
        },
        {
          "method": "org.eclipse.core.internal.boot.InternalBootLoader.run",
          "source": "InternalBootLoader.java:777"
        },
        {
          "method": "org.eclipse.core.boot.BootLoader.run",
          "source": "BootLoader.java:319"
        },
        {
          "method": "java.lang.reflect.Method.invoke",
          "source": "Native Method"
        },
        {
          "method": "org.eclipse.core.launcher.Main.basicRun",
          "source": "Main.java:196"
        },
        {
          "method": "org.eclipse.core.launcher.Main.run",
          "source": "Main.java:555"
        },
        {
          "method": "org.eclipse.core.launcher.Main.main",
          "source": "Main.java:396"
        }
      ],
      "number": 1,
      "commentIndex": 0,
      "bugId": "12522",
      "date": "2002-03-31T16:23:56+02:00",
      "product": "JDT",
      "component": "UI",
      "severity": "normal"
    }
  ],
  "groupId": "12522",
  "bugId": "12522",
  "date": "2002-03-31T16:23:56+02:00",
  "product": "JDT",
  "component": "UI",
  "severity": "normal"
}