{
  "comments": [
    "I have created a cheatsheet which I want to run/open programmatically on an ActionEvent, but I get this error when I try to run my RCP application.\n\n[code]\n Missing required bundle org.eclipse.ui.cheatsheets_0.0.0.\n[/code]\n\nOSGi bundle \u0027org.eclipse.ui.cheatsheets\u0027 is setup as one of the dependencies in the MANIFEST.MF. Removing it from the dependencies and commenting out the relevant for invoking the cheatsheet makes the RCP application startup without any errors.",
    "is cheatsheets actually required?  Is it installed?  How did the requirement get there?  \n\nrun eclipse with -console and type ss.  See if cheatsheets is there.\n",
    "(In reply to comment #1)\n\u003e is cheatsheets actually required?  Is it installed?  How did the requirement\n\u003e get there?  \n\nYes cheatsheets are required. I have a requirement to provide the user with a User Assistance interface that can walk them thru bits of functionality, hence need for cheatsheet.\n\n\u003e run eclipse with -console and type ss.  See if cheatsheets is there.\n\nThe application fails to start up if I simply include (not invoke any cheatsheet code) the \u0027org.eclipse.ui.cheatsheets\u0027 bundle in \"Require-Bundle: \" section of the MANIFEST.MF, I don\u0027t even get to the OSGi prompt where I can issue the \u0027ss\u0027 command. \n\nThe Cheatsheets JAR is in the eclipse installation. Any other idea?\n\nIf there\u0027s more input required, I am happy to provide.\n\nBelow is the full trace of the error that I get:\n\n!SESSION 2006-01-27 16:11:31.203 -----------------------------------------------\neclipse.buildId\u003dunknown\njava.version\u003d1.5.0_06\njava.vendor\u003dSun Microsystems Inc.\nBootLoader constants: OS\u003dwin32, ARCH\u003dx86, WS\u003dwin32, NL\u003den_NZ\nFramework arguments:  -product com.effacy.rms.rcp.rms\nCommand-line arguments:  -product com.effacy.rms.rcp.rms -data D:\\dev\\workspaces\\tmp-data -dev file:D:/dev/workspaces/products/.metadata/.plugins/org.eclipse.pde.core/rcpmock.product/dev.properties -console -os win32 -ws win32 -arch x86\n\n!ENTRY org.eclipse.osgi 2 0 2006-01-27 16:11:33.203\n!MESSAGE One or more bundles are not resolved because the following root constraints are not resolved:\n!SUBENTRY 1 org.eclipse.osgi 2 0 2006-01-27 16:11:33.203\n!MESSAGE Bundle update@../../../../dev/workspaces/products/products.rms.prototype.mock.rcp/ was not resolved.\n!SUBENTRY 2 com.effacy.rms.rcp 2 0 2006-01-27 16:11:33.203\n!MESSAGE Missing required bundle org.eclipse.ui.cheatsheets_0.0.0.\n\n!ENTRY org.eclipse.osgi 2 0 2006-01-27 16:11:33.265\n!MESSAGE The following is a complete list of bundles which are not resolved, see the prior log entry for the root cause if it exists:\n!SUBENTRY 1 org.eclipse.osgi 2 0 2006-01-27 16:11:33.265\n!MESSAGE Bundle update@../../../../dev/workspaces/products/products.rms.prototype.mock.rcp/ [8] was not resolved.\n!SUBENTRY 2 com.effacy.rms.rcp 2 0 2006-01-27 16:11:33.265\n!MESSAGE Missing required bundle org.eclipse.ui.cheatsheets_0.0.0.\n\n!ENTRY org.eclipse.core.runtime 2006-01-27 16:11:33.281\n!MESSAGE Product com.effacy.rms.rcp.rms could not be found.\n\n!ENTRY org.eclipse.osgi 4 0 2006-01-27 16:11:33.312\n!MESSAGE Application error\n!STACK 1\njava.lang.RuntimeException: No application id has been found.\n\tat org.eclipse.core.internal.runtime.PlatformActivator$1.run(PlatformActivator.java:87)\n\tat org.eclipse.core.runtime.internal.adaptor.EclipseAppLauncher.runApplication(EclipseAppLauncher.java:92)\n\tat org.eclipse.core.runtime.internal.adaptor.EclipseAppLauncher.start(EclipseAppLauncher.java:68)\n\tat org.eclipse.core.runtime.adaptor.EclipseStarter.run(EclipseStarter.java:373)\n\tat org.eclipse.core.runtime.adaptor.EclipseStarter.run(EclipseStarter.java:168)\n\tat sun.reflect.NativeMethodAccessorImpl.invoke0(Native Method)\n\tat sun.reflect.NativeMethodAccessorImpl.invoke(Unknown Source)\n\tat sun.reflect.DelegatingMethodAccessorImpl.invoke(Unknown Source)\n\tat java.lang.reflect.Method.invoke(Unknown Source)\n\tat org.eclipse.core.launcher.Main.invokeFramework(Main.java:338)\n\tat org.eclipse.core.launcher.Main.basicRun(Main.java:282)\n\tat org.eclipse.core.launcher.Main.run(Main.java:977)\n\tat org.eclipse.core.launcher.Main.main(Main.java:952)\n\n!ENTRY org.eclipse.osgi 2 0 2006-01-27 16:11:33.312\n!MESSAGE One or more bundles are not resolved because the following root constraints are not resolved:\n!SUBENTRY 1 org.eclipse.osgi 2 0 2006-01-27 16:11:33.312\n!MESSAGE Bundle update@../../../../dev/workspaces/products/products.rms.prototype.mock.rcp/ was not resolved.\n!SUBENTRY 2 com.effacy.rms.rcp 2 0 2006-01-27 16:11:33.312\n!MESSAGE Missing required bundle org.eclipse.ui.cheatsheets_0.0.0.\n\n!ENTRY org.eclipse.osgi 2 0 2006-01-27 16:11:33.312\n!MESSAGE The following is a complete list of bundles which are not resolved, see the prior log entry for the root cause if it exists:\n!SUBENTRY 1 org.eclipse.osgi 2 0 2006-01-27 16:11:33.312\n!MESSAGE Bundle update@../../../../dev/workspaces/products/products.rms.prototype.mock.rcp/ [8] was not resolved.\n!SUBENTRY 2 com.effacy.rms.rcp 2 0 2006-01-27 16:11:33.312\n!MESSAGE Missing required bundle org.eclipse.ui.cheatsheets_0.0.0.",
    "Run with the following:\n\neclipse -console -noExit\n\nThis should prevent eclipse from exiting on error and allow you to perform the requested ss command:\n\nosgi\u003e ss\n\nAll logs indicate you are missing the cheatsheets plugin from you target.",
    "ok, I tried this. The cheatsheets bundle is indeed not showing up. But I do see the cheatsheet bundle dependency in the MANIFEST.MF. \n\nLooks like something is causing the bundle to be unresolved (not sure why?). ",
    "This works for me. Make sure that all the plug-ins required by the cheatsheet plugin are present when you are running the application.\nReopen with detailed steps on how to recreate if you still have a problem."
  ],
  "commentCreationDates": [
    "2006-01-26T21:36:02+01:00",
    "2006-01-27T02:45:08+01:00",
    "2006-01-27T03:23:23+01:00",
    "2006-01-27T13:54:21+01:00",
    "2006-01-27T20:15:22+01:00",
    "2006-03-21T21:11:35+01:00"
  ],
  "traces": [
    {
      "exceptionType": "java.lang.RuntimeException",
      "message": "No application id has been found.",
      "elements": [
        {
          "method": "org.eclipse.core.internal.runtime.PlatformActivator$1.run",
          "source": "PlatformActivator.java:87"
        },
        {
          "method": "org.eclipse.core.runtime.internal.adaptor.EclipseAppLauncher.runApplication",
          "source": "EclipseAppLauncher.java:92"
        },
        {
          "method": "org.eclipse.core.runtime.internal.adaptor.EclipseAppLauncher.start",
          "source": "EclipseAppLauncher.java:68"
        },
        {
          "method": "org.eclipse.core.runtime.adaptor.EclipseStarter.run",
          "source": "EclipseStarter.java:373"
        },
        {
          "method": "org.eclipse.core.runtime.adaptor.EclipseStarter.run",
          "source": "EclipseStarter.java:168"
        },
        {
          "method": "sun.reflect.NativeMethodAccessorImpl.invoke0",
          "source": "Native Method"
        },
        {
          "method": "sun.reflect.NativeMethodAccessorImpl.invoke",
          "source": "Unknown Source"
        },
        {
          "method": "sun.reflect.DelegatingMethodAccessorImpl.invoke",
          "source": "Unknown Source"
        },
        {
          "method": "java.lang.reflect.Method.invoke",
          "source": "Unknown Source"
        },
        {
          "method": "org.eclipse.core.launcher.Main.invokeFramework",
          "source": "Main.java:338"
        },
        {
          "method": "org.eclipse.core.launcher.Main.basicRun",
          "source": "Main.java:282"
        },
        {
          "method": "org.eclipse.core.launcher.Main.run",
          "source": "Main.java:977"
        },
        {
          "method": "org.eclipse.core.launcher.Main.main",
          "source": "Main.java:952"
        }
      ],
      "number": 0,
      "commentIndex": 2,
      "bugId": "125398",
      "date": "2006-01-27T03:23:23+01:00",
      "product": "Platform",
      "component": "Runtime",
      "severity": "blocker"
    }
  ],
  "groupId": "125398",
  "bugId": "125398",
  "date": "2006-01-26T21:36:02+01:00",
  "product": "Platform",
  "component": "Runtime",
  "severity": "blocker"
}