{
  "comments": [
    "I\u0027m trying to run Maven2 from inside Eclipse 3.1 using an External Tools launcher.   I have installed Maven2 to C:\\java\\maven-2.0.2, which means the executable is c:\\java\\maven-2.0.2\\bin\\mvn.bat.   I can successfully use the tool from outside Eclipse at the commandline, so the installation is sound.  The problem is, if I set up an External Tool launcher for this program, I get an error message when I try to run it:  \"Exception occurred executing command line.\"   There is no associated detail.   \n\nIf I rename the directory to \"C:\\java\\maven2\" and point the tool at \"C:\\java\\maven2\\bin\\mvn.bat\", everything works great.  \n\nThe following is in my .log file after the error:\n\n------------------------------------------------------\n!MESSAGE Exception occurred executing command line.\n\n!STACK 0\n\njava.io.IOException: CreateProcess: C:\\java\\maven-2.0.2\\bin\\mvn.bat clean install error\u003d0\n\n\tat java.lang.ProcessImpl.create(Native Method)\n\n\tat java.lang.ProcessImpl.\u003cinit\u003e(ProcessImpl.java:81)\n\n\tat java.lang.ProcessImpl.start(ProcessImpl.java:30)\n\n\tat java.lang.ProcessBuilder.start(ProcessBuilder.java:451)\n\n\tat java.lang.Runtime.exec(Runtime.java:591)\n\n\tat org.eclipse.debug.core.DebugPlugin.exec(DebugPlugin.java:746)\n\n\tat org.eclipse.ui.externaltools.internal.program.launchConfigurations.ProgramLaunchDelegate.launch(ProgramLaunchDelegate.java:152)\n\n\tat org.eclipse.debug.internal.core.LaunchConfiguration.launch(LaunchConfiguration.java:590)\n\n\tat org.eclipse.debug.internal.core.LaunchConfiguration.launch(LaunchConfiguration.java:515)\n\n\tat org.eclipse.debug.internal.ui.DebugUIPlugin.buildAndLaunch(DebugUIPlugin.java:733)\n\n\tat org.eclipse.debug.internal.ui.DebugUIPlugin$6.run(DebugUIPlugin.java:931)\n\n\tat org.eclipse.core.internal.jobs.Worker.run(Worker.java:76)",
    "Move to Platform/Debug",
    "Thank you for the bug report.\nIn the debug view, can you right click on the terminated and failed process associated with this launch, Properties\u003eCommand Line.\nCould you paste the details here please.",
    "I\u0027m afraid that I don\u0027t get an entry in the list of launches in the Debug perspective when this fails.  When it successfully executes (with the c:\\java\\maven2 path), I get:\n\nC:\\java\\maven2\\bin\\mvn.bat clean install\n\nin the command line properties.  ",
    "This works for me on 3.1.2 and 3.2.",
    "Well, I\u0027m not sure what\u0027s changed, but I\u0027m no longer able to reproduce this bug either.  I\u0027m now successfully launching Maven2 from c:\\java\\maven-2.0.2\\bin\\mvn.bat. \n\nFeel free to close this as WORKSFORME.",
    "Thanks for the update. Works for me."
  ],
  "commentCreationDates": [
    "2006-02-06T16:09:48+01:00",
    "2006-02-06T16:12:23+01:00",
    "2006-02-06T16:22:28+01:00",
    "2006-02-06T16:28:49+01:00",
    "2006-03-06T17:50:52+01:00",
    "2006-03-06T18:44:02+01:00",
    "2006-03-06T19:07:43+01:00"
  ],
  "traces": [
    {
      "exceptionType": "java.io.IOException",
      "message": "CreateProcess: C:\\java\\maven-2.0.2\\bin\\mvn.bat clean install error\u003d0",
      "elements": [
        {
          "method": "java.lang.ProcessImpl.create",
          "source": "Native Method"
        },
        {
          "method": "java.lang.ProcessImpl.\u003cinit\u003e",
          "source": "ProcessImpl.java:81"
        },
        {
          "method": "java.lang.ProcessImpl.start",
          "source": "ProcessImpl.java:30"
        },
        {
          "method": "java.lang.ProcessBuilder.start",
          "source": "ProcessBuilder.java:451"
        },
        {
          "method": "java.lang.Runtime.exec",
          "source": "Runtime.java:591"
        },
        {
          "method": "org.eclipse.debug.core.DebugPlugin.exec",
          "source": "DebugPlugin.java:746"
        },
        {
          "method": "org.eclipse.ui.externaltools.internal.program.launchConfigurations.ProgramLaunchDelegate.launch",
          "source": "ProgramLaunchDelegate.java:152"
        },
        {
          "method": "org.eclipse.debug.internal.core.LaunchConfiguration.launch",
          "source": "LaunchConfiguration.java:590"
        },
        {
          "method": "org.eclipse.debug.internal.core.LaunchConfiguration.launch",
          "source": "LaunchConfiguration.java:515"
        },
        {
          "method": "org.eclipse.debug.internal.ui.DebugUIPlugin.buildAndLaunch",
          "source": "DebugUIPlugin.java:733"
        },
        {
          "method": "org.eclipse.debug.internal.ui.DebugUIPlugin$6.run",
          "source": "DebugUIPlugin.java:931"
        },
        {
          "method": "org.eclipse.core.internal.jobs.Worker.run",
          "source": "Worker.java:76"
        }
      ],
      "number": 0,
      "commentIndex": 0,
      "bugId": "126591",
      "date": "2006-02-06T16:09:48+01:00",
      "product": "Platform",
      "component": "Debug",
      "severity": "normal"
    }
  ],
  "groupId": "126591",
  "bugId": "126591",
  "date": "2006-02-06T16:09:48+01:00",
  "product": "Platform",
  "component": "Debug",
  "severity": "normal"
}