{
  "comments": [
    "I20060213-1200\n\nWhenever I checkout anything from HEAD with the Model Sync View open with something in it, I get the following NPE:\n\n\n!ENTRY org.eclipse.team.core 4 2 2006-02-13 17:17:42.953\n!MESSAGE Problems occurred when invoking code from plug-in: \"org.eclipse.team.co\nre\".\n!STACK 0\njava.lang.NullPointerException\n        at org.eclipse.team.internal.ui.mapping.ResourceModelScopeParticipant.co\nllectMappings(ResourceModelScopeParticipant.java:94)\n        at org.eclipse.team.internal.ui.mapping.ResourceModelScopeParticipant.ha\nndleContextChange(ResourceModelScopeParticipant.java:77)\n        at org.eclipse.team.core.subscribers.SubscriberScopeManager$3.run(Subscr\niberScopeManager.java:158)\n        at org.eclipse.core.runtime.SafeRunner.run(SafeRunner.java:37)\n        at org.eclipse.team.core.subscribers.SubscriberScopeManager.fireChange(S\nubscriberScopeManager.java:156)\n        at org.eclipse.team.core.subscribers.SubscriberScopeManager.subscriberRe\nsourceChanged(SubscriberScopeManager.java:148)\n        at org.eclipse.team.core.subscribers.Subscriber$1.run(Subscriber.java:28\n3)\n        at org.eclipse.core.runtime.SafeRunner.run(SafeRunner.java:37)\n        at org.eclipse.team.core.subscribers.Subscriber.fireTeamResourceChange(S\nubscriber.java:277)\n        at org.eclipse.team.internal.ccvs.core.CVSWorkspaceSubscriber.projectCon\nfigured(CVSWorkspaceSubscriber.java:126)\n        at org.eclipse.team.internal.ccvs.core.util.ResourceStateChangeListeners\n$4.notify(ResourceStateChangeListeners.java:129)\n        at org.eclipse.team.internal.ccvs.core.util.ResourceStateChangeListeners\n$Notification.run(ResourceStateChangeListeners.java:54)\n        at org.eclipse.core.runtime.SafeRunner.run(SafeRunner.java:37)\n        at org.eclipse.core.runtime.Platform.run(Platform.java:816)\n        at org.eclipse.team.internal.ccvs.core.util.ResourceStateChangeListeners\n$Notification.run(ResourceStateChangeListeners.java:51)\n        at org.eclipse.team.internal.ccvs.core.util.ResourceStateChangeListeners\n.fireNotification(ResourceStateChangeListeners.java:75)\n        at org.eclipse.team.internal.ccvs.core.util.ResourceStateChangeListeners\n.projectConfigured(ResourceStateChangeListeners.java:127)\n        at org.eclipse.team.internal.ccvs.core.CVSTeamProvider.configureProject(\nCVSTeamProvider.java:237)\n        at org.eclipse.team.core.RepositoryProvider.configure(RepositoryProvider\n.java:335)\n        at org.eclipse.team.core.RepositoryProvider.map(RepositoryProvider.java:\n130)\n        at org.eclipse.team.internal.ccvs.ui.operations.CheckoutProjectOperation\n.refreshProjects(CheckoutProjectOperation.java:473)\n        at org.eclipse.team.internal.ccvs.ui.operations.CheckoutProjectOperation\n.performCheckout(CheckoutProjectOperation.java:269)\n        at org.eclipse.team.internal.ccvs.ui.operations.CheckoutProjectOperation\n$1.run(CheckoutProjectOperation.java:166)\n        at org.eclipse.team.internal.ccvs.core.resources.EclipseSynchronizer.run\n(EclipseSynchronizer.java:1450)\n        at org.eclipse.team.internal.ccvs.ui.operations.CheckoutProjectOperation\n.checkout(CheckoutProjectOperation.java:164)\n        at org.eclipse.team.internal.ccvs.ui.operations.CheckoutMultipleProjects\nOperation.checkout(CheckoutMultipleProjectsOperation.java:50)\n        at org.eclipse.team.internal.ccvs.ui.operations.CheckoutOperation.checko\nut(CheckoutOperation.java:47)\n        at org.eclipse.team.internal.ccvs.ui.operations.CheckoutOperation.execut\ne(CheckoutOperation.java:32)\n        at org.eclipse.team.internal.ccvs.ui.operations.CVSOperation.run(CVSOper\nation.java:79)\n        at org.eclipse.team.internal.ui.actions.JobRunnableContext.run(JobRunnab\nleContext.java:144)\n        at org.eclipse.team.internal.ui.actions.JobRunnableContext$ResourceJob.r\nunInWorkspace(JobRunnableContext.java:72)\n        at org.eclipse.core.internal.resources.InternalWorkspaceJob.run(Internal\nWorkspaceJob.java:38)\n        at org.eclipse.core.internal.jobs.Worker.run(Worker.java:58)",
    "Fixed"
  ],
  "commentCreationDates": [
    "2006-02-13T22:17:32+01:00",
    "2006-02-14T15:53:10+01:00"
  ],
  "traces": [
    {
      "exceptionType": "java.lang.NullPointerException",
      "elements": [
        {
          "method": "org.eclipse.team.internal.ui.mapping.ResourceModelScopeParticipant.collectMappings",
          "source": "ResourceModelScopeParticipant.java:94"
        },
        {
          "method": "org.eclipse.team.internal.ui.mapping.ResourceModelScopeParticipant.handleContextChange",
          "source": "ResourceModelScopeParticipant.java:77"
        },
        {
          "method": "org.eclipse.team.core.subscribers.SubscriberScopeManager$3.run",
          "source": "Subscr iberScopeManager.java:158"
        },
        {
          "method": "org.eclipse.core.runtime.SafeRunner.run",
          "source": "SafeRunner.java:37"
        },
        {
          "method": "org.eclipse.team.core.subscribers.SubscriberScopeManager.fireChange",
          "source": "S ubscriberScopeManager.java:156"
        },
        {
          "method": "org.eclipse.team.core.subscribers.SubscriberScopeManager.subscriberResourceChanged",
          "source": "SubscriberScopeManager.java:148"
        },
        {
          "method": "org.eclipse.team.core.subscribers.Subscriber$1.run",
          "source": "Subscriber.java:28 3"
        },
        {
          "method": "org.eclipse.core.runtime.SafeRunner.run",
          "source": "SafeRunner.java:37"
        },
        {
          "method": "org.eclipse.team.core.subscribers.Subscriber.fireTeamResourceChange",
          "source": "S ubscriber.java:277"
        },
        {
          "method": "org.eclipse.team.internal.ccvs.core.CVSWorkspaceSubscriber.projectConfigured",
          "source": "CVSWorkspaceSubscriber.java:126"
        },
        {
          "method": "org.eclipse.team.internal.ccvs.core.util.ResourceStateChangeListeners$4.notify",
          "source": "ResourceStateChangeListeners.java:129"
        },
        {
          "method": "org.eclipse.team.internal.ccvs.core.util.ResourceStateChangeListeners$Notification.run",
          "source": "ResourceStateChangeListeners.java:54"
        },
        {
          "method": "org.eclipse.core.runtime.SafeRunner.run",
          "source": "SafeRunner.java:37"
        },
        {
          "method": "org.eclipse.core.runtime.Platform.run",
          "source": "Platform.java:816"
        },
        {
          "method": "org.eclipse.team.internal.ccvs.core.util.ResourceStateChangeListeners$Notification.run",
          "source": "ResourceStateChangeListeners.java:51"
        },
        {
          "method": "org.eclipse.team.internal.ccvs.core.util.ResourceStateChangeListeners.fireNotification",
          "source": "ResourceStateChangeListeners.java:75"
        },
        {
          "method": "org.eclipse.team.internal.ccvs.core.util.ResourceStateChangeListeners.projectConfigured",
          "source": "ResourceStateChangeListeners.java:127"
        },
        {
          "method": "org.eclipse.team.internal.ccvs.core.CVSTeamProvider.configureProject",
          "source": " CVSTeamProvider.java:237"
        },
        {
          "method": "org.eclipse.team.core.RepositoryProvider.configure",
          "source": "RepositoryProvider .java:335"
        },
        {
          "method": "org.eclipse.team.core.RepositoryProvider.map",
          "source": "RepositoryProvider.java: 130"
        },
        {
          "method": "org.eclipse.team.internal.ccvs.ui.operations.CheckoutProjectOperation.refreshProjects",
          "source": "CheckoutProjectOperation.java:473"
        },
        {
          "method": "org.eclipse.team.internal.ccvs.ui.operations.CheckoutProjectOperation.performCheckout",
          "source": "CheckoutProjectOperation.java:269"
        },
        {
          "method": "org.eclipse.team.internal.ccvs.ui.operations.CheckoutProjectOperation$1.run",
          "source": "CheckoutProjectOperation.java:166"
        },
        {
          "method": "org.eclipse.team.internal.ccvs.core.resources.EclipseSynchronizer.run",
          "source": "EclipseSynchronizer.java:1450"
        },
        {
          "method": "org.eclipse.team.internal.ccvs.ui.operations.CheckoutProjectOperation.checkout",
          "source": "CheckoutProjectOperation.java:164"
        },
        {
          "method": "org.eclipse.team.internal.ccvs.ui.operations.CheckoutMultipleProjectsOperation.checkout",
          "source": "CheckoutMultipleProjectsOperation.java:50"
        },
        {
          "method": "org.eclipse.team.internal.ccvs.ui.operations.CheckoutOperation.checkout",
          "source": "CheckoutOperation.java:47"
        },
        {
          "method": "org.eclipse.team.internal.ccvs.ui.operations.CheckoutOperation.execute",
          "source": "CheckoutOperation.java:32"
        },
        {
          "method": "org.eclipse.team.internal.ccvs.ui.operations.CVSOperation.run",
          "source": "CVSOper ation.java:79"
        },
        {
          "method": "org.eclipse.team.internal.ui.actions.JobRunnableContext.run",
          "source": "JobRunnab leContext.java:144"
        },
        {
          "method": "org.eclipse.team.internal.ui.actions.JobRunnableContext$ResourceJob.runInWorkspace",
          "source": "JobRunnableContext.java:72"
        },
        {
          "method": "org.eclipse.core.internal.resources.InternalWorkspaceJob.run",
          "source": "Internal WorkspaceJob.java:38"
        },
        {
          "method": "org.eclipse.core.internal.jobs.Worker.run",
          "source": "Worker.java:58"
        }
      ],
      "number": 0,
      "commentIndex": 0,
      "bugId": "127579",
      "date": "2006-02-13T22:17:32+01:00",
      "product": "Platform",
      "component": "Team",
      "severity": "normal"
    }
  ],
  "groupId": "127579",
  "bugId": "127579",
  "date": "2006-02-13T22:17:32+01:00",
  "product": "Platform",
  "component": "Team",
  "severity": "normal"
}