{
  "comments": [
    "Nomatter if downloaded or compiled (using: USE\u003d\"-gnome gtk\" emerge eclipse-sdk\")\nEclipse-sdk does not start at all. The splash appears and thats it. The next \nmessage tell you to look in the ~/workspace/.metadata/.log which tells you this:\n\n!SESSION 2006-02-17 23:14:50.490 -----------------------------------------------\neclipse.buildId\u003dGentoo Linux eclipse-sdk-3.1.1\njava.version\u003d1.4.2-03\njava.vendor\u003dBlackdown Java-Linux Team\nBootLoader constants: OS\u003dlinux, ARCH\u003dx86, WS\u003dgtk, NL\u003den_US\nCommand-line arguments:  -os linux -ws gtk -arch x86\n\n!ENTRY org.eclipse.osgi 2006-02-17 23:14:52.42\n!MESSAGE Application error\n!STACK 1\njava.lang.UnsatisfiedLinkError: /homes/anardil/.eclipse/org.eclipse.platform_3.1.1/configuration/org.\neclipse.osgi/bundles/79/1/.cp/libswt-pi-gtk-3139.so: /homes/anardil/.eclipse/org.eclipse.platform_3.1\n.1/configuration/org.eclipse.osgi/bundles/79/1/.cp/libswt-pi-gtk-3139.so: failed to map segment from\nshared object: Operation not permitted\n        at java.lang.ClassLoader$NativeLibrary.load(Native Method)\n        at java.lang.ClassLoader.loadLibrary0(ClassLoader.java:1586)\n        at java.lang.ClassLoader.loadLibrary(ClassLoader.java:1495)\n        at java.lang.Runtime.loadLibrary0(Runtime.java:788)\n        at java.lang.System.loadLibrary(System.java:834)\n        at org.eclipse.swt.internal.Library.loadLibrary(Library.java:123)\n        at org.eclipse.swt.internal.gtk.OS.\u003cclinit\u003e(OS.java:19)\n        at org.eclipse.swt.internal.Converter.wcsToMbcs(Converter.java:63)\n        at org.eclipse.swt.internal.Converter.wcsToMbcs(Converter.java:54)\n        at org.eclipse.swt.widgets.Display.\u003cclinit\u003e(Display.java:122)\n        at org.eclipse.ui.internal.Workbench.createDisplay(Workbench.java:381)\n        at org.eclipse.ui.PlatformUI.createDisplay(PlatformUI.java:155)\n        at org.eclipse.ui.internal.ide.IDEApplication.createDisplay(IDEApplication.java:128)\n        at org.eclipse.ui.internal.ide.IDEApplication.run(IDEApplication.java:79)\n        at org.eclipse.core.internal.runtime.PlatformActivator$1.run(PlatformActivator.java:226)\n        at org.eclipse.core.runtime.adaptor.EclipseStarter.run(EclipseStarter.java:376)\n        at org.eclipse.core.runtime.adaptor.EclipseStarter.run(EclipseStarter.java:163)\n        at sun.reflect.NativeMethodAccessorImpl.invoke0(Native Method)\n        at sun.reflect.NativeMethodAccessorImpl.invoke(NativeMethodAccessorImpl.java:39)\n        at sun.reflect.DelegatingMethodAccessorImpl.invoke(DelegatingMethodAccessorImpl.java:25)\n        at java.lang.reflect.Method.invoke(Method.java:324)\n        at org.eclipse.core.launcher.Main.invokeFramework(Main.java:334)\n        at org.eclipse.core.launcher.Main.basicRun(Main.java:278)\n        at org.eclipse.core.launcher.Main.run(Main.java:973)\n        at org.eclipse.core.launcher.Main.main(Main.java:948)\n\nWhere could be the problem?\nSorry if bothering you but there is no solution to this available neither in the \ngentoo-forums nor here in another bug-report.\n\nIf anything else is needed please let me know.",
    "Is your home directory mounted noexec?\n\nEclipse has extracted a shared library into your home directory and is trying to load it.",
    "Yes it was :-) (Not verified yet, because a revdep-rebuild for gnome is currently running ;-))\nCould this also be the problem when using the emerged version of eclipse, \nas this version also \"installs\"/copies swt-libs to the users home-dir?\n\nBTW: you know a way to only mount the homes exec for dedicated users?",
    "Solved the problem!\nIt now runs as smoothly as intended to.\n\nthx a lot",
    "But has got nothing to to with eclipse."
  ],
  "commentCreationDates": [
    "2006-02-17T22:21:47+01:00",
    "2006-02-18T05:16:12+01:00",
    "2006-02-18T12:47:21+01:00",
    "2006-02-18T14:46:31+01:00",
    "2006-02-18T14:47:37+01:00"
  ],
  "traces": [
    {
      "exceptionType": "java.lang.UnsatisfiedLinkError",
      "message": "/homes/anardil/.eclipse/org.eclipse.platform_3.1.1/configuration/org. eclipse.osgi/bundles/79/1/.cp/libswt-pi-gtk-3139.so: /homes/anardil/.eclipse/org.eclipse.platform_3.1 .1/configuration/org.eclipse.osgi/bundles/79/1/.cp/libswt-pi-gtk-3139.so: failed to map segment from shared object: Operation not permitted",
      "elements": [
        {
          "method": "java.lang.ClassLoader$NativeLibrary.load",
          "source": "Native Method"
        },
        {
          "method": "java.lang.ClassLoader.loadLibrary0",
          "source": "ClassLoader.java:1586"
        },
        {
          "method": "java.lang.ClassLoader.loadLibrary",
          "source": "ClassLoader.java:1495"
        },
        {
          "method": "java.lang.Runtime.loadLibrary0",
          "source": "Runtime.java:788"
        },
        {
          "method": "java.lang.System.loadLibrary",
          "source": "System.java:834"
        },
        {
          "method": "org.eclipse.swt.internal.Library.loadLibrary",
          "source": "Library.java:123"
        },
        {
          "method": "org.eclipse.swt.internal.gtk.OS.\u003cclinit\u003e",
          "source": "OS.java:19"
        },
        {
          "method": "org.eclipse.swt.internal.Converter.wcsToMbcs",
          "source": "Converter.java:63"
        },
        {
          "method": "org.eclipse.swt.internal.Converter.wcsToMbcs",
          "source": "Converter.java:54"
        },
        {
          "method": "org.eclipse.swt.widgets.Display.\u003cclinit\u003e",
          "source": "Display.java:122"
        },
        {
          "method": "org.eclipse.ui.internal.Workbench.createDisplay",
          "source": "Workbench.java:381"
        },
        {
          "method": "org.eclipse.ui.PlatformUI.createDisplay",
          "source": "PlatformUI.java:155"
        },
        {
          "method": "org.eclipse.ui.internal.ide.IDEApplication.createDisplay",
          "source": "IDEApplication.java:128"
        },
        {
          "method": "org.eclipse.ui.internal.ide.IDEApplication.run",
          "source": "IDEApplication.java:79"
        },
        {
          "method": "org.eclipse.core.internal.runtime.PlatformActivator$1.run",
          "source": "PlatformActivator.java:226"
        },
        {
          "method": "org.eclipse.core.runtime.adaptor.EclipseStarter.run",
          "source": "EclipseStarter.java:376"
        },
        {
          "method": "org.eclipse.core.runtime.adaptor.EclipseStarter.run",
          "source": "EclipseStarter.java:163"
        },
        {
          "method": "sun.reflect.NativeMethodAccessorImpl.invoke0",
          "source": "Native Method"
        },
        {
          "method": "sun.reflect.NativeMethodAccessorImpl.invoke",
          "source": "NativeMethodAccessorImpl.java:39"
        },
        {
          "method": "sun.reflect.DelegatingMethodAccessorImpl.invoke",
          "source": "DelegatingMethodAccessorImpl.java:25"
        },
        {
          "method": "java.lang.reflect.Method.invoke",
          "source": "Method.java:324"
        },
        {
          "method": "org.eclipse.core.launcher.Main.invokeFramework",
          "source": "Main.java:334"
        },
        {
          "method": "org.eclipse.core.launcher.Main.basicRun",
          "source": "Main.java:278"
        },
        {
          "method": "org.eclipse.core.launcher.Main.run",
          "source": "Main.java:973"
        },
        {
          "method": "org.eclipse.core.launcher.Main.main",
          "source": "Main.java:948"
        }
      ],
      "number": 0,
      "commentIndex": 0,
      "bugId": "128485",
      "date": "2006-02-17T22:21:47+01:00",
      "product": "Platform",
      "component": "SWT",
      "severity": "normal"
    }
  ],
  "groupId": "128485",
  "bugId": "128485",
  "date": "2006-02-17T22:21:47+01:00",
  "product": "Platform",
  "component": "SWT",
  "severity": "normal"
}