{
  "comments": [
    "I\u0027m working on an eclipse 3.1 RCP based debugger application.  I\u0027m having problems getting the updates to work correctly.  I\u0027m running into an \"ArrayStoreExcpetion\" right near the end of the update (it looks like almost all the features and plug-ins got layed down).  The following error was written out to the .log:\n\n!SESSION 2006-02-23 22:30:45.688 -----------------------------------------------\neclipse.buildId\u003dI20050527-1300\njava.fullversion\u003dJ2RE 1.4.2 IBM Windows 32 build cn142-20050609 (JIT enabled: jitc)\nBootLoader constants: OS\u003dwin32, ARCH\u003dx86, WS\u003dwin32, NL\u003den_CA\nCommand-line arguments:  -os win32 -ws win32 -arch x86\n\n!ENTRY org.eclipse.update.ui 4 0 2006-02-23 22:52:34.844\n!MESSAGE java.lang.ArrayStoreException\n!STACK 0\njava.lang.ArrayStoreException\n        at java.lang.System.arraycopy(Native Method)\n        at java.util.ArrayList.toArray(ArrayList.java(Compiled Code))\n        at org.eclipse.update.core.Feature.getRawIncludedFeatureReferences(Feature.java:631)\n        at org.eclipse.update.core.Feature.getIncludedFeatureReferences(Feature.java:1039)\n        at org.eclipse.update.internal.core.ConfiguredSite.configure(ConfiguredSite.java:247)\n        at org.eclipse.update.internal.core.ConfiguredSite.configure(ConfiguredSite.java:255)\n        at org.eclipse.update.internal.core.ConfiguredSite.install(ConfiguredSite.java:157)\n        at org.eclipse.update.internal.operations.InstallOperation.execute(InstallOperation.java:74)\n        at org.eclipse.update.internal.operations.BatchInstallOperation.execute(BatchInstallOperation.java:84)\n        at org.eclipse.update.internal.ui.wizards.InstallWizard2.install(InstallWizard2.java:373)\n        at org.eclipse.update.internal.ui.wizards.InstallWizard2.access$1(InstallWizard2.java:370)\n        at org.eclipse.update.internal.ui.wizards.InstallWizard2$2.run(InstallWizard2.java:465)\n        at org.eclipse.jface.operation.ModalContext$ModalContextThread.run(ModalContext.java:113)\n\nThis seems to be similar to https://bugs.eclipse.org/bugs/show_bug.cgi?id\u003d115359  Unfortunately the RCP application I\u0027m trying to update is not on 3.1.2, so I can\u0027t get the fix.  I\u0027m kind of stumped.  I was hoping that you could give me a couple of suggestions on how I can proceed.",
    "does this also happen to you with 3.2 m6?",
    "I haven\u0027t tested this on 3.2. Actually, this was an emergency 2 months ago. I was putting out an iFix for an IBM product who\u0027s installation failed because of bugs in the update manager on 3.1.0. I was more or less looking for support, not necessarily a bug fix. Anyway, I was able to figure out a work around on my own. You can close the defect if you can not reproduce on 3.2.",
    "\n\n*** This bug has been marked as a duplicate of 115359 ***"
  ],
  "commentCreationDates": [
    "2006-02-24T17:19:09+01:00",
    "2006-04-11T17:31:57+02:00",
    "2006-04-11T17:45:02+02:00",
    "2006-04-25T05:40:26+02:00"
  ],
  "traces": [
    {
      "exceptionType": "java.lang.ArrayStoreException",
      "elements": [
        {
          "method": "java.lang.System.arraycopy",
          "source": "Native Method"
        },
        {
          "method": "java.util.ArrayList.toArray",
          "source": "ArrayList.java(Compiled Code)"
        },
        {
          "method": "org.eclipse.update.core.Feature.getRawIncludedFeatureReferences",
          "source": "Feature.java:631"
        },
        {
          "method": "org.eclipse.update.core.Feature.getIncludedFeatureReferences",
          "source": "Feature.java:1039"
        },
        {
          "method": "org.eclipse.update.internal.core.ConfiguredSite.configure",
          "source": "ConfiguredSite.java:247"
        },
        {
          "method": "org.eclipse.update.internal.core.ConfiguredSite.configure",
          "source": "ConfiguredSite.java:255"
        },
        {
          "method": "org.eclipse.update.internal.core.ConfiguredSite.install",
          "source": "ConfiguredSite.java:157"
        },
        {
          "method": "org.eclipse.update.internal.operations.InstallOperation.execute",
          "source": "InstallOperation.java:74"
        },
        {
          "method": "org.eclipse.update.internal.operations.BatchInstallOperation.execute",
          "source": "BatchInstallOperation.java:84"
        },
        {
          "method": "org.eclipse.update.internal.ui.wizards.InstallWizard2.install",
          "source": "InstallWizard2.java:373"
        },
        {
          "method": "org.eclipse.update.internal.ui.wizards.InstallWizard2.access$1",
          "source": "InstallWizard2.java:370"
        },
        {
          "method": "org.eclipse.update.internal.ui.wizards.InstallWizard2$2.run",
          "source": "InstallWizard2.java:465"
        },
        {
          "method": "org.eclipse.jface.operation.ModalContext$ModalContextThread.run",
          "source": "ModalContext.java:113"
        }
      ],
      "number": 0,
      "commentIndex": 0,
      "bugId": "129372",
      "duplicateId": "115359",
      "date": "2006-02-24T17:19:09+01:00",
      "product": "Platform",
      "component": "Update",
      "severity": "blocker"
    }
  ],
  "groupId": "115359",
  "bugId": "129372",
  "duplicateId": "115359",
  "date": "2006-02-24T17:19:09+01:00",
  "product": "Platform",
  "component": "Update",
  "severity": "blocker"
}