{
  "comments": [
    "After using the update manager to go from 0.4.8-\u003e0.4.9 my Mylar install seemed to get into a knot and not start at all.\n\nI couldn\u0027t see the Mylar preferences stuff, and in the \"Manage Configuration\" there appeared to be red X\u0027s saying quite a few of the plugins couldn\u0027t start because the JIRA dashboard plugn wasn\u0027t there.\n\nI deleted all the mylar plugin folders, and removed what appeared to be a half-installed version of the JIRA dashboard plugin, and tried to reinstalled.  Same thing happened.\n\nNoticed this error in the .metadata/.log file:\n\n!ENTRY org.eclipse.osgi 4 0 2006-02-27 08:51:32.318\n!MESSAGE While loading class \"org.tigris.subversion.subclipse.ui.console.ConsoleDocument$ConsoleLine\", thread \"main\" timed out waiting (5000ms) for thread \"Worker-2\" to finish starting bundle \"org.tigris.subversion.subclipse.ui\". To avoid deadlock, thread \"main\" is proceeding but \"org.tigris.subversion.subclipse.ui.console.ConsoleDocument$ConsoleLine\" may not be fully initialized.\n!STACK 0\njava.lang.Exception: Generated exception.\n        at org.eclipse.core.runtime.internal.adaptor.EclipseLazyStarter.preFindLocalClass(EclipseLazyStarter.java:75)\n        at org.eclipse.osgi.baseadaptor.loader.ClasspathManager.findLocalClass(ClasspathManager.java:402)\n        at org.eclipse.osgi.internal.baseadaptor.DefaultClassLoader.findLocalClass(DefaultClassLoader.java:186)\n        at org.eclipse.osgi.framework.internal.core.BundleLoader.findLocalClass(BundleLoader.java:338)\n        at org.eclipse.osgi.framework.internal.core.BundleLoader.findClass(BundleLoader.java:390)\n        at org.eclipse.osgi.framework.internal.core.BundleLoader.findClass(BundleLoader.java:351)\n        at org.eclipse.osgi.internal.baseadaptor.DefaultClassLoader.loadClass(DefaultClassLoader.java:81)\n        at java.lang.ClassLoader.loadClass(ClassLoader.java:251)\n        at java.lang.ClassLoader.loadClassInternal(ClassLoader.java:319)\n        at org.tigris.subversion.subclipse.ui.console.ConsoleDocument.getLines(ConsoleDocument.java:79)\n        at org.tigris.subversion.subclipse.ui.console.SVNOutputConsole.dump(SVNOutputConsole.java:202)\n        at org.tigris.subversion.subclipse.ui.console.SVNOutputConsole.access$1(SVNOutputConsole.java:199)\n        at org.tigris.subversion.subclipse.ui.console.SVNOutputConsole$1.run(SVNOutputConsole.java:124)\n        at org.eclipse.swt.widgets.RunnableLock.run(RunnableLock.java:35)\n        at org.eclipse.swt.widgets.Synchronizer.runAsyncMessages(Synchronizer.java:123)\n        at org.eclipse.swt.widgets.Display.runAsyncMessages(Display.java:3128)\n        at org.eclipse.swt.widgets.Display.readAndDispatch(Display.java:2892)\n        at org.eclipse.ui.internal.Workbench.runEventLoop(Workbench.java:1899)\n        at org.eclipse.ui.internal.Workbench.runUI(Workbench.java:1863)\n        at org.eclipse.ui.internal.Workbench.createAndRunWorkbench(Workbench.java:417)\n        at org.eclipse.ui.PlatformUI.createAndRunWorkbench(PlatformUI.java:143)\n        at org.eclipse.ui.internal.ide.IDEApplication.run(IDEApplication.java:106)\n        at org.eclipse.core.internal.runtime.PlatformActivator$1.run(PlatformActivator.java:99)\n        at org.eclipse.core.runtime.internal.adaptor.EclipseAppLauncher.runApplication(EclipseAppLauncher.java:92)\n        at org.eclipse.core.runtime.internal.adaptor.EclipseAppLauncher.start(EclipseAppLauncher.java:68)\n        at org.eclipse.core.runtime.adaptor.EclipseStarter.run(EclipseStarter.java:374)\n        at org.eclipse.core.runtime.adaptor.EclipseStarter.run(EclipseStarter.java:169)\n        at sun.reflect.NativeMethodAccessorImpl.invoke0(Native Method)\n        at sun.reflect.NativeMethodAccessorImpl.invoke(NativeMethodAccessorImpl.java:39)\n        at sun.reflect.DelegatingMethodAccessorImpl.invoke(DelegatingMethodAccessorImpl.java:25)\n        at java.lang.reflect.Method.invoke(Method.java:585)\n        at org.eclipse.core.launcher.Main.invokeFramework(Main.java:338)\n        at org.eclipse.core.launcher.Main.basicRun(Main.java:282)\n        at org.eclipse.core.launcher.Main.run(Main.java:977)\n        at org.eclipse.core.launcher.Main.main(Main.java:952)\n\n\nI have the Subclipse plugin as well, which I need (as I work on Apache projects).\n\nBummer, was really looking forward to trying out teh JIRA stuff.\n\nLet me know if I can grab any more info or try anything else out.",
    "Paul: I use Mylar with Subclipse too, and there shouldn\u0027t be a problem so we need to figure out what\u0027s going wrong here.  Let\u0027s assume for the time being that it\u0027s not Mac related.  Unfortunately that log trace isn\u0027t saying much, so please try the following: \n- clear your .metadata/.log file\n- uninstall all versions of Mylar (see http://www.eclipse.org/mylar/doc/faq.php#install-failure)\n- install Mylar 0.4.9 including the JIRA support, and make sure that there are no errors reported in the install process\n- if there are any problems installing this time around please attach the entire .log file\n\nAlso ensure that you are using Eclipse 3.1.x or 3.2M5 (no other 3.2 version will work).  Let me know how it goes.",
    "Ok, removed all non-eclipse plugins (on M5), then installed the JIRA dashboard plugin first, then mylar 0.4.9, then subclipse, and now sanity appears to be restored.\n\nOdd, but happy.  Of course i\u0027m having a touch of bother with our JIRA service with 0.4.9 but I think that\u0027s because the certificate on the jira server is invalid(i\u0027ll fix that and see if that clears it up).\n\nDo you wanna mark this as invalid?\n\nThanks,\n\nPaul",
    "Good to hear.  Let me know if there\u0027s anything that could be made more clear in the FAQ in case your problem is experienced by others.",
    "Changing OS from Mac OS to Mac OS X as per bug 185991"
  ],
  "commentCreationDates": [
    "2006-02-26T21:56:05+01:00",
    "2006-02-27T17:34:13+01:00",
    "2006-02-27T19:51:09+01:00",
    "2006-02-28T01:21:57+01:00",
    "2007-07-29T15:19:08+02:00"
  ],
  "traces": [
    {
      "exceptionType": "java.lang.Exception",
      "message": "Generated exception.",
      "elements": [
        {
          "method": "org.eclipse.core.runtime.internal.adaptor.EclipseLazyStarter.preFindLocalClass",
          "source": "EclipseLazyStarter.java:75"
        },
        {
          "method": "org.eclipse.osgi.baseadaptor.loader.ClasspathManager.findLocalClass",
          "source": "ClasspathManager.java:402"
        },
        {
          "method": "org.eclipse.osgi.internal.baseadaptor.DefaultClassLoader.findLocalClass",
          "source": "DefaultClassLoader.java:186"
        },
        {
          "method": "org.eclipse.osgi.framework.internal.core.BundleLoader.findLocalClass",
          "source": "BundleLoader.java:338"
        },
        {
          "method": "org.eclipse.osgi.framework.internal.core.BundleLoader.findClass",
          "source": "BundleLoader.java:390"
        },
        {
          "method": "org.eclipse.osgi.framework.internal.core.BundleLoader.findClass",
          "source": "BundleLoader.java:351"
        },
        {
          "method": "org.eclipse.osgi.internal.baseadaptor.DefaultClassLoader.loadClass",
          "source": "DefaultClassLoader.java:81"
        },
        {
          "method": "java.lang.ClassLoader.loadClass",
          "source": "ClassLoader.java:251"
        },
        {
          "method": "java.lang.ClassLoader.loadClassInternal",
          "source": "ClassLoader.java:319"
        },
        {
          "method": "org.tigris.subversion.subclipse.ui.console.ConsoleDocument.getLines",
          "source": "ConsoleDocument.java:79"
        },
        {
          "method": "org.tigris.subversion.subclipse.ui.console.SVNOutputConsole.dump",
          "source": "SVNOutputConsole.java:202"
        },
        {
          "method": "org.tigris.subversion.subclipse.ui.console.SVNOutputConsole.access$1",
          "source": "SVNOutputConsole.java:199"
        },
        {
          "method": "org.tigris.subversion.subclipse.ui.console.SVNOutputConsole$1.run",
          "source": "SVNOutputConsole.java:124"
        },
        {
          "method": "org.eclipse.swt.widgets.RunnableLock.run",
          "source": "RunnableLock.java:35"
        },
        {
          "method": "org.eclipse.swt.widgets.Synchronizer.runAsyncMessages",
          "source": "Synchronizer.java:123"
        },
        {
          "method": "org.eclipse.swt.widgets.Display.runAsyncMessages",
          "source": "Display.java:3128"
        },
        {
          "method": "org.eclipse.swt.widgets.Display.readAndDispatch",
          "source": "Display.java:2892"
        },
        {
          "method": "org.eclipse.ui.internal.Workbench.runEventLoop",
          "source": "Workbench.java:1899"
        },
        {
          "method": "org.eclipse.ui.internal.Workbench.runUI",
          "source": "Workbench.java:1863"
        },
        {
          "method": "org.eclipse.ui.internal.Workbench.createAndRunWorkbench",
          "source": "Workbench.java:417"
        },
        {
          "method": "org.eclipse.ui.PlatformUI.createAndRunWorkbench",
          "source": "PlatformUI.java:143"
        },
        {
          "method": "org.eclipse.ui.internal.ide.IDEApplication.run",
          "source": "IDEApplication.java:106"
        },
        {
          "method": "org.eclipse.core.internal.runtime.PlatformActivator$1.run",
          "source": "PlatformActivator.java:99"
        },
        {
          "method": "org.eclipse.core.runtime.internal.adaptor.EclipseAppLauncher.runApplication",
          "source": "EclipseAppLauncher.java:92"
        },
        {
          "method": "org.eclipse.core.runtime.internal.adaptor.EclipseAppLauncher.start",
          "source": "EclipseAppLauncher.java:68"
        },
        {
          "method": "org.eclipse.core.runtime.adaptor.EclipseStarter.run",
          "source": "EclipseStarter.java:374"
        },
        {
          "method": "org.eclipse.core.runtime.adaptor.EclipseStarter.run",
          "source": "EclipseStarter.java:169"
        },
        {
          "method": "sun.reflect.NativeMethodAccessorImpl.invoke0",
          "source": "Native Method"
        },
        {
          "method": "sun.reflect.NativeMethodAccessorImpl.invoke",
          "source": "NativeMethodAccessorImpl.java:39"
        },
        {
          "method": "sun.reflect.DelegatingMethodAccessorImpl.invoke",
          "source": "DelegatingMethodAccessorImpl.java:25"
        },
        {
          "method": "java.lang.reflect.Method.invoke",
          "source": "Method.java:585"
        },
        {
          "method": "org.eclipse.core.launcher.Main.invokeFramework",
          "source": "Main.java:338"
        },
        {
          "method": "org.eclipse.core.launcher.Main.basicRun",
          "source": "Main.java:282"
        },
        {
          "method": "org.eclipse.core.launcher.Main.run",
          "source": "Main.java:977"
        },
        {
          "method": "org.eclipse.core.launcher.Main.main",
          "source": "Main.java:952"
        }
      ],
      "number": 0,
      "commentIndex": 0,
      "bugId": "129503",
      "date": "2006-02-26T21:56:05+01:00",
      "product": "Mylyn",
      "component": "Jira",
      "severity": "major"
    }
  ],
  "groupId": "129503",
  "bugId": "129503",
  "date": "2006-02-26T21:56:05+01:00",
  "product": "Mylyn",
  "component": "Jira",
  "severity": "major"
}