{
  "comments": [
    "Build: 20020328\n\nDescription:\nI\u0027m running some benchmarks that cause Eclipse to startup and shutdown in rapid \nsuccession.  On shutdown, I get a widget is disposed exception from the \nDebugActionGroupsManager on line 222:\n\npublic void registerView(final IDebugView view) {\n    if (fDebugViews.contains(view)) {\n        return;\n    }\n    final IMenuManager menu\u003d view.getContextMenuManager();\n    if (menu !\u003d null) {\n        menu.addMenuListener(this);\n    }\n\t\t\n    final Display display\u003d view.getSite().getPage().getWorkbenchWindow\n().getShell().getDisplay();\n    if (display !\u003d null \u0026\u0026 !display.isDisposed()) {\n        display.asyncExec(new Runnable() {\n            public void run() {\n                if (!display.isDisposed()) {\n                    updateDebugActionGroups(view);\n                    fDebugViews.add(view);\n                    if (menu !\u003d null) {\n                        //fake a showing of the context menu to get a \n                        //look at all of the items in the menu\n                        Menu swtMenu\u003d ((MenuManager)menu).getMenu();\n\u003e\u003e\u003e\u003eLine 222\u003e\u003e\u003e\u003e\u003e\u003e\u003e\u003e\u003e\u003e\u003e\u003eswtMenu.notifyListeners(SWT.Show, new Event());\n                        swtMenu.notifyListeners(SWT.Hide, new Event());\n                    }\n                }\n            }\n        });\n    }\n}\n\nIn my benchmark situation, the asyncExec doesn\u0027t get run until the Display is \nbeing disposed.\n\nStack dump:\norg.eclipse.swt.SWTException: Widget is disposed\n\tat org.eclipse.swt.SWT.error(SWT.java:1887)\n\tat org.eclipse.swt.SWT.error(SWT.java:1819)\n\tat org.eclipse.swt.widgets.Widget.error(Widget.java:368)\n\tat org.eclipse.swt.widgets.Menu.getDisplay(Menu.java(Compiled Code))\n\tat org.eclipse.swt.widgets.Widget.isValidThread(Widget.java(Compiled \nCode))\n\tat org.eclipse.swt.widgets.Widget.checkWidget(Widget.java(Compiled \nCode))\n\tat org.eclipse.swt.widgets.Widget.notifyListeners(Widget.java:632)\n\tat org.eclipse.debug.internal.ui.DebugActionGroupsManager$1.run\n(DebugActionGroupsManager.java:222)\n\tat org.eclipse.swt.widgets.RunnableLock.run(RunnableLock.java:29)\n\tat org.eclipse.swt.widgets.Synchronizer.runAsyncMessages\n(Synchronizer.java:93)\n\tat org.eclipse.swt.widgets.Display.runAsyncMessages(Display.java:1397)\n\tat org.eclipse.swt.widgets.Display.readAndDispatch(Display.java:1211)\n\tat org.eclipse.swt.widgets.Display.release(Display.java:1261)\n\tat org.eclipse.swt.graphics.Device.dispose(Device.java:198)\n\tat org.eclipse.ui.internal.Workbench.run(Workbench.java:743)\n\tat org.eclipse.core.internal.boot.InternalBootLoader.run\n(InternalBootLoader.java:777)\n\tat org.eclipse.core.boot.BootLoader.run(BootLoader.java:319)\n\tat java.lang.reflect.Method.invoke(Native Method)\n\tat org.eclipse.core.launcher.Main.basicRun(Main.java:196)\n\tat org.eclipse.core.launcher.Main.run(Main.java:555)\n\tat org.eclipse.core.launcher.Main.main(Main.java:396)",
    "\n\n*** This bug has been marked as a duplicate of 12613 ***"
  ],
  "commentCreationDates": [
    "2002-04-09T17:34:05+02:00",
    "2002-04-09T17:38:16+02:00"
  ],
  "traces": [
    {
      "exceptionType": "org.eclipse.swt.SWTException",
      "message": "Widget is disposed",
      "elements": [
        {
          "method": "org.eclipse.swt.SWT.error",
          "source": "SWT.java:1887"
        },
        {
          "method": "org.eclipse.swt.SWT.error",
          "source": "SWT.java:1819"
        },
        {
          "method": "org.eclipse.swt.widgets.Widget.error",
          "source": "Widget.java:368"
        },
        {
          "method": "org.eclipse.swt.widgets.Menu.getDisplay",
          "source": "Menu.java(Compiled Code)"
        },
        {
          "method": "org.eclipse.swt.widgets.Widget.isValidThread",
          "source": "Widget.java(Compiled  Code)"
        },
        {
          "method": "org.eclipse.swt.widgets.Widget.checkWidget",
          "source": "Widget.java(Compiled  Code)"
        },
        {
          "method": "org.eclipse.swt.widgets.Widget.notifyListeners",
          "source": "Widget.java:632"
        },
        {
          "method": "org.eclipse.debug.internal.ui.DebugActionGroupsManager$1.run",
          "source": "DebugActionGroupsManager.java:222"
        },
        {
          "method": "org.eclipse.swt.widgets.RunnableLock.run",
          "source": "RunnableLock.java:29"
        },
        {
          "method": "org.eclipse.swt.widgets.Synchronizer.runAsyncMessages",
          "source": "Synchronizer.java:93"
        },
        {
          "method": "org.eclipse.swt.widgets.Display.runAsyncMessages",
          "source": "Display.java:1397"
        },
        {
          "method": "org.eclipse.swt.widgets.Display.readAndDispatch",
          "source": "Display.java:1211"
        },
        {
          "method": "org.eclipse.swt.widgets.Display.release",
          "source": "Display.java:1261"
        },
        {
          "method": "org.eclipse.swt.graphics.Device.dispose",
          "source": "Device.java:198"
        },
        {
          "method": "org.eclipse.ui.internal.Workbench.run",
          "source": "Workbench.java:743"
        },
        {
          "method": "org.eclipse.core.internal.boot.InternalBootLoader.run",
          "source": "InternalBootLoader.java:777"
        },
        {
          "method": "org.eclipse.core.boot.BootLoader.run",
          "source": "BootLoader.java:319"
        },
        {
          "method": "java.lang.reflect.Method.invoke",
          "source": "Native Method"
        },
        {
          "method": "org.eclipse.core.launcher.Main.basicRun",
          "source": "Main.java:196"
        },
        {
          "method": "org.eclipse.core.launcher.Main.run",
          "source": "Main.java:555"
        },
        {
          "method": "org.eclipse.core.launcher.Main.main",
          "source": "Main.java:396"
        }
      ],
      "number": 0,
      "commentIndex": 0,
      "bugId": "13075",
      "duplicateId": "12613",
      "date": "2002-04-09T17:34:05+02:00",
      "product": "Platform",
      "component": "Debug",
      "severity": "normal"
    }
  ],
  "groupId": "12613",
  "bugId": "13075",
  "duplicateId": "12613",
  "date": "2002-04-09T17:34:05+02:00",
  "product": "Platform",
  "component": "Debug",
  "severity": "normal"
}