{
  "comments": [
    "20020404 integration build on Solaris\nFile-\u003eImport, External Plug-ins and Fragments, Next, Next, Select All, Finish.\nError dialog pops up titled \"Problem occured\", saying \"Plug-in import\" and \nlist: \"Problem while importin plugin ...\".\nThe entries are same as in the second entry in the log.  The log is below:\n\nLog: Tue Apr 09 19:49:22 EDT 2002\n1 org.eclipse.core.resources 2 Could not load library: libcore_2_0_5.so.\njava.lang.UnsatisfiedLinkError: no core_2_0_5 in java.library.path\n\tat java.lang.ClassLoader.loadLibrary(ClassLoader.java:1312)\n\tat java.lang.Runtime.loadLibrary0(Runtime.java:749)\n\tat java.lang.System.loadLibrary(System.java:820)\n\tat org.eclipse.core.internal.localstore.CoreFileSystemLibrary.\u003cclinit\u003e\n(CoreFileSystemLibrary.java:51)\n\tat org.eclipse.core.internal.resources.Resource.checkDoesNotExist\n(Resource.java:1065)\n\tat org.eclipse.core.internal.resources.Project.create(Project.java:238)\n\tat \norg.eclipse.pde.internal.wizards.imports.PluginImportOperation.createProject\n(PluginImportOperation.java:161)\n\tat org.eclipse.pde.internal.wizards.imports.PluginImportOperation.run\n(PluginImportOperation.java:103)\n\tat org.eclipse.core.internal.resources.Workspace.run\n(Workspace.java:1343)\n\tat org.eclipse.pde.internal.wizards.imports.PluginImportWizard$2.run\n(PluginImportWizard.java:130)\n\tat org.eclipse.jface.operation.ModalContext$ModalContextThread.run\n(ModalContext.java:98)\nLog: Tue Apr 09 19:49:24 EDT 2002\n4 org.eclipse.pde 0 Plug-in Import\n\t1\u003d\u003d\u003d\u003d\u003d\u003d\u003d\u003d\u003d\u003d\u003d\u003d\u003d\u003cchildren\u003e\u003d\u003d\u003d\u003d\u003d\u003d\u003d\u003d\u003d\u003d\u003d\u003d\u003d\n\t4 org.eclipse.pde 4 Problem while importing \nplugin \"org.eclipse.ant.core\": File is Read Only.\n\t4 org.eclipse.pde 4 Problem while importing \nplugin \"org.eclipse.ant.ui\": File is Read Only.\n\t4 org.eclipse.pde 4 Problem while importing plugin \"org.apache.ant\": \nFile is Read Only.\n\t4 org.eclipse.pde 4 Problem while importing plugin \"org.apache.lucene\": \nFile is Read Only.\n\t4 org.eclipse.pde 4 Problem while importing \nplugin \"org.eclipse.compare\": File is Read Only.\n\t4 org.eclipse.pde 4 Problem while importing \nplugin \"org.eclipse.core.boot\": File is Read Only.\n\t4 org.eclipse.pde 4 Problem while importing \nplugin \"org.eclipse.core.resources\": File is Read Only.\n\t4 org.eclipse.pde 4 Problem while importing \nplugin \"org.eclipse.core.runtime\": File is Read Only.\n\t4 org.eclipse.pde 4 Problem while importing \nplugin \"org.eclipse.core.target\": File is Read Only.\n\t4 org.eclipse.pde 4 Problem while importing \nplugin \"org.eclipse.team.cvs.ssh\": File is Read Only.\n\t4 org.eclipse.pde 4 Problem while importing \nplugin \"org.eclipse.team.cvs.core\": File is Read Only.\n\t4 org.eclipse.pde 4 Problem while importing \nplugin \"org.eclipse.team.cvs.ui\": File is Read Only.\n\t4 org.eclipse.pde 4 Problem while importing \nplugin \"org.eclipse.debug.core\": File is Read Only.\n\t4 org.eclipse.pde 4 Problem while importing \nplugin \"org.eclipse.debug.ui\": File is Read Only.\n\t4 org.eclipse.pde 4 Problem while importing plugin \"org.eclipse.sdk\": \nFile is Read Only.\n\t4 org.eclipse.pde 4 Problem while importing plugin \"org.eclipse.ui\": \nFile is Read Only.\n\t4 org.eclipse.pde 4 Problem while importing plugin \"org.eclipse.help\": \nFile is Read Only.\n\t4 org.eclipse.pde 4 Problem while importing \nplugin \"org.eclipse.help.ui\": File is Read Only.\n\t4 org.eclipse.pde 4 Problem while importing \nplugin \"org.eclipse.help.webapp\": File is Read Only.\n\t4 org.eclipse.pde 4 Problem while importing \nplugin \"org.eclipse.update.core\": File is Read Only.\n\t4 org.eclipse.pde 4 Problem while importing \nplugin \"org.eclipse.update.ui.forms\": File is Read Only.\n\t4 org.eclipse.pde 4 Problem while importing \nplugin \"org.eclipse.update.ui\": File is Read Only.\n\t4 org.eclipse.pde 4 Problem while importing \nplugin \"org.eclipse.jdt.core\": File is Read Only.\n\t4 org.eclipse.pde 4 Problem while importing \nplugin \"org.eclipse.jdt.junit\": File is Read Only.\n\t4 org.eclipse.pde 4 Problem while importing \nplugin \"org.eclipse.jdt.launching\": File is Read Only.\n\t4 org.eclipse.pde 4 Problem while importing \nplugin \"org.eclipse.jdt.ui\": File is Read Only.\n\t4 org.eclipse.pde 4 Problem while importing \nplugin \"org.eclipse.jdt.doc.user\": File is Read Only.\n\t4 org.eclipse.pde 4 Problem while importing \nplugin \"org.eclipse.jdt.debug\": File is Read Only.\n\t4 org.eclipse.pde 4 Problem while importing \nplugin \"org.eclipse.jdt.debug.ui\": File is Read Only.\n\t4 org.eclipse.pde 4 Problem while importing \nplugin \"org.eclipse.jdt.doc.isv\": File is Read Only.\n\t4 org.eclipse.pde 4 Problem while importing plugin \"org.junit\": File is \nRead Only.\n\t4 org.eclipse.pde 4 Problem while importing \nplugin \"org.eclipse.pde.doc.user\": File is Read Only.\n\t4 org.eclipse.pde 4 Problem while importing \nplugin \"org.eclipse.platform.doc.isv\": File is Read Only.\n\t4 org.eclipse.pde 4 Problem while importing \nplugin \"org.eclipse.pde.core\": File is Read Only.\n\t4 org.eclipse.pde 4 Problem while importing \nplugin \"org.eclipse.pde.runtime\": File is Read Only.\n\t4 org.eclipse.pde 4 Problem while importing plugin \"org.eclipse.pde\": \nFile is Read Only.\n\t4 org.eclipse.pde 4 Problem while importing \nplugin \"org.eclipse.search\": File is Read Only.\n\t4 org.eclipse.pde 4 Problem while importing plugin \"org.eclipse.swt\": \nFile is Read Only.\n\t4 org.eclipse.pde 4 Problem while importing \nplugin \"org.eclipse.team.core\": File is Read Only.\n\t4 org.eclipse.pde 4 Problem while importing \nplugin \"org.eclipse.team.ui\": File is Read Only.\n\t4 org.eclipse.pde 4 Problem while importing \nplugin \"org.eclipse.tomcat\": File is Read Only.\n\t4 org.eclipse.pde 4 Problem while importing \nplugin \"org.eclipse.webdav\": File is Read Only.\n\t4 org.eclipse.pde 4 Problem while importing \nplugin \"org.eclipse.platform.doc.user\": File is Read Only.\n\t4 org.eclipse.pde 4 Problem while importing plugin \"org.apache.xerces\": \nFile is Read Only.\n\t1\u003d\u003d\u003d\u003d\u003d\u003d\u003d\u003d\u003d\u003d\u003d\u003d\u003d\u003c/children\u003e\u003d\u003d\u003d\u003d\u003d\u003d\u003d\u003d\u003d\u003d\u003d\u003d\u003d",
    "Investigate.",
    "This does not look like a PDE problem and the build is old."
  ],
  "commentCreationDates": [
    "2002-04-09T17:58:30+02:00",
    "2002-04-16T23:44:25+02:00",
    "2002-05-16T04:02:00+02:00"
  ],
  "traces": [
    {
      "exceptionType": "java.lang.UnsatisfiedLinkError",
      "message": "no core_2_0_5 in java.library.path",
      "elements": [
        {
          "method": "java.lang.ClassLoader.loadLibrary",
          "source": "ClassLoader.java:1312"
        },
        {
          "method": "java.lang.Runtime.loadLibrary0",
          "source": "Runtime.java:749"
        },
        {
          "method": "java.lang.System.loadLibrary",
          "source": "System.java:820"
        },
        {
          "method": "org.eclipse.core.internal.localstore.CoreFileSystemLibrary.\u003cclinit\u003e",
          "source": "CoreFileSystemLibrary.java:51"
        },
        {
          "method": "org.eclipse.core.internal.resources.Resource.checkDoesNotExist",
          "source": "Resource.java:1065"
        },
        {
          "method": "org.eclipse.core.internal.resources.Project.create",
          "source": "Project.java:238"
        },
        {
          "method": "org.eclipse.pde.internal.wizards.imports.PluginImportOperation.createProject",
          "source": "PluginImportOperation.java:161"
        },
        {
          "method": "org.eclipse.pde.internal.wizards.imports.PluginImportOperation.run",
          "source": "PluginImportOperation.java:103"
        },
        {
          "method": "org.eclipse.core.internal.resources.Workspace.run",
          "source": "Workspace.java:1343"
        },
        {
          "method": "org.eclipse.pde.internal.wizards.imports.PluginImportWizard$2.run",
          "source": "PluginImportWizard.java:130"
        },
        {
          "method": "org.eclipse.jface.operation.ModalContext$ModalContextThread.run",
          "source": "ModalContext.java:98"
        }
      ],
      "number": 0,
      "commentIndex": 0,
      "bugId": "13079",
      "date": "2002-04-09T17:58:30+02:00",
      "product": "PDE",
      "component": "UI",
      "severity": "normal"
    }
  ],
  "groupId": "13079",
  "bugId": "13079",
  "date": "2002-04-09T17:58:30+02:00",
  "product": "PDE",
  "component": "UI",
  "severity": "normal"
}