{
  "comments": [
    "Description:On SuSE Linux Enterprise Sever 9 sp 3, snippet223 fail to run due to SWTError.\n Build date: Eclipse3.2 M5a, IBM JRE 5GA and Sun JRE1.5.0_06 \n OS: SLES9 sp3 ja_JP.utf8 and en_US.utf8        \nSteps to recreate problem:\n        1- load snippet223 and run\n                 \nfollowing error is displayed at Console view\n\nException in thread \"main\" org.eclipse.swt.SWTError: No more handles\n\tat org.eclipse.swt.SWT.error(SWT.java:3375)\n\tat org.eclipse.swt.SWT.error(SWT.java:3272)\n\tat org.eclipse.swt.SWT.error(SWT.java:3243)\n\tat org.eclipse.swt.widgets.Widget.error(Widget.java:431)\n\tat org.eclipse.swt.widgets.ExpandBar.createHandle(ExpandBar.java:45)\n\tat org.eclipse.swt.widgets.Widget.createWidget(Widget.java:378)\n\tat org.eclipse.swt.widgets.Control.createWidget(Control.java:364)\n\tat org.eclipse.swt.widgets.Scrollable.createWidget(Scrollable.java:148)\n\tat org.eclipse.swt.widgets.Control.\u003cinit\u003e(Control.java:88)\n\tat org.eclipse.swt.snippets.Snippet223.main(Snippet223.java:33)",
    "What version of GTK are you running (I don\u0027t have suse 9 here)?\nYou need GTK 2.4 to run the native gtkexpander.\n",
    "The GTK2 version of SLES9 sp3 is 2.2.4-125.10.",
    "*** Bug 133996 has been marked as a duplicate of this bug. ***",
    "fixed in HEAD \u003e 20060407",
    "verified in 20060412-2041, closing. Thanks."
  ],
  "commentCreationDates": [
    "2006-03-08T04:01:18+01:00",
    "2006-03-08T16:20:56+01:00",
    "2006-03-09T02:24:01+01:00",
    "2006-03-30T17:52:22+02:00",
    "2006-04-07T22:44:04+02:00",
    "2006-04-13T11:32:12+02:00"
  ],
  "traces": [
    {
      "exceptionType": "org.eclipse.swt.SWTError",
      "message": "No more handles",
      "elements": [
        {
          "method": "org.eclipse.swt.SWT.error",
          "source": "SWT.java:3375"
        },
        {
          "method": "org.eclipse.swt.SWT.error",
          "source": "SWT.java:3272"
        },
        {
          "method": "org.eclipse.swt.SWT.error",
          "source": "SWT.java:3243"
        },
        {
          "method": "org.eclipse.swt.widgets.Widget.error",
          "source": "Widget.java:431"
        },
        {
          "method": "org.eclipse.swt.widgets.ExpandBar.createHandle",
          "source": "ExpandBar.java:45"
        },
        {
          "method": "org.eclipse.swt.widgets.Widget.createWidget",
          "source": "Widget.java:378"
        },
        {
          "method": "org.eclipse.swt.widgets.Control.createWidget",
          "source": "Control.java:364"
        },
        {
          "method": "org.eclipse.swt.widgets.Scrollable.createWidget",
          "source": "Scrollable.java:148"
        },
        {
          "method": "org.eclipse.swt.widgets.Control.\u003cinit\u003e",
          "source": "Control.java:88"
        },
        {
          "method": "org.eclipse.swt.snippets.Snippet223.main",
          "source": "Snippet223.java:33"
        }
      ],
      "number": 0,
      "commentIndex": 0,
      "bugId": "130853",
      "date": "2006-03-08T04:01:18+01:00",
      "product": "Platform",
      "component": "SWT",
      "severity": "normal"
    }
  ],
  "groupId": "130853",
  "bugId": "130853",
  "date": "2006-03-08T04:01:18+01:00",
  "product": "Platform",
  "component": "SWT",
  "severity": "normal"
}