{
  "comments": [
    "Version: 3.2.0\nBuild id: I20060315-1200\n\nIn Motif-\u003e When running Snippet158, the following error appears:\n\norg.eclipse.swt.SWTError: Unspecified error\n\t\t at org.eclipse.swt.graphics.Device.XErrorProc(Device.java:891)\n\t\t at org.eclipse.swt.internal.motif.OS._XmGetAtomName(Native Method)\n\t\t at org.eclipse.swt.internal.motif.OS.XmGetAtomName(OS.java:2711)\n\t\t at org.eclipse.swt.snippets.Snippet158.getNameFromId(Snippet158.java:119)\n\t\t at org.eclipse.swt.snippets.Snippet158.getTypeIds(Snippet158.java:110)\n\t\t at \norg.eclipse.swt.dnd.ByteArrayTransfer.getSupportedTypes(ByteArrayTransfer.java\n:122)\n\t\t at org.eclipse.swt.dnd.DropTarget.registerDropTarget(DropTarget.java:583)\n\t\t at org.eclipse.swt.dnd.DropTarget$1.handleEvent(DropTarget.java:174)\n\t\t at org.eclipse.swt.widgets.EventTable.sendEvent(EventTable.java:66)\n\t\t at org.eclipse.swt.widgets.Widget.sendEvent(Widget.java:775)\n\t\t at org.eclipse.swt.widgets.Widget.sendEvent(Widget.java:796)\n\t\t at org.eclipse.swt.widgets.Widget.sendEvent(Widget.java:779)\n\t\t at org.eclipse.swt.widgets.Shell.setVisible(Shell.java:1540)\n\t\t at org.eclipse.swt.widgets.Shell.open(Shell.java:1094)\n\t\t at org.eclipse.swt.snippets.Snippet158.main(Snippet158.java:76)\nX Error of failed request:  BadAtom (invalid Atom parameter)\n  Major opcode of failed request:  17 (X_GetAtomName)\n  Atom id in failed request:  0x25c\n  Serial number of failed request:  1473\n  Current serial number in output stream:  1473"
  ],
  "commentCreationDates": [
    "2006-03-21T22:04:00+01:00"
  ],
  "traces": [
    {
      "exceptionType": "org.eclipse.swt.SWTError",
      "message": "Unspecified error",
      "elements": [
        {
          "method": "org.eclipse.swt.graphics.Device.XErrorProc",
          "source": "Device.java:891"
        },
        {
          "method": "org.eclipse.swt.internal.motif.OS._XmGetAtomName",
          "source": "Native Method"
        },
        {
          "method": "org.eclipse.swt.internal.motif.OS.XmGetAtomName",
          "source": "OS.java:2711"
        },
        {
          "method": "org.eclipse.swt.snippets.Snippet158.getNameFromId",
          "source": "Snippet158.java:119"
        },
        {
          "method": "org.eclipse.swt.snippets.Snippet158.getTypeIds",
          "source": "Snippet158.java:110"
        },
        {
          "method": "org.eclipse.swt.dnd.ByteArrayTransfer.getSupportedTypes",
          "source": "ByteArrayTransfer.java :122"
        },
        {
          "method": "org.eclipse.swt.dnd.DropTarget.registerDropTarget",
          "source": "DropTarget.java:583"
        },
        {
          "method": "org.eclipse.swt.dnd.DropTarget$1.handleEvent",
          "source": "DropTarget.java:174"
        },
        {
          "method": "org.eclipse.swt.widgets.EventTable.sendEvent",
          "source": "EventTable.java:66"
        },
        {
          "method": "org.eclipse.swt.widgets.Widget.sendEvent",
          "source": "Widget.java:775"
        },
        {
          "method": "org.eclipse.swt.widgets.Widget.sendEvent",
          "source": "Widget.java:796"
        },
        {
          "method": "org.eclipse.swt.widgets.Widget.sendEvent",
          "source": "Widget.java:779"
        },
        {
          "method": "org.eclipse.swt.widgets.Shell.setVisible",
          "source": "Shell.java:1540"
        },
        {
          "method": "org.eclipse.swt.widgets.Shell.open",
          "source": "Shell.java:1094"
        },
        {
          "method": "org.eclipse.swt.snippets.Snippet158.main",
          "source": "Snippet158.java:76"
        }
      ],
      "number": 0,
      "commentIndex": 0,
      "bugId": "132753",
      "date": "2006-03-21T22:04:00+01:00",
      "product": "Platform",
      "component": "SWT",
      "severity": "normal"
    }
  ],
  "groupId": "132753",
  "bugId": "132753",
  "date": "2006-03-21T22:04:00+01:00",
  "product": "Platform",
  "component": "SWT",
  "severity": "normal"
}