{
  "comments": [
    "Build id: I20060328-0010\n\nSorry to enter this without reproducible steps, but I can\u0027t launch an Eclipse application in debug mode using this build. Some data points:\n\n - It only fails on my self-hosting workspace.  \n - In a clean workspace it works fine.\n - Launch normal Java apps is fine, but Eclipse apps or PDE Junit apps fail\n - Restarting/rebuilding doesn\u0027t fix it\n - The error message just says \"Cannot connect to VM\"\n\nIn the log is the following exception:\n\njava.net.SocketException: socket closed\n\tat java.net.PlainSocketImpl.socketAccept(Native Method)\n\tat java.net.PlainSocketImpl.accept(PlainSocketImpl.java:384)\n\tat java.net.ServerSocket.implAccept(ServerSocket.java:471)\n\tat java.net.ServerSocket.accept(ServerSocket.java:442)\n\tat org.eclipse.jdi.internal.connect.SocketTransportService.accept(SocketTransportService.java:93)\n\tat org.eclipse.jdi.internal.connect.SocketTransportImpl.accept(SocketTransportImpl.java:56)\n\tat org.eclipse.jdi.internal.connect.SocketListeningConnectorImpl.accept(SocketListeningConnectorImpl.java:128)\n\tat org.eclipse.jdt.internal.launching.StandardVMDebugger$ConnectRunnable.run(StandardVMDebugger.java:78)\n\tat java.lang.Thread.run(Thread.java:816)",
    "I just noticed that this appears in the console:\n\nVMJ9VM007E Command-line option unrecognised: -agentlib:jdwp\u003dtransport\u003ddt_socket,suspend\u003dy,address\u003dlocalhost:1924\nCould not create the Java virtual machine.\n\nI don\u0027t see where this \"agentlib\" argument is specified in the launch configuration...",
    "The command line is generated for you to debug (agentlib is an expected argument for debugging on a 1.5 VM or higher).\n\nLikely a dup of bug 128605. If you\u0027re using an IBM, it changes your PATH environment variable. This causes Eclipse to find the wrong dlls when attempting to debug a remote VM that is of a different version than the host VM.",
    "In my case I\u0027m using the same VM for both my development and test workspaces (the same IBM 1.4 VM for both).  If I revert to Eclipse I20060315, then everything works fine. So, something has changed in Eclipse in the past two weeks that is causing this to fail.",
    "if you see \"agentlib\" on the debug target properties, it sounds like you\u0027re using a 1.5 VM to debug. Otherwise, we use -Xrunjdwp:....",
    "Turned out to be a combination of bug 87039, and the new feature for bug 124045. The old bug had the VM pegged as \"java version\" 2.2, when it was really 1.4. The new feature changes the command line when the version is \u003e 1.4, to properly support debug options. If you\u0027ve detected JREs since 3.1, this will not happen."
  ],
  "commentCreationDates": [
    "2006-03-28T19:54:13+02:00",
    "2006-03-28T20:03:26+02:00",
    "2006-03-28T20:05:23+02:00",
    "2006-03-28T20:29:21+02:00",
    "2006-03-28T20:35:27+02:00",
    "2006-03-28T21:11:14+02:00"
  ],
  "traces": [
    {
      "exceptionType": "java.net.SocketException",
      "message": "socket closed",
      "elements": [
        {
          "method": "java.net.PlainSocketImpl.socketAccept",
          "source": "Native Method"
        },
        {
          "method": "java.net.PlainSocketImpl.accept",
          "source": "PlainSocketImpl.java:384"
        },
        {
          "method": "java.net.ServerSocket.implAccept",
          "source": "ServerSocket.java:471"
        },
        {
          "method": "java.net.ServerSocket.accept",
          "source": "ServerSocket.java:442"
        },
        {
          "method": "org.eclipse.jdi.internal.connect.SocketTransportService.accept",
          "source": "SocketTransportService.java:93"
        },
        {
          "method": "org.eclipse.jdi.internal.connect.SocketTransportImpl.accept",
          "source": "SocketTransportImpl.java:56"
        },
        {
          "method": "org.eclipse.jdi.internal.connect.SocketListeningConnectorImpl.accept",
          "source": "SocketListeningConnectorImpl.java:128"
        },
        {
          "method": "org.eclipse.jdt.internal.launching.StandardVMDebugger$ConnectRunnable.run",
          "source": "StandardVMDebugger.java:78"
        },
        {
          "method": "java.lang.Thread.run",
          "source": "Thread.java:816"
        }
      ],
      "number": 0,
      "commentIndex": 0,
      "bugId": "133657",
      "date": "2006-03-28T19:54:13+02:00",
      "product": "JDT",
      "component": "Debug",
      "severity": "major"
    }
  ],
  "groupId": "133657",
  "bugId": "133657",
  "date": "2006-03-28T19:54:13+02:00",
  "product": "JDT",
  "component": "Debug",
  "severity": "major"
}