{
  "comments": [
    "3.2M6\n\n* Debug the following sample program (from bug 114725) using 1.5\n* Ensure the options to catch uncaught exceptions \u0026 compilation errors are on\n* while the program is being debugged, termiante the program\n\u003e the process terminates but the target does not update, an exception in the console\n\npublic class DebugTest {\n    static Throwable ex \u003d new Error() {\n        private static final long serialVersionUID \u003d 1L;\n    };\n    \n    public static void main(String[] args) {\n    \tlong time \u003d System.currentTimeMillis();\n        for (int i \u003d 0; i \u003c 1000000; i++) {\n            try {\n                throwException(true);\n            } catch (Throwable e) {\n                // do nothing\n            }\n        }\n        System.out.println(\"Elapsed time \u003d \" + (System.currentTimeMillis() - time));\n    }\n    \n    private static boolean throwException(boolean foobar) throws Throwable {\n        if(foobar) {\n            throw ex;\n        }\n        return false;\n    }\n\n}\n\n\n\tcom.sun.jdi.VMDisconnectedException: Got IOException from Virtual Machine\n    at org.eclipse.jdi.internal.connect.PacketReceiveManager.getReply(PacketReceiveManager.java:162)\n    at org.eclipse.jdi.internal.connect.PacketReceiveManager.getReply(PacketReceiveManager.java:177)\n    at org.eclipse.jdi.internal.MirrorImpl.requestVM(MirrorImpl.java:174)\n    at org.eclipse.jdi.internal.MirrorImpl.requestVM(MirrorImpl.java:192)\n    at org.eclipse.jdi.internal.MirrorImpl.requestVM(MirrorImpl.java:207)\n    at org.eclipse.jdi.internal.ObjectReferenceImpl.referenceType(ObjectReferenceImpl.java:426)\n    at org.eclipse.jdi.internal.ObjectReferenceImpl.type(ObjectReferenceImpl.java:443)\n    at org.eclipse.jdt.internal.debug.core.breakpoints.JavaExceptionBreakpoint.handleBreakpointEvent(JavaExceptionBreakpoint.java:305)\n    at org.eclipse.jdt.internal.debug.core.breakpoints.JavaBreakpoint.handleEvent(JavaBreakpoint.java:259)\n    at org.eclipse.jdt.internal.debug.core.EventDispatcher.dispatch(EventDispatcher.java:140)\n    at org.eclipse.jdt.internal.debug.core.EventDispatcher.run(EventDispatcher.java:232)\n    at java.lang.Thread.run(Thread.java:816)",
    "Fixed in JavaExceptionBreakpoint. Code now catches VMDisconnect and other JDI exceptions when trying to access exceptions super type chain.",
    "Please verify, Mike.",
    "you really have to get the timing right for this one...\n\nverified."
  ],
  "commentCreationDates": [
    "2006-04-04T22:31:07+02:00",
    "2006-04-19T20:33:02+02:00",
    "2006-04-19T20:33:15+02:00",
    "2006-04-19T22:55:26+02:00"
  ],
  "traces": [
    {
      "exceptionType": "com.sun.jdi.VMDisconnectedException",
      "message": "Got IOException from Virtual Machine",
      "elements": [
        {
          "method": "org.eclipse.jdi.internal.connect.PacketReceiveManager.getReply",
          "source": "PacketReceiveManager.java:162"
        },
        {
          "method": "org.eclipse.jdi.internal.connect.PacketReceiveManager.getReply",
          "source": "PacketReceiveManager.java:177"
        },
        {
          "method": "org.eclipse.jdi.internal.MirrorImpl.requestVM",
          "source": "MirrorImpl.java:174"
        },
        {
          "method": "org.eclipse.jdi.internal.MirrorImpl.requestVM",
          "source": "MirrorImpl.java:192"
        },
        {
          "method": "org.eclipse.jdi.internal.MirrorImpl.requestVM",
          "source": "MirrorImpl.java:207"
        },
        {
          "method": "org.eclipse.jdi.internal.ObjectReferenceImpl.referenceType",
          "source": "ObjectReferenceImpl.java:426"
        },
        {
          "method": "org.eclipse.jdi.internal.ObjectReferenceImpl.type",
          "source": "ObjectReferenceImpl.java:443"
        },
        {
          "method": "org.eclipse.jdt.internal.debug.core.breakpoints.JavaExceptionBreakpoint.handleBreakpointEvent",
          "source": "JavaExceptionBreakpoint.java:305"
        },
        {
          "method": "org.eclipse.jdt.internal.debug.core.breakpoints.JavaBreakpoint.handleEvent",
          "source": "JavaBreakpoint.java:259"
        },
        {
          "method": "org.eclipse.jdt.internal.debug.core.EventDispatcher.dispatch",
          "source": "EventDispatcher.java:140"
        },
        {
          "method": "org.eclipse.jdt.internal.debug.core.EventDispatcher.run",
          "source": "EventDispatcher.java:232"
        },
        {
          "method": "java.lang.Thread.run",
          "source": "Thread.java:816"
        }
      ],
      "number": 0,
      "commentIndex": 0,
      "bugId": "134865",
      "date": "2006-04-04T22:31:07+02:00",
      "product": "JDT",
      "component": "Debug",
      "severity": "normal"
    }
  ],
  "groupId": "134865",
  "bugId": "134865",
  "date": "2006-04-04T22:31:07+02:00",
  "product": "JDT",
  "component": "Debug",
  "severity": "normal"
}