{
  "comments": [
    "Right click on a working set, and choose \"open projects\"  This gives an error:  Unexpected exception happened during open projects.  See error log for more details.\n\nLast 100 lines of log are:\n\n!ENTRY org.eclipse.jdt.ui 4 10001 2006-04-04 12:32:25.716\n!MESSAGE Internal Error\n!STACK 0\njava.lang.reflect.InvocationTargetException\n        at org.eclipse.jface.operation.ModalContext.run(ModalContext.java:350)\n        at org.eclipse.jface.dialogs.ProgressMonitorDialog.run(ProgressMonitorDialog.java:\n470)\n        at org.eclipse.ui.internal.progress.ProgressMonitorJobsDialog.run(ProgressMonitorJ\nobsDialog.java:265)\n        at org.eclipse.ui.internal.progress.ProgressManager$3.run(ProgressManager.java:894\n)\n        at org.eclipse.swt.custom.BusyIndicator.showWhile(BusyIndicator.java:69)\n        at org.eclipse.ui.internal.progress.ProgressManager.busyCursorWhile(ProgressManage\nr.java:929)\n        at org.eclipse.ui.internal.progress.ProgressManager.busyCursorWhile(ProgressManage\nr.java:904)\n        at org.eclipse.jdt.internal.ui.workingsets.OpenCloseWorkingSetAction.run(OpenClose\nWorkingSetAction.java:152)\n        at org.eclipse.jdt.ui.actions.SelectionDispatchAction.dispatchRun(SelectionDispatc\nhAction.java:267)\n        at org.eclipse.jdt.ui.actions.SelectionDispatchAction.run(SelectionDispatchAction.\njava:243)\n        at org.eclipse.jface.action.Action.runWithEvent(Action.java:499)\n        at org.eclipse.jface.action.ActionContributionItem.handleWidgetSelection(ActionCon\ntributionItem.java:539)\n        at org.eclipse.jface.action.ActionContributionItem.access$2(ActionContributionItem\n.java:488)\n        at org.eclipse.jface.action.ActionContributionItem$5.handleEvent(ActionContributio\nnItem.java:400)\n        at org.eclipse.swt.widgets.EventTable.sendEvent(EventTable.java(Compiled Code))\n        at org.eclipse.swt.widgets.Widget.sendEvent(Widget.java(Inlined Compiled Code))\n        at org.eclipse.swt.widgets.Display.runDeferredEvents(Display.java(Compiled Code))\n        at org.eclipse.swt.widgets.Display.readAndDispatch(Display.java(Compiled Code))\n        at org.eclipse.ui.internal.Workbench.runEventLoop(Workbench.java(Compiled Code))\n        at org.eclipse.ui.internal.Workbench.runUI(Workbench.java:1878)\n        at org.eclipse.ui.internal.Workbench.createAndRunWorkbench(Workbench.java:419)\n        at org.eclipse.ui.PlatformUI.createAndRunWorkbench(PlatformUI.java:143)\n        at org.eclipse.ui.internal.ide.IDEApplication.run(IDEApplication.java:95)\n        at org.eclipse.core.internal.runtime.PlatformActivator$1.run(PlatformActivator.jav\na:78)\n        at org.eclipse.core.runtime.internal.adaptor.EclipseAppLauncher.runApplication(Ecl\nipseAppLauncher.java:92)\n        at org.eclipse.core.runtime.internal.adaptor.EclipseAppLauncher.start(EclipseAppLa\nuncher.java:68)\n        at org.eclipse.core.runtime.adaptor.EclipseStarter.run(EclipseStarter.java:376)\n        at org.eclipse.core.runtime.adaptor.EclipseStarter.run(EclipseStarter.java:169)\n        at sun.reflect.NativeMethodAccessorImpl.invoke0(Native Method)\n        at sun.reflect.NativeMethodAccessorImpl.invoke(NativeMethodAccessorImpl.java:85)\n        at sun.reflect.NativeMethodAccessorImpl.invoke(NativeMethodAccessorImpl.java:58)\n        at sun.reflect.DelegatingMethodAccessorImpl.invoke(DelegatingMethodAccessorImpl.ja\nva:60)\n        at java.lang.reflect.Method.invoke(Method.java:391)\n        at org.eclipse.core.launcher.Main.invokeFramework(Main.java:336)\n        at org.eclipse.core.launcher.Main.basicRun(Main.java:280)\n        at org.eclipse.core.launcher.Main.run(Main.java:977)\n        at org.eclipse.core.launcher.Main.main(Main.java:952)\nCaused by: java.util.ConcurrentModificationException\n        at java.util.HashMap$HashIterator.nextEntry(HashMap.java(Compiled Code))\n        at java.util.HashMap$KeyIterator.next(HashMap.java(Compiled Code))\n        at org.eclipse.core.internal.resources.AliasManager.updateAliases(AliasManager.jav\na:631)\n        at org.eclipse.core.internal.resources.Project.open(Project.java:877)\n        at org.eclipse.core.internal.resources.Project.open(Project.java:893)\n        at org.eclipse.jdt.internal.ui.workingsets.OpenCloseWorkingSetAction$OpenWorkingSe\ntAction.performOperation(OpenCloseWorkingSetAction.java:96)\n        at org.eclipse.jdt.internal.ui.workingsets.OpenCloseWorkingSetAction$1.run(OpenClo\nseWorkingSetAction.java:158)\n        at org.eclipse.jdt.internal.core.BatchOperation.executeOperation(BatchOperation.ja\nva:39)\n        at org.eclipse.jdt.internal.core.JavaModelOperation.run(JavaModelOperation.java:72\n0)\n        at org.eclipse.core.internal.resources.Workspace.run(Workspace.java:1737)\n        at org.eclipse.jdt.core.JavaCore.run(JavaCore.java:4013)\n        at org.eclipse.jdt.internal.ui.actions.WorkbenchRunnableAdapter.run(WorkbenchRunna\nbleAdapter.java:87)\n        at org.eclipse.jface.operation.ModalContext$ModalContextThread.run(ModalContext.ja\nva:113)\nRoot exception:\njava.util.ConcurrentModificationException\n        at java.util.HashMap$HashIterator.nextEntry(HashMap.java(Compiled Code))\n        at java.util.HashMap$KeyIterator.next(HashMap.java(Compiled Code))\n        at org.eclipse.core.internal.resources.AliasManager.updateAliases(AliasManager.jav\na:631)\n        at org.eclipse.core.internal.resources.Project.open(Project.java:877)\n        at org.eclipse.core.internal.resources.Project.open(Project.java:893)\n        at org.eclipse.jdt.internal.ui.workingsets.OpenCloseWorkingSetAction$OpenWorkingSe\ntAction.performOperation(OpenCloseWorkingSetAction.java:96)\n        at org.eclipse.jdt.internal.ui.workingsets.OpenCloseWorkingSetAction$1.run(OpenClo\nseWorkingSetAction.java:158)\n        at org.eclipse.jdt.internal.core.BatchOperation.executeOperation(BatchOperation.ja\nva:39)\n        at org.eclipse.jdt.internal.core.JavaModelOperation.run(JavaModelOperation.java:72\n0)\n        at org.eclipse.core.internal.resources.Workspace.run(Workspace.java:1737)\n        at org.eclipse.jdt.core.JavaCore.run(JavaCore.java:4013)\n        at org.eclipse.jdt.internal.ui.actions.WorkbenchRunnableAdapter.run(WorkbenchRunna\nbleAdapter.java:87)\n        at org.eclipse.jface.operation.ModalContext$ModalContextThread.run(ModalContext.ja\nva:113)\n\n!ENTRY org.eclipse.core.resources 2 1 2006-04-04 12:32:25.904\n!MESSAGE Skipping builder com.msdw.appmw.jxbui.jxbbuilder for project trunk_publisher_publ\nic. Either the builder is missing from the install, or it belongs to a project nature that\n is missing or disabled.\n\n!ENTRY org.eclipse.core.resources 2 1 2006-04-04 12:32:25.919\n!MESSAGE Skipping builder com.ibm.sse.model.structuredbuilder for project trunk_publisher_\npublic. Either the builder is missing from the install, or it belongs to a project nature\nthat is missing or disabled.\n\n!ENTRY org.eclipse.core.resources 2 1 2006-04-04 12:32:26.091\n!MESSAGE Skipping builder com.msdw.appmw.jxbui.jxbbuilder for project trunk_tradeflowcore_\nprivate. Either the builder is missing from the install, or it belongs to a project nature\n that is missing or disabled.\n\n!ENTRY org.eclipse.core.resources 2 1 2006-04-04 12:32:26.122\n!MESSAGE Skipping builder com.ibm.sse.model.structuredbuilder for project trunk_tradeflowc\nore_private. Either the builder is missing from the install, or it belongs to a project na\nture that is missing or disabled.",
    "Move to Platform/Resources",
    "*** Bug 134802 has been marked as a duplicate of this bug. ***",
    "I can\u0027t reproduce this on 3.2 M6. What build are you using? See Help \u003e About.",
    "I\u0027m on 3.2M6.\n\nVersion: 3.2.0\nBuild id: I20060331-2000\n",
    "Works for me in 3.2 (final).",
    "I can\u0027t reproduce it either.  Closing.  Matt, if you find a reproducible case on Eclipse 3.2 final or greater, please reopen with steps."
  ],
  "commentCreationDates": [
    "2006-04-04T18:39:48+02:00",
    "2006-04-04T20:27:41+02:00",
    "2006-04-04T20:28:25+02:00",
    "2006-04-04T20:42:37+02:00",
    "2006-04-04T21:00:31+02:00",
    "2006-08-02T01:03:18+02:00",
    "2006-08-02T15:38:31+02:00"
  ],
  "traces": [
    {
      "exceptionType": "java.lang.reflect.InvocationTargetException",
      "elements": [
        {
          "method": "org.eclipse.jface.operation.ModalContext.run",
          "source": "ModalContext.java:350"
        },
        {
          "method": "org.eclipse.jface.dialogs.ProgressMonitorDialog.run",
          "source": "ProgressMonitorDialog.java: 470"
        },
        {
          "method": "org.eclipse.ui.internal.progress.ProgressMonitorJobsDialog.run",
          "source": "ProgressMonitorJ obsDialog.java:265"
        },
        {
          "method": "org.eclipse.ui.internal.progress.ProgressManager$3.run",
          "source": "ProgressManager.java:894 "
        },
        {
          "method": "org.eclipse.swt.custom.BusyIndicator.showWhile",
          "source": "BusyIndicator.java:69"
        },
        {
          "method": "org.eclipse.ui.internal.progress.ProgressManager.busyCursorWhile",
          "source": "ProgressManage r.java:929"
        },
        {
          "method": "org.eclipse.ui.internal.progress.ProgressManager.busyCursorWhile",
          "source": "ProgressManage r.java:904"
        },
        {
          "method": "org.eclipse.jdt.internal.ui.workingsets.OpenCloseWorkingSetAction.run",
          "source": "OpenClose WorkingSetAction.java:152"
        },
        {
          "method": "org.eclipse.jdt.ui.actions.SelectionDispatchAction.dispatchRun",
          "source": "SelectionDispatc hAction.java:267"
        },
        {
          "method": "org.eclipse.jdt.ui.actions.SelectionDispatchAction.run",
          "source": "SelectionDispatchAction. java:243"
        },
        {
          "method": "org.eclipse.jface.action.Action.runWithEvent",
          "source": "Action.java:499"
        },
        {
          "method": "org.eclipse.jface.action.ActionContributionItem.handleWidgetSelection",
          "source": "ActionCon tributionItem.java:539"
        },
        {
          "method": "org.eclipse.jface.action.ActionContributionItem.access$2",
          "source": "ActionContributionItem .java:488"
        },
        {
          "method": "org.eclipse.jface.action.ActionContributionItem$5.handleEvent",
          "source": "ActionContributio nItem.java:400"
        },
        {
          "method": "org.eclipse.swt.widgets.EventTable.sendEvent",
          "source": "EventTable.java(Compiled Code)"
        },
        {
          "method": "org.eclipse.swt.widgets.Widget.sendEvent",
          "source": "Widget.java(Inlined Compiled Code)"
        },
        {
          "method": "org.eclipse.swt.widgets.Display.runDeferredEvents",
          "source": "Display.java(Compiled Code)"
        },
        {
          "method": "org.eclipse.swt.widgets.Display.readAndDispatch",
          "source": "Display.java(Compiled Code)"
        },
        {
          "method": "org.eclipse.ui.internal.Workbench.runEventLoop",
          "source": "Workbench.java(Compiled Code)"
        },
        {
          "method": "org.eclipse.ui.internal.Workbench.runUI",
          "source": "Workbench.java:1878"
        },
        {
          "method": "org.eclipse.ui.internal.Workbench.createAndRunWorkbench",
          "source": "Workbench.java:419"
        },
        {
          "method": "org.eclipse.ui.PlatformUI.createAndRunWorkbench",
          "source": "PlatformUI.java:143"
        },
        {
          "method": "org.eclipse.ui.internal.ide.IDEApplication.run",
          "source": "IDEApplication.java:95"
        },
        {
          "method": "org.eclipse.core.internal.runtime.PlatformActivator$1.run",
          "source": "PlatformActivator.jav a:78"
        },
        {
          "method": "org.eclipse.core.runtime.internal.adaptor.EclipseAppLauncher.runApplication",
          "source": "Ecl ipseAppLauncher.java:92"
        },
        {
          "method": "org.eclipse.core.runtime.internal.adaptor.EclipseAppLauncher.start",
          "source": "EclipseAppLa uncher.java:68"
        },
        {
          "method": "org.eclipse.core.runtime.adaptor.EclipseStarter.run",
          "source": "EclipseStarter.java:376"
        },
        {
          "method": "org.eclipse.core.runtime.adaptor.EclipseStarter.run",
          "source": "EclipseStarter.java:169"
        },
        {
          "method": "sun.reflect.NativeMethodAccessorImpl.invoke0",
          "source": "Native Method"
        },
        {
          "method": "sun.reflect.NativeMethodAccessorImpl.invoke",
          "source": "NativeMethodAccessorImpl.java:85"
        },
        {
          "method": "sun.reflect.NativeMethodAccessorImpl.invoke",
          "source": "NativeMethodAccessorImpl.java:58"
        },
        {
          "method": "sun.reflect.DelegatingMethodAccessorImpl.invoke",
          "source": "DelegatingMethodAccessorImpl.ja va:60"
        },
        {
          "method": "java.lang.reflect.Method.invoke",
          "source": "Method.java:391"
        },
        {
          "method": "org.eclipse.core.launcher.Main.invokeFramework",
          "source": "Main.java:336"
        },
        {
          "method": "org.eclipse.core.launcher.Main.basicRun",
          "source": "Main.java:280"
        },
        {
          "method": "org.eclipse.core.launcher.Main.run",
          "source": "Main.java:977"
        },
        {
          "method": "org.eclipse.core.launcher.Main.main",
          "source": "Main.java:952"
        }
      ],
      "causedBy": {
        "exceptionType": "java.util.ConcurrentModificationException",
        "elements": [
          {
            "method": "java.util.HashMap$HashIterator.nextEntry",
            "source": "HashMap.java(Compiled Code)"
          },
          {
            "method": "java.util.HashMap$KeyIterator.next",
            "source": "HashMap.java(Compiled Code)"
          },
          {
            "method": "org.eclipse.core.internal.resources.AliasManager.updateAliases",
            "source": "AliasManager.jav a:631"
          },
          {
            "method": "org.eclipse.core.internal.resources.Project.open",
            "source": "Project.java:877"
          },
          {
            "method": "org.eclipse.core.internal.resources.Project.open",
            "source": "Project.java:893"
          },
          {
            "method": "org.eclipse.jdt.internal.ui.workingsets.OpenCloseWorkingSetAction$OpenWorkingSetAction.performOperation",
            "source": "OpenCloseWorkingSetAction.java:96"
          },
          {
            "method": "org.eclipse.jdt.internal.ui.workingsets.OpenCloseWorkingSetAction$1.run",
            "source": "OpenClo seWorkingSetAction.java:158"
          },
          {
            "method": "org.eclipse.jdt.internal.core.BatchOperation.executeOperation",
            "source": "BatchOperation.ja va:39"
          },
          {
            "method": "org.eclipse.jdt.internal.core.JavaModelOperation.run",
            "source": "JavaModelOperation.java:72 0"
          },
          {
            "method": "org.eclipse.core.internal.resources.Workspace.run",
            "source": "Workspace.java:1737"
          },
          {
            "method": "org.eclipse.jdt.core.JavaCore.run",
            "source": "JavaCore.java:4013"
          },
          {
            "method": "org.eclipse.jdt.internal.ui.actions.WorkbenchRunnableAdapter.run",
            "source": "WorkbenchRunna bleAdapter.java:87"
          },
          {
            "method": "org.eclipse.jface.operation.ModalContext$ModalContextThread.run",
            "source": "ModalContext.ja va:113"
          }
        ],
        "number": 0,
        "commentIndex": 0
      },
      "number": 0,
      "commentIndex": 0,
      "bugId": "134803",
      "date": "2006-04-04T18:39:48+02:00",
      "product": "Platform",
      "component": "Resources",
      "severity": "normal"
    },
    {
      "exceptionType": "java.util.ConcurrentModificationException",
      "elements": [
        {
          "method": "java.util.HashMap$HashIterator.nextEntry",
          "source": "HashMap.java(Compiled Code)"
        },
        {
          "method": "java.util.HashMap$KeyIterator.next",
          "source": "HashMap.java(Compiled Code)"
        },
        {
          "method": "org.eclipse.core.internal.resources.AliasManager.updateAliases",
          "source": "AliasManager.jav a:631"
        },
        {
          "method": "org.eclipse.core.internal.resources.Project.open",
          "source": "Project.java:877"
        },
        {
          "method": "org.eclipse.core.internal.resources.Project.open",
          "source": "Project.java:893"
        },
        {
          "method": "org.eclipse.jdt.internal.ui.workingsets.OpenCloseWorkingSetAction$OpenWorkingSetAction.performOperation",
          "source": "OpenCloseWorkingSetAction.java:96"
        },
        {
          "method": "org.eclipse.jdt.internal.ui.workingsets.OpenCloseWorkingSetAction$1.run",
          "source": "OpenClo seWorkingSetAction.java:158"
        },
        {
          "method": "org.eclipse.jdt.internal.core.BatchOperation.executeOperation",
          "source": "BatchOperation.ja va:39"
        },
        {
          "method": "org.eclipse.jdt.internal.core.JavaModelOperation.run",
          "source": "JavaModelOperation.java:72 0"
        },
        {
          "method": "org.eclipse.core.internal.resources.Workspace.run",
          "source": "Workspace.java:1737"
        },
        {
          "method": "org.eclipse.jdt.core.JavaCore.run",
          "source": "JavaCore.java:4013"
        },
        {
          "method": "org.eclipse.jdt.internal.ui.actions.WorkbenchRunnableAdapter.run",
          "source": "WorkbenchRunna bleAdapter.java:87"
        },
        {
          "method": "org.eclipse.jface.operation.ModalContext$ModalContextThread.run",
          "source": "ModalContext.ja va:113"
        }
      ],
      "number": 1,
      "commentIndex": 0,
      "bugId": "134803",
      "date": "2006-04-04T18:39:48+02:00",
      "product": "Platform",
      "component": "Resources",
      "severity": "normal"
    }
  ],
  "groupId": "134803",
  "bugId": "134803",
  "date": "2006-04-04T18:39:48+02:00",
  "product": "Platform",
  "component": "Resources",
  "severity": "normal"
}