{
  "comments": [
    "Eventhough the system default on my mac is java 1.5, java_swt apparently uses a v1.4 or lower. This error pops up:\n\n----BEGIN COMMAND LINE DUMP-----\nusage: update_sharing 1.3 | 1.4 | 1.5\n\nException in thread \"main\" java.lang.UnsupportedClassVersionError: fleeble/starters/FleebleClientStarter (Unsupported major.minor version 49.0)\n        at java.lang.ClassLoader.defineClass0(Native Method)\n        at java.lang.ClassLoader.defineClass(ClassLoader.java:539)\n        at java.security.SecureClassLoader.defineClass(SecureClassLoader.java:123)\n        at java.net.URLClassLoader.defineClass(URLClassLoader.java:251)\n        at java.net.URLClassLoader.access$100(URLClassLoader.java:55)\n        at java.net.URLClassLoader$1.run(URLClassLoader.java:194)\n        at java.security.AccessController.doPrivileged(Native Method)\n        at java.net.URLClassLoader.findClass(URLClassLoader.java:187)\n        at java.lang.ClassLoader.loadClass(ClassLoader.java:289)\n        at sun.misc.Launcher$AppClassLoader.loadClass(Launcher.java:274)\n        at java.lang.ClassLoader.loadClass(ClassLoader.java:235)\n        at java.lang.ClassLoader.loadClassInternal(ClassLoader.java:302)\n---END COMMAND LINE DUMP---\n\nAside from the versioning problem (I tried fiddling with -Xbootclasspath but I couldn\u0027t get it to work, though that did have some effect as at that point I started getting other errors), it also seems to call \u0027update_sharing\u0027 for some reason, seeing as that program outputs its help for when you do not enter any version. As far as I know, when you call update_sharing with no parameters, nothing happends, so clearly something isn\u0027t entirely right there, either.\n\nI\u0027m not entirely sure if java_swt is still required, but manually launching an RCP app on Mac Os X causes it to crash about 5 seconds in, whereas this doesn\u0027t happen when running it from within eclipse, so I\u0027m guessing it\u0027s still required.",
    "1) java_swt is no longer required (See http://www.eclipse.org/swt/macosx/)\n2) I\u0027m pretty sure this is a Mac bug/feature and that you need to explicitly enable a java program to use 1.5",
    "We are not going to provide the java_swt executable anymore. Please have a look at this article http://www.eclipse.org/swt/macosx/."
  ],
  "commentCreationDates": [
    "2006-04-10T14:03:41+02:00",
    "2006-04-10T19:53:19+02:00",
    "2006-04-18T22:56:36+02:00"
  ],
  "traces": [
    {
      "exceptionType": "java.lang.UnsupportedClassVersionError",
      "message": "fleeble/starters/FleebleClientStarter (Unsupported major.minor version 49.0)",
      "elements": [
        {
          "method": "java.lang.ClassLoader.defineClass0",
          "source": "Native Method"
        },
        {
          "method": "java.lang.ClassLoader.defineClass",
          "source": "ClassLoader.java:539"
        },
        {
          "method": "java.security.SecureClassLoader.defineClass",
          "source": "SecureClassLoader.java:123"
        },
        {
          "method": "java.net.URLClassLoader.defineClass",
          "source": "URLClassLoader.java:251"
        },
        {
          "method": "java.net.URLClassLoader.access$100",
          "source": "URLClassLoader.java:55"
        },
        {
          "method": "java.net.URLClassLoader$1.run",
          "source": "URLClassLoader.java:194"
        },
        {
          "method": "java.security.AccessController.doPrivileged",
          "source": "Native Method"
        },
        {
          "method": "java.net.URLClassLoader.findClass",
          "source": "URLClassLoader.java:187"
        },
        {
          "method": "java.lang.ClassLoader.loadClass",
          "source": "ClassLoader.java:289"
        },
        {
          "method": "sun.misc.Launcher$AppClassLoader.loadClass",
          "source": "Launcher.java:274"
        },
        {
          "method": "java.lang.ClassLoader.loadClass",
          "source": "ClassLoader.java:235"
        },
        {
          "method": "java.lang.ClassLoader.loadClassInternal",
          "source": "ClassLoader.java:302"
        }
      ],
      "number": 0,
      "commentIndex": 0,
      "bugId": "135854",
      "date": "2006-04-10T14:03:41+02:00",
      "product": "Platform",
      "component": "SWT",
      "severity": "normal"
    }
  ],
  "groupId": "135854",
  "bugId": "135854",
  "date": "2006-04-10T14:03:41+02:00",
  "product": "Platform",
  "component": "SWT",
  "severity": "normal"
}