{
  "comments": [
    "I  get the following error when I declare a variable and save it...(I have used\nmany variables in my 1500 lines of code already)..But I dont know why I get at\nthis point of time...If I delete the variable and save again then I didnt get it. When this error occurs I am not able to do any cut or copy operations.\nI get a message dialog box\n\nThe command for the key you pressed failed\n\nReason:\nThe command for the key you pressed failed\n\nWhen I delete the variable declaration and save it..Then its fine....\n\nNote:- The error is pointed out only on the package declartion line and not in the specific variable declaration line\n\nBuild id: 200412162000\n\n\nSuggestions and Solutions will be highly appreciated\n\n        Internal compiler error\njava.lang.ArrayIndexOutOfBoundsException\n        at java.lang.System.arraycopy(Native Method)\n        at\norg.eclipse.jdt.internal.compiler.flow.UnconditionalFlowInfo.copy(UnconditionalFlowInfo.java:197)\n        at\norg.eclipse.jdt.internal.compiler.flow.ExceptionHandlingFlowContext.recordReturnFrom(ExceptionHandlingFlowContext.java:182)\n        at\norg.eclipse.jdt.internal.compiler.ast.ReturnStatement.analyseCode(ReturnStatement.java:60)\n        at\norg.eclipse.jdt.internal.compiler.ast.MethodDeclaration.analyseCode(MethodDeclaration.java:82)\n        at\norg.eclipse.jdt.internal.compiler.ast.TypeDeclaration.internalAnalyseCode(TypeDeclaration.java:697)\n        at\norg.eclipse.jdt.internal.compiler.ast.TypeDeclaration.analyseCode(TypeDeclaration.java:264)\n        at\norg.eclipse.jdt.internal.compiler.ast.CompilationUnitDeclaration.analyseCode(CompilationUnitDeclaration.java:80)\n        at\norg.eclipse.jdt.internal.compiler.Compiler.process(Compiler.java:513)\n        at\norg.eclipse.jdt.internal.compiler.Compiler.compile(Compiler.java:335)\n        at\norg.eclipse.jdt.internal.core.builder.AbstractImageBuilder.compile(AbstractImageBuilder.java:215)\n        at\norg.eclipse.jdt.internal.core.builder.AbstractImageBuilder.compile(AbstractImageBuilder.java:165)\n        at\norg.eclipse.jdt.internal.core.builder.IncrementalImageBuilder.build(IncrementalImageBuilder.java:113)\n        at\norg.eclipse.jdt.internal.core.builder.JavaBuilder.buildDeltas(JavaBuilder.java:223)\n        at\norg.eclipse.jdt.internal.core.builder.JavaBuilder.build(JavaBuilder.java:151)\n        at\norg.eclipse.core.internal.events.BuildManager$2.run(BuildManager.java:574)\n        at\norg.eclipse.core.internal.runtime.InternalPlatform.run(InternalPlatform.java:1044)\n        at org.eclipse.core.runtime.Platform.run(Platform.java:747)\n        at\norg.eclipse.core.internal.events.BuildManager.basicBuild(BuildManager.java:158)\n        at\norg.eclipse.core.internal.events.BuildManager.basicBuild(BuildManager.java:192)\n        at\norg.eclipse.core.internal.events.BuildManager$1.run(BuildManager.java:221)\n        at\norg.eclipse.core.internal.runtime.InternalPlatform.run(InternalPlatform.java:1044)\n        at org.eclipse.core.runtime.Platform.run(Platform.java:747)\n        at\norg.eclipse.core.internal.events.BuildManager.basicBuild(BuildManager.java:224)\n        at\norg.eclipse.core.internal.events.BuildManager.basicBuildLoop(BuildManager.java:243)\n        at\norg.eclipse.core.internal.events.BuildManager.build(BuildManager.java:272)\n        at\norg.eclipse.core.internal.events.AutoBuildJob.doBuild(AutoBuildJob.java:142)\n        at\norg.eclipse.core.internal.events.AutoBuildJob.run(AutoBuildJob.java:203)\n        at org.eclipse.core.internal.jobs.Worker.run(Worker.java:66)",
    "*** Bug 136958 has been marked as a duplicate of this bug. ***",
    "*** Bug 136959 has been marked as a duplicate of this bug. ***",
    "*** Bug 136964 has been marked as a duplicate of this bug. ***",
    "Could you please provide the steps requested in bug 136102 comment 4 or try a newer build as asked in bug 136102 comment 3 ?\nNo need to open multiple times the same bug.\n\n\n*** This bug has been marked as a duplicate of 136102 ***"
  ],
  "commentCreationDates": [
    "2006-04-17T07:43:59+02:00",
    "2006-04-17T15:42:57+02:00",
    "2006-04-17T15:43:20+02:00",
    "2006-04-17T15:44:32+02:00",
    "2006-04-17T15:47:31+02:00"
  ],
  "traces": [
    {
      "exceptionType": "java.lang.ArrayIndexOutOfBoundsException",
      "elements": [
        {
          "method": "java.lang.System.arraycopy",
          "source": "Native Method"
        },
        {
          "method": "org.eclipse.jdt.internal.compiler.flow.UnconditionalFlowInfo.copy",
          "source": "UnconditionalFlowInfo.java:197"
        },
        {
          "method": "org.eclipse.jdt.internal.compiler.flow.ExceptionHandlingFlowContext.recordReturnFrom",
          "source": "ExceptionHandlingFlowContext.java:182"
        },
        {
          "method": "org.eclipse.jdt.internal.compiler.ast.ReturnStatement.analyseCode",
          "source": "ReturnStatement.java:60"
        },
        {
          "method": "org.eclipse.jdt.internal.compiler.ast.MethodDeclaration.analyseCode",
          "source": "MethodDeclaration.java:82"
        },
        {
          "method": "org.eclipse.jdt.internal.compiler.ast.TypeDeclaration.internalAnalyseCode",
          "source": "TypeDeclaration.java:697"
        },
        {
          "method": "org.eclipse.jdt.internal.compiler.ast.TypeDeclaration.analyseCode",
          "source": "TypeDeclaration.java:264"
        },
        {
          "method": "org.eclipse.jdt.internal.compiler.ast.CompilationUnitDeclaration.analyseCode",
          "source": "CompilationUnitDeclaration.java:80"
        },
        {
          "method": "org.eclipse.jdt.internal.compiler.Compiler.process",
          "source": "Compiler.java:513"
        },
        {
          "method": "org.eclipse.jdt.internal.compiler.Compiler.compile",
          "source": "Compiler.java:335"
        },
        {
          "method": "org.eclipse.jdt.internal.core.builder.AbstractImageBuilder.compile",
          "source": "AbstractImageBuilder.java:215"
        },
        {
          "method": "org.eclipse.jdt.internal.core.builder.AbstractImageBuilder.compile",
          "source": "AbstractImageBuilder.java:165"
        },
        {
          "method": "org.eclipse.jdt.internal.core.builder.IncrementalImageBuilder.build",
          "source": "IncrementalImageBuilder.java:113"
        },
        {
          "method": "org.eclipse.jdt.internal.core.builder.JavaBuilder.buildDeltas",
          "source": "JavaBuilder.java:223"
        },
        {
          "method": "org.eclipse.jdt.internal.core.builder.JavaBuilder.build",
          "source": "JavaBuilder.java:151"
        },
        {
          "method": "org.eclipse.core.internal.events.BuildManager$2.run",
          "source": "BuildManager.java:574"
        },
        {
          "method": "org.eclipse.core.internal.runtime.InternalPlatform.run",
          "source": "InternalPlatform.java:1044"
        },
        {
          "method": "org.eclipse.core.runtime.Platform.run",
          "source": "Platform.java:747"
        },
        {
          "method": "org.eclipse.core.internal.events.BuildManager.basicBuild",
          "source": "BuildManager.java:158"
        },
        {
          "method": "org.eclipse.core.internal.events.BuildManager.basicBuild",
          "source": "BuildManager.java:192"
        },
        {
          "method": "org.eclipse.core.internal.events.BuildManager$1.run",
          "source": "BuildManager.java:221"
        },
        {
          "method": "org.eclipse.core.internal.runtime.InternalPlatform.run",
          "source": "InternalPlatform.java:1044"
        },
        {
          "method": "org.eclipse.core.runtime.Platform.run",
          "source": "Platform.java:747"
        },
        {
          "method": "org.eclipse.core.internal.events.BuildManager.basicBuild",
          "source": "BuildManager.java:224"
        },
        {
          "method": "org.eclipse.core.internal.events.BuildManager.basicBuildLoop",
          "source": "BuildManager.java:243"
        },
        {
          "method": "org.eclipse.core.internal.events.BuildManager.build",
          "source": "BuildManager.java:272"
        },
        {
          "method": "org.eclipse.core.internal.events.AutoBuildJob.doBuild",
          "source": "AutoBuildJob.java:142"
        },
        {
          "method": "org.eclipse.core.internal.events.AutoBuildJob.run",
          "source": "AutoBuildJob.java:203"
        },
        {
          "method": "org.eclipse.core.internal.jobs.Worker.run",
          "source": "Worker.java:66"
        }
      ],
      "number": 0,
      "commentIndex": 0,
      "bugId": "136957",
      "duplicateId": "136102",
      "date": "2006-04-17T07:43:59+02:00",
      "product": "JDT",
      "component": "Core",
      "severity": "blocker"
    }
  ],
  "groupId": "136102",
  "bugId": "136957",
  "duplicateId": "136102",
  "date": "2006-04-17T07:43:59+02:00",
  "product": "JDT",
  "component": "Core",
  "severity": "blocker"
}