{
  "comments": [
    "Personally I don\u0027t have this problem but several users report a problem with crashes due to the simple creation of a new MenuItem in a popup-menu on a Canvas.\nThe problem I have with this is that it\u0027s hard, actually impossible to trace the origin of this. There is no indication as to what might be the problem.  Also, it can work fine for days on end and then fail without any aparant difference in the environment, java runtime.\nThe popup-menu is always the same, not dynamically generated or anything. \n\nAnd, isn\u0027t open source wonderfull, the source code: http://www.javaforge.com/sccShowFileRevision/SpoonGraph.java?proj_id\u003d318\u0026tag\u003d659\u0026date\u003d2006-04-15+22%3A29\u0026filename\u003dtrunk%2Fsrc%2Fbe%2Fibridge%2Fkettle%2Fspoon%2FSpoonGraph.java\nLines 1031 ...\n\nUser report \u0026 stack trace follows.  I\u0027ll try to get an exact position in the SpoonGraph source code to see on which line it exactly fails.  However, the popup menu is fairly simple in nature and like I said always constructed in the same fashion.\n\n---------------------------------------------------------------\n\nDuring spoon usage, it mysteriously closes without any clues/errors etc. I did a stack trace and this is what I saw.\nI cannot reproduce the error at will. It just happens unexpectedly. I suspect it happens when I drag or click on steps. However, it just happens sometimes. I experience it more than once a day.\n\nThese computers experience the same problem...\n\nA. Intel Pentium 4 2.4 GHz 128MB RAM\nWindows 2000\nJava Version \u003d 1.5.0_06\nJava Runtime Environment , Standard Edition ( build 1.5.0_06-b05)\nSpoon Version \u003d 2.2.2\n\nB. Intel Centrino 1.4 GHz 256MB Ram\nWindows XP Home\nJava Version \u003d 1.5.0_06\nJava Runtime Environment , Standard Edition ( build 1.5.0_06-b05)\nSpoon Version \u003d 2.2.2\n\n\n----------------------------------------------\n\norg.eclipse.swt.SWTError: Item not added\nat org.eclipse.swt.SWT.error(SWT.java:2968)\nat org.eclipse.swt.SWT.error(SWT.java:2865)\nat org.eclipse.swt.SWT.error(SWT.java:2836)\nat org.eclipse.swt.widgets.Widget.error(Widget.java:395)\nat org.eclipse.swt.widgets.Menu.createItem(Menu.java:484)\nat org.eclipse.swt.widgets.MenuItem.\u003cinit\u003e(MenuItem.java:77)\nat be.ibridge.kettle.spoon.SpoonGraph.setMenu(Unknown Source)\nat be.ibridge.kettle.spoon.SpoonGraph.access$800(Unknown Source)\nat be.ibridge.kettle.spoon.SpoonGraph$4.mouseDown(Unknown Source)\nat org.eclipse.swt.widgets.TypedListener.handleEvent(TypedListener.java:\n133)\nat org.eclipse.swt.widgets.EventTable.sendEvent(EventTable.java:66)\nat org.eclipse.swt.widgets.Widget.sendEvent(Widget.java:843)\nat org.eclipse.swt.widgets.Display.runDeferredEvents(Display.java:3080)\nat org.eclipse.swt.widgets.Display.readAndDispatch(Display.java:2713)\nat be.ibridge.kettle.spoon.Spoon.readAndDispatch(Unknown Source)\nat be.ibridge.kettle.spoon.Spoon.main(Unknown Source)",
    "Looking at the code (quickly), I think you are leaking.  You create a new menu every time.  When is the old menu disposed?  Since the parent of a menu is the shell, it will only get automatically disposed when the shell is closed.  Over time, Windows runs out of handles and can\u0027t create any more menu item.",
    "Open source is wonderful!",
    "You sir, totally rock. :-)\nThanks a bunch!\nMatt"
  ],
  "commentCreationDates": [
    "2006-04-20T11:45:27+02:00",
    "2006-04-20T20:13:14+02:00",
    "2006-04-20T20:13:50+02:00",
    "2006-04-21T08:47:35+02:00"
  ],
  "traces": [
    {
      "exceptionType": "org.eclipse.swt.SWTError",
      "message": "Item not added",
      "elements": [
        {
          "method": "org.eclipse.swt.SWT.error",
          "source": "SWT.java:2968"
        },
        {
          "method": "org.eclipse.swt.SWT.error",
          "source": "SWT.java:2865"
        },
        {
          "method": "org.eclipse.swt.SWT.error",
          "source": "SWT.java:2836"
        },
        {
          "method": "org.eclipse.swt.widgets.Widget.error",
          "source": "Widget.java:395"
        },
        {
          "method": "org.eclipse.swt.widgets.Menu.createItem",
          "source": "Menu.java:484"
        },
        {
          "method": "org.eclipse.swt.widgets.MenuItem.\u003cinit\u003e",
          "source": "MenuItem.java:77"
        },
        {
          "method": "be.ibridge.kettle.spoon.SpoonGraph.setMenu",
          "source": "Unknown Source"
        },
        {
          "method": "be.ibridge.kettle.spoon.SpoonGraph.access$800",
          "source": "Unknown Source"
        },
        {
          "method": "be.ibridge.kettle.spoon.SpoonGraph$4.mouseDown",
          "source": "Unknown Source"
        },
        {
          "method": "org.eclipse.swt.widgets.TypedListener.handleEvent",
          "source": "TypedListener.java: 133"
        },
        {
          "method": "org.eclipse.swt.widgets.EventTable.sendEvent",
          "source": "EventTable.java:66"
        },
        {
          "method": "org.eclipse.swt.widgets.Widget.sendEvent",
          "source": "Widget.java:843"
        },
        {
          "method": "org.eclipse.swt.widgets.Display.runDeferredEvents",
          "source": "Display.java:3080"
        },
        {
          "method": "org.eclipse.swt.widgets.Display.readAndDispatch",
          "source": "Display.java:2713"
        },
        {
          "method": "be.ibridge.kettle.spoon.Spoon.readAndDispatch",
          "source": "Unknown Source"
        },
        {
          "method": "be.ibridge.kettle.spoon.Spoon.main",
          "source": "Unknown Source"
        }
      ],
      "number": 0,
      "commentIndex": 0,
      "bugId": "137680",
      "date": "2006-04-20T11:45:27+02:00",
      "product": "Platform",
      "component": "SWT",
      "severity": "major"
    }
  ],
  "groupId": "137680",
  "bugId": "137680",
  "date": "2006-04-20T11:45:27+02:00",
  "product": "Platform",
  "component": "SWT",
  "severity": "major"
}