{
  "comments": [
    "I used the standalone ejbDeploy tool with the non-debug version of jdtcore.jar \napplied.  Out of our 36 EJB groups, 30 of them were deployed successfully, but \nthe other 6 couldn\u0027t be built (ContractEJB is one of them if you want to \nreproduce the problem).  \n\n\nE:\\nondeployedEJBs\u003eejbDeploy.bat WCSContract-ejb.jar E:\\nondeployedEJBs \nE:\\nondeployedEJBs\\deployedEJBs\\WCSContract-ejb.jar -nowarn -35 -keep -cp \"wcsej\n*** Note: Running the standalone deploytool from E:\\BuildMachine\\DeployTool\\\nStarting workbench.\nCreating the project.\nImporting file..\nGenerating deployment code\nBuilding: /WCSContract-ejb.jar.\nInvoking RMIC.\nBuilding: /WCSContract-ejb.jar.\njava.lang.ArrayIndexOutOfBoundsException: 11600ce/contract/objimpl\n        at org.eclipse.jdt.internal.compiler.ClassFile.addAttributes\n(ClassFile.java:313)\n        at org.eclipse.jdt.internal.compiler.ast.TypeDeclaration.generateCode\n(TypeDeclaration.java(Compiled Code))\n        at org.eclipse.jdt.internal.compiler.ast.TypeDeclaration.generateCode\n(TypeDeclaration.java:635)\n        at \norg.eclipse.jdt.internal.compiler.ast.CompilationUnitDeclaration.generateCode\n(CompilationUnitDeclaration.java:129)\n        at org.eclipse.jdt.internal.compiler.Compiler.process(Compiler.java:383)\n        at org.eclipse.jdt.internal.compiler.Compiler.compile(Compiler.java\n(Compiled Code))\n        at \norg.eclipse.jdt.internal.core.builder.impl.AbstractImageBuilder.compile\n(AbstractImageBuilder.java:90)\n        at \norg.eclipse.jdt.internal.core.builder.impl.IncrementalImageBuilder.applySourceDe\nlta(IncrementalImageBuilder.java:264)\n        at \norg.eclipse.jdt.internal.core.builder.impl.JavaBuilder.incrementalBuild\n(JavaBuilder.java:210)\n        at org.eclipse.jdt.internal.core.builder.impl.JavaBuilder.build\n(JavaBuilder.java:54)\n        at org.eclipse.core.internal.events.BuildManager$1.run\n(BuildManager.java:93)\n        at org.eclipse.core.internal.runtime.InternalPlatform.run\n(InternalPlatform.java:758)\n        at org.eclipse.core.runtime.Platform.run(Platform.java:393)\n        at org.eclipse.core.internal.events.BuildManager.basicBuild\n(BuildManager.java:114)\n        at org.eclipse.core.internal.events.BuildManager.basicBuild\n(BuildManager.java:73)\n        at org.eclipse.core.internal.events.BuildManager.build\n(BuildManager.java:198)\n        at org.eclipse.core.internal.resources.Project.build(Project.java:91)\n        at com.ibm.etools.ejbdeploy.plugin.JavacOperation.run\n(JavacOperation.java:79)\n        at com.ibm.etools.ejbdeploy.batch.plugin.BatchExtension.run\n(BatchExtension.java:975)\n        at com.ibm.etools.ejbdeploy.batch.impl.BatchDeploy.execute\n(BatchDeploy.java:122)\n        at com.ibm.etools.ejbdeploy.EJBDeploy.execute(EJBDeploy.java:60)\n        at com.ibm.etools.ejbdeploy.EJBDeploy.main(EJBDeploy.java:240)\n[*Error] An unexpected exception was thrown.  Halting execution.\nShutting down workbench.\n\nAn error occurred while compiling the .java code. Correct the code, and try \nagain.\n\u003ecom.ibm.etools.ejbdeploy.EJBDeploymentException(An error occurred while \ncompiling the .java code. Correct the code, and try again.)\norg.eclipse.core.internal.resources.ResourceException: Errors during build.\n        at org.eclipse.core.internal.events.BuildManager.build\n(BuildManager.java:200)\n        at org.eclipse.core.internal.resources.Project.build(Project.java:91)\n        at com.ibm.etools.ejbdeploy.plugin.JavacOperation.run\n(JavacOperation.java:79)\n        at com.ibm.etools.ejbdeploy.batch.plugin.BatchExtension.run\n(BatchExtension.java:975)\n        at com.ibm.etools.ejbdeploy.batch.impl.BatchDeploy.execute\n(BatchDeploy.java:122)\n        at com.ibm.etools.ejbdeploy.EJBDeploy.execute(EJBDeploy.java:60)\n        at com.ibm.etools.ejbdeploy.EJBDeploy.main(EJBDeploy.java:240)\n\n\n\nI looked at the source code of the compiler \n(org.eclipse.jdt.internal.compiler.ClassFile).  I understand that the \naddAttributes method would construct the attribute information(debug info, \ninner class, deprecation, etc) in the class.  However, the method \"forgets\" to \nallocate memory when there is no debug information.  That is why it is throwing \nan ArrayIndexOutOfBoundsException.  I would suggest checking if enough memory \nhas been allocated before the method stores the attributeNumber.",
    "Looks like a duplicate of 11410. Could you please try to reproduce with jdtcore.jar from the M4 \nbuild?",
    "Closing, this was addressed in 2.0 stream.\n\n*** This bug has been marked as a duplicate of 11410 ***",
    "Code is ok now",
    "Verified"
  ],
  "commentCreationDates": [
    "2002-04-16T02:01:37+02:00",
    "2002-04-16T15:39:48+02:00",
    "2002-05-28T13:34:36+02:00",
    "2002-06-03T13:33:00+02:00",
    "2002-06-03T13:33:13+02:00"
  ],
  "traces": [
    {
      "exceptionType": "java.lang.ArrayIndexOutOfBoundsException",
      "message": "11600ce/contract/objimpl",
      "elements": [
        {
          "method": "org.eclipse.jdt.internal.compiler.ClassFile.addAttributes",
          "source": "ClassFile.java:313"
        },
        {
          "method": "org.eclipse.jdt.internal.compiler.ast.TypeDeclaration.generateCode",
          "source": "TypeDeclaration.java(Compiled Code)"
        },
        {
          "method": "org.eclipse.jdt.internal.compiler.ast.TypeDeclaration.generateCode",
          "source": "TypeDeclaration.java:635"
        },
        {
          "method": "org.eclipse.jdt.internal.compiler.ast.CompilationUnitDeclaration.generateCode",
          "source": "CompilationUnitDeclaration.java:129"
        },
        {
          "method": "org.eclipse.jdt.internal.compiler.Compiler.process",
          "source": "Compiler.java:383"
        },
        {
          "method": "org.eclipse.jdt.internal.compiler.Compiler.compile",
          "source": "Compiler.java (Compiled Code)"
        },
        {
          "method": "org.eclipse.jdt.internal.core.builder.impl.AbstractImageBuilder.compile",
          "source": "AbstractImageBuilder.java:90"
        },
        {
          "method": "org.eclipse.jdt.internal.core.builder.impl.IncrementalImageBuilder.applySourceDelta",
          "source": "IncrementalImageBuilder.java:264"
        },
        {
          "method": "org.eclipse.jdt.internal.core.builder.impl.JavaBuilder.incrementalBuild",
          "source": "JavaBuilder.java:210"
        },
        {
          "method": "org.eclipse.jdt.internal.core.builder.impl.JavaBuilder.build",
          "source": "JavaBuilder.java:54"
        },
        {
          "method": "org.eclipse.core.internal.events.BuildManager$1.run",
          "source": "BuildManager.java:93"
        },
        {
          "method": "org.eclipse.core.internal.runtime.InternalPlatform.run",
          "source": "InternalPlatform.java:758"
        },
        {
          "method": "org.eclipse.core.runtime.Platform.run",
          "source": "Platform.java:393"
        },
        {
          "method": "org.eclipse.core.internal.events.BuildManager.basicBuild",
          "source": "BuildManager.java:114"
        },
        {
          "method": "org.eclipse.core.internal.events.BuildManager.basicBuild",
          "source": "BuildManager.java:73"
        },
        {
          "method": "org.eclipse.core.internal.events.BuildManager.build",
          "source": "BuildManager.java:198"
        },
        {
          "method": "org.eclipse.core.internal.resources.Project.build",
          "source": "Project.java:91"
        },
        {
          "method": "com.ibm.etools.ejbdeploy.plugin.JavacOperation.run",
          "source": "JavacOperation.java:79"
        },
        {
          "method": "com.ibm.etools.ejbdeploy.batch.plugin.BatchExtension.run",
          "source": "BatchExtension.java:975"
        },
        {
          "method": "com.ibm.etools.ejbdeploy.batch.impl.BatchDeploy.execute",
          "source": "BatchDeploy.java:122"
        },
        {
          "method": "com.ibm.etools.ejbdeploy.EJBDeploy.execute",
          "source": "EJBDeploy.java:60"
        },
        {
          "method": "com.ibm.etools.ejbdeploy.EJBDeploy.main",
          "source": "EJBDeploy.java:240"
        }
      ],
      "number": 0,
      "commentIndex": 0,
      "bugId": "13852",
      "duplicateId": "11410",
      "date": "2002-04-16T02:01:37+02:00",
      "product": "JDT",
      "component": "Core",
      "severity": "critical"
    },
    {
      "exceptionType": "org.eclipse.core.internal.resources.ResourceException",
      "message": "Errors during build.",
      "elements": [
        {
          "method": "org.eclipse.core.internal.events.BuildManager.build",
          "source": "BuildManager.java:200"
        },
        {
          "method": "org.eclipse.core.internal.resources.Project.build",
          "source": "Project.java:91"
        },
        {
          "method": "com.ibm.etools.ejbdeploy.plugin.JavacOperation.run",
          "source": "JavacOperation.java:79"
        },
        {
          "method": "com.ibm.etools.ejbdeploy.batch.plugin.BatchExtension.run",
          "source": "BatchExtension.java:975"
        },
        {
          "method": "com.ibm.etools.ejbdeploy.batch.impl.BatchDeploy.execute",
          "source": "BatchDeploy.java:122"
        },
        {
          "method": "com.ibm.etools.ejbdeploy.EJBDeploy.execute",
          "source": "EJBDeploy.java:60"
        },
        {
          "method": "com.ibm.etools.ejbdeploy.EJBDeploy.main",
          "source": "EJBDeploy.java:240"
        }
      ],
      "number": 1,
      "commentIndex": 0,
      "bugId": "13852",
      "duplicateId": "11410",
      "date": "2002-04-16T02:01:37+02:00",
      "product": "JDT",
      "component": "Core",
      "severity": "critical"
    }
  ],
  "groupId": "11410",
  "bugId": "13852",
  "duplicateId": "11410",
  "date": "2002-04-16T02:01:37+02:00",
  "product": "JDT",
  "component": "Core",
  "severity": "critical"
}