{
  "comments": [
    "Build 20020412\n\nAfter adding the following conditional breakpoint \u0027owner instanceof \nWorkingCopy\u0027 on line 53 of org.eclipse.jdt.internal.core.Buffer, I got the \nfollowing exception when the breakpoint was hit:\n\njava.lang.ClassCastException: \norg.eclipse.jdt.internal.debug.eval.model.EvaluationVariable\n        at \norg.eclipse.jdt.internal.debug.eval.ast.instructions.InstanceOfOperator.execute\n(InstanceOfOperator.java:26)\n        at org.eclipse.jdt.internal.debug.eval.ast.engine.Interpreter.execute\n(Interpreter.java:32)\n        at \norg.eclipse.jdt.internal.debug.eval.ast.instructions.InstructionSequence.evaluat\ne(InstructionSequence.java:43)\n        at \norg.eclipse.jdt.internal.debug.eval.ast.engine.ASTEvaluationEngine$2.run\n(ASTEvaluationEngine.java:210)\n        at org.eclipse.jdt.internal.debug.core.model.JDIThread.runEvaluation\n(JDIThread.java:542)\n        at \norg.eclipse.jdt.internal.debug.eval.ast.engine.ASTEvaluationEngine$EvaluationThr\nead.doEvaluation(ASTEvaluationEngine.java:215)\n        at \norg.eclipse.jdt.internal.debug.eval.ast.engine.ASTEvaluationEngine$1.run\n(ASTEvaluationEngine.java:175)\n        at java.lang.Thread.run(Thread.java:484)",
    "Fixed. When we popped value from our runtime evaluation stack, we were calling\npop() and assuming the popped object was a value. The fix was to call popValue()\nwhich does the necessary conversion if the object is a variable (it returns\nvariable.getValue()).",
    "Please verify.",
    "Verified."
  ],
  "commentCreationDates": [
    "2002-04-16T11:45:25+02:00",
    "2002-04-17T16:41:14+02:00",
    "2002-04-17T16:42:24+02:00",
    "2002-04-17T20:18:39+02:00"
  ],
  "traces": [
    {
      "exceptionType": "java.lang.ClassCastException",
      "message": "org.eclipse.jdt.internal.debug.eval.model.EvaluationVariable",
      "elements": [
        {
          "method": "org.eclipse.jdt.internal.debug.eval.ast.instructions.InstanceOfOperator.execute",
          "source": "InstanceOfOperator.java:26"
        },
        {
          "method": "org.eclipse.jdt.internal.debug.eval.ast.engine.Interpreter.execute",
          "source": "Interpreter.java:32"
        },
        {
          "method": "org.eclipse.jdt.internal.debug.eval.ast.instructions.InstructionSequence.evaluate",
          "source": "InstructionSequence.java:43"
        },
        {
          "method": "org.eclipse.jdt.internal.debug.eval.ast.engine.ASTEvaluationEngine$2.run",
          "source": "ASTEvaluationEngine.java:210"
        },
        {
          "method": "org.eclipse.jdt.internal.debug.core.model.JDIThread.runEvaluation",
          "source": "JDIThread.java:542"
        },
        {
          "method": "org.eclipse.jdt.internal.debug.eval.ast.engine.ASTEvaluationEngine$EvaluationThread.doEvaluation",
          "source": "ASTEvaluationEngine.java:215"
        },
        {
          "method": "org.eclipse.jdt.internal.debug.eval.ast.engine.ASTEvaluationEngine$1.run",
          "source": "ASTEvaluationEngine.java:175"
        },
        {
          "method": "java.lang.Thread.run",
          "source": "Thread.java:484"
        }
      ],
      "number": 0,
      "commentIndex": 0,
      "bugId": "13866",
      "date": "2002-04-16T11:45:25+02:00",
      "product": "JDT",
      "component": "Debug",
      "severity": "normal"
    }
  ],
  "groupId": "13866",
  "bugId": "13866",
  "date": "2002-04-16T11:45:25+02:00",
  "product": "JDT",
  "component": "Debug",
  "severity": "normal"
}