{
  "comments": [
    "Install location:\n    file:/d:/dev/eclipse/\nConfiguration file:\n    file:/d:/dev/eclipse/configuration/config.ini loaded\nConfiguration location:\n    file:/d:/dev/eclipse/configuration/\nFramework located:\n    file:/d:/dev/eclipse/plugins/org.eclipse.osgi_3.2.0.N20060426-0010.jar\nFramework classpath:\n    file:/d:/dev/eclipse/plugins/org.eclipse.osgi_3.2.0.N20060426-0010.jar\nSplash location:\n    d:\\dev\\eclipse\\plugins\\org.eclipse.platform_3.2.0.N20060426-0010\\splash.bmp\nrunCommand:\n    \u003cD:\\dev\\eclipse\\eclipse.exe\u003e\u003c-name\u003e\u003cEclipse\u003e\u003c-showsplash\u003e\u003c600\u003e\u003cd:\\dev\\eclips\ne\\plugins\\org.eclipse.platform_3.2.0.N20060426-0010\\splash.bmp\u003e\nDebug options:\n    file:/D:/dev/eclipse/.options not found\nTime to load bundles: 47\n!SESSION 2006-04-26 08:45:25.125 -----------------------------------------------\n\neclipse.buildId\u003dN20060426-0010\njava.fullversion\u003dJ2RE 1.4.2 IBM J9 2.2 Windows XP x86-32 j9n142-20050609 (JIT en\nabled)\nJ9VM - 20050524_1738_lHdSMR\nJIT  - r7_level20050518_1803\nBootLoader constants: OS\u003dwin32, ARCH\u003dx86, WS\u003dwin32, NL\u003den_US\nCommand-line arguments:  -os win32 -ws win32 -arch x86 -debug -consolelog\n\n!ENTRY org.eclipse.osgi 2 0 2006-04-26 08:45:34.625\n!MESSAGE The following is a complete list of bundles which are not resolved, see\n the prior log entry for the root cause if it exists:\n!SUBENTRY 1 org.eclipse.osgi 2 0 2006-04-26 08:45:34.625\n!MESSAGE Bundle update@plugins/org.eclipse.jdt.apt.core_3.2.0.N20060426-0010.jar\n [38] was not resolved.\n!SUBENTRY 2 org.eclipse.jdt.apt.core 2 0 2006-04-26 08:45:34.640\n!MESSAGE Missing Constraint: Bundle-RequiredExecutionEnvironment: J2SE-1.5\n!SUBENTRY 1 org.eclipse.osgi 2 0 2006-04-26 08:45:34.640\n!MESSAGE Bundle update@plugins/org.eclipse.jdt.apt.ui_3.2.0.N20060426-0010.jar [\n39] was not resolved.\n!SUBENTRY 2 org.eclipse.jdt.apt.ui 2 0 2006-04-26 08:45:34.640\n!MESSAGE Missing required bundle org.eclipse.jdt.apt.core_0.0.0.\n!SUBENTRY 1 org.eclipse.osgi 2 0 2006-04-26 08:45:34.640\n!MESSAGE Bundle update@plugins/org.eclipse.jdt.junit4.runtime_1.0.0.N20060426-00\n10.jar [47] was not resolved.\n!SUBENTRY 2 org.eclipse.jdt.junit4.runtime 2 0 2006-04-26 08:45:34.640\n!MESSAGE Missing required bundle org.junit4_0.0.0.\n!SUBENTRY 1 org.eclipse.osgi 2 0 2006-04-26 08:45:34.671\n!MESSAGE Bundle update@plugins/org.junit4_1.0.0/ [113] was not resolved.\n!SUBENTRY 2 org.junit4 2 0 2006-04-26 08:45:34.671\n!MESSAGE Missing Constraint: Bundle-RequiredExecutionEnvironment: J2SE-1.5\nStarting application: 9562\nApplication Started: 203734\n\n!ENTRY org.eclipse.ui.workbench 4 0 2006-04-26 09:09:13.515\n!MESSAGE An unexpected exception was thrown.\n!STACK 0\njava.lang.NullPointerException\n        at org.eclipse.team.internal.ccvs.ui.CVSHistoryPage.getFileNameQualifier\n(CVSHistoryPage.java:612)\n        at org.eclipse.team.internal.ccvs.ui.CVSHistoryPage.contributeActions(CV\nSHistoryPage.java:581)\n        at org.eclipse.team.internal.ccvs.ui.CVSHistoryPage.createControl(CVSHis\ntoryPage.java:160)\n        at org.eclipse.team.internal.ui.history.GenericHistoryView.createPage(Ge\nnericHistoryView.java:595)\n        at org.eclipse.team.internal.ui.history.GenericHistoryView.itemDropped(G\nenericHistoryView.java:452)\n        at org.eclipse.team.internal.ui.history.GenericHistoryView$3.selectionCh\nanged(GenericHistoryView.java:165)\n        at org.eclipse.ui.internal.AbstractSelectionService.fireSelection(Abstra\nctSelectionService.java:156)\n        at org.eclipse.ui.internal.AbstractSelectionService$1.selectionChanged(A\nbstractSelectionService.java:62)\n        at org.eclipse.jface.viewers.Viewer$2.run(Viewer.java:162)\n        at org.eclipse.core.runtime.SafeRunner.run(SafeRunner.java:37)\n        at org.eclipse.core.runtime.Platform.run(Platform.java:843)\n        at org.eclipse.ui.internal.JFaceUtil$1.run(JFaceUtil.java:44)\n        at org.eclipse.jface.util.SafeRunnable.run(SafeRunnable.java:149)\n        at org.eclipse.jface.viewers.Viewer.fireSelectionChanged(Viewer.java:160\n)\n        at org.eclipse.jface.viewers.StructuredViewer.updateSelection(Structured\nViewer.java:1970)\n        at org.eclipse.jface.viewers.StructuredViewer.handleSelect(StructuredVie\nwer.java:1122)\n        at org.eclipse.jface.viewers.StructuredViewer$4.widgetSelected(Structure\ndViewer.java:1148)\n        at org.eclipse.jface.util.OpenStrategy.fireSelectionEvent(OpenStrategy.j\nava:213)\n        at org.eclipse.jface.util.OpenStrategy.access$3(OpenStrategy.java:207)\n        at org.eclipse.jface.util.OpenStrategy$1.handleEvent(OpenStrategy.java:3\n74)\n        at org.eclipse.swt.widgets.EventTable.sendEvent(EventTable.java:66)\n        at org.eclipse.swt.widgets.Widget.sendEvent(Widget.java:925)\n        at org.eclipse.swt.widgets.Display.runDeferredEvents(Display.java:3348)\n        at org.eclipse.swt.widgets.Display.readAndDispatch(Display.java:2968)\n        at org.eclipse.ui.internal.Workbench.runEventLoop(Workbench.java:1914)\n        at org.eclipse.ui.internal.Workbench.runUI(Workbench.java:1878)\n        at org.eclipse.ui.internal.Workbench.createAndRunWorkbench(Workbench.jav\na:419)\n        at org.eclipse.ui.PlatformUI.createAndRunWorkbench(PlatformUI.java:143)\n        at org.eclipse.ui.internal.ide.IDEApplication.run(IDEApplication.java:95\n)\n        at org.eclipse.core.internal.runtime.PlatformActivator$1.run(PlatformAct\nivator.java:78)\n        at org.eclipse.core.runtime.internal.adaptor.EclipseAppLauncher.runAppli\ncation(EclipseAppLauncher.java:92)\n        at org.eclipse.core.runtime.internal.adaptor.EclipseAppLauncher.start(Ec\nlipseAppLauncher.java:68)\n        at org.eclipse.core.runtime.adaptor.EclipseStarter.run(EclipseStarter.ja\nva:400)\n        at org.eclipse.core.runtime.adaptor.EclipseStarter.run(EclipseStarter.ja\nva:177)\n        at sun.reflect.NativeMethodAccessorImpl.invoke0(Native Method)\n        at sun.reflect.NativeMethodAccessorImpl.invoke(NativeMethodAccessorImpl.\njava:85)\n        at sun.reflect.NativeMethodAccessorImpl.invoke(NativeMethodAccessorImpl.\njava:58)\n        at sun.reflect.DelegatingMethodAccessorImpl.invoke(DelegatingMethodAcces\nsorImpl.java:60)\n        at java.lang.reflect.Method.invoke(Method.java:391)\n        at org.eclipse.core.launcher.Main.invokeFramework(Main.java:336)\n        at org.eclipse.core.launcher.Main.basicRun(Main.java:280)\n        at org.eclipse.core.launcher.Main.run(Main.java:977)\n        at org.eclipse.core.launcher.Main.main(Main.java:952)\n\n!ENTRY org.eclipse.ui.workbench 4 0 2006-04-26 09:09:16.265\n!MESSAGE An unexpected exception was thrown.\n!STACK 0\njava.lang.NullPointerException\n        at org.eclipse.team.internal.ccvs.ui.CVSHistoryPage.getFileNameQualifier\n(CVSHistoryPage.java:612)\n        at org.eclipse.team.internal.ccvs.ui.CVSHistoryPage.contributeActions(CV\nSHistoryPage.java:581)\n        at org.eclipse.team.internal.ccvs.ui.CVSHistoryPage.createControl(CVSHis\ntoryPage.java:160)\n        at org.eclipse.team.internal.ui.history.GenericHistoryView.createPage(Ge\nnericHistoryView.java:595)\n        at org.eclipse.team.internal.ui.history.GenericHistoryView.itemDropped(G\nenericHistoryView.java:452)\n        at org.eclipse.team.internal.ui.history.GenericHistoryView$3.selectionCh\nanged(GenericHistoryView.java:165)\n        at org.eclipse.ui.internal.AbstractSelectionService.fireSelection(Abstra\nctSelectionService.java:156)\n        at org.eclipse.ui.internal.AbstractSelectionService$1.selectionChanged(A\nbstractSelectionService.java:62)\n        at org.eclipse.jface.viewers.Viewer$2.run(Viewer.java:162)\n        at org.eclipse.core.runtime.SafeRunner.run(SafeRunner.java:37)\n        at org.eclipse.core.runtime.Platform.run(Platform.java:843)\n        at org.eclipse.ui.internal.JFaceUtil$1.run(JFaceUtil.java:44)\n        at org.eclipse.jface.util.SafeRunnable.run(SafeRunnable.java:149)\n        at org.eclipse.jface.viewers.Viewer.fireSelectionChanged(Viewer.java:160\n)\n        at org.eclipse.jface.viewers.StructuredViewer.updateSelection(Structured\nViewer.java:1970)\n        at org.eclipse.jface.viewers.StructuredViewer.handleSelect(StructuredVie\nwer.java:1122)\n        at org.eclipse.jface.viewers.StructuredViewer$4.widgetSelected(Structure\ndViewer.java:1148)\n        at org.eclipse.jface.util.OpenStrategy.fireSelectionEvent(OpenStrategy.j\nava:213)\n        at org.eclipse.jface.util.OpenStrategy.access$3(OpenStrategy.java:207)\n        at org.eclipse.jface.util.OpenStrategy$1.handleEvent(OpenStrategy.java:3\n74)\n        at org.eclipse.swt.widgets.EventTable.sendEvent(EventTable.java:66)\n        at org.eclipse.swt.widgets.Widget.sendEvent(Widget.java:925)\n        at org.eclipse.swt.widgets.Display.runDeferredEvents(Display.java:3348)\n        at org.eclipse.swt.widgets.Display.readAndDispatch(Display.java:2968)\n        at org.eclipse.ui.internal.Workbench.runEventLoop(Workbench.java:1914)\n        at org.eclipse.ui.internal.Workbench.runUI(Workbench.java:1878)\n        at org.eclipse.ui.internal.Workbench.createAndRunWorkbench(Workbench.jav\na:419)\n        at org.eclipse.ui.PlatformUI.createAndRunWorkbench(PlatformUI.java:143)\n        at org.eclipse.ui.internal.ide.IDEApplication.run(IDEApplication.java:95\n)\n        at org.eclipse.core.internal.runtime.PlatformActivator$1.run(PlatformAct\nivator.java:78)\n        at org.eclipse.core.runtime.internal.adaptor.EclipseAppLauncher.runAppli\ncation(EclipseAppLauncher.java:92)\n        at org.eclipse.core.runtime.internal.adaptor.EclipseAppLauncher.start(Ec\nlipseAppLauncher.java:68)\n        at org.eclipse.core.runtime.adaptor.EclipseStarter.run(EclipseStarter.ja\nva:400)\n        at org.eclipse.core.runtime.adaptor.EclipseStarter.run(EclipseStarter.ja\nva:177)\n        at sun.reflect.NativeMethodAccessorImpl.invoke0(Native Method)\n        at sun.reflect.NativeMethodAccessorImpl.invoke(NativeMethodAccessorImpl.\njava:85)\n        at sun.reflect.NativeMethodAccessorImpl.invoke(NativeMethodAccessorImpl.\njava:58)\n        at sun.reflect.DelegatingMethodAccessorImpl.invoke(DelegatingMethodAcces\nsorImpl.java:60)\n        at java.lang.reflect.Method.invoke(Method.java:391)\n        at org.eclipse.core.launcher.Main.invokeFramework(Main.java:336)\n        at org.eclipse.core.launcher.Main.basicRun(Main.java:280)\n        at org.eclipse.core.launcher.Main.run(Main.java:977)\n        at org.eclipse.core.launcher.Main.main(Main.java:952)",
    "It would be good to know why the file is null.",
    "Fixed in HEAD"
  ],
  "commentCreationDates": [
    "2006-04-26T16:24:06+02:00",
    "2006-04-26T16:25:48+02:00",
    "2006-04-27T16:10:20+02:00"
  ],
  "traces": [
    {
      "exceptionType": "java.lang.NullPointerException",
      "elements": [
        {
          "method": "org.eclipse.team.internal.ccvs.ui.CVSHistoryPage.getFileNameQualifier",
          "source": "CVSHistoryPage.java:612"
        },
        {
          "method": "org.eclipse.team.internal.ccvs.ui.CVSHistoryPage.contributeActions",
          "source": "CV SHistoryPage.java:581"
        },
        {
          "method": "org.eclipse.team.internal.ccvs.ui.CVSHistoryPage.createControl",
          "source": "CVSHis toryPage.java:160"
        },
        {
          "method": "org.eclipse.team.internal.ui.history.GenericHistoryView.createPage",
          "source": "Ge nericHistoryView.java:595"
        },
        {
          "method": "org.eclipse.team.internal.ui.history.GenericHistoryView.itemDropped",
          "source": "G enericHistoryView.java:452"
        },
        {
          "method": "org.eclipse.team.internal.ui.history.GenericHistoryView$3.selectionChanged",
          "source": "GenericHistoryView.java:165"
        },
        {
          "method": "org.eclipse.ui.internal.AbstractSelectionService.fireSelection",
          "source": "Abstra ctSelectionService.java:156"
        },
        {
          "method": "org.eclipse.ui.internal.AbstractSelectionService$1.selectionChanged",
          "source": "A bstractSelectionService.java:62"
        },
        {
          "method": "org.eclipse.jface.viewers.Viewer$2.run",
          "source": "Viewer.java:162"
        },
        {
          "method": "org.eclipse.core.runtime.SafeRunner.run",
          "source": "SafeRunner.java:37"
        },
        {
          "method": "org.eclipse.core.runtime.Platform.run",
          "source": "Platform.java:843"
        },
        {
          "method": "org.eclipse.ui.internal.JFaceUtil$1.run",
          "source": "JFaceUtil.java:44"
        },
        {
          "method": "org.eclipse.jface.util.SafeRunnable.run",
          "source": "SafeRunnable.java:149"
        },
        {
          "method": "org.eclipse.jface.viewers.Viewer.fireSelectionChanged",
          "source": "Viewer.java:160 "
        },
        {
          "method": "org.eclipse.jface.viewers.StructuredViewer.updateSelection",
          "source": "Structured Viewer.java:1970"
        },
        {
          "method": "org.eclipse.jface.viewers.StructuredViewer.handleSelect",
          "source": "StructuredVie wer.java:1122"
        },
        {
          "method": "org.eclipse.jface.viewers.StructuredViewer$4.widgetSelected",
          "source": "Structure dViewer.java:1148"
        },
        {
          "method": "org.eclipse.jface.util.OpenStrategy.fireSelectionEvent",
          "source": "OpenStrategy.j ava:213"
        },
        {
          "method": "org.eclipse.jface.util.OpenStrategy.access$3",
          "source": "OpenStrategy.java:207"
        },
        {
          "method": "org.eclipse.jface.util.OpenStrategy$1.handleEvent",
          "source": "OpenStrategy.java:3 74"
        },
        {
          "method": "org.eclipse.swt.widgets.EventTable.sendEvent",
          "source": "EventTable.java:66"
        },
        {
          "method": "org.eclipse.swt.widgets.Widget.sendEvent",
          "source": "Widget.java:925"
        },
        {
          "method": "org.eclipse.swt.widgets.Display.runDeferredEvents",
          "source": "Display.java:3348"
        },
        {
          "method": "org.eclipse.swt.widgets.Display.readAndDispatch",
          "source": "Display.java:2968"
        },
        {
          "method": "org.eclipse.ui.internal.Workbench.runEventLoop",
          "source": "Workbench.java:1914"
        },
        {
          "method": "org.eclipse.ui.internal.Workbench.runUI",
          "source": "Workbench.java:1878"
        },
        {
          "method": "org.eclipse.ui.internal.Workbench.createAndRunWorkbench",
          "source": "Workbench.jav a:419"
        },
        {
          "method": "org.eclipse.ui.PlatformUI.createAndRunWorkbench",
          "source": "PlatformUI.java:143"
        },
        {
          "method": "org.eclipse.ui.internal.ide.IDEApplication.run",
          "source": "IDEApplication.java:95 "
        },
        {
          "method": "org.eclipse.core.internal.runtime.PlatformActivator$1.run",
          "source": "PlatformAct ivator.java:78"
        },
        {
          "method": "org.eclipse.core.runtime.internal.adaptor.EclipseAppLauncher.runApplication",
          "source": "EclipseAppLauncher.java:92"
        },
        {
          "method": "org.eclipse.core.runtime.internal.adaptor.EclipseAppLauncher.start",
          "source": "Ec lipseAppLauncher.java:68"
        },
        {
          "method": "org.eclipse.core.runtime.adaptor.EclipseStarter.run",
          "source": "EclipseStarter.ja va:400"
        },
        {
          "method": "org.eclipse.core.runtime.adaptor.EclipseStarter.run",
          "source": "EclipseStarter.ja va:177"
        },
        {
          "method": "sun.reflect.NativeMethodAccessorImpl.invoke0",
          "source": "Native Method"
        },
        {
          "method": "sun.reflect.NativeMethodAccessorImpl.invoke",
          "source": "NativeMethodAccessorImpl. java:85"
        },
        {
          "method": "sun.reflect.NativeMethodAccessorImpl.invoke",
          "source": "NativeMethodAccessorImpl. java:58"
        },
        {
          "method": "sun.reflect.DelegatingMethodAccessorImpl.invoke",
          "source": "DelegatingMethodAcces sorImpl.java:60"
        },
        {
          "method": "java.lang.reflect.Method.invoke",
          "source": "Method.java:391"
        },
        {
          "method": "org.eclipse.core.launcher.Main.invokeFramework",
          "source": "Main.java:336"
        },
        {
          "method": "org.eclipse.core.launcher.Main.basicRun",
          "source": "Main.java:280"
        },
        {
          "method": "org.eclipse.core.launcher.Main.run",
          "source": "Main.java:977"
        },
        {
          "method": "org.eclipse.core.launcher.Main.main",
          "source": "Main.java:952"
        }
      ],
      "number": 0,
      "commentIndex": 0,
      "bugId": "138637",
      "date": "2006-04-26T16:24:06+02:00",
      "product": "Platform",
      "component": "CVS",
      "severity": "normal"
    },
    {
      "exceptionType": "java.lang.NullPointerException",
      "elements": [
        {
          "method": "org.eclipse.team.internal.ccvs.ui.CVSHistoryPage.getFileNameQualifier",
          "source": "CVSHistoryPage.java:612"
        },
        {
          "method": "org.eclipse.team.internal.ccvs.ui.CVSHistoryPage.contributeActions",
          "source": "CV SHistoryPage.java:581"
        },
        {
          "method": "org.eclipse.team.internal.ccvs.ui.CVSHistoryPage.createControl",
          "source": "CVSHis toryPage.java:160"
        },
        {
          "method": "org.eclipse.team.internal.ui.history.GenericHistoryView.createPage",
          "source": "Ge nericHistoryView.java:595"
        },
        {
          "method": "org.eclipse.team.internal.ui.history.GenericHistoryView.itemDropped",
          "source": "G enericHistoryView.java:452"
        },
        {
          "method": "org.eclipse.team.internal.ui.history.GenericHistoryView$3.selectionChanged",
          "source": "GenericHistoryView.java:165"
        },
        {
          "method": "org.eclipse.ui.internal.AbstractSelectionService.fireSelection",
          "source": "Abstra ctSelectionService.java:156"
        },
        {
          "method": "org.eclipse.ui.internal.AbstractSelectionService$1.selectionChanged",
          "source": "A bstractSelectionService.java:62"
        },
        {
          "method": "org.eclipse.jface.viewers.Viewer$2.run",
          "source": "Viewer.java:162"
        },
        {
          "method": "org.eclipse.core.runtime.SafeRunner.run",
          "source": "SafeRunner.java:37"
        },
        {
          "method": "org.eclipse.core.runtime.Platform.run",
          "source": "Platform.java:843"
        },
        {
          "method": "org.eclipse.ui.internal.JFaceUtil$1.run",
          "source": "JFaceUtil.java:44"
        },
        {
          "method": "org.eclipse.jface.util.SafeRunnable.run",
          "source": "SafeRunnable.java:149"
        },
        {
          "method": "org.eclipse.jface.viewers.Viewer.fireSelectionChanged",
          "source": "Viewer.java:160 "
        },
        {
          "method": "org.eclipse.jface.viewers.StructuredViewer.updateSelection",
          "source": "Structured Viewer.java:1970"
        },
        {
          "method": "org.eclipse.jface.viewers.StructuredViewer.handleSelect",
          "source": "StructuredVie wer.java:1122"
        },
        {
          "method": "org.eclipse.jface.viewers.StructuredViewer$4.widgetSelected",
          "source": "Structure dViewer.java:1148"
        },
        {
          "method": "org.eclipse.jface.util.OpenStrategy.fireSelectionEvent",
          "source": "OpenStrategy.j ava:213"
        },
        {
          "method": "org.eclipse.jface.util.OpenStrategy.access$3",
          "source": "OpenStrategy.java:207"
        },
        {
          "method": "org.eclipse.jface.util.OpenStrategy$1.handleEvent",
          "source": "OpenStrategy.java:3 74"
        },
        {
          "method": "org.eclipse.swt.widgets.EventTable.sendEvent",
          "source": "EventTable.java:66"
        },
        {
          "method": "org.eclipse.swt.widgets.Widget.sendEvent",
          "source": "Widget.java:925"
        },
        {
          "method": "org.eclipse.swt.widgets.Display.runDeferredEvents",
          "source": "Display.java:3348"
        },
        {
          "method": "org.eclipse.swt.widgets.Display.readAndDispatch",
          "source": "Display.java:2968"
        },
        {
          "method": "org.eclipse.ui.internal.Workbench.runEventLoop",
          "source": "Workbench.java:1914"
        },
        {
          "method": "org.eclipse.ui.internal.Workbench.runUI",
          "source": "Workbench.java:1878"
        },
        {
          "method": "org.eclipse.ui.internal.Workbench.createAndRunWorkbench",
          "source": "Workbench.jav a:419"
        },
        {
          "method": "org.eclipse.ui.PlatformUI.createAndRunWorkbench",
          "source": "PlatformUI.java:143"
        },
        {
          "method": "org.eclipse.ui.internal.ide.IDEApplication.run",
          "source": "IDEApplication.java:95 "
        },
        {
          "method": "org.eclipse.core.internal.runtime.PlatformActivator$1.run",
          "source": "PlatformAct ivator.java:78"
        },
        {
          "method": "org.eclipse.core.runtime.internal.adaptor.EclipseAppLauncher.runApplication",
          "source": "EclipseAppLauncher.java:92"
        },
        {
          "method": "org.eclipse.core.runtime.internal.adaptor.EclipseAppLauncher.start",
          "source": "Ec lipseAppLauncher.java:68"
        },
        {
          "method": "org.eclipse.core.runtime.adaptor.EclipseStarter.run",
          "source": "EclipseStarter.ja va:400"
        },
        {
          "method": "org.eclipse.core.runtime.adaptor.EclipseStarter.run",
          "source": "EclipseStarter.ja va:177"
        },
        {
          "method": "sun.reflect.NativeMethodAccessorImpl.invoke0",
          "source": "Native Method"
        },
        {
          "method": "sun.reflect.NativeMethodAccessorImpl.invoke",
          "source": "NativeMethodAccessorImpl. java:85"
        },
        {
          "method": "sun.reflect.NativeMethodAccessorImpl.invoke",
          "source": "NativeMethodAccessorImpl. java:58"
        },
        {
          "method": "sun.reflect.DelegatingMethodAccessorImpl.invoke",
          "source": "DelegatingMethodAcces sorImpl.java:60"
        },
        {
          "method": "java.lang.reflect.Method.invoke",
          "source": "Method.java:391"
        },
        {
          "method": "org.eclipse.core.launcher.Main.invokeFramework",
          "source": "Main.java:336"
        },
        {
          "method": "org.eclipse.core.launcher.Main.basicRun",
          "source": "Main.java:280"
        },
        {
          "method": "org.eclipse.core.launcher.Main.run",
          "source": "Main.java:977"
        },
        {
          "method": "org.eclipse.core.launcher.Main.main",
          "source": "Main.java:952"
        }
      ],
      "number": 1,
      "commentIndex": 0,
      "bugId": "138637",
      "date": "2006-04-26T16:24:06+02:00",
      "product": "Platform",
      "component": "CVS",
      "severity": "normal"
    }
  ],
  "groupId": "138637",
  "bugId": "138637",
  "date": "2006-04-26T16:24:06+02:00",
  "product": "Platform",
  "component": "CVS",
  "severity": "normal"
}