{
  "comments": [
    "The following message is shown in the log file if an administrator installs eclipse, but a normal user is running eclipse.  After this message and several others that are caused because of this failure, Eclipse fails to start.\n\n!SESSION 2006-04-28 12:42:37.561 -----------------------------------------------\neclipse.buildId\u003dI20050627-1435\njava.version\u003d1.4.2_06\njava.vendor\u003dSun Microsystems Inc.\nBootLoader constants: OS\u003dwin32, ARCH\u003dx86, WS\u003dwin32, NL\u003den_US\nCommand-line arguments:  -os win32 -ws win32 -arch x86\n\n!ENTRY org.eclipse.osgi 2006-04-28 12:42:37.920\n!MESSAGE Error reading configuration: \u003csnip\u003e\\eclipse\\configuration\\org.eclipse.osgi\\.manager\\.fileTableLock (Access is denied)\n!STACK 0\njava.io.FileNotFoundException: \u003csnip\u003e\\eclipse\\configuration\\org.eclipse.osgi\\.manager\\.fileTableLock (Access is denied)\n\tat java.io.FileOutputStream.openAppend(Native Method)\n\tat java.io.FileOutputStream.\u003cinit\u003e(FileOutputStream.java:177)\n\tat org.eclipse.core.runtime.internal.adaptor.Locker_JavaNio.lock(Locker_JavaNio.java:34)\n\tat org.eclipse.core.runtime.adaptor.FileManager.lock(FileManager.java:361)\n\tat org.eclipse.core.runtime.adaptor.FileManager.open(FileManager.java:658)\n\tat org.eclipse.core.runtime.adaptor.EclipseAdaptor.initFileManager(EclipseAdaptor.java:818)\n...\u003csnip\u003e\n\nI\u0027ve seen a couple of other bug reports \n\n69782  Has been marked as fixed in 3.0 which looks like an exact match for this problem, but it doesn\u0027t appear to be fixed or it has been rebroken in 3.1.1.\n\n44735 Also appears to be similar although I\u0027m not sure if its the same bug.  This one has been marked as wont fix.\n\nI\u0027ve seen workarounds for using a different -data directory or using \n\"-vmargs -Dosgi.locking\u003dnone\"  in the startup parameters.",
    "IThis setup requires special care. Please see the eclipse help."
  ],
  "commentCreationDates": [
    "2006-04-28T19:40:29+02:00",
    "2006-04-28T20:28:24+02:00"
  ],
  "traces": [
    {
      "exceptionType": "java.io.FileNotFoundException",
      "message": "\u003csnip\u003e\\eclipse\\configuration\\org.eclipse.osgi\\.manager\\.fileTableLock (Access is denied)",
      "elements": [
        {
          "method": "java.io.FileOutputStream.openAppend",
          "source": "Native Method"
        },
        {
          "method": "java.io.FileOutputStream.\u003cinit\u003e",
          "source": "FileOutputStream.java:177"
        },
        {
          "method": "org.eclipse.core.runtime.internal.adaptor.Locker_JavaNio.lock",
          "source": "Locker_JavaNio.java:34"
        },
        {
          "method": "org.eclipse.core.runtime.adaptor.FileManager.lock",
          "source": "FileManager.java:361"
        },
        {
          "method": "org.eclipse.core.runtime.adaptor.FileManager.open",
          "source": "FileManager.java:658"
        },
        {
          "method": "org.eclipse.core.runtime.adaptor.EclipseAdaptor.initFileManager",
          "source": "EclipseAdaptor.java:818"
        }
      ],
      "number": 0,
      "commentIndex": 0,
      "bugId": "139247",
      "date": "2006-04-28T19:40:29+02:00",
      "product": "Platform",
      "component": "Runtime",
      "severity": "normal"
    }
  ],
  "groupId": "139247",
  "bugId": "139247",
  "date": "2006-04-28T19:40:29+02:00",
  "product": "Platform",
  "component": "Runtime",
  "severity": "normal"
}