{
  "comments": [
    "If I try to start eclipse, I will get following error:\nAn error has occurred. See the log file:\n/home/max/workspace/.metadata/.log\n\nThe content of this file is:\n!SESSION 2006-05-18 18:19:54.880 -----------------------------------------------eclipse.buildId\u003dM20060118-1600\njava.version\u003d1.5.0_04\njava.vendor\u003dSun Microsystems Inc.\nBootLoader constants: OS\u003dlinux, ARCH\u003dx86_64, WS\u003dgtk, NL\u003dde_DE\nCommand-line arguments:  -os linux -ws gtk -arch x86_64\n\n!ENTRY org.eclipse.osgi 2006-05-18 18:19:56.275\n!MESSAGE Application error\n!STACK 1\njava.lang.UnsatisfiedLinkError: /home/max/.eclipse/org.eclipse.platform_3.1.2/configuration/org.eclipse.osgi/bundles/85/1/.cp/libswt-pi-gtk-3139.so: /home/max/.eclipse/org.eclipse.platform_3.1.2/configuration/org.eclipse.osgi/bundles/85/1/.cp/libswt-pi-gtk-3139.so: wrong ELF class: ELFCLASS64\n        at java.lang.ClassLoader$NativeLibrary.load(Native Method)\n        at java.lang.ClassLoader.loadLibrary0(Unknown Source)\n        at java.lang.ClassLoader.loadLibrary(Unknown Source)\n        at java.lang.Runtime.loadLibrary0(Unknown Source)\n        at java.lang.System.loadLibrary(Unknown Source)\n        at org.eclipse.swt.internal.Library.loadLibrary(Library.java:123)\n        at org.eclipse.swt.internal.gtk.OS.\u003cclinit\u003e(OS.java:19)\n        at org.eclipse.swt.internal.Converter.wcsToMbcs(Converter.java:63)\n        at org.eclipse.swt.internal.Converter.wcsToMbcs(Converter.java:54)\n        at org.eclipse.swt.widgets.Display.\u003cclinit\u003e(Display.java:122)\n        at org.eclipse.ui.internal.Workbench.createDisplay(Workbench.java:381)\n        at org.eclipse.ui.PlatformUI.createDisplay(PlatformUI.java:155)\n        at org.eclipse.ui.internal.ide.IDEApplication.createDisplay(IDEApplication.java:128)\n        at org.eclipse.ui.internal.ide.IDEApplication.run(IDEApplication.java:79)\n        at org.eclipse.core.internal.runtime.PlatformActivator$1.run(PlatformActivator.java:226)\n        at org.eclipse.core.runtime.adaptor.EclipseStarter.run(EclipseStarter.java:376)\n        at org.eclipse.core.runtime.adaptor.EclipseStarter.run(EclipseStarter.java:163)\n        at sun.reflect.NativeMethodAccessorImpl.invoke0(Native Method)\n        at sun.reflect.NativeMethodAccessorImpl.invoke(Unknown Source)\n        at sun.reflect.DelegatingMethodAccessorImpl.invoke(Unknown Source)\n        at java.lang.reflect.Method.invoke(Unknown Source)\n        at org.eclipse.core.launcher.Main.invokeFramework(Main.java:334)\n        at org.eclipse.core.launcher.Main.basicRun(Main.java:278)\n        at org.eclipse.core.launcher.Main.run(Main.java:973)\n        at org.eclipse.core.launcher.Main.main(Main.java:948)",
    "*** Bug 142706 has been marked as a duplicate of this bug. ***",
    "Works for me.  I suppose you are running on a 64bits machine. I tested here using an AMD64 running RedHat Linux 8.\n\nI googled the web and it seems you can get this error by running 32bits library on a 64bits machine.\nwhat is the output of the command:\nfile /home/max/.eclipse/org.eclipse.platform_3.1.2/configuration/org.eclipse.osgi/bundles/85/1/.cp/libswt-pi-gtk-3139.so\n\nmy output is:\nlibswt-pi-gtk-3139.so: ELF 64-bit LSB shared object, AMD x86-64, version 1 (SYSV), stripped\n",
    "Have you try a newer version of Eclipse, i.e. Eclipse 3.2 Rc4 ?",
    "Ok,\n  after several hours of searches in the web, I\u0027ve discovered that in my case it was a simple rights problem. In particular, running eclipse as \"root\" user there were no problems; then it was straightforward it could have been a permission problem. Finally I have discovered that mounting the user\u0027s home in fstab with \"exec\" parameter solves the problem.\n\n  That\u0027s all.\n\n\u003e If I try to start eclipse, I will get following error:\n\u003e An error has occurred. See the log file:\n\u003e /home/max/workspace/.metadata/.log\n\u003e \n\u003e The content of this file is:\n\u003e !SESSION 2006-05-18 18:19:54.880\n\u003e -----------------------------------------------eclipse.buildId\u003dM20060118-1600\n\u003e java.version\u003d1.5.0_04\n\u003e java.vendor\u003dSun Microsystems Inc.\n\u003e BootLoader constants: OS\u003dlinux, ARCH\u003dx86_64, WS\u003dgtk, NL\u003dde_DE\n\u003e Command-line arguments:  -os linux -ws gtk -arch x86_64\n\u003e \n\u003e !ENTRY org.eclipse.osgi 2006-05-18 18:19:56.275\n\u003e !MESSAGE Application error\n\u003e !STACK 1\n\u003e java.lang.UnsatisfiedLinkError:\n\u003e /home/max/.eclipse/org.eclipse.platform_3.1.2/configuration/org.eclipse.osgi/bundles/85/1/.cp/libswt-pi-gtk-3139.so:\n\u003e /home/max/.eclipse/org.eclipse.platform_3.1.2/configuration/org.eclipse.osgi/bundles/85/1/.cp/libswt-pi-gtk-3139.so:\n\u003e wrong ELF class: ELFCLASS64\n\u003e         at java.lang.ClassLoader$NativeLibrary.load(Native Method)\n\u003e         at java.lang.ClassLoader.loadLibrary0(Unknown Source)\n\u003e         at java.lang.ClassLoader.loadLibrary(Unknown Source)\n\u003e         at java.lang.Runtime.loadLibrary0(Unknown Source)\n\u003e         at java.lang.System.loadLibrary(Unknown Source)\n\u003e         at org.eclipse.swt.internal.Library.loadLibrary(Library.java:123)\n\u003e         at org.eclipse.swt.internal.gtk.OS.\u003cclinit\u003e(OS.java:19)\n\u003e         at org.eclipse.swt.internal.Converter.wcsToMbcs(Converter.java:63)\n\u003e         at org.eclipse.swt.internal.Converter.wcsToMbcs(Converter.java:54)\n\u003e         at org.eclipse.swt.widgets.Display.\u003cclinit\u003e(Display.java:122)\n\u003e         at org.eclipse.ui.internal.Workbench.createDisplay(Workbench.java:381)\n\u003e         at org.eclipse.ui.PlatformUI.createDisplay(PlatformUI.java:155)\n\u003e         at\n\u003e org.eclipse.ui.internal.ide.IDEApplication.createDisplay(IDEApplication.java:128)\n\u003e         at\n\u003e org.eclipse.ui.internal.ide.IDEApplication.run(IDEApplication.java:79)\n\u003e         at\n\u003e org.eclipse.core.internal.runtime.PlatformActivator$1.run(PlatformActivator.java:226)\n\u003e         at\n\u003e org.eclipse.core.runtime.adaptor.EclipseStarter.run(EclipseStarter.java:376)\n\u003e         at\n\u003e org.eclipse.core.runtime.adaptor.EclipseStarter.run(EclipseStarter.java:163)\n\u003e         at sun.reflect.NativeMethodAccessorImpl.invoke0(Native Method)\n\u003e         at sun.reflect.NativeMethodAccessorImpl.invoke(Unknown Source)\n\u003e         at sun.reflect.DelegatingMethodAccessorImpl.invoke(Unknown Source)\n\u003e         at java.lang.reflect.Method.invoke(Unknown Source)\n\u003e         at org.eclipse.core.launcher.Main.invokeFramework(Main.java:334)\n\u003e         at org.eclipse.core.launcher.Main.basicRun(Main.java:278)\n\u003e         at org.eclipse.core.launcher.Main.run(Main.java:973)\n\u003e         at org.eclipse.core.launcher.Main.main(Main.java:948)\n\u003e ",
    "I have a 64bits libary:\n\n/home/max/.eclipse/org.eclipse.platform_3.1.2/configuration/org.eclipse.osgi/bundles/85/1/.cp/libswt-pi-gtk-3139.so:\nELF 64-bit LSB shared object, AMD x86-64, version 1 (SYSV), stripped\n\nI also get the error if I run eclipse as root.\n\nNow I will download the newest version and test it...",
    "DJ: this is similar to Bug 142748, here the problem seems to be file permissions.\n\n\nCiAn: Thanks for the research.",
    "I tried Eclipse 3.2 RC4 but it also didn\u0027t run. I got the same error message.",
    "Max, what is the output of\nls -l /home/max/.eclipse/org.eclipse.platform_3.1.2/configuration/org.eclipse.osgi/bundles/85/1/.cp/libswt-pi-gtk-3139.so\n\nTry to change the permissions of the file\nchmod 775 /home/max/.eclipse/org.eclipse.platform_3.1.2/configuration/org.eclipse.osgi/bundles/85/1/.cp/libswt-pi-gtk-3139.so\n\nLet me if that helps.",
    "The output of:\nls -l /home/max/.eclipse/org.eclipse.platform_3.1.2/configuration/org.eclipse.osgi/bundles/85/1/.cp/libswt-pi-gtk-3139.so\n\nIs:\n-rw-r--r-- 1 max users 358896 19. Mai 23:35 /home/max/.eclipse/org.eclipse.platform_3.1.2/configuration/org.eclipse.osgi/bundles/85/1/.cp/libswt-pi-gtk-3139.so\n\nI did the chmod to the file and the to .eclipse:\nchmod 775 -R .eclipse/\n\nbut it didn\u0027t solve the problem.",
    "I installed a new version of my system and now everything works fine.\n\nThanks for all.",
    "-"
  ],
  "commentCreationDates": [
    "2006-05-18T18:24:36+02:00",
    "2006-05-19T16:09:24+02:00",
    "2006-05-19T21:17:23+02:00",
    "2006-05-19T21:18:06+02:00",
    "2006-05-19T22:31:47+02:00",
    "2006-05-19T22:35:35+02:00",
    "2006-05-19T22:40:02+02:00",
    "2006-05-19T23:07:01+02:00",
    "2006-05-19T23:17:44+02:00",
    "2006-05-19T23:39:12+02:00",
    "2006-06-01T19:31:52+02:00",
    "2006-06-01T19:32:19+02:00"
  ],
  "traces": [
    {
      "exceptionType": "java.lang.UnsatisfiedLinkError",
      "message": "/home/max/.eclipse/org.eclipse.platform_3.1.2/configuration/org.eclipse.osgi/bundles/85/1/.cp/libswt-pi-gtk-3139.so: /home/max/.eclipse/org.eclipse.platform_3.1.2/configuration/org.eclipse.osgi/bundles/85/1/.cp/libswt-pi-gtk-3139.so: wrong ELF class: ELFCLASS64",
      "elements": [
        {
          "method": "java.lang.ClassLoader$NativeLibrary.load",
          "source": "Native Method"
        },
        {
          "method": "java.lang.ClassLoader.loadLibrary0",
          "source": "Unknown Source"
        },
        {
          "method": "java.lang.ClassLoader.loadLibrary",
          "source": "Unknown Source"
        },
        {
          "method": "java.lang.Runtime.loadLibrary0",
          "source": "Unknown Source"
        },
        {
          "method": "java.lang.System.loadLibrary",
          "source": "Unknown Source"
        },
        {
          "method": "org.eclipse.swt.internal.Library.loadLibrary",
          "source": "Library.java:123"
        },
        {
          "method": "org.eclipse.swt.internal.gtk.OS.\u003cclinit\u003e",
          "source": "OS.java:19"
        },
        {
          "method": "org.eclipse.swt.internal.Converter.wcsToMbcs",
          "source": "Converter.java:63"
        },
        {
          "method": "org.eclipse.swt.internal.Converter.wcsToMbcs",
          "source": "Converter.java:54"
        },
        {
          "method": "org.eclipse.swt.widgets.Display.\u003cclinit\u003e",
          "source": "Display.java:122"
        },
        {
          "method": "org.eclipse.ui.internal.Workbench.createDisplay",
          "source": "Workbench.java:381"
        },
        {
          "method": "org.eclipse.ui.PlatformUI.createDisplay",
          "source": "PlatformUI.java:155"
        },
        {
          "method": "org.eclipse.ui.internal.ide.IDEApplication.createDisplay",
          "source": "IDEApplication.java:128"
        },
        {
          "method": "org.eclipse.ui.internal.ide.IDEApplication.run",
          "source": "IDEApplication.java:79"
        },
        {
          "method": "org.eclipse.core.internal.runtime.PlatformActivator$1.run",
          "source": "PlatformActivator.java:226"
        },
        {
          "method": "org.eclipse.core.runtime.adaptor.EclipseStarter.run",
          "source": "EclipseStarter.java:376"
        },
        {
          "method": "org.eclipse.core.runtime.adaptor.EclipseStarter.run",
          "source": "EclipseStarter.java:163"
        },
        {
          "method": "sun.reflect.NativeMethodAccessorImpl.invoke0",
          "source": "Native Method"
        },
        {
          "method": "sun.reflect.NativeMethodAccessorImpl.invoke",
          "source": "Unknown Source"
        },
        {
          "method": "sun.reflect.DelegatingMethodAccessorImpl.invoke",
          "source": "Unknown Source"
        },
        {
          "method": "java.lang.reflect.Method.invoke",
          "source": "Unknown Source"
        },
        {
          "method": "org.eclipse.core.launcher.Main.invokeFramework",
          "source": "Main.java:334"
        },
        {
          "method": "org.eclipse.core.launcher.Main.basicRun",
          "source": "Main.java:278"
        },
        {
          "method": "org.eclipse.core.launcher.Main.run",
          "source": "Main.java:973"
        },
        {
          "method": "org.eclipse.core.launcher.Main.main",
          "source": "Main.java:948"
        }
      ],
      "number": 0,
      "commentIndex": 0,
      "bugId": "142529",
      "date": "2006-05-18T18:24:36+02:00",
      "product": "Platform",
      "component": "SWT",
      "severity": "normal"
    },
    {
      "exceptionType": "java.lang.UnsatisfiedLinkError",
      "message": "\u003e /home/max/.eclipse/org.eclipse.platform_3.1.2/configuration/org.eclipse.osgi/bundles/85/1/.cp/libswt-pi-gtk-3139.so: \u003e /home/max/.eclipse/org.eclipse.platform_3.1.2/configuration/org.eclipse.osgi/bundles/85/1/.cp/libswt-pi-gtk-3139.so: \u003e wrong ELF class: ELFCLASS64 \u003e",
      "elements": [
        {
          "method": "java.lang.ClassLoader$NativeLibrary.load",
          "source": "Native Method"
        }
      ],
      "number": 1,
      "commentIndex": 4,
      "bugId": "142529",
      "date": "2006-05-19T22:31:47+02:00",
      "product": "Platform",
      "component": "SWT",
      "severity": "normal"
    }
  ],
  "groupId": "142529",
  "bugId": "142529",
  "date": "2006-05-18T18:24:36+02:00",
  "product": "Platform",
  "component": "SWT",
  "severity": "normal"
}