{
  "comments": [
    "build 2002-04-18 on WinXP.\n\nSorry, no reproducable steps...I just noticed this NPE on my console after I \nhad been stepping/debugging some code.\n\nC:\\dev\\i-20020418\\eclipse\u003e\\temp\\jre1.3.0\\jre\\bin\\java -cp startup.jar \norg.eclipse.core.launcher.UIMain -data \\target\\head\\plugins\\ -consoleLog\njava.lang.NullPointerException\n        at \norg.eclipse.debug.internal.ui.views.LaunchViewEventHandler$ThreadTimer.handleDe\nbugEvents(LaunchViewEventHandler.java:425)\n        at org.eclipse.debug.core.DebugPlugin.fireDebugEventSet\n(DebugPlugin.java(Compiled Code))\n        at org.eclipse.jdt.internal.debug.core.model.JDIDebugElement.fireEvent\n(JDIDebugElement.java:125)\n        at \norg.eclipse.jdt.internal.debug.core.model.JDIDebugElement.fireTerminateEvent\n(JDIDebugElement.java:177)\n        at org.eclipse.jdt.internal.debug.core.model.JDIDebugTarget.terminated\n(JDIDebugTarget.java:1244)\n        at \norg.eclipse.jdt.internal.debug.core.model.JDIDebugTarget.handleVMDeath\n(JDIDebugTarget.java:911)\n        at org.eclipse.jdt.internal.debug.core.EventDispatcher.dispatch\n(EventDispatcher.java:135)\n        at org.eclipse.jdt.internal.debug.core.EventDispatcher.run\n(EventDispatcher.java:205)\n        at java.lang.Thread.run(Thread.java:498)",
    "Fixed. When a launch is in run mode, there are no debug targets -\u003e missing null \ncheck. As well, should check all targets in a launch, not just the primary \ntarget.",
    "Please verify",
    "Verified the fix.\n\nI further refactored this code. The timer doesn\u0027t need to be a debug event\nlistener. Its enclosing type is already a debug event listener.\n\nRemoved the timer as a debug event listener. Instead, the launch view event\nhandler now \"shares\" its debug event sets with the timer.",
    "Please verify.",
    "Verified."
  ],
  "commentCreationDates": [
    "2002-04-19T20:59:37+02:00",
    "2002-04-19T21:35:02+02:00",
    "2002-04-19T21:35:12+02:00",
    "2002-04-23T16:03:18+02:00",
    "2002-04-23T16:03:53+02:00",
    "2002-04-23T17:02:50+02:00"
  ],
  "traces": [
    {
      "exceptionType": "java.lang.NullPointerException",
      "elements": [
        {
          "method": "org.eclipse.debug.internal.ui.views.LaunchViewEventHandler$ThreadTimer.handleDebugEvents",
          "source": "LaunchViewEventHandler.java:425"
        },
        {
          "method": "org.eclipse.debug.core.DebugPlugin.fireDebugEventSet",
          "source": "DebugPlugin.java(Compiled Code)"
        },
        {
          "method": "org.eclipse.jdt.internal.debug.core.model.JDIDebugElement.fireEvent",
          "source": "JDIDebugElement.java:125"
        },
        {
          "method": "org.eclipse.jdt.internal.debug.core.model.JDIDebugElement.fireTerminateEvent",
          "source": "JDIDebugElement.java:177"
        },
        {
          "method": "org.eclipse.jdt.internal.debug.core.model.JDIDebugTarget.terminated",
          "source": "JDIDebugTarget.java:1244"
        },
        {
          "method": "org.eclipse.jdt.internal.debug.core.model.JDIDebugTarget.handleVMDeath",
          "source": "JDIDebugTarget.java:911"
        },
        {
          "method": "org.eclipse.jdt.internal.debug.core.EventDispatcher.dispatch",
          "source": "EventDispatcher.java:135"
        },
        {
          "method": "org.eclipse.jdt.internal.debug.core.EventDispatcher.run",
          "source": "EventDispatcher.java:205"
        },
        {
          "method": "java.lang.Thread.run",
          "source": "Thread.java:498"
        }
      ],
      "number": 0,
      "commentIndex": 0,
      "bugId": "14254",
      "date": "2002-04-19T20:59:37+02:00",
      "product": "JDT",
      "component": "Debug",
      "severity": "normal"
    }
  ],
  "groupId": "14254",
  "bugId": "14254",
  "date": "2002-04-19T20:59:37+02:00",
  "product": "JDT",
  "component": "Debug",
  "severity": "normal"
}