{
  "comments": [
    "Environment:\n------------\n\nBuild: Linux 20020416-gtk1x\nJava: Sun 1.3.1_02 (Also tried Sun SDK 1.4.0, same result)\nLinux: Mandrake 8.2\n\nProblem description:\n--------------------\n\nThis problem have been present on older editions too.\n\nI have tried to start eclipse in a number of ways, but the startup problem \npersists:\n\n eclipse\n eclipse -ws gtk1x\n eclipse -ws gtk1x -data /home/sverre/java/workspace\n\nWhen I start eclipse first time, everything is fine. I add a \nproject from my CVS, and it seems to recognize it as a Java project.\n\nI then close eclipse. Next time I attempt to start eclipse I get following \nexception:\n\norg.eclipse.swt.SWTError: Unspecified error\n        at org.eclipse.swt.SWT.error(SWT.java:1912)\n        at org.eclipse.swt.SWT.error(SWT.java:1819)\n        at \n\norg.eclipse.swt.graphics.DefaultGtkStyle.loadDefaultFont(DefaultGtkStyle.java:97)\n\n        at org.eclipse.swt.graphics.GC.\u003cinit\u003e(GC.java:83)\n\n        at \norg.eclipse.swt.custom.CTabFolder.updateArrowBar(CTabFolder.java:1644)\n\n\n        at \norg.eclipse.swt.custom.CTabFolder.layoutButtons(CTabFolder.java:871)\n\n        at \norg.eclipse.swt.custom.CTabFolder.layoutItems(CTabFolder.java:1000)\n\n        at org.eclipse.swt.custom.CTabItem.setText(CTabItem.java:496)\n        at \norg.eclipse.ui.internal.PartTabFolder.createPartTab(PartTabFolder.java:241)\n        at \norg.eclipse.ui.internal.PartTabFolder.createControl(PartTabFolder.java:217)\n        at \n\norg.eclipse.ui.internal.PartSashContainer.createControl(PartSashContainer.java:177)\n\n        at \n\norg.eclipse.ui.internal.PerspectivePresentation.activate(PerspectivePresentation.java:88)\n\n\n        at \norg.eclipse.ui.internal.Perspective.onActivate(Perspective.java:565)\n\n        at \norg.eclipse.ui.internal.WorkbenchPage.onActivate(WorkbenchPage.java:1410)\n\n        at \norg.eclipse.ui.internal.WorkbenchWindow$6.run(WorkbenchWindow.java:1068)\n\n\n        at \norg.eclipse.swt.custom.BusyIndicator.showWhile(BusyIndicator.java:56)\n\n        at \n\norg.eclipse.ui.internal.WorkbenchWindow.setActivePage(WorkbenchWindow.java:1055)\n\n        at \norg.eclipse.ui.internal.WorkbenchWindow.restoreState(WorkbenchWindow.java:972)\n\n        at \norg.eclipse.ui.internal.Workbench.restoreState(Workbench.java:794)\n        at org.eclipse.ui.internal.Workbench$5.run(Workbench.java:632)\n        at \n\norg.eclipse.core.internal.runtime.InternalPlatform.run(InternalPlatform.java:838)\n\n        at org.eclipse.core.runtime.Platform.run(Platform.java:411)\n        at \n\norg.eclipse.ui.internal.Workbench.openPreviousWorkbenchState(Workbench.java:610)\n\n        at org.eclipse.ui.internal.Workbench.openWindows(Workbench.java:667)\n        at org.eclipse.ui.internal.Workbench.init(Workbench.java:503)\n        at org.eclipse.ui.internal.Workbench.run(Workbench.java:816)\n        at \n\norg.eclipse.core.internal.boot.InternalBootLoader.run(InternalBootLoader.java:777)\n\n        at org.eclipse.core.boot.BootLoader.run(BootLoader.java:319)\n        at java.lang.reflect.Method.invoke(Native Method)\n        at org.eclipse.core.launcher.Main.basicRun(Main.java:190)\n        at org.eclipse.core.launcher.Main.run(Main.java:549)\n        at org.eclipse.core.launcher.Main.main(Main.java:390)\n\n\nIf I attempt to start eclipse a number of times it will evenually succeed, \nand I can use it without any problems.",
    "Definately odd.",
    "The GTK 1.x port is unsupported. No work is going to be done here. Please use the GTK   \n2.x port."
  ],
  "commentCreationDates": [
    "2002-04-29T23:57:12+02:00",
    "2002-04-30T14:53:52+02:00",
    "2003-05-28T21:52:21+02:00"
  ],
  "traces": [
    {
      "exceptionType": "org.eclipse.swt.SWTError",
      "message": "Unspecified error",
      "elements": [
        {
          "method": "org.eclipse.swt.SWT.error",
          "source": "SWT.java:1912"
        },
        {
          "method": "org.eclipse.swt.SWT.error",
          "source": "SWT.java:1819"
        },
        {
          "method": "org.eclipse.swt.graphics.DefaultGtkStyle.loadDefaultFont",
          "source": "DefaultGtkStyle.java:97"
        },
        {
          "method": "org.eclipse.swt.graphics.GC.\u003cinit\u003e",
          "source": "GC.java:83"
        },
        {
          "method": "org.eclipse.swt.custom.CTabFolder.updateArrowBar",
          "source": "CTabFolder.java:1644"
        },
        {
          "method": "org.eclipse.swt.custom.CTabFolder.layoutButtons",
          "source": "CTabFolder.java:871"
        },
        {
          "method": "org.eclipse.swt.custom.CTabFolder.layoutItems",
          "source": "CTabFolder.java:1000"
        },
        {
          "method": "org.eclipse.swt.custom.CTabItem.setText",
          "source": "CTabItem.java:496"
        },
        {
          "method": "org.eclipse.ui.internal.PartTabFolder.createPartTab",
          "source": "PartTabFolder.java:241"
        },
        {
          "method": "org.eclipse.ui.internal.PartTabFolder.createControl",
          "source": "PartTabFolder.java:217"
        },
        {
          "method": "org.eclipse.ui.internal.PartSashContainer.createControl",
          "source": "PartSashContainer.java:177"
        },
        {
          "method": "org.eclipse.ui.internal.PerspectivePresentation.activate",
          "source": "PerspectivePresentation.java:88"
        },
        {
          "method": "org.eclipse.ui.internal.Perspective.onActivate",
          "source": "Perspective.java:565"
        },
        {
          "method": "org.eclipse.ui.internal.WorkbenchPage.onActivate",
          "source": "WorkbenchPage.java:1410"
        },
        {
          "method": "org.eclipse.ui.internal.WorkbenchWindow$6.run",
          "source": "WorkbenchWindow.java:1068"
        },
        {
          "method": "org.eclipse.swt.custom.BusyIndicator.showWhile",
          "source": "BusyIndicator.java:56"
        },
        {
          "method": "org.eclipse.ui.internal.WorkbenchWindow.setActivePage",
          "source": "WorkbenchWindow.java:1055"
        },
        {
          "method": "org.eclipse.ui.internal.WorkbenchWindow.restoreState",
          "source": "WorkbenchWindow.java:972"
        },
        {
          "method": "org.eclipse.ui.internal.Workbench.restoreState",
          "source": "Workbench.java:794"
        },
        {
          "method": "org.eclipse.ui.internal.Workbench$5.run",
          "source": "Workbench.java:632"
        },
        {
          "method": "org.eclipse.core.internal.runtime.InternalPlatform.run",
          "source": "InternalPlatform.java:838"
        },
        {
          "method": "org.eclipse.core.runtime.Platform.run",
          "source": "Platform.java:411"
        },
        {
          "method": "org.eclipse.ui.internal.Workbench.openPreviousWorkbenchState",
          "source": "Workbench.java:610"
        },
        {
          "method": "org.eclipse.ui.internal.Workbench.openWindows",
          "source": "Workbench.java:667"
        },
        {
          "method": "org.eclipse.ui.internal.Workbench.init",
          "source": "Workbench.java:503"
        },
        {
          "method": "org.eclipse.ui.internal.Workbench.run",
          "source": "Workbench.java:816"
        },
        {
          "method": "org.eclipse.core.internal.boot.InternalBootLoader.run",
          "source": "InternalBootLoader.java:777"
        },
        {
          "method": "org.eclipse.core.boot.BootLoader.run",
          "source": "BootLoader.java:319"
        },
        {
          "method": "java.lang.reflect.Method.invoke",
          "source": "Native Method"
        },
        {
          "method": "org.eclipse.core.launcher.Main.basicRun",
          "source": "Main.java:190"
        },
        {
          "method": "org.eclipse.core.launcher.Main.run",
          "source": "Main.java:549"
        },
        {
          "method": "org.eclipse.core.launcher.Main.main",
          "source": "Main.java:390"
        }
      ],
      "number": 0,
      "commentIndex": 0,
      "bugId": "14883",
      "date": "2002-04-29T23:57:12+02:00",
      "product": "Platform",
      "component": "SWT",
      "severity": "normal"
    }
  ],
  "groupId": "14883",
  "bugId": "14883",
  "date": "2002-04-29T23:57:12+02:00",
  "product": "Platform",
  "component": "SWT",
  "severity": "normal"
}