{
  "comments": [
    "To reproduce:\n\nThe attached update site was created by just clicking through the plugin, \nfeature and site wizard (contains one plugin and one feature). Now I put it\ninto a folder that contains also the Eclipse SDK and\n\n[snip]\nleif@seneca ~/temp/testdigest $ tar xfz eclipse-SDK-I20060620-1010-linux-gtk.tar.gz\nleif@seneca ~/temp/testdigest $ tar xfz s.tar.gz\nleif@seneca ~/temp/testdigest $ java -jar eclipse/startup.jar -data ./workspace -application org.eclipse.update.core.siteOptimizer -digestBuilder -digestOutputDir\u003d. -siteXML\u003ds/site.xml s\nleif@seneca ~/temp/testdigest $ cat ./workspace/.metadata/.log\n!SESSION 2006-06-27 22:05:54.019 -----------------------------------------------\neclipse.buildId\u003dI20060620-1010\njava.version\u003d1.5.0_06\njava.vendor\u003dSun Microsystems Inc.\nBootLoader constants: OS\u003dlinux, ARCH\u003dx86, WS\u003dgtk, NL\u003den_US\nFramework arguments:  -application org.eclipse.update.core.siteOptimizer -digestBuilder -digestOutputDir\u003d. -siteXML\u003ds/site.xml s\nCommand-line arguments:  -data ./workspace -application org.eclipse.update.core.siteOptimizer -digestBuilder -digestOutputDir\u003d. -siteXML\u003ds/site.xml s\n\n!ENTRY org.eclipse.osgi 4 0 2006-06-27 22:06:01.075\n!MESSAGE Application error\n!STACK 1\njava.lang.ArrayIndexOutOfBoundsException: 1\n        at org.eclipse.update.internal.provisional.SiteOptimizerApplication.getFeatureListFromSiteXML(SiteOptimizerApplication.java:469)\n        at org.eclipse.update.internal.provisional.SiteOptimizerApplication.getFeatureList(SiteOptimizerApplication.java:419)\n        at org.eclipse.update.internal.provisional.SiteOptimizerApplication.runDigestBuilder(SiteOptimizerApplication.java:190)\n        at org.eclipse.update.internal.provisional.SiteOptimizerApplication.run(SiteOptimizerApplication.java:511)\n        at org.eclipse.core.internal.runtime.PlatformActivator$1.run(PlatformActivator.java:78)\n        at org.eclipse.core.runtime.internal.adaptor.EclipseAppLauncher.runApplication(EclipseAppLauncher.java:92)\n        at org.eclipse.core.runtime.internal.adaptor.EclipseAppLauncher.start(EclipseAppLauncher.java:68)\n        at org.eclipse.core.runtime.adaptor.EclipseStarter.run(EclipseStarter.java:400)\n        at org.eclipse.core.runtime.adaptor.EclipseStarter.run(EclipseStarter.java:177)\n        at sun.reflect.NativeMethodAccessorImpl.invoke0(Native Method)\n        at sun.reflect.NativeMethodAccessorImpl.invoke(NativeMethodAccessorImpl.java:39)\n        at sun.reflect.DelegatingMethodAccessorImpl.invoke(DelegatingMethodAccessorImpl.java:25)\n        at java.lang.reflect.Method.invoke(Method.java:585)\n        at org.eclipse.core.launcher.Main.invokeFramework(Main.java:336)\n        at org.eclipse.core.launcher.Main.basicRun(Main.java:280)\n        at org.eclipse.core.launcher.Main.run(Main.java:977)\n        at org.eclipse.core.launcher.Main.main(Main.java:952)\n[snap]",
    "Created an attachment (id\u003d45436)\nsite for reproducing the problem\n\n"
  ],
  "commentCreationDates": [
    "2006-06-28T05:58:08+02:00",
    "2006-06-28T06:04:24+02:00"
  ],
  "traces": [
    {
      "exceptionType": "java.lang.ArrayIndexOutOfBoundsException",
      "message": "1",
      "elements": [
        {
          "method": "org.eclipse.update.internal.provisional.SiteOptimizerApplication.getFeatureListFromSiteXML",
          "source": "SiteOptimizerApplication.java:469"
        },
        {
          "method": "org.eclipse.update.internal.provisional.SiteOptimizerApplication.getFeatureList",
          "source": "SiteOptimizerApplication.java:419"
        },
        {
          "method": "org.eclipse.update.internal.provisional.SiteOptimizerApplication.runDigestBuilder",
          "source": "SiteOptimizerApplication.java:190"
        },
        {
          "method": "org.eclipse.update.internal.provisional.SiteOptimizerApplication.run",
          "source": "SiteOptimizerApplication.java:511"
        },
        {
          "method": "org.eclipse.core.internal.runtime.PlatformActivator$1.run",
          "source": "PlatformActivator.java:78"
        },
        {
          "method": "org.eclipse.core.runtime.internal.adaptor.EclipseAppLauncher.runApplication",
          "source": "EclipseAppLauncher.java:92"
        },
        {
          "method": "org.eclipse.core.runtime.internal.adaptor.EclipseAppLauncher.start",
          "source": "EclipseAppLauncher.java:68"
        },
        {
          "method": "org.eclipse.core.runtime.adaptor.EclipseStarter.run",
          "source": "EclipseStarter.java:400"
        },
        {
          "method": "org.eclipse.core.runtime.adaptor.EclipseStarter.run",
          "source": "EclipseStarter.java:177"
        },
        {
          "method": "sun.reflect.NativeMethodAccessorImpl.invoke0",
          "source": "Native Method"
        },
        {
          "method": "sun.reflect.NativeMethodAccessorImpl.invoke",
          "source": "NativeMethodAccessorImpl.java:39"
        },
        {
          "method": "sun.reflect.DelegatingMethodAccessorImpl.invoke",
          "source": "DelegatingMethodAccessorImpl.java:25"
        },
        {
          "method": "java.lang.reflect.Method.invoke",
          "source": "Method.java:585"
        },
        {
          "method": "org.eclipse.core.launcher.Main.invokeFramework",
          "source": "Main.java:336"
        },
        {
          "method": "org.eclipse.core.launcher.Main.basicRun",
          "source": "Main.java:280"
        },
        {
          "method": "org.eclipse.core.launcher.Main.run",
          "source": "Main.java:977"
        },
        {
          "method": "org.eclipse.core.launcher.Main.main",
          "source": "Main.java:952"
        }
      ],
      "number": 0,
      "commentIndex": 0,
      "bugId": "148926",
      "date": "2006-06-28T05:58:08+02:00",
      "product": "Platform",
      "component": "Update",
      "severity": "normal"
    }
  ],
  "groupId": "148926",
  "bugId": "148926",
  "date": "2006-06-28T05:58:08+02:00",
  "product": "Platform",
  "component": "Update",
  "severity": "normal"
}