{
  "comments": [
    "From a quick glance at the code, this seems to be a problem with features that \ndon\u0027t have a provider-name attribute (which should be ok, since that attribute \nis optional). Adding a provider-name in both feature.xml helps. (Btw: the traces below are with an integration build,but I also checked with 3.2 RC7 SDK.)\n\nSteps to reproduce:\n\nThe attached site contains two features, of which one has an externalized \ndescription and a feature.properties file. Both features were created by just\nclicking through the new feature wizard. Now I put it into a folder that \ncontains also the Eclipse SDK and:\n\n[snip]\nleif@seneca ~/temp/testdigest $ tar xfz eclipse-SDK-I20060620-1010-linux-gtk.tar.gz\nleif@seneca ~/temp/testdigest $ tar xfz s.tar.gz\nleif@seneca ~/temp/testdigest $ java -jar eclipse/startup.jar -data ./workspace -application org.eclipse.update.core.siteOptimizer -digestBuilder -digestOutputDir\u003d. -siteXML\u003ds/site.xml s\nExtracting locales from s/features/f1_1.0.0.jar\nExtracting locales from s/features/f2_1.0.0.jar\nProcessing... s/features/f1_1.0.0.jar\nleif@seneca ~/temp/testdigest $ cat ./workspace/.metadata/.log\n!SESSION 2006-06-27 22:23:32.506 -----------------------------------------------\neclipse.buildId\u003dI20060620-1010\njava.version\u003d1.5.0_06\njava.vendor\u003dSun Microsystems Inc.\nBootLoader constants: OS\u003dlinux, ARCH\u003dx86, WS\u003dgtk, NL\u003den_US\nFramework arguments:  -application org.eclipse.update.core.siteOptimizer -digestBuilder -digestOutputDir\u003d. -siteXML\u003ds/site.xml s\nCommand-line arguments:  -data ./workspace -application org.eclipse.update.core.siteOptimizer -digestBuilder -digestOutputDir\u003d. -siteXML\u003ds/site.xml s\n\n!ENTRY org.eclipse.osgi 4 0 2006-06-27 22:23:38.492\n!MESSAGE Application error\n!STACK 1\njava.lang.NullPointerException\n        at org.eclipse.update.internal.provisional.SiteOptimizerApplication.writeFeatureDigest(SiteOptimizerApplication.java:682)\n        at org.eclipse.update.internal.provisional.SiteOptimizerApplication$AvailableLocale.writeFeatureDigests(SiteOptimizerApplication.java:628)\n        at org.eclipse.update.internal.provisional.SiteOptimizerApplication.runDigestBuilder(SiteOptimizerApplication.java:243)\n        at org.eclipse.update.internal.provisional.SiteOptimizerApplication.run(SiteOptimizerApplication.java:511)\n        at org.eclipse.core.internal.runtime.PlatformActivator$1.run(PlatformActivator.java:78)\n        at org.eclipse.core.runtime.internal.adaptor.EclipseAppLauncher.runApplication(EclipseAppLauncher.java:92)\n        at org.eclipse.core.runtime.internal.adaptor.EclipseAppLauncher.start(EclipseAppLauncher.java:68)\n        at org.eclipse.core.runtime.adaptor.EclipseStarter.run(EclipseStarter.java:400)\n        at org.eclipse.core.runtime.adaptor.EclipseStarter.run(EclipseStarter.java:177)\n        at sun.reflect.NativeMethodAccessorImpl.invoke0(Native Method)\n        at sun.reflect.NativeMethodAccessorImpl.invoke(NativeMethodAccessorImpl.java:39)\n        at sun.reflect.DelegatingMethodAccessorImpl.invoke(DelegatingMethodAccessorImpl.java:25)\n        at java.lang.reflect.Method.invoke(Method.java:585)\n        at org.eclipse.core.launcher.Main.invokeFramework(Main.java:336)\n        at org.eclipse.core.launcher.Main.basicRun(Main.java:280)\n        at org.eclipse.core.launcher.Main.run(Main.java:977)\n        at org.eclipse.core.launcher.Main.main(Main.java:952)\n[snap]",
    "Created an attachment (id\u003d45435)\nsite to reproduce the problem\n\n"
  ],
  "commentCreationDates": [
    "2006-06-28T06:02:43+02:00",
    "2006-06-28T06:03:25+02:00"
  ],
  "traces": [
    {
      "exceptionType": "java.lang.NullPointerException",
      "elements": [
        {
          "method": "org.eclipse.update.internal.provisional.SiteOptimizerApplication.writeFeatureDigest",
          "source": "SiteOptimizerApplication.java:682"
        },
        {
          "method": "org.eclipse.update.internal.provisional.SiteOptimizerApplication$AvailableLocale.writeFeatureDigests",
          "source": "SiteOptimizerApplication.java:628"
        },
        {
          "method": "org.eclipse.update.internal.provisional.SiteOptimizerApplication.runDigestBuilder",
          "source": "SiteOptimizerApplication.java:243"
        },
        {
          "method": "org.eclipse.update.internal.provisional.SiteOptimizerApplication.run",
          "source": "SiteOptimizerApplication.java:511"
        },
        {
          "method": "org.eclipse.core.internal.runtime.PlatformActivator$1.run",
          "source": "PlatformActivator.java:78"
        },
        {
          "method": "org.eclipse.core.runtime.internal.adaptor.EclipseAppLauncher.runApplication",
          "source": "EclipseAppLauncher.java:92"
        },
        {
          "method": "org.eclipse.core.runtime.internal.adaptor.EclipseAppLauncher.start",
          "source": "EclipseAppLauncher.java:68"
        },
        {
          "method": "org.eclipse.core.runtime.adaptor.EclipseStarter.run",
          "source": "EclipseStarter.java:400"
        },
        {
          "method": "org.eclipse.core.runtime.adaptor.EclipseStarter.run",
          "source": "EclipseStarter.java:177"
        },
        {
          "method": "sun.reflect.NativeMethodAccessorImpl.invoke0",
          "source": "Native Method"
        },
        {
          "method": "sun.reflect.NativeMethodAccessorImpl.invoke",
          "source": "NativeMethodAccessorImpl.java:39"
        },
        {
          "method": "sun.reflect.DelegatingMethodAccessorImpl.invoke",
          "source": "DelegatingMethodAccessorImpl.java:25"
        },
        {
          "method": "java.lang.reflect.Method.invoke",
          "source": "Method.java:585"
        },
        {
          "method": "org.eclipse.core.launcher.Main.invokeFramework",
          "source": "Main.java:336"
        },
        {
          "method": "org.eclipse.core.launcher.Main.basicRun",
          "source": "Main.java:280"
        },
        {
          "method": "org.eclipse.core.launcher.Main.run",
          "source": "Main.java:977"
        },
        {
          "method": "org.eclipse.core.launcher.Main.main",
          "source": "Main.java:952"
        }
      ],
      "number": 0,
      "commentIndex": 0,
      "bugId": "148927",
      "date": "2006-06-28T06:02:43+02:00",
      "product": "Platform",
      "component": "Update",
      "severity": "normal"
    }
  ],
  "groupId": "148927",
  "bugId": "148927",
  "date": "2006-06-28T06:02:43+02:00",
  "product": "Platform",
  "component": "Update",
  "severity": "normal"
}