{
  "comments": [
    "I am trying to mirror features with the standaloneUpdate for eclipse 3.2 (M20060609-1217).\nUsing the sun jdk 1.4.2 it works though i get a org.xml.sax.SAXParseException that is ignored (see below for the complete log).\nUsing the sun jdk 1.5 it aborts with a org.eclipse.update.internal.core.FatalIOException (see below for the complete log).\nInstalling the same feature with the standaloneUpdate works fine with both jkd\u0027s.\n\nLogs:\n------------------ with jdk 1.4.2 ------------------------------\njava -cp startup.jar org.eclipse.core.launcher.Main -application org.eclipse.update.core.standaloneUpdate -command mirror -from http://download.eclipse.org/callisto/releases/ -featureId org.eclipse.cdt -version 3.1.0.200605290500 -to file:/home/mol/tmp/zzz -consolelog\nAnalyzing features already mirrored ...  Done.\n!SESSION 2006-06-29 12:32:17.101 -----------------------------------------------\neclipse.buildId\u003dM20060609-1217\njava.version\u003d1.4.2\njava.vendor\u003dSun Microsystems Inc.\nBootLoader constants: OS\u003dlinux, ARCH\u003dx86, WS\u003dgtk, NL\u003den_US\nFramework arguments:  -application org.eclipse.update.core.standaloneUpdate -command mirror -from http://download.eclipse.org/callisto/releases/ -featureId org.eclipse.cdt -version 3.1.0.200605290500 -to file:/home/mol/tmp/zzz\nCommand-line arguments:  -application org.eclipse.update.core.standaloneUpdate -command mirror -from http://download.eclipse.org/callisto/releases/ -featureId org.eclipse.cdt -version 3.1.0.200605290500 -to file:/home/mol/tmp/zzz -consolelog\n\n!ENTRY org.eclipse.update.core 4 0 2006-06-29 12:32:27.798\n!MESSAGE Error processing update site mirror. [Character conversion error: \"Malformed UTF-8 char -- is an XML encoding declaration missing?\" (line number may be too low).]\n!STACK 0\norg.xml.sax.SAXParseException: Character conversion error: \"Malformed UTF-8 char -- is an XML encoding declaration missing?\" (line number may be too low).\n        at org.apache.crimson.parser.InputEntity.fatal(InputEntity.java:1100)\n        at org.apache.crimson.parser.InputEntity.fillbuf(InputEntity.java:1072)\n        at org.apache.crimson.parser.InputEntity.isXmlDeclOrTextDeclPrefix(InputEntity.java:914)\n        at org.apache.crimson.parser.Parser2.maybeXmlDecl(Parser2.java:1150)\n        at org.apache.crimson.parser.Parser2.parseInternal(Parser2.java:620)\n        at org.apache.crimson.parser.Parser2.parse(Parser2.java:333)\n        at org.apache.crimson.parser.XMLReaderImpl.parse(XMLReaderImpl.java:448)\n        at org.apache.crimson.jaxp.DocumentBuilderImpl.parse(DocumentBuilderImpl.java:185)\n        at javax.xml.parsers.DocumentBuilder.parse(DocumentBuilder.java:124)\n        at org.eclipse.update.core.model.DefaultSiteParser.getMirrors(DefaultSiteParser.java:829)\n        at org.eclipse.update.core.model.DefaultSiteParser.processSite(DefaultSiteParser.java:514)\n        at org.eclipse.update.core.model.DefaultSiteParser.handleInitialState(DefaultSiteParser.java:396)\n        at org.eclipse.update.core.model.DefaultSiteParser.startElement(DefaultSiteParser.java:200)\n        at org.apache.crimson.parser.Parser2.maybeElement(Parser2.java:1635)\n        at org.apache.crimson.parser.Parser2.parseInternal(Parser2.java:634)\n        at org.apache.crimson.parser.Parser2.parse(Parser2.java:333)\n        at org.apache.crimson.parser.XMLReaderImpl.parse(XMLReaderImpl.java:448)\n        at javax.xml.parsers.SAXParser.parse(SAXParser.java:345)\n        at org.eclipse.update.core.model.DefaultSiteParser.parse(DefaultSiteParser.java:156)\n        at org.eclipse.update.core.model.SiteModelFactory.parseSite(SiteModelFactory.java:81)\n        at org.eclipse.update.internal.core.SiteURLFactory.createSite(SiteURLFactory.java:80)\n        at org.eclipse.update.internal.core.InternalSiteManager.createSite(InternalSiteManager.java:334)\n        at org.eclipse.update.internal.core.InternalSiteManager.createSite(InternalSiteManager.java:326)\n        at org.eclipse.update.internal.core.InternalSiteManager.createSite(InternalSiteManager.java:291)\n        at org.eclipse.update.internal.core.InternalSiteManager.attemptCreateSite(InternalSiteManager.java:222)\n        at org.eclipse.update.internal.core.InternalSiteManager.getSite(InternalSiteManager.java:162)\n        at org.eclipse.update.core.SiteManager.getSite(SiteManager.java:78)\n        at org.eclipse.update.internal.mirror.MirrorCommand.run(MirrorCommand.java:78)\n        at org.eclipse.update.standalone.ScriptedCommand.run(ScriptedCommand.java:64)\n        at org.eclipse.update.standalone.StandaloneUpdateApplication.run(StandaloneUpdateApplication.java:47)\n        at org.eclipse.core.internal.runtime.PlatformActivator$1.run(PlatformActivator.java:78)\n        at org.eclipse.core.runtime.internal.adaptor.EclipseAppLauncher.runApplication(EclipseAppLauncher.java:92)\n        at org.eclipse.core.runtime.internal.adaptor.EclipseAppLauncher.start(EclipseAppLauncher.java:68)\n        at org.eclipse.core.runtime.adaptor.EclipseStarter.run(EclipseStarter.java:400)\n        at org.eclipse.core.runtime.adaptor.EclipseStarter.run(EclipseStarter.java:177)\n        at sun.reflect.NativeMethodAccessorImpl.invoke0(Native Method)\n        at sun.reflect.NativeMethodAccessorImpl.invoke(NativeMethodAccessorImpl.java:39)\n        at sun.reflect.DelegatingMethodAccessorImpl.invoke(DelegatingMethodAccessorImpl.java:25)\n        at java.lang.reflect.Method.invoke(Method.java:324)\n        at org.eclipse.core.launcher.Main.invokeFramework(Main.java:336)\n        at org.eclipse.core.launcher.Main.basicRun(Main.java:280)\n        at org.eclipse.core.launcher.Main.run(Main.java:977)\n        at org.eclipse.core.launcher.Main.main(Main.java:952)\nFeature org.eclipse.cdt_3.1.0.200605290500 will be mirrored.\n Mirroring feature org.eclipse.cdt_3.1.0.200605290500 ...\n Getting plugin entries for org.eclipse.cdt_3.1.0.200605290500 ...\n Getting non plugin entries for org.eclipse.cdt_3.1.0.200605290500 ...\n Getting included features for org.eclipse.cdt_3.1.0.200605290500 ...\n Downloading feature archives for org.eclipse.cdt_3.1.0.200605290500 ...\n Downloading plug-in archives for org.eclipse.cdt_3.1.0.200605290500 ...\n Downloading non plug-in archives for org.eclipse.cdt_3.1.0.200605290500 ...\n Installing child features for org.eclipse.cdt_3.1.0.200605290500 ...\n Storing plug-in archives for org.eclipse.cdt_3.1.0.200605290500 ...\n Storing non plug-in archives for org.eclipse.cdt_3.1.0.200605290500 ...\n Storing feature archives for org.eclipse.cdt_3.1.0.200605290500 ...\n Adding feature org.eclipse.cdt_3.1.0.200605290500 to model ...\n Mirroring feature org.eclipse.cdt_3.1.0.200605290500 finished.\nFeature org.eclipse.cdt_3.1.0.200605290500 added to site.xml.\nInstalling features finished. Updating categories ...\nUpdating categories finished. Updating site description ...\nUpdating site description finished. Saving site.xml ...\nCommand completed successfully.\n\n------------------ with jdk 1.5  ------------------------------\njava -cp startup.jar org.eclipse.core.launcher.Main -application org.eclipse.update.core.standaloneUpdate -command mirror -from http://download.eclipse.org/callisto/releases/ -featureId org.eclipse.cdt -version 3.1.0.200605290500 -to file:/home/mol/tmp/zzz -consolelog\nAnalyzing features already mirrored ...  Done.\nFeature org.eclipse.cdt_3.1.0.200605290500 will be mirrored.\n Mirroring feature org.eclipse.cdt_3.1.0.200605290500 ...\n Getting plugin entries for org.eclipse.cdt_3.1.0.200605290500 ...\n Getting non plugin entries for org.eclipse.cdt_3.1.0.200605290500 ...\n Getting included features for org.eclipse.cdt_3.1.0.200605290500 ...\n Downloading feature archives for org.eclipse.cdt_3.1.0.200605290500 ...\n Downloading plug-in archives for org.eclipse.cdt_3.1.0.200605290500 ...\n Mirroring feature org.eclipse.cdt_3.1.0.200605290500 ...\n Getting plugin entries for org.eclipse.cdt_3.1.0.200605290500 ...\n Getting non plugin entries for org.eclipse.cdt_3.1.0.200605290500 ...\n Getting included features for org.eclipse.cdt_3.1.0.200605290500 ...\n Downloading feature archives for org.eclipse.cdt_3.1.0.200605290500 ...\n Downloading plug-in archives for org.eclipse.cdt_3.1.0.200605290500 ...\n!SESSION 2006-06-29 12:25:09.412 -----------------------------------------------\neclipse.buildId\u003dM20060609-1217\njava.version\u003d1.5.0\njava.vendor\u003dSun Microsystems Inc.\nBootLoader constants: OS\u003dlinux, ARCH\u003dx86, WS\u003dgtk, NL\u003den_US\nFramework arguments:  -application org.eclipse.update.core.standaloneUpdate -command mirror -from http://download.eclipse.org/callisto/releases/ -featureId org.eclipse.cdt -version 3.1.0.200605290500 -to file:/home/mol/tmp/zzz\nCommand-line arguments:  -application org.eclipse.update.core.standaloneUpdate -command mirror -from http://download.eclipse.org/callisto/releases/ -featureId org.eclipse.cdt -version 3.1.0.200605290500 -to file:/home/mol/tmp/zzz -consolelog\n\n!ENTRY org.eclipse.update.core 4 0 2006-06-29 12:25:19.213\n!MESSAGE Unable to retrieve remote reference \"http://download.eclipse.org/callisto/releases/plugins/org.eclipse.cdt.core_3.1.0.200605290500.jar.pack.gz\". [Server returned HTTP response code: \"404 Not Found\" for URL: http://download.eclipse.org/callisto/releases/plugins/org.eclipse.cdt.core_3.1.0.200605290500.jar.pack.gz.]\n!STACK 0\norg.eclipse.update.internal.core.FatalIOException: Server returned HTTP response code: \"404 Not Found\" for URL: http://download.eclipse.org/callisto/releases/plugins/org.eclipse.cdt.core_3.1.0.200605290500.jar.pack.gz.\n        at org.eclipse.update.internal.core.UpdateManagerUtils.checkConnectionResult(UpdateManagerUtils.java:558)\n        at org.eclipse.update.core.ContentReference.getInputStream(ContentReference.java:153)\n        at org.eclipse.update.core.FeatureContentProvider.asLocalReference(FeatureContentProvider.java:268)\n        at org.eclipse.update.internal.core.FeaturePackagedContentProvider.retrieveLocalJar(FeaturePackagedContentProvider.java:222)\n        at org.eclipse.update.internal.core.FeaturePackagedContentProvider.getPluginEntryArchiveReferences(FeaturePackagedContentProvider.java:179)\n        at org.eclipse.update.internal.mirror.MirrorSite.mirrorFeature(MirrorSite.java:256)\n        at org.eclipse.update.internal.mirror.MirrorSite.mirrorAndExposeFeatures(MirrorSite.java:147)\n        at org.eclipse.update.internal.mirror.MirrorSite.mirrorAndExpose(MirrorSite.java:85)\n        at org.eclipse.update.internal.mirror.MirrorCommand.run(MirrorCommand.java:91)\n        at org.eclipse.update.standalone.ScriptedCommand.run(ScriptedCommand.java:64)\n        at org.eclipse.update.standalone.StandaloneUpdateApplication.run(StandaloneUpdateApplication.java:47)\n        at org.eclipse.core.internal.runtime.PlatformActivator$1.run(PlatformActivator.java:78)\n        at org.eclipse.core.runtime.internal.adaptor.EclipseAppLauncher.runApplication(EclipseAppLauncher.java:92)\n        at org.eclipse.core.runtime.internal.adaptor.EclipseAppLauncher.start(EclipseAppLauncher.java:68)\n        at org.eclipse.core.runtime.adaptor.EclipseStarter.run(EclipseStarter.java:400)\n        at org.eclipse.core.runtime.adaptor.EclipseStarter.run(EclipseStarter.java:177)\n        at sun.reflect.NativeMethodAccessorImpl.invoke0(Native Method)\n        at sun.reflect.NativeMethodAccessorImpl.invoke(NativeMethodAccessorImpl.java:39)\n        at sun.reflect.DelegatingMethodAccessorImpl.invoke(DelegatingMethodAccessorImpl.java:25)\n        at java.lang.reflect.Method.invoke(Method.java:585)\n        at org.eclipse.core.launcher.Main.invokeFramework(Main.java:336)\n        at org.eclipse.core.launcher.Main.basicRun(Main.java:280)\n        at org.eclipse.core.launcher.Main.run(Main.java:977)\n        at org.eclipse.core.launcher.Main.main(Main.java:952)\nCommand failed. Please check log file /home/mol/workspace/.metadata/.log for details.",
    "When attempting to download the pack.gz file retrieveLocalJar catches IOException and then just downloads the normal jar.\n\nDuring a normal update, when a progress monitor is being used, a FatalIOException is thrown from FeaturePackagedContentProvider.asLocalReference line 228 when trying to get the size to display in the monitor.  This is caught properly and we proceed with the normal jar.\n\nWhen there is no progress monitor, (ie standaloneUpdate), FatalIOException is thrown by checkConnectionResult, but it is caught by asLocalReference and wrapped in a CoreException, which is not caught by the retrieveLocalJar.",
    "Note, a workaround is to set the system property to turn off pack200:\n-Dorg.eclipse.update.jarprocessor.pack200\u003d@none",
    "*** Bug 152963 has been marked as a duplicate of this bug. ***",
    "Created an attachment (id\u003d47528)\nPatch\n\nAttached patch catches the CoreException when the pack.gz file is not found and proceeds with the normal Jar download.",
    "commited"
  ],
  "commentCreationDates": [
    "2006-06-29T12:40:33+02:00",
    "2006-06-29T17:07:57+02:00",
    "2006-06-29T17:19:05+02:00",
    "2006-08-08T16:39:57+02:00",
    "2006-08-08T16:53:57+02:00",
    "2006-08-22T20:58:25+02:00"
  ],
  "traces": [
    {
      "exceptionType": "org.xml.sax.SAXParseException",
      "message": "Character conversion error: \"Malformed UTF-8 char -- is an XML encoding declaration missing?\" (line number may be too low).",
      "elements": [
        {
          "method": "org.apache.crimson.parser.InputEntity.fatal",
          "source": "InputEntity.java:1100"
        },
        {
          "method": "org.apache.crimson.parser.InputEntity.fillbuf",
          "source": "InputEntity.java:1072"
        },
        {
          "method": "org.apache.crimson.parser.InputEntity.isXmlDeclOrTextDeclPrefix",
          "source": "InputEntity.java:914"
        },
        {
          "method": "org.apache.crimson.parser.Parser2.maybeXmlDecl",
          "source": "Parser2.java:1150"
        },
        {
          "method": "org.apache.crimson.parser.Parser2.parseInternal",
          "source": "Parser2.java:620"
        },
        {
          "method": "org.apache.crimson.parser.Parser2.parse",
          "source": "Parser2.java:333"
        },
        {
          "method": "org.apache.crimson.parser.XMLReaderImpl.parse",
          "source": "XMLReaderImpl.java:448"
        },
        {
          "method": "org.apache.crimson.jaxp.DocumentBuilderImpl.parse",
          "source": "DocumentBuilderImpl.java:185"
        },
        {
          "method": "javax.xml.parsers.DocumentBuilder.parse",
          "source": "DocumentBuilder.java:124"
        },
        {
          "method": "org.eclipse.update.core.model.DefaultSiteParser.getMirrors",
          "source": "DefaultSiteParser.java:829"
        },
        {
          "method": "org.eclipse.update.core.model.DefaultSiteParser.processSite",
          "source": "DefaultSiteParser.java:514"
        },
        {
          "method": "org.eclipse.update.core.model.DefaultSiteParser.handleInitialState",
          "source": "DefaultSiteParser.java:396"
        },
        {
          "method": "org.eclipse.update.core.model.DefaultSiteParser.startElement",
          "source": "DefaultSiteParser.java:200"
        },
        {
          "method": "org.apache.crimson.parser.Parser2.maybeElement",
          "source": "Parser2.java:1635"
        },
        {
          "method": "org.apache.crimson.parser.Parser2.parseInternal",
          "source": "Parser2.java:634"
        },
        {
          "method": "org.apache.crimson.parser.Parser2.parse",
          "source": "Parser2.java:333"
        },
        {
          "method": "org.apache.crimson.parser.XMLReaderImpl.parse",
          "source": "XMLReaderImpl.java:448"
        },
        {
          "method": "javax.xml.parsers.SAXParser.parse",
          "source": "SAXParser.java:345"
        },
        {
          "method": "org.eclipse.update.core.model.DefaultSiteParser.parse",
          "source": "DefaultSiteParser.java:156"
        },
        {
          "method": "org.eclipse.update.core.model.SiteModelFactory.parseSite",
          "source": "SiteModelFactory.java:81"
        },
        {
          "method": "org.eclipse.update.internal.core.SiteURLFactory.createSite",
          "source": "SiteURLFactory.java:80"
        },
        {
          "method": "org.eclipse.update.internal.core.InternalSiteManager.createSite",
          "source": "InternalSiteManager.java:334"
        },
        {
          "method": "org.eclipse.update.internal.core.InternalSiteManager.createSite",
          "source": "InternalSiteManager.java:326"
        },
        {
          "method": "org.eclipse.update.internal.core.InternalSiteManager.createSite",
          "source": "InternalSiteManager.java:291"
        },
        {
          "method": "org.eclipse.update.internal.core.InternalSiteManager.attemptCreateSite",
          "source": "InternalSiteManager.java:222"
        },
        {
          "method": "org.eclipse.update.internal.core.InternalSiteManager.getSite",
          "source": "InternalSiteManager.java:162"
        },
        {
          "method": "org.eclipse.update.core.SiteManager.getSite",
          "source": "SiteManager.java:78"
        },
        {
          "method": "org.eclipse.update.internal.mirror.MirrorCommand.run",
          "source": "MirrorCommand.java:78"
        },
        {
          "method": "org.eclipse.update.standalone.ScriptedCommand.run",
          "source": "ScriptedCommand.java:64"
        },
        {
          "method": "org.eclipse.update.standalone.StandaloneUpdateApplication.run",
          "source": "StandaloneUpdateApplication.java:47"
        },
        {
          "method": "org.eclipse.core.internal.runtime.PlatformActivator$1.run",
          "source": "PlatformActivator.java:78"
        },
        {
          "method": "org.eclipse.core.runtime.internal.adaptor.EclipseAppLauncher.runApplication",
          "source": "EclipseAppLauncher.java:92"
        },
        {
          "method": "org.eclipse.core.runtime.internal.adaptor.EclipseAppLauncher.start",
          "source": "EclipseAppLauncher.java:68"
        },
        {
          "method": "org.eclipse.core.runtime.adaptor.EclipseStarter.run",
          "source": "EclipseStarter.java:400"
        },
        {
          "method": "org.eclipse.core.runtime.adaptor.EclipseStarter.run",
          "source": "EclipseStarter.java:177"
        },
        {
          "method": "sun.reflect.NativeMethodAccessorImpl.invoke0",
          "source": "Native Method"
        },
        {
          "method": "sun.reflect.NativeMethodAccessorImpl.invoke",
          "source": "NativeMethodAccessorImpl.java:39"
        },
        {
          "method": "sun.reflect.DelegatingMethodAccessorImpl.invoke",
          "source": "DelegatingMethodAccessorImpl.java:25"
        },
        {
          "method": "java.lang.reflect.Method.invoke",
          "source": "Method.java:324"
        },
        {
          "method": "org.eclipse.core.launcher.Main.invokeFramework",
          "source": "Main.java:336"
        },
        {
          "method": "org.eclipse.core.launcher.Main.basicRun",
          "source": "Main.java:280"
        },
        {
          "method": "org.eclipse.core.launcher.Main.run",
          "source": "Main.java:977"
        },
        {
          "method": "org.eclipse.core.launcher.Main.main",
          "source": "Main.java:952"
        }
      ],
      "number": 0,
      "commentIndex": 0,
      "bugId": "149128",
      "date": "2006-06-29T12:40:33+02:00",
      "product": "Platform",
      "component": "Update",
      "severity": "normal"
    },
    {
      "exceptionType": "org.eclipse.update.internal.core.FatalIOException",
      "message": "Server returned HTTP response code: \"404 Not Found\" for URL: http://download.eclipse.org/callisto/releases/plugins/org.eclipse.cdt.core_3.1.0.200605290500.jar.pack.gz.",
      "elements": [
        {
          "method": "org.eclipse.update.internal.core.UpdateManagerUtils.checkConnectionResult",
          "source": "UpdateManagerUtils.java:558"
        },
        {
          "method": "org.eclipse.update.core.ContentReference.getInputStream",
          "source": "ContentReference.java:153"
        },
        {
          "method": "org.eclipse.update.core.FeatureContentProvider.asLocalReference",
          "source": "FeatureContentProvider.java:268"
        },
        {
          "method": "org.eclipse.update.internal.core.FeaturePackagedContentProvider.retrieveLocalJar",
          "source": "FeaturePackagedContentProvider.java:222"
        },
        {
          "method": "org.eclipse.update.internal.core.FeaturePackagedContentProvider.getPluginEntryArchiveReferences",
          "source": "FeaturePackagedContentProvider.java:179"
        },
        {
          "method": "org.eclipse.update.internal.mirror.MirrorSite.mirrorFeature",
          "source": "MirrorSite.java:256"
        },
        {
          "method": "org.eclipse.update.internal.mirror.MirrorSite.mirrorAndExposeFeatures",
          "source": "MirrorSite.java:147"
        },
        {
          "method": "org.eclipse.update.internal.mirror.MirrorSite.mirrorAndExpose",
          "source": "MirrorSite.java:85"
        },
        {
          "method": "org.eclipse.update.internal.mirror.MirrorCommand.run",
          "source": "MirrorCommand.java:91"
        },
        {
          "method": "org.eclipse.update.standalone.ScriptedCommand.run",
          "source": "ScriptedCommand.java:64"
        },
        {
          "method": "org.eclipse.update.standalone.StandaloneUpdateApplication.run",
          "source": "StandaloneUpdateApplication.java:47"
        },
        {
          "method": "org.eclipse.core.internal.runtime.PlatformActivator$1.run",
          "source": "PlatformActivator.java:78"
        },
        {
          "method": "org.eclipse.core.runtime.internal.adaptor.EclipseAppLauncher.runApplication",
          "source": "EclipseAppLauncher.java:92"
        },
        {
          "method": "org.eclipse.core.runtime.internal.adaptor.EclipseAppLauncher.start",
          "source": "EclipseAppLauncher.java:68"
        },
        {
          "method": "org.eclipse.core.runtime.adaptor.EclipseStarter.run",
          "source": "EclipseStarter.java:400"
        },
        {
          "method": "org.eclipse.core.runtime.adaptor.EclipseStarter.run",
          "source": "EclipseStarter.java:177"
        },
        {
          "method": "sun.reflect.NativeMethodAccessorImpl.invoke0",
          "source": "Native Method"
        },
        {
          "method": "sun.reflect.NativeMethodAccessorImpl.invoke",
          "source": "NativeMethodAccessorImpl.java:39"
        },
        {
          "method": "sun.reflect.DelegatingMethodAccessorImpl.invoke",
          "source": "DelegatingMethodAccessorImpl.java:25"
        },
        {
          "method": "java.lang.reflect.Method.invoke",
          "source": "Method.java:585"
        },
        {
          "method": "org.eclipse.core.launcher.Main.invokeFramework",
          "source": "Main.java:336"
        },
        {
          "method": "org.eclipse.core.launcher.Main.basicRun",
          "source": "Main.java:280"
        },
        {
          "method": "org.eclipse.core.launcher.Main.run",
          "source": "Main.java:977"
        },
        {
          "method": "org.eclipse.core.launcher.Main.main",
          "source": "Main.java:952"
        }
      ],
      "number": 1,
      "commentIndex": 0,
      "bugId": "149128",
      "date": "2006-06-29T12:40:33+02:00",
      "product": "Platform",
      "component": "Update",
      "severity": "normal"
    }
  ],
  "groupId": "149128",
  "bugId": "149128",
  "date": "2006-06-29T12:40:33+02:00",
  "product": "Platform",
  "component": "Update",
  "severity": "normal"
}