{
  "comments": [
    "hi,\nI created a sample equinox bundle that prints \"hello\". \nIt works fine when it is started from eclipse.\n\nBut problem occurs when the osgi.jar is started from commandline.\nThe sample bundle gets installed and resolved.. but when i tried to start it.. it gives the error.\n\norg.osgi.framework.BundleException: The activator karbundle.Activator for bundle\n karbundle is invalid\n        at org.eclipse.osgi.framework.internal.core.AbstractBundle.loadBundleAct\nivator(AbstractBundle.java:141)\n        at org.eclipse.osgi.framework.internal.core.BundleContextImpl.start(Bund\nleContextImpl.java:966)\n        at org.eclipse.osgi.framework.internal.core.BundleHost.startWorker(Bundl\neHost.java:317)\n        at org.eclipse.osgi.framework.internal.core.AbstractBundle.start(Abstrac\ntBundle.java:256)\n        at org.eclipse.osgi.framework.internal.core.FrameworkCommandProvider._st\nart(FrameworkCommandProvider.java:239)\n        at sun.reflect.NativeMethodAccessorImpl.invoke0(Native Method)\n        at sun.reflect.NativeMethodAccessorImpl.invoke(Unknown Source)\n        at sun.reflect.DelegatingMethodAccessorImpl.invoke(Unknown Source)\n        at java.lang.reflect.Method.invoke(Unknown Source)\n        at org.eclipse.osgi.framework.internal.core.FrameworkCommandInterpreter.\nexecute(FrameworkCommandInterpreter.java:145)\n        at org.eclipse.osgi.framework.internal.core.FrameworkConsole.docommand(F\nrameworkConsole.java:293)\n        at org.eclipse.osgi.framework.internal.core.FrameworkConsole.console(Fra\nmeworkConsole.java:278)\n        at org.eclipse.osgi.framework.internal.core.FrameworkConsole.run(Framewo\nrkConsole.java:213)\n        at java.lang.Thread.run(Unknown Source)\nCaused by: java.lang.ClassNotFoundException: karbundle.Activator\n        at org.eclipse.osgi.framework.internal.core.BundleLoader.findClass(Bundl\neLoader.java:407)\n        at org.eclipse.osgi.framework.internal.core.BundleLoader.findClass(Bundl\neLoader.java:352)\n        at org.eclipse.osgi.internal.baseadaptor.DefaultClassLoader.loadClass(De\nfaultClassLoader.java:83)\n        at java.lang.ClassLoader.loadClass(Unknown Source)\n        at org.eclipse.osgi.framework.internal.core.BundleLoader.loadClass(Bundl\neLoader.java:276)\n        at org.eclipse.osgi.framework.internal.core.BundleHost.loadClass(BundleH\nost.java:227)\n        at org.eclipse.osgi.framework.internal.core.AbstractBundle.loadBundleAct\nivator(AbstractBundle.java:134)\n        ... 13 more\nNested Exception:\njava.lang.ClassNotFoundException: karbundle.Activator\n        at org.eclipse.osgi.framework.internal.core.BundleLoader.findClass(Bundl\neLoader.java:407)\n        at org.eclipse.osgi.framework.internal.core.BundleLoader.findClass(Bundl\neLoader.java:352)\n        at org.eclipse.osgi.internal.baseadaptor.DefaultClassLoader.loadClass(De\nfaultClassLoader.java:83)\n        at java.lang.ClassLoader.loadClass(Unknown Source)\n        at org.eclipse.osgi.framework.internal.core.BundleLoader.loadClass(Bundl\neLoader.java:276)\n        at org.eclipse.osgi.framework.internal.core.BundleHost.loadClass(BundleH\nost.java:227)\n        at org.eclipse.osgi.framework.internal.core.AbstractBundle.loadBundleAct\nivator(AbstractBundle.java:134)\n        at org.eclipse.osgi.framework.internal.core.BundleContextImpl.start(Bund\nleContextImpl.java:966)\n        at org.eclipse.osgi.framework.internal.core.BundleHost.startWorker(Bundl\neHost.java:317)\n        at org.eclipse.osgi.framework.internal.core.AbstractBundle.start(Abstrac\ntBundle.java:256)\n        at org.eclipse.osgi.framework.internal.core.FrameworkCommandProvider._st\nart(FrameworkCommandProvider.java:239)\n        at sun.reflect.NativeMethodAccessorImpl.invoke0(Native Method)\n        at sun.reflect.NativeMethodAccessorImpl.invoke(Unknown Source)\n        at sun.reflect.DelegatingMethodAccessorImpl.invoke(Unknown Source)\n        at java.lang.reflect.Method.invoke(Unknown Source)\n        at org.eclipse.osgi.framework.internal.core.FrameworkCommandInterpreter.\nexecute(FrameworkCommandInterpreter.java:145)\n        at org.eclipse.osgi.framework.internal.core.FrameworkConsole.docommand(F\nrameworkConsole.java:293)\n        at org.eclipse.osgi.framework.internal.core.FrameworkConsole.console(Fra\nmeworkConsole.java:278)\n        at org.eclipse.osgi.framework.internal.core.FrameworkConsole.run(Framewo\nrkConsole.java:213)\n        at java.lang.Thread.run(Unknown Source)\nNested Exception:\njava.lang.ClassNotFoundException: karbundle.Activator\n        at org.eclipse.osgi.framework.internal.core.BundleLoader.findClass(Bundl\neLoader.java:407)\n        at org.eclipse.osgi.framework.internal.core.BundleLoader.findClass(Bundl\neLoader.java:352)\n        at org.eclipse.osgi.internal.baseadaptor.DefaultClassLoader.loadClass(De\nfaultClassLoader.java:83)\n        at java.lang.ClassLoader.loadClass(Unknown Source)\n        at org.eclipse.osgi.framework.internal.core.BundleLoader.loadClass(Bundl\neLoader.java:276)\n        at org.eclipse.osgi.framework.internal.core.BundleHost.loadClass(BundleH\nost.java:227)\n        at org.eclipse.osgi.framework.internal.core.AbstractBundle.loadBundleAct\nivator(AbstractBundle.java:134)\n        at org.eclipse.osgi.framework.internal.core.BundleContextImpl.start(Bund\nleContextImpl.java:966)\n        at org.eclipse.osgi.framework.internal.core.BundleHost.startWorker(Bundl\neHost.java:317)\n        at org.eclipse.osgi.framework.internal.core.AbstractBundle.start(Abstrac\ntBundle.java:256)\n        at org.eclipse.osgi.framework.internal.core.FrameworkCommandProvider._st\nart(FrameworkCommandProvider.java:239)\n        at sun.reflect.NativeMethodAccessorImpl.invoke0(Native Method)\n        at sun.reflect.NativeMethodAccessorImpl.invoke(Unknown Source)\n        at sun.reflect.DelegatingMethodAccessorImpl.invoke(Unknown Source)\n        at java.lang.reflect.Method.invoke(Unknown Source)\n        at org.eclipse.osgi.framework.internal.core.FrameworkCommandInterpreter.\nexecute(FrameworkCommandInterpreter.java:145)\n        at org.eclipse.osgi.framework.internal.core.FrameworkConsole.docommand(F\nrameworkConsole.java:293)\n        at org.eclipse.osgi.framework.internal.core.FrameworkConsole.console(Fra\nmeworkConsole.java:278)\n        at org.eclipse.osgi.framework.internal.core.FrameworkConsole.run(Framewo\nrkConsole.java:213)\n        at java.lang.Thread.run(Unknown Source)\n\nwhat is the problem here\nthanks in advance",
    "Please attach the hello bundle jar that is failing.  My guess is that your Bundle-ClassPath is pointing to an \"inner\" jar that does not get included in your built bundle jar.",
    "It does not depend on any inner jar.The thing is that i did not export it as a separate .jar.Just tried to install the plug-in project folder.\ne.g\ninstall reference:file:D:\\sample\\bundle1\nwhere\nbundle1  - plug-in pjt folder\n\nIt got installed and even got resolved.So i expected it to run.Why it did not?\n\n",
    "It does not depend on any inner jar.The thing is that i did not export it as a separate .jar.Just tried to install the plug-in project folder.\ne.g\ninstall reference:file:D:\\sample\\bundle1\nwhere\nbundle1  - plug-in pjt folder\n\nIt got installed and even got resolved.So i expected it to run.Why it did not?\n\n",
    "This is not valid.\n\nPDE launches the framework in dev (using -dev \u003cpath to dev.properties\u003e).  The dev.properties file tells the runtime additional directories to add to the bundle classpath for particular bundles in your workspace.  By default the plugin project uses the \"bin\" directory in your project to store built classes.  When you install a bundle manually this extra bit of information is not passed to the framework.\n\nIf you really want to do this you can use a project the uses its root directory for the source and output location of your java classes.  This way no additional \"bin\" directories need to be added at development time."
  ],
  "commentCreationDates": [
    "2006-07-25T13:26:08+02:00",
    "2006-07-25T14:55:41+02:00",
    "2006-07-25T15:42:27+02:00",
    "2006-07-25T15:47:47+02:00",
    "2006-07-25T16:06:26+02:00"
  ],
  "traces": [
    {
      "exceptionType": "org.osgi.framework.BundleException",
      "message": "The activator karbundle.Activator for bundle  karbundle is invalid",
      "elements": [
        {
          "method": "org.eclipse.osgi.framework.internal.core.AbstractBundle.loadBundleActivator",
          "source": "AbstractBundle.java:141"
        },
        {
          "method": "org.eclipse.osgi.framework.internal.core.BundleContextImpl.start",
          "source": "Bund leContextImpl.java:966"
        },
        {
          "method": "org.eclipse.osgi.framework.internal.core.BundleHost.startWorker",
          "source": "Bundl eHost.java:317"
        },
        {
          "method": "org.eclipse.osgi.framework.internal.core.AbstractBundle.start",
          "source": "Abstrac tBundle.java:256"
        },
        {
          "method": "org.eclipse.osgi.framework.internal.core.FrameworkCommandProvider._start",
          "source": "FrameworkCommandProvider.java:239"
        },
        {
          "method": "sun.reflect.NativeMethodAccessorImpl.invoke0",
          "source": "Native Method"
        },
        {
          "method": "sun.reflect.NativeMethodAccessorImpl.invoke",
          "source": "Unknown Source"
        },
        {
          "method": "sun.reflect.DelegatingMethodAccessorImpl.invoke",
          "source": "Unknown Source"
        },
        {
          "method": "java.lang.reflect.Method.invoke",
          "source": "Unknown Source"
        },
        {
          "method": "org.eclipse.osgi.framework.internal.core.FrameworkCommandInterpreter.execute",
          "source": "FrameworkCommandInterpreter.java:145"
        },
        {
          "method": "org.eclipse.osgi.framework.internal.core.FrameworkConsole.docommand",
          "source": "F rameworkConsole.java:293"
        },
        {
          "method": "org.eclipse.osgi.framework.internal.core.FrameworkConsole.console",
          "source": "Fra meworkConsole.java:278"
        },
        {
          "method": "org.eclipse.osgi.framework.internal.core.FrameworkConsole.run",
          "source": "Framewo rkConsole.java:213"
        },
        {
          "method": "java.lang.Thread.run",
          "source": "Unknown Source"
        }
      ],
      "causedBy": {
        "exceptionType": "java.lang.ClassNotFoundException",
        "message": "karbundle.Activator",
        "elements": [
          {
            "method": "org.eclipse.osgi.framework.internal.core.BundleLoader.findClass",
            "source": "Bundl eLoader.java:407"
          },
          {
            "method": "org.eclipse.osgi.framework.internal.core.BundleLoader.findClass",
            "source": "Bundl eLoader.java:352"
          },
          {
            "method": "org.eclipse.osgi.internal.baseadaptor.DefaultClassLoader.loadClass",
            "source": "De faultClassLoader.java:83"
          },
          {
            "method": "java.lang.ClassLoader.loadClass",
            "source": "Unknown Source"
          },
          {
            "method": "org.eclipse.osgi.framework.internal.core.BundleLoader.loadClass",
            "source": "Bundl eLoader.java:276"
          },
          {
            "method": "org.eclipse.osgi.framework.internal.core.BundleHost.loadClass",
            "source": "BundleH ost.java:227"
          },
          {
            "method": "org.eclipse.osgi.framework.internal.core.AbstractBundle.loadBundleActivator",
            "source": "AbstractBundle.java:134"
          }
        ],
        "number": 0,
        "commentIndex": 0
      },
      "number": 0,
      "commentIndex": 0,
      "bugId": "151680",
      "date": "2006-07-25T13:26:08+02:00",
      "product": "Equinox",
      "component": "Bundles",
      "severity": "normal"
    },
    {
      "exceptionType": "java.lang.ClassNotFoundException",
      "message": "karbundle.Activator",
      "elements": [
        {
          "method": "org.eclipse.osgi.framework.internal.core.BundleLoader.findClass",
          "source": "Bundl eLoader.java:407"
        },
        {
          "method": "org.eclipse.osgi.framework.internal.core.BundleLoader.findClass",
          "source": "Bundl eLoader.java:352"
        },
        {
          "method": "org.eclipse.osgi.internal.baseadaptor.DefaultClassLoader.loadClass",
          "source": "De faultClassLoader.java:83"
        },
        {
          "method": "java.lang.ClassLoader.loadClass",
          "source": "Unknown Source"
        },
        {
          "method": "org.eclipse.osgi.framework.internal.core.BundleLoader.loadClass",
          "source": "Bundl eLoader.java:276"
        },
        {
          "method": "org.eclipse.osgi.framework.internal.core.BundleHost.loadClass",
          "source": "BundleH ost.java:227"
        },
        {
          "method": "org.eclipse.osgi.framework.internal.core.AbstractBundle.loadBundleActivator",
          "source": "AbstractBundle.java:134"
        },
        {
          "method": "org.eclipse.osgi.framework.internal.core.BundleContextImpl.start",
          "source": "Bund leContextImpl.java:966"
        },
        {
          "method": "org.eclipse.osgi.framework.internal.core.BundleHost.startWorker",
          "source": "Bundl eHost.java:317"
        },
        {
          "method": "org.eclipse.osgi.framework.internal.core.AbstractBundle.start",
          "source": "Abstrac tBundle.java:256"
        },
        {
          "method": "org.eclipse.osgi.framework.internal.core.FrameworkCommandProvider._start",
          "source": "FrameworkCommandProvider.java:239"
        },
        {
          "method": "sun.reflect.NativeMethodAccessorImpl.invoke0",
          "source": "Native Method"
        },
        {
          "method": "sun.reflect.NativeMethodAccessorImpl.invoke",
          "source": "Unknown Source"
        },
        {
          "method": "sun.reflect.DelegatingMethodAccessorImpl.invoke",
          "source": "Unknown Source"
        },
        {
          "method": "java.lang.reflect.Method.invoke",
          "source": "Unknown Source"
        },
        {
          "method": "org.eclipse.osgi.framework.internal.core.FrameworkCommandInterpreter.execute",
          "source": "FrameworkCommandInterpreter.java:145"
        },
        {
          "method": "org.eclipse.osgi.framework.internal.core.FrameworkConsole.docommand",
          "source": "F rameworkConsole.java:293"
        },
        {
          "method": "org.eclipse.osgi.framework.internal.core.FrameworkConsole.console",
          "source": "Fra meworkConsole.java:278"
        },
        {
          "method": "org.eclipse.osgi.framework.internal.core.FrameworkConsole.run",
          "source": "Framewo rkConsole.java:213"
        },
        {
          "method": "java.lang.Thread.run",
          "source": "Unknown Source"
        }
      ],
      "number": 1,
      "commentIndex": 0,
      "bugId": "151680",
      "date": "2006-07-25T13:26:08+02:00",
      "product": "Equinox",
      "component": "Bundles",
      "severity": "normal"
    },
    {
      "exceptionType": "java.lang.ClassNotFoundException",
      "message": "karbundle.Activator",
      "elements": [
        {
          "method": "org.eclipse.osgi.framework.internal.core.BundleLoader.findClass",
          "source": "Bundl eLoader.java:407"
        },
        {
          "method": "org.eclipse.osgi.framework.internal.core.BundleLoader.findClass",
          "source": "Bundl eLoader.java:352"
        },
        {
          "method": "org.eclipse.osgi.internal.baseadaptor.DefaultClassLoader.loadClass",
          "source": "De faultClassLoader.java:83"
        },
        {
          "method": "java.lang.ClassLoader.loadClass",
          "source": "Unknown Source"
        },
        {
          "method": "org.eclipse.osgi.framework.internal.core.BundleLoader.loadClass",
          "source": "Bundl eLoader.java:276"
        },
        {
          "method": "org.eclipse.osgi.framework.internal.core.BundleHost.loadClass",
          "source": "BundleH ost.java:227"
        },
        {
          "method": "org.eclipse.osgi.framework.internal.core.AbstractBundle.loadBundleActivator",
          "source": "AbstractBundle.java:134"
        },
        {
          "method": "org.eclipse.osgi.framework.internal.core.BundleContextImpl.start",
          "source": "Bund leContextImpl.java:966"
        },
        {
          "method": "org.eclipse.osgi.framework.internal.core.BundleHost.startWorker",
          "source": "Bundl eHost.java:317"
        },
        {
          "method": "org.eclipse.osgi.framework.internal.core.AbstractBundle.start",
          "source": "Abstrac tBundle.java:256"
        },
        {
          "method": "org.eclipse.osgi.framework.internal.core.FrameworkCommandProvider._start",
          "source": "FrameworkCommandProvider.java:239"
        },
        {
          "method": "sun.reflect.NativeMethodAccessorImpl.invoke0",
          "source": "Native Method"
        },
        {
          "method": "sun.reflect.NativeMethodAccessorImpl.invoke",
          "source": "Unknown Source"
        },
        {
          "method": "sun.reflect.DelegatingMethodAccessorImpl.invoke",
          "source": "Unknown Source"
        },
        {
          "method": "java.lang.reflect.Method.invoke",
          "source": "Unknown Source"
        },
        {
          "method": "org.eclipse.osgi.framework.internal.core.FrameworkCommandInterpreter.execute",
          "source": "FrameworkCommandInterpreter.java:145"
        },
        {
          "method": "org.eclipse.osgi.framework.internal.core.FrameworkConsole.docommand",
          "source": "F rameworkConsole.java:293"
        },
        {
          "method": "org.eclipse.osgi.framework.internal.core.FrameworkConsole.console",
          "source": "Fra meworkConsole.java:278"
        },
        {
          "method": "org.eclipse.osgi.framework.internal.core.FrameworkConsole.run",
          "source": "Framewo rkConsole.java:213"
        },
        {
          "method": "java.lang.Thread.run",
          "source": "Unknown Source"
        }
      ],
      "number": 2,
      "commentIndex": 0,
      "bugId": "151680",
      "date": "2006-07-25T13:26:08+02:00",
      "product": "Equinox",
      "component": "Bundles",
      "severity": "normal"
    }
  ],
  "groupId": "151680",
  "bugId": "151680",
  "date": "2006-07-25T13:26:08+02:00",
  "product": "Equinox",
  "component": "Bundles",
  "severity": "normal"
}