{
  "comments": [
    "Building of a large project fails while weaving. \nNPE in EclipseSourceContext.removeUnnecessaryProblems(..)\n\nThe project was just migrated to Eclipse 3.2\nEclipse newly installed with Eclipse SDK and via Update manager with\nAJDT, CDT, Web/J2EE tools, SubClipse, SpringIDE.\n\nSame Project workes in Eclipse 3.1.\nSimple Test AspectJ-Project workes OK\nBuilding with Ant/AspectJ compiler (as external Tools Launch in Eclipse)\nworks.\n\nI tried the following, but got the error anyway:\n - Checked out as a new AspectJ Project\n - upgraded to the developement Version of AJDT",
    "Version: 1.4.1\nBuild id: 20060726064959\nAspectJ version: 1.5.3.20060726092219\n\n\nStacktrace/Error Output:\njava.lang.NullPointerException\nat org.aspectj.ajdt.internal.core.builder.EclipseSourceContext.removeUnnecessaryProblems(EclipseSourceContext.java:82)\nat org.aspectj.weaver.bcel.BcelAdvice.removeUnnecessaryProblems(BcelAdvice.java:297)\nat org.aspectj.weaver.bcel.BcelAdvice.implementOn(BcelAdvice.java:214)\nat org.aspectj.weaver.Shadow.implementMungers(Shadow.java:684)\nat org.aspectj.weaver.Shadow.implement(Shadow.java:471)\nat org.aspectj.weaver.bcel.BcelClassWeaver.implement(BcelClassWeaver.java:2825)\nat org.aspectj.weaver.bcel.BcelClassWeaver.weave(BcelClassWeaver.java:502)\nat org.aspectj.weaver.bcel.BcelClassWeaver.weave(BcelClassWeaver.java:115)\nat org.aspectj.weaver.bcel.BcelWeaver.weave(BcelWeaver.java:1591)\nat org.aspectj.weaver.bcel.BcelWeaver.weaveWithoutDump(BcelWeaver.java:1542)\nat org.aspectj.weaver.bcel.BcelWeaver.weaveAndNotify(BcelWeaver.java:1322)\nat org.aspectj.weaver.bcel.BcelWeaver.weave(BcelWeaver.java:1143)\nat org.aspectj.ajdt.internal.compiler.AjCompilerAdapter.weave(AjCompilerAdapter.java:321)\nat org.aspectj.ajdt.internal.compiler.AjCompilerAdapter.afterCompiling(AjCompilerAdapter.java:192)\nat org.aspectj.ajdt.internal.compiler.CompilerAdapter.ajc$afterReturning$org_aspectj_ajdt_internal_compiler_CompilerAdapter$2$f9cc9ca0(CompilerAdapter.aj:70)\nat org.aspectj.org.eclipse.jdt.internal.compiler.Compiler.compile(Compiler.java:367)\nat org.aspectj.ajdt.internal.core.builder.AjBuildManager.performCompilation(AjBuildManager.java:890)\nat org.aspectj.ajdt.internal.core.builder.AjBuildManager.doBuild(AjBuildManager.java:245)\nat org.aspectj.ajdt.internal.core.builder.AjBuildManager.batchBuild(AjBuildManager.java:164)\nat org.aspectj.ajde.internal.CompilerAdapter.compile(CompilerAdapter.java:122)\nat org.aspectj.ajde.internal.AspectJBuildManager$CompilerThread.run(AspectJBuildManager.java:191)\n\ntrouble in: \npublic abstract class baag.boa.esn.client.ESNEnumDao extends java.lang.Object implements baag.boa.mvc.element.enums.EnumFilter:\n  protected baag.boa.common.interfaces.ESN esn\n  private String filterDaoID\n  private baag.boa.esn.server.workflowfw.dao.ClientDataDao filterDAO\n  private static final org.aspectj.lang.JoinPoint$StaticPart ajc$tjp_0 [Synthetic]\n  public void \u003cinit\u003e():\n                    ALOAD_0     // Lbaag/boa/esn/client/ESNEnumDao; this   (line 37)\n                    INVOKESPECIAL java.lang.Object.\u003cinit\u003e ()V\n    constructor-execution(void baag.boa.esn.client.ESNEnumDao.\u003cinit\u003e())\n    |               ALOAD_0     // Lbaag/boa/esn/client/ESNEnumDao; this   (line 47)\n    |               ACONST_NULL\n    |               PUTFIELD baag.boa.esn.client.ESNEnumDao.filterDaoID Ljava/lang/String;\n    |               ALOAD_0     // Lbaag/boa/esn/client/ESNEnumDao; this   (line 59)\n    |               ACONST_NULL\n    |               PUTFIELD baag.boa.esn.client.ESNEnumDao.filterDAO Lbaag/boa/esn/server/workflowfw/dao/ClientDataDao;\n    |               RETURN   (line 37)\n    constructor-execution(void baag.boa.esn.client.ESNEnumDao.\u003cinit\u003e())\n  end public void \u003cinit\u003e()\n\n  public void setEsn(baag.boa.common.interfaces.ESN)    org.aspectj.weaver.MethodDeclarationLineNumber: 42:1596\n:\n    method-execution(void baag.boa.esn.client.ESNEnumDao.setEsn(baag.boa.common.interfaces.ESN))\n    |               ALOAD_0     // Lbaag/boa/esn/client/ESNEnumDao; this   (line 42)\n    |               ALOAD_1     // Lbaag/boa/common/interfaces/ESN; esn\n    |               PUTFIELD baag.boa.esn.client.ESNEnumDao.esn Lbaag/boa/common/interfaces/ESN;\n    |               RETURN\n    method-execution(void baag.boa.esn.client.ESNEnumDao.setEsn(baag.boa.common.interfaces.ESN))\n  end public void setEsn(baag.boa.common.interfaces.ESN)\n\n  public void setFilterDaoID(String)    org.aspectj.weaver.MethodDeclarationLineNumber: 46:1754\n:\n    method-execution(void baag.boa.esn.client.ESNEnumDao.setFilterDaoID(java.lang.String))\n    |               ALOAD_0     // Lbaag/boa/esn/client/ESNEnumDao; this   (line 46)\n    |               ALOAD_1     // Ljava/lang/String; fidID\n    |               PUTFIELD baag.boa.esn.client.ESNEnumDao.filterDaoID Ljava/lang/String;\n    |               RETURN\n    method-execution(void baag.boa.esn.client.ESNEnumDao.setFilterDaoID(java.lang.String))\n  end public void setFilterDaoID(String)\n\n  protected baag.boa.esn.server.workflowfw.dao.ClientDataDao getFilter() throws baag.boa.exception.BOAException    org.aspectj.weaver.MethodDeclarationLineNumber: 51:1946\n:\n    method-execution(baag.boa.esn.server.workflowfw.dao.ClientDataDao baag.boa.esn.client.ESNEnumDao.getFilter())\n    |               ALOAD_0     // Lbaag/boa/esn/client/ESNEnumDao; this   (line 52)\n    | field-get(baag.boa.esn.server.workflowfw.dao.ClientDataDao baag.boa.esn.client.ESNEnumDao.filterDAO)\n    | |             GETFIELD baag.boa.esn.client.ESNEnumDao.filterDAO Lbaag/boa/esn/server/workflowfw/dao/ClientDataDao;\n    | field-get(baag.boa.esn.server.workflowfw.dao.ClientDataDao baag.boa.esn.client.ESNEnumDao.filterDAO)\n    |               IFNONNULL L1\n    |               ALOAD_0     // Lbaag/boa/esn/client/ESNEnumDao; this   (line 53)\n    | field-get(java.lang.String baag.boa.esn.client.ESNEnumDao.filterDaoID)\n    | |             GETFIELD baag.boa.esn.client.ESNEnumDao.filterDaoID Ljava/lang/String;\n    | field-get(java.lang.String baag.boa.esn.client.ESNEnumDao.filterDaoID)\n    |               IFNONNULL L0\n    |               NEW baag.boa.exception.BOARuntimeException   (line 54)\n    |               DUP\n    |               LDC \"Fehlkonfig: ID f?r Filter-DAO nicht definiert.\"\n    | constructor-call(void baag.boa.exception.BOARuntimeException.\u003cinit\u003e(java.lang.String))\n    | |             INVOKESPECIAL baag.boa.exception.BOARuntimeException.\u003cinit\u003e (Ljava/lang/String;)V\n    | constructor-call(void baag.boa.exception.BOARuntimeException.\u003cinit\u003e(java.lang.String))\n    |               ATHROW\n    |           L0: ALOAD_0     // Lbaag/boa/esn/client/ESNEnumDao; this   (line 55)\n    |               ALOAD_0     // Lbaag/boa/esn/client/ESNEnumDao; this\n    | field-get(baag.boa.common.interfaces.ESN baag.boa.esn.client.ESNEnumDao.esn)\n    | |             GETFIELD baag.boa.esn.client.ESNEnumDao.esn Lbaag/boa/common/interfaces/ESN;\n    | field-get(baag.boa.common.interfaces.ESN baag.boa.esn.client.ESNEnumDao.esn)\n    |               ALOAD_0     // Lbaag/boa/esn/client/ESNEnumDao; this\n    | field-get(java.lang.String baag.boa.esn.client.ESNEnumDao.filterDaoID)\n    | |             GETFIELD baag.boa.esn.client.ESNEnumDao.filterDaoID Ljava/lang/String;\n    | field-get(java.lang.String baag.boa.esn.client.ESNEnumDao.filterDaoID)\n    |               ASTORE_1\n    |               ASTORE_2\n    | method-call(baag.boa.esn.server.workflowfw.dao.ClientDataDao baag.boa.common.interfaces.ESN.filterData(java.lang.String))\n    | |             INVOKESTATIC baag.boa.common.connect.ServerFasadenDefinition.aspectOf ()Lbaag/boa/common/connect/ServerFasadenDefinition;\n    | |             ALOAD_2\n    | |             BIPUSH 3\n    | |             ANEWARRAY java.lang.Object\n    | |             ASTORE_3\n    | |             ALOAD_3\n    | |             BIPUSH 0\n    | |             ALOAD_0\n    | |             AASTORE\n    | |             ALOAD_3\n    | |             BIPUSH 1\n    | |             ALOAD_2\n    | |             AASTORE\n    | |             ALOAD_3\n    | |             BIPUSH 2\n    | |             ALOAD_1\n    | |             AASTORE\n    | |             NEW baag.boa.esn.client.ESNEnumDao$AjcClosure1\n    | |             DUP\n    | |             ALOAD_3\n    | |             INVOKESPECIAL baag.boa.esn.client.ESNEnumDao$AjcClosure1.\u003cinit\u003e ([Ljava/lang/Object;)V\n    | |             GETSTATIC baag.boa.esn.client.ESNEnumDao.ajc$tjp_0 Lorg/aspectj/lang/JoinPoint$StaticPart;\n    | |             INVOKEVIRTUAL baag.boa.common.connect.RufServer.ajc$around$baag_boa_common_connect_RufServer$1$19b2b7d5 (Ljava/lang/Object;Lorg/aspectj/runtime/internal/AroundClosure;Lorg/aspectj/lang/JoinPoint$StaticPart;)Ljava/lang/Object;\n    | |             CHECKCAST baag.boa.esn.server.workflowfw.dao.ClientDataDao\n    | method-call(baag.boa.esn.server.workflowfw.dao.ClientDataDao baag.boa.common.interfaces.ESN.filterData(java.lang.String))\n    |               PUTFIELD baag.boa.esn.client.ESNEnumDao.filterDAO Lbaag/boa/esn/server/workflowfw/dao/ClientDataDao;\n    |           L1: ALOAD_0     // Lbaag/boa/esn/client/ESNEnumDao; this   (line 57)\n    | field-get(baag.boa.esn.server.workflowfw.dao.ClientDataDao baag.boa.esn.client.ESNEnumDao.filterDAO)\n    | |             GETFIELD baag.boa.esn.client.ESNEnumDao.filterDAO Lbaag/boa/esn/server/workflowfw/dao/ClientDataDao;\n    | field-get(baag.boa.esn.server.workflowfw.dao.ClientDataDao baag.boa.esn.client.ESNEnumDao.filterDAO)\n    |               ARETURN\n    method-execution(baag.boa.esn.server.workflowfw.dao.ClientDataDao baag.boa.esn.client.ESNEnumDao.getFilter())\n  end protected baag.boa.esn.server.workflowfw.dao.ClientDataDao getFilter() throws baag.boa.exception.BOAException\n\n  public java.util.List select() throws baag.boa.exception.BOAException    org.aspectj.weaver.MethodDeclarationLineNumber: 70:2497\n:\n    method-execution(java.util.List baag.boa.esn.client.ESNEnumDao.select())\n    |               ALOAD_0     // Lbaag/boa/esn/client/ESNEnumDao; this   (line 71)\n    | method-call(baag.boa.esn.server.workflowfw.dao.ClientDataDao baag.boa.esn.client.ESNEnumDao.getFilter())\n    | |             INVOKEVIRTUAL baag.boa.esn.client.ESNEnumDao.getFilter ()Lbaag/boa/esn/server/workflowfw/dao/ClientDataDao;\n    | method-call(baag.boa.esn.server.workflowfw.dao.ClientDataDao baag.boa.esn.client.ESNEnumDao.getFilter())\n    |               ASTORE_1\n    |               ALOAD_1     // Lbaag/boa/esn/server/workflowfw/dao/ClientDataDao; dau   (line 72)\n    |               ICONST_0\n    | method-call(void baag.boa.esn.server.workflowfw.dao.ClientDataDao.setBisElement(int))\n    | |             INVOKEINTERFACE baag.boa.esn.server.workflowfw.dao.ClientDataDao.setBisElement (I)V\n    | method-call(void baag.boa.esn.server.workflowfw.dao.ClientDataDao.setBisElement(int))\n    |               ALOAD_0     // Lbaag/boa/esn/client/ESNEnumDao; this   (line 73)\n    |               ALOAD_0     // Lbaag/boa/esn/client/ESNEnumDao; this\n    | field-get(baag.boa.common.interfaces.ESN baag.boa.esn.client.ESNEnumDao.esn)\n    | |             GETFIELD baag.boa.esn.client.ESNEnumDao.esn Lbaag/boa/common/interfaces/ESN;\n    | field-get(baag.boa.common.interfaces.ESN baag.boa.esn.client.ESNEnumDao.esn)\n    |               ALOAD_1     // Lbaag/boa/esn/server/workflowfw/dao/ClientDataDao; dau\n    | method-call(java.util.List baag.boa.common.interfaces.ESN.getPresentationList(baag.boa.esn.server.workflowfw.dao.ClientDataDao))\n    | |             INVOKEINTERFACE baag.boa.common.interfaces.ESN.getPresentationList (Lbaag/boa/esn/server/workflowfw/dao/ClientDataDao;)Ljava/util/List;\n    | method-call(java.util.List baag.boa.common.interfaces.ESN.getPresentationList(baag.boa.esn.server.workflowfw.dao.ClientDataDao))\n    | method-call(java.util.List baag.boa.esn.client.ESNEnumDao.adaptiere(java.util.List))\n    | |             INVOKEVIRTUAL baag.boa.esn.client.ESNEnumDao.adaptiere (Ljava/util/List;)Ljava/util/List;\n    | method-call(java.util.List baag.boa.esn.client.ESNEnumDao.adaptiere(java.util.List))\n    |               ARETURN\n    method-execution(java.util.List baag.boa.esn.client.ESNEnumDao.select())\n  end public java.util.List select() throws baag.boa.exception.BOAException\n\n  protected abstract java.util.List adaptiere(java.util.List)    org.aspectj.weaver.MethodDeclarationLineNumber: 79:2853\n;\n\n  static final baag.boa.esn.server.workflowfw.dao.ClientDataDao filterData_aroundBody0(baag.boa.esn.client.ESNEnumDao, baag.boa.common.interfaces.ESN, String):\n                    ALOAD_1\n                    ALOAD_2\n                    INVOKEINTERFACE baag.boa.common.interfaces.ESN.filterData (Ljava/lang/String;)Lbaag/boa/esn/server/workflowfw/dao/ClientDataDao;   (line 55)\n                    ARETURN\n  end static final baag.boa.esn.server.workflowfw.dao.ClientDataDao filterData_aroundBody0(baag.boa.esn.client.ESNEnumDao, baag.boa.common.interfaces.ESN, String)\nend public abstract class baag.boa.esn.client.ESNEnumDao\n\npublic class baag.boa.esn.client.ESNEnumDao$AjcClosure1 extends org.aspectj.runtime.internal.AroundClosure:\n  public void \u003cinit\u003e(Object[]):\n                    ALOAD_0\n                    ALOAD_1\n                    INVOKESPECIAL org.aspectj.runtime.internal.AroundClosure.\u003cinit\u003e ([Ljava/lang/Object;)V\n                    RETURN\n  end public void \u003cinit\u003e(Object[])\n\n  public Object run(Object[]):\n                    ALOAD_0\n                    GETFIELD org.aspectj.runtime.internal.AroundClosure.state [Ljava/lang/Object;\n                    ASTORE_2\n                    ALOAD_2\n                    BIPUSH 0\n                    AALOAD\n                    CHECKCAST baag.boa.esn.client.ESNEnumDao\n                    ALOAD_1\n                    BIPUSH 0\n                    AALOAD\n                    CHECKCAST baag.boa.common.interfaces.ESN\n                    ALOAD_2\n                    BIPUSH 2\n                    AALOAD\n                    CHECKCAST java.lang.String\n                    INVOKESTATIC baag.boa.esn.client.ESNEnumDao.filterData_aroundBody0 (Lbaag/boa/esn/client/ESNEnumDao;Lbaag/boa/common/interfaces/ESN;Ljava/lang/String;)Lbaag/boa/esn/server/workflowfw/dao/ClientDataDao;\n                    ARETURN\n  end public Object run(Object[])\nend public class baag.boa.esn.client.ESNEnumDao$AjcClosure1\n\nwhen implementing on shadow method-call(baag.boa.esn.server.workflowfw.dao.ClientDataDao baag.boa.common.interfaces.ESN.filterData(java.lang.String))\nwhen weaving type baag.boa.esn.client.ESNEnumDao\nwhen weaving classes \nwhen weaving \nwhen batch building BuildConfig[/home/hiv/devel/Arbeit/.metadata/.plugins/org.eclipse.ajdt.core/BOA3.generated.lst] #Files\u003d658\n",
    "Passing over to compiler",
    "fix committed.  NPE guard.",
    "*** Bug 152024 has been marked as a duplicate of this bug. ***",
    "fix available in AJ dev builds."
  ],
  "commentCreationDates": [
    "2006-07-26T15:44:50+02:00",
    "2006-07-26T15:47:56+02:00",
    "2006-07-27T10:42:50+02:00",
    "2006-07-27T11:24:49+02:00",
    "2006-07-28T00:58:12+02:00",
    "2006-07-31T09:32:07+02:00"
  ],
  "traces": [
    {
      "exceptionType": "java.lang.NullPointerException",
      "elements": [
        {
          "method": "org.aspectj.ajdt.internal.core.builder.EclipseSourceContext.removeUnnecessaryProblems",
          "source": "EclipseSourceContext.java:82"
        },
        {
          "method": "org.aspectj.weaver.bcel.BcelAdvice.removeUnnecessaryProblems",
          "source": "BcelAdvice.java:297"
        },
        {
          "method": "org.aspectj.weaver.bcel.BcelAdvice.implementOn",
          "source": "BcelAdvice.java:214"
        },
        {
          "method": "org.aspectj.weaver.Shadow.implementMungers",
          "source": "Shadow.java:684"
        },
        {
          "method": "org.aspectj.weaver.Shadow.implement",
          "source": "Shadow.java:471"
        },
        {
          "method": "org.aspectj.weaver.bcel.BcelClassWeaver.implement",
          "source": "BcelClassWeaver.java:2825"
        },
        {
          "method": "org.aspectj.weaver.bcel.BcelClassWeaver.weave",
          "source": "BcelClassWeaver.java:502"
        },
        {
          "method": "org.aspectj.weaver.bcel.BcelClassWeaver.weave",
          "source": "BcelClassWeaver.java:115"
        },
        {
          "method": "org.aspectj.weaver.bcel.BcelWeaver.weave",
          "source": "BcelWeaver.java:1591"
        },
        {
          "method": "org.aspectj.weaver.bcel.BcelWeaver.weaveWithoutDump",
          "source": "BcelWeaver.java:1542"
        },
        {
          "method": "org.aspectj.weaver.bcel.BcelWeaver.weaveAndNotify",
          "source": "BcelWeaver.java:1322"
        },
        {
          "method": "org.aspectj.weaver.bcel.BcelWeaver.weave",
          "source": "BcelWeaver.java:1143"
        },
        {
          "method": "org.aspectj.ajdt.internal.compiler.AjCompilerAdapter.weave",
          "source": "AjCompilerAdapter.java:321"
        },
        {
          "method": "org.aspectj.ajdt.internal.compiler.AjCompilerAdapter.afterCompiling",
          "source": "AjCompilerAdapter.java:192"
        },
        {
          "method": "org.aspectj.ajdt.internal.compiler.CompilerAdapter.ajc$afterReturning$org_aspectj_ajdt_internal_compiler_CompilerAdapter$2$f9cc9ca0",
          "source": "CompilerAdapter.aj:70"
        },
        {
          "method": "org.aspectj.org.eclipse.jdt.internal.compiler.Compiler.compile",
          "source": "Compiler.java:367"
        },
        {
          "method": "org.aspectj.ajdt.internal.core.builder.AjBuildManager.performCompilation",
          "source": "AjBuildManager.java:890"
        },
        {
          "method": "org.aspectj.ajdt.internal.core.builder.AjBuildManager.doBuild",
          "source": "AjBuildManager.java:245"
        },
        {
          "method": "org.aspectj.ajdt.internal.core.builder.AjBuildManager.batchBuild",
          "source": "AjBuildManager.java:164"
        },
        {
          "method": "org.aspectj.ajde.internal.CompilerAdapter.compile",
          "source": "CompilerAdapter.java:122"
        },
        {
          "method": "org.aspectj.ajde.internal.AspectJBuildManager$CompilerThread.run",
          "source": "AspectJBuildManager.java:191"
        }
      ],
      "number": 0,
      "commentIndex": 1,
      "bugId": "151845",
      "date": "2006-07-26T15:47:56+02:00",
      "product": "AspectJ",
      "component": "Compiler",
      "severity": "normal"
    }
  ],
  "groupId": "151845",
  "bugId": "151845",
  "date": "2006-07-26T15:44:50+02:00",
  "product": "AspectJ",
  "component": "Compiler",
  "severity": "normal"
}