{
  "comments": [
    "Eclipse will not load if, on a windows machine, it is installed so that its installation path contains an exclamation mark (\u0027!\u0027, f.ex. c:\\!eclipse) as the OSGI fails to load its core bundle.\n\nThe reason is that no attention is paid to the fact that an exclamation mark has a separator meaning when accessing resources from JAR files (see JarURLConnection javadoc).\n\nEx. trace:\norg.eclipse.osgi error loading: jar:file:/i:/!Install/!Developement/Eclipse/eclipse-SDK-3.2-win32/eclipse/plugins/org.eclipse.osgi_3.2.0.v20060601.jar!/hookconfigurators.properties\njava.util.zip.ZipException: The system cannot find the path specified\n     at java.util.zip.ZipFile.open(Native Method)\n     at java.util.zip.ZipFile.\u003cinit\u003e(ZipFile.java:112)\n     at java.util.jar.JarFile.\u003cinit\u003e(JarFile.java:127)\n     at java.util.jar.JarFile.\u003cinit\u003e(JarFile.java:65)\n     at sun.net.www.protocol.jar.URLJarFile.\u003cinit\u003e(URLJarFile.java:55)\n     at sun.net.www.protocol.jar.URLJarFile.getJarFile(URLJarFile.java:40)\n     at sun.net.www.protocol.jar.JarFileFactory.get(JarFileFactory.java:63)\n     at sun.net.www.protocol.jar.JarURLConnection.connect(JarURLConnection.java:85)\n     at sun.net.www.protocol.jar.JarURLConnection.getInputStream(JarURLConnection.java:107)\n     at java.net.URL.openStream(URL.java:913)\n     at org.eclipse.osgi.baseadaptor.HookRegistry.mergeFileHookConfigurators(HookRegistry.java:118)\n     at org.eclipse.osgi.baseadaptor.HookRegistry.initialize(HookRegistry.java:95)\n     at org.eclipse.osgi.baseadaptor.BaseAdaptor.\u003cinit\u003e(BaseAdaptor.java:97)\n     at sun.reflect.NativeConstructorAccessorImpl.newInstance0(Native Method)\n     at sun.reflect.NativeConstructorAccessorImpl.newInstance(NativeConstructorAccessorImpl.java:39)\n     at sun.reflect.DelegatingConstructorAccessorImpl.newInstance(DelegatingConstructorAccessorImpl.java:27)\n     at java.lang.reflect.Constructor.newInstance(Constructor.java:274)\n     at org.eclipse.core.runtime.adaptor.EclipseStarter.createAdaptor(EclipseStarter.java:780)\n     at org.eclipse.core.runtime.adaptor.EclipseStarter.startup(EclipseStarter.java:280)\n     at org.eclipse.core.runtime.adaptor.EclipseStarter.run(EclipseStarter.java:173)\n     at sun.reflect.NativeMethodAccessorImpl.invoke0(Native Method)\n     at sun.reflect.NativeMethodAccessorImpl.invoke(NativeMethodAccessorImpl.java:39)\n     at sun.reflect.DelegatingMethodAccessorImpl.invoke(DelegatingMethodAccessorImpl.java:25)\n     at java.lang.reflect.Method.invoke(Method.java:324)\n     at org.eclipse.core.launcher.Main.invokeFramework(Main.java:336)\n     at org.eclipse.core.launcher.Main.basicRun(Main.java:280)\n     at org.eclipse.core.launcher.Main.run(Main.java:977)\n     at org.eclipse.core.launcher.Main.main(Main.java:952)",
    "\n\n*** This bug has been marked as a duplicate of 150742 ***"
  ],
  "commentCreationDates": [
    "2006-07-26T20:21:03+02:00",
    "2006-07-26T20:48:44+02:00"
  ],
  "traces": [
    {
      "exceptionType": "java.util.zip.ZipException",
      "message": "The system cannot find the path specified",
      "elements": [
        {
          "method": "java.util.zip.ZipFile.open",
          "source": "Native Method"
        },
        {
          "method": "java.util.zip.ZipFile.\u003cinit\u003e",
          "source": "ZipFile.java:112"
        },
        {
          "method": "java.util.jar.JarFile.\u003cinit\u003e",
          "source": "JarFile.java:127"
        },
        {
          "method": "java.util.jar.JarFile.\u003cinit\u003e",
          "source": "JarFile.java:65"
        },
        {
          "method": "sun.net.www.protocol.jar.URLJarFile.\u003cinit\u003e",
          "source": "URLJarFile.java:55"
        },
        {
          "method": "sun.net.www.protocol.jar.URLJarFile.getJarFile",
          "source": "URLJarFile.java:40"
        },
        {
          "method": "sun.net.www.protocol.jar.JarFileFactory.get",
          "source": "JarFileFactory.java:63"
        },
        {
          "method": "sun.net.www.protocol.jar.JarURLConnection.connect",
          "source": "JarURLConnection.java:85"
        },
        {
          "method": "sun.net.www.protocol.jar.JarURLConnection.getInputStream",
          "source": "JarURLConnection.java:107"
        },
        {
          "method": "java.net.URL.openStream",
          "source": "URL.java:913"
        },
        {
          "method": "org.eclipse.osgi.baseadaptor.HookRegistry.mergeFileHookConfigurators",
          "source": "HookRegistry.java:118"
        },
        {
          "method": "org.eclipse.osgi.baseadaptor.HookRegistry.initialize",
          "source": "HookRegistry.java:95"
        },
        {
          "method": "org.eclipse.osgi.baseadaptor.BaseAdaptor.\u003cinit\u003e",
          "source": "BaseAdaptor.java:97"
        },
        {
          "method": "sun.reflect.NativeConstructorAccessorImpl.newInstance0",
          "source": "Native Method"
        },
        {
          "method": "sun.reflect.NativeConstructorAccessorImpl.newInstance",
          "source": "NativeConstructorAccessorImpl.java:39"
        },
        {
          "method": "sun.reflect.DelegatingConstructorAccessorImpl.newInstance",
          "source": "DelegatingConstructorAccessorImpl.java:27"
        },
        {
          "method": "java.lang.reflect.Constructor.newInstance",
          "source": "Constructor.java:274"
        },
        {
          "method": "org.eclipse.core.runtime.adaptor.EclipseStarter.createAdaptor",
          "source": "EclipseStarter.java:780"
        },
        {
          "method": "org.eclipse.core.runtime.adaptor.EclipseStarter.startup",
          "source": "EclipseStarter.java:280"
        },
        {
          "method": "org.eclipse.core.runtime.adaptor.EclipseStarter.run",
          "source": "EclipseStarter.java:173"
        },
        {
          "method": "sun.reflect.NativeMethodAccessorImpl.invoke0",
          "source": "Native Method"
        },
        {
          "method": "sun.reflect.NativeMethodAccessorImpl.invoke",
          "source": "NativeMethodAccessorImpl.java:39"
        },
        {
          "method": "sun.reflect.DelegatingMethodAccessorImpl.invoke",
          "source": "DelegatingMethodAccessorImpl.java:25"
        },
        {
          "method": "java.lang.reflect.Method.invoke",
          "source": "Method.java:324"
        },
        {
          "method": "org.eclipse.core.launcher.Main.invokeFramework",
          "source": "Main.java:336"
        },
        {
          "method": "org.eclipse.core.launcher.Main.basicRun",
          "source": "Main.java:280"
        },
        {
          "method": "org.eclipse.core.launcher.Main.run",
          "source": "Main.java:977"
        },
        {
          "method": "org.eclipse.core.launcher.Main.main",
          "source": "Main.java:952"
        }
      ],
      "number": 0,
      "commentIndex": 0,
      "bugId": "151888",
      "duplicateId": "150742",
      "date": "2006-07-26T20:21:03+02:00",
      "product": "Platform",
      "component": "Runtime",
      "severity": "major"
    }
  ],
  "groupId": "150742",
  "bugId": "151888",
  "duplicateId": "150742",
  "date": "2006-07-26T20:21:03+02:00",
  "product": "Platform",
  "component": "Runtime",
  "severity": "major"
}