{
  "comments": [
    "When I am trying to run a Ant file I keep getting no messages on the Console, just a message on the Console window\u0027s title bar (across the top). It says \n\"\u003cterminated\u003e JiBxBuild [Ant Build] D:\\bea\\jdk142_05\\bin\\javaw.exe (Jul 31, 2006 8:31:55pm)\". I\u0027ve checked the log file and it says:\n!ENTRY org.eclipse.ant.ui 4 120 2006-07-31 20:32:05.609\n!MESSAGE Error logged from Ant UI: \n!STACK 0\njava.net.SocketTimeoutException: Accept timed out\n\tat java.net.PlainSocketImpl.socketAccept(Native Method)\n\tat java.net.PlainSocketImpl.accept(PlainSocketImpl.java:353)\n\tat java.net.ServerSocket.implAccept(ServerSocket.java:448)\n\tat java.net.ServerSocket.accept(ServerSocket.java:419)\n\tat org.eclipse.ant.internal.ui.launchConfigurations.RemoteAntBuildListener$ServerConnection.run(RemoteAntBuildListener.java:97)\n\nI\u0027ve check Ant classpath in both Run / External Tools / Classpath tab and Windows / Preference / Ant / Runtime / Classpath tab and they are the same, pointing to Ant 1.6.5.\n\nAny ideas how to fix this ?\n\nThanks in advance,\nMarcia\n\nPS: I have another view and Ant works fine there.",
    "I\u0027ve found the problem. I have added some VM arguments (-server -Xms128m -Xmx768m  -XX:MaxPermSize\u003d680m) in the selected Installed JRE and it was causing a problem. ",
    "Thank you for reporting back."
  ],
  "commentCreationDates": [
    "2006-08-01T02:50:40+02:00",
    "2006-08-01T15:43:08+02:00",
    "2006-08-01T17:52:03+02:00"
  ],
  "traces": [
    {
      "exceptionType": "java.net.SocketTimeoutException",
      "message": "Accept timed out",
      "elements": [
        {
          "method": "java.net.PlainSocketImpl.socketAccept",
          "source": "Native Method"
        },
        {
          "method": "java.net.PlainSocketImpl.accept",
          "source": "PlainSocketImpl.java:353"
        },
        {
          "method": "java.net.ServerSocket.implAccept",
          "source": "ServerSocket.java:448"
        },
        {
          "method": "java.net.ServerSocket.accept",
          "source": "ServerSocket.java:419"
        },
        {
          "method": "org.eclipse.ant.internal.ui.launchConfigurations.RemoteAntBuildListener$ServerConnection.run",
          "source": "RemoteAntBuildListener.java:97"
        }
      ],
      "number": 0,
      "commentIndex": 0,
      "bugId": "152400",
      "date": "2006-08-01T02:50:40+02:00",
      "product": "Platform",
      "component": "Ant",
      "severity": "normal"
    }
  ],
  "groupId": "152400",
  "bugId": "152400",
  "date": "2006-08-01T02:50:40+02:00",
  "product": "Platform",
  "component": "Ant",
  "severity": "normal"
}