{
  "comments": [
    "We deploy the Eclipse package on Linux as a daemon.  We install the Eclipse Help System as root, because we shell script to issue the chkconfig command  and copy the shell script to /etc/init.d.  All the files (Help System and content) are owned by user/group bin. When starting Eclipse using the start command. \n\nsu -s /bin/sh bin -c \u0027/opt/ibm/db2ic/V9/doc/bin/../jre/bin/javaw -classpath /opt/ibm/db2ic/V9/doc/bin/../eclipse/plugins/org.eclipse.help.base_3.1.0/helpbase.jar org.eclipse.help.standalone.Infocenter -command start -os linux -eclipsehome  /opt/ibm/db2ic/V9/doc/bin/../eclipse -nl en -locales ar bg cs da de el en es fi fr hr hu it ja ko nl no pl pt pt_BR ro ru sk sl sv tr zh_CN zh_TW -noexec -port  51000 \u0026\u0027\n\nwhich results in the following error:\n\n!SESSION 2006-08-03 14:48:35.598 -----------------------------------------------\neclipse.buildId\u003dM20050929-0840\njava.fullversion\u003dJ2RE 1.4.2 IBM build cxia32142-20050929 (SR3) (JIT enabled: jit\nc)\nBootLoader constants: OS\u003dlinux, ARCH\u003dx86, WS\u003dmotif, NL\u003den\nFramework arguments:  -application org.eclipse.help.base.infocenterApplication -\nlocales ar bg cs da de el en es fi fr hr hu it ja ko nl no pl pt pt_BR ro ru sk\nsl sv tr zh_CN zh_TW\nCommand-line arguments:  -application org.eclipse.help.base.infocenterApplicatio\nn -data /opt/ibm/db2ic/V9/doc/bin/../eclipse/workspace -os linux -locales ar bg\ncs da de el en es fi fr hr hu it ja ko nl no pl pt pt_BR ro ru sk sl sv tr zh_CN\n zh_TW\n\n!ENTRY org.eclipse.osgi 2006-08-03 14:48:35.867\n!MESSAGE Error reading configuration: /bin/.eclipse/configuration/org.eclipse.os\ngi/.manager/.fileTableLock (No such file or directory)\n!STACK 0\njava.io.FileNotFoundException: /bin/.eclipse/configuration/org.eclipse.osgi/.man\nager/.fileTableLock (No such file or directory)\n        at java.io.FileOutputStream.openAppend(Native Method)\n        at java.io.FileOutputStream.\u003cinit\u003e(FileOutputStream.java:199)\n        at org.eclipse.core.runtime.internal.adaptor.Locker_JavaNio.lock(Locker_\nJavaNio.java:34)\n        at org.eclipse.core.runtime.adaptor.FileManager.lock(FileManager.java:36\n1)\n        at org.eclipse.core.runtime.adaptor.FileManager.open(FileManager.java:65\n8)\n        at org.eclipse.core.runtime.adaptor.EclipseAdaptor.initFileManager(Eclip\nseAdaptor.java:818)\n        at org.eclipse.core.runtime.adaptor.EclipseAdaptor.initialize(EclipseAda\nptor.java:139)\n        at org.eclipse.osgi.framework.internal.core.Framework.initialize(Framework.java:128)\n        at org.eclipse.osgi.framework.internal.core.Framework.\u003cinit\u003e(Framework.java:106)\n        at org.eclipse.osgi.framework.internal.core.OSGi.createFramework(OSGi.java:90)\n        at org.eclipse.osgi.framework.internal.core.OSGi.\u003cinit\u003e(OSGi.java:31)\n        at org.eclipse.core.runtime.adaptor.EclipseStarter.startup(EclipseStarter.java:272)\n        at org.eclipse.core.runtime.adaptor.EclipseStarter.run(EclipseStarter.java:159)\n        at sun.reflect.NativeMethodAccessorImpl.invoke0(Native Method)\n        at sun.reflect.NativeMethodAccessorImpl.invoke(NativeMethodAccessorImpl.java:85)\n        at sun.reflect.NativeMethodAccessorImpl.invoke(NativeMethodAccessorImpl.java:58)\n        at java.lang.reflect.Method.invoke(Method.java:391)\n        at org.eclipse.core.launcher.Main.invokeFramework(Main.java:334)\n        at org.eclipse.core.launcher.Main.basicRun(Main.java:278)\n        at org.eclipse.core.launcher.Main.run(Main.java:973)\n        at org.eclipse.core.launcher.Main.main(Main.java:948)\n\nAfter further investigation, we found that the eclipse directory is read-only on our server and there is a code in eclipse saying:\n\nIn LocationManager.computeDefaultConfigurationLocation()\n// 1) We store the config state relative to the \u0027eclipse\u0027 directory if possible\n// 2) If this directory is read-only \n//    we store the state in \u003cuser.home\u003e/.eclipse/\u003capplication-id\u003e_\u003cversion\u003e where \u003cuser.home\u003e \n//    is unique for each local user, and \u003capplication-id\u003e is the one \n//    defined in .eclipseproduct marker file. If .eclipseproduct does not\n//    exist, use \"eclipse\" as the application-id.\n\nI think this design is really not good. Since on Linux/Unix platform, eclipse directory is read-only does not mean that the eclipse/configuration and eclipse/workspace directories are read-only."
  ],
  "commentCreationDates": [
    "2006-08-23T03:10:48+02:00"
  ],
  "traces": [
    {
      "exceptionType": "java.io.FileNotFoundException",
      "message": "/bin/.eclipse/configuration/org.eclipse.osgi/.man ager/.fileTableLock (No such file or directory)",
      "elements": [
        {
          "method": "java.io.FileOutputStream.openAppend",
          "source": "Native Method"
        },
        {
          "method": "java.io.FileOutputStream.\u003cinit\u003e",
          "source": "FileOutputStream.java:199"
        },
        {
          "method": "org.eclipse.core.runtime.internal.adaptor.Locker_JavaNio.lock",
          "source": "Locker_ JavaNio.java:34"
        },
        {
          "method": "org.eclipse.core.runtime.adaptor.FileManager.lock",
          "source": "FileManager.java:36 1"
        },
        {
          "method": "org.eclipse.core.runtime.adaptor.FileManager.open",
          "source": "FileManager.java:65 8"
        },
        {
          "method": "org.eclipse.core.runtime.adaptor.EclipseAdaptor.initFileManager",
          "source": "Eclip seAdaptor.java:818"
        },
        {
          "method": "org.eclipse.core.runtime.adaptor.EclipseAdaptor.initialize",
          "source": "EclipseAda ptor.java:139"
        },
        {
          "method": "org.eclipse.osgi.framework.internal.core.Framework.initialize",
          "source": "Framework.java:128"
        },
        {
          "method": "org.eclipse.osgi.framework.internal.core.Framework.\u003cinit\u003e",
          "source": "Framework.java:106"
        },
        {
          "method": "org.eclipse.osgi.framework.internal.core.OSGi.createFramework",
          "source": "OSGi.java:90"
        },
        {
          "method": "org.eclipse.osgi.framework.internal.core.OSGi.\u003cinit\u003e",
          "source": "OSGi.java:31"
        },
        {
          "method": "org.eclipse.core.runtime.adaptor.EclipseStarter.startup",
          "source": "EclipseStarter.java:272"
        },
        {
          "method": "org.eclipse.core.runtime.adaptor.EclipseStarter.run",
          "source": "EclipseStarter.java:159"
        },
        {
          "method": "sun.reflect.NativeMethodAccessorImpl.invoke0",
          "source": "Native Method"
        },
        {
          "method": "sun.reflect.NativeMethodAccessorImpl.invoke",
          "source": "NativeMethodAccessorImpl.java:85"
        },
        {
          "method": "sun.reflect.NativeMethodAccessorImpl.invoke",
          "source": "NativeMethodAccessorImpl.java:58"
        },
        {
          "method": "java.lang.reflect.Method.invoke",
          "source": "Method.java:391"
        },
        {
          "method": "org.eclipse.core.launcher.Main.invokeFramework",
          "source": "Main.java:334"
        },
        {
          "method": "org.eclipse.core.launcher.Main.basicRun",
          "source": "Main.java:278"
        },
        {
          "method": "org.eclipse.core.launcher.Main.run",
          "source": "Main.java:973"
        },
        {
          "method": "org.eclipse.core.launcher.Main.main",
          "source": "Main.java:948"
        }
      ],
      "number": 0,
      "commentIndex": 0,
      "bugId": "154797",
      "date": "2006-08-23T03:10:48+02:00",
      "product": "Platform",
      "component": "User Assistance",
      "severity": "normal"
    }
  ],
  "groupId": "154797",
  "bugId": "154797",
  "date": "2006-08-23T03:10:48+02:00",
  "product": "Platform",
  "component": "User Assistance",
  "severity": "normal"
}