{
  "comments": [
    "Got the following on my console:\n\norg.eclipse.swt.SWTException: Widget is disposed\n        at org.eclipse.swt.SWT.error(SWT.java:1887)\n        at org.eclipse.swt.SWT.error(SWT.java:1819)\n        at org.eclipse.swt.widgets.Widget.error(Widget.java:368)\n        at org.eclipse.swt.widgets.Control.getDisplay(Control.java:696)\n        at org.eclipse.swt.widgets.Widget.isValidThread(Widget.java:571)\n        at org.eclipse.swt.widgets.Widget.checkWidget(Widget.java:299)\n        at org.eclipse.swt.widgets.Control.getParent(Control.java:833)\n        at org.eclipse.ui.part.PageBook.showPage(PageBook.java:83)\n        at org.eclipse.jdt.internal.ui.typehierarchy.TypeHierarchyViewPart.updat\neHierarchyViewer(TypeHierarchyViewPart.java:881)\n        at org.eclipse.jdt.internal.ui.typehierarchy.TypeHierarchyViewPart.clear\nInput(TypeHierarchyViewPart.java:417)\n        at org.eclipse.jdt.internal.ui.typehierarchy.TypeHierarchyViewPart.doTyp\neHierarchyChangedOnViewers(TypeHierarchyViewPart.java:1128)\n        at org.eclipse.jdt.internal.ui.typehierarchy.TypeHierarchyViewPart.acces\ns$9(TypeHierarchyViewPart.java:1126)\n        at org.eclipse.jdt.internal.ui.typehierarchy.TypeHierarchyViewPart$8.run\n(TypeHierarchyViewPart.java:1120)\n        at org.eclipse.swt.widgets.RunnableLock.run(RunnableLock.java:29)\n        at org.eclipse.swt.widgets.Synchronizer.runAsyncMessages(Synchronizer.ja\nva:93)\n        at org.eclipse.swt.widgets.Display.runAsyncMessages(Display.java:1389)\n        at org.eclipse.swt.widgets.Display.readAndDispatch(Display.java:1211)\n        at org.eclipse.swt.widgets.Display.release(Display.java:1259)\n        at org.eclipse.swt.graphics.Device.dispose(Device.java:198)\n        at org.eclipse.ui.internal.Workbench.run(Workbench.java:871)\n        at org.eclipse.core.internal.boot.InternalBootLoader.run(InternalBootLoa\nder.java:733)\n        at org.eclipse.core.boot.BootLoader.run(BootLoader.java:349)\n        at java.lang.reflect.Method.invoke(Native Method)\n        at org.eclipse.core.launcher.Main.basicRun(Main.java:162)\n        at org.eclipse.core.launcher.Main.run(Main.java:588)\n        at org.eclipse.core.launcher.UIMain.main(UIMain.java:52)",
    "I think this one is already fixed. Martin pls dispose if yes.",
    "fixed in 20020508",
    "Verified."
  ],
  "commentCreationDates": [
    "2002-05-09T11:34:25+02:00",
    "2002-05-10T01:06:18+02:00",
    "2002-05-10T09:19:39+02:00",
    "2002-05-24T11:01:25+02:00"
  ],
  "traces": [
    {
      "exceptionType": "org.eclipse.swt.SWTException",
      "message": "Widget is disposed",
      "elements": [
        {
          "method": "org.eclipse.swt.SWT.error",
          "source": "SWT.java:1887"
        },
        {
          "method": "org.eclipse.swt.SWT.error",
          "source": "SWT.java:1819"
        },
        {
          "method": "org.eclipse.swt.widgets.Widget.error",
          "source": "Widget.java:368"
        },
        {
          "method": "org.eclipse.swt.widgets.Control.getDisplay",
          "source": "Control.java:696"
        },
        {
          "method": "org.eclipse.swt.widgets.Widget.isValidThread",
          "source": "Widget.java:571"
        },
        {
          "method": "org.eclipse.swt.widgets.Widget.checkWidget",
          "source": "Widget.java:299"
        },
        {
          "method": "org.eclipse.swt.widgets.Control.getParent",
          "source": "Control.java:833"
        },
        {
          "method": "org.eclipse.ui.part.PageBook.showPage",
          "source": "PageBook.java:83"
        },
        {
          "method": "org.eclipse.jdt.internal.ui.typehierarchy.TypeHierarchyViewPart.updateHierarchyViewer",
          "source": "TypeHierarchyViewPart.java:881"
        },
        {
          "method": "org.eclipse.jdt.internal.ui.typehierarchy.TypeHierarchyViewPart.clearInput",
          "source": "TypeHierarchyViewPart.java:417"
        },
        {
          "method": "org.eclipse.jdt.internal.ui.typehierarchy.TypeHierarchyViewPart.doTypeHierarchyChangedOnViewers",
          "source": "TypeHierarchyViewPart.java:1128"
        },
        {
          "method": "org.eclipse.jdt.internal.ui.typehierarchy.TypeHierarchyViewPart.access$9",
          "source": "TypeHierarchyViewPart.java:1126"
        },
        {
          "method": "org.eclipse.jdt.internal.ui.typehierarchy.TypeHierarchyViewPart$8.run",
          "source": "TypeHierarchyViewPart.java:1120"
        },
        {
          "method": "org.eclipse.swt.widgets.RunnableLock.run",
          "source": "RunnableLock.java:29"
        },
        {
          "method": "org.eclipse.swt.widgets.Synchronizer.runAsyncMessages",
          "source": "Synchronizer.ja va:93"
        },
        {
          "method": "org.eclipse.swt.widgets.Display.runAsyncMessages",
          "source": "Display.java:1389"
        },
        {
          "method": "org.eclipse.swt.widgets.Display.readAndDispatch",
          "source": "Display.java:1211"
        },
        {
          "method": "org.eclipse.swt.widgets.Display.release",
          "source": "Display.java:1259"
        },
        {
          "method": "org.eclipse.swt.graphics.Device.dispose",
          "source": "Device.java:198"
        },
        {
          "method": "org.eclipse.ui.internal.Workbench.run",
          "source": "Workbench.java:871"
        },
        {
          "method": "org.eclipse.core.internal.boot.InternalBootLoader.run",
          "source": "InternalBootLoa der.java:733"
        },
        {
          "method": "org.eclipse.core.boot.BootLoader.run",
          "source": "BootLoader.java:349"
        },
        {
          "method": "java.lang.reflect.Method.invoke",
          "source": "Native Method"
        },
        {
          "method": "org.eclipse.core.launcher.Main.basicRun",
          "source": "Main.java:162"
        },
        {
          "method": "org.eclipse.core.launcher.Main.run",
          "source": "Main.java:588"
        },
        {
          "method": "org.eclipse.core.launcher.UIMain.main",
          "source": "UIMain.java:52"
        }
      ],
      "number": 0,
      "commentIndex": 0,
      "bugId": "15600",
      "date": "2002-05-09T11:34:25+02:00",
      "product": "JDT",
      "component": "UI",
      "severity": "major"
    }
  ],
  "groupId": "15600",
  "bugId": "15600",
  "date": "2002-05-09T11:34:25+02:00",
  "product": "JDT",
  "component": "UI",
  "severity": "major"
}