{
  "comments": [
    "After installing Eclipse in clean room (getting welcome page on first bootup) of the following archives:\n\nDIST_ECLIPSE_32BIT\u003d\"eclipse-SDK-M20060912-1730-linux-gtk.tar.gz\"\nDIST_EMFSDOXSD\u003d\"emf-sdo-xsd-SDK-M200609071016.zip\"\nDIST_GEF\u003d\"GEF-SDK-3.2.zip\"\nDIST_VE\u003d\"VE-SDK-1.2.zip\"\nDIST_BIRT\u003d\"birt-report-framework-sdk-2_1_0.zip\"\nDIST_CDT_32BIT\u003d\"org.eclipse.cdt.sdk-3.1.0-linux.x86.tar.gz\"\nDIST_DALI\u003d\"dali-R-0.5-200606282232.zip\"\nDIST_JEM\u003d\"JEM-SDK-M20060912.zip\"\nDIST_WTP\u003d\"wtp-sdk-M-1.5.1-200609150551.zip\"\nDIST_JSF\u003d\"wtp-jsf-sdk-M-1.5.1-200609150551.zip\"\nDIST_TPTP\u003d\"tptp.runtime-TPTP-4.3.0-200609150100.zip\"\nDIST_TPTP_SDK\u003d\"tptp.sdk-TPTP-4.3.0-200609150100.zip\"\nDIST_TPTP_JVMTI\u003d\"jvmti-client-TPTP-4.2.0.2.zip\"\nDIST_DTP\u003d\"dtp-sdk_1.0M1.zip\"\n\nI then went on to install ATF atf-linux-sdk-0.1-20060912-1300.zip from \"New Archived Site\" in update manager.\n\nDuring the update process I am shown the License agreements, I select \"Agree\" and click the Next button and the following exception occurs.\n\nClicking Next again does not make another exception occur, but clicking Back button in the wizard, has the abnormal effect of making the 4 features listed get duplicated down the left hand side (on the license agreement page \"Feature License\") and clicking back again makes the dialog go back to where I expect (the feature selection page \"Search Results\")\n\nThe license agreement dialogue does not advance so I am unable to install ATF after installing this specific set of plugins.  I have deleted my Eclipse installation and my -configuration and workspace and started over and confirmed repeating the problem by being able to repeatidly demonstrate it.\n\n\n!SESSION 2006-09-20 19:36:51.062 -----------------------------------------------\neclipse.buildId\u003dM20060912-1730\njava.version\u003d1.5.0_08\njava.vendor\u003dSun Microsystems Inc.\nBootLoader constants: OS\u003dlinux, ARCH\u003dx86, WS\u003dgtk, NL\u003den_US\nCommand-line arguments:  -os linux -ws gtk -arch x86 -clean -debug /home/dlm/.options -data /home/dlm/workspace_cleanX\n\n!ENTRY org.eclipse.ui 4 4 2006-09-20 19:37:56.059\n!MESSAGE Unhandled event loop exception\n\n!ENTRY org.eclipse.ui 4 0 2006-09-20 19:37:56.060\n!MESSAGE java.lang.NullPointerException\n!STACK 0\njava.lang.NullPointerException\n        at org.eclipse.update.internal.ui.wizards.TargetPage$JobViewerSorter.compare(TargetPage.java:182)\n        at org.eclipse.jface.viewers.ViewerComparator$1.compare(ViewerComparator.java:184)\n        at java.util.Arrays.mergeSort(Arrays.java:1284)\n        at java.util.Arrays.sort(Arrays.java:1223)\n        at org.eclipse.jface.viewers.ViewerComparator.sort(ViewerComparator.java:182)\n        at org.eclipse.jface.viewers.StructuredViewer.getSortedChildren(StructuredViewer.java:988)\n        at org.eclipse.jface.viewers.TableViewer.internalRefreshAll(TableViewer.java:870)\n        at org.eclipse.jface.viewers.TableViewer.internalRefresh(TableViewer.java:818)\n        at org.eclipse.jface.viewers.TableViewer.internalRefresh(TableViewer.java:807)\n        at org.eclipse.jface.viewers.StructuredViewer$7.run(StructuredViewer.java:1388)\n        at org.eclipse.jface.viewers.StructuredViewer.preservingSelection(StructuredViewer.java:1323)\n        at org.eclipse.jface.viewers.StructuredViewer.refresh(StructuredViewer.java:1386)\n        at org.eclipse.jface.viewers.StructuredViewer.refresh(StructuredViewer.java:1345)\n        at org.eclipse.jface.viewers.TableViewer.inputChanged(TableViewer.java:767)\n        at org.eclipse.jface.viewers.ContentViewer.setInput(ContentViewer.java:250)\n        at org.eclipse.jface.viewers.StructuredViewer.setInput(StructuredViewer.java:1542)\n        at org.eclipse.update.internal.ui.wizards.TargetPage.setVisible(TargetPage.java:443)\n        at org.eclipse.jface.wizard.WizardDialog.updateForPage(WizardDialog.java:1056)\n        at org.eclipse.jface.wizard.WizardDialog.access$2(WizardDialog.java:1038)\n        at org.eclipse.jface.wizard.WizardDialog$4.run(WizardDialog.java:1028)\n        at org.eclipse.swt.custom.BusyIndicator.showWhile(BusyIndicator.java:67)\n        at org.eclipse.jface.wizard.WizardDialog.showPage(WizardDialog.java:1026)\n        at org.eclipse.jface.wizard.WizardDialog.nextPressed(WizardDialog.java:757)\n        at org.eclipse.jface.wizard.WizardDialog.buttonPressed(WizardDialog.java:351)\n        at org.eclipse.jface.dialogs.Dialog$3.widgetSelected(Dialog.java:660)\n        at org.eclipse.swt.widgets.TypedListener.handleEvent(TypedListener.java:90)\n        at org.eclipse.swt.widgets.EventTable.sendEvent(EventTable.java:66)\n        at org.eclipse.swt.widgets.Widget.sendEvent(Widget.java:1085)\n        at org.eclipse.swt.widgets.Display.runDeferredEvents(Display.java:3166)\n        at org.eclipse.swt.widgets.Display.readAndDispatch(Display.java:2842)\n        at org.eclipse.jface.window.Window.runEventLoop(Window.java:820)\n        at org.eclipse.jface.window.Window.open(Window.java:796)\n        at org.eclipse.update.internal.ui.wizards.ResizableInstallWizardDialog.open(ResizableInstallWizardDialog.java:59)\n        at org.eclipse.update.internal.ui.wizards.InstallWizardOperation$UpdateJobChangeListener.openInstallWizard2(InstallWizardOperation.java:100)\n        at org.eclipse.update.internal.ui.wizards.InstallWizardOperation$UpdateJobChangeListener.access$0(InstallWizardOperation.java:85)\n        at org.eclipse.update.internal.ui.wizards.InstallWizardOperation$3.run(InstallWizardOperation.java:77)",
    "I have narrowed down the problem a little.  First of all I made the configuration more leaner only installing:\n\nDIST_ECLIPSE_32BIT\u003d\"eclipse-SDK-M20060912-1730-linux-gtk.tar.gz\"\nDIST_EMFSDOXSD\u003d\"emf-sdo-xsd-SDK-M200609071016.zip\"\nDIST_GEF\u003d\"GEF-SDK-3.2.zip\"\nDIST_JEM\u003d\"JEM-SDK-M20060912.zip\"\nDIST_WTP\u003d\"wtp-sdk-M-1.5.1-200609150551.zip\"\n\nThis being WTP + Its prerequisites, which are all need for ATF to be installed.\n\n\nAfter my clean room install from ZIPs I run the command:\n\neclipse/eclipse -clean -initialize\n\n\nIf I run this command after I unzipped everything then I always get the exception.  If I simply omit this command and run eclipse like normal to use it, then Update Manager works as I except and no exception occurs.\n\nJust to clarify the procedure:\n\n* Delete the tree eclipse lives in /opt/eclipse\n* Delete the configuration area eclipse uses $HOME/.eclipse\n* Delete the workspace $HOME/workspace_clean\n* Unzip all the file from /opt, creating /opt/eclipse/\n\n* Run eclipse/eclipse -clean -initialize\n\n* Bootup Eclipse like normal (eclipse/eclipse -clean -configuration file:///home/dlm/.eclipse/org.eclipse.platform_3.2.0/empty/ -data /home/dlm/workspace_clean)\n* Close the welcome screen view\n* Goto Help -\u003e Software Updates -\u003e Find and Install\n* Search for New Features\n* Ensure ATF is ticked (which I added thru \"New Archived Site\")\n* Finish\n* Busy dialog shows while it searchs\n* Tick ATF again\n* Next\n* Select \"I Accept ...\"\n* Next (exception happens here)\n",
    "I have the same problem trying to install mylar from update site\n\nhttp://download.eclipse.org/technology/mylar/update-site/e3.2",
    "Note I am on win32 platform"
  ],
  "commentCreationDates": [
    "2006-09-20T20:44:39+02:00",
    "2006-09-20T22:47:52+02:00",
    "2007-03-13T22:37:07+01:00",
    "2007-03-13T22:38:34+01:00"
  ],
  "traces": [
    {
      "exceptionType": "java.lang.NullPointerException",
      "elements": [
        {
          "method": "org.eclipse.update.internal.ui.wizards.TargetPage$JobViewerSorter.compare",
          "source": "TargetPage.java:182"
        },
        {
          "method": "org.eclipse.jface.viewers.ViewerComparator$1.compare",
          "source": "ViewerComparator.java:184"
        },
        {
          "method": "java.util.Arrays.mergeSort",
          "source": "Arrays.java:1284"
        },
        {
          "method": "java.util.Arrays.sort",
          "source": "Arrays.java:1223"
        },
        {
          "method": "org.eclipse.jface.viewers.ViewerComparator.sort",
          "source": "ViewerComparator.java:182"
        },
        {
          "method": "org.eclipse.jface.viewers.StructuredViewer.getSortedChildren",
          "source": "StructuredViewer.java:988"
        },
        {
          "method": "org.eclipse.jface.viewers.TableViewer.internalRefreshAll",
          "source": "TableViewer.java:870"
        },
        {
          "method": "org.eclipse.jface.viewers.TableViewer.internalRefresh",
          "source": "TableViewer.java:818"
        },
        {
          "method": "org.eclipse.jface.viewers.TableViewer.internalRefresh",
          "source": "TableViewer.java:807"
        },
        {
          "method": "org.eclipse.jface.viewers.StructuredViewer$7.run",
          "source": "StructuredViewer.java:1388"
        },
        {
          "method": "org.eclipse.jface.viewers.StructuredViewer.preservingSelection",
          "source": "StructuredViewer.java:1323"
        },
        {
          "method": "org.eclipse.jface.viewers.StructuredViewer.refresh",
          "source": "StructuredViewer.java:1386"
        },
        {
          "method": "org.eclipse.jface.viewers.StructuredViewer.refresh",
          "source": "StructuredViewer.java:1345"
        },
        {
          "method": "org.eclipse.jface.viewers.TableViewer.inputChanged",
          "source": "TableViewer.java:767"
        },
        {
          "method": "org.eclipse.jface.viewers.ContentViewer.setInput",
          "source": "ContentViewer.java:250"
        },
        {
          "method": "org.eclipse.jface.viewers.StructuredViewer.setInput",
          "source": "StructuredViewer.java:1542"
        },
        {
          "method": "org.eclipse.update.internal.ui.wizards.TargetPage.setVisible",
          "source": "TargetPage.java:443"
        },
        {
          "method": "org.eclipse.jface.wizard.WizardDialog.updateForPage",
          "source": "WizardDialog.java:1056"
        },
        {
          "method": "org.eclipse.jface.wizard.WizardDialog.access$2",
          "source": "WizardDialog.java:1038"
        },
        {
          "method": "org.eclipse.jface.wizard.WizardDialog$4.run",
          "source": "WizardDialog.java:1028"
        },
        {
          "method": "org.eclipse.swt.custom.BusyIndicator.showWhile",
          "source": "BusyIndicator.java:67"
        },
        {
          "method": "org.eclipse.jface.wizard.WizardDialog.showPage",
          "source": "WizardDialog.java:1026"
        },
        {
          "method": "org.eclipse.jface.wizard.WizardDialog.nextPressed",
          "source": "WizardDialog.java:757"
        },
        {
          "method": "org.eclipse.jface.wizard.WizardDialog.buttonPressed",
          "source": "WizardDialog.java:351"
        },
        {
          "method": "org.eclipse.jface.dialogs.Dialog$3.widgetSelected",
          "source": "Dialog.java:660"
        },
        {
          "method": "org.eclipse.swt.widgets.TypedListener.handleEvent",
          "source": "TypedListener.java:90"
        },
        {
          "method": "org.eclipse.swt.widgets.EventTable.sendEvent",
          "source": "EventTable.java:66"
        },
        {
          "method": "org.eclipse.swt.widgets.Widget.sendEvent",
          "source": "Widget.java:1085"
        },
        {
          "method": "org.eclipse.swt.widgets.Display.runDeferredEvents",
          "source": "Display.java:3166"
        },
        {
          "method": "org.eclipse.swt.widgets.Display.readAndDispatch",
          "source": "Display.java:2842"
        },
        {
          "method": "org.eclipse.jface.window.Window.runEventLoop",
          "source": "Window.java:820"
        },
        {
          "method": "org.eclipse.jface.window.Window.open",
          "source": "Window.java:796"
        },
        {
          "method": "org.eclipse.update.internal.ui.wizards.ResizableInstallWizardDialog.open",
          "source": "ResizableInstallWizardDialog.java:59"
        },
        {
          "method": "org.eclipse.update.internal.ui.wizards.InstallWizardOperation$UpdateJobChangeListener.openInstallWizard2",
          "source": "InstallWizardOperation.java:100"
        },
        {
          "method": "org.eclipse.update.internal.ui.wizards.InstallWizardOperation$UpdateJobChangeListener.access$0",
          "source": "InstallWizardOperation.java:85"
        },
        {
          "method": "org.eclipse.update.internal.ui.wizards.InstallWizardOperation$3.run",
          "source": "InstallWizardOperation.java:77"
        }
      ],
      "number": 0,
      "commentIndex": 0,
      "bugId": "158047",
      "date": "2006-09-20T20:44:39+02:00",
      "product": "Platform",
      "component": "Update",
      "severity": "normal"
    }
  ],
  "groupId": "158047",
  "bugId": "158047",
  "date": "2006-09-20T20:44:39+02:00",
  "product": "Platform",
  "component": "Update",
  "severity": "normal"
}