{
  "comments": [
    "Trying to initialize a HbDataStore with an EPackage in which an integer-array is defined as EDataType results in the following Exception:\n\norg.hibernate.MappingException: Could not determine type for: int[], for columns: [org.hibernate.mapping.Column(elt)]\n    at org.hibernate.mapping.SimpleValue.getType(SimpleValue.java:266)\n    at org.hibernate.mapping.SimpleValue.isValid(SimpleValue.java:253)\n    at org.hibernate.mapping.Collection.validate(Collection.java:262)\n    at org.hibernate.cfg.Configuration.validate(Configuration.java:988)\n    at org.hibernate.cfg.Configuration.buildSessionFactory(Configuration.java:1169)\n    at org.eclipse.emf.teneo.hibernate.HbDataStore.buildSessionFactory(HbDataStore.java:474)\n    at org.eclipse.emf.teneo.hibernate.HbDataStore.initialize(HbDataStore.java:187)\n    at ...\n\n\nWhen using EByteArray in a model (which is a predefined EDataType) the initilization seems to work fine, but saving and storing to a Resource throws a ClassCastException trying to cast byte[] to a List:\n\norg.eclipse.emf.teneo.hibernate.HbStoreException: Exception when saving resource remarctest\n\tat org.eclipse.emf.teneo.hibernate.resource.HibernateResource.saveResource(HibernateResource.java:214)\n\tat org.eclipse.emf.teneo.resource.StoreResource.save(StoreResource.java:271)\n\tat ....\n\n\nThe use of Arrays as EDataTypes is quite important for us, and we are very interested in a BugFix ;)",
    "Addressed in 0.7.5 I200609290842 "
  ],
  "commentCreationDates": [
    "2006-09-21T14:09:59+02:00",
    "2006-09-29T22:26:18+02:00"
  ],
  "traces": [
    {
      "exceptionType": "org.hibernate.MappingException",
      "message": "Could not determine type for: int[], for columns: [org.hibernate.mapping.Column(elt)]",
      "elements": [
        {
          "method": "org.hibernate.mapping.SimpleValue.getType",
          "source": "SimpleValue.java:266"
        },
        {
          "method": "org.hibernate.mapping.SimpleValue.isValid",
          "source": "SimpleValue.java:253"
        },
        {
          "method": "org.hibernate.mapping.Collection.validate",
          "source": "Collection.java:262"
        },
        {
          "method": "org.hibernate.cfg.Configuration.validate",
          "source": "Configuration.java:988"
        },
        {
          "method": "org.hibernate.cfg.Configuration.buildSessionFactory",
          "source": "Configuration.java:1169"
        },
        {
          "method": "org.eclipse.emf.teneo.hibernate.HbDataStore.buildSessionFactory",
          "source": "HbDataStore.java:474"
        },
        {
          "method": "org.eclipse.emf.teneo.hibernate.HbDataStore.initialize",
          "source": "HbDataStore.java:187"
        }
      ],
      "number": 0,
      "commentIndex": 0,
      "bugId": "158132",
      "date": "2006-09-21T14:09:59+02:00",
      "product": "EMFT",
      "component": "Teneo",
      "severity": "normal"
    },
    {
      "exceptionType": "org.eclipse.emf.teneo.hibernate.HbStoreException",
      "message": "Exception when saving resource remarctest",
      "elements": [
        {
          "method": "org.eclipse.emf.teneo.hibernate.resource.HibernateResource.saveResource",
          "source": "HibernateResource.java:214"
        },
        {
          "method": "org.eclipse.emf.teneo.resource.StoreResource.save",
          "source": "StoreResource.java:271"
        }
      ],
      "number": 1,
      "commentIndex": 0,
      "bugId": "158132",
      "date": "2006-09-21T14:09:59+02:00",
      "product": "EMFT",
      "component": "Teneo",
      "severity": "normal"
    }
  ],
  "groupId": "158132",
  "bugId": "158132",
  "date": "2006-09-21T14:09:59+02:00",
  "product": "EMFT",
  "component": "Teneo",
  "severity": "normal"
}