{
  "comments": [
    "I run Eclipse buildId\u003dM20060629-1905 with the arguments shown below.\nI run Mandriva Linux 64-bit on a AMD64 processor but I use the 32-bit JDK from SUN (see below).\n\nTHE PROBLEM: it is not possible to run a program with run (running ant does not work either), a window appears to tell me \"exception occurred executing command line.\". There is a details button but it is grayed out.\n\nOutput from the log is given below together with an extract from the top program showing that all the ram is actually used, but there is still some swap free. \n\n---\neclipse.buildId\u003dM20060629-1905\njava.version\u003d1.5.0_08\njava.vendor\u003dSun Microsystems Inc.\nBootLoader constants: OS\u003dlinux, ARCH\u003dx86, WS\u003dgtk, NL\u003den_US\nFramework arguments:  -vm /usr/java/jdk-32bit/bin/java\nCommand-line arguments:  -os linux -ws gtk -arch x86 -vm /usr/java/jdk-32bit/bin/java\n\n----\n!ENTRY org.eclipse.debug.core 4 120 2006-09-21 06:45:46.013\n!MESSAGE Exception occurred executing command line.\n!STACK 0\njava.io.IOException: java.io.IOException: Cannot allocate memory\n        at java.lang.UNIXProcess.\u003cinit\u003e(UNIXProcess.java:148)\n        at java.lang.ProcessImpl.start(ProcessImpl.java:65)\n        at java.lang.ProcessBuilder.start(ProcessBuilder.java:451)\n        at java.lang.Runtime.exec(Runtime.java:591)\n        at org.eclipse.debug.core.DebugPlugin.exec(DebugPlugin.java:744)\n        at org.eclipse.jdt.launching.AbstractVMRunner.exec(AbstractVMRunner.java:70)\n        at org.eclipse.jdt.internal.launching.StandardVMRunner.run(StandardVMRunner.java:241)\n        at org.eclipse.jdt.launching.JavaLaunchDelegate.launch(JavaLaunchDelegate.java:101)\n        at org.eclipse.ant.internal.ui.launchConfigurations.AntLaunchDelegate.runInSeparateVM(AntLaunchDelegate.java:550)\n        at org.eclipse.ant.internal.ui.launchConfigurations.AntLaunchDelegate.launch(AntLaunchDelegate.java:209)\n        at org.eclipse.debug.internal.core.LaunchConfiguration.launch(LaunchConfiguration.java:639)\n        at org.eclipse.debug.internal.core.LaunchConfiguration.launch(LaunchConfiguration.java:565)\n        at org.eclipse.debug.internal.ui.DebugUIPlugin.buildAndLaunch(DebugUIPlugin.java:754)\n        at org.eclipse.debug.internal.ui.DebugUIPlugin$6.run(DebugUIPlugin.java:944)\n        at org.eclipse.core.internal.jobs.Worker.run(Worker.java:58)\n\n----\ntop - 20:03:10 up 23 days, 21:06,  1 user,  load average: 1.10, 1.20, 1.11\nTasks: 164 total,   2 running, 162 sleeping,   0 stopped,   0 zombie\nCpu(s): 11.7% us,  2.3% sy,  0.0% ni, 86.0% id,  0.0% wa,  0.0% hi,  0.0% si\nMem:   2059944k total,  2042168k used,    17776k free,    33576k buffers\nSwap:  1630556k total,  1456232k used,   174324k free,   271068k cached",
    "If you try using a 64-bit VM does the problem still occur?\n\nI am not sure there is much (if anything) we can do about this, we delegate the commandline (from the run dialog) to java.lang.Runtime and let it handle the process creation, etc.\n\nTaking a quick loook at sun\u0027s developer forums there are a lot of memory related problems using a 32-bit vm with a 64-bit processor.",
    "There is nothing we can do about this bug, this is a vm/processor problem. Closing as INVALID"
  ],
  "commentCreationDates": [
    "2006-09-22T02:08:27+02:00",
    "2006-09-25T18:18:37+02:00",
    "2006-10-17T18:59:46+02:00"
  ],
  "traces": [
    {
      "exceptionType": "java.io.IOException",
      "message": "Cannot allocate memory",
      "elements": [
        {
          "method": "java.lang.UNIXProcess.\u003cinit\u003e",
          "source": "UNIXProcess.java:148"
        },
        {
          "method": "java.lang.ProcessImpl.start",
          "source": "ProcessImpl.java:65"
        },
        {
          "method": "java.lang.ProcessBuilder.start",
          "source": "ProcessBuilder.java:451"
        },
        {
          "method": "java.lang.Runtime.exec",
          "source": "Runtime.java:591"
        },
        {
          "method": "org.eclipse.debug.core.DebugPlugin.exec",
          "source": "DebugPlugin.java:744"
        },
        {
          "method": "org.eclipse.jdt.launching.AbstractVMRunner.exec",
          "source": "AbstractVMRunner.java:70"
        },
        {
          "method": "org.eclipse.jdt.internal.launching.StandardVMRunner.run",
          "source": "StandardVMRunner.java:241"
        },
        {
          "method": "org.eclipse.jdt.launching.JavaLaunchDelegate.launch",
          "source": "JavaLaunchDelegate.java:101"
        },
        {
          "method": "org.eclipse.ant.internal.ui.launchConfigurations.AntLaunchDelegate.runInSeparateVM",
          "source": "AntLaunchDelegate.java:550"
        },
        {
          "method": "org.eclipse.ant.internal.ui.launchConfigurations.AntLaunchDelegate.launch",
          "source": "AntLaunchDelegate.java:209"
        },
        {
          "method": "org.eclipse.debug.internal.core.LaunchConfiguration.launch",
          "source": "LaunchConfiguration.java:639"
        },
        {
          "method": "org.eclipse.debug.internal.core.LaunchConfiguration.launch",
          "source": "LaunchConfiguration.java:565"
        },
        {
          "method": "org.eclipse.debug.internal.ui.DebugUIPlugin.buildAndLaunch",
          "source": "DebugUIPlugin.java:754"
        },
        {
          "method": "org.eclipse.debug.internal.ui.DebugUIPlugin$6.run",
          "source": "DebugUIPlugin.java:944"
        },
        {
          "method": "org.eclipse.core.internal.jobs.Worker.run",
          "source": "Worker.java:58"
        }
      ],
      "number": 0,
      "commentIndex": 0,
      "bugId": "158244",
      "date": "2006-09-22T02:08:27+02:00",
      "product": "JDT",
      "component": "Debug",
      "severity": "blocker"
    }
  ],
  "groupId": "158244",
  "bugId": "158244",
  "date": "2006-09-22T02:08:27+02:00",
  "product": "JDT",
  "component": "Debug",
  "severity": "blocker"
}