{
  "comments": [
    "Using the Report Engine API i invoke RunAndRenderTask.run() from a scheduled job and the invocation fails because a required parameter is missing:\n\norg.eclipse.birt.report.engine.api.EngineException: Some required parameter values are not set or set to incompatible data type.\n\nNow i want to store this Exception in a database in order to show information to the user, when he will look later at the result of the job execution. Trying to serialize the exception (via Hibernate) will fail with the following root cause: \n\nCaused by: java.io.NotSerializableException: com.ibm.icu.impl.ResourceBundleWrapper\n\tat java.io.ObjectOutputStream.writeObject0(Unknown Source)\n\tat java.io.ObjectOutputStream.defaultWriteFields(Unknown Source)\n\tat java.io.ObjectOutputStream.writeSerialData(Unknown Source)\n\tat java.io.ObjectOutputStream.writeOrdinaryObject(Unknown Source)\n\tat java.io.ObjectOutputStream.writeObject0(Unknown Source)\n\tat java.io.ObjectOutputStream.writeObject(Unknown Source)\n\tat org.hibernate.util.SerializationHelper.serialize(SerializationHelper.java:154)\n\nSuperclass BirtException seems to be the problem because it has a non-static field \"rb\" of type ResourceBundle, which references an instance of com.ibm.icu.impl.ResourceBundleWrapper.",
    "change the ResourceBundle field to transient."
  ],
  "commentCreationDates": [
    "2006-10-23T15:19:35+02:00",
    "2006-10-30T23:45:12+01:00"
  ],
  "traces": [
    {
      "exceptionType": "java.io.NotSerializableException",
      "message": "com.ibm.icu.impl.ResourceBundleWrapper",
      "elements": [
        {
          "method": "java.io.ObjectOutputStream.writeObject0",
          "source": "Unknown Source"
        },
        {
          "method": "java.io.ObjectOutputStream.defaultWriteFields",
          "source": "Unknown Source"
        },
        {
          "method": "java.io.ObjectOutputStream.writeSerialData",
          "source": "Unknown Source"
        },
        {
          "method": "java.io.ObjectOutputStream.writeOrdinaryObject",
          "source": "Unknown Source"
        },
        {
          "method": "java.io.ObjectOutputStream.writeObject0",
          "source": "Unknown Source"
        },
        {
          "method": "java.io.ObjectOutputStream.writeObject",
          "source": "Unknown Source"
        },
        {
          "method": "org.hibernate.util.SerializationHelper.serialize",
          "source": "SerializationHelper.java:154"
        }
      ],
      "number": 0,
      "commentIndex": 0,
      "bugId": "161938",
      "date": "2006-10-23T15:19:35+02:00",
      "product": "BIRT",
      "component": "Report Engine",
      "severity": "normal"
    }
  ],
  "groupId": "161938",
  "bugId": "161938",
  "date": "2006-10-23T15:19:35+02:00",
  "product": "BIRT",
  "component": "Report Engine",
  "severity": "normal"
}