{
  "comments": [
    "I start eclipse with -console, and press ctrl+\\ to generate the stack dump file. But got below errors: \n\nDon\u0027t know if I operated correctly? Thanks!\n\nshan-song-weis-computer:~/software/eclipse shansongwei$ ./eclipse -console\n\nosgi\u003e ^\\Full thread dump Java HotSpot(TM) Client VM (1.5.0_06-64 mixed mode, sharing):\n\n\n\n\n\"Worker-5\" prio\u003d5 tid\u003d0x00538d30 nid\u003d0x18c7600 in Object.wait() [0xb0b24000..0xb0b24d10]\n\n        at java.lang.Object.wait(Native Method)\n\n        - waiting on \u003c0x26b3bd48\u003e (a org.eclipse.core.internal.jobs.WorkerPool)\n\n        at org.eclipse.core.internal.jobs.WorkerPool.sleep(WorkerPool.java:173)\n\n        - locked \u003c0x26b3bd48\u003e (a org.eclipse.core.internal.jobs.WorkerPool)\n\n        at org.eclipse.core.internal.jobs.WorkerPool.startJob(WorkerPool.java:205)\n\n        at org.eclipse.core.internal.jobs.Worker.run(Worker.java:51)\n\n\n\n\n\"Worker-4\" prio\u003d5 tid\u003d0x00538880 nid\u003d0x199d200 in Object.wait() [0xb0aa3000..0xb0aa3d10]\n\n        at java.lang.Object.wait(Native Method)\n\n        - waiting on \u003c0x26b3bd48\u003e (a org.eclipse.core.internal.jobs.WorkerPool)\n\n        at org.eclipse.core.internal.jobs.WorkerPool.sleep(WorkerPool.java:173)\n\n        - locked \u003c0x26b3bd48\u003e (a org.eclipse.core.internal.jobs.WorkerPool)\n\n        at org.eclipse.core.internal.jobs.WorkerPool.startJob(WorkerPool.java:205)\n\n        at org.eclipse.core.internal.jobs.Worker.run(Worker.java:51)\n\n\n\n\n\"Worker-3\" prio\u003d5 tid\u003d0x00538490 nid\u003d0x195b600 in Object.wait() [0xb0a22000..0xb0a22d10]\n\n        at java.lang.Object.wait(Native Method)\n\n        - waiting on \u003c0x26b3bd48\u003e (a org.eclipse.core.internal.jobs.WorkerPool)\n\n        at org.eclipse.core.internal.jobs.WorkerPool.sleep(WorkerPool.java:173)\n\n        - locked \u003c0x26b3bd48\u003e (a org.eclipse.core.internal.jobs.WorkerPool)\n\n        at org.eclipse.core.internal.jobs.WorkerPool.startJob(WorkerPool.java:205)\n\n        at org.eclipse.core.internal.jobs.Worker.run(Worker.java:51)\n\n\n\n\n\"Worker-2\" prio\u003d5 tid\u003d0x00537fb0 nid\u003d0x199ce00 in Object.wait() [0xb09a1000..0xb09a1d10]\n\n        at java.lang.Object.wait(Native Method)\n\n        - waiting on \u003c0x26b3bd48\u003e (a org.eclipse.core.internal.jobs.WorkerPool)\n\n        at org.eclipse.core.internal.jobs.WorkerPool.sleep(WorkerPool.java:173)\n\n        - locked \u003c0x26b3bd48\u003e (a org.eclipse.core.internal.jobs.WorkerPool)\n\n        at org.eclipse.core.internal.jobs.WorkerPool.startJob(WorkerPool.java:205)\n\n        at org.eclipse.core.internal.jobs.Worker.run(Worker.java:51)\n\n\n\n\n\"Worker-1\" prio\u003d5 tid\u003d0x0050bc70 nid\u003d0x18b0e00 in Object.wait() [0xb078e000..0xb078ed10]\n\n        at java.lang.Object.wait(Native Method)\n\n        - waiting on \u003c0x26b3bd48\u003e (a org.eclipse.core.internal.jobs.WorkerPool)\n\n        at org.eclipse.core.internal.jobs.WorkerPool.sleep(WorkerPool.java:173)\n\n        - locked \u003c0x26b3bd48\u003e (a org.eclipse.core.internal.jobs.WorkerPool)\n\n        at org.eclipse.core.internal.jobs.WorkerPool.startJob(WorkerPool.java:205)\n\n        at org.eclipse.core.internal.jobs.Worker.run(Worker.java:51)\n\n\n\n\n\"Java indexing\" daemon prio\u003d4 tid\u003d0x0052ae70 nid\u003d0x192c000 in Object.wait() [0xb080f000..0xb080fd10]\n\n        at java.lang.Object.wait(Native Method)\n\n        - waiting on \u003c0x26e6ac18\u003e (a org.eclipse.jdt.internal.core.search.indexing.IndexManager)\n\n        at java.lang.Object.wait(Object.java:474)\n\n        at org.eclipse.jdt.internal.core.search.processing.JobManager.run(JobManager.java:349)\n\n        - locked \u003c0x26e6ac18\u003e (a org.eclipse.jdt.internal.core.search.indexing.IndexManager)\n\n        at java.lang.Thread.run(Thread.java:613)\n\n\n\n\n\"Worker-0\" prio\u003d5 tid\u003d0x0051a700 nid\u003d0x18ae000 in Object.wait() [0xb070d000..0xb070dd10]\n\n        at java.lang.Object.wait(Native Method)\n\n        - waiting on \u003c0x26b3bd48\u003e (a org.eclipse.core.internal.jobs.WorkerPool)\n\n        at org.eclipse.core.internal.jobs.WorkerPool.sleep(WorkerPool.java:173)\n\n        - locked \u003c0x26b3bd48\u003e (a org.eclipse.core.internal.jobs.WorkerPool)\n\n        at org.eclipse.core.internal.jobs.WorkerPool.startJob(WorkerPool.java:205)\n\n        at org.eclipse.core.internal.jobs.Worker.run(Worker.java:51)\n\n\n\n\n\"Start Level Event Dispatcher\" daemon prio\u003d5 tid\u003d0x00510920 nid\u003d0x1866200 in Object.wait() [0xb068c000..0xb068cd10]\n\n        at java.lang.Object.wait(Native Method)\n\n        - waiting on \u003c0x26b01730\u003e (a org.eclipse.osgi.framework.eventmgr.EventManager$EventThread)\n\n        at java.lang.Object.wait(Object.java:474)\n\n        at org.eclipse.osgi.framework.eventmgr.EventManager$EventThread.getNextEvent(EventManager.java:349)\n\n        - locked \u003c0x26b01730\u003e (a org.eclipse.osgi.framework.eventmgr.EventManager$EventThread)\n\n        at org.eclipse.osgi.framework.eventmgr.EventManager$EventThread.run(EventManager.java:287)\n\n\n\n\n\"OSGi Console\" prio\u003d5 tid\u003d0x0050fe80 nid\u003d0x1845000 runnable [0xb060b000..0xb060bd10]\n\n        at java.io.FileInputStream.readBytes(Native Method)\n\n        at java.io.FileInputStream.read(FileInputStream.java:194)\n\n        at java.io.BufferedInputStream.read1(BufferedInputStream.java:254)\n\n        at java.io.BufferedInputStream.read(BufferedInputStream.java:313)\n\n        - locked \u003c0x26a849d0\u003e (a java.io.BufferedInputStream)\n\n        at sun.nio.cs.StreamDecoder$CharsetSD.readBytes(StreamDecoder.java:411)\n\n        at sun.nio.cs.StreamDecoder$CharsetSD.implRead(StreamDecoder.java:453)\n\n        at sun.nio.cs.StreamDecoder.read(StreamDecoder.java:183)\n\n        - locked \u003c0x26aebce8\u003e (a java.io.InputStreamReader)\n\n        at java.io.InputStreamReader.read(InputStreamReader.java:167)\n\n        at java.io.BufferedReader.fill(BufferedReader.java:136)\n\n        at java.io.BufferedReader.readLine(BufferedReader.java:299)\n\n        - locked \u003c0x26aebce8\u003e (a java.io.InputStreamReader)\n\n        at java.io.BufferedReader.readLine(BufferedReader.java:362)\n\n        at org.eclipse.osgi.framework.internal.core.FrameworkConsole.console(FrameworkConsole.java:272)\n\n        at org.eclipse.osgi.framework.internal.core.FrameworkConsole.run(FrameworkConsole.java:213)\n\n        at java.lang.Thread.run(Thread.java:613)\n\n\n\n\n\"Framework Event Dispatcher\" daemon prio\u003d5 tid\u003d0x0050fc60 nid\u003d0x1863000 in Object.wait() [0xb058a000..0xb058ad10]\n\n        at java.lang.Object.wait(Native Method)\n\n        - waiting on \u003c0x26aebd70\u003e (a org.eclipse.osgi.framework.eventmgr.EventManager$EventThread)\n\n        at java.lang.Object.wait(Object.java:474)\n\n        at org.eclipse.osgi.framework.eventmgr.EventManager$EventThread.getNextEvent(EventManager.java:349)\n\n        - locked \u003c0x26aebd70\u003e (a org.eclipse.osgi.framework.eventmgr.EventManager$EventThread)\n\n        at org.eclipse.osgi.framework.eventmgr.EventManager$EventThread.run(EventManager.java:287)\n\n\n\n\n\"State Data Manager\" daemon prio\u003d5 tid\u003d0x0050f510 nid\u003d0x1866a00 waiting on condition [0xb0509000..0xb0509d10]\n\n        at java.lang.Thread.sleep(Native Method)\n\n        at org.eclipse.osgi.internal.baseadaptor.StateManager.run(StateManager.java:297)\n\n        at java.lang.Thread.run(Thread.java:613)\n\n\n\n\n\"Low Memory Detector\" daemon prio\u003d5 tid\u003d0x00508ec0 nid\u003d0x1817c00 runnable [0x00000000..0x00000000]\n\n\n\n\n\"CompilerThread0\" daemon prio\u003d9 tid\u003d0x005084c0 nid\u003d0x1817800 waiting on condition [0x00000000..0xb030574c]\n\n\n\n\n\"Signal Dispatcher\" daemon prio\u003d9 tid\u003d0x00507f40 nid\u003d0x1803e00 waiting on condition [0x00000000..0x00000000]\n\n\n\n\n\"Finalizer\" daemon prio\u003d8 tid\u003d0x00507700 nid\u003d0x1810800 in Object.wait() [0xb0203000..0xb0203d10]\n\n        at java.lang.Object.wait(Native Method)\n\n        - waiting on \u003c0x26a82390\u003e (a java.lang.ref.ReferenceQueue$Lock)\n\n        at java.lang.ref.ReferenceQueue.remove(ReferenceQueue.java:116)\n\n        - locked \u003c0x26a82390\u003e (a java.lang.ref.ReferenceQueue$Lock)\n\n        at java.lang.ref.ReferenceQueue.remove(ReferenceQueue.java:132)\n\n        at java.lang.ref.Finalizer$FinalizerThread.run(Finalizer.java:159)\n\n\n\n\n\"Reference Handler\" daemon prio\u003d10 tid\u003d0x00507300 nid\u003d0x1808000 in Object.wait() [0xb0182000..0xb0182d10]\n\n        at java.lang.Object.wait(Native Method)\n\n        - waiting on \u003c0x26a82410\u003e (a java.lang.ref.Reference$Lock)\n\n        at java.lang.Object.wait(Object.java:474)\n\n        at java.lang.ref.Reference$ReferenceHandler.run(Reference.java:116)\n\n        - locked \u003c0x26a82410\u003e (a java.lang.ref.Reference$Lock)\n\n\n\n\n\"main\" prio\u003d6 tid\u003d0x005013e0 nid\u003d0xa000cfc0 runnable [0xbfffe000..0xbfffea4c]\n\n        at org.eclipse.swt.internal.carbon.OS.ReceiveNextEvent(Native Method)\n\n        at org.eclipse.swt.widgets.Display.sleep(Display.java:3782)\n\n        at org.eclipse.ui.application.WorkbenchAdvisor.eventLoopIdle(WorkbenchAdvisor.java:333)\n\n        at org.eclipse.ui.internal.Workbench.runEventLoop(Workbench.java:1915)\n\n        at org.eclipse.ui.internal.Workbench.runUI(Workbench.java:1878)\n\n        at org.eclipse.ui.internal.Workbench.createAndRunWorkbench(Workbench.java:419)\n\n        at org.eclipse.ui.PlatformUI.createAndRunWorkbench(PlatformUI.java:149)\n\n        at org.eclipse.ui.internal.ide.IDEApplication.run(IDEApplication.java:95)\n\n        at org.eclipse.core.internal.runtime.PlatformActivator$1.run(PlatformActivator.java:78)\n\n        at org.eclipse.core.runtime.internal.adaptor.EclipseAppLauncher.runApplication(EclipseAppLauncher.java:92)\n\n        at org.eclipse.core.runtime.internal.adaptor.EclipseAppLauncher.start(EclipseAppLauncher.java:68)\n\n        at org.eclipse.core.runtime.adaptor.EclipseStarter.run(EclipseStarter.java:400)\n\n        at org.eclipse.core.runtime.adaptor.EclipseStarter.run(EclipseStarter.java:177)\n\n        at sun.reflect.NativeMethodAccessorImpl.invoke0(Native Method)\n\n        at sun.reflect.NativeMethodAccessorImpl.invoke(NativeMethodAccessorImpl.java:39)\n\n        at sun.reflect.DelegatingMethodAccessorImpl.invoke(DelegatingMethodAccessorImpl.java:25)\n\n        at java.lang.reflect.Method.invoke(Method.java:585)\n\n        at org.eclipse.core.launcher.Main.invokeFramework(Main.java:336)\n\n        at org.eclipse.core.launcher.Main.basicRun(Main.java:280)\n\n        at org.eclipse.core.launcher.Main.run(Main.java:977)\n\n        at org.eclipse.core.launcher.Main.main(Main.java:952)\n\n\n\n\n\"VM Thread\" prio\u003d9 tid\u003d0x00506af0 nid\u003d0x1807c00 runnable \n\n\n\n\n\"VM Periodic Task Thread\" prio\u003d9 tid\u003d0x0050a5d0 nid\u003d0x1818000 waiting on condition \n\n\n\n\n\"Exception Catcher Thread\" prio\u003d10 tid\u003d0x00501600 nid\u003d0x1804a00 runnable \n\nQuit\n\nshan-song-weis-computer:~/software/eclipse shansongwei$ java.io.IOException: Input/output error\n\n        at java.io.FileInputStream.readBytes(Native Method)\n\n        at java.io.FileInputStream.read(FileInputStream.java:194)\n\n        at java.io.BufferedInputStream.read1(BufferedInputStream.java:254)\n\n        at java.io.BufferedInputStream.read(BufferedInputStream.java:313)\n\n        at sun.nio.cs.StreamDecoder$CharsetSD.readBytes(StreamDecoder.java:411)\n\n        at sun.nio.cs.StreamDecoder$CharsetSD.implRead(StreamDecoder.java:453)\n\n        at sun.nio.cs.StreamDecoder.read(StreamDecoder.java:183)\n\n        at java.io.InputStreamReader.read(InputStreamReader.java:167)\n\n        at java.io.BufferedReader.fill(BufferedReader.java:136)\n\n        at java.io.BufferedReader.readLine(BufferedReader.java:299)\n\n        at java.io.BufferedReader.readLine(BufferedReader.java:362)\n\n        at org.eclipse.osgi.framework.internal.core.FrameworkConsole.console(FrameworkConsole.java:272)\n\n        at org.eclipse.osgi.framework.internal.core.FrameworkConsole.run(FrameworkConsole.java:213)\n\n        at java.lang.Thread.run(Thread.java:613)",
    "Looks like you got your stack dump.  Is that not what you were expecting?  I do not understand what the problem is with the output.",
    "What we don\u0027t expect is the exceptions. Our product is based on eclipse, and generation of stack dump file is a function our product need support. But now when we try to get a stack dump in our product, the exceptions are thrown out. And besides, I didn\u0027t see the created stack dump file. (On Linux, there\u0027s a sentence telling where the stack dump file is created). And this function works well in Windows/Linux, only had problem in Mac. ",
    "The launcher has changed significantly in 3.3.  Can you retry in 3.3 M6?",
    "i tried this in 3.3 RC3, not expect result is ouput."
  ],
  "commentCreationDates": [
    "2006-11-03T08:02:17+01:00",
    "2006-11-03T13:45:54+01:00",
    "2006-11-06T01:43:54+01:00",
    "2007-03-30T20:11:17+02:00",
    "2007-07-25T05:00:16+02:00"
  ],
  "traces": [
    {
      "exceptionType": "java.io.IOException",
      "message": "Input/output error",
      "elements": [
        {
          "method": "java.io.FileInputStream.readBytes",
          "source": "Native Method"
        },
        {
          "method": "java.io.FileInputStream.read",
          "source": "FileInputStream.java:194"
        },
        {
          "method": "java.io.BufferedInputStream.read1",
          "source": "BufferedInputStream.java:254"
        },
        {
          "method": "java.io.BufferedInputStream.read",
          "source": "BufferedInputStream.java:313"
        },
        {
          "method": "sun.nio.cs.StreamDecoder$CharsetSD.readBytes",
          "source": "StreamDecoder.java:411"
        },
        {
          "method": "sun.nio.cs.StreamDecoder$CharsetSD.implRead",
          "source": "StreamDecoder.java:453"
        },
        {
          "method": "sun.nio.cs.StreamDecoder.read",
          "source": "StreamDecoder.java:183"
        },
        {
          "method": "java.io.InputStreamReader.read",
          "source": "InputStreamReader.java:167"
        },
        {
          "method": "java.io.BufferedReader.fill",
          "source": "BufferedReader.java:136"
        },
        {
          "method": "java.io.BufferedReader.readLine",
          "source": "BufferedReader.java:299"
        },
        {
          "method": "java.io.BufferedReader.readLine",
          "source": "BufferedReader.java:362"
        },
        {
          "method": "org.eclipse.osgi.framework.internal.core.FrameworkConsole.console",
          "source": "FrameworkConsole.java:272"
        },
        {
          "method": "org.eclipse.osgi.framework.internal.core.FrameworkConsole.run",
          "source": "FrameworkConsole.java:213"
        },
        {
          "method": "java.lang.Thread.run",
          "source": "Thread.java:613"
        }
      ],
      "number": 0,
      "commentIndex": 0,
      "bugId": "163308",
      "date": "2006-11-03T08:02:17+01:00",
      "product": "Equinox",
      "component": "Framework",
      "severity": "normal"
    }
  ],
  "groupId": "163308",
  "bugId": "163308",
  "date": "2006-11-03T08:02:17+01:00",
  "product": "Equinox",
  "component": "Framework",
  "severity": "normal"
}