{
  "comments": [
    "See below:\n\n!SESSION 2006-11-08 10:24:32.280 -----------------------------------------------\n\neclipse.buildId\u003dM20060629-1905\njava.version\u003d1.5.0_08\njava.vendor\u003dSun Microsystems Inc.\nBootLoader constants: OS\u003dwin32, ARCH\u003dx86, WS\u003dwin32, NL\u003dde_DE\nFramework arguments:  -vmargs  -XX:MaxPermSize\u003d128m -Xms40m -Xmx512m\nCommand-line arguments:  -os win32 -ws win32 -arch x86 -vmargs  -XX:MaxPermSize\u003d\n128m -Xms40m -Xmx512m -consolelog\n\n!ENTRY org.eclipse.xsd 2 0 2006-11-08 10:25:46.458\n!MESSAGE White spaces are required between publicId and systemId.\n!STACK 0\norg.eclipse.emf.ecore.resource.Resource$IOWrappedException: White spaces are req\nuired between publicId and systemId.\n        at org.eclipse.xsd.util.XSDResourceImpl.getDocument(XSDResourceImpl.java\n:344)\n        at org.eclipse.xsd.util.XSDResourceImpl.getDocument(XSDResourceImpl.java\n:372)\n        at org.eclipse.xsd.util.XSDResourceImpl.doLoad(XSDResourceImpl.java:680)\n\n        at org.eclipse.xsd.util.XSDResourceImpl.doLoad(XSDResourceImpl.java:784)\n\n        at org.eclipse.emf.ecore.resource.impl.ResourceImpl.load(ResourceImpl.ja\nva:1094)\n        at org.eclipse.wst.xsd.contentmodel.internal.util.XSDSchemaLocatorImpl.l\nocateSchema(XSDSchemaLocatorImpl.java:56)\n        at org.eclipse.xsd.impl.XSDSchemaDirectiveImpl.locateSchema(XSDSchemaDir\nectiveImpl.java:400)\n        at org.eclipse.xsd.impl.XSDSchemaDirectiveImpl.resolve(XSDSchemaDirectiv\neImpl.java:340)\n        at org.eclipse.xsd.impl.XSDImportImpl.importSchema(XSDImportImpl.java:41\n1)\n        at org.eclipse.xsd.impl.XSDSchemaImpl.resolveSchema(XSDSchemaImpl.java:2\n136)\n        at org.eclipse.xsd.impl.XSDSchemaImpl.resolveNamedComponent(XSDSchemaImp\nl.java:2164)\n        at org.eclipse.xsd.impl.XSDSchemaImpl.resolveTypeDefinition(XSDSchemaImp\nl.java:2223)\n        at org.eclipse.xsd.impl.XSDConcreteComponentImpl.resolveTypeDefinition(X\nSDConcreteComponentImpl.java:2328)\n        at org.eclipse.xsd.impl.XSDComplexTypeDefinitionImpl.patch(XSDComplexTyp\neDefinitionImpl.java:997)\n        at org.eclipse.xsd.impl.XSDConcreteComponentImpl.patch(XSDConcreteCompon\nentImpl.java:526)\n        at org.eclipse.xsd.impl.XSDNamedComponentImpl.patch(XSDNamedComponentImp\nl.java:767)\n        at org.eclipse.xsd.impl.XSDElementDeclarationImpl.patch(XSDElementDeclar\nationImpl.java:545)\n        at org.eclipse.xsd.impl.XSDConcreteComponentImpl.patch(XSDConcreteCompon\nentImpl.java:526)\n        at org.eclipse.xsd.impl.XSDSchemaImpl.patch(XSDSchemaImpl.java:1505)\n        at org.eclipse.xsd.impl.XSDSchemaImpl.changeAttribute(XSDSchemaImpl.java\n:2335)\n        at org.eclipse.xsd.impl.XSDConcreteComponentImpl.eNotify(XSDConcreteComp\nonentImpl.java:1240)\n        at org.eclipse.xsd.impl.XSDSchemaImpl.setSchemaLocation(XSDSchemaImpl.ja\nva:829)\n        at org.eclipse.xsd.util.XSDResourceImpl.doLoad(XSDResourceImpl.java:756)\n\n        at org.eclipse.xsd.util.XSDResourceImpl.doLoad(XSDResourceImpl.java:784)\n\n        at org.eclipse.emf.ecore.resource.impl.ResourceImpl.load(ResourceImpl.ja\nva:1094)\n        at org.eclipse.wst.xsd.contentmodel.internal.XSDImpl.buildXSDModel(XSDIm\npl.java:210)\n        at org.eclipse.wst.xsd.contentmodel.internal.XSDImpl.buildCMDocument(XSD\nImpl.java:169)\n        at org.eclipse.wst.xsd.contentmodel.internal.CMDocumentFactoryXSD.create\nCMDocument(CMDocumentFactoryXSD.java:37)\n        at org.eclipse.wst.xml.core.internal.contentmodel.ContentModelManager.cr\neateCMDocument(ContentModelManager.java:56)\n        at org.eclipse.wst.xml.core.internal.contentmodel.modelqueryimpl.CMDocum\nentManagerImpl.buildCMDocument(CMDocumentManagerImpl.java:259)\n        at org.eclipse.wst.xml.core.internal.contentmodel.modelqueryimpl.CMDocum\nentManagerImpl$1.run(CMDocumentManagerImpl.java:229)\n        at org.eclipse.core.internal.jobs.Worker.run(Worker.java:58)\nCaused by: org.xml.sax.SAXParseException: White spaces are required between publ\nicId and systemId.\n        at com.sun.org.apache.xerces.internal.parsers.DOMParser.parse(DOMParser.\njava:264)\n        at com.sun.org.apache.xerces.internal.jaxp.DocumentBuilderImpl.parse(Doc\numentBuilderImpl.java:292)\n        at org.eclipse.xsd.util.XSDResourceImpl.getDocument(XSDResourceImpl.java\n:335)\n        ... 31 more",
    "Hi Oleksandr, can you please attach your test case?",
    "Hello, this message has appeared just after each Eclipse startup (during building workspace). After applying some of recent updates it does not appear any more. If it would reappear, I will provide additional information.",
    "Hi Oleksandr,\n\nResolving this bug.  Please reopen this bug if you encounter this in the future.  Thanks.",
    "Hello, \n\ndo not see any reason to have this bug resolved - I meet this situation on everyday basis. Any advices how to track down situation are very welcome.\n\nRegards,\nOleksandr",
    "Oleksandr, can you attach the XML Schema file (and dependencies) that are causing this issue?  I suspect that you have an invalid file that\u0027s causing the XML Schema model to choke. ",
    "Hmm.. this one is marked as major.  Can you describe what the side effects of this problem are?  I can\u0027t tell from the description given here if this problem meets the definition of \u0027major\u0027.",
    "Hello,\n\nif only I know this file ... - I have no clue which file it is and how to find it. \n\nRegards,\nOleksandr",
    "Oleksandr, did you have a copy of Xerces in your JRE/lib/ext folder at the time?  The mentions of com.sun.org.apache.xerces.internal.jaxp.DocumentBuilderImpl indicate the use of a different ciopy of Xerces than we were expecting.",
    "No, I have not and never had. The only lib that I have ever put in JRE/lib/ext is rxtx (to work with COM-ports).\n\nRegards, Oleksandr(In reply to comment #8)\n\u003e Oleksandr, did you have a copy of Xerces in your JRE/lib/ext folder at the\n\u003e time?  The mentions of\n\u003e com.sun.org.apache.xerces.internal.jaxp.DocumentBuilderImpl indicate the use of\n\u003e a different ciopy of Xerces than we were expecting.\n\u003e \n\n",
    "Hmm, ok, that\u0027s the one built into JRE 1.5.  Still, that\u0027s not a class that should be called from a plug-in.  Can you attach the output of the Configuration details from the About dialog?",
    "(In reply to comment #10)\n\u003e Hmm, ok, that\u0027s the one built into JRE 1.5.  Still, that\u0027s not a class that\n\u003e should be called from a plug-in.  Can you attach the output of the\n\u003e Configuration details from the About dialog?\n\u003e \n\nSorry, I has reported this bug more then one year ago and from that time Eclipse version, configuration and so on have changed a lot. Now I do not experience this bug. Have to test on another computer as well, but this a can do tomorrow only.\n\nRegards,\nOleksandr",
    "I\u0027ll close this for now as WORKSFORME.",
    "If the issue reappears feel free to re-open with more information."
  ],
  "commentCreationDates": [
    "2006-11-08T09:27:31+01:00",
    "2006-11-20T21:24:14+01:00",
    "2006-11-21T09:03:24+01:00",
    "2007-01-05T20:03:13+01:00",
    "2007-01-05T20:09:50+01:00",
    "2007-01-12T06:35:34+01:00",
    "2007-01-12T06:38:45+01:00",
    "2007-01-12T06:51:22+01:00",
    "2007-09-05T11:20:17+02:00",
    "2007-09-05T11:42:38+02:00",
    "2007-09-05T12:11:21+02:00",
    "2007-09-05T12:57:59+02:00",
    "2007-09-20T16:22:56+02:00",
    "2007-09-20T16:24:02+02:00"
  ],
  "traces": [
    {
      "exceptionType": "org.eclipse.emf.ecore.resource.Resource$IOWrappedException",
      "message": "White spaces are req uired between publicId and systemId.",
      "elements": [
        {
          "method": "org.eclipse.xsd.util.XSDResourceImpl.getDocument",
          "source": "XSDResourceImpl.java :344"
        },
        {
          "method": "org.eclipse.xsd.util.XSDResourceImpl.getDocument",
          "source": "XSDResourceImpl.java :372"
        },
        {
          "method": "org.eclipse.xsd.util.XSDResourceImpl.doLoad",
          "source": "XSDResourceImpl.java:680"
        },
        {
          "method": "org.eclipse.xsd.util.XSDResourceImpl.doLoad",
          "source": "XSDResourceImpl.java:784"
        },
        {
          "method": "org.eclipse.emf.ecore.resource.impl.ResourceImpl.load",
          "source": "ResourceImpl.ja va:1094"
        },
        {
          "method": "org.eclipse.wst.xsd.contentmodel.internal.util.XSDSchemaLocatorImpl.locateSchema",
          "source": "XSDSchemaLocatorImpl.java:56"
        },
        {
          "method": "org.eclipse.xsd.impl.XSDSchemaDirectiveImpl.locateSchema",
          "source": "XSDSchemaDir ectiveImpl.java:400"
        },
        {
          "method": "org.eclipse.xsd.impl.XSDSchemaDirectiveImpl.resolve",
          "source": "XSDSchemaDirectiv eImpl.java:340"
        },
        {
          "method": "org.eclipse.xsd.impl.XSDImportImpl.importSchema",
          "source": "XSDImportImpl.java:41 1"
        },
        {
          "method": "org.eclipse.xsd.impl.XSDSchemaImpl.resolveSchema",
          "source": "XSDSchemaImpl.java:2 136"
        },
        {
          "method": "org.eclipse.xsd.impl.XSDSchemaImpl.resolveNamedComponent",
          "source": "XSDSchemaImp l.java:2164"
        },
        {
          "method": "org.eclipse.xsd.impl.XSDSchemaImpl.resolveTypeDefinition",
          "source": "XSDSchemaImp l.java:2223"
        },
        {
          "method": "org.eclipse.xsd.impl.XSDConcreteComponentImpl.resolveTypeDefinition",
          "source": "X SDConcreteComponentImpl.java:2328"
        },
        {
          "method": "org.eclipse.xsd.impl.XSDComplexTypeDefinitionImpl.patch",
          "source": "XSDComplexTyp eDefinitionImpl.java:997"
        },
        {
          "method": "org.eclipse.xsd.impl.XSDConcreteComponentImpl.patch",
          "source": "XSDConcreteCompon entImpl.java:526"
        },
        {
          "method": "org.eclipse.xsd.impl.XSDNamedComponentImpl.patch",
          "source": "XSDNamedComponentImp l.java:767"
        },
        {
          "method": "org.eclipse.xsd.impl.XSDElementDeclarationImpl.patch",
          "source": "XSDElementDeclar ationImpl.java:545"
        },
        {
          "method": "org.eclipse.xsd.impl.XSDConcreteComponentImpl.patch",
          "source": "XSDConcreteCompon entImpl.java:526"
        },
        {
          "method": "org.eclipse.xsd.impl.XSDSchemaImpl.patch",
          "source": "XSDSchemaImpl.java:1505"
        },
        {
          "method": "org.eclipse.xsd.impl.XSDSchemaImpl.changeAttribute",
          "source": "XSDSchemaImpl.java :2335"
        },
        {
          "method": "org.eclipse.xsd.impl.XSDConcreteComponentImpl.eNotify",
          "source": "XSDConcreteComp onentImpl.java:1240"
        },
        {
          "method": "org.eclipse.xsd.impl.XSDSchemaImpl.setSchemaLocation",
          "source": "XSDSchemaImpl.ja va:829"
        },
        {
          "method": "org.eclipse.xsd.util.XSDResourceImpl.doLoad",
          "source": "XSDResourceImpl.java:756"
        },
        {
          "method": "org.eclipse.xsd.util.XSDResourceImpl.doLoad",
          "source": "XSDResourceImpl.java:784"
        },
        {
          "method": "org.eclipse.emf.ecore.resource.impl.ResourceImpl.load",
          "source": "ResourceImpl.ja va:1094"
        },
        {
          "method": "org.eclipse.wst.xsd.contentmodel.internal.XSDImpl.buildXSDModel",
          "source": "XSDIm pl.java:210"
        },
        {
          "method": "org.eclipse.wst.xsd.contentmodel.internal.XSDImpl.buildCMDocument",
          "source": "XSD Impl.java:169"
        },
        {
          "method": "org.eclipse.wst.xsd.contentmodel.internal.CMDocumentFactoryXSD.createCMDocument",
          "source": "CMDocumentFactoryXSD.java:37"
        },
        {
          "method": "org.eclipse.wst.xml.core.internal.contentmodel.ContentModelManager.createCMDocument",
          "source": "ContentModelManager.java:56"
        },
        {
          "method": "org.eclipse.wst.xml.core.internal.contentmodel.modelqueryimpl.CMDocumentManagerImpl.buildCMDocument",
          "source": "CMDocumentManagerImpl.java:259"
        },
        {
          "method": "org.eclipse.wst.xml.core.internal.contentmodel.modelqueryimpl.CMDocumentManagerImpl$1.run",
          "source": "CMDocumentManagerImpl.java:229"
        },
        {
          "method": "org.eclipse.core.internal.jobs.Worker.run",
          "source": "Worker.java:58"
        }
      ],
      "causedBy": {
        "exceptionType": "org.xml.sax.SAXParseException",
        "message": "White spaces are required between publ icId and systemId.",
        "elements": [
          {
            "method": "com.sun.org.apache.xerces.internal.parsers.DOMParser.parse",
            "source": "DOMParser. java:264"
          },
          {
            "method": "com.sun.org.apache.xerces.internal.jaxp.DocumentBuilderImpl.parse",
            "source": "Doc umentBuilderImpl.java:292"
          },
          {
            "method": "org.eclipse.xsd.util.XSDResourceImpl.getDocument",
            "source": "XSDResourceImpl.java :335"
          }
        ],
        "number": 0,
        "commentIndex": 0
      },
      "number": 0,
      "commentIndex": 0,
      "bugId": "163775",
      "date": "2006-11-08T09:27:31+01:00",
      "product": "Web Tools",
      "component": "wst.xsd",
      "severity": "major"
    }
  ],
  "groupId": "163775",
  "bugId": "163775",
  "date": "2006-11-08T09:27:31+01:00",
  "product": "Web Tools",
  "component": "wst.xsd",
  "severity": "major"
}