{
  "comments": [
    "05/19 integration build.\n\nWas trying to understand the logic on the About product dialog that determined \nwhen features icon\u0027s should appear.  When adding an alternate branding (WSWB) I \ncould not get the WSWB 32x32 gif to appear on the about dialog.  \n\nWas confused as  two different eclipse icons would appear when the WSWB brand \nwas the primary feature. (This is because the gif in the pde plugin is fuzzy \nwhen compared with the other eclipse plugins - so the dialog views them as \ndifferent).  \n\nFigured out that the active feature icon is not shown in the 32x32 icon area \neven when other features with the same 32x32 icons exist.  Wonder if this is the \ndesired behavior.\n\nAs part of debugging this I tried two things:\n\nLoad the UI plugin into the workspace, launch a runtime instance of the \nworkbench, and then trace through the about dialog code using breakpoints to \nstudy areas of interest.  This occurred during this process:\n- Error parsing version \"null\" for plugin: com.ibm.wswb.sdk in \nworkbench.readFeaturesInfo()\n- The about product dialog does not include any 32x32 gifs and the about \nfeatures dialog does not include any content.\nCopy the .options file from the UI plugin to the root directory and launch \neclipse with -debug -consolelog.  This occurred during this process:\n\n- If run from the base -5/19 eclipse unzip - nothing unusual occurs.\n- If run from a base that has been tweaked to use an alternate primary feature \n(WSWB) the following entries exist in the console window:\n------------\n!ENTRY org.eclipse.core.resources 1 4 5/20/02 11:50 AM\n!MESSAGE Problem reading configuration info for: org.eclipse.pde.doc.user\nProblem reading configuration info for: org.eclipse.pde.doc.user\nReason:\n!ENTRY org.eclipse.ui 4 0 5/20/02 11:50 AM\n!MESSAGE Unable to load plugin file: about.ini\nUnable to load plugin file: about.ini\n!ENTRY org.eclipse.core.resources 1 4 5/20/02 11:50 AM\n!MESSAGE Problem reading configuration info for: org.eclipse.platform\nProblem reading configuration info for: org.eclipse.platform\nReason:\n!ENTRY org.eclipse.ui 4 0 5/20/02 11:50 AM\n!MESSAGE Property \"%appName\" not found\n!STACK 0\njava.util.MissingResourceException: Can\u0027t find resource for bundle \njava.util.PropertyResourceBundle, key\nappName\n        at java.util.ResourceBundle.getObject(ResourceBundle.java:387)\n        at java.util.ResourceBundle.getString(ResourceBundle.java:359)\n        at \norg.eclipse.ui.internal.NewConfigurationInfo.getResourceString(NewConfigurationI\nnfo.java:196)\n        at org.eclipse.ui.internal.AboutInfo.readINIFile(AboutInfo.java:318)\n        at \norg.eclipse.ui.internal.NewConfigurationInfo.readINIFile(NewConfigurationInfo.ja\nva:110)\n        at \norg.eclipse.ui.internal.Workbench.readFeaturesInfo(Workbench.java:944)\n        at org.eclipse.ui.internal.Workbench.getFeaturesInfo(Workbench.java:475)\n        at \norg.eclipse.ui.internal.dialogs.AboutDialog.getFeaturesInfo(AboutDialog.java:353\n)\n        at \norg.eclipse.ui.internal.dialogs.AboutDialog.createDialogArea(AboutDialog.java:24\n5)\n        at org.eclipse.jface.dialogs.Dialog.createContents(Dialog.java:496)\n        at org.eclipse.jface.window.Window.create(Window.java:278)\n        at org.eclipse.jface.window.Window.open(Window.java:527)\n        at org.eclipse.ui.internal.AboutAction.run(AboutAction.java:37)\n        at org.eclipse.jface.action.Action.runWithEvent(Action.java:590)\n        at \norg.eclipse.jface.action.ActionContributionItem.handleWidgetSelection(ActionCont\nributionItem.j\nava:407)\n        at \norg.eclipse.jface.action.ActionContributionItem.handleWidgetEvent(ActionContribu\ntionItem.java:\n361)\n        at \norg.eclipse.jface.action.ActionContributionItem.access$0(ActionContributionItem.\njava:352)\n        at \norg.eclipse.jface.action.ActionContributionItem$ActionListener.handleEvent(Actio\nnContributionI\ntem.java:47)\n        at org.eclipse.swt.widgets.EventTable.sendEvent(EventTable.java(Compiled \nCode))\n        at org.eclipse.swt.widgets.Widget.sendEvent(Widget.java:825)\n        at org.eclipse.swt.widgets.Display.runDeferredEvents(Display.java:1513)\n        at org.eclipse.swt.widgets.Display.readAndDispatch(Display.java:1275)\n        at org.eclipse.ui.internal.Workbench.runEventLoop(Workbench.java:1085)\n        at org.eclipse.ui.internal.Workbench.run(Workbench.java:1068)\n        at \norg.eclipse.core.internal.boot.InternalBootLoader.run(InternalBootLoader.java:73\n9)\n        at org.eclipse.core.boot.BootLoader.run(BootLoader.java:454)\n        at java.lang.reflect.Method.invoke(Native Method)\n        at org.eclipse.core.launcher.Main.basicRun(Main.java:199)\n        at org.eclipse.core.launcher.Main.run(Main.java:642)\n        at org.eclipse.core.launcher.Main.main(Main.java:475)\nProperty \"%appName\" not found\n------------\n\nNot sure if there is something I\u0027m missing or if the dir names (_2.0.0) in the \nruntime plugin dir - no _2.0.0 in the workspace project) have anything to do \nwith this problem.",
    "The about dialog should work the same under debug as when running as host.\n\nWill ask PDE to fix up their icon.\n\n",
    "In 2.0 the feature icons in the about dialog are feature provider icons.\nAn icon is shown for each provider. More than one icon will be shown for a \nprovider if the provider\u0027s features specify icons with a different name or CRC.\nThe primary feature\u0027s icon is not excluded (this went in late in 2.0).\n\nNote when testing this in a runtime the -update command line argument should \nbe used (the the target has already been run you must also delete the contents \nof its .config directory). This will cause the features to appear in the \ntarget. This is a workaround for an Install/PDE issue.\n\nPlease reopen if any further problems are encountered."
  ],
  "commentCreationDates": [
    "2002-05-20T18:41:45+02:00",
    "2002-05-20T18:57:55+02:00",
    "2002-07-22T22:16:46+02:00"
  ],
  "traces": [
    {
      "exceptionType": "java.util.MissingResourceException",
      "message": "Can\u0027t find resource for bundle  java.util.PropertyResourceBundle, key appName",
      "elements": [
        {
          "method": "java.util.ResourceBundle.getObject",
          "source": "ResourceBundle.java:387"
        },
        {
          "method": "java.util.ResourceBundle.getString",
          "source": "ResourceBundle.java:359"
        },
        {
          "method": "org.eclipse.ui.internal.NewConfigurationInfo.getResourceString",
          "source": "NewConfigurationI nfo.java:196"
        },
        {
          "method": "org.eclipse.ui.internal.AboutInfo.readINIFile",
          "source": "AboutInfo.java:318"
        },
        {
          "method": "org.eclipse.ui.internal.NewConfigurationInfo.readINIFile",
          "source": "NewConfigurationInfo.ja va:110"
        },
        {
          "method": "org.eclipse.ui.internal.Workbench.readFeaturesInfo",
          "source": "Workbench.java:944"
        },
        {
          "method": "org.eclipse.ui.internal.Workbench.getFeaturesInfo",
          "source": "Workbench.java:475"
        },
        {
          "method": "org.eclipse.ui.internal.dialogs.AboutDialog.getFeaturesInfo",
          "source": "AboutDialog.java:353 "
        },
        {
          "method": "org.eclipse.ui.internal.dialogs.AboutDialog.createDialogArea",
          "source": "AboutDialog.java:24 5"
        },
        {
          "method": "org.eclipse.jface.dialogs.Dialog.createContents",
          "source": "Dialog.java:496"
        },
        {
          "method": "org.eclipse.jface.window.Window.create",
          "source": "Window.java:278"
        },
        {
          "method": "org.eclipse.jface.window.Window.open",
          "source": "Window.java:527"
        },
        {
          "method": "org.eclipse.ui.internal.AboutAction.run",
          "source": "AboutAction.java:37"
        },
        {
          "method": "org.eclipse.jface.action.Action.runWithEvent",
          "source": "Action.java:590"
        },
        {
          "method": "org.eclipse.jface.action.ActionContributionItem.handleWidgetSelection",
          "source": "ActionCont ributionItem.j ava:407"
        },
        {
          "method": "org.eclipse.jface.action.ActionContributionItem.handleWidgetEvent",
          "source": "ActionContribu tionItem.java: 361"
        },
        {
          "method": "org.eclipse.jface.action.ActionContributionItem.access$0",
          "source": "ActionContributionItem. java:352"
        },
        {
          "method": "org.eclipse.jface.action.ActionContributionItem$ActionListener.handleEvent",
          "source": "Actio nContributionI tem.java:47"
        },
        {
          "method": "org.eclipse.swt.widgets.EventTable.sendEvent",
          "source": "EventTable.java(Compiled  Code)"
        },
        {
          "method": "org.eclipse.swt.widgets.Widget.sendEvent",
          "source": "Widget.java:825"
        },
        {
          "method": "org.eclipse.swt.widgets.Display.runDeferredEvents",
          "source": "Display.java:1513"
        },
        {
          "method": "org.eclipse.swt.widgets.Display.readAndDispatch",
          "source": "Display.java:1275"
        },
        {
          "method": "org.eclipse.ui.internal.Workbench.runEventLoop",
          "source": "Workbench.java:1085"
        },
        {
          "method": "org.eclipse.ui.internal.Workbench.run",
          "source": "Workbench.java:1068"
        },
        {
          "method": "org.eclipse.core.internal.boot.InternalBootLoader.run",
          "source": "InternalBootLoader.java:73 9"
        },
        {
          "method": "org.eclipse.core.boot.BootLoader.run",
          "source": "BootLoader.java:454"
        },
        {
          "method": "java.lang.reflect.Method.invoke",
          "source": "Native Method"
        },
        {
          "method": "org.eclipse.core.launcher.Main.basicRun",
          "source": "Main.java:199"
        },
        {
          "method": "org.eclipse.core.launcher.Main.run",
          "source": "Main.java:642"
        },
        {
          "method": "org.eclipse.core.launcher.Main.main",
          "source": "Main.java:475"
        }
      ],
      "number": 0,
      "commentIndex": 0,
      "bugId": "16451",
      "date": "2002-05-20T18:41:45+02:00",
      "product": "Platform",
      "component": "UI",
      "severity": "major"
    }
  ],
  "groupId": "16451",
  "bugId": "16451",
  "date": "2002-05-20T18:41:45+02:00",
  "product": "Platform",
  "component": "UI",
  "severity": "major"
}