{
  "comments": [
    "Overview Description:  \n\n    The device server issued the following error messages when invoking Topology \u0026 AttributePEOnly scanners during Aperi fabric agent starting up time\n2006.11.09 11:20:06.767-08:00 BTAQE1107E InbandScanHandler failed to start InbandScanner Topology on managed   host 9.43.237.27:9570.   org.eclipse.aperi.discovery.tsanm.InbandScanner run\n2006.11.09 11:20:06.783-08:00 java.lang.RuntimeException: Handshake generated a fault.\n\tat org.eclipse.aperi.sanmgmt.middleware.data.SoapClient.handshake(SoapClient.java:300)\n\tat org.eclipse.aperi.sanmgmt.middleware.data.SoapClient.init(SoapClient.java:109)\n\tat org.eclipse.aperi.sanmgmt.middleware.data.SoapServiceProxy.invoke(SoapServiceProxy.java:50)\n\tat $Proxy7.invoke(Unknown Source)\n\tat org.eclipse.aperi.discovery.tsanm.InbandScanner.run(InbandScanner.java:134)   org.eclipse.aperi.discovery.tsanm.InbandScanner run\n2006.11.09 11:20:06.846-08:00 BTAQE1107E InbandScanHandler failed to start InbandScanner AttributePEOnly on managed   host 9.43.237.27:9570.   org.eclipse.aperi.discovery.tsanm.InbandScanner run\n2006.11.09 11:20:06.846-08:00 java.lang.RuntimeException: Handshake generated a fault.\n\tat org.eclipse.aperi.sanmgmt.middleware.data.SoapClient.handshake(SoapClient.java:300)\n\tat org.eclipse.aperi.sanmgmt.middleware.data.SoapClient.init(SoapClient.java:109)\n\tat org.eclipse.aperi.sanmgmt.middleware.data.SoapServiceProxy.invoke(SoapServiceProxy.java:50)\n\tat $Proxy7.invoke(Unknown Source)\n\tat org.eclipse.aperi.discovery.tsanm.InbandScanner.run(InbandScanner.java:134)   org.eclipse.aperi.discovery.tsanm.InbandScanner run\n\n\nSteps to Reproduce:  \n\n      Starting Aperi with device server and fabric agent installed\n\nActual Results:  \n\n      The fabric agent started without error but Topology \u0026 AttributePEOnly scanners would not run automatically. \n\nExpected Results:  \n\n      The fabric agent starts and Topology \u0026 AttributePEOnly scanners will run automatically. \n\nBuild Date \u0026 Platform:  \n\n    Build Aperi-20061121-1100.zip \u0026 windows platform",
    "The activator for the fabric agent did not provide a dictionary to be registered along with the services for IScanner, IChangeAgent, IHostQuery.\nThus the connector was not able to retrieve these services.\nThis has been fixed."
  ],
  "commentCreationDates": [
    "2006-11-24T20:50:58+01:00",
    "2006-11-28T12:47:00+01:00"
  ],
  "traces": [
    {
      "exceptionType": "java.lang.RuntimeException",
      "message": "Handshake generated a fault.",
      "elements": [
        {
          "method": "org.eclipse.aperi.sanmgmt.middleware.data.SoapClient.handshake",
          "source": "SoapClient.java:300"
        },
        {
          "method": "org.eclipse.aperi.sanmgmt.middleware.data.SoapClient.init",
          "source": "SoapClient.java:109"
        },
        {
          "method": "org.eclipse.aperi.sanmgmt.middleware.data.SoapServiceProxy.invoke",
          "source": "SoapServiceProxy.java:50"
        }
      ],
      "number": 0,
      "commentIndex": 0,
      "bugId": "165819",
      "date": "2006-11-24T20:50:58+01:00",
      "product": "Aperi",
      "component": "aperi.device",
      "severity": "critical"
    },
    {
      "exceptionType": "java.lang.RuntimeException",
      "message": "Handshake generated a fault.",
      "elements": [
        {
          "method": "org.eclipse.aperi.sanmgmt.middleware.data.SoapClient.handshake",
          "source": "SoapClient.java:300"
        },
        {
          "method": "org.eclipse.aperi.sanmgmt.middleware.data.SoapClient.init",
          "source": "SoapClient.java:109"
        },
        {
          "method": "org.eclipse.aperi.sanmgmt.middleware.data.SoapServiceProxy.invoke",
          "source": "SoapServiceProxy.java:50"
        }
      ],
      "number": 1,
      "commentIndex": 0,
      "bugId": "165819",
      "date": "2006-11-24T20:50:58+01:00",
      "product": "Aperi",
      "component": "aperi.device",
      "severity": "critical"
    }
  ],
  "groupId": "165819",
  "bugId": "165819",
  "date": "2006-11-24T20:50:58+01:00",
  "product": "Aperi",
  "component": "aperi.device",
  "severity": "critical"
}