{
  "comments": [
    "F1 on XP\nOk, this is my last try with strange path, promise \u003cg\u003e\n\nC:\\\u003eD:\\j2sdk1.4.0\\jre\\bin\\java.exe -cp \"C:\\Eclipse F1\\eclipse\\startup.jar\" \norg.eclipse.core.launcher.Main  -data \"c:\\Hi There\\\"  1\u003elog 2\u003eerr\n\nC:\\\u003etype err\nAn exception occurred while writing to the platform log:\njava.io.FileNotFoundException: c:\\Hi There\"  \\.metadata\\.log (The filename, \ndire\nctory name, or volume label syntax is incorrect)\n        at java.io.FileOutputStream.openAppend(Native Method)\n        at java.io.FileOutputStream.\u003cinit\u003e(FileOutputStream.java:174)\n        at java.io.FileOutputStream.\u003cinit\u003e(FileOutputStream.java:102)\n        at org.eclipse.core.launcher.Main.openLogFile(Main.java:1270)\n        at org.eclipse.core.launcher.Main.log(Main.java:1179)\n        at org.eclipse.core.launcher.Main.main(Main.java:480)\nLogging to the console instead.\n!ENTRY org.eclipse.core.launcher 4 0 \u0026#931;\u0026#9553;???? 22, 2002 10:44:49.439\n!MESSAGE Exception launching the Eclipse Platform:\nAn exception occurred while writing to the platform log:\njava.io.FileNotFoundException: c:\\Hi There\"  \\.metadata\\.log (The filename, \ndire\nctory name, or volume label syntax is incorrect)\n        at java.io.FileOutputStream.openAppend(Native Method)\n        at java.io.FileOutputStream.\u003cinit\u003e(FileOutputStream.java:174)\n        at java.io.FileOutputStream.\u003cinit\u003e(FileOutputStream.java:102)\n        at org.eclipse.core.launcher.Main.openLogFile(Main.java:1270)\n        at org.eclipse.core.launcher.Main.log(Main.java:1179)\n        at org.eclipse.core.launcher.Main.main(Main.java:481)\nLogging to the console instead.\n!STACK\njava.lang.reflect.InvocationTargetException\n        at sun.reflect.NativeMethodAccessorImpl.invoke0(Native Method)\n        at sun.reflect.NativeMethodAccessorImpl.invoke\n(NativeMethodAccessorImpl.\njava:39)\n        at sun.reflect.DelegatingMethodAccessorImpl.invoke\n(DelegatingMethodAcces\nsorImpl.java:25)\n        at java.lang.reflect.Method.invoke(Method.java:324)\n        at org.eclipse.core.launcher.Main.basicRun(Main.java:200)\n        at org.eclipse.core.launcher.Main.run(Main.java:643)\n        at org.eclipse.core.launcher.Main.main(Main.java:476)\nCaused by: java.lang.reflect.InvocationTargetException\n        at sun.reflect.NativeMethodAccessorImpl.invoke0(Native Method)\n        at sun.reflect.NativeMethodAccessorImpl.invoke\n(NativeMethodAccessorImpl.\njava:39)\n        at sun.reflect.DelegatingMethodAccessorImpl.invoke\n(DelegatingMethodAcces\nsorImpl.java:25)\n        at java.lang.reflect.Method.invoke(Method.java:324)\n        at org.eclipse.core.internal.boot.InternalBootLoader.startup\n(InternalBoo\ntLoader.java:873)\n        at org.eclipse.core.internal.boot.InternalBootLoader.run\n(InternalBootLoa\nder.java:732)\n        at org.eclipse.core.boot.BootLoader.run(BootLoader.java:462)\n        ... 7 more\nCaused by: org.eclipse.core.runtime.CoreException: The platform metadata area \nco\nuld not be written: c:\\Hi There\"  \\.metadata.  By default the platform writes \nit\ns content\nunder the current working directory when the platform is launched.  Use the -\ndat\na parameter to\nspecify a different content area for the platform.\n        at org.eclipse.core.internal.runtime.PlatformMetaArea.createLocation\n(Pla\ntformMetaArea.java:66)\n        at org.eclipse.core.internal.runtime.InternalPlatform.setupMetaArea\n(Inte\nrnalPlatform.java:849)\n        at org.eclipse.core.internal.runtime.InternalPlatform.loaderStartup\n(Inte\nrnalPlatform.java:545)\n        ... 14 more\n\n\nworks for \nC:\\\u003eD:\\j2sdk1.4.0\\jre\\bin\\java.exe -cp \"C:\\Eclipse F1\\eclipse\\startup.jar\" \norg.eclipse.core.launcher.Main  -data \"c:\\Hi There\\",
    "\"\\\" is a string escape character in Java.\ntry \"/\"",
    "will try but \u0027\\\u0027 worked for the path to starup.jar file \u003cg\u003e",
    "Duh !\nI am tired, of course you meant \\\" and not \\, \nOk, my bad, we can close this one",
    "Closed at originator\u0027s request."
  ],
  "commentCreationDates": [
    "2002-05-22T16:39:29+02:00",
    "2002-05-22T17:47:30+02:00",
    "2002-05-22T18:43:08+02:00",
    "2002-05-22T18:51:05+02:00",
    "2002-05-22T20:06:36+02:00"
  ],
  "traces": [
    {
      "exceptionType": "java.io.FileNotFoundException",
      "message": "c:\\Hi There\"  \\.metadata\\.log (The filename,  dire ctory name, or volume label syntax is incorrect)",
      "elements": [
        {
          "method": "java.io.FileOutputStream.openAppend",
          "source": "Native Method"
        },
        {
          "method": "java.io.FileOutputStream.\u003cinit\u003e",
          "source": "FileOutputStream.java:174"
        },
        {
          "method": "java.io.FileOutputStream.\u003cinit\u003e",
          "source": "FileOutputStream.java:102"
        },
        {
          "method": "org.eclipse.core.launcher.Main.openLogFile",
          "source": "Main.java:1270"
        },
        {
          "method": "org.eclipse.core.launcher.Main.log",
          "source": "Main.java:1179"
        },
        {
          "method": "org.eclipse.core.launcher.Main.main",
          "source": "Main.java:480"
        }
      ],
      "number": 0,
      "commentIndex": 0,
      "bugId": "16818",
      "date": "2002-05-22T16:39:29+02:00",
      "product": "Platform",
      "component": "Resources",
      "severity": "normal"
    },
    {
      "exceptionType": "java.io.FileNotFoundException",
      "message": "c:\\Hi There\"  \\.metadata\\.log (The filename,  dire ctory name, or volume label syntax is incorrect)",
      "elements": [
        {
          "method": "java.io.FileOutputStream.openAppend",
          "source": "Native Method"
        },
        {
          "method": "java.io.FileOutputStream.\u003cinit\u003e",
          "source": "FileOutputStream.java:174"
        },
        {
          "method": "java.io.FileOutputStream.\u003cinit\u003e",
          "source": "FileOutputStream.java:102"
        },
        {
          "method": "org.eclipse.core.launcher.Main.openLogFile",
          "source": "Main.java:1270"
        },
        {
          "method": "org.eclipse.core.launcher.Main.log",
          "source": "Main.java:1179"
        },
        {
          "method": "org.eclipse.core.launcher.Main.main",
          "source": "Main.java:481"
        }
      ],
      "number": 1,
      "commentIndex": 0,
      "bugId": "16818",
      "date": "2002-05-22T16:39:29+02:00",
      "product": "Platform",
      "component": "Resources",
      "severity": "normal"
    },
    {
      "exceptionType": "java.lang.reflect.InvocationTargetException",
      "elements": [
        {
          "method": "sun.reflect.NativeMethodAccessorImpl.invoke0",
          "source": "Native Method"
        },
        {
          "method": "sun.reflect.NativeMethodAccessorImpl.invoke",
          "source": "NativeMethodAccessorImpl. java:39"
        },
        {
          "method": "sun.reflect.DelegatingMethodAccessorImpl.invoke",
          "source": "DelegatingMethodAcces sorImpl.java:25"
        },
        {
          "method": "java.lang.reflect.Method.invoke",
          "source": "Method.java:324"
        },
        {
          "method": "org.eclipse.core.launcher.Main.basicRun",
          "source": "Main.java:200"
        },
        {
          "method": "org.eclipse.core.launcher.Main.run",
          "source": "Main.java:643"
        },
        {
          "method": "org.eclipse.core.launcher.Main.main",
          "source": "Main.java:476"
        }
      ],
      "causedBy": {
        "exceptionType": "java.lang.reflect.InvocationTargetException",
        "elements": [
          {
            "method": "sun.reflect.NativeMethodAccessorImpl.invoke0",
            "source": "Native Method"
          },
          {
            "method": "sun.reflect.NativeMethodAccessorImpl.invoke",
            "source": "NativeMethodAccessorImpl. java:39"
          },
          {
            "method": "sun.reflect.DelegatingMethodAccessorImpl.invoke",
            "source": "DelegatingMethodAcces sorImpl.java:25"
          },
          {
            "method": "java.lang.reflect.Method.invoke",
            "source": "Method.java:324"
          },
          {
            "method": "org.eclipse.core.internal.boot.InternalBootLoader.startup",
            "source": "InternalBoo tLoader.java:873"
          },
          {
            "method": "org.eclipse.core.internal.boot.InternalBootLoader.run",
            "source": "InternalBootLoa der.java:732"
          },
          {
            "method": "org.eclipse.core.boot.BootLoader.run",
            "source": "BootLoader.java:462"
          }
        ],
        "number": 0,
        "commentIndex": 0
      },
      "number": 2,
      "commentIndex": 0,
      "bugId": "16818",
      "date": "2002-05-22T16:39:29+02:00",
      "product": "Platform",
      "component": "Resources",
      "severity": "normal"
    }
  ],
  "groupId": "16818",
  "bugId": "16818",
  "date": "2002-05-22T16:39:29+02:00",
  "product": "Platform",
  "component": "Resources",
  "severity": "normal"
}