{
  "comments": [
    "Overview Description:  \nReceived the following error messages when discovering a DS8000 SS\n\n1/4/07 1:38:21 PM BTADS0000I Starting Discover Process collectStorageSubsystemsFromCIMOM , with Device Server RUN ID 46 , and Job ID 148 .\n1/4/07 1:38:22 PM HWN021727I Aperi discovery starting on CIMOM https://9.11.213.146:5989.\n1/4/07 1:38:24 PM HWN021725I Aperi discovered/rediscovered a device with name IBM.2107-1302541/Storage Facility Image IBM.2107-1302541 on CIMOM https://9.11.213.146:5989.\n1/4/07 1:38:24 PM HWN021503E An internal error occurred, please try again. If the problem persist, please contact IBM service.\n1/4/07 1:38:24 PM HWN021503E An internal error occurred, please try again. If the problem persist, please contact IBM service.\n1/4/07 1:38:24 PM HWN021728I Aperi discovery on CIMOM https://9.11.213.146:5989 is complete.\n1/4/07 1:38:39 PM BTADS0035E The execution of the job failed with: org.eclipse.aperi.common.api.ServerException: HWN021503E An internal error occurred, please try again. If the problem persist, please contact IBM service. .\n1/4/07 1:38:39 PM BTADS0001I Discover Process with Device Server RUN ID 46 and Job ID 148 is complete with Status\u003d 4 , Return Code\u003d 1 .\n\nThe traceAperiDeviceServer.log had the following error messages:\n\n2007.01.04 13:27:06.500-08:00 ERROR org.sblim.wbem.cim.CIMException: CIM_ERR_INVALID_CLASS(Remote exception at the CIMOM:CIM_ERR_INVALID_CLASS: The specified class does not exist: \"IBMTS_ObjectManager\")\n\tat org.sblim.wbem.xml.XMLDefaultHandlerImpl.startElement(XMLDefaultHandlerImpl.java:1041)\n\tat org.sblim.wbem.client.CIMEnumerationImpl.next(CIMEnumerationImpl.java:365)\n\tat org.sblim.wbem.client.CIMEnumerationImpl.\u003cinit\u003e(CIMEnumerationImpl.java:119)\n\tat org.sblim.wbem.client.CIMClientXML.getEnumeration(CIMClientXML.java:1590)\n\tat org.sblim.wbem.client.CIMClientXML.enumerateInstances(CIMClientXML.java:541)\n\tat org.sblim.wbem.client.CIMClient.enumerateInstances(CIMClient.java:908)\n\tat org.sblim.wbem.client.CIMClient.enumerateInstances(CIMClient.java:958)\n\tat sun.reflect.NativeMethodAccessorImpl.invoke0(Native Method)\n\tat sun.reflect.NativeMethodAccessorImpl.invoke(Unknown Source)\n\tat sun.reflect.DelegatingMethodAccessorImpl.invoke(Unknown Source)\n\tat java.lang.reflect.Method.invoke(Unknown Source)\n\tat org.eclipse.aperi.disk.common.util.thread.DiskMgrThread.run(DiskMgrThread.java:257)   org.eclipse.aperi.disk.common.CIM.CIMClientWrapper executeSvcCall CIMOM Registrator \n2007.01.04 13:27:07.375-08:00 ERROR org.sblim.wbem.cim.CIMException: CIM_ERR_NOT_FOUND(Remote exception at the CIMOM:CIM_ERR_NOT_FOUND: The requested object could not be found: \"CIM_IndicationFilter.CreationClassName\u003d\"CIM_IndicationFilter\",Name\u003d\"CIM_InstCreation for 9.43.237.27\",SystemCreationClassName\u003d\"CIM_ComputerSystem\",SystemName\u003d\"spyder.storage.tucson.ibm.com\"\")\n\tat org.sblim.wbem.xml.XMLDefaultHandlerImpl.startElement(XMLDefaultHandlerImpl.java:1041)\n\tat org.sblim.wbem.client.CIMEnumerationImpl.next(CIMEnumerationImpl.java:365)\n\tat org.sblim.wbem.client.CIMEnumerationImpl.\u003cinit\u003e(CIMEnumerationImpl.java:119)\n\tat org.sblim.wbem.client.CIMClientXML.getEnumeration(CIMClientXML.java:1590)\n\tat org.sblim.wbem.client.CIMClientXML.deleteInstance(CIMClientXML.java:459)\n\tat org.sblim.wbem.client.CIMClient.deleteInstance(CIMClient.java:591)\n\tat sun.reflect.NativeMethodAccessorImpl.invoke0(Native Method)\n\tat sun.reflect.NativeMethodAccessorImpl.invoke(Unknown Source)\n\tat sun.reflect.DelegatingMethodAccessorImpl.invoke(Unknown Source)\n\tat java.lang.reflect.Method.invoke(Unknown Source)\n\tat org.eclipse.aperi.disk.common.util.thread.DiskMgrThread.run(DiskMgrThread.java:257)   org.eclipse.aperi.disk.common.CIM.CIMClientWrapper executeSvcCall CIMOM Registrator \n2007.01.04 13:27:07.578-08:00 ERROR org.sblim.wbem.cim.CIMException: CIM_ERR_NOT_FOUND(Remote exception at the CIMOM:CIM_ERR_NOT_FOUND: The requested object could not be found: \"CIM_IndicationFilter.CreationClassName\u003d\"CIM_IndicationFilter\",Name\u003d\"CIM_InstModification for 9.43.237.27\",SystemCreationClassName\u003d\"CIM_ComputerSystem\",SystemName\u003d\"spyder.storage.tucson.ibm.com\"\")\n\tat org.sblim.wbem.xml.XMLDefaultHandlerImpl.startElement(XMLDefaultHandlerImpl.java:1041)\n \nSteps to Reproduce:\n         Run CIMOM discovery to a CIMOM agent with DS8000 SS\n      \nActual Results:  \n         The CIMOM discovery failed.                         \n     \nExpected Results:\n         The DS8000 SS will be discovered and can be probed\n                                 \nBuild Date \u0026 Platform: \n     Aperi-20070103.085736.zip",
    "The failed DS8000 CIMOM is at version 5.2.1.78, This CIM agent is incompatible with the versions of Aperi R0.2.  Aperi code will be fixed in the future release. \n \n",
    "*** Bug 176244 has been marked as a duplicate of this bug. ***"
  ],
  "commentCreationDates": [
    "2007-01-04T23:27:29+01:00",
    "2007-01-05T22:42:07+01:00",
    "2007-04-27T01:00:23+02:00"
  ],
  "traces": [
    {
      "exceptionType": "org.sblim.wbem.cim.CIMException",
      "message": "CIM_ERR_INVALID_CLASS(Remote exception at the CIMOM:CIM_ERR_INVALID_CLASS: The specified class does not exist: \"IBMTS_ObjectManager\")",
      "elements": [
        {
          "method": "org.sblim.wbem.xml.XMLDefaultHandlerImpl.startElement",
          "source": "XMLDefaultHandlerImpl.java:1041"
        },
        {
          "method": "org.sblim.wbem.client.CIMEnumerationImpl.next",
          "source": "CIMEnumerationImpl.java:365"
        },
        {
          "method": "org.sblim.wbem.client.CIMEnumerationImpl.\u003cinit\u003e",
          "source": "CIMEnumerationImpl.java:119"
        },
        {
          "method": "org.sblim.wbem.client.CIMClientXML.getEnumeration",
          "source": "CIMClientXML.java:1590"
        },
        {
          "method": "org.sblim.wbem.client.CIMClientXML.enumerateInstances",
          "source": "CIMClientXML.java:541"
        },
        {
          "method": "org.sblim.wbem.client.CIMClient.enumerateInstances",
          "source": "CIMClient.java:908"
        },
        {
          "method": "org.sblim.wbem.client.CIMClient.enumerateInstances",
          "source": "CIMClient.java:958"
        },
        {
          "method": "sun.reflect.NativeMethodAccessorImpl.invoke0",
          "source": "Native Method"
        },
        {
          "method": "sun.reflect.NativeMethodAccessorImpl.invoke",
          "source": "Unknown Source"
        },
        {
          "method": "sun.reflect.DelegatingMethodAccessorImpl.invoke",
          "source": "Unknown Source"
        },
        {
          "method": "java.lang.reflect.Method.invoke",
          "source": "Unknown Source"
        },
        {
          "method": "org.eclipse.aperi.disk.common.util.thread.DiskMgrThread.run",
          "source": "DiskMgrThread.java:257"
        }
      ],
      "number": 0,
      "commentIndex": 0,
      "bugId": "169607",
      "date": "2007-01-04T23:27:29+01:00",
      "product": "Aperi",
      "component": "aperi.device",
      "severity": "major"
    },
    {
      "exceptionType": "org.sblim.wbem.cim.CIMException",
      "message": "CIM_ERR_NOT_FOUND(Remote exception at the CIMOM:CIM_ERR_NOT_FOUND: The requested object could not be found: \"CIM_IndicationFilter.CreationClassName\u003d\"CIM_IndicationFilter\",Name\u003d\"CIM_InstCreation for 9.43.237.27\",SystemCreationClassName\u003d\"CIM_ComputerSystem\",SystemName\u003d\"spyder.storage.tucson.ibm.com\"\")",
      "elements": [
        {
          "method": "org.sblim.wbem.xml.XMLDefaultHandlerImpl.startElement",
          "source": "XMLDefaultHandlerImpl.java:1041"
        },
        {
          "method": "org.sblim.wbem.client.CIMEnumerationImpl.next",
          "source": "CIMEnumerationImpl.java:365"
        },
        {
          "method": "org.sblim.wbem.client.CIMEnumerationImpl.\u003cinit\u003e",
          "source": "CIMEnumerationImpl.java:119"
        },
        {
          "method": "org.sblim.wbem.client.CIMClientXML.getEnumeration",
          "source": "CIMClientXML.java:1590"
        },
        {
          "method": "org.sblim.wbem.client.CIMClientXML.deleteInstance",
          "source": "CIMClientXML.java:459"
        },
        {
          "method": "org.sblim.wbem.client.CIMClient.deleteInstance",
          "source": "CIMClient.java:591"
        },
        {
          "method": "sun.reflect.NativeMethodAccessorImpl.invoke0",
          "source": "Native Method"
        },
        {
          "method": "sun.reflect.NativeMethodAccessorImpl.invoke",
          "source": "Unknown Source"
        },
        {
          "method": "sun.reflect.DelegatingMethodAccessorImpl.invoke",
          "source": "Unknown Source"
        },
        {
          "method": "java.lang.reflect.Method.invoke",
          "source": "Unknown Source"
        },
        {
          "method": "org.eclipse.aperi.disk.common.util.thread.DiskMgrThread.run",
          "source": "DiskMgrThread.java:257"
        }
      ],
      "number": 1,
      "commentIndex": 0,
      "bugId": "169607",
      "date": "2007-01-04T23:27:29+01:00",
      "product": "Aperi",
      "component": "aperi.device",
      "severity": "major"
    },
    {
      "exceptionType": "org.sblim.wbem.cim.CIMException",
      "message": "CIM_ERR_NOT_FOUND(Remote exception at the CIMOM:CIM_ERR_NOT_FOUND: The requested object could not be found: \"CIM_IndicationFilter.CreationClassName\u003d\"CIM_IndicationFilter\",Name\u003d\"CIM_InstModification for 9.43.237.27\",SystemCreationClassName\u003d\"CIM_ComputerSystem\",SystemName\u003d\"spyder.storage.tucson.ibm.com\"\")",
      "elements": [
        {
          "method": "org.sblim.wbem.xml.XMLDefaultHandlerImpl.startElement",
          "source": "XMLDefaultHandlerImpl.java:1041"
        }
      ],
      "number": 2,
      "commentIndex": 0,
      "bugId": "169607",
      "date": "2007-01-04T23:27:29+01:00",
      "product": "Aperi",
      "component": "aperi.device",
      "severity": "major"
    }
  ],
  "groupId": "169607",
  "bugId": "169607",
  "date": "2007-01-04T23:27:29+01:00",
  "product": "Aperi",
  "component": "aperi.device",
  "severity": "major"
}