{
  "comments": [
    "Description:\nException is thrown out when use ReportEngine genReport.bat to run an old report with stock chart.\n\nBuild number:\n2.2.0.v20070118-0957\nruntime package\n\nSteps to reproduce:\n1. Use ReportEngine genReport.bat to run the attached design file.\n\nExpected result:\nNo exception is thrown out and the label position is set to the new default value.\n\nActual result:\nException is thrown out and the label can not be shown.\n\nError log:\norg.eclipse.birt.chart.render.Stock renderDataPointLabel\n?x??: Exception\norg.eclipse.birt.chart.exception.ChartException: Data point label position Outsi\nde is not supported when rendering on a stock series. Allowed values are ABOVE,\nBELOW, LEFT and RIGHT.\n        at org.eclipse.birt.chart.render.Stock.renderDataPointLabel(Stock.java:7\n09)\n        at org.eclipse.birt.chart.render.Stock.renderSeries(Stock.java:435)\n        at org.eclipse.birt.chart.render.AxesRenderer.renderPlot(AxesRenderer.ja\nva:2220)\n        at org.eclipse.birt.chart.render.AxesRenderer.render(AxesRenderer.java:2\n90)\n        at org.eclipse.birt.chart.factory.Generator.render(Generator.java:1231)\n        at org.eclipse.birt.chart.reportitem.ChartReportItemPresentationImpl.onR\nowSets(ChartReportItemPresentationImpl.java:477)\n        at org.eclipse.birt.report.engine.presentation.LocalizedContentVisitor.p\nrocessExtendedContent(LocalizedContentVisitor.java:665)\n        at org.eclipse.birt.report.engine.presentation.LocalizedContentVisitor.v\nisitForeign(LocalizedContentVisitor.java:370)\n        at org.eclipse.birt.report.engine.content.impl.ForeignContent.accept(For\neignContent.java:59)\n        at org.eclipse.birt.report.engine.presentation.LocalizedContentVisitor.l\nocalize(LocalizedContentVisitor.java:100)\n        at org.eclipse.birt.report.engine.internal.executor.l18n.LocalizedReport\nItemExecutor.execute(LocalizedReportItemExecutor.java:38)\n        at org.eclipse.birt.report.engine.layout.html.HTMLBlockStackingLM.layout\nChildren(HTMLBlockStackingLM.java:63)\n        at org.eclipse.birt.report.engine.layout.html.HTMLAbstractLM.layout(HTML\nAbstractLM.java:171)\n        at org.eclipse.birt.report.engine.layout.html.HTMLInlineStackingLM.resum\neLayout(HTMLInlineStackingLM.java:94)\n        at org.eclipse.birt.report.engine.layout.html.HTMLInlineStackingLM.layou\ntChildren(HTMLInlineStackingLM.java:138)\n        at org.eclipse.birt.report.engine.layout.html.HTMLAbstractLM.layout(HTML\nAbstractLM.java:171)\n        at org.eclipse.birt.report.engine.layout.html.HTMLRowLM.layout(HTMLRowLM\n.java:33)\n        at org.eclipse.birt.report.engine.layout.html.HTMLBlockStackingLM.layout\nChildren(HTMLBlockStackingLM.java:68)\n        at org.eclipse.birt.report.engine.layout.html.HTMLTableLM.layoutChildren\n(HTMLTableLM.java:74)\n        at org.eclipse.birt.report.engine.layout.html.HTMLAbstractLM.layout(HTML\nAbstractLM.java:171)\n        at org.eclipse.birt.report.engine.layout.html.HTMLPageLM.layoutChildren(\nHTMLPageLM.java:139)\n        at org.eclipse.birt.report.engine.layout.html.HTMLPageLM.layout(HTMLPage\nLM.java:81)\n        at org.eclipse.birt.report.engine.layout.html.HTMLReportLayoutEngine.lay\nout(HTMLReportLayoutEngine.java:80)\n        at org.eclipse.birt.report.engine.api.impl.RunAndRenderTask.doRun(RunAnd\nRenderTask.java:225)\n        at org.eclipse.birt.report.engine.api.impl.RunAndRenderTask.run(RunAndRe\nnderTask.java:147)\n        at org.eclipse.birt.report.engine.api.ReportRunner.runAndRenderReport(Re\nportRunner.java:237)\n        at org.eclipse.birt.report.engine.api.ReportRunner.execute(ReportRunner.\njava:162)\n        at org.eclipse.birt.report.engine.api.ReportRunner.main(ReportRunner.jav\na:118)",
    "Created an attachment (id\u003d57070)\nreport design\n\n",
    "outside should be supported like before.",
    "The error log is caused by obsolete label position by previous model change. Chart builder does correct the compatible issue, but runtime environment didn\u0027t fix it.\nIn this fix, stock renderer will display outside/inside as default position: above, so runtime environment  can work too.",
    "Verified in build (200701230630), closed."
  ],
  "commentCreationDates": [
    "2007-01-18T09:51:07+01:00",
    "2007-01-18T10:01:30+01:00",
    "2007-01-18T17:35:19+01:00",
    "2007-01-22T07:32:22+01:00",
    "2007-01-23T12:52:07+01:00"
  ],
  "traces": [
    {
      "exceptionType": "org.eclipse.birt.chart.exception.ChartException",
      "message": "Data point label position Outsi de is not supported when rendering on a stock series. Allowed values are ABOVE, BELOW, LEFT and RIGHT.",
      "elements": [
        {
          "method": "org.eclipse.birt.chart.render.Stock.renderDataPointLabel",
          "source": "Stock.java:7 09"
        },
        {
          "method": "org.eclipse.birt.chart.render.Stock.renderSeries",
          "source": "Stock.java:435"
        },
        {
          "method": "org.eclipse.birt.chart.render.AxesRenderer.renderPlot",
          "source": "AxesRenderer.ja va:2220"
        },
        {
          "method": "org.eclipse.birt.chart.render.AxesRenderer.render",
          "source": "AxesRenderer.java:2 90"
        },
        {
          "method": "org.eclipse.birt.chart.factory.Generator.render",
          "source": "Generator.java:1231"
        },
        {
          "method": "org.eclipse.birt.chart.reportitem.ChartReportItemPresentationImpl.onRowSets",
          "source": "ChartReportItemPresentationImpl.java:477"
        },
        {
          "method": "org.eclipse.birt.report.engine.presentation.LocalizedContentVisitor.processExtendedContent",
          "source": "LocalizedContentVisitor.java:665"
        },
        {
          "method": "org.eclipse.birt.report.engine.presentation.LocalizedContentVisitor.visitForeign",
          "source": "LocalizedContentVisitor.java:370"
        },
        {
          "method": "org.eclipse.birt.report.engine.content.impl.ForeignContent.accept",
          "source": "For eignContent.java:59"
        },
        {
          "method": "org.eclipse.birt.report.engine.presentation.LocalizedContentVisitor.localize",
          "source": "LocalizedContentVisitor.java:100"
        },
        {
          "method": "org.eclipse.birt.report.engine.internal.executor.l18n.LocalizedReportItemExecutor.execute",
          "source": "LocalizedReportItemExecutor.java:38"
        },
        {
          "method": "org.eclipse.birt.report.engine.layout.html.HTMLBlockStackingLM.layoutChildren",
          "source": "HTMLBlockStackingLM.java:63"
        },
        {
          "method": "org.eclipse.birt.report.engine.layout.html.HTMLAbstractLM.layout",
          "source": "HTML AbstractLM.java:171"
        },
        {
          "method": "org.eclipse.birt.report.engine.layout.html.HTMLInlineStackingLM.resumeLayout",
          "source": "HTMLInlineStackingLM.java:94"
        },
        {
          "method": "org.eclipse.birt.report.engine.layout.html.HTMLInlineStackingLM.layoutChildren",
          "source": "HTMLInlineStackingLM.java:138"
        },
        {
          "method": "org.eclipse.birt.report.engine.layout.html.HTMLAbstractLM.layout",
          "source": "HTML AbstractLM.java:171"
        },
        {
          "method": "org.eclipse.birt.report.engine.layout.html.HTMLRowLM.layout",
          "source": "HTMLRowLM .java:33"
        },
        {
          "method": "org.eclipse.birt.report.engine.layout.html.HTMLBlockStackingLM.layoutChildren",
          "source": "HTMLBlockStackingLM.java:68"
        },
        {
          "method": "org.eclipse.birt.report.engine.layout.html.HTMLTableLM.layoutChildren",
          "source": "HTMLTableLM.java:74"
        },
        {
          "method": "org.eclipse.birt.report.engine.layout.html.HTMLAbstractLM.layout",
          "source": "HTML AbstractLM.java:171"
        },
        {
          "method": "org.eclipse.birt.report.engine.layout.html.HTMLPageLM.layoutChildren",
          "source": " HTMLPageLM.java:139"
        },
        {
          "method": "org.eclipse.birt.report.engine.layout.html.HTMLPageLM.layout",
          "source": "HTMLPage LM.java:81"
        },
        {
          "method": "org.eclipse.birt.report.engine.layout.html.HTMLReportLayoutEngine.layout",
          "source": "HTMLReportLayoutEngine.java:80"
        },
        {
          "method": "org.eclipse.birt.report.engine.api.impl.RunAndRenderTask.doRun",
          "source": "RunAnd RenderTask.java:225"
        },
        {
          "method": "org.eclipse.birt.report.engine.api.impl.RunAndRenderTask.run",
          "source": "RunAndRe nderTask.java:147"
        },
        {
          "method": "org.eclipse.birt.report.engine.api.ReportRunner.runAndRenderReport",
          "source": "Re portRunner.java:237"
        },
        {
          "method": "org.eclipse.birt.report.engine.api.ReportRunner.execute",
          "source": "ReportRunner. java:162"
        },
        {
          "method": "org.eclipse.birt.report.engine.api.ReportRunner.main",
          "source": "ReportRunner.jav a:118"
        }
      ],
      "number": 0,
      "commentIndex": 0,
      "bugId": "170880",
      "date": "2007-01-18T09:51:07+01:00",
      "product": "BIRT",
      "component": "Chart",
      "severity": "normal"
    }
  ],
  "groupId": "170880",
  "bugId": "170880",
  "date": "2007-01-18T09:51:07+01:00",
  "product": "BIRT",
  "component": "Chart",
  "severity": "normal"
}