{
  "comments": [
    "Hello,\n\nI am referring to the book \"Integrating and Extending BIRT\", page 189 to write a simple standalone Java application to call the BIRT engine.  Here is the code:\n\n        IReportRunnable report \u003d null;\n        ReportEngine engine \u003d null;\n\n        try {\n            EngineConfig config \u003d new EngineConfig();\n            config.setEngineHome(\"C:/Program Files/birt-runtime-2_1_1/ReportEngine\");\n            PlatformFileContext fileContext \u003d new PlatformFileContext();\n            config.setPlatformContext(fileContext);\n            HTMLCompleteImageHandler imageHandler \u003d new HTMLCompleteImageHandler();\n            HTMLEmitterConfig htmlEmitterConfig \u003d new HTMLEmitterConfig();\n            htmlEmitterConfig.setImageHandler(imageHandler);\n            config.setEmitterConfiguration(RenderOptionBase.OUTPUT_FORMAT_HTML, htmlEmitterConfig);\n            engine \u003d new ReportEngine(config);\n        }\n        catch(Throwable err) {\n            System.err.println(err);\n        }\n\nWhen I try to create a new ReportEngine object (last statement), the following exception is thrown:\n\norg.eclipse.birt.core.exception.BirtException: $NO-RB$ Cant startup the OSGI framework\n\tat org.eclipse.birt.core.framework.Platform.startup(Platform.java:90)\n\tat org.eclipse.birt.core.framework.Platform.initialize(Platform.java:116)\n\tat org.eclipse.birt.report.engine.api.ReportEngine.\u003cinit\u003e(ReportEngine.java:49)\n\tat com.packeteer.pljava.test.BirtReportGenerator.initialize(BirtReportGenerator.java:38)\n\tat com.packeteer.pljava.test.BirtReportGenerator.\u003cinit\u003e(BirtReportGenerator.java:22)\n\tat com.packeteer.pljava.test.BirtReportGenerator.main(BirtReportGenerator.java:47)\nCaused by: org.eclipse.birt.core.exception.BirtException: $NO-RB$ Could not find the Framework - [Ljava.lang.Object;@183f74d\n\tat org.eclipse.birt.core.framework.osgi.OSGILauncher.startup(OSGILauncher.java:88)\n\tat org.eclipse.birt.core.framework.Platform.startup(Platform.java:78)\n\t... 5 more\nCan\u0027t load the report engine\n\nAny ideas to the source of the problem?  I am using version 2.1.1.  Thanks.\n\nCheers,\n\nFred",
    "As it turns out for BIRT version 2.1.1, one should use\n\nIReportEngineFactory factory \u003d\n    (IReportEngineFactory) Platform.createFactoryObject(\n    IReportEngineFactory.EXTENSION_REPORT_ENGINE_FACTORY);\nengine \u003d factory.createReportEngine(config);\n\nto create an object of IReportEngine.  Do not use \"new ReportEngine(config)\" as this is apparently outdated and the source of the problem.\n"
  ],
  "commentCreationDates": [
    "2007-02-28T01:10:46+01:00",
    "2007-02-28T19:59:30+01:00"
  ],
  "traces": [
    {
      "exceptionType": "org.eclipse.birt.core.exception.BirtException",
      "message": "$NO-RB$ Cant startup the OSGI framework",
      "elements": [
        {
          "method": "org.eclipse.birt.core.framework.Platform.startup",
          "source": "Platform.java:90"
        },
        {
          "method": "org.eclipse.birt.core.framework.Platform.initialize",
          "source": "Platform.java:116"
        },
        {
          "method": "org.eclipse.birt.report.engine.api.ReportEngine.\u003cinit\u003e",
          "source": "ReportEngine.java:49"
        },
        {
          "method": "com.packeteer.pljava.test.BirtReportGenerator.initialize",
          "source": "BirtReportGenerator.java:38"
        },
        {
          "method": "com.packeteer.pljava.test.BirtReportGenerator.\u003cinit\u003e",
          "source": "BirtReportGenerator.java:22"
        },
        {
          "method": "com.packeteer.pljava.test.BirtReportGenerator.main",
          "source": "BirtReportGenerator.java:47"
        }
      ],
      "causedBy": {
        "exceptionType": "org.eclipse.birt.core.exception.BirtException",
        "message": "$NO-RB$ Could not find the Framework - [Ljava.lang.Object;@183f74d",
        "elements": [
          {
            "method": "org.eclipse.birt.core.framework.osgi.OSGILauncher.startup",
            "source": "OSGILauncher.java:88"
          },
          {
            "method": "org.eclipse.birt.core.framework.Platform.startup",
            "source": "Platform.java:78"
          }
        ],
        "number": 0,
        "commentIndex": 0
      },
      "number": 0,
      "commentIndex": 0,
      "bugId": "175770",
      "date": "2007-02-28T01:10:46+01:00",
      "product": "BIRT",
      "component": "Report Engine",
      "severity": "major"
    }
  ],
  "groupId": "175770",
  "bugId": "175770",
  "date": "2007-02-28T01:10:46+01:00",
  "product": "BIRT",
  "component": "Report Engine",
  "severity": "major"
}