{
  "comments": [
    "The Map view gets an exception (below) when one is trying to change the aspect/property value.   I am not sure of the\nexact sequence of key strokes because it is when I am trying to find  the right place to do it and the window is not\nquite big enough.  ( Which is another problem )\n\n\njava.lang.ArrayIndexOutOfBoundsException: -1\n\tat org.eclipse.emf.common.util.BasicEList.get(BasicEList.java:514)\n\tat org.eclipse.ohf.stem.ui.views.map.InternalMapView$2.widgetSelected(InternalMapView.java:299)\n\tat org.eclipse.swt.widgets.TypedListener.handleEvent(TypedListener.java:90)\n\tat org.eclipse.swt.widgets.EventTable.sendEvent(EventTable.java:66)",
    "the Map view has been re-written so this bug is no longer current.",
    "closed"
  ],
  "commentCreationDates": [
    "2007-02-28T22:43:55+01:00",
    "2007-03-14T20:51:04+01:00",
    "2007-03-15T17:12:54+01:00"
  ],
  "traces": [
    {
      "exceptionType": "java.lang.ArrayIndexOutOfBoundsException",
      "message": "-1",
      "elements": [
        {
          "method": "org.eclipse.emf.common.util.BasicEList.get",
          "source": "BasicEList.java:514"
        },
        {
          "method": "org.eclipse.ohf.stem.ui.views.map.InternalMapView$2.widgetSelected",
          "source": "InternalMapView.java:299"
        },
        {
          "method": "org.eclipse.swt.widgets.TypedListener.handleEvent",
          "source": "TypedListener.java:90"
        },
        {
          "method": "org.eclipse.swt.widgets.EventTable.sendEvent",
          "source": "EventTable.java:66"
        }
      ],
      "number": 0,
      "commentIndex": 0,
      "bugId": "175930",
      "date": "2007-02-28T22:43:55+01:00",
      "product": "OHF",
      "component": "STEM",
      "severity": "normal"
    }
  ],
  "groupId": "175930",
  "bugId": "175930",
  "date": "2007-02-28T22:43:55+01:00",
  "product": "OHF",
  "component": "STEM",
  "severity": "normal"
}