{
  "comments": [
    "Whenever I\u0027m running a debug session I get a popup stating an Internal Error occurred and the message states \"Model Proxy Insalled notification job\".  If I have no breakpoints set and the application does not have any errors, it will run to completion.  However, when I set a breakpoint and it is hit, the application stalls, the breakpoint is not accessible (step, continue and other debug functions are disabled as if the breakpoint was not reached).  \n\nThe message from log file is \n!ENTRY org.eclipse.core.jobs 4 2 2007-03-05 11:55:36.275\n!MESSAGE An internal error occurred during: \"Model Proxy installed notification job\".\n!STACK 0\njava.lang.NoClassDefFoundError: org/eclipse/debug/internal/ui/viewers/update/StackFrameEventHandler\n\tat org.eclipse.jdt.internal.debug.ui.threadgroups.JavaDebugTargetProxy.createEventHandlers(JavaDebugTargetProxy.java:38)\n\tat org.eclipse.debug.internal.ui.viewers.update.EventHandlerModelProxy.init(EventHandlerModelProxy.java:109)\n\tat org.eclipse.debug.internal.ui.viewers.AsynchronousModel$1.run(AsynchronousModel.java:191)\n\tat org.eclipse.core.internal.jobs.Worker.run(Worker.java:58)",
    "Please try a clean installation. This class was added in 3.2.1. Works for me."
  ],
  "commentCreationDates": [
    "2007-03-05T17:33:16+01:00",
    "2007-03-12T20:18:45+01:00"
  ],
  "traces": [
    {
      "exceptionType": "java.lang.NoClassDefFoundError",
      "message": "org/eclipse/debug/internal/ui/viewers/update/StackFrameEventHandler",
      "elements": [
        {
          "method": "org.eclipse.jdt.internal.debug.ui.threadgroups.JavaDebugTargetProxy.createEventHandlers",
          "source": "JavaDebugTargetProxy.java:38"
        },
        {
          "method": "org.eclipse.debug.internal.ui.viewers.update.EventHandlerModelProxy.init",
          "source": "EventHandlerModelProxy.java:109"
        },
        {
          "method": "org.eclipse.debug.internal.ui.viewers.AsynchronousModel$1.run",
          "source": "AsynchronousModel.java:191"
        },
        {
          "method": "org.eclipse.core.internal.jobs.Worker.run",
          "source": "Worker.java:58"
        }
      ],
      "number": 0,
      "commentIndex": 0,
      "bugId": "176394",
      "date": "2007-03-05T17:33:16+01:00",
      "product": "JDT",
      "component": "Debug",
      "severity": "normal"
    }
  ],
  "groupId": "176394",
  "bugId": "176394",
  "date": "2007-03-05T17:33:16+01:00",
  "product": "JDT",
  "component": "Debug",
  "severity": "normal"
}