{
  "comments": [
    "The device server console received the following DB2 Sql errors when Aperi brought  up Inband Fabric agent at build Aperi-20070311-190942.zip, it seems the build had regressed the fix of 174837.\n\nDELETE FROM T_VIEW_HOST2PORT WHERE HOST_ID \u003d ?\nINSERT INTO T_VIEW_HOST2PORT SELECT PORT_ID, HOST_ID, HOST_URL FROM T_VIEW_HOST2\nPORT_TEMP2 WHERE HOST_ID \u003d ?\nINSERT INTO T_VIEW_HOST2PORT SELECT PORT_ID, HOST_ID, HOST_URL FROM T_VIEW_HOST2\nPORT_TEMP1 WHERE (PORT_ID NOT IN (SELECT PORT_ID FROM T_VIEW_HOST2PORT_TEMP2)) A\nND HOST_ID \u003d ?\ncom.ibm.db2.jcc.a.SqlException: DB2 SQL error: SQLCODE: -805, SQLSTATE: 51002, S\nQLERRMC: NULLID.SYSLH203 0X5359534C564C3031\n        at com.ibm.db2.jcc.a.rf.e(rf.java:1680)\n        at com.ibm.db2.jcc.b.jb.p(jb.java:626)\n        at com.ibm.db2.jcc.b.jb.h(jb.java:142)\n        at com.ibm.db2.jcc.b.jb.a(jb.java:43)\n        at com.ibm.db2.jcc.b.w.a(w.java:30)\n        at com.ibm.db2.jcc.b.cc.g(cc.java:160)\n        at com.ibm.db2.jcc.a.rf.n(rf.java:1219)\n        at com.ibm.db2.jcc.a.sf.gb(sf.java:1790)\n        at com.ibm.db2.jcc.a.sf.d(sf.java:2266)\n        at com.ibm.db2.jcc.a.sf.Y(sf.java:540)\n        at com.ibm.db2.jcc.a.sf.executeUpdate(sf.java:523)\n        at org.eclipse.aperi.infrastructure.database.DBPreparedStatement.execute\nUpdate(DBPreparedStatement.java:250)\n        at org.eclipse.aperi.common.dbaccess.ViewReportTablesUpdater.handleUpdat\ne(ViewReportTablesUpdater.java:1677)\n        at org.eclipse.aperi.common.dbaccess.ViewReportTablesUpdater.updateHostT\nables(ViewReportTablesUpdater.java:1407)\n        at org.eclipse.aperi.common.dbaccess.ViewReportTablesUpdater.updateOther\nTables(ViewReportTablesUpdater.java:1317)\n        at org.eclipse.aperi.common.dbaccess.ViewReportTablesUpdater.updateViewT\nables(ViewReportTablesUpdater.java:1135)\n        at org.eclipse.aperi.common.dbaccess.ViewReportTablesUpdater.processView\n(ViewReportTablesUpdater.java:1039)\n        at org.eclipse.aperi.infrastructure.history.detectability.ChangeDetectio\nn.startNew(ChangeDetection.java:857)\n        at org.eclipse.aperi.discovery.parser.Processor.end(Processor.java:273)\n        at org.eclipse.aperi.discovery.parser.TSANMLegacyParser$Worker.parse(TSA\nNMLegacyParser.java:333)\n        at org.eclipse.aperi.discovery.parser.Parser.processJob(Parser.java:17)\n        at org.eclipse.aperi.discovery.parser.TSANMLegacyParser.run(TSANMLegacyP\narser.java:131)\nDELETE FROM T_VIEW_HOST2PORT WHERE HOST_ID \u003d ?\nINSERT INTO T_VIEW_HOST2PORT SELECT PORT_ID, HOST_ID, HOST_URL FROM T_VIEW_HOST2\nPORT_TEMP2 WHERE HOST_ID \u003d ?\nINSERT INTO T_VIEW_HOST2PORT SELECT PORT_ID, HOST_ID, HOST_URL FROM T_VIEW_HOST2\nPORT_TEMP1 WHERE (PORT_ID NOT IN (SELECT PORT_ID FROM T_VIEW_HOST2PORT_TEMP2)) A\nND HOST_ID \u003d ?\ncom.ibm.db2.jcc.a.SqlException: DB2 SQL error: SQLCODE: -805, SQLSTATE: 51002, S\nQLERRMC: NULLID.SYSLH203 0X5359534C564C3031\n        at com.ibm.db2.jcc.a.rf.e(rf.java:1680)\n        at com.ibm.db2.jcc.b.jb.p(jb.java:626)\n        at com.ibm.db2.jcc.b.jb.h(jb.java:142)\n        at com.ibm.db2.jcc.b.jb.a(jb.java:43)\n        at com.ibm.db2.jcc.b.w.a(w.java:30)\n        at com.ibm.db2.jcc.b.cc.g(cc.java:160)\n        at com.ibm.db2.jcc.a.rf.n(rf.java:1219)\n        at com.ibm.db2.jcc.a.sf.gb(sf.java:1790)\n        at com.ibm.db2.jcc.a.sf.d(sf.java:2266)\n        at com.ibm.db2.jcc.a.sf.Y(sf.java:540)\n        at com.ibm.db2.jcc.a.sf.executeUpdate(sf.java:523)\n        at org.eclipse.aperi.infrastructure.database.DBPreparedStatement.execute\nUpdate(DBPreparedStatement.java:250)\n        at org.eclipse.aperi.common.dbaccess.ViewReportTablesUpdater.handleUpdat\ne(ViewReportTablesUpdater.java:1677)\n        at org.eclipse.aperi.common.dbaccess.ViewReportTablesUpdater.updateHostT\nables(ViewReportTablesUpdater.java:1407)\n        at org.eclipse.aperi.common.dbaccess.ViewReportTablesUpdater.updateOther\nTables(ViewReportTablesUpdater.java:1317)\n        at org.eclipse.aperi.common.dbaccess.ViewReportTablesUpdater.updateViewT\nables(ViewReportTablesUpdater.java:1135)\n        at org.eclipse.aperi.common.dbaccess.ViewReportTablesUpdater.processView\n(ViewReportTablesUpdater.java:1039)\n        at org.eclipse.aperi.infrastructure.history.detectability.ChangeDetectio\nn.complete(ChangeDetection.java:1585)\n        at org.eclipse.aperi.discovery.parser.Processor.end(Processor.java:277)\n        at org.eclipse.aperi.discovery.parser.TSANMLegacyParser$Worker.parse(TSA\nNMLegacyParser.java:333)\n        at org.eclipse.aperi.discovery.parser.Parser.processJob(Parser.java:17)\n        at org.eclipse.aperi.discovery.parser.TSANMLegacyParser.run(TSANMLegacyP\narser.java:131)",
    "\n\n*** This bug has been marked as a duplicate of bug 172220 ***",
    "Reopen the defect 177038, the error still exists in the latest nightly build of Aperi-20070329-191750.zip ",
    "The problem had been fixed by configuring Aperi db during db create time. Tested on Aperi-20070417-192015.zip build"
  ],
  "commentCreationDates": [
    "2007-03-12T18:51:41+01:00",
    "2007-03-23T21:39:00+01:00",
    "2007-03-30T19:28:22+02:00",
    "2007-04-20T22:53:52+02:00"
  ],
  "traces": [
    {
      "exceptionType": "com.ibm.db2.jcc.a.SqlException",
      "message": "DB2 SQL error: SQLCODE: -805, SQLSTATE: 51002, S QLERRMC: NULLID.SYSLH203 0X5359534C564C3031",
      "elements": [
        {
          "method": "com.ibm.db2.jcc.a.rf.e",
          "source": "rf.java:1680"
        },
        {
          "method": "com.ibm.db2.jcc.b.jb.p",
          "source": "jb.java:626"
        },
        {
          "method": "com.ibm.db2.jcc.b.jb.h",
          "source": "jb.java:142"
        },
        {
          "method": "com.ibm.db2.jcc.b.jb.a",
          "source": "jb.java:43"
        },
        {
          "method": "com.ibm.db2.jcc.b.w.a",
          "source": "w.java:30"
        },
        {
          "method": "com.ibm.db2.jcc.b.cc.g",
          "source": "cc.java:160"
        },
        {
          "method": "com.ibm.db2.jcc.a.rf.n",
          "source": "rf.java:1219"
        },
        {
          "method": "com.ibm.db2.jcc.a.sf.gb",
          "source": "sf.java:1790"
        },
        {
          "method": "com.ibm.db2.jcc.a.sf.d",
          "source": "sf.java:2266"
        },
        {
          "method": "com.ibm.db2.jcc.a.sf.Y",
          "source": "sf.java:540"
        },
        {
          "method": "com.ibm.db2.jcc.a.sf.executeUpdate",
          "source": "sf.java:523"
        },
        {
          "method": "org.eclipse.aperi.infrastructure.database.DBPreparedStatement.executeUpdate",
          "source": "DBPreparedStatement.java:250"
        },
        {
          "method": "org.eclipse.aperi.common.dbaccess.ViewReportTablesUpdater.handleUpdate",
          "source": "ViewReportTablesUpdater.java:1677"
        },
        {
          "method": "org.eclipse.aperi.common.dbaccess.ViewReportTablesUpdater.updateHostTables",
          "source": "ViewReportTablesUpdater.java:1407"
        },
        {
          "method": "org.eclipse.aperi.common.dbaccess.ViewReportTablesUpdater.updateOtherTables",
          "source": "ViewReportTablesUpdater.java:1317"
        },
        {
          "method": "org.eclipse.aperi.common.dbaccess.ViewReportTablesUpdater.updateViewTables",
          "source": "ViewReportTablesUpdater.java:1135"
        },
        {
          "method": "org.eclipse.aperi.common.dbaccess.ViewReportTablesUpdater.processView",
          "source": "ViewReportTablesUpdater.java:1039"
        },
        {
          "method": "org.eclipse.aperi.infrastructure.history.detectability.ChangeDetection.startNew",
          "source": "ChangeDetection.java:857"
        },
        {
          "method": "org.eclipse.aperi.discovery.parser.Processor.end",
          "source": "Processor.java:273"
        },
        {
          "method": "org.eclipse.aperi.discovery.parser.TSANMLegacyParser$Worker.parse",
          "source": "TSA NMLegacyParser.java:333"
        },
        {
          "method": "org.eclipse.aperi.discovery.parser.Parser.processJob",
          "source": "Parser.java:17"
        },
        {
          "method": "org.eclipse.aperi.discovery.parser.TSANMLegacyParser.run",
          "source": "TSANMLegacyP arser.java:131"
        }
      ],
      "number": 0,
      "commentIndex": 0,
      "bugId": "177038",
      "date": "2007-03-12T18:51:41+01:00",
      "product": "Aperi",
      "component": "aperi.db",
      "severity": "major"
    },
    {
      "exceptionType": "com.ibm.db2.jcc.a.SqlException",
      "message": "DB2 SQL error: SQLCODE: -805, SQLSTATE: 51002, S QLERRMC: NULLID.SYSLH203 0X5359534C564C3031",
      "elements": [
        {
          "method": "com.ibm.db2.jcc.a.rf.e",
          "source": "rf.java:1680"
        },
        {
          "method": "com.ibm.db2.jcc.b.jb.p",
          "source": "jb.java:626"
        },
        {
          "method": "com.ibm.db2.jcc.b.jb.h",
          "source": "jb.java:142"
        },
        {
          "method": "com.ibm.db2.jcc.b.jb.a",
          "source": "jb.java:43"
        },
        {
          "method": "com.ibm.db2.jcc.b.w.a",
          "source": "w.java:30"
        },
        {
          "method": "com.ibm.db2.jcc.b.cc.g",
          "source": "cc.java:160"
        },
        {
          "method": "com.ibm.db2.jcc.a.rf.n",
          "source": "rf.java:1219"
        },
        {
          "method": "com.ibm.db2.jcc.a.sf.gb",
          "source": "sf.java:1790"
        },
        {
          "method": "com.ibm.db2.jcc.a.sf.d",
          "source": "sf.java:2266"
        },
        {
          "method": "com.ibm.db2.jcc.a.sf.Y",
          "source": "sf.java:540"
        },
        {
          "method": "com.ibm.db2.jcc.a.sf.executeUpdate",
          "source": "sf.java:523"
        },
        {
          "method": "org.eclipse.aperi.infrastructure.database.DBPreparedStatement.executeUpdate",
          "source": "DBPreparedStatement.java:250"
        },
        {
          "method": "org.eclipse.aperi.common.dbaccess.ViewReportTablesUpdater.handleUpdate",
          "source": "ViewReportTablesUpdater.java:1677"
        },
        {
          "method": "org.eclipse.aperi.common.dbaccess.ViewReportTablesUpdater.updateHostTables",
          "source": "ViewReportTablesUpdater.java:1407"
        },
        {
          "method": "org.eclipse.aperi.common.dbaccess.ViewReportTablesUpdater.updateOtherTables",
          "source": "ViewReportTablesUpdater.java:1317"
        },
        {
          "method": "org.eclipse.aperi.common.dbaccess.ViewReportTablesUpdater.updateViewTables",
          "source": "ViewReportTablesUpdater.java:1135"
        },
        {
          "method": "org.eclipse.aperi.common.dbaccess.ViewReportTablesUpdater.processView",
          "source": "ViewReportTablesUpdater.java:1039"
        },
        {
          "method": "org.eclipse.aperi.infrastructure.history.detectability.ChangeDetection.complete",
          "source": "ChangeDetection.java:1585"
        },
        {
          "method": "org.eclipse.aperi.discovery.parser.Processor.end",
          "source": "Processor.java:277"
        },
        {
          "method": "org.eclipse.aperi.discovery.parser.TSANMLegacyParser$Worker.parse",
          "source": "TSA NMLegacyParser.java:333"
        },
        {
          "method": "org.eclipse.aperi.discovery.parser.Parser.processJob",
          "source": "Parser.java:17"
        },
        {
          "method": "org.eclipse.aperi.discovery.parser.TSANMLegacyParser.run",
          "source": "TSANMLegacyP arser.java:131"
        }
      ],
      "number": 1,
      "commentIndex": 0,
      "bugId": "177038",
      "date": "2007-03-12T18:51:41+01:00",
      "product": "Aperi",
      "component": "aperi.db",
      "severity": "major"
    }
  ],
  "groupId": "177038",
  "bugId": "177038",
  "date": "2007-03-12T18:51:41+01:00",
  "product": "Aperi",
  "component": "aperi.db",
  "severity": "major"
}