{
  "comments": [
    "Build F1 (20020521)\nRedhat 7.2, GTK2, KDE 2.2-10\n\n(GTK only)\n\nSee the SWT example ControlExample under the \"Sash\" tab.\nIf you click on the sash and drag the mouse then release, it doesn\u0027t do anything\nexcept draw another sash (well, a gray bar) where you released. But then if you\nclick on that new sash then it resizes and refreshes everything properly.\n\nI couldn\u0027t find any sashes in eclipse to confirm this so it\u0027s possible that the\nproblem is the example itself.",
    "I just noticed something else about sashes.. in this same example, if I double\nclick on the sash I get a ClassCastException.\n\nThe following gets printed to standard output:\nUnhandled exception caught in event loop.\nReason:\norg.eclipse.swt.examples.controlexample.SashTab$2\n\nHere is my .log file:\n!SESSION May 24, 2002 15:50:16.51 ----------------------------------------------\njava.fullversion\u003dJ2RE 1.3.1 IBM build cxia32131-20020410 (JIT enabled: jitc)\nBootLoader constants: OS\u003dlinux, ARCH\u003dx86, WS\u003dgtk, NL\u003den_US\nCommand-line arguments: -os linux -ws gtk -arch x86 -feature\norg.eclipse.platform -install\nfile:/bluebird/teamswt/cdentrem/eclipse0521gtk/eclipse/\n!ENTRY org.eclipse.core.resources 1 4 May 24, 2002 15:50:16.53\n!MESSAGE Reference action not found: additions\n!ENTRY org.eclipse.core.resources 1 4 May 24, 2002 15:50:55.147\n!MESSAGE Unhandled exception caught in event loop.\n!ENTRY org.eclipse.ui 4 0 May 24, 2002 15:50:55.151\n!MESSAGE org.eclipse.swt.examples.controlexample.SashTab$2\n!STACK 0\njava.lang.ClassCastException: org.eclipse.swt.examples.controlexample.SashTab$2\n        at\norg.eclipse.swt.widgets.TypedListener.handleEvent(TypedListener.java:132)\n        at org.eclipse.swt.widgets.EventTable.sendEvent(EventTable.java(Compiled\nCode))\n        at\norg.eclipse.swt.widgets.Display.runDeferredEvents(Display.java(Compiled Code))\n        at\norg.eclipse.swt.widgets.Display.runDeferredEvents(Display.java(Compiled Code))\n        at org.eclipse.swt.widgets.Display.readAndDispatch(Display.java(Compiled\nCode))\n        at\norg.eclipse.ui.internal.Workbench.runEventLoop(Workbench.java(Compiled Code))\n        at org.eclipse.ui.internal.Workbench.run(Workbench.java:1068)\n        at\norg.eclipse.core.internal.boot.InternalBootLoader.run(InternalBootLoader.java:739)\n        at org.eclipse.core.boot.BootLoader.run(BootLoader.java:462)\n        at java.lang.reflect.Method.invoke(Native Method)\n        at org.eclipse.core.launcher.Main.basicRun(Main.java:200)\n        at org.eclipse.core.launcher.Main.run(Main.java:643)\n        at org.eclipse.core.launcher.Main.main(Main.java:476)",
    "Focus issue?",
    "We are forcing size allocation when the control is only moved.",
    "Both bugs are fixed \u003e20020521."
  ],
  "commentCreationDates": [
    "2002-05-24T21:23:08+02:00",
    "2002-05-24T21:44:09+02:00",
    "2002-05-24T22:05:25+02:00",
    "2002-05-27T21:36:53+02:00",
    "2002-05-27T23:00:29+02:00"
  ],
  "traces": [
    {
      "exceptionType": "java.lang.ClassCastException",
      "message": "org.eclipse.swt.examples.controlexample.SashTab$2",
      "elements": [
        {
          "method": "org.eclipse.swt.widgets.TypedListener.handleEvent",
          "source": "TypedListener.java:132"
        },
        {
          "method": "org.eclipse.swt.widgets.EventTable.sendEvent",
          "source": "EventTable.java(Compiled Code)"
        },
        {
          "method": "org.eclipse.swt.widgets.Display.runDeferredEvents",
          "source": "Display.java(Compiled Code)"
        },
        {
          "method": "org.eclipse.swt.widgets.Display.runDeferredEvents",
          "source": "Display.java(Compiled Code)"
        },
        {
          "method": "org.eclipse.swt.widgets.Display.readAndDispatch",
          "source": "Display.java(Compiled Code)"
        },
        {
          "method": "org.eclipse.ui.internal.Workbench.runEventLoop",
          "source": "Workbench.java(Compiled Code)"
        },
        {
          "method": "org.eclipse.ui.internal.Workbench.run",
          "source": "Workbench.java:1068"
        },
        {
          "method": "org.eclipse.core.internal.boot.InternalBootLoader.run",
          "source": "InternalBootLoader.java:739"
        },
        {
          "method": "org.eclipse.core.boot.BootLoader.run",
          "source": "BootLoader.java:462"
        },
        {
          "method": "java.lang.reflect.Method.invoke",
          "source": "Native Method"
        },
        {
          "method": "org.eclipse.core.launcher.Main.basicRun",
          "source": "Main.java:200"
        },
        {
          "method": "org.eclipse.core.launcher.Main.run",
          "source": "Main.java:643"
        },
        {
          "method": "org.eclipse.core.launcher.Main.main",
          "source": "Main.java:476"
        }
      ],
      "number": 0,
      "commentIndex": 1,
      "bugId": "17802",
      "date": "2002-05-24T21:44:09+02:00",
      "product": "Platform",
      "component": "SWT",
      "severity": "normal"
    }
  ],
  "groupId": "17802",
  "bugId": "17802",
  "date": "2002-05-24T21:23:08+02:00",
  "product": "Platform",
  "component": "SWT",
  "severity": "normal"
}