{
  "comments": [
    "1. Install JAVA 1.4.2\n2. Set your JAVA_HOME TO your install location of JAVA 1.4.2\n3. Install Tomcat\n4. Install ALF SSO\n5. Launch Tomcat\n6. Inspect the catalina.date.log\n7. Notice the following errors indicating ALF SSO failed to launch properly\n\nSEVERE: Error deploying web application directory ALFSSOLogin\njava.lang.UnsupportedClassVersionError: org/eclipse/alf/security/sso/server/federationserver/FedSrvServlet (Unsupported major.minor version 49.0)\n\tat java.lang.ClassLoader.defineClass0(Native Method)\n\n\n\nApr 25, 2007 11:16:59 AM org.apache.catalina.startup.HostConfig undeployApps\nWARNING: Error while removing context [/ALFSSOLogin]\njava.lang.NullPointerException\n\tat org.apache.catalina.core.ContainerBase.removeChild(ContainerBase.java:883)"
  ],
  "commentCreationDates": [
    "2007-04-25T20:28:22+02:00"
  ],
  "traces": [
    {
      "exceptionType": "java.lang.UnsupportedClassVersionError",
      "message": "org/eclipse/alf/security/sso/server/federationserver/FedSrvServlet (Unsupported major.minor version 49.0)",
      "elements": [
        {
          "method": "java.lang.ClassLoader.defineClass0",
          "source": "Native Method"
        }
      ],
      "number": 0,
      "commentIndex": 0,
      "bugId": "184082",
      "date": "2007-04-25T20:28:22+02:00",
      "product": "ALF",
      "component": "alf-sso",
      "severity": "normal"
    },
    {
      "exceptionType": "java.lang.NullPointerException",
      "elements": [
        {
          "method": "org.apache.catalina.core.ContainerBase.removeChild",
          "source": "ContainerBase.java:883"
        }
      ],
      "number": 1,
      "commentIndex": 0,
      "bugId": "184082",
      "date": "2007-04-25T20:28:22+02:00",
      "product": "ALF",
      "component": "alf-sso",
      "severity": "normal"
    }
  ],
  "groupId": "184082",
  "bugId": "184082",
  "date": "2007-04-25T20:28:22+02:00",
  "product": "ALF",
  "component": "alf-sso",
  "severity": "normal"
}