{
  "comments": [
    "Evaluating the following code, or the code from the example in bug 153122 results in an empty stack exception.\n\nint[] x \u003d new int[]{1,2,3};\n        for (int i: x) {\n                switch (i) {\n                case 1:\n                        System.out.println(\"ONE\");\n                        break;\n                default:\n                        System.err.println(\"OTHER\");\n                        break;\n                }\n        }\n\njava.util.EmptyStackException\n\tat java.util.Stack.peek(Stack.java:85)\n\tat java.util.Stack.pop(Stack.java:67)\n\tat org.eclipse.jdt.internal.debug.eval.ast.engine.Interpreter.pop(Interpreter.java:89)\n\tat org.eclipse.jdt.internal.debug.eval.ast.instructions.Instruction.popValue(Instruction.java:109)\n\tat org.eclipse.jdt.internal.debug.eval.ast.instructions.ConditionalJump.execute(ConditionalJump.java:27)\n\tat org.eclipse.jdt.internal.debug.eval.ast.engine.Interpreter.execute(Interpreter.java:50)\n\tat org.eclipse.jdt.internal.debug.eval.ast.engine.ASTEvaluationEngine$1$EvaluationRunnable.run(ASTEvaluationEngine.java:482)\n\tat org.eclipse.jdt.internal.debug.core.model.JDIThread.runEvaluation(JDIThread.java:637)\n\tat org.eclipse.jdt.internal.debug.eval.ast.engine.ASTEvaluationEngine$EvalRunnable.run(ASTEvaluationEngine.java:518)\n\tat org.eclipse.jdt.internal.debug.core.model.JDIThread$ThreadJob.run(JDIThread.java:2594)\n\tat org.eclipse.core.internal.jobs.Worker.run(Worker.java:55)",
    "Seen while testing I20071030-0010 for 3.4M3.\n\nOccurred while evaluating the following code in the new Java5Evaluations in the debug manual test project.\n\nfor(enumerationsRock stuff : enumerationsRock.values()) {\n\tswitch(stuff) {\n\tcase ONE:\n\t\tSystem.out.println(\"1\");\n\t\tbreak;\n\tcase TWO:\n\t\tSystem.out.println(\"2\");\n\t\tbreak;\n\tcase THREE:\n\t\tSystem.out.println(\"3\");\n\t\tbreak;\n\tcase FIVE_BILLION:\n\t\tSystem.out.println(\"too many\");\n\t\tbreak;\n\t}\n}"
  ],
  "commentCreationDates": [
    "2007-04-26T21:28:50+02:00",
    "2007-10-30T16:51:36+01:00"
  ],
  "traces": [
    {
      "exceptionType": "java.util.EmptyStackException",
      "elements": [
        {
          "method": "java.util.Stack.peek",
          "source": "Stack.java:85"
        },
        {
          "method": "java.util.Stack.pop",
          "source": "Stack.java:67"
        },
        {
          "method": "org.eclipse.jdt.internal.debug.eval.ast.engine.Interpreter.pop",
          "source": "Interpreter.java:89"
        },
        {
          "method": "org.eclipse.jdt.internal.debug.eval.ast.instructions.Instruction.popValue",
          "source": "Instruction.java:109"
        },
        {
          "method": "org.eclipse.jdt.internal.debug.eval.ast.instructions.ConditionalJump.execute",
          "source": "ConditionalJump.java:27"
        },
        {
          "method": "org.eclipse.jdt.internal.debug.eval.ast.engine.Interpreter.execute",
          "source": "Interpreter.java:50"
        },
        {
          "method": "org.eclipse.jdt.internal.debug.eval.ast.engine.ASTEvaluationEngine$1$EvaluationRunnable.run",
          "source": "ASTEvaluationEngine.java:482"
        },
        {
          "method": "org.eclipse.jdt.internal.debug.core.model.JDIThread.runEvaluation",
          "source": "JDIThread.java:637"
        },
        {
          "method": "org.eclipse.jdt.internal.debug.eval.ast.engine.ASTEvaluationEngine$EvalRunnable.run",
          "source": "ASTEvaluationEngine.java:518"
        },
        {
          "method": "org.eclipse.jdt.internal.debug.core.model.JDIThread$ThreadJob.run",
          "source": "JDIThread.java:2594"
        },
        {
          "method": "org.eclipse.core.internal.jobs.Worker.run",
          "source": "Worker.java:55"
        }
      ],
      "number": 0,
      "commentIndex": 0,
      "bugId": "184308",
      "date": "2007-04-26T21:28:50+02:00",
      "product": "JDT",
      "component": "Debug",
      "severity": "normal"
    }
  ],
  "groupId": "184308",
  "bugId": "184308",
  "date": "2007-04-26T21:28:50+02:00",
  "product": "JDT",
  "component": "Debug",
  "severity": "normal"
}