{
  "comments": [
    "Build ID: Aperi built from CVS HEAD May 3rd, 2007\n\nSteps To Reproduce:\n1. Build aperi.zip for Linux, from HEAD\n2. Install aperi.zip on a test machine\n3. cfgaperi fails (stack trace in more information) due to missing properties in default.properties\n\n\n\nMore information:\nrwipfel1:~/aperi/configure # ./cfgaperi\n\nChecking Java installation...passed: 1.5.0_11\n\n\n\nAperi Storage Manager Configuration\n\nThis program will ask you a series of questions, then configure Aperi\nDefault values are displayed in [square brackets].\n\n\nThe Aperi Storage Manager consists of three major components:\nThe host-based agent, the server, the GUI, and the report server.\nYou can configure any or all of these to run on this computer.\n\nWhich components do you want to configure? Answer with Yes or No.\n\nAgent []No\nServer []Yes\nGUI []Yes\n\nEnter values to configure the device server.\n\nHostname : rwipfel1\nPort  [9000]:\nPassword  [password]: cluster\n\nEnter values to configure the data server.\n\nPort  [9549]:\nPort  [9001]:\n\nEnter values to configure the report server.\n\nReport server port []: 9999\n\nReport server repository path [/root/aperi/reports]:\nDo you want to use Derby as the Aperi repository [Yes]\nEnter values to configure Derby.\n\nPort  []: 1327\nDownload third party software: No\n\nReady to configure.\n\n\nConfiguring derby...\n ../db/derby\n ../db/derbystop\n ../db/aperi-schema\n ../db/aperi-ij\n\nConfiguring the device server...\n devsvr/configuration/setup.properties\nError occurred while performing the configuration updates.\njava.lang.NullPointerException\n        at java.util.Hashtable.put(Unknown Source)\n        at org.eclipse.aperi.configure.ConfigureAperi.deviceserver(ConfigureAperi.java:1116)\n        at org.eclipse.aperi.configure.ConfigureAperi.configure(ConfigureAperi.java:276)\n        at org.eclipse.aperi.configure.ConfigureAperi.configureAperi(ConfigureAperi.java:145)\n        at org.eclipse.aperi.configure.ConfigureAperi.main(ConfigureAperi.java:122)\n\n\n\nhad to add\n\ndbUsername\u003dAperi\ndbPassword\u003daperi\ndbPort\u003d1527\n\nto aperi/configure/default.properties\n\ndeviceServerPort \u003d 9000\nagentPort \u003d 9570\nrdbms \u003d derby\nderbyUsername \u003d Aperi\nderbyPassword \u003d aperi\ndbUsername\u003dAperi\ndbPassword\u003daperi\ndbPort\u003d1527\nderbyPort \u003d 1527\ndb2Username \u003d db2admin\ndb2Port \u003d 50000\n#db2Password \u003d # usually leave this blank so user has to type it in\ndataServerPort \u003d 9549\ndataServerHTTPPort \u003d 9001\nauthPassword \u003d password\njvmHeapSizeFlag \u003d -Xmx\nguiHeapSize \u003d 512m\nderbyHeapSize \u003d 1024m\ndataServerHeapSize \u003d 1024m\ndeviceServerHeapSize \u003d 1024m\ndataAgentHeapSize \u003d 128m\n# serverHostname \u003d # usually leave this blank to let the configurator choose",
    "This has been fixed"
  ],
  "commentCreationDates": [
    "2007-05-04T03:45:34+02:00",
    "2007-05-09T19:18:38+02:00"
  ],
  "traces": [
    {
      "exceptionType": "java.lang.NullPointerException",
      "elements": [
        {
          "method": "java.util.Hashtable.put",
          "source": "Unknown Source"
        },
        {
          "method": "org.eclipse.aperi.configure.ConfigureAperi.deviceserver",
          "source": "ConfigureAperi.java:1116"
        },
        {
          "method": "org.eclipse.aperi.configure.ConfigureAperi.configure",
          "source": "ConfigureAperi.java:276"
        },
        {
          "method": "org.eclipse.aperi.configure.ConfigureAperi.configureAperi",
          "source": "ConfigureAperi.java:145"
        },
        {
          "method": "org.eclipse.aperi.configure.ConfigureAperi.main",
          "source": "ConfigureAperi.java:122"
        }
      ],
      "number": 0,
      "commentIndex": 0,
      "bugId": "185478",
      "date": "2007-05-04T03:45:34+02:00",
      "product": "Aperi",
      "component": "Aperi",
      "severity": "normal"
    }
  ],
  "groupId": "185478",
  "bugId": "185478",
  "date": "2007-05-04T03:45:34+02:00",
  "product": "Aperi",
  "component": "Aperi",
  "severity": "normal"
}