{
  "comments": [
    "Version: 3.3.0\nBuild id: I20070323-1616\n(3.3 M6 + all but 3 europa projecs installed)\n\n- imported all europa/ eclipse plugins as bin with linked source\n- Hyerarchy view: focus on MylarMonitorPlugin\n- in the hierarchy view, right click this class --\u003e properties\n- no properties to display (ok)\n\n--\u003e exception in the MS-DOS console (I use the consolelog option)\n!ENTRY org.eclipse.core.expressions 4 201 2007-05-04 16:02:44.281\n!MESSAGE No property tester contributes a property toolEditEnabled to type class\n org.eclipse.jdt.internal.core.ResolvedBinaryType\n!STACK 1\norg.eclipse.core.runtime.CoreException: No property tester contributes a propert\ny toolEditEnabled to type class org.eclipse.jdt.internal.core.ResolvedBinaryType\n\n        at org.eclipse.core.internal.expressions.TypeExtensionManager.getPropert\ny(TypeExtensionManager.java:109)\n        at org.eclipse.core.internal.expressions.TestExpression.evaluate(TestExp\nression.java:95)\n        at org.eclipse.core.internal.expressions.CompositeExpression.evaluateAnd\n(CompositeExpression.java:53)\n        at org.eclipse.core.internal.expressions.AndExpression.evaluate(AndExpre\nssion.java:29)\n        at org.eclipse.ui.internal.dialogs.RegistryPageContributor.failsEnableme\nnt(RegistryPageContributor.java:257)\n        at org.eclipse.ui.internal.dialogs.RegistryPageContributor.isApplicableT\no(RegistryPageContributor.java:208)\n        at org.eclipse.ui.internal.dialogs.PropertyPageContributorManager.contri\nbute(PropertyPageContributorManager.java:143)\n        at org.eclipse.ui.internal.dialogs.PropertyDialog.createDialogOn(Propert\nyDialog.java:60)\n        at org.eclipse.ui.dialogs.PropertyDialogAction.createDialog(PropertyDial\nogAction.java:175)\n        at org.eclipse.ui.dialogs.PropertyDialogAction.run(PropertyDialogAction.\njava:154)\n        at org.eclipse.jface.action.Action.runWithEvent(Action.java:498)\n        at org.eclipse.jface.action.ActionContributionItem.handleWidgetSelection\n(ActionContributionItem.java:545)\n        at org.eclipse.jface.action.ActionContributionItem.access$2(ActionContri\nbutionItem.java:490)\n        at org.eclipse.jface.action.ActionContributionItem$5.handleEvent(ActionC\nontributionItem.java:402)\n        at org.eclipse.swt.widgets.EventTable.sendEvent(EventTable.java:66)\n        at org.eclipse.swt.widgets.Widget.sendEvent(Widget.java:938)\n        at org.eclipse.swt.widgets.Display.runDeferredEvents(Display.java:3673)\n        at org.eclipse.swt.widgets.Display.readAndDispatch(Display.java:3284)\n        at org.eclipse.ui.internal.Workbench.runEventLoop(Workbench.java:2337)\n        at org.eclipse.ui.internal.Workbench.runUI(Workbench.java:2301)\n        at org.eclipse.ui.internal.Workbench.access$4(Workbench.java:2176)\n        at org.eclipse.ui.internal.Workbench$4.run(Workbench.java:463)\n        at org.eclipse.core.databinding.observable.Realm.runWithDefault(Realm.ja\nva:289)\n        at org.eclipse.ui.internal.Workbench.createAndRunWorkbench(Workbench.jav\na:458)\n        at org.eclipse.ui.PlatformUI.createAndRunWorkbench(PlatformUI.java:149)\n        at org.eclipse.ui.internal.ide.application.IDEApplication.start(IDEAppli\ncation.java:101)\n        at org.eclipse.equinox.internal.app.EclipseAppHandle.run(EclipseAppHandl\ne.java:146)\n        at org.eclipse.core.runtime.internal.adaptor.EclipseAppLauncher.runAppli\ncation(EclipseAppLauncher.java:106)\n        at org.eclipse.core.runtime.internal.adaptor.EclipseAppLauncher.start(Ec\nlipseAppLauncher.java:76)\n        at org.eclipse.core.runtime.adaptor.EclipseStarter.run(EclipseStarter.ja\nva:359)\n        at org.eclipse.core.runtime.adaptor.EclipseStarter.run(EclipseStarter.ja\nva:174)\n        at sun.reflect.NativeMethodAccessorImpl.invoke0(Native Method)\n        at sun.reflect.NativeMethodAccessorImpl.invoke(NativeMethodAccessorImpl.\njava:57)\n        at sun.reflect.DelegatingMethodAccessorImpl.invoke(DelegatingMethodAcces\nsorImpl.java:43)\n        at java.lang.reflect.Method.invoke(Method.java:624)\n        at org.eclipse.equinox.launcher.Main.invokeFramework(Main.java:497)\n        at org.eclipse.equinox.launcher.Main.basicRun(Main.java:436)\n        at org.eclipse.equinox.launcher.Main.run(Main.java:1162)\n        at org.eclipse.equinox.launcher.Main.main(Main.java:1137)\n!SUBENTRY 1 org.eclipse.core.expressions 4 201 2007-05-04 16:02:44.281\n!MESSAGE No property tester contributes a property toolEditEnabled to type class\n org.eclipse.jdt.internal.core.ResolvedBinaryType"
  ],
  "commentCreationDates": [
    "2007-05-04T16:12:55+02:00"
  ],
  "traces": [
    {
      "exceptionType": "org.eclipse.core.runtime.CoreException",
      "message": "No property tester contributes a propert y toolEditEnabled to type class org.eclipse.jdt.internal.core.ResolvedBinaryType",
      "elements": [
        {
          "method": "org.eclipse.core.internal.expressions.TypeExtensionManager.getProperty",
          "source": "TypeExtensionManager.java:109"
        },
        {
          "method": "org.eclipse.core.internal.expressions.TestExpression.evaluate",
          "source": "TestExp ression.java:95"
        },
        {
          "method": "org.eclipse.core.internal.expressions.CompositeExpression.evaluateAnd",
          "source": "CompositeExpression.java:53"
        },
        {
          "method": "org.eclipse.core.internal.expressions.AndExpression.evaluate",
          "source": "AndExpre ssion.java:29"
        },
        {
          "method": "org.eclipse.ui.internal.dialogs.RegistryPageContributor.failsEnablement",
          "source": "RegistryPageContributor.java:257"
        },
        {
          "method": "org.eclipse.ui.internal.dialogs.RegistryPageContributor.isApplicableTo",
          "source": "RegistryPageContributor.java:208"
        },
        {
          "method": "org.eclipse.ui.internal.dialogs.PropertyPageContributorManager.contribute",
          "source": "PropertyPageContributorManager.java:143"
        },
        {
          "method": "org.eclipse.ui.internal.dialogs.PropertyDialog.createDialogOn",
          "source": "Propert yDialog.java:60"
        },
        {
          "method": "org.eclipse.ui.dialogs.PropertyDialogAction.createDialog",
          "source": "PropertyDial ogAction.java:175"
        },
        {
          "method": "org.eclipse.ui.dialogs.PropertyDialogAction.run",
          "source": "PropertyDialogAction. java:154"
        },
        {
          "method": "org.eclipse.jface.action.Action.runWithEvent",
          "source": "Action.java:498"
        },
        {
          "method": "org.eclipse.jface.action.ActionContributionItem.handleWidgetSelection",
          "source": "ActionContributionItem.java:545"
        },
        {
          "method": "org.eclipse.jface.action.ActionContributionItem.access$2",
          "source": "ActionContri butionItem.java:490"
        },
        {
          "method": "org.eclipse.jface.action.ActionContributionItem$5.handleEvent",
          "source": "ActionC ontributionItem.java:402"
        },
        {
          "method": "org.eclipse.swt.widgets.EventTable.sendEvent",
          "source": "EventTable.java:66"
        },
        {
          "method": "org.eclipse.swt.widgets.Widget.sendEvent",
          "source": "Widget.java:938"
        },
        {
          "method": "org.eclipse.swt.widgets.Display.runDeferredEvents",
          "source": "Display.java:3673"
        },
        {
          "method": "org.eclipse.swt.widgets.Display.readAndDispatch",
          "source": "Display.java:3284"
        },
        {
          "method": "org.eclipse.ui.internal.Workbench.runEventLoop",
          "source": "Workbench.java:2337"
        },
        {
          "method": "org.eclipse.ui.internal.Workbench.runUI",
          "source": "Workbench.java:2301"
        },
        {
          "method": "org.eclipse.ui.internal.Workbench.access$4",
          "source": "Workbench.java:2176"
        },
        {
          "method": "org.eclipse.ui.internal.Workbench$4.run",
          "source": "Workbench.java:463"
        },
        {
          "method": "org.eclipse.core.databinding.observable.Realm.runWithDefault",
          "source": "Realm.ja va:289"
        },
        {
          "method": "org.eclipse.ui.internal.Workbench.createAndRunWorkbench",
          "source": "Workbench.jav a:458"
        },
        {
          "method": "org.eclipse.ui.PlatformUI.createAndRunWorkbench",
          "source": "PlatformUI.java:149"
        },
        {
          "method": "org.eclipse.ui.internal.ide.application.IDEApplication.start",
          "source": "IDEAppli cation.java:101"
        },
        {
          "method": "org.eclipse.equinox.internal.app.EclipseAppHandle.run",
          "source": "EclipseAppHandl e.java:146"
        },
        {
          "method": "org.eclipse.core.runtime.internal.adaptor.EclipseAppLauncher.runApplication",
          "source": "EclipseAppLauncher.java:106"
        },
        {
          "method": "org.eclipse.core.runtime.internal.adaptor.EclipseAppLauncher.start",
          "source": "Ec lipseAppLauncher.java:76"
        },
        {
          "method": "org.eclipse.core.runtime.adaptor.EclipseStarter.run",
          "source": "EclipseStarter.ja va:359"
        },
        {
          "method": "org.eclipse.core.runtime.adaptor.EclipseStarter.run",
          "source": "EclipseStarter.ja va:174"
        },
        {
          "method": "sun.reflect.NativeMethodAccessorImpl.invoke0",
          "source": "Native Method"
        },
        {
          "method": "sun.reflect.NativeMethodAccessorImpl.invoke",
          "source": "NativeMethodAccessorImpl. java:57"
        },
        {
          "method": "sun.reflect.DelegatingMethodAccessorImpl.invoke",
          "source": "DelegatingMethodAcces sorImpl.java:43"
        },
        {
          "method": "java.lang.reflect.Method.invoke",
          "source": "Method.java:624"
        },
        {
          "method": "org.eclipse.equinox.launcher.Main.invokeFramework",
          "source": "Main.java:497"
        },
        {
          "method": "org.eclipse.equinox.launcher.Main.basicRun",
          "source": "Main.java:436"
        },
        {
          "method": "org.eclipse.equinox.launcher.Main.run",
          "source": "Main.java:1162"
        },
        {
          "method": "org.eclipse.equinox.launcher.Main.main",
          "source": "Main.java:1137"
        }
      ],
      "number": 0,
      "commentIndex": 0,
      "bugId": "185547",
      "date": "2007-05-04T16:12:55+02:00",
      "product": "Platform",
      "component": "UI",
      "severity": "normal"
    }
  ],
  "groupId": "185547",
  "bugId": "185547",
  "date": "2007-05-04T16:12:55+02:00",
  "product": "Platform",
  "component": "UI",
  "severity": "normal"
}