{
  "comments": [
    "Build ID: I20070503-1400\n\nSteps To Reproduce:\n1. Inflate an Eclipse SDK into a location containing spaces (i.e. c:\\some path\\eclipse)\n2. Try to run an Ant script that does any sort of file I/O.\n3. Watch it fail.\n\n\nMore information:\nTry to run the attached build script after installing Eclipse into a path with spaces.  For my tests I used c:\\eclipse\\some path with spaces\\eclipse.  It will fail with a dialog that simply says BUILD FAILED.  If you check the error log you will find the following:\n\n!ENTRY org.eclipse.ant.core 4 1 2007-05-14 09:50:01.843\n!MESSAGE BUILD FAILED\n!STACK 0\njava.lang.IllegalArgumentException\n\tat java.net.URI.create(Unknown Source)\n\tat sun.reflect.NativeMethodAccessorImpl.invoke0(Native Method)\n\tat sun.reflect.NativeMethodAccessorImpl.invoke(Unknown Source)\n\tat sun.reflect.DelegatingMethodAccessorImpl.invoke(Unknown Source)\n\tat java.lang.reflect.Method.invoke(Unknown Source)\n\tat org.apache.tools.ant.launch.Locator.fromURI(Locator.java:162)\n\tat org.apache.tools.ant.launch.Locator.getResourceSource(Locator.java:119)\n\tat org.apache.tools.ant.launch.Locator.getClassSource(Locator.java:90)\n\tat org.apache.tools.ant.Project.setAntLib(Project.java:313)\n\tat org.apache.tools.ant.Project.initProperties(Project.java:309)\n\tat org.apache.tools.ant.Project.init(Project.java:295)\n\tat org.eclipse.ant.internal.core.ant.InternalAntRunner.run(InternalAntRunner.java:520)\n\tat org.eclipse.ant.internal.core.ant.InternalAntRunner.run(InternalAntRunner.java:456)\n\tat sun.reflect.NativeMethodAccessorImpl.invoke0(Native Method)\n\tat sun.reflect.NativeMethodAccessorImpl.invoke(Unknown Source)\n\tat sun.reflect.DelegatingMethodAccessorImpl.invoke(Unknown Source)\n\tat java.lang.reflect.Method.invoke(Unknown Source)\n\tat org.eclipse.ant.core.AntRunner.run(AntRunner.java:377)\n\tat org.eclipse.ant.internal.ui.launchConfigurations.AntLaunchDelegate$1.run(AntLaunchDelegate.java:230)\n\tat java.lang.Thread.run(Unknown Source)\nCaused by: java.net.URISyntaxException: Illegal character in path at index 21: file:/C:/eclipse/path with spaces/eclipse/plugins/org.apache.ant_1.7.0.v200704241635/lib/ant.jar\n\tat java.net.URI$Parser.fail(Unknown Source)\n\tat java.net.URI$Parser.checkChars(Unknown Source)\n\tat java.net.URI$Parser.parseHierarchical(Unknown Source)\n\tat java.net.URI$Parser.parse(Unknown Source)\n\tat java.net.URI.\u003cinit\u003e(Unknown Source)\n\t... 20 more\n\nThis appears to be a bug in Ant 1.7 as far as I can see and this is a critical one.  We install our product into c:\\Program Files and our builder is based on Ant.  I was looking forward to Ant 1.7 too!  I hope this can be fixed right away.",
    "Created an attachment (id\u003d67057)\nSampel build file\n\nA build file illustrating the failure.  Must be run in the same JRE as the workspace to pick up ${eclipse.home}.  Make sure you install Eclipse into a location with spaces in the path.  The location of your workspace should not matter.",
    "\n\n*** This bug has been marked as a duplicate of bug 183283 ***",
    "Gul durnit!  I searched for this - honest...  ",
    "No problem at all...rather dups than missed problems."
  ],
  "commentCreationDates": [
    "2007-05-14T16:14:53+02:00",
    "2007-05-14T16:16:32+02:00",
    "2007-05-14T16:18:53+02:00",
    "2007-05-14T16:21:48+02:00",
    "2007-05-14T16:24:05+02:00"
  ],
  "traces": [
    {
      "exceptionType": "java.lang.IllegalArgumentException",
      "elements": [
        {
          "method": "java.net.URI.create",
          "source": "Unknown Source"
        },
        {
          "method": "sun.reflect.NativeMethodAccessorImpl.invoke0",
          "source": "Native Method"
        },
        {
          "method": "sun.reflect.NativeMethodAccessorImpl.invoke",
          "source": "Unknown Source"
        },
        {
          "method": "sun.reflect.DelegatingMethodAccessorImpl.invoke",
          "source": "Unknown Source"
        },
        {
          "method": "java.lang.reflect.Method.invoke",
          "source": "Unknown Source"
        },
        {
          "method": "org.apache.tools.ant.launch.Locator.fromURI",
          "source": "Locator.java:162"
        },
        {
          "method": "org.apache.tools.ant.launch.Locator.getResourceSource",
          "source": "Locator.java:119"
        },
        {
          "method": "org.apache.tools.ant.launch.Locator.getClassSource",
          "source": "Locator.java:90"
        },
        {
          "method": "org.apache.tools.ant.Project.setAntLib",
          "source": "Project.java:313"
        },
        {
          "method": "org.apache.tools.ant.Project.initProperties",
          "source": "Project.java:309"
        },
        {
          "method": "org.apache.tools.ant.Project.init",
          "source": "Project.java:295"
        },
        {
          "method": "org.eclipse.ant.internal.core.ant.InternalAntRunner.run",
          "source": "InternalAntRunner.java:520"
        },
        {
          "method": "org.eclipse.ant.internal.core.ant.InternalAntRunner.run",
          "source": "InternalAntRunner.java:456"
        },
        {
          "method": "sun.reflect.NativeMethodAccessorImpl.invoke0",
          "source": "Native Method"
        },
        {
          "method": "sun.reflect.NativeMethodAccessorImpl.invoke",
          "source": "Unknown Source"
        },
        {
          "method": "sun.reflect.DelegatingMethodAccessorImpl.invoke",
          "source": "Unknown Source"
        },
        {
          "method": "java.lang.reflect.Method.invoke",
          "source": "Unknown Source"
        },
        {
          "method": "org.eclipse.ant.core.AntRunner.run",
          "source": "AntRunner.java:377"
        },
        {
          "method": "org.eclipse.ant.internal.ui.launchConfigurations.AntLaunchDelegate$1.run",
          "source": "AntLaunchDelegate.java:230"
        },
        {
          "method": "java.lang.Thread.run",
          "source": "Unknown Source"
        }
      ],
      "causedBy": {
        "exceptionType": "java.net.URISyntaxException",
        "message": "Illegal character in path at index 21: file:/C:/eclipse/path with spaces/eclipse/plugins/org.apache.ant_1.7.0.v200704241635/lib/ant.jar",
        "elements": [
          {
            "method": "java.net.URI$Parser.fail",
            "source": "Unknown Source"
          },
          {
            "method": "java.net.URI$Parser.checkChars",
            "source": "Unknown Source"
          },
          {
            "method": "java.net.URI$Parser.parseHierarchical",
            "source": "Unknown Source"
          },
          {
            "method": "java.net.URI$Parser.parse",
            "source": "Unknown Source"
          },
          {
            "method": "java.net.URI.\u003cinit\u003e",
            "source": "Unknown Source"
          }
        ],
        "number": 0,
        "commentIndex": 0
      },
      "number": 0,
      "commentIndex": 0,
      "bugId": "186793",
      "duplicateId": "183283",
      "date": "2007-05-14T16:14:53+02:00",
      "product": "Platform",
      "component": "Ant",
      "severity": "critical"
    }
  ],
  "groupId": "183283",
  "bugId": "186793",
  "duplicateId": "183283",
  "date": "2007-05-14T16:14:53+02:00",
  "product": "Platform",
  "component": "Ant",
  "severity": "critical"
}