{
  "comments": [
    "Download report engine runtime birt-runtime-2.1.3-N20070524.zip, set up BIRT_HOME, and run birt-runtime-2_1_3\\ReportEngine\\genReport.bat to run any report design. A ClassNotFoundException (stack below) is shown. This is caused by Genreport.BAT file adding this entry to the class path: %BIRT_HOME%\\ReportEngine\\lib\\com.ibm.icu_3.4.5.jar. However in the lib directory the actual lib file name is com.ibm.icu_3.6.0.20061215.jar.\n\nError stack:\nException in thread \"main\" java.lang.NoClassDefFoundError: com/ibm/icu/text/SimpleDateFormat\n        at org.eclipse.birt.report.model.metadata.DateTimePropertyType.\u003cclinit\u003e(DateTimePropertyType\n.java:62)\n        at org.eclipse.birt.report.model.metadata.MetaDataDictionary.\u003cinit\u003e(MetaDataDictionary.java:\n227)\n        at org.eclipse.birt.report.model.metadata.MetaDataDictionary.\u003cclinit\u003e(MetaDataDictionary.jav\na:107)\n        at org.eclipse.birt.report.model.api.impl.DesignEngineImpl.newSessionHandle(DesignEngineImpl\n.java:122)\n        at org.eclipse.birt.report.model.api.DesignEngine.newSessionHandle(DesignEngine.java:106)\n        at org.eclipse.birt.report.model.api.DesignEngine.newSession(DesignEngine.java:128)\n        at org.eclipse.birt.report.engine.parser.ReportParser.getDesignHandle(ReportParser.java:144)\n\n        at org.eclipse.birt.report.engine.api.impl.ReportEngineHelper.openReportDesign(ReportEngineH\nelper.java:243)\n        at org.eclipse.birt.report.engine.api.impl.ReportEngineHelper.openReportDesign(ReportEngineH\nelper.java:191)\n        at org.eclipse.birt.report.engine.api.impl.ReportEngineHelper.openReportDesign(ReportEngineH\nelper.java:125)\n        at org.eclipse.birt.report.engine.api.impl.ReportEngine.openReportDesign(ReportEngine.java:2\n25)\n        at org.eclipse.birt.report.engine.api.ReportRunner.runAndRenderReport(ReportRunner.java:188)\n\n        at org.eclipse.birt.report.engine.api.ReportRunner.execute(ReportRunner.java:161)\n        at org.eclipse.birt.report.engine.api.ReportRunner.main(ReportRunner.java:117)",
    "Fixed.\n\ngenReport.bat/sh has been updated."
  ],
  "commentCreationDates": [
    "2007-05-25T23:50:30+02:00",
    "2007-05-28T09:14:34+02:00"
  ],
  "traces": [
    {
      "exceptionType": "java.lang.NoClassDefFoundError",
      "message": "com/ibm/icu/text/SimpleDateForm",
      "elements": [
        {
          "method": "atorg.eclipse.birt.report.model.metadata.DateTimePropertyType.\u003cclinit\u003e",
          "source": "DateTimePropertyType .java:62"
        },
        {
          "method": "org.eclipse.birt.report.model.metadata.MetaDataDictionary.\u003cinit\u003e",
          "source": "MetaDataDictionary.java: 227"
        },
        {
          "method": "org.eclipse.birt.report.model.metadata.MetaDataDictionary.\u003cclinit\u003e",
          "source": "MetaDataDictionary.jav a:107"
        },
        {
          "method": "org.eclipse.birt.report.model.api.impl.DesignEngineImpl.newSessionHandle",
          "source": "DesignEngineImpl .java:122"
        },
        {
          "method": "org.eclipse.birt.report.model.api.DesignEngine.newSessionHandle",
          "source": "DesignEngine.java:106"
        },
        {
          "method": "org.eclipse.birt.report.model.api.DesignEngine.newSession",
          "source": "DesignEngine.java:128"
        },
        {
          "method": "org.eclipse.birt.report.engine.parser.ReportParser.getDesignHandle",
          "source": "ReportParser.java:144"
        },
        {
          "method": "org.eclipse.birt.report.engine.api.impl.ReportEngineHelper.openReportDesign",
          "source": "ReportEngineH elper.java:243"
        },
        {
          "method": "org.eclipse.birt.report.engine.api.impl.ReportEngineHelper.openReportDesign",
          "source": "ReportEngineH elper.java:191"
        },
        {
          "method": "org.eclipse.birt.report.engine.api.impl.ReportEngineHelper.openReportDesign",
          "source": "ReportEngineH elper.java:125"
        },
        {
          "method": "org.eclipse.birt.report.engine.api.impl.ReportEngine.openReportDesign",
          "source": "ReportEngine.java:2 25"
        },
        {
          "method": "org.eclipse.birt.report.engine.api.ReportRunner.runAndRenderReport",
          "source": "ReportRunner.java:188"
        },
        {
          "method": "org.eclipse.birt.report.engine.api.ReportRunner.execute",
          "source": "ReportRunner.java:161"
        },
        {
          "method": "org.eclipse.birt.report.engine.api.ReportRunner.main",
          "source": "ReportRunner.java:117"
        }
      ],
      "number": 0,
      "commentIndex": 0,
      "bugId": "189241",
      "date": "2007-05-25T23:50:30+02:00",
      "product": "BIRT",
      "component": "Build",
      "severity": "normal"
    }
  ],
  "groupId": "189241",
  "bugId": "189241",
  "date": "2007-05-25T23:50:30+02:00",
  "product": "BIRT",
  "component": "Build",
  "severity": "normal"
}