{
  "comments": [
    "Debugging an application with cyclic projects results in a stack overflow error. (Sorry: I did \nnot test running the application.)\n\nProject A includes Project B into its build \npath.\nProject B includes Project A into its build path.\n\nIn earlier versions (I used build \n20020410) this resulted in a warning in the task-view, but worked well.\n\nIn F2, this leads to a \nstack overflow (see below) - forcing me to exit eclipse.\n\n\nLooks like an inifinite loop (by \nrecursion) to me and might happen in other places than debugging: running for example. Did not \ntest this.\n\n\n\n!SESSION Jun 04, 2002 10:13:24.906 ---------------------------------------------\njava.version\u003d1.4.0-\nrc\njava.vendor\u003dSun Microsystems Inc.\nBootLoader constants: OS\u003dwin32, ARCH\u003dx86, \nWS\u003dwin32, NL\u003dde_DE\nCommand-line arguments: -os win32 -ws win32 -arch x86 -install \nfile:D:/programme/Dev/eclipse/\n!ENTRY org.eclipse.jdt.launching 2 103 Jun 04, 2002 \n10:13:24.906\n!MESSAGE VM not fully specified in launch configuration KnowME - missing VM name. \nReverting to default VM.\n!ENTRY org.eclipse.jdt.launching 2 103 Jun 04, 2002 \n10:13:24.986\n!MESSAGE VM not fully specified in launch configuration KnowME - missing VM name. \nReverting to default VM.\n!ENTRY org.eclipse.jdt.launching 2 103 Jun 04, 2002 \n10:13:25.26\n!MESSAGE VM not fully specified in launch configuration KnowME - missing VM name. \nReverting to default VM.\n!ENTRY org.eclipse.jdt.launching 2 103 Jun 04, 2002 \n10:15:37.727\n!MESSAGE VM not fully specified in launch configuration KnowME - missing VM name. \nReverting to default VM.\n!ENTRY org.eclipse.ui 4 4 Jun 04, 2002 10:15:39.299\n!MESSAGE \nUnhandled exception caught in event loop.\n!ENTRY org.eclipse.ui 4 0 Jun 04, 2002 \n10:15:39.299\n!MESSAGE java.lang.StackOverflowError\n!STACK \n0\njava.lang.StackOverflowError\n    at \norg.eclipse.core.internal.dtree.DataTreeLookup.newLookup(DataTreeLookup.java:65)\n    \nat org.eclipse.core.internal.dtree.DeltaDataTree.lookup(DeltaDataTree.java:710)\n    at \norg.eclipse.core.internal.watson.ElementTree.includes(ElementTree.java:706)\n    at \norg.eclipse.core.internal.resources.Workspace.getResourceInfo(Workspace.java:964)\n \n   at org.eclipse.core.internal.resources.Container.findMember(Container.java:58)\n    at \norg.eclipse.core.internal.resources.Container.findMember(Container.java:51)\n    at \norg.eclipse.jdt.launching.JavaRuntime.expandProject(JavaRuntime.java:936)\n    at \norg.eclipse.jdt.launching.JavaRuntime.expandProject(JavaRuntime.java:969)\n    at \norg.eclipse.jdt.launching.JavaRuntime.expandProject(JavaRuntime.java:969)",
    "Candidate for F3",
    "Fixed.",
    "Needs F3 verification.",
    "Verified."
  ],
  "commentCreationDates": [
    "2002-06-04T13:28:26+02:00",
    "2002-06-04T14:53:37+02:00",
    "2002-06-05T21:14:55+02:00",
    "2002-06-05T21:15:11+02:00",
    "2002-06-07T23:01:39+02:00"
  ],
  "traces": [
    {
      "exceptionType": "java.lang.StackOverflowError",
      "elements": [
        {
          "method": "org.eclipse.core.internal.dtree.DataTreeLookup.newLookup",
          "source": "DataTreeLookup.java:65"
        },
        {
          "method": "org.eclipse.core.internal.dtree.DeltaDataTree.lookup",
          "source": "DeltaDataTree.java:710"
        },
        {
          "method": "org.eclipse.core.internal.watson.ElementTree.includes",
          "source": "ElementTree.java:706"
        },
        {
          "method": "org.eclipse.core.internal.resources.Workspace.getResourceInfo",
          "source": "Workspace.java:964"
        },
        {
          "method": "org.eclipse.core.internal.resources.Container.findMember",
          "source": "Container.java:58"
        },
        {
          "method": "org.eclipse.core.internal.resources.Container.findMember",
          "source": "Container.java:51"
        },
        {
          "method": "org.eclipse.jdt.launching.JavaRuntime.expandProject",
          "source": "JavaRuntime.java:936"
        },
        {
          "method": "org.eclipse.jdt.launching.JavaRuntime.expandProject",
          "source": "JavaRuntime.java:969"
        },
        {
          "method": "org.eclipse.jdt.launching.JavaRuntime.expandProject",
          "source": "JavaRuntime.java:969"
        }
      ],
      "number": 0,
      "commentIndex": 0,
      "bugId": "18998",
      "date": "2002-06-04T13:28:26+02:00",
      "product": "JDT",
      "component": "Debug",
      "severity": "major"
    }
  ],
  "groupId": "18998",
  "bugId": "18998",
  "date": "2002-06-04T13:28:26+02:00",
  "product": "JDT",
  "component": "Debug",
  "severity": "major"
}