{
  "comments": [
    "I have an application deployed in JBoss 4.0.4 that has been working with BIRT reports, but the latest version of the viewer (2.2RC2) won\u0027t execute a report if the application is also deployed.  I saw a thread about a conflict being caused because of JAAS being used in the other application, but it is not an option to turn off security in our environment.  Crosstab functionality in the new release is critical, and it looks right now like it\u0027s not scheduled to be addressed until later.  Any workarounds?",
    "I have downloaded JBoss4.0.4 and deployed BIRT on it. it worked well.\nHow did you integrate BIRT into your application?",
    "We have a single \nEAR file that holds our application, and have modified the security file in the conmf directory to point to our login module (using JAAS.). The birt.war is put in the same deploy directory as the application ear.\n\nIf our ear is there (and I assume using JAAs), birt won\u0027t start.  If I remove the ear, birt works as usual.",
    "The JAAS policy is defined in the \u003cjboss_home\u003e/\u003cserver\u003e/conf/login-config.xml:\n\n    \u003capplication-policy name \u003d \"RomeLogin\"\u003e\n       \u003cauthentication\u003e\n          \u003clogin-module code \u003d \"rome.security.loginModules.RomeDbLoginModule\" flag \u003d \"sufficient\"\u003e\n\t\t\u003cmodule-option name\u003d\"useShardState\"\u003etrue\u003c/module-option\u003e\n\t\t\u003cmodule-option name\u003d\"debug\"\u003efalse\u003c/module-option\u003e\n          \u003c/login-module\u003e\n\t  \u003clogin-module code \u003d \"rome.security.loginModules.LdapLoginModule\" flag \u003d \"sufficient\"\u003e\n                \u003cmodule-option name \u003d \"jndiProvider\"\u003e\n\t\t    com.sun.jndi.ldap.LdapCtxFactory   \n                \u003c/module-option\u003e\n                \u003cmodule-option name \u003d \"hostUrl\"\u003e\n                    ldap://houtstul1.rometest.com:389\n                \u003c/module-option\u003e\n                \u003cmodule-option name \u003d \"baseDN\"\u003e\n                    DC\u003drometest,DC\u003dcom\n                \u003c/module-option\u003e\n                \u003cmodule-option name \u003d \"userDNPattern\"\u003e\n                    rometest\\?\n                \u003c/module-option\u003e\n                \u003cmodule-option name \u003d \"appendBaseDN\"\u003e\n                    false\n                \u003c/module-option\u003e\n                \u003cmodule-option name \u003d \"groupFilterPattern\"\u003e\n                    (sameaccountname\u003d?)\n                \u003c/module-option\u003e\n                \u003cmodule-option name \u003d \"groupFilterAttribute\"\u003e\n                    memberOf\n                \u003c/module-option\u003e\n                \u003cmodule-option name \u003d \"groupNameAttribute\"\u003e\n                    cn\n                \u003c/module-option\u003e\n                \u003cmodule-option name \u003d \"useShardState\"\u003e\n                    true\n                \u003c/module-option\u003e\n                \u003cmodule-option name \u003d \"debug\"\u003e\n                    false\n                \u003c/module-option\u003e\n\t  \u003c/login-module\u003e   \n       \u003c/authentication\u003e\n    \u003c/application-policy\u003e\n\n-----------------------------------------------------------------------------\nThe error in the log is below:\n\n!ENTRY org.eclipse.osgi 4 0 2007-06-13 14:25:45.843\n!MESSAGE error loading hook: org.eclipse.core.runtime.internal.adaptor.EclipseCl\nassLoadingHook\n!STACK 0\njava.lang.ExceptionInInitializerError\n        at java.lang.Class.forName0(Native Method)\n        at java.lang.Class.forName(Class.java:164)\n        at org.eclipse.osgi.baseadaptor.HookRegistry.loadConfigurators(HookRegis\ntry.java:166)\n        at org.eclipse.osgi.baseadaptor.HookRegistry.initialize(HookRegistry.jav\na:99)\n        at org.eclipse.osgi.baseadaptor.BaseAdaptor.\u003cinit\u003e(BaseAdaptor.java:97)\n        at sun.reflect.NativeConstructorAccessorImpl.newInstance0(Native Method)\n\n        at sun.reflect.NativeConstructorAccessorImpl.newInstance(NativeConstruct\norAccessorImpl.java:39)\n        at sun.reflect.DelegatingConstructorAccessorImpl.newInstance(DelegatingC\nonstructorAccessorImpl.java:27)\n        at java.lang.reflect.Constructor.newInstance(Constructor.java:494)\n        at org.eclipse.core.runtime.adaptor.EclipseStarter.createAdaptor(Eclipse\nStarter.java:776)\n        at org.eclipse.core.runtime.adaptor.EclipseStarter.startup(EclipseStarte\nr.java:279)\n        at sun.reflect.NativeMethodAccessorImpl.invoke0(Native Method)\n        at sun.reflect.NativeMethodAccessorImpl.invoke(NativeMethodAccessorImpl.\njava:39)\n        at sun.reflect.DelegatingMethodAccessorImpl.invoke(DelegatingMethodAcces\nsorImpl.java:25)\n        at java.lang.reflect.Method.invoke(Method.java:585)\n        at org.eclipse.birt.core.framework.osgi.OSGILauncher.startup(OSGILaunche\nr.java:163)\n        at org.eclipse.birt.core.framework.Platform.startup(Platform.java:77)\n        at org.eclipse.birt.report.service.ReportEngineService.setEngineContext(\nUnknown Source)\n        at org.eclipse.birt.report.service.BirtViewerReportService.setContext(Un\nknown Source)\n        at org.eclipse.birt.report.servlet.ViewerServlet.__getContext(Unknown So\nurce)\n        at org.eclipse.birt.report.servlet.BirtSoapMessageDispatcherServlet.doGe\nt(Unknown Source)\n        at javax.servlet.http.HttpServlet.service(HttpServlet.java:697)\n        at org.apache.axis.transport.http.AxisServletBase.service(AxisServletBas\ne.java:327)\n        at javax.servlet.http.HttpServlet.service(HttpServlet.java:810)\n        at org.apache.catalina.core.ApplicationFilterChain.internalDoFilter(Appl\nicationFilterChain.java:252)\n        at org.apache.catalina.core.ApplicationFilterChain.doFilter(ApplicationF\nilterChain.java:173)\n        at org.jboss.web.tomcat.filters.ReplyHeaderFilter.doFilter(ReplyHeaderFi\nlter.java:96)\n        at org.apache.catalina.core.ApplicationFilterChain.internalDoFilter(Appl\nicationFilterChain.java:202)\n        at org.apache.catalina.core.ApplicationFilterChain.doFilter(ApplicationF\nilterChain.java:173)\n        at org.apache.catalina.core.StandardWrapperValve.invoke(StandardWrapperV\nalve.java:213)\n        at org.apache.catalina.core.StandardContextValve.invoke(StandardContextV\nalve.java:178)\n        at org.jboss.web.tomcat.security.SecurityAssociationValve.invoke(Securit\nyAssociationValve.java:175)\n        at org.jboss.web.tomcat.security.JaccContextValve.invoke(JaccContextValv\ne.java:74)\n        at org.apache.catalina.core.StandardHostValve.invoke(StandardHostValve.j\nava:126)\n        at org.apache.catalina.valves.ErrorReportValve.invoke(ErrorReportValve.j\nava:105)\n        at org.apache.catalina.core.StandardEngineValve.invoke(StandardEngineVal\nve.java:107)\n        at org.apache.catalina.connector.CoyoteAdapter.service(CoyoteAdapter.jav\na:148)\n        at org.apache.coyote.http11.Http11Processor.process(Http11Processor.java\n:869)\n        at org.apache.coyote.http11.Http11BaseProtocol$Http11ConnectionHandler.p\nrocessConnection(Http11BaseProtocol.java:664)\n        at org.apache.tomcat.util.net.PoolTcpEndpoint.processSocket(PoolTcpEndpo\nint.java:527)\n        at org.apache.tomcat.util.net.MasterSlaveWorkerThread.run(MasterSlaveWor\nkerThread.java:112)\n        at java.lang.Thread.run(Thread.java:595)\nCaused by: java.lang.NullPointerException\n        at org.eclipse.core.runtime.internal.adaptor.EclipseEnvironmentInfo.gues\nsOS(EclipseEnvironmentInfo.java:208)\n        at org.eclipse.core.runtime.internal.adaptor.EclipseEnvironmentInfo.setu\npSystemContext(EclipseEnvironmentInfo.java:142)\n        at org.eclipse.core.runtime.internal.adaptor.EclipseEnvironmentInfo.\u003cini\nt\u003e(EclipseEnvironmentInfo.java:50)\n        at org.eclipse.core.runtime.internal.adaptor.EclipseEnvironmentInfo.getD\nefault(EclipseEnvironmentInfo.java:55)\n        at org.eclipse.core.runtime.internal.adaptor.EclipseClassLoadingHook.\u003ccl\ninit\u003e(EclipseClassLoadingHook.java:30)\n        ... 42 more\n14:25:46,078 ERROR [STDERR] java.lang.reflect.InvocationTargetException\n14:25:46,078 ERROR [STDERR]     at sun.reflect.NativeMethodAccessorImpl.invoke0(\nNative Method)\n14:25:46,078 ERROR [STDERR]     at sun.reflect.NativeMethodAccessorImpl.invoke(N\nativeMethodAccessorImpl.java:39)\n14:25:46,078 ERROR [STDERR]     at sun.reflect.DelegatingMethodAccessorImpl.invo\nke(DelegatingMethodAccessorImpl.java:25)\n14:25:46,093 ERROR [STDERR]     at java.lang.reflect.Method.invoke(Method.java:5\n85)\n14:25:46,093 ERROR [STDERR]     at org.eclipse.birt.core.framework.osgi.OSGILaun\ncher.startup(OSGILauncher.java:163)\n14:25:46,093 ERROR [STDERR]     at org.eclipse.birt.core.framework.Platform.star\ntup(Platform.java:77)\n14:25:46,093 ERROR [STDERR]     at org.eclipse.birt.report.service.ReportEngineS\nervice.setEngineContext(Unknown Source)\n14:25:46,093 ERROR [STDERR]     at org.eclipse.birt.report.service.BirtViewerRep\nortService.setContext(Unknown Source)\n14:25:46,109 ERROR [STDERR]     at org.eclipse.birt.report.servlet.ViewerServlet\n.__getContext(Unknown Source)\n14:25:46,109 ERROR [STDERR]     at org.eclipse.birt.report.servlet.BirtSoapMessa\ngeDispatcherServlet.doGet(Unknown Source)\n14:25:46,109 ERROR [STDERR]     at javax.servlet.http.HttpServlet.service(HttpSe\nrvlet.java:697)\n14:25:46,109 ERROR [STDERR]     at org.apache.axis.transport.http.AxisServletBas\ne.service(AxisServletBase.java:327)\n14:25:46,109 ERROR [STDERR]     at javax.servlet.http.HttpServlet.service(HttpSe\nrvlet.java:810)\n14:25:46,109 ERROR [STDERR]     at org.apache.catalina.core.ApplicationFilterCha\nin.internalDoFilter(ApplicationFilterChain.java:252)\n14:25:46,109 ERROR [STDERR]     at org.apache.catalina.core.ApplicationFilterCha\nin.doFilter(ApplicationFilterChain.java:173)\n14:25:46,125 ERROR [STDERR]     at org.jboss.web.tomcat.filters.ReplyHeaderFilte\nr.doFilter(ReplyHeaderFilter.java:96)\n14:25:46,125 ERROR [STDERR]     at org.apache.catalina.core.ApplicationFilterCha\nin.internalDoFilter(ApplicationFilterChain.java:202)\n14:25:46,125 ERROR [STDERR]     at org.apache.catalina.core.ApplicationFilterCha\nin.doFilter(ApplicationFilterChain.java:173)\n14:25:46,125 ERROR [STDERR]     at org.apache.catalina.core.StandardWrapperValve\n.invoke(StandardWrapperValve.java:213)\n14:25:46,125 ERROR [STDERR]     at org.apache.catalina.core.StandardContextValve\n.invoke(StandardContextValve.java:178)\n14:25:46,125 ERROR [STDERR]     at org.jboss.web.tomcat.security.SecurityAssocia\ntionValve.invoke(SecurityAssociationValve.java:175)\n14:25:46,140 ERROR [STDERR]     at org.jboss.web.tomcat.security.JaccContextValv\ne.invoke(JaccContextValve.java:74)\n14:25:46,140 ERROR [STDERR]     at org.apache.catalina.core.StandardHostValve.in\nvoke(StandardHostValve.java:126)\n14:25:46,140 ERROR [STDERR]     at org.apache.catalina.valves.ErrorReportValve.i\nnvoke(ErrorReportValve.java:105)\n14:25:46,140 ERROR [STDERR]     at org.apache.catalina.core.StandardEngineValve.\ninvoke(StandardEngineValve.java:107)\n14:25:46,140 ERROR [STDERR]     at org.apache.catalina.connector.CoyoteAdapter.s\nervice(CoyoteAdapter.java:148)\n14:25:46,140 ERROR [STDERR]     at org.apache.coyote.http11.Http11Processor.proc\ness(Http11Processor.java:869)\n14:25:46,156 ERROR [STDERR]     at org.apache.coyote.http11.Http11BaseProtocol$H\nttp11ConnectionHandler.processConnection(Http11BaseProtocol.java:664)\n14:25:46,156 ERROR [STDERR]     at org.apache.tomcat.util.net.PoolTcpEndpoint.pr\nocessSocket(PoolTcpEndpoint.java:527)\n14:25:46,156 ERROR [STDERR]     at org.apache.tomcat.util.net.MasterSlaveWorkerT\nhread.run(MasterSlaveWorkerThread.java:112)\n14:25:46,156 ERROR [STDERR]     at java.lang.Thread.run(Thread.java:595)\n14:25:46,156 ERROR [STDERR] Caused by: java.lang.NullPointerException\n14:25:46,171 ERROR [STDERR]     at org.eclipse.core.runtime.internal.adaptor.Ecl\nipseEnvironmentInfo.guessOS(EclipseEnvironmentInfo.java:208)\n14:25:46,171 ERROR [STDERR]     at org.eclipse.core.runtime.internal.adaptor.Ecl\nipseEnvironmentInfo.setupSystemContext(EclipseEnvironmentInfo.java:142)\n14:25:46,171 ERROR [STDERR]     at org.eclipse.core.runtime.internal.adaptor.Ecl\nipseEnvironmentInfo.\u003cinit\u003e(EclipseEnvironmentInfo.java:50)\n14:25:46,171 ERROR [STDERR]     at org.eclipse.core.runtime.internal.adaptor.Ecl\nipseEnvironmentInfo.getDefault(EclipseEnvironmentInfo.java:55)\n14:25:46,171 ERROR [STDERR]     at org.eclipse.core.runtime.internal.adaptor.Ecl\nipseAdaptorHook.initialize(EclipseAdaptorHook.java:186)\n14:25:46,171 ERROR [STDERR]     at org.eclipse.osgi.baseadaptor.BaseAdaptor.init\nialize(BaseAdaptor.java:117)\n14:25:46,171 ERROR [STDERR]     at org.eclipse.osgi.framework.internal.core.Fram\nework.initialize(Framework.java:170)\n14:25:46,187 ERROR [STDERR]     at org.eclipse.osgi.framework.internal.core.Fram\nework.\u003cinit\u003e(Framework.java:147)\n14:25:46,187 ERROR [STDERR]     at org.eclipse.osgi.framework.internal.core.OSGi\n.createFramework(OSGi.java:90)\n14:25:46,187 ERROR [STDERR]     at org.eclipse.osgi.framework.internal.core.OSGi\n.\u003cinit\u003e(OSGi.java:31)\n14:25:46,187 ERROR [STDERR]     at org.eclipse.core.runtime.adaptor.EclipseStart\ner.startup(EclipseStarter.java:283)\n14:25:46,187 ERROR [STDERR]     ... 31 more\n14:25:46,828 ERROR [STDERR] org.eclipse.birt.report.exception.ViewerException: F\natal error occurred when try to startup report engine.\n14:25:46,828 ERROR [STDERR]     at org.eclipse.birt.report.service.ReportEngineS\nervice.setEngineContext(Unknown Source)\n14:25:46,843 ERROR [STDERR]     at org.eclipse.birt.report.service.BirtViewerRep\nortService.setContext(Unknown Source)\n14:25:46,843 ERROR [STDERR]     at org.eclipse.birt.report.servlet.ViewerServlet\n.__getContext(Unknown Source)\n14:25:46,843 ERROR [STDERR]     at org.eclipse.birt.report.servlet.BirtSoapMessa\ngeDispatcherServlet.doGet(Unknown Source)\n14:25:46,843 ERROR [STDERR]     at javax.servlet.http.HttpServlet.service(HttpSe\nrvlet.java:697)\n14:25:46,843 ERROR [STDERR]     at org.apache.axis.transport.http.AxisServletBas\ne.service(AxisServletBase.java:327)\n14:25:46,843 ERROR [STDERR]     at javax.servlet.http.HttpServlet.service(HttpSe\nrvlet.java:810)\n14:25:46,843 ERROR [STDERR]     at org.apache.catalina.core.ApplicationFilterCha\nin.internalDoFilter(ApplicationFilterChain.java:252)\n14:25:46,859 ERROR [STDERR]     at org.apache.catalina.core.ApplicationFilterCha\nin.doFilter(ApplicationFilterChain.java:173)\n14:25:46,859 ERROR [STDERR]     at org.jboss.web.tomcat.filters.ReplyHeaderFilte\nr.doFilter(ReplyHeaderFilter.java:96)\n14:25:46,859 ERROR [STDERR]     at org.apache.catalina.core.ApplicationFilterCha\nin.internalDoFilter(ApplicationFilterChain.java:202)\n14:25:46,859 ERROR [STDERR]     at org.apache.catalina.core.ApplicationFilterCha\nin.doFilter(ApplicationFilterChain.java:173)\n14:25:46,859 ERROR [STDERR]     at org.apache.catalina.core.StandardWrapperValve\n.invoke(StandardWrapperValve.java:213)\n14:25:46,859 ERROR [STDERR]     at org.apache.catalina.core.StandardContextValve\n.invoke(StandardContextValve.java:178)\n14:25:46,875 ERROR [STDERR]     at org.jboss.web.tomcat.security.SecurityAssocia\ntionValve.invoke(SecurityAssociationValve.java:175)\n14:25:46,875 ERROR [STDERR]     at org.jboss.web.tomcat.security.JaccContextValv\ne.invoke(JaccContextValve.java:74)\n14:25:46,875 ERROR [STDERR]     at org.apache.catalina.core.StandardHostValve.in\nvoke(StandardHostValve.java:126)\n14:25:46,875 ERROR [STDERR]     at org.apache.catalina.valves.ErrorReportValve.i\nnvoke(ErrorReportValve.java:105)\n14:25:46,875 ERROR [STDERR]     at org.apache.catalina.core.StandardEngineValve.\ninvoke(StandardEngineValve.java:107)\n14:25:46,890 ERROR [STDERR]     at org.apache.catalina.connector.CoyoteAdapter.s\nervice(CoyoteAdapter.java:148)\n14:25:46,890 ERROR [STDERR]     at org.apache.coyote.http11.Http11Processor.proc\ness(Http11Processor.java:869)\n14:25:46,890 ERROR [STDERR]     at org.apache.coyote.http11.Http11BaseProtocol$H\nttp11ConnectionHandler.processConnection(Http11BaseProtocol.java:664)\n14:25:46,890 ERROR [STDERR]     at org.apache.tomcat.util.net.PoolTcpEndpoint.pr\nocessSocket(PoolTcpEndpoint.java:527)\n14:25:46,890 ERROR [STDERR]     at org.apache.tomcat.util.net.MasterSlaveWorkerT\nhread.run(MasterSlaveWorkerThread.java:112)\n14:25:46,890 ERROR [STDERR]     at java.lang.Thread.run(Thread.java:595)",
    "Can\u0027t startup Report Engine correctly.\nReassign to engine team for further research.",
    "\n\n*** This bug has been marked as a duplicate of bug 182161 ***"
  ],
  "commentCreationDates": [
    "2007-06-12T22:40:47+02:00",
    "2007-06-13T05:23:15+02:00",
    "2007-06-13T15:01:04+02:00",
    "2007-06-13T21:31:42+02:00",
    "2007-06-14T05:30:00+02:00",
    "2007-06-14T06:53:10+02:00"
  ],
  "traces": [
    {
      "exceptionType": "java.lang.ExceptionInInitializerError",
      "elements": [
        {
          "method": "java.lang.Class.forName0",
          "source": "Native Method"
        },
        {
          "method": "java.lang.Class.forName",
          "source": "Class.java:164"
        },
        {
          "method": "org.eclipse.osgi.baseadaptor.HookRegistry.loadConfigurators",
          "source": "HookRegis try.java:166"
        },
        {
          "method": "org.eclipse.osgi.baseadaptor.HookRegistry.initialize",
          "source": "HookRegistry.jav a:99"
        },
        {
          "method": "org.eclipse.osgi.baseadaptor.BaseAdaptor.\u003cinit\u003e",
          "source": "BaseAdaptor.java:97"
        },
        {
          "method": "sun.reflect.NativeConstructorAccessorImpl.newInstance0",
          "source": "Native Method"
        },
        {
          "method": "sun.reflect.NativeConstructorAccessorImpl.newInstance",
          "source": "NativeConstruct orAccessorImpl.java:39"
        },
        {
          "method": "sun.reflect.DelegatingConstructorAccessorImpl.newInstance",
          "source": "DelegatingC onstructorAccessorImpl.java:27"
        },
        {
          "method": "java.lang.reflect.Constructor.newInstance",
          "source": "Constructor.java:494"
        },
        {
          "method": "org.eclipse.core.runtime.adaptor.EclipseStarter.createAdaptor",
          "source": "Eclipse Starter.java:776"
        },
        {
          "method": "org.eclipse.core.runtime.adaptor.EclipseStarter.startup",
          "source": "EclipseStarte r.java:279"
        },
        {
          "method": "sun.reflect.NativeMethodAccessorImpl.invoke0",
          "source": "Native Method"
        },
        {
          "method": "sun.reflect.NativeMethodAccessorImpl.invoke",
          "source": "NativeMethodAccessorImpl. java:39"
        },
        {
          "method": "sun.reflect.DelegatingMethodAccessorImpl.invoke",
          "source": "DelegatingMethodAcces sorImpl.java:25"
        },
        {
          "method": "java.lang.reflect.Method.invoke",
          "source": "Method.java:585"
        },
        {
          "method": "org.eclipse.birt.core.framework.osgi.OSGILauncher.startup",
          "source": "OSGILaunche r.java:163"
        },
        {
          "method": "org.eclipse.birt.core.framework.Platform.startup",
          "source": "Platform.java:77"
        },
        {
          "method": "org.eclipse.birt.report.service.ReportEngineService.setEngineContext",
          "source": " Unknown Source"
        },
        {
          "method": "org.eclipse.birt.report.service.BirtViewerReportService.setContext",
          "source": "Un known Source"
        },
        {
          "method": "org.eclipse.birt.report.servlet.ViewerServlet.__getContext",
          "source": "Unknown So urce"
        },
        {
          "method": "org.eclipse.birt.report.servlet.BirtSoapMessageDispatcherServlet.doGet",
          "source": "Unknown Source"
        },
        {
          "method": "javax.servlet.http.HttpServlet.service",
          "source": "HttpServlet.java:697"
        },
        {
          "method": "org.apache.axis.transport.http.AxisServletBase.service",
          "source": "AxisServletBas e.java:327"
        },
        {
          "method": "javax.servlet.http.HttpServlet.service",
          "source": "HttpServlet.java:810"
        },
        {
          "method": "org.apache.catalina.core.ApplicationFilterChain.internalDoFilter",
          "source": "Appl icationFilterChain.java:252"
        },
        {
          "method": "org.apache.catalina.core.ApplicationFilterChain.doFilter",
          "source": "ApplicationF ilterChain.java:173"
        },
        {
          "method": "org.jboss.web.tomcat.filters.ReplyHeaderFilter.doFilter",
          "source": "ReplyHeaderFi lter.java:96"
        },
        {
          "method": "org.apache.catalina.core.ApplicationFilterChain.internalDoFilter",
          "source": "Appl icationFilterChain.java:202"
        },
        {
          "method": "org.apache.catalina.core.ApplicationFilterChain.doFilter",
          "source": "ApplicationF ilterChain.java:173"
        },
        {
          "method": "org.apache.catalina.core.StandardWrapperValve.invoke",
          "source": "StandardWrapperV alve.java:213"
        },
        {
          "method": "org.apache.catalina.core.StandardContextValve.invoke",
          "source": "StandardContextV alve.java:178"
        },
        {
          "method": "org.jboss.web.tomcat.security.SecurityAssociationValve.invoke",
          "source": "Securit yAssociationValve.java:175"
        },
        {
          "method": "org.jboss.web.tomcat.security.JaccContextValve.invoke",
          "source": "JaccContextValv e.java:74"
        },
        {
          "method": "org.apache.catalina.core.StandardHostValve.invoke",
          "source": "StandardHostValve.j ava:126"
        },
        {
          "method": "org.apache.catalina.valves.ErrorReportValve.invoke",
          "source": "ErrorReportValve.j ava:105"
        },
        {
          "method": "org.apache.catalina.core.StandardEngineValve.invoke",
          "source": "StandardEngineVal ve.java:107"
        },
        {
          "method": "org.apache.catalina.connector.CoyoteAdapter.service",
          "source": "CoyoteAdapter.jav a:148"
        },
        {
          "method": "org.apache.coyote.http11.Http11Processor.process",
          "source": "Http11Processor.java :869"
        },
        {
          "method": "org.apache.coyote.http11.Http11BaseProtocol$Http11ConnectionHandler.processConnection",
          "source": "Http11BaseProtocol.java:664"
        },
        {
          "method": "org.apache.tomcat.util.net.PoolTcpEndpoint.processSocket",
          "source": "PoolTcpEndpo int.java:527"
        },
        {
          "method": "org.apache.tomcat.util.net.MasterSlaveWorkerThread.run",
          "source": "MasterSlaveWor kerThread.java:112"
        },
        {
          "method": "java.lang.Thread.run",
          "source": "Thread.java:595"
        }
      ],
      "causedBy": {
        "exceptionType": "java.lang.NullPointerException",
        "elements": [
          {
            "method": "org.eclipse.core.runtime.internal.adaptor.EclipseEnvironmentInfo.guessOS",
            "source": "EclipseEnvironmentInfo.java:208"
          },
          {
            "method": "org.eclipse.core.runtime.internal.adaptor.EclipseEnvironmentInfo.setupSystemContext",
            "source": "EclipseEnvironmentInfo.java:142"
          },
          {
            "method": "org.eclipse.core.runtime.internal.adaptor.EclipseEnvironmentInfo.\u003cinit\u003e",
            "source": "EclipseEnvironmentInfo.java:50"
          },
          {
            "method": "org.eclipse.core.runtime.internal.adaptor.EclipseEnvironmentInfo.getDefault",
            "source": "EclipseEnvironmentInfo.java:55"
          },
          {
            "method": "org.eclipse.core.runtime.internal.adaptor.EclipseClassLoadingHook.\u003cclinit\u003e",
            "source": "EclipseClassLoadingHook.java:30"
          }
        ],
        "number": 0,
        "commentIndex": 0
      },
      "number": 0,
      "commentIndex": 3,
      "bugId": "192288",
      "duplicateId": "182161",
      "date": "2007-06-13T21:31:42+02:00",
      "product": "BIRT",
      "component": "Report Engine",
      "severity": "critical"
    },
    {
      "exceptionType": "org.eclipse.birt.report.exception.ViewerException",
      "message": "F atal error occurred when try to startup report engine. 14:25:46,828 ERROR [STDERR]",
      "elements": [
        {
          "method": "org.eclipse.birt.report.service.ReportEngineService.setEngineContext",
          "source": "Unknown Source"
        }
      ],
      "number": 1,
      "commentIndex": 3,
      "bugId": "192288",
      "duplicateId": "182161",
      "date": "2007-06-13T21:31:42+02:00",
      "product": "BIRT",
      "component": "Report Engine",
      "severity": "critical"
    }
  ],
  "groupId": "182161",
  "bugId": "192288",
  "duplicateId": "182161",
  "date": "2007-06-12T22:40:47+02:00",
  "product": "BIRT",
  "component": "Report Engine",
  "severity": "critical"
}