{
  "comments": [
    "I want to work with files on a remote computer trough sftp. I use the RSE functionality provided with Eclipse for this. \n\nI\u0027m trying to use Eclipse (either 3.2.2 or the newer 3.3RC4 or the released 3.3) with the PDT and RSE functionality. \n\nI can succesfully make a connection to a remote host by ssh(sftp) and open the files in the normal text editor. Editing works ok, but i want to use the PDT project features like code assist and project outlines. When i switch to the PDT editor or try to open the files in the php explorer it results in an NullPointerException (see below).\n\nThe only reference i found was in the message:\nProblem - PDT and Subclipse from 12-5-2007 by Ali B on the eclipse.tools.pdt newsgroup. \n\nIt looks like the PDT doesn\u0027t recognize the files opened by the RSE plugin. Does the PDT support the EFS (eclipse file system) which the RSE providers or isn\u0027t that support needed to open files trough sftp? Because the normal text editor works, i believe this is a PDT problem.  \n\nIf you need any more information, please let me know. \n\nSteps to reproduce :\n1. Open RSE perspective\n2. Create new connection\n3. Choose ssh only\n4. fill in host information (next,next finish)\n5. Open PDT perspective\n6. Create new PHP project\n7. Add a folder to this new project (new -\u003e folder)\n   Choose advanced, link to folder in file system\n   Choose file system : RSE\n   Choose the directory containing the php files \n   Finish\n8. Open a php file from this added folder -\u003e Results in NPE\n\n\n\n---------------\nEclipse 3.3 I20070608-1718 (and 3.3v20070612)\nRemote System Explorer End-User Runtime 2.0.0v20070609\nPDT Feature 1.0.0.HEAD-79\nAlso tried with PDT feature V20070611-79\nWindows XP and Vista\n\n\njava.lang.NullPointerException\n    at org.eclipse.wst.sse.core.internal.FileBufferModelManager.createURIResolver(FileBufferModelManager.java:419)\n    at org.eclipse.wst.sse.core.internal.FileBufferModelManager.getModel(FileBufferModelManager.java:624)\n    at org.eclipse.wst.sse.core.internal.model.ModelManagerImpl._getModelFor(ModelManagerImpl.java:393)\n    at org.eclipse.wst.sse.core.internal.model.ModelManagerImpl.getModelForEdit(ModelManagerImpl.java:1020)\n    at org.eclipse.wst.sse.ui.StructuredTextEditor.doSetInput(StructuredTextEditor.java:2113)\n    at org.eclipse.php.internal.ui.editor.PHPStructuredEditor.doSetInput(Unknown Source)\n    at org.eclipse.ui.texteditor.AbstractTextEditor$19.run(AbstractTextEditor.java:2994)\n    at org.eclipse.jface.operation.ModalContext.runInCurrentThread(ModalContext.java:369)\n    at org.eclipse.jface.operation.ModalContext.run(ModalContext.java:313)\n    at org.eclipse.jface.window.ApplicationWindow$1.run(ApplicationWindow.java:758)\n    at org.eclipse.swt.custom.BusyIndicator.showWhile(BusyIndicator.java:67)\n    at org.eclipse.jface.window.ApplicationWindow.run(ApplicationWindow.java:755)\n    at org.eclipse.ui.internal.WorkbenchWindow.run(WorkbenchWindow.java:2451)\n    at org.eclipse.ui.texteditor.AbstractTextEditor.internalInit(AbstractTextEditor.java:3012)\n    at org.eclipse.ui.texteditor.AbstractTextEditor.init(AbstractTextEditor.java:3039)\n    at org.eclipse.wst.sse.ui.StructuredTextEditor.init(StructuredTextEditor.java:2615)\n    at org.eclipse.php.internal.ui.editor.PHPStructuredEditor.init(Unknown Source)\n    at org.eclipse.ui.internal.EditorManager.createSite(EditorManager.java:794)\n    at org.eclipse.ui.internal.EditorReference.createPartHelper(EditorReference.java:643)\n    at org.eclipse.ui.internal.EditorReference.createPart(EditorReference.java:426)\n    at org.eclipse.ui.internal.WorkbenchPartReference.getPart(WorkbenchPartReference.java:592)\n    at org.eclipse.ui.internal.EditorAreaHelper.setVisibleEditor(EditorAreaHelper.java:263)\n    at org.eclipse.ui.internal.EditorManager.setVisibleEditor(EditorManager.java:1405)\n    at org.eclipse.ui.internal.EditorManager$5.runWithException(EditorManager.java:939)\n    at org.eclipse.ui.internal.StartupThreading$StartupRunnable.run(StartupThreading.java:31)\n    at org.eclipse.swt.widgets.RunnableLock.run(RunnableLock.java:35)\n    at org.eclipse.swt.widgets.Synchronizer.runAsyncMessages(Synchronizer.java:123)\n    at org.eclipse.swt.widgets.Display.runAsyncMessages(Display.java:3659)\n    at org.eclipse.swt.widgets.Display.readAndDispatch(Display.java:3296)\n    at org.eclipse.ui.application.WorkbenchAdvisor.openWindows(WorkbenchAdvisor.java:797)\n    at org.eclipse.ui.internal.Workbench$25.runWithException(Workbench.java:1342)\n    at org.eclipse.ui.internal.StartupThreading$StartupRunnable.run(StartupThreading.java:31)\n    at org.eclipse.swt.widgets.RunnableLock.run(RunnableLock.java:35)\n    at org.eclipse.swt.widgets.Synchronizer.runAsyncMessages(Synchronizer.java:123)\n    at org.eclipse.swt.widgets.Display.runAsyncMessages(Display.java:3659)\n    at org.eclipse.swt.widgets.Display.readAndDispatch(Display.java:3296)\n    at org.eclipse.ui.internal.Workbench.runUI(Workbench.java:2309)\n    at org.eclipse.ui.internal.Workbench.access$4(Workbench.java:2219)\n    at org.eclipse.ui.internal.Workbench$4.run(Workbench.java:466)\n    at org.eclipse.core.databinding.observable.Realm.runWithDefault(Realm.java:289)\n    at org.eclipse.ui.internal.Workbench.createAndRunWorkbench(Workbench.java:461)\n    at org.eclipse.ui.PlatformUI.createAndRunWorkbench(PlatformUI.java:149)\n    at org.eclipse.ui.internal.ide.application.IDEApplication.start(IDEApplication.java:106)\n    at org.eclipse.equinox.internal.app.EclipseAppHandle.run(EclipseAppHandle.java:153)\n    at org.eclipse.core.runtime.internal.adaptor.EclipseAppLauncher.runApplication(EclipseAppLauncher.java:106)\n    at org.eclipse.core.runtime.internal.adaptor.EclipseAppLauncher.start(EclipseAppLauncher.java:76)\n    at org.eclipse.core.runtime.adaptor.EclipseStarter.run(EclipseStarter.java:363)\n    at org.eclipse.core.runtime.adaptor.EclipseStarter.run(EclipseStarter.java:176)\n    at sun.reflect.NativeMethodAccessorImpl.invoke0(Native Method)\n    at sun.reflect.NativeMethodAccessorImpl.invoke(Unknown Source)\n    at sun.reflect.DelegatingMethodAccessorImpl.invoke(Unknown Source)\n    at java.lang.reflect.Method.invoke(Unknown Source)\n    at org.eclipse.equinox.launcher.Main.invokeFramework(Main.java:504)\n    at org.eclipse.equinox.launcher.Main.basicRun(Main.java:443)\n    at org.eclipse.equinox.launcher.Main.run(Main.java:1169)",
    "This is a WST issue and I opened a bug on it last week.\nIt seems WST does not handle Null values coming from IResource.getLocation() which occurs when working\nwith RSE.\n\n*** This bug has been marked as a duplicate of bug 196172 ***",
    "duplicate"
  ],
  "commentCreationDates": [
    "2007-07-08T19:51:16+02:00",
    "2007-07-16T09:02:06+02:00",
    "2007-07-25T18:40:36+02:00"
  ],
  "traces": [
    {
      "exceptionType": "java.lang.NullPointerException",
      "elements": [
        {
          "method": "org.eclipse.wst.sse.core.internal.FileBufferModelManager.createURIResolver",
          "source": "FileBufferModelManager.java:419"
        },
        {
          "method": "org.eclipse.wst.sse.core.internal.FileBufferModelManager.getModel",
          "source": "FileBufferModelManager.java:624"
        },
        {
          "method": "org.eclipse.wst.sse.core.internal.model.ModelManagerImpl._getModelFor",
          "source": "ModelManagerImpl.java:393"
        },
        {
          "method": "org.eclipse.wst.sse.core.internal.model.ModelManagerImpl.getModelForEdit",
          "source": "ModelManagerImpl.java:1020"
        },
        {
          "method": "org.eclipse.wst.sse.ui.StructuredTextEditor.doSetInput",
          "source": "StructuredTextEditor.java:2113"
        },
        {
          "method": "org.eclipse.php.internal.ui.editor.PHPStructuredEditor.doSetInput",
          "source": "Unknown Source"
        },
        {
          "method": "org.eclipse.ui.texteditor.AbstractTextEditor$19.run",
          "source": "AbstractTextEditor.java:2994"
        },
        {
          "method": "org.eclipse.jface.operation.ModalContext.runInCurrentThread",
          "source": "ModalContext.java:369"
        },
        {
          "method": "org.eclipse.jface.operation.ModalContext.run",
          "source": "ModalContext.java:313"
        },
        {
          "method": "org.eclipse.jface.window.ApplicationWindow$1.run",
          "source": "ApplicationWindow.java:758"
        },
        {
          "method": "org.eclipse.swt.custom.BusyIndicator.showWhile",
          "source": "BusyIndicator.java:67"
        },
        {
          "method": "org.eclipse.jface.window.ApplicationWindow.run",
          "source": "ApplicationWindow.java:755"
        },
        {
          "method": "org.eclipse.ui.internal.WorkbenchWindow.run",
          "source": "WorkbenchWindow.java:2451"
        },
        {
          "method": "org.eclipse.ui.texteditor.AbstractTextEditor.internalInit",
          "source": "AbstractTextEditor.java:3012"
        },
        {
          "method": "org.eclipse.ui.texteditor.AbstractTextEditor.init",
          "source": "AbstractTextEditor.java:3039"
        },
        {
          "method": "org.eclipse.wst.sse.ui.StructuredTextEditor.init",
          "source": "StructuredTextEditor.java:2615"
        },
        {
          "method": "org.eclipse.php.internal.ui.editor.PHPStructuredEditor.init",
          "source": "Unknown Source"
        },
        {
          "method": "org.eclipse.ui.internal.EditorManager.createSite",
          "source": "EditorManager.java:794"
        },
        {
          "method": "org.eclipse.ui.internal.EditorReference.createPartHelper",
          "source": "EditorReference.java:643"
        },
        {
          "method": "org.eclipse.ui.internal.EditorReference.createPart",
          "source": "EditorReference.java:426"
        },
        {
          "method": "org.eclipse.ui.internal.WorkbenchPartReference.getPart",
          "source": "WorkbenchPartReference.java:592"
        },
        {
          "method": "org.eclipse.ui.internal.EditorAreaHelper.setVisibleEditor",
          "source": "EditorAreaHelper.java:263"
        },
        {
          "method": "org.eclipse.ui.internal.EditorManager.setVisibleEditor",
          "source": "EditorManager.java:1405"
        },
        {
          "method": "org.eclipse.ui.internal.EditorManager$5.runWithException",
          "source": "EditorManager.java:939"
        },
        {
          "method": "org.eclipse.ui.internal.StartupThreading$StartupRunnable.run",
          "source": "StartupThreading.java:31"
        },
        {
          "method": "org.eclipse.swt.widgets.RunnableLock.run",
          "source": "RunnableLock.java:35"
        },
        {
          "method": "org.eclipse.swt.widgets.Synchronizer.runAsyncMessages",
          "source": "Synchronizer.java:123"
        },
        {
          "method": "org.eclipse.swt.widgets.Display.runAsyncMessages",
          "source": "Display.java:3659"
        },
        {
          "method": "org.eclipse.swt.widgets.Display.readAndDispatch",
          "source": "Display.java:3296"
        },
        {
          "method": "org.eclipse.ui.application.WorkbenchAdvisor.openWindows",
          "source": "WorkbenchAdvisor.java:797"
        },
        {
          "method": "org.eclipse.ui.internal.Workbench$25.runWithException",
          "source": "Workbench.java:1342"
        },
        {
          "method": "org.eclipse.ui.internal.StartupThreading$StartupRunnable.run",
          "source": "StartupThreading.java:31"
        },
        {
          "method": "org.eclipse.swt.widgets.RunnableLock.run",
          "source": "RunnableLock.java:35"
        },
        {
          "method": "org.eclipse.swt.widgets.Synchronizer.runAsyncMessages",
          "source": "Synchronizer.java:123"
        },
        {
          "method": "org.eclipse.swt.widgets.Display.runAsyncMessages",
          "source": "Display.java:3659"
        },
        {
          "method": "org.eclipse.swt.widgets.Display.readAndDispatch",
          "source": "Display.java:3296"
        },
        {
          "method": "org.eclipse.ui.internal.Workbench.runUI",
          "source": "Workbench.java:2309"
        },
        {
          "method": "org.eclipse.ui.internal.Workbench.access$4",
          "source": "Workbench.java:2219"
        },
        {
          "method": "org.eclipse.ui.internal.Workbench$4.run",
          "source": "Workbench.java:466"
        },
        {
          "method": "org.eclipse.core.databinding.observable.Realm.runWithDefault",
          "source": "Realm.java:289"
        },
        {
          "method": "org.eclipse.ui.internal.Workbench.createAndRunWorkbench",
          "source": "Workbench.java:461"
        },
        {
          "method": "org.eclipse.ui.PlatformUI.createAndRunWorkbench",
          "source": "PlatformUI.java:149"
        },
        {
          "method": "org.eclipse.ui.internal.ide.application.IDEApplication.start",
          "source": "IDEApplication.java:106"
        },
        {
          "method": "org.eclipse.equinox.internal.app.EclipseAppHandle.run",
          "source": "EclipseAppHandle.java:153"
        },
        {
          "method": "org.eclipse.core.runtime.internal.adaptor.EclipseAppLauncher.runApplication",
          "source": "EclipseAppLauncher.java:106"
        },
        {
          "method": "org.eclipse.core.runtime.internal.adaptor.EclipseAppLauncher.start",
          "source": "EclipseAppLauncher.java:76"
        },
        {
          "method": "org.eclipse.core.runtime.adaptor.EclipseStarter.run",
          "source": "EclipseStarter.java:363"
        },
        {
          "method": "org.eclipse.core.runtime.adaptor.EclipseStarter.run",
          "source": "EclipseStarter.java:176"
        },
        {
          "method": "sun.reflect.NativeMethodAccessorImpl.invoke0",
          "source": "Native Method"
        },
        {
          "method": "sun.reflect.NativeMethodAccessorImpl.invoke",
          "source": "Unknown Source"
        },
        {
          "method": "sun.reflect.DelegatingMethodAccessorImpl.invoke",
          "source": "Unknown Source"
        },
        {
          "method": "java.lang.reflect.Method.invoke",
          "source": "Unknown Source"
        },
        {
          "method": "org.eclipse.equinox.launcher.Main.invokeFramework",
          "source": "Main.java:504"
        },
        {
          "method": "org.eclipse.equinox.launcher.Main.basicRun",
          "source": "Main.java:443"
        },
        {
          "method": "org.eclipse.equinox.launcher.Main.run",
          "source": "Main.java:1169"
        }
      ],
      "number": 0,
      "commentIndex": 0,
      "bugId": "195768",
      "duplicateId": "196172",
      "date": "2007-07-08T19:51:16+02:00",
      "product": "PDT",
      "component": "Core",
      "severity": "normal"
    }
  ],
  "groupId": "196172",
  "bugId": "195768",
  "duplicateId": "196172",
  "date": "2007-07-08T19:51:16+02:00",
  "product": "PDT",
  "component": "Core",
  "severity": "normal"
}