{
  "comments": [
    "Various places in the BIRT code, exceptions are caught, a stack trace is printed, and the code continues.\n\nOutputting standard error (e.printStackTrace flows the several pages of stack trace all the way back to the caller) makes it look like an error occurred, but the code continues anyway.\n\nWhen the exception is caught, either it\u0027s and error (exception should be thrown) or it\u0027s not (write a trace message to the log and continue).  But e.printStrackTrace causes problems for callers.  As a caller, I can\u0027t tell if an error occurred or not.  Do I continue or not.\n\nAs an example, I create a design with a dynamic parameter, and mis-spell the host name (localhos).  Then I try and get the selection list.  BIRT catches an exception, prints the stacktrace, and continues as if there were no error.  In this example, catch that eats the excpetion is on line 489 of org\\eclipse\\birt\\report\\engine\\api\\impl\\GetParameterDefinitionTask.java\n\nThere of dozens examples more throughout the code.\n\nWhat the caller sees:\nCannot load JDBC Driver class: com.ibm.db2.jcc.DB2Driver\n        at org.eclipse.birt.data.engine.odaconsumer.ConnectionManager.openConnec\ntion(ConnectionManager.java:152)\n        at org.eclipse.birt.data.engine.executor.DataSource.newConnection(DataSo\nurce.java:133)\n        at org.eclipse.birt.data.engine.executor.DataSource.open(DataSource.java\n:121)\n        at org.eclipse.birt.data.engine.impl.DataSourceRuntime.openOdiDataSource\n(DataSourceRuntime.java:206)\n        at org.eclipse.birt.data.engine.impl.QueryExecutor.openDataSource(QueryE\nxecutor.java:248)\n        at org.eclipse.birt.data.engine.impl.QueryExecutor.prepareExecution(Quer\nyExecutor.java:202)\n        at org.eclipse.birt.data.engine.impl.PreparedQuery.doPrepare(PreparedQue\nry.java:396)\n        at org.eclipse.birt.data.engine.impl.PreparedDataSourceQuery.execute(Pre\nparedDataSourceQuery.java:145)\n        at org.eclipse.birt.data.engine.impl.PreparedOdaDSQuery.execute(Prepared\nOdaDSQuery.java:134)\n        at org.eclipse.birt.data.engine.impl.PreparedDataSourceQuery.execute(Pre\nparedDataSourceQuery.java:125)\n        at org.eclipse.birt.report.engine.api.impl.GetParameterDefinitionTask.cr\neateDynamicSelectionChoices(GetParameterDefinitionTask.java:465)\n        at org.eclipse.birt.report.engine.api.impl.GetParameterDefinitionTask.ge\ntChoicesFromParameterQuery(GetParameterDefinitionTask.java:831)\n        at org.eclipse.birt.report.engine.api.impl.GetParameterDefinitionTask.ge\ntSelectionList(GetParameterDefinitionTask.java:323)\n...\n\nCaused by: org.eclipse.birt.report.data.oda.jdbc.JDBCException: Cannot load JDBC\n Driver class: com.ibm.db2.jcc.DB2Driver\n        at org.eclipse.birt.report.data.oda.jdbc.JDBCDriverManager.loadAndRegist\nerDriver(JDBCDriverManager.java:605)\n        at org.eclipse.birt.report.data.oda.jdbc.JDBCDriverManager.doConnect(JDB\nCDriverManager.java:180)\n        at org.eclipse.birt.report.data.oda.jdbc.JDBCDriverManager.getConnection\n(JDBCDriverManager.java:146)\n        at org.eclipse.birt.report.data.oda.jdbc.Connection.connectByUrl(Connect\nion.java:149)\n        at org.eclipse.birt.report.data.oda.jdbc.Connection.open(Connection.java\n:111)\n        at org.eclipse.datatools.connectivity.oda.consumer.helper.OdaConnection.\nopen(OdaConnection.java:235)\n        at org.eclipse.birt.data.engine.odaconsumer.ConnectionManager.openConnec\ntion(ConnectionManager.java:140)\n        ... 20 more\norg.eclipse.birt.data.engine.core.DataException: Cannot open the connection for\nthe driver: org.eclipse.birt.report.data.oda.jdbc\nCannot load JDBC Driver class: com.ibm.db2.jcc.DB2Driver\n        at org.eclipse.birt.data.engine.odaconsumer.ConnectionManager.openConnec\ntion(ConnectionManager.java:152)\n        at org.eclipse.birt.data.engine.executor.DataSource.newConnection(DataSo\nurce.java:133)\n        at org.eclipse.birt.data.engine.executor.DataSource.open(DataSource.java\n:121)\n        at org.eclipse.birt.data.engine.impl.DataSourceRuntime.openOdiDataSource\n(DataSourceRuntime.java:206)\n        at org.eclipse.birt.data.engine.impl.QueryExecutor.openDataSource(QueryE\nxecutor.java:248)\n        at org.eclipse.birt.data.engine.impl.QueryExecutor.prepareExecution(Quer\nyExecutor.java:202)\n        at org.eclipse.birt.data.engine.impl.PreparedQuery.doPrepare(PreparedQue\nry.java:396)\n        at org.eclipse.birt.data.engine.impl.PreparedDataSourceQuery.execute(Pre\nparedDataSourceQuery.java:145)\n        at org.eclipse.birt.data.engine.impl.PreparedOdaDSQuery.execute(Prepared\nOdaDSQuery.java:134)\n        at org.eclipse.birt.data.engine.impl.PreparedDataSourceQuery.execute(Pre\nparedDataSourceQuery.java:125)\n        at org.eclipse.birt.report.engine.api.impl.GetParameterDefinitionTask.cr\neateDynamicSelectionChoices(GetParameterDefinitionTask.java:465)\n        at org.eclipse.birt.report.engine.api.impl.GetParameterDefinitionTask.ge\ntChoicesFromParameterQuery(GetParameterDefinitionTask.java:831)\n        at org.eclipse.birt.report.engine.api.impl.GetParameterDefinitionTask.ge\ntSelectionList(GetParameterDefinitionTask.java:323)\n...\nCaused by: org.eclipse.birt.report.data.oda.jdbc.JDBCException: Cannot load JDBC\n Driver class: com.ibm.db2.jcc.DB2Driver\n        at org.eclipse.birt.report.data.oda.jdbc.JDBCDriverManager.loadAndRegist\nerDriver(JDBCDriverManager.java:605)\n        at org.eclipse.birt.report.data.oda.jdbc.JDBCDriverManager.doConnect(JDB\nCDriverManager.java:180)\n        at org.eclipse.birt.report.data.oda.jdbc.JDBCDriverManager.getConnection\n(JDBCDriverManager.java:146)\n        at org.eclipse.birt.report.data.oda.jdbc.Connection.connectByUrl(Connect\nion.java:149)\n        at org.eclipse.birt.report.data.oda.jdbc.Connection.open(Connection.java\n:111)\n        at org.eclipse.datatools.connectivity.oda.consumer.helper.OdaConnection.\nopen(OdaConnection.java:235)\n        at org.eclipse.birt.data.engine.odaconsumer.ConnectionManager.openConnec\ntion(ConnectionManager.java:140)\n        ... 20 more",
    "Engine has fixed it.\nBut also need DTE, MODEL and UI to fix it.\nSo please transfer this bug one by one to check it.\n\n\n",
    "Dte has fixed it.\nNow reassign it to UI team .\n",
    "Log exception information in stead of printing.\nGUI part is fixed.\n\nReassign it to Model team, if model team think they don\u0027t have this issue, please pass this bug to another team or set it to FIXED.",
    "Please remove printStrackTrace from ParameterValidationUtil.",
    "Finish remove \u0027printStackTrace\u0027 method."
  ],
  "commentCreationDates": [
    "2007-07-09T17:15:22+02:00",
    "2007-07-17T11:55:42+02:00",
    "2007-07-20T10:29:43+02:00",
    "2007-08-01T10:04:32+02:00",
    "2007-08-01T10:15:18+02:00",
    "2007-08-03T08:41:15+02:00"
  ],
  "traces": [
    {
      "exceptionType": "org.eclipse.birt.report.data.oda.jdbc.JDBCException",
      "message": "Cannot load JDBC  Driver class: com.ibm.db2.jcc.DB2Driver",
      "elements": [
        {
          "method": "org.eclipse.birt.report.data.oda.jdbc.JDBCDriverManager.loadAndRegisterDriver",
          "source": "JDBCDriverManager.java:605"
        },
        {
          "method": "org.eclipse.birt.report.data.oda.jdbc.JDBCDriverManager.doConnect",
          "source": "JDB CDriverManager.java:180"
        },
        {
          "method": "org.eclipse.birt.report.data.oda.jdbc.JDBCDriverManager.getConnection",
          "source": "JDBCDriverManager.java:146"
        },
        {
          "method": "org.eclipse.birt.report.data.oda.jdbc.Connection.connectByUrl",
          "source": "Connect ion.java:149"
        },
        {
          "method": "org.eclipse.birt.report.data.oda.jdbc.Connection.open",
          "source": "Connection.java :111"
        },
        {
          "method": "org.eclipse.datatools.connectivity.oda.consumer.helper.OdaConnection.open",
          "source": "OdaConnection.java:235"
        },
        {
          "method": "org.eclipse.birt.data.engine.odaconsumer.ConnectionManager.openConnection",
          "source": "ConnectionManager.java:140"
        }
      ],
      "number": 0,
      "commentIndex": 0,
      "bugId": "195841",
      "date": "2007-07-09T17:15:22+02:00",
      "product": "BIRT",
      "component": "Report",
      "severity": "normal"
    },
    {
      "exceptionType": "org.eclipse.birt.data.engine.core.DataException",
      "message": "Cannot open the connection for the driver: org.eclipse.birt.report.data.oda.jdbc Cannot load JDBC Driver class: com.ibm.db2.jcc.DB2Driver",
      "elements": [
        {
          "method": "org.eclipse.birt.data.engine.odaconsumer.ConnectionManager.openConnection",
          "source": "ConnectionManager.java:152"
        },
        {
          "method": "org.eclipse.birt.data.engine.executor.DataSource.newConnection",
          "source": "DataSo urce.java:133"
        },
        {
          "method": "org.eclipse.birt.data.engine.executor.DataSource.open",
          "source": "DataSource.java :121"
        },
        {
          "method": "org.eclipse.birt.data.engine.impl.DataSourceRuntime.openOdiDataSource",
          "source": "DataSourceRuntime.java:206"
        },
        {
          "method": "org.eclipse.birt.data.engine.impl.QueryExecutor.openDataSource",
          "source": "QueryE xecutor.java:248"
        },
        {
          "method": "org.eclipse.birt.data.engine.impl.QueryExecutor.prepareExecution",
          "source": "Quer yExecutor.java:202"
        },
        {
          "method": "org.eclipse.birt.data.engine.impl.PreparedQuery.doPrepare",
          "source": "PreparedQue ry.java:396"
        },
        {
          "method": "org.eclipse.birt.data.engine.impl.PreparedDataSourceQuery.execute",
          "source": "Pre paredDataSourceQuery.java:145"
        },
        {
          "method": "org.eclipse.birt.data.engine.impl.PreparedOdaDSQuery.execute",
          "source": "Prepared OdaDSQuery.java:134"
        },
        {
          "method": "org.eclipse.birt.data.engine.impl.PreparedDataSourceQuery.execute",
          "source": "Pre paredDataSourceQuery.java:125"
        },
        {
          "method": "org.eclipse.birt.report.engine.api.impl.GetParameterDefinitionTask.createDynamicSelectionChoices",
          "source": "GetParameterDefinitionTask.java:465"
        },
        {
          "method": "org.eclipse.birt.report.engine.api.impl.GetParameterDefinitionTask.getChoicesFromParameterQuery",
          "source": "GetParameterDefinitionTask.java:831"
        },
        {
          "method": "org.eclipse.birt.report.engine.api.impl.GetParameterDefinitionTask.getSelectionList",
          "source": "GetParameterDefinitionTask.java:323"
        }
      ],
      "number": 1,
      "commentIndex": 0,
      "bugId": "195841",
      "date": "2007-07-09T17:15:22+02:00",
      "product": "BIRT",
      "component": "Report",
      "severity": "normal"
    },
    {
      "exceptionType": "org.eclipse.birt.report.data.oda.jdbc.JDBCException",
      "message": "Cannot load JDBC  Driver class: com.ibm.db2.jcc.DB2Driver",
      "elements": [
        {
          "method": "org.eclipse.birt.report.data.oda.jdbc.JDBCDriverManager.loadAndRegisterDriver",
          "source": "JDBCDriverManager.java:605"
        },
        {
          "method": "org.eclipse.birt.report.data.oda.jdbc.JDBCDriverManager.doConnect",
          "source": "JDB CDriverManager.java:180"
        },
        {
          "method": "org.eclipse.birt.report.data.oda.jdbc.JDBCDriverManager.getConnection",
          "source": "JDBCDriverManager.java:146"
        },
        {
          "method": "org.eclipse.birt.report.data.oda.jdbc.Connection.connectByUrl",
          "source": "Connect ion.java:149"
        },
        {
          "method": "org.eclipse.birt.report.data.oda.jdbc.Connection.open",
          "source": "Connection.java :111"
        },
        {
          "method": "org.eclipse.datatools.connectivity.oda.consumer.helper.OdaConnection.open",
          "source": "OdaConnection.java:235"
        },
        {
          "method": "org.eclipse.birt.data.engine.odaconsumer.ConnectionManager.openConnection",
          "source": "ConnectionManager.java:140"
        }
      ],
      "number": 2,
      "commentIndex": 0,
      "bugId": "195841",
      "date": "2007-07-09T17:15:22+02:00",
      "product": "BIRT",
      "component": "Report",
      "severity": "normal"
    }
  ],
  "groupId": "195841",
  "bugId": "195841",
  "date": "2007-07-09T17:15:22+02:00",
  "product": "BIRT",
  "component": "Report",
  "severity": "normal"
}