{
  "comments": [
    "Build ID: I20070625-1500\n\nSteps To Reproduce:\n1. Install WebViewer on MacOSX\n2. Clicking on the test report does not work (workaround by disabling BIRT_VIEWER_PRINT_SERVERSIDE in web.xml)\n2. Print to PDF does not work\n3. test1.rptdesign does not work\n\nThe stack trace for both is similar and is below.\n\nI was asked by QS on the Birt Newsgroup to post this as an issue\n\nthanx\n\n\nMore information:\n\nSEVERE: Error happened while running the report.\njava.lang.InternalError: Can\u0027t connect to window server - not enough permissions.\n        at java.lang.ClassLoader$NativeLibrary.load(Native Method)\n        at java.lang.ClassLoader.loadLibrary0(ClassLoader.java:1751)\n        at java.lang.ClassLoader.loadLibrary(ClassLoader.java:1668)\n        at java.lang.Runtime.loadLibrary0(Runtime.java:822)\n        at java.lang.System.loadLibrary(System.java:992)\n        at sun.security.action.LoadLibraryAction.run(LoadLibraryAction.java:50)\n        at java.security.AccessController.doPrivileged(Native Method)\n        at java.awt.image.ColorModel.loadLibraries(ColorModel.java:188)\n        at java.awt.image.ColorModel.\u003cclinit\u003e(ColorModel.java:196)\n        at java.awt.image.BufferedImage.\u003cclinit\u003e(BufferedImage.java:279)\n        at org.eclipse.birt.chart.device.swing.SwingDisplayServer.\u003cinit\u003e(SwingDisplayServer.java:66)\n        at sun.reflect.NativeConstructorAccessorImpl.newInstance0(Native Method)\n        at sun.reflect.NativeConstructorAccessorImpl.newInstance(NativeConstructorAccessorImpl.java:39)\n        at sun.reflect.DelegatingConstructorAccessorImpl.newInstance(DelegatingConstructorAccessorImpl.java:27)\n        at java.lang.reflect.Constructor.newInstance(Constructor.java:494)\n        at java.lang.Class.newInstance0(Class.java:350)\n        at java.lang.Class.newInstance(Class.java:303)",
    "It isn\u0027t a BIRT issue and due to environment issue.\nYou can try these workarounds:\n\n1) startup with the -Djava.awt.headless\u003dtrue command line option.\n2) Install a toolkit which emulates AWT without the need for an underlying X server. One example is the PJA toolkit(http://www.eteks.com/pja/en/), which is free and comes with detailed installation instructions. \n\nThanks.",
    "Changing OS from Mac OS to Mac OS X as per bug 185991"
  ],
  "commentCreationDates": [
    "2007-07-23T21:44:43+02:00",
    "2007-07-24T04:40:05+02:00",
    "2007-07-29T15:23:28+02:00"
  ],
  "traces": [
    {
      "exceptionType": "java.lang.InternalError",
      "message": "Can\u0027t connect to window server - not enough permissions.",
      "elements": [
        {
          "method": "java.lang.ClassLoader$NativeLibrary.load",
          "source": "Native Method"
        },
        {
          "method": "java.lang.ClassLoader.loadLibrary0",
          "source": "ClassLoader.java:1751"
        },
        {
          "method": "java.lang.ClassLoader.loadLibrary",
          "source": "ClassLoader.java:1668"
        },
        {
          "method": "java.lang.Runtime.loadLibrary0",
          "source": "Runtime.java:822"
        },
        {
          "method": "java.lang.System.loadLibrary",
          "source": "System.java:992"
        },
        {
          "method": "sun.security.action.LoadLibraryAction.run",
          "source": "LoadLibraryAction.java:50"
        },
        {
          "method": "java.security.AccessController.doPrivileged",
          "source": "Native Method"
        },
        {
          "method": "java.awt.image.ColorModel.loadLibraries",
          "source": "ColorModel.java:188"
        },
        {
          "method": "java.awt.image.ColorModel.\u003cclinit\u003e",
          "source": "ColorModel.java:196"
        },
        {
          "method": "java.awt.image.BufferedImage.\u003cclinit\u003e",
          "source": "BufferedImage.java:279"
        },
        {
          "method": "org.eclipse.birt.chart.device.swing.SwingDisplayServer.\u003cinit\u003e",
          "source": "SwingDisplayServer.java:66"
        },
        {
          "method": "sun.reflect.NativeConstructorAccessorImpl.newInstance0",
          "source": "Native Method"
        },
        {
          "method": "sun.reflect.NativeConstructorAccessorImpl.newInstance",
          "source": "NativeConstructorAccessorImpl.java:39"
        },
        {
          "method": "sun.reflect.DelegatingConstructorAccessorImpl.newInstance",
          "source": "DelegatingConstructorAccessorImpl.java:27"
        },
        {
          "method": "java.lang.reflect.Constructor.newInstance",
          "source": "Constructor.java:494"
        },
        {
          "method": "java.lang.Class.newInstance0",
          "source": "Class.java:350"
        },
        {
          "method": "java.lang.Class.newInstance",
          "source": "Class.java:303"
        }
      ],
      "number": 0,
      "commentIndex": 0,
      "bugId": "197538",
      "date": "2007-07-23T21:44:43+02:00",
      "product": "BIRT",
      "component": "Report Viewer",
      "severity": "critical"
    }
  ],
  "groupId": "197538",
  "bugId": "197538",
  "date": "2007-07-23T21:44:43+02:00",
  "product": "BIRT",
  "component": "Report Viewer",
  "severity": "critical"
}