{
  "comments": [
    "Launch RSE as debuggee with assertions enabled \n(JRE options -ea -eas in the Launch).\n\nCreate an FTP connection (supposedly any connection type would work too).\nWhen logging in, do save the username but not the password.\nExpand it 2 levels deep.\nQuit \u0026 restart RSE (with \"Restore System View\" preference).\n\nOn restart, it tries to re-open the connection but before showing the password prompt there is an error dialog (Unknown Error... details: error). Error log shows this exception:\n\norg.eclipse.swt.SWTException: Failed to execute runnable (java.lang.AssertionError)\nat org.eclipse.swt.SWT.error(SWT.java:3563)\n   [...]\nCaused by: java.lang.AssertionError\nat org.eclipse.rse.internal.ui.view.SystemView.refreshRemoteObject(SystemView.java:2981)\nat org.eclipse.rse.internal.ui.view.SystemViewPart$RestoreStateRunnable.runInUIThread(SystemViewPart.java:1728)\nat org.eclipse.ui.progress.UIJob$1.run(UIJob.java:94)\nat org.eclipse.swt.widgets.RunnableLock.run(RunnableLock.java:35)\nat org.eclipse.swt.widgets.Synchronizer.runAsyncMessages(Synchronizer.java:123)\n... 23 more\n\nThis is most probably a regression of the fix for bug #196662.",
    "Created an attachment (id\u003d75763)\nPatch to fix the assertion\n\nAttached patch fixes the assertion, but it\u0027s unclear whether RSE can restore the previous systemView state (this might be a regression)",
    "Patch applied:\n[198650] Fix assertion when restoring workbench state\n    SystemView.java  1.148",
    "Marking fixed since the assertion is fixed.\n\nNot properly restoring the RSE view is covered in bug #199424."
  ],
  "commentCreationDates": [
    "2007-08-02T13:20:29+02:00",
    "2007-08-09T15:23:55+02:00",
    "2007-08-09T15:24:49+02:00",
    "2007-08-09T15:40:34+02:00"
  ],
  "traces": [
    {
      "exceptionType": "org.eclipse.swt.SWTException",
      "message": "Failed to execute runnable (java.lang.AssertionError)",
      "elements": [
        {
          "method": "org.eclipse.swt.SWT.error",
          "source": "SWT.java:3563"
        }
      ],
      "number": 0,
      "commentIndex": 0,
      "bugId": "198650",
      "date": "2007-08-02T13:20:29+02:00",
      "product": "Target Management",
      "component": "RSE",
      "severity": "minor"
    },
    {
      "exceptionType": "java.lang.AssertionError",
      "elements": [
        {
          "method": "org.eclipse.rse.internal.ui.view.SystemView.refreshRemoteObject",
          "source": "SystemView.java:2981"
        },
        {
          "method": "org.eclipse.rse.internal.ui.view.SystemViewPart$RestoreStateRunnable.runInUIThread",
          "source": "SystemViewPart.java:1728"
        },
        {
          "method": "org.eclipse.ui.progress.UIJob$1.run",
          "source": "UIJob.java:94"
        },
        {
          "method": "org.eclipse.swt.widgets.RunnableLock.run",
          "source": "RunnableLock.java:35"
        },
        {
          "method": "org.eclipse.swt.widgets.Synchronizer.runAsyncMessages",
          "source": "Synchronizer.java:123"
        }
      ],
      "number": 1,
      "commentIndex": 0,
      "bugId": "198650",
      "date": "2007-08-02T13:20:29+02:00",
      "product": "Target Management",
      "component": "RSE",
      "severity": "minor"
    }
  ],
  "groupId": "198650",
  "bugId": "198650",
  "date": "2007-08-02T13:20:29+02:00",
  "product": "Target Management",
  "component": "RSE",
  "severity": "minor"
}