{
  "comments": [
    "The new GUI-installer fails on Linux because the *sh files in install/templates/db/ and install/templates/gui/ are missing.",
    "sample error message for aperi-ij.sh\n\nOutput:\n\nTargets:init,configureDerby,configureServer-linux,configureAgent-linux\nBuildfile: /opt/aperi/install/build.xml\n\ninit:\n\nconfigureDerby:\n\nconfigureDerbyFiles:\n     [echo] Updating the properties file: /opt/aperi/install/../db/aperi-ij.sh\n\n\nErrors:\n\nBUILD FAILED\n/opt/aperi/install/scripts/derby.xml:31: The following error occurred while executing this line:\n/opt/aperi/install/scripts/derby.xml:46: Warning: Could not find file /opt/aperi/install/templates/db/aperi-ij.sh to copy.\n\nTotal time: 1 second\norg.tp23.antinstaller.InstallException: Error running the install, Ant run failed - examine the error logs for details\n        at org.tp23.antinstaller.runtime.exe.AntLauncherFilter.exec(AntLauncherFilter.java:88)\n        at org.tp23.antinstaller.runtime.ExecInstall.exec(ExecInstall.java:85)\n        at org.tp23.antinstaller.runtime.ExecInstall.main(ExecInstall.java:157)\n        at org.eclipse.aperi.install.Activator.start(Activator.java:16)\n",
    "resolved."
  ],
  "commentCreationDates": [
    "2007-08-27T17:10:46+02:00",
    "2007-09-19T10:01:23+02:00",
    "2007-10-27T23:50:49+02:00"
  ],
  "traces": [
    {
      "exceptionType": "org.tp23.antinstaller.InstallException",
      "message": "Error running the install, Ant run failed - examine the error logs for details",
      "elements": [
        {
          "method": "org.tp23.antinstaller.runtime.exe.AntLauncherFilter.exec",
          "source": "AntLauncherFilter.java:88"
        },
        {
          "method": "org.tp23.antinstaller.runtime.ExecInstall.exec",
          "source": "ExecInstall.java:85"
        },
        {
          "method": "org.tp23.antinstaller.runtime.ExecInstall.main",
          "source": "ExecInstall.java:157"
        },
        {
          "method": "org.eclipse.aperi.install.Activator.start",
          "source": "Activator.java:16"
        }
      ],
      "number": 0,
      "commentIndex": 1,
      "bugId": "201269",
      "date": "2007-09-19T10:01:23+02:00",
      "product": "Aperi",
      "component": "aperi.install",
      "severity": "normal"
    }
  ],
  "groupId": "201269",
  "bugId": "201269",
  "date": "2007-08-27T17:10:46+02:00",
  "product": "Aperi",
  "component": "aperi.install",
  "severity": "normal"
}