{
  "comments": [
    "I am using the R0.9 version.  Several times now when I try to synchronize my\nproject I get the following error:\n \n java.io.IOException: crc error\n  at org.eclipse.vcm.internal.core.ccvs.ssh.ServerPacket$PacketInputStream.close(\n ServerPacket.java(Compiled Code))\n  at org.eclipse.vcm.internal.core.ccvs.ssh.Client$StandardInputStream.close(Clie\n nt.java:111)\n  at org.eclipse.vcm.internal.core.ccvs.ssh.SSHServerConnection.close(SSHServerCo\n nnection.java:39)\n  at org.eclipse.vcm.internal.core.ccvs.client.Connection.close(Connection.java:8\n 3)\n  at org.eclipse.vcm.internal.core.ccvs.client.Client.disconnect(Client.java:251)\n  at  org.eclipse.vcm.internal.core.ccvs.CVSAdapter.fetchRemoteTree(CVSAdapter.jav\n a:578) \n  at org.eclipse.vcm.internal.core.Subscriber.refresh(Subscriber.java:516)\n  at org.eclipse.vcm.internal.core.Subscriber$3.run(Subscriber.java:484)\n  at org.eclipse.core.internal.resources.Workspace.run(Workspace.java:1194)\n  at org.eclipse.vcm.internal.core.Subscriber.run(Subscriber.java:535)\n  at\n org.eclipse.vcm.internal.core.SharingManager.run(SharingManager.java:676)\n  at org.eclipse.vcm.internal.core.Subscriber.refresh(Subscriber.java:478)\n  at\n org.eclipse.vcm.internal.ui.sync.Repository.doServerDelta(Repository.java:18\n 1)\n  at\n org.eclipse.vcm.internal.ui.sync.Repository$1.execute(Repository.java:225)\n  at\n org.eclipse.ui.actions.WorkspaceModifyOperation$1.run(WorkspaceModifyOperati\n on.java:64)\n  at org.eclipse.core.internal.resources.Workspace.run(Workspace.java:1194)\n  at\n org.eclipse.ui.actions.WorkspaceModifyOperation.run(WorkspaceModifyOperation\n .java:78)\n  at\n org.eclipse.vcm.internal.ui.sync.Repository.localServerDelta(Repository.java\n :229)\n  at\n org.eclipse.vcm.internal.ui.sync.SyncCompareInput.prepareInput(SyncCompareIn\n put.java:434)\n  at org.eclipse.compare.CompareEditorInput.run(CompareEditorInput.java:596)\n  at\n org.eclipse.jface.operation.ModalContext$ModalContextThread.run(ModalContext\n .java:98)\n\nNOTES:\n\nJean-Michel (7/6/01 8:40:15 AM)\n\tWe should review the code and find out the following:\n\t1. why do we care about the crc at when closing?\n\t2. is the crc calculation correct in close?\n\nJEM (7/9/2001 11:30:48 AM)\n\t3. is this crc error brought about by the flushing that we\u0027re doing when closing the connection?\n\t\tI think this only appeared after we fixed that code, but I\u0027m not positive.\n\nJean-Michel (23/07/2001 10:51:52 AM)\n\tThe code in close looks fine. I cannot reproduce this error. I would like to install ssh onto cvslnx\n\tso that we can test ssh during our daily development. SSH is already installed on dj and fiji \n\ttest machines.\n\nJean-Michel (26/07/2001 9:53:40 AM)\n\tSSH installed on both fiji and cvslnx. Sent an e-mail to vcm team so that we all use\n\tthe \u0027extssh\u0027 connection method for development.",
    "See bug 4944",
    "[Fixed in v205]",
    "PRODUCT VERSION:\nR0.9\n\n"
  ],
  "commentCreationDates": [
    "2001-10-11T03:38:07+02:00",
    "2001-10-18T17:48:34+02:00",
    "2001-10-18T20:30:26+02:00",
    "2001-10-24T05:46:44+02:00"
  ],
  "traces": [
    {
      "exceptionType": "java.io.IOException",
      "message": "crc error",
      "elements": [
        {
          "method": "org.eclipse.vcm.internal.core.ccvs.ssh.ServerPacket$PacketInputStream.close",
          "source": "  ServerPacket.java(Compiled Code)"
        },
        {
          "method": "org.eclipse.vcm.internal.core.ccvs.ssh.Client$StandardInputStream.close",
          "source": "Clie  nt.java:111"
        },
        {
          "method": "org.eclipse.vcm.internal.core.ccvs.ssh.SSHServerConnection.close",
          "source": "SSHServerCo  nnection.java:39"
        },
        {
          "method": "org.eclipse.vcm.internal.core.ccvs.client.Connection.close",
          "source": "Connection.java:8  3"
        },
        {
          "method": "org.eclipse.vcm.internal.core.ccvs.client.Client.disconnect",
          "source": "Client.java:251"
        },
        {
          "method": "org.eclipse.vcm.internal.core.ccvs.CVSAdapter.fetchRemoteTree",
          "source": "CVSAdapter.jav  a:578"
        },
        {
          "method": "org.eclipse.vcm.internal.core.Subscriber.refresh",
          "source": "Subscriber.java:516"
        },
        {
          "method": "org.eclipse.vcm.internal.core.Subscriber$3.run",
          "source": "Subscriber.java:484"
        },
        {
          "method": "org.eclipse.core.internal.resources.Workspace.run",
          "source": "Workspace.java:1194"
        },
        {
          "method": "org.eclipse.vcm.internal.core.Subscriber.run",
          "source": "Subscriber.java:535"
        },
        {
          "method": "org.eclipse.vcm.internal.core.SharingManager.run",
          "source": "SharingManager.java:676"
        },
        {
          "method": "org.eclipse.vcm.internal.core.Subscriber.refresh",
          "source": "Subscriber.java:478"
        },
        {
          "method": "org.eclipse.vcm.internal.ui.sync.Repository.doServerDelta",
          "source": "Repository.java:18  1"
        },
        {
          "method": "org.eclipse.vcm.internal.ui.sync.Repository$1.execute",
          "source": "Repository.java:225"
        },
        {
          "method": "org.eclipse.ui.actions.WorkspaceModifyOperation$1.run",
          "source": "WorkspaceModifyOperati  on.java:64"
        },
        {
          "method": "org.eclipse.core.internal.resources.Workspace.run",
          "source": "Workspace.java:1194"
        },
        {
          "method": "org.eclipse.ui.actions.WorkspaceModifyOperation.run",
          "source": "WorkspaceModifyOperation  .java:78"
        },
        {
          "method": "org.eclipse.vcm.internal.ui.sync.Repository.localServerDelta",
          "source": "Repository.java  :229"
        },
        {
          "method": "org.eclipse.vcm.internal.ui.sync.SyncCompareInput.prepareInput",
          "source": "SyncCompareIn  put.java:434"
        },
        {
          "method": "org.eclipse.compare.CompareEditorInput.run",
          "source": "CompareEditorInput.java:596"
        },
        {
          "method": "org.eclipse.jface.operation.ModalContext$ModalContextThread.run",
          "source": "ModalContext  .java:98"
        }
      ],
      "number": 0,
      "commentIndex": 0,
      "bugId": "202",
      "date": "2001-10-11T03:38:07+02:00",
      "product": "Platform",
      "component": "Team",
      "severity": "normal"
    }
  ],
  "groupId": "202",
  "bugId": "202",
  "date": "2001-10-11T03:38:07+02:00",
  "product": "Platform",
  "component": "Team",
  "severity": "normal"
}