{
  "comments": [
    "build 20020624\n\nFrom the newsgroup:\n\nSubject: \n             Support for Ant \"input\".\n        Date: \n             Tue, 11 Jun 2002 15:04:25 +0200\n       From: \n             Torkild Ulv?y Resheim \u003ctresheim@online.no\u003e\n Organization: \n             EclipseCorner\n Newsgroups: \n             eclipse.tools\n\n\n\n\nI\u0027m trying to get user input using the ant task \"input\" but end up with \nan exception. Seems like there is something missing in the ant support:\n\n\nBuild exception: d:\\eclipse-ws-emmaedb\\bravo-ebutikk\\distribute.xml:69: \nFailed to read input from Console.\nBuild exception: d:\\eclipse-ws-emmaedb\\bravo-ebutikk\\distribute.xml:69: \nFailed to read input from Console.\nd:\\eclipse-ws-emmaedb\\bravo-ebutikk\\distribute.xml:69: Failed to read \ninput from Console.\n        at \norg.apache.tools.ant.input.DefaultInputHandler.handleInput\n(DefaultInputHandler.java:94)\n        at org.apache.tools.ant.taskdefs.Input.execute(Input.java:138)\n        at org.apache.tools.ant.Task.perform(Task.java:313)\n        at org.apache.tools.ant.Target.execute(Target.java:309)\n        at org.apache.tools.ant.Target.performTasks(Target.java:334)\n        at org.apache.tools.ant.Project.executeTarget(Project.java:1216)\n        at org.apache.tools.ant.Project.executeTargets(Project.java:1160)\n        at \norg.eclipse.ant.internal.core.ant.InternalAntRunner.run\n(InternalAntRunner.java:269)\n        at sun.reflect.NativeMethodAccessorImpl.invoke0(Native Method)\n        at \nsun.reflect.NativeMethodAccessorImpl.invoke(NativeMethodAccessorImpl.java:39)\n        at \nsun.reflect.DelegatingMethodAccessorImpl.invoke\n(DelegatingMethodAccessorImpl.java:25)\n        at java.lang.reflect.Method.invoke(Method.java:324)\n        at org.eclipse.ant.core.AntRunner.run(AntRunner.java:155)\n        at \norg.eclipse.ui.externaltools.internal.core.AntFileRunner.execute\n(AntFileRunner.java:54)\n        at \norg.eclipse.ui.externaltools.internal.core.DefaultRunnerContext.executeRunner\n(DefaultRunnerContext.java:320)\n        at \norg.eclipse.ui.externaltools.internal.core.DefaultRunnerContext.run\n(DefaultRunnerContext.java:370)\n        at \norg.eclipse.ui.externaltools.internal.ui.AntLaunchWizard$1.run\n(AntLaunchWizard.java:116)\n        at \norg.eclipse.jface.operation.ModalContext$ModalContextThread.run\n(ModalContext.java:98)\n--- Nested Exception ---\njava.io.IOException: Ugyldig referanse\n        at java.io.FileInputStream.readBytes(Native Method)\n        at java.io.FileInputStream.read(FileInputStream.java:192)\n        at java.io.BufferedInputStream.read1(BufferedInputStream.java:220)\n        at java.io.BufferedInputStream.read(BufferedInputStream.java:277)\n        at sun.nio.cs.StreamDecoder$CharsetSD.readBytes(StreamDecoder.java:404)\n        at sun.nio.cs.StreamDecoder$CharsetSD.implRead(StreamDecoder.java:442)\n        at sun.nio.cs.StreamDecoder.read(StreamDecoder.java:179)\n        at java.io.InputStreamReader.read(InputStreamReader.java:167)\n        at java.io.BufferedReader.fill(BufferedReader.java:136)\n        at java.io.BufferedReader.readLine(BufferedReader.java:299)\n        at java.io.BufferedReader.readLine(BufferedReader.java:362)\n        at \norg.apache.tools.ant.input.DefaultInputHandler.handleInput\n(DefaultInputHandler.java:91)\n        at org.apache.tools.ant.taskdefs.Input.execute(Input.java:138)\n        at org.apache.tools.ant.Task.perform(Task.java:313)\n        at org.apache.tools.ant.Target.execute(Target.java:309)\n        at org.apache.tools.ant.Target.performTasks(Target.java:334)\n        at org.apache.tools.ant.Project.executeTarget(Project.java:1216)\n        at org.apache.tools.ant.Project.executeTargets(Project.java:1160)\n        at \norg.eclipse.ant.internal.core.ant.InternalAntRunner.run\n(InternalAntRunner.java:269)\n        at sun.reflect.NativeMethodAccessorImpl.invoke0(Native Method)\n        at \nsun.reflect.NativeMethodAccessorImpl.invoke(NativeMethodAccessorImpl.java:39)\n        at \nsun.reflect.DelegatingMethodAccessorImpl.invoke\n(DelegatingMethodAccessorImpl.java:25)\n        at java.lang.reflect.Method.invoke(Method.java:324)\n        at org.eclipse.ant.core.AntRunner.run(AntRunner.java:155)\n        at \norg.eclipse.ui.externaltools.internal.core.AntFileRunner.execute\n(AntFileRunner.java:54)\n        at \norg.eclipse.ui.externaltools.internal.core.DefaultRunnerContext.executeRunner\n(DefaultRunnerContext.java:320)\n        at \norg.eclipse.ui.externaltools.internal.core.DefaultRunnerContext.run\n(DefaultRunnerContext.java:370)\n        at \norg.eclipse.ui.externaltools.internal.ui.AntLaunchWizard$1.run\n(AntLaunchWizard.java:116)\n        at \norg.eclipse.jface.operation.ModalContext$ModalContextThread.run\n(ModalContext.java:98)\nBuild exception: d:\\eclipse-ws-emmaedb\\bravo-ebutikk\\distribute.xml:69: \nFailed to read input from Console.\n\n-- \n                                                             ((\n   Med vennlig hilsen / kind regards                          ))\n   Torkild Ulv?y Resheim                                    |----|_\n   Systemutvikler / Software Engineer @ Emma EDB AS         |    | )\n   http://www.emmaedb.no                                    |____|?",
    "This is something we have to look at after 2.0.",
    "Reopening.",
    "\n\n*** This bug has been marked as a duplicate of 21149 ***"
  ],
  "commentCreationDates": [
    "2002-06-24T22:08:26+02:00",
    "2002-06-24T22:09:04+02:00",
    "2002-07-08T21:18:14+02:00",
    "2002-07-08T21:18:30+02:00"
  ],
  "traces": [
    {
      "exceptionType": "java.io.IOException",
      "message": "Ugyldig referanse",
      "elements": [
        {
          "method": "java.io.FileInputStream.readBytes",
          "source": "Native Method"
        },
        {
          "method": "java.io.FileInputStream.read",
          "source": "FileInputStream.java:192"
        },
        {
          "method": "java.io.BufferedInputStream.read1",
          "source": "BufferedInputStream.java:220"
        },
        {
          "method": "java.io.BufferedInputStream.read",
          "source": "BufferedInputStream.java:277"
        },
        {
          "method": "sun.nio.cs.StreamDecoder$CharsetSD.readBytes",
          "source": "StreamDecoder.java:404"
        },
        {
          "method": "sun.nio.cs.StreamDecoder$CharsetSD.implRead",
          "source": "StreamDecoder.java:442"
        },
        {
          "method": "sun.nio.cs.StreamDecoder.read",
          "source": "StreamDecoder.java:179"
        },
        {
          "method": "java.io.InputStreamReader.read",
          "source": "InputStreamReader.java:167"
        },
        {
          "method": "java.io.BufferedReader.fill",
          "source": "BufferedReader.java:136"
        },
        {
          "method": "java.io.BufferedReader.readLine",
          "source": "BufferedReader.java:299"
        },
        {
          "method": "java.io.BufferedReader.readLine",
          "source": "BufferedReader.java:362"
        },
        {
          "method": "org.apache.tools.ant.input.DefaultInputHandler.handleInput",
          "source": "DefaultInputHandler.java:91"
        },
        {
          "method": "org.apache.tools.ant.taskdefs.Input.execute",
          "source": "Input.java:138"
        },
        {
          "method": "org.apache.tools.ant.Task.perform",
          "source": "Task.java:313"
        },
        {
          "method": "org.apache.tools.ant.Target.execute",
          "source": "Target.java:309"
        },
        {
          "method": "org.apache.tools.ant.Target.performTasks",
          "source": "Target.java:334"
        },
        {
          "method": "org.apache.tools.ant.Project.executeTarget",
          "source": "Project.java:1216"
        },
        {
          "method": "org.apache.tools.ant.Project.executeTargets",
          "source": "Project.java:1160"
        },
        {
          "method": "org.eclipse.ant.internal.core.ant.InternalAntRunner.run",
          "source": "InternalAntRunner.java:269"
        },
        {
          "method": "sun.reflect.NativeMethodAccessorImpl.invoke0",
          "source": "Native Method"
        },
        {
          "method": "sun.reflect.NativeMethodAccessorImpl.invoke",
          "source": "NativeMethodAccessorImpl.java:39"
        },
        {
          "method": "sun.reflect.DelegatingMethodAccessorImpl.invoke",
          "source": "DelegatingMethodAccessorImpl.java:25"
        },
        {
          "method": "java.lang.reflect.Method.invoke",
          "source": "Method.java:324"
        },
        {
          "method": "org.eclipse.ant.core.AntRunner.run",
          "source": "AntRunner.java:155"
        },
        {
          "method": "org.eclipse.ui.externaltools.internal.core.AntFileRunner.execute",
          "source": "AntFileRunner.java:54"
        },
        {
          "method": "org.eclipse.ui.externaltools.internal.core.DefaultRunnerContext.executeRunner",
          "source": "DefaultRunnerContext.java:320"
        },
        {
          "method": "org.eclipse.ui.externaltools.internal.core.DefaultRunnerContext.run",
          "source": "DefaultRunnerContext.java:370"
        },
        {
          "method": "org.eclipse.ui.externaltools.internal.ui.AntLaunchWizard$1.run",
          "source": "AntLaunchWizard.java:116"
        },
        {
          "method": "org.eclipse.jface.operation.ModalContext$ModalContextThread.run",
          "source": "ModalContext.java:98"
        }
      ],
      "number": 0,
      "commentIndex": 0,
      "bugId": "20916",
      "duplicateId": "21149",
      "date": "2002-06-24T22:08:26+02:00",
      "product": "Platform",
      "component": "Ant",
      "severity": "normal"
    }
  ],
  "groupId": "21149",
  "bugId": "20916",
  "duplicateId": "21149",
  "date": "2002-06-24T22:08:26+02:00",
  "product": "Platform",
  "component": "Ant",
  "severity": "normal"
}