{
  "comments": [
    "I20071127-0800\n\nThis is a blocker for bug 113247\n\n1. Add \u0027new Exception(region.toString()).printStackTrace();\u0027 to\norg.eclipse.jface.text.presentation.PresentationReconciler.InternalListener.textChanged(TextEvent)\nline 210\n2. Open faust with 9999 spelling errors and spelling errors with \u0027Native\nProblem Underline\u0027\n3. Press and hold enter for about 10 seconds\nIs:\n you get a couple of stack traces (see below) after you release the key. Each time the complete document is damaged and repaired. Each repair takes a long time\nShould:\n exactly one stack trace after key release\n\nThe trace:\njava.lang.Exception: [0+76881]\n        at\norg.eclipse.jface.text.presentation.PresentationReconciler$InternalListener.textChanged(PresentationReconciler.java:208)\n        at\norg.eclipse.jface.text.TextViewer.updateTextListeners(TextViewer.java:2624)\n        at\norg.eclipse.jface.text.TextViewer.invalidateTextPresentation(TextViewer.java:3271)\n        at\norg.eclipse.jface.text.source.AnnotationPainter.invalidateTextPresentation(AnnotationPainter.java:959)\n        at\norg.eclipse.jface.text.source.AnnotationPainter.updatePainting(AnnotationPainter.java:941)\n        at\norg.eclipse.jface.text.source.AnnotationPainter.access$1(AnnotationPainter.java:935)\n        at\norg.eclipse.jface.text.source.AnnotationPainter$1.run(AnnotationPainter.java:1074)\n        at org.eclipse.swt.widgets.RunnableLock.run(RunnableLock.java:35)\n        at\norg.eclipse.swt.widgets.Synchronizer.runAsyncMessages(Synchronizer.java:130)\n        at org.eclipse.swt.widgets.Display.runAsyncMessages(Display.java:3727)\n        at org.eclipse.swt.widgets.Display.readAndDispatch(Display.java:3364)\n        at org.eclipse.ui.internal.Workbench.runEventLoop(Workbench.java:2393)",
    "This is intended for two reasons:\n- the widget itself treats each new character as a separate text change\n- we want the syntax coloring to update while the key is pressed"
  ],
  "commentCreationDates": [
    "2007-12-04T14:28:53+01:00",
    "2007-12-10T14:49:28+01:00"
  ],
  "traces": [
    {
      "exceptionType": "java.lang.Exception",
      "message": "[0+76881]",
      "elements": [
        {
          "method": "org.eclipse.jface.text.presentation.PresentationReconciler$InternalListener.textChanged",
          "source": "PresentationReconciler.java:208"
        },
        {
          "method": "org.eclipse.jface.text.TextViewer.updateTextListeners",
          "source": "TextViewer.java:2624"
        },
        {
          "method": "org.eclipse.jface.text.TextViewer.invalidateTextPresentation",
          "source": "TextViewer.java:3271"
        },
        {
          "method": "org.eclipse.jface.text.source.AnnotationPainter.invalidateTextPresentation",
          "source": "AnnotationPainter.java:959"
        },
        {
          "method": "org.eclipse.jface.text.source.AnnotationPainter.updatePainting",
          "source": "AnnotationPainter.java:941"
        },
        {
          "method": "org.eclipse.jface.text.source.AnnotationPainter.access$1",
          "source": "AnnotationPainter.java:935"
        },
        {
          "method": "org.eclipse.jface.text.source.AnnotationPainter$1.run",
          "source": "AnnotationPainter.java:1074"
        },
        {
          "method": "org.eclipse.swt.widgets.RunnableLock.run",
          "source": "RunnableLock.java:35"
        },
        {
          "method": "org.eclipse.swt.widgets.Synchronizer.runAsyncMessages",
          "source": "Synchronizer.java:130"
        },
        {
          "method": "org.eclipse.swt.widgets.Display.runAsyncMessages",
          "source": "Display.java:3727"
        },
        {
          "method": "org.eclipse.swt.widgets.Display.readAndDispatch",
          "source": "Display.java:3364"
        },
        {
          "method": "org.eclipse.ui.internal.Workbench.runEventLoop",
          "source": "Workbench.java:2393"
        }
      ],
      "number": 0,
      "commentIndex": 0,
      "bugId": "211878",
      "date": "2007-12-04T14:28:53+01:00",
      "product": "Platform",
      "component": "Text",
      "severity": "normal"
    }
  ],
  "groupId": "211878",
  "bugId": "211878",
  "date": "2007-12-04T14:28:53+01:00",
  "product": "Platform",
  "component": "Text",
  "severity": "normal"
}