{
  "comments": [
    "Installing eclipse-SDK-2.0-linux-gtk on a Linux Suse 8.0, with KDE, after  \nrpm -ivh glib2-2.0.4-1.rpm \nrpm -ivh atk-1.0.2-15.rpm \nrpm -ivh pango-1.0.3-1.rpm \nrpm -ivh gtk2-2.0.5-2.rpm \n \nI got the following result: \nFehlermeldung: \n** (\u003cunknown\u003e:16088): WARNING **: No builtin or dynamically loaded modules \nwere found. Pango will not work correctly. This probably means \nthere was an error in the creation of: \n  \u0027/etc/pango/pango.modules\u0027 \nYou may be able to recreate this file by running pango-querymodules. \n \n** (\u003cunknown\u003e:16088): WARNING **: Invalid subfont 0 \n \n** (\u003cunknown\u003e:16088): WARNING **: Invalid subfont 0 in \nget_font_metrics_from_subfonts \n \n** (\u003cunknown\u003e:16088): WARNING **: Invalid subfont 0 \n \n** (\u003cunknown\u003e:16088): WARNING **: Invalid subfont 0 in \nget_font_metrics_from_subfonts \n \n** (\u003cunknown\u003e:16088): WARNING **: Invalid subfont 0 \n \n** (\u003cunknown\u003e:16088): WARNING **: Invalid subfont 0 in \nget_font_metrics_from_subfonts \norg.eclipse.swt.SWTError: Widget is disposed \n        at org.eclipse.swt.widgets.Widget.error(Widget.java:290) \n        at org.eclipse.swt.widgets.Control.getDisplay(Control.java:1270) \n        at org.eclipse.swt.widgets.Widget.isValidThread(Widget.java:462) \n        at org.eclipse.swt.widgets.Widget.checkWidget(Widget.java:228) \n        at org.eclipse.swt.widgets.Composite.setFocus(Composite.java:546) \n        at \norg.eclipse.ui.internal.dialogs.WelcomeEditor.setFocus(WelcomeEditor.java:705) \n        at org.eclipse.ui.internal.WorkbenchPage$2.run(WorkbenchPage.java:344) \n        at \norg.eclipse.core.internal.runtime.InternalPlatform.run(InternalPlatform.java:831) \n        at org.eclipse.core.runtime.Platform.run(Platform.java:416) \n        at \norg.eclipse.ui.internal.WorkbenchPage.activatePart(WorkbenchPage.java:341) \n        at \norg.eclipse.ui.internal.WorkbenchPage.setActivePart(WorkbenchPage.java:2037) \n        at \norg.eclipse.ui.internal.WorkbenchPage.activate(WorkbenchPage.java:330) \n        at \norg.eclipse.ui.internal.WorkbenchPage.openEditor(WorkbenchPage.java:1695) \n        at \norg.eclipse.ui.internal.WorkbenchPage.openEditor(WorkbenchPage.java:1646) \n        at \norg.eclipse.ui.internal.WorkbenchPage.openEditor(WorkbenchPage.java:1638) \n        at org.eclipse.ui.internal.Workbench.openEditor(Workbench.java:897) \n        at \norg.eclipse.ui.internal.Workbench.openWelcomeEditor(Workbench.java:835) \n        at org.eclipse.ui.internal.Workbench.init(Workbench.java:569) \n        at org.eclipse.ui.internal.Workbench.run(Workbench.java:1153) \n        at \norg.eclipse.core.internal.boot.InternalBootLoader.run(InternalBootLoader.java:775) \n        at org.eclipse.core.boot.BootLoader.run(BootLoader.java:462) \n        at java.lang.reflect.Method.invoke(Native Method) \n        at org.eclipse.core.launcher.Main.basicRun(Main.java:248) \n        at org.eclipse.core.launcher.Main.run(Main.java:698) \n        at org.eclipse.core.launcher.Main.main(Main.java:534)",
    "Moving to SWT for comment.\n\nNote there are many people using eclipse 2.0 with GTK, so I suspect a \nconfiguration problem on your end.",
    "Do other GTK2 applications work?  (I usually look at GtkDemo first.)",
    "Johannes,\n\nAre you still having trouble and need help with this?",
    "Johannes,  we would like to help you get eclipse running on GTK.  However, if \nwe get no reply, we are going to have to close this bug report.  Please respond \nif you are still interested in this problem.",
    "No reply received.  Closing bug report"
  ],
  "commentCreationDates": [
    "2002-07-09T22:18:44+02:00",
    "2002-07-09T23:35:20+02:00",
    "2002-09-03T19:56:05+02:00",
    "2002-10-08T19:32:38+02:00",
    "2002-10-22T20:31:22+02:00",
    "2002-10-28T17:45:29+01:00"
  ],
  "traces": [
    {
      "exceptionType": "org.eclipse.swt.SWTError",
      "message": "Widget is disposed",
      "elements": [
        {
          "method": "org.eclipse.swt.widgets.Widget.error",
          "source": "Widget.java:290"
        },
        {
          "method": "org.eclipse.swt.widgets.Control.getDisplay",
          "source": "Control.java:1270"
        },
        {
          "method": "org.eclipse.swt.widgets.Widget.isValidThread",
          "source": "Widget.java:462"
        },
        {
          "method": "org.eclipse.swt.widgets.Widget.checkWidget",
          "source": "Widget.java:228"
        },
        {
          "method": "org.eclipse.swt.widgets.Composite.setFocus",
          "source": "Composite.java:546"
        },
        {
          "method": "org.eclipse.ui.internal.dialogs.WelcomeEditor.setFocus",
          "source": "WelcomeEditor.java:705"
        },
        {
          "method": "org.eclipse.ui.internal.WorkbenchPage$2.run",
          "source": "WorkbenchPage.java:344"
        },
        {
          "method": "org.eclipse.core.internal.runtime.InternalPlatform.run",
          "source": "InternalPlatform.java:831"
        },
        {
          "method": "org.eclipse.core.runtime.Platform.run",
          "source": "Platform.java:416"
        },
        {
          "method": "org.eclipse.ui.internal.WorkbenchPage.activatePart",
          "source": "WorkbenchPage.java:341"
        },
        {
          "method": "org.eclipse.ui.internal.WorkbenchPage.setActivePart",
          "source": "WorkbenchPage.java:2037"
        },
        {
          "method": "org.eclipse.ui.internal.WorkbenchPage.activate",
          "source": "WorkbenchPage.java:330"
        },
        {
          "method": "org.eclipse.ui.internal.WorkbenchPage.openEditor",
          "source": "WorkbenchPage.java:1695"
        },
        {
          "method": "org.eclipse.ui.internal.WorkbenchPage.openEditor",
          "source": "WorkbenchPage.java:1646"
        },
        {
          "method": "org.eclipse.ui.internal.WorkbenchPage.openEditor",
          "source": "WorkbenchPage.java:1638"
        },
        {
          "method": "org.eclipse.ui.internal.Workbench.openEditor",
          "source": "Workbench.java:897"
        },
        {
          "method": "org.eclipse.ui.internal.Workbench.openWelcomeEditor",
          "source": "Workbench.java:835"
        },
        {
          "method": "org.eclipse.ui.internal.Workbench.init",
          "source": "Workbench.java:569"
        },
        {
          "method": "org.eclipse.ui.internal.Workbench.run",
          "source": "Workbench.java:1153"
        },
        {
          "method": "org.eclipse.core.internal.boot.InternalBootLoader.run",
          "source": "InternalBootLoader.java:775"
        },
        {
          "method": "org.eclipse.core.boot.BootLoader.run",
          "source": "BootLoader.java:462"
        },
        {
          "method": "java.lang.reflect.Method.invoke",
          "source": "Native Method"
        },
        {
          "method": "org.eclipse.core.launcher.Main.basicRun",
          "source": "Main.java:248"
        },
        {
          "method": "org.eclipse.core.launcher.Main.run",
          "source": "Main.java:698"
        },
        {
          "method": "org.eclipse.core.launcher.Main.main",
          "source": "Main.java:534"
        }
      ],
      "number": 0,
      "commentIndex": 0,
      "bugId": "21422",
      "date": "2002-07-09T22:18:44+02:00",
      "product": "Platform",
      "component": "SWT",
      "severity": "blocker"
    }
  ],
  "groupId": "21422",
  "bugId": "21422",
  "date": "2002-07-09T22:18:44+02:00",
  "product": "Platform",
  "component": "SWT",
  "severity": "blocker"
}