{
  "comments": [
    "Build 200208150800 (2.0.1)\n\n1. Create scrapbook page\n2. Type in: \njava.io.File f\u003ccursor\u003e\n3. Invoke code assist\nObserve: You get no completion but an exception in the log:\norg.eclipse.jface.util.Assert$AssertionFailedException: Assertion failed:\n        at org.eclipse.jface.util.Assert.isTrue(Assert.java:162)\n        at org.eclipse.jface.util.Assert.isTrue(Assert.java:148)\n        at org.eclipse.jdt.internal.ui.text.java.JavaCompletionProposal.\u003cinit\u003e\n(JavaCompletionProposal.java:58)\n        at \norg.eclipse.jdt.internal.ui.text.java.ResultCollector.createCompletion\n(ResultCollector.java:415)\n        at \norg.eclipse.jdt.internal.ui.text.java.ResultCollector.acceptVariableName\n(ResultCollector.java:286)\n        at \norg.eclipse.jdt.internal.core.CompletionRequestorWrapper.acceptVariableName\n(CompletionRequestorWrapper.java:306)\n        at \norg.eclipse.jdt.internal.eval.CodeSnippetToCuMapper$1.acceptVariableName\n(CodeSnippetToCuMapper.java:214)\n        at org.eclipse.jdt.internal.codeassist.CompletionEngine.findVariableName\n(CompletionEngine.java:2516)\n        at \norg.eclipse.jdt.internal.codeassist.CompletionEngine.findVariableNames\n(CompletionEngine.java:2533)\n        at org.eclipse.jdt.internal.codeassist.CompletionEngine.complete\n(CompletionEngine.java:639)\n        at org.eclipse.jdt.internal.codeassist.CompletionEngine.complete\n(CompletionEngine.java:824)\n        at org.eclipse.jdt.internal.eval.EvaluationContext.complete\n(EvaluationContext.java:118)\n        at \norg.eclipse.jdt.internal.core.eval.EvaluationContextWrapper.codeComplete\n(EvaluationContextWrapper.java:87)\n        at \norg.eclipse.jdt.internal.debug.ui.snippeteditor.JavaSnippetEditor.codeComplete\n(JavaSnippetEditor.java:575)\n        at \norg.eclipse.jdt.internal.debug.ui.snippeteditor.JavaSnippetCompletionProcessor.c\nomputeCompletionProposals(JavaSnippetCompletionPr\n        at \norg.eclipse.jface.text.contentassist.ContentAssistant.computeCompletionProposals\n(ContentAssistant.java:1266)\n        at \norg.eclipse.jface.text.contentassist.CompletionProposalPopup.computeProposals\n(CompletionProposalPopup.java:132)\n        at org.eclipse.jface.text.contentassist.CompletionProposalPopup.access$3\n(CompletionProposalPopup.java:131)\n        at org.eclipse.jface.text.contentassist.CompletionProposalPopup$1.run\n(CompletionProposalPopup.java:93)\n        at org.eclipse.swt.custom.BusyIndicator.showWhile(BusyIndicator.java:66)\n        at \norg.eclipse.jface.text.contentassist.CompletionProposalPopup.showProposals\n(CompletionProposalPopup.java:88)\n        at \norg.eclipse.jface.text.contentassist.ContentAssistant.showPossibleCompletions\n(ContentAssistant.java:1200)\n        at org.eclipse.jface.text.source.SourceViewer.doOperation\n(SourceViewer.java:403)\n        at org.eclipse.ui.texteditor.TextOperationAction$1.run\n(TextOperationAction.java:119)\n        at org.eclipse.swt.custom.BusyIndicator.showWhile(BusyIndicator.java:66)\n        at org.eclipse.ui.texteditor.TextOperationAction.run\n(TextOperationAction.java:117)\n        at org.eclipse.ui.texteditor.RetargetTextEditorAction.run\n(RetargetTextEditorAction.java:137)\n        at org.eclipse.jface.action.Action.runWithEvent(Action.java:749)\n        at org.eclipse.ui.actions.RetargetAction.runWithEvent\n(RetargetAction.java:179)\n        at org.eclipse.jface.action.ActionContributionItem.handleWidgetSelection\n(ActionContributionItem.java:407)\n        at org.eclipse.jface.action.ActionContributionItem.handleWidgetEvent\n(ActionContributionItem.java:361)\n        at org.eclipse.jface.action.ActionContributionItem.access$0\n(ActionContributionItem.java:352)\n        at \norg.eclipse.jface.action.ActionContributionItem$ActionListener.handleEvent\n(ActionContributionItem.java:47)\n        at org.eclipse.swt.widgets.EventTable.sendEvent(EventTable.java:77)\n        at org.eclipse.swt.widgets.Widget.sendEvent(Widget.java:827)\n        at org.eclipse.swt.widgets.Display.runDeferredEvents(Display.java:1529)\n        at org.eclipse.swt.widgets.Display.readAndDispatch(Display.java:1291)\n        at org.eclipse.ui.internal.Workbench.runEventLoop(Workbench.java:1256)\n        at org.eclipse.ui.internal.Workbench.run(Workbench.java:1239)\n        at org.eclipse.core.internal.boot.InternalBootLoader.run\n(InternalBootLoader.java:775)\n        at org.eclipse.core.boot.BootLoader.run(BootLoader.java:462)\n        at java.lang.reflect.Method.invoke(Native Method)\n        at org.eclipse.core.launcher.Main.basicRun(Main.java:248)\n        at org.eclipse.core.launcher.Main.run(Main.java:698)\n        at org.eclipse.core.launcher.Main.main(Main.java:534)",
    "The problem still exists in 2.0.1 but does not exist in 2.1. In 2.1 no variable \nname is proposed at all.",
    "Still happens in I20030611\n",
    "*** Bug 68672 has been marked as a duplicate of this bug. ***",
    "This has been fixed long time ago.",
    "Reopening to close as WORKSFORME.",
    "."
  ],
  "commentCreationDates": [
    "2002-08-20T12:04:18+02:00",
    "2002-09-04T09:56:43+02:00",
    "2003-06-17T15:29:03+02:00",
    "2004-07-23T13:03:11+02:00",
    "2006-08-10T17:15:11+02:00",
    "2007-06-12T11:29:32+02:00",
    "2007-06-12T11:36:04+02:00"
  ],
  "traces": [
    {
      "exceptionType": "org.eclipse.jface.util.Assert$AssertionFailedException",
      "message": "Assertion failed:",
      "elements": [
        {
          "method": "org.eclipse.jface.util.Assert.isTrue",
          "source": "Assert.java:162"
        },
        {
          "method": "org.eclipse.jface.util.Assert.isTrue",
          "source": "Assert.java:148"
        },
        {
          "method": "org.eclipse.jdt.internal.ui.text.java.JavaCompletionProposal.\u003cinit\u003e",
          "source": "JavaCompletionProposal.java:58"
        },
        {
          "method": "org.eclipse.jdt.internal.ui.text.java.ResultCollector.createCompletion",
          "source": "ResultCollector.java:415"
        },
        {
          "method": "org.eclipse.jdt.internal.ui.text.java.ResultCollector.acceptVariableName",
          "source": "ResultCollector.java:286"
        },
        {
          "method": "org.eclipse.jdt.internal.core.CompletionRequestorWrapper.acceptVariableName",
          "source": "CompletionRequestorWrapper.java:306"
        },
        {
          "method": "org.eclipse.jdt.internal.eval.CodeSnippetToCuMapper$1.acceptVariableName",
          "source": "CodeSnippetToCuMapper.java:214"
        },
        {
          "method": "org.eclipse.jdt.internal.codeassist.CompletionEngine.findVariableName",
          "source": "CompletionEngine.java:2516"
        },
        {
          "method": "org.eclipse.jdt.internal.codeassist.CompletionEngine.findVariableNames",
          "source": "CompletionEngine.java:2533"
        },
        {
          "method": "org.eclipse.jdt.internal.codeassist.CompletionEngine.complete",
          "source": "CompletionEngine.java:639"
        },
        {
          "method": "org.eclipse.jdt.internal.codeassist.CompletionEngine.complete",
          "source": "CompletionEngine.java:824"
        },
        {
          "method": "org.eclipse.jdt.internal.eval.EvaluationContext.complete",
          "source": "EvaluationContext.java:118"
        },
        {
          "method": "org.eclipse.jdt.internal.core.eval.EvaluationContextWrapper.codeComplete",
          "source": "EvaluationContextWrapper.java:87"
        },
        {
          "method": "org.eclipse.jdt.internal.debug.ui.snippeteditor.JavaSnippetEditor.codeComplete",
          "source": "JavaSnippetEditor.java:575"
        }
      ],
      "number": 0,
      "commentIndex": 0,
      "bugId": "22565",
      "date": "2002-08-20T12:04:18+02:00",
      "product": "JDT",
      "component": "Text",
      "severity": "normal"
    }
  ],
  "groupId": "22565",
  "bugId": "22565",
  "date": "2002-08-20T12:04:18+02:00",
  "product": "JDT",
  "component": "Text",
  "severity": "normal"
}