{
  "comments": [
    "This bug was originally reported as a WSAD 4.03 defect (Eclipse 1.0) from a \ncustomer seeking a patch.  After some investigation it seems that this is a \nproblem in the eclipse platform involving the MultiPageEditorPart class.\n\nIf (or when) this problem is fixed, can someone tell me how I might provide \nthis fix to a customer?  Would this fix be available from the eclipse.org?\n\n\nThis problem is consistently reproduceable using eclipse 1.0.  The problem \ninvolves the MultiPageEditorPart and affects any editor that is implemented \nusing this class.  I\u0027ve reproduced this problem below using the Multi-Page \nEditor Example.  BTW ... this problem no longer occurs in eclipse 2.0 so \nhopefully one could reuse the fix.\n\nSteps to recreate : \n\n- create a Jave project with some arbitary Java files\n- create a file called Test.mpe in the Java project\n- open the file with \"Multi-Page Editor Example\" (keep the editor open)\n- attempt to export the project to a jar file\n- an \"Create of JAR failed - Invalid Thread acces\" message will result\n- note that if the editor is closed before performing the export, everything \nworks just fine\n\n\nThe following output is written to the .log file :\n\nLog: Tue Sep 10 16:44:04 EDT 2002\n4 org.eclipse.jdt.ui 566 Creation of JAR failed\norg.eclipse.swt.SWTException: Invalid thread access\n\tat org.eclipse.swt.SWT.error(SWT.java:1708)\n\tat org.eclipse.swt.SWT.error(SWT.java:1642)\n\tat org.eclipse.swt.widgets.Widget.error(Widget.java:368)\n\tat org.eclipse.swt.widgets.Widget.checkWidget(Widget.java(Compiled \nCode))\n\tat org.eclipse.swt.widgets.Widget.getData(Widget.java(Compiled Code))\n\tat org.eclipse.ui.part.MultiPageEditorPart.getEditor\n(MultiPageEditorPart.java:265)\n\tat org.eclipse.ui.part.MultiPageEditorPart.isDirty\n(MultiPageEditorPart.java:365)\n\tat org.eclipse.jdt.internal.ui.JavaPlugin.getDirtyEditors\n(JavaPlugin.java:154)\n\tat \norg.eclipse.jdt.internal.ui.jarpackager.JarFileExportOperation.preconditionsOK\n(JarFileExportOperation.java:455)\n\tat \norg.eclipse.jdt.internal.ui.jarpackager.JarFileExportOperation.singleRun\n(JarFileExportOperation.java:611)\n\tat org.eclipse.jdt.internal.ui.jarpackager.JarFileExportOperation.run\n(JarFileExportOperation.java:529)\n\tat org.eclipse.jface.operation.ModalContext$ModalContextThread.run\n(ModalContext.java:98)",
    "This is a dup of bug 12996.\n\nNot marking as a dup for now because I don\u0027t know what is the protocol in terms \nof sending bug fixes to customers.\nAdding KH to the CC list to comment on that.\n\n \n",
    "You need to persue this with the WSWB team. \n\n*** This bug has been marked as a duplicate of 12996 ***"
  ],
  "commentCreationDates": [
    "2002-09-10T23:09:00+02:00",
    "2002-09-17T17:03:58+02:00",
    "2002-09-17T18:12:49+02:00"
  ],
  "traces": [
    {
      "exceptionType": "org.eclipse.swt.SWTException",
      "message": "Invalid thread access",
      "elements": [
        {
          "method": "org.eclipse.swt.SWT.error",
          "source": "SWT.java:1708"
        },
        {
          "method": "org.eclipse.swt.SWT.error",
          "source": "SWT.java:1642"
        },
        {
          "method": "org.eclipse.swt.widgets.Widget.error",
          "source": "Widget.java:368"
        },
        {
          "method": "org.eclipse.swt.widgets.Widget.checkWidget",
          "source": "Widget.java(Compiled  Code)"
        },
        {
          "method": "org.eclipse.swt.widgets.Widget.getData",
          "source": "Widget.java(Compiled Code)"
        },
        {
          "method": "org.eclipse.ui.part.MultiPageEditorPart.getEditor",
          "source": "MultiPageEditorPart.java:265"
        },
        {
          "method": "org.eclipse.ui.part.MultiPageEditorPart.isDirty",
          "source": "MultiPageEditorPart.java:365"
        },
        {
          "method": "org.eclipse.jdt.internal.ui.JavaPlugin.getDirtyEditors",
          "source": "JavaPlugin.java:154"
        },
        {
          "method": "org.eclipse.jdt.internal.ui.jarpackager.JarFileExportOperation.preconditionsOK",
          "source": "JarFileExportOperation.java:455"
        },
        {
          "method": "org.eclipse.jdt.internal.ui.jarpackager.JarFileExportOperation.singleRun",
          "source": "JarFileExportOperation.java:611"
        },
        {
          "method": "org.eclipse.jdt.internal.ui.jarpackager.JarFileExportOperation.run",
          "source": "JarFileExportOperation.java:529"
        },
        {
          "method": "org.eclipse.jface.operation.ModalContext$ModalContextThread.run",
          "source": "ModalContext.java:98"
        }
      ],
      "number": 0,
      "commentIndex": 0,
      "bugId": "23390",
      "duplicateId": "12996",
      "date": "2002-09-10T23:09:00+02:00",
      "product": "Platform",
      "component": "UI",
      "severity": "normal"
    }
  ],
  "groupId": "12996",
  "bugId": "23390",
  "duplicateId": "12996",
  "date": "2002-09-10T23:09:00+02:00",
  "product": "Platform",
  "component": "UI",
  "severity": "normal"
}