{
  "comments": [
    "Build: 20021031\n\nI tried downloading \u0026 running the automated tests, and java.exe turfed during\nthe execution of the tests.  Here\u0027s what I got from ant for a walkback:\n\neclipse-test:\n     [echo] Running org.eclipse.jdt.debug.tests.AutomatedSuite\n     [java] org.eclipse.swt.SWTException: Failed to execute runnable (java.lang.\nIllegalArgumentException: Index out of bounds)\n     [java]     at org.eclipse.swt.SWT.error(SWT.java:2180)\n     [java]     at org.eclipse.swt.widgets.Synchronizer.runAsyncMessages(Synchro\nnizer.java:97)\n     [java]     at org.eclipse.swt.widgets.Display.runAsyncMessages(Display.java\n:1669)\n     [java]     at org.eclipse.swt.widgets.Display.readAndDispatch(Display.java:\n1414)\n     [java]     at org.eclipse.jdt.debug.tests.AutomatedSuite.run(AutomatedSuite\n.java:158)\n     [java]     at org.eclipse.test.EclipseTestRunner.run(EclipseTestRunner.java\n:307)\n     [java]     at org.eclipse.test.EclipseTestRunner.main(EclipseTestRunner.jav\na:186)\n     [java]     at org.eclipse.test.UITestApplication.runTests(UITestApplication\n.java:41)\n     [java]     at org.eclipse.test.UITestApplication.runEventLoop(UITestApplica\ntion.java:35)\n     [java]     at org.eclipse.ui.internal.Workbench.run(Workbench.java:1402)\n     [java]     at org.eclipse.core.internal.boot.InternalBootLoader.run(Interna\nlBootLoader.java:831)\n     [java]     at org.eclipse.core.boot.BootLoader.run(BootLoader.java:462)\n     [java]     at java.lang.reflect.Method.invoke(Native Method)\n     [java]     at org.eclipse.core.launcher.Main.basicRun(Main.java:247)\n     [java]     at org.eclipse.core.launcher.Main.run(Main.java:703)\n     [java]     at org.eclipse.core.launcher.Main.main(Main.java:539)\n     [java] *** Stack trace of contained exception ***\n     [java] java.lang.IllegalArgumentException: Index out of bounds\n     [java]     at org.eclipse.swt.SWT.error(SWT.java:2166)\n     [java]     at org.eclipse.swt.SWT.error(SWT.java:2110)\n     [java]     at org.eclipse.swt.custom.StyledText.setStyleRanges(StyledText.j\nava:7348)\n     [java]     at org.eclipse.debug.internal.ui.views.console.ConsoleViewer$1.r\nun(ConsoleViewer.java:220)\n     [java]     at org.eclipse.swt.widgets.RunnableLock.run(RunnableLock.java:31\n)\n     [java]     at org.eclipse.swt.widgets.Synchronizer.runAsyncMessages(Synchro\nnizer.java:94)\n     [java]     at org.eclipse.swt.widgets.Display.runAsyncMessages(Display.java\n:1669)\n     [java]     at org.eclipse.swt.widgets.Display.readAndDispatch(Display.java:\n1414)\n     [java]     at org.eclipse.jdt.debug.tests.AutomatedSuite.run(AutomatedSuite\n.java:158)\n     [java]     at org.eclipse.test.EclipseTestRunner.run(EclipseTestRunner.java\n:307)\n     [java]     at org.eclipse.test.EclipseTestRunner.main(EclipseTestRunner.jav\na:186)\n     [java]     at org.eclipse.test.UITestApplication.runTests(UITestApplication\n.java:41)\n     [java]     at org.eclipse.test.UITestApplication.runEventLoop(UITestApplica\ntion.java:35)\n     [java]     at org.eclipse.ui.internal.Workbench.run(Workbench.java:1402)\n     [java]     at org.eclipse.core.internal.boot.InternalBootLoader.run(Interna\nlBootLoader.java:831)\n     [java]     at org.eclipse.core.boot.BootLoader.run(BootLoader.java:462)\n     [java]     at java.lang.reflect.Method.invoke(Native Method)\n     [java]     at org.eclipse.core.launcher.Main.basicRun(Main.java:247)\n     [java]     at org.eclipse.core.launcher.Main.run(Main.java:703)\n     [java]     at org.eclipse.core.launcher.Main.main(Main.java:539)",
    "\n\n*** This bug has been marked as a duplicate of 25689 ***"
  ],
  "commentCreationDates": [
    "2002-11-04T20:09:44+01:00",
    "2002-11-04T20:40:57+01:00"
  ],
  "traces": [
    {
      "exceptionType": "IllegalArgumentException",
      "message": "Index out of bounds)      [java]",
      "elements": [
        {
          "method": "org.eclipse.swt.SWT.error",
          "source": "SWT.java:2180"
        }
      ],
      "number": 0,
      "commentIndex": 0,
      "bugId": "25697",
      "duplicateId": "25689",
      "date": "2002-11-04T20:09:44+01:00",
      "product": "JDT",
      "component": "Debug",
      "severity": "normal"
    },
    {
      "exceptionType": "java.lang.IllegalArgumentException",
      "message": "Index out of bounds      [java]",
      "elements": [
        {
          "method": "org.eclipse.swt.SWT.error",
          "source": "SWT.java:2166"
        }
      ],
      "number": 1,
      "commentIndex": 0,
      "bugId": "25697",
      "duplicateId": "25689",
      "date": "2002-11-04T20:09:44+01:00",
      "product": "JDT",
      "component": "Debug",
      "severity": "normal"
    }
  ],
  "groupId": "25689",
  "bugId": "25697",
  "duplicateId": "25689",
  "date": "2002-11-04T20:09:44+01:00",
  "product": "JDT",
  "component": "Debug",
  "severity": "normal"
}