{
  "comments": [
    "I had just imported a java src project\n(the org.eclipse.swt.examples_2.1.0).\nThen I clicked on one of the visual tree\ncontrols - a package icon in the tree display\nof the project.\nEclipse crashed.\n\nFollowing are the logs for \n\tcrashreporter, and\n\t.metadata/\n\nThis was on Mac OS 10.2.2\n\n\n\u003d\u003d\u003d\u003d\u003d\u003d\u003d\u003d\u003d\u003d\u003d\u003d\u003d\u003d\u003d\u003d\u003d\u003d\u003d\u003d\u003d\u003d\u003d\u003d\u003d\u003d\u003d\u003d\u003d\u003d\u003d\u003d\u003d\u003d\u003d\u003d\u003d\u003d\u003d\u003d\u003d\u003d\u003d\u003d\u003d\u003d\u003d\u003d\u003d\u003d\u003d\u003d\u003d\u003d\u003d\u003d\u003d\u003d\n\nDate/Time:  2002-11-26 12:00:50 -0700\nOS Version: 10.2.2 (Build 6F21)\nHost:       Alan-Hawrelaks-Computer.local.\n\nCommand:    Eclipse\nPID:        466\n\nException:  EXC_BAD_ACCESS (0x0001)\nCodes:      KERN_PROTECTION_FAILURE (0x0002) at 0x0000000c\n\nThread 0 Crashed:\n #0   0x929c650c in eh_rest_world_r10\n #1   0x92832ca8 in JVM_Clone\n #2   0x928357f8 in __floatdidf\n #3   0x9284f880 in JVM_IsInterface\n #4   0x9285e8d8 in JVM_FillInStackTrace\n #5   0x93dc0f60 in Java_java_lang_Throwable_fillInStackTrace\n #6   0x0222fd24 in 0x222fd24\n #7   0x0225567c in 0x225567c\n #8   0x022554f0 in 0x22554f0\n #9   0x023b1270 in 0x23b1270\n #10  0x023b0f70 in 0x23b0f70\n #11  0x023b10f0 in 0x23b10f0\n #12  0xa2843c38 in typeinfo name for std::bad_exception\n #13  0x92838bdc in JVM_CurrentTimeMillis\n #14  0x92891724 in JVM_MonitorNotifyAll\n #15  0x9287c17c in JVM_GetCPMethodModifiers\n #16  0x928a3a48 in JVM_GetClassContext\n #17  0x92899344 in JVM_Open\n #18  0x9297be0c in JVM_UnloadLibrary\n #19  0x02201934 in 0x2201934\n #20  0x022ef504 in 0x22ef504\n #21  0x022f0624 in 0x22f0624\n #22  0x022eb518 in 0x22eb518\n #23  0x023b37f4 in 0x23b37f4\n #24  0x023be2a0 in 0x23be2a0\n #25  0x023e6b20 in 0x23e6b20\n #26  0x023e6660 in 0x23e6660\n #27  0x021005cc in 0x21005cc\n #28  0x021005cc in 0x21005cc\n #29  0x021005cc in 0x21005cc\n #30  0x021007ac in 0x21007ac\n #31  0x021005cc in 0x21005cc\n #32  0x021005cc in 0x21005cc\n #33  0x021007ac in 0x21007ac\n #34  0x021005cc in 0x21005cc\n #35  0x021005cc in 0x21005cc\n #36  0x0210068c in 0x210068c\n #37  0x0210068c in 0x210068c\n #38  0x0210086c in 0x210086c\n #39  0x0235500c in 0x235500c\n #40  0x0239570c in 0x239570c\n #41  0x0210068c in 0x210068c\n #42  0x0210068c in 0x210068c\n #43  0x0210068c in 0x210068c\n #44  0x0210068c in 0x210068c\n #45  0x0235500c in 0x235500c\n #46  0x0239570c in 0x239570c\n #47  0x0238dffc in 0x238dffc\n #48  0x02394d60 in 0x2394d60\n #49  0x021005cc in 0x21005cc\n #50  0x0210068c in 0x210068c\n #51  0x021007ac in 0x21007ac\n #52  0x021005cc in 0x21005cc\n #53  0xa2843c38 in typeinfo name for std::bad_exception\n #54  0x92838bdc in JVM_CurrentTimeMillis\n #55  0x92872ed4 in JVM_GetCPClassNameUTF\n #56  0x92907430 in JVM_InvokeMethod\n #57  0x92906a90 in JVM_InvokeMethod\n #58  0x92906738 in JVM_InvokeMethod\n #59  0x02102668 in 0x2102668\n #60  0x021005cc in 0x21005cc\n #61  0x021005cc in 0x21005cc\n #62  0x021005cc in 0x21005cc\n #63  0xa2843c38 in typeinfo name for std::bad_exception\n #64  0x92838bdc in JVM_CurrentTimeMillis\n #65  0x92872ed4 in JVM_GetCPClassNameUTF\n #66  0x92907430 in JVM_InvokeMethod\n #67  0x92906a90 in JVM_InvokeMethod\n #68  0x92906738 in JVM_InvokeMethod\n #69  0x02102668 in 0x2102668\n #70  0x021005cc in 0x21005cc\n #71  0x0210068c in 0x210068c\n #72  0x0210068c in 0x210068c\n #73  0xa2843c38 in typeinfo name for std::bad_exception\n #74  0x92838bdc in JVM_CurrentTimeMillis\n #75  0x92872ed4 in JVM_GetCPClassNameUTF\n #76  0x9287a3b8 in JVM_GetCPMethodModifiers\n #77  0x92904790 in JVM_IsSupportedJNIVersion\n #78  0x92b22174 in JNIEnv_::CallStaticVoidMethod(_jclass*, _jmethodID*, ...)\n #79  0x92b111c0 in CallCarbonLibAppLaunch(JNIEnv_*, __CFDictionary const*, __CFArray const*)\n #80  0x92b12ce8 in launchJavaApplication\n #81  0x00001c54 in 0x1c54\n #82  0x00001ad4 in 0x1ad4\n\nThread 1:\n #0   0x90074168 in mach_msg_trap\n #1   0x900064b0 in mach_msg\n #2   0x928ec28c in JNI_CreateJavaVM_Impl\n #3   0x928ec224 in JNI_CreateJavaVM_Impl\n #4   0x928a51fc in JVM_GetClassMethodsCount\n #5   0x90021268 in _pthread_body\n\nThread 2:\n #0   0x90074168 in mach_msg_trap\n #1   0x900064b0 in mach_msg\n #2   0x9283de9c in JVM_NewInstance\n #3   0x9285eae4 in JVM_FillInStackTrace\n #4   0x928647a0 in JVM_Send\n #5   0x9290114c in JNI_CreateJavaVM_Impl\n #6   0x928a51fc in JVM_GetClassMethodsCount\n #7   0x90021268 in _pthread_body\n\nThread 3:\n #0   0x90074168 in mach_msg_trap\n #1   0x900064b0 in mach_msg\n #2   0x9283ddf4 in JVM_NewInstance\n #3   0x92845d80 in JVM_ArrayCopy\n #4   0x9285d620 in JVM_MonitorNotify\n #5   0x9285e2f8 in JVM_MonitorWait\n #6   0x02102668 in 0x2102668\n #7   0x0210068c in 0x210068c\n #8   0x0210068c in 0x210068c\n #9   0xa2843c38 in typeinfo name for std::bad_exception\n #10  0x92838bdc in JVM_CurrentTimeMillis\n #11  0x92878c28 in JVM_FindClassFromClass\n #12  0x92892c90 in JVM_IsSameClassPackage\n #13  0x9288cf70 in JVM_GetMethodIxExceptionTableEntry\n #14  0x928787a0 in JVM_FindClassFromClass\n #15  0x928a51fc in JVM_GetClassMethodsCount\n #16  0x90021268 in _pthread_body\n\nThread 4:\n #0   0x90074168 in mach_msg_trap\n #1   0x900064b0 in mach_msg\n #2   0x9283ddf4 in JVM_NewInstance\n #3   0x92845d80 in JVM_ArrayCopy\n #4   0x9285d620 in JVM_MonitorNotify\n #5   0x9285e2f8 in JVM_MonitorWait\n #6   0x02102668 in 0x2102668\n #7   0x0210068c in 0x210068c\n #8   0x021005cc in 0x21005cc\n #9   0x021005cc in 0x21005cc\n #10  0xa2843c38 in typeinfo name for std::bad_exception\n #11  0x92838bdc in JVM_CurrentTimeMillis\n #12  0x92878c28 in JVM_FindClassFromClass\n #13  0x92892c90 in JVM_IsSameClassPackage\n #14  0x9288cf70 in JVM_GetMethodIxExceptionTableEntry\n #15  0x928787a0 in JVM_FindClassFromClass\n #16  0x928a51fc in JVM_GetClassMethodsCount\n #17  0x90021268 in _pthread_body\n\nThread 5:\n #0   0x90074168 in mach_msg_trap\n #1   0x900064b0 in mach_msg\n #2   0x9283de9c in JVM_NewInstance\n #3   0x92844e18 in JVM_GetClassLoader\n #4   0x92844ba4 in JVM_GetClassLoader\n #5   0x928a51fc in JVM_GetClassMethodsCount\n #6   0x90021268 in _pthread_body\n\nThread 6:\n #0   0x90074168 in mach_msg_trap\n #1   0x900064b0 in mach_msg\n #2   0x9283ddf4 in JVM_NewInstance\n #3   0x9285eb40 in JVM_FillInStackTrace\n #4   0x92903300 in JVM_InitProperties\n #5   0x92903138 in JVM_InitProperties\n #6   0x928787a0 in JVM_FindClassFromClass\n #7   0x928a51fc in JVM_GetClassMethodsCount\n #8   0x90021268 in _pthread_body\n\nThread 7:\n #0   0x90074168 in mach_msg_trap\n #1   0x900064b0 in mach_msg\n #2   0x9283ddf4 in JVM_NewInstance\n #3   0x9285eb40 in JVM_FillInStackTrace\n #4   0x9288890c in JVM_StartThread\n #5   0x92876c10 in JVM_FindLoadedClass\n #6   0x928787a0 in JVM_FindClassFromClass\n #7   0x928a51fc in JVM_GetClassMethodsCount\n #8   0x90021268 in _pthread_body\n\nThread 8:\n #0   0x90074168 in mach_msg_trap\n #1   0x900064b0 in mach_msg\n #2   0xc00076cc in __ape_internal\n #3   0xc0000dd0 in __ape_agent\n #4   0x90021268 in _pthread_body\n\nThread 9:\n #0   0x90074168 in mach_msg_trap\n #1   0x900064b0 in mach_msg\n #2   0x9283ddf4 in JVM_NewInstance\n #3   0x92845d80 in JVM_ArrayCopy\n #4   0x9285d620 in JVM_MonitorNotify\n #5   0x9285e2f8 in JVM_MonitorWait\n #6   0x02102668 in 0x2102668\n #7   0x0210068c in 0x210068c\n #8   0x0210068c in 0x210068c\n #9   0x0210086c in 0x210086c\n #10  0xa2843c38 in typeinfo name for std::bad_exception\n #11  0x92838bdc in JVM_CurrentTimeMillis\n #12  0x92878c28 in JVM_FindClassFromClass\n #13  0x92892c90 in JVM_IsSameClassPackage\n #14  0x9288cf70 in JVM_GetMethodIxExceptionTableEntry\n #15  0x928787a0 in JVM_FindClassFromClass\n #16  0x928a51fc in JVM_GetClassMethodsCount\n #17  0x90021268 in _pthread_body\n\nThread 10:\n #0   0x90074168 in mach_msg_trap\n #1   0x900064b0 in mach_msg\n #2   0x9283de9c in JVM_NewInstance\n #3   0x92844d34 in JVM_GetClassLoader\n #4   0x9290a3a4 in JVM_Sleep\n #5   0x02102668 in 0x2102668\n #6   0x0210068c in 0x210068c\n #7   0x0210086c in 0x210086c\n #8   0xa2843c38 in typeinfo name for std::bad_exception\n #9   0x92838bdc in JVM_CurrentTimeMillis\n #10  0x92878c28 in JVM_FindClassFromClass\n #11  0x92892c90 in JVM_IsSameClassPackage\n #12  0x9288cf70 in JVM_GetMethodIxExceptionTableEntry\n #13  0x928787a0 in JVM_FindClassFromClass\n #14  0x928a51fc in JVM_GetClassMethodsCount\n #15  0x90021268 in _pthread_body\n\nThread 11:\n #0   0x90074168 in mach_msg_trap\n #1   0x900064b0 in mach_msg\n #2   0x9283de9c in JVM_NewInstance\n #3   0x92845d80 in JVM_ArrayCopy\n #4   0x9285d620 in JVM_MonitorNotify\n #5   0x9285e2f8 in JVM_MonitorWait\n #6   0x02102668 in 0x2102668\n #7   0x0210068c in 0x210068c\n #8   0xa2843c38 in typeinfo name for std::bad_exception\n #9   0x92838bdc in JVM_CurrentTimeMillis\n #10  0x92878c28 in JVM_FindClassFromClass\n #11  0x92892c90 in JVM_IsSameClassPackage\n #12  0x9288cf70 in JVM_GetMethodIxExceptionTableEntry\n #13  0x928787a0 in JVM_FindClassFromClass\n #14  0x928a51fc in JVM_GetClassMethodsCount\n #15  0x90021268 in _pthread_body\n\nPPC Thread State:\n  srr0: 0x929c650c srr1: 0x0000f030                vrsave: 0x00000000\n   xer: 0x20000000   lr: 0x92831b5c  ctr: 0x929c6504   mq: 0x00000000\n    r0: 0xffff8000   r1: 0xbfffd5b0   r2: 0x00000000   r3: 0x023b3590\n    r4: 0x6c643520   r5: 0x00000009   r6: 0x00010800   r7: 0x00000001\n    r8: 0xa2837ef0   r9: 0x00000000  r10: 0xa2837ef0  r11: 0x02200000\n   r12: 0x929c6504  r13: 0x000e9ed0  r14: 0xa283515c  r15: 0xa2830658\n   r16: 0xa2831c64  r17: 0xa284dadc  r18: 0xa284dae8  r19: 0x000ea4ec\n   r20: 0xa284dae4  r21: 0xbfffd6d0  r22: 0x000ea4e4  r23: 0x62a9ba18\n   r24: 0x00000003  r25: 0x00000003  r26: 0x000ea4d4  r27: 0x62a9bab8\n   r28: 0x00000000  r29: 0xbfffd6d0  r30: 0x023b3590  r31: 0x92831aac\n\n\u003d\u003d\u003d\u003d\u003d\u003d\u003d\u003d\u003d\u003d\u003d\u003d\u003d\u003d\u003d\u003d\u003d\u003d\u003d\u003d\u003d\u003d\u003d\u003d\u003d\u003d\u003d\u003d\u003d\u003d\u003d\u003d\u003d\u003d\u003d\u003d\u003d\u003d\u003d\u003d\u003d\u003d\u003d\u003d\u003d\u003d\u003d\u003d\u003d\u003d\u003d\u003d\u003d\u003d\u003d\u003d\u003d\u003d\n\n\n!SESSION Nov 18, 2002 17:12:49.377 ---------------------------------------------\njava.version\u003d1.3.1\njava.vendor\u003dApple Computer, Inc.\nBootLoader constants: OS\u003dmacosx, ARCH\u003dppc, WS\u003dcarbon, NL\u003den_US\nCommand-line arguments: -noupdate -consoleLog -showlocation -os macosx -ws carbon -install file:/Volumes/Mac9.2/eclipse_Nov15/Eclipse_2.0.app/Contents/Resources/Java/\n!ENTRY org.eclipse.ui.workbench 4 2 Nov 18, 2002 17:12:49.379\n!MESSAGE Problems occurred when invoking code from plug-in: \"org.eclipse.ui.workbench\".\n!STACK 0\norg.eclipse.swt.SWTException: Widget is disposed\n\tat org.eclipse.swt.SWT.error(SWT.java:2180)\n\tat org.eclipse.swt.SWT.error(SWT.java:2110)\n\tat org.eclipse.swt.widgets.Widget.error(Widget.java:299)\n\tat org.eclipse.swt.widgets.Menu.getDisplay(Menu.java:335)\n\tat org.eclipse.swt.widgets.Widget.isValidThread(Widget.java:458)\n\tat org.eclipse.swt.widgets.Widget.checkWidget(Widget.java:229)\n\tat org.eclipse.swt.widgets.Menu.getItems(Menu.java:415)\n\tat org.eclipse.swt.widgets.Menu.releaseWidget(Menu.java:688)\n\tat org.eclipse.swt.widgets.MenuItem.releaseWidget(MenuItem.java:402)\n\tat org.eclipse.swt.widgets.Menu.releaseWidget(Menu.java:692)\n\tat org.eclipse.swt.widgets.MenuItem.releaseWidget(MenuItem.java:402)\n\tat org.eclipse.swt.widgets.Menu.releaseWidget(Menu.java:692)\n\tat org.eclipse.swt.widgets.Decorations.releaseWidget(Decorations.java:393)\n\tat org.eclipse.swt.widgets.Shell.releaseWidget(Shell.java:1213)\n\tat org.eclipse.swt.widgets.Widget.dispose(Widget.java:289)\n\tat org.eclipse.swt.widgets.Shell.dispose(Shell.java:725)\n\tat org.eclipse.jface.window.Window.close(Window.java:223)\n\tat org.eclipse.jface.window.ApplicationWindow.close(ApplicationWindow.java:186)\n\tat org.eclipse.ui.internal.WorkbenchWindow.hardClose(WorkbenchWindow.java:908)\n\tat org.eclipse.ui.internal.WorkbenchWindow.busyClose(WorkbenchWindow.java:337)\n\tat org.eclipse.ui.internal.WorkbenchWindow.access$3(WorkbenchWindow.java:326)\n\tat org.eclipse.ui.internal.WorkbenchWindow$2.run(WorkbenchWindow.java:382)\n\tat org.eclipse.swt.custom.BusyIndicator.showWhile(BusyIndicator.java:65)\n\tat org.eclipse.ui.internal.WorkbenchWindow.close(WorkbenchWindow.java:380)\n\tat org.eclipse.jface.window.WindowManager.close(WindowManager.java:102)\n\tat org.eclipse.ui.internal.Workbench$3.run(Workbench.java:253)\n\tat org.eclipse.core.internal.runtime.InternalPlatform.run(InternalPlatform.java:839)\n\tat org.eclipse.core.runtime.Platform.run(Platform.java:413)\n\tat org.eclipse.ui.internal.Workbench.busyClose(Workbench.java:250)\n\tat org.eclipse.ui.internal.Workbench.access$5(Workbench.java:207)\n\tat org.eclipse.ui.internal.Workbench$5.run(Workbench.java:383)\n\tat org.eclipse.swt.custom.BusyIndicator.showWhile(BusyIndicator.java:65)\n\tat org.eclipse.ui.internal.Workbench.close(Workbench.java:381)\n\tat org.eclipse.ui.internal.Workbench.close(Workbench.java:373)\n\tat org.eclipse.ui.internal.Workbench.close(Workbench.java:367)\n\tat org.eclipse.ui.internal.Workbench$13.handleEvent(Workbench.java:1405)\n\tat org.eclipse.swt.widgets.EventTable.sendEvent(EventTable.java:77)\n\tat org.eclipse.swt.widgets.Display.sendEvent(Display.java:1301)\n\tat org.eclipse.swt.widgets.Display.close(Display.java:338)\n\tat org.eclipse.swt.widgets.Display.handleApplicationCallback(Display.java:2065)\n\tat org.eclipse.swt.internal.carbon.OS.SendEventToEventTarget(Native Method)\n\tat org.eclipse.swt.widgets.Display.readAndDispatch(Display.java:1118)\n\tat org.eclipse.ui.internal.Workbench.runEventLoop(Workbench.java:1435)\n\tat org.eclipse.ui.internal.Workbench.run(Workbench.java:1418)\n\tat org.eclipse.core.internal.boot.InternalBootLoader.run(InternalBootLoader.java:831)\n\tat org.eclipse.core.boot.BootLoader.run(BootLoader.java:462)\n\tat java.lang.reflect.Method.invoke(Native Method)\n\tat org.eclipse.core.launcher.Main.basicRun(Main.java:247)\n\tat org.eclipse.core.launcher.Main.run(Main.java:703)\n\tat org.eclipse.core.launcher.Main.main(Main.java:539)\n\tat java.lang.reflect.Method.invoke(Native Method)\n\tat com.apple.buckyball.app.LaunchRunner.run(LaunchRunner.java:82)\n\tat com.apple.buckyball.app.LaunchRunner.callMain(LaunchRunner.java:44)\n\tat com.apple.buckyball.app.CarbonLibApp.launch(CarbonLibApp.java:67)\n!SESSION Nov 19, 2002 17:01:40.853 ---------------------------------------------\njava.version\u003d1.3.1\njava.vendor\u003dApple Computer, Inc.\nBootLoader constants: OS\u003dmacosx, ARCH\u003dppc, WS\u003dcarbon, NL\u003den_US\nCommand-line arguments: -noupdate -consoleLog -showlocation -os macosx -ws carbon -install file:/Volumes/Mac9.2/eclipse_Nov15/Eclipse_2.0.app/Contents/Resources/Java/\n!ENTRY org.eclipse.core.resources 1 1 Nov 19, 2002 17:01:40.856\n!MESSAGE Could not load library: libcore_2_0_5.jnilib.  This library provides platform-specific optimizations for certain file-system operations.  This library is not present on all platforms, so this may not be an error.  The resources plugin will safely fall back to using java.io.File functionality.\n!SESSION Nov 21, 2002 16:25:10.562 ---------------------------------------------\njava.version\u003d1.3.1\njava.vendor\u003dApple Computer, Inc.\nBootLoader constants: OS\u003dmacosx, ARCH\u003dppc, WS\u003dcarbon, NL\u003den_US\nCommand-line arguments: -noupdate -consoleLog -showlocation -os macosx -ws carbon -install file:/Volumes/Mac9.2/eclipse_Nov15/Eclipse_2.0.app/Contents/Resources/Java/\n!ENTRY org.eclipse.core.resources 1 1 Nov 21, 2002 16:25:10.564\n!MESSAGE Could not load library: libcore_2_0_5.jnilib.  This library provides platform-specific optimizations for certain file-system operations.  This library is not present on all platforms, so this may not be an error.  The resources plugin will safely fall back to using java.io.File functionality.\n!SESSION Nov 21, 2002 16:27:33.503 ---------------------------------------------\njava.version\u003d1.3.1\njava.vendor\u003dApple Computer, Inc.\nBootLoader constants: OS\u003dmacosx, ARCH\u003dppc, WS\u003dcarbon, NL\u003den_US\nCommand-line arguments: -noupdate -consoleLog -showlocation -os macosx -ws carbon -install file:/Volumes/Mac9.2/eclipse_Nov15/Eclipse_2.0.app/Contents/Resources/Java/\n!ENTRY org.eclipse.core.resources 1 1 Nov 21, 2002 16:27:33.507\n!MESSAGE Could not load library: libcore_2_0_5.jnilib.  This library provides platform-specific optimizations for certain file-system operations.  This library is not present on all platforms, so this may not be an error.  The resources plugin will safely fall back to using java.io.File functionality.\n!SESSION Nov 21, 2002 16:32:53.29 ----------------------------------------------\njava.version\u003d1.3.1\njava.vendor\u003dApple Computer, Inc.\nBootLoader constants: OS\u003dmacosx, ARCH\u003dppc, WS\u003dcarbon, NL\u003den_US\nCommand-line arguments: -noupdate -consoleLog -showlocation -os macosx -ws carbon -install file:/Volumes/Mac9.2/eclipse_Nov15/Eclipse_2.0.app/Contents/Resources/Java/\n!ENTRY org.eclipse.core.resources 1 1 Nov 21, 2002 16:32:53.32\n!MESSAGE Could not load library: libcore_2_0_5.jnilib.  This library provides platform-specific optimizations for certain file-system operations.  This library is not present on all platforms, so this may not be an error.  The resources plugin will safely fall back to using java.io.File functionality.\n!SESSION Nov 26, 2002 09:57:31.977 ---------------------------------------------\njava.version\u003d1.3.1\njava.vendor\u003dApple Computer, Inc.\nBootLoader constants: OS\u003dmacosx, ARCH\u003dppc, WS\u003dcarbon, NL\u003den_US\nCommand-line arguments: -noupdate -consoleLog -showlocation -os macosx -ws carbon -install file:/Volumes/Mac9.2/eclipse_Nov15/Eclipse_2.0.app/Contents/Resources/Java/\n!ENTRY org.eclipse.core.resources 1 1 Nov 26, 2002 09:57:31.983\n!MESSAGE Could not load library: libcore_2_0_5.jnilib.  This library provides platform-specific optimizations for certain file-system operations.  This library is not present on all platforms, so this may not be an error.  The resources plugin will safely fall back to using java.io.File functionality.\n!SESSION Nov 26, 2002 10:02:15.186 ---------------------------------------------\njava.version\u003d1.3.1\njava.vendor\u003dApple Computer, Inc.\nBootLoader constants: OS\u003dmacosx, ARCH\u003dppc, WS\u003dcarbon, NL\u003den_US\nCommand-line arguments: -noupdate -consoleLog -showlocation -os macosx -ws carbon -install file:/Volumes/Mac9.2/eclipse_Nov15/Eclipse_2.0.app/Contents/Resources/Java/\n!ENTRY org.eclipse.core.resources 1 1 Nov 26, 2002 10:02:15.198\n!MESSAGE Could not load library: libcore_2_0_5.jnilib.  This library provides platform-specific optimizations for certain file-system operations.  This library is not present on all platforms, so this may not be an error.  The resources plugin will safely fall back to using java.io.File functionality.\n!SESSION Nov 26, 2002 11:06:22.587 ---------------------------------------------\njava.version\u003d1.3.1\njava.vendor\u003dApple Computer, Inc.\nBootLoader constants: OS\u003dmacosx, ARCH\u003dppc, WS\u003dcarbon, NL\u003den_US\nCommand-line arguments: -noupdate -consoleLog -showlocation -os macosx -ws carbon -install file:/Volumes/Mac9.2/eclipse_Nov15/Eclipse_2.0.app/Contents/Resources/Java/\n!ENTRY org.eclipse.core.resources 1 1 Nov 26, 2002 11:06:22.592\n!MESSAGE Could not load library: libcore_2_0_5.jnilib.  This library provides platform-specific optimizations for certain file-system operations.  This library is not present on all platforms, so this may not be an error.  The resources plugin will safely fall back to using java.io.File functionality.\n\n\u003d\u003d\u003d\u003d\u003d\u003d\u003d\u003d\u003d\u003d\u003d\u003d\u003d\u003d\u003d\u003d\u003d\u003d\u003d\u003d\u003d\u003d\u003d\u003d\u003d\u003d\u003d\u003d\u003d\u003d\u003d\u003d\u003d\u003d\u003d\u003d\u003d\u003d\u003d\u003d\u003d\u003d\u003d\u003d\u003d\u003d\u003d\u003d\u003d\u003d\u003d\u003d\u003d\u003d\u003d\u003d\u003d\u003d",
    "Alan,\nWhich version of Eclipse were you running?\nCan you reproduce the crash by repeating the steps you described?\nDoes it happen with other projects you import?\nThanks,\nChris",
    "Closing PR for now, on the assumption that this is caused by a low memory \nsituation. This is consistent with the VM crashing after the OS requesting the \napp to shutdown (see Display.close in stack trace).\nAlan, please reopen if you can repeat the problem and not run into an out of \nmemory/out of space situation.\n\nWas sent to my own mail box. Pasted to the bug report.\n\nChristophe,\n\nIt is the Nov 15 build of Eclipse, v. 2.1, Build id: 200211151436.\n\nI am attempting to replicate, but crashed before I got there. Currently \npursuing the idea that 200 MB of free space on the boot drive, with 256 \nMB of RAM, on Mac OS X may have contributed to the problem. But will \ntry and replicate.\n\nThis was the first import I had tried for awhile. Since it was a stock \nexample off of the eclipse.org website, I assumed it would go smooth \nand it did not.\n\nThanks,\n\nAlan Hawrelak"
  ],
  "commentCreationDates": [
    "2002-11-26T18:58:06+01:00",
    "2002-11-27T14:19:51+01:00",
    "2002-11-27T22:16:05+01:00"
  ],
  "traces": [
    {
      "exceptionType": "org.eclipse.swt.SWTException",
      "message": "Widget is disposed",
      "elements": [
        {
          "method": "org.eclipse.swt.SWT.error",
          "source": "SWT.java:2180"
        },
        {
          "method": "org.eclipse.swt.SWT.error",
          "source": "SWT.java:2110"
        },
        {
          "method": "org.eclipse.swt.widgets.Widget.error",
          "source": "Widget.java:299"
        },
        {
          "method": "org.eclipse.swt.widgets.Menu.getDisplay",
          "source": "Menu.java:335"
        },
        {
          "method": "org.eclipse.swt.widgets.Widget.isValidThread",
          "source": "Widget.java:458"
        },
        {
          "method": "org.eclipse.swt.widgets.Widget.checkWidget",
          "source": "Widget.java:229"
        },
        {
          "method": "org.eclipse.swt.widgets.Menu.getItems",
          "source": "Menu.java:415"
        },
        {
          "method": "org.eclipse.swt.widgets.Menu.releaseWidget",
          "source": "Menu.java:688"
        },
        {
          "method": "org.eclipse.swt.widgets.MenuItem.releaseWidget",
          "source": "MenuItem.java:402"
        },
        {
          "method": "org.eclipse.swt.widgets.Menu.releaseWidget",
          "source": "Menu.java:692"
        },
        {
          "method": "org.eclipse.swt.widgets.MenuItem.releaseWidget",
          "source": "MenuItem.java:402"
        },
        {
          "method": "org.eclipse.swt.widgets.Menu.releaseWidget",
          "source": "Menu.java:692"
        },
        {
          "method": "org.eclipse.swt.widgets.Decorations.releaseWidget",
          "source": "Decorations.java:393"
        },
        {
          "method": "org.eclipse.swt.widgets.Shell.releaseWidget",
          "source": "Shell.java:1213"
        },
        {
          "method": "org.eclipse.swt.widgets.Widget.dispose",
          "source": "Widget.java:289"
        },
        {
          "method": "org.eclipse.swt.widgets.Shell.dispose",
          "source": "Shell.java:725"
        },
        {
          "method": "org.eclipse.jface.window.Window.close",
          "source": "Window.java:223"
        },
        {
          "method": "org.eclipse.jface.window.ApplicationWindow.close",
          "source": "ApplicationWindow.java:186"
        },
        {
          "method": "org.eclipse.ui.internal.WorkbenchWindow.hardClose",
          "source": "WorkbenchWindow.java:908"
        },
        {
          "method": "org.eclipse.ui.internal.WorkbenchWindow.busyClose",
          "source": "WorkbenchWindow.java:337"
        },
        {
          "method": "org.eclipse.ui.internal.WorkbenchWindow.access$3",
          "source": "WorkbenchWindow.java:326"
        },
        {
          "method": "org.eclipse.ui.internal.WorkbenchWindow$2.run",
          "source": "WorkbenchWindow.java:382"
        },
        {
          "method": "org.eclipse.swt.custom.BusyIndicator.showWhile",
          "source": "BusyIndicator.java:65"
        },
        {
          "method": "org.eclipse.ui.internal.WorkbenchWindow.close",
          "source": "WorkbenchWindow.java:380"
        },
        {
          "method": "org.eclipse.jface.window.WindowManager.close",
          "source": "WindowManager.java:102"
        },
        {
          "method": "org.eclipse.ui.internal.Workbench$3.run",
          "source": "Workbench.java:253"
        },
        {
          "method": "org.eclipse.core.internal.runtime.InternalPlatform.run",
          "source": "InternalPlatform.java:839"
        },
        {
          "method": "org.eclipse.core.runtime.Platform.run",
          "source": "Platform.java:413"
        },
        {
          "method": "org.eclipse.ui.internal.Workbench.busyClose",
          "source": "Workbench.java:250"
        },
        {
          "method": "org.eclipse.ui.internal.Workbench.access$5",
          "source": "Workbench.java:207"
        },
        {
          "method": "org.eclipse.ui.internal.Workbench$5.run",
          "source": "Workbench.java:383"
        },
        {
          "method": "org.eclipse.swt.custom.BusyIndicator.showWhile",
          "source": "BusyIndicator.java:65"
        },
        {
          "method": "org.eclipse.ui.internal.Workbench.close",
          "source": "Workbench.java:381"
        },
        {
          "method": "org.eclipse.ui.internal.Workbench.close",
          "source": "Workbench.java:373"
        },
        {
          "method": "org.eclipse.ui.internal.Workbench.close",
          "source": "Workbench.java:367"
        },
        {
          "method": "org.eclipse.ui.internal.Workbench$13.handleEvent",
          "source": "Workbench.java:1405"
        },
        {
          "method": "org.eclipse.swt.widgets.EventTable.sendEvent",
          "source": "EventTable.java:77"
        },
        {
          "method": "org.eclipse.swt.widgets.Display.sendEvent",
          "source": "Display.java:1301"
        },
        {
          "method": "org.eclipse.swt.widgets.Display.close",
          "source": "Display.java:338"
        },
        {
          "method": "org.eclipse.swt.widgets.Display.handleApplicationCallback",
          "source": "Display.java:2065"
        },
        {
          "method": "org.eclipse.swt.internal.carbon.OS.SendEventToEventTarget",
          "source": "Native Method"
        },
        {
          "method": "org.eclipse.swt.widgets.Display.readAndDispatch",
          "source": "Display.java:1118"
        },
        {
          "method": "org.eclipse.ui.internal.Workbench.runEventLoop",
          "source": "Workbench.java:1435"
        },
        {
          "method": "org.eclipse.ui.internal.Workbench.run",
          "source": "Workbench.java:1418"
        },
        {
          "method": "org.eclipse.core.internal.boot.InternalBootLoader.run",
          "source": "InternalBootLoader.java:831"
        },
        {
          "method": "org.eclipse.core.boot.BootLoader.run",
          "source": "BootLoader.java:462"
        },
        {
          "method": "java.lang.reflect.Method.invoke",
          "source": "Native Method"
        },
        {
          "method": "org.eclipse.core.launcher.Main.basicRun",
          "source": "Main.java:247"
        },
        {
          "method": "org.eclipse.core.launcher.Main.run",
          "source": "Main.java:703"
        },
        {
          "method": "org.eclipse.core.launcher.Main.main",
          "source": "Main.java:539"
        },
        {
          "method": "java.lang.reflect.Method.invoke",
          "source": "Native Method"
        },
        {
          "method": "com.apple.buckyball.app.LaunchRunner.run",
          "source": "LaunchRunner.java:82"
        },
        {
          "method": "com.apple.buckyball.app.LaunchRunner.callMain",
          "source": "LaunchRunner.java:44"
        },
        {
          "method": "com.apple.buckyball.app.CarbonLibApp.launch",
          "source": "CarbonLibApp.java:67"
        }
      ],
      "number": 0,
      "commentIndex": 0,
      "bugId": "27176",
      "date": "2002-11-26T18:58:06+01:00",
      "product": "Platform",
      "component": "SWT",
      "severity": "critical"
    }
  ],
  "groupId": "27176",
  "bugId": "27176",
  "date": "2002-11-26T18:58:06+01:00",
  "product": "Platform",
  "component": "SWT",
  "severity": "critical"
}