{
  "comments": [
    "In using the menu command Import File -\u003e Import ... ,\nto attempt to import the source files for a java\nproject (the org.eclipse.swt.examples_2.1.0)\nEclipse started the import but crashed.\n\nFollowing are the logs for \n\tcrashreporter, and\n\t.metadata/\n\nThis was on Mac OS 10.2.2\n\u003d\u003d\u003d\u003d\u003d\u003d\u003d\u003d\u003d\u003d\u003d\u003d\u003d\u003d\u003d\u003d\u003d\u003d\u003d\u003d\u003d\u003d\u003d\u003d\u003d\u003d\u003d\u003d\u003d\u003d\u003d\u003d\u003d\u003d\u003d\u003d\u003d\u003d\u003d\u003d\u003d\u003d\u003d\u003d\u003d\u003d\u003d\u003d\u003d\u003d\u003d\u003d\u003d\u003d\u003d\n\n\nDate/Time:  2002-11-26 10:56:19 -0700\nOS Version: 10.2.2 (Build 6F21)\nHost:       Alan-Hawrelaks-Computer.local.\n\nCommand:    Eclipse\nPID:        443\n\nException:  EXC_BAD_ACCESS (0x0001)\nCodes:      KERN_PROTECTION_FAILURE (0x0002) at 0x00000034\n\nThread 0:\n #0   0x90074168 in mach_msg_trap\n #1   0x900064b0 in mach_msg\n #2   0x901490a8 in __CFRunLoopRun\n #3   0x9018157c in CFRunLoopRunSpecific\n #4   0x92ba34cc in RunCurrentEventLoopInMode\n #5   0x92bb32f4 in ReceiveNextEventCommon\n #6   0x92c0499c in ReceiveNextEventInMode\n #7   0x01f6dfa0 in Java_org_eclipse_swt_internal_carbon_OS_ReceiveNextEvent\n #8   0x0234ed30 in 0x234ed30\n #9   0x0237a66c in 0x237a66c\n #10  0x021005cc in 0x21005cc\n #11  0x0210068c in 0x210068c\n #12  0x0210068c in 0x210068c\n #13  0x0210086c in 0x210086c\n #14  0x021005cc in 0x21005cc\n #15  0x021005cc in 0x21005cc\n #16  0x021005cc in 0x21005cc\n #17  0x021005cc in 0x21005cc\n #18  0x021007ac in 0x21007ac\n #19  0x0210068c in 0x210068c\n #20  0x0210068c in 0x210068c\n #21  0x0210086c in 0x210086c\n #22  0x0230f40c in 0x230f40c\n #23  0x0210068c in 0x210068c\n #24  0x0235cdbc in 0x235cdbc\n #25  0x0235dce0 in 0x235dce0\n #26  0x0237730c in 0x237730c\n #27  0x0210068c in 0x210068c\n #28  0x021005cc in 0x21005cc\n #29  0x0210068c in 0x210068c\n #30  0x0210086c in 0x210086c\n #31  0x0210068c in 0x210068c\n #32  0x0210068c in 0x210068c\n #33  0x0210068c in 0x210068c\n #34  0x0230f40c in 0x230f40c\n #35  0x0210068c in 0x210068c\n #36  0x0235cdbc in 0x235cdbc\n #37  0x0235dce0 in 0x235dce0\n #38  0x021005cc in 0x21005cc\n #39  0x0210068c in 0x210068c\n #40  0x021007ac in 0x21007ac\n #41  0x021005cc in 0x21005cc\n #42  0xa2843c38 in typeinfo name for std::bad_exception\n #43  0x92838bdc in JVM_CurrentTimeMillis\n #44  0x92872ed4 in JVM_GetCPClassNameUTF\n #45  0x92907430 in JVM_InvokeMethod\n #46  0x92906a90 in JVM_InvokeMethod\n #47  0x92906738 in JVM_InvokeMethod\n #48  0x02102668 in 0x2102668\n #49  0x021005cc in 0x21005cc\n #50  0x021005cc in 0x21005cc\n #51  0x021005cc in 0x21005cc\n #52  0xa2843c38 in typeinfo name for std::bad_exception\n #53  0x92838bdc in JVM_CurrentTimeMillis\n #54  0x92872ed4 in JVM_GetCPClassNameUTF\n #55  0x92907430 in JVM_InvokeMethod\n #56  0x92906a90 in JVM_InvokeMethod\n #57  0x92906738 in JVM_InvokeMethod\n #58  0x02102668 in 0x2102668\n #59  0x021005cc in 0x21005cc\n #60  0x0210068c in 0x210068c\n #61  0x0210068c in 0x210068c\n #62  0xa2843c38 in typeinfo name for std::bad_exception\n #63  0x92838bdc in JVM_CurrentTimeMillis\n #64  0x92872ed4 in JVM_GetCPClassNameUTF\n #65  0x9287a3b8 in JVM_GetCPMethodModifiers\n #66  0x92904790 in JVM_IsSupportedJNIVersion\n #67  0x92b22174 in JNIEnv_::CallStaticVoidMethod(_jclass*, _jmethodID*, ...)\n #68  0x92b111c0 in CallCarbonLibAppLaunch(JNIEnv_*, __CFDictionary const*, __CFArray const*)\n #69  0x92b12ce8 in launchJavaApplication\n #70  0x00001c54 in 0x1c54\n #71  0x00001ad4 in 0x1ad4\n\nThread 1:\n #0   0x90074168 in mach_msg_trap\n #1   0x900064b0 in mach_msg\n #2   0x928ec28c in JNI_CreateJavaVM_Impl\n #3   0x928ec224 in JNI_CreateJavaVM_Impl\n #4   0x928a51fc in JVM_GetClassMethodsCount\n #5   0x90021268 in _pthread_body\n\nThread 2 Crashed:\n #0   0x92833854 in __fixunsdfdi\n #1   0x9285c248 in JVM_GetCPMethodNameUTF\n #2   0x928917f4 in JVM_MonitorNotifyAll\n #3   0x92886e6c in JVM_SetThreadPriority\n #4   0x92864964 in JVM_Send\n #5   0x9290114c in JNI_CreateJavaVM_Impl\n #6   0x928a51fc in JVM_GetClassMethodsCount\n #7   0x90021268 in _pthread_body\n\nThread 3:\n #0   0x90074168 in mach_msg_trap\n #1   0x900064b0 in mach_msg\n #2   0x9283ddf4 in JVM_NewInstance\n #3   0x92845d80 in JVM_ArrayCopy\n #4   0x9285d620 in JVM_MonitorNotify\n #5   0x9285e2f8 in JVM_MonitorWait\n #6   0x02102668 in 0x2102668\n #7   0x0210068c in 0x210068c\n #8   0x0210068c in 0x210068c\n #9   0xa2843c38 in typeinfo name for std::bad_exception\n #10  0x92838bdc in JVM_CurrentTimeMillis\n #11  0x92878c28 in JVM_FindClassFromClass\n #12  0x92892c90 in JVM_IsSameClassPackage\n #13  0x9288cf70 in JVM_GetMethodIxExceptionTableEntry\n #14  0x928787a0 in JVM_FindClassFromClass\n #15  0x928a51fc in JVM_GetClassMethodsCount\n #16  0x90021268 in _pthread_body\n\nThread 4:\n #0   0x90074168 in mach_msg_trap\n #1   0x900064b0 in mach_msg\n #2   0x9283ddf4 in JVM_NewInstance\n #3   0x92845d80 in JVM_ArrayCopy\n #4   0x9285d620 in JVM_MonitorNotify\n #5   0x9285e2f8 in JVM_MonitorWait\n #6   0x02102668 in 0x2102668\n #7   0x0210068c in 0x210068c\n #8   0x021005cc in 0x21005cc\n #9   0x021005cc in 0x21005cc\n #10  0xa2843c38 in typeinfo name for std::bad_exception\n #11  0x92838bdc in JVM_CurrentTimeMillis\n #12  0x92878c28 in JVM_FindClassFromClass\n #13  0x92892c90 in JVM_IsSameClassPackage\n #14  0x9288cf70 in JVM_GetMethodIxExceptionTableEntry\n #15  0x928787a0 in JVM_FindClassFromClass\n #16  0x928a51fc in JVM_GetClassMethodsCount\n #17  0x90021268 in _pthread_body\n\nThread 5:\n #0   0x90074168 in mach_msg_trap\n #1   0x900064b0 in mach_msg\n #2   0x9283de9c in JVM_NewInstance\n #3   0x92844e18 in JVM_GetClassLoader\n #4   0x92844ba4 in JVM_GetClassLoader\n #5   0x928a51fc in JVM_GetClassMethodsCount\n #6   0x90021268 in _pthread_body\n\nThread 6:\n #0   0x90074168 in mach_msg_trap\n #1   0x900064b0 in mach_msg\n #2   0x9283ddf4 in JVM_NewInstance\n #3   0x9285eb40 in JVM_FillInStackTrace\n #4   0x92903300 in JVM_InitProperties\n #5   0x92903138 in JVM_InitProperties\n #6   0x928787a0 in JVM_FindClassFromClass\n #7   0x928a51fc in JVM_GetClassMethodsCount\n #8   0x90021268 in _pthread_body\n\nThread 7:\n #0   0x90074168 in mach_msg_trap\n #1   0x900064b0 in mach_msg\n #2   0x9283ddf4 in JVM_NewInstance\n #3   0x9285eb40 in JVM_FillInStackTrace\n #4   0x9288890c in JVM_StartThread\n #5   0x92876c10 in JVM_FindLoadedClass\n #6   0x928787a0 in JVM_FindClassFromClass\n #7   0x928a51fc in JVM_GetClassMethodsCount\n #8   0x90021268 in _pthread_body\n\nThread 8:\n #0   0x90074168 in mach_msg_trap\n #1   0x900064b0 in mach_msg\n #2   0xc00076cc in __ape_internal\n #3   0xc0000dd0 in __ape_agent\n #4   0x90021268 in _pthread_body\n\nThread 9:\n #0   0x90074168 in mach_msg_trap\n #1   0x900064b0 in mach_msg\n #2   0x9283ddf4 in JVM_NewInstance\n #3   0x92845d80 in JVM_ArrayCopy\n #4   0x9285d620 in JVM_MonitorNotify\n #5   0x9285e2f8 in JVM_MonitorWait\n #6   0x02102668 in 0x2102668\n #7   0x0210068c in 0x210068c\n #8   0x0210068c in 0x210068c\n #9   0x0210086c in 0x210086c\n #10  0xa2843c38 in typeinfo name for std::bad_exception\n #11  0x92838bdc in JVM_CurrentTimeMillis\n #12  0x92878c28 in JVM_FindClassFromClass\n #13  0x92892c90 in JVM_IsSameClassPackage\n #14  0x9288cf70 in JVM_GetMethodIxExceptionTableEntry\n #15  0x928787a0 in JVM_FindClassFromClass\n #16  0x928a51fc in JVM_GetClassMethodsCount\n #17  0x90021268 in _pthread_body\n\nThread 10:\n #0   0x90074168 in mach_msg_trap\n #1   0x900064b0 in mach_msg\n #2   0x9283ddf4 in JVM_NewInstance\n #3   0x9284ee30 in JVM_GetCPMethodClassNameUTF\n #4   0x92861b2c in JVM_Send\n #5   0x92844df4 in JVM_GetClassLoader\n #6   0x9290a3a4 in JVM_Sleep\n #7   0x02102668 in 0x2102668\n #8   0x0210068c in 0x210068c\n #9   0x0210086c in 0x210086c\n #10  0xa2843c38 in typeinfo name for std::bad_exception\n #11  0x92838bdc in JVM_CurrentTimeMillis\n #12  0x92878c28 in JVM_FindClassFromClass\n #13  0x92892c90 in JVM_IsSameClassPackage\n #14  0x9288cf70 in JVM_GetMethodIxExceptionTableEntry\n #15  0x928787a0 in JVM_FindClassFromClass\n #16  0x928a51fc in JVM_GetClassMethodsCount\n #17  0x90021268 in _pthread_body\n\nThread 11:\n #0   0x90074168 in mach_msg_trap\n #1   0x900064b0 in mach_msg\n #2   0x9283ddf4 in JVM_NewInstance\n #3   0x9284ee30 in JVM_GetCPMethodClassNameUTF\n #4   0x92861b2c in JVM_Send\n #5   0x92845e54 in JVM_ArrayCopy\n #6   0x9285d620 in JVM_MonitorNotify\n #7   0x9285e2f8 in JVM_MonitorWait\n #8   0x02102668 in 0x2102668\n #9   0x0210068c in 0x210068c\n #10  0xa2843c38 in typeinfo name for std::bad_exception\n #11  0x92838bdc in JVM_CurrentTimeMillis\n #12  0x92878c28 in JVM_FindClassFromClass\n #13  0x92892c90 in JVM_IsSameClassPackage\n #14  0x9288cf70 in JVM_GetMethodIxExceptionTableEntry\n #15  0x928787a0 in JVM_FindClassFromClass\n #16  0x928a51fc in JVM_GetClassMethodsCount\n #17  0x90021268 in _pthread_body\n\nThread 12:\n #0   0x90074168 in mach_msg_trap\n #1   0x900064b0 in mach_msg\n #2   0x9283ddf4 in JVM_NewInstance\n #3   0x9284ee30 in JVM_GetCPMethodClassNameUTF\n #4   0x92861a94 in JVM_Send\n #5   0x9285eb14 in JVM_FillInStackTrace\n #6   0x92868468 in JVM_DoPrivileged\n #7   0x9288e0e0 in JVM_GetMethodIxExceptionTableEntry\n #8   0x92883e80 in JVM_DefineClass\n #9   0x92849a00 in __moddi3\n #10  0x928af2cc in JVM_IsNaN\n #11  0x02200c90 in 0x2200c90\n #12  0x023acfd0 in 0x23acfd0\n #13  0x0210068c in 0x210068c\n #14  0x021005cc in 0x21005cc\n #15  0x0210068c in 0x210068c\n #16  0x021005cc in 0x21005cc\n #17  0x0210068c in 0x210068c\n #18  0x0210068c in 0x210068c\n #19  0x02326254 in 0x2326254\n #20  0x02358cb8 in 0x2358cb8\n #21  0x023abba8 in 0x23abba8\n #22  0x023ede48 in 0x23ede48\n #23  0x023ec168 in 0x23ec168\n #24  0x0210068c in 0x210068c\n #25  0x0210068c in 0x210068c\n #26  0x0210086c in 0x210086c\n #27  0x0210068c in 0x210068c\n #28  0x0210068c in 0x210068c\n #29  0x0210068c in 0x210068c\n #30  0x021005cc in 0x21005cc\n #31  0x0210068c in 0x210068c\n #32  0x021005cc in 0x21005cc\n #33  0x0235a4dc in 0x235a4dc\n #34  0x0210068c in 0x210068c\n #35  0x0210068c in 0x210068c\n #36  0x0210068c in 0x210068c\n #37  0x0210068c in 0x210068c\n #38  0x0210068c in 0x210068c\n #39  0x0235a4dc in 0x235a4dc\n #40  0x0210068c in 0x210068c\n #41  0x0210068c in 0x210068c\n #42  0x0210068c in 0x210068c\n #43  0x0210068c in 0x210068c\n #44  0x0210068c in 0x210068c\n #45  0x0210086c in 0x210086c\n #46  0x0210086c in 0x210086c\n #47  0xa2843c38 in typeinfo name for std::bad_exception\n #48  0x92838bdc in JVM_CurrentTimeMillis\n #49  0x92878c28 in JVM_FindClassFromClass\n #50  0x92892c90 in JVM_IsSameClassPackage\n #51  0x9288cf70 in JVM_GetMethodIxExceptionTableEntry\n #52  0x928787a0 in JVM_FindClassFromClass\n #53  0x928a51fc in JVM_GetClassMethodsCount\n #54  0x90021268 in _pthread_body\n\nPPC Thread State:\n  srr0: 0x92833854 srr1: 0x0200f030                vrsave: 0x00000000\n   xer: 0x00000000   lr: 0x928338d0  ctr: 0x92841c10   mq: 0x00000000\n    r0: 0x63f1e0d8   r1: 0xf0101a80   r2: 0x00000010   r3: 0x00000008\n    r4: 0x000093ed   r5: 0x63efe428   r6: 0x63efe400   r7: 0x000093f3\n    r8: 0x000093f2   r9: 0x00000000  r10: 0x928338d0  r11: 0x000093ec\n   r12: 0x92841c10  r13: 0xa282bd1c  r14: 0xa282bd1c  r15: 0xf0101b90\n   r16: 0xa28320f8  r17: 0x00000000  r18: 0x01b80000  r19: 0xa282bd1c\n   r20: 0xf0101b60  r21: 0xa282bd1c  r22: 0xa282bd1c  r23: 0xa282bd1c\n   r24: 0xf070cafc  r25: 0xa284dae4  r26: 0x000ecb90  r27: 0x63e89e30\n   r28: 0x000ecbb0  r29: 0x63efe428  r30: 0x63efe428  r31: 0x9285bd1c\n\n\u003d\u003d\u003d\u003d\u003d\u003d\u003d\u003d\u003d\u003d\u003d\u003d\u003d\u003d\u003d\u003d\u003d\u003d\u003d\u003d\u003d\u003d\u003d\u003d\u003d\u003d\u003d\u003d\u003d\u003d\u003d\u003d\u003d\u003d\u003d\u003d\u003d\u003d\u003d\u003d\u003d\u003d\u003d\u003d\u003d\u003d\u003d\u003d\u003d\u003d\u003d\u003d\u003d\u003d\u003d\n\n!SESSION Nov 18, 2002 17:12:49.377 ---------------------------------------------\njava.version\u003d1.3.1\njava.vendor\u003dApple Computer, Inc.\nBootLoader constants: OS\u003dmacosx, ARCH\u003dppc, WS\u003dcarbon, NL\u003den_US\nCommand-line arguments: -noupdate -consoleLog -showlocation -os macosx -ws carbon -install file:/Volumes/Mac9.2/eclipse_Nov15/Eclipse_2.0.app/Contents/Resources/Java/\n!ENTRY org.eclipse.ui.workbench 4 2 Nov 18, 2002 17:12:49.379\n!MESSAGE Problems occurred when invoking code from plug-in: \"org.eclipse.ui.workbench\".\n!STACK 0\norg.eclipse.swt.SWTException: Widget is disposed\n\tat org.eclipse.swt.SWT.error(SWT.java:2180)\n\tat org.eclipse.swt.SWT.error(SWT.java:2110)\n\tat org.eclipse.swt.widgets.Widget.error(Widget.java:299)\n\tat org.eclipse.swt.widgets.Menu.getDisplay(Menu.java:335)\n\tat org.eclipse.swt.widgets.Widget.isValidThread(Widget.java:458)\n\tat org.eclipse.swt.widgets.Widget.checkWidget(Widget.java:229)\n\tat org.eclipse.swt.widgets.Menu.getItems(Menu.java:415)\n\tat org.eclipse.swt.widgets.Menu.releaseWidget(Menu.java:688)\n\tat org.eclipse.swt.widgets.MenuItem.releaseWidget(MenuItem.java:402)\n\tat org.eclipse.swt.widgets.Menu.releaseWidget(Menu.java:692)\n\tat org.eclipse.swt.widgets.MenuItem.releaseWidget(MenuItem.java:402)\n\tat org.eclipse.swt.widgets.Menu.releaseWidget(Menu.java:692)\n\tat org.eclipse.swt.widgets.Decorations.releaseWidget(Decorations.java:393)\n\tat org.eclipse.swt.widgets.Shell.releaseWidget(Shell.java:1213)\n\tat org.eclipse.swt.widgets.Widget.dispose(Widget.java:289)\n\tat org.eclipse.swt.widgets.Shell.dispose(Shell.java:725)\n\tat org.eclipse.jface.window.Window.close(Window.java:223)\n\tat org.eclipse.jface.window.ApplicationWindow.close(ApplicationWindow.java:186)\n\tat org.eclipse.ui.internal.WorkbenchWindow.hardClose(WorkbenchWindow.java:908)\n\tat org.eclipse.ui.internal.WorkbenchWindow.busyClose(WorkbenchWindow.java:337)\n\tat org.eclipse.ui.internal.WorkbenchWindow.access$3(WorkbenchWindow.java:326)\n\tat org.eclipse.ui.internal.WorkbenchWindow$2.run(WorkbenchWindow.java:382)\n\tat org.eclipse.swt.custom.BusyIndicator.showWhile(BusyIndicator.java:65)\n\tat org.eclipse.ui.internal.WorkbenchWindow.close(WorkbenchWindow.java:380)\n\tat org.eclipse.jface.window.WindowManager.close(WindowManager.java:102)\n\tat org.eclipse.ui.internal.Workbench$3.run(Workbench.java:253)\n\tat org.eclipse.core.internal.runtime.InternalPlatform.run(InternalPlatform.java:839)\n\tat org.eclipse.core.runtime.Platform.run(Platform.java:413)\n\tat org.eclipse.ui.internal.Workbench.busyClose(Workbench.java:250)\n\tat org.eclipse.ui.internal.Workbench.access$5(Workbench.java:207)\n\tat org.eclipse.ui.internal.Workbench$5.run(Workbench.java:383)\n\tat org.eclipse.swt.custom.BusyIndicator.showWhile(BusyIndicator.java:65)\n\tat org.eclipse.ui.internal.Workbench.close(Workbench.java:381)\n\tat org.eclipse.ui.internal.Workbench.close(Workbench.java:373)\n\tat org.eclipse.ui.internal.Workbench.close(Workbench.java:367)\n\tat org.eclipse.ui.internal.Workbench$13.handleEvent(Workbench.java:1405)\n\tat org.eclipse.swt.widgets.EventTable.sendEvent(EventTable.java:77)\n\tat org.eclipse.swt.widgets.Display.sendEvent(Display.java:1301)\n\tat org.eclipse.swt.widgets.Display.close(Display.java:338)\n\tat org.eclipse.swt.widgets.Display.handleApplicationCallback(Display.java:2065)\n\tat org.eclipse.swt.internal.carbon.OS.SendEventToEventTarget(Native Method)\n\tat org.eclipse.swt.widgets.Display.readAndDispatch(Display.java:1118)\n\tat org.eclipse.ui.internal.Workbench.runEventLoop(Workbench.java:1435)\n\tat org.eclipse.ui.internal.Workbench.run(Workbench.java:1418)\n\tat org.eclipse.core.internal.boot.InternalBootLoader.run(InternalBootLoader.java:831)\n\tat org.eclipse.core.boot.BootLoader.run(BootLoader.java:462)\n\tat java.lang.reflect.Method.invoke(Native Method)\n\tat org.eclipse.core.launcher.Main.basicRun(Main.java:247)\n\tat org.eclipse.core.launcher.Main.run(Main.java:703)\n\tat org.eclipse.core.launcher.Main.main(Main.java:539)\n\tat java.lang.reflect.Method.invoke(Native Method)\n\tat com.apple.buckyball.app.LaunchRunner.run(LaunchRunner.java:82)\n\tat com.apple.buckyball.app.LaunchRunner.callMain(LaunchRunner.java:44)\n\tat com.apple.buckyball.app.CarbonLibApp.launch(CarbonLibApp.java:67)\n!SESSION Nov 19, 2002 17:01:40.853 ---------------------------------------------\njava.version\u003d1.3.1\njava.vendor\u003dApple Computer, Inc.\nBootLoader constants: OS\u003dmacosx, ARCH\u003dppc, WS\u003dcarbon, NL\u003den_US\nCommand-line arguments: -noupdate -consoleLog -showlocation -os macosx -ws carbon -install file:/Volumes/Mac9.2/eclipse_Nov15/Eclipse_2.0.app/Contents/Resources/Java/\n!ENTRY org.eclipse.core.resources 1 1 Nov 19, 2002 17:01:40.856\n!MESSAGE Could not load library: libcore_2_0_5.jnilib.  This library provides platform-specific optimizations for certain file-system operations.  This library is not present on all platforms, so this may not be an error.  The resources plugin will safely fall back to using java.io.File functionality.\n!SESSION Nov 21, 2002 16:25:10.562 ---------------------------------------------\njava.version\u003d1.3.1\njava.vendor\u003dApple Computer, Inc.\nBootLoader constants: OS\u003dmacosx, ARCH\u003dppc, WS\u003dcarbon, NL\u003den_US\nCommand-line arguments: -noupdate -consoleLog -showlocation -os macosx -ws carbon -install file:/Volumes/Mac9.2/eclipse_Nov15/Eclipse_2.0.app/Contents/Resources/Java/\n!ENTRY org.eclipse.core.resources 1 1 Nov 21, 2002 16:25:10.564\n!MESSAGE Could not load library: libcore_2_0_5.jnilib.  This library provides platform-specific optimizations for certain file-system operations.  This library is not present on all platforms, so this may not be an error.  The resources plugin will safely fall back to using java.io.File functionality.\n!SESSION Nov 21, 2002 16:27:33.503 ---------------------------------------------\njava.version\u003d1.3.1\njava.vendor\u003dApple Computer, Inc.\nBootLoader constants: OS\u003dmacosx, ARCH\u003dppc, WS\u003dcarbon, NL\u003den_US\nCommand-line arguments: -noupdate -consoleLog -showlocation -os macosx -ws carbon -install file:/Volumes/Mac9.2/eclipse_Nov15/Eclipse_2.0.app/Contents/Resources/Java/\n!ENTRY org.eclipse.core.resources 1 1 Nov 21, 2002 16:27:33.507\n!MESSAGE Could not load library: libcore_2_0_5.jnilib.  This library provides platform-specific optimizations for certain file-system operations.  This library is not present on all platforms, so this may not be an error.  The resources plugin will safely fall back to using java.io.File functionality.\n!SESSION Nov 21, 2002 16:32:53.29 ----------------------------------------------\njava.version\u003d1.3.1\njava.vendor\u003dApple Computer, Inc.\nBootLoader constants: OS\u003dmacosx, ARCH\u003dppc, WS\u003dcarbon, NL\u003den_US\nCommand-line arguments: -noupdate -consoleLog -showlocation -os macosx -ws carbon -install file:/Volumes/Mac9.2/eclipse_Nov15/Eclipse_2.0.app/Contents/Resources/Java/\n!ENTRY org.eclipse.core.resources 1 1 Nov 21, 2002 16:32:53.32\n!MESSAGE Could not load library: libcore_2_0_5.jnilib.  This library provides platform-specific optimizations for certain file-system operations.  This library is not present on all platforms, so this may not be an error.  The resources plugin will safely fall back to using java.io.File functionality.\n!SESSION Nov 26, 2002 09:57:31.977 ---------------------------------------------\njava.version\u003d1.3.1\njava.vendor\u003dApple Computer, Inc.\nBootLoader constants: OS\u003dmacosx, ARCH\u003dppc, WS\u003dcarbon, NL\u003den_US\nCommand-line arguments: -noupdate -consoleLog -showlocation -os macosx -ws carbon -install file:/Volumes/Mac9.2/eclipse_Nov15/Eclipse_2.0.app/Contents/Resources/Java/\n!ENTRY org.eclipse.core.resources 1 1 Nov 26, 2002 09:57:31.983\n!MESSAGE Could not load library: libcore_2_0_5.jnilib.  This library provides platform-specific optimizations for certain file-system operations.  This library is not present on all platforms, so this may not be an error.  The resources plugin will safely fall back to using java.io.File functionality.\n!SESSION Nov 26, 2002 10:02:15.186 ---------------------------------------------\njava.version\u003d1.3.1\njava.vendor\u003dApple Computer, Inc.\nBootLoader constants: OS\u003dmacosx, ARCH\u003dppc, WS\u003dcarbon, NL\u003den_US\nCommand-line arguments: -noupdate -consoleLog -showlocation -os macosx -ws carbon -install file:/Volumes/Mac9.2/eclipse_Nov15/Eclipse_2.0.app/Contents/Resources/Java/\n!ENTRY org.eclipse.core.resources 1 1 Nov 26, 2002 10:02:15.198\n!MESSAGE Could not load library: libcore_2_0_5.jnilib.  This library provides platform-specific optimizations for certain file-system operations.  This library is not present on all platforms, so this may not be an error.  The resources plugin will safely fall back to using java.io.File functionality.\n\n\n\u003d\u003d\u003d\u003d\u003d\u003d\u003d\u003d\u003d\u003d\u003d\u003d\u003d\u003d\u003d\u003d\u003d\u003d\u003d\u003d\u003d\u003d\u003d\u003d\u003d\u003d\u003d\u003d\u003d\u003d\u003d\u003d\u003d\u003d\u003d\u003d\u003d\u003d\u003d\u003d\u003d\u003d\u003d\u003d\u003d\u003d\u003d\u003d\u003d\u003d\u003d\u003d\u003d\u003d\u003d",
    "This bug is believed to be due to a shortage of memory (too little disc space for virtual memory to operate properly) on the testing machine."
  ],
  "commentCreationDates": [
    "2002-11-26T17:59:27+01:00",
    "2002-11-28T18:07:30+01:00"
  ],
  "traces": [
    {
      "exceptionType": "org.eclipse.swt.SWTException",
      "message": "Widget is disposed",
      "elements": [
        {
          "method": "org.eclipse.swt.SWT.error",
          "source": "SWT.java:2180"
        },
        {
          "method": "org.eclipse.swt.SWT.error",
          "source": "SWT.java:2110"
        },
        {
          "method": "org.eclipse.swt.widgets.Widget.error",
          "source": "Widget.java:299"
        },
        {
          "method": "org.eclipse.swt.widgets.Menu.getDisplay",
          "source": "Menu.java:335"
        },
        {
          "method": "org.eclipse.swt.widgets.Widget.isValidThread",
          "source": "Widget.java:458"
        },
        {
          "method": "org.eclipse.swt.widgets.Widget.checkWidget",
          "source": "Widget.java:229"
        },
        {
          "method": "org.eclipse.swt.widgets.Menu.getItems",
          "source": "Menu.java:415"
        },
        {
          "method": "org.eclipse.swt.widgets.Menu.releaseWidget",
          "source": "Menu.java:688"
        },
        {
          "method": "org.eclipse.swt.widgets.MenuItem.releaseWidget",
          "source": "MenuItem.java:402"
        },
        {
          "method": "org.eclipse.swt.widgets.Menu.releaseWidget",
          "source": "Menu.java:692"
        },
        {
          "method": "org.eclipse.swt.widgets.MenuItem.releaseWidget",
          "source": "MenuItem.java:402"
        },
        {
          "method": "org.eclipse.swt.widgets.Menu.releaseWidget",
          "source": "Menu.java:692"
        },
        {
          "method": "org.eclipse.swt.widgets.Decorations.releaseWidget",
          "source": "Decorations.java:393"
        },
        {
          "method": "org.eclipse.swt.widgets.Shell.releaseWidget",
          "source": "Shell.java:1213"
        },
        {
          "method": "org.eclipse.swt.widgets.Widget.dispose",
          "source": "Widget.java:289"
        },
        {
          "method": "org.eclipse.swt.widgets.Shell.dispose",
          "source": "Shell.java:725"
        },
        {
          "method": "org.eclipse.jface.window.Window.close",
          "source": "Window.java:223"
        },
        {
          "method": "org.eclipse.jface.window.ApplicationWindow.close",
          "source": "ApplicationWindow.java:186"
        },
        {
          "method": "org.eclipse.ui.internal.WorkbenchWindow.hardClose",
          "source": "WorkbenchWindow.java:908"
        },
        {
          "method": "org.eclipse.ui.internal.WorkbenchWindow.busyClose",
          "source": "WorkbenchWindow.java:337"
        },
        {
          "method": "org.eclipse.ui.internal.WorkbenchWindow.access$3",
          "source": "WorkbenchWindow.java:326"
        },
        {
          "method": "org.eclipse.ui.internal.WorkbenchWindow$2.run",
          "source": "WorkbenchWindow.java:382"
        },
        {
          "method": "org.eclipse.swt.custom.BusyIndicator.showWhile",
          "source": "BusyIndicator.java:65"
        },
        {
          "method": "org.eclipse.ui.internal.WorkbenchWindow.close",
          "source": "WorkbenchWindow.java:380"
        },
        {
          "method": "org.eclipse.jface.window.WindowManager.close",
          "source": "WindowManager.java:102"
        },
        {
          "method": "org.eclipse.ui.internal.Workbench$3.run",
          "source": "Workbench.java:253"
        },
        {
          "method": "org.eclipse.core.internal.runtime.InternalPlatform.run",
          "source": "InternalPlatform.java:839"
        },
        {
          "method": "org.eclipse.core.runtime.Platform.run",
          "source": "Platform.java:413"
        },
        {
          "method": "org.eclipse.ui.internal.Workbench.busyClose",
          "source": "Workbench.java:250"
        },
        {
          "method": "org.eclipse.ui.internal.Workbench.access$5",
          "source": "Workbench.java:207"
        },
        {
          "method": "org.eclipse.ui.internal.Workbench$5.run",
          "source": "Workbench.java:383"
        },
        {
          "method": "org.eclipse.swt.custom.BusyIndicator.showWhile",
          "source": "BusyIndicator.java:65"
        },
        {
          "method": "org.eclipse.ui.internal.Workbench.close",
          "source": "Workbench.java:381"
        },
        {
          "method": "org.eclipse.ui.internal.Workbench.close",
          "source": "Workbench.java:373"
        },
        {
          "method": "org.eclipse.ui.internal.Workbench.close",
          "source": "Workbench.java:367"
        },
        {
          "method": "org.eclipse.ui.internal.Workbench$13.handleEvent",
          "source": "Workbench.java:1405"
        },
        {
          "method": "org.eclipse.swt.widgets.EventTable.sendEvent",
          "source": "EventTable.java:77"
        },
        {
          "method": "org.eclipse.swt.widgets.Display.sendEvent",
          "source": "Display.java:1301"
        },
        {
          "method": "org.eclipse.swt.widgets.Display.close",
          "source": "Display.java:338"
        },
        {
          "method": "org.eclipse.swt.widgets.Display.handleApplicationCallback",
          "source": "Display.java:2065"
        },
        {
          "method": "org.eclipse.swt.internal.carbon.OS.SendEventToEventTarget",
          "source": "Native Method"
        },
        {
          "method": "org.eclipse.swt.widgets.Display.readAndDispatch",
          "source": "Display.java:1118"
        },
        {
          "method": "org.eclipse.ui.internal.Workbench.runEventLoop",
          "source": "Workbench.java:1435"
        },
        {
          "method": "org.eclipse.ui.internal.Workbench.run",
          "source": "Workbench.java:1418"
        },
        {
          "method": "org.eclipse.core.internal.boot.InternalBootLoader.run",
          "source": "InternalBootLoader.java:831"
        },
        {
          "method": "org.eclipse.core.boot.BootLoader.run",
          "source": "BootLoader.java:462"
        },
        {
          "method": "java.lang.reflect.Method.invoke",
          "source": "Native Method"
        },
        {
          "method": "org.eclipse.core.launcher.Main.basicRun",
          "source": "Main.java:247"
        },
        {
          "method": "org.eclipse.core.launcher.Main.run",
          "source": "Main.java:703"
        },
        {
          "method": "org.eclipse.core.launcher.Main.main",
          "source": "Main.java:539"
        },
        {
          "method": "java.lang.reflect.Method.invoke",
          "source": "Native Method"
        },
        {
          "method": "com.apple.buckyball.app.LaunchRunner.run",
          "source": "LaunchRunner.java:82"
        },
        {
          "method": "com.apple.buckyball.app.LaunchRunner.callMain",
          "source": "LaunchRunner.java:44"
        },
        {
          "method": "com.apple.buckyball.app.CarbonLibApp.launch",
          "source": "CarbonLibApp.java:67"
        }
      ],
      "number": 0,
      "commentIndex": 0,
      "bugId": "27170",
      "date": "2002-11-26T17:59:27+01:00",
      "product": "Platform",
      "component": "UI",
      "severity": "critical"
    }
  ],
  "groupId": "27170",
  "bugId": "27170",
  "date": "2002-11-26T17:59:27+01:00",
  "product": "Platform",
  "component": "UI",
  "severity": "critical"
}