{
  "comments": [
    "Internal Error occurred checking out as project from CVS using an Italian locale\n\nVersion: 2.0.1\t\t(I believe this is wrong, we are built on 2.0.2)\nBuild id: 200211071448\n\n\nThe following information comes from an original defect opened against WSADIE\nduring our translation verification tests (TVT).\n\n\nMachine Name: tvtz221a (Italian win2k Machine)\n\nDescription:\n1. Open CVS Repository View\n2. Right click on the view, select New \u003e Repository Location\n3. Fill in valid data on Add CVS Repository Wizard\n4. On CVS Repository View expand the repository location and \"HEAD\"\n5. Right click on a project and select Check out as project.\n\nA generic error comes up: \"Internal error occurred checking out the files\".\n\nTester: Arturo Zitani\n\nThe following exceptions were in the .log file\n\njava.lang.IllegalArgumentException: Illegal pattern character \u0027t\u0027\n       at java.text.SimpleDateFormat.subFormat(SimpleDateFormat.java:491)\n       at java.text.SimpleDateFormat.format(SimpleDateFormat.java(Compiled \nCode))\n       at java.text.DateFormat.format(DateFormat.java:301)\n       at \norg.eclipse.team.internal.ccvs.ui.Console$ConsoleListener.commandCompleted\n(Console.java:414)\n       at \norg.eclipse.team.internal.ccvs.core.client.Command.notifyConsoleOnCompletion\n(Command.java:340)\n       at org.eclipse.team.internal.ccvs.core.client.Command.access$2\n(Command.java:337)\n       at org.eclipse.team.internal.ccvs.core.client.Command$2.run\n(Command.java:328)\n       at org.eclipse.team.internal.ccvs.core.resources.EclipseFolder$2.run\n(EclipseFolder.java:277)\n       at org.eclipse.core.internal.resources.Workspace.run(Workspace.java:1378)\n       at org.eclipse.team.internal.ccvs.core.resources.EclipseFolder.run\n(EclipseFolder.java:270)\n       at org.eclipse.team.internal.ccvs.core.client.Command.execute\n(Command.java:333)\n       at org.eclipse.team.internal.ccvs.core.CVSProvider$1.run\n(CVSProvider.java:272)\n       at org.eclipse.core.internal.resources.Workspace.run(Workspace.java:1378)\n       at org.eclipse.team.internal.ccvs.core.CVSProvider.checkout\n(CVSProvider.java:300)\n       at \norg.eclipse.team.internal.ccvs.ui.actions.AddToWorkspaceAction$1.execute\n(AddToWorkspaceAction.java:86)\n       at org.eclipse.ui.actions.WorkspaceModifyOperation$1.run\n(WorkspaceModifyOperation.java:64)\n       at org.eclipse.core.internal.resources.Workspace.run(Workspace.java:1378)\n       at org.eclipse.ui.actions.WorkspaceModifyOperation.run\n(WorkspaceModifyOperation.java:78)\n       at org.eclipse.jface.operation.ModalContext$ModalContextThread.run\n(ModalContext.java:98)\n!ENTRY org.eclipse.team.ui 4 1 dic 09, 2002 11:01:55.78\n!MESSAGE Si ? verificato un errore interno.\n!STACK 0\njava.lang.IllegalArgumentException: Illegal pattern character \u0027t\u0027\n       at java.text.SimpleDateFormat.subFormat(SimpleDateFormat.java:491)\n       at java.text.SimpleDateFormat.format(SimpleDateFormat.java(Compiled \nCode))\n       at java.text.DateFormat.format(DateFormat.java:301)\n       at \norg.eclipse.team.internal.ccvs.ui.Console$ConsoleListener.commandCompleted\n(Console.java:414)\n       at \norg.eclipse.team.internal.ccvs.core.client.Command.notifyConsoleOnCompletion\n(Command.java:340)\n       at org.eclipse.team.internal.ccvs.core.client.Command.access$2\n(Command.java:337)\n       at org.eclipse.team.internal.ccvs.core.client.Command$2.run\n(Command.java:328)\n       at org.eclipse.team.internal.ccvs.core.resources.EclipseFolder$2.run\n(EclipseFolder.java:277)\n       at org.eclipse.core.internal.resources.Workspace.run(Workspace.java:1378)\n       at org.eclipse.team.internal.ccvs.core.resources.EclipseFolder.run\n(EclipseFolder.java:270)\n       at org.eclipse.team.internal.ccvs.core.client.Command.execute\n(Command.java:333)\n       at org.eclipse.team.internal.ccvs.core.CVSProvider$1.run\n(CVSProvider.java:272)\n       at org.eclipse.core.internal.resources.Workspace.run(Workspace.java:1378)\n       at org.eclipse.team.internal.ccvs.core.CVSProvider.checkout\n(CVSProvider.java:300)\n       at \norg.eclipse.team.internal.ccvs.ui.actions.AddToWorkspaceAction$1.execute\n(AddToWorkspaceAction.java:86)\n       at org.eclipse.ui.actions.WorkspaceModifyOperation$1.run\n(WorkspaceModifyOperation.java:64)\n       at org.eclipse.core.internal.resources.Workspace.run(Workspace.java:1378)\n       at org.eclipse.ui.actions.WorkspaceModifyOperation.run\n(WorkspaceModifyOperation.java:78)\n       at org.eclipse.jface.operation.ModalContext$ModalContextThread.run\n(ModalContext.java:98)\n\n\n\n\nThe problem is caused by an invalid string for the Console.resultTimeFormat key \nin the messages_it.properties\nfound in the org.eclipse.team.cvs.ui.nl1 fragment.\n\nFrom the English properties file:\n\tConsole.resultTimeFormat\u003d\u0027(took \u0027m:ss.SSS\u0027)\u0027\nFrom the Italian properties file:\n\tConsole.resultTimeFormat\u003d\u0027\u0027(took \u0027m\\:ss.SSS\u0027)\u0027\u0027\n\n\nHere is the output from running the attached sample code to reproduce the \nproblem.\n\nConsole.resultTimeFormat from properties file: \u0027\u0027(took \u0027m:ss.SSS\u0027)\u0027\u0027\njava.lang.IllegalArgumentException: Illegal pattern character \u0027t\u0027\n\tat java.text.SimpleDateFormat.subFormat(SimpleDateFormat.java:491)\n\tat java.text.SimpleDateFormat.format(SimpleDateFormat.java:424)\n\tat java.text.DateFormat.format(DateFormat.java:301)\n\tat test.Test.test(Test.java:45)\n\tat test.Test.main(Test.java:54)\nConsole.resultTimeFormat from properties file: \u0027(took \u0027m:ss.SSS\u0027)\u0027\ntime: (took 0:00.301)",
    "Created an attachment (id\u003d2729)\nSample that shows the root cause of the problem.\n",
    "\n\n*** This bug has been marked as a duplicate of 28781 ***",
    "Reopening to deal with failure case in Console.",
    "Fix released to HEAD. Console will no longer choke on a bad format. The fix of \nthe format is left to bug 28781."
  ],
  "commentCreationDates": [
    "2002-12-09T17:44:37+01:00",
    "2002-12-09T17:47:04+01:00",
    "2003-01-07T16:26:15+01:00",
    "2003-01-07T19:09:15+01:00",
    "2003-01-07T21:20:45+01:00"
  ],
  "traces": [
    {
      "exceptionType": "java.lang.IllegalArgumentException",
      "message": "Illegal pattern character \u0027t\u0027",
      "elements": [
        {
          "method": "java.text.SimpleDateFormat.subFormat",
          "source": "SimpleDateFormat.java:491"
        },
        {
          "method": "java.text.SimpleDateFormat.format",
          "source": "SimpleDateFormat.java(Compiled  Code)"
        },
        {
          "method": "java.text.DateFormat.format",
          "source": "DateFormat.java:301"
        },
        {
          "method": "org.eclipse.team.internal.ccvs.ui.Console$ConsoleListener.commandCompleted",
          "source": "Console.java:414"
        },
        {
          "method": "org.eclipse.team.internal.ccvs.core.client.Command.notifyConsoleOnCompletion",
          "source": "Command.java:340"
        },
        {
          "method": "org.eclipse.team.internal.ccvs.core.client.Command.access$2",
          "source": "Command.java:337"
        },
        {
          "method": "org.eclipse.team.internal.ccvs.core.client.Command$2.run",
          "source": "Command.java:328"
        },
        {
          "method": "org.eclipse.team.internal.ccvs.core.resources.EclipseFolder$2.run",
          "source": "EclipseFolder.java:277"
        },
        {
          "method": "org.eclipse.core.internal.resources.Workspace.run",
          "source": "Workspace.java:1378"
        },
        {
          "method": "org.eclipse.team.internal.ccvs.core.resources.EclipseFolder.run",
          "source": "EclipseFolder.java:270"
        },
        {
          "method": "org.eclipse.team.internal.ccvs.core.client.Command.execute",
          "source": "Command.java:333"
        },
        {
          "method": "org.eclipse.team.internal.ccvs.core.CVSProvider$1.run",
          "source": "CVSProvider.java:272"
        },
        {
          "method": "org.eclipse.core.internal.resources.Workspace.run",
          "source": "Workspace.java:1378"
        },
        {
          "method": "org.eclipse.team.internal.ccvs.core.CVSProvider.checkout",
          "source": "CVSProvider.java:300"
        },
        {
          "method": "org.eclipse.team.internal.ccvs.ui.actions.AddToWorkspaceAction$1.execute",
          "source": "AddToWorkspaceAction.java:86"
        },
        {
          "method": "org.eclipse.ui.actions.WorkspaceModifyOperation$1.run",
          "source": "WorkspaceModifyOperation.java:64"
        },
        {
          "method": "org.eclipse.core.internal.resources.Workspace.run",
          "source": "Workspace.java:1378"
        },
        {
          "method": "org.eclipse.ui.actions.WorkspaceModifyOperation.run",
          "source": "WorkspaceModifyOperation.java:78"
        },
        {
          "method": "org.eclipse.jface.operation.ModalContext$ModalContextThread.run",
          "source": "ModalContext.java:98"
        }
      ],
      "number": 0,
      "commentIndex": 0,
      "bugId": "27960",
      "date": "2002-12-09T17:44:37+01:00",
      "product": "Platform",
      "component": "Team",
      "severity": "major"
    },
    {
      "exceptionType": "java.lang.IllegalArgumentException",
      "message": "Illegal pattern character \u0027t\u0027",
      "elements": [
        {
          "method": "java.text.SimpleDateFormat.subFormat",
          "source": "SimpleDateFormat.java:491"
        },
        {
          "method": "java.text.SimpleDateFormat.format",
          "source": "SimpleDateFormat.java(Compiled  Code)"
        },
        {
          "method": "java.text.DateFormat.format",
          "source": "DateFormat.java:301"
        },
        {
          "method": "org.eclipse.team.internal.ccvs.ui.Console$ConsoleListener.commandCompleted",
          "source": "Console.java:414"
        },
        {
          "method": "org.eclipse.team.internal.ccvs.core.client.Command.notifyConsoleOnCompletion",
          "source": "Command.java:340"
        },
        {
          "method": "org.eclipse.team.internal.ccvs.core.client.Command.access$2",
          "source": "Command.java:337"
        },
        {
          "method": "org.eclipse.team.internal.ccvs.core.client.Command$2.run",
          "source": "Command.java:328"
        },
        {
          "method": "org.eclipse.team.internal.ccvs.core.resources.EclipseFolder$2.run",
          "source": "EclipseFolder.java:277"
        },
        {
          "method": "org.eclipse.core.internal.resources.Workspace.run",
          "source": "Workspace.java:1378"
        },
        {
          "method": "org.eclipse.team.internal.ccvs.core.resources.EclipseFolder.run",
          "source": "EclipseFolder.java:270"
        },
        {
          "method": "org.eclipse.team.internal.ccvs.core.client.Command.execute",
          "source": "Command.java:333"
        },
        {
          "method": "org.eclipse.team.internal.ccvs.core.CVSProvider$1.run",
          "source": "CVSProvider.java:272"
        },
        {
          "method": "org.eclipse.core.internal.resources.Workspace.run",
          "source": "Workspace.java:1378"
        },
        {
          "method": "org.eclipse.team.internal.ccvs.core.CVSProvider.checkout",
          "source": "CVSProvider.java:300"
        },
        {
          "method": "org.eclipse.team.internal.ccvs.ui.actions.AddToWorkspaceAction$1.execute",
          "source": "AddToWorkspaceAction.java:86"
        },
        {
          "method": "org.eclipse.ui.actions.WorkspaceModifyOperation$1.run",
          "source": "WorkspaceModifyOperation.java:64"
        },
        {
          "method": "org.eclipse.core.internal.resources.Workspace.run",
          "source": "Workspace.java:1378"
        },
        {
          "method": "org.eclipse.ui.actions.WorkspaceModifyOperation.run",
          "source": "WorkspaceModifyOperation.java:78"
        },
        {
          "method": "org.eclipse.jface.operation.ModalContext$ModalContextThread.run",
          "source": "ModalContext.java:98"
        }
      ],
      "number": 1,
      "commentIndex": 0,
      "bugId": "27960",
      "date": "2002-12-09T17:44:37+01:00",
      "product": "Platform",
      "component": "Team",
      "severity": "major"
    },
    {
      "exceptionType": "java.lang.IllegalArgumentException",
      "message": "Illegal pattern character \u0027t\u0027",
      "elements": [
        {
          "method": "java.text.SimpleDateFormat.subFormat",
          "source": "SimpleDateFormat.java:491"
        },
        {
          "method": "java.text.SimpleDateFormat.format",
          "source": "SimpleDateFormat.java:424"
        },
        {
          "method": "java.text.DateFormat.format",
          "source": "DateFormat.java:301"
        },
        {
          "method": "test.Test.test",
          "source": "Test.java:45"
        },
        {
          "method": "test.Test.main",
          "source": "Test.java:54"
        }
      ],
      "number": 2,
      "commentIndex": 0,
      "bugId": "27960",
      "date": "2002-12-09T17:44:37+01:00",
      "product": "Platform",
      "component": "Team",
      "severity": "major"
    }
  ],
  "groupId": "27960",
  "bugId": "27960",
  "date": "2002-12-09T17:44:37+01:00",
  "product": "Platform",
  "component": "Team",
  "severity": "major"
}