{
  "comments": [
    "Attempted to run the trace example with AspectJ 1.1b3. \nCommand: \nD:\\javatools\\aspectj1.1\\doc\\examples\\tracing\u003e ajc @tracev1.lst\n\nReceived the following:\nno manifest found in D:\\javatools\\aspectj1.1\\lib\\aspectjrt.jar, expected \n1.1beta3\nno manifest found in D:\\javatools\\aspectj1.1\\lib\\aspectjrt.jar, expected \n1.1beta3\nMessage: warning: no manifest found in D:\\javatools\\aspectj1.1\n\\lib\\aspectjrt.jar, expected 1.1beta3\norg.aspectj.bridge.AbortException: no manifest found in D:\\javatools\\aspectj1.1\n\\lib\\aspectjrt.jar, expected 1.1beta3\n        at org.aspectj.ajdt.internal.core.builder.AjBuildManager.batchBuild\n(AjBuildManager.java:88)\n        at org.aspectj.ajdt.ajc.AjdtCommand.runCommand(AjdtCommand.java:54)\n        at org.aspectj.tools.ajc.Main.run(Main.java:199)\n        at org.aspectj.tools.ajc.Main.runMain(Main.java:138)\n        at org.aspectj.tools.ajc.Main.main(Main.java:58)\n\nI checked the .jar and there was no manifest.  I\u0027m new to AspectJ so this my \nfirst experience.  I tried others but received the same message.  Perhaps I\u0027ll \ntry a non-beta version.\n\nJim",
    "This was a major error in the build configuration for the beta3 release.  It \nhas been fixed in the beta4 release now available.\n\nThe download page has also been edited to emphasize that 1.0.6 is the latest \nstable release of AspectJ to encourage people who don\u0027t want to help us with \nbeta testing to use that release."
  ],
  "commentCreationDates": [
    "2003-01-15T21:26:04+01:00",
    "2003-01-16T16:30:07+01:00"
  ],
  "traces": [
    {
      "exceptionType": "org.aspectj.bridge.AbortException",
      "message": "no manifest found in D:\\javatools\\aspectj1.1 \\lib\\aspectjrt.jar, expected 1.1beta3",
      "elements": [
        {
          "method": "org.aspectj.ajdt.internal.core.builder.AjBuildManager.batchBuild",
          "source": "AjBuildManager.java:88"
        },
        {
          "method": "org.aspectj.ajdt.ajc.AjdtCommand.runCommand",
          "source": "AjdtCommand.java:54"
        },
        {
          "method": "org.aspectj.tools.ajc.Main.run",
          "source": "Main.java:199"
        },
        {
          "method": "org.aspectj.tools.ajc.Main.runMain",
          "source": "Main.java:138"
        },
        {
          "method": "org.aspectj.tools.ajc.Main.main",
          "source": "Main.java:58"
        }
      ],
      "number": 0,
      "commentIndex": 0,
      "bugId": "29577",
      "date": "2003-01-15T21:26:04+01:00",
      "product": "AspectJ",
      "component": "Compiler",
      "severity": "blocker"
    }
  ],
  "groupId": "29577",
  "bugId": "29577",
  "date": "2003-01-15T21:26:04+01:00",
  "product": "AspectJ",
  "component": "Compiler",
  "severity": "blocker"
}