{
  "comments": [
    "Hello,\nI would suggest an improvement to the CVS repository view. I think that the \nbranches sub-list should be identic to the the version sub-list, ie presenting \nthe different brnaches by module. Actually we need to make branches onto \nmodules like we need to make versions on modules.\nwe should have the following :\nBranches\n--Module1\n------branch1\n------branch2\n------xxx\n--Module2\n------branch3\nVersions\n--Module1\n------Version1\n--Module2\n------Version2\n\nregards\nXavier",
    "It\u0027s interesting -- I would actually rather have the opposite, which is for the\nVersions tree have version name as the first layer rather than the module\n(basically making it function like the branches tree).  It seems like this might\nbe worthy of a configuration option.  Regardless, though, I think they should be\nmutually consistent unless there\u0027s a good reason to do otherwise that I just\ncan\u0027t think of at the moment.",
    "Hi Mike,\nThanks for taken into account my proposal :-) \nWe can even have the following :\nCVSRepository\n--Module1\n----Main\n-------Current\n-------Version1\n----Branch1\n-------Current\n-------Version1\n-------Version2\n----Branch2\n-------Current\n--Module2\n----Main\n-------Current\n----Branch1\n-------Current\n-------Version1\n-------Version2\n\nOr also (if a graphical view is provided)\nCVSRepository\n--Module1\n   |_Main\n      |_Current\n      |_version1 (snapshot)\n         |_branch2\n             |___Current\n             |___Version2.1 (snapshot)\n   |_Branch1\n      |_ Current\n--Module2\n....\nBest regards\nXavier\n",
    "There is currently no plan to address this item.",
    "Guys, could you tell me what I\u0027ve to do to refresh tags?\n\nI\u0027m working with Eclipse Platform 3.1 and my Eclipse java project has two modules inside it (CVS Modules).\n\nWhen I change something and switch to sychronize perspective I\u0027m able to commit everything fine. Although, when I want to replace some module (working copy at JAVA perspective) with \"Replace With-\u003eAnother Branch or Version..\", I can see just only one created release below \"Versions\". When I try to refresh tags it crashes and don\u0027t give any problems\u0027 details.\n\nIs something to configure in CVS related to Refresh tags??\n\nDespite this problem I can see the releases i\u0027ve created at CVS Repository Exploring perspective. But from it, choosing some release and trying to make a \"checkout into\" to my project and indicating a module (directory inside the project) nothing happens.\n\nThanks for any help!\n\n(In reply to comment #2)\n\u003e Hi Mike,\n\u003e Thanks for taken into account my proposal :-) \n\u003e We can even have the following :\n\u003e CVSRepository\n\u003e --Module1\n\u003e ----Main\n\u003e -------Current\n\u003e -------Version1\n\u003e ----Branch1\n\u003e -------Current\n\u003e -------Version1\n\u003e -------Version2\n\u003e ----Branch2\n\u003e -------Current\n\u003e --Module2\n\u003e ----Main\n\u003e -------Current\n\u003e ----Branch1\n\u003e -------Current\n\u003e -------Version1\n\u003e -------Version2\n\u003e \n\u003e Or also (if a graphical view is provided)\n\u003e CVSRepository\n\u003e --Module1\n\u003e    |_Main\n\u003e       |_Current\n\u003e       |_version1 (snapshot)\n\u003e          |_branch2\n\u003e              |___Current\n\u003e              |___Version2.1 (snapshot)\n\u003e    |_Branch1\n\u003e       |_ Current\n\u003e --Module2\n\u003e ....\n\u003e Best regards\n\u003e Xavier\n\u003e (In reply to comment #2)\n\u003e Hi Mike,\n\u003e Thanks for taken into account my proposal :-) \n\u003e We can even have the following :\n\u003e CVSRepository\n\u003e --Module1\n\u003e ----Main\n\u003e -------Current\n\u003e -------Version1\n\u003e ----Branch1\n\u003e -------Current\n\u003e -------Version1\n\u003e -------Version2\n\u003e ----Branch2\n\u003e -------Current\n\u003e --Module2\n\u003e ----Main\n\u003e -------Current\n\u003e ----Branch1\n\u003e -------Current\n\u003e -------Version1\n\u003e -------Version2\n\u003e \n\u003e Or also (if a graphical view is provided)\n\u003e CVSRepository\n\u003e --Module1\n\u003e    |_Main\n\u003e       |_Current\n\u003e       |_version1 (snapshot)\n\u003e          |_branch2\n\u003e              |___Current\n\u003e              |___Version2.1 (snapshot)\n\u003e    |_Branch1\n\u003e       |_ Current\n\u003e --Module2\n\u003e ....\n\u003e Best regards\n\u003e Xavier\n\u003e \n\n",
    "There should be a Configure Tags button that allows you to search for tags on the files in your project.",
    "Thks for your reply, but Eclipse doesn\u0027t show the tags (releases) i\u0027ve created in the CVS repository.\nThrough the operation \"Replace With-\u003eAnother Branch or version..\" in the JAVA Perspective it shows a node called \"Versions\" and bellow it is shown just the first tags (releases) i\u0027ve created in the repcvs. When i hit the button \"Refresh tags\" it crashes and doesn\u0027t show the details button. Through \"Configure tags..\" option occurs the same problem.\n\nI\u0027ve created the following structure in $CVSROOT/modules file (i\u0027m working with modules in CVS to address component development versioning stuff):\n\nALIAS (MODULE)                COMPONENT DIRECTORY\na                             a-dir\nb                             b-dir\ncomponent-dev  -a             a-dir b-dir ...many others that will be dev.\nmyproject                     \u0026component-dev\n\nWhen developers make a checkout of \"myproject\" is created a Eclipse project which has a-dir and b-dir renamed with their aliases. In JAVA Perspective i\u0027m able to make the operation \"Replace With-\u003eLatest from HEAD\" and \"Replace With-\u003eAnother Branch or version..\" *JUST* for some releases because Eclipse doesn\u0027t show all releases created.\nIn \"CVS Repository Exploring perspective\" it shows more releases than the other, but NOT ALL created releases! So it seems to be a bug!?\n\nHear is the Eclipse log file:\n//////////////////////////////\n!SESSION 2005-11-24 12:07:45.425 -----------------------------------------------\neclipse.buildId\u003dM20050929-0840\njava.version\u003d1.5.0_05\njava.vendor\u003dSun Microsystems Inc.\nBootLoader constants: OS\u003dlinux, ARCH\u003dx86, WS\u003dgtk, NL\u003dpt_BR\nCommand-line arguments:  -os linux -ws gtk -arch x86\n\n!ENTRY org.eclipse.team.cvs.core 4 0 2005-11-24 12:18:45.619\n!MESSAGE Error refreshing tags\n!STACK 0\njava.lang.reflect.InvocationTargetException\n        at org.eclipse.team.internal.ccvs.ui.tags.TagRefreshButtonArea$3.run(TagRefreshButtonArea.java:128)\n        at org.eclipse.team.internal.ccvs.ui.tags.TagSelectionDialog$4.run(TagSelectionDialog.java:280)\n        at org.eclipse.core.internal.jobs.Worker.run(Worker.java:76)\nCaused by: org.eclipse.team.internal.ccvs.core.connection.CVSServerException: The server reported an error: No such file or directory\n        at org.eclipse.team.internal.ccvs.core.client.Request.executeRequest(Request.java:173)\n        at org.eclipse.team.internal.ccvs.core.client.Command.doExecute(Command.java:404)\n        at org.eclipse.team.internal.ccvs.core.client.Command$1.run(Command.java:323)\n        at org.eclipse.team.internal.ccvs.core.resources.RemoteFolder.run(RemoteFolder.java:457)\n        at org.eclipse.team.internal.ccvs.core.client.Command.execute(Command.java:335)\n        at org.eclipse.team.internal.ccvs.core.client.Command.execute(Command.java:785)\n        at org.eclipse.team.internal.ccvs.core.resources.RemoteFile.getLogEntries(RemoteFile.java:269)\n        at org.eclipse.team.internal.ccvs.ui.repo.RepositoryRoot.fetchTags(RepositoryRoot.java:435)\n        at org.eclipse.team.internal.ccvs.ui.repo.RepositoryRoot.fetchTagsUsingAutoRefreshFiles(RepositoryRoot.java:408)\n        at org.eclipse.team.internal.ccvs.ui.repo.RepositoryRoot.refreshDefinedTags(RepositoryRoot.java:341)\n        at org.eclipse.team.internal.ccvs.ui.repo.RepositoryManager.refreshDefinedTags(RepositoryManager.java:226)\n        at org.eclipse.team.internal.ccvs.ui.tags.SingleFolderTagSource.refresh(SingleFolderTagSource.java:63)\n        at org.eclipse.team.internal.ccvs.ui.tags.TagRefreshButtonArea$3.run(TagRefreshButtonArea.java:118)\n///////////////////////////////////\n\nCan you help me? I\u0027ve made tests with Eclipse platform 3.1 and Eclipse SDK 3.1.1\n\nDespite the ROOT CAUSE told in the stack trace, i\u0027ve checked in the CVS repository and the directory is there.\n\nWhy \"The server reported an error: No such file or directory\" if i\u0027m asking to Refresh tags, not choosing or telling someone that doesn\u0027t exists in fact!?\n\nThks, Denis Clayton\n\n(In reply to comment #5)\n\u003e There should be a Configure Tags button that allows you to search for tags on\n\u003e the files in your project.\n\u003e \n\n",
    "When I make a module check out from my CVS repository choosing the option \"Check Out As...\" and selecting \"Check out as a project configured using the New Project Wizard\", this wizard has a \"Refresh tags\" button which action doesn\u0027t generate any exception and so i\u0027m able to see ALL created tags. \u003d) Eclipse platform 3.1.0.\n\nBut i still need that the option \"Replace with-\u003eAnother Branch or Version\" from Java perspective works when i hit the \"Refresh tags\" button, because in my java project i\u0027ve many modules and sometimes is needed change just one release of a module, not make an entire check out.\n\nThks again!\n\n\n\n\n(In reply to comment #6)"
  ],
  "commentCreationDates": [
    "2003-01-23T08:23:10+01:00",
    "2004-10-07T19:51:04+02:00",
    "2004-10-07T20:43:51+02:00",
    "2005-05-09T20:29:58+02:00",
    "2005-11-23T18:37:23+01:00",
    "2005-11-23T20:54:29+01:00",
    "2005-11-24T14:53:55+01:00",
    "2005-11-24T18:58:15+01:00"
  ],
  "traces": [
    {
      "exceptionType": "java.lang.reflect.InvocationTargetException",
      "elements": [
        {
          "method": "org.eclipse.team.internal.ccvs.ui.tags.TagRefreshButtonArea$3.run",
          "source": "TagRefreshButtonArea.java:128"
        },
        {
          "method": "org.eclipse.team.internal.ccvs.ui.tags.TagSelectionDialog$4.run",
          "source": "TagSelectionDialog.java:280"
        },
        {
          "method": "org.eclipse.core.internal.jobs.Worker.run",
          "source": "Worker.java:76"
        }
      ],
      "causedBy": {
        "exceptionType": "org.eclipse.team.internal.ccvs.core.connection.CVSServerException",
        "message": "The server reported an error: No such file or directory",
        "elements": [
          {
            "method": "org.eclipse.team.internal.ccvs.core.client.Request.executeRequest",
            "source": "Request.java:173"
          },
          {
            "method": "org.eclipse.team.internal.ccvs.core.client.Command.doExecute",
            "source": "Command.java:404"
          },
          {
            "method": "org.eclipse.team.internal.ccvs.core.client.Command$1.run",
            "source": "Command.java:323"
          },
          {
            "method": "org.eclipse.team.internal.ccvs.core.resources.RemoteFolder.run",
            "source": "RemoteFolder.java:457"
          },
          {
            "method": "org.eclipse.team.internal.ccvs.core.client.Command.execute",
            "source": "Command.java:335"
          },
          {
            "method": "org.eclipse.team.internal.ccvs.core.client.Command.execute",
            "source": "Command.java:785"
          },
          {
            "method": "org.eclipse.team.internal.ccvs.core.resources.RemoteFile.getLogEntries",
            "source": "RemoteFile.java:269"
          },
          {
            "method": "org.eclipse.team.internal.ccvs.ui.repo.RepositoryRoot.fetchTags",
            "source": "RepositoryRoot.java:435"
          },
          {
            "method": "org.eclipse.team.internal.ccvs.ui.repo.RepositoryRoot.fetchTagsUsingAutoRefreshFiles",
            "source": "RepositoryRoot.java:408"
          },
          {
            "method": "org.eclipse.team.internal.ccvs.ui.repo.RepositoryRoot.refreshDefinedTags",
            "source": "RepositoryRoot.java:341"
          },
          {
            "method": "org.eclipse.team.internal.ccvs.ui.repo.RepositoryManager.refreshDefinedTags",
            "source": "RepositoryManager.java:226"
          },
          {
            "method": "org.eclipse.team.internal.ccvs.ui.tags.SingleFolderTagSource.refresh",
            "source": "SingleFolderTagSource.java:63"
          },
          {
            "method": "org.eclipse.team.internal.ccvs.ui.tags.TagRefreshButtonArea$3.run",
            "source": "TagRefreshButtonArea.java:118"
          }
        ],
        "number": 0,
        "commentIndex": 0
      },
      "number": 0,
      "commentIndex": 6,
      "bugId": "30048",
      "date": "2005-11-24T14:53:55+01:00",
      "product": "Platform",
      "component": "Team",
      "severity": "enhancement"
    }
  ],
  "groupId": "30048",
  "bugId": "30048",
  "date": "2003-01-23T08:23:10+01:00",
  "product": "Platform",
  "component": "Team",
  "severity": "enhancement"
}