{
  "comments": [
    "JUnit setup.\n1) Select TestResult runTest in the source\n2) accept the default settings\n3) finish (without preview)\n\n\n!ENTRY org.eclipse.jdt.ui 4 10001 Jan 26, 2003 00:37:57.355\n!MESSAGE Internal Error\n!STACK 0\njava.lang.reflect.InvocationTargetException\n        at org.eclipse.jface.operation.ModalContext.runInCurrentThread(ModalCont\next.java:307)\n        at org.eclipse.jface.operation.ModalContext.run(ModalContext.java:246)\n        at org.eclipse.jdt.internal.ui.refactoring.RefactoringWizardDialog2.run(\nRefactoringWizardDialog2.java:256)\n        at org.eclipse.jdt.internal.ui.refactoring.PerformRefactoringUtil.perfor\nmRefactoring(PerformRefactoringUtil.java:43)\n        at org.eclipse.jdt.internal.ui.refactoring.RefactoringWizard.performFini\nsh(RefactoringWizard.java:362)\n        at org.eclipse.jdt.internal.ui.refactoring.UserInputWizardPage.performFi\nnish(UserInputWizardPage.java:113)\n        at org.eclipse.jdt.internal.ui.refactoring.RefactoringWizard.performFini\nsh(RefactoringWizard.java:425)\n        at org.eclipse.jdt.internal.ui.refactoring.RefactoringWizardDialog2.okPr\nessed(RefactoringWizardDialog2.java:371)\n        at org.eclipse.jface.dialogs.Dialog.buttonPressed(Dialog.java:240)\n        at org.eclipse.jface.dialogs.Dialog$1.widgetSelected(Dialog.java:398)\n        at org.eclipse.swt.widgets.TypedListener.handleEvent(TypedListener.java:\n87)\n        at org.eclipse.swt.widgets.EventTable.sendEvent(EventTable.java:77)\n        at org.eclipse.swt.widgets.Widget.sendEvent(Widget.java:836)\n        at org.eclipse.swt.widgets.Display.runDeferredEvents(Display.java:1692)\n        at org.eclipse.swt.widgets.Display.readAndDispatch(Display.java:1410)\n        at org.eclipse.jface.window.Window.runEventLoop(Window.java:561)\n        at org.eclipse.jface.window.Window.open(Window.java:541)\n        at org.eclipse.jdt.internal.ui.refactoring.actions.RefactoringStarter.ac\ntivate(RefactoringStarter.java:60)\n        at org.eclipse.jdt.internal.ui.refactoring.actions.MoveInstanceMethodAct\nion.run(MoveInstanceMethodAction.java:131)\n        at org.eclipse.jdt.internal.ui.refactoring.actions.MoveInstanceMethodAct\nion.run(MoveInstanceMethodAction.java:115)\n        at org.eclipse.jdt.ui.actions.MoveAction.tryMoveInstanceMethod(MoveActio\nn.java:172)\n        at org.eclipse.jdt.ui.actions.MoveAction.run(MoveAction.java:135)\n        at org.eclipse.jdt.ui.actions.SelectionDispatchAction.dispatchRun(Select\nionDispatchAction.java:193)\n        at org.eclipse.jdt.ui.actions.SelectionDispatchAction.run(SelectionDispa\ntchAction.java:169)\n        at org.eclipse.jface.action.Action.runWithEvent(Action.java:804)\n        at org.eclipse.jface.action.ActionContributionItem.handleWidgetSelection\n(ActionContributionItem.java:422)\n        at org.eclipse.jface.action.ActionContributionItem.handleWidgetEvent(Act\nionContributionItem.java:374)\n        at org.eclipse.jface.action.ActionContributionItem.access$0(ActionContri\nbutionItem.java:368)\n        at org.eclipse.jface.action.ActionContributionItem$ActionListener.handle\nEvent(ActionContributionItem.java:69)\n        at org.eclipse.swt.widgets.EventTable.sendEvent(EventTable.java:77)\n        at org.eclipse.swt.widgets.Widget.sendEvent(Widget.java:836)\n        at org.eclipse.swt.widgets.Display.runDeferredEvents(Display.java:1692)\n        at org.eclipse.swt.widgets.Display.readAndDispatch(Display.java:1410)\n        at org.eclipse.ui.internal.Workbench.runEventLoop(Workbench.java:1525)\n        at org.eclipse.ui.internal.Workbench.run(Workbench.java:1508)\n        at org.eclipse.core.internal.boot.InternalBootLoader.run(InternalBootLoa\nder.java:845)\n        at org.eclipse.core.boot.BootLoader.run(BootLoader.java:462)\n        at sun.reflect.NativeMethodAccessorImpl.invoke0(Native Method)\n        at sun.reflect.NativeMethodAccessorImpl.invoke(NativeMethodAccessorImpl.\njava:39)\n        at sun.reflect.DelegatingMethodAccessorImpl.invoke(DelegatingMethodAcces\nsorImpl.java:25)\n        at java.lang.reflect.Method.invoke(Method.java:324)\n        at org.eclipse.core.launcher.Main.basicRun(Main.java:247)\n        at org.eclipse.core.launcher.Main.run(Main.java:703)\n        at org.eclipse.core.launcher.Main.main(Main.java:539)\nCaused by: org.eclipse.jdt.internal.corext.Assert$AssertionFailedException: null\n argument;New receiver must be chosen before checkInput(..) is called.\n        at org.eclipse.jdt.internal.corext.Assert.isNotNull(Assert.java:99)\n        at org.eclipse.jdt.internal.corext.refactoring.structure.InstanceMethodM\nover.checkInput(InstanceMethodMover.java:1848)\n        at org.eclipse.jdt.internal.corext.refactoring.structure.MoveInstanceMet\nhodRefactoring.checkInput(MoveInstanceMethodRefactoring.java:158)\n        at org.eclipse.jdt.internal.ui.refactoring.CheckConditionsOperation.run(\nCheckConditionsOperation.java:59)\n        at org.eclipse.jdt.internal.ui.refactoring.CreateChangeOperation.run(Cre\nateChangeOperation.java:94)\n        at org.eclipse.jdt.internal.ui.refactoring.PerformChangeOperation.run(Pe\nrformChangeOperation.java:138)\n        at org.eclipse.jface.operation.ModalContext.runInCurrentThread(ModalCont\next.java:296)\n        ... 43 more",
    "The error message in the dialog is: null argument;New receiver must be chosen \nbefore checkInptt() is called.",
    "which junit ?\ni do not see TestResult.runTest in 3.7\n",
    "The method is TestResult.run(TestCase) sorry.\n\n3.7 or 3.8 the code hasn\u0027t changed. I just try to reproduce it and I had the \nsame problem.",
    "very strange - it did work before",
    "nope, it never did (forgot to pass stuff from ui down)\nfixed now"
  ],
  "commentCreationDates": [
    "2003-01-25T23:11:42+01:00",
    "2003-01-25T23:13:52+01:00",
    "2003-01-27T10:49:32+01:00",
    "2003-01-27T11:32:36+01:00",
    "2003-01-27T12:01:32+01:00",
    "2003-01-27T12:16:07+01:00"
  ],
  "traces": [
    {
      "exceptionType": "java.lang.reflect.InvocationTargetException",
      "elements": [
        {
          "method": "org.eclipse.jface.operation.ModalContext.runInCurrentThread",
          "source": "ModalCont ext.java:307"
        },
        {
          "method": "org.eclipse.jface.operation.ModalContext.run",
          "source": "ModalContext.java:246"
        },
        {
          "method": "org.eclipse.jdt.internal.ui.refactoring.RefactoringWizardDialog2.run",
          "source": " RefactoringWizardDialog2.java:256"
        },
        {
          "method": "org.eclipse.jdt.internal.ui.refactoring.PerformRefactoringUtil.performRefactoring",
          "source": "PerformRefactoringUtil.java:43"
        },
        {
          "method": "org.eclipse.jdt.internal.ui.refactoring.RefactoringWizard.performFinish",
          "source": "RefactoringWizard.java:362"
        },
        {
          "method": "org.eclipse.jdt.internal.ui.refactoring.UserInputWizardPage.performFinish",
          "source": "UserInputWizardPage.java:113"
        },
        {
          "method": "org.eclipse.jdt.internal.ui.refactoring.RefactoringWizard.performFinish",
          "source": "RefactoringWizard.java:425"
        },
        {
          "method": "org.eclipse.jdt.internal.ui.refactoring.RefactoringWizardDialog2.okPressed",
          "source": "RefactoringWizardDialog2.java:371"
        },
        {
          "method": "org.eclipse.jface.dialogs.Dialog.buttonPressed",
          "source": "Dialog.java:240"
        },
        {
          "method": "org.eclipse.jface.dialogs.Dialog$1.widgetSelected",
          "source": "Dialog.java:398"
        },
        {
          "method": "org.eclipse.swt.widgets.TypedListener.handleEvent",
          "source": "TypedListener.java: 87"
        },
        {
          "method": "org.eclipse.swt.widgets.EventTable.sendEvent",
          "source": "EventTable.java:77"
        },
        {
          "method": "org.eclipse.swt.widgets.Widget.sendEvent",
          "source": "Widget.java:836"
        },
        {
          "method": "org.eclipse.swt.widgets.Display.runDeferredEvents",
          "source": "Display.java:1692"
        },
        {
          "method": "org.eclipse.swt.widgets.Display.readAndDispatch",
          "source": "Display.java:1410"
        },
        {
          "method": "org.eclipse.jface.window.Window.runEventLoop",
          "source": "Window.java:561"
        },
        {
          "method": "org.eclipse.jface.window.Window.open",
          "source": "Window.java:541"
        },
        {
          "method": "org.eclipse.jdt.internal.ui.refactoring.actions.RefactoringStarter.activate",
          "source": "RefactoringStarter.java:60"
        },
        {
          "method": "org.eclipse.jdt.internal.ui.refactoring.actions.MoveInstanceMethodAction.run",
          "source": "MoveInstanceMethodAction.java:131"
        },
        {
          "method": "org.eclipse.jdt.internal.ui.refactoring.actions.MoveInstanceMethodAction.run",
          "source": "MoveInstanceMethodAction.java:115"
        },
        {
          "method": "org.eclipse.jdt.ui.actions.MoveAction.tryMoveInstanceMethod",
          "source": "MoveActio n.java:172"
        },
        {
          "method": "org.eclipse.jdt.ui.actions.MoveAction.run",
          "source": "MoveAction.java:135"
        },
        {
          "method": "org.eclipse.jdt.ui.actions.SelectionDispatchAction.dispatchRun",
          "source": "Select ionDispatchAction.java:193"
        },
        {
          "method": "org.eclipse.jdt.ui.actions.SelectionDispatchAction.run",
          "source": "SelectionDispa tchAction.java:169"
        },
        {
          "method": "org.eclipse.jface.action.Action.runWithEvent",
          "source": "Action.java:804"
        },
        {
          "method": "org.eclipse.jface.action.ActionContributionItem.handleWidgetSelection",
          "source": "ActionContributionItem.java:422"
        },
        {
          "method": "org.eclipse.jface.action.ActionContributionItem.handleWidgetEvent",
          "source": "Act ionContributionItem.java:374"
        },
        {
          "method": "org.eclipse.jface.action.ActionContributionItem.access$0",
          "source": "ActionContri butionItem.java:368"
        },
        {
          "method": "org.eclipse.jface.action.ActionContributionItem$ActionListener.handleEvent",
          "source": "ActionContributionItem.java:69"
        },
        {
          "method": "org.eclipse.swt.widgets.EventTable.sendEvent",
          "source": "EventTable.java:77"
        },
        {
          "method": "org.eclipse.swt.widgets.Widget.sendEvent",
          "source": "Widget.java:836"
        },
        {
          "method": "org.eclipse.swt.widgets.Display.runDeferredEvents",
          "source": "Display.java:1692"
        },
        {
          "method": "org.eclipse.swt.widgets.Display.readAndDispatch",
          "source": "Display.java:1410"
        },
        {
          "method": "org.eclipse.ui.internal.Workbench.runEventLoop",
          "source": "Workbench.java:1525"
        },
        {
          "method": "org.eclipse.ui.internal.Workbench.run",
          "source": "Workbench.java:1508"
        },
        {
          "method": "org.eclipse.core.internal.boot.InternalBootLoader.run",
          "source": "InternalBootLoa der.java:845"
        },
        {
          "method": "org.eclipse.core.boot.BootLoader.run",
          "source": "BootLoader.java:462"
        },
        {
          "method": "sun.reflect.NativeMethodAccessorImpl.invoke0",
          "source": "Native Method"
        },
        {
          "method": "sun.reflect.NativeMethodAccessorImpl.invoke",
          "source": "NativeMethodAccessorImpl. java:39"
        },
        {
          "method": "sun.reflect.DelegatingMethodAccessorImpl.invoke",
          "source": "DelegatingMethodAcces sorImpl.java:25"
        },
        {
          "method": "java.lang.reflect.Method.invoke",
          "source": "Method.java:324"
        },
        {
          "method": "org.eclipse.core.launcher.Main.basicRun",
          "source": "Main.java:247"
        },
        {
          "method": "org.eclipse.core.launcher.Main.run",
          "source": "Main.java:703"
        },
        {
          "method": "org.eclipse.core.launcher.Main.main",
          "source": "Main.java:539"
        }
      ],
      "causedBy": {
        "exceptionType": "org.eclipse.jdt.internal.corext.Assert$AssertionFailedException",
        "message": "null  argument;New receiver must be chosen before checkInput(..) is called.",
        "elements": [
          {
            "method": "org.eclipse.jdt.internal.corext.Assert.isNotNull",
            "source": "Assert.java:99"
          },
          {
            "method": "org.eclipse.jdt.internal.corext.refactoring.structure.InstanceMethodMover.checkInput",
            "source": "InstanceMethodMover.java:1848"
          },
          {
            "method": "org.eclipse.jdt.internal.corext.refactoring.structure.MoveInstanceMethodRefactoring.checkInput",
            "source": "MoveInstanceMethodRefactoring.java:158"
          },
          {
            "method": "org.eclipse.jdt.internal.ui.refactoring.CheckConditionsOperation.run",
            "source": " CheckConditionsOperation.java:59"
          },
          {
            "method": "org.eclipse.jdt.internal.ui.refactoring.CreateChangeOperation.run",
            "source": "Cre ateChangeOperation.java:94"
          },
          {
            "method": "org.eclipse.jdt.internal.ui.refactoring.PerformChangeOperation.run",
            "source": "Pe rformChangeOperation.java:138"
          },
          {
            "method": "org.eclipse.jface.operation.ModalContext.runInCurrentThread",
            "source": "ModalCont ext.java:296"
          }
        ],
        "number": 0,
        "commentIndex": 0
      },
      "number": 0,
      "commentIndex": 0,
      "bugId": "30235",
      "date": "2003-01-25T23:11:42+01:00",
      "product": "JDT",
      "component": "UI",
      "severity": "critical"
    }
  ],
  "groupId": "30235",
  "bugId": "30235",
  "date": "2003-01-25T23:11:42+01:00",
  "product": "JDT",
  "component": "UI",
  "severity": "critical"
}