{
  "comments": [
    "AspectJ compiler 1.1beta4\n\nAspectJ compiler aborts with NullPointerException when command-line arguments \nare incorrect.\n\nFor instance, I got the following error when passing an empty directory \"foo\" \nas the only parameter:\n\n\u003eajc -classpath c:\\aspectj1.1\\lib\\aspectjrt.jar foo\nException thrown from AspectJ 1.1beta4\n\nThis might be logged as a bug already -- see the bug database at\n  http://dev.eclipse.org (product: AspectJ, component: compiler)\n\nBugs for exceptions thrown have titles File:line from the top stack,\ne.g., \"SomeFile.java:243\"\n\nIf you don\u0027t find the exception below in a bug, please add a new bug\nTo make the bug a priority, please include a test program\nthat can reproduce this exception.\nnull\njava.lang.NullPointerException\n        at java.lang.System.arraycopy(Native Method)\n        at org.eclipse.jdt.internal.compiler.batch.Main.configure(Main.java:817)\n\n        at org.aspectj.ajdt.ajc.BuildArgParser.genBuildConfig(BuildArgParser.jav\na:108)\n        at org.aspectj.ajdt.ajc.AjdtCommand.genBuildConfig(AjdtCommand.java:104)\n\n        at org.aspectj.ajdt.ajc.AjdtCommand.runCommand(AjdtCommand.java:53)\n        at org.aspectj.tools.ajc.Main.run(Main.java:199)\n        at org.aspectj.tools.ajc.Main.runMain(Main.java:138)\n        at org.aspectj.tools.ajc.Main.main(Main.java:58)\n\n\n1 fail|abort",
    "This is a bug in the argument parsing code written by Mik Kersten, so I\u0027m \nreassigning it to him.  Let me know if there\u0027s a problem with this.",
    "I believe that Wes has fixed this bug.  If so, Mik should either assign it to \nWes or just mark it fixed.  I can\u0027t figure out any way to reassign the bug now \nthat it\u0027s not assigned to me.",
    "Fixed in tree.  The compiler now signals an argument error when detecting an \nunflagged directory.\n\nNo test case because the harness does not support checking for abort messages or \nmessages without source line numbers. It would be something like this:\n\n   \u003cajc-test dir\u003d\"errors\" pr\u003d\"30765\"\n   \ttitle\u003d\"error on unflagged directory\"\u003e\n        \u003ccompile options\u003d\"protectedAccess\"  \n        \tsourceroots\u003d\".\"\u003e\n        \t\u003cmessage kind\u003d\"error\" line\u003d\"0\"/\u003e\n        \t\u003cmessage kind\u003d\"abort\" line\u003d\"0\"/\u003e\n        \u003c/compile\u003e\n    \u003c/ajc-test\u003e\n"
  ],
  "commentCreationDates": [
    "2003-02-01T16:08:17+01:00",
    "2003-02-13T17:47:36+01:00",
    "2003-05-01T03:59:03+02:00",
    "2003-05-08T07:12:21+02:00"
  ],
  "traces": [
    {
      "exceptionType": "java.lang.NullPointerException",
      "elements": [
        {
          "method": "java.lang.System.arraycopy",
          "source": "Native Method"
        },
        {
          "method": "org.eclipse.jdt.internal.compiler.batch.Main.configure",
          "source": "Main.java:817"
        },
        {
          "method": "org.aspectj.ajdt.ajc.BuildArgParser.genBuildConfig",
          "source": "BuildArgParser.jav a:108"
        },
        {
          "method": "org.aspectj.ajdt.ajc.AjdtCommand.genBuildConfig",
          "source": "AjdtCommand.java:104"
        },
        {
          "method": "org.aspectj.ajdt.ajc.AjdtCommand.runCommand",
          "source": "AjdtCommand.java:53"
        },
        {
          "method": "org.aspectj.tools.ajc.Main.run",
          "source": "Main.java:199"
        },
        {
          "method": "org.aspectj.tools.ajc.Main.runMain",
          "source": "Main.java:138"
        },
        {
          "method": "org.aspectj.tools.ajc.Main.main",
          "source": "Main.java:58"
        }
      ],
      "number": 0,
      "commentIndex": 0,
      "bugId": "30765",
      "date": "2003-02-01T16:08:17+01:00",
      "product": "AspectJ",
      "component": "Compiler",
      "severity": "normal"
    }
  ],
  "groupId": "30765",
  "bugId": "30765",
  "date": "2003-02-01T16:08:17+01:00",
  "product": "AspectJ",
  "component": "Compiler",
  "severity": "normal"
}