{
  "comments": [
    "Build 20030129\n\nIn Java editor, was trying to paste in following source, and fix up by removing \nextra string delimiters:\n\nSteps:\n\n- create unit X.java\n- paste following contents:\n\n\t\t\t\"package p1;\t\\n\"+\n\t\t\t\"public class X extends AbstractY {\t\\n\"+\n\t\t\t\"\tpublic void init(){\t\\n\"+\n\t\t\t\"\t\tsuper.init();\t\\n\"+\n\t\t\t\"\t}\t\\n\"+\n\t\t\t\"}\t\\n\"+\n\t\t\t\"abstract class AbstractY extends AbstractZ implements \nI {\t\\n\"+\n\t\t\t\"}\t\\n\"+\n\t\t\t\"abstract class AbstractZ {\t\\n\"+\n\t\t\t\"\tprivate void init(){}\t\\n\"+\n\t\t\t\"}\t\\n\"+\n\t\t\t\"interface I {\t\\n\"+\n\t\t\t\"\tvoid init();\t\\n\"+\n\t\t\t\"} \t\\n\"\n\n- trying to remove leading \u0027\\t\\t\\t\\t\"\u0027, I got the following exception:\n\nUnhandled exception caught in event loop.\nReason:\n!ENTRY org.eclipse.ui 4 0 Feb 04, 2003 15:22:22.732\n!MESSAGE Invalid range argument\n!STACK 0\njava.lang.IllegalArgumentException: Invalid range argument\n        at org.eclipse.jface.text.TextViewer.internalRevealRange\n(TextViewer.java:2272)\n        at org.eclipse.jface.text.TextViewer.revealRange(TextViewer.java:2178)\n        at org.eclipse.jface.text.TextViewer.enabledRedrawing\n(TextViewer.java:3622)\n        at org.eclipse.jface.text.TextViewer.setRedraw(TextViewer.java:3659)\n        at org.eclipse.jface.text.TextViewer$FindReplaceTarget.setReplaceAllMode\n(TextViewer.java:859)\n        at org.eclipse.ui.texteditor.FindReplaceTarget.setReplaceAllMode\n(FindReplaceTarget.java:163)\n        at org.eclipse.ui.texteditor.FindReplaceDialog.replaceAll\n(FindReplaceDialog.java:1173)\n        at org.eclipse.ui.texteditor.FindReplaceDialog.access$29\n(FindReplaceDialog.java:1138)\n        at org.eclipse.ui.texteditor.FindReplaceDialog$1$ReplaceAllRunnable.run\n(FindReplaceDialog.java:1043)\n        at org.eclipse.swt.custom.BusyIndicator.showWhile(BusyIndicator.java:65)\n        at org.eclipse.ui.texteditor.FindReplaceDialog.performReplaceAll\n(FindReplaceDialog.java:1048)\n        at org.eclipse.ui.texteditor.FindReplaceDialog.access$25\n(FindReplaceDialog.java:1032)\n        at org.eclipse.ui.texteditor.FindReplaceDialog$4.widgetSelected\n(FindReplaceDialog.java:290)\n        at org.eclipse.swt.widgets.TypedListener.handleEvent\n(TypedListener.java:87)\n        at org.eclipse.swt.widgets.EventTable.sendEvent(EventTable.java:77)\n        at org.eclipse.swt.widgets.Widget.sendEvent(Widget.java:836)\n        at org.eclipse.swt.widgets.Display.runDeferredEvents(Display.java:1692)\n        at org.eclipse.swt.widgets.Display.readAndDispatch(Display.java:1410)\n        at org.eclipse.ui.internal.Workbench.runEventLoop(Workbench.java:1240)\n        at org.eclipse.ui.internal.Workbench.run(Workbench.java:1223)\n        at org.eclipse.core.internal.boot.InternalBootLoader.run\n(InternalBootLoader.java:845)\n        at org.eclipse.core.boot.BootLoader.run(BootLoader.java:462)\n        at sun.reflect.NativeMethodAccessorImpl.invoke0(Native Method)\n        at sun.reflect.NativeMethodAccessorImpl.invoke\n(NativeMethodAccessorImpl.java:39)\n        at sun.reflect.DelegatingMethodAccessorImpl.invoke\n(DelegatingMethodAccessorImpl.java:25)\n        at java.lang.reflect.Method.invoke(Method.java:324)\n        at org.eclipse.core.launcher.Main.basicRun(Main.java:247)\n        at org.eclipse.core.launcher.Main.run(Main.java:703)\n        at org.eclipse.core.launcher.Main.main(Main.java:539)\nInvalid range argument",
    "Build I20030206.",
    "start verifying"
  ],
  "commentCreationDates": [
    "2003-02-04T14:35:13+01:00",
    "2003-02-05T17:15:49+01:00",
    "2003-02-27T08:20:26+01:00"
  ],
  "traces": [
    {
      "exceptionType": "java.lang.IllegalArgumentException",
      "message": "Invalid range argument",
      "elements": [
        {
          "method": "org.eclipse.jface.text.TextViewer.internalRevealRange",
          "source": "TextViewer.java:2272"
        },
        {
          "method": "org.eclipse.jface.text.TextViewer.revealRange",
          "source": "TextViewer.java:2178"
        },
        {
          "method": "org.eclipse.jface.text.TextViewer.enabledRedrawing",
          "source": "TextViewer.java:3622"
        },
        {
          "method": "org.eclipse.jface.text.TextViewer.setRedraw",
          "source": "TextViewer.java:3659"
        },
        {
          "method": "org.eclipse.jface.text.TextViewer$FindReplaceTarget.setReplaceAllMode",
          "source": "TextViewer.java:859"
        },
        {
          "method": "org.eclipse.ui.texteditor.FindReplaceTarget.setReplaceAllMode",
          "source": "FindReplaceTarget.java:163"
        },
        {
          "method": "org.eclipse.ui.texteditor.FindReplaceDialog.replaceAll",
          "source": "FindReplaceDialog.java:1173"
        },
        {
          "method": "org.eclipse.ui.texteditor.FindReplaceDialog.access$29",
          "source": "FindReplaceDialog.java:1138"
        },
        {
          "method": "org.eclipse.ui.texteditor.FindReplaceDialog$1$ReplaceAllRunnable.run",
          "source": "FindReplaceDialog.java:1043"
        },
        {
          "method": "org.eclipse.swt.custom.BusyIndicator.showWhile",
          "source": "BusyIndicator.java:65"
        },
        {
          "method": "org.eclipse.ui.texteditor.FindReplaceDialog.performReplaceAll",
          "source": "FindReplaceDialog.java:1048"
        },
        {
          "method": "org.eclipse.ui.texteditor.FindReplaceDialog.access$25",
          "source": "FindReplaceDialog.java:1032"
        },
        {
          "method": "org.eclipse.ui.texteditor.FindReplaceDialog$4.widgetSelected",
          "source": "FindReplaceDialog.java:290"
        },
        {
          "method": "org.eclipse.swt.widgets.TypedListener.handleEvent",
          "source": "TypedListener.java:87"
        },
        {
          "method": "org.eclipse.swt.widgets.EventTable.sendEvent",
          "source": "EventTable.java:77"
        },
        {
          "method": "org.eclipse.swt.widgets.Widget.sendEvent",
          "source": "Widget.java:836"
        },
        {
          "method": "org.eclipse.swt.widgets.Display.runDeferredEvents",
          "source": "Display.java:1692"
        },
        {
          "method": "org.eclipse.swt.widgets.Display.readAndDispatch",
          "source": "Display.java:1410"
        },
        {
          "method": "org.eclipse.ui.internal.Workbench.runEventLoop",
          "source": "Workbench.java:1240"
        },
        {
          "method": "org.eclipse.ui.internal.Workbench.run",
          "source": "Workbench.java:1223"
        },
        {
          "method": "org.eclipse.core.internal.boot.InternalBootLoader.run",
          "source": "InternalBootLoader.java:845"
        },
        {
          "method": "org.eclipse.core.boot.BootLoader.run",
          "source": "BootLoader.java:462"
        },
        {
          "method": "sun.reflect.NativeMethodAccessorImpl.invoke0",
          "source": "Native Method"
        },
        {
          "method": "sun.reflect.NativeMethodAccessorImpl.invoke",
          "source": "NativeMethodAccessorImpl.java:39"
        },
        {
          "method": "sun.reflect.DelegatingMethodAccessorImpl.invoke",
          "source": "DelegatingMethodAccessorImpl.java:25"
        },
        {
          "method": "java.lang.reflect.Method.invoke",
          "source": "Method.java:324"
        },
        {
          "method": "org.eclipse.core.launcher.Main.basicRun",
          "source": "Main.java:247"
        },
        {
          "method": "org.eclipse.core.launcher.Main.run",
          "source": "Main.java:703"
        },
        {
          "method": "org.eclipse.core.launcher.Main.main",
          "source": "Main.java:539"
        }
      ],
      "number": 0,
      "commentIndex": 0,
      "bugId": "30864",
      "date": "2003-02-04T14:35:13+01:00",
      "product": "Platform",
      "component": "Text",
      "severity": "normal"
    }
  ],
  "groupId": "30864",
  "bugId": "30864",
  "date": "2003-02-04T14:35:13+01:00",
  "product": "Platform",
  "component": "Text",
  "severity": "normal"
}