{
  "comments": [
    "Choosing Help-\u003eSoftware Updates-\u003eUpdate Manager results in en error dialog:\n\"The chosen operation is not currently available\".\n\n!ENTRY org.eclipse.ui 4 4 Feb 25, 2003 12:19:33.26\n!MESSAGE Could not create action delegate.\n!ENTRY org.eclipse.core.runtime 4 2 Feb 25, 2003 12:19:33.31\n!MESSAGE Plug-in org.eclipse.update.ui was unable to load class org.eclipse.upda\nte.internal.ui.UpdateManagerAction.\n!STACK 0\norg.eclipse.core.internal.boot.DelegatingURLClassLoader$DelegatingLoaderExceptio\nn: Attempt to load class \"org.eclipse.update.internal.ui.UpdateManagerAction\" fr\nom deactivated plug-in \"org.eclipse.update.ui\".\n        at org.eclipse.core.internal.plugins.PluginClassLoader.shouldLookForClas\ns(PluginClassLoader.java(Compiled Code))\n        at org.eclipse.core.internal.plugins.PluginClassLoader.internalFindClass\nParentsSelf(PluginClassLoader.java(Compiled Code))\n        at org.eclipse.core.internal.boot.DelegatingURLClassLoader.findClassPare\nntsSelf(DelegatingURLClassLoader.java(Compiled Code))\n        at org.eclipse.core.internal.boot.DelegatingURLClassLoader.loadClass(Del\negatingURLClassLoader.java(Compiled Code))\n        at org.eclipse.core.internal.boot.DelegatingURLClassLoader.loadClass(Del\negatingURLClassLoader.java(Compiled Code))\n        at java.lang.ClassLoader.loadClass(ClassLoader.java(Compiled Code))\n        at org.eclipse.core.internal.plugins.PluginDescriptor.createExecutableEx\ntension(PluginDescriptor.java(Compiled Code))\n        at org.eclipse.core.internal.plugins.PluginDescriptor.createExecutableEx\ntension(PluginDescriptor.java(Compiled Code))\n        at org.eclipse.core.internal.plugins.ConfigurationElement.createExecutab\nleExtension(ConfigurationElement.java(Compiled Code))\n        at org.eclipse.ui.internal.WorkbenchPlugin$1.run(WorkbenchPlugin.java:15\n8)\n        at org.eclipse.swt.custom.BusyIndicator.showWhile(BusyIndicator.java(Com\npiled Code))\n        at org.eclipse.ui.internal.WorkbenchPlugin.createExtension(WorkbenchPlug\nin.java(Compiled Code))\n        at org.eclipse.ui.internal.PluginAction.createDelegate(PluginAction.java\n(Compiled Code))\n        at org.eclipse.ui.internal.PluginAction.runWithEvent(PluginAction.java:2\n21)\n        at org.eclipse.ui.internal.WWinPluginAction.runWithEvent(WWinPluginActio\nn.java:202)\n        at org.eclipse.jface.action.ActionContributionItem.handleWidgetSelection\n(ActionContributionItem.java(Compiled Code))\n        at org.eclipse.jface.action.ActionContributionItem.handleWidgetEvent(Act\nionContributionItem.java(Compiled Code))\n        at org.eclipse.jface.action.ActionContributionItem$ActionListener.handle\nEvent(ActionContributionItem.java(Compiled Code))\n        at org.eclipse.jface.action.ActionContributionItem$ActionListener.handle\nEvent(ActionContributionItem.java(Compiled Code))\n        at org.eclipse.swt.widgets.EventTable.sendEvent(EventTable.java(Compiled\n Code))\n        at org.eclipse.swt.widgets.Display.runDeferredEvents(Display.java(Compil\ned Code))\n        at org.eclipse.swt.widgets.Display.runDeferredEvents(Display.java(Compil\ned Code))\n        at org.eclipse.swt.widgets.Display.readAndDispatch(Display.java(Compiled\n Code))\n        at org.eclipse.ui.internal.Workbench.runEventLoop(Workbench.java:1271)\n        at org.eclipse.ui.internal.Workbench.run(Workbench.java:1254)\n        at org.eclipse.core.internal.boot.InternalBootLoader.run(InternalBootLoa\nder.java:845)\n        at org.eclipse.core.boot.BootLoader.run(BootLoader.java:461)\n        at java.lang.reflect.Method.invoke(Native Method)\n        at org.eclipse.core.launcher.Main.basicRun(Main.java:247)\n        at org.eclipse.core.launcher.Main.run(Main.java:703)\n        at org.eclipse.core.launcher.Main.main(Main.java:539)",
    "\n\nIn new installation of Eclipse, trying to open Update Manager produces \nfollowing in the log:\n\n!SESSION Feb 25, 2003 12:43:03.763 --------------------------------------------\n-\njava.fullversion\u003dJ2RE 1.3.1 IBM AIX build ca1311-20011123a (JIT enabled: jitc)\nBootLoader constants: OS\u003daix, ARCH\u003dppc, WS\u003dmotif, NL\u003den_US\nCommand-line arguments: -os aix -ws motif -arch ppc -install file:/bluebird/tea\nmswt/kkolosow/e0221aixU/eclipse/\n!ENTRY org.eclipse.core.runtime 4 2 Feb 25, 2003 12:43:03.764\n!MESSAGE Problems occurred when invoking code from plug-in: \"org.eclipse.core.r\nuntime\".\n!STACK 0\njava.lang.IllegalArgumentException: argument number too large at \n        at java.text.MessageFormat.makeFormat(MessageFormat.java(Compiled Code)\n)\n        at java.text.MessageFormat.applyPattern(MessageFormat.java(Compiled Cod\ne))\n        at java.text.MessageFormat.\u003cinit\u003e(MessageFormat.java(Compiled Code))\n        at java.text.MessageFormat.format(MessageFormat.java(Compiled Code))\n        at org.eclipse.update.internal.ui.parts.ConfigurationInfo.getResourceSt\nring(ConfigurationInfo.java:195)\n        at org.eclipse.update.internal.ui.parts.AboutInfo.readINIFile(AboutInfo\n.java:232)\n        at org.eclipse.update.internal.ui.parts.ConfigurationInfo.readINIFile(C\nonfigurationInfo.java:100)\n        at org.eclipse.update.internal.ui.UpdateUI.readInfo(UpdateUI.java:392)\n        at org.eclipse.update.internal.ui.UpdateUI.startup(UpdateUI.java:142)\n        at org.eclipse.core.internal.plugins.PluginDescriptor$1.run(PluginDescr\niptor.java:728)\n        at org.eclipse.core.internal.runtime.InternalPlatform.run(InternalPlatf\norm.java(Compiled Code))\n        at org.eclipse.core.internal.plugins.PluginDescriptor.internalDoPluginA\nctivation(PluginDescriptor.java(Compiled Code))\n        at org.eclipse.core.internal.plugins.PluginDescriptor.doPluginActivatio\nn(PluginDescriptor.java(Compiled Code))\n        at org.eclipse.core.internal.plugins.PluginClassLoader.activatePlugin(P\nluginClassLoader.java(Compiled Code))\n        at org.eclipse.core.internal.plugins.PluginClassLoader.internalFindClas\nsParentsSelf(PluginClassLoader.java(Compiled Code))\n        at org.eclipse.core.internal.boot.DelegatingURLClassLoader.findClassPar\nentsSelf(DelegatingURLClassLoader.java(Compiled Code))\n        at org.eclipse.core.internal.boot.DelegatingURLClassLoader.loadClass(De\nlegatingURLClassLoader.java(Compiled Code))\n        at org.eclipse.core.internal.boot.DelegatingURLClassLoader.loadClass(De\nlegatingURLClassLoader.java(Compiled Code))\n        at org.eclipse.core.internal.plugins.PluginDescriptor.createExecutableE\nxtension(PluginDescriptor.java(Compiled Code))\n        at org.eclipse.core.internal.plugins.PluginDescriptor.createExecutableE\nxtension(PluginDescriptor.java(Compiled Code))\n        at org.eclipse.core.internal.plugins.PluginDescriptor.createExecutableE\nxtension(PluginDescriptor.java(Compiled Code))\n        at org.eclipse.core.internal.plugins.ConfigurationElement.createExecuta\nbleExtension(ConfigurationElement.java(Compiled Code))\n        at org.eclipse.ui.internal.WorkbenchPlugin$1.run(WorkbenchPlugin.java:1\n58)\n        at org.eclipse.swt.custom.BusyIndicator.showWhile(BusyIndicator.java(Co\nmpiled Code))\n        at org.eclipse.ui.internal.WorkbenchPlugin.createExtension(WorkbenchPlu\ngin.java:155)\n        at org.eclipse.ui.internal.PluginAction.createDelegate(PluginAction.jav\na:103)\n        at org.eclipse.ui.internal.PluginAction.runWithEvent(PluginAction.java:\n221)\n        at org.eclipse.ui.internal.WWinPluginAction.runWithEvent(WWinPluginActi\non.java:202)\n        at org.eclipse.jface.action.ActionContributionItem.handleWidgetSelectio\nn(ActionContributionItem.java:450)\n        at org.eclipse.jface.action.ActionContributionItem.handleWidgetEvent(Ac\ntionContributionItem.java:398)\n        at org.eclipse.jface.action.ActionContributionItem.access$0(ActionContr\nibutionItem.java:392)\n        at org.eclipse.jface.action.ActionContributionItem$ActionListener.handl\neEvent(ActionContributionItem.java:72)\n        at org.eclipse.swt.widgets.EventTable.sendEvent(EventTable.java(Compile\nd Code))\n        at org.eclipse.swt.widgets.Display.runDeferredEvents(Display.java(Compi\nled Code))\n        at org.eclipse.swt.widgets.Display.runDeferredEvents(Display.java(Compi\nled Code))\n        at org.eclipse.swt.widgets.Display.readAndDispatch(Display.java\n(Compiled Code))\n        at org.eclipse.ui.internal.Workbench.runEventLoop(Workbench.java:1271)\n        at org.eclipse.ui.internal.Workbench.run(Workbench.java:1254)\n        at org.eclipse.core.internal.boot.InternalBootLoader.run(InternalBootLo\nader.java:845)\n        at org.eclipse.core.boot.BootLoader.run(BootLoader.java:461)\n        at java.lang.reflect.Method.invoke(Native Method)\n        at org.eclipse.core.launcher.Main.basicRun(Main.java:247)\n        at org.eclipse.core.launcher.Main.run(Main.java:703)\n        at org.eclipse.core.launcher.Main.main(Main.java:539)\n!ENTRY org.eclipse.core.runtime 4 2 Feb 25, 2003 12:43:03.982\n!MESSAGE Plug-in org.eclipse.update.ui was unable to load class org.eclipse.upd\nate.internal.ui.UpdateManagerAction.\n!STACK 0\norg.eclipse.core.internal.boot.DelegatingLoaderException: org.eclipse.core.runt\nime.CoreException: Problems encountered starting up plug-in: \"org.eclipse.updat\ne.ui\".\n        at org.eclipse.core.internal.plugins.PluginDescriptor.internalDoPluginA\nctivation(PluginDescriptor.java(Compiled Code))\n        at org.eclipse.core.internal.plugins.PluginDescriptor.doPluginActivatio\nn(PluginDescriptor.java(Compiled Code))\n        at org.eclipse.core.internal.plugins.PluginClassLoader.activatePlugin(P\nluginClassLoader.java(Compiled Code))\n        at org.eclipse.core.internal.plugins.PluginClassLoader.internalFindClas\nsParentsSelf(PluginClassLoader.java(Compiled Code))\n        at org.eclipse.core.internal.boot.DelegatingURLClassLoader.findClassPar\nentsSelf(DelegatingURLClassLoader.java(Compiled Code))\n        at org.eclipse.core.internal.boot.DelegatingURLClassLoader.loadClass(De\nlegatingURLClassLoader.java(Compiled Code))\n        at org.eclipse.core.internal.boot.DelegatingURLClassLoader.loadClass(De\nlegatingURLClassLoader.java(Compiled Code))\n        at org.eclipse.core.internal.plugins.PluginDescriptor.createExecutableE\nxtension(PluginDescriptor.java(Compiled Code))\n        at org.eclipse.core.internal.plugins.PluginDescriptor.createExecutableE\nxtension(PluginDescriptor.java(Compiled Code))\n        at org.eclipse.core.internal.plugins.PluginDescriptor.createExecutableE\nxtension(PluginDescriptor.java(Compiled Code))\n        at org.eclipse.core.internal.plugins.ConfigurationElement.createExecuta\nbleExtension(ConfigurationElement.java(Compiled Code))\n        at org.eclipse.ui.internal.WorkbenchPlugin$1.run(WorkbenchPlugin.java:1\n58)\n        at org.eclipse.swt.custom.BusyIndicator.showWhile(BusyIndicator.java(Co\nmpiled Code))\n        at org.eclipse.ui.internal.WorkbenchPlugin.createExtension(WorkbenchPlu\ngin.java:155)\n        at org.eclipse.ui.internal.PluginAction.createDelegate(PluginAction.jav\na:103)\n        at org.eclipse.ui.internal.PluginAction.runWithEvent(PluginAction.java:\n221)\n        at org.eclipse.ui.internal.WWinPluginAction.runWithEvent(WWinPluginActi\non.java:202)\n        at org.eclipse.jface.action.ActionContributionItem.handleWidgetSelectio\nn(ActionContributionItem.java:450)\n        at org.eclipse.jface.action.ActionContributionItem.handleWidgetEvent(Ac\ntionContributionItem.java:398)\n        at org.eclipse.jface.action.ActionContributionItem.access$0(ActionContr\nibutionItem.java:392)\n        at org.eclipse.jface.action.ActionContributionItem$ActionListener.handl\neEvent(ActionContributionItem.java:72)\n        at org.eclipse.swt.widgets.EventTable.sendEvent(EventTable.java(Compile\nd Code))\n        at org.eclipse.swt.widgets.Display.runDeferredEvents(Display.java(Compi\nled Code))\n        at org.eclipse.swt.widgets.Display.runDeferredEvents(Display.java(Compi\nled Code))\n        at org.eclipse.swt.widgets.Display.readAndDispatch(Display.java(Compile\nd Code))\n        at org.eclipse.ui.internal.Workbench.runEventLoop(Workbench.java:1271)\n        at org.eclipse.ui.internal.Workbench.run(Workbench.java:1254)\n        at org.eclipse.core.internal.boot.InternalBootLoader.run(InternalBootLo\nader.java:845)\n        at org.eclipse.core.boot.BootLoader.run(BootLoader.java:461)\n        at java.lang.reflect.Method.invoke(Native Method)\n        at org.eclipse.core.launcher.Main.basicRun(Main.java:247)\n        at org.eclipse.core.launcher.Main.run(Main.java:703)\n        at org.eclipse.core.launcher.Main.main(Main.java:539)\n!ENTRY org.eclipse.ui 4 4 Feb 25, 2003 12:43:04.145\n!MESSAGE Could not create action delegate.\n!ENTRY org.eclipse.core.runtime 4 2 Feb 25, 2003 12:43:04.200\n!MESSAGE Plug-in org.eclipse.update.ui was unable to load class org.eclipse.upd\nate.internal.ui.UpdateManagerAction.\n!STACK 0\norg.eclipse.core.internal.boot.DelegatingLoaderException: org.eclipse.core.runt\nime.CoreException: Problems encountered starting up plug-in: \"org.eclipse.updat\ne.ui\".\n        at org.eclipse.core.internal.plugins.PluginDescriptor.internalDoPluginA\nctivation(PluginDescriptor.java(Compiled Code))\n        at org.eclipse.core.internal.plugins.PluginDescriptor.doPluginActivatio\nn(PluginDescriptor.java(Compiled Code))\n        at org.eclipse.core.internal.plugins.PluginClassLoader.activatePlugin(P\nluginClassLoader.java(Compiled Code))\n        at org.eclipse.core.internal.plugins.PluginClassLoader.internalFindClas\nsParentsSelf(PluginClassLoader.java(Compiled Code))\n        at org.eclipse.core.internal.boot.DelegatingURLClassLoader.findClassPar\nentsSelf(DelegatingURLClassLoader.java(Compiled Code))\n        at org.eclipse.core.internal.boot.DelegatingURLClassLoader.loadClass(De\nlegatingURLClassLoader.java(Compiled Code))\n        at org.eclipse.core.internal.boot.DelegatingURLClassLoader.loadClass(De\nlegatingURLClassLoader.java(Compiled Code))\n        at org.eclipse.core.internal.plugins.PluginDescriptor.createExecutableE\nxtension(PluginDescriptor.java(Compiled Code))\n        at org.eclipse.core.internal.plugins.PluginDescriptor.createExecutableE\nxtension(PluginDescriptor.java(Compiled Code))\n        at org.eclipse.core.internal.plugins.PluginDescriptor.createExecutableE\nxtension(PluginDescriptor.java(Compiled Code))\n        at org.eclipse.core.internal.plugins.ConfigurationElement.createExecuta\nbleExtension(ConfigurationElement.java(Compiled Code))\n        at org.eclipse.ui.internal.WorkbenchPlugin$1.run(WorkbenchPlugin.java:1\n58)\n        at org.eclipse.swt.custom.BusyIndicator.showWhile(BusyIndicator.java(Co\nmpiled Code))\n        at org.eclipse.ui.internal.WorkbenchPlugin.createExtension(WorkbenchPlu\ngin.java:155)\n        at org.eclipse.ui.internal.PluginAction.createDelegate(PluginAction.jav\na:103)\n        at org.eclipse.ui.internal.PluginAction.runWithEvent(PluginAction.java:\n221)\n        at org.eclipse.ui.internal.WWinPluginAction.runWithEvent(WWinPluginActi\non.java:202)\n        at org.eclipse.jface.action.ActionContributionItem.handleWidgetSelectio\nn(ActionContributionItem.java:450)\n        at org.eclipse.jface.action.ActionContributionItem.handleWidgetEvent(Ac\ntionContributionItem.java:398)\n        at org.eclipse.jface.action.ActionContributionItem.access$0(ActionContr\nibutionItem.java:392)\n        at org.eclipse.jface.action.ActionContributionItem$ActionListener.handl\neEvent(ActionContributionItem.java:72)\n        at org.eclipse.swt.widgets.EventTable.sendEvent(EventTable.java(Compile\nd Code))\n        at org.eclipse.swt.widgets.Display.runDeferredEvents(Display.java(Compi\nled Code))\n        at org.eclipse.swt.widgets.Display.runDeferredEvents(Display.java(Compi\nled Code))\n        at org.eclipse.swt.widgets.Display.readAndDispatch(Display.java(Compile\nd Code))\n        at org.eclipse.ui.internal.Workbench.runEventLoop(Workbench.java:1271)\n        at org.eclipse.ui.internal.Workbench.run(Workbench.java:1254)\n        at org.eclipse.core.internal.boot.InternalBootLoader.run(InternalBootLo\nader.java:845)\n        at org.eclipse.core.boot.BootLoader.run(BootLoader.java:461)\n        at java.lang.reflect.Method.invoke(Native Method)\n        at org.eclipse.core.launcher.Main.basicRun(Main.java:247)\n        at org.eclipse.core.launcher.Main.run(Main.java:703)\n        at org.eclipse.core.launcher.Main.main(Main.java:539)\n",
    "Same problem on HP.  Neither \"New Updates\" nor \"Update Manager\" actions work.  \nAnd perspective cannot be opened manually.",
    "It looks fixed in I20030307 RC2 candidate.  Update manager opens, and New \nUpdates action reports no updates on both AIX and HP.",
    "I think that RC1 was probably not built correctly for these platforms because I \ndidn\u0027t touch the code that now works. Could also be feature info or \ncustomization files for these platforms that is kept in separate files.\n\nClosing as fixed."
  ],
  "commentCreationDates": [
    "2003-02-25T17:23:34+01:00",
    "2003-02-25T17:49:32+01:00",
    "2003-02-26T21:01:48+01:00",
    "2003-03-07T17:53:08+01:00",
    "2003-03-07T18:12:07+01:00"
  ],
  "traces": [
    {
      "exceptionType": "java.lang.IllegalArgumentException",
      "message": "argument number too large at          at java.text.MessageFormat.makeFormat(MessageFormat.java(Compiled Code) )",
      "elements": [
        {
          "method": "java.text.MessageFormat.applyPattern",
          "source": "MessageFormat.java(Compiled Cod e)"
        },
        {
          "method": "java.text.MessageFormat.\u003cinit\u003e",
          "source": "MessageFormat.java(Compiled Code)"
        },
        {
          "method": "java.text.MessageFormat.format",
          "source": "MessageFormat.java(Compiled Code)"
        },
        {
          "method": "org.eclipse.update.internal.ui.parts.ConfigurationInfo.getResourceString",
          "source": "ConfigurationInfo.java:195"
        },
        {
          "method": "org.eclipse.update.internal.ui.parts.AboutInfo.readINIFile",
          "source": "AboutInfo .java:232"
        },
        {
          "method": "org.eclipse.update.internal.ui.parts.ConfigurationInfo.readINIFile",
          "source": "C onfigurationInfo.java:100"
        },
        {
          "method": "org.eclipse.update.internal.ui.UpdateUI.readInfo",
          "source": "UpdateUI.java:392"
        },
        {
          "method": "org.eclipse.update.internal.ui.UpdateUI.startup",
          "source": "UpdateUI.java:142"
        },
        {
          "method": "org.eclipse.core.internal.plugins.PluginDescriptor$1.run",
          "source": "PluginDescr iptor.java:728"
        },
        {
          "method": "org.eclipse.core.internal.runtime.InternalPlatform.run",
          "source": "InternalPlatf orm.java(Compiled Code)"
        },
        {
          "method": "org.eclipse.core.internal.plugins.PluginDescriptor.internalDoPluginActivation",
          "source": "PluginDescriptor.java(Compiled Code)"
        },
        {
          "method": "org.eclipse.core.internal.plugins.PluginDescriptor.doPluginActivation",
          "source": "PluginDescriptor.java(Compiled Code)"
        },
        {
          "method": "org.eclipse.core.internal.plugins.PluginClassLoader.activatePlugin",
          "source": "P luginClassLoader.java(Compiled Code)"
        },
        {
          "method": "org.eclipse.core.internal.plugins.PluginClassLoader.internalFindClassParentsSelf",
          "source": "PluginClassLoader.java(Compiled Code)"
        },
        {
          "method": "org.eclipse.core.internal.boot.DelegatingURLClassLoader.findClassParentsSelf",
          "source": "DelegatingURLClassLoader.java(Compiled Code)"
        },
        {
          "method": "org.eclipse.core.internal.boot.DelegatingURLClassLoader.loadClass",
          "source": "De legatingURLClassLoader.java(Compiled Code)"
        },
        {
          "method": "org.eclipse.core.internal.boot.DelegatingURLClassLoader.loadClass",
          "source": "De legatingURLClassLoader.java(Compiled Code)"
        },
        {
          "method": "org.eclipse.core.internal.plugins.PluginDescriptor.createExecutableExtension",
          "source": "PluginDescriptor.java(Compiled Code)"
        },
        {
          "method": "org.eclipse.core.internal.plugins.PluginDescriptor.createExecutableExtension",
          "source": "PluginDescriptor.java(Compiled Code)"
        },
        {
          "method": "org.eclipse.core.internal.plugins.PluginDescriptor.createExecutableExtension",
          "source": "PluginDescriptor.java(Compiled Code)"
        },
        {
          "method": "org.eclipse.core.internal.plugins.ConfigurationElement.createExecutableExtension",
          "source": "ConfigurationElement.java(Compiled Code)"
        },
        {
          "method": "org.eclipse.ui.internal.WorkbenchPlugin$1.run",
          "source": "WorkbenchPlugin.java:1 58"
        },
        {
          "method": "org.eclipse.swt.custom.BusyIndicator.showWhile",
          "source": "BusyIndicator.java(Co mpiled Code)"
        },
        {
          "method": "org.eclipse.ui.internal.WorkbenchPlugin.createExtension",
          "source": "WorkbenchPlu gin.java:155"
        },
        {
          "method": "org.eclipse.ui.internal.PluginAction.createDelegate",
          "source": "PluginAction.jav a:103"
        },
        {
          "method": "org.eclipse.ui.internal.PluginAction.runWithEvent",
          "source": "PluginAction.java: 221"
        },
        {
          "method": "org.eclipse.ui.internal.WWinPluginAction.runWithEvent",
          "source": "WWinPluginActi on.java:202"
        },
        {
          "method": "org.eclipse.jface.action.ActionContributionItem.handleWidgetSelection",
          "source": "ActionContributionItem.java:450"
        },
        {
          "method": "org.eclipse.jface.action.ActionContributionItem.handleWidgetEvent",
          "source": "Ac tionContributionItem.java:398"
        },
        {
          "method": "org.eclipse.jface.action.ActionContributionItem.access$0",
          "source": "ActionContr ibutionItem.java:392"
        },
        {
          "method": "org.eclipse.jface.action.ActionContributionItem$ActionListener.handleEvent",
          "source": "ActionContributionItem.java:72"
        },
        {
          "method": "org.eclipse.swt.widgets.EventTable.sendEvent",
          "source": "EventTable.java(Compile d Code)"
        },
        {
          "method": "org.eclipse.swt.widgets.Display.runDeferredEvents",
          "source": "Display.java(Compi led Code)"
        },
        {
          "method": "org.eclipse.swt.widgets.Display.runDeferredEvents",
          "source": "Display.java(Compi led Code)"
        },
        {
          "method": "org.eclipse.swt.widgets.Display.readAndDispatch",
          "source": "Display.java (Compiled Code)"
        },
        {
          "method": "org.eclipse.ui.internal.Workbench.runEventLoop",
          "source": "Workbench.java:1271"
        },
        {
          "method": "org.eclipse.ui.internal.Workbench.run",
          "source": "Workbench.java:1254"
        },
        {
          "method": "org.eclipse.core.internal.boot.InternalBootLoader.run",
          "source": "InternalBootLo ader.java:845"
        },
        {
          "method": "org.eclipse.core.boot.BootLoader.run",
          "source": "BootLoader.java:461"
        },
        {
          "method": "java.lang.reflect.Method.invoke",
          "source": "Native Method"
        },
        {
          "method": "org.eclipse.core.launcher.Main.basicRun",
          "source": "Main.java:247"
        },
        {
          "method": "org.eclipse.core.launcher.Main.run",
          "source": "Main.java:703"
        },
        {
          "method": "org.eclipse.core.launcher.Main.main",
          "source": "Main.java:539"
        }
      ],
      "number": 0,
      "commentIndex": 1,
      "bugId": "33036",
      "date": "2003-02-25T17:49:32+01:00",
      "product": "Platform",
      "component": "Update",
      "severity": "normal"
    },
    {
      "exceptionType": "ime.CoreException",
      "message": "Problems encountered starting up plug-in: \"org.eclipse.updat e.ui\".",
      "elements": [
        {
          "method": "org.eclipse.core.internal.plugins.PluginDescriptor.internalDoPluginActivation",
          "source": "PluginDescriptor.java(Compiled Code)"
        },
        {
          "method": "org.eclipse.core.internal.plugins.PluginDescriptor.doPluginActivation",
          "source": "PluginDescriptor.java(Compiled Code)"
        },
        {
          "method": "org.eclipse.core.internal.plugins.PluginClassLoader.activatePlugin",
          "source": "P luginClassLoader.java(Compiled Code)"
        },
        {
          "method": "org.eclipse.core.internal.plugins.PluginClassLoader.internalFindClassParentsSelf",
          "source": "PluginClassLoader.java(Compiled Code)"
        },
        {
          "method": "org.eclipse.core.internal.boot.DelegatingURLClassLoader.findClassParentsSelf",
          "source": "DelegatingURLClassLoader.java(Compiled Code)"
        },
        {
          "method": "org.eclipse.core.internal.boot.DelegatingURLClassLoader.loadClass",
          "source": "De legatingURLClassLoader.java(Compiled Code)"
        },
        {
          "method": "org.eclipse.core.internal.boot.DelegatingURLClassLoader.loadClass",
          "source": "De legatingURLClassLoader.java(Compiled Code)"
        },
        {
          "method": "org.eclipse.core.internal.plugins.PluginDescriptor.createExecutableExtension",
          "source": "PluginDescriptor.java(Compiled Code)"
        },
        {
          "method": "org.eclipse.core.internal.plugins.PluginDescriptor.createExecutableExtension",
          "source": "PluginDescriptor.java(Compiled Code)"
        },
        {
          "method": "org.eclipse.core.internal.plugins.PluginDescriptor.createExecutableExtension",
          "source": "PluginDescriptor.java(Compiled Code)"
        },
        {
          "method": "org.eclipse.core.internal.plugins.ConfigurationElement.createExecutableExtension",
          "source": "ConfigurationElement.java(Compiled Code)"
        },
        {
          "method": "org.eclipse.ui.internal.WorkbenchPlugin$1.run",
          "source": "WorkbenchPlugin.java:1 58"
        },
        {
          "method": "org.eclipse.swt.custom.BusyIndicator.showWhile",
          "source": "BusyIndicator.java(Co mpiled Code)"
        },
        {
          "method": "org.eclipse.ui.internal.WorkbenchPlugin.createExtension",
          "source": "WorkbenchPlu gin.java:155"
        },
        {
          "method": "org.eclipse.ui.internal.PluginAction.createDelegate",
          "source": "PluginAction.jav a:103"
        },
        {
          "method": "org.eclipse.ui.internal.PluginAction.runWithEvent",
          "source": "PluginAction.java: 221"
        },
        {
          "method": "org.eclipse.ui.internal.WWinPluginAction.runWithEvent",
          "source": "WWinPluginActi on.java:202"
        },
        {
          "method": "org.eclipse.jface.action.ActionContributionItem.handleWidgetSelection",
          "source": "ActionContributionItem.java:450"
        },
        {
          "method": "org.eclipse.jface.action.ActionContributionItem.handleWidgetEvent",
          "source": "Ac tionContributionItem.java:398"
        },
        {
          "method": "org.eclipse.jface.action.ActionContributionItem.access$0",
          "source": "ActionContr ibutionItem.java:392"
        },
        {
          "method": "org.eclipse.jface.action.ActionContributionItem$ActionListener.handleEvent",
          "source": "ActionContributionItem.java:72"
        },
        {
          "method": "org.eclipse.swt.widgets.EventTable.sendEvent",
          "source": "EventTable.java(Compile d Code)"
        },
        {
          "method": "org.eclipse.swt.widgets.Display.runDeferredEvents",
          "source": "Display.java(Compi led Code)"
        },
        {
          "method": "org.eclipse.swt.widgets.Display.runDeferredEvents",
          "source": "Display.java(Compi led Code)"
        },
        {
          "method": "org.eclipse.swt.widgets.Display.readAndDispatch",
          "source": "Display.java(Compile d Code)"
        },
        {
          "method": "org.eclipse.ui.internal.Workbench.runEventLoop",
          "source": "Workbench.java:1271"
        },
        {
          "method": "org.eclipse.ui.internal.Workbench.run",
          "source": "Workbench.java:1254"
        },
        {
          "method": "org.eclipse.core.internal.boot.InternalBootLoader.run",
          "source": "InternalBootLo ader.java:845"
        },
        {
          "method": "org.eclipse.core.boot.BootLoader.run",
          "source": "BootLoader.java:461"
        },
        {
          "method": "java.lang.reflect.Method.invoke",
          "source": "Native Method"
        },
        {
          "method": "org.eclipse.core.launcher.Main.basicRun",
          "source": "Main.java:247"
        },
        {
          "method": "org.eclipse.core.launcher.Main.run",
          "source": "Main.java:703"
        },
        {
          "method": "org.eclipse.core.launcher.Main.main",
          "source": "Main.java:539"
        }
      ],
      "number": 1,
      "commentIndex": 1,
      "bugId": "33036",
      "date": "2003-02-25T17:49:32+01:00",
      "product": "Platform",
      "component": "Update",
      "severity": "normal"
    },
    {
      "exceptionType": "ime.CoreException",
      "message": "Problems encountered starting up plug-in: \"org.eclipse.updat e.ui\".",
      "elements": [
        {
          "method": "org.eclipse.core.internal.plugins.PluginDescriptor.internalDoPluginActivation",
          "source": "PluginDescriptor.java(Compiled Code)"
        },
        {
          "method": "org.eclipse.core.internal.plugins.PluginDescriptor.doPluginActivation",
          "source": "PluginDescriptor.java(Compiled Code)"
        },
        {
          "method": "org.eclipse.core.internal.plugins.PluginClassLoader.activatePlugin",
          "source": "P luginClassLoader.java(Compiled Code)"
        },
        {
          "method": "org.eclipse.core.internal.plugins.PluginClassLoader.internalFindClassParentsSelf",
          "source": "PluginClassLoader.java(Compiled Code)"
        },
        {
          "method": "org.eclipse.core.internal.boot.DelegatingURLClassLoader.findClassParentsSelf",
          "source": "DelegatingURLClassLoader.java(Compiled Code)"
        },
        {
          "method": "org.eclipse.core.internal.boot.DelegatingURLClassLoader.loadClass",
          "source": "De legatingURLClassLoader.java(Compiled Code)"
        },
        {
          "method": "org.eclipse.core.internal.boot.DelegatingURLClassLoader.loadClass",
          "source": "De legatingURLClassLoader.java(Compiled Code)"
        },
        {
          "method": "org.eclipse.core.internal.plugins.PluginDescriptor.createExecutableExtension",
          "source": "PluginDescriptor.java(Compiled Code)"
        },
        {
          "method": "org.eclipse.core.internal.plugins.PluginDescriptor.createExecutableExtension",
          "source": "PluginDescriptor.java(Compiled Code)"
        },
        {
          "method": "org.eclipse.core.internal.plugins.PluginDescriptor.createExecutableExtension",
          "source": "PluginDescriptor.java(Compiled Code)"
        },
        {
          "method": "org.eclipse.core.internal.plugins.ConfigurationElement.createExecutableExtension",
          "source": "ConfigurationElement.java(Compiled Code)"
        },
        {
          "method": "org.eclipse.ui.internal.WorkbenchPlugin$1.run",
          "source": "WorkbenchPlugin.java:1 58"
        },
        {
          "method": "org.eclipse.swt.custom.BusyIndicator.showWhile",
          "source": "BusyIndicator.java(Co mpiled Code)"
        },
        {
          "method": "org.eclipse.ui.internal.WorkbenchPlugin.createExtension",
          "source": "WorkbenchPlu gin.java:155"
        },
        {
          "method": "org.eclipse.ui.internal.PluginAction.createDelegate",
          "source": "PluginAction.jav a:103"
        },
        {
          "method": "org.eclipse.ui.internal.PluginAction.runWithEvent",
          "source": "PluginAction.java: 221"
        },
        {
          "method": "org.eclipse.ui.internal.WWinPluginAction.runWithEvent",
          "source": "WWinPluginActi on.java:202"
        },
        {
          "method": "org.eclipse.jface.action.ActionContributionItem.handleWidgetSelection",
          "source": "ActionContributionItem.java:450"
        },
        {
          "method": "org.eclipse.jface.action.ActionContributionItem.handleWidgetEvent",
          "source": "Ac tionContributionItem.java:398"
        },
        {
          "method": "org.eclipse.jface.action.ActionContributionItem.access$0",
          "source": "ActionContr ibutionItem.java:392"
        },
        {
          "method": "org.eclipse.jface.action.ActionContributionItem$ActionListener.handleEvent",
          "source": "ActionContributionItem.java:72"
        },
        {
          "method": "org.eclipse.swt.widgets.EventTable.sendEvent",
          "source": "EventTable.java(Compile d Code)"
        },
        {
          "method": "org.eclipse.swt.widgets.Display.runDeferredEvents",
          "source": "Display.java(Compi led Code)"
        },
        {
          "method": "org.eclipse.swt.widgets.Display.runDeferredEvents",
          "source": "Display.java(Compi led Code)"
        },
        {
          "method": "org.eclipse.swt.widgets.Display.readAndDispatch",
          "source": "Display.java(Compile d Code)"
        },
        {
          "method": "org.eclipse.ui.internal.Workbench.runEventLoop",
          "source": "Workbench.java:1271"
        },
        {
          "method": "org.eclipse.ui.internal.Workbench.run",
          "source": "Workbench.java:1254"
        },
        {
          "method": "org.eclipse.core.internal.boot.InternalBootLoader.run",
          "source": "InternalBootLo ader.java:845"
        },
        {
          "method": "org.eclipse.core.boot.BootLoader.run",
          "source": "BootLoader.java:461"
        },
        {
          "method": "java.lang.reflect.Method.invoke",
          "source": "Native Method"
        },
        {
          "method": "org.eclipse.core.launcher.Main.basicRun",
          "source": "Main.java:247"
        },
        {
          "method": "org.eclipse.core.launcher.Main.run",
          "source": "Main.java:703"
        },
        {
          "method": "org.eclipse.core.launcher.Main.main",
          "source": "Main.java:539"
        }
      ],
      "number": 2,
      "commentIndex": 1,
      "bugId": "33036",
      "date": "2003-02-25T17:49:32+01:00",
      "product": "Platform",
      "component": "Update",
      "severity": "normal"
    }
  ],
  "groupId": "33036",
  "bugId": "33036",
  "date": "2003-02-25T17:23:34+01:00",
  "product": "Platform",
  "component": "Update",
  "severity": "normal"
}