{
  "comments": [
    "when the eclipseDir/workspace/cvsModuleName/.project file contains a CVS tag as\ncomment on the second line, I get first a window:\n\n\u003c\u003cProblems during startup. Check the \".log\" file in the \".metadata\" directory of\nyour workspace.\u003e\u003e\n\nThen I went to that file:\n\u003c\u003c!SESSION ----------------------------------------------------------------------\n!ENTRY org.eclipse.core.launcher 4 0 Apr 12, 2003 14:51:42.294\n!MESSAGE Exception launching the Eclipse Platform:\n!STACK\njava.lang.reflect.InvocationTargetException\n\tat sun.reflect.NativeMethodAccessorImpl.invoke0(Native Method)\n\tat sun.reflect.NativeMethodAccessorImpl.invoke(NativeMethodAccessorImpl.java:39)\n\tat\nsun.reflect.DelegatingMethodAccessorImpl.invoke(DelegatingMethodAccessorImpl.java:25)\n\tat java.lang.reflect.Method.invoke(Method.java:324)\n\tat org.eclipse.core.launcher.Main.basicRun(Main.java:247)\n\tat org.eclipse.core.launcher.Main.run(Main.java:703)\n\tat org.eclipse.core.launcher.Main.main(Main.java:539)\nCaused by: java.lang.IllegalArgumentException: Application not found:\norg.eclipse.ui.workbench.\n\tat\norg.eclipse.core.internal.boot.InternalBootLoader.run(InternalBootLoader.java:829)\n\tat org.eclipse.core.boot.BootLoader.run(BootLoader.java:462)\n\t... 7 more\u003e\u003e\n\nThx to bug http://bugs.eclipse.org/bugs/show_bug.cgi?id\u003d32404 that I figured out\nthat the .project file was the cause.\n\nMoving the line\n\u003c!-- $Id: .project,v 1.6 2003/04/12 14:24:41 hauser Exp $ --\u003e\nfrom line 2 to the end of .project solved the problem...\n\nConclusion:\nIt appears that xml comments are not properly treated? (or is there a rule that\nno comments are allowed on line 2 of a file?)\n\nP.S.: Did the same to .classpath (no complaint when xml comment on line 2)",
    "This file is auto-generated, and we may overwrite it at any time and delete your\ncomment.  You shouldn\u0027t be adding extra things in there.\n\nThis bug occurs on Eclipse 2.0 only.  In Eclipse 2.1, the .project file parser\nwill tolerate and ignore comments.\n\nI\u0027m going to close since the bug is 2.0 only, and is not really a valid use case.",
    "right, I got to 2.1 since and it no longer happens.\n\nHowever, wouldn\u0027t it be good to label all the files that are auto-generated and\nthus shouldn\u0027t be checked into CVS or alike with a corresponding warning comment?"
  ],
  "commentCreationDates": [
    "2003-04-12T15:35:36+02:00",
    "2003-04-23T18:59:54+02:00",
    "2003-04-23T19:56:44+02:00"
  ],
  "traces": [
    {
      "exceptionType": "java.lang.reflect.InvocationTargetException",
      "elements": [
        {
          "method": "sun.reflect.NativeMethodAccessorImpl.invoke0",
          "source": "Native Method"
        },
        {
          "method": "sun.reflect.NativeMethodAccessorImpl.invoke",
          "source": "NativeMethodAccessorImpl.java:39"
        },
        {
          "method": "sun.reflect.DelegatingMethodAccessorImpl.invoke",
          "source": "DelegatingMethodAccessorImpl.java:25"
        },
        {
          "method": "java.lang.reflect.Method.invoke",
          "source": "Method.java:324"
        },
        {
          "method": "org.eclipse.core.launcher.Main.basicRun",
          "source": "Main.java:247"
        },
        {
          "method": "org.eclipse.core.launcher.Main.run",
          "source": "Main.java:703"
        },
        {
          "method": "org.eclipse.core.launcher.Main.main",
          "source": "Main.java:539"
        }
      ],
      "causedBy": {
        "exceptionType": "java.lang.IllegalArgumentException",
        "message": "Application not found: org.eclipse.ui.workbench.",
        "elements": [
          {
            "method": "org.eclipse.core.internal.boot.InternalBootLoader.run",
            "source": "InternalBootLoader.java:829"
          },
          {
            "method": "org.eclipse.core.boot.BootLoader.run",
            "source": "BootLoader.java:462"
          }
        ],
        "number": 0,
        "commentIndex": 0
      },
      "number": 0,
      "commentIndex": 0,
      "bugId": "36426",
      "date": "2003-04-12T15:35:36+02:00",
      "product": "Platform",
      "component": "Resources",
      "severity": "normal"
    }
  ],
  "groupId": "36426",
  "bugId": "36426",
  "date": "2003-04-12T15:35:36+02:00",
  "product": "Platform",
  "component": "Resources",
  "severity": "normal"
}