{
  "comments": [
    "The Javadoc for the org.eclipse.swt.widgets.Combo.select() methods says that \nindecies that are out of range are ignored by on the Mac platform I get the \nfollowing exception:\n\njava.lang.IllegalArgumentException: Index out of bounds\n         at org.eclipse.swt.SWT.error(SWT.java:2318)\n         at org.eclipse.swt.SWT.error(SWT.java:2262)\n         at org.eclipse.swt.widgets.Widget.error(Widget.java:506)\n         at org.eclipse.swt.widgets.Combo.select(Combo.java:1155)\n\nI found the following line in the source code, which I assume is where the \nexception is being thrown:\n\nif (0 \u003e index || index \u003e\u003d count) error (SWT.ERROR_INVALID_RANGE);\n\nThis causes the Mac platform to behave differently then other platforms and \nfrom the way the document says it should work.",
    "fixed in HEAD \u003e 20030529\n"
  ],
  "commentCreationDates": [
    "2003-05-29T04:56:04+02:00",
    "2003-05-29T19:53:42+02:00"
  ],
  "traces": [
    {
      "exceptionType": "java.lang.IllegalArgumentException",
      "message": "Index out of bounds",
      "elements": [
        {
          "method": "org.eclipse.swt.SWT.error",
          "source": "SWT.java:2318"
        },
        {
          "method": "org.eclipse.swt.SWT.error",
          "source": "SWT.java:2262"
        },
        {
          "method": "org.eclipse.swt.widgets.Widget.error",
          "source": "Widget.java:506"
        },
        {
          "method": "org.eclipse.swt.widgets.Combo.select",
          "source": "Combo.java:1155"
        }
      ],
      "number": 0,
      "commentIndex": 0,
      "bugId": "38221",
      "date": "2003-05-29T04:56:04+02:00",
      "product": "Platform",
      "component": "SWT",
      "severity": "normal"
    }
  ],
  "groupId": "38221",
  "bugId": "38221",
  "date": "2003-05-29T04:56:04+02:00",
  "product": "Platform",
  "component": "SWT",
  "severity": "normal"
}