{
  "comments": [
    "Here is the compiler output. Source code below.\n---\nC:\\devel\\test\\entAJtutorial\\test\u003eajc Processing.java\nC:\\devel\\test\\entAJtutorial\\test\\Processing.java:17 this affected type is not \nex\nposed to the weaver: java.lang.Void (needed for privileged access) \n[Xlint:typeNo\ntExposedToWeaver]\njava.lang.NullPointerException\n        at \norg.eclipse.jdt.internal.compiler.lookup.SyntheticAccessMethodBinding\n.initializeConstructorAccessor(SyntheticAccessMethodBinding.java:215)\n        at \norg.eclipse.jdt.internal.compiler.lookup.SyntheticAccessMethodBinding\n.\u003cinit\u003e(SyntheticAccessMethodBinding.java:136)\n        at \norg.eclipse.jdt.internal.compiler.lookup.SourceTypeBinding.addSynthet\nicMethod(SourceTypeBinding.java:332)\n        at \norg.eclipse.jdt.internal.compiler.ast.AllocationExpression.manageSynt\nheticAccessIfNecessary(AllocationExpression.java:200)\n        at \norg.eclipse.jdt.internal.compiler.ast.AllocationExpression.analyseCod\ne(AllocationExpression.java:60)\n        at org.eclipse.jdt.internal.compiler.ast.ReturnStatement.analyseCode\n(Ret\nurnStatement.java:37)\n        at org.eclipse.jdt.internal.compiler.ast.Block.analyseCode\n(Block.java:41\n)\n        at org.eclipse.jdt.internal.compiler.ast.IfStatement.analyseCode\n(IfState\nment.java:84)\n        at org.eclipse.jdt.internal.compiler.ast.MethodDeclaration.analyseCode\n(M\nethodDeclaration.java:70)\n        at \norg.eclipse.jdt.internal.compiler.ast.TypeDeclaration.internalAnalyse\nCode(TypeDeclaration.java:639)\n        at org.eclipse.jdt.internal.compiler.ast.TypeDeclaration.analyseCode\n(Typ\neDeclaration.java:196)\n        at \norg.eclipse.jdt.internal.compiler.ast.CompilationUnitDeclaration.anal\nyseCode(CompilationUnitDeclaration.java:78)\n        at org.eclipse.jdt.internal.compiler.Compiler.process\n(Compiler.java:541)\n\n        at org.aspectj.ajdt.internal.compiler.AjCompiler.process\n(AjCompiler.java\n:65)\n        at org.eclipse.jdt.internal.compiler.Compiler.compile\n(Compiler.java:338)\n\n        at \norg.aspectj.ajdt.internal.core.builder.AjBuildManager.performCompilat\nion(AjBuildManager.java:372)\n        at org.aspectj.ajdt.internal.core.builder.AjBuildManager.doBuild\n(AjBuild\nManager.java:133)\n        at org.aspectj.ajdt.internal.core.builder.AjBuildManager.batchBuild\n(AjBu\nildManager.java:78)\n        at org.aspectj.ajdt.ajc.AjdtCommand.doCommand(AjdtCommand.java:106)\n        at org.aspectj.ajdt.ajc.AjdtCommand.runCommand(AjdtCommand.java:60)\n        at org.aspectj.tools.ajc.Main.run(Main.java:217)\n        at org.aspectj.tools.ajc.Main.runMain(Main.java:155)\n        at org.aspectj.tools.ajc.Main.main(Main.java:72)\nC:\\devel\\test\\entAJtutorial\\test\\Processing.java:0 Internal compiler error\njava.lang.NullPointerException\n        at \norg.eclipse.jdt.internal.compiler.lookup.SyntheticAccessMethodBinding\n.initializeConstructorAccessor(SyntheticAccessMethodBinding.java:215)\n        at \norg.eclipse.jdt.internal.compiler.lookup.SyntheticAccessMethodBinding\n.\u003cinit\u003e(SyntheticAccessMethodBinding.java:136)\n        at \norg.eclipse.jdt.internal.compiler.lookup.SourceTypeBinding.addSynthet\nicMethod(SourceTypeBinding.java:332)\n        at \norg.eclipse.jdt.internal.compiler.ast.AllocationExpression.manageSynt\nheticAccessIfNecessary(AllocationExpression.java:200)\n        at \norg.eclipse.jdt.internal.compiler.ast.AllocationExpression.analyseCod\ne(AllocationExpression.java:60)\n        at org.eclipse.jdt.internal.compiler.ast.ReturnStatement.analyseCode\n(Ret\nurnStatement.java:37)\n        at org.eclipse.jdt.internal.compiler.ast.Block.analyseCode\n(Block.java:41\n)\n        at org.eclipse.jdt.internal.compiler.ast.IfStatement.analyseCode\n(IfState\nment.java:84)\n        at org.eclipse.jdt.internal.compiler.ast.MethodDeclaration.analyseCode\n(M\nethodDeclaration.java:70)\n        at \norg.eclipse.jdt.internal.compiler.ast.TypeDeclaration.internalAnalyse\nCode(TypeDeclaration.java:639)\n        at org.eclipse.jdt.internal.compiler.ast.TypeDeclaration.analyseCode\n(Typ\neDeclaration.java:196)\n        at \norg.eclipse.jdt.internal.compiler.ast.CompilationUnitDeclaration.anal\nyseCode(CompilationUnitDeclaration.java:78)\n        at org.eclipse.jdt.internal.compiler.Compiler.process\n(Compiler.java:541)\n\n        at org.aspectj.ajdt.internal.compiler.AjCompiler.process\n(AjCompiler.java\n:65)\n        at org.eclipse.jdt.internal.compiler.Compiler.compile\n(Compiler.java:338)\n\n        at \norg.aspectj.ajdt.internal.core.builder.AjBuildManager.performCompilat\nion(AjBuildManager.java:372)\n        at org.aspectj.ajdt.internal.core.builder.AjBuildManager.doBuild\n(AjBuild\nManager.java:133)\n        at org.aspectj.ajdt.internal.core.builder.AjBuildManager.batchBuild\n(AjBu\nildManager.java:78)\n        at org.aspectj.ajdt.ajc.AjdtCommand.doCommand(AjdtCommand.java:106)\n        at org.aspectj.ajdt.ajc.AjdtCommand.runCommand(AjdtCommand.java:60)\n        at org.aspectj.tools.ajc.Main.run(Main.java:217)\n        at org.aspectj.tools.ajc.Main.runMain(Main.java:155)\n        at org.aspectj.tools.ajc.Main.main(Main.java:72)\n\n\n!! no source information available !!\nABORT\nException thrown from AspectJ 1.1.0\n\nThis might be logged as a bug already -- find current bugs at\n  http://bugs.eclipse.org/bugs/buglist.cgi?product\u003dAspectJ\u0026component\u003dCompiler\n\nBugs for exceptions thrown have titles File:line from the top stack,\ne.g., \"SomeFile.java:243\"\n\nIf you don\u0027t find the exception below in a bug, please add a new bug\nat http://bugs.eclipse.org/bugs/enter_bug.cgi?product\u003dAspectJ\nTo make the bug a priority, please include a test program\nthat can reproduce this exception.\nnull\njava.lang.NullPointerException\n        at \norg.eclipse.jdt.internal.compiler.lookup.SyntheticAccessMethodBinding\n.initializeConstructorAccessor(SyntheticAccessMethodBinding.java:215)\n        at \norg.eclipse.jdt.internal.compiler.lookup.SyntheticAccessMethodBinding\n.\u003cinit\u003e(SyntheticAccessMethodBinding.java:136)\n        at \norg.eclipse.jdt.internal.compiler.lookup.SourceTypeBinding.addSynthet\nicMethod(SourceTypeBinding.java:332)\n        at \norg.eclipse.jdt.internal.compiler.ast.AllocationExpression.manageSynt\nheticAccessIfNecessary(AllocationExpression.java:200)\n        at \norg.eclipse.jdt.internal.compiler.ast.AllocationExpression.analyseCod\ne(AllocationExpression.java:60)\n        at org.eclipse.jdt.internal.compiler.ast.ReturnStatement.analyseCode\n(Ret\nurnStatement.java:37)\n        at org.eclipse.jdt.internal.compiler.ast.Block.analyseCode\n(Block.java:41\n)\n        at org.eclipse.jdt.internal.compiler.ast.IfStatement.analyseCode\n(IfState\nment.java:84)\n        at org.eclipse.jdt.internal.compiler.ast.MethodDeclaration.analyseCode\n(M\nethodDeclaration.java:70)\n        at \norg.eclipse.jdt.internal.compiler.ast.TypeDeclaration.internalAnalyse\nCode(TypeDeclaration.java:639)\n        at org.eclipse.jdt.internal.compiler.ast.TypeDeclaration.analyseCode\n(Typ\neDeclaration.java:196)\n        at \norg.eclipse.jdt.internal.compiler.ast.CompilationUnitDeclaration.anal\nyseCode(CompilationUnitDeclaration.java:78)\n        at org.eclipse.jdt.internal.compiler.Compiler.process\n(Compiler.java:541)\n\n        at org.aspectj.ajdt.internal.compiler.AjCompiler.process\n(AjCompiler.java\n:65)\n        at org.eclipse.jdt.internal.compiler.Compiler.compile\n(Compiler.java:338)\n\n        at \norg.aspectj.ajdt.internal.core.builder.AjBuildManager.performCompilat\nion(AjBuildManager.java:372)\n        at org.aspectj.ajdt.internal.core.builder.AjBuildManager.doBuild\n(AjBuild\nManager.java:133)\n        at org.aspectj.ajdt.internal.core.builder.AjBuildManager.batchBuild\n(AjBu\nildManager.java:78)\n        at org.aspectj.ajdt.ajc.AjdtCommand.doCommand(AjdtCommand.java:106)\n        at org.aspectj.ajdt.ajc.AjdtCommand.runCommand(AjdtCommand.java:60)\n        at org.aspectj.tools.ajc.Main.run(Main.java:217)\n        at org.aspectj.tools.ajc.Main.runMain(Main.java:155)\n        at org.aspectj.tools.ajc.Main.main(Main.java:72)\n\n\n1 fail|abort, 1 error, 1 warning\n\nProcessing.java source:\n---\nimport org.aspectj.lang.*;\nimport org.aspectj.lang.reflect.*;\nimport java.lang.reflect.Method;\n\npublic aspect Processing {\n    Object around() : \n            call(new(..))  {\n        return proceed();\n    }\n\n    \n    Object around() : \n             call(* *(..)) {\n        MethodSignature sig \u003d (MethodSignature)thisJoinPoint.getSignature();\n        Class returnType \u003d sig.getReturnType();\n        if (returnType \u003d\u003d java.lang.Void.TYPE) {\n            return new java.lang.Void(); // this works if you make it null\n        } \n    }\n}",
    "Raised priority because this awful error message was simple to fix\ntest in bugs/NewVoid.java, fix in cvs",
    "updated target milestone field to 1.1.1"
  ],
  "commentCreationDates": [
    "2003-06-30T05:42:42+02:00",
    "2003-07-03T01:13:57+02:00",
    "2003-08-28T14:05:36+02:00"
  ],
  "traces": [
    {
      "exceptionType": "java.lang.NullPointerException",
      "elements": [
        {
          "method": "org.eclipse.jdt.internal.compiler.lookup.SyntheticAccessMethodBinding.initializeConstructorAccessor",
          "source": "SyntheticAccessMethodBinding.java:215"
        },
        {
          "method": "org.eclipse.jdt.internal.compiler.lookup.SyntheticAccessMethodBinding.\u003cinit\u003e",
          "source": "SyntheticAccessMethodBinding.java:136"
        },
        {
          "method": "org.eclipse.jdt.internal.compiler.lookup.SourceTypeBinding.addSyntheticMethod",
          "source": "SourceTypeBinding.java:332"
        },
        {
          "method": "org.eclipse.jdt.internal.compiler.ast.AllocationExpression.manageSyntheticAccessIfNecessary",
          "source": "AllocationExpression.java:200"
        },
        {
          "method": "org.eclipse.jdt.internal.compiler.ast.AllocationExpression.analyseCode",
          "source": "AllocationExpression.java:60"
        },
        {
          "method": "org.eclipse.jdt.internal.compiler.ast.ReturnStatement.analyseCode",
          "source": "Ret urnStatement.java:37"
        },
        {
          "method": "org.eclipse.jdt.internal.compiler.ast.Block.analyseCode",
          "source": "Block.java:41 "
        },
        {
          "method": "org.eclipse.jdt.internal.compiler.ast.IfStatement.analyseCode",
          "source": "IfState ment.java:84"
        },
        {
          "method": "org.eclipse.jdt.internal.compiler.ast.MethodDeclaration.analyseCode",
          "source": "M ethodDeclaration.java:70"
        },
        {
          "method": "org.eclipse.jdt.internal.compiler.ast.TypeDeclaration.internalAnalyseCode",
          "source": "TypeDeclaration.java:639"
        },
        {
          "method": "org.eclipse.jdt.internal.compiler.ast.TypeDeclaration.analyseCode",
          "source": "Typ eDeclaration.java:196"
        },
        {
          "method": "org.eclipse.jdt.internal.compiler.ast.CompilationUnitDeclaration.analyseCode",
          "source": "CompilationUnitDeclaration.java:78"
        },
        {
          "method": "org.eclipse.jdt.internal.compiler.Compiler.process",
          "source": "Compiler.java:541"
        },
        {
          "method": "org.aspectj.ajdt.internal.compiler.AjCompiler.process",
          "source": "AjCompiler.java :65"
        },
        {
          "method": "org.eclipse.jdt.internal.compiler.Compiler.compile",
          "source": "Compiler.java:338"
        },
        {
          "method": "org.aspectj.ajdt.internal.core.builder.AjBuildManager.performCompilation",
          "source": "AjBuildManager.java:372"
        },
        {
          "method": "org.aspectj.ajdt.internal.core.builder.AjBuildManager.doBuild",
          "source": "AjBuild Manager.java:133"
        },
        {
          "method": "org.aspectj.ajdt.internal.core.builder.AjBuildManager.batchBuild",
          "source": "AjBu ildManager.java:78"
        },
        {
          "method": "org.aspectj.ajdt.ajc.AjdtCommand.doCommand",
          "source": "AjdtCommand.java:106"
        },
        {
          "method": "org.aspectj.ajdt.ajc.AjdtCommand.runCommand",
          "source": "AjdtCommand.java:60"
        },
        {
          "method": "org.aspectj.tools.ajc.Main.run",
          "source": "Main.java:217"
        },
        {
          "method": "org.aspectj.tools.ajc.Main.runMain",
          "source": "Main.java:155"
        },
        {
          "method": "org.aspectj.tools.ajc.Main.main",
          "source": "Main.java:72"
        }
      ],
      "number": 0,
      "commentIndex": 0,
      "bugId": "39458",
      "date": "2003-06-30T05:42:42+02:00",
      "product": "AspectJ",
      "component": "Compiler",
      "severity": "normal"
    },
    {
      "exceptionType": "java.lang.NullPointerException",
      "elements": [
        {
          "method": "org.eclipse.jdt.internal.compiler.lookup.SyntheticAccessMethodBinding.initializeConstructorAccessor",
          "source": "SyntheticAccessMethodBinding.java:215"
        },
        {
          "method": "org.eclipse.jdt.internal.compiler.lookup.SyntheticAccessMethodBinding.\u003cinit\u003e",
          "source": "SyntheticAccessMethodBinding.java:136"
        },
        {
          "method": "org.eclipse.jdt.internal.compiler.lookup.SourceTypeBinding.addSyntheticMethod",
          "source": "SourceTypeBinding.java:332"
        },
        {
          "method": "org.eclipse.jdt.internal.compiler.ast.AllocationExpression.manageSyntheticAccessIfNecessary",
          "source": "AllocationExpression.java:200"
        },
        {
          "method": "org.eclipse.jdt.internal.compiler.ast.AllocationExpression.analyseCode",
          "source": "AllocationExpression.java:60"
        },
        {
          "method": "org.eclipse.jdt.internal.compiler.ast.ReturnStatement.analyseCode",
          "source": "Ret urnStatement.java:37"
        },
        {
          "method": "org.eclipse.jdt.internal.compiler.ast.Block.analyseCode",
          "source": "Block.java:41 "
        },
        {
          "method": "org.eclipse.jdt.internal.compiler.ast.IfStatement.analyseCode",
          "source": "IfState ment.java:84"
        },
        {
          "method": "org.eclipse.jdt.internal.compiler.ast.MethodDeclaration.analyseCode",
          "source": "M ethodDeclaration.java:70"
        },
        {
          "method": "org.eclipse.jdt.internal.compiler.ast.TypeDeclaration.internalAnalyseCode",
          "source": "TypeDeclaration.java:639"
        },
        {
          "method": "org.eclipse.jdt.internal.compiler.ast.TypeDeclaration.analyseCode",
          "source": "Typ eDeclaration.java:196"
        },
        {
          "method": "org.eclipse.jdt.internal.compiler.ast.CompilationUnitDeclaration.analyseCode",
          "source": "CompilationUnitDeclaration.java:78"
        },
        {
          "method": "org.eclipse.jdt.internal.compiler.Compiler.process",
          "source": "Compiler.java:541"
        },
        {
          "method": "org.aspectj.ajdt.internal.compiler.AjCompiler.process",
          "source": "AjCompiler.java :65"
        },
        {
          "method": "org.eclipse.jdt.internal.compiler.Compiler.compile",
          "source": "Compiler.java:338"
        },
        {
          "method": "org.aspectj.ajdt.internal.core.builder.AjBuildManager.performCompilation",
          "source": "AjBuildManager.java:372"
        },
        {
          "method": "org.aspectj.ajdt.internal.core.builder.AjBuildManager.doBuild",
          "source": "AjBuild Manager.java:133"
        },
        {
          "method": "org.aspectj.ajdt.internal.core.builder.AjBuildManager.batchBuild",
          "source": "AjBu ildManager.java:78"
        },
        {
          "method": "org.aspectj.ajdt.ajc.AjdtCommand.doCommand",
          "source": "AjdtCommand.java:106"
        },
        {
          "method": "org.aspectj.ajdt.ajc.AjdtCommand.runCommand",
          "source": "AjdtCommand.java:60"
        },
        {
          "method": "org.aspectj.tools.ajc.Main.run",
          "source": "Main.java:217"
        },
        {
          "method": "org.aspectj.tools.ajc.Main.runMain",
          "source": "Main.java:155"
        },
        {
          "method": "org.aspectj.tools.ajc.Main.main",
          "source": "Main.java:72"
        }
      ],
      "number": 1,
      "commentIndex": 0,
      "bugId": "39458",
      "date": "2003-06-30T05:42:42+02:00",
      "product": "AspectJ",
      "component": "Compiler",
      "severity": "normal"
    },
    {
      "exceptionType": "java.lang.NullPointerException",
      "elements": [
        {
          "method": "org.eclipse.jdt.internal.compiler.lookup.SyntheticAccessMethodBinding.initializeConstructorAccessor",
          "source": "SyntheticAccessMethodBinding.java:215"
        },
        {
          "method": "org.eclipse.jdt.internal.compiler.lookup.SyntheticAccessMethodBinding.\u003cinit\u003e",
          "source": "SyntheticAccessMethodBinding.java:136"
        },
        {
          "method": "org.eclipse.jdt.internal.compiler.lookup.SourceTypeBinding.addSyntheticMethod",
          "source": "SourceTypeBinding.java:332"
        },
        {
          "method": "org.eclipse.jdt.internal.compiler.ast.AllocationExpression.manageSyntheticAccessIfNecessary",
          "source": "AllocationExpression.java:200"
        },
        {
          "method": "org.eclipse.jdt.internal.compiler.ast.AllocationExpression.analyseCode",
          "source": "AllocationExpression.java:60"
        },
        {
          "method": "org.eclipse.jdt.internal.compiler.ast.ReturnStatement.analyseCode",
          "source": "Ret urnStatement.java:37"
        },
        {
          "method": "org.eclipse.jdt.internal.compiler.ast.Block.analyseCode",
          "source": "Block.java:41 "
        },
        {
          "method": "org.eclipse.jdt.internal.compiler.ast.IfStatement.analyseCode",
          "source": "IfState ment.java:84"
        },
        {
          "method": "org.eclipse.jdt.internal.compiler.ast.MethodDeclaration.analyseCode",
          "source": "M ethodDeclaration.java:70"
        },
        {
          "method": "org.eclipse.jdt.internal.compiler.ast.TypeDeclaration.internalAnalyseCode",
          "source": "TypeDeclaration.java:639"
        },
        {
          "method": "org.eclipse.jdt.internal.compiler.ast.TypeDeclaration.analyseCode",
          "source": "Typ eDeclaration.java:196"
        },
        {
          "method": "org.eclipse.jdt.internal.compiler.ast.CompilationUnitDeclaration.analyseCode",
          "source": "CompilationUnitDeclaration.java:78"
        },
        {
          "method": "org.eclipse.jdt.internal.compiler.Compiler.process",
          "source": "Compiler.java:541"
        },
        {
          "method": "org.aspectj.ajdt.internal.compiler.AjCompiler.process",
          "source": "AjCompiler.java :65"
        },
        {
          "method": "org.eclipse.jdt.internal.compiler.Compiler.compile",
          "source": "Compiler.java:338"
        },
        {
          "method": "org.aspectj.ajdt.internal.core.builder.AjBuildManager.performCompilation",
          "source": "AjBuildManager.java:372"
        },
        {
          "method": "org.aspectj.ajdt.internal.core.builder.AjBuildManager.doBuild",
          "source": "AjBuild Manager.java:133"
        },
        {
          "method": "org.aspectj.ajdt.internal.core.builder.AjBuildManager.batchBuild",
          "source": "AjBu ildManager.java:78"
        },
        {
          "method": "org.aspectj.ajdt.ajc.AjdtCommand.doCommand",
          "source": "AjdtCommand.java:106"
        },
        {
          "method": "org.aspectj.ajdt.ajc.AjdtCommand.runCommand",
          "source": "AjdtCommand.java:60"
        },
        {
          "method": "org.aspectj.tools.ajc.Main.run",
          "source": "Main.java:217"
        },
        {
          "method": "org.aspectj.tools.ajc.Main.runMain",
          "source": "Main.java:155"
        },
        {
          "method": "org.aspectj.tools.ajc.Main.main",
          "source": "Main.java:72"
        }
      ],
      "number": 2,
      "commentIndex": 0,
      "bugId": "39458",
      "date": "2003-06-30T05:42:42+02:00",
      "product": "AspectJ",
      "component": "Compiler",
      "severity": "normal"
    }
  ],
  "groupId": "39458",
  "bugId": "39458",
  "date": "2003-06-30T05:42:42+02:00",
  "product": "AspectJ",
  "component": "Compiler",
  "severity": "normal"
}