{
  "comments": [
    "- create a java class\n\t- open it in the editor\n\t- choose File -\u003e Save As..\n\t- select the project\n\t- enter a filename\n\nYou get an error in the log:\n\njava.lang.IllegalArgumentException: resources.resourcePath\n\tat org.eclipse.core.internal.utils.Assert.isLegal(Assert.java:50)\n\tat org.eclipse.core.internal.resources.Workspace.newResource\n(Workspace.java:1037)\n\tat org.eclipse.core.internal.resources.Container.getResource\n(Container.java:123)\n\tat org.eclipse.core.internal.resources.Container.getFolder\n(Container.java:119)\n\tat \norg.eclipse.jdt.internal.ui.javaeditor.CompilationUnitEditor.performSaveAs\n(CompilationUnitEditor.java:356)\n\tat org.eclipse.ui.texteditor.AbstractTextEditor.doSaveAs\n(AbstractTextEditor.java:823)\n\tat org.eclipse.ui.internal.SaveAsAction.run(SaveAsAction.java:28)\n\tat org.eclipse.jface.action.ActionContributionItem.handleWidgetSelection\n(ActionContributionItem.java:408)\n\tat org.eclipse.jface.action.ActionContributionItem.handleWidgetEvent\n(ActionContributionItem.java:362)\n\tat org.eclipse.jface.action.ActionContributionItem.access$0\n(ActionContributionItem.java:353)\n\tat \norg.eclipse.jface.action.ActionContributionItem$ActionListener.handleEvent\n(ActionContributionItem.java:47)\n\tat org.eclipse.swt.widgets.EventTable.sendEvent(EventTable.java\n(Compiled Code))\n\tat org.eclipse.swt.widgets.Widget.notifyListeners(Widget.java:622)\n\tat org.eclipse.swt.widgets.Display.runDeferredEvents(Display.java\n(Compiled Code))\n\tat org.eclipse.swt.widgets.Display.readAndDispatch(Display.java\n(Compiled Code))\n\tat org.eclipse.ui.internal.Workbench.runEventLoop(Workbench.java:637)\n\tat org.eclipse.ui.internal.Workbench.run(Workbench.java:620)\n\tat org.eclipse.core.internal.boot.InternalBootLoader.run\n(InternalBootLoader.java:815)\n\tat org.eclipse.core.boot.BootLoader.run(BootLoader.java:285)\n\tat java.lang.reflect.Method.invoke(Native Method)\n\tat org.eclipse.core.launcher.Main.basicRun(Main.java:126)\n\tat org.eclipse.core.launcher.Main.run(Main.java:408)\n\tat org.eclipse.core.launcher.Main.main(Main.java:281)\n\nThis is happening because CompilationUnitEditor.performSaveAs is calling \nIContainer.getFolder\non the workspace root and the path that it is passing in has only one segment. \n(the project path)\n\nNOTES:\n\nARCH (6/12/01 4:07:33 PM)\n\tFix\n\nKUM (6/13/01 1:05:23 PM)\n\tFixed. Build \u003e 122.\n\nDM (6/19/01 9:52:50 AM)\n\tThe error is gone but \"Save As...\" does not work as I would expect i.e.\n\tthere\u0027s no Java support/integration:\n\t- I don\u0027t see packages in the save as dialog - all other dialogs like \ncopy,\n\t\tmove, export do so\n\t- A dialog similar to the one in rename, which asks me if the class \nshould\n\t  be also renamed to the new name (if the extension is .java).\n\n\tAsking EG if the PR should be kept open or closed.\n\n",
    "moved to \u0027active\u0027",
    "PRODUCT VERSION:\n\t0.122 JRE on Win98\n\n",
    "current solution is good enough"
  ],
  "commentCreationDates": [
    "2001-10-11T05:03:32+02:00",
    "2001-10-16T17:14:59+02:00",
    "2001-10-24T13:25:50+02:00",
    "2001-11-11T00:42:43+01:00"
  ],
  "traces": [
    {
      "exceptionType": "java.lang.IllegalArgumentException",
      "message": "resources.resourcePath",
      "elements": [
        {
          "method": "org.eclipse.core.internal.utils.Assert.isLegal",
          "source": "Assert.java:50"
        },
        {
          "method": "org.eclipse.core.internal.resources.Workspace.newResource",
          "source": "Workspace.java:1037"
        },
        {
          "method": "org.eclipse.core.internal.resources.Container.getResource",
          "source": "Container.java:123"
        },
        {
          "method": "org.eclipse.core.internal.resources.Container.getFolder",
          "source": "Container.java:119"
        },
        {
          "method": "org.eclipse.jdt.internal.ui.javaeditor.CompilationUnitEditor.performSaveAs",
          "source": "CompilationUnitEditor.java:356"
        },
        {
          "method": "org.eclipse.ui.texteditor.AbstractTextEditor.doSaveAs",
          "source": "AbstractTextEditor.java:823"
        },
        {
          "method": "org.eclipse.ui.internal.SaveAsAction.run",
          "source": "SaveAsAction.java:28"
        },
        {
          "method": "org.eclipse.jface.action.ActionContributionItem.handleWidgetSelection",
          "source": "ActionContributionItem.java:408"
        },
        {
          "method": "org.eclipse.jface.action.ActionContributionItem.handleWidgetEvent",
          "source": "ActionContributionItem.java:362"
        },
        {
          "method": "org.eclipse.jface.action.ActionContributionItem.access$0",
          "source": "ActionContributionItem.java:353"
        },
        {
          "method": "org.eclipse.jface.action.ActionContributionItem$ActionListener.handleEvent",
          "source": "ActionContributionItem.java:47"
        },
        {
          "method": "org.eclipse.swt.widgets.EventTable.sendEvent",
          "source": "EventTable.java (Compiled Code)"
        },
        {
          "method": "org.eclipse.swt.widgets.Widget.notifyListeners",
          "source": "Widget.java:622"
        },
        {
          "method": "org.eclipse.swt.widgets.Display.runDeferredEvents",
          "source": "Display.java (Compiled Code)"
        },
        {
          "method": "org.eclipse.swt.widgets.Display.readAndDispatch",
          "source": "Display.java (Compiled Code)"
        },
        {
          "method": "org.eclipse.ui.internal.Workbench.runEventLoop",
          "source": "Workbench.java:637"
        },
        {
          "method": "org.eclipse.ui.internal.Workbench.run",
          "source": "Workbench.java:620"
        },
        {
          "method": "org.eclipse.core.internal.boot.InternalBootLoader.run",
          "source": "InternalBootLoader.java:815"
        },
        {
          "method": "org.eclipse.core.boot.BootLoader.run",
          "source": "BootLoader.java:285"
        },
        {
          "method": "java.lang.reflect.Method.invoke",
          "source": "Native Method"
        },
        {
          "method": "org.eclipse.core.launcher.Main.basicRun",
          "source": "Main.java:126"
        },
        {
          "method": "org.eclipse.core.launcher.Main.run",
          "source": "Main.java:408"
        },
        {
          "method": "org.eclipse.core.launcher.Main.main",
          "source": "Main.java:281"
        }
      ],
      "number": 0,
      "commentIndex": 0,
      "bugId": "3949",
      "date": "2001-10-11T05:03:32+02:00",
      "product": "JDT",
      "component": "UI",
      "severity": "normal"
    }
  ],
  "groupId": "3949",
  "bugId": "3949",
  "date": "2001-10-11T05:03:32+02:00",
  "product": "JDT",
  "component": "UI",
  "severity": "normal"
}