{
  "comments": [
    "i20030715\n\nGot this stack, not sure when. Sorry, no steps to reproduce.\n\n!ENTRY org.eclipse.team.cvs.core 4 2 Jul 15, 2003 14:53:24.156\n!MESSAGE Problems occurred when invoking code from plug-in: \"org.eclipse.team.cv\ns.core\".\n!STACK 0\norg.eclipse.swt.SWTException: Invalid thread access\n        at java.lang.Throwable.\u003cinit\u003e(Throwable.java)\n        at java.lang.Throwable.\u003cinit\u003e(Throwable.java)\n        at org.eclipse.swt.SWTException.\u003cinit\u003e(SWTException.java:73)\n        at org.eclipse.swt.SWTException.\u003cinit\u003e(SWTException.java:62)\n        at org.eclipse.swt.SWT.error(SWT.java:2365)\n        at org.eclipse.swt.SWT.error(SWT.java:2295)\n        at org.eclipse.swt.widgets.Widget.error(Widget.java:389)\n        at org.eclipse.swt.widgets.Widget.checkWidget(Widget.java)\n        at org.eclipse.swt.widgets.Control.removeMouseMoveListener(Control.java:\n1614)\n        at org.eclipse.ui.internal.PartDragDrop.dispose(Unknown Source)\n        at org.eclipse.ui.internal.EditorWorkbook.disableTabDrag(Unknown Source)\n\n        at org.eclipse.ui.internal.EditorWorkbook.removeListeners(Unknown Source\n)\n        at org.eclipse.ui.internal.EditorWorkbook.remove(Unknown Source)\n        at org.eclipse.ui.internal.EditorArea.removeEditor(Unknown Source)\n        at org.eclipse.ui.internal.EditorPresentation.closeEditor(Unknown Source\n)\n        at org.eclipse.ui.internal.EditorPresentation.closeEditor(Unknown Source\n)\n        at org.eclipse.ui.internal.EditorManager.closeEditor(Unknown Source)\n        at org.eclipse.ui.internal.WorkbenchPage.closeEditor(Unknown Source)\n        at org.eclipse.ui.internal.EditorManager$Editor.getEditor(Unknown Source\n)\n        at org.eclipse.team.internal.ui.sync.actions.OpenInCompareAction.closeCo\nmpareEditorFor(Unknown Source)\n        at org.eclipse.team.internal.ui.sync.views.SyncViewer.syncSetChanged(Unk\nnown Source)\n        at org.eclipse.team.internal.ui.sync.views.SyncSet.fireChanges(Unknown S\nource)\n        at org.eclipse.team.internal.ui.sync.views.SyncSet.endInput(Unknown Sour\nce)\n        at org.eclipse.team.internal.ui.sync.views.SyncSetInputFromSyncSet.syncS\netChanged(Unknown Source)\n        at org.eclipse.team.internal.ui.sync.views.SyncSet.fireChanges(Unknown S\nource)\n        at org.eclipse.team.internal.ui.sync.views.SyncSet.endInput(Unknown Sour\nce)\n        at org.eclipse.team.internal.ui.sync.views.SyncSetInputFromSubscriber.te\namResourceChanged(Unknown Source)\n        at org.eclipse.team.core.subscribers.TeamSubscriber.fireTeamResourceChan\nge(Unknown Source)\n        at org.eclipse.team.internal.ccvs.core.CVSWorkspaceSubscriber.projectDec\nonfigured(Unknown Source)\n        at org.eclipse.team.internal.ccvs.core.CVSProviderPlugin$6.run(Unknown S\nource)\n        at org.eclipse.core.internal.runtime.InternalPlatform.run(Unknown Source\n)\n        at org.eclipse.core.runtime.Platform.run(Unknown Source)\n        at org.eclipse.team.internal.ccvs.core.CVSProviderPlugin.broadcastProjec\ntDeconfigured(Unknown Source)\n        at org.eclipse.team.internal.ccvs.core.CVSTeamProvider.deconfigured(Unkn\nown Source)\n        at org.eclipse.team.core.RepositoryProvider.unmap(Unknown Source)\n        at org.eclipse.team.internal.ccvs.ui.actions.UnmanageAction$2.execute(Un\nknown Source)\n        at org.eclipse.ui.actions.WorkspaceModifyOperation$1.run(Unknown Source)\n\n        at org.eclipse.core.internal.resources.Workspace.run(Unknown Source)\n        at org.eclipse.ui.actions.WorkspaceModifyOperation.run(Unknown Source)\n        at org.eclipse.team.internal.ccvs.ui.repo.RepositoryManager.run(Unknown\nSource)\n        at org.eclipse.team.internal.ccvs.ui.actions.CVSAction$1.run(Unknown Sou\nrce)\n        at org.eclipse.jface.operation.ModalContext$ModalContextThread.run(Unkno\nwn Source)",
    "SWT - transferring to you for comment.  Don\u0027t know if this is your\u0027s or not \nbut I don\u0027t think there has been much activity in the Drag and Drop sector \nhere.  Please reassign if I\u0027m wrong.",
    "This is not an SWT problem.  Adding and removing listeners must be done in the \nUI thread and this has been the case since day one.\n\nPartDragDrop does not use DragDource/DropTarget - it is the mechanism for \nrearranging views on the desktop and implements its own \"drag-like\" \nbehaviour.  There was working in this area recently to add the ability to \ndetach views (Eduardo).\n\nThere has also been work recently in the area of performing more tasks in \nbackground threads.",
    "The sync view seems to be making ui related calls but is not running in the UI \nthread.",
    "Fix released to HEAD. I didn\u0027t realize that getEditor() could end up closing an\neditor and need the be done in the UI thread :)"
  ],
  "commentCreationDates": [
    "2003-07-15T21:14:17+02:00",
    "2003-07-15T21:50:16+02:00",
    "2003-07-16T15:15:45+02:00",
    "2003-07-17T17:25:35+02:00",
    "2003-07-23T19:20:22+02:00"
  ],
  "traces": [
    {
      "exceptionType": "org.eclipse.swt.SWTException",
      "message": "Invalid thread access",
      "elements": [
        {
          "method": "java.lang.Throwable.\u003cinit\u003e",
          "source": "Throwable.java"
        },
        {
          "method": "java.lang.Throwable.\u003cinit\u003e",
          "source": "Throwable.java"
        },
        {
          "method": "org.eclipse.swt.SWTException.\u003cinit\u003e",
          "source": "SWTException.java:73"
        },
        {
          "method": "org.eclipse.swt.SWTException.\u003cinit\u003e",
          "source": "SWTException.java:62"
        },
        {
          "method": "org.eclipse.swt.SWT.error",
          "source": "SWT.java:2365"
        },
        {
          "method": "org.eclipse.swt.SWT.error",
          "source": "SWT.java:2295"
        },
        {
          "method": "org.eclipse.swt.widgets.Widget.error",
          "source": "Widget.java:389"
        },
        {
          "method": "org.eclipse.swt.widgets.Widget.checkWidget",
          "source": "Widget.java"
        },
        {
          "method": "org.eclipse.swt.widgets.Control.removeMouseMoveListener",
          "source": "Control.java: 1614"
        },
        {
          "method": "org.eclipse.ui.internal.PartDragDrop.dispose",
          "source": "Unknown Source"
        },
        {
          "method": "org.eclipse.ui.internal.EditorWorkbook.disableTabDrag",
          "source": "Unknown Source"
        },
        {
          "method": "org.eclipse.ui.internal.EditorWorkbook.removeListeners",
          "source": "Unknown Source "
        },
        {
          "method": "org.eclipse.ui.internal.EditorWorkbook.remove",
          "source": "Unknown Source"
        },
        {
          "method": "org.eclipse.ui.internal.EditorArea.removeEditor",
          "source": "Unknown Source"
        },
        {
          "method": "org.eclipse.ui.internal.EditorPresentation.closeEditor",
          "source": "Unknown Source "
        },
        {
          "method": "org.eclipse.ui.internal.EditorPresentation.closeEditor",
          "source": "Unknown Source "
        },
        {
          "method": "org.eclipse.ui.internal.EditorManager.closeEditor",
          "source": "Unknown Source"
        },
        {
          "method": "org.eclipse.ui.internal.WorkbenchPage.closeEditor",
          "source": "Unknown Source"
        },
        {
          "method": "org.eclipse.ui.internal.EditorManager$Editor.getEditor",
          "source": "Unknown Source "
        },
        {
          "method": "org.eclipse.team.internal.ui.sync.actions.OpenInCompareAction.closeCompareEditorFor",
          "source": "Unknown Source"
        },
        {
          "method": "org.eclipse.team.internal.ui.sync.views.SyncViewer.syncSetChanged",
          "source": "Unk nown Source"
        },
        {
          "method": "org.eclipse.team.internal.ui.sync.views.SyncSet.fireChanges",
          "source": "Unknown S ource"
        },
        {
          "method": "org.eclipse.team.internal.ui.sync.views.SyncSet.endInput",
          "source": "Unknown Sour ce"
        },
        {
          "method": "org.eclipse.team.internal.ui.sync.views.SyncSetInputFromSyncSet.syncSetChanged",
          "source": "Unknown Source"
        },
        {
          "method": "org.eclipse.team.internal.ui.sync.views.SyncSet.fireChanges",
          "source": "Unknown S ource"
        },
        {
          "method": "org.eclipse.team.internal.ui.sync.views.SyncSet.endInput",
          "source": "Unknown Sour ce"
        },
        {
          "method": "org.eclipse.team.internal.ui.sync.views.SyncSetInputFromSubscriber.teamResourceChanged",
          "source": "Unknown Source"
        },
        {
          "method": "org.eclipse.team.core.subscribers.TeamSubscriber.fireTeamResourceChange",
          "source": "Unknown Source"
        },
        {
          "method": "org.eclipse.team.internal.ccvs.core.CVSWorkspaceSubscriber.projectDeconfigured",
          "source": "Unknown Source"
        },
        {
          "method": "org.eclipse.team.internal.ccvs.core.CVSProviderPlugin$6.run",
          "source": "Unknown S ource"
        },
        {
          "method": "org.eclipse.core.internal.runtime.InternalPlatform.run",
          "source": "Unknown Source "
        },
        {
          "method": "org.eclipse.core.runtime.Platform.run",
          "source": "Unknown Source"
        },
        {
          "method": "org.eclipse.team.internal.ccvs.core.CVSProviderPlugin.broadcastProjectDeconfigured",
          "source": "Unknown Source"
        },
        {
          "method": "org.eclipse.team.internal.ccvs.core.CVSTeamProvider.deconfigured",
          "source": "Unkn own Source"
        },
        {
          "method": "org.eclipse.team.core.RepositoryProvider.unmap",
          "source": "Unknown Source"
        },
        {
          "method": "org.eclipse.team.internal.ccvs.ui.actions.UnmanageAction$2.execute",
          "source": "Un known Source"
        },
        {
          "method": "org.eclipse.ui.actions.WorkspaceModifyOperation$1.run",
          "source": "Unknown Source"
        },
        {
          "method": "org.eclipse.core.internal.resources.Workspace.run",
          "source": "Unknown Source"
        },
        {
          "method": "org.eclipse.ui.actions.WorkspaceModifyOperation.run",
          "source": "Unknown Source"
        },
        {
          "method": "org.eclipse.team.internal.ccvs.ui.repo.RepositoryManager.run",
          "source": "Unknown Source"
        },
        {
          "method": "org.eclipse.team.internal.ccvs.ui.actions.CVSAction$1.run",
          "source": "Unknown Sou rce"
        },
        {
          "method": "org.eclipse.jface.operation.ModalContext$ModalContextThread.run",
          "source": "Unkno wn Source"
        }
      ],
      "number": 0,
      "commentIndex": 0,
      "bugId": "40139",
      "date": "2003-07-15T21:14:17+02:00",
      "product": "Platform",
      "component": "Team",
      "severity": "normal"
    }
  ],
  "groupId": "40139",
  "bugId": "40139",
  "date": "2003-07-15T21:14:17+02:00",
  "product": "Platform",
  "component": "Team",
  "severity": "normal"
}