{
  "comments": [
    "When I try to select default run/debug perspectives for my launch configuration\ntype, Eclipse can not find descriptor (as I see in source) for my perspective.\nFor my other launch configuration types I don\u0027t see NPE. Here are definition of\nperspectives, launch configurations and stack trace.\n\n   \u003cextension\n         point\u003d\"org.eclipse.ui.perspectives\"\u003e\n      \u003cperspective\n            name\u003d\"Profiler\"\n            icon\u003d\"icons/profiler2.gif\"\n            class\u003d\"ru.nlmk.eclipse.plugins.profiler.ProfilerPerspectiveFactory\"\n            id\u003d\"ru.nlmk.eclipse.plugins.profiler.ProfilerPerspective\"\u003e\n      \u003c/perspective\u003e\n      \u003cperspective\n            name\u003d\"Profiler (threads)\"\n            icon\u003d\"icons/perspective_threads.gif\"\n           \nclass\u003d\"ru.nlmk.eclipse.plugins.profiler.ProfilerThreadsPerspectiveFactory\"\n            id\u003d\"ru.nlmk.eclipse.plugins.profiler.ProfilerThreadsPerspective\"\u003e\n      \u003c/perspective\u003e\n   \u003c/extension\u003e\n   \u003cextension\n         point\u003d\"org.eclipse.debug.core.launchConfigurationTypes\"\u003e\n      \u003claunchConfigurationType\n            name\u003d\"Profiler\"\n           \ndelegate\u003d\"ru.nlmk.eclipse.plugins.profiler.launch.ProfilerLaunchConfigurationDelegate\"\n            modes\u003d\"run,debug\"\n            id\u003d\"ru.nlmk.eclipse.plugin.profiler.launch.image\"\u003e\n      \u003c/launchConfigurationType\u003e\n      \u003claunchConfigurationType\n            name\u003d\"Remote Profiler\"\n           \ndelegate\u003d\"ru.nlmk.eclipse.plugins.profiler.launch.remote.LaunchConfigurationDelegate\"\n            modes\u003d\"run\"\n            id\u003d\"ru.nlmk.eclipse.plugin.profiler.launch.remote.image\"\u003e\n      \u003c/launchConfigurationType\u003e\n   \u003c/extension\u003e\n   \u003cextension\n         point\u003d\"org.eclipse.debug.ui.launchConfigurationTypeImages\"\u003e\n      \u003claunchConfigurationTypeImage\n            icon\u003d\"icons/profiler2.gif\"\n            configTypeID\u003d\"ru.nlmk.eclipse.plugin.profiler.launch.image\"\n            id\u003d\"ru.nlmk.eclipse.plugin.profiler.launch.image\"\u003e\n      \u003c/launchConfigurationTypeImage\u003e\n      \u003claunchConfigurationTypeImage\n            icon\u003d\"icons/profiler2_remote.gif\"\n            configTypeID\u003d\"ru.nlmk.eclipse.plugin.profiler.launch.remote.image\"\n            id\u003d\"ru.nlmk.eclipse.plugin.profiler.launch.remote.image\"\u003e\n      \u003c/launchConfigurationTypeImage\u003e\n   \u003c/extension\u003e\n   \u003cextension\n         point\u003d\"org.eclipse.debug.ui.launchConfigurationTabGroups\"\u003e\n      \u003claunchConfigurationTabGroup\n            type\u003d\"ru.nlmk.eclipse.plugin.profiler.launch.image\"\n            class\u003d\"ru.nlmk.eclipse.plugins.profiler.launch.ProfilerTabGroup\"\n            id\u003d\"ru.nlmk.eclipse.plugins.profiler.launch.ProfilerTabGroup\"\u003e\n      \u003c/launchConfigurationTabGroup\u003e\n      \u003claunchConfigurationTabGroup\n            type\u003d\"ru.nlmk.eclipse.plugin.profiler.launch.remote.image\"\n            class\u003d\"ru.nlmk.eclipse.plugins.profiler.launch.remote.TabGroup\"\n            id\u003d\"ru.nlmk.eclipse.plugins.profiler.launch.remote.TabGroup\"\u003e\n      \u003c/launchConfigurationTabGroup\u003e\n   \u003c/extension\u003e\n\n\n!MESSAGE Problems occurred when invoking code from plug-in: \"org.eclipse.jface\".\n!STACK 0\njava.lang.NullPointerException\n\tat\norg.eclipse.debug.internal.ui.launchConfigurations.PerspectivesTab.initializeFrom(PerspectivesTab.java:271)\n\tat\norg.eclipse.debug.ui.AbstractLaunchConfigurationTabGroup.initializeFrom(AbstractLaunchConfigurationTabGroup.java:86)\n\tat\norg.eclipse.debug.internal.ui.launchConfigurations.LaunchConfigurationTabGroupViewer.displaySharedTabs(LaunchConfigurationTabGroupViewer.java:578)\n\tat\norg.eclipse.debug.internal.ui.launchConfigurations.LaunchConfigurationTabGroupViewer$5.run(LaunchConfigurationTabGroupViewer.java:474)\n\tat org.eclipse.swt.custom.BusyIndicator.showWhile(BusyIndicator.java:84)\n\tat\norg.eclipse.debug.internal.ui.launchConfigurations.LaunchConfigurationTabGroupViewer.inputChanged(LaunchConfigurationTabGroupViewer.java:484)\n\tat\norg.eclipse.debug.internal.ui.launchConfigurations.LaunchConfigurationTabGroupViewer.setInput(LaunchConfigurationTabGroupViewer.java:443)\n\tat\norg.eclipse.debug.internal.ui.launchConfigurations.LaunchConfigurationsDialog.handleLaunchConfigurationSelectionChanged(LaunchConfigurationsDialog.java:856)\n\tat\norg.eclipse.debug.internal.ui.launchConfigurations.LaunchConfigurationsDialog$2.selectionChanged(LaunchConfigurationsDialog.java:628)\n\tat org.eclipse.jface.viewers.Viewer$2.run(Viewer.java:159)\n\tat\norg.eclipse.core.internal.runtime.InternalPlatform.run(InternalPlatform.java:1015)\n\tat org.eclipse.core.runtime.Platform.run(Platform.java:420)\n\tat org.eclipse.jface.viewers.Viewer.fireSelectionChanged(Viewer.java:157)\n\tat\norg.eclipse.jface.viewers.StructuredViewer.updateSelection(StructuredViewer.java:1282)\n\tat\norg.eclipse.jface.viewers.StructuredViewer.handleSelect(StructuredViewer.java:652)\n\tat\norg.eclipse.jface.viewers.StructuredViewer$4.widgetSelected(StructuredViewer.java:676)\n\tat org.eclipse.jface.util.OpenStrategy.fireSelectionEvent(OpenStrategy.java:178)\n\tat org.eclipse.jface.util.OpenStrategy.access$3(OpenStrategy.java:173)\n\tat org.eclipse.jface.util.OpenStrategy$1.handleEvent(OpenStrategy.java:308)\n\tat org.eclipse.swt.widgets.EventTable.sendEvent(EventTable.java:82)\n\tat org.eclipse.swt.widgets.Widget.sendEvent(Widget.java:848)\n\tat org.eclipse.swt.widgets.Display.runDeferredEvents(Display.java:2188)\n\tat org.eclipse.swt.widgets.Display.readAndDispatch(Display.java:1878)\n\tat org.eclipse.jface.window.Window.runEventLoop(Window.java:583)\n\tat org.eclipse.jface.window.Window.open(Window.java:563)\n\tat\norg.eclipse.debug.internal.ui.launchConfigurations.LaunchConfigurationsDialog.openDialogOnSelection(LaunchConfigurationsDialog.java:491)\n\tat\norg.eclipse.debug.internal.ui.launchConfigurations.LaunchConfigurationsDialog.open(LaunchConfigurationsDialog.java:445)\n\tat org.eclipse.debug.ui.DebugUITools$1.run(DebugUITools.java:381)\n\tat org.eclipse.swt.custom.BusyIndicator.showWhile(BusyIndicator.java:84)\n\tat\norg.eclipse.debug.ui.DebugUITools.openLaunchConfigurationDialogOnGroup(DebugUITools.java:385)\n\tat\norg.eclipse.debug.ui.DebugUITools.openLaunchConfigurationDialogOnGroup(DebugUITools.java:327)\n\tat\norg.eclipse.debug.ui.actions.OpenLaunchDialogAction.run(OpenLaunchDialogAction.java:79)\n\tat org.eclipse.jface.action.Action.runWithEvent(Action.java:842)\n\tat\norg.eclipse.jface.action.ActionContributionItem.handleWidgetSelection(ActionContributionItem.java:542)\n\tat\norg.eclipse.jface.action.ActionContributionItem.access$4(ActionContributionItem.java:496)\n\tat\norg.eclipse.jface.action.ActionContributionItem$6.handleEvent(ActionContributionItem.java:468)\n\tat org.eclipse.swt.widgets.EventTable.sendEvent(EventTable.java:82)\n\tat org.eclipse.swt.widgets.Widget.sendEvent(Widget.java:848)\n\tat org.eclipse.swt.widgets.Display.runDeferredEvents(Display.java:2188)\n\tat org.eclipse.swt.widgets.Display.readAndDispatch(Display.java:1878)\n\tat org.eclipse.ui.internal.Workbench.runEventLoop(Workbench.java:1630)\n\tat org.eclipse.ui.internal.Workbench.run(Workbench.java:1613)\n\tat\norg.eclipse.core.internal.boot.InternalBootLoader.run(InternalBootLoader.java:858)\n\tat org.eclipse.core.boot.BootLoader.run(BootLoader.java:461)\n\tat sun.reflect.NativeMethodAccessorImpl.invoke0(Native Method)\n\tat sun.reflect.NativeMethodAccessorImpl.invoke(NativeMethodAccessorImpl.java:39)\n\tat\nsun.reflect.DelegatingMethodAccessorImpl.invoke(DelegatingMethodAccessorImpl.java:25)\n\tat java.lang.reflect.Method.invoke(Method.java:324)\n\tat org.eclipse.core.launcher.Main.basicRun(Main.java:291)\n\tat org.eclipse.core.launcher.Main.run(Main.java:747)\n\tat org.eclipse.core.launcher.Main.main(Main.java:583)",
    "Have you changed your perspective IDs recently? It looks like the perspective \nID stored in the config does not match any registered perspective ID.",
    "Oops, yes, you are right, perspective ID was changed.\nAfter I changed name in runtime-workbench XML files, I can again activate page\nfor perspective selection without NPE.\n\nMay be it will be good to show message, that perspective not found, instead of\nNPE? In case of NPE it is not very easy to fix this problem - manual changes in\ninternal configs are required...",
    "Yes, we should protect against the NPE.",
    "This has been fixed as part of other work.\nIf the descriptor for the perspective is not found, we default to no \nperspective switching.",
    "Please verify Luc.",
    "Verified."
  ],
  "commentCreationDates": [
    "2003-07-21T10:37:15+02:00",
    "2003-07-21T22:37:07+02:00",
    "2003-07-22T05:29:15+02:00",
    "2003-07-24T17:57:06+02:00",
    "2003-12-15T22:47:58+01:00",
    "2003-12-15T22:48:15+01:00",
    "2003-12-16T01:02:18+01:00"
  ],
  "traces": [
    {
      "exceptionType": "java.lang.NullPointerException",
      "elements": [
        {
          "method": "org.eclipse.debug.internal.ui.launchConfigurations.PerspectivesTab.initializeFrom",
          "source": "PerspectivesTab.java:271"
        },
        {
          "method": "org.eclipse.debug.ui.AbstractLaunchConfigurationTabGroup.initializeFrom",
          "source": "AbstractLaunchConfigurationTabGroup.java:86"
        },
        {
          "method": "org.eclipse.debug.internal.ui.launchConfigurations.LaunchConfigurationTabGroupViewer.displaySharedTabs",
          "source": "LaunchConfigurationTabGroupViewer.java:578"
        },
        {
          "method": "org.eclipse.debug.internal.ui.launchConfigurations.LaunchConfigurationTabGroupViewer$5.run",
          "source": "LaunchConfigurationTabGroupViewer.java:474"
        },
        {
          "method": "org.eclipse.swt.custom.BusyIndicator.showWhile",
          "source": "BusyIndicator.java:84"
        },
        {
          "method": "org.eclipse.debug.internal.ui.launchConfigurations.LaunchConfigurationTabGroupViewer.inputChanged",
          "source": "LaunchConfigurationTabGroupViewer.java:484"
        },
        {
          "method": "org.eclipse.debug.internal.ui.launchConfigurations.LaunchConfigurationTabGroupViewer.setInput",
          "source": "LaunchConfigurationTabGroupViewer.java:443"
        },
        {
          "method": "org.eclipse.debug.internal.ui.launchConfigurations.LaunchConfigurationsDialog.handleLaunchConfigurationSelectionChanged",
          "source": "LaunchConfigurationsDialog.java:856"
        },
        {
          "method": "org.eclipse.debug.internal.ui.launchConfigurations.LaunchConfigurationsDialog$2.selectionChanged",
          "source": "LaunchConfigurationsDialog.java:628"
        },
        {
          "method": "org.eclipse.jface.viewers.Viewer$2.run",
          "source": "Viewer.java:159"
        },
        {
          "method": "org.eclipse.core.internal.runtime.InternalPlatform.run",
          "source": "InternalPlatform.java:1015"
        },
        {
          "method": "org.eclipse.core.runtime.Platform.run",
          "source": "Platform.java:420"
        },
        {
          "method": "org.eclipse.jface.viewers.Viewer.fireSelectionChanged",
          "source": "Viewer.java:157"
        },
        {
          "method": "org.eclipse.jface.viewers.StructuredViewer.updateSelection",
          "source": "StructuredViewer.java:1282"
        },
        {
          "method": "org.eclipse.jface.viewers.StructuredViewer.handleSelect",
          "source": "StructuredViewer.java:652"
        },
        {
          "method": "org.eclipse.jface.viewers.StructuredViewer$4.widgetSelected",
          "source": "StructuredViewer.java:676"
        },
        {
          "method": "org.eclipse.jface.util.OpenStrategy.fireSelectionEvent",
          "source": "OpenStrategy.java:178"
        },
        {
          "method": "org.eclipse.jface.util.OpenStrategy.access$3",
          "source": "OpenStrategy.java:173"
        },
        {
          "method": "org.eclipse.jface.util.OpenStrategy$1.handleEvent",
          "source": "OpenStrategy.java:308"
        },
        {
          "method": "org.eclipse.swt.widgets.EventTable.sendEvent",
          "source": "EventTable.java:82"
        },
        {
          "method": "org.eclipse.swt.widgets.Widget.sendEvent",
          "source": "Widget.java:848"
        },
        {
          "method": "org.eclipse.swt.widgets.Display.runDeferredEvents",
          "source": "Display.java:2188"
        },
        {
          "method": "org.eclipse.swt.widgets.Display.readAndDispatch",
          "source": "Display.java:1878"
        },
        {
          "method": "org.eclipse.jface.window.Window.runEventLoop",
          "source": "Window.java:583"
        },
        {
          "method": "org.eclipse.jface.window.Window.open",
          "source": "Window.java:563"
        },
        {
          "method": "org.eclipse.debug.internal.ui.launchConfigurations.LaunchConfigurationsDialog.openDialogOnSelection",
          "source": "LaunchConfigurationsDialog.java:491"
        },
        {
          "method": "org.eclipse.debug.internal.ui.launchConfigurations.LaunchConfigurationsDialog.open",
          "source": "LaunchConfigurationsDialog.java:445"
        },
        {
          "method": "org.eclipse.debug.ui.DebugUITools$1.run",
          "source": "DebugUITools.java:381"
        },
        {
          "method": "org.eclipse.swt.custom.BusyIndicator.showWhile",
          "source": "BusyIndicator.java:84"
        },
        {
          "method": "org.eclipse.debug.ui.DebugUITools.openLaunchConfigurationDialogOnGroup",
          "source": "DebugUITools.java:385"
        },
        {
          "method": "org.eclipse.debug.ui.DebugUITools.openLaunchConfigurationDialogOnGroup",
          "source": "DebugUITools.java:327"
        },
        {
          "method": "org.eclipse.debug.ui.actions.OpenLaunchDialogAction.run",
          "source": "OpenLaunchDialogAction.java:79"
        },
        {
          "method": "org.eclipse.jface.action.Action.runWithEvent",
          "source": "Action.java:842"
        },
        {
          "method": "org.eclipse.jface.action.ActionContributionItem.handleWidgetSelection",
          "source": "ActionContributionItem.java:542"
        },
        {
          "method": "org.eclipse.jface.action.ActionContributionItem.access$4",
          "source": "ActionContributionItem.java:496"
        },
        {
          "method": "org.eclipse.jface.action.ActionContributionItem$6.handleEvent",
          "source": "ActionContributionItem.java:468"
        },
        {
          "method": "org.eclipse.swt.widgets.EventTable.sendEvent",
          "source": "EventTable.java:82"
        },
        {
          "method": "org.eclipse.swt.widgets.Widget.sendEvent",
          "source": "Widget.java:848"
        },
        {
          "method": "org.eclipse.swt.widgets.Display.runDeferredEvents",
          "source": "Display.java:2188"
        },
        {
          "method": "org.eclipse.swt.widgets.Display.readAndDispatch",
          "source": "Display.java:1878"
        },
        {
          "method": "org.eclipse.ui.internal.Workbench.runEventLoop",
          "source": "Workbench.java:1630"
        },
        {
          "method": "org.eclipse.ui.internal.Workbench.run",
          "source": "Workbench.java:1613"
        },
        {
          "method": "org.eclipse.core.internal.boot.InternalBootLoader.run",
          "source": "InternalBootLoader.java:858"
        },
        {
          "method": "org.eclipse.core.boot.BootLoader.run",
          "source": "BootLoader.java:461"
        },
        {
          "method": "sun.reflect.NativeMethodAccessorImpl.invoke0",
          "source": "Native Method"
        },
        {
          "method": "sun.reflect.NativeMethodAccessorImpl.invoke",
          "source": "NativeMethodAccessorImpl.java:39"
        },
        {
          "method": "sun.reflect.DelegatingMethodAccessorImpl.invoke",
          "source": "DelegatingMethodAccessorImpl.java:25"
        },
        {
          "method": "java.lang.reflect.Method.invoke",
          "source": "Method.java:324"
        },
        {
          "method": "org.eclipse.core.launcher.Main.basicRun",
          "source": "Main.java:291"
        },
        {
          "method": "org.eclipse.core.launcher.Main.run",
          "source": "Main.java:747"
        },
        {
          "method": "org.eclipse.core.launcher.Main.main",
          "source": "Main.java:583"
        }
      ],
      "number": 0,
      "commentIndex": 0,
      "bugId": "40541",
      "date": "2003-07-21T10:37:15+02:00",
      "product": "Platform",
      "component": "Debug",
      "severity": "normal"
    }
  ],
  "groupId": "40541",
  "bugId": "40541",
  "date": "2003-07-21T10:37:15+02:00",
  "product": "Platform",
  "component": "Debug",
  "severity": "normal"
}