{
  "comments": [
    "I get this compiler output. Sample source file to be sent out of band.\n\njava.lang.NullPointerException\n        at \norg.eclipse.jdt.internal.compiler.lookup.SourceTypeBinding.getExactMe\nthodBase(SourceTypeBinding.java:459)\n        at \norg.eclipse.jdt.internal.compiler.lookup.SourceTypeBinding.getExactMe\nthod(SourceTypeBinding.java:449)\n        at org.eclipse.jdt.internal.compiler.lookup.Scope.findExactMethod\n(Scope.\njava:190)\n        at org.eclipse.jdt.internal.compiler.lookup.BlockScope.getMethod\n(BlockSc\nope.java:1231)\n        at \norg.eclipse.jdt.internal.compiler.ast.MessageSend.resolveMethodBindin\ng(MessageSend.java:268)\n        at org.eclipse.jdt.internal.compiler.ast.MessageSend.resolveType\n(Message\nSend.java:213)\n        at org.eclipse.jdt.internal.compiler.ast.Expression.resolve\n(Expression.j\nava:433)\n        at org.eclipse.jdt.internal.compiler.ast.Block.resolveUsing\n(Block.java:1\n03)\n        at org.eclipse.jdt.internal.compiler.ast.TryStatement.resolve\n(TryStateme\nnt.java:465)\n        at \norg.eclipse.jdt.internal.compiler.ast.AbstractMethodDeclaration.resol\nveStatements(AbstractMethodDeclaration.java:328)\n        at \norg.eclipse.jdt.internal.compiler.ast.MethodDeclaration.resolveStatem\nents(MethodDeclaration.java:127)\n        at \norg.aspectj.ajdt.internal.compiler.ast.AdviceDeclaration.resolveState\nments(AdviceDeclaration.java:128)\n        at \norg.eclipse.jdt.internal.compiler.ast.AbstractMethodDeclaration.resol\nve(AbstractMethodDeclaration.java:317)\n        at org.eclipse.jdt.internal.compiler.ast.TypeDeclaration.resolve\n(TypeDec\nlaration.java:804)\n        at org.aspectj.ajdt.internal.compiler.ast.AspectDeclaration.resolve\n(Aspe\nctDeclaration.java:73)\n        at org.eclipse.jdt.internal.compiler.ast.TypeDeclaration.resolve\n(TypeDec\nlaration.java:845)\n        at \norg.eclipse.jdt.internal.compiler.ast.CompilationUnitDeclaration.reso\nlve(CompilationUnitDeclaration.java:251)\n        at org.eclipse.jdt.internal.compiler.Compiler.process\n(Compiler.java:538)\n\n        at org.aspectj.ajdt.internal.compiler.AjCompiler.process\n(AjCompiler.java\n:65)\n        at org.eclipse.jdt.internal.compiler.Compiler.compile\n(Compiler.java:338)\n\n        at \norg.aspectj.ajdt.internal.core.builder.AjBuildManager.performCompilat\nion(AjBuildManager.java:372)\n        at org.aspectj.ajdt.internal.core.builder.AjBuildManager.doBuild\n(AjBuild\nManager.java:133)\n        at org.aspectj.ajdt.internal.core.builder.AjBuildManager.batchBuild\n(AjBu\nildManager.java:78)\n        at org.aspectj.ajdt.ajc.AjdtCommand.doCommand(AjdtCommand.java:106)\n        at org.aspectj.ajdt.ajc.AjdtCommand.runCommand(AjdtCommand.java:60)\n        at org.aspectj.tools.ajc.Main.run(Main.java:217)\n        at org.aspectj.tools.ajc.Main.runMain(Main.java:155)\n        at org.aspectj.tools.ajc.Main.main(Main.java:72)\nC:\\eclipse\\workspace\\ajee\\src\\ajee\\ui\\security\\FilterJsp.java:0 Internal \ncompile\nr error\njava.lang.NullPointerException\n        at \norg.eclipse.jdt.internal.compiler.lookup.SourceTypeBinding.getExactMe\nthodBase(SourceTypeBinding.java:459)\n        at \norg.eclipse.jdt.internal.compiler.lookup.SourceTypeBinding.getExactMe\nthod(SourceTypeBinding.java:449)\n        at org.eclipse.jdt.internal.compiler.lookup.Scope.findExactMethod\n(Scope.\njava:190)\n        at org.eclipse.jdt.internal.compiler.lookup.BlockScope.getMethod\n(BlockSc\nope.java:1231)\n        at \norg.eclipse.jdt.internal.compiler.ast.MessageSend.resolveMethodBindin\ng(MessageSend.java:268)\n        at org.eclipse.jdt.internal.compiler.ast.MessageSend.resolveType\n(Message\nSend.java:213)\n        at org.eclipse.jdt.internal.compiler.ast.Expression.resolve\n(Expression.j\nava:433)\n        at org.eclipse.jdt.internal.compiler.ast.Block.resolveUsing\n(Block.java:1\n03)\n        at org.eclipse.jdt.internal.compiler.ast.TryStatement.resolve\n(TryStateme\nnt.java:465)\n        at \norg.eclipse.jdt.internal.compiler.ast.AbstractMethodDeclaration.resol\nveStatements(AbstractMethodDeclaration.java:328)\n        at \norg.eclipse.jdt.internal.compiler.ast.MethodDeclaration.resolveStatem\nents(MethodDeclaration.java:127)\n        at \norg.aspectj.ajdt.internal.compiler.ast.AdviceDeclaration.resolveState\nments(AdviceDeclaration.java:128)\n        at \norg.eclipse.jdt.internal.compiler.ast.AbstractMethodDeclaration.resol\nve(AbstractMethodDeclaration.java:317)\n        at org.eclipse.jdt.internal.compiler.ast.TypeDeclaration.resolve\n(TypeDec\nlaration.java:804)\n        at org.aspectj.ajdt.internal.compiler.ast.AspectDeclaration.resolve\n(Aspe\nctDeclaration.java:73)\n        at org.eclipse.jdt.internal.compiler.ast.TypeDeclaration.resolve\n(TypeDec\nlaration.java:845)\n        at \norg.eclipse.jdt.internal.compiler.ast.CompilationUnitDeclaration.reso\nlve(CompilationUnitDeclaration.java:251)\n        at org.eclipse.jdt.internal.compiler.Compiler.process\n(Compiler.java:538)\n\n        at org.aspectj.ajdt.internal.compiler.AjCompiler.process\n(AjCompiler.java\n:65)\n        at org.eclipse.jdt.internal.compiler.Compiler.compile\n(Compiler.java:338)\n\n        at \norg.aspectj.ajdt.internal.core.builder.AjBuildManager.performCompilat\nion(AjBuildManager.java:372)\n        at org.aspectj.ajdt.internal.core.builder.AjBuildManager.doBuild\n(AjBuild\nManager.java:133)\n        at org.aspectj.ajdt.internal.core.builder.AjBuildManager.batchBuild\n(AjBu\nildManager.java:78)\n        at org.aspectj.ajdt.ajc.AjdtCommand.doCommand(AjdtCommand.java:106)\n        at org.aspectj.ajdt.ajc.AjdtCommand.runCommand(AjdtCommand.java:60)\n        at org.aspectj.tools.ajc.Main.run(Main.java:217)\n        at org.aspectj.tools.ajc.Main.runMain(Main.java:155)\n        at org.aspectj.tools.ajc.Main.main(Main.java:72)\n\n\n!! no source information available !!",
    "This appears to be fixed in the tree.  Please confirm by testing with the\n1.1.1rc expected out this week.\n\nThis is another manifestation of your previously reported crashes that result\nfrom poor handling of missing types in 1.1.0.\n\n",
    "Marking this as fixed, Ron should reopen if 1.1rc1 doesn\u0027t in fact solve the\nproblem."
  ],
  "commentCreationDates": [
    "2003-08-01T07:36:07+02:00",
    "2003-08-04T23:19:49+02:00",
    "2003-08-25T19:23:43+02:00"
  ],
  "traces": [
    {
      "exceptionType": "java.lang.NullPointerException",
      "elements": [
        {
          "method": "org.eclipse.jdt.internal.compiler.lookup.SourceTypeBinding.getExactMethodBase",
          "source": "SourceTypeBinding.java:459"
        },
        {
          "method": "org.eclipse.jdt.internal.compiler.lookup.SourceTypeBinding.getExactMethod",
          "source": "SourceTypeBinding.java:449"
        },
        {
          "method": "org.eclipse.jdt.internal.compiler.lookup.Scope.findExactMethod",
          "source": "Scope. java:190"
        },
        {
          "method": "org.eclipse.jdt.internal.compiler.lookup.BlockScope.getMethod",
          "source": "BlockSc ope.java:1231"
        },
        {
          "method": "org.eclipse.jdt.internal.compiler.ast.MessageSend.resolveMethodBinding",
          "source": "MessageSend.java:268"
        },
        {
          "method": "org.eclipse.jdt.internal.compiler.ast.MessageSend.resolveType",
          "source": "Message Send.java:213"
        },
        {
          "method": "org.eclipse.jdt.internal.compiler.ast.Expression.resolve",
          "source": "Expression.j ava:433"
        },
        {
          "method": "org.eclipse.jdt.internal.compiler.ast.Block.resolveUsing",
          "source": "Block.java:1 03"
        },
        {
          "method": "org.eclipse.jdt.internal.compiler.ast.TryStatement.resolve",
          "source": "TryStateme nt.java:465"
        },
        {
          "method": "org.eclipse.jdt.internal.compiler.ast.AbstractMethodDeclaration.resolveStatements",
          "source": "AbstractMethodDeclaration.java:328"
        },
        {
          "method": "org.eclipse.jdt.internal.compiler.ast.MethodDeclaration.resolveStatements",
          "source": "MethodDeclaration.java:127"
        },
        {
          "method": "org.aspectj.ajdt.internal.compiler.ast.AdviceDeclaration.resolveStatements",
          "source": "AdviceDeclaration.java:128"
        },
        {
          "method": "org.eclipse.jdt.internal.compiler.ast.AbstractMethodDeclaration.resolve",
          "source": "AbstractMethodDeclaration.java:317"
        },
        {
          "method": "org.eclipse.jdt.internal.compiler.ast.TypeDeclaration.resolve",
          "source": "TypeDec laration.java:804"
        },
        {
          "method": "org.aspectj.ajdt.internal.compiler.ast.AspectDeclaration.resolve",
          "source": "Aspe ctDeclaration.java:73"
        },
        {
          "method": "org.eclipse.jdt.internal.compiler.ast.TypeDeclaration.resolve",
          "source": "TypeDec laration.java:845"
        },
        {
          "method": "org.eclipse.jdt.internal.compiler.ast.CompilationUnitDeclaration.resolve",
          "source": "CompilationUnitDeclaration.java:251"
        },
        {
          "method": "org.eclipse.jdt.internal.compiler.Compiler.process",
          "source": "Compiler.java:538"
        },
        {
          "method": "org.aspectj.ajdt.internal.compiler.AjCompiler.process",
          "source": "AjCompiler.java :65"
        },
        {
          "method": "org.eclipse.jdt.internal.compiler.Compiler.compile",
          "source": "Compiler.java:338"
        },
        {
          "method": "org.aspectj.ajdt.internal.core.builder.AjBuildManager.performCompilation",
          "source": "AjBuildManager.java:372"
        },
        {
          "method": "org.aspectj.ajdt.internal.core.builder.AjBuildManager.doBuild",
          "source": "AjBuild Manager.java:133"
        },
        {
          "method": "org.aspectj.ajdt.internal.core.builder.AjBuildManager.batchBuild",
          "source": "AjBu ildManager.java:78"
        },
        {
          "method": "org.aspectj.ajdt.ajc.AjdtCommand.doCommand",
          "source": "AjdtCommand.java:106"
        },
        {
          "method": "org.aspectj.ajdt.ajc.AjdtCommand.runCommand",
          "source": "AjdtCommand.java:60"
        },
        {
          "method": "org.aspectj.tools.ajc.Main.run",
          "source": "Main.java:217"
        },
        {
          "method": "org.aspectj.tools.ajc.Main.runMain",
          "source": "Main.java:155"
        },
        {
          "method": "org.aspectj.tools.ajc.Main.main",
          "source": "Main.java:72"
        }
      ],
      "number": 0,
      "commentIndex": 0,
      "bugId": "41042",
      "date": "2003-08-01T07:36:07+02:00",
      "product": "AspectJ",
      "component": "Compiler",
      "severity": "normal"
    },
    {
      "exceptionType": "java.lang.NullPointerException",
      "elements": [
        {
          "method": "org.eclipse.jdt.internal.compiler.lookup.SourceTypeBinding.getExactMethodBase",
          "source": "SourceTypeBinding.java:459"
        },
        {
          "method": "org.eclipse.jdt.internal.compiler.lookup.SourceTypeBinding.getExactMethod",
          "source": "SourceTypeBinding.java:449"
        },
        {
          "method": "org.eclipse.jdt.internal.compiler.lookup.Scope.findExactMethod",
          "source": "Scope. java:190"
        },
        {
          "method": "org.eclipse.jdt.internal.compiler.lookup.BlockScope.getMethod",
          "source": "BlockSc ope.java:1231"
        },
        {
          "method": "org.eclipse.jdt.internal.compiler.ast.MessageSend.resolveMethodBinding",
          "source": "MessageSend.java:268"
        },
        {
          "method": "org.eclipse.jdt.internal.compiler.ast.MessageSend.resolveType",
          "source": "Message Send.java:213"
        },
        {
          "method": "org.eclipse.jdt.internal.compiler.ast.Expression.resolve",
          "source": "Expression.j ava:433"
        },
        {
          "method": "org.eclipse.jdt.internal.compiler.ast.Block.resolveUsing",
          "source": "Block.java:1 03"
        },
        {
          "method": "org.eclipse.jdt.internal.compiler.ast.TryStatement.resolve",
          "source": "TryStateme nt.java:465"
        },
        {
          "method": "org.eclipse.jdt.internal.compiler.ast.AbstractMethodDeclaration.resolveStatements",
          "source": "AbstractMethodDeclaration.java:328"
        },
        {
          "method": "org.eclipse.jdt.internal.compiler.ast.MethodDeclaration.resolveStatements",
          "source": "MethodDeclaration.java:127"
        },
        {
          "method": "org.aspectj.ajdt.internal.compiler.ast.AdviceDeclaration.resolveStatements",
          "source": "AdviceDeclaration.java:128"
        },
        {
          "method": "org.eclipse.jdt.internal.compiler.ast.AbstractMethodDeclaration.resolve",
          "source": "AbstractMethodDeclaration.java:317"
        },
        {
          "method": "org.eclipse.jdt.internal.compiler.ast.TypeDeclaration.resolve",
          "source": "TypeDec laration.java:804"
        },
        {
          "method": "org.aspectj.ajdt.internal.compiler.ast.AspectDeclaration.resolve",
          "source": "Aspe ctDeclaration.java:73"
        },
        {
          "method": "org.eclipse.jdt.internal.compiler.ast.TypeDeclaration.resolve",
          "source": "TypeDec laration.java:845"
        },
        {
          "method": "org.eclipse.jdt.internal.compiler.ast.CompilationUnitDeclaration.resolve",
          "source": "CompilationUnitDeclaration.java:251"
        },
        {
          "method": "org.eclipse.jdt.internal.compiler.Compiler.process",
          "source": "Compiler.java:538"
        },
        {
          "method": "org.aspectj.ajdt.internal.compiler.AjCompiler.process",
          "source": "AjCompiler.java :65"
        },
        {
          "method": "org.eclipse.jdt.internal.compiler.Compiler.compile",
          "source": "Compiler.java:338"
        },
        {
          "method": "org.aspectj.ajdt.internal.core.builder.AjBuildManager.performCompilation",
          "source": "AjBuildManager.java:372"
        },
        {
          "method": "org.aspectj.ajdt.internal.core.builder.AjBuildManager.doBuild",
          "source": "AjBuild Manager.java:133"
        },
        {
          "method": "org.aspectj.ajdt.internal.core.builder.AjBuildManager.batchBuild",
          "source": "AjBu ildManager.java:78"
        },
        {
          "method": "org.aspectj.ajdt.ajc.AjdtCommand.doCommand",
          "source": "AjdtCommand.java:106"
        },
        {
          "method": "org.aspectj.ajdt.ajc.AjdtCommand.runCommand",
          "source": "AjdtCommand.java:60"
        },
        {
          "method": "org.aspectj.tools.ajc.Main.run",
          "source": "Main.java:217"
        },
        {
          "method": "org.aspectj.tools.ajc.Main.runMain",
          "source": "Main.java:155"
        },
        {
          "method": "org.aspectj.tools.ajc.Main.main",
          "source": "Main.java:72"
        }
      ],
      "number": 1,
      "commentIndex": 0,
      "bugId": "41042",
      "date": "2003-08-01T07:36:07+02:00",
      "product": "AspectJ",
      "component": "Compiler",
      "severity": "normal"
    }
  ],
  "groupId": "41042",
  "bugId": "41042",
  "date": "2003-08-01T07:36:07+02:00",
  "product": "AspectJ",
  "component": "Compiler",
  "severity": "normal"
}