{
  "comments": [
    "Opened the export wizard, selected JAR and Next.\nGot the exception below. I\u0027ve exported from the same workspace before, using build 129.\n\nNOTES:\n\nLog: Mon Aug 20 16:52:44 EDT 2001\n4 org.eclipse.core.runtime 0 Unhandled exception caught in event loop.\norg.eclipse.core.internal.runtime.AssertionFailedException: null argument:\n\tat org.eclipse.core.internal.runtime.Assert.isNotNull(Assert.java(Compiled Code))\n\tat org.eclipse.core.runtime.Path.initialize(Path.java(Compiled Code))\n\tat org.eclipse.core.runtime.Path.initialize(Path.java(Compiled Code))\n\tat org.eclipse.core.runtime.Path.\u003cinit\u003e(Path.java(Compiled Code))\n\tat org.eclipse.jdt.internal.ui.jarpackager.JarOptionsPage.getPathFromString(JarOptionsPage.java:270)\n\tat org.eclipse.jdt.internal.ui.jarpackager.JarOptionsPage.initializeJarPackage(JarOptionsPage.java:309)\n\tat org.eclipse.jdt.internal.ui.jarpackager.JarOptionsPage.restoreWidgetValues(JarOptionsPage.java:323)\n\tat org.eclipse.jdt.internal.ui.jarpackager.JarOptionsPage.createControl(JarOptionsPage.java:122)\n\tat org.eclipse.jface.wizard.Wizard.createPageControls(Wizard.java:164)\n\tat org.eclipse.jface.wizard.WizardDialog.createPageControls(WizardDialog.java:506)\n\tat org.eclipse.jface.wizard.WizardDialog.setWizard(WizardDialog.java:835)\n\tat org.eclipse.jface.wizard.WizardDialog.showPage(WizardDialog.java:870)\n\tat org.eclipse.jface.wizard.WizardDialog.nextPressed(WizardDialog.java:648)\n\tat org.eclipse.jface.wizard.WizardDialog.buttonPressed(WizardDialog.java:309)\n\tat org.eclipse.jface.dialogs.Dialog$1.widgetSelected(Dialog.java:211)\n\tat org.eclipse.swt.widgets.TypedListener.handleEvent(TypedListener.java(Compiled Code))\n\tat org.eclipse.swt.widgets.Widget.notifyListeners(Widget.java(Compiled Code))\n\tat org.eclipse.swt.widgets.Widget.notifyListeners(Widget.java(Compiled Code))\n\tat org.eclipse.swt.widgets.Display.runDeferredEvents(Display.java(Compiled Code))\n\tat org.eclipse.swt.widgets.Display.readAndDispatch(Display.java(Compiled Code))\n\tat org.eclipse.jface.window.Window.runEventLoop(Window.java(Compiled Code))\n\tat org.eclipse.jface.window.Window.open(Window.java:523)\n\tat org.eclipse.ui.internal.ExportResourcesAction.run(ExportResourcesAction.java:62)\n\tat org.eclipse.jface.action.ActionContributionItem.handleWidgetSelection(ActionContributionItem.java:408)\n\tat org.eclipse.jface.action.ActionContributionItem.handleWidgetEvent(ActionContributionItem.java(Compiled Code))\n\tat org.eclipse.jface.action.ActionContributionItem$ActionListener.handleEvent(ActionContributionItem.java(Compiled Code))\n\tat org.eclipse.jface.action.ActionContributionItem$ActionListener.handleEvent(ActionContributionItem.java(Compiled Code))\n\tat org.eclipse.swt.widgets.Widget.notifyListeners(Widget.java(Compiled Code))\n\tat org.eclipse.swt.widgets.Widget.notifyListeners(Widget.java(Compiled Code))\n\tat org.eclipse.swt.widgets.Display.runDeferredEvents(Display.java(Compiled Code))\n\tat org.eclipse.swt.widgets.Display.readAndDispatch(Display.java(Compiled Code))\n\tat org.eclipse.ui.internal.Workbench.runEventLoop(Workbench.java(Compiled Code))\n\tat org.eclipse.ui.internal.Workbench.run(Workbench.java:622)\n\tat org.eclipse.core.internal.boot.InternalBootLoader.run(InternalBootLoader.java:815)\n\tat org.eclipse.core.boot.BootLoader.run(BootLoader.java:285)\n\tat java.lang.reflect.Method.invoke(Native Method)\n\tat org.eclipse.core.launcher.Main.basicRun(Main.java:119)\n\tat org.eclipse.core.launcher.Main.run(Main.java:401)\n\tat org.eclipse.core.launcher.Main.main(Main.java:274)\n\nKR (8/20/01 4:57:50 PM)\n\tExport to Zip or file system works. I get to the second page.\n\nKR (8/20/01 5:00:37 PM)\n\tWhen I actually try to export to a zip file it doesn\u0027t work.\n\tI selected a couple of folders and when I click on Finish I get the message\n\t\"There are no resources currently selected for export\"\n\tI tried exporting to a JAR on a different machine (i.e., with a different workspace) and\n\tgot the same exception.\n\nDM (8/21/01 5:19:03 PM)\n\tThe bug is caused by the new wizard page name for JarOptionsPage. It has\n\tbeen changed from \"JarWizardPage\" to \"JarOptionsPage\" in Eclipse 0.126.\n\tTherefore one corresponding\tsetting returns null, causing the error.\n\tThe has already been fixed for the 2.0 stream.\n\tWORKAROUND for 1.0 stream:\n\t\tIn your workspace delete the file: .metadata/.plugins/org.eclipse.jdt.ui/dialog_settings.xml\n\t\tor if you don\u0027t want to loose the other settings: remove the JarPackageWizard section\n\t\tfrom AND INCLUDING \u003csection name\u003d\"JarPackageWizard\"\u003e to \u003c/section\u003e\n\nDM (8/21/01 5:45:01 PM)\n\t* e-mail sent to KR for more info about last comment.\n\t* e-mail sent to EG to ask if this PR should be fixed in the 1.0 stream (simple if-null test)\n\nKR (8/21/01 1:31:44 PM)\n\tI got the \"no resources selected for export\" message when I tried exporting to a ZIP file\n\tafter switching from build 129 to 131.\n\tWhen I copied a fresh dialog_settings.xml both the jar export and zip export worked again.\n\tThis should be reproducable by using a 129 workspace (or just the xml file) with 131 and \n\ttrying to export to a zip file.\n\nDM (8/22/01 2:59:40 PM)\n\tFixed for 1.0 stream (\u003e0.132) and 2.0 stream.\n\n\tWaiting for KR to acknowledge that this PR contains two different PRs. Can be moved\n\tto Verify if a new PR is created for the other problem.\n\nDM (8/22/01 6:28:58 PM)\n\tKR filed a second PR but it describes an NPE and not the \"There are no resources currently selected for export\"\n\tproblem, though it could be related.\n\nKR (8/22/01 1:17:54 PM)\n\tThe \"no resources selected\" message also occurred in the crashed wizard. I assume it is related to\n\tthe problem I opened 1GIV8KI for.\n\tI just couldn\u0027t reproduce the \"no resources selected\" problem anymore. I could only reproduce the \n\t\"NPE when clicking Browse button\" problem. That\u0027s why I hacked the xml file, too. I didn\u0027t want to run \n\t129 to try and get an old style xml file.\n\nDM (8/23/01 9:18:46 AM)\n\tOK, no additional PR needed - moving to verify",
    "didn\u0027t get any exceptions",
    "verified"
  ],
  "commentCreationDates": [
    "2001-10-11T05:06:19+02:00",
    "2001-10-11T17:55:43+02:00",
    "2001-10-11T17:55:54+02:00"
  ],
  "traces": [
    {
      "exceptionType": "org.eclipse.core.internal.runtime.AssertionFailedException",
      "message": "null argument:",
      "elements": [
        {
          "method": "org.eclipse.core.internal.runtime.Assert.isNotNull",
          "source": "Assert.java(Compiled Code)"
        },
        {
          "method": "org.eclipse.core.runtime.Path.initialize",
          "source": "Path.java(Compiled Code)"
        },
        {
          "method": "org.eclipse.core.runtime.Path.initialize",
          "source": "Path.java(Compiled Code)"
        },
        {
          "method": "org.eclipse.core.runtime.Path.\u003cinit\u003e",
          "source": "Path.java(Compiled Code)"
        },
        {
          "method": "org.eclipse.jdt.internal.ui.jarpackager.JarOptionsPage.getPathFromString",
          "source": "JarOptionsPage.java:270"
        },
        {
          "method": "org.eclipse.jdt.internal.ui.jarpackager.JarOptionsPage.initializeJarPackage",
          "source": "JarOptionsPage.java:309"
        },
        {
          "method": "org.eclipse.jdt.internal.ui.jarpackager.JarOptionsPage.restoreWidgetValues",
          "source": "JarOptionsPage.java:323"
        },
        {
          "method": "org.eclipse.jdt.internal.ui.jarpackager.JarOptionsPage.createControl",
          "source": "JarOptionsPage.java:122"
        },
        {
          "method": "org.eclipse.jface.wizard.Wizard.createPageControls",
          "source": "Wizard.java:164"
        },
        {
          "method": "org.eclipse.jface.wizard.WizardDialog.createPageControls",
          "source": "WizardDialog.java:506"
        },
        {
          "method": "org.eclipse.jface.wizard.WizardDialog.setWizard",
          "source": "WizardDialog.java:835"
        },
        {
          "method": "org.eclipse.jface.wizard.WizardDialog.showPage",
          "source": "WizardDialog.java:870"
        },
        {
          "method": "org.eclipse.jface.wizard.WizardDialog.nextPressed",
          "source": "WizardDialog.java:648"
        },
        {
          "method": "org.eclipse.jface.wizard.WizardDialog.buttonPressed",
          "source": "WizardDialog.java:309"
        },
        {
          "method": "org.eclipse.jface.dialogs.Dialog$1.widgetSelected",
          "source": "Dialog.java:211"
        },
        {
          "method": "org.eclipse.swt.widgets.TypedListener.handleEvent",
          "source": "TypedListener.java(Compiled Code)"
        },
        {
          "method": "org.eclipse.swt.widgets.Widget.notifyListeners",
          "source": "Widget.java(Compiled Code)"
        },
        {
          "method": "org.eclipse.swt.widgets.Widget.notifyListeners",
          "source": "Widget.java(Compiled Code)"
        },
        {
          "method": "org.eclipse.swt.widgets.Display.runDeferredEvents",
          "source": "Display.java(Compiled Code)"
        },
        {
          "method": "org.eclipse.swt.widgets.Display.readAndDispatch",
          "source": "Display.java(Compiled Code)"
        },
        {
          "method": "org.eclipse.jface.window.Window.runEventLoop",
          "source": "Window.java(Compiled Code)"
        },
        {
          "method": "org.eclipse.jface.window.Window.open",
          "source": "Window.java:523"
        },
        {
          "method": "org.eclipse.ui.internal.ExportResourcesAction.run",
          "source": "ExportResourcesAction.java:62"
        },
        {
          "method": "org.eclipse.jface.action.ActionContributionItem.handleWidgetSelection",
          "source": "ActionContributionItem.java:408"
        },
        {
          "method": "org.eclipse.jface.action.ActionContributionItem.handleWidgetEvent",
          "source": "ActionContributionItem.java(Compiled Code)"
        },
        {
          "method": "org.eclipse.jface.action.ActionContributionItem$ActionListener.handleEvent",
          "source": "ActionContributionItem.java(Compiled Code)"
        },
        {
          "method": "org.eclipse.jface.action.ActionContributionItem$ActionListener.handleEvent",
          "source": "ActionContributionItem.java(Compiled Code)"
        },
        {
          "method": "org.eclipse.swt.widgets.Widget.notifyListeners",
          "source": "Widget.java(Compiled Code)"
        },
        {
          "method": "org.eclipse.swt.widgets.Widget.notifyListeners",
          "source": "Widget.java(Compiled Code)"
        },
        {
          "method": "org.eclipse.swt.widgets.Display.runDeferredEvents",
          "source": "Display.java(Compiled Code)"
        },
        {
          "method": "org.eclipse.swt.widgets.Display.readAndDispatch",
          "source": "Display.java(Compiled Code)"
        },
        {
          "method": "org.eclipse.ui.internal.Workbench.runEventLoop",
          "source": "Workbench.java(Compiled Code)"
        },
        {
          "method": "org.eclipse.ui.internal.Workbench.run",
          "source": "Workbench.java:622"
        },
        {
          "method": "org.eclipse.core.internal.boot.InternalBootLoader.run",
          "source": "InternalBootLoader.java:815"
        },
        {
          "method": "org.eclipse.core.boot.BootLoader.run",
          "source": "BootLoader.java:285"
        },
        {
          "method": "java.lang.reflect.Method.invoke",
          "source": "Native Method"
        },
        {
          "method": "org.eclipse.core.launcher.Main.basicRun",
          "source": "Main.java:119"
        },
        {
          "method": "org.eclipse.core.launcher.Main.run",
          "source": "Main.java:401"
        },
        {
          "method": "org.eclipse.core.launcher.Main.main",
          "source": "Main.java:274"
        }
      ],
      "number": 0,
      "commentIndex": 0,
      "bugId": "4116",
      "date": "2001-10-11T05:06:19+02:00",
      "product": "JDT",
      "component": "UI",
      "severity": "critical"
    }
  ],
  "groupId": "4116",
  "bugId": "4116",
  "date": "2001-10-11T05:06:19+02:00",
  "product": "JDT",
  "component": "UI",
  "severity": "critical"
}