{
  "comments": [
    "Almost always (though not always), when trying to edit a template, I am able to\nclick on the edit button, hit \"Ok\" and the edit dialog disappears, but the\nprefrences dialog breaks.  The ok and apply buttons don\u0027t work, I can\u0027t change\nwhich prefrence pane I am looking at, and the scrollview that is showing me the\ncurrent template won\u0027t scroll the view (even though the scroll bar works), and I\ncan\u0027t change which template is shown in the scroll view.\n\nThe console says:\nUnhandled exception caught in event loop.\nReason:\nWidget is disposed\n\nHere is a stack trace from the .log:\n\n!SESSION Aug 23, 2003 10:31:00.792\n---------------------------------------------java.version\u003d1.4.2\njava.vendor\u003dSun Microsystems Inc.\nBootLoader constants: OS\u003dlinux, ARCH\u003dx86, WS\u003dgtk, NL\u003den_US\nCommand-line arguments: -os linux -ws gtk -arch x86 -install file:/opt/eclipse/\n!ENTRY org.eclipse.ui 4 4 Aug 23, 2003 10:31:00.793\n!MESSAGE Unhandled exception caught in event loop.\n!ENTRY org.eclipse.ui 4 0 Aug 23, 2003 10:31:00.796\n!MESSAGE Widget is disposed\n!STACK 0\norg.eclipse.swt.SWTException: Widget is disposed\n        at org.eclipse.swt.SWT.error(SWT.java:2332)\n        at org.eclipse.swt.SWT.error(SWT.java:2262)\n        at org.eclipse.swt.widgets.Widget.error(Widget.java:370)\n        at org.eclipse.swt.widgets.Control.getDisplay(Control.java:1365)\n        at org.eclipse.swt.widgets.Widget.isValidThread(Widget.java:729)\n        at org.eclipse.swt.widgets.Widget.checkWidget(Widget.java:308)\n        at org.eclipse.swt.widgets.Table.getItems(Table.java:787)\n        at\norg.eclipse.jface.viewers.CheckboxTableViewer.preservingSelection(CheckboxTableViewer.java:264)\n        at\norg.eclipse.jface.viewers.StructuredViewer.refresh(StructuredViewer.java:859)\n        at\norg.eclipse.cdt.internal.ui.preferences.TemplatePreferencePage.edit(TemplatePreferencePage.java:409)\n        at\norg.eclipse.cdt.internal.ui.preferences.TemplatePreferencePage.edit(TemplatePreferencePage.java:388)\n        at\norg.eclipse.cdt.internal.ui.preferences.TemplatePreferencePage$6.handleEvent(TemplatePreferencePage.java:194)\n        at org.eclipse.swt.widgets.EventTable.sendEvent(EventTable.java:81)\n        at org.eclipse.swt.widgets.Widget.sendEvent(Widget.java:923)\n        at org.eclipse.swt.widgets.Display.runDeferredEvents(Display.java:1641)\n        at org.eclipse.swt.widgets.Display.readAndDispatch(Display.java:1433)\n        at org.eclipse.jface.window.Window.runEventLoop(Window.java:583)\n        at org.eclipse.jface.window.Window.open(Window.java:563)\n        at\norg.eclipse.ui.internal.OpenPreferencesAction.run(OpenPreferencesAction.java:53)\n        at org.eclipse.jface.action.Action.runWithEvent(Action.java:842)\n        at\norg.eclipse.jface.action.ActionContributionItem.handleWidgetSelection(ActionContributionItem.java:456)\n        at\norg.eclipse.jface.action.ActionContributionItem.handleWidgetEvent(ActionContributionItem.java:403)\n        at\norg.eclipse.jface.action.ActionContributionItem.access$0(ActionContributionItem.java:397)\n        at\norg.eclipse.jface.action.ActionContributionItem$ActionListener.handleEvent(ActionContributionItem.java:72)\n        at org.eclipse.swt.widgets.EventTable.sendEvent(EventTable.java:81)\n        at org.eclipse.swt.widgets.Widget.sendEvent(Widget.java:923)\n        at org.eclipse.swt.widgets.Display.runDeferredEvents(Display.java:1641)\n        at org.eclipse.swt.widgets.Display.readAndDispatch(Display.java:1433)\n        at org.eclipse.ui.internal.Workbench.runEventLoop(Workbench.java:1402)\n        at org.eclipse.ui.internal.Workbench.run(Workbench.java:1385)\n        at\norg.eclipse.core.internal.boot.InternalBootLoader.run(InternalBootLoader.java:858)\n        at org.eclipse.core.boot.BootLoader.run(BootLoader.java:461)\n        at sun.reflect.NativeMethodAccessorImpl.invoke0(Native Method)\n        at\nsun.reflect.NativeMethodAccessorImpl.invoke(NativeMethodAccessorImpl.java:39)\n        at\nsun.reflect.DelegatingMethodAccessorImpl.invoke(DelegatingMethodAccessorImpl.java:25)\n        at java.lang.reflect.Method.invoke(Method.java:324)\n        at org.eclipse.core.launcher.Main.basicRun(Main.java:291)\n        at org.eclipse.core.launcher.Main.run(Main.java:747)\n        at org.eclipse.core.launcher.Main.main(Main.java:583)\n\nperhaps you are letting the event loop thread die with an uncaught exception??",
    "Hoda did the first implementation of the template.",
    "Could not reproduce the bug on my workstation.\nNeed more detailed steps on how to reproduce it."
  ],
  "commentCreationDates": [
    "2003-08-23T19:23:35+02:00",
    "2003-09-09T21:18:38+02:00",
    "2003-09-26T16:50:16+02:00"
  ],
  "traces": [
    {
      "exceptionType": "org.eclipse.swt.SWTException",
      "message": "Widget is disposed",
      "elements": [
        {
          "method": "org.eclipse.swt.SWT.error",
          "source": "SWT.java:2332"
        },
        {
          "method": "org.eclipse.swt.SWT.error",
          "source": "SWT.java:2262"
        },
        {
          "method": "org.eclipse.swt.widgets.Widget.error",
          "source": "Widget.java:370"
        },
        {
          "method": "org.eclipse.swt.widgets.Control.getDisplay",
          "source": "Control.java:1365"
        },
        {
          "method": "org.eclipse.swt.widgets.Widget.isValidThread",
          "source": "Widget.java:729"
        },
        {
          "method": "org.eclipse.swt.widgets.Widget.checkWidget",
          "source": "Widget.java:308"
        },
        {
          "method": "org.eclipse.swt.widgets.Table.getItems",
          "source": "Table.java:787"
        },
        {
          "method": "org.eclipse.jface.viewers.CheckboxTableViewer.preservingSelection",
          "source": "CheckboxTableViewer.java:264"
        },
        {
          "method": "org.eclipse.jface.viewers.StructuredViewer.refresh",
          "source": "StructuredViewer.java:859"
        },
        {
          "method": "org.eclipse.cdt.internal.ui.preferences.TemplatePreferencePage.edit",
          "source": "TemplatePreferencePage.java:409"
        },
        {
          "method": "org.eclipse.cdt.internal.ui.preferences.TemplatePreferencePage.edit",
          "source": "TemplatePreferencePage.java:388"
        },
        {
          "method": "org.eclipse.cdt.internal.ui.preferences.TemplatePreferencePage$6.handleEvent",
          "source": "TemplatePreferencePage.java:194"
        },
        {
          "method": "org.eclipse.swt.widgets.EventTable.sendEvent",
          "source": "EventTable.java:81"
        },
        {
          "method": "org.eclipse.swt.widgets.Widget.sendEvent",
          "source": "Widget.java:923"
        },
        {
          "method": "org.eclipse.swt.widgets.Display.runDeferredEvents",
          "source": "Display.java:1641"
        },
        {
          "method": "org.eclipse.swt.widgets.Display.readAndDispatch",
          "source": "Display.java:1433"
        },
        {
          "method": "org.eclipse.jface.window.Window.runEventLoop",
          "source": "Window.java:583"
        },
        {
          "method": "org.eclipse.jface.window.Window.open",
          "source": "Window.java:563"
        },
        {
          "method": "org.eclipse.ui.internal.OpenPreferencesAction.run",
          "source": "OpenPreferencesAction.java:53"
        },
        {
          "method": "org.eclipse.jface.action.Action.runWithEvent",
          "source": "Action.java:842"
        },
        {
          "method": "org.eclipse.jface.action.ActionContributionItem.handleWidgetSelection",
          "source": "ActionContributionItem.java:456"
        },
        {
          "method": "org.eclipse.jface.action.ActionContributionItem.handleWidgetEvent",
          "source": "ActionContributionItem.java:403"
        },
        {
          "method": "org.eclipse.jface.action.ActionContributionItem.access$0",
          "source": "ActionContributionItem.java:397"
        },
        {
          "method": "org.eclipse.jface.action.ActionContributionItem$ActionListener.handleEvent",
          "source": "ActionContributionItem.java:72"
        },
        {
          "method": "org.eclipse.swt.widgets.EventTable.sendEvent",
          "source": "EventTable.java:81"
        },
        {
          "method": "org.eclipse.swt.widgets.Widget.sendEvent",
          "source": "Widget.java:923"
        },
        {
          "method": "org.eclipse.swt.widgets.Display.runDeferredEvents",
          "source": "Display.java:1641"
        },
        {
          "method": "org.eclipse.swt.widgets.Display.readAndDispatch",
          "source": "Display.java:1433"
        },
        {
          "method": "org.eclipse.ui.internal.Workbench.runEventLoop",
          "source": "Workbench.java:1402"
        },
        {
          "method": "org.eclipse.ui.internal.Workbench.run",
          "source": "Workbench.java:1385"
        },
        {
          "method": "org.eclipse.core.internal.boot.InternalBootLoader.run",
          "source": "InternalBootLoader.java:858"
        },
        {
          "method": "org.eclipse.core.boot.BootLoader.run",
          "source": "BootLoader.java:461"
        },
        {
          "method": "sun.reflect.NativeMethodAccessorImpl.invoke0",
          "source": "Native Method"
        },
        {
          "method": "sun.reflect.NativeMethodAccessorImpl.invoke",
          "source": "NativeMethodAccessorImpl.java:39"
        },
        {
          "method": "sun.reflect.DelegatingMethodAccessorImpl.invoke",
          "source": "DelegatingMethodAccessorImpl.java:25"
        },
        {
          "method": "java.lang.reflect.Method.invoke",
          "source": "Method.java:324"
        },
        {
          "method": "org.eclipse.core.launcher.Main.basicRun",
          "source": "Main.java:291"
        },
        {
          "method": "org.eclipse.core.launcher.Main.run",
          "source": "Main.java:747"
        },
        {
          "method": "org.eclipse.core.launcher.Main.main",
          "source": "Main.java:583"
        }
      ],
      "number": 0,
      "commentIndex": 0,
      "bugId": "41893",
      "date": "2003-08-23T19:23:35+02:00",
      "product": "CDT",
      "component": "UI",
      "severity": "normal"
    }
  ],
  "groupId": "41893",
  "bugId": "41893",
  "date": "2003-08-23T19:23:35+02:00",
  "product": "CDT",
  "component": "UI",
  "severity": "normal"
}