{
  "comments": [
    "Build 20030827\n\nAfter replacing a project with another version, I saw the background activity \nicon animating. I double-clicked on it to open the Progress view. It showed \nan \u0027ERROR: Decoration calculation: An internal error occured \nduring: \"Decoration calculation\" \u0027 job.\n\nThe internal error was:\n\njava.util.ConcurrentModificationException\n        at java.util.HashMap$HashIterator.nextEntry(HashMap.java:762)\n        at java.util.HashMap$KeyIterator.next(HashMap.java:798)\n        at org.eclipse.core.internal.jobs.JobManager.findBlockingJob\n(JobManager.java:311)\n        at org.eclipse.core.internal.jobs.ImplicitJobs$ThreadJob.joinRun\n(ImplicitJobs.java:47)\n        at org.eclipse.core.internal.jobs.ImplicitJobs.begin\n(ImplicitJobs.java:138)\n        at org.eclipse.core.internal.jobs.JobManager.beginRule\n(JobManager.java:111)\n        at \norg.eclipse.team.internal.ccvs.core.resources.EclipseSynchronizer.beginOperation\n(EclipseSynchronizer.java:422)\n        at \norg.eclipse.team.internal.ccvs.core.resources.EclipseSynchronizer.getFolderSync\n(EclipseSynchronizer.java:160)\n        at \norg.eclipse.team.internal.ccvs.core.resources.EclipseFolder.isCVSFolder\n(EclipseFolder.java:226)\n        at org.eclipse.team.internal.ccvs.ui.CVSLightweightDecorator.getOverlay\n(CVSLightweightDecorator.java:335)\n        at org.eclipse.team.internal.ccvs.ui.CVSLightweightDecorator.decorate\n(CVSLightweightDecorator.java:194)\n        at \norg.eclipse.ui.internal.decorators.LightweightDecoratorDefinition.decorate\n(LightweightDecoratorDefinition.java:158)\n        at \norg.eclipse.ui.internal.decorators.LightweightDecoratorManager$LightweightRunnab\nle.run(LightweightDecoratorManager.java:59)\n        at org.eclipse.core.internal.runtime.InternalPlatform.run\n(InternalPlatform.java:1016)\n        at org.eclipse.core.runtime.Platform.run(Platform.java:420)\n        at \norg.eclipse.ui.internal.decorators.LightweightDecoratorManager.decorate\n(LightweightDecoratorManager.java:212)\n        at \norg.eclipse.ui.internal.decorators.LightweightDecoratorManager.getDecorations\n(LightweightDecoratorManager.java:195)\n        at org.eclipse.ui.internal.decorators.DecorationScheduler$1.run\n(DecorationScheduler.java:253)\n        at org.eclipse.core.internal.jobs.Worker.run(Worker.java:61)\n!ENTRY org.eclipse.core.runtime 4 2 Aug 28, 2003 11:15:10.522\n!MESSAGE An internal error occurred during: \"Decoration Calculation\".\n!STACK 0\norg.eclipse.ui.internal.misc.AssertionFailedException: assertion failed;\n        at org.eclipse.ui.internal.misc.Assert.isTrue(Assert.java:100)\n        at org.eclipse.ui.internal.misc.Assert.isTrue(Assert.java:87)\n        at org.eclipse.ui.internal.misc.StatusUtil.newStatus(StatusUtil.java:78)\n        at \norg.eclipse.ui.internal.decorators.LightweightDecoratorManager$LightweightRunnab\nle.handleException(LightweightDecoratorManager.java:52)\n        at org.eclipse.core.internal.runtime.InternalPlatform.handleException\n(InternalPlatform.java:467)\n        at org.eclipse.core.internal.runtime.InternalPlatform.run\n(InternalPlatform.java:1018)\n        at org.eclipse.core.runtime.Platform.run(Platform.java:420)\n        at \norg.eclipse.ui.internal.decorators.LightweightDecoratorManager.decorate\n(LightweightDecoratorManager.java:212)\n        at \norg.eclipse.ui.internal.decorators.LightweightDecoratorManager.getDecorations\n(LightweightDecoratorManager.java:195)\n        at org.eclipse.ui.internal.decorators.DecorationScheduler$1.run\n(DecorationScheduler.java:253)\n        at org.eclipse.core.internal.jobs.Worker.run(Worker.java:61)",
    "I\u0027ve had a quick look at the Core code and all access to the \"running\" \ninstance variable of JobManager is protected by a lock except for the access \nin the findBlockingJob() method. ",
    "I got the same thing on the Mac",
    "Fixed and released."
  ],
  "commentCreationDates": [
    "2003-08-28T11:23:49+02:00",
    "2003-08-28T15:04:36+02:00",
    "2003-08-28T16:21:40+02:00",
    "2003-08-28T20:47:29+02:00"
  ],
  "traces": [
    {
      "exceptionType": "java.util.ConcurrentModificationException",
      "elements": [
        {
          "method": "java.util.HashMap$HashIterator.nextEntry",
          "source": "HashMap.java:762"
        },
        {
          "method": "java.util.HashMap$KeyIterator.next",
          "source": "HashMap.java:798"
        },
        {
          "method": "org.eclipse.core.internal.jobs.JobManager.findBlockingJob",
          "source": "JobManager.java:311"
        },
        {
          "method": "org.eclipse.core.internal.jobs.ImplicitJobs$ThreadJob.joinRun",
          "source": "ImplicitJobs.java:47"
        },
        {
          "method": "org.eclipse.core.internal.jobs.ImplicitJobs.begin",
          "source": "ImplicitJobs.java:138"
        },
        {
          "method": "org.eclipse.core.internal.jobs.JobManager.beginRule",
          "source": "JobManager.java:111"
        },
        {
          "method": "org.eclipse.team.internal.ccvs.core.resources.EclipseSynchronizer.beginOperation",
          "source": "EclipseSynchronizer.java:422"
        },
        {
          "method": "org.eclipse.team.internal.ccvs.core.resources.EclipseSynchronizer.getFolderSync",
          "source": "EclipseSynchronizer.java:160"
        },
        {
          "method": "org.eclipse.team.internal.ccvs.core.resources.EclipseFolder.isCVSFolder",
          "source": "EclipseFolder.java:226"
        },
        {
          "method": "org.eclipse.team.internal.ccvs.ui.CVSLightweightDecorator.getOverlay",
          "source": "CVSLightweightDecorator.java:335"
        },
        {
          "method": "org.eclipse.team.internal.ccvs.ui.CVSLightweightDecorator.decorate",
          "source": "CVSLightweightDecorator.java:194"
        },
        {
          "method": "org.eclipse.ui.internal.decorators.LightweightDecoratorDefinition.decorate",
          "source": "LightweightDecoratorDefinition.java:158"
        },
        {
          "method": "org.eclipse.ui.internal.decorators.LightweightDecoratorManager$LightweightRunnable.run",
          "source": "LightweightDecoratorManager.java:59"
        },
        {
          "method": "org.eclipse.core.internal.runtime.InternalPlatform.run",
          "source": "InternalPlatform.java:1016"
        },
        {
          "method": "org.eclipse.core.runtime.Platform.run",
          "source": "Platform.java:420"
        },
        {
          "method": "org.eclipse.ui.internal.decorators.LightweightDecoratorManager.decorate",
          "source": "LightweightDecoratorManager.java:212"
        },
        {
          "method": "org.eclipse.ui.internal.decorators.LightweightDecoratorManager.getDecorations",
          "source": "LightweightDecoratorManager.java:195"
        },
        {
          "method": "org.eclipse.ui.internal.decorators.DecorationScheduler$1.run",
          "source": "DecorationScheduler.java:253"
        },
        {
          "method": "org.eclipse.core.internal.jobs.Worker.run",
          "source": "Worker.java:61"
        }
      ],
      "number": 0,
      "commentIndex": 0,
      "bugId": "42201",
      "date": "2003-08-28T11:23:49+02:00",
      "product": "Platform",
      "component": "Resources",
      "severity": "normal"
    },
    {
      "exceptionType": "org.eclipse.ui.internal.misc.AssertionFailedException",
      "message": "assertion failed;",
      "elements": [
        {
          "method": "org.eclipse.ui.internal.misc.Assert.isTrue",
          "source": "Assert.java:100"
        },
        {
          "method": "org.eclipse.ui.internal.misc.Assert.isTrue",
          "source": "Assert.java:87"
        },
        {
          "method": "org.eclipse.ui.internal.misc.StatusUtil.newStatus",
          "source": "StatusUtil.java:78"
        },
        {
          "method": "org.eclipse.ui.internal.decorators.LightweightDecoratorManager$LightweightRunnable.handleException",
          "source": "LightweightDecoratorManager.java:52"
        },
        {
          "method": "org.eclipse.core.internal.runtime.InternalPlatform.handleException",
          "source": "InternalPlatform.java:467"
        },
        {
          "method": "org.eclipse.core.internal.runtime.InternalPlatform.run",
          "source": "InternalPlatform.java:1018"
        },
        {
          "method": "org.eclipse.core.runtime.Platform.run",
          "source": "Platform.java:420"
        },
        {
          "method": "org.eclipse.ui.internal.decorators.LightweightDecoratorManager.decorate",
          "source": "LightweightDecoratorManager.java:212"
        },
        {
          "method": "org.eclipse.ui.internal.decorators.LightweightDecoratorManager.getDecorations",
          "source": "LightweightDecoratorManager.java:195"
        },
        {
          "method": "org.eclipse.ui.internal.decorators.DecorationScheduler$1.run",
          "source": "DecorationScheduler.java:253"
        },
        {
          "method": "org.eclipse.core.internal.jobs.Worker.run",
          "source": "Worker.java:61"
        }
      ],
      "number": 1,
      "commentIndex": 0,
      "bugId": "42201",
      "date": "2003-08-28T11:23:49+02:00",
      "product": "Platform",
      "component": "Resources",
      "severity": "normal"
    }
  ],
  "groupId": "42201",
  "bugId": "42201",
  "date": "2003-08-28T11:23:49+02:00",
  "product": "Platform",
  "component": "Resources",
  "severity": "normal"
}