{
  "comments": [
    "My project uses some complex aspectual interactions. My sources work fine under \najc 1.0.6, however, if I compile with 1.1, I get verification errors in the \ngenerated bytecodes. My problem is even worse with 1.1.1rc1 because the \ncompiler does not even get to finish. Here are the errors:\n\n(cd \"c:\\Documents and Settings\\Macneil Shonle\\eclipse\\workspace\\Nebulous\"; rm -\nf -r bin/edu Nebulous.jar)\n(cd \"c:\\Documents and Settings\\Macneil \nShonle\\eclipse\\workspace\\Nebulous\"; /cygdrive/c/aspectj1.1.1rc1/bin/ajc  -\nclasspath \"c:\\Documents and Settings\\Macneil \nShonle\\eclipse\\workspace\\edu.ucsd.aspectbrowser\\aspectbrowser.jar;c:\\Documents \nand Settings\\Macneil Shonle\\eclipse\\workspace\\Nebulous\\gnu-regexp-\n1.1.4.jar;c:\\Documents and Settings\\Macneil \nShonle\\eclipse\\plugins\\org.eclipse.ui_2.1.1\\ui.jar;c:\\Documents and \nSettings\\Macneil Shonle\\eclipse\\plugins\\org.eclipse.swt.win32_2.1.1\\ws\\win32\n\\swt.jar;c:\\Documents and Settings\\Macneil \nShonle\\eclipse\\plugins\\org.eclipse.text_2.1.0\\text.jar;c:\\Documents and \nSettings\\Macneil Shonle\\eclipse\\plugins\\org.eclipse.jface_2.1.1\n\\jface.jar;c:\\Documents and Settings\\Macneil \nShonle\\eclipse\\plugins\\org.eclipse.jface.text_2.1.0\\jfacetext.jar;c:\\Documents \nand Settings\\Macneil Shonle\\eclipse\\plugins\\org.eclipse.ui.workbench_2.1.1\n\\workbench.jar;c:\\Documents and Settings\\Macneil \nShonle\\eclipse\\plugins\\org.eclipse.ui.workbench.texteditor_2.1.0\n\\texteditor.jar;c:\\Documents and Settings\\Macneil \nShonle\\eclipse\\plugins\\org.eclipse.ui.editors_2.1.0\\editors.jar;c:\\Documents \nand Settings\\Macneil Shonle\\eclipse\\plugins\\org.eclipse.core.resources_2.1.1\n\\resources.jar;c:\\Documents and Settings\\Macneil \nShonle\\eclipse\\plugins\\org.eclipse.core.runtime_2.1.1\n\\runtime.jar;c:\\aspectj1.1.1rc1\\lib\\aspectjrt.jar\" -d bin @default.lst)\ntrouble in: \npublic class edu.ucsd.nebulous.ContainerCaching extends \nedu.ucsd.nebulous.AbstractCaching implements \nedu.ucsd.nebulous.ContainerCaching$ajcMightHaveAspect:\n     declares: [declare parents: ExactTypePattern\n(edu.ucsd.nebulous.ActiveContainer) extends (ExactTypePattern\n(edu.ucsd.nebulous.AbstractCaching$Value));, declare parents: ExactTypePattern\n(edu.ucsd.nebulous.ContainerDescriptor) extends (ExactTypePattern\n(edu.ucsd.nebulous.AbstractCaching$Key));]\n  private edu.ucsd.nebulous.ContainerLoader loader\n  private transient edu.ucsd.nebulous.ContainerCaching \najc$edu_ucsd_nebulous_ContainerCaching$perObjectField\n  public static final org.aspectj.runtime.internal.CFlowStack ajc$cflowStack$0\n  public static final org.aspectj.runtime.internal.CFlowStack ajc$cflowStack$1\n  public void \u003cinit\u003e():\n                    ALOAD_0     // edu.ucsd.nebulous.ContainerCaching this   \n(line 36)\n                    INVOKESPECIAL edu.ucsd.nebulous.AbstractCaching.\u003cinit\u003e ()V\n    constructor-execution(void edu.ucsd.nebulous.ContainerCaching.\u003cinit\u003e())\n    |               RETURN\n    constructor-execution(void edu.ucsd.nebulous.ContainerCaching.\u003cinit\u003e())\n  end public void \u003cinit\u003e()\n\n  public static int getCacheSize(edu.ucsd.nebulous.ContainerLoader):\n    method-execution(int edu.ucsd.nebulous.ContainerCaching.getCacheSize\n(edu.ucsd.nebulous.ContainerLoader))\n    |               ALOAD_0     // edu.ucsd.nebulous.ContainerLoader arg0   \n(line 41)\n    | method-call(edu.ucsd.nebulous.ContainerCaching \nedu.ucsd.nebulous.ContainerCaching.aspectOf(java.lang.Object))\n    | |             INVOKESTATIC edu.ucsd.nebulous.ContainerCaching.aspectOf \n(Ljava/lang/Object;)Ledu/ucsd/nebulous/ContainerCaching;\n    | method-call(edu.ucsd.nebulous.ContainerCaching \nedu.ucsd.nebulous.ContainerCaching.aspectOf(java.lang.Object))\n    | method-call(int edu.ucsd.nebulous.AbstractCaching.getMaximumCacheSize())\n    | |             INVOKEVIRTUAL \nedu.ucsd.nebulous.AbstractCaching.getMaximumCacheSize ()I\n    | method-call(int edu.ucsd.nebulous.AbstractCaching.getMaximumCacheSize())\n    |               IRETURN\n    method-execution(int edu.ucsd.nebulous.ContainerCaching.getCacheSize\n(edu.ucsd.nebulous.ContainerLoader))\n  end public static int getCacheSize(edu.ucsd.nebulous.ContainerLoader)\n\n  public static void setCacheSize(edu.ucsd.nebulous.ContainerLoader, int):\n    method-execution(void edu.ucsd.nebulous.ContainerCaching.setCacheSize\n(edu.ucsd.nebulous.ContainerLoader, int))\n    |               ALOAD_0     // edu.ucsd.nebulous.ContainerLoader arg0   \n(line 46)\n    | method-call(edu.ucsd.nebulous.ContainerCaching \nedu.ucsd.nebulous.ContainerCaching.aspectOf(java.lang.Object))\n    | |             INVOKESTATIC edu.ucsd.nebulous.ContainerCaching.aspectOf \n(Ljava/lang/Object;)Ledu/ucsd/nebulous/ContainerCaching;\n    | method-call(edu.ucsd.nebulous.ContainerCaching \nedu.ucsd.nebulous.ContainerCaching.aspectOf(java.lang.Object))\n    |               ILOAD_1     // int arg1\n    | method-call(void edu.ucsd.nebulous.AbstractCaching.setMaximumCacheSize\n(int))\n    | |             INVOKEVIRTUAL \nedu.ucsd.nebulous.AbstractCaching.setMaximumCacheSize (I)V\n    | method-call(void edu.ucsd.nebulous.AbstractCaching.setMaximumCacheSize\n(int))\n    |               RETURN   (line 47)\n    method-execution(void edu.ucsd.nebulous.ContainerCaching.setCacheSize\n(edu.ucsd.nebulous.ContainerLoader, int))\n  end public static void setCacheSize(edu.ucsd.nebulous.ContainerLoader, int)\n\n  private void dispatchGenerator(edu.ucsd.nebulous.Generator):\n    method-execution(void edu.ucsd.nebulous.ContainerCaching.dispatchGenerator\n(edu.ucsd.nebulous.Generator))\n    |               ALOAD_0     // edu.ucsd.nebulous.ContainerCaching this   \n(line 51)\n    | method-call(java.util.Iterator \nedu.ucsd.nebulous.AbstractCaching.getCachedValues())\n    | |             INVOKEVIRTUAL \nedu.ucsd.nebulous.AbstractCaching.getCachedValues ()Ljava/util/Iterator;\n    | method-call(java.util.Iterator \nedu.ucsd.nebulous.AbstractCaching.getCachedValues())\n    |               ASTORE_2\n    |               GOTO L1   (line 52)\n    |           L0: ALOAD_2     // java.util.Iterator i   (line 54)\n    | method-call(java.lang.Object java.util.Iterator.next())\n    | |             INVOKEINTERFACE java.util.Iterator.next ()Ljava/lang/Object;\n    | method-call(java.lang.Object java.util.Iterator.next())\n    |               CHECKCAST edu.ucsd.nebulous.ActiveContainer\n    |               ASTORE_3\n    |               ALOAD_3     // edu.ucsd.nebulous.ActiveContainer \ncontainer   (line 55)\n    |               ALOAD_1     // edu.ucsd.nebulous.Generator inGenerator\n    | method-call(void edu.ucsd.nebulous.ActiveContainer.dispatchGenerator\n(edu.ucsd.nebulous.Generator))\n    | |             INVOKEVIRTUAL \nedu.ucsd.nebulous.ActiveContainer.dispatchGenerator \n(Ledu/ucsd/nebulous/Generator;)V\n    | method-call(void edu.ucsd.nebulous.ActiveContainer.dispatchGenerator\n(edu.ucsd.nebulous.Generator))\n    |           L1: ALOAD_2     // java.util.Iterator i   (line 52)\n    | method-call(boolean java.util.Iterator.hasNext())\n    | |             INVOKEINTERFACE java.util.Iterator.hasNext ()Z\n    | method-call(boolean java.util.Iterator.hasNext())\n    |               IFNE L0\n    |               RETURN   (line 57)\n    method-execution(void edu.ucsd.nebulous.ContainerCaching.dispatchGenerator\n(edu.ucsd.nebulous.Generator))\n  end private void dispatchGenerator(edu.ucsd.nebulous.Generator)\n\n  private static void debugPrint(edu.ucsd.nebulous.ContainerLoader):\n                    ALOAD_0     // edu.ucsd.nebulous.ContainerLoader arg0   \n(line 60)\n                    INVOKESTATIC edu.ucsd.nebulous.ContainerCaching.aspectOf \n(Ljava/lang/Object;)Ledu/ucsd/nebulous/ContainerCaching;\n                    INVOKESPECIAL edu.ucsd.nebulous.ContainerCaching.debugPrint \n()V\n                    RETURN   (line 61)\n  end private static void debugPrint(edu.ucsd.nebulous.ContainerLoader)\n\n  private void debugPrint():\n                    GETSTATIC java.lang.System.err Ljava/io/PrintStream;   \n(line 65)\n                    LDC \"Cache Contents {\"\n                    INVOKEVIRTUAL java.io.PrintStream.println \n(Ljava/lang/String;)V\n                    ALOAD_0     // edu.ucsd.nebulous.ContainerCaching this   \n(line 67)\n                    INVOKEVIRTUAL \nedu.ucsd.nebulous.AbstractCaching.getCachedKeys ()Ljava/util/Iterator;\n                    ASTORE_1\n                    GOTO L1   (line 68)\n                L0: ALOAD_1     // java.util.Iterator keys   (line 70)\n                    INVOKEINTERFACE java.util.Iterator.next ()Ljava/lang/Object;\n                    CHECKCAST edu.ucsd.nebulous.ContainerDescriptor\n                    ASTORE_2\n                    GETSTATIC java.lang.System.err Ljava/io/PrintStream;   \n(line 71)\n                    NEW java.lang.StringBuffer\n                    DUP\n                    ALOAD_2     // edu.ucsd.nebulous.ContainerDescriptor \ncontainerDesc\n                    INVOKEVIRTUAL edu.ucsd.nebulous.ContainerDescriptor.getName \n()Ljava/lang/String;\n                    INVOKESTATIC java.lang.String.valueOf (Ljava/lang/Object;)\nLjava/lang/String;\n                    INVOKESPECIAL java.lang.StringBuffer.\u003cinit\u003e \n(Ljava/lang/String;)V\n                    LDC \"; \"\n                    INVOKEVIRTUAL java.lang.StringBuffer.append \n(Ljava/lang/String;)Ljava/lang/StringBuffer;\n                    INVOKEVIRTUAL java.lang.StringBuffer.toString ()\nLjava/lang/String;\n                    INVOKEVIRTUAL java.io.PrintStream.print (Ljava/lang/String;)\nV\n                L1: ALOAD_1     // java.util.Iterator keys   (line 68)\n                    INVOKEINTERFACE java.util.Iterator.hasNext ()Z\n                    IFNE L0\n                    GETSTATIC java.lang.System.err Ljava/io/PrintStream;   \n(line 74)\n                    LDC \"}\"\n                    INVOKEVIRTUAL java.io.PrintStream.println \n(Ljava/lang/String;)V\n                    RETURN   (line 75)\n  end private void debugPrint()\n\n  protected void unload(edu.ucsd.nebulous.AbstractCaching$Value):\n                    ALOAD_1     // edu.ucsd.nebulous.AbstractCaching$Value \narg0   (line 82)\n                    CHECKCAST edu.ucsd.nebulous.ActiveContainer\n                    INVOKEVIRTUAL edu.ucsd.nebulous.ActiveContainer.delete ()V\n                    RETURN   (line 83)\n  end protected void unload(edu.ucsd.nebulous.AbstractCaching$Value)\n\n  protected edu.ucsd.nebulous.AbstractCaching$Key getKey\n(edu.ucsd.nebulous.AbstractCaching$Value):\n                    ALOAD_1     // edu.ucsd.nebulous.AbstractCaching$Value \narg0   (line 86)\n                    CHECKCAST edu.ucsd.nebulous.ActiveContainer\n                    INVOKEVIRTUAL \nedu.ucsd.nebulous.ActiveContainer.getDescriptor ()\nLedu/ucsd/nebulous/ContainerDescriptor;\n                    ARETURN\n  end protected edu.ucsd.nebulous.AbstractCaching$Key getKey\n(edu.ucsd.nebulous.AbstractCaching$Value)\n\n  private void dummy():\n                    RETURN   (line 101)\n  end private void dummy()\n\n  public void ajc$after$edu_ucsd_nebulous_ContainerCaching$105a\n(edu.ucsd.nebulous.ContainerLoader)    AdviceAttribute(after, (this\n(BindingTypePattern(edu.ucsd.nebulous.ContainerLoader, 0)) \u0026\u0026 execution\n(ExactTypePattern(edu.ucsd.nebulous.ContainerLoader).new(..))), 0, 4186)\n:\n                    ALOAD_0     // edu.ucsd.nebulous.ContainerCaching this   \n(line 107)\n                    ALOAD_1     // edu.ucsd.nebulous.ContainerLoader inLoader\n                    PUTFIELD edu.ucsd.nebulous.ContainerCaching.loader \nLedu/ucsd/nebulous/ContainerLoader;\n                    RETURN   (line 108)\n  end public void ajc$after$edu_ucsd_nebulous_ContainerCaching$105a\n(edu.ucsd.nebulous.ContainerLoader)\n\n  public void ajc$after$edu_ucsd_nebulous_ContainerCaching$10ea\n(edu.ucsd.nebulous.ContainerLoader, edu.ucsd.nebulous.Generator)    \nAdviceAttribute(after, edu.ucsd.nebulous.ContainerLoader.generatorDispatches\n(BindingTypePattern(edu.ucsd.nebulous.ContainerLoader, 0), BindingTypePattern\n(edu.ucsd.nebulous.Generator, 1)), 0, 4330)\n:\n                    ALOAD_0     // edu.ucsd.nebulous.ContainerCaching this   \n(line 113)\n                    ALOAD_2     // edu.ucsd.nebulous.Generator generator\n                    INVOKESPECIAL \nedu.ucsd.nebulous.ContainerCaching.dispatchGenerator \n(Ledu/ucsd/nebulous/Generator;)V\n                    RETURN   (line 114)\n  end public void ajc$after$edu_ucsd_nebulous_ContainerCaching$10ea\n(edu.ucsd.nebulous.ContainerLoader, edu.ucsd.nebulous.Generator)\n\n  public static edu.ucsd.nebulous.ContainerCaching aspectOf(Object)    \norg.aspectj.weaver.AjAttribute$AjSynthetic@1f489d9\n:\n                    ALOAD_0     // java.lang.Object arg0\n                    INSTANCEOF \nedu.ucsd.nebulous.ContainerCaching$ajcMightHaveAspect\n                    IFEQ L1\n                    ALOAD_0     // java.lang.Object arg0\n                    CHECKCAST \nedu.ucsd.nebulous.ContainerCaching$ajcMightHaveAspect\n                    INVOKEINTERFACE \nedu.ucsd.nebulous.ContainerCaching$ajcMightHaveAspect.ajc$edu_ucsd_nebulous_Cont\nainerCaching$perObjectGet ()Ledu/ucsd/nebulous/ContainerCaching;\n                    DUP\n                    IFNULL L0\n                    ARETURN\n                L0: POP\n                L1: NEW org.aspectj.lang.NoAspectBoundException\n                    DUP\n                    INVOKESPECIAL \norg.aspectj.lang.NoAspectBoundException.\u003cinit\u003e ()V\n                    ATHROW\n  end public static edu.ucsd.nebulous.ContainerCaching aspectOf(Object)\n\n  public static boolean hasAspect(Object)    \norg.aspectj.weaver.AjAttribute$AjSynthetic@18637cc\n:\n                    ALOAD_0     // java.lang.Object arg0\n                    INSTANCEOF \nedu.ucsd.nebulous.ContainerCaching$ajcMightHaveAspect\n                    IFEQ L0\n                    ALOAD_0     // java.lang.Object arg0\n                    CHECKCAST \nedu.ucsd.nebulous.ContainerCaching$ajcMightHaveAspect\n                    INVOKEINTERFACE \nedu.ucsd.nebulous.ContainerCaching$ajcMightHaveAspect.ajc$edu_ucsd_nebulous_Cont\nainerCaching$perObjectGet ()Ledu/ucsd/nebulous/ContainerCaching;\n                    IFNULL L0\n                    ICONST_1\n                    IRETURN\n                L0: ICONST_0\n                    IRETURN\n  end public static boolean hasAspect(Object)\n\n  public static void ajc$perObjectBind(Object)    \norg.aspectj.weaver.AjAttribute$AjSynthetic@b97275\n:\n                    ALOAD_0     // java.lang.Object arg0\n                    INSTANCEOF \nedu.ucsd.nebulous.ContainerCaching$ajcMightHaveAspect\n                    IFEQ L0\n                    ALOAD_0     // java.lang.Object arg0\n                    CHECKCAST \nedu.ucsd.nebulous.ContainerCaching$ajcMightHaveAspect\n                    INVOKEINTERFACE \nedu.ucsd.nebulous.ContainerCaching$ajcMightHaveAspect.ajc$edu_ucsd_nebulous_Cont\nainerCaching$perObjectGet ()Ledu/ucsd/nebulous/ContainerCaching;\n                    IFNONNULL L0\n                    ALOAD_0     // java.lang.Object arg0\n                    CHECKCAST \nedu.ucsd.nebulous.ContainerCaching$ajcMightHaveAspect\n                    NEW edu.ucsd.nebulous.ContainerCaching\n                    DUP\n                    INVOKESPECIAL edu.ucsd.nebulous.ContainerCaching.\u003cinit\u003e ()V\n                    INVOKEINTERFACE \nedu.ucsd.nebulous.ContainerCaching$ajcMightHaveAspect.ajc$edu_ucsd_nebulous_Cont\nainerCaching$perObjectSet (Ledu/ucsd/nebulous/ContainerCaching;)V\n                L0: RETURN\n  end public static void ajc$perObjectBind(Object)\n\n  public edu.ucsd.nebulous.ContainerCaching \najc$edu_ucsd_nebulous_ContainerCaching$perObjectGet():\n                    ALOAD_0\n                    GETFIELD \nedu.ucsd.nebulous.ContainerCaching.ajc$edu_ucsd_nebulous_ContainerCaching$perObj\nectField Ledu/ucsd/nebulous/ContainerCaching;\n                    ARETURN\n  end public edu.ucsd.nebulous.ContainerCaching \najc$edu_ucsd_nebulous_ContainerCaching$perObjectGet()\n\n  public void ajc$edu_ucsd_nebulous_ContainerCaching$perObjectSet\n(edu.ucsd.nebulous.ContainerCaching):\n                    ALOAD_0\n                    ALOAD_1\n                    PUTFIELD \nedu.ucsd.nebulous.ContainerCaching.ajc$edu_ucsd_nebulous_ContainerCaching$perObj\nectField Ledu/ucsd/nebulous/ContainerCaching;\n                    RETURN\n  end public void ajc$edu_ucsd_nebulous_ContainerCaching$perObjectSet\n(edu.ucsd.nebulous.ContainerCaching)\n\n  static void ajc$preClinit():\n                    NEW org.aspectj.runtime.internal.CFlowStack\n                    DUP\n                    INVOKESPECIAL \norg.aspectj.runtime.internal.CFlowStack.\u003cinit\u003e ()V\n                    PUTSTATIC \nedu.ucsd.nebulous.ContainerCaching.ajc$cflowStack$1 \nLorg/aspectj/runtime/internal/CFlowStack;\n                    NEW org.aspectj.runtime.internal.CFlowStack\n                    DUP\n                    INVOKESPECIAL \norg.aspectj.runtime.internal.CFlowStack.\u003cinit\u003e ()V\n                    PUTSTATIC \nedu.ucsd.nebulous.ContainerCaching.ajc$cflowStack$0 \nLorg/aspectj/runtime/internal/CFlowStack;\n                    RETURN\n  end static void ajc$preClinit()\n\n  static void \u003cclinit\u003e():\n                    INVOKESTATIC \nedu.ucsd.nebulous.ContainerCaching.ajc$preClinit ()V\n                    RETURN\n  end static void \u003cclinit\u003e()\nend public class edu.ucsd.nebulous.ContainerCaching\nABORT\nException thrown from AspectJ 1.1.1rc1\n\nThis might be logged as a bug already -- find current bugs at\n  http://bugs.eclipse.org/bugs/buglist.cgi?product\u003dAspectJ\u0026component\u003dCompiler\n\nBugs for exceptions thrown have titles File:line from the top stack, \ne.g., \"SomeFile.java:243\"\n\nIf you don\u0027t find the exception below in a bug, please add a new bug\nat http://bugs.eclipse.org/bugs/enter_bug.cgi?product\u003dAspectJ\nTo make the bug a priority, please include a test program\nthat can reproduce this exception.\nnull\njava.lang.NullPointerException\n\tat org.aspectj.weaver.ResolvedTypeX.matches(ResolvedTypeX.java:245)\n\tat org.aspectj.weaver.ResolvedTypeX.lookupMemberNoSupers\n(ResolvedTypeX.java:914)\n\tat org.aspectj.weaver.Member.walkUp(Member.java:502)\n\tat org.aspectj.weaver.Member.walkUp(Member.java:498)\n\tat org.aspectj.weaver.Member.getDeclaringTypes(Member.java:487)\n\tat org.aspectj.weaver.patterns.SignaturePattern.declaringTypeMatch\n(SignaturePattern.java:143)\n\tat org.aspectj.weaver.patterns.SignaturePattern.matches\n(SignaturePattern.java:124)\n\tat org.aspectj.weaver.patterns.KindedPointcut.match\n(KindedPointcut.java:40)\n\tat org.aspectj.weaver.patterns.AndPointcut.match(AndPointcut.java:42)\n\tat org.aspectj.weaver.patterns.OrPointcut.match(OrPointcut.java:43)\n\tat org.aspectj.weaver.patterns.AndPointcut.match(AndPointcut.java:42)\n\tat org.aspectj.weaver.ShadowMunger.match(ShadowMunger.java:59)\n\tat org.aspectj.weaver.Advice.match(Advice.java:89)\n\tat org.aspectj.weaver.bcel.BcelClassWeaver.match\n(BcelClassWeaver.java:985)\n\tat org.aspectj.weaver.bcel.BcelClassWeaver.match\n(BcelClassWeaver.java:791)\n\tat org.aspectj.weaver.bcel.BcelClassWeaver.weave\n(BcelClassWeaver.java:291)\n\tat org.aspectj.weaver.bcel.BcelClassWeaver.weave\n(BcelClassWeaver.java:77)\n\tat org.aspectj.weaver.bcel.BcelWeaver.weave(BcelWeaver.java:417)\n\tat org.aspectj.weaver.bcel.BcelWeaver.weave(BcelWeaver.java:390)\n\tat org.aspectj.weaver.bcel.BcelWeaver.weave(BcelWeaver.java:316)\n\tat \norg.aspectj.ajdt.internal.core.builder.AjBuildManager.weaveAndGenerateClassFiles\n(AjBuildManager.java:256)\n\tat org.aspectj.ajdt.internal.core.builder.AjBuildManager.doBuild\n(AjBuildManager.java:156)\n\tat org.aspectj.ajdt.internal.core.builder.AjBuildManager.batchBuild\n(AjBuildManager.java:70)\n\tat org.aspectj.ajdt.ajc.AjdtCommand.doCommand(AjdtCommand.java:99)\n\tat org.aspectj.ajdt.ajc.AjdtCommand.runCommand(AjdtCommand.java:53)\n\tat org.aspectj.tools.ajc.Main.run(Main.java:217)\n\tat org.aspectj.tools.ajc.Main.runMain(Main.java:155)\n\tat org.aspectj.tools.ajc.Main.main(Main.java:72)\n\n\n1 fail|abort\nSignal 127\nmake: *** [neb] Error 255\n\n*************************\nThe source for my project is available upon request. However, I cannot post it \nto any site or repository, it can only be emailed (or I could provide a private \ndownload link off of my web-site).\n*************************\n\nFrom: Jim Hugunin\nSubject: Re: [aspectj-dev] java.lang.VerifyError                               \n                                                                               \nPlease file this as a bug report.  That will make life easier for the          \ndevelopers.  It\u0027s always best to include a self-contained example, but         \nif that\u0027s not possible, it\u0027s still good to get this into the bug               \ndatabase for tracking purposes.                                                \n                                                                               \nBTW - This bug appears to be a bad interaction between perthis/target          \naspects, intertype declarations and method signature matching in pcds --       \na classic kind of large system interaction issue.                              \n                                                                               \n-Jim",
    "This is fixed in the tree and will be fixed in the upcoming 1.1.1 release.  The\nfollowing short-test case (in bugs/InterPerCall.java) reproduces the bug:\n\n----------------------------\npublic class InterPerCall {\n    public static void main(String[] args) {\n        new D().m();\n    }\n}\n\nclass C {\n}\n\nclass D extends C {\n    public void m() { }\n}\n\naspect A perthis(p1()) {\n    pointcut p1(): execution(void D.m());\n    pointcut p2(): execution(void C.m());\n    \n    before(): p2() {\n        System.out.println(\"hello\");\n    }\n}\n--------------------------------------------\n\nThe regression was caused by a fix to the method lookup rules for inter-type\ndeclarations when matching call joinpoint signatures that interacted badly with\nthe implementation of perthis aspects."
  ],
  "commentCreationDates": [
    "2003-09-06T00:42:55+02:00",
    "2003-09-08T17:32:10+02:00"
  ],
  "traces": [
    {
      "exceptionType": "java.lang.NullPointerException",
      "elements": [
        {
          "method": "org.aspectj.weaver.ResolvedTypeX.matches",
          "source": "ResolvedTypeX.java:245"
        },
        {
          "method": "org.aspectj.weaver.ResolvedTypeX.lookupMemberNoSupers",
          "source": "ResolvedTypeX.java:914"
        },
        {
          "method": "org.aspectj.weaver.Member.walkUp",
          "source": "Member.java:502"
        },
        {
          "method": "org.aspectj.weaver.Member.walkUp",
          "source": "Member.java:498"
        },
        {
          "method": "org.aspectj.weaver.Member.getDeclaringTypes",
          "source": "Member.java:487"
        },
        {
          "method": "org.aspectj.weaver.patterns.SignaturePattern.declaringTypeMatch",
          "source": "SignaturePattern.java:143"
        },
        {
          "method": "org.aspectj.weaver.patterns.SignaturePattern.matches",
          "source": "SignaturePattern.java:124"
        },
        {
          "method": "org.aspectj.weaver.patterns.KindedPointcut.match",
          "source": "KindedPointcut.java:40"
        },
        {
          "method": "org.aspectj.weaver.patterns.AndPointcut.match",
          "source": "AndPointcut.java:42"
        },
        {
          "method": "org.aspectj.weaver.patterns.OrPointcut.match",
          "source": "OrPointcut.java:43"
        },
        {
          "method": "org.aspectj.weaver.patterns.AndPointcut.match",
          "source": "AndPointcut.java:42"
        },
        {
          "method": "org.aspectj.weaver.ShadowMunger.match",
          "source": "ShadowMunger.java:59"
        },
        {
          "method": "org.aspectj.weaver.Advice.match",
          "source": "Advice.java:89"
        },
        {
          "method": "org.aspectj.weaver.bcel.BcelClassWeaver.match",
          "source": "BcelClassWeaver.java:985"
        },
        {
          "method": "org.aspectj.weaver.bcel.BcelClassWeaver.match",
          "source": "BcelClassWeaver.java:791"
        },
        {
          "method": "org.aspectj.weaver.bcel.BcelClassWeaver.weave",
          "source": "BcelClassWeaver.java:291"
        },
        {
          "method": "org.aspectj.weaver.bcel.BcelClassWeaver.weave",
          "source": "BcelClassWeaver.java:77"
        },
        {
          "method": "org.aspectj.weaver.bcel.BcelWeaver.weave",
          "source": "BcelWeaver.java:417"
        },
        {
          "method": "org.aspectj.weaver.bcel.BcelWeaver.weave",
          "source": "BcelWeaver.java:390"
        },
        {
          "method": "org.aspectj.weaver.bcel.BcelWeaver.weave",
          "source": "BcelWeaver.java:316"
        },
        {
          "method": "org.aspectj.ajdt.internal.core.builder.AjBuildManager.weaveAndGenerateClassFiles",
          "source": "AjBuildManager.java:256"
        },
        {
          "method": "org.aspectj.ajdt.internal.core.builder.AjBuildManager.doBuild",
          "source": "AjBuildManager.java:156"
        },
        {
          "method": "org.aspectj.ajdt.internal.core.builder.AjBuildManager.batchBuild",
          "source": "AjBuildManager.java:70"
        },
        {
          "method": "org.aspectj.ajdt.ajc.AjdtCommand.doCommand",
          "source": "AjdtCommand.java:99"
        },
        {
          "method": "org.aspectj.ajdt.ajc.AjdtCommand.runCommand",
          "source": "AjdtCommand.java:53"
        },
        {
          "method": "org.aspectj.tools.ajc.Main.run",
          "source": "Main.java:217"
        },
        {
          "method": "org.aspectj.tools.ajc.Main.runMain",
          "source": "Main.java:155"
        },
        {
          "method": "org.aspectj.tools.ajc.Main.main",
          "source": "Main.java:72"
        }
      ],
      "number": 0,
      "commentIndex": 0,
      "bugId": "42652",
      "date": "2003-09-06T00:42:55+02:00",
      "product": "AspectJ",
      "component": "Compiler",
      "severity": "critical"
    }
  ],
  "groupId": "42652",
  "bugId": "42652",
  "date": "2003-09-06T00:42:55+02:00",
  "product": "AspectJ",
  "component": "Compiler",
  "severity": "critical"
}