{
  "comments": [
    "I had a workbench open, with the following perspectives open in the following order:\n\tteam, java, java type hierarchy, debug\n\nI closed and reopened the workbench in the \"java\" perspective\n\nIn the perspective bar on the left hand side of the screen, I right-clicked on the type\nhierarchy perspective, and selected \"Close\".  Note that I had not yet used that \nperspective in the current invocation of the workbench.\n\nImmediately after clicking close, I clicked in the content outline in my current\nperspective.  The UI froze completely for about 30 seconds.  Using TaskManager\nI saw that CPU usage was very low during that time (maybe 1%).  The UI didn\u0027t even\nrepaint during this time.\n\nAfter awhile, the UI came back with a generic \"internal error\" dialog.  The log file contained\nthe following stack trace:\n\norg.eclipse.jface.util.Assert$AssertionFailedException: null argument;\n\tat org.eclipse.jface.util.Assert.isNotNull(Assert.java:133)\n\tat org.eclipse.jface.util.Assert.isNotNull(Assert.java(Compiled Code))\n\tat org.eclipse.jface.util.ListenerList.remove(ListenerList.java:131)\n\tat org.eclipse.jdt.internal.ui.viewsupport.ProblemMarkerManager.removeListener(ProblemMarkerManager.java:184)\n\tat org.eclipse.jdt.internal.ui.typehierarchy.TypeHierarchyViewPart.dispose(TypeHierarchyViewPart.java:366)\n\tat org.eclipse.ui.internal.WorkbenchPage.dispose(WorkbenchPage.java:500)\n\tat org.eclipse.ui.internal.WorkbenchWindow.closePage(WorkbenchWindow.java:353)\n\tat org.eclipse.ui.internal.WorkbenchWindow$6.widgetSelected(WorkbenchWindow.java:917)\n\tat org.eclipse.swt.widgets.TypedListener.handleEvent(TypedListener.java:85)\n\tat org.eclipse.swt.widgets.EventTable.sendEvent(EventTable.java(Compiled Code))\n\tat org.eclipse.swt.widgets.Widget.notifyListeners(Widget.java:646)\n\tat org.eclipse.swt.widgets.Display.runDeferredEvents(Display.java(Compiled Code))\n\tat org.eclipse.swt.widgets.Display.readAndDispatch(Display.java:1160)\n\tat org.eclipse.ui.internal.Workbench.runEventLoop(Workbench.java:675)\n\tat org.eclipse.ui.internal.Workbench.run(Workbench.java:658)\n\tat org.eclipse.core.internal.boot.InternalBootLoader.run(InternalBootLoader.java:820)\n\tat org.eclipse.core.boot.BootLoader.run(BootLoader.java:285)\n\tat java.lang.reflect.Method.invoke(Native Method)\n\tat org.eclipse.core.launcher.Main.basicRun(Main.java:151)\n\tat org.eclipse.core.launcher.Main.run(Main.java:502)\n\tat org.eclipse.core.launcher.Main.main(Main.java:362)\n\nNOTES:\n\nJohnA (9/27/2001 3:09:31 PM)\n\tI have not yet reproduced this, but I will record more details if they become available...\n\nJohnA (9/27/2001 4:01:42 PM)\n\tI can consistently reproduce the internal error, but the freeze is intermittent.\n\tIt\u0027s important that the type hierarchy perspective has never been opened during that \n\tinvocation of the workbench.\n\nEG (10/1/2001 12:00:10 AM)\n\tGiven the current workbench APIs the code cannot assume that createPartControl\n\tis called before dispose. When a part never becomes visible then createPartControl\n\tisn\u0027t called. Therefore the code in dispose cannot assume that variables like the\n\tviewer field are set when calling dispose.\n\tWe have to review all our ViewParts: TypeHierarchy, PackagesView, SearchResults, Outliner.\n\nEG (10/1/2001 12:03:16 AM)\n\tMA pls check type hierarchy and then forward the PR to the owners of the other parts.\n\nMA (01.10.2001 11:30:29)\n\tfor TypeHierarchy, fixed in 202\n\nDM (10/1/01 4:07:32 PM)\n\tFixed for Search view \u003e 0.202a",
    "Checked remaining parts."
  ],
  "commentCreationDates": [
    "2001-10-11T05:08:49+02:00",
    "2002-02-06T09:26:02+01:00"
  ],
  "traces": [
    {
      "exceptionType": "org.eclipse.jface.util.Assert$AssertionFailedException",
      "message": "null argument;",
      "elements": [
        {
          "method": "org.eclipse.jface.util.Assert.isNotNull",
          "source": "Assert.java:133"
        },
        {
          "method": "org.eclipse.jface.util.Assert.isNotNull",
          "source": "Assert.java(Compiled Code)"
        },
        {
          "method": "org.eclipse.jface.util.ListenerList.remove",
          "source": "ListenerList.java:131"
        },
        {
          "method": "org.eclipse.jdt.internal.ui.viewsupport.ProblemMarkerManager.removeListener",
          "source": "ProblemMarkerManager.java:184"
        },
        {
          "method": "org.eclipse.jdt.internal.ui.typehierarchy.TypeHierarchyViewPart.dispose",
          "source": "TypeHierarchyViewPart.java:366"
        },
        {
          "method": "org.eclipse.ui.internal.WorkbenchPage.dispose",
          "source": "WorkbenchPage.java:500"
        },
        {
          "method": "org.eclipse.ui.internal.WorkbenchWindow.closePage",
          "source": "WorkbenchWindow.java:353"
        },
        {
          "method": "org.eclipse.ui.internal.WorkbenchWindow$6.widgetSelected",
          "source": "WorkbenchWindow.java:917"
        },
        {
          "method": "org.eclipse.swt.widgets.TypedListener.handleEvent",
          "source": "TypedListener.java:85"
        },
        {
          "method": "org.eclipse.swt.widgets.EventTable.sendEvent",
          "source": "EventTable.java(Compiled Code)"
        },
        {
          "method": "org.eclipse.swt.widgets.Widget.notifyListeners",
          "source": "Widget.java:646"
        },
        {
          "method": "org.eclipse.swt.widgets.Display.runDeferredEvents",
          "source": "Display.java(Compiled Code)"
        },
        {
          "method": "org.eclipse.swt.widgets.Display.readAndDispatch",
          "source": "Display.java:1160"
        },
        {
          "method": "org.eclipse.ui.internal.Workbench.runEventLoop",
          "source": "Workbench.java:675"
        },
        {
          "method": "org.eclipse.ui.internal.Workbench.run",
          "source": "Workbench.java:658"
        },
        {
          "method": "org.eclipse.core.internal.boot.InternalBootLoader.run",
          "source": "InternalBootLoader.java:820"
        },
        {
          "method": "org.eclipse.core.boot.BootLoader.run",
          "source": "BootLoader.java:285"
        },
        {
          "method": "java.lang.reflect.Method.invoke",
          "source": "Native Method"
        },
        {
          "method": "org.eclipse.core.launcher.Main.basicRun",
          "source": "Main.java:151"
        },
        {
          "method": "org.eclipse.core.launcher.Main.run",
          "source": "Main.java:502"
        },
        {
          "method": "org.eclipse.core.launcher.Main.main",
          "source": "Main.java:362"
        }
      ],
      "number": 0,
      "commentIndex": 0,
      "bugId": "4265",
      "date": "2001-10-11T05:08:49+02:00",
      "product": "JDT",
      "component": "UI",
      "severity": "normal"
    }
  ],
  "groupId": "4265",
  "bugId": "4265",
  "date": "2001-10-11T05:08:49+02:00",
  "product": "JDT",
  "component": "UI",
  "severity": "normal"
}