{
  "comments": [
    "While using IBM\u0027s WSADv511 in RedHat8.0 GTK we had a NPE error. We reported\nto IBM developemt. They came back and said that it as a Bugzilla defect. Please\nfind the our comments as follows. Please let us know if you need more \ninformation.\n\u003d\u003d\u003d\u003d\u003d\u003d\u003d\u003d\u003d\u003d\u003d\u003d\u003d\u003d\nIn 924_1915 Linux AD build, Running in RedHat8.0 GTK:\nAfter importing an EAR file V5SurveyEAR.ear  (which works fine in AD v51  \u0026 \nalso in ADv511), While\nchanging the Server Target options we see NPE errors in the command prompt \nwindow.\nPlease let us know if you need this EAR file. We can mail it to you. You could \ncreate it instantly.\n\nSteps to Recreate the Error:\nBefore importing the Appln,  Make sure that the J2EE 1.3 is selected \u0026 Server \ntargeting is Enabled under J2EE preferences.  \nWhile importing the Appln: Choose \"\u003cnone\u003e No Target Server\" as the server. \nRight click the EAR module and Select the \"Target Server\" option. Then Modify \nthe server target as \"Exp5.1\".  As soon as we do \nthat, we see lots of error throw in the task view. This is understandable since \nExpress cannot handle EJBs.\nThen, Right click the EJB module and Select the \"Target Server\" option. Then \nModify the server target as \"WAS5.1\".  \n \nAt this time, we also noticed a NPE thrown in the command prompt window.\n\u003d\u003d\u003d\u003d\u003d\u003d\u003d\u003d\u003d\u003d\u003d\u003d\u003d\u003d\u003d\u003d\u003d\u003d\u003d\u003d\njava.lang.NullPointerException\n        at java.lang.Throwable.\u003cinit\u003e(Throwable.java)\n        at java.lang.Throwable.\u003cinit\u003e(Throwable.java)\n        at java.lang.NullPointerException.\u003cinit\u003e(NullPointerException.java:63)\n        at org.eclipse.jdt.internal.core.index.impl.Util.quickSort(Util.java)\n        at org.eclipse.jdt.internal.core.index.impl.Util.sort(Util.java:292)\n        at org.eclipse.jdt.internal.core.index.impl.InMemoryIndex.getSortedWordE\nntries(InMemoryIndex.java:134)\n        at org.eclipse.jdt.internal.core.index.impl.SimpleIndexInput.open(Simple\nIndexInput.java:118)\n        at org.eclipse.jdt.internal.core.index.impl.MergeFactory.merge(MergeFact\nory.java:78)\n        at org.eclipse.jdt.internal.core.index.impl.Index.merge(Index.java:243)\n        at org.eclipse.jdt.internal.core.index.impl.Index.save(Index.java:348)\n        at org.eclipse.jdt.internal.core.search.indexing.IndexManager.saveIndex(\nIndexManager.java:453)\n        at org.eclipse.jdt.internal.core.search.indexing.AddJarFileToIndex.execu\nte(AddJarFileToIndex.java)\n        at org.eclipse.jdt.internal.core.search.processing.JobManager.run(JobMan\nager.java:360)\n        at java.lang.Thread.run(Thread.java:802)\n\n    \u003cNote by suresht (Thyagarajan, Sureshbabu), 2003/09/25 17:44:52, seq: 2 \nrel: 0  action: assign\u003e\nAssigning as per my ST chat with Vijay. Please\nassign to the right team. Thx for yr help Vijay.\nOld Owner: couch\nNew Owner: danberg\n\nOld Component: wsa.etools.rsc.subuilder\nNew Component: wsa.ejb.projectsupport\n\n\n\n    \u003cNote by danberg (Berg, Daniel), 2003/09/25 19:32:13, seq: 3 rel: 0  \naction: assign\u003e\nThis is a JDT problem and not a problem\nwith a WSAD component.  A Bugzilla defect\nshould be opened.\nOld Component: wsa.ejb.projectsupport\nNew Component: wsa.prereq.workbench",
    "\n\n*** This bug has been marked as a duplicate of 40950 ***"
  ],
  "commentCreationDates": [
    "2003-10-21T18:10:53+02:00",
    "2003-10-21T20:13:06+02:00"
  ],
  "traces": [
    {
      "exceptionType": "java.lang.NullPointerException",
      "elements": [
        {
          "method": "java.lang.Throwable.\u003cinit\u003e",
          "source": "Throwable.java"
        },
        {
          "method": "java.lang.Throwable.\u003cinit\u003e",
          "source": "Throwable.java"
        },
        {
          "method": "java.lang.NullPointerException.\u003cinit\u003e",
          "source": "NullPointerException.java:63"
        },
        {
          "method": "org.eclipse.jdt.internal.core.index.impl.Util.quickSort",
          "source": "Util.java"
        },
        {
          "method": "org.eclipse.jdt.internal.core.index.impl.Util.sort",
          "source": "Util.java:292"
        },
        {
          "method": "org.eclipse.jdt.internal.core.index.impl.InMemoryIndex.getSortedWordEntries",
          "source": "InMemoryIndex.java:134"
        },
        {
          "method": "org.eclipse.jdt.internal.core.index.impl.SimpleIndexInput.open",
          "source": "Simple IndexInput.java:118"
        },
        {
          "method": "org.eclipse.jdt.internal.core.index.impl.MergeFactory.merge",
          "source": "MergeFact ory.java:78"
        },
        {
          "method": "org.eclipse.jdt.internal.core.index.impl.Index.merge",
          "source": "Index.java:243"
        },
        {
          "method": "org.eclipse.jdt.internal.core.index.impl.Index.save",
          "source": "Index.java:348"
        },
        {
          "method": "org.eclipse.jdt.internal.core.search.indexing.IndexManager.saveIndex",
          "source": " IndexManager.java:453"
        },
        {
          "method": "org.eclipse.jdt.internal.core.search.indexing.AddJarFileToIndex.execute",
          "source": "AddJarFileToIndex.java"
        },
        {
          "method": "org.eclipse.jdt.internal.core.search.processing.JobManager.run",
          "source": "JobMan ager.java:360"
        },
        {
          "method": "java.lang.Thread.run",
          "source": "Thread.java:802"
        }
      ],
      "number": 0,
      "commentIndex": 0,
      "bugId": "45290",
      "duplicateId": "40950",
      "date": "2003-10-21T18:10:53+02:00",
      "product": "JDT",
      "component": "Core",
      "severity": "normal"
    }
  ],
  "groupId": "40950",
  "bugId": "45290",
  "duplicateId": "40950",
  "date": "2003-10-21T18:10:53+02:00",
  "product": "JDT",
  "component": "Core",
  "severity": "normal"
}