{
  "comments": [
    "Using Equinox on top of I20031021 (after using it on top of I20031015), I get:\nUsing the installation directory.\nStartup: using configuration file:D:/eclipse1021/eclipse/.config/platform.cfg\nBoot URL:\n    file:D:/eclipse1021/eclipse/plugins/org.eclipse.core.boot_3.0.0/boot.jar\nStartup: splash path \u003d\nD:\\eclipse1021\\eclipse\\plugins\\org.eclipse.core.boot_3.0.0\\splash.bmp\nStartup: using configuration file:D:\\eclipse1021\\eclipse\\.config\\platform.cfg\nBoot URL:\n   \nfile:D:/eclipse1021/eclipse/plugins/org.eclipse.osgi.framework.core_3.0.0/core.jar\n   \nfile:D:/eclipse1021/eclipse/plugins/org.eclipse.osgi.framework.console_3.0.0/console.jar\n   \nfile:D:/eclipse1021/eclipse/plugins/org.eclipse.osgi.framework.defaultadaptor_3.0.0/adaptor.jar\n   \nfile:D:/eclipse1021/eclipse/plugins/org.eclipse.core.runtime.adaptor_3.0.0/adaptor.jar\n\nEclipse OSGi Framework 3.6.0\n\nOSGi Service Platform Release 3\n\nCopyright (c) 2003 IBM Corporation and others.\nAll rights reserved. This program and the accompanying materials\nare made available under the terms of the Common Public License v1.0\nwhich accompanies this distribution, and is available at\nhttp://www.eclipse.org/legal/cpl-v10.html\nContributors:\n     IBM Corporation - initial API and implementation\nIgnoring org.eclipse.core.runtime.osgi_3.0.0\norg.osgi.framework.BundleException: A bundle with the unique ID and version is\nalready installed: org.eclipse.core.runtime.osgi 3.0.0\n        at\norg.eclipse.osgi.framework.internal.core.Framework.installWorkerPrivileged(Framework.java:976)\n        at\norg.eclipse.osgi.framework.internal.core.Framework$1.run(Framework.java:842)\n        at java.security.AccessController.doPrivileged(Native Method)\n        at\norg.eclipse.osgi.framework.internal.core.Framework.installWorker(Framework.java:933)\n        at\norg.eclipse.osgi.framework.internal.core.Framework.installBundle(Framework.java:835)\n        at\norg.eclipse.osgi.framework.internal.core.BundleContext.installBundle(BundleContext.java:254)\n        at\norg.eclipse.core.runtime.adaptor.EclipseStarter.loadBundles(EclipseStarter.java:153)\n        at\norg.eclipse.core.runtime.adaptor.EclipseStarter.run(EclipseStarter.java:71)\n        at sun.reflect.NativeMethodAccessorImpl.invoke0(Native Method)\n        at\nsun.reflect.NativeMethodAccessorImpl.invoke(NativeMethodAccessorImpl.java:39)\n        at\nsun.reflect.DelegatingMethodAccessorImpl.invoke(DelegatingMethodAccessorImpl.java:25)\n        at java.lang.reflect.Method.invoke(Method.java:324)\n        at\norg.eclipse.core.internal.boot.OSGiBootLoader.basicRun(OSGiBootLoader.java:250)\n        at\norg.eclipse.core.internal.boot.OSGiBootLoader.run(OSGiBootLoader.java:765)\n        at\norg.eclipse.core.internal.boot.OSGiBootLoader.run(OSGiBootLoader.java:752)\n        at sun.reflect.NativeMethodAccessorImpl.invoke0(Native Method)\n        at\nsun.reflect.NativeMethodAccessorImpl.invoke(NativeMethodAccessorImpl.java:39)\n        at\nsun.reflect.DelegatingMethodAccessorImpl.invoke(DelegatingMethodAccessorImpl.java:25)\n        at java.lang.reflect.Method.invoke(Method.java:324)\n        at org.eclipse.core.launcher.Main.basicRun(Main.java:299)\n        at org.eclipse.core.launcher.Main.run(Main.java:765)\n        at org.eclipse.core.launcher.Main.main(Main.java:599)\nIgnoring org.eclipse.update.configurator_3.0.0\norg.osgi.framework.BundleException: A bundle with the unique ID and version is\nalready installed: org.eclipse.update.configurator 3.0.0\n        at\norg.eclipse.osgi.framework.internal.core.Framework.installWorkerPrivileged(Framework.java:976)\n        at\norg.eclipse.osgi.framework.internal.core.Framework$1.run(Framework.java:842)\n        at java.security.AccessController.doPrivileged(Native Method)\n        at\norg.eclipse.osgi.framework.internal.core.Framework.installWorker(Framework.java:933)\n        at\norg.eclipse.osgi.framework.internal.core.Framework.installBundle(Framework.java:835)\n        at\norg.eclipse.osgi.framework.internal.core.BundleContext.installBundle(BundleContext.java:254)\n        at\norg.eclipse.core.runtime.adaptor.EclipseStarter.loadBundles(EclipseStarter.java:153)\n        at\norg.eclipse.core.runtime.adaptor.EclipseStarter.run(EclipseStarter.java:71)\n        at sun.reflect.NativeMethodAccessorImpl.invoke0(Native Method)\n        at\nsun.reflect.NativeMethodAccessorImpl.invoke(NativeMethodAccessorImpl.java:39)\n        at\nsun.reflect.DelegatingMethodAccessorImpl.invoke(DelegatingMethodAccessorImpl.java:25)\n        at java.lang.reflect.Method.invoke(Method.java:324)\n        at\norg.eclipse.core.internal.boot.OSGiBootLoader.basicRun(OSGiBootLoader.java:250)\n        at\norg.eclipse.core.internal.boot.OSGiBootLoader.run(OSGiBootLoader.java:765)\n        at\norg.eclipse.core.internal.boot.OSGiBootLoader.run(OSGiBootLoader.java:752)\n        at sun.reflect.NativeMethodAccessorImpl.invoke0(Native Method)\n        at\nsun.reflect.NativeMethodAccessorImpl.invoke(NativeMethodAccessorImpl.java:39)\n        at\nsun.reflect.DelegatingMethodAccessorImpl.invoke(DelegatingMethodAccessorImpl.java:25)\n        at java.lang.reflect.Method.invoke(Method.java:324)\n        at org.eclipse.core.launcher.Main.basicRun(Main.java:299)\n        at org.eclipse.core.launcher.Main.run(Main.java:765)\n        at org.eclipse.core.launcher.Main.main(Main.java:599)\nIgnoring org.eclipse.core.applicationrunner_1.0.0\norg.osgi.framework.BundleException: A bundle with the unique ID and version is\nalready installed: org.eclipse.core.applicationrunner 3.0.0\n        at\norg.eclipse.osgi.framework.internal.core.Framework.installWorkerPrivileged(Framework.java:976)\n        at\norg.eclipse.osgi.framework.internal.core.Framework$1.run(Framework.java:842)\n        at java.security.AccessController.doPrivileged(Native Method)\n        at\norg.eclipse.osgi.framework.internal.core.Framework.installWorker(Framework.java:933)\n        at\norg.eclipse.osgi.framework.internal.core.Framework.installBundle(Framework.java:835)\n        at\norg.eclipse.osgi.framework.internal.core.BundleContext.installBundle(BundleContext.java:254)\n        at\norg.eclipse.core.runtime.adaptor.EclipseStarter.loadBundles(EclipseStarter.java:153)\n        at\norg.eclipse.core.runtime.adaptor.EclipseStarter.run(EclipseStarter.java:71)\n        at sun.reflect.NativeMethodAccessorImpl.invoke0(Native Method)\n        at\nsun.reflect.NativeMethodAccessorImpl.invoke(NativeMethodAccessorImpl.java:39)\n        at\nsun.reflect.DelegatingMethodAccessorImpl.invoke(DelegatingMethodAccessorImpl.java:25)\n        at java.lang.reflect.Method.invoke(Method.java:324)\n        at\norg.eclipse.core.internal.boot.OSGiBootLoader.basicRun(OSGiBootLoader.java:250)\n        at\norg.eclipse.core.internal.boot.OSGiBootLoader.run(OSGiBootLoader.java:765)\n        at\norg.eclipse.core.internal.boot.OSGiBootLoader.run(OSGiBootLoader.java:752)\n        at sun.reflect.NativeMethodAccessorImpl.invoke0(Native Method)\n        at\nsun.reflect.NativeMethodAccessorImpl.invoke(NativeMethodAccessorImpl.java:39)\n        at\nsun.reflect.DelegatingMethodAccessorImpl.invoke(DelegatingMethodAccessorImpl.java:25)\n        at java.lang.reflect.Method.invoke(Method.java:324)\n        at org.eclipse.core.launcher.Main.basicRun(Main.java:299)\n        at org.eclipse.core.launcher.Main.run(Main.java:765)\n        at org.eclipse.core.launcher.Main.main(Main.java:599)\nIgnoring bundle at:\nreference:file:D:/eclipse1021/eclipse/plugins/org.apache.xerces_4.0.13\nA bundle with the unique ID and version is already installed: org.apache.xerces\n4.0.13\nIgnoring bundle at:\nreference:file:D:/eclipse1021/eclipse/plugins/org.eclipse.core.boot_3.0.0\nManifest not found:\nreference:file:D:/eclipse1021/eclipse/plugins/org.eclipse.core.boot_3.0.0\nIgnoring bundle at:\nreference:file:D:/eclipse1021/eclipse/plugins/org.eclipse.core.runtime.compatibility_3.0.0\nA bundle with the unique ID and version is already installed:\norg.eclipse.core.runtime.compatibility 3.0.0\nIgnoring bundle at:\nreference:file:D:/eclipse1021/eclipse/plugins/org.eclipse.core.runtime.osgi_3.0.0\nA bundle with the unique ID and version is already installed:\norg.eclipse.core.runtime.osgi 3.0.0\nIgnoring bundle at:\nreference:file:D:/eclipse1021/eclipse/plugins/org.eclipse.help.url_1.0.0\nA bundle with the unique ID and version is already installed:\norg.eclipse.help.url 1.0.0\nIgnoring bundle at:\nreference:file:D:/eclipse1021/eclipse/plugins/org.eclipse.osgi.framework.console_3.0.0\nManifest not found:\nreference:file:D:/eclipse1021/eclipse/plugins/org.eclipse.osgi.framework.console_3.0.0\nIgnoring bundle at:\nreference:file:D:/eclipse1021/eclipse/plugins/org.eclipse.osgi.framework.core_3.0.0\nManifest not found:\nreference:file:D:/eclipse1021/eclipse/plugins/org.eclipse.osgi.framework.core_3.0.0\nIgnoring bundle at:\nreference:file:D:/eclipse1021/eclipse/plugins/org.eclipse.osgi.framework.defaultadaptor_3.0.0\nManifest not found:\nreference:file:D:/eclipse1021/eclipse/plugins/org.eclipse.osgi.framework.defaultadaptor_3.0.0\nIgnoring bundle at:\nreference:file:D:/eclipse1021/eclipse/plugins/org.eclipse.osgi_1.0.0\nManifest not found:\nreference:file:D:/eclipse1021/eclipse/plugins/org.eclipse.osgi_1.0.0\nIgnoring bundle at:\nreference:file:D:/eclipse1021/eclipse/plugins/org.eclipse.swt.win32_3.0.0\nA bundle with the unique ID and version is already installed:\norg.eclipse.swt.win32 3.0.0\nIgnoring bundle at:\nreference:file:D:/eclipse1021/eclipse/plugins/org.eclipse.swt_3.0.0\nA bundle with the unique ID and version is already installed: org.eclipse.swt 3.0.0\nIgnoring bundle at:\nreference:file:D:/eclipse1021/eclipse/plugins/org.eclipse.update.configurator_3.0.0\nA bundle with the unique ID and version is already installed:\norg.eclipse.update.configurator 3.0.0",
    "This should no longer as we moved the framework state in the config area.\nClosing for now."
  ],
  "commentCreationDates": [
    "2003-10-22T15:21:14+02:00",
    "2003-10-24T22:35:27+02:00"
  ],
  "traces": [
    {
      "exceptionType": "org.osgi.framework.BundleException",
      "message": "A bundle with the unique ID and version is already installed: org.eclipse.core.runtime.osgi 3.0.0",
      "elements": [
        {
          "method": "org.eclipse.osgi.framework.internal.core.Framework.installWorkerPrivileged",
          "source": "Framework.java:976"
        },
        {
          "method": "org.eclipse.osgi.framework.internal.core.Framework$1.run",
          "source": "Framework.java:842"
        },
        {
          "method": "java.security.AccessController.doPrivileged",
          "source": "Native Method"
        },
        {
          "method": "org.eclipse.osgi.framework.internal.core.Framework.installWorker",
          "source": "Framework.java:933"
        },
        {
          "method": "org.eclipse.osgi.framework.internal.core.Framework.installBundle",
          "source": "Framework.java:835"
        },
        {
          "method": "org.eclipse.osgi.framework.internal.core.BundleContext.installBundle",
          "source": "BundleContext.java:254"
        },
        {
          "method": "org.eclipse.core.runtime.adaptor.EclipseStarter.loadBundles",
          "source": "EclipseStarter.java:153"
        },
        {
          "method": "org.eclipse.core.runtime.adaptor.EclipseStarter.run",
          "source": "EclipseStarter.java:71"
        },
        {
          "method": "sun.reflect.NativeMethodAccessorImpl.invoke0",
          "source": "Native Method"
        },
        {
          "method": "sun.reflect.NativeMethodAccessorImpl.invoke",
          "source": "NativeMethodAccessorImpl.java:39"
        },
        {
          "method": "sun.reflect.DelegatingMethodAccessorImpl.invoke",
          "source": "DelegatingMethodAccessorImpl.java:25"
        },
        {
          "method": "java.lang.reflect.Method.invoke",
          "source": "Method.java:324"
        },
        {
          "method": "org.eclipse.core.internal.boot.OSGiBootLoader.basicRun",
          "source": "OSGiBootLoader.java:250"
        },
        {
          "method": "org.eclipse.core.internal.boot.OSGiBootLoader.run",
          "source": "OSGiBootLoader.java:765"
        },
        {
          "method": "org.eclipse.core.internal.boot.OSGiBootLoader.run",
          "source": "OSGiBootLoader.java:752"
        },
        {
          "method": "sun.reflect.NativeMethodAccessorImpl.invoke0",
          "source": "Native Method"
        },
        {
          "method": "sun.reflect.NativeMethodAccessorImpl.invoke",
          "source": "NativeMethodAccessorImpl.java:39"
        },
        {
          "method": "sun.reflect.DelegatingMethodAccessorImpl.invoke",
          "source": "DelegatingMethodAccessorImpl.java:25"
        },
        {
          "method": "java.lang.reflect.Method.invoke",
          "source": "Method.java:324"
        },
        {
          "method": "org.eclipse.core.launcher.Main.basicRun",
          "source": "Main.java:299"
        },
        {
          "method": "org.eclipse.core.launcher.Main.run",
          "source": "Main.java:765"
        },
        {
          "method": "org.eclipse.core.launcher.Main.main",
          "source": "Main.java:599"
        }
      ],
      "number": 0,
      "commentIndex": 0,
      "bugId": "45366",
      "date": "2003-10-22T15:21:14+02:00",
      "product": "Equinox",
      "component": "Incubator",
      "severity": "normal"
    },
    {
      "exceptionType": "org.osgi.framework.BundleException",
      "message": "A bundle with the unique ID and version is already installed: org.eclipse.update.configurator 3.0.0",
      "elements": [
        {
          "method": "org.eclipse.osgi.framework.internal.core.Framework.installWorkerPrivileged",
          "source": "Framework.java:976"
        },
        {
          "method": "org.eclipse.osgi.framework.internal.core.Framework$1.run",
          "source": "Framework.java:842"
        },
        {
          "method": "java.security.AccessController.doPrivileged",
          "source": "Native Method"
        },
        {
          "method": "org.eclipse.osgi.framework.internal.core.Framework.installWorker",
          "source": "Framework.java:933"
        },
        {
          "method": "org.eclipse.osgi.framework.internal.core.Framework.installBundle",
          "source": "Framework.java:835"
        },
        {
          "method": "org.eclipse.osgi.framework.internal.core.BundleContext.installBundle",
          "source": "BundleContext.java:254"
        },
        {
          "method": "org.eclipse.core.runtime.adaptor.EclipseStarter.loadBundles",
          "source": "EclipseStarter.java:153"
        },
        {
          "method": "org.eclipse.core.runtime.adaptor.EclipseStarter.run",
          "source": "EclipseStarter.java:71"
        },
        {
          "method": "sun.reflect.NativeMethodAccessorImpl.invoke0",
          "source": "Native Method"
        },
        {
          "method": "sun.reflect.NativeMethodAccessorImpl.invoke",
          "source": "NativeMethodAccessorImpl.java:39"
        },
        {
          "method": "sun.reflect.DelegatingMethodAccessorImpl.invoke",
          "source": "DelegatingMethodAccessorImpl.java:25"
        },
        {
          "method": "java.lang.reflect.Method.invoke",
          "source": "Method.java:324"
        },
        {
          "method": "org.eclipse.core.internal.boot.OSGiBootLoader.basicRun",
          "source": "OSGiBootLoader.java:250"
        },
        {
          "method": "org.eclipse.core.internal.boot.OSGiBootLoader.run",
          "source": "OSGiBootLoader.java:765"
        },
        {
          "method": "org.eclipse.core.internal.boot.OSGiBootLoader.run",
          "source": "OSGiBootLoader.java:752"
        },
        {
          "method": "sun.reflect.NativeMethodAccessorImpl.invoke0",
          "source": "Native Method"
        },
        {
          "method": "sun.reflect.NativeMethodAccessorImpl.invoke",
          "source": "NativeMethodAccessorImpl.java:39"
        },
        {
          "method": "sun.reflect.DelegatingMethodAccessorImpl.invoke",
          "source": "DelegatingMethodAccessorImpl.java:25"
        },
        {
          "method": "java.lang.reflect.Method.invoke",
          "source": "Method.java:324"
        },
        {
          "method": "org.eclipse.core.launcher.Main.basicRun",
          "source": "Main.java:299"
        },
        {
          "method": "org.eclipse.core.launcher.Main.run",
          "source": "Main.java:765"
        },
        {
          "method": "org.eclipse.core.launcher.Main.main",
          "source": "Main.java:599"
        }
      ],
      "number": 1,
      "commentIndex": 0,
      "bugId": "45366",
      "date": "2003-10-22T15:21:14+02:00",
      "product": "Equinox",
      "component": "Incubator",
      "severity": "normal"
    },
    {
      "exceptionType": "org.osgi.framework.BundleException",
      "message": "A bundle with the unique ID and version is already installed: org.eclipse.core.applicationrunner 3.0.0",
      "elements": [
        {
          "method": "org.eclipse.osgi.framework.internal.core.Framework.installWorkerPrivileged",
          "source": "Framework.java:976"
        },
        {
          "method": "org.eclipse.osgi.framework.internal.core.Framework$1.run",
          "source": "Framework.java:842"
        },
        {
          "method": "java.security.AccessController.doPrivileged",
          "source": "Native Method"
        },
        {
          "method": "org.eclipse.osgi.framework.internal.core.Framework.installWorker",
          "source": "Framework.java:933"
        },
        {
          "method": "org.eclipse.osgi.framework.internal.core.Framework.installBundle",
          "source": "Framework.java:835"
        },
        {
          "method": "org.eclipse.osgi.framework.internal.core.BundleContext.installBundle",
          "source": "BundleContext.java:254"
        },
        {
          "method": "org.eclipse.core.runtime.adaptor.EclipseStarter.loadBundles",
          "source": "EclipseStarter.java:153"
        },
        {
          "method": "org.eclipse.core.runtime.adaptor.EclipseStarter.run",
          "source": "EclipseStarter.java:71"
        },
        {
          "method": "sun.reflect.NativeMethodAccessorImpl.invoke0",
          "source": "Native Method"
        },
        {
          "method": "sun.reflect.NativeMethodAccessorImpl.invoke",
          "source": "NativeMethodAccessorImpl.java:39"
        },
        {
          "method": "sun.reflect.DelegatingMethodAccessorImpl.invoke",
          "source": "DelegatingMethodAccessorImpl.java:25"
        },
        {
          "method": "java.lang.reflect.Method.invoke",
          "source": "Method.java:324"
        },
        {
          "method": "org.eclipse.core.internal.boot.OSGiBootLoader.basicRun",
          "source": "OSGiBootLoader.java:250"
        },
        {
          "method": "org.eclipse.core.internal.boot.OSGiBootLoader.run",
          "source": "OSGiBootLoader.java:765"
        },
        {
          "method": "org.eclipse.core.internal.boot.OSGiBootLoader.run",
          "source": "OSGiBootLoader.java:752"
        },
        {
          "method": "sun.reflect.NativeMethodAccessorImpl.invoke0",
          "source": "Native Method"
        },
        {
          "method": "sun.reflect.NativeMethodAccessorImpl.invoke",
          "source": "NativeMethodAccessorImpl.java:39"
        },
        {
          "method": "sun.reflect.DelegatingMethodAccessorImpl.invoke",
          "source": "DelegatingMethodAccessorImpl.java:25"
        },
        {
          "method": "java.lang.reflect.Method.invoke",
          "source": "Method.java:324"
        },
        {
          "method": "org.eclipse.core.launcher.Main.basicRun",
          "source": "Main.java:299"
        },
        {
          "method": "org.eclipse.core.launcher.Main.run",
          "source": "Main.java:765"
        },
        {
          "method": "org.eclipse.core.launcher.Main.main",
          "source": "Main.java:599"
        }
      ],
      "number": 2,
      "commentIndex": 0,
      "bugId": "45366",
      "date": "2003-10-22T15:21:14+02:00",
      "product": "Equinox",
      "component": "Incubator",
      "severity": "normal"
    }
  ],
  "groupId": "45366",
  "bugId": "45366",
  "date": "2003-10-22T15:21:14+02:00",
  "product": "Equinox",
  "component": "Incubator",
  "severity": "normal"
}