{
  "comments": [
    "I recently upgraded from Red Hat Linux 9.0.93 to Fedora 1.0 and now I can\u0027t\nstart Eclipse with gtk bindings. This is the error I get:\n\n!SESSION ----------------------------------------------------------------------\n!ENTRY org.eclipse.core.launcher 4 0 Nov 06, 2003 10:12:52.822\n!MESSAGE Exception launching the Eclipse Platform:\n!STACK\njava.lang.reflect.InvocationTargetException\n        at sun.reflect.NativeMethodAccessorImpl.invoke0(Native Method)\n        at\nsun.reflect.NativeMethodAccessorImpl.invoke(NativeMethodAccessorImpl.java:39)\n        at\nsun.reflect.DelegatingMethodAccessorImpl.invoke(DelegatingMethodAccessorImpl.java:25)\n        at java.lang.reflect.Method.invoke(Method.java:324)\n        at org.eclipse.core.launcher.Main.basicRun(Main.java:299)\n        at org.eclipse.core.launcher.Main.run(Main.java:765)\n        at org.eclipse.core.launcher.Main.main(Main.java:599)\nCaused by: java.lang.reflect.InvocationTargetException\n        at\norg.eclipse.core.internal.boot.InternalBootLoader.run(InternalBootLoader.java:861)\n        at org.eclipse.core.boot.BootLoader.run(BootLoader.java:461)\n        ... 7 more\nCaused by: java.lang.NullPointerException\n        at org.eclipse.swt.widgets.ToolBar.releaseWidget(ToolBar.java:328)\n        at org.eclipse.swt.widgets.Widget.releaseResources(Widget.java:868)\n        at org.eclipse.swt.widgets.Composite.releaseChildren(Composite.java:604)\n       at org.eclipse.swt.widgets.Composite.releaseWidget(Composite.java:609)\n        at org.eclipse.swt.widgets.Widget.releaseResources(Widget.java:868)\n        at org.eclipse.swt.widgets.Composite.releaseChildren(Composite.java:604)\n       at org.eclipse.swt.widgets.Composite.releaseWidget(Composite.java:609)\n        at org.eclipse.swt.widgets.Canvas.releaseWidget(Canvas.java:132)\n        at org.eclipse.swt.widgets.Decorations.releaseWidget(Decorations.java:384)\n        at org.eclipse.swt.widgets.Shell.releaseWidget(Shell.java:1170)\n        at org.eclipse.swt.widgets.Widget.dispose(Widget.java:375)\n        at org.eclipse.swt.widgets.Shell.dispose(Shell.java:1112)\n        at org.eclipse.swt.widgets.Display.release(Display.java:1643)\n        at org.eclipse.swt.graphics.Device.dispose(Device.java:174)\n        at org.eclipse.ui.internal.Workbench.run(Workbench.java:2335)\n        at\norg.eclipse.core.internal.boot.InternalBootLoader.run(InternalBootLoader.java:858)\n        ... 8 more\n \nI have Eclipse 3.0M4 on a Fedora (Red Hat) Linux box\nwith JDK 1.4.2_02. \n\nThe motif version still seems to work.\n\nI post this as an enhancement request as I am aware you don\u0027t promise\ncomaptibility with Gnome 2.4.0. In the mean time I\u0027d like advice on a workaround\n  using Gnome 2.2 for Eclipse while using Gnome 2.4 for the rest of my machine.",
    "is this still a problem for you on R3.0?",
    "Marking remind pending response"
  ],
  "commentCreationDates": [
    "2003-11-06T14:16:38+01:00",
    "2004-06-28T17:21:20+02:00",
    "2006-04-13T22:03:50+02:00"
  ],
  "traces": [
    {
      "exceptionType": "java.lang.reflect.InvocationTargetException",
      "elements": [
        {
          "method": "sun.reflect.NativeMethodAccessorImpl.invoke0",
          "source": "Native Method"
        },
        {
          "method": "sun.reflect.NativeMethodAccessorImpl.invoke",
          "source": "NativeMethodAccessorImpl.java:39"
        },
        {
          "method": "sun.reflect.DelegatingMethodAccessorImpl.invoke",
          "source": "DelegatingMethodAccessorImpl.java:25"
        },
        {
          "method": "java.lang.reflect.Method.invoke",
          "source": "Method.java:324"
        },
        {
          "method": "org.eclipse.core.launcher.Main.basicRun",
          "source": "Main.java:299"
        },
        {
          "method": "org.eclipse.core.launcher.Main.run",
          "source": "Main.java:765"
        },
        {
          "method": "org.eclipse.core.launcher.Main.main",
          "source": "Main.java:599"
        }
      ],
      "causedBy": {
        "exceptionType": "java.lang.reflect.InvocationTargetException",
        "elements": [
          {
            "method": "org.eclipse.core.internal.boot.InternalBootLoader.run",
            "source": "InternalBootLoader.java:861"
          },
          {
            "method": "org.eclipse.core.boot.BootLoader.run",
            "source": "BootLoader.java:461"
          }
        ],
        "causedBy": {
          "exceptionType": "java.lang.NullPointerException",
          "elements": [
            {
              "method": "org.eclipse.swt.widgets.ToolBar.releaseWidget",
              "source": "ToolBar.java:328"
            },
            {
              "method": "org.eclipse.swt.widgets.Widget.releaseResources",
              "source": "Widget.java:868"
            },
            {
              "method": "org.eclipse.swt.widgets.Composite.releaseChildren",
              "source": "Composite.java:604"
            },
            {
              "method": "org.eclipse.swt.widgets.Composite.releaseWidget",
              "source": "Composite.java:609"
            },
            {
              "method": "org.eclipse.swt.widgets.Widget.releaseResources",
              "source": "Widget.java:868"
            },
            {
              "method": "org.eclipse.swt.widgets.Composite.releaseChildren",
              "source": "Composite.java:604"
            },
            {
              "method": "org.eclipse.swt.widgets.Composite.releaseWidget",
              "source": "Composite.java:609"
            },
            {
              "method": "org.eclipse.swt.widgets.Canvas.releaseWidget",
              "source": "Canvas.java:132"
            },
            {
              "method": "org.eclipse.swt.widgets.Decorations.releaseWidget",
              "source": "Decorations.java:384"
            },
            {
              "method": "org.eclipse.swt.widgets.Shell.releaseWidget",
              "source": "Shell.java:1170"
            },
            {
              "method": "org.eclipse.swt.widgets.Widget.dispose",
              "source": "Widget.java:375"
            },
            {
              "method": "org.eclipse.swt.widgets.Shell.dispose",
              "source": "Shell.java:1112"
            },
            {
              "method": "org.eclipse.swt.widgets.Display.release",
              "source": "Display.java:1643"
            },
            {
              "method": "org.eclipse.swt.graphics.Device.dispose",
              "source": "Device.java:174"
            },
            {
              "method": "org.eclipse.ui.internal.Workbench.run",
              "source": "Workbench.java:2335"
            },
            {
              "method": "org.eclipse.core.internal.boot.InternalBootLoader.run",
              "source": "InternalBootLoader.java:858"
            }
          ],
          "number": 0,
          "commentIndex": 0
        },
        "number": 0,
        "commentIndex": 0
      },
      "number": 0,
      "commentIndex": 0,
      "bugId": "46196",
      "date": "2003-11-06T14:16:38+01:00",
      "product": "Platform",
      "component": "UI",
      "severity": "enhancement"
    }
  ],
  "groupId": "46196",
  "bugId": "46196",
  "date": "2003-11-06T14:16:38+01:00",
  "product": "Platform",
  "component": "UI",
  "severity": "enhancement"
}