{
  "comments": [
    "Eclipse 200311050952\nOS X 10.3 on Dual G5\n\nWhen the \u0027show source of selected element only\u0027 state is unchecked - completion works perfectly.\n\nHowever, when \u0027show source of selected element only\u0027 state is checked there are two reproducible \nerrors:\n\n1. If you select the class, so the whole class is visible in the editor, then selecting an item from a \nlist of possible completions adds the selected item, but puts the cursor several lines below where it \nshould. There are no stack traces in the logs.\n\n2. If you select a method and then select a completion from the list, a stack is produced:\n\n!ENTRY org.eclipse.ui 4 4 Nov 14, 2003 10:29:58.101\n!MESSAGE Unhandled exception caught in event loop.\n!ENTRY org.eclipse.ui 4 0 Nov 14, 2003 10:29:58.102\n!MESSAGE Index out of bounds\n!STACK 0\njava.lang.IllegalArgumentException: Index out of bounds\n        at org.eclipse.swt.SWT.error(SWT.java:2524)\n        at org.eclipse.swt.SWT.error(SWT.java:2468)\n        at org.eclipse.swt.custom.StyledText.setSelectionRange(StyledText.java:7835)\n        at \norg.eclipse.jface.text.contentassist.ContentAssistSubjectAdapter.setSelectedRange(ContentAssistSu\nbjectAdapter.java:241)\n        at \norg.eclipse.jface.text.contentassist.CompletionProposalPopup.insertProposal(CompletionProposalP\nopup.java:377)\n        at \norg.eclipse.jface.text.contentassist.CompletionProposalPopup.selectProposalWithMask(Completion\nProposalPopup.java:336)\n        at \norg.eclipse.jface.text.contentassist.CompletionProposalPopup.verifyKey(CompletionProposalPopup.\njava:635)\n        at \norg.eclipse.jface.text.contentassist.ContentAssistant$InternalListener.verifyKey(ContentAssistant.ja\nva:603)\n        at org.eclipse.jface.text.TextViewer$VerifyKeyListenersManager.verifyKey(TextViewer.java:\n369)\n        at org.eclipse.swt.custom.StyledTextListener.handleEvent(StyledTextListener.java:55)\n        at org.eclipse.swt.widgets.EventTable.sendEvent(EventTable.java:82)\n        at org.eclipse.swt.widgets.Widget.notifyListeners(Widget.java:1040)\n        at org.eclipse.swt.custom.StyledText.handleKeyDown(StyledText.java:5321)\n        at org.eclipse.swt.custom.StyledText$8.handleEvent(StyledText.java:5070)\n        at org.eclipse.swt.widgets.EventTable.sendEvent(EventTable.java:82)\n        at org.eclipse.swt.widgets.Widget.sendEvent(Widget.java:1183)\n        at org.eclipse.swt.widgets.Widget.sendEvent(Widget.java:1207)\n        at org.eclipse.swt.widgets.Widget.sendEvent(Widget.java:1192)\n        at org.eclipse.swt.widgets.Control.sendKeyEvent(Control.java:1925)\n        at org.eclipse.swt.widgets.Control.sendKeyEvent(Control.java:1920)\n        at org.eclipse.swt.widgets.Control.kEventTextInputUnicodeForKeyEvent(Control.java:1463)\n        at org.eclipse.swt.widgets.Composite.kEventTextInputUnicodeForKeyEvent(Composite.java:\n368)\n        at org.eclipse.swt.widgets.Widget.textInputProc(Widget.java:1560)\n        at org.eclipse.swt.widgets.Display.textInputProc(Display.java:2723)\n        at org.eclipse.swt.internal.carbon.OS.SendEventToEventTarget(Native Method)\n        at org.eclipse.swt.widgets.Display.readAndDispatch(Display.java:1927)\n        at org.eclipse.ui.internal.Workbench.runEventLoop(Workbench.java:1611)\n        at org.eclipse.ui.internal.Workbench.run(Workbench.java:1594)\n        at org.eclipse.core.internal.boot.InternalBootLoader.run(InternalBootLoader.java:858)\n        at org.eclipse.core.boot.BootLoader.run(BootLoader.java:461)\n        at sun.reflect.NativeMethodAccessorImpl.invoke0(Native Method)\n        at sun.reflect.NativeMethodAccessorImpl.invoke(NativeMethodAccessorImpl.java:39)\n        at sun.reflect.DelegatingMethodAccessorImpl.invoke(DelegatingMethodAccessorImpl.java:25)\n        at java.lang.reflect.Method.invoke(Method.java:324)\n        at org.eclipse.core.launcher.Main.basicRun(Main.java:299)\n        at org.eclipse.core.launcher.Main.run(Main.java:765)\n        at org.eclipse.core.launcher.Main.main(Main.java:599)",
    "ContentAssistSubjectAdapter::setSelectedRange sets the selection on the widget,\nbut CompletionProposalPopup.insertProposal fills in the model offsets it gets\nfrom the completion proposal.\n\nInvestigating.",
    "fixed \u003e 200311118",
    "Thanks Tom.",
    "Hi Tom,\nI\u0027ve just tried Eclipse 20031118 and the problem still exists for me. Did you mean the fix will be in \nthe next version after this ?\n\nchanning",
    "it went into the repository yesterday night, so it didn\u0027t make it into the\nnightly build... Should be working in today\u0027s (20031119) and will certainly be\nin M5 due this friday.",
    "ok thanks tom.",
    "start verify",
    "verified"
  ],
  "commentCreationDates": [
    "2003-11-14T10:46:12+01:00",
    "2003-11-18T17:04:16+01:00",
    "2003-11-18T17:31:23+01:00",
    "2003-11-18T18:02:04+01:00",
    "2003-11-18T23:43:32+01:00",
    "2003-11-19T09:08:20+01:00",
    "2003-11-19T09:11:38+01:00",
    "2003-11-19T15:17:20+01:00",
    "2003-11-19T15:24:54+01:00"
  ],
  "traces": [
    {
      "exceptionType": "java.lang.IllegalArgumentException",
      "message": "Index out of bounds",
      "elements": [
        {
          "method": "org.eclipse.swt.SWT.error",
          "source": "SWT.java:2524"
        },
        {
          "method": "org.eclipse.swt.SWT.error",
          "source": "SWT.java:2468"
        },
        {
          "method": "org.eclipse.swt.custom.StyledText.setSelectionRange",
          "source": "StyledText.java:7835"
        },
        {
          "method": "org.eclipse.jface.text.contentassist.ContentAssistSubjectAdapter.setSelectedRange",
          "source": "ContentAssistSu bjectAdapter.java:241"
        },
        {
          "method": "org.eclipse.jface.text.contentassist.CompletionProposalPopup.insertProposal",
          "source": "CompletionProposalP opup.java:377"
        },
        {
          "method": "org.eclipse.jface.text.contentassist.CompletionProposalPopup.selectProposalWithMask",
          "source": "Completion ProposalPopup.java:336"
        },
        {
          "method": "org.eclipse.jface.text.contentassist.CompletionProposalPopup.verifyKey",
          "source": "CompletionProposalPopup. java:635"
        },
        {
          "method": "org.eclipse.jface.text.contentassist.ContentAssistant$InternalListener.verifyKey",
          "source": "ContentAssistant.ja va:603"
        },
        {
          "method": "org.eclipse.jface.text.TextViewer$VerifyKeyListenersManager.verifyKey",
          "source": "TextViewer.java: 369"
        },
        {
          "method": "org.eclipse.swt.custom.StyledTextListener.handleEvent",
          "source": "StyledTextListener.java:55"
        },
        {
          "method": "org.eclipse.swt.widgets.EventTable.sendEvent",
          "source": "EventTable.java:82"
        },
        {
          "method": "org.eclipse.swt.widgets.Widget.notifyListeners",
          "source": "Widget.java:1040"
        },
        {
          "method": "org.eclipse.swt.custom.StyledText.handleKeyDown",
          "source": "StyledText.java:5321"
        },
        {
          "method": "org.eclipse.swt.custom.StyledText$8.handleEvent",
          "source": "StyledText.java:5070"
        },
        {
          "method": "org.eclipse.swt.widgets.EventTable.sendEvent",
          "source": "EventTable.java:82"
        },
        {
          "method": "org.eclipse.swt.widgets.Widget.sendEvent",
          "source": "Widget.java:1183"
        },
        {
          "method": "org.eclipse.swt.widgets.Widget.sendEvent",
          "source": "Widget.java:1207"
        },
        {
          "method": "org.eclipse.swt.widgets.Widget.sendEvent",
          "source": "Widget.java:1192"
        },
        {
          "method": "org.eclipse.swt.widgets.Control.sendKeyEvent",
          "source": "Control.java:1925"
        },
        {
          "method": "org.eclipse.swt.widgets.Control.sendKeyEvent",
          "source": "Control.java:1920"
        },
        {
          "method": "org.eclipse.swt.widgets.Control.kEventTextInputUnicodeForKeyEvent",
          "source": "Control.java:1463"
        },
        {
          "method": "org.eclipse.swt.widgets.Composite.kEventTextInputUnicodeForKeyEvent",
          "source": "Composite.java: 368"
        },
        {
          "method": "org.eclipse.swt.widgets.Widget.textInputProc",
          "source": "Widget.java:1560"
        },
        {
          "method": "org.eclipse.swt.widgets.Display.textInputProc",
          "source": "Display.java:2723"
        },
        {
          "method": "org.eclipse.swt.internal.carbon.OS.SendEventToEventTarget",
          "source": "Native Method"
        },
        {
          "method": "org.eclipse.swt.widgets.Display.readAndDispatch",
          "source": "Display.java:1927"
        },
        {
          "method": "org.eclipse.ui.internal.Workbench.runEventLoop",
          "source": "Workbench.java:1611"
        },
        {
          "method": "org.eclipse.ui.internal.Workbench.run",
          "source": "Workbench.java:1594"
        },
        {
          "method": "org.eclipse.core.internal.boot.InternalBootLoader.run",
          "source": "InternalBootLoader.java:858"
        },
        {
          "method": "org.eclipse.core.boot.BootLoader.run",
          "source": "BootLoader.java:461"
        },
        {
          "method": "sun.reflect.NativeMethodAccessorImpl.invoke0",
          "source": "Native Method"
        },
        {
          "method": "sun.reflect.NativeMethodAccessorImpl.invoke",
          "source": "NativeMethodAccessorImpl.java:39"
        },
        {
          "method": "sun.reflect.DelegatingMethodAccessorImpl.invoke",
          "source": "DelegatingMethodAccessorImpl.java:25"
        },
        {
          "method": "java.lang.reflect.Method.invoke",
          "source": "Method.java:324"
        },
        {
          "method": "org.eclipse.core.launcher.Main.basicRun",
          "source": "Main.java:299"
        },
        {
          "method": "org.eclipse.core.launcher.Main.run",
          "source": "Main.java:765"
        },
        {
          "method": "org.eclipse.core.launcher.Main.main",
          "source": "Main.java:599"
        }
      ],
      "number": 0,
      "commentIndex": 0,
      "bugId": "46660",
      "date": "2003-11-14T10:46:12+01:00",
      "product": "JDT",
      "component": "Text",
      "severity": "normal"
    }
  ],
  "groupId": "46660",
  "bugId": "46660",
  "date": "2003-11-14T10:46:12+01:00",
  "product": "JDT",
  "component": "Text",
  "severity": "normal"
}