{
  "comments": [
    "build I20031121\n\n- with the fix for bug 46837,\n- follow the steps in bug 46837, comment #7\n- the log has:\n!ENTRY org.eclipse.ui.ide 4 4 Dec 08, 2003 23:54:56.673\n!MESSAGE Exception in org.eclipse.ui.actions.DeleteResourceAction.run: \norg.eclipse.core.internal.resources.ResourceException: Problems encountered \nwhile deleting resources.\n!ENTRY org.eclipse.core.resources 4 4 Dec 08, 2003 23:54:56.683\n!MESSAGE Problems encountered while deleting resources.\n!SUBENTRY 1 org.eclipse.core.resources 4 273 Dec 08, 2003 23:54:56.683\n!MESSAGE Could not delete: /Java.\n!STACK 1\norg.eclipse.core.internal.resources.ResourceException: Problems encountered \nwhile deleting resources.\n\tat org.eclipse.core.internal.localstore.FileSystemResourceManager.delete\n(FileSystemResourceManager.java:169)\n\tat \norg.eclipse.core.internal.resources.ResourceTree.standardDeleteProject\n(ResourceTree.java:768)\n\tat org.eclipse.core.internal.resources.Resource.unprotectedDelete\n(Resource.java:1427)\n\tat org.eclipse.core.internal.resources.Resource.delete\n(Resource.java:649)\n\tat org.eclipse.core.internal.resources.Project.delete(Project.java:289)\n\tat org.eclipse.ui.actions.DeleteResourceAction.delete\n(DeleteResourceAction.java:309)\n\tat org.eclipse.ui.actions.DeleteResourceAction.delete\n(DeleteResourceAction.java:296)\n\tat org.eclipse.ui.actions.DeleteResourceAction$2.execute\n(DeleteResourceAction.java:388)\n\tat org.eclipse.ui.actions.WorkspaceModifyOperation$1.run\n(WorkspaceModifyOperation.java:91)\n\tat org.eclipse.core.internal.resources.Workspace.run\n(Workspace.java:1554)\n\tat org.eclipse.ui.actions.WorkspaceModifyOperation.run\n(WorkspaceModifyOperation.java:105)\n\tat org.eclipse.jface.operation.ModalContext$ModalContextThread.run\n(ModalContext.java:101)\n!ENTRY org.eclipse.core.resources 4 273 Dec 08, 2003 23:54:56.683\n!MESSAGE Problems encountered while deleting resources.\n!SUBENTRY 1 org.eclipse.core.resources 4 273 Dec 08, 2003 23:54:56.683\n!MESSAGE Could not delete: d:\\eclipse-new\\runtime-workspace\\Java\\Test2.doc.\n!SUBENTRY 2 org.eclipse.core.resources 4 273 Dec 08, 2003 23:54:56.683\n!MESSAGE Could not delete: d:\\eclipse-new\\runtime-workspace\\Java\\Test2.doc.\n\n\nNote that at the end it complains about Test2.doc twice.\nHowever, the status object from core is of the form:\nstatus\u003d MultiStatus  (id\u003d292)\n  message\u003d \"Problems encountered while deleting resources.\"\n  children\u003d IStatus[1]  (id\u003d296)\n    [0]\u003d MultiStatus  (id\u003d301)\n      message\u003d \"Could not delete: /Java.\"\n      children\u003d IStatus[1]  (id\u003d302)\n        [0]\u003d ResourceStatus  (id\u003d305)\n          message\u003d \"Could not delete: d:\\\\eclipse-new\\\\runtime-\nworkspace\\\\Java\\\\Test2.doc.\"\n\nNote also that the message \"Could not delete: /Java.\" does not appear in the \nlog.",
    "The \"Could not delete: /Java\" message does appear in the log:\n\n!SUBENTRY 1 org.eclipse.core.resources 4 273 Dec 08, 2003 23:54:56.683\n!MESSAGE Could not delete: /Java.\n\nHowever, the duplicated child entry is strange.",
    "This hasn\u0027t been reproduced and the code has changed significantly since then.\nClosing, but will reopen if this occurs in 3.1."
  ],
  "commentCreationDates": [
    "2003-12-09T05:08:53+01:00",
    "2003-12-09T18:47:07+01:00",
    "2005-04-11T23:15:30+02:00"
  ],
  "traces": [
    {
      "exceptionType": "org.eclipse.core.internal.resources.ResourceException",
      "message": "Problems encountered  while deleting resources.",
      "elements": [
        {
          "method": "org.eclipse.core.internal.localstore.FileSystemResourceManager.delete",
          "source": "FileSystemResourceManager.java:169"
        },
        {
          "method": "org.eclipse.core.internal.resources.ResourceTree.standardDeleteProject",
          "source": "ResourceTree.java:768"
        },
        {
          "method": "org.eclipse.core.internal.resources.Resource.unprotectedDelete",
          "source": "Resource.java:1427"
        },
        {
          "method": "org.eclipse.core.internal.resources.Resource.delete",
          "source": "Resource.java:649"
        },
        {
          "method": "org.eclipse.core.internal.resources.Project.delete",
          "source": "Project.java:289"
        },
        {
          "method": "org.eclipse.ui.actions.DeleteResourceAction.delete",
          "source": "DeleteResourceAction.java:309"
        },
        {
          "method": "org.eclipse.ui.actions.DeleteResourceAction.delete",
          "source": "DeleteResourceAction.java:296"
        },
        {
          "method": "org.eclipse.ui.actions.DeleteResourceAction$2.execute",
          "source": "DeleteResourceAction.java:388"
        },
        {
          "method": "org.eclipse.ui.actions.WorkspaceModifyOperation$1.run",
          "source": "WorkspaceModifyOperation.java:91"
        },
        {
          "method": "org.eclipse.core.internal.resources.Workspace.run",
          "source": "Workspace.java:1554"
        },
        {
          "method": "org.eclipse.ui.actions.WorkspaceModifyOperation.run",
          "source": "WorkspaceModifyOperation.java:105"
        },
        {
          "method": "org.eclipse.jface.operation.ModalContext$ModalContextThread.run",
          "source": "ModalContext.java:101"
        }
      ],
      "number": 0,
      "commentIndex": 0,
      "bugId": "48322",
      "date": "2003-12-09T05:08:53+01:00",
      "product": "Platform",
      "component": "Resources",
      "severity": "normal"
    }
  ],
  "groupId": "48322",
  "bugId": "48322",
  "date": "2003-12-09T05:08:53+01:00",
  "product": "Platform",
  "component": "Resources",
  "severity": "normal"
}