{
  "comments": [
    "Using build 204, I get a verification error when trying to instantiate\nJDK12DebugLauncher. (No problem when I fall back to 203). The runtime error is:\n\n4 org.eclipse.ui 0 (class: \norg/eclipse/jdt/internal/ui/launcher/JDK12DebugLauncher, method: run signature: \n(Lorg/eclipse/jdt/launching/VMRunnerConfiguration;)\nLorg/eclipse/jdt/launching/VMRunnerResult;) Localvariable 16 contains wrong type\njava.lang.VerifyError: (class: \norg/eclipse/jdt/internal/ui/launcher/JDK12DebugLauncher, method: run signature: \n(Lorg/eclipse/jdt/launching/VMRunnerConfiguration;)\nLorg/eclipse/jdt/launching/VMRunnerResult;) Localvariable 16 contains wrong type\n\tat org.eclipse.jdt.internal.ui.launcher.StandardVM.getVMRunner\n(StandardVM.java:37)\n\tat \norg.eclipse.jdt.internal.ui.launcher.JavaApplicationLauncherDelegate.getVMRunner\n(JavaApplicationLauncherDelegate.java:213)\n\tat \norg.eclipse.jdt.internal.ui.launcher.JavaApplicationLauncherDelegate.doLaunch\n(JavaApplicationLauncherDelegate.java:135)\n\tat \norg.eclipse.jdt.internal.ui.launcher.JavaApplicationLauncherDelegate.launchEleme\nnt(JavaApplicationLauncherDelegate.java:82)\n\tat \norg.eclipse.jdt.internal.ui.launcher.JavaApplicationLauncherDelegate.launch\n(JavaApplicationLauncherDelegate.java:94)\n\tat org.eclipse.debug.internal.core.Launcher.launch(Launcher.java:104)\n\tat org.eclipse.debug.internal.ui.RelaunchActionDelegate.relaunch\n(RelaunchActionDelegate.java:37)\n\tat org.eclipse.debug.internal.ui.RelaunchActionDelegate.relaunch\n(RelaunchActionDelegate.java:46)\n\tat org.eclipse.debug.internal.ui.RelaunchHistoryLaunchAction$1.run\n(RelaunchHistoryLaunchAction.java:49)\n\tat org.eclipse.swt.custom.BusyIndicator.showWhile(BusyIndicator.java:56)\n\tat org.eclipse.debug.internal.ui.RelaunchHistoryLaunchAction.run\n(RelaunchHistoryLaunchAction.java:47)\n\tat org.eclipse.jface.action.Action.runWithEvent(Action.java:451)\n\tat org.eclipse.jface.action.ActionContributionItem.handleWidgetSelection\n(ActionContributionItem.java:407)\n\tat org.eclipse.jface.action.ActionContributionItem.handleWidgetEvent\n(ActionContributionItem.java:361)\n\tat org.eclipse.jface.action.ActionContributionItem.access$0\n(ActionContributionItem.java:352)\n\tat \norg.eclipse.jface.action.ActionContributionItem$ActionListener.handleEvent\n(ActionContributionItem.java:47)\n\tat org.eclipse.swt.widgets.EventTable.sendEvent(EventTable.java\n(Compiled Code))\n\tat org.eclipse.swt.widgets.Widget.notifyListeners(Widget.java:645)\n\tat org.eclipse.swt.widgets.Display.runDeferredEvents(Display.java:1359)\n\tat org.eclipse.swt.widgets.Display.readAndDispatch(Display.java:1160)\n\tat org.eclipse.ui.internal.Workbench.runEventLoop(Workbench.java:675)\n\tat org.eclipse.ui.internal.Workbench.run(Workbench.java:658)\n\tat org.eclipse.core.internal.boot.InternalBootLoader.run\n(InternalBootLoader.java:820)\n\tat org.eclipse.core.boot.BootLoader.run(BootLoader.java:285)\n\tat java.lang.reflect.Method.invoke(Native Method)\n\tat org.eclipse.core.launcher.Main.basicRun(Main.java:151)\n\tat org.eclipse.core.launcher.Main.run(Main.java:502)\n\tat org.eclipse.core.launcher.UIMain.main(UIMain.java:52)\n\nThe code looks like:\n\n\n\t/**\n\t * @see IVMRunner#run\n\t */\n\tpublic VMRunnerResult run(VMRunnerConfiguration config) throws \nCoreException {\n\t\tint port\u003d SocketUtil.findUnusedLocalPort(null, 5000, 15000);\n\t\tif (port \u003d\u003d -1) {\n\t\t\tthrow new CoreException(createStatus\n(LauncherMessages.getString(\"jdkLauncher.noPort\"), null)); //$NON-NLS-1$\n\t\t}\n\t\tString location\u003d getJDKLocation(\"\"); //$NON-NLS-1$\n\t\tif (\"\".equals(location)) { //$NON-NLS-1$\n\t\t\tthrow new CoreException(createStatus\n(LauncherMessages.getString(\"jdkLauncher.error.noJDKHome\"), null)); //$NON-NLS-1\n$\n\t\t}\n\t\tString program\u003d \nlocation+File.separator+\"bin\"+File.separator+\"java\"; //$NON-NLS-2$ //$NON-NLS-1$\n\t\tFile javawexe\u003d new File(program+\"w.exe\"); //$NON-NLS-1$\n\t\tFile javaw\u003d new File(program+\"w\"); //$NON-NLS-1$\n\t\t\n\t\tif (javaw.isFile()) \n\t\t\tprogram\u003d javaw.getAbsolutePath();\n\t\telse if (javawexe.isFile())\n\t\t\tprogram\u003d javawexe.getAbsolutePath();\n\n\t\tVector arguments\u003d new Vector();\n\n\t\targuments.addElement(program);\n\n\t\tString[] bootCP\u003d config.getBootClassPath();\n\t\tif (bootCP.length \u003e 0) {\n\t\t\targuments.add(\"-Xbootclasspath:\"+convertClassPath\n(bootCP)); //$NON-NLS-1$\n\t\t} \n\t\t\n\t\tString[] cp\u003d config.getClassPath();\n\t\tif (cp.length \u003e 0) {\n\t\t\targuments.add(\"-classpath\"); //$NON-NLS-1$\n\t\t\targuments.add(convertClassPath(cp));\n\t\t}\n\t\taddArguments(config.getVMArguments(), arguments);\n\n\t\targuments.add(\"-Xdebug\"); //$NON-NLS-1$\n\t\targuments.add(\"-Xnoagent\"); //$NON-NLS-1$\n\t\targuments.add(\"-Djava.compiler\u003dNONE\"); //$NON-NLS-1$\n\t\targuments.add(\"-\nXrunjdwp:transport\u003ddt_socket,address\u003d127.0.0.1:\" + port); //$NON-NLS-1$\n\n\t\targuments.add(config.getClassToLaunch());\n\t\taddArguments(config.getProgramArguments(), arguments);\n\t\tString[] cmdLine\u003d new String[arguments.size()];\n\t\targuments.copyInto(cmdLine);\n\n\t\tListeningConnector connector\u003d getConnector();\n\t\tif (connector \u003d\u003d null) {\n\t\t\tthrow new CoreException(createStatus\n(LauncherMessages.getString(\"jdkLauncher.error.noConnector\"), null)); //$NON-\nNLS-1$\n\t\t}\n\t\tMap map\u003d connector.defaultArguments();\n\t\tint timeout\u003d fVMInstance.getDebuggerTimeout();\n\t\t\n\t\tspecifyArguments(map, port, timeout);\n\t\tProcess p\u003d null;\n\t\ttry {\n\t\t\ttry {\n\t\t\t\tconnector.startListening(map);\n\n\t\t\t\ttry {\n\t\t\t\t\tp\u003d Runtime.getRuntime().exec(cmdLine);\n\t\t\n\t\t\t\t} catch (IOException e) {\n\t\t\t\t\tif (p !\u003d null) {\n\t\t\t\t\t\tp.destroy();\n\t\t\t\t\t}\n\t\t\t\t\tthrow new CoreException(createStatus\n(LauncherMessages.getString(\"jdkLauncher.error.title\"), e)); //$NON-NLS-1$\n\t\t\t\t}\n\t\t\n\t\t\t\tIProcess process\u003d DebugPlugin.getDefault\n().newProcess(p, renderProcessLabel(cmdLine));\n\t\t\t\tprocess.setAttribute(JavaRuntime.ATTR_CMDLINE, \nrenderCommandLine(cmdLine));\n\t\t\t\t//try {\n\t\t\t\t//\tThread.currentThread().sleep(5000);\n\t\t\t\t//} catch (InterruptedException e) {\n\t\t\t\t//}\n\t\t\t\tboolean retry\u003d false;\n\t\t\t\tdo  {\n\t\t\t\t\ttry {\n\t\t\t\t\t\tVirtualMachine vm\u003d \nconnector.accept(map);\n\t\t\t\t\t\tsetTimeout(vm);\n\t\t\t\t\t\tIDebugTarget debugTarget\u003d \nJDIDebugModel.newDebugTarget(vm, renderDebugTarget(config.getClassToLaunch(), \nport), process, true, false);\n\t\t\t\t\t\treturn new VMRunnerResult\n(debugTarget, new IProcess[] { process });\n\t\t\t\t\t} catch (InterruptedIOException e) {\n\t\t\t\t\t\tretry\u003d fRetryQuery.queryRetry();\n\t\t\t\t\t}\n\t\t\t\t} while (retry);\n\t\t\t} finally {\n\t\t\t\tconnector.stopListening(map);\n\t\t\t}\n\t\t} catch (IOException e) {\n\t\t\tthrow new CoreException(createStatus\n(LauncherMessages.getString(\"jdkLauncher.error.connect\"), e)); //$NON-NLS-1$\n\t\t} catch (IllegalConnectorArgumentsException e) {\n\t\t\tthrow new CoreException(createStatus\n(LauncherMessages.getString(\"jdkLauncher.error.connect\"), e)); //$NON-NLS-1$\n\t\t}\n\t\tif (p !\u003d null)\n\t\t\tp.destroy();\n\t\treturn null;\n\t}",
    "I\u0027ve got a similar problem running Core Test Cases. When compiling with 204 I \ncannot run and get the following stack trace. When compiling with 202a I can \nrun on both 202a and 204. I can provide further information if necessary.\n\n2 org.eclipse.core.runtime 2 Problems occurred when invoking code from plug-\nin: org.eclipse.core.runtime.\njava.lang.VerifyError: (class: org/eclipse/core/internal/resources/Workspace, \nmethod: delete signature: \n([Lorg/eclipse/core/resources/IResource;ZLorg/eclipse/core/runtime/IProgressMon\nitor;)Lorg/eclipse/core/runtime/IStatus;) Localvariable 5 contains wrong type\n\tat org.eclipse.core.resources.ResourcesPlugin.constructWorkspace\n(ResourcesPlugin.java:91)\n\tat org.eclipse.core.resources.ResourcesPlugin.startup\n(ResourcesPlugin.java:134)\n\tat org.eclipse.core.internal.plugins.PluginDescriptor$1.run\n(PluginDescriptor.java:644)\n\tat org.eclipse.core.internal.runtime.InternalPlatform.run\n(InternalPlatform.java:814)\n\tat ",
    "This bug was introduced when dealing with another verification error:\n1GDS7IP:  ITPJCORE:WIN2000 - VerifyError related to a local index computation\n\nProblem comes from the fact that it appears that bytecode verifiers want:\n\n(1) secret try return addresses must be allocated after any local variables in \nthe method \n(2) variables local to a finally block need to be allocated behind the ones from \nthe matching try block. \n\nFixed in HEAD. Issuing a patch for 204 (not the optimal, simply reverting to \n\u003c204 behavior for bug introduced try statement). The new code needs more \ntesting.\nThe old code (\u003c203) did not do either one of these. 204 dealt properly with (2) \nbut since it did not do anything special for return addresses, then many more \ncode patterns broke (1) since return addresses reused the same location, like \nthe test cases mentionned on this PR.\n\n",
    "*** Bug 4919 has been marked as a duplicate of this bug. ***"
  ],
  "commentCreationDates": [
    "2001-10-12T20:39:25+02:00",
    "2001-10-12T21:28:01+02:00",
    "2001-10-13T19:05:00+02:00",
    "2001-10-13T19:07:42+02:00"
  ],
  "traces": [
    {
      "exceptionType": "java.lang.VerifyError",
      "message": "(class:  org/eclipse/jdt/internal/ui/launcher/JDK12DebugLauncher, method: run signature:  (Lorg/eclipse/jdt/launching/VMRunnerConfiguration;) Lorg/eclipse/jdt/launching/VMRunnerResult;) Localvariable 16 contains wrong type",
      "elements": [
        {
          "method": "org.eclipse.jdt.internal.ui.launcher.StandardVM.getVMRunner",
          "source": "StandardVM.java:37"
        },
        {
          "method": "org.eclipse.jdt.internal.ui.launcher.JavaApplicationLauncherDelegate.getVMRunner",
          "source": "JavaApplicationLauncherDelegate.java:213"
        },
        {
          "method": "org.eclipse.jdt.internal.ui.launcher.JavaApplicationLauncherDelegate.doLaunch",
          "source": "JavaApplicationLauncherDelegate.java:135"
        },
        {
          "method": "org.eclipse.jdt.internal.ui.launcher.JavaApplicationLauncherDelegate.launchElement",
          "source": "JavaApplicationLauncherDelegate.java:82"
        },
        {
          "method": "org.eclipse.jdt.internal.ui.launcher.JavaApplicationLauncherDelegate.launch",
          "source": "JavaApplicationLauncherDelegate.java:94"
        },
        {
          "method": "org.eclipse.debug.internal.core.Launcher.launch",
          "source": "Launcher.java:104"
        },
        {
          "method": "org.eclipse.debug.internal.ui.RelaunchActionDelegate.relaunch",
          "source": "RelaunchActionDelegate.java:37"
        },
        {
          "method": "org.eclipse.debug.internal.ui.RelaunchActionDelegate.relaunch",
          "source": "RelaunchActionDelegate.java:46"
        },
        {
          "method": "org.eclipse.debug.internal.ui.RelaunchHistoryLaunchAction$1.run",
          "source": "RelaunchHistoryLaunchAction.java:49"
        },
        {
          "method": "org.eclipse.swt.custom.BusyIndicator.showWhile",
          "source": "BusyIndicator.java:56"
        },
        {
          "method": "org.eclipse.debug.internal.ui.RelaunchHistoryLaunchAction.run",
          "source": "RelaunchHistoryLaunchAction.java:47"
        },
        {
          "method": "org.eclipse.jface.action.Action.runWithEvent",
          "source": "Action.java:451"
        },
        {
          "method": "org.eclipse.jface.action.ActionContributionItem.handleWidgetSelection",
          "source": "ActionContributionItem.java:407"
        },
        {
          "method": "org.eclipse.jface.action.ActionContributionItem.handleWidgetEvent",
          "source": "ActionContributionItem.java:361"
        },
        {
          "method": "org.eclipse.jface.action.ActionContributionItem.access$0",
          "source": "ActionContributionItem.java:352"
        },
        {
          "method": "org.eclipse.jface.action.ActionContributionItem$ActionListener.handleEvent",
          "source": "ActionContributionItem.java:47"
        },
        {
          "method": "org.eclipse.swt.widgets.EventTable.sendEvent",
          "source": "EventTable.java (Compiled Code)"
        },
        {
          "method": "org.eclipse.swt.widgets.Widget.notifyListeners",
          "source": "Widget.java:645"
        },
        {
          "method": "org.eclipse.swt.widgets.Display.runDeferredEvents",
          "source": "Display.java:1359"
        },
        {
          "method": "org.eclipse.swt.widgets.Display.readAndDispatch",
          "source": "Display.java:1160"
        },
        {
          "method": "org.eclipse.ui.internal.Workbench.runEventLoop",
          "source": "Workbench.java:675"
        },
        {
          "method": "org.eclipse.ui.internal.Workbench.run",
          "source": "Workbench.java:658"
        },
        {
          "method": "org.eclipse.core.internal.boot.InternalBootLoader.run",
          "source": "InternalBootLoader.java:820"
        },
        {
          "method": "org.eclipse.core.boot.BootLoader.run",
          "source": "BootLoader.java:285"
        },
        {
          "method": "java.lang.reflect.Method.invoke",
          "source": "Native Method"
        },
        {
          "method": "org.eclipse.core.launcher.Main.basicRun",
          "source": "Main.java:151"
        },
        {
          "method": "org.eclipse.core.launcher.Main.run",
          "source": "Main.java:502"
        },
        {
          "method": "org.eclipse.core.launcher.UIMain.main",
          "source": "UIMain.java:52"
        }
      ],
      "number": 0,
      "commentIndex": 0,
      "bugId": "4943",
      "date": "2001-10-12T20:39:25+02:00",
      "product": "JDT",
      "component": "Core",
      "severity": "normal"
    },
    {
      "exceptionType": "java.lang.VerifyError",
      "message": "(class: org/eclipse/core/internal/resources/Workspace,  method: delete signature:  ([Lorg/eclipse/core/resources/IResource;ZLorg/eclipse/core/runtime/IProgressMon itor;)Lorg/eclipse/core/runtime/IStatus;) Localvariable 5 contains wrong type",
      "elements": [
        {
          "method": "org.eclipse.core.resources.ResourcesPlugin.constructWorkspace",
          "source": "ResourcesPlugin.java:91"
        },
        {
          "method": "org.eclipse.core.resources.ResourcesPlugin.startup",
          "source": "ResourcesPlugin.java:134"
        },
        {
          "method": "org.eclipse.core.internal.plugins.PluginDescriptor$1.run",
          "source": "PluginDescriptor.java:644"
        },
        {
          "method": "org.eclipse.core.internal.runtime.InternalPlatform.run",
          "source": "InternalPlatform.java:814"
        }
      ],
      "number": 1,
      "commentIndex": 1,
      "bugId": "4943",
      "date": "2001-10-12T21:28:01+02:00",
      "product": "JDT",
      "component": "Core",
      "severity": "normal"
    }
  ],
  "groupId": "4943",
  "bugId": "4943",
  "date": "2001-10-12T20:39:25+02:00",
  "product": "JDT",
  "component": "Core",
  "severity": "normal"
}