{
  "comments": [
    "I have a directory structure such that \n\nD:\\java\\aop\\benchmark\\strategy\\aspectj\\ca\\ubc\\ca\\spl\\pattern\\library\n\nexists, and contains source files. The command I issued was\n\najc ca\\ubc\\cs\\spl\\patterns\\library\\*.java examples\\strategy\\aspectj\\*.java\n\nThe difference is the directory is actually called \u0027pattern\u0027, but I mistyped and\ntried to compile in the directory \u0027patterns\u0027. Here\u0027s the output after calling this:\n\nbuild config error: can\u0027t find D:\\java\\aop\\BENCHM~1\\strategy\\aspectj\\ca\\ubc\\cs\\s\npl\\patterns\\library\nABORT\nException thrown from AspectJ 1.1.1\n\nThis might be logged as a bug already -- find current bugs at\n  http://bugs.eclipse.org/bugs/buglist.cgi?product\u003dAspectJ\u0026component\u003dCompiler\n\nBugs for exceptions thrown have titles File:line from the top stack,\ne.g., \"SomeFile.java:243\"\n\nIf you don\u0027t find the exception below in a bug, please add a new bug\nat http://bugs.eclipse.org/bugs/enter_bug.cgi?product\u003dAspectJ\nTo make the bug a priority, please include a test program\nthat can reproduce this exception.\nnull\njava.lang.NullPointerException\n        at org.aspectj.util.ConfigParser.addFiles(ConfigParser.java:132)\n        at org.aspectj.util.ConfigParser.addFileOrPattern(ConfigParser.java:110)\n\n        at org.aspectj.util.ConfigParser.parseOneArg(ConfigParser.java:194)\n        at org.aspectj.util.ConfigParser.parseArgs(ConfigParser.java:157)\n        at org.aspectj.util.ConfigParser.parseCommandLine(ConfigParser.java:35)\n        at org.aspectj.ajdt.ajc.BuildArgParser.genBuildConfig(BuildArgParser.jav\na:109)\n        at org.aspectj.ajdt.ajc.BuildArgParser.genBuildConfig(BuildArgParser.jav\na:88)\n        at org.aspectj.ajdt.ajc.AjdtCommand.genBuildConfig(AjdtCommand.java:131)\n\n        at org.aspectj.ajdt.ajc.AjdtCommand.doCommand(AjdtCommand.java:89)\n        at org.aspectj.ajdt.ajc.AjdtCommand.runCommand(AjdtCommand.java:53)\n        at org.aspectj.tools.ajc.Main.run(Main.java:217)\n        at org.aspectj.tools.ajc.Main.runMain(Main.java:155)\n        at org.aspectj.tools.ajc.Main.main(Main.java:72)\n\n\n1 fail|abort, 1 error",
    "After reporting the error about the directory missing (\"... can\u0027t find ...\"), \nthe code (ConfigParser) still attempts to look for files in the missing \ndirectory.  This results in a null list and the NPE.  We should only attempt \nto look for files in the directory if it exists.\n\nTest added to the org.eclipse.ajdt.core module tests - alongside the tests \nrelated to parsing the configuration.",
    "Fixed in tree based on patch from Andy Clement"
  ],
  "commentCreationDates": [
    "2004-01-10T22:46:43+01:00",
    "2004-01-12T11:37:57+01:00",
    "2004-01-12T11:44:48+01:00"
  ],
  "traces": [
    {
      "exceptionType": "java.lang.NullPointerException",
      "elements": [
        {
          "method": "org.aspectj.util.ConfigParser.addFiles",
          "source": "ConfigParser.java:132"
        },
        {
          "method": "org.aspectj.util.ConfigParser.addFileOrPattern",
          "source": "ConfigParser.java:110"
        },
        {
          "method": "org.aspectj.util.ConfigParser.parseOneArg",
          "source": "ConfigParser.java:194"
        },
        {
          "method": "org.aspectj.util.ConfigParser.parseArgs",
          "source": "ConfigParser.java:157"
        },
        {
          "method": "org.aspectj.util.ConfigParser.parseCommandLine",
          "source": "ConfigParser.java:35"
        },
        {
          "method": "org.aspectj.ajdt.ajc.BuildArgParser.genBuildConfig",
          "source": "BuildArgParser.jav a:109"
        },
        {
          "method": "org.aspectj.ajdt.ajc.BuildArgParser.genBuildConfig",
          "source": "BuildArgParser.jav a:88"
        },
        {
          "method": "org.aspectj.ajdt.ajc.AjdtCommand.genBuildConfig",
          "source": "AjdtCommand.java:131"
        },
        {
          "method": "org.aspectj.ajdt.ajc.AjdtCommand.doCommand",
          "source": "AjdtCommand.java:89"
        },
        {
          "method": "org.aspectj.ajdt.ajc.AjdtCommand.runCommand",
          "source": "AjdtCommand.java:53"
        },
        {
          "method": "org.aspectj.tools.ajc.Main.run",
          "source": "Main.java:217"
        },
        {
          "method": "org.aspectj.tools.ajc.Main.runMain",
          "source": "Main.java:155"
        },
        {
          "method": "org.aspectj.tools.ajc.Main.main",
          "source": "Main.java:72"
        }
      ],
      "number": 0,
      "commentIndex": 0,
      "bugId": "49814",
      "date": "2004-01-10T22:46:43+01:00",
      "product": "AspectJ",
      "component": "Compiler",
      "severity": "trivial"
    }
  ],
  "groupId": "49814",
  "bugId": "49814",
  "date": "2004-01-10T22:46:43+01:00",
  "product": "AspectJ",
  "component": "Compiler",
  "severity": "trivial"
}