{
  "comments": [
    "In our application, we create a temporary project in which to store\ntemporary objects while Eclipse is active.  Just before Eclipse shuts down\nwe delete all the data in the temporary project and then delete the\nproject itself.  All appears well and the .project file is deleted.\n\nOne of several code snippets we have tried is below:\n\npublic void shutdown() throws CoreException {\n            \n            // Delete the temporary project\n\n            IWorkspaceRoot root \u003d SclmPlugin.getWorkspace().getRoot();\n\n            final IProject project \u003d root.getProject(Constants.TEMP_PROJECT);\n           \n            project.delete(true, true, null);\n            super.shutdown();\n    \n    }\n\nHowever, when we restart Eclipse, we get the following exception:\n\norg.eclipse.core.internal.resources.ResourceException: The project description \nfile (.project) for sclmawb is missing.  This file contains important \ninformation about the project.  The project will not function properly until \nthis file is restored.\n\n      at org.eclipse.core.internal.localstore.FileSystemResourceManager.read\n(FileSystemResourceManager.java:443)\n\n      at org.eclipse.core.internal.resources.SaveManager.restoreMetaInfo\n(SaveManager.java:582)\n\n      at org.eclipse.core.internal.resources.SaveManager.restore\n(SaveManager.java:461)\n\n      at org.eclipse.core.internal.resources.Project.open(Project.java:689)\n\n      at com.rocketsoftware.auz.sclmui.actions.OpenProject.run\n(OpenProject.java:229)\n\n      at com.rocketsoftware.auz.rse.actions.ProxyAction.run\n(ProxyAction.java:411)\n\n      at com.rocketsoftware.auz.rse.actions.ProxyAction.run\n(ProxyAction.java:174)\n\n      at \ncom.rocketsoftware.auz.rse.model.ProjectResourceAdapter.handleDoubleClick\n(ProjectResourceAdapter.java:306)\n\n      at com.ibm.etools.systems.core.ui.view.SystemView.handleDoubleClick\n(SystemView.java:336)\n\n      at com.ibm.etools.systems.core.ui.view.SystemView.access$000\n(SystemView.java:36)\n\n      at com.ibm.etools.systems.core.ui.view.SystemView$1.doubleClick\n(SystemView.java:267)\n\n      at org.eclipse.jface.viewers.StructuredViewer$1.run\n(StructuredViewer.java:372)\n\n\nI suspect it is a result of something we did, or didn\u0027t do.  Any suggestions\nwould be appreciated.",
    "This bug must have gone unnoticed.  You shouldn\u0027t be deleting the .project file\nbefore deleting the project. Simply deleting the project from within Eclipse\nwill also delete all of the project\u0027s contents."
  ],
  "commentCreationDates": [
    "2004-02-09T15:22:38+01:00",
    "2004-11-08T21:40:24+01:00"
  ],
  "traces": [
    {
      "exceptionType": "org.eclipse.core.internal.resources.ResourceException",
      "message": "The project description  file (.project) for sclmawb is missing.  This file contains important  information about the project.  The project will not function properly until  this file is restored.",
      "elements": [
        {
          "method": "org.eclipse.core.internal.localstore.FileSystemResourceManager.read",
          "source": "FileSystemResourceManager.java:443"
        },
        {
          "method": "org.eclipse.core.internal.resources.SaveManager.restoreMetaInfo",
          "source": "SaveManager.java:582"
        },
        {
          "method": "org.eclipse.core.internal.resources.SaveManager.restore",
          "source": "SaveManager.java:461"
        },
        {
          "method": "org.eclipse.core.internal.resources.Project.open",
          "source": "Project.java:689"
        },
        {
          "method": "com.rocketsoftware.auz.sclmui.actions.OpenProject.run",
          "source": "OpenProject.java:229"
        },
        {
          "method": "com.rocketsoftware.auz.rse.actions.ProxyAction.run",
          "source": "ProxyAction.java:411"
        },
        {
          "method": "com.rocketsoftware.auz.rse.actions.ProxyAction.run",
          "source": "ProxyAction.java:174"
        },
        {
          "method": "com.rocketsoftware.auz.rse.model.ProjectResourceAdapter.handleDoubleClick",
          "source": "ProjectResourceAdapter.java:306"
        },
        {
          "method": "com.ibm.etools.systems.core.ui.view.SystemView.handleDoubleClick",
          "source": "SystemView.java:336"
        },
        {
          "method": "com.ibm.etools.systems.core.ui.view.SystemView.access$000",
          "source": "SystemView.java:36"
        },
        {
          "method": "com.ibm.etools.systems.core.ui.view.SystemView$1.doubleClick",
          "source": "SystemView.java:267"
        },
        {
          "method": "org.eclipse.jface.viewers.StructuredViewer$1.run",
          "source": "StructuredViewer.java:372"
        }
      ],
      "number": 0,
      "commentIndex": 0,
      "bugId": "51362",
      "date": "2004-02-09T15:22:38+01:00",
      "product": "Platform",
      "component": "Resources",
      "severity": "normal"
    }
  ],
  "groupId": "51362",
  "bugId": "51362",
  "date": "2004-02-09T15:22:38+01:00",
  "product": "Platform",
  "component": "Resources",
  "severity": "normal"
}