{
  "comments": [
    "Build 200402100800\n\nGot the following exception starting up a I20040205 workspace with \nI200402100800:\n\n!ENTRY org.eclipse.core.runtime 4 1 Feb 10, 2004 18:16:56.614\n!MESSAGE Plug-in org.eclipse.team.cvs.ui was unable to load class \norg.eclipse.team.internal.ccvs.ui.CVSLightweightDecorator.\n!STACK 0\norg.osgi.framework.BundleException: Exception in \norg.eclipse.core.internal.compatibility.PluginActivator.start()\n        at org.eclipse.osgi.framework.internal.core.BundleContext.startActivator\n(BundleContext.java:1071)\n        at org.eclipse.osgi.framework.internal.core.BundleContext.start\n(BundleContext.java:991)\n        at org.eclipse.osgi.framework.internal.core.BundleHost.startWorker\n(BundleHost.java:403)\n        at org.eclipse.osgi.framework.internal.core.Bundle.start\n(Bundle.java:312)\n        at \norg.eclipse.core.internal.registry.ConfigurationElement.createExecutableExtensio\nn(ConfigurationElement.java:133)\n        at \norg.eclipse.core.internal.registry.ConfigurationElement.createExecutableExtensio\nn(ConfigurationElement.java:125)\n        at \norg.eclipse.core.internal.registry.ConfigurationElement.createExecutableExtensio\nn(ConfigurationElement.java:114)\n        at org.eclipse.ui.internal.WorkbenchPlugin$1.run\n(WorkbenchPlugin.java:171)\n        at org.eclipse.swt.custom.BusyIndicator.showWhile(BusyIndicator.java:51)\n        at org.eclipse.ui.internal.WorkbenchPlugin.createExtension\n(WorkbenchPlugin.java:168)\n        at \norg.eclipse.ui.internal.decorators.LightweightDecoratorDefinition$1.run\n(LightweightDecoratorDefinition.java:83)\n        at org.eclipse.core.internal.runtime.InternalPlatform.run\n(InternalPlatform.java:819)\n        at org.eclipse.core.runtime.Platform.run(Platform.java:483)\n        at \norg.eclipse.ui.internal.decorators.LightweightDecoratorDefinition.internalGetDec\norator(LightweightDecoratorDefinition.java:79)\n        at \norg.eclipse.ui.internal.decorators.LightweightDecoratorDefinition.decorate\n(LightweightDecoratorDefinition.java:153)\n        at \norg.eclipse.ui.internal.decorators.LightweightDecoratorManager$LightweightRunnab\nle.run(LightweightDecoratorManager.java:59)\n        at org.eclipse.core.internal.runtime.InternalPlatform.run\n(InternalPlatform.java:819)\n        at org.eclipse.core.runtime.Platform.run(Platform.java:483)\n        at \norg.eclipse.ui.internal.decorators.LightweightDecoratorManager.decorate\n(LightweightDecoratorManager.java:245)\n        at \norg.eclipse.ui.internal.decorators.LightweightDecoratorManager.getDecorations\n(LightweightDecoratorManager.java:228)\n        at org.eclipse.ui.internal.decorators.DecorationScheduler$1.run\n(DecorationScheduler.java:245)\n        at org.eclipse.core.internal.jobs.Worker.run(Worker.java:62)\nNested exception:\norg.eclipse.swt.SWTException: Invalid thread access\n        at org.eclipse.swt.SWT.error(SWT.java:2608)\n        at org.eclipse.swt.SWT.error(SWT.java:2538)\n        at org.eclipse.swt.widgets.Widget.error(Widget.java:377)\n        at org.eclipse.swt.widgets.Shell.\u003cinit\u003e(Shell.java:245)\n        at org.eclipse.swt.widgets.Shell.\u003cinit\u003e(Shell.java:236)\n        at org.eclipse.swt.widgets.Shell.\u003cinit\u003e(Shell.java:189)\n        at org.eclipse.swt.widgets.Shell.\u003cinit\u003e(Shell.java:127)\n        at org.eclipse.jface.resource.FontRegistry.defaultFont\n(FontRegistry.java:293)\n        at org.eclipse.jface.resource.FontRegistry.get(FontRegistry.java:370)\n        at org.eclipse.team.internal.ccvs.ui.console.CVSOutputConsole.\u003cinit\u003e\n(CVSOutputConsole.java:78)\n        at org.eclipse.team.internal.ccvs.ui.CVSUIPlugin.startup\n(CVSUIPlugin.java:683)\n        at org.eclipse.core.internal.compatibility.PluginActivator.start\n(PluginActivator.java:49)\n        at org.eclipse.osgi.framework.internal.core.BundleContext$1.run\n(BundleContext.java:1054)\n        at java.security.AccessController.doPrivileged(Native Method)\n        at org.eclipse.osgi.framework.internal.core.BundleContext.startActivator\n(BundleContext.java:1050)\n        at org.eclipse.osgi.framework.internal.core.BundleContext.start\n(BundleContext.java:991)\n        at org.eclipse.osgi.framework.internal.core.BundleHost.startWorker\n(BundleHost.java:403)\n        at org.eclipse.osgi.framework.internal.core.Bundle.start\n(Bundle.java:312)\n        at \norg.eclipse.core.internal.registry.ConfigurationElement.createExecutableExtensio\nn(ConfigurationElement.java:133)\n        at \norg.eclipse.core.internal.registry.ConfigurationElement.createExecutableExtensio\nn(ConfigurationElement.java:125)\n        at \norg.eclipse.core.internal.registry.ConfigurationElement.createExecutableExtensio\nn(ConfigurationElement.java:114)\n        at org.eclipse.ui.internal.WorkbenchPlugin$1.run\n(WorkbenchPlugin.java:171)\n        at org.eclipse.swt.custom.BusyIndicator.showWhile(BusyIndicator.java:51)\n        at org.eclipse.ui.internal.WorkbenchPlugin.createExtension\n(WorkbenchPlugin.java:168)\n        at \norg.eclipse.ui.internal.decorators.LightweightDecoratorDefinition$1.run\n(LightweightDecoratorDefinition.java:83)\n        at org.eclipse.core.internal.runtime.InternalPlatform.run\n(InternalPlatform.java:819)\n        at org.eclipse.core.runtime.Platform.run(Platform.java:483)\n        at \norg.eclipse.ui.internal.decorators.LightweightDecoratorDefinition.internalGetDec\norator(LightweightDecoratorDefinition.java:79)\n        at \norg.eclipse.ui.internal.decorators.LightweightDecoratorDefinition.decorate\n(LightweightDecoratorDefinition.java:153)\n        at \norg.eclipse.ui.internal.decorators.LightweightDecoratorManager$LightweightRunnab\nle.run(LightweightDecoratorManager.java:59)\n        at org.eclipse.core.internal.runtime.InternalPlatform.run\n(InternalPlatform.java:819)\n        at org.eclipse.core.runtime.Platform.run(Platform.java:483)\n        at \norg.eclipse.ui.internal.decorators.LightweightDecoratorManager.decorate\n(LightweightDecoratorManager.java:245)\n        at \norg.eclipse.ui.internal.decorators.LightweightDecoratorManager.getDecorations\n(LightweightDecoratorManager.java:228)\n        at org.eclipse.ui.internal.decorators.DecorationScheduler$1.run\n(DecorationScheduler.java:245)\n        at org.eclipse.core.internal.jobs.Worker.run(Worker.java:62)",
    "\n\n*** This bug has been marked as a duplicate of 51473 ***"
  ],
  "commentCreationDates": [
    "2004-02-10T17:30:51+01:00",
    "2004-02-10T17:43:08+01:00"
  ],
  "traces": [
    {
      "exceptionType": "org.osgi.framework.BundleException",
      "message": "Exception in  org.eclipse.core.internal.compatibility.PluginActivator.start()",
      "elements": [
        {
          "method": "org.eclipse.osgi.framework.internal.core.BundleContext.startActivator",
          "source": "BundleContext.java:1071"
        },
        {
          "method": "org.eclipse.osgi.framework.internal.core.BundleContext.start",
          "source": "BundleContext.java:991"
        },
        {
          "method": "org.eclipse.osgi.framework.internal.core.BundleHost.startWorker",
          "source": "BundleHost.java:403"
        },
        {
          "method": "org.eclipse.osgi.framework.internal.core.Bundle.start",
          "source": "Bundle.java:312"
        },
        {
          "method": "org.eclipse.core.internal.registry.ConfigurationElement.createExecutableExtension",
          "source": "ConfigurationElement.java:133"
        },
        {
          "method": "org.eclipse.core.internal.registry.ConfigurationElement.createExecutableExtension",
          "source": "ConfigurationElement.java:125"
        },
        {
          "method": "org.eclipse.core.internal.registry.ConfigurationElement.createExecutableExtension",
          "source": "ConfigurationElement.java:114"
        },
        {
          "method": "org.eclipse.ui.internal.WorkbenchPlugin$1.run",
          "source": "WorkbenchPlugin.java:171"
        },
        {
          "method": "org.eclipse.swt.custom.BusyIndicator.showWhile",
          "source": "BusyIndicator.java:51"
        },
        {
          "method": "org.eclipse.ui.internal.WorkbenchPlugin.createExtension",
          "source": "WorkbenchPlugin.java:168"
        },
        {
          "method": "org.eclipse.ui.internal.decorators.LightweightDecoratorDefinition$1.run",
          "source": "LightweightDecoratorDefinition.java:83"
        },
        {
          "method": "org.eclipse.core.internal.runtime.InternalPlatform.run",
          "source": "InternalPlatform.java:819"
        },
        {
          "method": "org.eclipse.core.runtime.Platform.run",
          "source": "Platform.java:483"
        },
        {
          "method": "org.eclipse.ui.internal.decorators.LightweightDecoratorDefinition.internalGetDecorator",
          "source": "LightweightDecoratorDefinition.java:79"
        },
        {
          "method": "org.eclipse.ui.internal.decorators.LightweightDecoratorDefinition.decorate",
          "source": "LightweightDecoratorDefinition.java:153"
        },
        {
          "method": "org.eclipse.ui.internal.decorators.LightweightDecoratorManager$LightweightRunnable.run",
          "source": "LightweightDecoratorManager.java:59"
        },
        {
          "method": "org.eclipse.core.internal.runtime.InternalPlatform.run",
          "source": "InternalPlatform.java:819"
        },
        {
          "method": "org.eclipse.core.runtime.Platform.run",
          "source": "Platform.java:483"
        },
        {
          "method": "org.eclipse.ui.internal.decorators.LightweightDecoratorManager.decorate",
          "source": "LightweightDecoratorManager.java:245"
        },
        {
          "method": "org.eclipse.ui.internal.decorators.LightweightDecoratorManager.getDecorations",
          "source": "LightweightDecoratorManager.java:228"
        },
        {
          "method": "org.eclipse.ui.internal.decorators.DecorationScheduler$1.run",
          "source": "DecorationScheduler.java:245"
        },
        {
          "method": "org.eclipse.core.internal.jobs.Worker.run",
          "source": "Worker.java:62"
        }
      ],
      "number": 0,
      "commentIndex": 0,
      "bugId": "51491",
      "duplicateId": "51473",
      "date": "2004-02-10T17:30:51+01:00",
      "product": "Platform",
      "component": "CVS",
      "severity": "normal"
    },
    {
      "exceptionType": "org.eclipse.swt.SWTException",
      "message": "Invalid thread access",
      "elements": [
        {
          "method": "org.eclipse.swt.SWT.error",
          "source": "SWT.java:2608"
        },
        {
          "method": "org.eclipse.swt.SWT.error",
          "source": "SWT.java:2538"
        },
        {
          "method": "org.eclipse.swt.widgets.Widget.error",
          "source": "Widget.java:377"
        },
        {
          "method": "org.eclipse.swt.widgets.Shell.\u003cinit\u003e",
          "source": "Shell.java:245"
        },
        {
          "method": "org.eclipse.swt.widgets.Shell.\u003cinit\u003e",
          "source": "Shell.java:236"
        },
        {
          "method": "org.eclipse.swt.widgets.Shell.\u003cinit\u003e",
          "source": "Shell.java:189"
        },
        {
          "method": "org.eclipse.swt.widgets.Shell.\u003cinit\u003e",
          "source": "Shell.java:127"
        },
        {
          "method": "org.eclipse.jface.resource.FontRegistry.defaultFont",
          "source": "FontRegistry.java:293"
        },
        {
          "method": "org.eclipse.jface.resource.FontRegistry.get",
          "source": "FontRegistry.java:370"
        },
        {
          "method": "org.eclipse.team.internal.ccvs.ui.console.CVSOutputConsole.\u003cinit\u003e",
          "source": "CVSOutputConsole.java:78"
        },
        {
          "method": "org.eclipse.team.internal.ccvs.ui.CVSUIPlugin.startup",
          "source": "CVSUIPlugin.java:683"
        },
        {
          "method": "org.eclipse.core.internal.compatibility.PluginActivator.start",
          "source": "PluginActivator.java:49"
        },
        {
          "method": "org.eclipse.osgi.framework.internal.core.BundleContext$1.run",
          "source": "BundleContext.java:1054"
        },
        {
          "method": "java.security.AccessController.doPrivileged",
          "source": "Native Method"
        },
        {
          "method": "org.eclipse.osgi.framework.internal.core.BundleContext.startActivator",
          "source": "BundleContext.java:1050"
        },
        {
          "method": "org.eclipse.osgi.framework.internal.core.BundleContext.start",
          "source": "BundleContext.java:991"
        },
        {
          "method": "org.eclipse.osgi.framework.internal.core.BundleHost.startWorker",
          "source": "BundleHost.java:403"
        },
        {
          "method": "org.eclipse.osgi.framework.internal.core.Bundle.start",
          "source": "Bundle.java:312"
        },
        {
          "method": "org.eclipse.core.internal.registry.ConfigurationElement.createExecutableExtension",
          "source": "ConfigurationElement.java:133"
        },
        {
          "method": "org.eclipse.core.internal.registry.ConfigurationElement.createExecutableExtension",
          "source": "ConfigurationElement.java:125"
        },
        {
          "method": "org.eclipse.core.internal.registry.ConfigurationElement.createExecutableExtension",
          "source": "ConfigurationElement.java:114"
        },
        {
          "method": "org.eclipse.ui.internal.WorkbenchPlugin$1.run",
          "source": "WorkbenchPlugin.java:171"
        },
        {
          "method": "org.eclipse.swt.custom.BusyIndicator.showWhile",
          "source": "BusyIndicator.java:51"
        },
        {
          "method": "org.eclipse.ui.internal.WorkbenchPlugin.createExtension",
          "source": "WorkbenchPlugin.java:168"
        },
        {
          "method": "org.eclipse.ui.internal.decorators.LightweightDecoratorDefinition$1.run",
          "source": "LightweightDecoratorDefinition.java:83"
        },
        {
          "method": "org.eclipse.core.internal.runtime.InternalPlatform.run",
          "source": "InternalPlatform.java:819"
        },
        {
          "method": "org.eclipse.core.runtime.Platform.run",
          "source": "Platform.java:483"
        },
        {
          "method": "org.eclipse.ui.internal.decorators.LightweightDecoratorDefinition.internalGetDecorator",
          "source": "LightweightDecoratorDefinition.java:79"
        },
        {
          "method": "org.eclipse.ui.internal.decorators.LightweightDecoratorDefinition.decorate",
          "source": "LightweightDecoratorDefinition.java:153"
        },
        {
          "method": "org.eclipse.ui.internal.decorators.LightweightDecoratorManager$LightweightRunnable.run",
          "source": "LightweightDecoratorManager.java:59"
        },
        {
          "method": "org.eclipse.core.internal.runtime.InternalPlatform.run",
          "source": "InternalPlatform.java:819"
        },
        {
          "method": "org.eclipse.core.runtime.Platform.run",
          "source": "Platform.java:483"
        },
        {
          "method": "org.eclipse.ui.internal.decorators.LightweightDecoratorManager.decorate",
          "source": "LightweightDecoratorManager.java:245"
        },
        {
          "method": "org.eclipse.ui.internal.decorators.LightweightDecoratorManager.getDecorations",
          "source": "LightweightDecoratorManager.java:228"
        },
        {
          "method": "org.eclipse.ui.internal.decorators.DecorationScheduler$1.run",
          "source": "DecorationScheduler.java:245"
        },
        {
          "method": "org.eclipse.core.internal.jobs.Worker.run",
          "source": "Worker.java:62"
        }
      ],
      "number": 1,
      "commentIndex": 0,
      "bugId": "51491",
      "duplicateId": "51473",
      "date": "2004-02-10T17:30:51+01:00",
      "product": "Platform",
      "component": "CVS",
      "severity": "normal"
    }
  ],
  "groupId": "51473",
  "bugId": "51491",
  "duplicateId": "51473",
  "date": "2004-02-10T17:30:51+01:00",
  "product": "Platform",
  "component": "CVS",
  "severity": "normal"
}