{
  "comments": [
    "We get the following exception loading snippets view (depends on palette) \nfrom of M7 based WSWB build. \nIt goes away once \n\u003cimport plugin\u003d\"org.eclipse.core.runtime.compatibility\"/\u003e\nis added as a pre-req. \n\n[It seems GEF needs a 3.0 version added to bugzilla site!?]\n\n\n\u003d\u003d\u003d\u003d\u003d top of stack only \u003d\u003d\u003d\u003d\u003d \norg.osgi.framework.BundleException: The BundleActivator org.eclipse.gef.GEFPlugi\nn is invalid\n        at org.eclipse.osgi.framework.internal.core.Bundle.loadBundleActivator(B\nundle.java:176)\n        at org.eclipse.osgi.framework.internal.core.BundleContext.start(BundleCo\nntext.java:987)\n        at org.eclipse.osgi.framework.internal.core.BundleHost.startWorker(Bundl\neHost.java:403)\n        at org.eclipse.osgi.framework.internal.core.Bundle.start(Bundle.java:312\n)\n        at org.eclipse.core.runtime.adaptor.EclipseClassLoader.findLocalClass(Ec\nlipseClassLoader.java:58)\n        at org.eclipse.osgi.framework.internal.core.BundleLoader.findLocalClass(\nBundleLoader.java:326)\n        at org.eclipse.osgi.framework.internal.core.BundleLoader.requireClass(Bu\nndleLoader.java:291)\n        at org.eclipse.osgi.framework.internal.core.BundleLoader.findRequiredCla\nss(BundleLoader.java:915)\n        at org.eclipse.osgi.framework.internal.core.BundleLoader.findClass(Bundl\neLoader.java:352)\n        at org.eclipse.osgi.framework.adaptor.BundleClassLoader.loadClass(Bundle\nClassLoader.java:115)",
    "We made this change a few weeks ago, so we just need to change the wswb3.txt \nfile to use newer GEF builds.\n\n*** This bug has been marked as a duplicate of 51563 ***"
  ],
  "commentCreationDates": [
    "2004-02-16T07:23:11+01:00",
    "2004-02-16T16:56:59+01:00"
  ],
  "traces": [
    {
      "exceptionType": "org.osgi.framework.BundleException",
      "message": "The BundleActivator org.eclipse.gef.GEFPlugi n is invalid",
      "elements": [
        {
          "method": "org.eclipse.osgi.framework.internal.core.Bundle.loadBundleActivator",
          "source": "B undle.java:176"
        },
        {
          "method": "org.eclipse.osgi.framework.internal.core.BundleContext.start",
          "source": "BundleCo ntext.java:987"
        },
        {
          "method": "org.eclipse.osgi.framework.internal.core.BundleHost.startWorker",
          "source": "Bundl eHost.java:403"
        },
        {
          "method": "org.eclipse.osgi.framework.internal.core.Bundle.start",
          "source": "Bundle.java:312 "
        },
        {
          "method": "org.eclipse.core.runtime.adaptor.EclipseClassLoader.findLocalClass",
          "source": "Ec lipseClassLoader.java:58"
        },
        {
          "method": "org.eclipse.osgi.framework.internal.core.BundleLoader.findLocalClass",
          "source": " BundleLoader.java:326"
        },
        {
          "method": "org.eclipse.osgi.framework.internal.core.BundleLoader.requireClass",
          "source": "Bu ndleLoader.java:291"
        },
        {
          "method": "org.eclipse.osgi.framework.internal.core.BundleLoader.findRequiredClass",
          "source": "BundleLoader.java:915"
        },
        {
          "method": "org.eclipse.osgi.framework.internal.core.BundleLoader.findClass",
          "source": "Bundl eLoader.java:352"
        },
        {
          "method": "org.eclipse.osgi.framework.adaptor.BundleClassLoader.loadClass",
          "source": "Bundle ClassLoader.java:115"
        }
      ],
      "number": 0,
      "commentIndex": 0,
      "bugId": "52124",
      "duplicateId": "51563",
      "date": "2004-02-16T07:23:11+01:00",
      "product": "GEF",
      "component": "GEF",
      "severity": "blocker"
    }
  ],
  "groupId": "51563",
  "bugId": "52124",
  "duplicateId": "51563",
  "date": "2004-02-16T07:23:11+01:00",
  "product": "GEF",
  "component": "GEF",
  "severity": "blocker"
}