{
  "comments": [
    "Eclipse Version : Eclipse 3.0 M6 HPUX (9000/motif) version\n\nJDK Version : java version \"1.4.1.00\"\n              Java(TM) 2 Runtime Environment, Standard Edition \n              (build 1.4.1.00-030116-09:58)\n              Java HotSpot(TM) Server VM (build 1.4.1 1.4.1.00-030116-11:27-   \n              PA_RISC2.0 PA2.0, mixed mode)\n \n\nAfter installing this build, I tried executing eclipse and resulted in the \nfollowing error in my log file. I tried the various options which various \npeople in the newsgroup suggested like deleting .config folder or providing -vm \narguments in the command line. \n\nSomebody has suggested installing this eclipse in the root user. But I could \nnot buy the argument as everyone will not get the super user password in an HP-\nUX box or any box for that matter. Is there any work around for this problem? \nIs it a bug?\n\nException that appears in the log file:\n\n!SESSION ----------------------------------------------------------------------\n!ENTRY org.eclipse.core.launcher 4 0 Feb 17, 2004 19:47:55.774\n!MESSAGE Exception launching the Eclipse Platform:\n!STACK\njava.lang.IllegalStateException: Unable to acquire application service\n\tat org.eclipse.core.runtime.adaptor.EclipseStarter.run\n(EclipseStarter.java:84)\n\tat sun.reflect.NativeMethodAccessorImpl.invoke0(Native Method)\n\tat sun.reflect.NativeMethodAccessorImpl.invoke\n(NativeMethodAccessorImpl.java:39)\n\tat sun.reflect.DelegatingMethodAccessorImpl.invoke\n(DelegatingMethodAccessorImpl.java:25)\n\tat java.lang.reflect.Method.invoke(Method.java:324)\n\tat org.eclipse.core.launcher.Main.basicRun(Main.java:279)\n\tat org.eclipse.core.launcher.Main.run(Main.java:742)\n\tat org.eclipse.core.launcher.Main.main(Main.java:581)\n\n\nThanks \u0026 Regard\nBalasubramaniyan K",
    "This is probably a duplicate of bug 44487 (a bug in the HP VM). A clearer error\nmessage is available since 3.0 M7.\n\nPlease try the workaround described in bug 44487 comment 2. Reopen this bug if\nit does not solve your problem.\n\n*** This bug has been marked as a duplicate of 44487 ***"
  ],
  "commentCreationDates": [
    "2004-02-17T15:09:43+01:00",
    "2004-02-17T17:13:10+01:00"
  ],
  "traces": [
    {
      "exceptionType": "java.lang.IllegalStateException",
      "message": "Unable to acquire application service",
      "elements": [
        {
          "method": "org.eclipse.core.runtime.adaptor.EclipseStarter.run",
          "source": "EclipseStarter.java:84"
        },
        {
          "method": "sun.reflect.NativeMethodAccessorImpl.invoke0",
          "source": "Native Method"
        },
        {
          "method": "sun.reflect.NativeMethodAccessorImpl.invoke",
          "source": "NativeMethodAccessorImpl.java:39"
        },
        {
          "method": "sun.reflect.DelegatingMethodAccessorImpl.invoke",
          "source": "DelegatingMethodAccessorImpl.java:25"
        },
        {
          "method": "java.lang.reflect.Method.invoke",
          "source": "Method.java:324"
        },
        {
          "method": "org.eclipse.core.launcher.Main.basicRun",
          "source": "Main.java:279"
        },
        {
          "method": "org.eclipse.core.launcher.Main.run",
          "source": "Main.java:742"
        },
        {
          "method": "org.eclipse.core.launcher.Main.main",
          "source": "Main.java:581"
        }
      ],
      "number": 0,
      "commentIndex": 0,
      "bugId": "52251",
      "duplicateId": "44487",
      "date": "2004-02-17T15:09:43+01:00",
      "product": "Platform",
      "component": "Resources",
      "severity": "critical"
    }
  ],
  "groupId": "44735",
  "bugId": "52251",
  "duplicateId": "44487",
  "date": "2004-02-17T15:09:43+01:00",
  "product": "Platform",
  "component": "Resources",
  "severity": "critical"
}