{
  "comments": [
    "build I20040323-0800\n\nWhile refactoring some code, the editor wasn\u0027t always updating the red squiggles.\nSteps were typically like:\n- wanted to move some code in a method m from WorkbenchWindow to\nPerspectiveBarManager\n- cut old code in m\n- type perspectiveBar.m(...)\n- use Ctrl+1 to create m in PerspectiveBarManager\n- paste the code into the new m in PerspectiveBarManager and fix it up\n- Ctrl+F6 to switch back to WorkbenchWindow\n- it still complains about PerspectiveBarManager.m being undefined\n- type a character\n- the error gets cleared\n\n\nNoticed the following in my console, which may be related.\n\njava.lang.NullPointerException\n        at\norg.eclipse.jdt.internal.ui.javaeditor.ASTProvider.reconciled(ASTProvider.java:413)\n        at\norg.eclipse.jdt.internal.ui.javaeditor.CompilationUnitEditor.reconciled(CompilationUnitEditor.java:1530)\n        at\norg.eclipse.jdt.internal.ui.text.java.JavaReconcilingStrategy.reconcile(JavaReconcilingStrategy.java:101)\n        at\norg.eclipse.jdt.internal.ui.text.java.JavaReconcilingStrategy.initialReconcile(JavaReconcilingStrategy.java:143)\n        at\norg.eclipse.jface.text.reconciler.CompositeReconcilingStrategy.initialReconcile(CompositeReconcilingStrategy.java:111\n)\n        at\norg.eclipse.jdt.internal.ui.text.JavaCompositeReconcilingStrategy.initialReconcile(JavaCompositeReconcilingStrategy.j\nava:123)\n        at\norg.eclipse.jface.text.reconciler.MonoReconciler.initialProcess(MonoReconciler.java:104)\n        at\norg.eclipse.jdt.internal.ui.text.JavaReconciler.initialProcess(JavaReconciler.java:280)\n        at\norg.eclipse.jface.text.reconciler.AbstractReconciler$BackgroundThread.run(AbstractReconciler.java:155)",
    "\n\n*** This bug has been marked as a duplicate of 55675 ***"
  ],
  "commentCreationDates": [
    "2004-03-23T21:53:02+01:00",
    "2004-03-23T21:57:19+01:00"
  ],
  "traces": [
    {
      "exceptionType": "java.lang.NullPointerException",
      "elements": [
        {
          "method": "org.eclipse.jdt.internal.ui.javaeditor.ASTProvider.reconciled",
          "source": "ASTProvider.java:413"
        },
        {
          "method": "org.eclipse.jdt.internal.ui.javaeditor.CompilationUnitEditor.reconciled",
          "source": "CompilationUnitEditor.java:1530"
        },
        {
          "method": "org.eclipse.jdt.internal.ui.text.java.JavaReconcilingStrategy.reconcile",
          "source": "JavaReconcilingStrategy.java:101"
        },
        {
          "method": "org.eclipse.jdt.internal.ui.text.java.JavaReconcilingStrategy.initialReconcile",
          "source": "JavaReconcilingStrategy.java:143"
        },
        {
          "method": "org.eclipse.jface.text.reconciler.CompositeReconcilingStrategy.initialReconcile",
          "source": "CompositeReconcilingStrategy.java:111 "
        },
        {
          "method": "org.eclipse.jdt.internal.ui.text.JavaCompositeReconcilingStrategy.initialReconcile",
          "source": "JavaCompositeReconcilingStrategy.j ava:123"
        },
        {
          "method": "org.eclipse.jface.text.reconciler.MonoReconciler.initialProcess",
          "source": "MonoReconciler.java:104"
        },
        {
          "method": "org.eclipse.jdt.internal.ui.text.JavaReconciler.initialProcess",
          "source": "JavaReconciler.java:280"
        },
        {
          "method": "org.eclipse.jface.text.reconciler.AbstractReconciler$BackgroundThread.run",
          "source": "AbstractReconciler.java:155"
        }
      ],
      "number": 0,
      "commentIndex": 0,
      "bugId": "55786",
      "duplicateId": "55675",
      "date": "2004-03-23T21:53:02+01:00",
      "product": "JDT",
      "component": "Text",
      "severity": "major"
    }
  ],
  "groupId": "55675",
  "bugId": "55786",
  "duplicateId": "55675",
  "date": "2004-03-23T21:53:02+01:00",
  "product": "JDT",
  "component": "Text",
  "severity": "major"
}