{
  "comments": [
    "build i0324:0800\nwinxp\njdk1.4.2\nreleng tool 3.0.3\n\n- I was working in a branch for 2 projects (runtime, runtime.tests)\n- I committed all my changes\n- I selected the 2 projects in the Navigator\n- choose \"Team -\u003e Release\" from the context menu\n- it worked away for a while and then I got the following exceptions.\n\nThis is bad because:\n- I don\u0027t know how far the operation went\n- it didn\u0027t bring up the core.map file so I know it didn\u0027t completely finish\n\nI tagged (moving if necessary) manually to work around this and then edited the\ncore.map file manually.\n\nMarked as major if we believe people should be using the releng tool for releasing.\n\nosgi\u003e !SESSION Mar 24, 2004 19:32:06.367 ---------------------------------------\n------\njava.version\u003d1.4.2\njava.vendor\u003dSun Microsystems Inc.\nBootLoader constants: OS\u003dwin32, ARCH\u003dx86, WS\u003dwin32, NL\u003den_US\nCommand-line arguments: -showlocation -vmargs -cp C:\\eclipse\\dev\\i0324-0800\\ecli\npse\\startup.jar org.eclipse.core.launcher.Main\n!ENTRY org.eclipse.ui 4 4 Mar 24, 2004 19:32:06.367\n!MESSAGE Unhandled event loop exception\nUnhandled event loop exception\nReason:\n!ENTRY org.eclipse.ui 4 0 Mar 24, 2004 19:32:06.387\n!MESSAGE Failed to execute runnable (java.lang.IllegalAccessError: tried to acce\nss method org.eclipse.team.internal.ccvs.ui.operations.CVSOperation.getShell()Lo\nrg/eclipse/swt/widgets/Shell; from class org.eclipse.releng.tools.TagAndReleaseO\nperation$1)\n!STACK 0\norg.eclipse.swt.SWTException: Failed to execute runnable (java.lang.IllegalAcces\nsError: tried to access method org.eclipse.team.internal.ccvs.ui.operations.CVSO\nperation.getShell()Lorg/eclipse/swt/widgets/Shell; from class org.eclipse.releng\n.tools.TagAndReleaseOperation$1)\n        at org.eclipse.swt.SWT.error(SWT.java:2625)\n        at org.eclipse.swt.widgets.Synchronizer.runAsyncMessages(Synchronizer.ja\nva:109)\n        at org.eclipse.swt.widgets.Display.runAsyncMessages(Display.java:2561)\n        at org.eclipse.swt.widgets.Display.readAndDispatch(Display.java:2266)\n        at org.eclipse.ui.internal.Workbench.runEventLoop(Workbench.java:1541)\n        at org.eclipse.ui.internal.Workbench.runUI(Workbench.java:1515)\n        at org.eclipse.ui.internal.Workbench.createAndRunWorkbench(Workbench.jav\na:257)\n        at org.eclipse.ui.PlatformUI.createAndRunWorkbench(PlatformUI.java:139)\n        at org.eclipse.ui.internal.ide.IDEApplication.run(IDEApplication.java:90\n)\n        at org.eclipse.core.internal.runtime.PlatformActivator$1.run(PlatformAct\nivator.java:288)\n        at org.eclipse.core.runtime.adaptor.EclipseStarter.run(EclipseStarter.ja\nva:232)\n        at org.eclipse.core.runtime.adaptor.EclipseStarter.run(EclipseStarter.ja\nva:116)\n        at sun.reflect.NativeMethodAccessorImpl.invoke0(Native Method)\n        at sun.reflect.NativeMethodAccessorImpl.invoke(NativeMethodAccessorImpl.\njava:39)\n        at sun.reflect.DelegatingMethodAccessorImpl.invoke(DelegatingMethodAcces\nsorImpl.java:25)\n        at java.lang.reflect.Method.invoke(Method.java:324)\n        at org.eclipse.core.launcher.Main.basicRun(Main.java:315)\n        at org.eclipse.core.launcher.Main.run(Main.java:740)\n        at org.eclipse.core.launcher.Main.main(Main.java:724)\nFailed to execute runnable (java.lang.IllegalAccessError: tried to access method\n org.eclipse.team.internal.ccvs.ui.operations.CVSOperation.getShell()Lorg/eclips\ne/swt/widgets/Shell; from class org.eclipse.releng.tools.TagAndReleaseOperation$\n1)\n!ENTRY org.eclipse.ui 4 4 Mar 24, 2004 19:32:06.407\n!MESSAGE *** SWT nested exception\n*** SWT nested exception\nReason:\n!ENTRY org.eclipse.ui 4 0 Mar 24, 2004 19:32:06.427\n!MESSAGE tried to access method org.eclipse.team.internal.ccvs.ui.operations.CVS\nOperation.getShell()Lorg/eclipse/swt/widgets/Shell; from class org.eclipse.relen\ng.tools.TagAndReleaseOperation$1\n!STACK 0\njava.lang.IllegalAccessError: tried to access method org.eclipse.team.internal.c\ncvs.ui.operations.CVSOperation.getShell()Lorg/eclipse/swt/widgets/Shell; from cl\nass org.eclipse.releng.tools.TagAndReleaseOperation$1\n        at org.eclipse.releng.tools.TagAndReleaseOperation$1.run(TagAndReleaseOp\neration.java:170)\n        at org.eclipse.swt.widgets.RunnableLock.run(RunnableLock.java:35)\n        at org.eclipse.swt.widgets.Synchronizer.runAsyncMessages(Synchronizer.ja\nva:106)\n        at org.eclipse.swt.widgets.Display.runAsyncMessages(Display.java:2561)\n        at org.eclipse.swt.widgets.Display.readAndDispatch(Display.java:2266)\n        at org.eclipse.ui.internal.Workbench.runEventLoop(Workbench.java:1541)\n        at org.eclipse.ui.internal.Workbench.runUI(Workbench.java:1515)\n        at org.eclipse.ui.internal.Workbench.createAndRunWorkbench(Workbench.jav\na:257)\n        at org.eclipse.ui.PlatformUI.createAndRunWorkbench(PlatformUI.java:139)\n        at org.eclipse.ui.internal.ide.IDEApplication.run(IDEApplication.java:90\n)\n        at org.eclipse.core.internal.runtime.PlatformActivator$1.run(PlatformAct\nivator.java:288)\n        at org.eclipse.core.runtime.adaptor.EclipseStarter.run(EclipseStarter.ja\nva:232)\n        at org.eclipse.core.runtime.adaptor.EclipseStarter.run(EclipseStarter.ja\nva:116)\n        at sun.reflect.NativeMethodAccessorImpl.invoke0(Native Method)\n        at sun.reflect.NativeMethodAccessorImpl.invoke(NativeMethodAccessorImpl.\njava:39)\n        at sun.reflect.DelegatingMethodAccessorImpl.invoke(DelegatingMethodAcces\nsorImpl.java:25)\n        at java.lang.reflect.Method.invoke(Method.java:324)\n        at org.eclipse.core.launcher.Main.basicRun(Main.java:315)\n        at org.eclipse.core.launcher.Main.run(Main.java:740)\n        at org.eclipse.core.launcher.Main.main(Main.java:724)\ntried to access method org.eclipse.team.internal.ccvs.ui.operations.CVSOperation\n.getShell()Lorg/eclipse/swt/widgets/Shell; from class org.eclipse.releng.tools.T\nagAndReleaseOperation$1",
    "Note I just got this again using the ibm VM and selecting 1 project in the\nworkspace.\n\nNote that the operation did seem to complete. I checked the contents of HEAD\nversus the tag and there were no differences. And the core.map file was updated\ncorrectly. So perhaps its just problems bringing the Synchronize window into view?",
    "I believe this is fixed in 3.0.4, however reassigning for verification.",
    "Fixed"
  ],
  "commentCreationDates": [
    "2004-03-25T00:42:13+01:00",
    "2004-03-25T20:41:18+01:00",
    "2004-03-29T21:27:51+02:00",
    "2005-04-28T19:03:31+02:00"
  ],
  "traces": [
    {
      "exceptionType": "sError",
      "message": "tried to access method org.eclipse.team.internal.ccvs.ui.operations.CVSO peration.getShell()Lorg/eclipse/swt/widgets/Shell; from class org.eclipse.releng .tools.TagAndReleaseOperation$1)",
      "elements": [
        {
          "method": "org.eclipse.swt.SWT.error",
          "source": "SWT.java:2625"
        },
        {
          "method": "org.eclipse.swt.widgets.Synchronizer.runAsyncMessages",
          "source": "Synchronizer.ja va:109"
        },
        {
          "method": "org.eclipse.swt.widgets.Display.runAsyncMessages",
          "source": "Display.java:2561"
        },
        {
          "method": "org.eclipse.swt.widgets.Display.readAndDispatch",
          "source": "Display.java:2266"
        },
        {
          "method": "org.eclipse.ui.internal.Workbench.runEventLoop",
          "source": "Workbench.java:1541"
        },
        {
          "method": "org.eclipse.ui.internal.Workbench.runUI",
          "source": "Workbench.java:1515"
        },
        {
          "method": "org.eclipse.ui.internal.Workbench.createAndRunWorkbench",
          "source": "Workbench.jav a:257"
        },
        {
          "method": "org.eclipse.ui.PlatformUI.createAndRunWorkbench",
          "source": "PlatformUI.java:139"
        },
        {
          "method": "org.eclipse.ui.internal.ide.IDEApplication.run",
          "source": "IDEApplication.java:90 "
        },
        {
          "method": "org.eclipse.core.internal.runtime.PlatformActivator$1.run",
          "source": "PlatformAct ivator.java:288"
        },
        {
          "method": "org.eclipse.core.runtime.adaptor.EclipseStarter.run",
          "source": "EclipseStarter.ja va:232"
        },
        {
          "method": "org.eclipse.core.runtime.adaptor.EclipseStarter.run",
          "source": "EclipseStarter.ja va:116"
        },
        {
          "method": "sun.reflect.NativeMethodAccessorImpl.invoke0",
          "source": "Native Method"
        },
        {
          "method": "sun.reflect.NativeMethodAccessorImpl.invoke",
          "source": "NativeMethodAccessorImpl. java:39"
        },
        {
          "method": "sun.reflect.DelegatingMethodAccessorImpl.invoke",
          "source": "DelegatingMethodAcces sorImpl.java:25"
        },
        {
          "method": "java.lang.reflect.Method.invoke",
          "source": "Method.java:324"
        },
        {
          "method": "org.eclipse.core.launcher.Main.basicRun",
          "source": "Main.java:315"
        },
        {
          "method": "org.eclipse.core.launcher.Main.run",
          "source": "Main.java:740"
        },
        {
          "method": "org.eclipse.core.launcher.Main.main",
          "source": "Main.java:724"
        }
      ],
      "number": 0,
      "commentIndex": 0,
      "bugId": "56077",
      "date": "2004-03-25T00:42:13+01:00",
      "product": "Platform",
      "component": "CVS",
      "severity": "major"
    },
    {
      "exceptionType": "java.lang.IllegalAccessError",
      "message": "tried to access method org.eclipse.team.internal.c cvs.ui.operations.CVSOperation.getShell()Lorg/eclipse/swt/widgets/Shell; from cl ass org.eclipse.releng.tools.TagAndReleaseOperation$1",
      "elements": [
        {
          "method": "org.eclipse.releng.tools.TagAndReleaseOperation$1.run",
          "source": "TagAndReleaseOp eration.java:170"
        },
        {
          "method": "org.eclipse.swt.widgets.RunnableLock.run",
          "source": "RunnableLock.java:35"
        },
        {
          "method": "org.eclipse.swt.widgets.Synchronizer.runAsyncMessages",
          "source": "Synchronizer.ja va:106"
        },
        {
          "method": "org.eclipse.swt.widgets.Display.runAsyncMessages",
          "source": "Display.java:2561"
        },
        {
          "method": "org.eclipse.swt.widgets.Display.readAndDispatch",
          "source": "Display.java:2266"
        },
        {
          "method": "org.eclipse.ui.internal.Workbench.runEventLoop",
          "source": "Workbench.java:1541"
        },
        {
          "method": "org.eclipse.ui.internal.Workbench.runUI",
          "source": "Workbench.java:1515"
        },
        {
          "method": "org.eclipse.ui.internal.Workbench.createAndRunWorkbench",
          "source": "Workbench.jav a:257"
        },
        {
          "method": "org.eclipse.ui.PlatformUI.createAndRunWorkbench",
          "source": "PlatformUI.java:139"
        },
        {
          "method": "org.eclipse.ui.internal.ide.IDEApplication.run",
          "source": "IDEApplication.java:90 "
        },
        {
          "method": "org.eclipse.core.internal.runtime.PlatformActivator$1.run",
          "source": "PlatformAct ivator.java:288"
        },
        {
          "method": "org.eclipse.core.runtime.adaptor.EclipseStarter.run",
          "source": "EclipseStarter.ja va:232"
        },
        {
          "method": "org.eclipse.core.runtime.adaptor.EclipseStarter.run",
          "source": "EclipseStarter.ja va:116"
        },
        {
          "method": "sun.reflect.NativeMethodAccessorImpl.invoke0",
          "source": "Native Method"
        },
        {
          "method": "sun.reflect.NativeMethodAccessorImpl.invoke",
          "source": "NativeMethodAccessorImpl. java:39"
        },
        {
          "method": "sun.reflect.DelegatingMethodAccessorImpl.invoke",
          "source": "DelegatingMethodAcces sorImpl.java:25"
        },
        {
          "method": "java.lang.reflect.Method.invoke",
          "source": "Method.java:324"
        },
        {
          "method": "org.eclipse.core.launcher.Main.basicRun",
          "source": "Main.java:315"
        },
        {
          "method": "org.eclipse.core.launcher.Main.run",
          "source": "Main.java:740"
        },
        {
          "method": "org.eclipse.core.launcher.Main.main",
          "source": "Main.java:724"
        }
      ],
      "number": 1,
      "commentIndex": 0,
      "bugId": "56077",
      "date": "2004-03-25T00:42:13+01:00",
      "product": "Platform",
      "component": "CVS",
      "severity": "major"
    }
  ],
  "groupId": "56077",
  "bugId": "56077",
  "date": "2004-03-25T00:42:13+01:00",
  "product": "Platform",
  "component": "CVS",
  "severity": "major"
}