{
  "comments": [
    "build i0330, winxp, sunjdk1.4.2\n\nI have a scrap book with the following line:\n  new org.eclipse.core.runtime.Path(\"\");\n\nI have my project reference org.eclipse.core.runtime in its build path.\n\nI have compile errors in org.eclipse.core.runtime (but nothing that will effect\nthe execution of this line.\n\nWhen I select the code and try to execute it, I am prompted saying that there\nare problems with a pre-req project, do I want to continue. If I select \"No\" I\nget the following NPE in my log and for the life-time of the editor, the\n\"inspect, display, execute\" actions in the context menu are disabled.\n\nClosing the editor and re-opening it enables the actions.\n\nUnhandled event loop exception\nReason:\n!ENTRY org.eclipse.ui 4 0 Apr 07, 2004 12:16:50.161\n!MESSAGE java.lang.NullPointerException\n!STACK 0\njava.lang.NullPointerException\n        at org.eclipse.jdt.internal.debug.ui.snippeteditor.ScrapbookLauncher.doL\naunch(ScrapbookLauncher.java:225)\n        at org.eclipse.jdt.internal.debug.ui.snippeteditor.ScrapbookLauncher.lau\nnch(ScrapbookLauncher.java:144)\n        at org.eclipse.jdt.internal.debug.ui.snippeteditor.JavaSnippetEditor$18.\nrun(JavaSnippetEditor.java:1210)\n        at org.eclipse.swt.custom.BusyIndicator.showWhile(BusyIndicator.java:84)\n\n        at org.eclipse.jdt.internal.debug.ui.snippeteditor.JavaSnippetEditor.lau\nnchVM(JavaSnippetEditor.java:1213)\n        at org.eclipse.jdt.internal.debug.ui.snippeteditor.JavaSnippetEditor.bui\nldAndLaunch(JavaSnippetEditor.java:399)\n        at org.eclipse.jdt.internal.debug.ui.snippeteditor.JavaSnippetEditor.eva\nlSelection(JavaSnippetEditor.java:325)\n        at org.eclipse.jdt.internal.debug.ui.actions.ExecuteAction.run(ExecuteAc\ntion.java:49)\n        at org.eclipse.jdt.internal.debug.ui.actions.EvaluateAction.run(Evaluate\nAction.java:565)\n        at org.eclipse.ui.internal.PluginAction.runWithEvent(PluginAction.java:2\n69)\n        at org.eclipse.jface.action.ActionContributionItem.handleWidgetSelection\n(ActionContributionItem.java:550)\n        at org.eclipse.jface.action.ActionContributionItem.access$2(ActionContri\nbutionItem.java:502)\n        at org.eclipse.jface.action.ActionContributionItem$5.handleEvent(ActionC\nontributionItem.java:435)\n        at org.eclipse.swt.widgets.EventTable.sendEvent(EventTable.java:82)\n        at org.eclipse.swt.widgets.Widget.sendEvent(Widget.java:769)\n        at org.eclipse.swt.widgets.Display.runDeferredEvents(Display.java:2586)\n        at org.eclipse.swt.widgets.Display.readAndDispatch(Display.java:2264)\n        at org.eclipse.ui.internal.Workbench.runEventLoop(Workbench.java:1558)\n        at org.eclipse.ui.internal.Workbench.runUI(Workbench.java:1532)\n        at org.eclipse.ui.internal.Workbench.createAndRunWorkbench(Workbench.jav\na:257)\n        at org.eclipse.ui.PlatformUI.createAndRunWorkbench(PlatformUI.java:139)\n        at org.eclipse.ui.internal.ide.IDEApplication.run(IDEApplication.java:90\n)\n        at org.eclipse.core.internal.runtime.PlatformActivator$1.run(PlatformAct\nivator.java:277)\n        at org.eclipse.core.runtime.adaptor.EclipseStarter.run(EclipseStarter.ja\nva:241)\n        at org.eclipse.core.runtime.adaptor.EclipseStarter.run(EclipseStarter.ja\nva:117)\n        at sun.reflect.NativeMethodAccessorImpl.invoke0(Native Method)\n        at sun.reflect.NativeMethodAccessorImpl.invoke(NativeMethodAccessorImpl.\njava:39)\n        at sun.reflect.DelegatingMethodAccessorImpl.invoke(DelegatingMethodAcces\nsorImpl.java:25)\n        at java.lang.reflect.Method.invoke(Method.java:324)\n        at org.eclipse.core.launcher.Main.basicRun(Main.java:267)\n        at org.eclipse.core.launcher.Main.run(Main.java:692)\n        at org.eclipse.core.launcher.Main.main(Main.java:676)\njava.lang.NullPointerException",
    "*** Bug 61405 has been marked as a duplicate of this bug. ***",
    "Fixed in CompileErrorPromptStatusHandler. The launch was aborted for private \nconfigs with compile errors in the project. We should silently launch private \nconfigs (no matter if there are errors).",
    "Please verify, Kevin.",
    "verified\n"
  ],
  "commentCreationDates": [
    "2004-04-07T18:27:43+02:00",
    "2004-05-07T18:54:25+02:00",
    "2004-05-07T19:07:32+02:00",
    "2004-05-07T19:07:50+02:00",
    "2004-05-09T05:44:59+02:00"
  ],
  "traces": [
    {
      "exceptionType": "java.lang.NullPointerException",
      "elements": [
        {
          "method": "org.eclipse.jdt.internal.debug.ui.snippeteditor.ScrapbookLauncher.doLaunch",
          "source": "ScrapbookLauncher.java:225"
        },
        {
          "method": "org.eclipse.jdt.internal.debug.ui.snippeteditor.ScrapbookLauncher.launch",
          "source": "ScrapbookLauncher.java:144"
        },
        {
          "method": "org.eclipse.jdt.internal.debug.ui.snippeteditor.JavaSnippetEditor$18.run",
          "source": "JavaSnippetEditor.java:1210"
        },
        {
          "method": "org.eclipse.swt.custom.BusyIndicator.showWhile",
          "source": "BusyIndicator.java:84"
        },
        {
          "method": "org.eclipse.jdt.internal.debug.ui.snippeteditor.JavaSnippetEditor.launchVM",
          "source": "JavaSnippetEditor.java:1213"
        },
        {
          "method": "org.eclipse.jdt.internal.debug.ui.snippeteditor.JavaSnippetEditor.buildAndLaunch",
          "source": "JavaSnippetEditor.java:399"
        },
        {
          "method": "org.eclipse.jdt.internal.debug.ui.snippeteditor.JavaSnippetEditor.evalSelection",
          "source": "JavaSnippetEditor.java:325"
        },
        {
          "method": "org.eclipse.jdt.internal.debug.ui.actions.ExecuteAction.run",
          "source": "ExecuteAc tion.java:49"
        },
        {
          "method": "org.eclipse.jdt.internal.debug.ui.actions.EvaluateAction.run",
          "source": "Evaluate Action.java:565"
        },
        {
          "method": "org.eclipse.ui.internal.PluginAction.runWithEvent",
          "source": "PluginAction.java:2 69"
        },
        {
          "method": "org.eclipse.jface.action.ActionContributionItem.handleWidgetSelection",
          "source": "ActionContributionItem.java:550"
        },
        {
          "method": "org.eclipse.jface.action.ActionContributionItem.access$2",
          "source": "ActionContri butionItem.java:502"
        },
        {
          "method": "org.eclipse.jface.action.ActionContributionItem$5.handleEvent",
          "source": "ActionC ontributionItem.java:435"
        },
        {
          "method": "org.eclipse.swt.widgets.EventTable.sendEvent",
          "source": "EventTable.java:82"
        },
        {
          "method": "org.eclipse.swt.widgets.Widget.sendEvent",
          "source": "Widget.java:769"
        },
        {
          "method": "org.eclipse.swt.widgets.Display.runDeferredEvents",
          "source": "Display.java:2586"
        },
        {
          "method": "org.eclipse.swt.widgets.Display.readAndDispatch",
          "source": "Display.java:2264"
        },
        {
          "method": "org.eclipse.ui.internal.Workbench.runEventLoop",
          "source": "Workbench.java:1558"
        },
        {
          "method": "org.eclipse.ui.internal.Workbench.runUI",
          "source": "Workbench.java:1532"
        },
        {
          "method": "org.eclipse.ui.internal.Workbench.createAndRunWorkbench",
          "source": "Workbench.jav a:257"
        },
        {
          "method": "org.eclipse.ui.PlatformUI.createAndRunWorkbench",
          "source": "PlatformUI.java:139"
        },
        {
          "method": "org.eclipse.ui.internal.ide.IDEApplication.run",
          "source": "IDEApplication.java:90 "
        },
        {
          "method": "org.eclipse.core.internal.runtime.PlatformActivator$1.run",
          "source": "PlatformAct ivator.java:277"
        },
        {
          "method": "org.eclipse.core.runtime.adaptor.EclipseStarter.run",
          "source": "EclipseStarter.ja va:241"
        },
        {
          "method": "org.eclipse.core.runtime.adaptor.EclipseStarter.run",
          "source": "EclipseStarter.ja va:117"
        },
        {
          "method": "sun.reflect.NativeMethodAccessorImpl.invoke0",
          "source": "Native Method"
        },
        {
          "method": "sun.reflect.NativeMethodAccessorImpl.invoke",
          "source": "NativeMethodAccessorImpl. java:39"
        },
        {
          "method": "sun.reflect.DelegatingMethodAccessorImpl.invoke",
          "source": "DelegatingMethodAcces sorImpl.java:25"
        },
        {
          "method": "java.lang.reflect.Method.invoke",
          "source": "Method.java:324"
        },
        {
          "method": "org.eclipse.core.launcher.Main.basicRun",
          "source": "Main.java:267"
        },
        {
          "method": "org.eclipse.core.launcher.Main.run",
          "source": "Main.java:692"
        },
        {
          "method": "org.eclipse.core.launcher.Main.main",
          "source": "Main.java:676"
        }
      ],
      "number": 0,
      "commentIndex": 0,
      "bugId": "57763",
      "date": "2004-04-07T18:27:43+02:00",
      "product": "JDT",
      "component": "Debug",
      "severity": "normal"
    }
  ],
  "groupId": "57763",
  "bugId": "57763",
  "date": "2004-04-07T18:27:43+02:00",
  "product": "JDT",
  "component": "Debug",
  "severity": "normal"
}