{
  "comments": [
    "Build I2004131323.\n\nI\u0027m editing a really simple Ant file Javadoc.xml:\n\u003c?xml version\u003d\"1.0\" encoding\u003d\"UTF-8\"?\u003e\n\u003cproject default\u003d\"javadoc\"\u003e\n    \u003ctarget name\u003d\"javadoc\"\u003e\n        \u003cjavadoc destdir\u003d\"D:\\usr\\OTI\\Javadoc\" access\u003d\"public\" use\u003d\"false\" \nnotree\u003d\"true\" nonavbar\u003d\"true\" noindex\u003d\"true\" splitindex\u003d\"false\" author\u003d\"false\" \nversion\u003d\"false\" nodeprecatedlist\u003d\"false\" nodeprecated\u003d\"false\" \nsourcefiles\u003d\"X.java\" sourcepath\u003d\"b51911\" classpath\u003d\"b51911\"/\u003e\n    \u003c/target\u003e\n\u003c/project\u003e\n\nI want to replace sourcepath and classpath value.\n\nFirst problem: I double-click on one of \u0027b51911\u0027 (let say sourcepath one) and \ndidn\u0027t get the text selected although it should be.\n\nSecond problem: I select manually the text \u0027b51911\u0027 and replace it by \u0027.\u0027,\nthen I get following NPE:\n\n!ENTRY org.eclipse.ui 4 4 Apr 15, 2004 10:55:33.181\n!MESSAGE Unhandled event loop exception\nUnhandled event loop exception\nReason:\n!ENTRY org.eclipse.ui 4 0 Apr 15, 2004 10:55:33.191\n!MESSAGE java.lang.NullPointerException\n!STACK 0\njava.lang.NullPointerException\n        at \norg.eclipse.ant.internal.ui.editor.text.PartiallySynchronizedDocument.replace\n(PartiallySynchronizedDocument.java:74)\n        at org.eclipse.jface.text.DocumentAdapter.replaceTextRange\n(DocumentAdapter.java:194)\n        at org.eclipse.swt.custom.StyledText.modifyContent(StyledText.java:5557)\n        at org.eclipse.swt.custom.StyledText.sendKeyEvent(StyledText.java:6397)\n        at org.eclipse.swt.custom.StyledText.doContent(StyledText.java:2533)\n        at org.eclipse.swt.custom.StyledText.handleKey(StyledText.java:4956)\n        at org.eclipse.swt.custom.StyledText.handleKeyDown(StyledText.java:4979)\n        at org.eclipse.swt.custom.StyledText$7.handleEvent(StyledText.java:4724)\n        at org.eclipse.swt.widgets.EventTable.sendEvent(EventTable.java:82)\n        at org.eclipse.swt.widgets.Widget.sendEvent(Widget.java:769)\n        at org.eclipse.swt.widgets.Widget.sendEvent(Widget.java:793)\n        at org.eclipse.swt.widgets.Widget.sendEvent(Widget.java:778)\n        at org.eclipse.swt.widgets.Control.sendKeyEvent(Control.java:1720)\n        at org.eclipse.swt.widgets.Control.sendKeyEvent(Control.java:1716)\n        at org.eclipse.swt.widgets.Control.WM_CHAR(Control.java:3039)\n        at org.eclipse.swt.widgets.Control.windowProc(Control.java:2942)\n        at org.eclipse.swt.widgets.Display.windowProc(Display.java:3150)\n        at org.eclipse.swt.internal.win32.OS.DispatchMessageW(Native Method)\n        at org.eclipse.swt.internal.win32.OS.DispatchMessage(OS.java:1457)\n        at org.eclipse.swt.widgets.Display.readAndDispatch(Display.java:2260)\n        at org.eclipse.ui.internal.Workbench.runEventLoop(Workbench.java:1436)\n        at org.eclipse.ui.internal.Workbench.runUI(Workbench.java:1407)\n        at org.eclipse.ui.internal.Workbench.createAndRunWorkbench\n(Workbench.java:244)\n        at org.eclipse.ui.PlatformUI.createAndRunWorkbench(PlatformUI.java:140)\n        at org.eclipse.ui.internal.ide.IDEApplication.run\n(IDEApplication.java:90)\n        at org.eclipse.core.internal.runtime.PlatformActivator$1.run\n(PlatformActivator.java:280)\n        at org.eclipse.core.runtime.adaptor.EclipseStarter.run\n(EclipseStarter.java:241)\n        at org.eclipse.core.runtime.adaptor.EclipseStarter.run\n(EclipseStarter.java:117)\n        at sun.reflect.NativeMethodAccessorImpl.invoke0(Native Method)\n        at sun.reflect.NativeMethodAccessorImpl.invoke\n(NativeMethodAccessorImpl.java:39)\n        at sun.reflect.DelegatingMethodAccessorImpl.invoke\n(DelegatingMethodAccessorImpl.java:25)\n        at java.lang.reflect.Method.invoke(Method.java:324)\n        at org.eclipse.core.launcher.Main.basicRun(Main.java:267)\n        at org.eclipse.core.launcher.Main.run(Main.java:692)\n        at org.eclipse.core.launcher.Main.main(Main.java:676)\njava.lang.NullPointerException",
    "\n\n*** This bug has been marked as a duplicate of 58426 ***"
  ],
  "commentCreationDates": [
    "2004-04-15T11:21:08+02:00",
    "2004-04-15T15:06:31+02:00"
  ],
  "traces": [
    {
      "exceptionType": "java.lang.NullPointerException",
      "elements": [
        {
          "method": "org.eclipse.ant.internal.ui.editor.text.PartiallySynchronizedDocument.replace",
          "source": "PartiallySynchronizedDocument.java:74"
        },
        {
          "method": "org.eclipse.jface.text.DocumentAdapter.replaceTextRange",
          "source": "DocumentAdapter.java:194"
        },
        {
          "method": "org.eclipse.swt.custom.StyledText.modifyContent",
          "source": "StyledText.java:5557"
        },
        {
          "method": "org.eclipse.swt.custom.StyledText.sendKeyEvent",
          "source": "StyledText.java:6397"
        },
        {
          "method": "org.eclipse.swt.custom.StyledText.doContent",
          "source": "StyledText.java:2533"
        },
        {
          "method": "org.eclipse.swt.custom.StyledText.handleKey",
          "source": "StyledText.java:4956"
        },
        {
          "method": "org.eclipse.swt.custom.StyledText.handleKeyDown",
          "source": "StyledText.java:4979"
        },
        {
          "method": "org.eclipse.swt.custom.StyledText$7.handleEvent",
          "source": "StyledText.java:4724"
        },
        {
          "method": "org.eclipse.swt.widgets.EventTable.sendEvent",
          "source": "EventTable.java:82"
        },
        {
          "method": "org.eclipse.swt.widgets.Widget.sendEvent",
          "source": "Widget.java:769"
        },
        {
          "method": "org.eclipse.swt.widgets.Widget.sendEvent",
          "source": "Widget.java:793"
        },
        {
          "method": "org.eclipse.swt.widgets.Widget.sendEvent",
          "source": "Widget.java:778"
        },
        {
          "method": "org.eclipse.swt.widgets.Control.sendKeyEvent",
          "source": "Control.java:1720"
        },
        {
          "method": "org.eclipse.swt.widgets.Control.sendKeyEvent",
          "source": "Control.java:1716"
        },
        {
          "method": "org.eclipse.swt.widgets.Control.WM_CHAR",
          "source": "Control.java:3039"
        },
        {
          "method": "org.eclipse.swt.widgets.Control.windowProc",
          "source": "Control.java:2942"
        },
        {
          "method": "org.eclipse.swt.widgets.Display.windowProc",
          "source": "Display.java:3150"
        },
        {
          "method": "org.eclipse.swt.internal.win32.OS.DispatchMessageW",
          "source": "Native Method"
        },
        {
          "method": "org.eclipse.swt.internal.win32.OS.DispatchMessage",
          "source": "OS.java:1457"
        },
        {
          "method": "org.eclipse.swt.widgets.Display.readAndDispatch",
          "source": "Display.java:2260"
        },
        {
          "method": "org.eclipse.ui.internal.Workbench.runEventLoop",
          "source": "Workbench.java:1436"
        },
        {
          "method": "org.eclipse.ui.internal.Workbench.runUI",
          "source": "Workbench.java:1407"
        },
        {
          "method": "org.eclipse.ui.internal.Workbench.createAndRunWorkbench",
          "source": "Workbench.java:244"
        },
        {
          "method": "org.eclipse.ui.PlatformUI.createAndRunWorkbench",
          "source": "PlatformUI.java:140"
        },
        {
          "method": "org.eclipse.ui.internal.ide.IDEApplication.run",
          "source": "IDEApplication.java:90"
        },
        {
          "method": "org.eclipse.core.internal.runtime.PlatformActivator$1.run",
          "source": "PlatformActivator.java:280"
        },
        {
          "method": "org.eclipse.core.runtime.adaptor.EclipseStarter.run",
          "source": "EclipseStarter.java:241"
        },
        {
          "method": "org.eclipse.core.runtime.adaptor.EclipseStarter.run",
          "source": "EclipseStarter.java:117"
        },
        {
          "method": "sun.reflect.NativeMethodAccessorImpl.invoke0",
          "source": "Native Method"
        },
        {
          "method": "sun.reflect.NativeMethodAccessorImpl.invoke",
          "source": "NativeMethodAccessorImpl.java:39"
        },
        {
          "method": "sun.reflect.DelegatingMethodAccessorImpl.invoke",
          "source": "DelegatingMethodAccessorImpl.java:25"
        },
        {
          "method": "java.lang.reflect.Method.invoke",
          "source": "Method.java:324"
        },
        {
          "method": "org.eclipse.core.launcher.Main.basicRun",
          "source": "Main.java:267"
        },
        {
          "method": "org.eclipse.core.launcher.Main.run",
          "source": "Main.java:692"
        },
        {
          "method": "org.eclipse.core.launcher.Main.main",
          "source": "Main.java:676"
        }
      ],
      "number": 0,
      "commentIndex": 0,
      "bugId": "58624",
      "duplicateId": "58426",
      "date": "2004-04-15T11:21:08+02:00",
      "product": "Platform",
      "component": "Ant",
      "severity": "normal"
    }
  ],
  "groupId": "58426",
  "bugId": "58624",
  "duplicateId": "58426",
  "date": "2004-04-15T11:21:08+02:00",
  "product": "Platform",
  "component": "Ant",
  "severity": "normal"
}