{
  "comments": [
    "build: I20040413\n\nOld builds would show a tooltip popup when I hovered over a type in a java \neditor.  This no longer seems to happen.\n\nAlso, while running with -debug enabled (for a different problem) I got the \nfollowing exception (which does not appear in the .log file):\n\norg.eclipse.swt.SWTException: Invalid thread access\n        at org.eclipse.swt.SWT.error(SWT.java:2659)\n        at org.eclipse.swt.SWT.error(SWT.java:2584)\n        at org.eclipse.swt.SWT.error(SWT.java:2555)\n        at org.eclipse.swt.widgets.Display.error(Display.java:701)\n        at org.eclipse.swt.widgets.Display.checkDevice(Display.java:526)\n        at org.eclipse.swt.widgets.Display.getActiveShell(Display.java:788)\n        at org.eclipse.ui.internal.Workbench.getActiveWorkbenchWindow(Workbench.\njava:581)\n        at org.eclipse.jdt.internal.ui.text.HTMLPrinter.insertPageProlog(HTMLPri\nnter.java:97)\n        at org.eclipse.jdt.internal.ui.text.java.hover.JavadocHover.getHoverInfo\n(JavadocHover.java:74)\n        at org.eclipse.jdt.internal.ui.text.java.hover.AbstractJavaEditorTextHov\ner.getHoverInfo(AbstractJavaEditorTextHover.java:119)\n        at org.eclipse.jdt.internal.ui.text.java.hover.BestMatchHover.getHoverIn\nfo(BestMatchHover.java:102)\n        at org.eclipse.jdt.internal.ui.text.java.hover.JavaEditorTextHoverProxy.\ngetHoverInfo(JavaEditorTextHoverProxy.java:69)\n        at org.eclipse.jface.text.TextViewerHoverManager$4.run(TextViewerHoverMa\nnager.java:161)",
    "\n\n*** This bug has been marked as a duplicate of 57384 ***"
  ],
  "commentCreationDates": [
    "2004-04-15T19:09:23+02:00",
    "2004-04-16T12:28:42+02:00"
  ],
  "traces": [
    {
      "exceptionType": "org.eclipse.swt.SWTException",
      "message": "Invalid thread access",
      "elements": [
        {
          "method": "org.eclipse.swt.SWT.error",
          "source": "SWT.java:2659"
        },
        {
          "method": "org.eclipse.swt.SWT.error",
          "source": "SWT.java:2584"
        },
        {
          "method": "org.eclipse.swt.SWT.error",
          "source": "SWT.java:2555"
        },
        {
          "method": "org.eclipse.swt.widgets.Display.error",
          "source": "Display.java:701"
        },
        {
          "method": "org.eclipse.swt.widgets.Display.checkDevice",
          "source": "Display.java:526"
        },
        {
          "method": "org.eclipse.swt.widgets.Display.getActiveShell",
          "source": "Display.java:788"
        },
        {
          "method": "org.eclipse.ui.internal.Workbench.getActiveWorkbenchWindow",
          "source": "Workbench. java:581"
        },
        {
          "method": "org.eclipse.jdt.internal.ui.text.HTMLPrinter.insertPageProlog",
          "source": "HTMLPri nter.java:97"
        },
        {
          "method": "org.eclipse.jdt.internal.ui.text.java.hover.JavadocHover.getHoverInfo",
          "source": "JavadocHover.java:74"
        },
        {
          "method": "org.eclipse.jdt.internal.ui.text.java.hover.AbstractJavaEditorTextHover.getHoverInfo",
          "source": "AbstractJavaEditorTextHover.java:119"
        },
        {
          "method": "org.eclipse.jdt.internal.ui.text.java.hover.BestMatchHover.getHoverInfo",
          "source": "BestMatchHover.java:102"
        },
        {
          "method": "org.eclipse.jdt.internal.ui.text.java.hover.JavaEditorTextHoverProxy.getHoverInfo",
          "source": "JavaEditorTextHoverProxy.java:69"
        },
        {
          "method": "org.eclipse.jface.text.TextViewerHoverManager$4.run",
          "source": "TextViewerHoverMa nager.java:161"
        }
      ],
      "number": 0,
      "commentIndex": 0,
      "bugId": "58694",
      "duplicateId": "57384",
      "date": "2004-04-15T19:09:23+02:00",
      "product": "JDT",
      "component": "Text",
      "severity": "normal"
    }
  ],
  "groupId": "57384",
  "bugId": "58694",
  "duplicateId": "57384",
  "date": "2004-04-15T19:09:23+02:00",
  "product": "JDT",
  "component": "Text",
  "severity": "normal"
}