{
  "comments": [
    "20040414\n\nThe text hover looks like it is running in a background Thread and trying to \nget a Shell to do something.\n\nIf this is a fast operation you should asynch or synch exec. If not then post \na UIJob. However if it happens all of the time you may want to batch using a \nUIJob so it is not constantly updating.\n\norg.eclipse.swt.SWTException: Invalid thread access\n        at org.eclipse.swt.SWT.error(SWT.java:2659)\n        at org.eclipse.swt.SWT.error(SWT.java:2584)\n        at org.eclipse.swt.SWT.error(SWT.java:2555)\n        at org.eclipse.swt.widgets.Display.error(Display.java:701)\n        at org.eclipse.swt.widgets.Display.checkDevice(Display.java:526)\n        at org.eclipse.swt.widgets.Display.getActiveShell(Display.java:788)\n        at org.eclipse.ui.internal.Workbench.getActiveWorkbenchWindow\n(Workbench.\njava:581)\n        at org.eclipse.jdt.internal.ui.text.HTMLPrinter.insertPageProlog\n(HTMLPri\nnter.java:97)\n        at \norg.eclipse.jdt.internal.ui.text.java.hover.JavadocHover.getHoverInfo\n(JavadocHover.java:74)\n        at \norg.eclipse.jdt.internal.ui.text.java.hover.AbstractJavaEditorTextHov\ner.getHoverInfo(AbstractJavaEditorTextHover.java:119)\n        at \norg.eclipse.jdt.internal.ui.text.java.hover.BestMatchHover.getHoverIn\nfo(BestMatchHover.java:102)\n        at \norg.eclipse.jdt.internal.ui.text.java.hover.JavaEditorTextHoverProxy.\ngetHoverInfo(JavaEditorTextHoverProxy.java:69)\n        at org.eclipse.jface.text.TextViewerHoverManager$4.run\n(TextViewerHoverMa\nnager.java:161)",
    "\n\n*** This bug has been marked as a duplicate of 57384 ***"
  ],
  "commentCreationDates": [
    "2004-04-16T15:56:03+02:00",
    "2004-04-16T16:06:15+02:00"
  ],
  "traces": [
    {
      "exceptionType": "org.eclipse.swt.SWTException",
      "message": "Invalid thread access",
      "elements": [
        {
          "method": "org.eclipse.swt.SWT.error",
          "source": "SWT.java:2659"
        },
        {
          "method": "org.eclipse.swt.SWT.error",
          "source": "SWT.java:2584"
        },
        {
          "method": "org.eclipse.swt.SWT.error",
          "source": "SWT.java:2555"
        },
        {
          "method": "org.eclipse.swt.widgets.Display.error",
          "source": "Display.java:701"
        },
        {
          "method": "org.eclipse.swt.widgets.Display.checkDevice",
          "source": "Display.java:526"
        },
        {
          "method": "org.eclipse.swt.widgets.Display.getActiveShell",
          "source": "Display.java:788"
        },
        {
          "method": "org.eclipse.ui.internal.Workbench.getActiveWorkbenchWindow",
          "source": "Workbench. java:581"
        },
        {
          "method": "org.eclipse.jdt.internal.ui.text.HTMLPrinter.insertPageProlog",
          "source": "HTMLPri nter.java:97"
        },
        {
          "method": "org.eclipse.jdt.internal.ui.text.java.hover.JavadocHover.getHoverInfo",
          "source": "JavadocHover.java:74"
        },
        {
          "method": "org.eclipse.jdt.internal.ui.text.java.hover.AbstractJavaEditorTextHover.getHoverInfo",
          "source": "AbstractJavaEditorTextHover.java:119"
        },
        {
          "method": "org.eclipse.jdt.internal.ui.text.java.hover.BestMatchHover.getHoverInfo",
          "source": "BestMatchHover.java:102"
        },
        {
          "method": "org.eclipse.jdt.internal.ui.text.java.hover.JavaEditorTextHoverProxy.getHoverInfo",
          "source": "JavaEditorTextHoverProxy.java:69"
        },
        {
          "method": "org.eclipse.jface.text.TextViewerHoverManager$4.run",
          "source": "TextViewerHoverMa nager.java:161"
        }
      ],
      "number": 0,
      "commentIndex": 0,
      "bugId": "58833",
      "duplicateId": "57384",
      "date": "2004-04-16T15:56:03+02:00",
      "product": "JDT",
      "component": "Text",
      "severity": "normal"
    }
  ],
  "groupId": "57384",
  "bugId": "58833",
  "duplicateId": "57384",
  "date": "2004-04-16T15:56:03+02:00",
  "product": "JDT",
  "component": "Text",
  "severity": "normal"
}