{
  "comments": [
    "build N20040423\n\nIn the console output for the test run for this build, I see the following.\nNot sure if this is a real problem or not, but it looks like an assertion \nfailure is not being caught by JUnit because it\u0027s being thrown in an \nasyncExec, not the JUnit thread.\n\nSee also bug 59842 for the stack trace above this one in the console output.\n\n\n     [java] org.eclipse.swt.SWTException: Failed to execute runnable \n(junit.framework.AssertionFailedError: BadLocationException occurred: \norg.eclipse.jface.text.BadLocationException)\n     [java] \tat org.eclipse.swt.SWT.error(SWT.java:2659)\n     [java] \tat org.eclipse.swt.SWT.error(SWT.java:2584)\n     [java] \tat org.eclipse.swt.widgets.Synchronizer.runAsyncMessages\n(Synchronizer.java:109)\n     [java] \tat org.eclipse.swt.widgets.Display.runAsyncMessages\n(Display.java:2569)\n     [java] \tat org.eclipse.swt.widgets.Display.readAndDispatch\n(Display.java:2274)\n     [java] \tat org.eclipse.jdt.debug.tests.AutomatedSuite.run\n(AutomatedSuite.java:191)\n     [java] \tat org.eclipse.test.EclipseTestRunner.run\n(EclipseTestRunner.java:320)\n     [java] \tat org.eclipse.test.EclipseTestRunner.run\n(EclipseTestRunner.java:199)\n     [java] \tat org.eclipse.test.EclipseTestRunner.main\n(EclipseTestRunner.java:134)\n     [java] \tat org.eclipse.test.UITestApplication$3.run\n(UITestApplication.java:180)\n     [java] \tat org.eclipse.swt.widgets.RunnableLock.run\n(RunnableLock.java:35)\n     [java] \tat org.eclipse.swt.widgets.Synchronizer.runAsyncMessages\n(Synchronizer.java:106)\n     [java] \tat org.eclipse.swt.widgets.Display.runAsyncMessages\n(Display.java:2569)\n     [java] \tat org.eclipse.swt.widgets.Display.readAndDispatch\n(Display.java:2274)\n     [java] \tat org.eclipse.ui.internal.Workbench.runEventLoop\n(Workbench.java:1352)\n     [java] \tat org.eclipse.ui.internal.Workbench.runUI(Workbench.java:1323)\n     [java] \tat org.eclipse.ui.internal.Workbench.createAndRunWorkbench\n(Workbench.java:239)\n     [java] \tat org.eclipse.ui.PlatformUI.createAndRunWorkbench\n(PlatformUI.java:140)\n     [java] \tat org.eclipse.ui.internal.ide.IDEApplication.run\n(IDEApplication.java:90)\n     [java] \tat org.eclipse.test.UITestApplication.runApplication\n(UITestApplication.java:123)\n     [java] \tat org.eclipse.test.UITestApplication.run\n(UITestApplication.java:55)\n     [java] \tat org.eclipse.core.internal.runtime.PlatformActivator$1.run\n(PlatformActivator.java:283)\n     [java] \tat org.eclipse.core.runtime.adaptor.EclipseStarter.run\n(EclipseStarter.java:240)\n     [java] \tat org.eclipse.core.runtime.adaptor.EclipseStarter.run\n(EclipseStarter.java:117)\n     [java] \tat sun.reflect.NativeMethodAccessorImpl.invoke0(Native Method)\n     [java] \tat sun.reflect.NativeMethodAccessorImpl.invoke\n(NativeMethodAccessorImpl.java:39)\n     [java] \tat sun.reflect.DelegatingMethodAccessorImpl.invoke\n(DelegatingMethodAccessorImpl.java:25)\n     [java] \tat java.lang.reflect.Method.invoke(Method.java:324)\n     [java] \tat org.eclipse.core.launcher.Main.basicRun(Main.java:269)\n     [java] \tat org.eclipse.core.launcher.Main.run(Main.java:700)\n     [java] \tat org.eclipse.core.launcher.Main.main(Main.java:684)\n     [java] *** Stack trace of contained exception ***\n     [java] junit.framework.AssertionFailedError: BadLocationException \noccurred: org.eclipse.jface.text.BadLocationException\n     [java] \tat junit.framework.Assert.fail(Assert.java:47)\n     [java] \tat junit.framework.Assert.assertTrue(Assert.java:20)\n     [java] \tat \norg.eclipse.jdt.debug.tests.core.LineTrackerTests.lineAppended\n(LineTrackerTests.java:164)\n     [java] \tat \norg.eclipse.jdt.debug.testplugin.ConsoleLineTracker.lineAppended\n(ConsoleLineTracker.java:66)\n     [java] \tat \norg.eclipse.debug.internal.ui.views.console.ConsoleLineNotifier.processNewLines\n(ConsoleLineNotifier.java:133)\n     [java] \tat \norg.eclipse.debug.internal.ui.views.console.ConsoleLineNotifier.streamsClosed\n(ConsoleLineNotifier.java:93)\n     [java] \tat \norg.eclipse.debug.internal.ui.views.console.ConsoleDocumentPartitioner$2.run\n(ConsoleDocumentPartitioner.java:642)\n     [java] \tat org.eclipse.swt.widgets.RunnableLock.run\n(RunnableLock.java:35)\n     [java] \tat org.eclipse.swt.widgets.Synchronizer.runAsyncMessages\n(Synchronizer.java:106)\n     [java] \tat org.eclipse.swt.widgets.Display.runAsyncMessages\n(Display.java:2569)\n     [java] \tat org.eclipse.swt.widgets.Display.readAndDispatch\n(Display.java:2274)\n     [java] \tat org.eclipse.jdt.debug.tests.AutomatedSuite.run\n(AutomatedSuite.java:191)\n     [java] \tat org.eclipse.test.EclipseTestRunner.run\n(EclipseTestRunner.java:320)\n     [java] \tat org.eclipse.test.EclipseTestRunner.run\n(EclipseTestRunner.java:199)\n     [java] \tat org.eclipse.test.EclipseTestRunner.main\n(EclipseTestRunner.java:134)\n     [java] \tat org.eclipse.test.UITestApplication$3.run\n(UITestApplication.java:180)\n     [java] \tat org.eclipse.swt.widgets.RunnableLock.run\n(RunnableLock.java:35)\n     [java] \tat org.eclipse.swt.widgets.Synchronizer.runAsyncMessages\n(Synchronizer.java:106)\n     [java] \tat org.eclipse.swt.widgets.Display.runAsyncMessages\n(Display.java:2569)\n     [java] \tat org.eclipse.swt.widgets.Display.readAndDispatch\n(Display.java:2274)\n     [java] \tat org.eclipse.ui.internal.Workbench.runEventLoop\n(Workbench.java:1352)\n     [java] \tat org.eclipse.ui.internal.Workbench.runUI(Workbench.java:1323)\n     [java] \tat org.eclipse.ui.internal.Workbench.createAndRunWorkbench\n(Workbench.java:239)\n     [java] \tat org.eclipse.ui.PlatformUI.createAndRunWorkbench\n(PlatformUI.java:140)\n     [java] \tat org.eclipse.ui.internal.ide.IDEApplication.run\n(IDEApplication.java:90)\n     [java] \tat org.eclipse.test.UITestApplication.runApplication\n(UITestApplication.java:123)\n     [java] \tat org.eclipse.test.UITestApplication.run\n(UITestApplication.java:55)\n     [java] \tat org.eclipse.core.internal.runtime.PlatformActivator$1.run\n(PlatformActivator.java:283)\n     [java] \tat org.eclipse.core.runtime.adaptor.EclipseStarter.run\n(EclipseStarter.java:240)\n     [java] \tat org.eclipse.core.runtime.adaptor.EclipseStarter.run\n(EclipseStarter.java:117)\n     [java] \tat sun.reflect.NativeMethodAccessorImpl.invoke0(Native Method)\n     [java] \tat sun.reflect.NativeMethodAccessorImpl.invoke\n(NativeMethodAccessorImpl.java:39)\n     [java] \tat sun.reflect.DelegatingMethodAccessorImpl.invoke\n(DelegatingMethodAccessorImpl.java:25)\n     [java] \tat java.lang.reflect.Method.invoke(Method.java:324)\n     [java] \tat org.eclipse.core.launcher.Main.basicRun(Main.java:269)\n     [java] \tat org.eclipse.core.launcher.Main.run(Main.java:700)\n     [java] \tat org.eclipse.core.launcher.Main.main(Main.java:684)",
    "That code is there to help us debug the test failure that we haven\u0027t been able to reproduce. Fixed it \nup to not call the assertion code until we\u0027re back in JUnit land.\n\nPlease verify fix to LineTrackerTests, DarinS. Hopefully, this will yield more useful info in the \nfuture.",
    "Verified code."
  ],
  "commentCreationDates": [
    "2004-04-23T22:29:41+02:00",
    "2004-04-23T23:48:19+02:00",
    "2004-04-24T23:20:48+02:00"
  ],
  "traces": [
    {
      "exceptionType": "junit.framework.AssertionFailedError",
      "message": "BadLocationException occurred:  org.eclipse.jface.text.BadLocationException)      [java]",
      "elements": [
        {
          "method": "org.eclipse.swt.SWT.error",
          "source": "SWT.java:2659"
        }
      ],
      "number": 0,
      "commentIndex": 0,
      "bugId": "59844",
      "date": "2004-04-23T22:29:41+02:00",
      "product": "JDT",
      "component": "Debug",
      "severity": "normal"
    },
    {
      "exceptionType": "junit.framework.AssertionFailedError",
      "message": "BadLocationException  occurred: org.eclipse.jface.text.BadLocationException      [java]",
      "elements": [
        {
          "method": "junit.framework.Assert.fail",
          "source": "Assert.java:47"
        }
      ],
      "number": 1,
      "commentIndex": 0,
      "bugId": "59844",
      "date": "2004-04-23T22:29:41+02:00",
      "product": "JDT",
      "component": "Debug",
      "severity": "normal"
    }
  ],
  "groupId": "59844",
  "bugId": "59844",
  "date": "2004-04-23T22:29:41+02:00",
  "product": "JDT",
  "component": "Debug",
  "severity": "normal"
}