{
  "comments": [
    "Using I-0427 build, just opening the Java Editor, and selecting something in the \noutline causes following exception. I marked as critical, since once it happens, \nthe edit area doesn\u0027t repaint correctly and editor must be closed to recover. \n\nNote: I had experimented with -Dorg.eclipse.jdt.internal.ui.projection\u003dtrue\nbut saw lots of problems, removed it, then still saw this problem. I\u0027m not sure \nif occurs in \"fresh install\" (but since I know some don\u0027t use outline view much \nany more, thought it might have slipped through unnoticed).\n\n\n\n\n!MESSAGE Failed to execute runnable (org.eclipse.jface.text.\nAssert$AssertionFailedException: Assertion failed: )\n!STACK 0\norg.eclipse.swt.SWTException: Failed to execute runnable (org.eclipse.jface.\ntext.Assert$AssertionFailedException: Assertion failed: )\n        at java.lang.Throwable.\u003cinit\u003e(Throwable.java)\n        at java.lang.Throwable.\u003cinit\u003e(Throwable.java)\n        at org.eclipse.swt.SWTException.\u003cinit\u003e(SWTException.java:73)\n        at org.eclipse.swt.SWT.error(SWT.java:2659)\n        at org.eclipse.swt.SWT.error(SWT.java)\n        at org.eclipse.swt.widgets.Synchronizer.runAsyncMessages(Synchronizer.\njava)\n        at org.eclipse.swt.widgets.Display.runAsyncMessages(Display.java)\n        at org.eclipse.swt.widgets.Display.readAndDispatch(Display.java)\n        at org.eclipse.ui.internal.Workbench.runEventLoop(Workbench.java:1437)\n        at org.eclipse.ui.internal.Workbench.runUI(Workbench.java:1408)\n        at org.eclipse.ui.internal.Workbench.createAndRunWorkbench(Workbench.\njava:244)\n        at org.eclipse.ui.PlatformUI.createAndRunWorkbench(PlatformUI.java:140)\n        at org.eclipse.ui.internal.ide.IDEApplication.run(IDEApplication.java:\n90)\n        at org.eclipse.core.internal.runtime.PlatformActivator$1.\nrun(PlatformActivator.java:280)\n        at org.eclipse.core.runtime.adaptor.EclipseStarter.run(EclipseStarter.\njava:240)\n        at org.eclipse.core.runtime.adaptor.EclipseStarter.run(EclipseStarter.\njava:117)\n        at sun.reflect.NativeMethodAccessorImpl.invoke0(Native Method)\n        at sun.reflect.NativeMethodAccessorImpl.invoke(NativeMethodAccessorImpl.\njava:84)\n        at sun.reflect.NativeMethodAccessorImpl.invoke(NativeMethodAccessorImpl.\njava:57)\n        at sun.reflect.DelegatingMethodAccessorImpl.\ninvoke(DelegatingMethodAccessorImpl.java:59)\n        at java.lang.reflect.Method.invoke(Method.java:389)\n        at org.eclipse.core.launcher.Main.basicRun(Main.java:267)\n        at org.eclipse.core.launcher.Main.run(Main.java:699)\n        at org.eclipse.core.launcher.Main.main(Main.java:683)\nFailed to execute runnable (org.eclipse.jface.text.\nAssert$AssertionFailedException: Assertion failed: )\n!ENTRY org.eclipse.ui 4 4 Apr 29, 2004 03:54:15.897\n!MESSAGE *** SWT nested exception\n*** SWT nested exception\nReason:\n!ENTRY org.eclipse.ui 4 0 Apr 29, 2004 03:54:15.897\n!MESSAGE Assertion failed:\n!STACK 0\norg.eclipse.jface.text.Assert$AssertionFailedException: Assertion failed:\n        at java.lang.Throwable.\u003cinit\u003e(Throwable.java)\n        at java.lang.Throwable.\u003cinit\u003e(Throwable.java)\n        at org.eclipse.jface.text.Assert$AssertionFailedException.\u003cinit\u003e(Assert.\njava:56)\n        at org.eclipse.jface.text.Assert.isTrue(Assert.java:177)\n        at org.eclipse.jface.text.Assert.isTrue(Assert.java)\n        at org.eclipse.jface.text.projection.ProjectionMapping.\ntoImageRegion(ProjectionMapping.java)\n        at org.eclipse.jface.text.projection.ProjectionMapping.\ntoImageRegion(ProjectionMapping.java)\n        at org.eclipse.jface.text.TextViewer.modelRange2WidgetRange(TextViewer.\njava)\n        at org.eclipse.jface.text.source.AnnotationRulerColumn.\ndoPaint1(AnnotationRulerColumn.java:504)\n        at org.eclipse.jface.text.source.AnnotationRulerColumn.\ndoubleBufferPaint(AnnotationRulerColumn.java:312)\n        at org.eclipse.jface.text.source.AnnotationRulerColumn.\naccess$3(AnnotationRulerColumn.java:288)\n        at org.eclipse.jface.text.source.AnnotationRulerColumn$1.\npaintControl(AnnotationRulerColumn.java:207)\n        at org.eclipse.swt.widgets.TypedListener.handleEvent(TypedListener.java:\n82)\n        at org.eclipse.swt.widgets.EventTable.sendEvent(EventTable.java)\n        at org.eclipse.swt.widgets.Widget.sendEvent(Widget.java)\n        at org.eclipse.swt.widgets.Widget.sendEvent(Widget.java)\n        at org.eclipse.swt.widgets.Widget.sendEvent(Widget.java)\n        at org.eclipse.swt.widgets.Composite.WM_PAINT(Composite.java)\n        at org.eclipse.swt.widgets.Control.windowProc(Control.java)\n        at org.eclipse.swt.widgets.Display.windowProc(Display.java)\n        at org.eclipse.swt.internal.win32.OS.RedrawWindow(Native Method)\n        at org.eclipse.swt.widgets.Control.update(Control.java:2847)\n        at org.eclipse.swt.widgets.Display.update(Display.java:3065)\n        at org.eclipse.jface.window.Window.runEventLoop(Window.java)\n        at org.eclipse.jface.window.Window.open(Window.java:650)\n        at org.eclipse.jface.dialogs.MessageDialog.openError(MessageDialog.java:\n287)\n        at org.eclipse.jface.util.SafeRunnable.handleException(SafeRunnable.\njava:50)\n        at org.eclipse.jface.viewers.StructuredViewer$3.\nhandleException(StructuredViewer.java:434)\n        at org.eclipse.core.internal.runtime.InternalPlatform.\nhandleException(InternalPlatform.java:333)\n        at org.eclipse.core.internal.runtime.InternalPlatform.\nrun(InternalPlatform.java)\n        at org.eclipse.core.runtime.Platform.run(Platform.java)\n        at org.eclipse.jface.viewers.StructuredViewer.\nfirePostSelectionChanged(StructuredViewer.java:429)\n        at org.eclipse.jface.viewers.StructuredViewer.\nhandlePostSelect(StructuredViewer.java:680)\n        at org.eclipse.jface.viewers.StructuredViewer$5.\nwidgetSelected(StructuredViewer.java:698)\n        at org.eclipse.jface.util.OpenStrategy.\nfirePostSelectionEvent(OpenStrategy.java:198)\n        at org.eclipse.jface.util.OpenStrategy.access$4(OpenStrategy.java:193)\n        at org.eclipse.jface.util.OpenStrategy$3.run(OpenStrategy.java:334)\n        at org.eclipse.swt.widgets.RunnableLock.run(RunnableLock.java:35)\n        at org.eclipse.swt.widgets.Synchronizer.runAsyncMessages(Synchronizer.\njava)\n        at org.eclipse.swt.widgets.Display.runAsyncMessages(Display.java)\n        at org.eclipse.swt.widgets.Display.readAndDispatch(Display.java)\n        at org.eclipse.ui.internal.Workbench.runEventLoop(Workbench.java:1437)\n        at org.eclipse.ui.internal.Workbench.runUI(Workbench.java:1408)\n        at org.eclipse.ui.internal.Workbench.createAndRunWorkbench(Workbench.\njava:244)\n        at org.eclipse.ui.PlatformUI.createAndRunWorkbench(PlatformUI.java:140)\n        at org.eclipse.ui.internal.ide.IDEApplication.run(IDEApplication.java:\n90)\n        at org.eclipse.core.internal.runtime.PlatformActivator$1.\nrun(PlatformActivator.java:280)\n        at org.eclipse.core.runtime.adaptor.EclipseStarter.run(EclipseStarter.\njava:240)\n        at org.eclipse.core.runtime.adaptor.EclipseStarter.run(EclipseStarter.\njava:117)\n        at sun.reflect.NativeMethodAccessorImpl.invoke0(Native Method)\n        at sun.reflect.NativeMethodAccessorImpl.invoke(NativeMethodAccessorImpl.\njava:84)\n        at sun.reflect.NativeMethodAccessorImpl.invoke(NativeMethodAccessorImpl.\njava:57)\n        at sun.reflect.DelegatingMethodAccessorImpl.\ninvoke(DelegatingMethodAccessorImpl.java:59)\n        at java.lang.reflect.Method.invoke(Method.java:389)\n        at org.eclipse.core.launcher.Main.basicRun(Main.java:267)\n        at org.eclipse.core.launcher.Main.run(Main.java:699)\n        at org.eclipse.core.launcher.Main.main(Main.java:683)\nAssertion failed:\n\n\n\nNote: I had experimented with -Dorg.eclipse.jdt.internal.ui.projection\u003dtrue\nbut saw lots of problems, removed it, then still saw this problem.",
    "Are you running on J9?",
    "Yes, I was using J9. Turning it off causes bug to go away. \n\n*** This bug has been marked as a duplicate of 55814 ***"
  ],
  "commentCreationDates": [
    "2004-04-29T10:13:00+02:00",
    "2004-04-29T11:26:52+02:00",
    "2004-04-29T14:41:59+02:00"
  ],
  "traces": [
    {
      "exceptionType": "text.Assert$AssertionFailedException",
      "message": "Assertion failed: )",
      "elements": [
        {
          "method": "java.lang.Throwable.\u003cinit\u003e",
          "source": "Throwable.java"
        },
        {
          "method": "java.lang.Throwable.\u003cinit\u003e",
          "source": "Throwable.java"
        },
        {
          "method": "org.eclipse.swt.SWTException.\u003cinit\u003e",
          "source": "SWTException.java:73"
        },
        {
          "method": "org.eclipse.swt.SWT.error",
          "source": "SWT.java:2659"
        },
        {
          "method": "org.eclipse.swt.SWT.error",
          "source": "SWT.java"
        },
        {
          "method": "org.eclipse.swt.widgets.Synchronizer.runAsyncMessages",
          "source": "Synchronizer. java"
        },
        {
          "method": "org.eclipse.swt.widgets.Display.runAsyncMessages",
          "source": "Display.java"
        },
        {
          "method": "org.eclipse.swt.widgets.Display.readAndDispatch",
          "source": "Display.java"
        },
        {
          "method": "org.eclipse.ui.internal.Workbench.runEventLoop",
          "source": "Workbench.java:1437"
        },
        {
          "method": "org.eclipse.ui.internal.Workbench.runUI",
          "source": "Workbench.java:1408"
        },
        {
          "method": "org.eclipse.ui.internal.Workbench.createAndRunWorkbench",
          "source": "Workbench. java:244"
        },
        {
          "method": "org.eclipse.ui.PlatformUI.createAndRunWorkbench",
          "source": "PlatformUI.java:140"
        },
        {
          "method": "org.eclipse.ui.internal.ide.IDEApplication.run",
          "source": "IDEApplication.java: 90"
        },
        {
          "method": "org.eclipse.core.internal.runtime.PlatformActivator$1.run",
          "source": "PlatformActivator.java:280"
        },
        {
          "method": "org.eclipse.core.runtime.adaptor.EclipseStarter.run",
          "source": "EclipseStarter. java:240"
        },
        {
          "method": "org.eclipse.core.runtime.adaptor.EclipseStarter.run",
          "source": "EclipseStarter. java:117"
        },
        {
          "method": "sun.reflect.NativeMethodAccessorImpl.invoke0",
          "source": "Native Method"
        },
        {
          "method": "sun.reflect.NativeMethodAccessorImpl.invoke",
          "source": "NativeMethodAccessorImpl. java:84"
        },
        {
          "method": "sun.reflect.NativeMethodAccessorImpl.invoke",
          "source": "NativeMethodAccessorImpl. java:57"
        },
        {
          "method": "sun.reflect.DelegatingMethodAccessorImpl.invoke",
          "source": "DelegatingMethodAccessorImpl.java:59"
        },
        {
          "method": "java.lang.reflect.Method.invoke",
          "source": "Method.java:389"
        },
        {
          "method": "org.eclipse.core.launcher.Main.basicRun",
          "source": "Main.java:267"
        },
        {
          "method": "org.eclipse.core.launcher.Main.run",
          "source": "Main.java:699"
        },
        {
          "method": "org.eclipse.core.launcher.Main.main",
          "source": "Main.java:683"
        }
      ],
      "number": 0,
      "commentIndex": 0,
      "bugId": "60380",
      "duplicateId": "55814",
      "date": "2004-04-29T10:13:00+02:00",
      "product": "JDT",
      "component": "Text",
      "severity": "critical"
    },
    {
      "exceptionType": "org.eclipse.jface.text.Assert$AssertionFailedException",
      "message": "Assertion failed:",
      "elements": [
        {
          "method": "java.lang.Throwable.\u003cinit\u003e",
          "source": "Throwable.java"
        },
        {
          "method": "java.lang.Throwable.\u003cinit\u003e",
          "source": "Throwable.java"
        },
        {
          "method": "org.eclipse.jface.text.Assert$AssertionFailedException.\u003cinit\u003e",
          "source": "Assert. java:56"
        },
        {
          "method": "org.eclipse.jface.text.Assert.isTrue",
          "source": "Assert.java:177"
        },
        {
          "method": "org.eclipse.jface.text.Assert.isTrue",
          "source": "Assert.java"
        },
        {
          "method": "org.eclipse.jface.text.projection.ProjectionMapping.toImageRegion",
          "source": "ProjectionMapping.java"
        },
        {
          "method": "org.eclipse.jface.text.projection.ProjectionMapping.toImageRegion",
          "source": "ProjectionMapping.java"
        },
        {
          "method": "org.eclipse.jface.text.TextViewer.modelRange2WidgetRange",
          "source": "TextViewer. java"
        },
        {
          "method": "org.eclipse.jface.text.source.AnnotationRulerColumn.doPaint1",
          "source": "AnnotationRulerColumn.java:504"
        },
        {
          "method": "org.eclipse.jface.text.source.AnnotationRulerColumn.doubleBufferPaint",
          "source": "AnnotationRulerColumn.java:312"
        },
        {
          "method": "org.eclipse.jface.text.source.AnnotationRulerColumn.access$3",
          "source": "AnnotationRulerColumn.java:288"
        },
        {
          "method": "org.eclipse.jface.text.source.AnnotationRulerColumn$1.paintControl",
          "source": "AnnotationRulerColumn.java:207"
        },
        {
          "method": "org.eclipse.swt.widgets.TypedListener.handleEvent",
          "source": "TypedListener.java: 82"
        },
        {
          "method": "org.eclipse.swt.widgets.EventTable.sendEvent",
          "source": "EventTable.java"
        },
        {
          "method": "org.eclipse.swt.widgets.Widget.sendEvent",
          "source": "Widget.java"
        },
        {
          "method": "org.eclipse.swt.widgets.Widget.sendEvent",
          "source": "Widget.java"
        },
        {
          "method": "org.eclipse.swt.widgets.Widget.sendEvent",
          "source": "Widget.java"
        },
        {
          "method": "org.eclipse.swt.widgets.Composite.WM_PAINT",
          "source": "Composite.java"
        },
        {
          "method": "org.eclipse.swt.widgets.Control.windowProc",
          "source": "Control.java"
        },
        {
          "method": "org.eclipse.swt.widgets.Display.windowProc",
          "source": "Display.java"
        },
        {
          "method": "org.eclipse.swt.internal.win32.OS.RedrawWindow",
          "source": "Native Method"
        },
        {
          "method": "org.eclipse.swt.widgets.Control.update",
          "source": "Control.java:2847"
        },
        {
          "method": "org.eclipse.swt.widgets.Display.update",
          "source": "Display.java:3065"
        },
        {
          "method": "org.eclipse.jface.window.Window.runEventLoop",
          "source": "Window.java"
        },
        {
          "method": "org.eclipse.jface.window.Window.open",
          "source": "Window.java:650"
        },
        {
          "method": "org.eclipse.jface.dialogs.MessageDialog.openError",
          "source": "MessageDialog.java: 287"
        },
        {
          "method": "org.eclipse.jface.util.SafeRunnable.handleException",
          "source": "SafeRunnable. java:50"
        },
        {
          "method": "org.eclipse.jface.viewers.StructuredViewer$3.handleException",
          "source": "StructuredViewer.java:434"
        },
        {
          "method": "org.eclipse.core.internal.runtime.InternalPlatform.handleException",
          "source": "InternalPlatform.java:333"
        },
        {
          "method": "org.eclipse.core.internal.runtime.InternalPlatform.run",
          "source": "InternalPlatform.java"
        },
        {
          "method": "org.eclipse.core.runtime.Platform.run",
          "source": "Platform.java"
        },
        {
          "method": "org.eclipse.jface.viewers.StructuredViewer.firePostSelectionChanged",
          "source": "StructuredViewer.java:429"
        },
        {
          "method": "org.eclipse.jface.viewers.StructuredViewer.handlePostSelect",
          "source": "StructuredViewer.java:680"
        },
        {
          "method": "org.eclipse.jface.viewers.StructuredViewer$5.widgetSelected",
          "source": "StructuredViewer.java:698"
        },
        {
          "method": "org.eclipse.jface.util.OpenStrategy.firePostSelectionEvent",
          "source": "OpenStrategy.java:198"
        },
        {
          "method": "org.eclipse.jface.util.OpenStrategy.access$4",
          "source": "OpenStrategy.java:193"
        },
        {
          "method": "org.eclipse.jface.util.OpenStrategy$3.run",
          "source": "OpenStrategy.java:334"
        },
        {
          "method": "org.eclipse.swt.widgets.RunnableLock.run",
          "source": "RunnableLock.java:35"
        },
        {
          "method": "org.eclipse.swt.widgets.Synchronizer.runAsyncMessages",
          "source": "Synchronizer. java"
        },
        {
          "method": "org.eclipse.swt.widgets.Display.runAsyncMessages",
          "source": "Display.java"
        },
        {
          "method": "org.eclipse.swt.widgets.Display.readAndDispatch",
          "source": "Display.java"
        },
        {
          "method": "org.eclipse.ui.internal.Workbench.runEventLoop",
          "source": "Workbench.java:1437"
        },
        {
          "method": "org.eclipse.ui.internal.Workbench.runUI",
          "source": "Workbench.java:1408"
        },
        {
          "method": "org.eclipse.ui.internal.Workbench.createAndRunWorkbench",
          "source": "Workbench. java:244"
        },
        {
          "method": "org.eclipse.ui.PlatformUI.createAndRunWorkbench",
          "source": "PlatformUI.java:140"
        },
        {
          "method": "org.eclipse.ui.internal.ide.IDEApplication.run",
          "source": "IDEApplication.java: 90"
        },
        {
          "method": "org.eclipse.core.internal.runtime.PlatformActivator$1.run",
          "source": "PlatformActivator.java:280"
        },
        {
          "method": "org.eclipse.core.runtime.adaptor.EclipseStarter.run",
          "source": "EclipseStarter. java:240"
        },
        {
          "method": "org.eclipse.core.runtime.adaptor.EclipseStarter.run",
          "source": "EclipseStarter. java:117"
        },
        {
          "method": "sun.reflect.NativeMethodAccessorImpl.invoke0",
          "source": "Native Method"
        },
        {
          "method": "sun.reflect.NativeMethodAccessorImpl.invoke",
          "source": "NativeMethodAccessorImpl. java:84"
        },
        {
          "method": "sun.reflect.NativeMethodAccessorImpl.invoke",
          "source": "NativeMethodAccessorImpl. java:57"
        },
        {
          "method": "sun.reflect.DelegatingMethodAccessorImpl.invoke",
          "source": "DelegatingMethodAccessorImpl.java:59"
        },
        {
          "method": "java.lang.reflect.Method.invoke",
          "source": "Method.java:389"
        },
        {
          "method": "org.eclipse.core.launcher.Main.basicRun",
          "source": "Main.java:267"
        },
        {
          "method": "org.eclipse.core.launcher.Main.run",
          "source": "Main.java:699"
        },
        {
          "method": "org.eclipse.core.launcher.Main.main",
          "source": "Main.java:683"
        }
      ],
      "number": 1,
      "commentIndex": 0,
      "bugId": "60380",
      "duplicateId": "55814",
      "date": "2004-04-29T10:13:00+02:00",
      "product": "JDT",
      "component": "Text",
      "severity": "critical"
    }
  ],
  "groupId": "55814",
  "bugId": "60380",
  "duplicateId": "55814",
  "date": "2004-04-29T10:13:00+02:00",
  "product": "JDT",
  "component": "Text",
  "severity": "critical"
}