{
  "comments": [
    "After running Eclipse for some period of time, Eclipse stops responding to \nmouse input.  It is still responsive to keyboard input.  While it is possible \nto open menus, selecting menu items does nothing.  By clicking on the \"X\" in \nthe top-right corner of the window, it is possible to shutdown Eclipse.  If \nEclipse is shutdown while this problem is occurring, the following \nNullPointerException occurs. \n \nI200404281424.  GTK+ 2.4.0. \n \n \n \n!ENTRY org.eclipse.ui 4 4 Apr 29, 2004 13:21:12.737 \n!MESSAGE Unhandled event loop exception \n!ENTRY org.eclipse.ui 4 0 Apr 29, 2004 13:21:12.737 \n!MESSAGE Failed to execute runnable (java.lang.NullPointerException) \n!STACK 0 \norg.eclipse.swt.SWTException: Failed to execute runnable \n(java.lang.NullPointerException) \n        at org.eclipse.swt.SWT.error(SWT.java:2680) \n        at org.eclipse.swt.SWT.error(SWT.java:2605) \n        at \norg.eclipse.swt.widgets.Synchronizer.runAsyncMessages(Synchronizer.java:109) \n        at org.eclipse.swt.widgets.Display.runAsyncMessages(Display.java:1996) \n        at org.eclipse.swt.widgets.Display.readAndDispatch(Display.java:1786) \n        at org.eclipse.ui.internal.Workbench.runEventLoop(Workbench.java:1353) \n        at org.eclipse.ui.internal.Workbench.runUI(Workbench.java:1324) \n        at \norg.eclipse.ui.internal.Workbench.createAndRunWorkbench(Workbench.java:240) \n        at org.eclipse.ui.PlatformUI.createAndRunWorkbench(PlatformUI.java:140) \n        at \norg.eclipse.ui.internal.ide.IDEApplication.run(IDEApplication.java:90) \n        at \norg.eclipse.core.internal.runtime.PlatformActivator$1.run(PlatformActivator.java:283) \n        at \norg.eclipse.core.runtime.adaptor.EclipseStarter.run(EclipseStarter.java:240) \n        at \norg.eclipse.core.runtime.adaptor.EclipseStarter.run(EclipseStarter.java:117) \n        at sun.reflect.NativeMethodAccessorImpl.invoke0(Native Method) \n        at \nsun.reflect.NativeMethodAccessorImpl.invoke(NativeMethodAccessorImpl.java:39) \n        at \nsun.reflect.DelegatingMethodAccessorImpl.invoke(DelegatingMethodAccessorImpl.java:25) \n        at java.lang.reflect.Method.invoke(Method.java:324) \n        at org.eclipse.core.launcher.Main.basicRun(Main.java:269) \n        at org.eclipse.core.launcher.Main.run(Main.java:700) \n        at org.eclipse.core.launcher.Main.main(Main.java:684) \n!ENTRY org.eclipse.ui 4 4 Apr 29, 2004 13:21:12.739 \n!MESSAGE *** SWT nested exception \n!ENTRY org.eclipse.ui 4 0 Apr 29, 2004 13:21:12.739 \n!MESSAGE java.lang.NullPointerException \n!STACK 0 \njava.lang.NullPointerException \n        at \norg.eclipse.jface.text.contentassist.CompletionProposalPopup.showProposals(CompletionProposalPopup.java:194) \n        at \norg.eclipse.jface.text.contentassist.ContentAssistant$2.run(ContentAssistant.java:322) \n        at org.eclipse.swt.widgets.RunnableLock.run(RunnableLock.java:35) \n        at \norg.eclipse.swt.widgets.Synchronizer.runAsyncMessages(Synchronizer.java:106) \n        at org.eclipse.swt.widgets.Display.runAsyncMessages(Display.java:1996) \n        at org.eclipse.swt.widgets.Display.readAndDispatch(Display.java:1786) \n        at org.eclipse.ui.internal.Workbench.runEventLoop(Workbench.java:1353) \n        at org.eclipse.ui.internal.Workbench.runUI(Workbench.java:1324) \n        at \norg.eclipse.ui.internal.Workbench.createAndRunWorkbench(Workbench.java:240) \n        at org.eclipse.ui.PlatformUI.createAndRunWorkbench(PlatformUI.java:140) \n        at \norg.eclipse.ui.internal.ide.IDEApplication.run(IDEApplication.java:90) \n        at \norg.eclipse.core.internal.runtime.PlatformActivator$1.run(PlatformActivator.java:283) \n        at \norg.eclipse.core.runtime.adaptor.EclipseStarter.run(EclipseStarter.java:240) \n        at \norg.eclipse.core.runtime.adaptor.EclipseStarter.run(EclipseStarter.java:117) \n        at sun.reflect.NativeMethodAccessorImpl.invoke0(Native Method) \n        at \nsun.reflect.NativeMethodAccessorImpl.invoke(NativeMethodAccessorImpl.java:39) \n        at \nsun.reflect.DelegatingMethodAccessorImpl.invoke(DelegatingMethodAccessorImpl.java:25) \n        at java.lang.reflect.Method.invoke(Method.java:324) \n        at org.eclipse.core.launcher.Main.basicRun(Main.java:269) \n        at org.eclipse.core.launcher.Main.run(Main.java:700) \n        at org.eclipse.core.launcher.Main.main(Main.java:684)",
    "The exception stems from content assist being invoked by the auto-assist\nlistener (auto-popup typing . after some delay) that has nothing to do with the\nmouse.\n\nDo you always get the mentioned exception or was that just once?\n",
    "Fixed the NPE. Moving to Platform UI for comment since the NPE most likely isn\u0027t\nthe cause for the reported problem.",
    "I\u0027ve seen similar weirdness in the last integration build.  Initiating a drag\nkilled gnome entirely - the mouse pointer was stuck with the drag image.  Moving\nthe mouse was possible, but no part of the UI (eclipse or otherwise) was\nresponsive to mouse input.  Billy suggested this was a consequence of the patch\nfor Bug 58575.  I\u0027ve been trying to reproduce this but without success.",
    "Event re-ordering?  Please investigate for 3.0. ",
    "This problem was caused by the event re-ordering in Display.update().\n\nFixed \u003e 20040406.\n"
  ],
  "commentCreationDates": [
    "2004-04-29T19:35:03+02:00",
    "2004-04-30T10:24:10+02:00",
    "2004-04-30T12:58:30+02:00",
    "2004-04-30T14:46:51+02:00",
    "2004-04-30T16:17:48+02:00",
    "2004-05-07T00:31:25+02:00"
  ],
  "traces": [
    {
      "exceptionType": "org.eclipse.swt.SWTException",
      "message": "Failed to execute runnable  (java.lang.NullPointerException)",
      "elements": [
        {
          "method": "org.eclipse.swt.SWT.error",
          "source": "SWT.java:2680"
        },
        {
          "method": "org.eclipse.swt.SWT.error",
          "source": "SWT.java:2605"
        },
        {
          "method": "org.eclipse.swt.widgets.Synchronizer.runAsyncMessages",
          "source": "Synchronizer.java:109"
        },
        {
          "method": "org.eclipse.swt.widgets.Display.runAsyncMessages",
          "source": "Display.java:1996"
        },
        {
          "method": "org.eclipse.swt.widgets.Display.readAndDispatch",
          "source": "Display.java:1786"
        },
        {
          "method": "org.eclipse.ui.internal.Workbench.runEventLoop",
          "source": "Workbench.java:1353"
        },
        {
          "method": "org.eclipse.ui.internal.Workbench.runUI",
          "source": "Workbench.java:1324"
        },
        {
          "method": "org.eclipse.ui.internal.Workbench.createAndRunWorkbench",
          "source": "Workbench.java:240"
        },
        {
          "method": "org.eclipse.ui.PlatformUI.createAndRunWorkbench",
          "source": "PlatformUI.java:140"
        },
        {
          "method": "org.eclipse.ui.internal.ide.IDEApplication.run",
          "source": "IDEApplication.java:90"
        },
        {
          "method": "org.eclipse.core.internal.runtime.PlatformActivator$1.run",
          "source": "PlatformActivator.java:283"
        },
        {
          "method": "org.eclipse.core.runtime.adaptor.EclipseStarter.run",
          "source": "EclipseStarter.java:240"
        },
        {
          "method": "org.eclipse.core.runtime.adaptor.EclipseStarter.run",
          "source": "EclipseStarter.java:117"
        },
        {
          "method": "sun.reflect.NativeMethodAccessorImpl.invoke0",
          "source": "Native Method"
        },
        {
          "method": "sun.reflect.NativeMethodAccessorImpl.invoke",
          "source": "NativeMethodAccessorImpl.java:39"
        },
        {
          "method": "sun.reflect.DelegatingMethodAccessorImpl.invoke",
          "source": "DelegatingMethodAccessorImpl.java:25"
        },
        {
          "method": "java.lang.reflect.Method.invoke",
          "source": "Method.java:324"
        },
        {
          "method": "org.eclipse.core.launcher.Main.basicRun",
          "source": "Main.java:269"
        },
        {
          "method": "org.eclipse.core.launcher.Main.run",
          "source": "Main.java:700"
        },
        {
          "method": "org.eclipse.core.launcher.Main.main",
          "source": "Main.java:684"
        }
      ],
      "number": 0,
      "commentIndex": 0,
      "bugId": "60471",
      "date": "2004-04-29T19:35:03+02:00",
      "product": "Platform",
      "component": "SWT",
      "severity": "normal"
    },
    {
      "exceptionType": "java.lang.NullPointerException",
      "elements": [
        {
          "method": "org.eclipse.jface.text.contentassist.CompletionProposalPopup.showProposals",
          "source": "CompletionProposalPopup.java:194"
        },
        {
          "method": "org.eclipse.jface.text.contentassist.ContentAssistant$2.run",
          "source": "ContentAssistant.java:322"
        },
        {
          "method": "org.eclipse.swt.widgets.RunnableLock.run",
          "source": "RunnableLock.java:35"
        },
        {
          "method": "org.eclipse.swt.widgets.Synchronizer.runAsyncMessages",
          "source": "Synchronizer.java:106"
        },
        {
          "method": "org.eclipse.swt.widgets.Display.runAsyncMessages",
          "source": "Display.java:1996"
        },
        {
          "method": "org.eclipse.swt.widgets.Display.readAndDispatch",
          "source": "Display.java:1786"
        },
        {
          "method": "org.eclipse.ui.internal.Workbench.runEventLoop",
          "source": "Workbench.java:1353"
        },
        {
          "method": "org.eclipse.ui.internal.Workbench.runUI",
          "source": "Workbench.java:1324"
        },
        {
          "method": "org.eclipse.ui.internal.Workbench.createAndRunWorkbench",
          "source": "Workbench.java:240"
        },
        {
          "method": "org.eclipse.ui.PlatformUI.createAndRunWorkbench",
          "source": "PlatformUI.java:140"
        },
        {
          "method": "org.eclipse.ui.internal.ide.IDEApplication.run",
          "source": "IDEApplication.java:90"
        },
        {
          "method": "org.eclipse.core.internal.runtime.PlatformActivator$1.run",
          "source": "PlatformActivator.java:283"
        },
        {
          "method": "org.eclipse.core.runtime.adaptor.EclipseStarter.run",
          "source": "EclipseStarter.java:240"
        },
        {
          "method": "org.eclipse.core.runtime.adaptor.EclipseStarter.run",
          "source": "EclipseStarter.java:117"
        },
        {
          "method": "sun.reflect.NativeMethodAccessorImpl.invoke0",
          "source": "Native Method"
        },
        {
          "method": "sun.reflect.NativeMethodAccessorImpl.invoke",
          "source": "NativeMethodAccessorImpl.java:39"
        },
        {
          "method": "sun.reflect.DelegatingMethodAccessorImpl.invoke",
          "source": "DelegatingMethodAccessorImpl.java:25"
        },
        {
          "method": "java.lang.reflect.Method.invoke",
          "source": "Method.java:324"
        },
        {
          "method": "org.eclipse.core.launcher.Main.basicRun",
          "source": "Main.java:269"
        },
        {
          "method": "org.eclipse.core.launcher.Main.run",
          "source": "Main.java:700"
        },
        {
          "method": "org.eclipse.core.launcher.Main.main",
          "source": "Main.java:684"
        }
      ],
      "number": 1,
      "commentIndex": 0,
      "bugId": "60471",
      "date": "2004-04-29T19:35:03+02:00",
      "product": "Platform",
      "component": "SWT",
      "severity": "normal"
    }
  ],
  "groupId": "60471",
  "bugId": "60471",
  "date": "2004-04-29T19:35:03+02:00",
  "product": "Platform",
  "component": "SWT",
  "severity": "normal"
}