{
  "comments": [
    "in i05051045\n\nI was having trouble getting source for java.net.URL so I used the Add Source \nContainer button and selected the JRE library then clicked OK.  Nothing \nappeared to happen.  I looked in my log and found several of the following \nentries.  The timestamp indicates that they just happened.\n\nI don\u0027t have much more info unfortunately.\n\n!ENTRY org.eclipse.ui 4 4 May 07, 2004 00:21:10.409\n!MESSAGE Unhandled event loop exception\nUnhandled event loop exception\nReason:\n!ENTRY org.eclipse.ui 4 0 May 07, 2004 00:21:10.419\n!MESSAGE java.lang.NullPointerException\n!STACK 0\njava.lang.NullPointerException\n        at \norg.eclipse.jdt.internal.launching.ClasspathContainerSourceContainerTypeDelegate\n.getMemento(ClasspathContaine\nrSourceContainerTypeDelegate.java:56)\n        at \norg.eclipse.debug.internal.core.sourcelookup.SourceContainerType.getMemento\n(SourceContainerType.java:55)\n        at \norg.eclipse.debug.core.sourcelookup.AbstractSourceLookupDirector.getMemento\n(AbstractSourceLookupDirector.java\n:366)\n        at \norg.eclipse.debug.internal.ui.sourcelookup.SourceLookupPanel.performApply\n(SourceLookupPanel.java:365)\n        at org.eclipse.debug.ui.sourcelookup.SourceLookupDialog.okPressed\n(SourceLookupDialog.java:95)\n        at org.eclipse.jface.dialogs.Dialog.buttonPressed(Dialog.java:351)\n        at org.eclipse.jface.dialogs.Dialog$2.widgetSelected(Dialog.java:491)\n        at org.eclipse.swt.widgets.TypedListener.handleEvent\n(TypedListener.java:89)\n        at org.eclipse.swt.widgets.EventTable.sendEvent(EventTable.java:82)\n        at org.eclipse.swt.widgets.Widget.sendEvent(Widget.java:796)\n        at org.eclipse.swt.widgets.Display.runDeferredEvents(Display.java:2594)\n        at org.eclipse.swt.widgets.Display.readAndDispatch(Display.java:2272)\n        at org.eclipse.jface.window.Window.runEventLoop(Window.java:668)\n        at org.eclipse.jface.window.Window.open(Window.java:648)\n        at \norg.eclipse.debug.internal.ui.sourcelookup.CommonSourceNotFoundEditor.buttonSele\ncted(CommonSourceNotFoundEdit\nor.java:204)\n        at \norg.eclipse.debug.internal.ui.sourcelookup.CommonSourceNotFoundEditor.access$0\n(CommonSourceNotFoundEditor.jav\na:182)\n        at \norg.eclipse.debug.internal.ui.sourcelookup.CommonSourceNotFoundEditor$1.widgetSe\nlected(CommonSourceNotFoundEd\nitor.java:168)\n        at org.eclipse.swt.widgets.TypedListener.handleEvent\n(TypedListener.java:89)\n        at org.eclipse.swt.widgets.EventTable.sendEvent(EventTable.java:82)\n        at org.eclipse.swt.widgets.Widget.sendEvent(Widget.java:796)\n        at org.eclipse.swt.widgets.Display.runDeferredEvents(Display.java:2594)\n        at org.eclipse.swt.widgets.Display.readAndDispatch(Display.java:2272)\n        at org.eclipse.ui.internal.Workbench.runEventLoop(Workbench.java:1353)\n        at org.eclipse.ui.internal.Workbench.runUI(Workbench.java:1324)\n        at org.eclipse.ui.internal.Workbench.createAndRunWorkbench\n(Workbench.java:243)\n        at org.eclipse.ui.PlatformUI.createAndRunWorkbench(PlatformUI.java:140)\n        at org.eclipse.ui.internal.ide.IDEApplication.run\n(IDEApplication.java:90)\n        at org.eclipse.core.internal.runtime.PlatformActivator$1.run\n(PlatformActivator.java:283)\n        at org.eclipse.core.runtime.adaptor.EclipseStarter.run\n(EclipseStarter.java:243)\n        at org.eclipse.core.runtime.adaptor.EclipseStarter.run\n(EclipseStarter.java:120)\n        at sun.reflect.NativeMethodAccessorImpl.invoke0(Native Method)\n        at sun.reflect.NativeMethodAccessorImpl.invoke\n(NativeMethodAccessorImpl.java:39)\n        at sun.reflect.DelegatingMethodAccessorImpl.invoke\n(DelegatingMethodAccessorImpl.java:25)\n        at java.lang.reflect.Method.invoke(Method.java:324)\n        at org.eclipse.core.launcher.Main.basicRun(Main.java:269)\n        at org.eclipse.core.launcher.Main.run(Main.java:700)\n        at org.eclipse.core.launcher.Main.main(Main.java:684)\njava.lang.NullPointerException",
    "\n\n*** This bug has been marked as a duplicate of 58554 ***"
  ],
  "commentCreationDates": [
    "2004-05-07T06:37:34+02:00",
    "2004-05-07T15:49:28+02:00"
  ],
  "traces": [
    {
      "exceptionType": "java.lang.NullPointerException",
      "elements": [
        {
          "method": "org.eclipse.jdt.internal.launching.ClasspathContainerSourceContainerTypeDelegate.getMemento",
          "source": "ClasspathContaine rSourceContainerTypeDelegate.java:56"
        },
        {
          "method": "org.eclipse.debug.internal.core.sourcelookup.SourceContainerType.getMemento",
          "source": "SourceContainerType.java:55"
        },
        {
          "method": "org.eclipse.debug.core.sourcelookup.AbstractSourceLookupDirector.getMemento",
          "source": "AbstractSourceLookupDirector.java :366"
        },
        {
          "method": "org.eclipse.debug.internal.ui.sourcelookup.SourceLookupPanel.performApply",
          "source": "SourceLookupPanel.java:365"
        },
        {
          "method": "org.eclipse.debug.ui.sourcelookup.SourceLookupDialog.okPressed",
          "source": "SourceLookupDialog.java:95"
        },
        {
          "method": "org.eclipse.jface.dialogs.Dialog.buttonPressed",
          "source": "Dialog.java:351"
        },
        {
          "method": "org.eclipse.jface.dialogs.Dialog$2.widgetSelected",
          "source": "Dialog.java:491"
        },
        {
          "method": "org.eclipse.swt.widgets.TypedListener.handleEvent",
          "source": "TypedListener.java:89"
        },
        {
          "method": "org.eclipse.swt.widgets.EventTable.sendEvent",
          "source": "EventTable.java:82"
        },
        {
          "method": "org.eclipse.swt.widgets.Widget.sendEvent",
          "source": "Widget.java:796"
        },
        {
          "method": "org.eclipse.swt.widgets.Display.runDeferredEvents",
          "source": "Display.java:2594"
        },
        {
          "method": "org.eclipse.swt.widgets.Display.readAndDispatch",
          "source": "Display.java:2272"
        },
        {
          "method": "org.eclipse.jface.window.Window.runEventLoop",
          "source": "Window.java:668"
        },
        {
          "method": "org.eclipse.jface.window.Window.open",
          "source": "Window.java:648"
        },
        {
          "method": "org.eclipse.debug.internal.ui.sourcelookup.CommonSourceNotFoundEditor.buttonSelected",
          "source": "CommonSourceNotFoundEdit or.java:204"
        },
        {
          "method": "org.eclipse.debug.internal.ui.sourcelookup.CommonSourceNotFoundEditor.access$0",
          "source": "CommonSourceNotFoundEditor.jav a:182"
        },
        {
          "method": "org.eclipse.debug.internal.ui.sourcelookup.CommonSourceNotFoundEditor$1.widgetSelected",
          "source": "CommonSourceNotFoundEd itor.java:168"
        },
        {
          "method": "org.eclipse.swt.widgets.TypedListener.handleEvent",
          "source": "TypedListener.java:89"
        },
        {
          "method": "org.eclipse.swt.widgets.EventTable.sendEvent",
          "source": "EventTable.java:82"
        },
        {
          "method": "org.eclipse.swt.widgets.Widget.sendEvent",
          "source": "Widget.java:796"
        },
        {
          "method": "org.eclipse.swt.widgets.Display.runDeferredEvents",
          "source": "Display.java:2594"
        },
        {
          "method": "org.eclipse.swt.widgets.Display.readAndDispatch",
          "source": "Display.java:2272"
        },
        {
          "method": "org.eclipse.ui.internal.Workbench.runEventLoop",
          "source": "Workbench.java:1353"
        },
        {
          "method": "org.eclipse.ui.internal.Workbench.runUI",
          "source": "Workbench.java:1324"
        },
        {
          "method": "org.eclipse.ui.internal.Workbench.createAndRunWorkbench",
          "source": "Workbench.java:243"
        },
        {
          "method": "org.eclipse.ui.PlatformUI.createAndRunWorkbench",
          "source": "PlatformUI.java:140"
        },
        {
          "method": "org.eclipse.ui.internal.ide.IDEApplication.run",
          "source": "IDEApplication.java:90"
        },
        {
          "method": "org.eclipse.core.internal.runtime.PlatformActivator$1.run",
          "source": "PlatformActivator.java:283"
        },
        {
          "method": "org.eclipse.core.runtime.adaptor.EclipseStarter.run",
          "source": "EclipseStarter.java:243"
        },
        {
          "method": "org.eclipse.core.runtime.adaptor.EclipseStarter.run",
          "source": "EclipseStarter.java:120"
        },
        {
          "method": "sun.reflect.NativeMethodAccessorImpl.invoke0",
          "source": "Native Method"
        },
        {
          "method": "sun.reflect.NativeMethodAccessorImpl.invoke",
          "source": "NativeMethodAccessorImpl.java:39"
        },
        {
          "method": "sun.reflect.DelegatingMethodAccessorImpl.invoke",
          "source": "DelegatingMethodAccessorImpl.java:25"
        },
        {
          "method": "java.lang.reflect.Method.invoke",
          "source": "Method.java:324"
        },
        {
          "method": "org.eclipse.core.launcher.Main.basicRun",
          "source": "Main.java:269"
        },
        {
          "method": "org.eclipse.core.launcher.Main.run",
          "source": "Main.java:700"
        },
        {
          "method": "org.eclipse.core.launcher.Main.main",
          "source": "Main.java:684"
        }
      ],
      "number": 0,
      "commentIndex": 0,
      "bugId": "61354",
      "duplicateId": "58554",
      "date": "2004-05-07T06:37:34+02:00",
      "product": "JDT",
      "component": "Debug",
      "severity": "normal"
    }
  ],
  "groupId": "58554",
  "bugId": "61354",
  "duplicateId": "58554",
  "date": "2004-05-07T06:37:34+02:00",
  "product": "JDT",
  "component": "Debug",
  "severity": "normal"
}