{
  "comments": [
    "Build 20011115\n\nWhen trying to evaluate the following snippet in a project \nhaving \u0027org.eclipse.jdt.core\u0027 on its classpath:\n\n[org.eclipse.jdt.internal.compiler.util.ObjectSet set \u003d new \norg.eclipse.jdt.internal.compiler.util.ObjectSet();\njava.util.Enumeration elements \u003d set.elements();\nwhile (elements.hasMoreElements()){\n\tSystem.out.println(elements.nextElement());\n}]\n\nI get the following stack trace:\n\njava.lang.NullPointerException\n        at org.eclipse.jdt.internal.debug.eval.LocalEvaluationEngine.deploy(Loca\nlEvaluationEngine.java:630)\n        at org.eclipse.jdt.internal.debug.eval.LocalEvaluationEngine.acceptClass\nFiles(LocalEvaluationEngine.java:170)\n        at org.eclipse.jdt.internal.core.eval.RequestorWrapper.acceptClassFiles(\nRequestorWrapper.java:41)\n        at org.eclipse.jdt.internal.eval.EvaluationContext.deployCodeSnippetClas\nsIfNeeded(EvaluationContext.java:134)\n        at org.eclipse.jdt.internal.eval.EvaluationContext.evaluate(EvaluationCo\nntext.java:173)\n        at org.eclipse.jdt.internal.eval.EvaluationContext.evaluate(EvaluationCo\nntext.java:239)\n        at org.eclipse.jdt.internal.core.eval.EvaluationContextWrapper.evaluateC\nodeSnippet(EvaluationContextWrapper.java:186)\n        at org.eclipse.jdt.internal.debug.eval.LocalEvaluationEngine$1.run(Local\nEvaluationEngine.java:395)\n        at java.lang.Thread.run(Thread.java:484)",
    "In build 20011120, it works for me:\n\n* I made a new java project in my workspace\n* added \"org.eclipse.jdt.core\" as a required project on the build path.\n* evaluated the expression, and received \"(No explicit return value)\" as the \nresult.\n\nDoes this work for you in the 11/20 build?"
  ],
  "commentCreationDates": [
    "2001-11-21T11:55:40+01:00",
    "2001-11-21T14:18:01+01:00"
  ],
  "traces": [
    {
      "exceptionType": "java.lang.NullPointerException",
      "elements": [
        {
          "method": "org.eclipse.jdt.internal.debug.eval.LocalEvaluationEngine.deploy",
          "source": "Loca lEvaluationEngine.java:630"
        },
        {
          "method": "org.eclipse.jdt.internal.debug.eval.LocalEvaluationEngine.acceptClassFiles",
          "source": "LocalEvaluationEngine.java:170"
        },
        {
          "method": "org.eclipse.jdt.internal.core.eval.RequestorWrapper.acceptClassFiles",
          "source": " RequestorWrapper.java:41"
        },
        {
          "method": "org.eclipse.jdt.internal.eval.EvaluationContext.deployCodeSnippetClassIfNeeded",
          "source": "EvaluationContext.java:134"
        },
        {
          "method": "org.eclipse.jdt.internal.eval.EvaluationContext.evaluate",
          "source": "EvaluationCo ntext.java:173"
        },
        {
          "method": "org.eclipse.jdt.internal.eval.EvaluationContext.evaluate",
          "source": "EvaluationCo ntext.java:239"
        },
        {
          "method": "org.eclipse.jdt.internal.core.eval.EvaluationContextWrapper.evaluateCodeSnippet",
          "source": "EvaluationContextWrapper.java:186"
        },
        {
          "method": "org.eclipse.jdt.internal.debug.eval.LocalEvaluationEngine$1.run",
          "source": "Local EvaluationEngine.java:395"
        },
        {
          "method": "java.lang.Thread.run",
          "source": "Thread.java:484"
        }
      ],
      "number": 0,
      "commentIndex": 0,
      "bugId": "6156",
      "date": "2001-11-21T11:55:40+01:00",
      "product": "JDT",
      "component": "Debug",
      "severity": "normal"
    }
  ],
  "groupId": "6156",
  "bugId": "6156",
  "date": "2001-11-21T11:55:40+01:00",
  "product": "JDT",
  "component": "Debug",
  "severity": "normal"
}