{
  "comments": [
    "I200405111600\nI\u0027ve seen this before so it\u0027s not new in this build. I selected 3 or 4 lines \nand pressed Control-X (cut) and got a dialog that said \"A SWT error has \noccurred. You are recommended to exit the workbench\". The same thing happens \nif I press Control-C (copy). The text does get into the clipboard but is \nsometimes not cut from the original source file (Java code). (Note: I saw \nbugzilla entries with similar but not quite the same traceback so this may or \nmay not be a dup.) Windows XP SP1, JDK1.4.2_04.\n\nError May 11, 2004 21:56:41.728 Cannot set data in clipboard\norg.eclipse.swt.SWTError: Cannot set data in clipboard\nat org.eclipse.swt.dnd.DND.error(DND.java:225)\nat org.eclipse.swt.dnd.DND.error(DND.java:181)\nat org.eclipse.swt.dnd.Clipboard.setContents(Clipboard.java:289)\nat \norg.eclipse.jdt.internal.ui.javaeditor.ClipboardOperationAction.doCutCopyWithIm\nportsOperation(ClipboardOperationAction.java:301)\nat \norg.eclipse.jdt.internal.ui.javaeditor.ClipboardOperationAction.internalDoOpera\ntion(ClipboardOperationAction.java:245)\nat org.eclipse.jdt.internal.ui.javaeditor.ClipboardOperationAction$1.run\n(ClipboardOperationAction.java:223)\nat org.eclipse.swt.custom.BusyIndicator.showWhile(BusyIndicator.java:69)\nat org.eclipse.jdt.internal.ui.javaeditor.ClipboardOperationAction.run\n(ClipboardOperationAction.java:221)\nat org.eclipse.jface.action.Action.runWithEvent(Action.java:881)\nat org.eclipse.ui.commands.ActionHandler.execute(ActionHandler.java:141)\nat org.eclipse.ui.internal.commands.Command.execute(Command.java:132)\nat org.eclipse.ui.internal.keys.WorkbenchKeyboard.executeCommand\n(WorkbenchKeyboard.java:468)\nat org.eclipse.ui.internal.keys.WorkbenchKeyboard.press\n(WorkbenchKeyboard.java:886)\nat org.eclipse.ui.internal.keys.WorkbenchKeyboard.processKeyEvent\n(WorkbenchKeyboard.java:927)\nat org.eclipse.ui.internal.keys.WorkbenchKeyboard.filterKeySequenceBindings\n(WorkbenchKeyboard.java:545)\nat org.eclipse.ui.internal.keys.WorkbenchKeyboard.access$2\n(WorkbenchKeyboard.java:493)\nat org.eclipse.ui.internal.keys.WorkbenchKeyboard$1.handleEvent\n(WorkbenchKeyboard.java:258)\nat org.eclipse.swt.widgets.EventTable.sendEvent(EventTable.java:82)\nat org.eclipse.swt.widgets.Display.filterEvent(Display.java:712)\nat org.eclipse.swt.widgets.Widget.sendEvent(Widget.java:795)\nat org.eclipse.swt.widgets.Widget.sendEvent(Widget.java:820)\nat org.eclipse.swt.widgets.Widget.sendEvent(Widget.java:805)\nat org.eclipse.swt.widgets.Control.sendKeyEvent(Control.java:1724)\nat org.eclipse.swt.widgets.Control.sendKeyEvent(Control.java:1720)\nat org.eclipse.swt.widgets.Control.WM_CHAR(Control.java:3048)\nat org.eclipse.swt.widgets.Control.windowProc(Control.java:2951)\nat org.eclipse.swt.widgets.Display.windowProc(Display.java:3291)\nat org.eclipse.swt.internal.win32.OS.DispatchMessageW(Native Method)\nat org.eclipse.swt.internal.win32.OS.DispatchMessage(OS.java:1466)\nat org.eclipse.swt.widgets.Display.readAndDispatch(Display.java:2388)\nat org.eclipse.ui.internal.Workbench.runEventLoop(Workbench.java:1353)\nat org.eclipse.ui.internal.Workbench.runUI(Workbench.java:1324)\nat org.eclipse.ui.internal.Workbench.createAndRunWorkbench(Workbench.java:243)\nat org.eclipse.ui.PlatformUI.createAndRunWorkbench(PlatformUI.java:141)\nat org.eclipse.ui.internal.ide.IDEApplication.run(IDEApplication.java:90)\nat org.eclipse.core.internal.runtime.PlatformActivator$1.run\n(PlatformActivator.java:298)\nat org.eclipse.core.runtime.adaptor.EclipseStarter.run(EclipseStarter.java:249)\nat org.eclipse.core.runtime.adaptor.EclipseStarter.run(EclipseStarter.java:126)\nat sun.reflect.NativeMethodAccessorImpl.invoke0(Native Method)\nat sun.reflect.NativeMethodAccessorImpl.invoke(Unknown Source)\nat sun.reflect.DelegatingMethodAccessorImpl.invoke(Unknown Source)\nat java.lang.reflect.Method.invoke(Unknown Source)\nat org.eclipse.core.launcher.Main.basicRun(Main.java:269)\nat org.eclipse.core.launcher.Main.run(Main.java:722)\nat org.eclipse.core.launcher.Main.main(Main.java:706)",
    "How reproducable is this?  Is there anything unusual about the text being \ncopied?\n\nVI, this looks similar to bug 44399, but could be a better case for tracking \nthis down.\n",
    "Are you using a tool that manages the Clipboard (such as Deluxe ReGet)?",
    "When it starts doing it, it does it repeatedly on all source files I edit, but \nfor example when I came in this morning and reopened all my files it wouldn\u0027t \ncrash at all.\n\nI\u0027m not currently running anything that would do anything special with the \nclipboard, and I don\u0027t see anything special about the source code.\n",
    "My guess is that there is an exception being thrown when we try to retrieve \nthe data that was set.\n\nI can give you a swt.jar that will report when eclipse tries to put something \nbogus on the clipboard.  If yuo are game to try this, what build would you \nlike it for?",
    "Today\u0027s 4pm I-build would be good. It hasn\u0027t happened all day today (still \nusing I200405111600) so I don\u0027t know if it will reproduce but I\u0027ll give it a \nshot.",
    "Here is an instrumented swt.jar that will work with the I200405121600 build:\n\nhttp://dev.eclipse.org/viewcvs/index.cgi/platform-swt-home/temp/Bug61841/\n\nPlace the swt.jar in eclipse/plugins/org.eclipse.swt.win32_3.0.0/os/win32/x86 \nand then launch eclipse.\n\nNote that swt has no dependency on the rest of eclipse so I can not make use \nof the eclipse error logging system.  As a result, I have printed to standard \nout any time a Transfer subclass throws an exception.  To see the information \nprovided by this instrumented jar, you must launch eclipse with java.exe \ninstead of the usual javaw.exe and look in the dos console for error messages.",
    "Sorry, I am not quite awake yet.  My previous instructions gave the wrong \nplace to put the swt.jar.  They should have read:\n\nPlace the swt.jar in eclipse/plugins/org.eclipse.swt.win32_3.0.0/ws/win32/ \nand then launch eclipse.\n",
    "The best way to download the swt.jar is to go to the following location:\n\nhttp://dev.eclipse.org/viewcvs/index.cgi/platform-swt-\nhome/temp/Bug61841/swt.jar\n\nClick on download in the line Revision 1.2/(download)\n\nand save to the ws/win32 folder mentioned above.",
    "Will that work ok with later builds like 200405130800?",
    "Yes.  It will work with any build that has the following file:\n\neclipse/plugins/org.eclipse.swt.win32_3.0.0/os/win32/x86/swt-win32-3051.dll",
    "I\u0027m not sure what it was supposed to print out but I ran Eclipse with java.exe \nand -console -consoleLog and got the SWT error with the new jar file. Here is \neverything that was printed to the command window. Copy/paste seems to be \nworking ok with other applications (i.e., I pasted this with no problems):\n\n\nosgi\u003e !SESSION May 13, 2004 21:14:03.980 --------------------------------------\n-\n------\neclipse.buildId\u003dI200405130800\njava.version\u003d1.4.2_04\njava.vendor\u003dSun Microsystems Inc.\nBootLoader constants: OS\u003dwin32, ARCH\u003dx86, WS\u003dwin32, NL\u003den_US\n!ENTRY org.eclipse.ui 4 4 May 13, 2004 21:14:04.58\n!MESSAGE Unhandled event loop exception\nUnhandled event loop exception\nReason:\n!ENTRY org.eclipse.ui 4 0 May 13, 2004 21:14:05.668\n!MESSAGE Cannot set data in clipboard\n!STACK 0\norg.eclipse.swt.SWTError: Cannot set data in clipboard\n        at org.eclipse.swt.dnd.DND.error(DND.java:225)\n        at org.eclipse.swt.dnd.DND.error(DND.java:181)\n        at org.eclipse.swt.dnd.Clipboard.setContents(Clipboard.java:291)\n        at \norg.eclipse.jdt.internal.ui.javaeditor.ClipboardOperationAction.doCutCopyWithIm\nportsOperation(ClipboardOperationAction.java:304)\n        at \norg.eclipse.jdt.internal.ui.javaeditor.ClipboardOperationAction.internalDoOpera\ntion(ClipboardOperationAction.java:246)\n        at \norg.eclipse.jdt.internal.ui.javaeditor.ClipboardOperationAction$1.run\n(ClipboardOperationAction.java:224)\n        at org.eclipse.swt.custom.BusyIndicator.showWhile\n(BusyIndicator.java:69)\n\n        at org.eclipse.jdt.internal.ui.javaeditor.ClipboardOperationAction.run\n(ClipboardOperationAction.java:222)\n        at org.eclipse.jface.action.Action.runWithEvent(Action.java:881)\n        at org.eclipse.ui.commands.ActionHandler.execute\n(ActionHandler.java:141)\n\n        at org.eclipse.ui.internal.commands.Command.execute(Command.java:132)\n        at org.eclipse.ui.internal.keys.WorkbenchKeyboard.executeCommand\n(WorkbenchKeyboard.java:468)\n        at org.eclipse.ui.internal.keys.WorkbenchKeyboard.press\n(WorkbenchKeyboard.java:886)\n        at org.eclipse.ui.internal.keys.WorkbenchKeyboard.processKeyEvent\n(WorkbenchKeyboard.java:927)\n        at \norg.eclipse.ui.internal.keys.WorkbenchKeyboard.filterKeySequenceBindi\nngs(WorkbenchKeyboard.java:545)\n        at org.eclipse.ui.internal.keys.WorkbenchKeyboard.access$2\n(WorkbenchKeyboard.java:493)\n        at org.eclipse.ui.internal.keys.WorkbenchKeyboard$1.handleEvent\n(WorkbenchKeyboard.java:258)\n        at org.eclipse.swt.widgets.EventTable.sendEvent(EventTable.java:82)\n        at org.eclipse.swt.widgets.Display.filterEvent(Display.java:712)\n        at org.eclipse.swt.widgets.Widget.sendEvent(Widget.java:795)\n        at org.eclipse.swt.widgets.Widget.sendEvent(Widget.java:820)\n        at org.eclipse.swt.widgets.Widget.sendEvent(Widget.java:805)\n        at org.eclipse.swt.widgets.Control.sendKeyEvent(Control.java:1724)\n        at org.eclipse.swt.widgets.Control.sendKeyEvent(Control.java:1720)\n        at org.eclipse.swt.widgets.Control.WM_CHAR(Control.java:3048)\n        at org.eclipse.swt.widgets.Control.windowProc(Control.java:2951)\n        at org.eclipse.swt.widgets.Display.windowProc(Display.java:3291)\n        at org.eclipse.swt.internal.win32.OS.DispatchMessageW(Native Method)\n        at org.eclipse.swt.internal.win32.OS.DispatchMessage(OS.java:1466)\n        at org.eclipse.swt.widgets.Display.readAndDispatch(Display.java:2388)\n        at org.eclipse.ui.internal.Workbench.runEventLoop(Workbench.java:1353)\n        at org.eclipse.ui.internal.Workbench.runUI(Workbench.java:1324)\n        at org.eclipse.ui.internal.Workbench.createAndRunWorkbench\n(Workbench.java:243)\n        at org.eclipse.ui.PlatformUI.createAndRunWorkbench(PlatformUI.java:141)\n        at org.eclipse.ui.internal.ide.IDEApplication.run\n(IDEApplication.java:90\n)\n        at org.eclipse.core.internal.runtime.PlatformActivator$1.run\n(PlatformActivator.java:298)\n        at org.eclipse.core.runtime.adaptor.EclipseStarter.run\n(EclipseStarter.java:249)\n        at org.eclipse.core.runtime.adaptor.EclipseStarter.run\n(EclipseStarter.java:126)\n        at sun.reflect.NativeMethodAccessorImpl.invoke0(Native Method)\n        at sun.reflect.NativeMethodAccessorImpl.invoke(Unknown Source)\n        at sun.reflect.DelegatingMethodAccessorImpl.invoke(Unknown Source)\n        at java.lang.reflect.Method.invoke(Unknown Source)\n        at org.eclipse.core.launcher.Main.basicRun(Main.java:269)\n        at org.eclipse.core.launcher.Main.run(Main.java:722)\n        at org.eclipse.core.launcher.Main.main(Main.java:706)\nCannot set data in clipboard\n",
    "The following code is trying to place null data onto the clipboard.  The \nvalues textData and rtfData can be null which is invalid.\n\nFrom ClipboardOperationAction.doCutCopyWithImportsOperation:\n\nif (clipboardData !\u003d null) {\n\tClipboard clipboard\u003d new Clipboard(getDisplay());\n\tObject textData\u003d clipboard.getContents(TextTransfer.getInstance());\n\tObject rtfData\u003d clipboard.getContents(RTFTransfer.getInstance());\n\t// see bug 61876, I currently make assumptions about what the styled \ntext widget sets\n\t\t\t\n\tTransfer[] dataTypes\u003d new Transfer[] { TextTransfer.getInstance(), \n\tRTFTransfer.getInstance(), fgTransferInstance};\n\tObject[] data\u003d new Object[] { textData, rtfData, clipboardData};\n\tclipboard.setContents(data, dataTypes);\n}\n\nReassigning bug report to Martin so he can fix the java UI code to check for \nnull before trying to set the data on the clipboard.",
    "I finally realized that the failures might have something to do with the fact \nthat I\u0027m running Microsft Remote Desktop (RDP), because I believe I only get \nthem when working from home. With RDP, when you copy text on one machine it \ntries to transfer it to the other machine so you can paste it there if you \nwant.\n\nWhatever is causing it, it\u0027s really, really annoying so if you could give me a \nworkaround, that would be great (besides not using RDP, I have no choice \nthere). If it helps, this is a fairly recent problem, say within the past \nmonth. Thx.\n",
    "fixed \u003e 20040515\n\nThe workaround is to turn off paste on import (java-editor-typing-imports on \npaste)",
    "*** Bug 62418 has been marked as a duplicate of this bug. ***"
  ],
  "commentCreationDates": [
    "2004-05-12T04:17:50+02:00",
    "2004-05-12T15:48:35+02:00",
    "2004-05-12T16:14:57+02:00",
    "2004-05-12T16:32:56+02:00",
    "2004-05-12T22:02:19+02:00",
    "2004-05-12T22:08:08+02:00",
    "2004-05-13T15:20:11+02:00",
    "2004-05-13T15:24:04+02:00",
    "2004-05-13T15:45:34+02:00",
    "2004-05-13T16:36:10+02:00",
    "2004-05-13T16:45:08+02:00",
    "2004-05-14T03:33:44+02:00",
    "2004-05-14T16:36:52+02:00",
    "2004-05-14T17:40:41+02:00",
    "2004-05-16T00:09:08+02:00",
    "2004-05-17T19:34:35+02:00"
  ],
  "traces": [
    {
      "exceptionType": "org.eclipse.swt.SWTError",
      "message": "Cannot set data in clipboard",
      "elements": [
        {
          "method": "org.eclipse.swt.dnd.DND.error",
          "source": "DND.java:225"
        },
        {
          "method": "org.eclipse.swt.dnd.DND.error",
          "source": "DND.java:181"
        },
        {
          "method": "org.eclipse.swt.dnd.Clipboard.setContents",
          "source": "Clipboard.java:289"
        },
        {
          "method": "org.eclipse.jdt.internal.ui.javaeditor.ClipboardOperationAction.doCutCopyWithImportsOperation",
          "source": "ClipboardOperationAction.java:301"
        },
        {
          "method": "org.eclipse.jdt.internal.ui.javaeditor.ClipboardOperationAction.internalDoOperation",
          "source": "ClipboardOperationAction.java:245"
        },
        {
          "method": "org.eclipse.jdt.internal.ui.javaeditor.ClipboardOperationAction$1.run",
          "source": "ClipboardOperationAction.java:223"
        },
        {
          "method": "org.eclipse.swt.custom.BusyIndicator.showWhile",
          "source": "BusyIndicator.java:69"
        },
        {
          "method": "org.eclipse.jdt.internal.ui.javaeditor.ClipboardOperationAction.run",
          "source": "ClipboardOperationAction.java:221"
        },
        {
          "method": "org.eclipse.jface.action.Action.runWithEvent",
          "source": "Action.java:881"
        },
        {
          "method": "org.eclipse.ui.commands.ActionHandler.execute",
          "source": "ActionHandler.java:141"
        },
        {
          "method": "org.eclipse.ui.internal.commands.Command.execute",
          "source": "Command.java:132"
        },
        {
          "method": "org.eclipse.ui.internal.keys.WorkbenchKeyboard.executeCommand",
          "source": "WorkbenchKeyboard.java:468"
        },
        {
          "method": "org.eclipse.ui.internal.keys.WorkbenchKeyboard.press",
          "source": "WorkbenchKeyboard.java:886"
        },
        {
          "method": "org.eclipse.ui.internal.keys.WorkbenchKeyboard.processKeyEvent",
          "source": "WorkbenchKeyboard.java:927"
        },
        {
          "method": "org.eclipse.ui.internal.keys.WorkbenchKeyboard.filterKeySequenceBindings",
          "source": "WorkbenchKeyboard.java:545"
        },
        {
          "method": "org.eclipse.ui.internal.keys.WorkbenchKeyboard.access$2",
          "source": "WorkbenchKeyboard.java:493"
        },
        {
          "method": "org.eclipse.ui.internal.keys.WorkbenchKeyboard$1.handleEvent",
          "source": "WorkbenchKeyboard.java:258"
        },
        {
          "method": "org.eclipse.swt.widgets.EventTable.sendEvent",
          "source": "EventTable.java:82"
        },
        {
          "method": "org.eclipse.swt.widgets.Display.filterEvent",
          "source": "Display.java:712"
        },
        {
          "method": "org.eclipse.swt.widgets.Widget.sendEvent",
          "source": "Widget.java:795"
        },
        {
          "method": "org.eclipse.swt.widgets.Widget.sendEvent",
          "source": "Widget.java:820"
        },
        {
          "method": "org.eclipse.swt.widgets.Widget.sendEvent",
          "source": "Widget.java:805"
        },
        {
          "method": "org.eclipse.swt.widgets.Control.sendKeyEvent",
          "source": "Control.java:1724"
        },
        {
          "method": "org.eclipse.swt.widgets.Control.sendKeyEvent",
          "source": "Control.java:1720"
        },
        {
          "method": "org.eclipse.swt.widgets.Control.WM_CHAR",
          "source": "Control.java:3048"
        },
        {
          "method": "org.eclipse.swt.widgets.Control.windowProc",
          "source": "Control.java:2951"
        },
        {
          "method": "org.eclipse.swt.widgets.Display.windowProc",
          "source": "Display.java:3291"
        },
        {
          "method": "org.eclipse.swt.internal.win32.OS.DispatchMessageW",
          "source": "Native Method"
        },
        {
          "method": "org.eclipse.swt.internal.win32.OS.DispatchMessage",
          "source": "OS.java:1466"
        },
        {
          "method": "org.eclipse.swt.widgets.Display.readAndDispatch",
          "source": "Display.java:2388"
        },
        {
          "method": "org.eclipse.ui.internal.Workbench.runEventLoop",
          "source": "Workbench.java:1353"
        },
        {
          "method": "org.eclipse.ui.internal.Workbench.runUI",
          "source": "Workbench.java:1324"
        },
        {
          "method": "org.eclipse.ui.internal.Workbench.createAndRunWorkbench",
          "source": "Workbench.java:243"
        },
        {
          "method": "org.eclipse.ui.PlatformUI.createAndRunWorkbench",
          "source": "PlatformUI.java:141"
        },
        {
          "method": "org.eclipse.ui.internal.ide.IDEApplication.run",
          "source": "IDEApplication.java:90"
        },
        {
          "method": "org.eclipse.core.internal.runtime.PlatformActivator$1.run",
          "source": "PlatformActivator.java:298"
        },
        {
          "method": "org.eclipse.core.runtime.adaptor.EclipseStarter.run",
          "source": "EclipseStarter.java:249"
        },
        {
          "method": "org.eclipse.core.runtime.adaptor.EclipseStarter.run",
          "source": "EclipseStarter.java:126"
        },
        {
          "method": "sun.reflect.NativeMethodAccessorImpl.invoke0",
          "source": "Native Method"
        },
        {
          "method": "sun.reflect.NativeMethodAccessorImpl.invoke",
          "source": "Unknown Source"
        },
        {
          "method": "sun.reflect.DelegatingMethodAccessorImpl.invoke",
          "source": "Unknown Source"
        },
        {
          "method": "java.lang.reflect.Method.invoke",
          "source": "Unknown Source"
        },
        {
          "method": "org.eclipse.core.launcher.Main.basicRun",
          "source": "Main.java:269"
        },
        {
          "method": "org.eclipse.core.launcher.Main.run",
          "source": "Main.java:722"
        },
        {
          "method": "org.eclipse.core.launcher.Main.main",
          "source": "Main.java:706"
        }
      ],
      "number": 0,
      "commentIndex": 0,
      "bugId": "61841",
      "date": "2004-05-12T04:17:50+02:00",
      "product": "JDT",
      "component": "UI",
      "severity": "normal"
    },
    {
      "exceptionType": "org.eclipse.swt.SWTError",
      "message": "Cannot set data in clipboard",
      "elements": [
        {
          "method": "org.eclipse.swt.dnd.DND.error",
          "source": "DND.java:225"
        },
        {
          "method": "org.eclipse.swt.dnd.DND.error",
          "source": "DND.java:181"
        },
        {
          "method": "org.eclipse.swt.dnd.Clipboard.setContents",
          "source": "Clipboard.java:291"
        },
        {
          "method": "org.eclipse.jdt.internal.ui.javaeditor.ClipboardOperationAction.doCutCopyWithImportsOperation",
          "source": "ClipboardOperationAction.java:304"
        },
        {
          "method": "org.eclipse.jdt.internal.ui.javaeditor.ClipboardOperationAction.internalDoOperation",
          "source": "ClipboardOperationAction.java:246"
        },
        {
          "method": "org.eclipse.jdt.internal.ui.javaeditor.ClipboardOperationAction$1.run",
          "source": "ClipboardOperationAction.java:224"
        },
        {
          "method": "org.eclipse.swt.custom.BusyIndicator.showWhile",
          "source": "BusyIndicator.java:69"
        },
        {
          "method": "org.eclipse.jdt.internal.ui.javaeditor.ClipboardOperationAction.run",
          "source": "ClipboardOperationAction.java:222"
        },
        {
          "method": "org.eclipse.jface.action.Action.runWithEvent",
          "source": "Action.java:881"
        },
        {
          "method": "org.eclipse.ui.commands.ActionHandler.execute",
          "source": "ActionHandler.java:141"
        },
        {
          "method": "org.eclipse.ui.internal.commands.Command.execute",
          "source": "Command.java:132"
        },
        {
          "method": "org.eclipse.ui.internal.keys.WorkbenchKeyboard.executeCommand",
          "source": "WorkbenchKeyboard.java:468"
        },
        {
          "method": "org.eclipse.ui.internal.keys.WorkbenchKeyboard.press",
          "source": "WorkbenchKeyboard.java:886"
        },
        {
          "method": "org.eclipse.ui.internal.keys.WorkbenchKeyboard.processKeyEvent",
          "source": "WorkbenchKeyboard.java:927"
        },
        {
          "method": "org.eclipse.ui.internal.keys.WorkbenchKeyboard.filterKeySequenceBindings",
          "source": "WorkbenchKeyboard.java:545"
        },
        {
          "method": "org.eclipse.ui.internal.keys.WorkbenchKeyboard.access$2",
          "source": "WorkbenchKeyboard.java:493"
        },
        {
          "method": "org.eclipse.ui.internal.keys.WorkbenchKeyboard$1.handleEvent",
          "source": "WorkbenchKeyboard.java:258"
        },
        {
          "method": "org.eclipse.swt.widgets.EventTable.sendEvent",
          "source": "EventTable.java:82"
        },
        {
          "method": "org.eclipse.swt.widgets.Display.filterEvent",
          "source": "Display.java:712"
        },
        {
          "method": "org.eclipse.swt.widgets.Widget.sendEvent",
          "source": "Widget.java:795"
        },
        {
          "method": "org.eclipse.swt.widgets.Widget.sendEvent",
          "source": "Widget.java:820"
        },
        {
          "method": "org.eclipse.swt.widgets.Widget.sendEvent",
          "source": "Widget.java:805"
        },
        {
          "method": "org.eclipse.swt.widgets.Control.sendKeyEvent",
          "source": "Control.java:1724"
        },
        {
          "method": "org.eclipse.swt.widgets.Control.sendKeyEvent",
          "source": "Control.java:1720"
        },
        {
          "method": "org.eclipse.swt.widgets.Control.WM_CHAR",
          "source": "Control.java:3048"
        },
        {
          "method": "org.eclipse.swt.widgets.Control.windowProc",
          "source": "Control.java:2951"
        },
        {
          "method": "org.eclipse.swt.widgets.Display.windowProc",
          "source": "Display.java:3291"
        },
        {
          "method": "org.eclipse.swt.internal.win32.OS.DispatchMessageW",
          "source": "Native Method"
        },
        {
          "method": "org.eclipse.swt.internal.win32.OS.DispatchMessage",
          "source": "OS.java:1466"
        },
        {
          "method": "org.eclipse.swt.widgets.Display.readAndDispatch",
          "source": "Display.java:2388"
        },
        {
          "method": "org.eclipse.ui.internal.Workbench.runEventLoop",
          "source": "Workbench.java:1353"
        },
        {
          "method": "org.eclipse.ui.internal.Workbench.runUI",
          "source": "Workbench.java:1324"
        },
        {
          "method": "org.eclipse.ui.internal.Workbench.createAndRunWorkbench",
          "source": "Workbench.java:243"
        },
        {
          "method": "org.eclipse.ui.PlatformUI.createAndRunWorkbench",
          "source": "PlatformUI.java:141"
        },
        {
          "method": "org.eclipse.ui.internal.ide.IDEApplication.run",
          "source": "IDEApplication.java:90 "
        },
        {
          "method": "org.eclipse.core.internal.runtime.PlatformActivator$1.run",
          "source": "PlatformActivator.java:298"
        },
        {
          "method": "org.eclipse.core.runtime.adaptor.EclipseStarter.run",
          "source": "EclipseStarter.java:249"
        },
        {
          "method": "org.eclipse.core.runtime.adaptor.EclipseStarter.run",
          "source": "EclipseStarter.java:126"
        },
        {
          "method": "sun.reflect.NativeMethodAccessorImpl.invoke0",
          "source": "Native Method"
        },
        {
          "method": "sun.reflect.NativeMethodAccessorImpl.invoke",
          "source": "Unknown Source"
        },
        {
          "method": "sun.reflect.DelegatingMethodAccessorImpl.invoke",
          "source": "Unknown Source"
        },
        {
          "method": "java.lang.reflect.Method.invoke",
          "source": "Unknown Source"
        },
        {
          "method": "org.eclipse.core.launcher.Main.basicRun",
          "source": "Main.java:269"
        },
        {
          "method": "org.eclipse.core.launcher.Main.run",
          "source": "Main.java:722"
        },
        {
          "method": "org.eclipse.core.launcher.Main.main",
          "source": "Main.java:706"
        }
      ],
      "number": 1,
      "commentIndex": 11,
      "bugId": "61841",
      "date": "2004-05-14T03:33:44+02:00",
      "product": "JDT",
      "component": "UI",
      "severity": "normal"
    }
  ],
  "groupId": "61841",
  "bugId": "61841",
  "date": "2004-05-12T04:17:50+02:00",
  "product": "JDT",
  "component": "UI",
  "severity": "normal"
}