{
  "comments": [
    "Inadequate error message from SDO\n\nWhen setting a \u0027Float\u0027 property with a \u0027Double\u0027 value, I get a\nclass cast exception deep within Ecore. There is no data put\ninto the class cast, so a user without a debugger has no chance\nof finding the cause.\n\nHere is a stack trace:\n\njava.lang.ClassCastException\n       at \norg.eclipse.emf.ecore.impl.EStructuralFeatureImpl$InternalSettingDelegateSingle\nDataUnsettableStatic.validate(EStructuralFeatureImpl.java:2035)\n       at \norg.eclipse.emf.ecore.impl.EStructuralFeatureImpl$InternalSettingDelegateSingle\nDataUnsettable.dynamicSet(EStructuralFeatureImpl.java:1956)\n       at org.eclipse.emf.ecore.impl.BasicEObjectImpl.eDynamicSet\n(BasicEObjectImpl.java:519)\n       at org.eclipse.emf.ecore.impl.BasicEObjectImpl.eSet\n(BasicEObjectImpl.java:503)\n       at org.eclipse.emf.ecore.sdo.util.SDOUtil.set(SDOUtil.java:902)\n       at org.eclipse.emf.ecore.sdo.util.SDOUtil.set(SDOUtil.java:121)\n       at org.eclipse.emf.ecore.sdo.util.SDOUtil.setDouble(SDOUtil.java:252)\n       at org.eclipse.emf.ecore.sdo.impl.EDataObjectImpl.setDouble\n(EDataObjectImpl.java:478)\n       at webservicesdoc.Example1.buildResponse(Example1.java:97)\n       at webservicesdoc.Example1.main(Example1.java:51)\n\nIn my case, the local variables look like this:\n\nthis\u003d \nEStructuralFeatureImpl$InternalSettingDelegateSingleDataUnsettableStatic  \n(id\u003d58)\n  - dataClass\u003d Class (java.lang.Float) (id\u003d67)\n\nobject\u003d Double  (id\u003d60)",
    "The improvements are committed to CVS.",
    "The fix is available in the latest build."
  ],
  "commentCreationDates": [
    "2004-05-12T18:02:37+02:00",
    "2004-05-12T21:25:07+02:00",
    "2004-05-13T19:38:45+02:00"
  ],
  "traces": [
    {
      "exceptionType": "java.lang.ClassCastException",
      "elements": [
        {
          "method": "org.eclipse.emf.ecore.impl.EStructuralFeatureImpl$InternalSettingDelegateSingleDataUnsettableStatic.validate",
          "source": "EStructuralFeatureImpl.java:2035"
        },
        {
          "method": "org.eclipse.emf.ecore.impl.EStructuralFeatureImpl$InternalSettingDelegateSingleDataUnsettable.dynamicSet",
          "source": "EStructuralFeatureImpl.java:1956"
        },
        {
          "method": "org.eclipse.emf.ecore.impl.BasicEObjectImpl.eDynamicSet",
          "source": "BasicEObjectImpl.java:519"
        },
        {
          "method": "org.eclipse.emf.ecore.impl.BasicEObjectImpl.eSet",
          "source": "BasicEObjectImpl.java:503"
        },
        {
          "method": "org.eclipse.emf.ecore.sdo.util.SDOUtil.set",
          "source": "SDOUtil.java:902"
        },
        {
          "method": "org.eclipse.emf.ecore.sdo.util.SDOUtil.set",
          "source": "SDOUtil.java:121"
        },
        {
          "method": "org.eclipse.emf.ecore.sdo.util.SDOUtil.setDouble",
          "source": "SDOUtil.java:252"
        },
        {
          "method": "org.eclipse.emf.ecore.sdo.impl.EDataObjectImpl.setDouble",
          "source": "EDataObjectImpl.java:478"
        },
        {
          "method": "webservicesdoc.Example1.buildResponse",
          "source": "Example1.java:97"
        },
        {
          "method": "webservicesdoc.Example1.main",
          "source": "Example1.java:51"
        }
      ],
      "number": 0,
      "commentIndex": 0,
      "bugId": "61929",
      "date": "2004-05-12T18:02:37+02:00",
      "product": "EMF",
      "component": "Core",
      "severity": "normal"
    }
  ],
  "groupId": "61929",
  "bugId": "61929",
  "date": "2004-05-12T18:02:37+02:00",
  "product": "EMF",
  "component": "Core",
  "severity": "normal"
}