{
  "comments": [
    "Here is the aspect:\n\npackage com.sampullara.testing;\n\npublic aspect UsedClasses {\n  pointcut scope() : staticinitialization(*) \u0026\u0026 !within(com.sampullara.testing.UsedClasses);\n  \n  before() : scope() {\n    System.out.println(\"[Initializing class: \" + thisJoinPointStaticPart.getSourceLocation() + \"]\");\n  }\n}\n\n/Users/sam/Software/WLS-STAGE/wls/server/lib:\u003e time ajc -injars weblogic.jar -outjar \nnewweblogic.jar -sourceroots ~/Projects/AspectJ/UsedClasses/src\nABORT\n\nException thrown from AspectJ 1.2rc1\n\nThis might be logged as a bug already -- find current bugs at\n  http://bugs.eclipse.org/bugs/buglist.cgi?product\u003dAspectJ\u0026component\u003dCompiler\n\nBugs for exceptions thrown have titles File:line from the top stack, \ne.g., \"SomeFile.java:243\"\n\nIf you don\u0027t find the exception below in a bug, please add a new bug\nat http://bugs.eclipse.org/bugs/enter_bug.cgi?product\u003dAspectJ\nTo make the bug a priority, please include a test program\nthat can reproduce this exception.\nnull\njava.lang.NullPointerException\n        at org.eclipse.jdt.internal.compiler.CompilationResult.computePriority(CompilationResult.java:110)\n        at org.eclipse.jdt.internal.compiler.CompilationResult.quickPrioritize(CompilationResult.java:336)\n        at org.eclipse.jdt.internal.compiler.CompilationResult.getProblems(CompilationResult.java:230)\n        at org.eclipse.jdt.internal.compiler.CompilationResult.getAllProblems(CompilationResult.java:118)\n        at org.aspectj.ajdt.internal.core.builder.AjBuildManager$4.acceptResult(AjBuildManager.java:661)\n        at org.aspectj.ajdt.internal.compiler.AjCompilerAdapter.acceptResult(AjCompilerAdapter.java:178)\n        at org.aspectj.ajdt.internal.compiler.WeaverAdapter.finishedWith(WeaverAdapter.java:203)\n        at org.aspectj.ajdt.internal.compiler.WeaverAdapter.weaveCompleted(WeaverAdapter.java:167)\n        at org.aspectj.weaver.bcel.BcelWeaver.weave(BcelWeaver.java:570)\n        at org.aspectj.ajdt.internal.compiler.AjCompilerAdapter.weave(AjCompilerAdapter.java:239)\n        at org.aspectj.ajdt.internal.compiler.AjCompilerAdapter.afterCompiling(AjCompilerAdapter.java:\n114)\n        at org.eclipse.jdt.internal.compiler.Compiler.compile(Compiler.java:376)\n        at org.aspectj.ajdt.internal.core.builder.AjBuildManager.performCompilation(AjBuildManager.java:\n600)\n        at org.aspectj.ajdt.internal.core.builder.AjBuildManager.doBuild(AjBuildManager.java:160)\n        at org.aspectj.ajdt.internal.core.builder.AjBuildManager.batchBuild(AjBuildManager.java:94)\n        at org.aspectj.ajdt.ajc.AjdtCommand.doCommand(AjdtCommand.java:102)\n        at org.aspectj.ajdt.ajc.AjdtCommand.runCommand(AjdtCommand.java:53)\n        at org.aspectj.tools.ajc.Main.run(Main.java:280)\n        at org.aspectj.tools.ajc.Main.runMain(Main.java:217)\n        at org.aspectj.tools.ajc.Main.main(Main.java:79)\n\n\n1 fail|abort\n\nreal    37m7.541s\nuser    7m0.690s\nsys     0m23.010s",
    "I believe this is fixed in Aspectj 1.2rc2 - please can you retry with this \nversion of AspectJ (that we only released yesterday).  For discussion of the \nfix see bug 58679 and bug 57432.  It is to do with attaching more than 100 \nerrors/warnings to a file.",
    "I\u0027m 99.9999999999999999999999% sure this is now fixed, so I\u0027m closing the bug.",
    "Fix released as part of AspectJ 1.2.1"
  ],
  "commentCreationDates": [
    "2004-05-14T01:48:01+02:00",
    "2004-05-14T09:25:04+02:00",
    "2004-08-06T11:37:55+02:00",
    "2004-10-21T10:31:48+02:00"
  ],
  "traces": [
    {
      "exceptionType": "java.lang.NullPointerException",
      "elements": [
        {
          "method": "org.eclipse.jdt.internal.compiler.CompilationResult.computePriority",
          "source": "CompilationResult.java:110"
        },
        {
          "method": "org.eclipse.jdt.internal.compiler.CompilationResult.quickPrioritize",
          "source": "CompilationResult.java:336"
        },
        {
          "method": "org.eclipse.jdt.internal.compiler.CompilationResult.getProblems",
          "source": "CompilationResult.java:230"
        },
        {
          "method": "org.eclipse.jdt.internal.compiler.CompilationResult.getAllProblems",
          "source": "CompilationResult.java:118"
        },
        {
          "method": "org.aspectj.ajdt.internal.core.builder.AjBuildManager$4.acceptResult",
          "source": "AjBuildManager.java:661"
        },
        {
          "method": "org.aspectj.ajdt.internal.compiler.AjCompilerAdapter.acceptResult",
          "source": "AjCompilerAdapter.java:178"
        },
        {
          "method": "org.aspectj.ajdt.internal.compiler.WeaverAdapter.finishedWith",
          "source": "WeaverAdapter.java:203"
        },
        {
          "method": "org.aspectj.ajdt.internal.compiler.WeaverAdapter.weaveCompleted",
          "source": "WeaverAdapter.java:167"
        },
        {
          "method": "org.aspectj.weaver.bcel.BcelWeaver.weave",
          "source": "BcelWeaver.java:570"
        },
        {
          "method": "org.aspectj.ajdt.internal.compiler.AjCompilerAdapter.weave",
          "source": "AjCompilerAdapter.java:239"
        },
        {
          "method": "org.aspectj.ajdt.internal.compiler.AjCompilerAdapter.afterCompiling",
          "source": "AjCompilerAdapter.java: 114"
        },
        {
          "method": "org.eclipse.jdt.internal.compiler.Compiler.compile",
          "source": "Compiler.java:376"
        },
        {
          "method": "org.aspectj.ajdt.internal.core.builder.AjBuildManager.performCompilation",
          "source": "AjBuildManager.java: 600"
        },
        {
          "method": "org.aspectj.ajdt.internal.core.builder.AjBuildManager.doBuild",
          "source": "AjBuildManager.java:160"
        },
        {
          "method": "org.aspectj.ajdt.internal.core.builder.AjBuildManager.batchBuild",
          "source": "AjBuildManager.java:94"
        },
        {
          "method": "org.aspectj.ajdt.ajc.AjdtCommand.doCommand",
          "source": "AjdtCommand.java:102"
        },
        {
          "method": "org.aspectj.ajdt.ajc.AjdtCommand.runCommand",
          "source": "AjdtCommand.java:53"
        },
        {
          "method": "org.aspectj.tools.ajc.Main.run",
          "source": "Main.java:280"
        },
        {
          "method": "org.aspectj.tools.ajc.Main.runMain",
          "source": "Main.java:217"
        },
        {
          "method": "org.aspectj.tools.ajc.Main.main",
          "source": "Main.java:79"
        }
      ],
      "number": 0,
      "commentIndex": 0,
      "bugId": "62199",
      "date": "2004-05-14T01:48:01+02:00",
      "product": "AspectJ",
      "component": "Compiler",
      "severity": "critical"
    }
  ],
  "groupId": "62199",
  "bugId": "62199",
  "date": "2004-05-14T01:48:01+02:00",
  "product": "AspectJ",
  "component": "Compiler",
  "severity": "critical"
}