{
  "comments": [
    "200405171219\n\nThis was printed to my cmd window on startup. I have all the debug views in my\none java perspective and have the pref to bring the debug view to front when a\nbreakpoint is hit. Also, I have \u0027never\u0027 switch to debug perspective.\n\njava.vendor\u003dSun Microsystems Inc.\nBootLoader constants: OS\u003dwin32, ARCH\u003dx86, WS\u003dwin32, NL\u003den_US\nCommand-line arguments: -showlocation -keyring c:/keyring\n!ENTRY org.eclipse.update.configurator May 17, 2004 14:27:10.312\n!MESSAGE Unable to find feature.xml in directory: c:\\Eclipse\\Latest\\eclipse\\feat\nures\\org.eclipse.pde.container.feature_1.0.0\n!ENTRY org.eclipse.core.runtime 4 2 May 17, 2004 14:27:42.558\n!MESSAGE Problems occurred when invoking code from plug-in: \"org.eclipse.core.ru\nntime\".\n!STACK 0\njava.lang.NullPointerException\n        at org.eclipse.debug.internal.ui.views.launch.LaunchView.perspectiveChan\nged(LaunchView.java:614)\n        at org.eclipse.ui.internal.PerspectiveListenerListOld$2.run(PerspectiveL\nistenerListOld.java:58)\n        at org.eclipse.core.internal.runtime.InternalPlatform.run(InternalPlatfo\nrm.java:608)\n        at org.eclipse.core.runtime.Platform.run(Platform.java:668)\n        at org.eclipse.ui.internal.PerspectiveListenerListOld.firePerspectiveCha\nnged(PerspectiveListenerListOld.java:56)\n        at org.eclipse.ui.internal.WorkbenchWindow.firePerspectiveChanged(Workbe\nnchWindow.java:913)\n        at org.eclipse.ui.internal.WorkbenchPage.showActionSet(WorkbenchPage.jav\na:2921)\n        at org.eclipse.debug.internal.ui.views.launch.LaunchViewContextListener.\nshowDebugActionSet(LaunchViewContextListener.java:821)\n        at org.eclipse.debug.internal.ui.views.launch.LaunchViewContextListener.\n\u003cinit\u003e(LaunchViewContextListener.java:135)\n        at org.eclipse.debug.internal.ui.views.launch.LaunchView.partOpened(Laun\nchView.java:656)\n        at org.eclipse.ui.internal.PartListenerList$5.run(PartListenerList.java:\n105)\n        at org.eclipse.core.internal.runtime.InternalPlatform.run(InternalPlatfo\nrm.java:608)\n        at org.eclipse.core.runtime.Platform.run(Platform.java:668)\n        at org.eclipse.ui.internal.PartListenerList.firePartOpened(PartListenerL\nist.java:103)\n        at org.eclipse.ui.internal.WorkbenchPage.firePartOpened(WorkbenchPage.ja\nva:1404)\n        at org.eclipse.ui.internal.PartPane.createChildControl(PartPane.java:138\n)\n        at org.eclipse.ui.internal.ViewPane.createChildControl(ViewPane.java:140\n)\n        at org.eclipse.ui.internal.PartPane.createControl(PartPane.java:170)\n        at org.eclipse.ui.internal.ViewPane.createControl(ViewPane.java:128)\n        at org.eclipse.ui.internal.WorkbenchPage.findView(WorkbenchPage.java:131\n7)\n        at org.eclipse.ui.internal.PagePartSelectionTracker.\u003cinit\u003e(PagePartSelec\ntionTracker.java:58)\n        at org.eclipse.ui.internal.PageSelectionService.createPartTracker(PageSe\nlectionService.java:49)\n        at org.eclipse.ui.internal.AbstractSelectionService.getPerPartTracker(Ab\nstractSelectionService.java:190)\n        at org.eclipse.ui.internal.AbstractSelectionService.addSelectionListener\n(AbstractSelectionService.java:97)\n        at org.eclipse.ui.internal.WorkbenchPage.addSelectionListener(WorkbenchP\nage.java:545)\n        at org.eclipse.ui.internal.WindowPartSelectionTracker.pageOpened(WindowP\nartSelectionTracker.java:85)\n        at org.eclipse.ui.internal.WindowPartSelectionTracker.\u003cinit\u003e(WindowPartS\nelectionTracker.java:63)\n        at org.eclipse.ui.internal.WindowSelectionService.createPartTracker(Wind\nowSelectionService.java:52)\n        at org.eclipse.ui.internal.AbstractSelectionService.getPerPartTracker(Ab\nstractSelectionService.java:190)\n        at org.eclipse.ui.internal.AbstractSelectionService.addSelectionListener\n(AbstractSelectionService.java:97)\n        at org.eclipse.debug.internal.ui.actions.AbstractDebugActionDelegate.ini\nt(AbstractDebugActionDelegate.java:86)\n        at org.eclipse.ui.internal.WWinPluginAction.initDelegate(WWinPluginActio\nn.java:168)\n        at org.eclipse.ui.internal.PluginAction.createDelegate(PluginAction.java\n:116)\n        at org.eclipse.ui.internal.WWinPluginAction.refreshActionList(WWinPlugin\nAction.java:147)\n        at org.eclipse.ui.plugin.AbstractUIPlugin$3.run(AbstractUIPlugin.java:80\n1)\n        at org.eclipse.swt.widgets.RunnableLock.run(RunnableLock.java:35)\n        at org.eclipse.swt.widgets.Synchronizer.runAsyncMessages(Synchronizer.ja\nva:106)\n        at org.eclipse.swt.widgets.Display.runAsyncMessages(Display.java:2702)",
    "Same for me. Same build.\nI was in the resource perspective on startup, switched to the Team perspective,\nand then to Debug.",
    "\n\n*** This bug has been marked as a duplicate of 60327 ***"
  ],
  "commentCreationDates": [
    "2004-05-17T20:44:17+02:00",
    "2004-05-17T20:49:17+02:00",
    "2004-05-17T20:50:45+02:00"
  ],
  "traces": [
    {
      "exceptionType": "java.lang.NullPointerException",
      "elements": [
        {
          "method": "org.eclipse.debug.internal.ui.views.launch.LaunchView.perspectiveChanged",
          "source": "LaunchView.java:614"
        },
        {
          "method": "org.eclipse.ui.internal.PerspectiveListenerListOld$2.run",
          "source": "PerspectiveL istenerListOld.java:58"
        },
        {
          "method": "org.eclipse.core.internal.runtime.InternalPlatform.run",
          "source": "InternalPlatfo rm.java:608"
        },
        {
          "method": "org.eclipse.core.runtime.Platform.run",
          "source": "Platform.java:668"
        },
        {
          "method": "org.eclipse.ui.internal.PerspectiveListenerListOld.firePerspectiveChanged",
          "source": "PerspectiveListenerListOld.java:56"
        },
        {
          "method": "org.eclipse.ui.internal.WorkbenchWindow.firePerspectiveChanged",
          "source": "Workbe nchWindow.java:913"
        },
        {
          "method": "org.eclipse.ui.internal.WorkbenchPage.showActionSet",
          "source": "WorkbenchPage.jav a:2921"
        },
        {
          "method": "org.eclipse.debug.internal.ui.views.launch.LaunchViewContextListener.showDebugActionSet",
          "source": "LaunchViewContextListener.java:821"
        },
        {
          "method": "org.eclipse.debug.internal.ui.views.launch.LaunchViewContextListener.\u003cinit\u003e",
          "source": "LaunchViewContextListener.java:135"
        },
        {
          "method": "org.eclipse.debug.internal.ui.views.launch.LaunchView.partOpened",
          "source": "Laun chView.java:656"
        },
        {
          "method": "org.eclipse.ui.internal.PartListenerList$5.run",
          "source": "PartListenerList.java: 105"
        },
        {
          "method": "org.eclipse.core.internal.runtime.InternalPlatform.run",
          "source": "InternalPlatfo rm.java:608"
        },
        {
          "method": "org.eclipse.core.runtime.Platform.run",
          "source": "Platform.java:668"
        },
        {
          "method": "org.eclipse.ui.internal.PartListenerList.firePartOpened",
          "source": "PartListenerL ist.java:103"
        },
        {
          "method": "org.eclipse.ui.internal.WorkbenchPage.firePartOpened",
          "source": "WorkbenchPage.ja va:1404"
        },
        {
          "method": "org.eclipse.ui.internal.PartPane.createChildControl",
          "source": "PartPane.java:138 "
        },
        {
          "method": "org.eclipse.ui.internal.ViewPane.createChildControl",
          "source": "ViewPane.java:140 "
        },
        {
          "method": "org.eclipse.ui.internal.PartPane.createControl",
          "source": "PartPane.java:170"
        },
        {
          "method": "org.eclipse.ui.internal.ViewPane.createControl",
          "source": "ViewPane.java:128"
        },
        {
          "method": "org.eclipse.ui.internal.WorkbenchPage.findView",
          "source": "WorkbenchPage.java:131 7"
        },
        {
          "method": "org.eclipse.ui.internal.PagePartSelectionTracker.\u003cinit\u003e",
          "source": "PagePartSelec tionTracker.java:58"
        },
        {
          "method": "org.eclipse.ui.internal.PageSelectionService.createPartTracker",
          "source": "PageSe lectionService.java:49"
        },
        {
          "method": "org.eclipse.ui.internal.AbstractSelectionService.getPerPartTracker",
          "source": "Ab stractSelectionService.java:190"
        },
        {
          "method": "org.eclipse.ui.internal.AbstractSelectionService.addSelectionListener",
          "source": "AbstractSelectionService.java:97"
        },
        {
          "method": "org.eclipse.ui.internal.WorkbenchPage.addSelectionListener",
          "source": "WorkbenchP age.java:545"
        },
        {
          "method": "org.eclipse.ui.internal.WindowPartSelectionTracker.pageOpened",
          "source": "WindowP artSelectionTracker.java:85"
        },
        {
          "method": "org.eclipse.ui.internal.WindowPartSelectionTracker.\u003cinit\u003e",
          "source": "WindowPartS electionTracker.java:63"
        },
        {
          "method": "org.eclipse.ui.internal.WindowSelectionService.createPartTracker",
          "source": "Wind owSelectionService.java:52"
        },
        {
          "method": "org.eclipse.ui.internal.AbstractSelectionService.getPerPartTracker",
          "source": "Ab stractSelectionService.java:190"
        },
        {
          "method": "org.eclipse.ui.internal.AbstractSelectionService.addSelectionListener",
          "source": "AbstractSelectionService.java:97"
        },
        {
          "method": "org.eclipse.debug.internal.ui.actions.AbstractDebugActionDelegate.init",
          "source": "AbstractDebugActionDelegate.java:86"
        },
        {
          "method": "org.eclipse.ui.internal.WWinPluginAction.initDelegate",
          "source": "WWinPluginActio n.java:168"
        },
        {
          "method": "org.eclipse.ui.internal.PluginAction.createDelegate",
          "source": "PluginAction.java :116"
        },
        {
          "method": "org.eclipse.ui.internal.WWinPluginAction.refreshActionList",
          "source": "WWinPlugin Action.java:147"
        },
        {
          "method": "org.eclipse.ui.plugin.AbstractUIPlugin$3.run",
          "source": "AbstractUIPlugin.java:80 1"
        },
        {
          "method": "org.eclipse.swt.widgets.RunnableLock.run",
          "source": "RunnableLock.java:35"
        },
        {
          "method": "org.eclipse.swt.widgets.Synchronizer.runAsyncMessages",
          "source": "Synchronizer.ja va:106"
        },
        {
          "method": "org.eclipse.swt.widgets.Display.runAsyncMessages",
          "source": "Display.java:2702"
        }
      ],
      "number": 0,
      "commentIndex": 0,
      "bugId": "62519",
      "duplicateId": "60327",
      "date": "2004-05-17T20:44:17+02:00",
      "product": "Platform",
      "component": "Debug",
      "severity": "normal"
    }
  ],
  "groupId": "60327",
  "bugId": "62519",
  "duplicateId": "60327",
  "date": "2004-05-17T20:44:17+02:00",
  "product": "Platform",
  "component": "Debug",
  "severity": "normal"
}