{
  "comments": [
    "I am getting the following exception when I try to search a symbol. I clicked \non a symbol and selected \u0027open declaration\u0027. \n\nI am using Eclipse 2.1.2, CDT 2.1 and Linux OS. Here is the uname -a output\nfrom Linux:\n\nLinux linus 2.4.7-10smp #1 SMP Thu Sep 6 17:09:31 EDT 2001 i686 unknown\n\n\nHere is the exception I got:\n\njava.lang.ClassCastException: \norg.eclipse.cdt.internal.core.parser.MacroDescriptor\n        at org.eclipse.cdt.internal.core.parser.Scanner.poundDefine\n(Scanner.java:2073)\n        at org.eclipse.cdt.internal.core.parser.Scanner.nextToken\n(Scanner.java:1024)\n        at org.eclipse.cdt.internal.core.parser.Scanner.nextToken\n(Scanner.java:629)\n        at org.eclipse.cdt.internal.core.parser.Parser.fetchToken\n(Parser.java:4979)\n        at org.eclipse.cdt.internal.core.parser.Parser.fetchToken\n(Parser.java:4997)\n        at org.eclipse.cdt.internal.core.parser.Parser.fetchToken\n(Parser.java:4997)\n        at org.eclipse.cdt.internal.core.parser.Parser.fetchToken\n(Parser.java:4997)\n        at org.eclipse.cdt.internal.core.parser.Parser.LA(Parser.java:5012)\n        at org.eclipse.cdt.internal.core.parser.Parser.LT(Parser.java:5031)\n        at org.eclipse.cdt.internal.core.parser.Parser.errorHandling\n(Parser.java:240)\n        at org.eclipse.cdt.internal.core.parser.Parser.translationUnit\n(Parser.java:205)\n        at org.eclipse.cdt.internal.core.parser.Parser.parse(Parser.java:143)\n        at org.eclipse.cdt.internal.core.search.indexing.SourceIndexer.indexFile\n(SourceIndexer.java:91)\n        at org.eclipse.cdt.internal.core.search.indexing.AbstractIndexer.index\n(AbstractIndexer.java:353)\n        at org.eclipse.cdt.internal.core.index.impl.Index.add(Index.java:110)\n        at \norg.eclipse.cdt.internal.core.search.indexing.AddCompilationUnitToIndex.indexDoc\nument(AddCompilationUnitToIndex.java:29)\n        at org.eclipse.cdt.internal.core.search.indexing.AddFileToIndex.execute\n(AddFileToIndex.java:39)\n        at org.eclipse.cdt.internal.core.search.processing.JobManager.run\n(JobManager.java:368)\n        at java.lang.Thread.run(Thread.java:534)",
    "I am sorry. The CDT version is 1.2.1",
    "Please provide a piece of source code that produces this example.  \nThanks.  ",
    "Here is a piece of source code I was trying to browse:\n\nint Container::initData()\n{\n        AConf         aConf; \u003c--- I was trying to find AConf\n   //   BTUConf       bConf;\n        CConf         cConf;\n        DConf         dConf;\n        int bandClass, Id;\n\n        if( IPBSS_FAIL \u003d\u003d getTuple(ID, 0, (char * ) \u0026bconfig sizeof(BConf)) )\n    {\n        cout\u003c\u003c \"[bConf] Pld Access Error \" \u003c\u003cendl;\n        return  IPBSS_FAIL;\n    }\n...\n}",
    "Where is AConf defined?\nPlease run gcc -E on this file in the same manner in which you compile it \n(w/include paths, etc.) so that I can see the entire picture. \nThanks",
    "unfortunately I can\u0027t send you the code because:\n        a) It is a large project\n        b) prop. information\n\nSo I changed the names on those definitions.\n\nAnything else I can help you with?\n\nHere is some more info:\n This file (say A.cpp) includes A.h and A.h includes B.h and the definition is \nin B.h\n\nAnd the definition is a structure:\n\ntypedef struct {\n        byte    Status;\n        /* def:\"BTS Status\"\n        * role:mo asn:none access:rwrite range:0~3 init:1 */\n\n        ....\n} AConf;\n",
    "Reproducing this example using the latest out of CVS (for CDT 2.0) yields the \nproper result.  We have done a significant amount of work in refining Search \nand Open Declarations in this release.  \n\nSince we are not planning on doing a 1.2.2 release, I must mark this defect as \nWONTFIX for the CDT 1.2 codebase.  "
  ],
  "commentCreationDates": [
    "2004-05-21T20:20:55+02:00",
    "2004-05-21T20:23:00+02:00",
    "2004-05-21T20:27:38+02:00",
    "2004-05-21T20:33:45+02:00",
    "2004-05-21T21:05:28+02:00",
    "2004-05-21T21:31:00+02:00",
    "2004-05-21T22:14:05+02:00"
  ],
  "traces": [
    {
      "exceptionType": "java.lang.ClassCastException",
      "message": "org.eclipse.cdt.internal.core.parser.MacroDescriptor",
      "elements": [
        {
          "method": "org.eclipse.cdt.internal.core.parser.Scanner.poundDefine",
          "source": "Scanner.java:2073"
        },
        {
          "method": "org.eclipse.cdt.internal.core.parser.Scanner.nextToken",
          "source": "Scanner.java:1024"
        },
        {
          "method": "org.eclipse.cdt.internal.core.parser.Scanner.nextToken",
          "source": "Scanner.java:629"
        },
        {
          "method": "org.eclipse.cdt.internal.core.parser.Parser.fetchToken",
          "source": "Parser.java:4979"
        },
        {
          "method": "org.eclipse.cdt.internal.core.parser.Parser.fetchToken",
          "source": "Parser.java:4997"
        },
        {
          "method": "org.eclipse.cdt.internal.core.parser.Parser.fetchToken",
          "source": "Parser.java:4997"
        },
        {
          "method": "org.eclipse.cdt.internal.core.parser.Parser.fetchToken",
          "source": "Parser.java:4997"
        },
        {
          "method": "org.eclipse.cdt.internal.core.parser.Parser.LA",
          "source": "Parser.java:5012"
        },
        {
          "method": "org.eclipse.cdt.internal.core.parser.Parser.LT",
          "source": "Parser.java:5031"
        },
        {
          "method": "org.eclipse.cdt.internal.core.parser.Parser.errorHandling",
          "source": "Parser.java:240"
        },
        {
          "method": "org.eclipse.cdt.internal.core.parser.Parser.translationUnit",
          "source": "Parser.java:205"
        },
        {
          "method": "org.eclipse.cdt.internal.core.parser.Parser.parse",
          "source": "Parser.java:143"
        },
        {
          "method": "org.eclipse.cdt.internal.core.search.indexing.SourceIndexer.indexFile",
          "source": "SourceIndexer.java:91"
        },
        {
          "method": "org.eclipse.cdt.internal.core.search.indexing.AbstractIndexer.index",
          "source": "AbstractIndexer.java:353"
        },
        {
          "method": "org.eclipse.cdt.internal.core.index.impl.Index.add",
          "source": "Index.java:110"
        },
        {
          "method": "org.eclipse.cdt.internal.core.search.indexing.AddCompilationUnitToIndex.indexDocument",
          "source": "AddCompilationUnitToIndex.java:29"
        },
        {
          "method": "org.eclipse.cdt.internal.core.search.indexing.AddFileToIndex.execute",
          "source": "AddFileToIndex.java:39"
        },
        {
          "method": "org.eclipse.cdt.internal.core.search.processing.JobManager.run",
          "source": "JobManager.java:368"
        },
        {
          "method": "java.lang.Thread.run",
          "source": "Thread.java:534"
        }
      ],
      "number": 0,
      "commentIndex": 0,
      "bugId": "63458",
      "date": "2004-05-21T20:20:55+02:00",
      "product": "CDT",
      "component": "CDT-parser",
      "severity": "normal"
    }
  ],
  "groupId": "63458",
  "bugId": "63458",
  "date": "2004-05-21T20:20:55+02:00",
  "product": "CDT",
  "component": "CDT-parser",
  "severity": "normal"
}