{
  "comments": [
    "Driver: M9 Linux-GTK\nPlatfrom: RHEL 3.0WS and SLES9 Beta 5 Japanese locale\n\nsteps\n1-startup a brand new Eclipse\n2-click icon Workbench at the Welcome page\n\n\u003cError\u003e\nFollowing error is thrown.\n!SESSION 5 26, 2004 15:40:58.350 -----------------------------------------------\neclipse.buildId\u003dI200405211200\njava.fullversion\u003dJ2RE 1.4.2 IBM build cxia32dev-20040524 (JIT enabled: jitc)\nBootLoader constants: OS\u003dlinux, ARCH\u003dx86, WS\u003dgtk, NL\u003dja_JP\n!ENTRY org.eclipse.ui 4 4 5 26, 2004 15:40:58.353\n!MESSAGE Unhandled event loop exception\nUnhandled event loop exception\nReason:\n!ENTRY org.eclipse.ui 4 0 5 26, 2004 15:40:58.366\n!MESSAGE Widget is disposed\n!STACK 0\norg.eclipse.swt.SWTException: Widget is disposed\n        at org.eclipse.swt.SWT.error(SWT.java:2689)\n        at org.eclipse.swt.SWT.error(SWT.java(Inlined Compiled Code))\n        at org.eclipse.swt.SWT.error(SWT.java(Inlined Compiled Code))\n        at org.eclipse.swt.widgets.Widget.error(Widget.java(Inlined Compiled Code))\n        at org.eclipse.swt.widgets.Widget.checkWidget(Widget.java(Compiled Code))\n        at org.eclipse.swt.widgets.Control.redraw(Control.java:2106)\n        at\norg.eclipse.ui.forms.widgets.ImageHyperlink.handleActivate(ImageHyperlink.java:139)\n        at\norg.eclipse.ui.forms.widgets.AbstractHyperlink.handleMouseUp(AbstractHyperlink.java:264)\n        at\norg.eclipse.ui.forms.widgets.AbstractHyperlink.access$1(AbstractHyperlink.java:248)\n        at\norg.eclipse.ui.forms.widgets.AbstractHyperlink$4.handleEvent(AbstractHyperlink.java:95)\n        at org.eclipse.swt.widgets.EventTable.sendEvent(EventTable.java(Compiled\nCode))\n        at org.eclipse.swt.widgets.Widget.sendEvent(Widget.java:944)\n        at org.eclipse.swt.widgets.Display.runDeferredEvents(Display.java:2542)\n        at org.eclipse.swt.widgets.Display.readAndDispatch(Display.java:2253)\n        at org.eclipse.ui.internal.Workbench.runEventLoop(Workbench.java:1363)\n        at org.eclipse.ui.internal.Workbench.runUI(Workbench.java:1334)\n        at\norg.eclipse.ui.internal.Workbench.createAndRunWorkbench(Workbench.java:253)\n        at org.eclipse.ui.PlatformUI.createAndRunWorkbench(PlatformUI.java:141)\n        at org.eclipse.ui.internal.ide.IDEApplication.run(IDEApplication.java:97)\n        at\norg.eclipse.core.internal.runtime.PlatformActivator$1.run(PlatformActivator.java:307)\n        at\norg.eclipse.core.runtime.adaptor.EclipseStarter.run(EclipseStarter.java:256)\n        at\norg.eclipse.core.runtime.adaptor.EclipseStarter.run(EclipseStarter.java:127)\n        at sun.reflect.NativeMethodAccessorImpl.invoke0(Native Method)\n        at\nsun.reflect.NativeMethodAccessorImpl.invoke(NativeMethodAccessorImpl.java:85)\n        at\nsun.reflect.NativeMethodAccessorImpl.invoke(NativeMethodAccessorImpl.java:58)\n        at\nsun.reflect.DelegatingMethodAccessorImpl.invoke(DelegatingMethodAccessorImpl.java:60)\n        at java.lang.reflect.Method.invoke(Method.java:391)\n        at org.eclipse.core.launcher.Main.basicRun(Main.java:185)\n        at org.eclipse.core.launcher.Main.run(Main.java:638)\n        at org.eclipse.core.launcher.Main.main(Main.java:622)\nWidget is disposed",
    "Fixed in the recent builds.",
    "verified n RC1, closing"
  ],
  "commentCreationDates": [
    "2004-05-26T09:04:32+02:00",
    "2004-05-26T16:32:44+02:00",
    "2004-06-03T07:38:10+02:00"
  ],
  "traces": [
    {
      "exceptionType": "org.eclipse.swt.SWTException",
      "message": "Widget is disposed",
      "elements": [
        {
          "method": "org.eclipse.swt.SWT.error",
          "source": "SWT.java:2689"
        },
        {
          "method": "org.eclipse.swt.SWT.error",
          "source": "SWT.java(Inlined Compiled Code)"
        },
        {
          "method": "org.eclipse.swt.SWT.error",
          "source": "SWT.java(Inlined Compiled Code)"
        },
        {
          "method": "org.eclipse.swt.widgets.Widget.error",
          "source": "Widget.java(Inlined Compiled Code)"
        },
        {
          "method": "org.eclipse.swt.widgets.Widget.checkWidget",
          "source": "Widget.java(Compiled Code)"
        },
        {
          "method": "org.eclipse.swt.widgets.Control.redraw",
          "source": "Control.java:2106"
        },
        {
          "method": "org.eclipse.ui.forms.widgets.ImageHyperlink.handleActivate",
          "source": "ImageHyperlink.java:139"
        },
        {
          "method": "org.eclipse.ui.forms.widgets.AbstractHyperlink.handleMouseUp",
          "source": "AbstractHyperlink.java:264"
        },
        {
          "method": "org.eclipse.ui.forms.widgets.AbstractHyperlink.access$1",
          "source": "AbstractHyperlink.java:248"
        },
        {
          "method": "org.eclipse.ui.forms.widgets.AbstractHyperlink$4.handleEvent",
          "source": "AbstractHyperlink.java:95"
        },
        {
          "method": "org.eclipse.swt.widgets.EventTable.sendEvent",
          "source": "EventTable.java(Compiled Code)"
        },
        {
          "method": "org.eclipse.swt.widgets.Widget.sendEvent",
          "source": "Widget.java:944"
        },
        {
          "method": "org.eclipse.swt.widgets.Display.runDeferredEvents",
          "source": "Display.java:2542"
        },
        {
          "method": "org.eclipse.swt.widgets.Display.readAndDispatch",
          "source": "Display.java:2253"
        },
        {
          "method": "org.eclipse.ui.internal.Workbench.runEventLoop",
          "source": "Workbench.java:1363"
        },
        {
          "method": "org.eclipse.ui.internal.Workbench.runUI",
          "source": "Workbench.java:1334"
        },
        {
          "method": "org.eclipse.ui.internal.Workbench.createAndRunWorkbench",
          "source": "Workbench.java:253"
        },
        {
          "method": "org.eclipse.ui.PlatformUI.createAndRunWorkbench",
          "source": "PlatformUI.java:141"
        },
        {
          "method": "org.eclipse.ui.internal.ide.IDEApplication.run",
          "source": "IDEApplication.java:97"
        },
        {
          "method": "org.eclipse.core.internal.runtime.PlatformActivator$1.run",
          "source": "PlatformActivator.java:307"
        },
        {
          "method": "org.eclipse.core.runtime.adaptor.EclipseStarter.run",
          "source": "EclipseStarter.java:256"
        },
        {
          "method": "org.eclipse.core.runtime.adaptor.EclipseStarter.run",
          "source": "EclipseStarter.java:127"
        },
        {
          "method": "sun.reflect.NativeMethodAccessorImpl.invoke0",
          "source": "Native Method"
        },
        {
          "method": "sun.reflect.NativeMethodAccessorImpl.invoke",
          "source": "NativeMethodAccessorImpl.java:85"
        },
        {
          "method": "sun.reflect.NativeMethodAccessorImpl.invoke",
          "source": "NativeMethodAccessorImpl.java:58"
        },
        {
          "method": "sun.reflect.DelegatingMethodAccessorImpl.invoke",
          "source": "DelegatingMethodAccessorImpl.java:60"
        },
        {
          "method": "java.lang.reflect.Method.invoke",
          "source": "Method.java:391"
        },
        {
          "method": "org.eclipse.core.launcher.Main.basicRun",
          "source": "Main.java:185"
        },
        {
          "method": "org.eclipse.core.launcher.Main.run",
          "source": "Main.java:638"
        },
        {
          "method": "org.eclipse.core.launcher.Main.main",
          "source": "Main.java:622"
        }
      ],
      "number": 0,
      "commentIndex": 0,
      "bugId": "64042",
      "date": "2004-05-26T09:04:32+02:00",
      "product": "Platform",
      "component": "UI",
      "severity": "normal"
    }
  ],
  "groupId": "64042",
  "bugId": "64042",
  "date": "2004-05-26T09:04:32+02:00",
  "product": "Platform",
  "component": "UI",
  "severity": "normal"
}