{
  "comments": [
    "The exact version is 2.1.3, Build id: 200403101828.\n\nSuddenly (no changes were made to the eclipse platform) on startup and shutdown\nthe following error occurs (multiple times):\n\n!ENTRY org.eclipse.core.resources 4 272 Jun 01, 2004 10:33:26.281\n!MESSAGE Could not open indexed store: \\\\network-drive\\user\\yyy\\eclipse_workspace\\\n.metadata\\.plugins\\org.eclipse.core.resources\\.root\\.properties.\n!STACK 0\nIndexedStoreException:An error occurred during an indexed store operation.\njava.lang.ClassCastException: org.eclipse.core.internal.indexing.BinarySmallObje\nct\n        at org.eclipse.core.internal.indexing.IndexedStore.open(IndexedStore.jav\na:363)\n        at org.eclipse.core.internal.properties.IndexedStoreWrapper.open(Indexed\nStoreWrapper.java:41)\n        at org.eclipse.core.internal.properties.IndexedStoreWrapper.create(Index\nedStoreWrapper.java:96)\n        at org.eclipse.core.internal.properties.IndexedStoreWrapper.getStore(Ind\nexedStoreWrapper.java:166)\n        at org.eclipse.core.internal.properties.IndexedStoreWrapper.getIndex(Ind\nexedStoreWrapper.java:122)\n        at org.eclipse.core.internal.properties.IndexedStoreWrapper.getCursor(In\ndexedStoreWrapper.java:172)\n        at org.eclipse.core.internal.properties.PropertyStore.recordsMatching(Pr\nopertyStore.java:302)\n        at org.eclipse.core.internal.properties.PropertyStore.get(PropertyStore.\njava:171)\n        at org.eclipse.core.internal.properties.PropertyManager.getProperty(Prop\nertyManager.java:108)\n        at org.eclipse.core.internal.resources.Resource.getPersistentProperty(Re\nsource.java:880)\n        at org.eclipse.jdt.internal.core.JavaModelManager.loadVariablesAndContai\nners(JavaModelManager.java:1096)\n        at org.eclipse.jdt.core.JavaCore.startup(JavaCore.java:3048)\n        at org.eclipse.core.internal.plugins.PluginDescriptor$1.run(PluginDescri\nptor.java:736)\n        at org.eclipse.core.internal.runtime.InternalPlatform.run(InternalPlatfo\nrm.java:1006)\n        at org.eclipse.core.internal.plugins.PluginDescriptor.internalDoPluginAc\ntivation(PluginDescriptor.java:748)\n        at org.eclipse.core.internal.plugins.PluginDescriptor.doPluginActivation\n(PluginDescriptor.java:188)\n        at org.eclipse.core.internal.plugins.PluginClassLoader.activatePlugin(Pl\nuginClassLoader.java:112)\n        at org.eclipse.core.internal.plugins.PluginClassLoader.internalFindClass\nParentsSelf(PluginClassLoader.java:185)\n        at org.eclipse.core.internal.boot.DelegatingURLClassLoader.findClassPare\nntsSelf(DelegatingURLClassLoader.java:490)\n        at org.eclipse.core.internal.boot.DelegatingURLClassLoader.loadClass(Del\negatingURLClassLoader.java:882)\n        at org.eclipse.core.internal.boot.DelegatingURLClassLoader.access$0(Dele\ngatingURLClassLoader.java:876)\n        at org.eclipse.core.internal.boot.DelegatingURLClassLoader$DelegateLoade\nr.loadClass(DelegatingURLClassLoader.java:90)\n        at org.eclipse.core.internal.boot.DelegatingURLClassLoader.findClassPrer\nequisites(DelegatingURLClassLoader.java:554)\n        at org.eclipse.core.internal.boot.DelegatingURLClassLoader.loadClass(Del\negatingURLClassLoader.java:890)\n        at org.eclipse.core.internal.boot.DelegatingURLClassLoader.loadClass(Del\negatingURLClassLoader.java:862)\n        at java.lang.ClassLoader.loadClass(ClassLoader.java:250)\n        at java.lang.ClassLoader.loadClassInternal(ClassLoader.java:310)\n        at org.eclipse.jdt.internal.ui.JavaPlugin.registerAdapters(JavaPlugin.ja\nva:397)\n        at org.eclipse.jdt.internal.ui.JavaPlugin.startup(JavaPlugin.java:220)\n        at org.eclipse.core.internal.plugins.PluginDescriptor$1.run(PluginDescri\nptor.java:736)\n        at org.eclipse.core.internal.runtime.InternalPlatform.run(InternalPlatfo\nrm.java:1006)\n        at org.eclipse.core.internal.plugins.PluginDescriptor.internalDoPluginAc\ntivation(PluginDescriptor.java:748)\n        at org.eclipse.core.internal.plugins.PluginDescriptor.doPluginActivation\n(PluginDescriptor.java:188)\n        at org.eclipse.core.internal.plugins.PluginClassLoader.activatePlugin(Pl\nuginClassLoader.java:112)\n        at org.eclipse.core.internal.plugins.PluginClassLoader.internalFindClass\nParentsSelf(PluginClassLoader.java:185)\n        at org.eclipse.core.internal.boot.DelegatingURLClassLoader.findClassPare\nntsSelf(DelegatingURLClassLoader.java:490)\n        at org.eclipse.core.internal.boot.DelegatingURLClassLoader.loadClass(Del\negatingURLClassLoader.java:882)\n        at org.eclipse.core.internal.boot.DelegatingURLClassLoader.loadClass(Del\negatingURLClassLoader.java:862)\n        at java.lang.ClassLoader.loadClass(ClassLoader.java:250)\n        at org.eclipse.core.internal.plugins.PluginDescriptor.createExecutableEx\ntension(PluginDescriptor.java:130)\n        at org.eclipse.core.internal.plugins.PluginDescriptor.createExecutableEx\ntension(PluginDescriptor.java:167)\n        at org.eclipse.core.internal.plugins.ConfigurationElement.createExecutab\nleExtension(ConfigurationElement.java:103)\n        at org.eclipse.ui.internal.WorkbenchPlugin$1.run(WorkbenchPlugin.java:15\n8)\n        at org.eclipse.swt.custom.BusyIndicator.showWhile(BusyIndicator.java:69)\n\n        at org.eclipse.ui.internal.WorkbenchPlugin.createExtension(WorkbenchPlug\nin.java:155)\n        at org.eclipse.ui.internal.registry.ViewDescriptor.createView(ViewDescri\nptor.java:51)\n        at org.eclipse.ui.internal.ViewFactory$2.run(ViewFactory.java:115)\n        at org.eclipse.core.internal.runtime.InternalPlatform.run(InternalPlatfo\nrm.java:1006)\n        at org.eclipse.core.runtime.Platform.run(Platform.java:413)\n        at org.eclipse.ui.internal.ViewFactory.busyRestoreView(ViewFactory.java:\n98)\n        at org.eclipse.ui.internal.ViewFactory$1.run(ViewFactory.java:82)\n        at org.eclipse.swt.custom.BusyIndicator.showWhile(BusyIndicator.java:69)\n\n        at org.eclipse.ui.internal.ViewFactory.restoreView(ViewFactory.java:78)\n        at org.eclipse.ui.internal.Perspective.restoreState(Perspective.java:911\n)\n        at org.eclipse.ui.internal.WorkbenchPage.restoreState(WorkbenchPage.java\n:2316)\n        at org.eclipse.ui.internal.WorkbenchWindow.restoreState(WorkbenchWindow.\njava:1327)\n        at org.eclipse.ui.internal.Workbench.restoreState(Workbench.java:1263)\n        at org.eclipse.ui.internal.Workbench.access$10(Workbench.java:1223)\n        at org.eclipse.ui.internal.Workbench$12.run(Workbench.java:1141)\n        at org.eclipse.core.internal.runtime.InternalPlatform.run(InternalPlatfo\nrm.java:1006)\n        at org.eclipse.core.runtime.Platform.run(Platform.java:413)\n        at org.eclipse.ui.internal.Workbench.openPreviousWorkbenchState(Workbenc\nh.java:1093)\n        at org.eclipse.ui.internal.Workbench.init(Workbench.java:870)\n        at org.eclipse.ui.internal.Workbench.run(Workbench.java:1373)\n        at org.eclipse.core.internal.boot.InternalBootLoader.run(InternalBootLoa\nder.java:858)\n        at org.eclipse.core.boot.BootLoader.run(BootLoader.java:461)\n        at java.lang.reflect.Method.invoke(Native Method)\n        at org.eclipse.core.launcher.Main.basicRun(Main.java:291)\n        at org.eclipse.core.launcher.Main.run(Main.java:747)\n        at org.eclipse.core.launcher.Main.main(Main.java:583)\njava.lang.ClassCastException: org.eclipse.core.internal.indexing.BinarySmallObje\nct\n        at org.eclipse.core.internal.indexing.IndexedStore.acquireContext(Indexe\ndStore.java:52)\n        at org.eclipse.core.internal.indexing.IndexedStore.open(IndexedStore.jav\na:343)\n        at org.eclipse.core.internal.properties.IndexedStoreWrapper.open(Indexed\nStoreWrapper.java:41)\n        at org.eclipse.core.internal.properties.IndexedStoreWrapper.create(Index\nedStoreWrapper.java:96)\n        at org.eclipse.core.internal.properties.IndexedStoreWrapper.getStore(Ind\nexedStoreWrapper.java:166)\n        at org.eclipse.core.internal.properties.IndexedStoreWrapper.getIndex(Ind\nexedStoreWrapper.java:122)\n        at org.eclipse.core.internal.properties.IndexedStoreWrapper.getCursor(In\ndexedStoreWrapper.java:172)\n        at org.eclipse.core.internal.properties.PropertyStore.recordsMatching(Pr\nopertyStore.java:302)\n        at org.eclipse.core.internal.properties.PropertyStore.get(PropertyStore.\njava:171)\n        at org.eclipse.core.internal.properties.PropertyManager.getProperty(Prop\nertyManager.java:108)\n        at org.eclipse.core.internal.resources.Resource.getPersistentProperty(Re\nsource.java:880)\n        at org.eclipse.jdt.internal.core.JavaModelManager.loadVariablesAndContai\nners(JavaModelManager.java:1096)\n        at org.eclipse.jdt.core.JavaCore.startup(JavaCore.java:3048)\n        at org.eclipse.core.internal.plugins.PluginDescriptor$1.run(PluginDescri\nptor.java:736)\n        at org.eclipse.core.internal.runtime.InternalPlatform.run(InternalPlatfo\nrm.java:1006)\n        at org.eclipse.core.internal.plugins.PluginDescriptor.internalDoPluginAc\ntivation(PluginDescriptor.java:748)\n        at org.eclipse.core.internal.plugins.PluginDescriptor.doPluginActivation\n(PluginDescriptor.java:188)\n        at org.eclipse.core.internal.plugins.PluginClassLoader.activatePlugin(Pl\nuginClassLoader.java:112)\n        at org.eclipse.core.internal.plugins.PluginClassLoader.internalFindClass\nParentsSelf(PluginClassLoader.java:185)\n        at org.eclipse.core.internal.boot.DelegatingURLClassLoader.findClassPare\nntsSelf(DelegatingURLClassLoader.java:490)\n        at org.eclipse.core.internal.boot.DelegatingURLClassLoader.loadClass(Del\negatingURLClassLoader.java:882)\n        at org.eclipse.core.internal.boot.DelegatingURLClassLoader.access$0(Dele\ngatingURLClassLoader.java:876)\n        at org.eclipse.core.internal.boot.DelegatingURLClassLoader$DelegateLoade\nr.loadClass(DelegatingURLClassLoader.java:90)\n        at org.eclipse.core.internal.boot.DelegatingURLClassLoader.findClassPrer\nequisites(DelegatingURLClassLoader.java:554)\n        at org.eclipse.core.internal.boot.DelegatingURLClassLoader.loadClass(Del\negatingURLClassLoader.java:890)\n        at org.eclipse.core.internal.boot.DelegatingURLClassLoader.loadClass(Del\negatingURLClassLoader.java:862)\n        at java.lang.ClassLoader.loadClass(ClassLoader.java:250)\n        at java.lang.ClassLoader.loadClassInternal(ClassLoader.java:310)\n        at org.eclipse.jdt.internal.ui.JavaPlugin.registerAdapters(JavaPlugin.ja\nva:397)\n        at org.eclipse.jdt.internal.ui.JavaPlugin.startup(JavaPlugin.java:220)\n        at org.eclipse.core.internal.plugins.PluginDescriptor$1.run(PluginDescri\nptor.java:736)\n        at org.eclipse.core.internal.runtime.InternalPlatform.run(InternalPlatfo\nrm.java:1006)\n        at org.eclipse.core.internal.plugins.PluginDescriptor.internalDoPluginAc\ntivation(PluginDescriptor.java:748)\n        at org.eclipse.core.internal.plugins.PluginDescriptor.doPluginActivation\n(PluginDescriptor.java:188)\n        at org.eclipse.core.internal.plugins.PluginClassLoader.activatePlugin(Pl\nuginClassLoader.java:112)\n        at org.eclipse.core.internal.plugins.PluginClassLoader.internalFindClass\nParentsSelf(PluginClassLoader.java:185)\n        at org.eclipse.core.internal.boot.DelegatingURLClassLoader.findClassPare\nntsSelf(DelegatingURLClassLoader.java:490)\n        at org.eclipse.core.internal.boot.DelegatingURLClassLoader.loadClass(Del\negatingURLClassLoader.java:882)\n        at org.eclipse.core.internal.boot.DelegatingURLClassLoader.loadClass(Del\negatingURLClassLoader.java:862)\n        at java.lang.ClassLoader.loadClass(ClassLoader.java:250)\n        at org.eclipse.core.internal.plugins.PluginDescriptor.createExecutableEx\ntension(PluginDescriptor.java:130)\n        at org.eclipse.core.internal.plugins.PluginDescriptor.createExecutableEx\ntension(PluginDescriptor.java:167)\n        at org.eclipse.core.internal.plugins.ConfigurationElement.createExecutab\nleExtension(ConfigurationElement.java:103)\n        at org.eclipse.ui.internal.WorkbenchPlugin$1.run(WorkbenchPlugin.java:15\n8)\n        at org.eclipse.swt.custom.BusyIndicator.showWhile(BusyIndicator.java:69)\n\n        at org.eclipse.ui.internal.WorkbenchPlugin.createExtension(WorkbenchPlug\nin.java:155)\n        at org.eclipse.ui.internal.registry.ViewDescriptor.createView(ViewDescri\nptor.java:51)\n        at org.eclipse.ui.internal.ViewFactory$2.run(ViewFactory.java:115)\n        at org.eclipse.core.internal.runtime.InternalPlatform.run(InternalPlatfo\nrm.java:1006)\n        at org.eclipse.core.runtime.Platform.run(Platform.java:413)\n        at org.eclipse.ui.internal.ViewFactory.busyRestoreView(ViewFactory.java:\n98)\n        at org.eclipse.ui.internal.ViewFactory$1.run(ViewFactory.java:82)\n        at org.eclipse.swt.custom.BusyIndicator.showWhile(BusyIndicator.java:69)\n\n        at org.eclipse.ui.internal.ViewFactory.restoreView(ViewFactory.java:78)\n        at org.eclipse.ui.internal.Perspective.restoreState(Perspective.java:911\n)\n        at org.eclipse.ui.internal.WorkbenchPage.restoreState(WorkbenchPage.java\n:2316)\n        at org.eclipse.ui.internal.WorkbenchWindow.restoreState(WorkbenchWindow.\njava:1327)\n        at org.eclipse.ui.internal.Workbench.restoreState(Workbench.java:1263)\n        at org.eclipse.ui.internal.Workbench.access$10(Workbench.java:1223)\n        at org.eclipse.ui.internal.Workbench$12.run(Workbench.java:1141)\n        at org.eclipse.core.internal.runtime.InternalPlatform.run(InternalPlatfo\nrm.java:1006)\n        at org.eclipse.core.runtime.Platform.run(Platform.java:413)\n        at org.eclipse.ui.internal.Workbench.openPreviousWorkbenchState(Workbenc\nh.java:1093)\n        at org.eclipse.ui.internal.Workbench.init(Workbench.java:870)\n        at org.eclipse.ui.internal.Workbench.run(Workbench.java:1373)\n        at org.eclipse.core.internal.boot.InternalBootLoader.run(InternalBootLoa\nder.java:858)\n        at org.eclipse.core.boot.BootLoader.run(BootLoader.java:461)\n        at java.lang.reflect.Method.invoke(Native Method)\n        at org.eclipse.core.launcher.Main.basicRun(Main.java:291)\n        at org.eclipse.core.launcher.Main.run(Main.java:747)\n        at org.eclipse.core.launcher.Main.main(Main.java:583)\n\n\nThere were some network trouble from time to time, so the workspace could not be\nsaved at least once. ... but how can such lead to a CCEx?!?\nHow can I fix it?",
    "This is likely due to corrupted metadata. The class cast exception occurs due to\nan object of a non-expected class being found when reading from the serialized\nstate.\n\nLooks like a dup of bug 35824 (workspace also on network location).",
    "As a work-around, try deleting (or moving) the offending file. Should work.\n\n*** This bug has been marked as a duplicate of 35824 ***"
  ],
  "commentCreationDates": [
    "2004-06-01T10:47:56+02:00",
    "2004-06-01T16:54:28+02:00",
    "2004-06-01T23:50:54+02:00"
  ],
  "traces": [
    {
      "exceptionType": "java.lang.ClassCastException",
      "message": "org.eclipse.core.internal.indexing.BinarySmallObje ct",
      "elements": [
        {
          "method": "org.eclipse.core.internal.indexing.IndexedStore.open",
          "source": "IndexedStore.jav a:363"
        },
        {
          "method": "org.eclipse.core.internal.properties.IndexedStoreWrapper.open",
          "source": "Indexed StoreWrapper.java:41"
        },
        {
          "method": "org.eclipse.core.internal.properties.IndexedStoreWrapper.create",
          "source": "Index edStoreWrapper.java:96"
        },
        {
          "method": "org.eclipse.core.internal.properties.IndexedStoreWrapper.getStore",
          "source": "Ind exedStoreWrapper.java:166"
        },
        {
          "method": "org.eclipse.core.internal.properties.IndexedStoreWrapper.getIndex",
          "source": "Ind exedStoreWrapper.java:122"
        },
        {
          "method": "org.eclipse.core.internal.properties.IndexedStoreWrapper.getCursor",
          "source": "In dexedStoreWrapper.java:172"
        },
        {
          "method": "org.eclipse.core.internal.properties.PropertyStore.recordsMatching",
          "source": "Pr opertyStore.java:302"
        },
        {
          "method": "org.eclipse.core.internal.properties.PropertyStore.get",
          "source": "PropertyStore. java:171"
        },
        {
          "method": "org.eclipse.core.internal.properties.PropertyManager.getProperty",
          "source": "Prop ertyManager.java:108"
        },
        {
          "method": "org.eclipse.core.internal.resources.Resource.getPersistentProperty",
          "source": "Re source.java:880"
        },
        {
          "method": "org.eclipse.jdt.internal.core.JavaModelManager.loadVariablesAndContainers",
          "source": "JavaModelManager.java:1096"
        },
        {
          "method": "org.eclipse.jdt.core.JavaCore.startup",
          "source": "JavaCore.java:3048"
        },
        {
          "method": "org.eclipse.core.internal.plugins.PluginDescriptor$1.run",
          "source": "PluginDescri ptor.java:736"
        },
        {
          "method": "org.eclipse.core.internal.runtime.InternalPlatform.run",
          "source": "InternalPlatfo rm.java:1006"
        },
        {
          "method": "org.eclipse.core.internal.plugins.PluginDescriptor.internalDoPluginActivation",
          "source": "PluginDescriptor.java:748"
        },
        {
          "method": "org.eclipse.core.internal.plugins.PluginDescriptor.doPluginActivation",
          "source": "PluginDescriptor.java:188"
        },
        {
          "method": "org.eclipse.core.internal.plugins.PluginClassLoader.activatePlugin",
          "source": "Pl uginClassLoader.java:112"
        },
        {
          "method": "org.eclipse.core.internal.plugins.PluginClassLoader.internalFindClassParentsSelf",
          "source": "PluginClassLoader.java:185"
        },
        {
          "method": "org.eclipse.core.internal.boot.DelegatingURLClassLoader.findClassParentsSelf",
          "source": "DelegatingURLClassLoader.java:490"
        },
        {
          "method": "org.eclipse.core.internal.boot.DelegatingURLClassLoader.loadClass",
          "source": "Del egatingURLClassLoader.java:882"
        },
        {
          "method": "org.eclipse.core.internal.boot.DelegatingURLClassLoader.access$0",
          "source": "Dele gatingURLClassLoader.java:876"
        },
        {
          "method": "org.eclipse.core.internal.boot.DelegatingURLClassLoader$DelegateLoader.loadClass",
          "source": "DelegatingURLClassLoader.java:90"
        },
        {
          "method": "org.eclipse.core.internal.boot.DelegatingURLClassLoader.findClassPrerequisites",
          "source": "DelegatingURLClassLoader.java:554"
        },
        {
          "method": "org.eclipse.core.internal.boot.DelegatingURLClassLoader.loadClass",
          "source": "Del egatingURLClassLoader.java:890"
        },
        {
          "method": "org.eclipse.core.internal.boot.DelegatingURLClassLoader.loadClass",
          "source": "Del egatingURLClassLoader.java:862"
        },
        {
          "method": "java.lang.ClassLoader.loadClass",
          "source": "ClassLoader.java:250"
        },
        {
          "method": "java.lang.ClassLoader.loadClassInternal",
          "source": "ClassLoader.java:310"
        },
        {
          "method": "org.eclipse.jdt.internal.ui.JavaPlugin.registerAdapters",
          "source": "JavaPlugin.ja va:397"
        },
        {
          "method": "org.eclipse.jdt.internal.ui.JavaPlugin.startup",
          "source": "JavaPlugin.java:220"
        },
        {
          "method": "org.eclipse.core.internal.plugins.PluginDescriptor$1.run",
          "source": "PluginDescri ptor.java:736"
        },
        {
          "method": "org.eclipse.core.internal.runtime.InternalPlatform.run",
          "source": "InternalPlatfo rm.java:1006"
        },
        {
          "method": "org.eclipse.core.internal.plugins.PluginDescriptor.internalDoPluginActivation",
          "source": "PluginDescriptor.java:748"
        },
        {
          "method": "org.eclipse.core.internal.plugins.PluginDescriptor.doPluginActivation",
          "source": "PluginDescriptor.java:188"
        },
        {
          "method": "org.eclipse.core.internal.plugins.PluginClassLoader.activatePlugin",
          "source": "Pl uginClassLoader.java:112"
        },
        {
          "method": "org.eclipse.core.internal.plugins.PluginClassLoader.internalFindClassParentsSelf",
          "source": "PluginClassLoader.java:185"
        },
        {
          "method": "org.eclipse.core.internal.boot.DelegatingURLClassLoader.findClassParentsSelf",
          "source": "DelegatingURLClassLoader.java:490"
        },
        {
          "method": "org.eclipse.core.internal.boot.DelegatingURLClassLoader.loadClass",
          "source": "Del egatingURLClassLoader.java:882"
        },
        {
          "method": "org.eclipse.core.internal.boot.DelegatingURLClassLoader.loadClass",
          "source": "Del egatingURLClassLoader.java:862"
        },
        {
          "method": "java.lang.ClassLoader.loadClass",
          "source": "ClassLoader.java:250"
        },
        {
          "method": "org.eclipse.core.internal.plugins.PluginDescriptor.createExecutableExtension",
          "source": "PluginDescriptor.java:130"
        },
        {
          "method": "org.eclipse.core.internal.plugins.PluginDescriptor.createExecutableExtension",
          "source": "PluginDescriptor.java:167"
        },
        {
          "method": "org.eclipse.core.internal.plugins.ConfigurationElement.createExecutableExtension",
          "source": "ConfigurationElement.java:103"
        },
        {
          "method": "org.eclipse.ui.internal.WorkbenchPlugin$1.run",
          "source": "WorkbenchPlugin.java:15 8"
        },
        {
          "method": "org.eclipse.swt.custom.BusyIndicator.showWhile",
          "source": "BusyIndicator.java:69"
        },
        {
          "method": "org.eclipse.ui.internal.WorkbenchPlugin.createExtension",
          "source": "WorkbenchPlug in.java:155"
        },
        {
          "method": "org.eclipse.ui.internal.registry.ViewDescriptor.createView",
          "source": "ViewDescri ptor.java:51"
        },
        {
          "method": "org.eclipse.ui.internal.ViewFactory$2.run",
          "source": "ViewFactory.java:115"
        },
        {
          "method": "org.eclipse.core.internal.runtime.InternalPlatform.run",
          "source": "InternalPlatfo rm.java:1006"
        },
        {
          "method": "org.eclipse.core.runtime.Platform.run",
          "source": "Platform.java:413"
        },
        {
          "method": "org.eclipse.ui.internal.ViewFactory.busyRestoreView",
          "source": "ViewFactory.java: 98"
        },
        {
          "method": "org.eclipse.ui.internal.ViewFactory$1.run",
          "source": "ViewFactory.java:82"
        },
        {
          "method": "org.eclipse.swt.custom.BusyIndicator.showWhile",
          "source": "BusyIndicator.java:69"
        },
        {
          "method": "org.eclipse.ui.internal.ViewFactory.restoreView",
          "source": "ViewFactory.java:78"
        },
        {
          "method": "org.eclipse.ui.internal.Perspective.restoreState",
          "source": "Perspective.java:911 "
        },
        {
          "method": "org.eclipse.ui.internal.WorkbenchPage.restoreState",
          "source": "WorkbenchPage.java :2316"
        },
        {
          "method": "org.eclipse.ui.internal.WorkbenchWindow.restoreState",
          "source": "WorkbenchWindow. java:1327"
        },
        {
          "method": "org.eclipse.ui.internal.Workbench.restoreState",
          "source": "Workbench.java:1263"
        },
        {
          "method": "org.eclipse.ui.internal.Workbench.access$10",
          "source": "Workbench.java:1223"
        },
        {
          "method": "org.eclipse.ui.internal.Workbench$12.run",
          "source": "Workbench.java:1141"
        },
        {
          "method": "org.eclipse.core.internal.runtime.InternalPlatform.run",
          "source": "InternalPlatfo rm.java:1006"
        },
        {
          "method": "org.eclipse.core.runtime.Platform.run",
          "source": "Platform.java:413"
        },
        {
          "method": "org.eclipse.ui.internal.Workbench.openPreviousWorkbenchState",
          "source": "Workbenc h.java:1093"
        },
        {
          "method": "org.eclipse.ui.internal.Workbench.init",
          "source": "Workbench.java:870"
        },
        {
          "method": "org.eclipse.ui.internal.Workbench.run",
          "source": "Workbench.java:1373"
        },
        {
          "method": "org.eclipse.core.internal.boot.InternalBootLoader.run",
          "source": "InternalBootLoa der.java:858"
        },
        {
          "method": "org.eclipse.core.boot.BootLoader.run",
          "source": "BootLoader.java:461"
        },
        {
          "method": "java.lang.reflect.Method.invoke",
          "source": "Native Method"
        },
        {
          "method": "org.eclipse.core.launcher.Main.basicRun",
          "source": "Main.java:291"
        },
        {
          "method": "org.eclipse.core.launcher.Main.run",
          "source": "Main.java:747"
        },
        {
          "method": "org.eclipse.core.launcher.Main.main",
          "source": "Main.java:583"
        }
      ],
      "number": 0,
      "commentIndex": 0,
      "bugId": "64870",
      "duplicateId": "35824",
      "date": "2004-06-01T10:47:56+02:00",
      "product": "Platform",
      "component": "Resources",
      "severity": "normal"
    },
    {
      "exceptionType": "java.lang.ClassCastException",
      "message": "org.eclipse.core.internal.indexing.BinarySmallObje ct",
      "elements": [
        {
          "method": "org.eclipse.core.internal.indexing.IndexedStore.acquireContext",
          "source": "Indexe dStore.java:52"
        },
        {
          "method": "org.eclipse.core.internal.indexing.IndexedStore.open",
          "source": "IndexedStore.jav a:343"
        },
        {
          "method": "org.eclipse.core.internal.properties.IndexedStoreWrapper.open",
          "source": "Indexed StoreWrapper.java:41"
        },
        {
          "method": "org.eclipse.core.internal.properties.IndexedStoreWrapper.create",
          "source": "Index edStoreWrapper.java:96"
        },
        {
          "method": "org.eclipse.core.internal.properties.IndexedStoreWrapper.getStore",
          "source": "Ind exedStoreWrapper.java:166"
        },
        {
          "method": "org.eclipse.core.internal.properties.IndexedStoreWrapper.getIndex",
          "source": "Ind exedStoreWrapper.java:122"
        },
        {
          "method": "org.eclipse.core.internal.properties.IndexedStoreWrapper.getCursor",
          "source": "In dexedStoreWrapper.java:172"
        },
        {
          "method": "org.eclipse.core.internal.properties.PropertyStore.recordsMatching",
          "source": "Pr opertyStore.java:302"
        },
        {
          "method": "org.eclipse.core.internal.properties.PropertyStore.get",
          "source": "PropertyStore. java:171"
        },
        {
          "method": "org.eclipse.core.internal.properties.PropertyManager.getProperty",
          "source": "Prop ertyManager.java:108"
        },
        {
          "method": "org.eclipse.core.internal.resources.Resource.getPersistentProperty",
          "source": "Re source.java:880"
        },
        {
          "method": "org.eclipse.jdt.internal.core.JavaModelManager.loadVariablesAndContainers",
          "source": "JavaModelManager.java:1096"
        },
        {
          "method": "org.eclipse.jdt.core.JavaCore.startup",
          "source": "JavaCore.java:3048"
        },
        {
          "method": "org.eclipse.core.internal.plugins.PluginDescriptor$1.run",
          "source": "PluginDescri ptor.java:736"
        },
        {
          "method": "org.eclipse.core.internal.runtime.InternalPlatform.run",
          "source": "InternalPlatfo rm.java:1006"
        },
        {
          "method": "org.eclipse.core.internal.plugins.PluginDescriptor.internalDoPluginActivation",
          "source": "PluginDescriptor.java:748"
        },
        {
          "method": "org.eclipse.core.internal.plugins.PluginDescriptor.doPluginActivation",
          "source": "PluginDescriptor.java:188"
        },
        {
          "method": "org.eclipse.core.internal.plugins.PluginClassLoader.activatePlugin",
          "source": "Pl uginClassLoader.java:112"
        },
        {
          "method": "org.eclipse.core.internal.plugins.PluginClassLoader.internalFindClassParentsSelf",
          "source": "PluginClassLoader.java:185"
        },
        {
          "method": "org.eclipse.core.internal.boot.DelegatingURLClassLoader.findClassParentsSelf",
          "source": "DelegatingURLClassLoader.java:490"
        },
        {
          "method": "org.eclipse.core.internal.boot.DelegatingURLClassLoader.loadClass",
          "source": "Del egatingURLClassLoader.java:882"
        },
        {
          "method": "org.eclipse.core.internal.boot.DelegatingURLClassLoader.access$0",
          "source": "Dele gatingURLClassLoader.java:876"
        },
        {
          "method": "org.eclipse.core.internal.boot.DelegatingURLClassLoader$DelegateLoader.loadClass",
          "source": "DelegatingURLClassLoader.java:90"
        },
        {
          "method": "org.eclipse.core.internal.boot.DelegatingURLClassLoader.findClassPrerequisites",
          "source": "DelegatingURLClassLoader.java:554"
        },
        {
          "method": "org.eclipse.core.internal.boot.DelegatingURLClassLoader.loadClass",
          "source": "Del egatingURLClassLoader.java:890"
        },
        {
          "method": "org.eclipse.core.internal.boot.DelegatingURLClassLoader.loadClass",
          "source": "Del egatingURLClassLoader.java:862"
        },
        {
          "method": "java.lang.ClassLoader.loadClass",
          "source": "ClassLoader.java:250"
        },
        {
          "method": "java.lang.ClassLoader.loadClassInternal",
          "source": "ClassLoader.java:310"
        },
        {
          "method": "org.eclipse.jdt.internal.ui.JavaPlugin.registerAdapters",
          "source": "JavaPlugin.ja va:397"
        },
        {
          "method": "org.eclipse.jdt.internal.ui.JavaPlugin.startup",
          "source": "JavaPlugin.java:220"
        },
        {
          "method": "org.eclipse.core.internal.plugins.PluginDescriptor$1.run",
          "source": "PluginDescri ptor.java:736"
        },
        {
          "method": "org.eclipse.core.internal.runtime.InternalPlatform.run",
          "source": "InternalPlatfo rm.java:1006"
        },
        {
          "method": "org.eclipse.core.internal.plugins.PluginDescriptor.internalDoPluginActivation",
          "source": "PluginDescriptor.java:748"
        },
        {
          "method": "org.eclipse.core.internal.plugins.PluginDescriptor.doPluginActivation",
          "source": "PluginDescriptor.java:188"
        },
        {
          "method": "org.eclipse.core.internal.plugins.PluginClassLoader.activatePlugin",
          "source": "Pl uginClassLoader.java:112"
        },
        {
          "method": "org.eclipse.core.internal.plugins.PluginClassLoader.internalFindClassParentsSelf",
          "source": "PluginClassLoader.java:185"
        },
        {
          "method": "org.eclipse.core.internal.boot.DelegatingURLClassLoader.findClassParentsSelf",
          "source": "DelegatingURLClassLoader.java:490"
        },
        {
          "method": "org.eclipse.core.internal.boot.DelegatingURLClassLoader.loadClass",
          "source": "Del egatingURLClassLoader.java:882"
        },
        {
          "method": "org.eclipse.core.internal.boot.DelegatingURLClassLoader.loadClass",
          "source": "Del egatingURLClassLoader.java:862"
        },
        {
          "method": "java.lang.ClassLoader.loadClass",
          "source": "ClassLoader.java:250"
        },
        {
          "method": "org.eclipse.core.internal.plugins.PluginDescriptor.createExecutableExtension",
          "source": "PluginDescriptor.java:130"
        },
        {
          "method": "org.eclipse.core.internal.plugins.PluginDescriptor.createExecutableExtension",
          "source": "PluginDescriptor.java:167"
        },
        {
          "method": "org.eclipse.core.internal.plugins.ConfigurationElement.createExecutableExtension",
          "source": "ConfigurationElement.java:103"
        },
        {
          "method": "org.eclipse.ui.internal.WorkbenchPlugin$1.run",
          "source": "WorkbenchPlugin.java:15 8"
        },
        {
          "method": "org.eclipse.swt.custom.BusyIndicator.showWhile",
          "source": "BusyIndicator.java:69"
        },
        {
          "method": "org.eclipse.ui.internal.WorkbenchPlugin.createExtension",
          "source": "WorkbenchPlug in.java:155"
        },
        {
          "method": "org.eclipse.ui.internal.registry.ViewDescriptor.createView",
          "source": "ViewDescri ptor.java:51"
        },
        {
          "method": "org.eclipse.ui.internal.ViewFactory$2.run",
          "source": "ViewFactory.java:115"
        },
        {
          "method": "org.eclipse.core.internal.runtime.InternalPlatform.run",
          "source": "InternalPlatfo rm.java:1006"
        },
        {
          "method": "org.eclipse.core.runtime.Platform.run",
          "source": "Platform.java:413"
        },
        {
          "method": "org.eclipse.ui.internal.ViewFactory.busyRestoreView",
          "source": "ViewFactory.java: 98"
        },
        {
          "method": "org.eclipse.ui.internal.ViewFactory$1.run",
          "source": "ViewFactory.java:82"
        },
        {
          "method": "org.eclipse.swt.custom.BusyIndicator.showWhile",
          "source": "BusyIndicator.java:69"
        },
        {
          "method": "org.eclipse.ui.internal.ViewFactory.restoreView",
          "source": "ViewFactory.java:78"
        },
        {
          "method": "org.eclipse.ui.internal.Perspective.restoreState",
          "source": "Perspective.java:911 "
        },
        {
          "method": "org.eclipse.ui.internal.WorkbenchPage.restoreState",
          "source": "WorkbenchPage.java :2316"
        },
        {
          "method": "org.eclipse.ui.internal.WorkbenchWindow.restoreState",
          "source": "WorkbenchWindow. java:1327"
        },
        {
          "method": "org.eclipse.ui.internal.Workbench.restoreState",
          "source": "Workbench.java:1263"
        },
        {
          "method": "org.eclipse.ui.internal.Workbench.access$10",
          "source": "Workbench.java:1223"
        },
        {
          "method": "org.eclipse.ui.internal.Workbench$12.run",
          "source": "Workbench.java:1141"
        },
        {
          "method": "org.eclipse.core.internal.runtime.InternalPlatform.run",
          "source": "InternalPlatfo rm.java:1006"
        },
        {
          "method": "org.eclipse.core.runtime.Platform.run",
          "source": "Platform.java:413"
        },
        {
          "method": "org.eclipse.ui.internal.Workbench.openPreviousWorkbenchState",
          "source": "Workbenc h.java:1093"
        },
        {
          "method": "org.eclipse.ui.internal.Workbench.init",
          "source": "Workbench.java:870"
        },
        {
          "method": "org.eclipse.ui.internal.Workbench.run",
          "source": "Workbench.java:1373"
        },
        {
          "method": "org.eclipse.core.internal.boot.InternalBootLoader.run",
          "source": "InternalBootLoa der.java:858"
        },
        {
          "method": "org.eclipse.core.boot.BootLoader.run",
          "source": "BootLoader.java:461"
        },
        {
          "method": "java.lang.reflect.Method.invoke",
          "source": "Native Method"
        },
        {
          "method": "org.eclipse.core.launcher.Main.basicRun",
          "source": "Main.java:291"
        },
        {
          "method": "org.eclipse.core.launcher.Main.run",
          "source": "Main.java:747"
        },
        {
          "method": "org.eclipse.core.launcher.Main.main",
          "source": "Main.java:583"
        }
      ],
      "number": 1,
      "commentIndex": 0,
      "bugId": "64870",
      "duplicateId": "35824",
      "date": "2004-06-01T10:47:56+02:00",
      "product": "Platform",
      "component": "Resources",
      "severity": "normal"
    }
  ],
  "groupId": "78099",
  "bugId": "64870",
  "duplicateId": "35824",
  "date": "2004-06-01T10:47:56+02:00",
  "product": "Platform",
  "component": "Resources",
  "severity": "normal"
}