{
  "comments": [
    "RC1\n\nTest Case\n\n/*\n * Created on 01.06.2004\n *\n * TODO To change the template for this generated file go to\n * Window - Preferences - Java - Code Style - Code Templates\n */\npackage p;\n\nimport junit.framework.TestCase;\n\n/**\n * @author dbaeumer\n *\n * TODO To change the template for this generated type comment go to\n * Window - Preferences - Java - Code Style - Code Templates\n */\npublic class Dummy extends TestCase {\n\n\tprivate String fValue;\n\t\n\tpublic void testOne() throws Exception {\n\t\t\n\t}\n}\n\n- locked workspace\n- selected fValue;\n- generated delegate methods\n- canceled test action\n- reverted editor content back\n\nException:\n\njava.lang.IllegalArgumentException: Index out of bounds\n        at org.eclipse.swt.SWT.error(SWT.java:2677)\n        at org.eclipse.swt.SWT.error(SWT.java:2616)\n        at org.eclipse.swt.SWT.error(SWT.java:2587)\n        at org.eclipse.swt.custom.StyledText.getLocationAtOffset\n(StyledText.java:3818)\n        at org.eclipse.jface.text.CursorLinePainter.drawHighlightLine\n(CursorLinePainter.java:173)\n        at org.eclipse.jface.text.CursorLinePainter.paint\n(CursorLinePainter.java:239)\n        at org.eclipse.jface.text.PaintManager.paint(PaintManager.java:296)\n        at org.eclipse.jface.text.PaintManager.access$1(PaintManager.java:294)\n        at org.eclipse.jface.text.PaintManager$1.run(PaintManager.java:351)\n        at org.eclipse.swt.widgets.RunnableLock.run(RunnableLock.java(Inlined \nCompiled Code))\n        at org.eclipse.swt.widgets.Synchronizer.runAsyncMessages\n(Synchronizer.java(Compiled Code))\n        at org.eclipse.swt.widgets.Display.runAsyncMessages(Display.java\n(Inlined Compiled Code))\n        at org.eclipse.swt.widgets.Display.readAndDispatch(Display.java\n(Compiled Code))\n        at org.eclipse.ui.internal.Workbench.runEventLoop(Workbench.java\n(Compiled Code))\n        at org.eclipse.ui.internal.Workbench.runUI(Workbench.java:1334)\n        at org.eclipse.ui.internal.Workbench.createAndRunWorkbench\n(Workbench.java:253)\n        at org.eclipse.ui.PlatformUI.createAndRunWorkbench(PlatformUI.java:141)\n        at org.eclipse.ui.internal.ide.IDEApplication.run\n(IDEApplication.java:96)\n        at org.eclipse.core.internal.runtime.PlatformActivator$1.run\n(PlatformActivator.java:334)\n        at org.eclipse.core.runtime.adaptor.EclipseStarter.run\n(EclipseStarter.java:273)\n        at org.eclipse.core.runtime.adaptor.EclipseStarter.run\n(EclipseStarter.java:128)\n        at sun.reflect.NativeMethodAccessorImpl.invoke0(Native Method)\n        at sun.reflect.NativeMethodAccessorImpl.invoke\n(NativeMethodAccessorImpl.java:79)\n        at sun.reflect.DelegatingMethodAccessorImpl.invoke\n(DelegatingMethodAccessorImpl.java:41)\n        at java.lang.reflect.Method.invoke(Method.java:386)\n        at org.eclipse.core.launcher.Main.basicRun(Main.java:185)\n        at org.eclipse.core.launcher.Main.run(Main.java:638)\n        at org.eclipse.core.launcher.Main.main(Main.java:622)",
    "*** Bug 64603 has been marked as a duplicate of this bug. ***",
    "*** Bug 65244 has been marked as a duplicate of this bug. ***",
    "*** Bug 65972 has been marked as a duplicate of this bug. ***",
    "Build I200406091200.",
    "I can\u0027t verify with the original scenario, since it now causes bug 66641. \nHowever, I was able to verify the scenario from bug 65244."
  ],
  "commentCreationDates": [
    "2004-06-01T12:10:55+02:00",
    "2004-06-02T19:54:09+02:00",
    "2004-06-02T19:54:39+02:00",
    "2004-06-07T18:57:33+02:00",
    "2004-06-09T12:47:21+02:00",
    "2004-06-11T11:35:37+02:00"
  ],
  "traces": [
    {
      "exceptionType": "java.lang.IllegalArgumentException",
      "message": "Index out of bounds",
      "elements": [
        {
          "method": "org.eclipse.swt.SWT.error",
          "source": "SWT.java:2677"
        },
        {
          "method": "org.eclipse.swt.SWT.error",
          "source": "SWT.java:2616"
        },
        {
          "method": "org.eclipse.swt.SWT.error",
          "source": "SWT.java:2587"
        },
        {
          "method": "org.eclipse.swt.custom.StyledText.getLocationAtOffset",
          "source": "StyledText.java:3818"
        },
        {
          "method": "org.eclipse.jface.text.CursorLinePainter.drawHighlightLine",
          "source": "CursorLinePainter.java:173"
        },
        {
          "method": "org.eclipse.jface.text.CursorLinePainter.paint",
          "source": "CursorLinePainter.java:239"
        },
        {
          "method": "org.eclipse.jface.text.PaintManager.paint",
          "source": "PaintManager.java:296"
        },
        {
          "method": "org.eclipse.jface.text.PaintManager.access$1",
          "source": "PaintManager.java:294"
        },
        {
          "method": "org.eclipse.jface.text.PaintManager$1.run",
          "source": "PaintManager.java:351"
        },
        {
          "method": "org.eclipse.swt.widgets.RunnableLock.run",
          "source": "RunnableLock.java(Inlined  Compiled Code)"
        },
        {
          "method": "org.eclipse.swt.widgets.Synchronizer.runAsyncMessages",
          "source": "Synchronizer.java(Compiled Code)"
        },
        {
          "method": "org.eclipse.swt.widgets.Display.runAsyncMessages",
          "source": "Display.java (Inlined Compiled Code)"
        },
        {
          "method": "org.eclipse.swt.widgets.Display.readAndDispatch",
          "source": "Display.java (Compiled Code)"
        },
        {
          "method": "org.eclipse.ui.internal.Workbench.runEventLoop",
          "source": "Workbench.java (Compiled Code)"
        },
        {
          "method": "org.eclipse.ui.internal.Workbench.runUI",
          "source": "Workbench.java:1334"
        },
        {
          "method": "org.eclipse.ui.internal.Workbench.createAndRunWorkbench",
          "source": "Workbench.java:253"
        },
        {
          "method": "org.eclipse.ui.PlatformUI.createAndRunWorkbench",
          "source": "PlatformUI.java:141"
        },
        {
          "method": "org.eclipse.ui.internal.ide.IDEApplication.run",
          "source": "IDEApplication.java:96"
        },
        {
          "method": "org.eclipse.core.internal.runtime.PlatformActivator$1.run",
          "source": "PlatformActivator.java:334"
        },
        {
          "method": "org.eclipse.core.runtime.adaptor.EclipseStarter.run",
          "source": "EclipseStarter.java:273"
        },
        {
          "method": "org.eclipse.core.runtime.adaptor.EclipseStarter.run",
          "source": "EclipseStarter.java:128"
        },
        {
          "method": "sun.reflect.NativeMethodAccessorImpl.invoke0",
          "source": "Native Method"
        },
        {
          "method": "sun.reflect.NativeMethodAccessorImpl.invoke",
          "source": "NativeMethodAccessorImpl.java:79"
        },
        {
          "method": "sun.reflect.DelegatingMethodAccessorImpl.invoke",
          "source": "DelegatingMethodAccessorImpl.java:41"
        },
        {
          "method": "java.lang.reflect.Method.invoke",
          "source": "Method.java:386"
        },
        {
          "method": "org.eclipse.core.launcher.Main.basicRun",
          "source": "Main.java:185"
        },
        {
          "method": "org.eclipse.core.launcher.Main.run",
          "source": "Main.java:638"
        },
        {
          "method": "org.eclipse.core.launcher.Main.main",
          "source": "Main.java:622"
        }
      ],
      "number": 0,
      "commentIndex": 0,
      "bugId": "64898",
      "date": "2004-06-01T12:10:55+02:00",
      "product": "Platform",
      "component": "Text",
      "severity": "normal"
    }
  ],
  "groupId": "64898",
  "bugId": "64898",
  "date": "2004-06-01T12:10:55+02:00",
  "product": "Platform",
  "component": "Text",
  "severity": "normal"
}