{
  "comments": [
    "build R3.0 RC2\n\n- open new workspace\n- tried to use Tab, shift+tab, alt+tab and arrow keys to navigate around the\nintro, finally tabbed to the \"go to workbench\" button and pressed enter.\n\nWent to the log and the following error was reported.\n\n!SESSION Jun 14, 2004 13:15:25.962 ---------------------------------------------\neclipse.buildId\u003dI200406111814\njava.version\u003d1.4.2_01\njava.vendor\u003dSun Microsystems Inc.\nBootLoader constants: OS\u003dlinux, ARCH\u003dx86, WS\u003dmotif, NL\u003den_US\n\n!ENTRY org.eclipse.ui 4 4 Jun 14, 2004 13:15:25.962\n!MESSAGE Unhandled event loop exception\n\n!ENTRY org.eclipse.ui 4 0 Jun 14, 2004 13:15:25.964\n!MESSAGE Widget is disposed\n!STACK 0\norg.eclipse.swt.SWTException: Widget is disposed\n        at org.eclipse.swt.SWT.error(SWT.java:2691)\n        at org.eclipse.swt.SWT.error(SWT.java:2616)\n        at org.eclipse.swt.SWT.error(SWT.java:2587)\n        at org.eclipse.swt.widgets.Widget.error(Widget.java:334)\n        at org.eclipse.swt.widgets.Widget.checkWidget(Widget.java:271)\n        at org.eclipse.swt.widgets.Control.getParent(Control.java:930)\n        at\norg.eclipse.ui.internal.forms.widgets.FormUtil.getScrolledComposite(FormUtil.java:181)\n        at\norg.eclipse.ui.internal.forms.widgets.FormUtil.processKey(FormUtil.java:293)\n        at\norg.eclipse.ui.forms.widgets.FormToolkit$KeyboardHandler.keyPressed(FormToolkit.java:133)\n        at org.eclipse.swt.widgets.TypedListener.handleEvent(TypedListener.java:121)\n        at org.eclipse.swt.widgets.EventTable.sendEvent(EventTable.java:82)\n        at org.eclipse.swt.widgets.Widget.sendEvent(Widget.java:731)\n        at org.eclipse.swt.widgets.Widget.sendEvent(Widget.java:752)\n        at org.eclipse.swt.widgets.Widget.sendEvent(Widget.java:738)\n        at org.eclipse.swt.widgets.Control.sendKeyEvent(Control.java:1793)\n        at org.eclipse.swt.widgets.Control.XKeyPress(Control.java:3112)\n        at org.eclipse.swt.widgets.Composite.XKeyPress(Composite.java:906)\n        at org.eclipse.swt.widgets.Widget.windowProc(Widget.java:908)\n        at org.eclipse.swt.widgets.Display.windowProc(Display.java:3478)\n        at org.eclipse.swt.internal.motif.OS.XtDispatchEvent(Native Method)\n        at org.eclipse.swt.widgets.Display.readAndDispatch(Display.java:2640)\n        at org.eclipse.ui.internal.Workbench.runEventLoop(Workbench.java:1362)\n        at org.eclipse.ui.internal.Workbench.runUI(Workbench.java:1333)\n        at\norg.eclipse.ui.internal.Workbench.createAndRunWorkbench(Workbench.java:252)\n        at org.eclipse.ui.PlatformUI.createAndRunWorkbench(PlatformUI.java:141)\n        at org.eclipse.ui.internal.ide.IDEApplication.run(IDEApplication.java:96)\n        at\norg.eclipse.core.internal.runtime.PlatformActivator$1.run(PlatformActivator.java:334)\n        at\norg.eclipse.core.runtime.adaptor.EclipseStarter.run(EclipseStarter.java:272)\n        at\norg.eclipse.core.runtime.adaptor.EclipseStarter.run(EclipseStarter.java:128)\n        at sun.reflect.NativeMethodAccessorImpl.invoke0(Native Method)\n        at\nsun.reflect.NativeMethodAccessorImpl.invoke(NativeMethodAccessorImpl.java:39)\n        at\nsun.reflect.DelegatingMethodAccessorImpl.invoke(DelegatingMethodAccessorImpl.java:25)\n        at java.lang.reflect.Method.invoke(Method.java:324)\n        at org.eclipse.core.launcher.Main.basicRun(Main.java:185)\n        at org.eclipse.core.launcher.Main.run(Main.java:638)",
    "reproduced bug on R3.0. \nTried on 3.0.1 RC1, bug is not reproducable. \nDejan,\nIm cc u just as fyi.. \nFormUtil seems to have been fixed in 3.0.1."
  ],
  "commentCreationDates": [
    "2004-06-14T20:24:43+02:00",
    "2004-09-01T22:08:25+02:00"
  ],
  "traces": [
    {
      "exceptionType": "org.eclipse.swt.SWTException",
      "message": "Widget is disposed",
      "elements": [
        {
          "method": "org.eclipse.swt.SWT.error",
          "source": "SWT.java:2691"
        },
        {
          "method": "org.eclipse.swt.SWT.error",
          "source": "SWT.java:2616"
        },
        {
          "method": "org.eclipse.swt.SWT.error",
          "source": "SWT.java:2587"
        },
        {
          "method": "org.eclipse.swt.widgets.Widget.error",
          "source": "Widget.java:334"
        },
        {
          "method": "org.eclipse.swt.widgets.Widget.checkWidget",
          "source": "Widget.java:271"
        },
        {
          "method": "org.eclipse.swt.widgets.Control.getParent",
          "source": "Control.java:930"
        },
        {
          "method": "org.eclipse.ui.internal.forms.widgets.FormUtil.getScrolledComposite",
          "source": "FormUtil.java:181"
        },
        {
          "method": "org.eclipse.ui.internal.forms.widgets.FormUtil.processKey",
          "source": "FormUtil.java:293"
        },
        {
          "method": "org.eclipse.ui.forms.widgets.FormToolkit$KeyboardHandler.keyPressed",
          "source": "FormToolkit.java:133"
        },
        {
          "method": "org.eclipse.swt.widgets.TypedListener.handleEvent",
          "source": "TypedListener.java:121"
        },
        {
          "method": "org.eclipse.swt.widgets.EventTable.sendEvent",
          "source": "EventTable.java:82"
        },
        {
          "method": "org.eclipse.swt.widgets.Widget.sendEvent",
          "source": "Widget.java:731"
        },
        {
          "method": "org.eclipse.swt.widgets.Widget.sendEvent",
          "source": "Widget.java:752"
        },
        {
          "method": "org.eclipse.swt.widgets.Widget.sendEvent",
          "source": "Widget.java:738"
        },
        {
          "method": "org.eclipse.swt.widgets.Control.sendKeyEvent",
          "source": "Control.java:1793"
        },
        {
          "method": "org.eclipse.swt.widgets.Control.XKeyPress",
          "source": "Control.java:3112"
        },
        {
          "method": "org.eclipse.swt.widgets.Composite.XKeyPress",
          "source": "Composite.java:906"
        },
        {
          "method": "org.eclipse.swt.widgets.Widget.windowProc",
          "source": "Widget.java:908"
        },
        {
          "method": "org.eclipse.swt.widgets.Display.windowProc",
          "source": "Display.java:3478"
        },
        {
          "method": "org.eclipse.swt.internal.motif.OS.XtDispatchEvent",
          "source": "Native Method"
        },
        {
          "method": "org.eclipse.swt.widgets.Display.readAndDispatch",
          "source": "Display.java:2640"
        },
        {
          "method": "org.eclipse.ui.internal.Workbench.runEventLoop",
          "source": "Workbench.java:1362"
        },
        {
          "method": "org.eclipse.ui.internal.Workbench.runUI",
          "source": "Workbench.java:1333"
        },
        {
          "method": "org.eclipse.ui.internal.Workbench.createAndRunWorkbench",
          "source": "Workbench.java:252"
        },
        {
          "method": "org.eclipse.ui.PlatformUI.createAndRunWorkbench",
          "source": "PlatformUI.java:141"
        },
        {
          "method": "org.eclipse.ui.internal.ide.IDEApplication.run",
          "source": "IDEApplication.java:96"
        },
        {
          "method": "org.eclipse.core.internal.runtime.PlatformActivator$1.run",
          "source": "PlatformActivator.java:334"
        },
        {
          "method": "org.eclipse.core.runtime.adaptor.EclipseStarter.run",
          "source": "EclipseStarter.java:272"
        },
        {
          "method": "org.eclipse.core.runtime.adaptor.EclipseStarter.run",
          "source": "EclipseStarter.java:128"
        },
        {
          "method": "sun.reflect.NativeMethodAccessorImpl.invoke0",
          "source": "Native Method"
        },
        {
          "method": "sun.reflect.NativeMethodAccessorImpl.invoke",
          "source": "NativeMethodAccessorImpl.java:39"
        },
        {
          "method": "sun.reflect.DelegatingMethodAccessorImpl.invoke",
          "source": "DelegatingMethodAccessorImpl.java:25"
        },
        {
          "method": "java.lang.reflect.Method.invoke",
          "source": "Method.java:324"
        },
        {
          "method": "org.eclipse.core.launcher.Main.basicRun",
          "source": "Main.java:185"
        },
        {
          "method": "org.eclipse.core.launcher.Main.run",
          "source": "Main.java:638"
        }
      ],
      "number": 0,
      "commentIndex": 0,
      "bugId": "67070",
      "date": "2004-06-14T20:24:43+02:00",
      "product": "Platform",
      "component": "User Assistance",
      "severity": "normal"
    }
  ],
  "groupId": "67070",
  "bugId": "67070",
  "date": "2004-06-14T20:24:43+02:00",
  "product": "Platform",
  "component": "User Assistance",
  "severity": "normal"
}