{
  "comments": [
    "I had a debug target that would not properly terminate.\nSo I terminated and removed.\nI believe it was a J9 target.\n\nNow I am getting the following:\n\nInternal error logged from JDI debug model:\ncom.sun.jdi.VMDisconnectedException: Got IOException from Virtual Machine\n        at org.eclipse.jdi.internal.connect.PacketReceiveManager.getReply(Packet\nReceiveManager.java:116)\n        at org.eclipse.jdi.internal.connect.PacketReceiveManager.getReply(Packet\nReceiveManager.java:130)\n        at org.eclipse.jdi.internal.MirrorImpl.requestVM(MirrorImpl.java:155)\n        at org.eclipse.jdi.internal.MirrorImpl.requestVM(MirrorImpl.java:173)\n        at org.eclipse.jdi.internal.VirtualMachineImpl.classesBySignature(Virtua\nlMachineImpl.java:474)\n        at org.eclipse.jdi.internal.VirtualMachineImpl.classesByName(VirtualMach\nineImpl.java:501)\n        at org.eclipse.jdt.internal.debug.core.JDIDebugTarget.jdiClassesByName(J\nDIDebugTarget.java:1228)\n        at org.eclipse.jdt.internal.debug.core.JDIDebugTarget.typesFailedReload(\nJDIDebugTarget.java:711)\n        at org.eclipse.jdt.internal.debug.core.JavaHotCodeReplaceManager.notifyF\nailedHCR(JavaHotCodeReplaceManager.java:164)\n        at org.eclipse.jdt.internal.debug.core.JavaHotCodeReplaceManager.notifyF\nailedHCR(JavaHotCodeReplaceManager.java:158)\n        at org.eclipse.jdt.internal.debug.core.JavaHotCodeReplaceManager$2.run(J\navaHotCodeReplaceManager.java:144)\n        at org.eclipse.core.internal.resources.Workspace.run(Workspace.java:1231\n)\n        at org.eclipse.jdt.internal.debug.core.JavaHotCodeReplaceManager$3.run(J\navaHotCodeReplaceManager.java:395)\n        at java.lang.Thread.run(Thread.java:484)",
    "Fixed.",
    "Please verify.",
    "Verified."
  ],
  "commentCreationDates": [
    "2001-12-10T16:52:15+01:00",
    "2001-12-11T16:25:39+01:00",
    "2001-12-11T16:26:21+01:00",
    "2001-12-11T16:26:49+01:00"
  ],
  "traces": [
    {
      "exceptionType": "com.sun.jdi.VMDisconnectedException",
      "message": "Got IOException from Virtual Machine",
      "elements": [
        {
          "method": "org.eclipse.jdi.internal.connect.PacketReceiveManager.getReply",
          "source": "Packet ReceiveManager.java:116"
        },
        {
          "method": "org.eclipse.jdi.internal.connect.PacketReceiveManager.getReply",
          "source": "Packet ReceiveManager.java:130"
        },
        {
          "method": "org.eclipse.jdi.internal.MirrorImpl.requestVM",
          "source": "MirrorImpl.java:155"
        },
        {
          "method": "org.eclipse.jdi.internal.MirrorImpl.requestVM",
          "source": "MirrorImpl.java:173"
        },
        {
          "method": "org.eclipse.jdi.internal.VirtualMachineImpl.classesBySignature",
          "source": "Virtua lMachineImpl.java:474"
        },
        {
          "method": "org.eclipse.jdi.internal.VirtualMachineImpl.classesByName",
          "source": "VirtualMach ineImpl.java:501"
        },
        {
          "method": "org.eclipse.jdt.internal.debug.core.JDIDebugTarget.jdiClassesByName",
          "source": "J DIDebugTarget.java:1228"
        },
        {
          "method": "org.eclipse.jdt.internal.debug.core.JDIDebugTarget.typesFailedReload",
          "source": " JDIDebugTarget.java:711"
        },
        {
          "method": "org.eclipse.jdt.internal.debug.core.JavaHotCodeReplaceManager.notifyFailedHCR",
          "source": "JavaHotCodeReplaceManager.java:164"
        },
        {
          "method": "org.eclipse.jdt.internal.debug.core.JavaHotCodeReplaceManager.notifyFailedHCR",
          "source": "JavaHotCodeReplaceManager.java:158"
        },
        {
          "method": "org.eclipse.jdt.internal.debug.core.JavaHotCodeReplaceManager$2.run",
          "source": "J avaHotCodeReplaceManager.java:144"
        },
        {
          "method": "org.eclipse.core.internal.resources.Workspace.run",
          "source": "Workspace.java:1231 "
        },
        {
          "method": "org.eclipse.jdt.internal.debug.core.JavaHotCodeReplaceManager$3.run",
          "source": "J avaHotCodeReplaceManager.java:395"
        },
        {
          "method": "java.lang.Thread.run",
          "source": "Thread.java:484"
        }
      ],
      "number": 0,
      "commentIndex": 0,
      "bugId": "6737",
      "date": "2001-12-10T16:52:15+01:00",
      "product": "JDT",
      "component": "Debug",
      "severity": "critical"
    }
  ],
  "groupId": "6737",
  "bugId": "6737",
  "date": "2001-12-10T16:52:15+01:00",
  "product": "JDT",
  "component": "Debug",
  "severity": "critical"
}