{
  "comments": [
    "I have had to Force Quit Eclipse due to it hanging.  When I try to relaunch, I get a \nNoClassDefFoundError.\nThis time it is looking for org.eclipse.core.resources.IProject.  It appears that something gets hosed \nwhen\nforce quitting - although I have been able to quit Eclipse on Windows, and can restart without\nlosing anything (other than perhaps the last thing i was editing).  I have to totally reconstruct\na new .metadata, and recheck out all my projects, etc., copy over any changed files, and this\ntakes alot of time and is prone to errors.  I had thought that perhaps Eclipse 3.0RC1 was too\nflaky, so I had to switch back to 2.1.3, and the same thing occurred!  (See bug 68095).\nSo, I\u0027m stuck with having to reconstruct my workspace every time Eclipse hangs.\n\nI\u0027m running Mac OS X (10.3.4)\ndual-proc G5\n1GB memory\n-------------------.log entry\n\neclipse.buildId\u003dI200405290105\njava.version\u003d1.4.2_03\njava.vendor\u003dApple Computer, Inc.\nBootLoader constants: OS\u003dmacosx, ARCH\u003dppc, WS\u003dcarbon, NL\u003den_US\nCommand-line arguments: -keyring /Users/simunich/.eclipse_keyring -showlocation\n!ENTRY org.eclipse.osgi Jun 18, 2004 10:59:21.494\n!MESSAGE Application error\n!STACK 1\njava.lang.NoClassDefFoundError: org/eclipse/core/resources/IProject\n        at \norg.eclipse.ui.internal.ide.model.WorkbenchAdapterFactory.\u003cinit\u003e(WorkbenchAdapterFactory.java:26)\n        at \norg.eclipse.ui.internal.ide.model.WorkbenchAdapterBuilder.registerAdapters(WorkbenchAdapterBuilder.j\nava:33)\n        at org.eclipse.ui.internal.ide.IDEWorkbenchAdvisor.initialize(IDEWorkbenchAdvisor.java:155)\n        at org.eclipse.ui.application.WorkbenchAdvisor.internalBasicInitialize(WorkbenchAdvisor.java:165)\n        at org.eclipse.ui.internal.Workbench.init(Workbench.java:787)\n        at org.eclipse.ui.internal.Workbench.runUI(Workbench.java:1311)\n        at org.eclipse.ui.internal.Workbench.createAndRunWorkbench(Workbench.java:253)\n        at org.eclipse.ui.PlatformUI.createAndRunWorkbench(PlatformUI.java:141)\n        at org.eclipse.ui.internal.ide.IDEApplication.run(IDEApplication.java:96)\n        at org.eclipse.core.internal.runtime.PlatformActivator$1.run(PlatformActivator.java:334)\n        at org.eclipse.core.runtime.adaptor.EclipseStarter.run(EclipseStarter.java:273)\n        at org.eclipse.core.runtime.adaptor.EclipseStarter.run(EclipseStarter.java:128)\n        at sun.reflect.NativeMethodAccessorImpl.invoke0(Native Method)\n        at sun.reflect.NativeMethodAccessorImpl.invoke(NativeMethodAccessorImpl.java:39)\n        at sun.reflect.DelegatingMethodAccessorImpl.invoke(DelegatingMethodAccessorImpl.java:25)\n        at java.lang.reflect.Method.invoke(Method.java:324)\n        at org.eclipse.core.launcher.Main.basicRun(Main.java:185)\n        at org.eclipse.core.launcher.Main.run(Main.java:638)\n        at org.eclipse.core.launcher.Main.main(Main.java:622)",
    "\n\n*** This bug has been marked as a duplicate of 68095 ***"
  ],
  "commentCreationDates": [
    "2004-06-21T22:29:12+02:00",
    "2004-06-21T22:53:13+02:00"
  ],
  "traces": [
    {
      "exceptionType": "java.lang.NoClassDefFoundError",
      "message": "org/eclipse/core/resources/IProject",
      "elements": [
        {
          "method": "org.eclipse.ui.internal.ide.model.WorkbenchAdapterFactory.\u003cinit\u003e",
          "source": "WorkbenchAdapterFactory.java:26"
        },
        {
          "method": "org.eclipse.ui.internal.ide.model.WorkbenchAdapterBuilder.registerAdapters",
          "source": "WorkbenchAdapterBuilder.j ava:33"
        },
        {
          "method": "org.eclipse.ui.internal.ide.IDEWorkbenchAdvisor.initialize",
          "source": "IDEWorkbenchAdvisor.java:155"
        },
        {
          "method": "org.eclipse.ui.application.WorkbenchAdvisor.internalBasicInitialize",
          "source": "WorkbenchAdvisor.java:165"
        },
        {
          "method": "org.eclipse.ui.internal.Workbench.init",
          "source": "Workbench.java:787"
        },
        {
          "method": "org.eclipse.ui.internal.Workbench.runUI",
          "source": "Workbench.java:1311"
        },
        {
          "method": "org.eclipse.ui.internal.Workbench.createAndRunWorkbench",
          "source": "Workbench.java:253"
        },
        {
          "method": "org.eclipse.ui.PlatformUI.createAndRunWorkbench",
          "source": "PlatformUI.java:141"
        },
        {
          "method": "org.eclipse.ui.internal.ide.IDEApplication.run",
          "source": "IDEApplication.java:96"
        },
        {
          "method": "org.eclipse.core.internal.runtime.PlatformActivator$1.run",
          "source": "PlatformActivator.java:334"
        },
        {
          "method": "org.eclipse.core.runtime.adaptor.EclipseStarter.run",
          "source": "EclipseStarter.java:273"
        },
        {
          "method": "org.eclipse.core.runtime.adaptor.EclipseStarter.run",
          "source": "EclipseStarter.java:128"
        },
        {
          "method": "sun.reflect.NativeMethodAccessorImpl.invoke0",
          "source": "Native Method"
        },
        {
          "method": "sun.reflect.NativeMethodAccessorImpl.invoke",
          "source": "NativeMethodAccessorImpl.java:39"
        },
        {
          "method": "sun.reflect.DelegatingMethodAccessorImpl.invoke",
          "source": "DelegatingMethodAccessorImpl.java:25"
        },
        {
          "method": "java.lang.reflect.Method.invoke",
          "source": "Method.java:324"
        },
        {
          "method": "org.eclipse.core.launcher.Main.basicRun",
          "source": "Main.java:185"
        },
        {
          "method": "org.eclipse.core.launcher.Main.run",
          "source": "Main.java:638"
        },
        {
          "method": "org.eclipse.core.launcher.Main.main",
          "source": "Main.java:622"
        }
      ],
      "number": 0,
      "commentIndex": 0,
      "bugId": "68100",
      "duplicateId": "68095",
      "date": "2004-06-21T22:29:12+02:00",
      "product": "Platform",
      "component": "Resources",
      "severity": "major"
    }
  ],
  "groupId": "68095",
  "bugId": "68100",
  "duplicateId": "68095",
  "date": "2004-06-21T22:29:12+02:00",
  "product": "Platform",
  "component": "Resources",
  "severity": "major"
}