{
  "comments": [
    "Security exception when calling ClassLoader.getSystemClassLoader() with Java 2 \nsecurity enabled.\n\nFor example, when line 128 of \norg.eclipse.hyades.logging.events.cbe.impl.EventXMLFileEventFactoryHomeImpl \ngenerates a security exception when calling ClassLoader.getSystemClassLoader() \nwith Java 2 security enabled:\n\njava.security.AccessControlException: access denied \n(java.lang.RuntimePermission getClassLoader)\n       at java.security.AccessControlContext.checkPermission\n(AccessControlContext.java(Compiled Code))\n       at java.security.AccessController.checkPermission(AccessController.java\n(Compiled Code))\n       at java.lang.SecurityManager.checkPermission(SecurityManager.java\n(Compiled Code))\n       at com.ibm.ws.security.core.SecurityManager.checkPermission\n(SecurityManager.java(Compiled Code))\n       at java.lang.ClassLoader.getSystemClassLoader(ClassLoader.java(Compiled \nCode))\n       at \norg.eclipse.hyades.logging.events.cbe.impl.EventXMLFileEventFactoryHomeImpl.crea\nteContentHandler(EventXMLFileEventFactoryHomeImpl.java:128)\n       at \norg.eclipse.hyades.logging.events.cbe.impl.AbstractEventFactoryHome.getEventFact\nory(AbstractEventFactoryHome.java:111)\n       at com.ibm.ws.logging.cbe.EventFactoryHelper.getEventFactory\n(EventFactoryHelper.java:118)\n       at com.ibm.ws.logging.WsLoggerConfigurator.configureLogger\n(WsLoggerConfigurator.java:248)\n       at com.ibm.ws.logging.WsLoggerFactoryImpl.createWsLogger\n(WsLoggerFactoryImpl.java:76)\n       at com.ibm.ws.bootstrap.RASDelegator.createWsLogger(RASDelegator.java:76)\n       at com.ibm.ws.bootstrap.WsLogManager.getLogger(WsLogManager.java:72)\n       at java.util.logging.Logger.getLogger(Logger.java:242)\n\nNOTE: Ensure all calls to ClassLoader.getSystemClassLoader() in all Haydes \nplugins are contained in a doPriv block.",
    "Code checked-in to HEAD on July 15, 2004.",
    "Verified in Toronto\u0027s 20040715_1621 (HEAD) build on July 19, 2004.",
    "Closing."
  ],
  "commentCreationDates": [
    "2004-06-21T23:29:40+02:00",
    "2004-07-15T17:04:30+02:00",
    "2004-07-19T14:36:34+02:00",
    "2004-07-19T14:36:42+02:00"
  ],
  "traces": [
    {
      "exceptionType": "java.security.AccessControlException",
      "message": "access denied  (java.lang.RuntimePermission getClassLoader)",
      "elements": [
        {
          "method": "java.security.AccessControlContext.checkPermission",
          "source": "AccessControlContext.java(Compiled Code)"
        },
        {
          "method": "java.security.AccessController.checkPermission",
          "source": "AccessController.java (Compiled Code)"
        },
        {
          "method": "java.lang.SecurityManager.checkPermission",
          "source": "SecurityManager.java (Compiled Code)"
        },
        {
          "method": "com.ibm.ws.security.core.SecurityManager.checkPermission",
          "source": "SecurityManager.java(Compiled Code)"
        },
        {
          "method": "java.lang.ClassLoader.getSystemClassLoader",
          "source": "ClassLoader.java(Compiled  Code)"
        },
        {
          "method": "org.eclipse.hyades.logging.events.cbe.impl.EventXMLFileEventFactoryHomeImpl.createContentHandler",
          "source": "EventXMLFileEventFactoryHomeImpl.java:128"
        },
        {
          "method": "org.eclipse.hyades.logging.events.cbe.impl.AbstractEventFactoryHome.getEventFactory",
          "source": "AbstractEventFactoryHome.java:111"
        },
        {
          "method": "com.ibm.ws.logging.cbe.EventFactoryHelper.getEventFactory",
          "source": "EventFactoryHelper.java:118"
        },
        {
          "method": "com.ibm.ws.logging.WsLoggerConfigurator.configureLogger",
          "source": "WsLoggerConfigurator.java:248"
        },
        {
          "method": "com.ibm.ws.logging.WsLoggerFactoryImpl.createWsLogger",
          "source": "WsLoggerFactoryImpl.java:76"
        },
        {
          "method": "com.ibm.ws.bootstrap.RASDelegator.createWsLogger",
          "source": "RASDelegator.java:76"
        },
        {
          "method": "com.ibm.ws.bootstrap.WsLogManager.getLogger",
          "source": "WsLogManager.java:72"
        },
        {
          "method": "java.util.logging.Logger.getLogger",
          "source": "Logger.java:242"
        }
      ],
      "number": 0,
      "commentIndex": 0,
      "bugId": "68120",
      "date": "2004-06-21T23:29:40+02:00",
      "product": "Hyades",
      "component": "Exec.logging",
      "severity": "normal"
    }
  ],
  "groupId": "68120",
  "bugId": "68120",
  "date": "2004-06-21T23:29:40+02:00",
  "product": "Hyades",
  "component": "Exec.logging",
  "severity": "normal"
}