{
  "comments": [
    "In RC3 (not noticed this before, but cannot guarantee it wasn\u0027t there), I have \na situation where some of my Java files do not appear in the Open Type dialog.\n\nI have a new workspace (newly created with RC3) consisting of 6 projects. All \nprojects were retrieved from CVS, and I have done nothing but file edits - no \nnew files, or file deletions etc...\n\nWhen I do an open type, I have noticed that at least one class (and its \nnested, inner classes) does not appear in the list.\n\nThe file in question does exist in Package Explorer, and will quite happily \nopen if I double-click it in that view.\n\nThis is a disturbing situation as there is nothing about this class that would \nsuggest a problem.\n\nHere is the contents of my .log file, although I cannot infer any connection \nbetween this problem and the logged exceptions...\n\n!ENTRY org.eclipse.ui 4 4 Jun 22, 2004 11:09:28.947\n!MESSAGE Unhandled event loop exception\n\n!ENTRY org.eclipse.ui 4 0 Jun 22, 2004 11:09:28.947\n!MESSAGE Failed to execute runnable (java.lang.IllegalArgumentException: Index \nout of bounds)\n!STACK 0\norg.eclipse.swt.SWTException: Failed to execute runnable \n(java.lang.IllegalArgumentException: Index out of bounds)\n        at org.eclipse.swt.SWT.error(SWT.java:2691)\n        at org.eclipse.swt.SWT.error(SWT.java:2616)\n        at org.eclipse.swt.widgets.Synchronizer.runAsyncMessages\n(Synchronizer.java:109)\n        at org.eclipse.swt.widgets.Display.runAsyncMessages(Display.java:2709)\n        at org.eclipse.swt.widgets.Display.readAndDispatch(Display.java:2401)\n        at org.eclipse.ui.internal.Workbench.runEventLoop(Workbench.java:1375)\n        at org.eclipse.ui.internal.Workbench.runUI(Workbench.java:1346)\n        at org.eclipse.ui.internal.Workbench.createAndRunWorkbench\n(Workbench.java:252)\n        at org.eclipse.ui.PlatformUI.createAndRunWorkbench(PlatformUI.java:141)\n        at org.eclipse.ui.internal.ide.IDEApplication.run\n(IDEApplication.java:96)\n        at org.eclipse.core.internal.runtime.PlatformActivator$1.run\n(PlatformActivator.java:335)\n        at org.eclipse.core.runtime.adaptor.EclipseStarter.run\n(EclipseStarter.java:272)\n        at org.eclipse.core.runtime.adaptor.EclipseStarter.run\n(EclipseStarter.java:128)\n        at sun.reflect.NativeMethodAccessorImpl.invoke0(Native Method)\n        at sun.reflect.NativeMethodAccessorImpl.invoke\n(NativeMethodAccessorImpl.java:39)\n        at sun.reflect.DelegatingMethodAccessorImpl.invoke\n(DelegatingMethodAccessorImpl.java:25)\n        at java.lang.reflect.Method.invoke(Method.java:324)\n        at org.eclipse.core.launcher.Main.basicRun(Main.java:186)\n        at org.eclipse.core.launcher.Main.run(Main.java:647)\n        at org.eclipse.core.launcher.Main.main(Main.java:631)\n\n!ENTRY org.eclipse.ui 4 4 Jun 22, 2004 11:09:28.947\n!MESSAGE *** SWT nested exception\n\n!ENTRY org.eclipse.ui 4 0 Jun 22, 2004 11:09:28.947\n!MESSAGE Index out of bounds\n!STACK 0\njava.lang.IllegalArgumentException: Index out of bounds\n        at org.eclipse.swt.SWT.error(SWT.java:2677)\n        at org.eclipse.swt.SWT.error(SWT.java:2616)\n        at org.eclipse.swt.SWT.error(SWT.java:2587)\n        at org.eclipse.swt.custom.StyledText.replaceStyleRanges\n(StyledText.java:6231)\n        at org.eclipse.jface.text.TextViewer.addPresentation\n(TextViewer.java:4042)\n        at org.eclipse.jface.text.TextViewer.changeTextPresentation\n(TextViewer.java:4121)\n        at \norg.eclipse.jdt.internal.ui.javaeditor.SemanticHighlightingPresenter.updatePres\nentation(SemanticHighlightingPresenter.java:434)\n        at \norg.eclipse.jdt.internal.ui.javaeditor.SemanticHighlightingPresenter$1.run\n(SemanticHighlightingPresenter.java:347)\n        at org.eclipse.swt.widgets.RunnableLock.run(RunnableLock.java:35)\n        at org.eclipse.swt.widgets.Synchronizer.runAsyncMessages\n(Synchronizer.java:106)\n        at org.eclipse.swt.widgets.Display.runAsyncMessages(Display.java:2709)\n        at org.eclipse.swt.widgets.Display.readAndDispatch(Display.java:2401)\n        at org.eclipse.ui.internal.Workbench.runEventLoop(Workbench.java:1375)\n        at org.eclipse.ui.internal.Workbench.runUI(Workbench.java:1346)\n        at org.eclipse.ui.internal.Workbench.createAndRunWorkbench\n(Workbench.java:252)\n        at org.eclipse.ui.PlatformUI.createAndRunWorkbench(PlatformUI.java:141)\n        at org.eclipse.ui.internal.ide.IDEApplication.run\n(IDEApplication.java:96)\n        at org.eclipse.core.internal.runtime.PlatformActivator$1.run\n(PlatformActivator.java:335)\n        at org.eclipse.core.runtime.adaptor.EclipseStarter.run\n(EclipseStarter.java:272)\n        at org.eclipse.core.runtime.adaptor.EclipseStarter.run\n(EclipseStarter.java:128)\n        at sun.reflect.NativeMethodAccessorImpl.invoke0(Native Method)\n        at sun.reflect.NativeMethodAccessorImpl.invoke\n(NativeMethodAccessorImpl.java:39)\n        at sun.reflect.DelegatingMethodAccessorImpl.invoke\n(DelegatingMethodAccessorImpl.java:25)\n        at java.lang.reflect.Method.invoke(Method.java:324)\n        at org.eclipse.core.launcher.Main.basicRun(Main.java:186)\n        at org.eclipse.core.launcher.Main.run(Main.java:647)\n        at org.eclipse.core.launcher.Main.main(Main.java:631)",
    "Move to JDT/UI",
    "Ian, do you have any steps to reproduce it. Is the source you checked out \npublic available and can you tell me which class is missing.\n\nWhat happens if you close the workspace and reopen it. Will the Opent Type \ndialog contain all files or is the same file still missing?\n\nThe exceptions above are very likely not related to this problem.",
    "Ian, \n\ncould it be that the CU from which the types are missing had syntax errors. \nThere are cases where this can lead to missing types.",
    "Sadly, I have no steps to reproduce it.\n\nThe file was one that I had been editing so /may/ have had errors in it (sadly \nunable to recall as I was also suffering from stale decorators at the time - \nissue 62113). I don\u0027t think that it was the case at the time, although it \nprobably was earlier during my Eclipse session - and as I use Open Type a lot, \nthere may have been a time when it was broken when I did Open Type.\n\nEventually, I resorted to opening the class from Package Explorer and, \nsometime later on, after a restart, the class re-appeared in the list.\n\nWould like to write this off as a one-off, but sadly as my workspace has 600+ \njava files in it (across 6 projects), for all I know there is more than one \nabsentee file - and I just happened to have only noticed one of them (!)\n\nSadly can\u0027t share the code, but will report back if it happens again.\n\nAs I couldn\u0027t see the file\u0027s inner classes in Open Type either, I\u0027m presuming \nthat the whole CU had opted out for some reason. It is the most complex file \nin the project, but not excessively so (1800 lines)\n\nMore info if I can get it...",
    "Ian, thanks for the update. I will mark the bug as resolved later. Please \nreopen if you have more information."
  ],
  "commentCreationDates": [
    "2004-06-22T23:04:46+02:00",
    "2004-06-23T10:36:22+02:00",
    "2004-06-23T12:21:10+02:00",
    "2004-06-23T14:09:32+02:00",
    "2004-06-23T20:37:45+02:00",
    "2004-06-23T23:52:48+02:00"
  ],
  "traces": [
    {
      "exceptionType": "java.lang.IllegalArgumentException",
      "message": "Index out of bounds)",
      "elements": [
        {
          "method": "org.eclipse.swt.SWT.error",
          "source": "SWT.java:2691"
        },
        {
          "method": "org.eclipse.swt.SWT.error",
          "source": "SWT.java:2616"
        },
        {
          "method": "org.eclipse.swt.widgets.Synchronizer.runAsyncMessages",
          "source": "Synchronizer.java:109"
        },
        {
          "method": "org.eclipse.swt.widgets.Display.runAsyncMessages",
          "source": "Display.java:2709"
        },
        {
          "method": "org.eclipse.swt.widgets.Display.readAndDispatch",
          "source": "Display.java:2401"
        },
        {
          "method": "org.eclipse.ui.internal.Workbench.runEventLoop",
          "source": "Workbench.java:1375"
        },
        {
          "method": "org.eclipse.ui.internal.Workbench.runUI",
          "source": "Workbench.java:1346"
        },
        {
          "method": "org.eclipse.ui.internal.Workbench.createAndRunWorkbench",
          "source": "Workbench.java:252"
        },
        {
          "method": "org.eclipse.ui.PlatformUI.createAndRunWorkbench",
          "source": "PlatformUI.java:141"
        },
        {
          "method": "org.eclipse.ui.internal.ide.IDEApplication.run",
          "source": "IDEApplication.java:96"
        },
        {
          "method": "org.eclipse.core.internal.runtime.PlatformActivator$1.run",
          "source": "PlatformActivator.java:335"
        },
        {
          "method": "org.eclipse.core.runtime.adaptor.EclipseStarter.run",
          "source": "EclipseStarter.java:272"
        },
        {
          "method": "org.eclipse.core.runtime.adaptor.EclipseStarter.run",
          "source": "EclipseStarter.java:128"
        },
        {
          "method": "sun.reflect.NativeMethodAccessorImpl.invoke0",
          "source": "Native Method"
        },
        {
          "method": "sun.reflect.NativeMethodAccessorImpl.invoke",
          "source": "NativeMethodAccessorImpl.java:39"
        },
        {
          "method": "sun.reflect.DelegatingMethodAccessorImpl.invoke",
          "source": "DelegatingMethodAccessorImpl.java:25"
        },
        {
          "method": "java.lang.reflect.Method.invoke",
          "source": "Method.java:324"
        },
        {
          "method": "org.eclipse.core.launcher.Main.basicRun",
          "source": "Main.java:186"
        },
        {
          "method": "org.eclipse.core.launcher.Main.run",
          "source": "Main.java:647"
        },
        {
          "method": "org.eclipse.core.launcher.Main.main",
          "source": "Main.java:631"
        }
      ],
      "number": 0,
      "commentIndex": 0,
      "bugId": "68237",
      "date": "2004-06-22T23:04:46+02:00",
      "product": "JDT",
      "component": "UI",
      "severity": "normal"
    },
    {
      "exceptionType": "java.lang.IllegalArgumentException",
      "message": "Index out of bounds",
      "elements": [
        {
          "method": "org.eclipse.swt.SWT.error",
          "source": "SWT.java:2677"
        },
        {
          "method": "org.eclipse.swt.SWT.error",
          "source": "SWT.java:2616"
        },
        {
          "method": "org.eclipse.swt.SWT.error",
          "source": "SWT.java:2587"
        },
        {
          "method": "org.eclipse.swt.custom.StyledText.replaceStyleRanges",
          "source": "StyledText.java:6231"
        },
        {
          "method": "org.eclipse.jface.text.TextViewer.addPresentation",
          "source": "TextViewer.java:4042"
        },
        {
          "method": "org.eclipse.jface.text.TextViewer.changeTextPresentation",
          "source": "TextViewer.java:4121"
        },
        {
          "method": "org.eclipse.jdt.internal.ui.javaeditor.SemanticHighlightingPresenter.updatePresentation",
          "source": "SemanticHighlightingPresenter.java:434"
        },
        {
          "method": "org.eclipse.jdt.internal.ui.javaeditor.SemanticHighlightingPresenter$1.run",
          "source": "SemanticHighlightingPresenter.java:347"
        },
        {
          "method": "org.eclipse.swt.widgets.RunnableLock.run",
          "source": "RunnableLock.java:35"
        },
        {
          "method": "org.eclipse.swt.widgets.Synchronizer.runAsyncMessages",
          "source": "Synchronizer.java:106"
        },
        {
          "method": "org.eclipse.swt.widgets.Display.runAsyncMessages",
          "source": "Display.java:2709"
        },
        {
          "method": "org.eclipse.swt.widgets.Display.readAndDispatch",
          "source": "Display.java:2401"
        },
        {
          "method": "org.eclipse.ui.internal.Workbench.runEventLoop",
          "source": "Workbench.java:1375"
        },
        {
          "method": "org.eclipse.ui.internal.Workbench.runUI",
          "source": "Workbench.java:1346"
        },
        {
          "method": "org.eclipse.ui.internal.Workbench.createAndRunWorkbench",
          "source": "Workbench.java:252"
        },
        {
          "method": "org.eclipse.ui.PlatformUI.createAndRunWorkbench",
          "source": "PlatformUI.java:141"
        },
        {
          "method": "org.eclipse.ui.internal.ide.IDEApplication.run",
          "source": "IDEApplication.java:96"
        },
        {
          "method": "org.eclipse.core.internal.runtime.PlatformActivator$1.run",
          "source": "PlatformActivator.java:335"
        },
        {
          "method": "org.eclipse.core.runtime.adaptor.EclipseStarter.run",
          "source": "EclipseStarter.java:272"
        },
        {
          "method": "org.eclipse.core.runtime.adaptor.EclipseStarter.run",
          "source": "EclipseStarter.java:128"
        },
        {
          "method": "sun.reflect.NativeMethodAccessorImpl.invoke0",
          "source": "Native Method"
        },
        {
          "method": "sun.reflect.NativeMethodAccessorImpl.invoke",
          "source": "NativeMethodAccessorImpl.java:39"
        },
        {
          "method": "sun.reflect.DelegatingMethodAccessorImpl.invoke",
          "source": "DelegatingMethodAccessorImpl.java:25"
        },
        {
          "method": "java.lang.reflect.Method.invoke",
          "source": "Method.java:324"
        },
        {
          "method": "org.eclipse.core.launcher.Main.basicRun",
          "source": "Main.java:186"
        },
        {
          "method": "org.eclipse.core.launcher.Main.run",
          "source": "Main.java:647"
        },
        {
          "method": "org.eclipse.core.launcher.Main.main",
          "source": "Main.java:631"
        }
      ],
      "number": 1,
      "commentIndex": 0,
      "bugId": "68237",
      "date": "2004-06-22T23:04:46+02:00",
      "product": "JDT",
      "component": "UI",
      "severity": "normal"
    }
  ],
  "groupId": "68237",
  "bugId": "68237",
  "date": "2004-06-22T23:04:46+02:00",
  "product": "JDT",
  "component": "UI",
  "severity": "normal"
}