{
  "comments": [
    "Greetings:\n\nThis happened during startup. \n\nhomeoffice:/usr/local/eclipse/configuration$ more 1091968243875.log\n!SESSION Aug 08, 2004 07:30:44.799 \n---------------------------------------------eclipse.buildId\u003dI200406251208\njava.version\u003d1.5.0-beta\njava.vendor\u003dSun Microsystems Inc.\nBootLoader constants: OS\u003dlinux, ARCH\u003dx86, WS\u003dgtk, NL\u003den_US\n\n!ENTRY org.eclipse.osgi Aug 08, 2004 07:30:44.801\n!MESSAGE Startup error\n!STACK 1\njava.lang.VerifyError: (class: \norg/eclipse/core/runtime/adaptor/EclipseBundleData, method: \ncheckManifestAndParent signature: (Ljava/lang/String;Ljava/lang/String;\nLjava/lang/String;B)Lorg/eclipse/osgi/framework/util/Headers;) Expecting to find \narray on stack\n        at org.eclipse.core.runtime.adaptor.EclipseElementFactory.\ncreateBundleData(EclipseElementFactory.java:25)\n        at org.eclipse.core.runtime.adaptor.EclipseAdaptor.\ngetInstalledBundles(EclipseAdaptor.java:378)\n        at org.eclipse.osgi.framework.internal.core.Framework.\ninitialize(Framework.java:158)\n        at org.eclipse.osgi.framework.internal.core.Framework.\u003cinit\u003e(Framework.\njava:95)\n        at org.eclipse.osgi.framework.internal.core.OSGi.createFramework(OSGi.\njava:90)\n        at org.eclipse.osgi.framework.internal.core.OSGi.\u003cinit\u003e(OSGi.java:31)\n        at org.eclipse.core.runtime.adaptor.EclipseStarter.\nstartup(EclipseStarter.java:215)\n        at org.eclipse.core.runtime.adaptor.EclipseStarter.run(EclipseStarter.\njava:127)\n        at sun.reflect.NativeMethodAccessorImpl.invoke0(Native Method)\n        at sun.reflect.NativeMethodAccessorImpl.invoke(NativeMethodAccessorImpl.\njava:39)\n        at sun.reflect.DelegatingMethodAccessorImpl.\ninvoke(DelegatingMethodAccessorImpl.java:25)\n        at java.lang.reflect.Method.invoke(Method.java:494)\n        at org.eclipse.core.launcher.Main.basicRun(Main.java:183)\n        at org.eclipse.core.launcher.Main.run(Main.java:644)\n        at org.eclipse.core.launcher.Main.main(Main.java:628)\n!SESSION Sun Aug 08 07:30:44 CDT 2004 \n------------------------------------------!ENTRY org.eclipse.core.launcher 4 0 \nAug 08, 2004 07:30:44.848\n!MESSAGE Exception launching the Eclipse Platform:\n!STACK\njava.lang.NullPointerException\n        at org.eclipse.core.runtime.adaptor.EclipseStarter.run(EclipseStarter.\njava:138)\n        at sun.reflect.NativeMethodAccessorImpl.invoke0(Native Method)\n        at sun.reflect.NativeMethodAccessorImpl.invoke(NativeMethodAccessorImpl.\njava:39)\n        at sun.reflect.DelegatingMethodAccessorImpl.\ninvoke(DelegatingMethodAccessorImpl.java:25)\n        at java.lang.reflect.Method.invoke(Method.java:494)\n        at org.eclipse.core.launcher.Main.basicRun(Main.java:183)\n        at org.eclipse.core.launcher.Main.run(Main.java:644)\n        at org.eclipse.core.launcher.Main.main(Main.java:628)",
    "Does it always happen? If so, has it ever started correctly?\n\n",
    "Greetings:\n\nIt does not always happen.  In fact, after I reported the bug, I rebooted the\nmachine and it opened ok.  Do you need me to send more info?",
    "Please correct if any of the facts below are not correct:\n1) Eclipse was being used successfully, always starting fine\n2) Eclipse failed to start with the error reported\n3) After that, Eclipse would not start anymore\n4) A reboot caused Eclipse to start fine again, and the problem is not\nreproducible anymore",
    "Greetings:\n\nThe lineage of the error report you wrote is accurate.  I run this on a debain\nsystem and I run updates on the machine pretty much every day.  Since the crash\nis not reproducable it is hard to note what could be wrong Eclipse.  Also, I am\nrunning JDK 1.5 beta 1. \n\n ",
    "Agreed. Closing as not reproducible."
  ],
  "commentCreationDates": [
    "2004-08-08T19:45:00+02:00",
    "2004-08-09T18:58:37+02:00",
    "2004-08-09T19:38:38+02:00",
    "2004-08-09T20:05:09+02:00",
    "2004-08-10T19:35:31+02:00",
    "2004-08-10T22:45:41+02:00"
  ],
  "traces": [
    {
      "exceptionType": "java.lang.VerifyError",
      "message": "(class:  org/eclipse/core/runtime/adaptor/EclipseBundleData, method:  checkManifestAndParent signature: (Ljava/lang/String;Ljava/lang/String; Ljava/lang/String;B)Lorg/eclipse/osgi/framework/util/Headers;) Expecting to find  array on stack",
      "elements": [
        {
          "method": "org.eclipse.core.runtime.adaptor.EclipseElementFactory.createBundleData",
          "source": "EclipseElementFactory.java:25"
        },
        {
          "method": "org.eclipse.core.runtime.adaptor.EclipseAdaptor.getInstalledBundles",
          "source": "EclipseAdaptor.java:378"
        },
        {
          "method": "org.eclipse.osgi.framework.internal.core.Framework.initialize",
          "source": "Framework.java:158"
        },
        {
          "method": "org.eclipse.osgi.framework.internal.core.Framework.\u003cinit\u003e",
          "source": "Framework. java:95"
        },
        {
          "method": "org.eclipse.osgi.framework.internal.core.OSGi.createFramework",
          "source": "OSGi. java:90"
        },
        {
          "method": "org.eclipse.osgi.framework.internal.core.OSGi.\u003cinit\u003e",
          "source": "OSGi.java:31"
        },
        {
          "method": "org.eclipse.core.runtime.adaptor.EclipseStarter.startup",
          "source": "EclipseStarter.java:215"
        },
        {
          "method": "org.eclipse.core.runtime.adaptor.EclipseStarter.run",
          "source": "EclipseStarter. java:127"
        },
        {
          "method": "sun.reflect.NativeMethodAccessorImpl.invoke0",
          "source": "Native Method"
        },
        {
          "method": "sun.reflect.NativeMethodAccessorImpl.invoke",
          "source": "NativeMethodAccessorImpl. java:39"
        },
        {
          "method": "sun.reflect.DelegatingMethodAccessorImpl.invoke",
          "source": "DelegatingMethodAccessorImpl.java:25"
        },
        {
          "method": "java.lang.reflect.Method.invoke",
          "source": "Method.java:494"
        },
        {
          "method": "org.eclipse.core.launcher.Main.basicRun",
          "source": "Main.java:183"
        },
        {
          "method": "org.eclipse.core.launcher.Main.run",
          "source": "Main.java:644"
        },
        {
          "method": "org.eclipse.core.launcher.Main.main",
          "source": "Main.java:628"
        }
      ],
      "number": 0,
      "commentIndex": 0,
      "bugId": "71619",
      "date": "2004-08-08T19:45:00+02:00",
      "product": "Platform",
      "component": "Runtime",
      "severity": "critical"
    },
    {
      "exceptionType": "java.lang.NullPointerException",
      "elements": [
        {
          "method": "org.eclipse.core.runtime.adaptor.EclipseStarter.run",
          "source": "EclipseStarter. java:138"
        },
        {
          "method": "sun.reflect.NativeMethodAccessorImpl.invoke0",
          "source": "Native Method"
        },
        {
          "method": "sun.reflect.NativeMethodAccessorImpl.invoke",
          "source": "NativeMethodAccessorImpl. java:39"
        },
        {
          "method": "sun.reflect.DelegatingMethodAccessorImpl.invoke",
          "source": "DelegatingMethodAccessorImpl.java:25"
        },
        {
          "method": "java.lang.reflect.Method.invoke",
          "source": "Method.java:494"
        },
        {
          "method": "org.eclipse.core.launcher.Main.basicRun",
          "source": "Main.java:183"
        },
        {
          "method": "org.eclipse.core.launcher.Main.run",
          "source": "Main.java:644"
        },
        {
          "method": "org.eclipse.core.launcher.Main.main",
          "source": "Main.java:628"
        }
      ],
      "number": 1,
      "commentIndex": 0,
      "bugId": "71619",
      "date": "2004-08-08T19:45:00+02:00",
      "product": "Platform",
      "component": "Runtime",
      "severity": "critical"
    }
  ],
  "groupId": "71619",
  "bugId": "71619",
  "date": "2004-08-08T19:45:00+02:00",
  "product": "Platform",
  "component": "Runtime",
  "severity": "critical"
}