{
  "comments": [
    "The following exceptions is raised because SQL statements are not always \nclosed, this happens only on DB2 and very large resource. we hit this once on a \n370k records log file.\n\n------------ JDBCHelper.executeQuery sqlString\u003dSELECT Id FROM Id_Table\ncom.ibm.db2.jcc.b.SQLException: NULLID.SYSSH203 0X5359534C564C3031\n        at com.ibm.db2.jcc.b.ce.e(ce.java(Compiled Code))\n        at com.ibm.db2.jcc.a.bd.o(bd.java:564)\n        at com.ibm.db2.jcc.a.bd.g(bd.java(Compiled Code))\n        at com.ibm.db2.jcc.a.bd.a(bd.java:40)\n        at com.ibm.db2.jcc.a.r.a(r.java:31)\n        at com.ibm.db2.jcc.a.bp.g(bp.java:141)\n        at com.ibm.db2.jcc.b.ce.h(ce.java:853)\n        at com.ibm.db2.jcc.b.ce.a(ce.java:1311)\n        at com.ibm.db2.jcc.b.ce.executeQuery(ce.java:253)\n        at org.eclipse.hyades.resources.database.internal.extensions.JDBCHelper.\nexecuteQuery(JDBCHelper.java)\n        at org.eclipse.hyades.resources.database.internal.impl.GetLargestDatabas\neIdCommand.execute(GetLargestDatabaseIdCommand.java)\n        at com.ibm.etools.resources.database.extension.core.AddCommand.getLarges\ntDatabaseId(AddCommand.java:203)\n        at com.ibm.etools.resources.database.extension.core.AddCommand.assignObj\nectsToIds(AddCommand.java:193)\n        at com.ibm.etools.resources.database.extension.core.AddCommand.addObject\ns(AddCommand.java:173)\n        at com.ibm.etools.resources.database.extension.core.AddCommand.execute(A\nddCommand.java:104)\n        at com.ibm.etools.resources.database.extension.db2.DB2AddCommand.execute\n(DB2AddCommand.java:45)\n        at com.ibm.etools.resources.database.extension.core.DatabaseImpl.interna\nlAdd(DatabaseImpl.java:117)\n        at com.ibm.etools.resources.database.extension.core.DatabaseImpl.add(Dat\nabaseImpl.java:110)\n        at org.eclipse.hyades.resources.database.internal.impl.UpdateCommand.add\nObjects(UpdateCommand.java(Compiled Code))\n        at org.eclipse.hyades.resources.database.internal.impl.UpdateCommand.exe\ncute(UpdateCommand.java)\n        at com.ibm.etools.resources.database.extension.core.DatabaseImpl.process\nUpdates(DatabaseImpl.java:293)\n        at com.ibm.etools.resources.database.extension.core.DatabaseImpl.update(\nDatabaseImpl.java(Compiled Code))\n        at org.eclipse.hyades.resources.database.internal.impl.DBResourceContent\nAdapter.updateDatabase(DBResourceContentAdapter.java(Compiled Code))\n        at org.eclipse.hyades.resources.database.internal.impl.DBResourceContent\nAdapter.updateForPagingListAdd(DBResourceContentAdapter.java(Inlined Compiled Co\nde))\n        at org.eclipse.hyades.resources.database.internal.impl.DBResourceContent\nAdapter.processAdd(DBResourceContentAdapter.java(Compiled Code))\n        at org.eclipse.hyades.resources.database.internal.impl.DBResourceContent\nAdapter.notifyChanged(DBResourceContentAdapter.java(Compiled Code))\n        at org.eclipse.emf.common.notify.impl.BasicNotifierImpl.eNotify(BasicNot\nifierImpl.java(Compiled Code))\n        at org.eclipse.emf.ecore.util.DelegatingEcoreEList.dispatchNotification(\nDelegatingEcoreEList.java(Compiled Code))\n        at org.eclipse.emf.common.notify.impl.DelegatingNotifyingListImpl.addUni\nque(DelegatingNotifyingListImpl.java(Compiled Code))\n        at org.eclipse.emf.common.util.DelegatingEList.add(DelegatingEList.java(\nCompiled Code))\n        at org.eclipse.hyades.loaders.cbe.XMLCommonBaseEventLoader.addYourselfIn\nContext(XMLCommonBaseEventLoader.java(Compiled Code))\n        at org.eclipse.hyades.loaders.util.XMLLoader.endElement(XMLLoader.java(I\nnlined Compiled Code))\n        at org.eclipse.hyades.loaders.util.SAXFragmentHandler.endElement(SAXFrag\nmentHandler.java(Compiled Code))\n        at org.apache.xerces.parsers.AbstractSAXParser.endElement(Unknown Source\n)\n        at org.apache.xerces.impl.XMLDocumentFragmentScannerImpl.scanEndElement(\nUnknown Source)\n        at org.apache.xerces.impl.XMLDocumentFragmentScannerImpl$FragmentContent\nDispatcher.dispatch(Unknown Source)\n        at org.apache.xerces.impl.XMLDocumentFragmentScannerImpl.scanDocument(Un\nknown Source)\n        at org.apache.xerces.parsers.XML11Configuration.parse(Unknown Source)\n        at org.apache.xerces.parsers.XML11Configuration.parse(Unknown Source)\n        at org.apache.xerces.parsers.XMLParser.parse(Unknown Source)\n        at org.apache.xerces.parsers.AbstractSAXParser.parse(Unknown Source)\n        at javax.xml.parsers.SAXParser.parse(Unknown Source)\n        at org.eclipse.hyades.loaders.util.SAXFragmentHandler.parse(SAXFragmentH\nandler.java)\n        at org.eclipse.hyades.loaders.util.SAXFragmentHandler$1.run(SAXFragmentH\nandler.java)",
    "Fix in CVS.",
    "Closing the defect."
  ],
  "commentCreationDates": [
    "2004-08-24T23:47:35+02:00",
    "2004-08-30T17:31:24+02:00",
    "2004-08-30T17:39:02+02:00"
  ],
  "traces": [
    {
      "exceptionType": "com.ibm.db2.jcc.b.SQLException",
      "message": "NULLID.SYSSH203 0X5359534C564C3031",
      "elements": [
        {
          "method": "com.ibm.db2.jcc.b.ce.e",
          "source": "ce.java(Compiled Code)"
        },
        {
          "method": "com.ibm.db2.jcc.a.bd.o",
          "source": "bd.java:564"
        },
        {
          "method": "com.ibm.db2.jcc.a.bd.g",
          "source": "bd.java(Compiled Code)"
        },
        {
          "method": "com.ibm.db2.jcc.a.bd.a",
          "source": "bd.java:40"
        },
        {
          "method": "com.ibm.db2.jcc.a.r.a",
          "source": "r.java:31"
        },
        {
          "method": "com.ibm.db2.jcc.a.bp.g",
          "source": "bp.java:141"
        },
        {
          "method": "com.ibm.db2.jcc.b.ce.h",
          "source": "ce.java:853"
        },
        {
          "method": "com.ibm.db2.jcc.b.ce.a",
          "source": "ce.java:1311"
        },
        {
          "method": "com.ibm.db2.jcc.b.ce.executeQuery",
          "source": "ce.java:253"
        },
        {
          "method": "org.eclipse.hyades.resources.database.internal.extensions.JDBCHelper.executeQuery",
          "source": "JDBCHelper.java"
        },
        {
          "method": "org.eclipse.hyades.resources.database.internal.impl.GetLargestDatabaseIdCommand.execute",
          "source": "GetLargestDatabaseIdCommand.java"
        },
        {
          "method": "com.ibm.etools.resources.database.extension.core.AddCommand.getLargestDatabaseId",
          "source": "AddCommand.java:203"
        },
        {
          "method": "com.ibm.etools.resources.database.extension.core.AddCommand.assignObjectsToIds",
          "source": "AddCommand.java:193"
        },
        {
          "method": "com.ibm.etools.resources.database.extension.core.AddCommand.addObjects",
          "source": "AddCommand.java:173"
        },
        {
          "method": "com.ibm.etools.resources.database.extension.core.AddCommand.execute",
          "source": "A ddCommand.java:104"
        },
        {
          "method": "com.ibm.etools.resources.database.extension.db2.DB2AddCommand.execute",
          "source": "DB2AddCommand.java:45"
        },
        {
          "method": "com.ibm.etools.resources.database.extension.core.DatabaseImpl.internalAdd",
          "source": "DatabaseImpl.java:117"
        },
        {
          "method": "com.ibm.etools.resources.database.extension.core.DatabaseImpl.add",
          "source": "Dat abaseImpl.java:110"
        },
        {
          "method": "org.eclipse.hyades.resources.database.internal.impl.UpdateCommand.addObjects",
          "source": "UpdateCommand.java(Compiled Code)"
        },
        {
          "method": "org.eclipse.hyades.resources.database.internal.impl.UpdateCommand.execute",
          "source": "UpdateCommand.java"
        },
        {
          "method": "com.ibm.etools.resources.database.extension.core.DatabaseImpl.processUpdates",
          "source": "DatabaseImpl.java:293"
        },
        {
          "method": "com.ibm.etools.resources.database.extension.core.DatabaseImpl.update",
          "source": " DatabaseImpl.java(Compiled Code)"
        },
        {
          "method": "org.eclipse.hyades.resources.database.internal.impl.DBResourceContentAdapter.updateDatabase",
          "source": "DBResourceContentAdapter.java(Compiled Code)"
        },
        {
          "method": "org.eclipse.hyades.resources.database.internal.impl.DBResourceContentAdapter.updateForPagingListAdd",
          "source": "DBResourceContentAdapter.java(Inlined Compiled Co de)"
        },
        {
          "method": "org.eclipse.hyades.resources.database.internal.impl.DBResourceContentAdapter.processAdd",
          "source": "DBResourceContentAdapter.java(Compiled Code)"
        },
        {
          "method": "org.eclipse.hyades.resources.database.internal.impl.DBResourceContentAdapter.notifyChanged",
          "source": "DBResourceContentAdapter.java(Compiled Code)"
        },
        {
          "method": "org.eclipse.emf.common.notify.impl.BasicNotifierImpl.eNotify",
          "source": "BasicNot ifierImpl.java(Compiled Code)"
        },
        {
          "method": "org.eclipse.emf.ecore.util.DelegatingEcoreEList.dispatchNotification",
          "source": " DelegatingEcoreEList.java(Compiled Code)"
        },
        {
          "method": "org.eclipse.emf.common.notify.impl.DelegatingNotifyingListImpl.addUnique",
          "source": "DelegatingNotifyingListImpl.java(Compiled Code)"
        },
        {
          "method": "org.eclipse.emf.common.util.DelegatingEList.add",
          "source": "DelegatingEList.java( Compiled Code)"
        },
        {
          "method": "org.eclipse.hyades.loaders.cbe.XMLCommonBaseEventLoader.addYourselfInContext",
          "source": "XMLCommonBaseEventLoader.java(Compiled Code)"
        },
        {
          "method": "org.eclipse.hyades.loaders.util.XMLLoader.endElement",
          "source": "XMLLoader.java(I nlined Compiled Code)"
        },
        {
          "method": "org.eclipse.hyades.loaders.util.SAXFragmentHandler.endElement",
          "source": "SAXFrag mentHandler.java(Compiled Code)"
        },
        {
          "method": "org.apache.xerces.parsers.AbstractSAXParser.endElement",
          "source": "Unknown Source "
        },
        {
          "method": "org.apache.xerces.impl.XMLDocumentFragmentScannerImpl.scanEndElement",
          "source": " Unknown Source"
        },
        {
          "method": "org.apache.xerces.impl.XMLDocumentFragmentScannerImpl$FragmentContentDispatcher.dispatch",
          "source": "Unknown Source"
        },
        {
          "method": "org.apache.xerces.impl.XMLDocumentFragmentScannerImpl.scanDocument",
          "source": "Un known Source"
        },
        {
          "method": "org.apache.xerces.parsers.XML11Configuration.parse",
          "source": "Unknown Source"
        },
        {
          "method": "org.apache.xerces.parsers.XML11Configuration.parse",
          "source": "Unknown Source"
        },
        {
          "method": "org.apache.xerces.parsers.XMLParser.parse",
          "source": "Unknown Source"
        },
        {
          "method": "org.apache.xerces.parsers.AbstractSAXParser.parse",
          "source": "Unknown Source"
        },
        {
          "method": "javax.xml.parsers.SAXParser.parse",
          "source": "Unknown Source"
        },
        {
          "method": "org.eclipse.hyades.loaders.util.SAXFragmentHandler.parse",
          "source": "SAXFragmentH andler.java"
        },
        {
          "method": "org.eclipse.hyades.loaders.util.SAXFragmentHandler$1.run",
          "source": "SAXFragmentH andler.java"
        }
      ],
      "number": 0,
      "commentIndex": 0,
      "bugId": "72557",
      "date": "2004-08-24T23:47:35+02:00",
      "product": "Hyades",
      "component": "UI.log_view",
      "severity": "critical"
    }
  ],
  "groupId": "72557",
  "bugId": "72557",
  "date": "2004-08-24T23:47:35+02:00",
  "product": "Hyades",
  "component": "UI.log_view",
  "severity": "critical"
}