{
  "comments": [
    "I20040914\n\nI noticed that my \"open types\" dialog was hung reporting progress. I was able \nto cancel the progress dialog, but saw this in the Eclispe console:\n\njava.lang.IllegalMonitorStateException\n        at java.lang.Object.notifyAll(Native Method)\n        at \norg.eclipse.jdt.internal.core.search.indexing.ReadWriteMonitor.exitRe\nad(ReadWriteMonitor.java:58)\n        at org.eclipse.jdt.internal.core.search.PatternSearchJob.search\n(PatternS\nearchJob.java:119)\n        at org.eclipse.jdt.internal.core.search.PatternSearchJob.execute\n(Pattern\nSearchJob.java:64)\n        at \norg.eclipse.jdt.internal.core.search.processing.JobManager.performCon\ncurrentJob(JobManager.java:260)\n        at org.eclipse.jdt.core.search.SearchEngine.searchAllTypeNames\n(SearchEng\nine.java:870)\n        at org.eclipse.jdt.internal.corext.util.AllTypesCache.search\n(AllTypesCac\nhe.java:532)\n        at \norg.eclipse.jdt.internal.corext.util.AllTypesCache$TypeCacher.doSearc\nhTypes(AllTypesCache.java:197)\n        at org.eclipse.jdt.internal.corext.util.AllTypesCache$TypeCacher.run\n(All\nTypesCache.java:166)",
    "\n\n*** This bug has been marked as a duplicate of 73226 ***"
  ],
  "commentCreationDates": [
    "2004-09-15T15:56:25+02:00",
    "2004-09-15T16:08:11+02:00"
  ],
  "traces": [
    {
      "exceptionType": "java.lang.IllegalMonitorStateException",
      "elements": [
        {
          "method": "java.lang.Object.notifyAll",
          "source": "Native Method"
        },
        {
          "method": "org.eclipse.jdt.internal.core.search.indexing.ReadWriteMonitor.exitRead",
          "source": "ReadWriteMonitor.java:58"
        },
        {
          "method": "org.eclipse.jdt.internal.core.search.PatternSearchJob.search",
          "source": "PatternS earchJob.java:119"
        },
        {
          "method": "org.eclipse.jdt.internal.core.search.PatternSearchJob.execute",
          "source": "Pattern SearchJob.java:64"
        },
        {
          "method": "org.eclipse.jdt.internal.core.search.processing.JobManager.performConcurrentJob",
          "source": "JobManager.java:260"
        },
        {
          "method": "org.eclipse.jdt.core.search.SearchEngine.searchAllTypeNames",
          "source": "SearchEng ine.java:870"
        },
        {
          "method": "org.eclipse.jdt.internal.corext.util.AllTypesCache.search",
          "source": "AllTypesCac he.java:532"
        },
        {
          "method": "org.eclipse.jdt.internal.corext.util.AllTypesCache$TypeCacher.doSearchTypes",
          "source": "AllTypesCache.java:197"
        },
        {
          "method": "org.eclipse.jdt.internal.corext.util.AllTypesCache$TypeCacher.run",
          "source": "All TypesCache.java:166"
        }
      ],
      "number": 0,
      "commentIndex": 0,
      "bugId": "73982",
      "duplicateId": "73226",
      "date": "2004-09-15T15:56:25+02:00",
      "product": "JDT",
      "component": "Core",
      "severity": "normal"
    }
  ],
  "groupId": "73226",
  "bugId": "73982",
  "duplicateId": "73226",
  "date": "2004-09-15T15:56:25+02:00",
  "product": "JDT",
  "component": "Core",
  "severity": "normal"
}