{
  "comments": [
    "Strange error when moving a source with a deactivated breakpoint from a named \npackage to a !default package!. Strange, because it\u0027s hard to get it \nreproducable.\n\n20011219 JDK 131\n\nSteps:\nOpen eclipse. Open preferences - java - check use src/bin folder.\nCreate new Java-project MoveTest.\nCreate new package A.\nCreate new Class A in package a. (check create main)\nAdd a std statement\n\npackage A;\n\npublic class A {\n\n\tpublic static void main(String[] args) {\n\t\tSystem.out.println(\"\");\n\t}\n} \n\nSet breakpoint in main.\nOpen debug perspective. Set this breakpoint enabled \u003d false.\nOpen java perspective. Drag class A to folder src and drop.\nError message Internal Error appears.\n\nLog: Thu Jan 10 14:21:42 CET 2002\n4 org.eclipse.jdt.core 969 A.java does not exist.\nLog: Thu Jan 10 14:21:42 CET 2002\n1 org.eclipse.core.resources 4 Unhandled exception caught in event loop.\nLog: Thu Jan 10 14:21:42 CET 2002\n4 org.eclipse.ui 0 Failed to execute runnable \n(java.lang.IllegalArgumentException: Invalid range argument)\norg.eclipse.swt.SWTException: Failed to execute runnable \n(java.lang.IllegalArgumentException: Invalid range argument)\n\tat org.eclipse.swt.SWT.error(SWT.java:1887)\n\tat \norg.eclipse.swt.widgets.Synchronizer.runAsyncMessages(Synchronizer.java:96)\n\tat org.eclipse.swt.widgets.Display.runAsyncMessages(Display.java:1385)\n\tat org.eclipse.swt.widgets.Display.readAndDispatch(Display.java:1203)\n\tat org.eclipse.ui.internal.Workbench.runEventLoop(Workbench.java:815)\n\tat org.eclipse.ui.internal.Workbench.run(Workbench.java:798)\n\tat \norg.eclipse.core.internal.boot.InternalBootLoader.run(InternalBootLoader.java:82\n1)\n\tat org.eclipse.core.boot.BootLoader.run(BootLoader.java:285)\n\tat java.lang.reflect.Method.invoke(Native Method)\n\tat org.eclipse.core.launcher.Main.basicRun(Main.java:151)\n\tat org.eclipse.core.launcher.Main.run(Main.java:502)\n\tat org.eclipse.core.launcher.Main.main(Main.java:362)\n\nThere are other errors as well, while trying to get an working example. But i\u0027ve \nnot so much time to work it out.\nIt can happen, that there is a breakpoint of a moved source still in in the \nproperties editor at debug perspective. Changing a poperty will result in an \nerror.\nStrange too, is that you can do the dragging between 2 named packages without \nproblems. An if you move the class A without breakpoint from A to default and \nback, and try the same with an activated breakpoint it works (perhaps something \nis cached?)",
    "Martin, i cannot reproduce it on the latest integration build (20020205)\ncan you maybe give it a try on the lastest integration or the next stable and \nreopen if see it again?\nthanks\n",
    "Next stable build is ok.",
    "Did a test with 20020125. All seems ok, as the breakpoints are removed when \nmoving a class. No very polite but effective. So works for me too.",
    "for the disappearing breakpoints you might be interested in bug#7552  \n"
  ],
  "commentCreationDates": [
    "2002-01-10T13:28:42+01:00",
    "2002-02-11T18:25:07+01:00",
    "2002-02-11T20:54:15+01:00",
    "2002-02-12T10:42:40+01:00",
    "2002-02-12T10:47:37+01:00"
  ],
  "traces": [
    {
      "exceptionType": "java.lang.IllegalArgumentException",
      "message": "Invalid range argument)",
      "elements": [
        {
          "method": "org.eclipse.swt.SWT.error",
          "source": "SWT.java:1887"
        },
        {
          "method": "org.eclipse.swt.widgets.Synchronizer.runAsyncMessages",
          "source": "Synchronizer.java:96"
        },
        {
          "method": "org.eclipse.swt.widgets.Display.runAsyncMessages",
          "source": "Display.java:1385"
        },
        {
          "method": "org.eclipse.swt.widgets.Display.readAndDispatch",
          "source": "Display.java:1203"
        },
        {
          "method": "org.eclipse.ui.internal.Workbench.runEventLoop",
          "source": "Workbench.java:815"
        },
        {
          "method": "org.eclipse.ui.internal.Workbench.run",
          "source": "Workbench.java:798"
        },
        {
          "method": "org.eclipse.core.internal.boot.InternalBootLoader.run",
          "source": "InternalBootLoader.java:82 1"
        },
        {
          "method": "org.eclipse.core.boot.BootLoader.run",
          "source": "BootLoader.java:285"
        },
        {
          "method": "java.lang.reflect.Method.invoke",
          "source": "Native Method"
        },
        {
          "method": "org.eclipse.core.launcher.Main.basicRun",
          "source": "Main.java:151"
        },
        {
          "method": "org.eclipse.core.launcher.Main.run",
          "source": "Main.java:502"
        },
        {
          "method": "org.eclipse.core.launcher.Main.main",
          "source": "Main.java:362"
        }
      ],
      "number": 0,
      "commentIndex": 0,
      "bugId": "7424",
      "date": "2002-01-10T13:28:42+01:00",
      "product": "JDT",
      "component": "UI",
      "severity": "normal"
    }
  ],
  "groupId": "7424",
  "bugId": "7424",
  "date": "2002-01-10T13:28:42+01:00",
  "product": "JDT",
  "component": "UI",
  "severity": "normal"
}