{
  "comments": [
    "20041214 1.5 vm\n\nIf you create a java project with a Hebrew name and then a jpage with an \nEnglish name you will not be able to execute it. This is fine with a Hebrew \npage name and an English project name\n\nSTEPS\n1) Create a project with a Hebrew name\n2) Create a file called test.jpage\n3) Insert the following code: System.out.println(java.util.Locale.getDefault\n());\n4) Highlight and select Display\n\nYou will get the following error:\n\n\n!ENTRY org.eclipse.debug.core 4 120 2004-12-14 10:35:09.449\n!MESSAGE Exception occurred executing command line.\n!STACK 0\njava.io.IOException: CreateProcess: D:\\R31\\1214\\eclipse\\jre\\bin\\javaw.exe -\nclass\npath D:\\R31\\1214\\eclipse\\plugins\\org.eclipse.jdt.debug.ui_3.1.0\n\\snippetsupport.j\nar -Xdebug -Xnoagent -\nXrunjdwp:transport\u003ddt_socket,suspend\u003dy,address\u003dlocalhost:2\n575 org.eclipse.jdt.internal.debug.ui.snippeteditor.ScrapbookMain \nfile:/D:/R31/1\n214/eclipse/workspace/.metadata/.plugins/org.eclipse.core.resources/.projects/%\n3\nF%3F%3F%3F/org.eclipse.jdt.debug.ui/ file:/D:/R31/1214/eclipse/workspace/%3F%\n3F%\n3F%3F/ error\u003d267\n        at java.lang.ProcessImpl.create(Native Method)\n        at java.lang.ProcessImpl.\u003cinit\u003e(ProcessImpl.java:81)\n        at java.lang.ProcessImpl.start(ProcessImpl.java:30)\n        at java.lang.ProcessBuilder.start(ProcessBuilder.java:451)\n        at java.lang.Runtime.exec(Runtime.java:591)\n        at org.eclipse.debug.core.DebugPlugin.exec(DebugPlugin.java:699)\n        at org.eclipse.jdt.launching.AbstractVMRunner.exec\n(AbstractVMRunner.java\n:70)\n        at org.eclipse.jdt.internal.launching.StandardVMDebugger.run\n(StandardVMD\nebugger.java:199)\n        at \norg.eclipse.jdt.internal.launching.JavaLocalApplicationLaunchConfigur\nationDelegate.launch(JavaLocalApplicationLaunchConfigurationDelegate.java:109)\n        at org.eclipse.debug.internal.core.LaunchConfiguration.launch\n(LaunchConf\niguration.java:588)\n        at org.eclipse.debug.internal.core.LaunchConfiguration.launch\n(LaunchConf\niguration.java:513)\n        at org.eclipse.debug.internal.core.LaunchConfiguration.launch\n(LaunchConf\niguration.java:150)\n        at \norg.eclipse.jdt.internal.debug.ui.snippeteditor.ScrapbookLauncher.doL\naunch(ScrapbookLauncher.java:219)\n        at \norg.eclipse.jdt.internal.debug.ui.snippeteditor.ScrapbookLauncher.lau\nnch(ScrapbookLauncher.java:143)\n        at \norg.eclipse.jdt.internal.debug.ui.snippeteditor.JavaSnippetEditor$14.\nrun(JavaSnippetEditor.java:1146)\n        at org.eclipse.swt.custom.BusyIndicator.showWhile\n(BusyIndicator.java:69)\n\n        at \norg.eclipse.jdt.internal.debug.ui.snippeteditor.JavaSnippetEditor.lau\nnchVM(JavaSnippetEditor.java:1149)\n        at \norg.eclipse.jdt.internal.debug.ui.snippeteditor.JavaSnippetEditor.bui\nldAndLaunch(JavaSnippetEditor.java:402)\n        at \norg.eclipse.jdt.internal.debug.ui.snippeteditor.JavaSnippetEditor.eva\nlSelection(JavaSnippetEditor.java:324)\n        at org.eclipse.jdt.internal.debug.ui.actions.DisplayAction.run\n(DisplayAc\ntion.java:101)\n        at org.eclipse.jdt.internal.debug.ui.actions.EvaluateAction.run\n(Evaluate\nAction.java:564)\n        at org.eclipse.ui.internal.PluginAction.runWithEvent\n(PluginAction.java:2\n43)\n        at \norg.eclipse.jface.action.ActionContributionItem.handleWidgetSelection\n(ActionContributionItem.java:555)\n        at org.eclipse.jface.action.ActionContributionItem.access$2\n(ActionContri\nbutionItem.java:505)\n        at org.eclipse.jface.action.ActionContributionItem$6.handleEvent\n(ActionC\nontributionItem.java:419)\n        at org.eclipse.swt.widgets.EventTable.sendEvent(EventTable.java:82)\n        at org.eclipse.swt.widgets.Widget.sendEvent(Widget.java:833)\n        at org.eclipse.swt.widgets.Display.runDeferredEvents(Display.java:2803)\n        at org.eclipse.swt.widgets.Display.readAndDispatch(Display.java:2448)\n        at org.eclipse.ui.internal.Workbench.runEventLoop(Workbench.java:1569)\n        at org.eclipse.ui.internal.Workbench.runUI(Workbench.java:1540)\n        at org.eclipse.ui.internal.Workbench.createAndRunWorkbench\n(Workbench.jav\na:285)\n        at org.eclipse.ui.PlatformUI.createAndRunWorkbench(PlatformUI.java:144)\n        at org.eclipse.ui.internal.ide.IDEApplication.run\n(IDEApplication.java:10\n2)\n        at org.eclipse.core.internal.runtime.PlatformActivator$1.run\n(PlatformAct\nivator.java:220)\n        at org.eclipse.core.runtime.adaptor.EclipseStarter.run\n(EclipseStarter.ja\nva:273)\n        at org.eclipse.core.runtime.adaptor.EclipseStarter.run\n(EclipseStarter.ja\nva:129)\n        at sun.reflect.NativeMethodAccessorImpl.invoke0(Native Method)\n        at sun.reflect.NativeMethodAccessorImpl.invoke\n(NativeMethodAccessorImpl.\njava:39)\n        at sun.reflect.DelegatingMethodAccessorImpl.invoke\n(DelegatingMethodAcces\nsorImpl.java:25)\n        at java.lang.reflect.Method.invoke(Method.java:585)\n        at org.eclipse.core.launcher.Main.basicRun(Main.java:185)\n        at org.eclipse.core.launcher.Main.run(Main.java:710)\n        at org.eclipse.core.launcher.Main.main(Main.java:694)",
    "\n\n*** This bug has been marked as a duplicate of 32206 ***",
    "Todd, I think the problem is that the encoding used by the workspace and the \nencoding used by the Eclipse runtime are different in this case. When we send \na command line to Runtime.exec(..), the command is interpretted in the \nencoding of the Eclipse runtime. \n\nI\u0027m not sure if there is a way to detect that incompatible characters are \npresent, and if there is a way to convert them to unicode. I can\u0027t find an \nenvironment variable on Windows to specify encodings, but if one were \navaialable we might be able to set the evironment in which to interpret the \ncommand (via the Environment tab).\n\nTodd, do you have any insight on automated character conversion (i.e. from \nHebrew to unicode)?",
    "Another note - I noticed that IFiles have an encoding in Eclispe 3.0, but I do \nnot see encodings for resources in general. Do you know if there is a way to \ndetermine the encoding of a resource name?",
    "Not sure if that is what you asked, but container resources (the workspace root,\nprojects and folders) have a default encoding (check\nIContainer#getDefaultCharset()). That may affect the encoding for any contained\nfiles, if their encoding cannot be determined by the content type for that file.\n\nAlso, you can see the charset setting for any resource by checking the\nproperties dialog, \"Info\" section."
  ],
  "commentCreationDates": [
    "2004-12-14T15:36:07+01:00",
    "2004-12-17T18:57:33+01:00",
    "2004-12-17T19:20:19+01:00",
    "2004-12-17T19:22:20+01:00",
    "2004-12-17T19:52:48+01:00"
  ],
  "traces": [
    {
      "exceptionType": "java.io.IOException",
      "message": "CreateProcess: D:\\R31\\1214\\eclipse\\jre\\bin\\javaw.exe - class path D:\\R31\\1214\\eclipse\\plugins\\org.eclipse.jdt.debug.ui_3.1.0 \\snippetsupport.j ar -Xdebug -Xnoagent - Xrunjdwp:transport\u003ddt_socket,suspend\u003dy,address\u003dlocalhost:2 575 org.eclipse.jdt.internal.debug.ui.snippeteditor.ScrapbookMain  file:/D:/R31/1 214/eclipse/workspace/.metadata/.plugins/org.eclipse.core.resources/.projects/% 3 F%3F%3F%3F/org.eclipse.jdt.debug.ui/ file:/D:/R31/1214/eclipse/workspace/%3F% 3F% 3F%3F/ error\u003d267",
      "elements": [
        {
          "method": "java.lang.ProcessImpl.create",
          "source": "Native Method"
        },
        {
          "method": "java.lang.ProcessImpl.\u003cinit\u003e",
          "source": "ProcessImpl.java:81"
        },
        {
          "method": "java.lang.ProcessImpl.start",
          "source": "ProcessImpl.java:30"
        },
        {
          "method": "java.lang.ProcessBuilder.start",
          "source": "ProcessBuilder.java:451"
        },
        {
          "method": "java.lang.Runtime.exec",
          "source": "Runtime.java:591"
        },
        {
          "method": "org.eclipse.debug.core.DebugPlugin.exec",
          "source": "DebugPlugin.java:699"
        },
        {
          "method": "org.eclipse.jdt.launching.AbstractVMRunner.exec",
          "source": "AbstractVMRunner.java :70"
        },
        {
          "method": "org.eclipse.jdt.internal.launching.StandardVMDebugger.run",
          "source": "StandardVMD ebugger.java:199"
        },
        {
          "method": "org.eclipse.jdt.internal.launching.JavaLocalApplicationLaunchConfigurationDelegate.launch",
          "source": "JavaLocalApplicationLaunchConfigurationDelegate.java:109"
        },
        {
          "method": "org.eclipse.debug.internal.core.LaunchConfiguration.launch",
          "source": "LaunchConf iguration.java:588"
        },
        {
          "method": "org.eclipse.debug.internal.core.LaunchConfiguration.launch",
          "source": "LaunchConf iguration.java:513"
        },
        {
          "method": "org.eclipse.debug.internal.core.LaunchConfiguration.launch",
          "source": "LaunchConf iguration.java:150"
        },
        {
          "method": "org.eclipse.jdt.internal.debug.ui.snippeteditor.ScrapbookLauncher.doLaunch",
          "source": "ScrapbookLauncher.java:219"
        },
        {
          "method": "org.eclipse.jdt.internal.debug.ui.snippeteditor.ScrapbookLauncher.launch",
          "source": "ScrapbookLauncher.java:143"
        },
        {
          "method": "org.eclipse.jdt.internal.debug.ui.snippeteditor.JavaSnippetEditor$14.run",
          "source": "JavaSnippetEditor.java:1146"
        },
        {
          "method": "org.eclipse.swt.custom.BusyIndicator.showWhile",
          "source": "BusyIndicator.java:69"
        },
        {
          "method": "org.eclipse.jdt.internal.debug.ui.snippeteditor.JavaSnippetEditor.launchVM",
          "source": "JavaSnippetEditor.java:1149"
        },
        {
          "method": "org.eclipse.jdt.internal.debug.ui.snippeteditor.JavaSnippetEditor.buildAndLaunch",
          "source": "JavaSnippetEditor.java:402"
        },
        {
          "method": "org.eclipse.jdt.internal.debug.ui.snippeteditor.JavaSnippetEditor.evalSelection",
          "source": "JavaSnippetEditor.java:324"
        },
        {
          "method": "org.eclipse.jdt.internal.debug.ui.actions.DisplayAction.run",
          "source": "DisplayAc tion.java:101"
        },
        {
          "method": "org.eclipse.jdt.internal.debug.ui.actions.EvaluateAction.run",
          "source": "Evaluate Action.java:564"
        },
        {
          "method": "org.eclipse.ui.internal.PluginAction.runWithEvent",
          "source": "PluginAction.java:2 43"
        },
        {
          "method": "org.eclipse.jface.action.ActionContributionItem.handleWidgetSelection",
          "source": "ActionContributionItem.java:555"
        },
        {
          "method": "org.eclipse.jface.action.ActionContributionItem.access$2",
          "source": "ActionContri butionItem.java:505"
        },
        {
          "method": "org.eclipse.jface.action.ActionContributionItem$6.handleEvent",
          "source": "ActionC ontributionItem.java:419"
        },
        {
          "method": "org.eclipse.swt.widgets.EventTable.sendEvent",
          "source": "EventTable.java:82"
        },
        {
          "method": "org.eclipse.swt.widgets.Widget.sendEvent",
          "source": "Widget.java:833"
        },
        {
          "method": "org.eclipse.swt.widgets.Display.runDeferredEvents",
          "source": "Display.java:2803"
        },
        {
          "method": "org.eclipse.swt.widgets.Display.readAndDispatch",
          "source": "Display.java:2448"
        },
        {
          "method": "org.eclipse.ui.internal.Workbench.runEventLoop",
          "source": "Workbench.java:1569"
        },
        {
          "method": "org.eclipse.ui.internal.Workbench.runUI",
          "source": "Workbench.java:1540"
        },
        {
          "method": "org.eclipse.ui.internal.Workbench.createAndRunWorkbench",
          "source": "Workbench.jav a:285"
        },
        {
          "method": "org.eclipse.ui.PlatformUI.createAndRunWorkbench",
          "source": "PlatformUI.java:144"
        },
        {
          "method": "org.eclipse.ui.internal.ide.IDEApplication.run",
          "source": "IDEApplication.java:10 2"
        },
        {
          "method": "org.eclipse.core.internal.runtime.PlatformActivator$1.run",
          "source": "PlatformAct ivator.java:220"
        },
        {
          "method": "org.eclipse.core.runtime.adaptor.EclipseStarter.run",
          "source": "EclipseStarter.ja va:273"
        },
        {
          "method": "org.eclipse.core.runtime.adaptor.EclipseStarter.run",
          "source": "EclipseStarter.ja va:129"
        },
        {
          "method": "sun.reflect.NativeMethodAccessorImpl.invoke0",
          "source": "Native Method"
        },
        {
          "method": "sun.reflect.NativeMethodAccessorImpl.invoke",
          "source": "NativeMethodAccessorImpl. java:39"
        },
        {
          "method": "sun.reflect.DelegatingMethodAccessorImpl.invoke",
          "source": "DelegatingMethodAcces sorImpl.java:25"
        },
        {
          "method": "java.lang.reflect.Method.invoke",
          "source": "Method.java:585"
        },
        {
          "method": "org.eclipse.core.launcher.Main.basicRun",
          "source": "Main.java:185"
        },
        {
          "method": "org.eclipse.core.launcher.Main.run",
          "source": "Main.java:710"
        },
        {
          "method": "org.eclipse.core.launcher.Main.main",
          "source": "Main.java:694"
        }
      ],
      "number": 0,
      "commentIndex": 0,
      "bugId": "80938",
      "duplicateId": "32206",
      "date": "2004-12-14T15:36:07+01:00",
      "product": "Platform",
      "component": "Debug",
      "severity": "normal"
    }
  ],
  "groupId": "32206",
  "bugId": "80938",
  "duplicateId": "32206",
  "date": "2004-12-14T15:36:07+01:00",
  "product": "Platform",
  "component": "Debug",
  "severity": "normal"
}