{
  "comments": [
    "While verifying bug 82498, i got multiple times an NPE in\nRemoteAntDebugBuildListener.\nI have no real test case, I was using \u0027run to line\u0027 over breakpoints, and/or in\nposition where the line would not be hit again, and some times (1 of 5-10\ntimes), I got this exception.\n\n!ENTRY org.eclipse.debug.core 4 120 2005-01-25 11:24:56.26\n!MESSAGE An exception occurred while dispatching debug events.\n!STACK 0\njava.lang.NullPointerException\n        at\norg.eclipse.ant.internal.ui.debug.model.RemoteAntDebugBuildListener.handleBreakpoint(RemoteAntDebugBuildListener.java:250)\n        at\norg.eclipse.ant.internal.ui.debug.model.AntDebugTarget.breakpointRemoved(AntDebugTarget.java:238)\n        at\norg.eclipse.debug.ui.actions.RunToLineHandler.cancel(RunToLineHandler.java:113)\n        at\norg.eclipse.debug.ui.actions.RunToLineHandler.handleDebugEvents(RunToLineHandler.java:83)\n        at\norg.eclipse.debug.core.DebugPlugin$EventNotifier.run(DebugPlugin.java:1046)\n        at\norg.eclipse.core.internal.runtime.InternalPlatform.run(InternalPlatform.java:1051)\n        at org.eclipse.core.runtime.Platform.run(Platform.java:747)\n        at\norg.eclipse.debug.core.DebugPlugin$EventNotifier.dispatch(DebugPlugin.java:1078)\n        at\norg.eclipse.debug.core.DebugPlugin$EventDispatchJob.run(DebugPlugin.java:337)\n        at org.eclipse.core.internal.jobs.Worker.run(Worker.java:66)",
    "Looks like we are cancelling the run to line after termination has occurred \n(fTarget is null).",
    "Forgot to say that when this problem occurs, the \u0027skip all breakpoints\u0027 is not\nreset.",
    "Fixed in RemoteAntDebugBuildListener to ignore the removeBreakpoint if the \ntarget is null (the listener has been shutdown).\n\nAlso try/finally in RunToLineHandler to ensure the breakpoint manager is \ncorrectly \"restored\"",
    "Please verify Luc.",
    "Verified.\nPlease update the build notes, Darin S.",
    "Thanks Build notes updated"
  ],
  "commentCreationDates": [
    "2005-01-25T19:33:47+01:00",
    "2005-01-25T19:36:36+01:00",
    "2005-01-25T19:51:54+01:00",
    "2005-01-25T21:27:50+01:00",
    "2005-01-25T21:28:05+01:00",
    "2005-01-25T22:00:46+01:00",
    "2005-01-25T23:10:17+01:00"
  ],
  "traces": [
    {
      "exceptionType": "java.lang.NullPointerException",
      "elements": [
        {
          "method": "org.eclipse.ant.internal.ui.debug.model.RemoteAntDebugBuildListener.handleBreakpoint",
          "source": "RemoteAntDebugBuildListener.java:250"
        },
        {
          "method": "org.eclipse.ant.internal.ui.debug.model.AntDebugTarget.breakpointRemoved",
          "source": "AntDebugTarget.java:238"
        },
        {
          "method": "org.eclipse.debug.ui.actions.RunToLineHandler.cancel",
          "source": "RunToLineHandler.java:113"
        },
        {
          "method": "org.eclipse.debug.ui.actions.RunToLineHandler.handleDebugEvents",
          "source": "RunToLineHandler.java:83"
        },
        {
          "method": "org.eclipse.debug.core.DebugPlugin$EventNotifier.run",
          "source": "DebugPlugin.java:1046"
        },
        {
          "method": "org.eclipse.core.internal.runtime.InternalPlatform.run",
          "source": "InternalPlatform.java:1051"
        },
        {
          "method": "org.eclipse.core.runtime.Platform.run",
          "source": "Platform.java:747"
        },
        {
          "method": "org.eclipse.debug.core.DebugPlugin$EventNotifier.dispatch",
          "source": "DebugPlugin.java:1078"
        },
        {
          "method": "org.eclipse.debug.core.DebugPlugin$EventDispatchJob.run",
          "source": "DebugPlugin.java:337"
        },
        {
          "method": "org.eclipse.core.internal.jobs.Worker.run",
          "source": "Worker.java:66"
        }
      ],
      "number": 0,
      "commentIndex": 0,
      "bugId": "83644",
      "date": "2005-01-25T19:33:47+01:00",
      "product": "Platform",
      "component": "Ant",
      "severity": "normal"
    }
  ],
  "groupId": "83644",
  "bugId": "83644",
  "date": "2005-01-25T19:33:47+01:00",
  "product": "Platform",
  "component": "Ant",
  "severity": "normal"
}