{
  "comments": [
    "The following code fails with Acrobat Reader 7 ActiveX\n\n        String progID \u003d \"AcroPDF.PDF.1\";\n        Shell shell \u003d new Shell();\n        OleFrame frame \u003d new OleFrame(shell, SWT.NONE);\n        OleControlSite site \u003d null;\n        OleAutomation auto \u003d null;\n        try\n        {\n            site \u003d new OleControlSite(frame, SWT.NONE, progID);\n            auto \u003d new OleAutomation(site);\n        }\n        catch (SWTException ex)\n        {\n            ex.printStackTrace();\n            System.out.println(\"Unable to open type library for \" + progID);\n            return;\n        }\n\n\norg.eclipse.swt.SWTException: Failed to create Ole Client. result \u003d -2147467262\n\tat org.eclipse.swt.ole.win32.OLE.error(OLE.java:302)\n\tat org.eclipse.swt.ole.win32.OleControlSite.\u003cinit\u003e\n(OleControlSite.java:101)\n\tat Main.main(Main.java:37)",
    "The error you are getting is:\n\n0x80004002  -2147467262  No such interface supported\n\n\"AcroPDF.PDF.1\" does not support the neccessary interfaces to be created with \nOleCreate.  That is not something that SWT can change.\n\nYou can, however, use the following program ID instead:\n\nString progID \u003d \"AcroExch.Document.7\""
  ],
  "commentCreationDates": [
    "2005-02-03T10:23:29+01:00",
    "2005-02-07T18:09:32+01:00"
  ],
  "traces": [
    {
      "exceptionType": "org.eclipse.swt.SWTException",
      "message": "Failed to create Ole Client. result \u003d -2147467262",
      "elements": [
        {
          "method": "org.eclipse.swt.ole.win32.OLE.error",
          "source": "OLE.java:302"
        },
        {
          "method": "org.eclipse.swt.ole.win32.OleControlSite.\u003cinit\u003e",
          "source": "OleControlSite.java:101"
        },
        {
          "method": "Main.main",
          "source": "Main.java:37"
        }
      ],
      "number": 0,
      "commentIndex": 0,
      "bugId": "84309",
      "date": "2005-02-03T10:23:29+01:00",
      "product": "Platform",
      "component": "SWT",
      "severity": "normal"
    }
  ],
  "groupId": "84309",
  "bugId": "84309",
  "date": "2005-02-03T10:23:29+01:00",
  "product": "Platform",
  "component": "SWT",
  "severity": "normal"
}