{
  "comments": [
    "latest pde.core/pde.ui/pde.build from head.\n\n1. Create an RCP product as descirbed in bug 84511.\n2. Unzip it.\n3. As a workaround to bug 84511, manually create a create a configuration/ \nsubdirectory into the eclipse root directory, and cut/paste the config.ini \nfile into that subdirectory.\n\n4. Try to run the product by double-clicking on eclipse.exe,\nyou will get the following error in the log:\n\n!SESSION Sat Feb 05 00:20:32 EST 2005 -----------------------------------------\n-\n!ENTRY org.eclipse.core.launcher 4 0 Feb 05, 2005 24:20:32.871\n!MESSAGE Exception launching the Eclipse Platform:\n!STACK\njava.io.FileNotFoundException: \nd:\\Temp\\eclipse\\plugins\\org.eclipse.osgi\\eclipse.properties (The system cannot \nfind the path specified)\n\tat java.io.FileInputStream.open(Native Method)\n\tat java.io.FileInputStream.\u003cinit\u003e(Unknown Source)\n\tat java.io.FileInputStream.\u003cinit\u003e(Unknown Source)\n\tat sun.net.www.protocol.file.FileURLConnection.connect(Unknown Source)\n\tat sun.net.www.protocol.file.FileURLConnection.getInputStream(Unknown \nSource)\n\tat java.net.URL.openStream(Unknown Source)\n\tat org.eclipse.core.launcher.Main.load(Main.java:1252)\n\tat org.eclipse.core.launcher.Main.loadProperties(Main.java:1224)\n\tat org.eclipse.core.launcher.Main.addBaseJars(Main.java:441)\n\tat org.eclipse.core.launcher.Main.getDevPath(Main.java:393)\n\tat org.eclipse.core.launcher.Main.getBootPath(Main.java:519)\n\tat org.eclipse.core.launcher.Main.basicRun(Main.java:250)\n\tat org.eclipse.core.launcher.Main.run(Main.java:817)\n\tat org.eclipse.core.launcher.Main.main(Main.java:801)\n\n\nNot sure why Main is not looking in org.eclipse.osgi_3.1.0 for the \neclipse.properties file.  Also not sure why that file is mandatory.\n\nObserve the generated config.ini file.  It is fine.",
    "There is a problem with the value specified in the osgi.framework property.\nIt seems that the startup and fwk do not like plaform URL as a way to specify\nthe fwk location.\n\nInstead I recommend that you simply don\u0027t specify a value for the fwk since the\nstartup.jar knows where to find it.\n\nI will check what are / should be the supported values for the fwk.\nJeff any idea?",
    "not generating the osgi.framework key solved the problem.\n\nThe value that I put in however was compliant with the comments in the \nconfig.ini that ships with eclipse.\n\nAnother format which the runtime recognizes when I generate a config.ini for \nthe runtime app is:\nosgi.framework\u003dfile:d:/Eclipse/plugins/org.eclipse.osgi_3.1.0/",
    "*** Bug 91968 has been marked as a duplicate of this bug. ***",
    "I\u0027m experiencing this same problem when trying to debug a workbench instance.  I\nstarted with a new workspace, using 3.1M6.  I imported the plugins I wanted to\ndebug and generated a new Eclipse Application launch configuration with all\ndefaults.  When I launch this configuration, I get\njava.io.FileNotFoundException:\n/home/tools/eclipse/3.1M6/eclipse/plugins/org.eclipse.osgi_3.1.0.jar/eclipse.properties\n(Not a directory).",
    "comment 4 is a separate (minor) PDE issue.  I\u0027ll open a bug report for it.",
    "*** Bug 93177 has been marked as a duplicate of this bug. ***"
  ],
  "commentCreationDates": [
    "2005-02-05T05:34:50+01:00",
    "2005-02-07T14:32:24+01:00",
    "2005-02-07T16:05:31+01:00",
    "2005-04-20T00:11:02+02:00",
    "2005-04-28T21:53:56+02:00",
    "2005-04-28T22:13:28+02:00",
    "2005-04-29T17:49:27+02:00"
  ],
  "traces": [
    {
      "exceptionType": "java.io.FileNotFoundException",
      "message": "d:\\Temp\\eclipse\\plugins\\org.eclipse.osgi\\eclipse.properties (The system cannot  find the path specified)",
      "elements": [
        {
          "method": "java.io.FileInputStream.open",
          "source": "Native Method"
        },
        {
          "method": "java.io.FileInputStream.\u003cinit\u003e",
          "source": "Unknown Source"
        },
        {
          "method": "java.io.FileInputStream.\u003cinit\u003e",
          "source": "Unknown Source"
        },
        {
          "method": "sun.net.www.protocol.file.FileURLConnection.connect",
          "source": "Unknown Source"
        },
        {
          "method": "sun.net.www.protocol.file.FileURLConnection.getInputStream",
          "source": "Unknown  Source"
        },
        {
          "method": "java.net.URL.openStream",
          "source": "Unknown Source"
        },
        {
          "method": "org.eclipse.core.launcher.Main.load",
          "source": "Main.java:1252"
        },
        {
          "method": "org.eclipse.core.launcher.Main.loadProperties",
          "source": "Main.java:1224"
        },
        {
          "method": "org.eclipse.core.launcher.Main.addBaseJars",
          "source": "Main.java:441"
        },
        {
          "method": "org.eclipse.core.launcher.Main.getDevPath",
          "source": "Main.java:393"
        },
        {
          "method": "org.eclipse.core.launcher.Main.getBootPath",
          "source": "Main.java:519"
        },
        {
          "method": "org.eclipse.core.launcher.Main.basicRun",
          "source": "Main.java:250"
        },
        {
          "method": "org.eclipse.core.launcher.Main.run",
          "source": "Main.java:817"
        },
        {
          "method": "org.eclipse.core.launcher.Main.main",
          "source": "Main.java:801"
        }
      ],
      "number": 0,
      "commentIndex": 0,
      "bugId": "84512",
      "date": "2005-02-05T05:34:50+01:00",
      "product": "Platform",
      "component": "Runtime",
      "severity": "normal"
    }
  ],
  "groupId": "84512",
  "bugId": "84512",
  "date": "2005-02-05T05:34:50+01:00",
  "product": "Platform",
  "component": "Runtime",
  "severity": "normal"
}