{
  "comments": [
    "Platform:-\nWin2000\nIntegration Build 0123\nJDK 1.3.1_02\n \nI tried a couple of things:-\na.  selecting the code in my source code view and selecting \"Display\" on the \ncontext menu\nb.  entering expression like \"action.length()\" in the Display view, highlight, \nand selecting display or inspect on the menu\n\nAll came up with a popup window that says ClassNotFoundException.  I can see\nvariables, and other that this, debugging seems to be working.\n\nCouldn\u0027t find any log files, but my remote application console has an exception \nstack trace...\n\n\njava.lang.ClassNotFoundException: com.nova.web.transaction.form.CodeSnippet_6\n        at com.evermind._cl.findClass(.:374)\n        at java.lang.ClassLoader.loadClass(Unknown Source)\n        at java.lang.ClassLoader.loadClass(Unknown Source)\n        at java.lang.ClassLoader.loadClassInternal(Unknown Source)\n        at java.lang.Class.forName0(Native Method)\n        at java.lang.Class.forName(Unknown Source)\n        at com.nova.web.transaction.form.CashTransactionFormSaveAction.perform(C\nashTransactionFormSaveAction.java:160)\n        at org.apache.struts.action.ActionServlet.processActionPerform(ActionSer\nvlet.java:1787)\n        at org.apache.struts.action.ActionServlet.process(ActionServlet.java:158\n6)\n        at org.apache.struts.action.ActionServlet.doPost(ActionServlet.java:510)\n\n        at javax.servlet.http.HttpServlet.service(HttpServlet.java:211)\n        at javax.servlet.http.HttpServlet.service(HttpServlet.java:309)\n        at javax.servlet.http.HttpServlet.service(HttpServlet.java:336)\n        at com.evermind._bxb._crd(.:501)\n        at com.evermind._bxb._ukb(.:170)\n        at com.evermind._cn._uab(.:576)\n        at com.evermind._cn._fm(.:189)\n        at com.evermind._bs.run(.:62)",
    "\n\n*** This bug has been marked as a duplicate of 1546 ***"
  ],
  "commentCreationDates": [
    "2002-01-25T17:37:22+01:00",
    "2002-01-28T15:51:36+01:00"
  ],
  "traces": [
    {
      "exceptionType": "java.lang.ClassNotFoundException",
      "message": "com.nova.web.transaction.form.CodeSnippet_6",
      "elements": [
        {
          "method": "com.evermind._cl.findClass",
          "source": ".:374"
        },
        {
          "method": "java.lang.ClassLoader.loadClass",
          "source": "Unknown Source"
        },
        {
          "method": "java.lang.ClassLoader.loadClass",
          "source": "Unknown Source"
        },
        {
          "method": "java.lang.ClassLoader.loadClassInternal",
          "source": "Unknown Source"
        },
        {
          "method": "java.lang.Class.forName0",
          "source": "Native Method"
        },
        {
          "method": "java.lang.Class.forName",
          "source": "Unknown Source"
        },
        {
          "method": "com.nova.web.transaction.form.CashTransactionFormSaveAction.perform",
          "source": "C ashTransactionFormSaveAction.java:160"
        },
        {
          "method": "org.apache.struts.action.ActionServlet.processActionPerform",
          "source": "ActionSer vlet.java:1787"
        },
        {
          "method": "org.apache.struts.action.ActionServlet.process",
          "source": "ActionServlet.java:158 6"
        },
        {
          "method": "org.apache.struts.action.ActionServlet.doPost",
          "source": "ActionServlet.java:510"
        },
        {
          "method": "javax.servlet.http.HttpServlet.service",
          "source": "HttpServlet.java:211"
        },
        {
          "method": "javax.servlet.http.HttpServlet.service",
          "source": "HttpServlet.java:309"
        },
        {
          "method": "javax.servlet.http.HttpServlet.service",
          "source": "HttpServlet.java:336"
        },
        {
          "method": "com.evermind._bxb._crd",
          "source": ".:501"
        },
        {
          "method": "com.evermind._bxb._ukb",
          "source": ".:170"
        },
        {
          "method": "com.evermind._cn._uab",
          "source": ".:576"
        },
        {
          "method": "com.evermind._cn._fm",
          "source": ".:189"
        },
        {
          "method": "com.evermind._bs.run",
          "source": ".:62"
        }
      ],
      "number": 0,
      "commentIndex": 0,
      "bugId": "8488",
      "duplicateId": "1546",
      "date": "2002-01-25T17:37:22+01:00",
      "product": "JDT",
      "component": "Debug",
      "severity": "normal"
    }
  ],
  "groupId": "1546",
  "bugId": "8488",
  "duplicateId": "1546",
  "date": "2002-01-25T17:37:22+01:00",
  "product": "JDT",
  "component": "Debug",
  "severity": "normal"
}