{
  "comments": [
    "Test build: I20050212-0918 (on relengbuildserv)\n\nI am unable to run a headless antRunner to run the JUnit and performance tests \nin a test build.\n\nSteps to reproduce:\n\n1.  install eclipse from test build\n2.  execute java -jar startup.jar -application org.eclipse.ant.core.antRunner\n\nA .log file is written in the configuration directory with the following \ncontent:\n\n!SESSION 2005-02-12 11:04:03.661 ----------------------------------------------\n-\neclipse.buildId\u003dI20050212-0918\njava.version\u003d1.4.2_06\njava.vendor\u003dSun Microsystems Inc.\nBootLoader constants: OS\u003dlinux, ARCH\u003dx86, WS\u003dgtk, NL\u003den_US\nFramework arguments:  -application org.eclipse.ant.core.antRunner -\nf ../test.xml\nCommand-line arguments:  -application org.eclipse.ant.core.antRunner -\nf ../test.xml\n\n!ENTRY org.eclipse.osgi 2005-02-12 11:04:03.662\n!MESSAGE Bundle org.eclipse.core.runtime@2:start not found.\n\n!ENTRY org.eclipse.osgi 2005-02-12 11:04:03.664\n!MESSAGE Bundle org.eclipse.update.configurator@3:start not found.\n\n!ENTRY org.eclipse.osgi 2005-02-12 11:04:03.678\n!MESSAGE Application error\n!STACK 1\njava.lang.IllegalStateException: Unable to acquire application service.\n        at org.eclipse.core.runtime.adaptor.EclipseStarter.run\n(EclipseStarter.java:323)\n        at org.eclipse.core.runtime.adaptor.EclipseStarter.run\n(EclipseStarter.java:149)\n        at sun.reflect.NativeMethodAccessorImpl.invoke0(Native Method)\n        at sun.reflect.NativeMethodAccessorImpl.invoke\n(NativeMethodAccessorImpl.java:39)\n        at sun.reflect.DelegatingMethodAccessorImpl.invoke\n(DelegatingMethodAccessorImpl.java:25)\n        at java.lang.reflect.Method.invoke(Method.java:324)\n        at org.eclipse.core.launcher.Main.basicRun(Main.java:261)\n        at org.eclipse.core.launcher.Main.run(Main.java:817)\n        at org.eclipse.core.launcher.Main.main(Main.java:801)\n\"1108224243285.log\" 27L, 1393C                                1,1           All",
    "Sorry for this false alarm.  This looks like a case of bad build timing on my part."
  ],
  "commentCreationDates": [
    "2005-02-12T16:10:49+01:00",
    "2005-02-13T14:10:07+01:00"
  ],
  "traces": [
    {
      "exceptionType": "java.lang.IllegalStateException",
      "message": "Unable to acquire application service.",
      "elements": [
        {
          "method": "org.eclipse.core.runtime.adaptor.EclipseStarter.run",
          "source": "EclipseStarter.java:323"
        },
        {
          "method": "org.eclipse.core.runtime.adaptor.EclipseStarter.run",
          "source": "EclipseStarter.java:149"
        },
        {
          "method": "sun.reflect.NativeMethodAccessorImpl.invoke0",
          "source": "Native Method"
        },
        {
          "method": "sun.reflect.NativeMethodAccessorImpl.invoke",
          "source": "NativeMethodAccessorImpl.java:39"
        },
        {
          "method": "sun.reflect.DelegatingMethodAccessorImpl.invoke",
          "source": "DelegatingMethodAccessorImpl.java:25"
        },
        {
          "method": "java.lang.reflect.Method.invoke",
          "source": "Method.java:324"
        },
        {
          "method": "org.eclipse.core.launcher.Main.basicRun",
          "source": "Main.java:261"
        },
        {
          "method": "org.eclipse.core.launcher.Main.run",
          "source": "Main.java:817"
        },
        {
          "method": "org.eclipse.core.launcher.Main.main",
          "source": "Main.java:801"
        }
      ],
      "number": 0,
      "commentIndex": 0,
      "bugId": "85091",
      "date": "2005-02-12T16:10:49+01:00",
      "product": "Platform",
      "component": "Runtime",
      "severity": "blocker"
    }
  ],
  "groupId": "85091",
  "bugId": "85091",
  "date": "2005-02-12T16:10:49+01:00",
  "product": "Platform",
  "component": "Runtime",
  "severity": "blocker"
}