{
  "comments": [
    "- I had the GTK build running for a while then I installed the motif build and\nran it against the same workspace. \n- Then I opened my launch configs and edited the program args for my Runtime\nWorkbench config and didn\u0027t save.\n- I clicked on New to create a new launch config\n- I was prompted that I had unsaved changes, did I want to save?\n- Yes\n- NPE and didn\u0027t create new config\n\n!SESSION 2005-02-16 17:42:25.949 -----------------------------------------------\neclipse.buildId\u003dI20050215-2300\njava.version\u003d1.4.2_06\njava.vendor\u003dSun Microsystems Inc.\nBootLoader constants: OS\u003dlinux, ARCH\u003dx86, WS\u003dmotif, NL\u003den_US\nCommand-line arguments:  -os linux -ws motif -arch x86 -consoleLog -console\n-data /home/dj/target/head\n \n!ENTRY org.eclipse.ui 4 4 2005-02-16 17:42:25.951\n!MESSAGE Unhandled event loop exception\nUnhandled event loop exception\nReason:\n \n!ENTRY org.eclipse.ui 4 0 2005-02-16 17:42:25.952\n!MESSAGE java.lang.NullPointerException\n!STACK 0\njava.lang.NullPointerException\n        at\norg.eclipse.debug.internal.ui.launchConfigurations.CreateLaunchConfigurationAction.performAction(CreateLaunchConfigurationAction.java:63)\n        at\norg.eclipse.debug.internal.ui.launchConfigurations.AbstractLaunchConfigurationAction$1.run(AbstractLaunchConfigurationAction.java:103)\n        at org.eclipse.swt.custom.BusyIndicator.showWhile(BusyIndicator.java:69)\n        at\norg.eclipse.debug.internal.ui.launchConfigurations.AbstractLaunchConfigurationAction.run(AbstractLaunchConfigurationAction.java:106)\n        at\norg.eclipse.debug.internal.ui.launchConfigurations.LaunchConfigurationsDialog$ButtonActionNew.run(LaunchConfigurationsDialog.java:1464)\n        at\norg.eclipse.debug.internal.ui.launchConfigurations.LaunchConfigurationsDialog$1.widgetSelected(LaunchConfigurationsDialog.java:1433)\n        at org.eclipse.swt.widgets.TypedListener.handleEvent(TypedListener.java:89)\n        at org.eclipse.swt.widgets.EventTable.sendEvent(EventTable.java:82)\n        at org.eclipse.swt.widgets.Widget.sendEvent(Widget.java:740)\n        at org.eclipse.swt.widgets.Display.runDeferredEvents(Display.java:2960)\n        at org.eclipse.swt.widgets.Display.readAndDispatch(Display.java:2660)\n        at org.eclipse.jface.window.Window.runEventLoop(Window.java:718)\n        at org.eclipse.jface.window.Window.open(Window.java:696)\n        at\norg.eclipse.debug.internal.ui.launchConfigurations.LaunchConfigurationsDialog.open(LaunchConfigurationsDialog.java:431)\n        at org.eclipse.debug.ui.DebugUITools$1.run(DebugUITools.java:356)\n        at org.eclipse.swt.custom.BusyIndicator.showWhile(BusyIndicator.java:69)\n        at\norg.eclipse.debug.ui.DebugUITools.openLaunchConfigurationDialogOnGroup(DebugUITools.java:360)\n        at\norg.eclipse.debug.ui.DebugUITools.openLaunchConfigurationDialogOnGroup(DebugUITools.java:302)\n        at\norg.eclipse.debug.ui.actions.OpenLaunchDialogAction.run(OpenLaunchDialogAction.java:80)\n        at org.eclipse.jface.action.Action.runWithEvent(Action.java:1003)\n        at\norg.eclipse.jface.action.ActionContributionItem.handleWidgetSelection(ActionContributionItem.java:557)\n        at\norg.eclipse.jface.action.ActionContributionItem.access$2(ActionContributionItem.java:507)\n        at\norg.eclipse.jface.action.ActionContributionItem$6.handleEvent(ActionContributionItem.java:421)\n        at org.eclipse.swt.widgets.EventTable.sendEvent(EventTable.java:82)\n        at org.eclipse.swt.widgets.Widget.sendEvent(Widget.java:740)\n        at org.eclipse.swt.widgets.Display.runDeferredEvents(Display.java:2960)\n        at org.eclipse.swt.widgets.Display.readAndDispatch(Display.java:2660)\n        at org.eclipse.ui.internal.Workbench.runEventLoop(Workbench.java:1612)\n        at org.eclipse.ui.internal.Workbench.runUI(Workbench.java:1578)\n        at\norg.eclipse.ui.internal.Workbench.createAndRunWorkbench(Workbench.java:293)\n        at org.eclipse.ui.PlatformUI.createAndRunWorkbench(PlatformUI.java:144)\n        at org.eclipse.ui.internal.ide.IDEApplication.run(IDEApplication.java:102)\n        at\norg.eclipse.core.internal.runtime.PlatformActivator$1.run(PlatformActivator.java:228)\n        at\norg.eclipse.core.runtime.adaptor.EclipseStarter.run(EclipseStarter.java:333)\n        at\norg.eclipse.core.runtime.adaptor.EclipseStarter.run(EclipseStarter.java:150)\n        at sun.reflect.NativeMethodAccessorImpl.invoke0(Native Method)\n        at\nsun.reflect.NativeMethodAccessorImpl.invoke(NativeMethodAccessorImpl.java:39)\n        at\nsun.reflect.DelegatingMethodAccessorImpl.invoke(DelegatingMethodAccessorImpl.java:25)\n        at java.lang.reflect.Method.invoke(Method.java:324)\n        at org.eclipse.core.launcher.Main.invokeFramework(Main.java:268)\n        at org.eclipse.core.launcher.Main.basicRun(Main.java:260)\n        at org.eclipse.core.launcher.Main.run(Main.java:887)\n        at org.eclipse.core.launcher.Main.main(Main.java:871)\njava.lang.NullPointerException\nbash-2.05b$",
    "I\u0027m not able to reproduce with similar steps. Can you?",
    "(Of course, I\u0027m on XP).",
    "I\u0027ll try with a fresh workspace, etc.\n\nNote that I just hit the \"close\" button on the dialog (yes I left my machine on\nlast night :-) and I got a \"Discard Changes?\" dialog with the following message:\n\nThe configuration \"Runtime Workbench (motif)\" has unsaved changes that CANNOT be\nsaved because of the following error: Launch Configuration already exists with\nthis name \nDo you wish to discard changes?",
    "Got it. Here are the exact steps:\n\n- start eclipse GTK on fresh workspace\n- go to Debug perspective\n- create a new launch config for a runtime workbench\n- in the \"Program Args\" add: \"-ws gtk\" \u003c- my launch config had this because it\nwas old\n- run the launch config\n- shut down runtime workbench\n- shut down eclipse\n- start eclipse MOTIF on the same workspace\n- go to Debug perspective\n- try to run launch config\n- won\u0027t work (because of the wrong WS)\n- configure launch config\n- change \"-ws gtk\" to \"-ws motif\"\n- modify the title to read \"New_configuration (motif)\"\n- don\u0027t save or apply yet\n- hit \"New\"\n- prompted for save\n- yes save changes\n\nGet the NPE and the problems as noted above. ",
    "Thanks :-)",
    "The GTK-motif switch is unnecessary. Steps can be reduced to:\n1 - select an existing launch config\n2 - change it\u0027s name\n3 - click new\n4 - say yes to save changes\n\nThe action tries to get the current selection but receives null and \"type\" variable is set to null -\u003e NPE. \nNot sure why the selection is being returned as null.",
    "Selection was not being maintained properly in the LaunchConfigurationView. Changing the name of a \nconfig actually deletes the old config (the current selection) and creates a brand new one w/o resetting \nthe selection.\nFixed in LaunchConfigurationView, reset the selection to the new one.",
    "Darin, please verify",
    "Verified."
  ],
  "commentCreationDates": [
    "2005-02-16T22:46:51+01:00",
    "2005-02-17T15:00:11+01:00",
    "2005-02-17T15:00:31+01:00",
    "2005-02-17T16:44:14+01:00",
    "2005-02-17T17:32:46+01:00",
    "2005-02-17T17:36:51+01:00",
    "2005-04-18T21:21:39+02:00",
    "2005-05-17T21:06:01+02:00",
    "2005-05-17T21:06:24+02:00",
    "2005-05-19T15:33:25+02:00"
  ],
  "traces": [
    {
      "exceptionType": "java.lang.NullPointerException",
      "elements": [
        {
          "method": "org.eclipse.debug.internal.ui.launchConfigurations.CreateLaunchConfigurationAction.performAction",
          "source": "CreateLaunchConfigurationAction.java:63"
        },
        {
          "method": "org.eclipse.debug.internal.ui.launchConfigurations.AbstractLaunchConfigurationAction$1.run",
          "source": "AbstractLaunchConfigurationAction.java:103"
        },
        {
          "method": "org.eclipse.swt.custom.BusyIndicator.showWhile",
          "source": "BusyIndicator.java:69"
        },
        {
          "method": "org.eclipse.debug.internal.ui.launchConfigurations.AbstractLaunchConfigurationAction.run",
          "source": "AbstractLaunchConfigurationAction.java:106"
        },
        {
          "method": "org.eclipse.debug.internal.ui.launchConfigurations.LaunchConfigurationsDialog$ButtonActionNew.run",
          "source": "LaunchConfigurationsDialog.java:1464"
        },
        {
          "method": "org.eclipse.debug.internal.ui.launchConfigurations.LaunchConfigurationsDialog$1.widgetSelected",
          "source": "LaunchConfigurationsDialog.java:1433"
        },
        {
          "method": "org.eclipse.swt.widgets.TypedListener.handleEvent",
          "source": "TypedListener.java:89"
        },
        {
          "method": "org.eclipse.swt.widgets.EventTable.sendEvent",
          "source": "EventTable.java:82"
        },
        {
          "method": "org.eclipse.swt.widgets.Widget.sendEvent",
          "source": "Widget.java:740"
        },
        {
          "method": "org.eclipse.swt.widgets.Display.runDeferredEvents",
          "source": "Display.java:2960"
        },
        {
          "method": "org.eclipse.swt.widgets.Display.readAndDispatch",
          "source": "Display.java:2660"
        },
        {
          "method": "org.eclipse.jface.window.Window.runEventLoop",
          "source": "Window.java:718"
        },
        {
          "method": "org.eclipse.jface.window.Window.open",
          "source": "Window.java:696"
        },
        {
          "method": "org.eclipse.debug.internal.ui.launchConfigurations.LaunchConfigurationsDialog.open",
          "source": "LaunchConfigurationsDialog.java:431"
        },
        {
          "method": "org.eclipse.debug.ui.DebugUITools$1.run",
          "source": "DebugUITools.java:356"
        },
        {
          "method": "org.eclipse.swt.custom.BusyIndicator.showWhile",
          "source": "BusyIndicator.java:69"
        },
        {
          "method": "org.eclipse.debug.ui.DebugUITools.openLaunchConfigurationDialogOnGroup",
          "source": "DebugUITools.java:360"
        },
        {
          "method": "org.eclipse.debug.ui.DebugUITools.openLaunchConfigurationDialogOnGroup",
          "source": "DebugUITools.java:302"
        },
        {
          "method": "org.eclipse.debug.ui.actions.OpenLaunchDialogAction.run",
          "source": "OpenLaunchDialogAction.java:80"
        },
        {
          "method": "org.eclipse.jface.action.Action.runWithEvent",
          "source": "Action.java:1003"
        },
        {
          "method": "org.eclipse.jface.action.ActionContributionItem.handleWidgetSelection",
          "source": "ActionContributionItem.java:557"
        },
        {
          "method": "org.eclipse.jface.action.ActionContributionItem.access$2",
          "source": "ActionContributionItem.java:507"
        },
        {
          "method": "org.eclipse.jface.action.ActionContributionItem$6.handleEvent",
          "source": "ActionContributionItem.java:421"
        },
        {
          "method": "org.eclipse.swt.widgets.EventTable.sendEvent",
          "source": "EventTable.java:82"
        },
        {
          "method": "org.eclipse.swt.widgets.Widget.sendEvent",
          "source": "Widget.java:740"
        },
        {
          "method": "org.eclipse.swt.widgets.Display.runDeferredEvents",
          "source": "Display.java:2960"
        },
        {
          "method": "org.eclipse.swt.widgets.Display.readAndDispatch",
          "source": "Display.java:2660"
        },
        {
          "method": "org.eclipse.ui.internal.Workbench.runEventLoop",
          "source": "Workbench.java:1612"
        },
        {
          "method": "org.eclipse.ui.internal.Workbench.runUI",
          "source": "Workbench.java:1578"
        },
        {
          "method": "org.eclipse.ui.internal.Workbench.createAndRunWorkbench",
          "source": "Workbench.java:293"
        },
        {
          "method": "org.eclipse.ui.PlatformUI.createAndRunWorkbench",
          "source": "PlatformUI.java:144"
        },
        {
          "method": "org.eclipse.ui.internal.ide.IDEApplication.run",
          "source": "IDEApplication.java:102"
        },
        {
          "method": "org.eclipse.core.internal.runtime.PlatformActivator$1.run",
          "source": "PlatformActivator.java:228"
        },
        {
          "method": "org.eclipse.core.runtime.adaptor.EclipseStarter.run",
          "source": "EclipseStarter.java:333"
        },
        {
          "method": "org.eclipse.core.runtime.adaptor.EclipseStarter.run",
          "source": "EclipseStarter.java:150"
        },
        {
          "method": "sun.reflect.NativeMethodAccessorImpl.invoke0",
          "source": "Native Method"
        },
        {
          "method": "sun.reflect.NativeMethodAccessorImpl.invoke",
          "source": "NativeMethodAccessorImpl.java:39"
        },
        {
          "method": "sun.reflect.DelegatingMethodAccessorImpl.invoke",
          "source": "DelegatingMethodAccessorImpl.java:25"
        },
        {
          "method": "java.lang.reflect.Method.invoke",
          "source": "Method.java:324"
        },
        {
          "method": "org.eclipse.core.launcher.Main.invokeFramework",
          "source": "Main.java:268"
        },
        {
          "method": "org.eclipse.core.launcher.Main.basicRun",
          "source": "Main.java:260"
        },
        {
          "method": "org.eclipse.core.launcher.Main.run",
          "source": "Main.java:887"
        },
        {
          "method": "org.eclipse.core.launcher.Main.main",
          "source": "Main.java:871"
        }
      ],
      "number": 0,
      "commentIndex": 0,
      "bugId": "85612",
      "date": "2005-02-16T22:46:51+01:00",
      "product": "Platform",
      "component": "Debug",
      "severity": "normal"
    }
  ],
  "groupId": "85612",
  "bugId": "85612",
  "date": "2005-02-16T22:46:51+01:00",
  "product": "Platform",
  "component": "Debug",
  "severity": "normal"
}