{
  "comments": [
    "I hit this when I tried to make an extra long Main-Class name for an app client\nthat needed to wrap to the next line.\n\n*** ERROR ***: Tue Feb 22 01:54:28 EST 2005   \norg.eclipse.jst.j2ee.commonarchivecore.internal.exception.ManifestExcepti\non: IWAE0015E An IOException occurred reading the manifest in archive:\nAnAppClient.jar\n    !Stack_trace_of_nested_exce!\n    java.io.IOException: invalid header field\n        at java.util.jar.Attributes.read(Attributes.java(Compiled Code))\n        at java.util.jar.Manifest.read(Manifest.java:181)\n        at java.util.jar.Manifest.\u003cinit\u003e(Manifest.java:66)\n        at\norg.eclipse.jst.j2ee.commonarchivecore.internal.helpers.ArchiveManifestImpl.\u003cinit\u003e(ArchiveManifestImpl.java:4\n6)\n        at\norg.eclipse.jst.j2ee.commonarchivecore.internal.impl.ArchiveImpl.makeManifest(ArchiveImpl.java:1071)\n        at\norg.eclipse.jst.j2ee.commonarchivecore.internal.impl.ArchiveImpl.getManifest(ArchiveImpl.java:843)\n        at\norg.eclipse.jst.j2ee.internal.validation.UIEarValidator.validateManifestClasspath(UIEarValidator.java:321)\n        at\norg.eclipse.jst.j2ee.internal.validation.UIEarValidator.validateManifests(UIEarValidator.java:287)\n        at\norg.eclipse.jst.j2ee.internal.validation.UIEarValidator.validate(UIEarValidator.java:239)\n        at\norg.eclipse.wst.validation.core.ValidatorLauncher.start(ValidatorLauncher.java:86)\n        at\norg.eclipse.wst.validation.internal.operations.ValidationOperation.launchValidator(ValidationOperation.java:1\n246)\n        at\norg.eclipse.wst.validation.internal.operations.ValidationOperation.internalValidate(ValidationOperation.java:\n1073)\n        at\norg.eclipse.wst.validation.internal.operations.ValidationOperation.validate(ValidationOperation.java:991)\n        at\norg.eclipse.wst.validation.internal.operations.ValidationOperation.run(ValidationOperation.java:703)\n        at\norg.eclipse.wst.validation.internal.operations.ValidationBuilder.performFullBuild(ValidationBuilder.java:254)\n\n        at\norg.eclipse.wst.validation.internal.operations.ValidationBuilder.performFullBuildForReferencedProjectChanged(\nValidationBuilder.java:242)\n        at\norg.eclipse.wst.validation.internal.operations.ValidationBuilder.build(ValidationBuilder.java:195)\n        at\norg.eclipse.core.internal.events.BuildManager$2.run(BuildManager.java:581)\n        at\norg.eclipse.core.internal.runtime.InternalPlatform.run(InternalPlatform.java(Compiled\nCode))\n        at org.eclipse.core.runtime.Platform.run(Platform.java(Inlined Compiled\nCode))\n        at\norg.eclipse.core.internal.events.BuildManager.basicBuild(BuildManager.java(Compiled\nCode))\n        at\norg.eclipse.core.internal.events.BuildManager.basicBuild(BuildManager.java(Compiled\nCode))\n        at\norg.eclipse.core.internal.events.BuildManager$1.run(BuildManager.java:227)\n        at\norg.eclipse.core.internal.runtime.InternalPlatform.run(InternalPlatform.java(Inlined\nCompiled Code))\n        at org.eclipse.core.runtime.Platform.run(Platform.java(Compiled Code))\n        at\norg.eclipse.core.internal.events.BuildManager.basicBuild(BuildManager.java:230)\n        at\norg.eclipse.core.internal.events.BuildManager.basicBuildLoop(BuildManager.java:249)\n        at\norg.eclipse.core.internal.events.BuildManager.build(BuildManager.java:278)\n        at\norg.eclipse.core.internal.events.AutoBuildJob.doBuild(AutoBuildJob.java:138)\n        at org.eclipse.core.internal.events.AutoBuildJob.run(AutoBuildJob.java:199)\n        at org.eclipse.core.internal.jobs.Worker.run(Worker.java:67)\n\n!ENTRY org.eclipse.wst.validation 4 0 2005-02-22 01:54:28.551\n!MESSAGE\n*** ERROR ***: Tue Feb 22 01:54:28 EST 2005   \norg.eclipse.wst.validation.core.ValidationException: IWAE0053E An interna\nl error has occurred running validation on project:AnAppClient, check the log\nfile for details\n\n!ENTRY org.eclipse.wst.validation 4 0 2005-02-22 01:54:28.551\n!MESSAGE\n*** ERROR ***: Tue Feb 22 01:54:28 EST 2005   \norg.eclipse.jst.j2ee.commonarchivecore.internal.exception.ManifestExcepti\non: IWAE0015E An IOException occurred reading the manifest in archive:\nAnAppClient.jar",
    "currently we don\u0027t have validator for Manifest file. push to M5.",
    "Changed Version field given new release numbering.\n",
    "move to m8",
    "\n\n*** This bug has been marked as a duplicate of 86096 ***",
    "closig."
  ],
  "commentCreationDates": [
    "2005-02-22T06:55:18+01:00",
    "2005-04-18T19:28:18+02:00",
    "2005-06-15T07:22:52+02:00",
    "2005-07-11T18:50:47+02:00",
    "2005-08-25T18:30:56+02:00",
    "2005-09-19T17:19:30+02:00"
  ],
  "traces": [
    {
      "exceptionType": "java.io.IOException",
      "message": "invalid header field",
      "elements": [
        {
          "method": "java.util.jar.Attributes.read",
          "source": "Attributes.java(Compiled Code)"
        },
        {
          "method": "java.util.jar.Manifest.read",
          "source": "Manifest.java:181"
        },
        {
          "method": "java.util.jar.Manifest.\u003cinit\u003e",
          "source": "Manifest.java:66"
        },
        {
          "method": "org.eclipse.jst.j2ee.commonarchivecore.internal.helpers.ArchiveManifestImpl.\u003cinit\u003e",
          "source": "ArchiveManifestImpl.java:4 6"
        },
        {
          "method": "org.eclipse.jst.j2ee.commonarchivecore.internal.impl.ArchiveImpl.makeManifest",
          "source": "ArchiveImpl.java:1071"
        },
        {
          "method": "org.eclipse.jst.j2ee.commonarchivecore.internal.impl.ArchiveImpl.getManifest",
          "source": "ArchiveImpl.java:843"
        },
        {
          "method": "org.eclipse.jst.j2ee.internal.validation.UIEarValidator.validateManifestClasspath",
          "source": "UIEarValidator.java:321"
        },
        {
          "method": "org.eclipse.jst.j2ee.internal.validation.UIEarValidator.validateManifests",
          "source": "UIEarValidator.java:287"
        },
        {
          "method": "org.eclipse.jst.j2ee.internal.validation.UIEarValidator.validate",
          "source": "UIEarValidator.java:239"
        },
        {
          "method": "org.eclipse.wst.validation.core.ValidatorLauncher.start",
          "source": "ValidatorLauncher.java:86"
        },
        {
          "method": "org.eclipse.wst.validation.internal.operations.ValidationOperation.launchValidator",
          "source": "ValidationOperation.java:1 246"
        },
        {
          "method": "org.eclipse.wst.validation.internal.operations.ValidationOperation.internalValidate",
          "source": "ValidationOperation.java: 1073"
        },
        {
          "method": "org.eclipse.wst.validation.internal.operations.ValidationOperation.validate",
          "source": "ValidationOperation.java:991"
        },
        {
          "method": "org.eclipse.wst.validation.internal.operations.ValidationOperation.run",
          "source": "ValidationOperation.java:703"
        },
        {
          "method": "org.eclipse.wst.validation.internal.operations.ValidationBuilder.performFullBuild",
          "source": "ValidationBuilder.java:254"
        },
        {
          "method": "org.eclipse.wst.validation.internal.operations.ValidationBuilder.performFullBuildForReferencedProjectChanged",
          "source": " ValidationBuilder.java:242"
        },
        {
          "method": "org.eclipse.wst.validation.internal.operations.ValidationBuilder.build",
          "source": "ValidationBuilder.java:195"
        },
        {
          "method": "org.eclipse.core.internal.events.BuildManager$2.run",
          "source": "BuildManager.java:581"
        },
        {
          "method": "org.eclipse.core.internal.runtime.InternalPlatform.run",
          "source": "InternalPlatform.java(Compiled Code)"
        },
        {
          "method": "org.eclipse.core.runtime.Platform.run",
          "source": "Platform.java(Inlined Compiled Code)"
        },
        {
          "method": "org.eclipse.core.internal.events.BuildManager.basicBuild",
          "source": "BuildManager.java(Compiled Code)"
        },
        {
          "method": "org.eclipse.core.internal.events.BuildManager.basicBuild",
          "source": "BuildManager.java(Compiled Code)"
        },
        {
          "method": "org.eclipse.core.internal.events.BuildManager$1.run",
          "source": "BuildManager.java:227"
        },
        {
          "method": "org.eclipse.core.internal.runtime.InternalPlatform.run",
          "source": "InternalPlatform.java(Inlined Compiled Code)"
        },
        {
          "method": "org.eclipse.core.runtime.Platform.run",
          "source": "Platform.java(Compiled Code)"
        },
        {
          "method": "org.eclipse.core.internal.events.BuildManager.basicBuild",
          "source": "BuildManager.java:230"
        },
        {
          "method": "org.eclipse.core.internal.events.BuildManager.basicBuildLoop",
          "source": "BuildManager.java:249"
        },
        {
          "method": "org.eclipse.core.internal.events.BuildManager.build",
          "source": "BuildManager.java:278"
        },
        {
          "method": "org.eclipse.core.internal.events.AutoBuildJob.doBuild",
          "source": "AutoBuildJob.java:138"
        },
        {
          "method": "org.eclipse.core.internal.events.AutoBuildJob.run",
          "source": "AutoBuildJob.java:199"
        },
        {
          "method": "org.eclipse.core.internal.jobs.Worker.run",
          "source": "Worker.java:67"
        }
      ],
      "number": 0,
      "commentIndex": 0,
      "bugId": "86099",
      "duplicateId": "86096",
      "date": "2005-02-22T06:55:18+01:00",
      "product": "Web Tools",
      "component": "jst.j2ee",
      "severity": "normal"
    }
  ],
  "groupId": "86096",
  "bugId": "86099",
  "duplicateId": "86096",
  "date": "2005-02-22T06:55:18+01:00",
  "product": "Web Tools",
  "component": "jst.j2ee",
  "severity": "normal"
}