{
  "comments": [
    "0129\n\n1. Unzip eclipse into c:\\eclipse0129\n2. Launch eclipse - this should work fine. (I usually create a shortcut and \nlaunch from there, but you can use the command line)\n3. exit \n4. Rename the directory from eclipse0129 to eclipsex0129.\n5. Launch eclipse (you need to create a new shortcut because the directory name \nis now different. if you use the command line you can use the same one)\nThe splash screen comes up and then down almost immediately.  A message is \nwritten, but it disappears.\n\nThe problem appears to be absolute paths in the install directory - if I \ndiscard the files immediately in the install directory, eclipse works as \nexpected again.\n\nI realize this is being replaced in the 2.0 update solution.  It would be good \nif we avoided this particular failure case.\n\nStack trace contents follow\nC:\\eclipsex0129\\eclipse\u003ec:\\jdk1.4\\bin\\java -cp startup.jar org.eclipse.core.laun\ncher.UIMain\nException launching the Eclipse Platform UI:\njava.lang.reflect.InvocationTargetException\n        at sun.reflect.NativeMethodAccessorImpl.invoke0(Native Method)\n        at sun.reflect.NativeMethodAccessorImpl.invoke(NativeMethodAccessorImpl.\njava:39)\n        at sun.reflect.DelegatingMethodAccessorImpl.invoke(DelegatingMethodAcces\nsorImpl.java:25)\n        at java.lang.reflect.Method.invoke(Method.java:324)\n        at org.eclipse.core.launcher.Main.basicRun(Main.java:151)\n        at org.eclipse.core.launcher.Main.run(Main.java:502)\n        at org.eclipse.core.launcher.UIMain.main(UIMain.java:52)\nCaused by: java.lang.reflect.InvocationTargetException\n        at sun.reflect.NativeMethodAccessorImpl.invoke0(Native Method)\n        at sun.reflect.NativeMethodAccessorImpl.invoke(NativeMethodAccessorImpl.\njava:39)\n        at sun.reflect.DelegatingMethodAccessorImpl.invoke(DelegatingMethodAcces\nsorImpl.java:25)\n        at java.lang.reflect.Method.invoke(Method.java:324)\n        at org.eclipse.core.internal.boot.InternalBootLoader.startup(InternalBoo\ntLoader.java:996)\n        at org.eclipse.core.internal.boot.InternalBootLoader.run(InternalBootLoa\nder.java:883)\n        at org.eclipse.core.boot.BootLoader.run(BootLoader.java:321)\n        ... 7 more\nCaused by: java.lang.NullPointerException\n        at org.eclipse.core.internal.runtime.InternalPlatform.activateDefaultPlu\ngins(InternalPlatform.java:112)\n        at org.eclipse.core.internal.runtime.InternalPlatform.loaderStartup(Inte\nrnalPlatform.java:594)\n        ... 14 more",
    "This one is in fact introduced by the 2.0 code that is now in core boot. The \nplatform.cfg file is the cached platform configuration in support of the \nmultiple launch points (ie. is the \"logical\" definition of the install tree \n(which directories, what mix of features/ plugins)). \n\nSo in the general case, this file can exist anywhere and need not be inside the \ninstall/ directory (so the paths need to be absolute). However, I agree that in \nthe simple default case (which is what we are using right now) this introduces \na legitimate problem.\n\nTransfering the defect to Update component. Will look at fixing the default \ncase.",
    "Fixed in split stream by using platform:/base/ URL instead of file: URL for the \ndefault configuration. This makes it relative to BootLoader that is running.\n\nWill release into HEAD after additional testing (is part of a larger wad of \nchanges)",
    "released into HEAD"
  ],
  "commentCreationDates": [
    "2002-01-30T17:25:23+01:00",
    "2002-01-31T13:40:44+01:00",
    "2002-01-31T16:30:56+01:00",
    "2002-01-31T21:16:03+01:00"
  ],
  "traces": [
    {
      "exceptionType": "java.lang.reflect.InvocationTargetException",
      "elements": [
        {
          "method": "sun.reflect.NativeMethodAccessorImpl.invoke0",
          "source": "Native Method"
        },
        {
          "method": "sun.reflect.NativeMethodAccessorImpl.invoke",
          "source": "NativeMethodAccessorImpl. java:39"
        },
        {
          "method": "sun.reflect.DelegatingMethodAccessorImpl.invoke",
          "source": "DelegatingMethodAcces sorImpl.java:25"
        },
        {
          "method": "java.lang.reflect.Method.invoke",
          "source": "Method.java:324"
        },
        {
          "method": "org.eclipse.core.launcher.Main.basicRun",
          "source": "Main.java:151"
        },
        {
          "method": "org.eclipse.core.launcher.Main.run",
          "source": "Main.java:502"
        },
        {
          "method": "org.eclipse.core.launcher.UIMain.main",
          "source": "UIMain.java:52"
        }
      ],
      "causedBy": {
        "exceptionType": "java.lang.reflect.InvocationTargetException",
        "elements": [
          {
            "method": "sun.reflect.NativeMethodAccessorImpl.invoke0",
            "source": "Native Method"
          },
          {
            "method": "sun.reflect.NativeMethodAccessorImpl.invoke",
            "source": "NativeMethodAccessorImpl. java:39"
          },
          {
            "method": "sun.reflect.DelegatingMethodAccessorImpl.invoke",
            "source": "DelegatingMethodAcces sorImpl.java:25"
          },
          {
            "method": "java.lang.reflect.Method.invoke",
            "source": "Method.java:324"
          },
          {
            "method": "org.eclipse.core.internal.boot.InternalBootLoader.startup",
            "source": "InternalBoo tLoader.java:996"
          },
          {
            "method": "org.eclipse.core.internal.boot.InternalBootLoader.run",
            "source": "InternalBootLoa der.java:883"
          },
          {
            "method": "org.eclipse.core.boot.BootLoader.run",
            "source": "BootLoader.java:321"
          }
        ],
        "causedBy": {
          "exceptionType": "java.lang.NullPointerException",
          "elements": [
            {
              "method": "org.eclipse.core.internal.runtime.InternalPlatform.activateDefaultPlugins",
              "source": "InternalPlatform.java:112"
            },
            {
              "method": "org.eclipse.core.internal.runtime.InternalPlatform.loaderStartup",
              "source": "Inte rnalPlatform.java:594"
            }
          ],
          "number": 0,
          "commentIndex": 0
        },
        "number": 0,
        "commentIndex": 0
      },
      "number": 0,
      "commentIndex": 0,
      "bugId": "8768",
      "date": "2002-01-30T17:25:23+01:00",
      "product": "Platform",
      "component": "Update",
      "severity": "normal"
    }
  ],
  "groupId": "8768",
  "bugId": "8768",
  "date": "2002-01-30T17:25:23+01:00",
  "product": "Platform",
  "component": "Update",
  "severity": "normal"
}