{
  "comments": [
    "I tried downloading Eclipse 3.0.2, along with some other updates available at \nyour site (EMF, GDT, Visual Editors).  On completion of the download, I was \ninformed that I needed to shutdown the platform and restart.  When I did that \nI was greeted with a popup message \"An error has occurred. See the log file \nc:\\Dev\\Eclipse\\configuration\\nnnnnnnnnn.log\".  After reading the log file, \nwhich said that there was an \"ID\" missing, I thought that maybe my \"MyEclipse\" \ninstallation had gotten in the way somehow.  However, when I uninstalled \nMyEclipse, Eclipse just gave me the same error message.  I\u0027ve included the \ncontents of the latest version of the log file below.\n\nClearly this is a very serious problem: I can\u0027t even start my Eclipse program \nin order to revert to my previous version, which was 3.0.1.  It looks like I \nwill have to completely reinstall my Eclipse, along with all of the other plug-\nins I have added over time.  Sorry, but this is simply not acceptable!\n\nDavid McLeod\n\n-----------------  LOG FILE ATTACHED HERE --------------\n!SESSION Mar 24, 2005 17:55:10.718 --------------------------------------------\n-\neclipse.buildId\u003dM200409161125\njava.version\u003d1.5.0_01\njava.vendor\u003dSun Microsystems Inc.\nBootLoader constants: OS\u003dwin32, ARCH\u003dx86, WS\u003dwin32, NL\u003den_US\n\n!ENTRY org.eclipse.core.runtime Mar 24, 2005 17:55:10.718\n!MESSAGE Product org.eclipse.platform.ide could not be found.\n\n!ENTRY org.eclipse.osgi Mar 24, 2005 17:55:10.734\n!MESSAGE Application error\n!STACK 1\njava.lang.RuntimeException: No application id has been found.\n\tat org.eclipse.core.internal.runtime.PlatformActivator$1.run\n(PlatformActivator.java:313)\n\tat org.eclipse.core.runtime.adaptor.EclipseStarter.run\n(EclipseStarter.java:273)\n\tat org.eclipse.core.runtime.adaptor.EclipseStarter.run\n(EclipseStarter.java:129)\n\tat sun.reflect.NativeMethodAccessorImpl.invoke0(Native Method)\n\tat sun.reflect.NativeMethodAccessorImpl.invoke(Unknown Source)\n\tat sun.reflect.DelegatingMethodAccessorImpl.invoke(Unknown Source)\n\tat java.lang.reflect.Method.invoke(Unknown Source)\n\tat org.eclipse.core.launcher.Main.basicRun(Main.java:185)\n\tat org.eclipse.core.launcher.Main.run(Main.java:704)\n\tat org.eclipse.core.launcher.Main.main(Main.java:688)\n\n!ENTRY org.eclipse.osgi Mar 24, 2005 17:55:10.750\n!MESSAGE Bundle update@/c:/Dev/Eclipse/plugins/de.jayefem.log4e_0.7.7/ [367] \nwas not resolved.\n\n!ENTRY org.eclipse.osgi Mar 24, 2005 17:55:10.750\n!MESSAGE Bundle \nupdate@/c:/Dev/Eclipse/plugins/org.eclipse.compare.examples.xml_3.0.0/ [372] \nwas not resolved.\n\n!ENTRY org.eclipse.osgi Mar 24, 2005 17:55:10.750\n!MESSAGE Bundle \nupdate@/c:/Dev/Eclipse/plugins/org.eclipse.compare.examples_3.0.0/ [373] was \nnot resolved.\n\n!ENTRY org.eclipse.osgi Mar 24, 2005 17:55:10.750\n!MESSAGE Bundle update@/c:/Dev/Eclipse/plugins/org.eclipse.compare_3.0.0/ \n[374] was not resolved.\n\n!ENTRY org.eclipse.osgi Mar 24, 2005 17:55:10.765\n!MESSAGE Bundle update@/c:/Dev/Eclipse/plugins/org.eclipse.draw2d_3.0.1/ [386] \nwas not resolved.\n\n!ENTRY org.eclipse.osgi Mar 24, 2005 17:55:10.765\n!MESSAGE Bundle update@/c:/Dev/Eclipse/plugins/org.eclipse.gef.doc.isv_3.0.1/ \n[421] was not resolved.\n\n!ENTRY org.eclipse.osgi Mar 24, 2005 17:55:10.765\n!MESSAGE Bundle \nupdate@/c:/Dev/Eclipse/plugins/org.eclipse.gef.examples.flow_3.0.1/ [422] was \nnot resolved.\n\n!ENTRY org.eclipse.osgi Mar 24, 2005 17:55:10.765\n!MESSAGE Bundle \nupdate@/c:/Dev/Eclipse/plugins/org.eclipse.gef.examples.logic_3.0.0/ [423] was \nnot resolved.\n\n!ENTRY org.eclipse.osgi Mar 24, 2005 17:55:10.765\n!MESSAGE Bundle update@/c:/Dev/Eclipse/plugins/org.eclipse.gef_3.0.1/ [426] \nwas not resolved.\n\n!ENTRY org.eclipse.osgi Mar 24, 2005 17:55:10.765\n!MESSAGE Bundle update@/c:/Dev/Eclipse/plugins/org.eclipse.help.ide_3.0.0/ \n[430] was not resolved.\n\n!ENTRY org.eclipse.osgi Mar 24, 2005 17:55:10.765\n!MESSAGE Bundle update@/c:/Dev/Eclipse/plugins/org.eclipse.jdt.junit_3.0.1/ \n[440] was not resolved.\n\n!ENTRY org.eclipse.osgi Mar 24, 2005 17:55:10.765\n!MESSAGE Bundle \nupdate@/c:/Dev/Eclipse/plugins/org.eclipse.jdt.ui.examples.projects_3.0.1/ \n[443] was not resolved.\n\n!ENTRY org.eclipse.osgi Mar 24, 2005 17:55:10.765\n!MESSAGE Bundle update@/c:/Dev/Eclipse/plugins/org.eclipse.jem.beaninfo_1.0.1/ \n[446] was not resolved.\n\n!ENTRY org.eclipse.osgi Mar 24, 2005 17:55:10.781\n!MESSAGE Bundle update@/c:/Dev/Eclipse/plugins/org.eclipse.jem.proxy_1.0.1/ \n[447] was not resolved.\n\n!ENTRY org.eclipse.osgi Mar 24, 2005 17:55:10.781\n!MESSAGE Bundle update@/c:/Dev/Eclipse/plugins/org.eclipse.jem.ui_1.0.1/ [450] \nwas not resolved.\n\n!ENTRY org.eclipse.osgi Mar 24, 2005 17:55:10.781\n!MESSAGE Bundle \nupdate@/c:/Dev/Eclipse/plugins/org.eclipse.ltk.ui.refactoring_3.0.1/ [456] was \nnot resolved.\n\n!ENTRY org.eclipse.osgi Mar 24, 2005 17:55:10.781\n!MESSAGE Bundle update@/c:/Dev/Eclipse/plugins/org.eclipse.pde.build_3.0.1/ \n[460] was not resolved.\n\n!ENTRY org.eclipse.osgi Mar 24, 2005 17:55:10.781\n!MESSAGE Bundle \nupdate@/c:/Dev/Eclipse/plugins/org.eclipse.pde.junit.runtime_3.0.0/ [463] was \nnot resolved.\n\n!ENTRY org.eclipse.osgi Mar 24, 2005 17:55:10.781\n!MESSAGE Bundle update@/c:/Dev/Eclipse/plugins/org.eclipse.pde.runtime_3.0.1/ \n[464] was not resolved.\n\n!ENTRY org.eclipse.osgi Mar 24, 2005 17:55:10.781\n!MESSAGE Bundle update@/c:/Dev/Eclipse/plugins/org.eclipse.pde_3.0.1/ [467] \nwas not resolved.\n\n!ENTRY org.eclipse.osgi Mar 24, 2005 17:55:10.796\n!MESSAGE Bundle \nupdate@/c:/Dev/Eclipse/plugins/org.eclipse.platform.doc.isv_3.0.1/ [468] was \nnot resolved.\n\n!ENTRY org.eclipse.osgi Mar 24, 2005 17:55:10.796\n!MESSAGE Bundle update@/c:/Dev/Eclipse/plugins/org.eclipse.sdk.samples_3.0.0/ \n[476] was not resolved.\n\n!ENTRY org.eclipse.osgi Mar 24, 2005 17:55:10.796\n!MESSAGE Bundle update@/c:/Dev/Eclipse/plugins/org.eclipse.search_3.0.1/ [478] \nwas not resolved.\n\n!ENTRY org.eclipse.osgi Mar 24, 2005 17:55:10.796\n!MESSAGE Bundle \nupdate@/c:/Dev/Eclipse/plugins/org.eclipse.swt.examples.browser_3.0.0/ [479] \nwas not resolved.\n\n!ENTRY org.eclipse.osgi Mar 24, 2005 17:55:10.796\n!MESSAGE Bundle \nupdate@/c:/Dev/Eclipse/plugins/org.eclipse.swt.examples.controls_3.0.0/ [480] \nwas not resolved.\n\n!ENTRY org.eclipse.osgi Mar 24, 2005 17:55:10.796\n!MESSAGE Bundle \nupdate@/c:/Dev/Eclipse/plugins/org.eclipse.swt.examples.launcher_3.0.0/ [481] \nwas not resolved.\n\n!ENTRY org.eclipse.osgi Mar 24, 2005 17:55:10.796\n!MESSAGE Bundle \nupdate@/c:/Dev/Eclipse/plugins/org.eclipse.swt.examples.layouts_3.0.0/ [482] \nwas not resolved.\n\n!ENTRY org.eclipse.osgi Mar 24, 2005 17:55:10.796\n!MESSAGE Bundle \nupdate@/c:/Dev/Eclipse/plugins/org.eclipse.swt.examples.ole.win32_3.0.0/ [483] \nwas not resolved.\n\n!ENTRY org.eclipse.osgi Mar 24, 2005 17:55:10.812\n!MESSAGE Bundle \nupdate@/c:/Dev/Eclipse/plugins/org.eclipse.swt.examples.paint_3.0.0/ [484] was \nnot resolved.\n\n!ENTRY org.eclipse.osgi Mar 24, 2005 17:55:10.812\n!MESSAGE Bundle update@/c:/Dev/Eclipse/plugins/org.eclipse.swt.examples_3.0.0/ \n[485] was not resolved.\n\n!ENTRY org.eclipse.osgi Mar 24, 2005 17:55:10.812\n!MESSAGE Bundle \nupdate@/c:/Dev/Eclipse/plugins/org.eclipse.team.cvs.ssh2_3.0.0/ [490] was not \nresolved.\n\n!ENTRY org.eclipse.osgi Mar 24, 2005 17:55:10.812\n!MESSAGE Bundle update@/c:/Dev/Eclipse/plugins/org.eclipse.team.cvs.ui_3.0.1/ \n[492] was not resolved.\n\n!ENTRY org.eclipse.osgi Mar 24, 2005 17:55:10.812\n!MESSAGE Bundle \nupdate@/c:/Dev/Eclipse/plugins/org.eclipse.team.examples.filesystem_3.0.0/ \n[493] was not resolved.\n\n!ENTRY org.eclipse.osgi Mar 24, 2005 17:55:10.812\n!MESSAGE Bundle update@/c:/Dev/Eclipse/plugins/org.eclipse.team.ui_3.0.1/ \n[494] was not resolved.\n\n!ENTRY org.eclipse.osgi Mar 24, 2005 17:55:10.812\n!MESSAGE Bundle \nupdate@/c:/Dev/Eclipse/plugins/org.eclipse.ui.cheatsheets_3.0.1/ [497] was not \nresolved.\n\n!ENTRY org.eclipse.osgi Mar 24, 2005 17:55:10.812\n!MESSAGE Bundle update@/c:/Dev/Eclipse/plugins/org.eclipse.ui.console_3.0.0/ \n[498] was not resolved.\n\n!ENTRY org.eclipse.osgi Mar 24, 2005 17:55:10.828\n!MESSAGE Bundle update@/c:/Dev/Eclipse/plugins/org.eclipse.ui.editors_3.0.1/ \n[499] was not resolved.\n\n!ENTRY org.eclipse.osgi Mar 24, 2005 17:55:10.828\n!MESSAGE Bundle \nupdate@/c:/Dev/Eclipse/plugins/org.eclipse.ui.examples.javaeditor_3.0.0/ [500] \nwas not resolved.\n\n!ENTRY org.eclipse.osgi Mar 24, 2005 17:55:10.828\n!MESSAGE Bundle \nupdate@/c:/Dev/Eclipse/plugins/org.eclipse.ui.examples.multipageeditor_2.1.0/ \n[501] was not resolved.\n\n!ENTRY org.eclipse.osgi Mar 24, 2005 17:55:10.828\n!MESSAGE Bundle \nupdate@/c:/Dev/Eclipse/plugins/org.eclipse.ui.examples.propertysheet_2.1.0/ \n[502] was not resolved.\n\n!ENTRY org.eclipse.osgi Mar 24, 2005 17:55:10.828\n!MESSAGE Bundle \nupdate@/c:/Dev/Eclipse/plugins/org.eclipse.ui.examples.readmetool_2.1.0/ [503] \nwas not resolved.\n\n!ENTRY org.eclipse.osgi Mar 24, 2005 17:55:10.828\n!MESSAGE Bundle \nupdate@/c:/Dev/Eclipse/plugins/org.eclipse.ui.externaltools_3.0.1/ [504] was \nnot resolved.\n\n!ENTRY org.eclipse.osgi Mar 24, 2005 17:55:10.828\n!MESSAGE Bundle update@/c:/Dev/Eclipse/plugins/org.eclipse.ui.forms_3.0.0/ \n[505] was not resolved.\n\n!ENTRY org.eclipse.osgi Mar 24, 2005 17:55:10.828\n!MESSAGE Bundle \nupdate@/c:/Dev/Eclipse/plugins/org.eclipse.ui.presentations.r21_3.0.1/ [508] \nwas not resolved.\n\n!ENTRY org.eclipse.osgi Mar 24, 2005 17:55:10.843\n!MESSAGE Bundle update@/c:/Dev/Eclipse/plugins/org.eclipse.ui.views_3.0.0/ \n[509] was not resolved.\n\n!ENTRY org.eclipse.osgi Mar 24, 2005 17:55:10.843\n!MESSAGE Bundle update@/c:/Dev/Eclipse/plugins/org.eclipse.ui.win32_3.0.1/ \n[510] was not resolved.\n\n!ENTRY org.eclipse.osgi Mar 24, 2005 17:55:10.843\n!MESSAGE Bundle \nupdate@/c:/Dev/Eclipse/plugins/org.eclipse.ui.workbench.compatibility_3.0.0/ \n[511] was not resolved.\n\n!ENTRY org.eclipse.osgi Mar 24, 2005 17:55:10.843\n!MESSAGE Bundle \nupdate@/c:/Dev/Eclipse/plugins/org.eclipse.ui.workbench.texteditor_3.0.1/ \n[512] was not resolved.\n\n!ENTRY org.eclipse.osgi Mar 24, 2005 17:55:10.843\n!MESSAGE Bundle \nupdate@/c:/Dev/Eclipse/plugins/org.eclipse.update.core.win32_3.0.0/ [516] was \nnot resolved.\n\n!ENTRY org.eclipse.osgi Mar 24, 2005 17:55:10.843\n!MESSAGE Bundle update@/c:/Dev/Eclipse/plugins/org.eclipse.ve.cde_1.0.1/ [520] \nwas not resolved.\n\n!ENTRY org.eclipse.osgi Mar 24, 2005 17:55:10.843\n!MESSAGE Bundle \nupdate@/c:/Dev/Eclipse/plugins/org.eclipse.ve.propertysheet_1.0.1/ [524] was \nnot resolved.\n\n!ENTRY org.eclipse.osgi Mar 24, 2005 17:55:10.843\n!MESSAGE Bundle update@/c:/Dev/Eclipse/plugins/org.eclipse.ve.swt_1.0.1/ [527] \nwas not resolved.\n\n!ENTRY org.eclipse.osgi Mar 24, 2005 17:55:10.859\n!MESSAGE Bundle \nupdate@/c:/Dev/Eclipse/plugins/com.ibm.wtp.emf.workbench_1.0.1.1/ [536] was \nnot resolved.\n!SUBENTRY 1 org.eclipse.osgi Mar 24, 2005 17:55:10.859\n!MESSAGE Missing required bundle org.eclipse.jdt.core_0.0.0.\n\n!ENTRY org.eclipse.osgi Mar 24, 2005 17:55:10.859\n!MESSAGE Bundle \nupdate@/c:/Dev/Eclipse/plugins/org.eclipse.emf.codegen.ecore.ui_2.0.1.200409081\n700/ [538] was not resolved.\n!SUBENTRY 1 org.eclipse.osgi Mar 24, 2005 17:55:10.859\n!MESSAGE Missing required bundle org.eclipse.jdt.core_0.0.0.\n!SUBENTRY 1 org.eclipse.osgi Mar 24, 2005 17:55:10.859\n!MESSAGE Missing required bundle org.eclipse.ui.ide_0.0.0.\n!SUBENTRY 1 org.eclipse.osgi Mar 24, 2005 17:55:10.859\n!MESSAGE Missing required bundle org.eclipse.emf.codegen.ecore_0.0.0.\n!SUBENTRY 1 org.eclipse.osgi Mar 24, 2005 17:55:10.859\n!MESSAGE Missing required bundle org.eclipse.emf.edit.ui_0.0.0.\n\n!ENTRY org.eclipse.osgi Mar 24, 2005 17:55:10.859\n!MESSAGE Bundle \nupdate@/c:/Dev/Eclipse/plugins/org.eclipse.emf.codegen.ecore_2.0.1.200409081700\n/ [539] was not resolved.\n!SUBENTRY 1 org.eclipse.osgi Mar 24, 2005 17:55:10.859\n!MESSAGE Missing required bundle org.eclipse.jdt.core_0.0.0.\n!SUBENTRY 1 org.eclipse.osgi Mar 24, 2005 17:55:10.859\n!MESSAGE Missing required bundle org.eclipse.jdt.launching_0.0.0.\n!SUBENTRY 1 org.eclipse.osgi Mar 24, 2005 17:55:10.859\n!MESSAGE Missing required bundle org.eclipse.emf.codegen_0.0.0.\n\n!ENTRY org.eclipse.osgi Mar 24, 2005 17:55:10.859\n!MESSAGE Bundle \nupdate@/c:/Dev/Eclipse/plugins/org.eclipse.emf.codegen.ui_2.0.0.200409081700/ \n[540] was not resolved.\n!SUBENTRY 1 org.eclipse.osgi Mar 24, 2005 17:55:10.859\n!MESSAGE Missing required bundle org.eclipse.emf.codegen_0.0.0.\n!SUBENTRY 1 org.eclipse.osgi Mar 24, 2005 17:55:10.859\n!MESSAGE Missing required bundle org.eclipse.jdt.core_0.0.0.\n!SUBENTRY 1 org.eclipse.osgi Mar 24, 2005 17:55:10.859\n!MESSAGE Missing required bundle org.eclipse.jdt.launching_0.0.0.\n!SUBENTRY 1 org.eclipse.osgi Mar 24, 2005 17:55:10.875\n!MESSAGE Missing required bundle org.eclipse.ui_0.0.0.\n!SUBENTRY 1 org.eclipse.osgi Mar 24, 2005 17:55:10.875\n!MESSAGE Missing required bundle org.eclipse.ui.ide_0.0.0.\n\n!ENTRY org.eclipse.osgi Mar 24, 2005 17:55:10.875\n!MESSAGE Bundle \nupdate@/c:/Dev/Eclipse/plugins/org.eclipse.emf.codegen_2.0.1.200409081700/ \n[541] was not resolved.\n!SUBENTRY 1 org.eclipse.osgi Mar 24, 2005 17:55:10.875\n!MESSAGE Missing required bundle org.eclipse.jdt.core_0.0.0.\n!SUBENTRY 1 org.eclipse.osgi Mar 24, 2005 17:55:10.875\n!MESSAGE Missing required bundle org.eclipse.jdt.launching_0.0.0.\n!SUBENTRY 1 org.eclipse.osgi Mar 24, 2005 17:55:10.875\n!MESSAGE Missing required bundle org.eclipse.debug.core_0.0.0.\n\n!ENTRY org.eclipse.osgi Mar 24, 2005 17:55:10.875\n!MESSAGE Bundle \nupdate@/c:/Dev/Eclipse/plugins/org.eclipse.emf.common.ui_2.0.1.200409081700/ \n[542] was not resolved.\n!SUBENTRY 1 org.eclipse.osgi Mar 24, 2005 17:55:10.875\n!MESSAGE Missing required bundle org.eclipse.ui_0.0.0.\n\n!ENTRY org.eclipse.osgi Mar 24, 2005 17:55:10.875\n!MESSAGE Bundle \nupdate@/c:/Dev/Eclipse/plugins/org.eclipse.emf.ecore.editor_2.0.1.200409081700/\n [548] was not resolved.\n!SUBENTRY 1 org.eclipse.osgi Mar 24, 2005 17:55:10.875\n!MESSAGE Missing required bundle org.eclipse.ui.ide_0.0.0.\n!SUBENTRY 1 org.eclipse.osgi Mar 24, 2005 17:55:10.875\n!MESSAGE Missing required bundle org.eclipse.emf.edit.ui_0.0.0.\n\n!ENTRY org.eclipse.osgi Mar 24, 2005 17:55:10.875\n!MESSAGE Bundle \nupdate@/c:/Dev/Eclipse/plugins/org.eclipse.emf.ecore.sdo.editor_2.0.0.200409081\n700/ [551] was not resolved.\n!SUBENTRY 1 org.eclipse.osgi Mar 24, 2005 17:55:10.875\n!MESSAGE Missing required bundle org.eclipse.ui.ide_0.0.0.\n!SUBENTRY 1 org.eclipse.osgi Mar 24, 2005 17:55:10.875\n!MESSAGE Missing required bundle org.eclipse.emf.edit.ui_0.0.0.\n!SUBENTRY 1 org.eclipse.osgi Mar 24, 2005 17:55:10.875\n!MESSAGE Missing required bundle org.eclipse.emf.codegen.ecore_0.0.0.\n\n!ENTRY org.eclipse.osgi Mar 24, 2005 17:55:10.875\n!MESSAGE Bundle \nupdate@/c:/Dev/Eclipse/plugins/org.eclipse.emf.edit.ui_2.0.1.200409081700/ \n[557] was not resolved.\n!SUBENTRY 1 org.eclipse.osgi Mar 24, 2005 17:55:10.875\n!MESSAGE Missing required bundle org.eclipse.ui.views_0.0.0.\n!SUBENTRY 1 org.eclipse.osgi Mar 24, 2005 17:55:10.875\n!MESSAGE Missing required bundle org.eclipse.ui.workbench_0.0.0.\n!SUBENTRY 1 org.eclipse.osgi Mar 24, 2005 17:55:10.875\n!MESSAGE Missing required bundle org.eclipse.emf.common.ui_0.0.0.\n!SUBENTRY 1 org.eclipse.osgi Mar 24, 2005 17:55:10.875\n!MESSAGE Missing optionally required bundle org.eclipse.ui.ide_0.0.0.\n\n!ENTRY org.eclipse.osgi Mar 24, 2005 17:55:10.875\n!MESSAGE Bundle \nupdate@/c:/Dev/Eclipse/plugins/org.eclipse.emf.java.editor_2.0.1.200409081700/ \n[560] was not resolved.\n!SUBENTRY 1 org.eclipse.osgi Mar 24, 2005 17:55:10.875\n!MESSAGE Missing required bundle org.eclipse.ui.ide_0.0.0.\n!SUBENTRY 1 org.eclipse.osgi Mar 24, 2005 17:55:10.875\n!MESSAGE Missing required bundle org.eclipse.emf.java.edit_0.0.0.\n!SUBENTRY 1 org.eclipse.osgi Mar 24, 2005 17:55:10.875\n!MESSAGE Missing required bundle org.eclipse.emf.edit.ui_0.0.0.\n\n!ENTRY org.eclipse.osgi Mar 24, 2005 17:55:10.875\n!MESSAGE Bundle \nupdate@/c:/Dev/Eclipse/plugins/org.eclipse.emf.java.edit_2.0.0.200409081700/ \n[561] was not resolved.\n!SUBENTRY 1 org.eclipse.osgi Mar 24, 2005 17:55:10.890\n!MESSAGE Missing required bundle org.eclipse.emf.java_0.0.0.\n\n!ENTRY org.eclipse.osgi Mar 24, 2005 17:55:10.890\n!MESSAGE Bundle \nupdate@/c:/Dev/Eclipse/plugins/org.eclipse.emf.java_2.0.1.200409081700/ [562] \nwas not resolved.\n!SUBENTRY 1 org.eclipse.osgi Mar 24, 2005 17:55:10.890\n!MESSAGE Missing required bundle org.eclipse.jdt.core_0.0.0.\n\n!ENTRY org.eclipse.osgi Mar 24, 2005 17:55:10.890\n!MESSAGE Bundle \nupdate@/c:/Dev/Eclipse/plugins/org.eclipse.emf.mapping.ecore2ecore.editor_2.0.1\n.200409081700/ [563] was not resolved.\n!SUBENTRY 1 org.eclipse.osgi Mar 24, 2005 17:55:10.890\n!MESSAGE Missing required bundle org.eclipse.emf.mapping.ui_0.0.0.\n!SUBENTRY 1 org.eclipse.osgi Mar 24, 2005 17:55:10.890\n!MESSAGE Missing required bundle org.eclipse.ui_0.0.0.\n\n!ENTRY org.eclipse.osgi Mar 24, 2005 17:55:10.890\n!MESSAGE Bundle \nupdate@/c:/Dev/Eclipse/plugins/org.eclipse.emf.mapping.ui_2.0.0.200409081700/ \n[565] was not resolved.\n!SUBENTRY 1 org.eclipse.osgi Mar 24, 2005 17:55:10.890\n!MESSAGE Missing required bundle org.eclipse.ui.ide_0.0.0.\n!SUBENTRY 1 org.eclipse.osgi Mar 24, 2005 17:55:10.890\n!MESSAGE Missing required bundle org.eclipse.emf.edit.ui_0.0.0.\n\n!ENTRY org.eclipse.osgi Mar 24, 2005 17:55:10.890\n!MESSAGE Bundle \nupdate@/c:/Dev/Eclipse/plugins/org.eclipse.emf.mapping.xsd2ecore.editor_2.0.1.2\n00409081700/ [566] was not resolved.\n!SUBENTRY 1 org.eclipse.osgi Mar 24, 2005 17:55:10.890\n!MESSAGE Missing required bundle org.eclipse.emf.mapping.ui_0.0.0.\n\n!ENTRY org.eclipse.osgi Mar 24, 2005 17:55:10.890\n!MESSAGE Bundle \nupdate@/c:/Dev/Eclipse/plugins/org.eclipse.jem.workbench_1.0.1.1/ [573] was \nnot resolved.\n!SUBENTRY 1 org.eclipse.osgi Mar 24, 2005 17:55:10.890\n!MESSAGE Missing required bundle org.eclipse.jdt.core_0.0.0.\n!SUBENTRY 1 org.eclipse.osgi Mar 24, 2005 17:55:10.890\n!MESSAGE Missing required bundle org.eclipse.jem.proxy_0.0.0.\n!SUBENTRY 1 org.eclipse.osgi Mar 24, 2005 17:55:10.890\n!MESSAGE Missing required bundle com.ibm.wtp.emf.workbench_0.0.0.\n\n!ENTRY org.eclipse.osgi Mar 24, 2005 17:55:10.890\n!MESSAGE Bundle update@/c:/Dev/Eclipse/plugins/org.eclipse.pde.core_3.0.2/ \n[575] was not resolved.\n!SUBENTRY 1 org.eclipse.osgi Mar 24, 2005 17:55:10.890\n!MESSAGE Missing required bundle org.eclipse.jdt.core_0.0.0.\n\n!ENTRY org.eclipse.osgi Mar 24, 2005 17:55:10.906\n!MESSAGE Bundle update@/c:/Dev/Eclipse/plugins/org.eclipse.pde.ui_3.0.2/ [577] \nwas not resolved.\n!SUBENTRY 1 org.eclipse.osgi Mar 24, 2005 17:55:10.906\n!MESSAGE Missing required bundle org.eclipse.ui.ide_0.0.0.\n!SUBENTRY 1 org.eclipse.osgi Mar 24, 2005 17:55:10.906\n!MESSAGE Missing required bundle org.eclipse.ui.views_0.0.0.\n!SUBENTRY 1 org.eclipse.osgi Mar 24, 2005 17:55:10.906\n!MESSAGE Missing required bundle org.eclipse.jface.text_0.0.0.\n!SUBENTRY 1 org.eclipse.osgi Mar 24, 2005 17:55:10.906\n!MESSAGE Missing required bundle org.eclipse.ui.workbench.texteditor_0.0.0.\n!SUBENTRY 1 org.eclipse.osgi Mar 24, 2005 17:55:10.906\n!MESSAGE Missing required bundle org.eclipse.ui.editors_0.0.0.\n!SUBENTRY 1 org.eclipse.osgi Mar 24, 2005 17:55:10.906\n!MESSAGE Missing required bundle org.eclipse.debug.core_0.0.0.\n!SUBENTRY 1 org.eclipse.osgi Mar 24, 2005 17:55:10.906\n!MESSAGE Missing required bundle org.eclipse.debug.ui_0.0.0.\n!SUBENTRY 1 org.eclipse.osgi Mar 24, 2005 17:55:10.906\n!MESSAGE Missing required bundle org.eclipse.help.base_0.0.0.\n!SUBENTRY 1 org.eclipse.osgi Mar 24, 2005 17:55:10.906\n!MESSAGE Missing required bundle org.eclipse.jdt.core_0.0.0.\n!SUBENTRY 1 org.eclipse.osgi Mar 24, 2005 17:55:10.906\n!MESSAGE Missing required bundle org.eclipse.jdt.debug.ui_0.0.0.\n!SUBENTRY 1 org.eclipse.osgi Mar 24, 2005 17:55:10.906\n!MESSAGE Missing required bundle org.eclipse.jdt.launching_0.0.0.\n!SUBENTRY 1 org.eclipse.osgi Mar 24, 2005 17:55:10.906\n!MESSAGE Missing required bundle org.eclipse.jdt.ui_0.0.0.\n!SUBENTRY 1 org.eclipse.osgi Mar 24, 2005 17:55:10.906\n!MESSAGE Missing required bundle org.eclipse.pde_0.0.0.\n!SUBENTRY 1 org.eclipse.osgi Mar 24, 2005 17:55:10.906\n!MESSAGE Missing required bundle org.eclipse.pde.build_0.0.0.\n!SUBENTRY 1 org.eclipse.osgi Mar 24, 2005 17:55:10.906\n!MESSAGE Missing required bundle org.eclipse.search_0.0.0.\n!SUBENTRY 1 org.eclipse.osgi Mar 24, 2005 17:55:10.906\n!MESSAGE Missing required bundle org.eclipse.ui_0.0.0.\n!SUBENTRY 1 org.eclipse.osgi Mar 24, 2005 17:55:10.906\n!MESSAGE Missing required bundle org.eclipse.update.core_0.0.0.\n!SUBENTRY 1 org.eclipse.osgi Mar 24, 2005 17:55:10.906\n!MESSAGE Missing required bundle org.eclipse.ui.forms_0.0.0.\n!SUBENTRY 1 org.eclipse.osgi Mar 24, 2005 17:55:10.906\n!MESSAGE Missing required bundle org.eclipse.ant.ui_0.0.0.\n!SUBENTRY 1 org.eclipse.osgi Mar 24, 2005 17:55:10.906\n!MESSAGE Missing required bundle org.eclipse.jdt.junit_0.0.0.\n!SUBENTRY 1 org.eclipse.osgi Mar 24, 2005 17:55:10.906\n!MESSAGE Missing required bundle org.eclipse.ui.intro_0.0.0.\n!SUBENTRY 1 org.eclipse.osgi Mar 24, 2005 17:55:10.906\n!MESSAGE Missing required bundle org.eclipse.ui.cheatsheets_0.0.0.\n\n!ENTRY org.eclipse.osgi Mar 24, 2005 17:55:10.906\n!MESSAGE Bundle update@/c:/Dev/Eclipse/plugins/org.eclipse.sdk_3.0.2/ [578] \nwas not resolved.\n!SUBENTRY 1 org.eclipse.osgi Mar 24, 2005 17:55:10.906\n!MESSAGE Missing required bundle org.eclipse.ui_0.0.0.\n\n!ENTRY org.eclipse.osgi Mar 24, 2005 17:55:10.906\n!MESSAGE Bundle \nupdate@/c:/Dev/Eclipse/plugins/org.eclipse.ve.java.core_1.0.1.1/ [580] was not \nresolved.\n!SUBENTRY 1 org.eclipse.osgi Mar 24, 2005 17:55:10.906\n!MESSAGE Missing required bundle org.eclipse.ve.cde_0.0.0.\n!SUBENTRY 1 org.eclipse.osgi Mar 24, 2005 17:55:10.906\n!MESSAGE Missing required bundle org.eclipse.jem.beaninfo_0.0.0.\n!SUBENTRY 1 org.eclipse.osgi Mar 24, 2005 17:55:10.906\n!MESSAGE Missing required bundle org.eclipse.jdt.core_0.0.0.\n!SUBENTRY 1 org.eclipse.osgi Mar 24, 2005 17:55:10.906\n!MESSAGE Missing required bundle org.eclipse.jdt.ui_0.0.0.\n!SUBENTRY 1 org.eclipse.osgi Mar 24, 2005 17:55:10.906\n!MESSAGE Missing required bundle org.eclipse.debug.core_0.0.0.\n!SUBENTRY 1 org.eclipse.osgi Mar 24, 2005 17:55:10.906\n!MESSAGE Missing required bundle org.eclipse.emf.codegen_0.0.0.\n!SUBENTRY 1 org.eclipse.osgi Mar 24, 2005 17:55:10.906\n!MESSAGE Missing required bundle org.eclipse.debug.ui_0.0.0.\n!SUBENTRY 1 org.eclipse.osgi Mar 24, 2005 17:55:10.906\n!MESSAGE Missing required bundle org.eclipse.jdt.debug.ui_0.0.0.\n!SUBENTRY 1 org.eclipse.osgi Mar 24, 2005 17:55:10.906\n!MESSAGE Missing required bundle org.eclipse.ui.views_0.0.0.\n!SUBENTRY 1 org.eclipse.osgi Mar 24, 2005 17:55:10.906\n!MESSAGE Missing required bundle org.eclipse.ui.editors_0.0.0.\n!SUBENTRY 1 org.eclipse.osgi Mar 24, 2005 17:55:10.906\n!MESSAGE Missing required bundle org.eclipse.ui.workbench.texteditor_0.0.0.\n!SUBENTRY 1 org.eclipse.osgi Mar 24, 2005 17:55:10.906\n!MESSAGE Missing required bundle org.eclipse.jface.text_0.0.0.\n!SUBENTRY 1 org.eclipse.osgi Mar 24, 2005 17:55:10.906\n!MESSAGE Missing required bundle org.eclipse.ui.ide_0.0.0.\n!SUBENTRY 1 org.eclipse.osgi Mar 24, 2005 17:55:10.906\n!MESSAGE Missing required bundle org.eclipse.jface_0.0.0.\n!SUBENTRY 1 org.eclipse.osgi Mar 24, 2005 17:55:10.906\n!MESSAGE Missing required bundle org.eclipse.gef_0.0.0.\n!SUBENTRY 1 org.eclipse.osgi Mar 24, 2005 17:55:10.906\n!MESSAGE Missing required bundle org.eclipse.ve.propertysheet_0.0.0.\n!SUBENTRY 1 org.eclipse.osgi Mar 24, 2005 17:55:10.906\n!MESSAGE Missing required bundle org.eclipse.jem.proxy_0.0.0.\n!SUBENTRY 1 org.eclipse.osgi Mar 24, 2005 17:55:10.906\n!MESSAGE Missing required bundle org.eclipse.jdt.launching_0.0.0.\n!SUBENTRY 1 org.eclipse.osgi Mar 24, 2005 17:55:10.906\n!MESSAGE Missing required bundle org.eclipse.ui.workbench_0.0.0.\n!SUBENTRY 1 org.eclipse.osgi Mar 24, 2005 17:55:10.906\n!MESSAGE Missing required bundle org.eclipse.jem.workbench_0.0.0.\n!SUBENTRY 1 org.eclipse.osgi Mar 24, 2005 17:55:10.906\n!MESSAGE Missing required bundle com.ibm.wtp.emf.workbench_0.0.0.\n\n!ENTRY org.eclipse.osgi Mar 24, 2005 17:55:10.906\n!MESSAGE Bundle update@/c:/Dev/Eclipse/plugins/org.eclipse.ve.jfc_1.0.1.1/ \n[581] was not resolved.\n!SUBENTRY 1 org.eclipse.osgi Mar 24, 2005 17:55:10.906\n!MESSAGE Missing required bundle org.eclipse.ve.java.core_0.0.0.\n!SUBENTRY 1 org.eclipse.osgi Mar 24, 2005 17:55:10.906\n!MESSAGE Missing required bundle org.eclipse.jdt.ui_0.0.0.\n!SUBENTRY 1 org.eclipse.osgi Mar 24, 2005 17:55:10.906\n!MESSAGE Missing required bundle org.eclipse.jdt.core_0.0.0.\n!SUBENTRY 1 org.eclipse.osgi Mar 24, 2005 17:55:10.906\n!MESSAGE Missing required bundle org.eclipse.ui.views_0.0.0.\n!SUBENTRY 1 org.eclipse.osgi Mar 24, 2005 17:55:10.906\n!MESSAGE Missing required bundle org.eclipse.jface.text_0.0.0.\n!SUBENTRY 1 org.eclipse.osgi Mar 24, 2005 17:55:10.906\n!MESSAGE Missing required bundle org.eclipse.ui.ide_0.0.0.\n!SUBENTRY 1 org.eclipse.osgi Mar 24, 2005 17:55:10.906\n!MESSAGE Missing required bundle org.eclipse.ve.cde_0.0.0.\n!SUBENTRY 1 org.eclipse.osgi Mar 24, 2005 17:55:10.906\n!MESSAGE Missing required bundle org.eclipse.gef_0.0.0.\n!SUBENTRY 1 org.eclipse.osgi Mar 24, 2005 17:55:10.906\n!MESSAGE Missing required bundle org.eclipse.ve.propertysheet_0.0.0.\n!SUBENTRY 1 org.eclipse.osgi Mar 24, 2005 17:55:10.906\n!MESSAGE Missing required bundle org.eclipse.jem.proxy_0.0.0.\n!SUBENTRY 1 org.eclipse.osgi Mar 24, 2005 17:55:10.906\n!MESSAGE Missing required bundle org.eclipse.jem.beaninfo_0.0.0.\n!SUBENTRY 1 org.eclipse.osgi Mar 24, 2005 17:55:10.906\n!MESSAGE Missing required bundle org.eclipse.jdt.launching_0.0.0.\n!SUBENTRY 1 org.eclipse.osgi Mar 24, 2005 17:55:10.906\n!MESSAGE Missing required bundle org.eclipse.ui.workbench_0.0.0.\n!SUBENTRY 1 org.eclipse.osgi Mar 24, 2005 17:55:10.906\n!MESSAGE Missing required bundle org.eclipse.jface_0.0.0.\n!SUBENTRY 1 org.eclipse.osgi Mar 24, 2005 17:55:10.906\n!MESSAGE Missing required bundle org.eclipse.jem.workbench_0.0.0.\n\n!ENTRY org.eclipse.osgi Mar 24, 2005 17:55:10.921\n!MESSAGE Bundle \nupdate@/c:/Dev/Eclipse/plugins/org.eclipse.xsd.editor_2.0.1.200409081700/ \n[584] was not resolved.\n!SUBENTRY 1 org.eclipse.osgi Mar 24, 2005 17:55:10.921\n!MESSAGE Missing required bundle org.eclipse.jface.text_0.0.0.\n!SUBENTRY 1 org.eclipse.osgi Mar 24, 2005 17:55:10.921\n!MESSAGE Missing required bundle org.eclipse.ui.ide_0.0.0.\n!SUBENTRY 1 org.eclipse.osgi Mar 24, 2005 17:55:10.921\n!MESSAGE Missing required bundle org.eclipse.ui.workbench.texteditor_0.0.0.\n!SUBENTRY 1 org.eclipse.osgi Mar 24, 2005 17:55:10.921\n!MESSAGE Missing required bundle org.eclipse.ui.editors_0.0.0.\n!SUBENTRY 1 org.eclipse.osgi Mar 24, 2005 17:55:10.921\n!MESSAGE Missing required bundle org.eclipse.emf.edit.ui_0.0.0.",
    "You\u0027ve probably encountered \"the bug\" that was fixed in 3.0.1.1 (and 3.0.2 as \nwell).\nThis is unfortunate, but there is an easy workaround: do not uninstall \nanything, just get the eclipse sdk zip, unzip it on top, and restart eclipse \nwith -clean.\n\n"
  ],
  "commentCreationDates": [
    "2005-03-25T02:02:21+01:00",
    "2005-03-25T03:37:43+01:00"
  ],
  "traces": [
    {
      "exceptionType": "java.lang.RuntimeException",
      "message": "No application id has been found.",
      "elements": [
        {
          "method": "org.eclipse.core.internal.runtime.PlatformActivator$1.run",
          "source": "PlatformActivator.java:313"
        },
        {
          "method": "org.eclipse.core.runtime.adaptor.EclipseStarter.run",
          "source": "EclipseStarter.java:273"
        },
        {
          "method": "org.eclipse.core.runtime.adaptor.EclipseStarter.run",
          "source": "EclipseStarter.java:129"
        },
        {
          "method": "sun.reflect.NativeMethodAccessorImpl.invoke0",
          "source": "Native Method"
        },
        {
          "method": "sun.reflect.NativeMethodAccessorImpl.invoke",
          "source": "Unknown Source"
        },
        {
          "method": "sun.reflect.DelegatingMethodAccessorImpl.invoke",
          "source": "Unknown Source"
        },
        {
          "method": "java.lang.reflect.Method.invoke",
          "source": "Unknown Source"
        },
        {
          "method": "org.eclipse.core.launcher.Main.basicRun",
          "source": "Main.java:185"
        },
        {
          "method": "org.eclipse.core.launcher.Main.run",
          "source": "Main.java:704"
        },
        {
          "method": "org.eclipse.core.launcher.Main.main",
          "source": "Main.java:688"
        }
      ],
      "number": 0,
      "commentIndex": 0,
      "bugId": "89068",
      "date": "2005-03-25T02:02:21+01:00",
      "product": "Platform",
      "component": "Update",
      "severity": "blocker"
    }
  ],
  "groupId": "89068",
  "bugId": "89068",
  "date": "2005-03-25T02:02:21+01:00",
  "product": "Platform",
  "component": "Update",
  "severity": "blocker"
}