{
  "comments": [
    "I have an Eclipse project using SWT. I just migrated to 3.1 M6 and read in the\nchange log about the \"Run as SWT application\" feature. First I thought I could\nremove all libraries needed in the past for SWT stand-alone applications, but\nthen first had to add swt.jar again to make it compile, then the\norg.eclipse.core.runtime again after an error when trying to run and now finally\nI get \n\nException in thread \"main\" java.lang.UnsatisfiedLinkError: no swt-win32-3128 in\njava.library.path\n\tat java.lang.ClassLoader.loadLibrary(ClassLoader.java:1682)\n\tat java.lang.Runtime.loadLibrary0(Runtime.java:822)\n\tat java.lang.System.loadLibrary(System.java:992)\n\tat org.eclipse.swt.internal.Library.loadLibrary(Library.java:123)\n\tat org.eclipse.swt.internal.win32.OS.\u003cclinit\u003e(OS.java:18)\n\tat org.eclipse.swt.widgets.Display.\u003cclinit\u003e(Display.java:125)\n\tat chrriis.filecutter.LabelPrinter.\u003cinit\u003e(LabelPrinter.java:64)\n\tat chrriis.filecutter.LabelPrinter.main(LabelPrinter.java:38)\n\nwhen trying to \"Run as SWT application\".\n\nSo what\u0027s going wrong or what should this feature bring me? What exactly is it\ndoing, is there some kind of documenation (I did not found anything in the Help)?\n\nOr more generally: What JARs/DLLs do you need to add to your classpath or to\nyour command line for starting a stand-alone SWT application with 3.1 M6?",
    "\n\n*** This bug has been marked as a duplicate of 88669 ***"
  ],
  "commentCreationDates": [
    "2005-04-08T00:50:16+02:00",
    "2005-04-08T05:28:58+02:00"
  ],
  "traces": [
    {
      "exceptionType": "java.lang.UnsatisfiedLinkError",
      "message": "no swt-win32-3128 in java.library.path",
      "elements": [
        {
          "method": "java.lang.ClassLoader.loadLibrary",
          "source": "ClassLoader.java:1682"
        },
        {
          "method": "java.lang.Runtime.loadLibrary0",
          "source": "Runtime.java:822"
        },
        {
          "method": "java.lang.System.loadLibrary",
          "source": "System.java:992"
        },
        {
          "method": "org.eclipse.swt.internal.Library.loadLibrary",
          "source": "Library.java:123"
        },
        {
          "method": "org.eclipse.swt.internal.win32.OS.\u003cclinit\u003e",
          "source": "OS.java:18"
        },
        {
          "method": "org.eclipse.swt.widgets.Display.\u003cclinit\u003e",
          "source": "Display.java:125"
        },
        {
          "method": "chrriis.filecutter.LabelPrinter.\u003cinit\u003e",
          "source": "LabelPrinter.java:64"
        },
        {
          "method": "chrriis.filecutter.LabelPrinter.main",
          "source": "LabelPrinter.java:38"
        }
      ],
      "number": 0,
      "commentIndex": 0,
      "bugId": "90741",
      "duplicateId": "88669",
      "date": "2005-04-08T00:50:16+02:00",
      "product": "JDT",
      "component": "Core",
      "severity": "normal"
    }
  ],
  "groupId": "88669",
  "bugId": "90741",
  "duplicateId": "88669",
  "date": "2005-04-08T00:50:16+02:00",
  "product": "JDT",
  "component": "Core",
  "severity": "normal"
}