{
  "comments": [
    "I\u0027m trying to run the packager with M6 plugins using the following \n\n./eclipse -application org.eclipse.ant.core.antRunner -buildfile\n/home/kmoir/m6/eclipse/plugins/org.eclipse.pde.build_3.1.0/scripts/package.xml\n-DpackagingInfo\u003d/home/kmoir/ies -DbuildingOSGi\u003dtrue -vm\n/home/kmoir/IBMJava2-142/jre/bin/java -DdeltaPack\u003dfalse\n\nThe build failed with the following message\n\ngenerateAssembleScripts:\n \nBUILD FAILED\n/home/kmoir/m6/eclipse/plugins/org.eclipse.pde.build_3.1.0/scripts/package.xml:60:\nThe following error occurred while executing this line:\n/home/kmoir/m6/eclipse/plugins/org.eclipse.pde.build_3.1.0/scripts/package.xml:42:\njava.lang.NullPointerException\n\nLine 42 corresponds to the line where the deltaPack property is defined.\n\n \u003ctarget name\u003d\"generateAssembleScripts\"\u003e\n                \u003ceclipse.assembler featureList\u003d\"${featureList}\"\n                                                                       \nworkingDirectory\u003d\"${workingDirectory}\"\n                                                                       \nconfigInfo\u003d\"${config}\"\n                                                                       \nbaseLocation\u003d\"${tempDirectory}/${featurePaths}\"\n                                                                       \npackagePropertyFile\u003d\"${packagingPropertyFile}\"\n                                                                       \ndeltaPack\u003d\"${deltaPack}\"/\u003e\n        \u003c/target\u003e\n\nHere is the .log\n/home/kmoir/m6/eclipse/plugins/org.eclipse.pde.build_3.1.0/scripts/package.xml:42:\njava.lang.NullPointerException\n        at org.apache.tools.ant.Task.perform(Task.java:373)\n        at org.apache.tools.ant.Target.execute(Target.java:341)\n        at org.apache.tools.ant.Target.performTasks(Target.java:369)\n        at org.apache.tools.ant.Project.executeTarget(Project.java:1214)\n        at org.apache.tools.ant.taskdefs.Ant.execute(Ant.java:386)\n        at org.apache.tools.ant.taskdefs.CallTarget.execute(CallTarget.java:106)\n        at org.apache.tools.ant.UnknownElement.execute(UnknownElement.java:275)\n        at org.apache.tools.ant.Task.perform(Task.java:364)\n        at org.apache.tools.ant.Target.execute(Target.java:341)\n        at org.apache.tools.ant.Target.performTasks(Target.java:369)\n        at org.apache.tools.ant.Project.executeTarget(Project.java:1214)\n        at org.apache.tools.ant.Project.executeTargets(Project.java:1062)",
    "Did you specify a value for the archivesFormat property?",
    "The archivesFormat property was not being passed to the script generator.\nI fixed the package.xml script and reworked the script generators.\nThe fix is in HEAD.\n\nFor delta pack:\nIn the list of configs, in addition of the configs you need, add \"delta, delta,\ndelta\" and set the archivesFormat to \"delta, delta, delta - zip\"."
  ],
  "commentCreationDates": [
    "2005-04-11T16:11:35+02:00",
    "2005-04-11T16:14:38+02:00",
    "2005-04-19T18:16:28+02:00"
  ],
  "traces": [
    {
      "exceptionType": "java.lang.NullPointerException",
      "elements": [
        {
          "method": "org.apache.tools.ant.Task.perform",
          "source": "Task.java:373"
        },
        {
          "method": "org.apache.tools.ant.Target.execute",
          "source": "Target.java:341"
        },
        {
          "method": "org.apache.tools.ant.Target.performTasks",
          "source": "Target.java:369"
        },
        {
          "method": "org.apache.tools.ant.Project.executeTarget",
          "source": "Project.java:1214"
        },
        {
          "method": "org.apache.tools.ant.taskdefs.Ant.execute",
          "source": "Ant.java:386"
        },
        {
          "method": "org.apache.tools.ant.taskdefs.CallTarget.execute",
          "source": "CallTarget.java:106"
        },
        {
          "method": "org.apache.tools.ant.UnknownElement.execute",
          "source": "UnknownElement.java:275"
        },
        {
          "method": "org.apache.tools.ant.Task.perform",
          "source": "Task.java:364"
        },
        {
          "method": "org.apache.tools.ant.Target.execute",
          "source": "Target.java:341"
        },
        {
          "method": "org.apache.tools.ant.Target.performTasks",
          "source": "Target.java:369"
        },
        {
          "method": "org.apache.tools.ant.Project.executeTarget",
          "source": "Project.java:1214"
        },
        {
          "method": "org.apache.tools.ant.Project.executeTargets",
          "source": "Project.java:1062"
        }
      ],
      "number": 0,
      "commentIndex": 0,
      "bugId": "90983",
      "date": "2005-04-11T16:11:35+02:00",
      "product": "PDE",
      "component": "Build",
      "severity": "normal"
    }
  ],
  "groupId": "90983",
  "bugId": "90983",
  "date": "2005-04-11T16:11:35+02:00",
  "product": "PDE",
  "component": "Build",
  "severity": "normal"
}