{
  "comments": [
    "When I compile any of these two aspects with ajc -1.5, an exception is thrown by\nthe compiler:\n\n\nimport java.util.*;\n\npublic aspect TestBug1 {\n    static \u003cT\u003e void addToEnv(Map\u003cString,T\u003e env, String key, T value) {\n\tenv.put(key, value);\n    }\n}\n\n\nimport java.util.*;\n\npublic aspect TestBug2 {\n    static \u003cT\u003e T lookupEnv(Map\u003cString,T\u003e env, String key) {\n\treturn env.get(key);\n    }\n}\n\n\nIf the methods are placed into classes instead of aspects, all works fine.\n\nThe exception thrown is the following:\n\njava.lang.NullPointerException\n        at\norg.aspectj.ajdt.internal.compiler.lookup.EclipseFactory.getName(EclipseFactory.java:143)\n        at\norg.aspectj.ajdt.internal.compiler.lookup.EclipseFactory.fromBinding(EclipseFactory.java:166)\n        at\norg.aspectj.ajdt.internal.compiler.lookup.EclipseFactory.fromBindings(EclipseFactory.java:176)\n        at\norg.aspectj.ajdt.internal.compiler.lookup.EclipseFactory.makeResolvedMember(EclipseFactory.java:254)\n        at\norg.aspectj.ajdt.internal.compiler.lookup.EclipseFactory.makeResolvedMember(EclipseFactory.java:249)\n        at\norg.aspectj.ajdt.internal.compiler.lookup.EclipseSourceType.fillDeclaredMembers(EclipseSourceType.java:115)\n        at\norg.aspectj.ajdt.internal.compiler.lookup.EclipseSourceType.getDeclaredPointcuts(EclipseSourceType.java:146)\n        at\norg.aspectj.ajdt.internal.compiler.ast.AspectDeclaration.buildInterTypeAndPerClause(AspectDeclaration.java:977)\n        at\norg.aspectj.ajdt.internal.compiler.lookup.AjLookupEnvironment.buildInterTypeAndPerClause(AjLookupEnvironment.java:303)\n        at\norg.aspectj.ajdt.internal.compiler.lookup.AjLookupEnvironment.completeTypeBindings(AjLookupEnvironment.java:119)\n        at\norg.aspectj.org.eclipse.jdt.internal.compiler.Compiler.beginToCompile(Compiler.java:331)\n        at\norg.aspectj.org.eclipse.jdt.internal.compiler.Compiler.compile(Compiler.java:348)\n        at\norg.aspectj.ajdt.internal.core.builder.AjBuildManager.performCompilation(AjBuildManager.java:683)\n        at\norg.aspectj.ajdt.internal.core.builder.AjBuildManager.doBuild(AjBuildManager.java:168)\n        at\norg.aspectj.ajdt.internal.core.builder.AjBuildManager.batchBuild(AjBuildManager.java:102)\n        at org.aspectj.ajdt.ajc.AjdtCommand.doCommand(AjdtCommand.java:109)\n        at org.aspectj.ajdt.ajc.AjdtCommand.runCommand(AjdtCommand.java:60)\n        at org.aspectj.tools.ajc.Main.run(Main.java:291)\n        at org.aspectj.tools.ajc.Main.runMain(Main.java:227)\n        at org.aspectj.tools.ajc.Main.main(Main.java:80)",
    "Full generics support is targetted for M3, so I\u0027ve set the target for fixing\nthis appropriately.  thanks for the bug report!",
    "Fixed in CVS - will be in next dev build.\n\nProblem is us not processing eclipse \u0027TypeVariableBinding\u0027 objects correctly -\nI\u0027ve enhanced our support to fix this case but it is not complete, in going from\na TVB to a TypeX we are losing information about it being a type variable that I\nthink we\u0027ll need later.  When I hit a bug that requires it, I\u0027ll fully upgrade\nTypeX.",
    "Fix available, see AJ downloads page:\n\nhttp://eclipse.org/aspectj/downloads.php"
  ],
  "commentCreationDates": [
    "2005-04-13T15:29:09+02:00",
    "2005-04-13T15:46:31+02:00",
    "2005-05-06T12:25:19+02:00",
    "2005-05-09T09:21:47+02:00"
  ],
  "traces": [
    {
      "exceptionType": "java.lang.NullPointerException",
      "elements": [
        {
          "method": "org.aspectj.ajdt.internal.compiler.lookup.EclipseFactory.getName",
          "source": "EclipseFactory.java:143"
        },
        {
          "method": "org.aspectj.ajdt.internal.compiler.lookup.EclipseFactory.fromBinding",
          "source": "EclipseFactory.java:166"
        },
        {
          "method": "org.aspectj.ajdt.internal.compiler.lookup.EclipseFactory.fromBindings",
          "source": "EclipseFactory.java:176"
        },
        {
          "method": "org.aspectj.ajdt.internal.compiler.lookup.EclipseFactory.makeResolvedMember",
          "source": "EclipseFactory.java:254"
        },
        {
          "method": "org.aspectj.ajdt.internal.compiler.lookup.EclipseFactory.makeResolvedMember",
          "source": "EclipseFactory.java:249"
        },
        {
          "method": "org.aspectj.ajdt.internal.compiler.lookup.EclipseSourceType.fillDeclaredMembers",
          "source": "EclipseSourceType.java:115"
        },
        {
          "method": "org.aspectj.ajdt.internal.compiler.lookup.EclipseSourceType.getDeclaredPointcuts",
          "source": "EclipseSourceType.java:146"
        },
        {
          "method": "org.aspectj.ajdt.internal.compiler.ast.AspectDeclaration.buildInterTypeAndPerClause",
          "source": "AspectDeclaration.java:977"
        },
        {
          "method": "org.aspectj.ajdt.internal.compiler.lookup.AjLookupEnvironment.buildInterTypeAndPerClause",
          "source": "AjLookupEnvironment.java:303"
        },
        {
          "method": "org.aspectj.ajdt.internal.compiler.lookup.AjLookupEnvironment.completeTypeBindings",
          "source": "AjLookupEnvironment.java:119"
        },
        {
          "method": "org.aspectj.org.eclipse.jdt.internal.compiler.Compiler.beginToCompile",
          "source": "Compiler.java:331"
        },
        {
          "method": "org.aspectj.org.eclipse.jdt.internal.compiler.Compiler.compile",
          "source": "Compiler.java:348"
        },
        {
          "method": "org.aspectj.ajdt.internal.core.builder.AjBuildManager.performCompilation",
          "source": "AjBuildManager.java:683"
        },
        {
          "method": "org.aspectj.ajdt.internal.core.builder.AjBuildManager.doBuild",
          "source": "AjBuildManager.java:168"
        },
        {
          "method": "org.aspectj.ajdt.internal.core.builder.AjBuildManager.batchBuild",
          "source": "AjBuildManager.java:102"
        },
        {
          "method": "org.aspectj.ajdt.ajc.AjdtCommand.doCommand",
          "source": "AjdtCommand.java:109"
        },
        {
          "method": "org.aspectj.ajdt.ajc.AjdtCommand.runCommand",
          "source": "AjdtCommand.java:60"
        },
        {
          "method": "org.aspectj.tools.ajc.Main.run",
          "source": "Main.java:291"
        },
        {
          "method": "org.aspectj.tools.ajc.Main.runMain",
          "source": "Main.java:227"
        },
        {
          "method": "org.aspectj.tools.ajc.Main.main",
          "source": "Main.java:80"
        }
      ],
      "number": 0,
      "commentIndex": 0,
      "bugId": "91267",
      "date": "2005-04-13T15:29:09+02:00",
      "product": "AspectJ",
      "component": "Compiler",
      "severity": "normal"
    }
  ],
  "groupId": "91267",
  "bugId": "91267",
  "date": "2005-04-13T15:29:09+02:00",
  "product": "AspectJ",
  "component": "Compiler",
  "severity": "normal"
}