{
  "comments": [
    "build I20050413-0910\n\nSo the following in the console from which my host was launched (I\u0027m running\njava.exe instead of javaw.exe).  Nothing in the log.\n\nI had been evaluating the following snippet:\nwhile (true) {\n\tSystem.out.println(System.currentTimeMillis());\n}\n\nand had done both of the following:\n1) stopped it from the Debug view\n  - this closed my console so I tried again\n2) paused it from the Debug view\n\nBut I just tried both of these, and could not reproduce the NPE.\n\njava.lang.NullPointerException\n        at\norg.eclipse.jdt.internal.debug.ui.snippeteditor.JavaSnippetEditor.async(JavaSnippetEditor.java:1357)\n        at\norg.eclipse.jdt.internal.debug.ui.snippeteditor.JavaSnippetEditor.showException(JavaSnippetEditor.java:850)\n        at\norg.eclipse.jdt.internal.debug.ui.snippeteditor.JavaSnippetEditor.showUnderlyingException(JavaSnippetEditor.java:870)\n        at\norg.eclipse.jdt.internal.debug.ui.snippeteditor.JavaSnippetEditor.showException(JavaSnippetEditor.java:832)\n        at\norg.eclipse.jdt.internal.debug.ui.snippeteditor.JavaSnippetEditor.evaluationComplete(JavaSnippetEditor.java:605)\n        at\norg.eclipse.jdt.internal.debug.eval.LocalEvaluationEngine.evaluationComplete(LocalEvaluationEngine.java:903)\n        at\norg.eclipse.jdt.internal.debug.eval.LocalEvaluationEngine$1.run(LocalEvaluationEngine.java:436)\n        at java.lang.Thread.run(Thread.java:813)",
    "Ah:\n- run the snippet\n- close the snippet editor while it\u0027s running\n",
    "In comment 0, \"So\" should be \"Saw\".\n",
    "Deferred"
  ],
  "commentCreationDates": [
    "2005-04-15T21:15:03+02:00",
    "2005-04-15T21:16:01+02:00",
    "2005-04-18T16:33:40+02:00",
    "2005-04-18T23:01:00+02:00"
  ],
  "traces": [
    {
      "exceptionType": "java.lang.NullPointerException",
      "elements": [
        {
          "method": "org.eclipse.jdt.internal.debug.ui.snippeteditor.JavaSnippetEditor.async",
          "source": "JavaSnippetEditor.java:1357"
        },
        {
          "method": "org.eclipse.jdt.internal.debug.ui.snippeteditor.JavaSnippetEditor.showException",
          "source": "JavaSnippetEditor.java:850"
        },
        {
          "method": "org.eclipse.jdt.internal.debug.ui.snippeteditor.JavaSnippetEditor.showUnderlyingException",
          "source": "JavaSnippetEditor.java:870"
        },
        {
          "method": "org.eclipse.jdt.internal.debug.ui.snippeteditor.JavaSnippetEditor.showException",
          "source": "JavaSnippetEditor.java:832"
        },
        {
          "method": "org.eclipse.jdt.internal.debug.ui.snippeteditor.JavaSnippetEditor.evaluationComplete",
          "source": "JavaSnippetEditor.java:605"
        },
        {
          "method": "org.eclipse.jdt.internal.debug.eval.LocalEvaluationEngine.evaluationComplete",
          "source": "LocalEvaluationEngine.java:903"
        },
        {
          "method": "org.eclipse.jdt.internal.debug.eval.LocalEvaluationEngine$1.run",
          "source": "LocalEvaluationEngine.java:436"
        },
        {
          "method": "java.lang.Thread.run",
          "source": "Thread.java:813"
        }
      ],
      "number": 0,
      "commentIndex": 0,
      "bugId": "91592",
      "date": "2005-04-15T21:15:03+02:00",
      "product": "JDT",
      "component": "Debug",
      "severity": "normal"
    }
  ],
  "groupId": "91592",
  "bugId": "91592",
  "date": "2005-04-15T21:15:03+02:00",
  "product": "JDT",
  "component": "Debug",
  "severity": "normal"
}