{
  "comments": [
    "If I open a dialog in the \u0027Command.execute()\u0027 the GEF throws an  \nNullPointerException.\n\njava.lang.NullPointerException\n    at org.eclipse.gef.tools.CreationTool.selectAddedObject(CreationTool.java:247)\n    at org.eclipse.gef.tools.CreationTool.performCreation(CreationTool.java:236)\n    at org.eclipse.gef.tools.CreationTool.handleButtonUp(CreationTool.java:159)\n    at org.eclipse.gef.tools.AbstractTool.mouseUp(AbstractTool.java:1054)\n    at org.eclipse.gef.EditDomain.mouseUp(EditDomain.java:245)\n\n\n-----------------------------------\nReason (Randy):\nTools release any references to the viewer to avoid potential short-term \nmemory leaks.  This problem seems to come up again and again, so maybe we \nwill provide some kind of workaround such as using a weak reference or \ncreating a runnable block of code which does not require calling back to the \ntools viewer.\n---------------------------------",
    "Why I open a dialog in the Command.execute method?\n\nI will insert more than one (different) objects to the GEF Editor. \n\nIn that case the user select the \u0027template\u0027 object from\nthe left side palette.\n\nI open a dialog in the Command.execute method and the user\nselects one or more instances of the template object\nfrom the dialog.\n\n",
    "\n\n*** This bug has been marked as a duplicate of 96108 ***"
  ],
  "commentCreationDates": [
    "2005-04-18T21:32:33+02:00",
    "2005-04-18T21:39:24+02:00",
    "2005-09-02T23:31:19+02:00"
  ],
  "traces": [
    {
      "exceptionType": "java.lang.NullPointerException",
      "elements": [
        {
          "method": "org.eclipse.gef.tools.CreationTool.selectAddedObject",
          "source": "CreationTool.java:247"
        },
        {
          "method": "org.eclipse.gef.tools.CreationTool.performCreation",
          "source": "CreationTool.java:236"
        },
        {
          "method": "org.eclipse.gef.tools.CreationTool.handleButtonUp",
          "source": "CreationTool.java:159"
        },
        {
          "method": "org.eclipse.gef.tools.AbstractTool.mouseUp",
          "source": "AbstractTool.java:1054"
        },
        {
          "method": "org.eclipse.gef.EditDomain.mouseUp",
          "source": "EditDomain.java:245"
        }
      ],
      "number": 0,
      "commentIndex": 0,
      "bugId": "91778",
      "duplicateId": "96108",
      "date": "2005-04-18T21:32:33+02:00",
      "product": "GEF",
      "component": "GEF",
      "severity": "major"
    }
  ],
  "groupId": "96108",
  "bugId": "91778",
  "duplicateId": "96108",
  "date": "2005-04-18T21:32:33+02:00",
  "product": "GEF",
  "component": "GEF",
  "severity": "major"
}