{
  "comments": [
    "Using I20050419-1200 for a while, I found this error in my log.  I am not sure\nwhat triggered it.\n\n!ENTRY org.eclipse.jdt.core 4 4 2005-04-20 10:36:09.197\n!MESSAGE Background Indexer Crash Recovery\n!STACK 0\njava.lang.ClassCastException: java.lang.Integer\n        at\norg.eclipse.jdt.internal.core.index.DiskIndex.mergeCategory(DiskIndex.java:403)\n        at\norg.eclipse.jdt.internal.core.index.DiskIndex.mergeCategories(DiskIndex.java:388)\n        at\norg.eclipse.jdt.internal.core.index.DiskIndex.mergeWith(DiskIndex.java:480)\n        at org.eclipse.jdt.internal.core.index.Index.save(Index.java:156)\n        at\norg.eclipse.jdt.internal.core.search.indexing.IndexManager.saveIndex(IndexManager.java:522)\n        at\norg.eclipse.jdt.internal.core.search.indexing.IndexManager.saveIndexes(IndexManager.java:566)\n        at\norg.eclipse.jdt.internal.core.search.indexing.IndexManager.notifyIdle(IndexManager.java:386)\n        at\norg.eclipse.jdt.internal.core.search.processing.JobManager.run(JobManager.java:352)\n        at java.lang.Thread.run(Thread.java:534)",
    "I got it also on my WinXP box today. Unfortunately, I also cannot provide any\ntest case to help to reproduce it.",
    "Fixed.\n\nCan reproduce by searching for a method reference \u0026 then modifying one of the \nmatching files in JDT/Core.",
    "*** Bug 92295 has been marked as a duplicate of this bug. ***",
    "Could not reproduce anymore.\nVerified in I20050510-0010."
  ],
  "commentCreationDates": [
    "2005-04-20T17:04:11+02:00",
    "2005-04-20T17:06:38+02:00",
    "2005-04-20T20:02:01+02:00",
    "2005-04-21T23:48:57+02:00",
    "2005-05-11T15:24:03+02:00"
  ],
  "traces": [
    {
      "exceptionType": "java.lang.ClassCastException",
      "message": "java.lang.Integer",
      "elements": [
        {
          "method": "org.eclipse.jdt.internal.core.index.DiskIndex.mergeCategory",
          "source": "DiskIndex.java:403"
        },
        {
          "method": "org.eclipse.jdt.internal.core.index.DiskIndex.mergeCategories",
          "source": "DiskIndex.java:388"
        },
        {
          "method": "org.eclipse.jdt.internal.core.index.DiskIndex.mergeWith",
          "source": "DiskIndex.java:480"
        },
        {
          "method": "org.eclipse.jdt.internal.core.index.Index.save",
          "source": "Index.java:156"
        },
        {
          "method": "org.eclipse.jdt.internal.core.search.indexing.IndexManager.saveIndex",
          "source": "IndexManager.java:522"
        },
        {
          "method": "org.eclipse.jdt.internal.core.search.indexing.IndexManager.saveIndexes",
          "source": "IndexManager.java:566"
        },
        {
          "method": "org.eclipse.jdt.internal.core.search.indexing.IndexManager.notifyIdle",
          "source": "IndexManager.java:386"
        },
        {
          "method": "org.eclipse.jdt.internal.core.search.processing.JobManager.run",
          "source": "JobManager.java:352"
        },
        {
          "method": "java.lang.Thread.run",
          "source": "Thread.java:534"
        }
      ],
      "number": 0,
      "commentIndex": 0,
      "bugId": "92086",
      "date": "2005-04-20T17:04:11+02:00",
      "product": "JDT",
      "component": "Core",
      "severity": "normal"
    }
  ],
  "groupId": "92086",
  "bugId": "92086",
  "date": "2005-04-20T17:04:11+02:00",
  "product": "JDT",
  "component": "Core",
  "severity": "normal"
}