{
  "comments": [
    "On a previous run I also saw a few errors towards the start with the following:\n[12/05/05 15:19:37:875 BST] 0000003a SystemErr     R\njava.lang.IllegalArgumentException: Class \u0027InfoType\u0027 does not have a feature\nnamed \u0027any\u0027\n       at\norg.eclipse.emf.ecore.sdo.util.SDOUtil.getEStructuralFeature(SDOUtil.java(Compiled\nCode))\n       at\norg.eclipse.emf.ecore.sdo.util.SDOUtil$Accessor.setFeatureName(SDOUtil.java(Inlined\nCompiled Code))\n       at\norg.eclipse.emf.ecore.sdo.util.SDOUtil$Accessor.process(SDOUtil.java(Compiled Code))\n       at\norg.eclipse.emf.ecore.sdo.util.SDOUtil$Accessor.init(SDOUtil.java(Inlined\nCompiled Code))\n       at\norg.eclipse.emf.ecore.sdo.util.SDOUtil$Accessor.create(SDOUtil.java(Inlined\nCompiled Code))\n       at org.eclipse.emf.ecore.sdo.util.SDOUtil.get(SDOUtil.java(Compiled Code))\n       at org.eclipse.emf.ecore.sdo.util.SDOUtil.getBoolean(SDOUtil.java:1470)\n       at\norg.eclipse.emf.ecore.sdo.impl.DynamicEStoreEDataObjectImpl.getBoolean(DynamicEStoreEDataObjectImpl.java:270)\n       at\ncom.ibm.websphere.samples.wsbench.ifxbank.WSBenchPortRouter.handle(Unknown Source)\n        ..............\n\nThis would be when there is the greatest chance of high concurrency in the\nmediation (might help?)\n\n    \u003cNote note\u003e\nThis looks like a thread safety issue within SDO. The\ndatagraphs themselves will be completely separate\ninstances. (In other words, there are two (or more)\nSDO datagraphs being processed on separate threads).\n\nIt looks like the code that handles compound objects\nand/or lists is not thread safe across different\nSDO instances.\n\n---------------------------------\nComments from Ed ...\n\nLooking at how our pool of Accessors is used it\u0027s clear now that we should not\nrecycle the Accessor until after we\u0027ve used it for the last time.  For example,\nthis before-fixes version looks bad:\n\n     public Object getAndRecyle()\n     {\n       pool.recycle(this);\n       return get();\n      }\n     \nAnd this after-fixes version should be better:\n\n     public Object getAndRecyle()\n     {\n       Object result \u003d get();\n       pool.recycle(this);\n       return result;\n      }\n     \nNote that the get() and the recycle() methods on the pool are synchronized, so\nthe pool itself is definitely thread safe.",
    "The fix has been committed to CVS.",
    "Fixed in Build 2.1.0 I200505261142",
    "Also fixed in Build 2.0.3 M200505271408 (RC1)."
  ],
  "commentCreationDates": [
    "2005-05-20T16:48:27+02:00",
    "2005-05-22T15:16:22+02:00",
    "2005-05-26T19:13:17+02:00",
    "2005-05-27T22:11:35+02:00"
  ],
  "traces": [
    {
      "exceptionType": "java.lang.IllegalArgumentException",
      "message": "Class \u0027InfoType\u0027 does not have a feature named \u0027any\u0027",
      "elements": [
        {
          "method": "org.eclipse.emf.ecore.sdo.util.SDOUtil.getEStructuralFeature",
          "source": "SDOUtil.java(Compiled Code)"
        },
        {
          "method": "org.eclipse.emf.ecore.sdo.util.SDOUtil$Accessor.setFeatureName",
          "source": "SDOUtil.java(Inlined Compiled Code)"
        },
        {
          "method": "org.eclipse.emf.ecore.sdo.util.SDOUtil$Accessor.process",
          "source": "SDOUtil.java(Compiled Code)"
        },
        {
          "method": "org.eclipse.emf.ecore.sdo.util.SDOUtil$Accessor.init",
          "source": "SDOUtil.java(Inlined Compiled Code)"
        },
        {
          "method": "org.eclipse.emf.ecore.sdo.util.SDOUtil$Accessor.create",
          "source": "SDOUtil.java(Inlined Compiled Code)"
        },
        {
          "method": "org.eclipse.emf.ecore.sdo.util.SDOUtil.get",
          "source": "SDOUtil.java(Compiled Code)"
        },
        {
          "method": "org.eclipse.emf.ecore.sdo.util.SDOUtil.getBoolean",
          "source": "SDOUtil.java:1470"
        },
        {
          "method": "org.eclipse.emf.ecore.sdo.impl.DynamicEStoreEDataObjectImpl.getBoolean",
          "source": "DynamicEStoreEDataObjectImpl.java:270"
        },
        {
          "method": "com.ibm.websphere.samples.wsbench.ifxbank.WSBenchPortRouter.handle",
          "source": "Unknown Source"
        }
      ],
      "number": 0,
      "commentIndex": 0,
      "bugId": "96106",
      "date": "2005-05-20T16:48:27+02:00",
      "product": "EMF",
      "component": "SDO",
      "severity": "normal"
    }
  ],
  "groupId": "96106",
  "bugId": "96106",
  "date": "2005-05-20T16:48:27+02:00",
  "product": "EMF",
  "component": "SDO",
  "severity": "normal"
}