{
  "comments": [
    "3.1 RC1\n\nI was debugging a remote application when it crashed.\nThe Debug view still showed me connected to the application with 4 threads.\nRegardless of the command (disconnect, terminate) I attempted, I got the following:\n!SUBENTRY 1 org.eclipse.jdt.debug 4 5010 2005-06-01 22:43:21.780\n!MESSAGE org.eclipse.jdi.TimeoutException: Timeout occurred while waiting for\npacket 9502. occurred disconnecting from VM.\n!STACK 0\norg.eclipse.jdi.TimeoutException: Timeout occurred while waiting for packet 9502.\n        at\norg.eclipse.jdi.internal.connect.PacketReceiveManager.getReply(PacketReceiveManager.java:174)\n        at\norg.eclipse.jdi.internal.connect.PacketReceiveManager.getReply(PacketReceiveManager.java:184)\n        at org.eclipse.jdi.internal.MirrorImpl.requestVM(MirrorImpl.java:174)\n        at org.eclipse.jdi.internal.MirrorImpl.requestVM(MirrorImpl.java:230)\n        at\norg.eclipse.jdi.internal.VirtualMachineImpl.dispose(VirtualMachineImpl.java:572)\n        at\norg.eclipse.jdt.internal.debug.core.model.JDIDebugTarget.disconnect(JDIDebugTarget.java:636)\n        at org.eclipse.debug.core.Launch.terminate(Launch.java:262)\n        at\norg.eclipse.debug.internal.ui.actions.TerminateActionDelegate.doAction(TerminateActionDelegate.java:25)\n        at\norg.eclipse.debug.internal.ui.actions.AbstractDebugActionDelegate$DebugRequestJob.run(AbstractDebugActionDelegate.java:106)\n        at org.eclipse.core.internal.jobs.Worker.run(Worker.java:67)\n\n!ENTRY org.eclipse.debug.ui 4 5012 2005-06-01 22:43:56.280\n!MESSAGE Exceptions occurred attempting to disconnect.\n!SUBENTRY 1 org.eclipse.jdt.debug 4 5010 2005-06-01 22:43:56.280\n!MESSAGE org.eclipse.jdi.TimeoutException: Timeout occurred while waiting for\npacket 9503. occurred disconnecting from VM.\n!STACK 0\norg.eclipse.jdi.TimeoutException: Timeout occurred while waiting for packet 9503.\n        at\norg.eclipse.jdi.internal.connect.PacketReceiveManager.getReply(PacketReceiveManager.java:174)\n        at\norg.eclipse.jdi.internal.connect.PacketReceiveManager.getReply(PacketReceiveManager.java:184)\n        at org.eclipse.jdi.internal.MirrorImpl.requestVM(MirrorImpl.java:174)\n        at org.eclipse.jdi.internal.MirrorImpl.requestVM(MirrorImpl.java:230)\n        at\norg.eclipse.jdi.internal.VirtualMachineImpl.dispose(VirtualMachineImpl.java:572)\n        at\norg.eclipse.jdt.internal.debug.core.model.JDIDebugTarget.disconnect(JDIDebugTarget.java:636)\n        at org.eclipse.debug.core.Launch.disconnect(Launch.java:480)\n        at\norg.eclipse.debug.internal.ui.actions.DisconnectActionDelegate.doAction(DisconnectActionDelegate.java:26)\n        at\norg.eclipse.debug.internal.ui.actions.AbstractDebugActionDelegate$DebugRequestJob.run(AbstractDebugActionDelegate.java:106)\n        at org.eclipse.core.internal.jobs.Worker.run(Worker.java:67)\n\n\nAfter a minute or two, the Debug view finally detected the process was dead.",
    "This is working as expected. Looks like the front end did not receive \na \"disconnect/terminate\" event, and tried to continue communication. \nEventually the front end noticed and cleaned up."
  ],
  "commentCreationDates": [
    "2005-06-02T04:48:07+02:00",
    "2005-06-13T15:32:20+02:00"
  ],
  "traces": [
    {
      "exceptionType": "org.eclipse.jdi.TimeoutException",
      "message": "Timeout occurred while waiting for packet 9502.",
      "elements": [
        {
          "method": "org.eclipse.jdi.internal.connect.PacketReceiveManager.getReply",
          "source": "PacketReceiveManager.java:174"
        },
        {
          "method": "org.eclipse.jdi.internal.connect.PacketReceiveManager.getReply",
          "source": "PacketReceiveManager.java:184"
        },
        {
          "method": "org.eclipse.jdi.internal.MirrorImpl.requestVM",
          "source": "MirrorImpl.java:174"
        },
        {
          "method": "org.eclipse.jdi.internal.MirrorImpl.requestVM",
          "source": "MirrorImpl.java:230"
        },
        {
          "method": "org.eclipse.jdi.internal.VirtualMachineImpl.dispose",
          "source": "VirtualMachineImpl.java:572"
        },
        {
          "method": "org.eclipse.jdt.internal.debug.core.model.JDIDebugTarget.disconnect",
          "source": "JDIDebugTarget.java:636"
        },
        {
          "method": "org.eclipse.debug.core.Launch.terminate",
          "source": "Launch.java:262"
        },
        {
          "method": "org.eclipse.debug.internal.ui.actions.TerminateActionDelegate.doAction",
          "source": "TerminateActionDelegate.java:25"
        },
        {
          "method": "org.eclipse.debug.internal.ui.actions.AbstractDebugActionDelegate$DebugRequestJob.run",
          "source": "AbstractDebugActionDelegate.java:106"
        },
        {
          "method": "org.eclipse.core.internal.jobs.Worker.run",
          "source": "Worker.java:67"
        }
      ],
      "number": 0,
      "commentIndex": 0,
      "bugId": "98038",
      "date": "2005-06-02T04:48:07+02:00",
      "product": "JDT",
      "component": "Debug",
      "severity": "normal"
    },
    {
      "exceptionType": "org.eclipse.jdi.TimeoutException",
      "message": "Timeout occurred while waiting for packet 9503.",
      "elements": [
        {
          "method": "org.eclipse.jdi.internal.connect.PacketReceiveManager.getReply",
          "source": "PacketReceiveManager.java:174"
        },
        {
          "method": "org.eclipse.jdi.internal.connect.PacketReceiveManager.getReply",
          "source": "PacketReceiveManager.java:184"
        },
        {
          "method": "org.eclipse.jdi.internal.MirrorImpl.requestVM",
          "source": "MirrorImpl.java:174"
        },
        {
          "method": "org.eclipse.jdi.internal.MirrorImpl.requestVM",
          "source": "MirrorImpl.java:230"
        },
        {
          "method": "org.eclipse.jdi.internal.VirtualMachineImpl.dispose",
          "source": "VirtualMachineImpl.java:572"
        },
        {
          "method": "org.eclipse.jdt.internal.debug.core.model.JDIDebugTarget.disconnect",
          "source": "JDIDebugTarget.java:636"
        },
        {
          "method": "org.eclipse.debug.core.Launch.disconnect",
          "source": "Launch.java:480"
        },
        {
          "method": "org.eclipse.debug.internal.ui.actions.DisconnectActionDelegate.doAction",
          "source": "DisconnectActionDelegate.java:26"
        },
        {
          "method": "org.eclipse.debug.internal.ui.actions.AbstractDebugActionDelegate$DebugRequestJob.run",
          "source": "AbstractDebugActionDelegate.java:106"
        },
        {
          "method": "org.eclipse.core.internal.jobs.Worker.run",
          "source": "Worker.java:67"
        }
      ],
      "number": 1,
      "commentIndex": 0,
      "bugId": "98038",
      "date": "2005-06-02T04:48:07+02:00",
      "product": "JDT",
      "component": "Debug",
      "severity": "normal"
    }
  ],
  "groupId": "98038",
  "bugId": "98038",
  "date": "2005-06-02T04:48:07+02:00",
  "product": "JDT",
  "component": "Debug",
  "severity": "normal"
}