{
  "comments": [
    "Eclipse 3.1.0, JDK 1.5.0_3, XP Pro, Pentium Mobile.\n\nI downloaded and installed Eclipse 3.1.0 .\nI followed instructions to import org.eclipse.swt.examples.\nI found the document org.eclipse.swt.examples.launcher\\\ndoc-html\\swt_launcher_ex.html and followed instructions found in the link \"SWT \nstandalone examples setup\".\n\nA. Incorrect instructions.\nswt_manual_setup.html is obsolete. It intructs to use \norg.eclipse.swt.win32_3.0.0\\ws\\win32\\swt.jar and\norg.eclipse.swt.win32_3.0.0\\os\\win32\\x86\nwhen it should be win32_3.1.0!\n\nB. When I press run as instructed:\nException in thread \"main\" java.lang.UnsatisfiedLinkError: no swt-win32-3101 \nin java.library.path\n\tat java.lang.ClassLoader.loadLibrary(Unknown Source)\n\tat java.lang.Runtime.loadLibrary0(Unknown Source)\n\tat java.lang.System.loadLibrary(Unknown Source)\n\tat org.eclipse.swt.internal.Library.loadLibrary(Library.java:100)\n\tat org.eclipse.swt.internal.win32.OS.\u003cclinit\u003e(OS.java:18)\n\tat org.eclipse.swt.graphics.Device.init(Device.java:564)\n\tat org.eclipse.swt.widgets.Display.init(Display.java:1780)\n\tat org.eclipse.swt.graphics.Device.\u003cinit\u003e(Device.java:100)\n\tat org.eclipse.swt.widgets.Display.\u003cinit\u003e(Display.java:355)\n\tat org.eclipse.swt.widgets.Display.\u003cinit\u003e(Display.java:351)\n\tat org.eclipse.swt.examples.addressbook.AddressBook.main\n(AddressBook.java:54)\n\nC. I followed instructions to use Running the Example Launcher.\nBut Show View \u003e Other does not have the item \"SWT Example Launcher\".\n\nD. Okay. I\u0027m quite Eclipsed already for the day.\nI going back to my NetBeans session.",
    "E. Veronika, is it a bug in the documentation?",
    "The documentation is out of date and I have released new doc into HEAD.  Also,\nthe example src download does not contain any resources, just Java classes.  I\nhave fixed the build script to include resources but I have to wait for nightly\nbuild to confirm 100% that all is fixed.",
    "CAR, please verify that the doc is right (ie no java.library.path needed anymore) and close this bug."
  ],
  "commentCreationDates": [
    "2005-06-08T18:21:31+02:00",
    "2005-06-10T22:21:57+02:00",
    "2005-06-14T19:17:27+02:00",
    "2007-06-18T15:47:45+02:00"
  ],
  "traces": [
    {
      "exceptionType": "java.lang.UnsatisfiedLinkError",
      "message": "no swt-win32-3101  in java.library.path",
      "elements": [
        {
          "method": "java.lang.ClassLoader.loadLibrary",
          "source": "Unknown Source"
        },
        {
          "method": "java.lang.Runtime.loadLibrary0",
          "source": "Unknown Source"
        },
        {
          "method": "java.lang.System.loadLibrary",
          "source": "Unknown Source"
        },
        {
          "method": "org.eclipse.swt.internal.Library.loadLibrary",
          "source": "Library.java:100"
        },
        {
          "method": "org.eclipse.swt.internal.win32.OS.\u003cclinit\u003e",
          "source": "OS.java:18"
        },
        {
          "method": "org.eclipse.swt.graphics.Device.init",
          "source": "Device.java:564"
        },
        {
          "method": "org.eclipse.swt.widgets.Display.init",
          "source": "Display.java:1780"
        },
        {
          "method": "org.eclipse.swt.graphics.Device.\u003cinit\u003e",
          "source": "Device.java:100"
        },
        {
          "method": "org.eclipse.swt.widgets.Display.\u003cinit\u003e",
          "source": "Display.java:355"
        },
        {
          "method": "org.eclipse.swt.widgets.Display.\u003cinit\u003e",
          "source": "Display.java:351"
        },
        {
          "method": "org.eclipse.swt.examples.addressbook.AddressBook.main",
          "source": "AddressBook.java:54"
        }
      ],
      "number": 0,
      "commentIndex": 0,
      "bugId": "98993",
      "date": "2005-06-08T18:21:31+02:00",
      "product": "Platform",
      "component": "SWT",
      "severity": "normal"
    }
  ],
  "groupId": "98993",
  "bugId": "98993",
  "date": "2005-06-08T18:21:31+02:00",
  "product": "Platform",
  "component": "SWT",
  "severity": "normal"
}