{
  "comments": [
    "Config:  Stable 20020214, Sun JDK 1.3.1, Solaris 8.\n\nI fired up a clean install of Stable 20020214 and started fooling around with\nthe preferences settings, particularly the Netscape path in the Help settings.\n\nSomething that I did (I\u0027m not sure what, sorry) led to a NullPointerException.\nI eventually got Eclipse shut down.\n\nNow, whenever I start it, it comes up with a very persistent \"Internal Error\"\npop-up for a NullPointerException.  I can click on \"Details\u003e\u003e\" to expand it\nand see the stack trace, but I can\u0027t do anything else with it -- in particular\nI can\u0027t dismiss it, neither by clicking the OK button nor by selecting Close \nin the CDE/Motif window frame.  This probably isn\u0027t too surprising, because\npretty much any window activity (e.g. mouse-enter and mouse-exit on the pop-up\nwindow) generates another instance of the same NPE.\n\nIf I ignore the pop-up, and do a File-\u003eExit (or a Motif Close) on the main\nEclipse window, then the main window goes away but the pop-up hangs around\n(and the Java process has not exited).  If I then try to dismiss the pop-up,\n(again, using either the OK button or Motif Close), sometimes it stubbornly\nstays, and sometimes it generates a segfault in SWT native code.\n\n(I didn\u0027t realize until fairly late in the game that there may actually have\nbeen multiple pop-windows stacked exactly on top of each other, so the \n\"I can\u0027t dismiss it\" stuff above might be a lie).\n\nAs an exercise in voodoo I tried deleting the .metadata/.registry file and\nthen starting Eclipse, but that didn\u0027t change anything.\n\nIf it\u0027s useful to anyone, I have kept a copy of the broken workspace metadata.\n\nBelow I have included a stack trace of the NPE (from .log) and a Sun JDK\nlogs of the SWT segfault.\n\nLog: Sat Feb 16 19:21:20 EST 2002\n1 org.eclipse.core.resources 4 Unhandled exception caught in event loop.\nLog: Sat Feb 16 19:21:20 EST 2002\n4 org.eclipse.ui 0 java.lang.NullPointerException\njava.lang.NullPointerException\n        at\norg.eclipse.ui.internal.EditorWorkbook.drawGradient(EditorWorkbook.java:317)\n        at\norg.eclipse.ui.internal.EditorPane.shellActivated(EditorPane.java:124)\n        at\norg.eclipse.ui.internal.WorkbenchWindow$8.shellActivated(WorkbenchWindow.java:1005)\n        at\norg.eclipse.swt.widgets.TypedListener.handleEvent(TypedListener.java:155)\n        at org.eclipse.swt.widgets.EventTable.sendEvent(EventTable.java:74)\n        at org.eclipse.swt.widgets.Widget.notifyListeners(Widget.java:488)\n        at org.eclipse.swt.widgets.Display.runDeferredEvents(Display.java:1577)\n        at org.eclipse.swt.widgets.Display.readAndDispatch(Display.java:1431)\n        at org.eclipse.ui.internal.Workbench.runEventLoop(Workbench.java:788)\n        at org.eclipse.ui.internal.Workbench.run(Workbench.java:771)\n        at\norg.eclipse.core.internal.boot.InternalBootLoader.run(InternalBootLoader.java:777)\n        at org.eclipse.core.boot.BootLoader.run(BootLoader.java:319)\n        at java.lang.reflect.Method.invoke(Native Method)\n        at org.eclipse.core.launcher.Main.basicRun(Main.java:151)\n        at org.eclipse.core.launcher.Main.run(Main.java:502)\n        at org.eclipse.core.launcher.Main.main(Main.java:362)\n\n\n\nAn unexpected exception has been detected in native code outside the VM.\nUnexpected Signal : 10 occurred at PC\u003d0xf43a9bf4\nFunction name\u003dXSaveContext\nLibrary\u003d/usr/lib/libX11.so.4\n\nCurrent Java thread:\n        at org.eclipse.swt.internal.motif.OS.XmGetXmDisplay(Native Method)\n        at org.eclipse.swt.widgets.Display.initializeDisplay(Display.java:1128)\n        at org.eclipse.swt.widgets.Display.init(Display.java:942)\n        at org.eclipse.swt.graphics.Device.\u003cinit\u003e(Device.java:105)\n        at org.eclipse.swt.widgets.Display.\u003cinit\u003e(Display.java:305)\n        at org.eclipse.swt.widgets.Display.\u003cinit\u003e(Display.java:302)\n        at org.eclipse.swt.widgets.Display.getDefault(Display.java:679)\n        at\norg.eclipse.jdt.internal.debug.ui.JDIDebugUIPlugin.getStandardDisplay(JDIDebugUIPlugin.java:305)\n        at\norg.eclipse.jdt.internal.debug.ui.ImageDescriptorRegistry.\u003cinit\u003e(ImageDescriptorRegistry.java:30)\n        at\norg.eclipse.jdt.internal.debug.ui.JDIDebugUIPlugin.getImageDescriptorRegistry(JDIDebugUIPlugin.java:291)\n        at\norg.eclipse.jdt.internal.debug.ui.JDIDebugUIPlugin.shutdown(JDIDebugUIPlugin.java:206)\n        at\norg.eclipse.core.internal.plugins.PluginRegistry$2.run(PluginRegistry.java:268)\n        at\norg.eclipse.core.internal.runtime.InternalPlatform.run(InternalPlatform.java:817)\n        at\norg.eclipse.core.internal.plugins.PluginRegistry$1.visit(PluginRegistry.java:281)\n        at\norg.eclipse.core.internal.plugins.PluginRegistry.accept(PluginRegistry.java:45)\n        at\norg.eclipse.core.internal.plugins.PluginRegistry.shutdownPlugins(PluginRegistry.java:284)\n        at\norg.eclipse.core.internal.plugins.PluginRegistry.shutdown(PluginRegistry.java:250)\n        at\norg.eclipse.core.internal.runtime.InternalPlatform.loaderShutdown(InternalPlatform.java:518)\n        at java.lang.reflect.Method.invoke(Native Method)\n        at\norg.eclipse.core.internal.boot.InternalBootLoader.shutdown(InternalBootLoader.java:859)\n        at\norg.eclipse.core.internal.boot.InternalBootLoader.run(InternalBootLoader.java:782)\n        at org.eclipse.core.boot.BootLoader.run(BootLoader.java:319)\n        at java.lang.reflect.Method.invoke(Native Method)\n        at org.eclipse.core.launcher.Main.basicRun(Main.java:151)\n        at org.eclipse.core.launcher.Main.run(Main.java:502)\n        at org.eclipse.core.launcher.Main.main(Main.java:362)\n\nDynamic libraries:\n0x10000         /usr/local/stow/jdk-1.3.1/bin/../bin/sparc/native_threads/java\n0xff350000      /usr/lib/libthread.so.1\n0xff390000      /usr/lib/libdl.so.1\n0xff200000      /usr/lib/libc.so.1\n0xff330000      /usr/platform/SUNW,Ultra-60/lib/libc_psr.so.1\n0xfe480000      /opt/local/stow/jdk-1.3.1/jre/lib/sparc/client/libjvm.so\n0xff2d0000      /usr/lib/libCrun.so.1\n0xff1e0000      /usr/lib/libsocket.so.1\n0xff100000      /usr/lib/libnsl.so.1\n0xff0d0000      /usr/lib/libm.so.1\n0xff300000      /usr/lib/libw.so.1\n0xff0b0000      /usr/lib/libmp.so.2\n0xff080000      /opt/local/stow/jdk-1.3.1/jre/lib/sparc/native_threads/libhpi.so\n0xff050000      /opt/local/stow/jdk-1.3.1/jre/lib/sparc/libverify.so\n0xfe440000      /opt/local/stow/jdk-1.3.1/jre/lib/sparc/libjava.so\n0xff020000      /opt/local/stow/jdk-1.3.1/jre/lib/sparc/libzip.so\n0xfd010000     \n/local/maslen/eclipse-stable-0214/eclipse/plugins/org.eclipse.swt/os/solaris/sparc/libswt-motif-2026.so\n0xf4480000      /usr/lib/libXm.so.4\n0xfac10000      /usr/lib/libXt.so.4\n0xf4380000      /usr/lib/libX11.so.4\n0xfafd0000      /usr/openwin/lib/libSM.so.6\n0xfafa0000      /usr/openwin/lib/libICE.so.6\n0xf4bd0000      /usr/openwin/lib/libXext.so.0\n0xfaee0000      /usr/lib//liblayout.so\n0xf3930000      /opt/local/stow/jdk-1.3.1/jre/lib/sparc/libnet.so\n0xf3910000      /usr/lib/nss_files.so.1\n\nLocal Time \u003d Sat Feb 16 17:53:11 2002\nElapsed Time \u003d 1563\n#\n# The exception above was detected in native code outside the VM\n#\n# Java VM: Java HotSpot(TM) Client VM (1.3.1-b24 mixed mode)\n#",
    "Stack trace shows NPE in drawgradient. GG to investigate. \n\nThomas, if you do a new \"clean install\" does the problem happen here?\n",
    "The seg. fault has been taken care of (see \nhttp://dev.eclipse.org/bugs/show_bug.cgi?id\u003d10009).  However I believe that \nthis is not related to the initial NPE problem.\n\nI\u0027m passing this to the desktop since this is where the exception is \noccurring.  Replication of the problem will be difficult without steps, but the \nprovided stack trace should be helpful.\n",
    "Belated reply to Mike Wilson\u0027s question from 25-Feb:\n\n\u003e Thomas, if you do a new \"clean install\" does the problem happen here?\n\nNo -- if I recall correctly, when I reinstalled (or just nuked the workspace\nand started from scratch) I was fine.\n",
    "Simon, \n\n   Pls investigate the NPE in draw gradient. ",
    "This NPE problem was fix in build \u003e 2002-03-05 as part of bug #10826"
  ],
  "commentCreationDates": [
    "2002-02-16T09:43:41+01:00",
    "2002-02-25T16:23:30+01:00",
    "2002-02-27T16:31:59+01:00",
    "2002-03-05T12:07:20+01:00",
    "2002-03-07T01:11:12+01:00",
    "2002-03-07T13:26:00+01:00"
  ],
  "traces": [
    {
      "exceptionType": "java.lang.NullPointerException",
      "elements": [
        {
          "method": "org.eclipse.ui.internal.EditorWorkbook.drawGradient",
          "source": "EditorWorkbook.java:317"
        },
        {
          "method": "org.eclipse.ui.internal.EditorPane.shellActivated",
          "source": "EditorPane.java:124"
        },
        {
          "method": "org.eclipse.ui.internal.WorkbenchWindow$8.shellActivated",
          "source": "WorkbenchWindow.java:1005"
        },
        {
          "method": "org.eclipse.swt.widgets.TypedListener.handleEvent",
          "source": "TypedListener.java:155"
        },
        {
          "method": "org.eclipse.swt.widgets.EventTable.sendEvent",
          "source": "EventTable.java:74"
        },
        {
          "method": "org.eclipse.swt.widgets.Widget.notifyListeners",
          "source": "Widget.java:488"
        },
        {
          "method": "org.eclipse.swt.widgets.Display.runDeferredEvents",
          "source": "Display.java:1577"
        },
        {
          "method": "org.eclipse.swt.widgets.Display.readAndDispatch",
          "source": "Display.java:1431"
        },
        {
          "method": "org.eclipse.ui.internal.Workbench.runEventLoop",
          "source": "Workbench.java:788"
        },
        {
          "method": "org.eclipse.ui.internal.Workbench.run",
          "source": "Workbench.java:771"
        },
        {
          "method": "org.eclipse.core.internal.boot.InternalBootLoader.run",
          "source": "InternalBootLoader.java:777"
        },
        {
          "method": "org.eclipse.core.boot.BootLoader.run",
          "source": "BootLoader.java:319"
        },
        {
          "method": "java.lang.reflect.Method.invoke",
          "source": "Native Method"
        },
        {
          "method": "org.eclipse.core.launcher.Main.basicRun",
          "source": "Main.java:151"
        },
        {
          "method": "org.eclipse.core.launcher.Main.run",
          "source": "Main.java:502"
        },
        {
          "method": "org.eclipse.core.launcher.Main.main",
          "source": "Main.java:362"
        }
      ],
      "number": 0,
      "commentIndex": 0,
      "bugId": "9959",
      "date": "2002-02-16T09:43:41+01:00",
      "product": "Platform",
      "component": "SWT",
      "severity": "critical"
    }
  ],
  "groupId": "9959",
  "bugId": "9959",
  "date": "2002-02-16T09:43:41+01:00",
  "product": "Platform",
  "component": "SWT",
  "severity": "critical"
}