{
  "comments": [
    "If the Team Synchronization fails due to an authentication error on the CVS \nrepository server, a message dialog is displayed and the following exception \nis logged:\n\n!ENTRY org.eclipse.team.cvs.core 4 2 2005-06-13 16:28:33.515\n!MESSAGE Authentication error: An undetermined authentication failure has \noccurred\n!STACK 0\ncom.jcraft.jsch.JSchException: Auth fail\n        at com.jcraft.jsch.Session.connect(Unknown Source)\n        at com.jcraft.jsch.Session.connect(Unknown Source)\n        at org.eclipse.team.internal.ccvs.ssh2.JSchSession.createSession\n(JSchSession.java:486)\n        at org.eclipse.team.internal.ccvs.ssh2.JSchSession.getSession\n(JSchSession.java:435)\n        at \norg.eclipse.team.internal.ccvs.ssh2.CVSSSH2ServerConnection.internalOpen\n(CVSSSH2ServerConnection.java:122)\n        at org.eclipse.team.internal.ccvs.ssh2.CVSSSH2ServerConnection.open\n(CVSSSH2ServerConnection.java:107)\n        at org.eclipse.team.internal.ccvs.core.connection.Connection.open\n(Connection.java:128)\n        at \norg.eclipse.team.internal.ccvs.core.connection.CVSRepositoryLocation.createConn\nection(CVSRepositoryLocation.j\nava:494)\n        at \norg.eclipse.team.internal.ccvs.core.connection.CVSRepositoryLocation.openConnec\ntion(CVSRepositoryLocation.jav\na:735)\n        at org.eclipse.team.internal.ccvs.core.client.Session.open\n(Session.java:149)\n        at \norg.eclipse.team.internal.ccvs.ui.operations.SingleCommandOperation.execute\n(SingleCommandOperation.java:40)\n        at \norg.eclipse.team.internal.ccvs.ui.operations.RepositoryProviderOperation.execut\ne(RepositoryProviderOperation.\njava:227)\n        at \norg.eclipse.team.internal.ccvs.ui.operations.SingleCommandOperation.execute\n(SingleCommandOperation.java:58)\n        at \norg.eclipse.team.internal.ccvs.ui.operations.RepositoryProviderOperation.execut\ne(RepositoryProviderOperation.\njava:206)\n        at \norg.eclipse.team.internal.ccvs.ui.operations.RepositoryProviderOperation.execut\ne(RepositoryProviderOperation.\njava:190)\n        at org.eclipse.team.internal.ccvs.ui.operations.CVSOperation.run\n(CVSOperation.java:79)\n        at org.eclipse.team.internal.ui.actions.JobRunnableContext.run\n(JobRunnableContext.java:146)\n        at \norg.eclipse.team.internal.ui.actions.JobRunnableContext$ResourceJob.runInWorksp\nace(JobRunnableContext.java:72\n)\n        at org.eclipse.core.internal.resources.InternalWorkspaceJob.run\n(InternalWorkspaceJob.java:38)\n        at org.eclipse.core.internal.jobs.Worker.run(Worker.java:76)\n\n\n-\u003e Since the event has already been communicated to the user, this exception \nshould not be logged.",
    "Will investigate in 3.2 but I suspect that the error is being logged by the \nJobs framework.",
    "This is standard behavior for the Jobs framework. Reported errors are shown to the user and logged."
  ],
  "commentCreationDates": [
    "2005-06-13T17:46:23+02:00",
    "2005-06-17T20:52:04+02:00",
    "2006-04-12T14:58:04+02:00"
  ],
  "traces": [
    {
      "exceptionType": "com.jcraft.jsch.JSchException",
      "message": "Auth fail",
      "elements": [
        {
          "method": "com.jcraft.jsch.Session.connect",
          "source": "Unknown Source"
        },
        {
          "method": "com.jcraft.jsch.Session.connect",
          "source": "Unknown Source"
        },
        {
          "method": "org.eclipse.team.internal.ccvs.ssh2.JSchSession.createSession",
          "source": "JSchSession.java:486"
        },
        {
          "method": "org.eclipse.team.internal.ccvs.ssh2.JSchSession.getSession",
          "source": "JSchSession.java:435"
        },
        {
          "method": "org.eclipse.team.internal.ccvs.ssh2.CVSSSH2ServerConnection.internalOpen",
          "source": "CVSSSH2ServerConnection.java:122"
        },
        {
          "method": "org.eclipse.team.internal.ccvs.ssh2.CVSSSH2ServerConnection.open",
          "source": "CVSSSH2ServerConnection.java:107"
        },
        {
          "method": "org.eclipse.team.internal.ccvs.core.connection.Connection.open",
          "source": "Connection.java:128"
        },
        {
          "method": "org.eclipse.team.internal.ccvs.core.connection.CVSRepositoryLocation.createConnection",
          "source": "CVSRepositoryLocation.j ava:494"
        },
        {
          "method": "org.eclipse.team.internal.ccvs.core.connection.CVSRepositoryLocation.openConnection",
          "source": "CVSRepositoryLocation.jav a:735"
        },
        {
          "method": "org.eclipse.team.internal.ccvs.core.client.Session.open",
          "source": "Session.java:149"
        },
        {
          "method": "org.eclipse.team.internal.ccvs.ui.operations.SingleCommandOperation.execute",
          "source": "SingleCommandOperation.java:40"
        },
        {
          "method": "org.eclipse.team.internal.ccvs.ui.operations.RepositoryProviderOperation.execute",
          "source": "RepositoryProviderOperation. java:227"
        },
        {
          "method": "org.eclipse.team.internal.ccvs.ui.operations.SingleCommandOperation.execute",
          "source": "SingleCommandOperation.java:58"
        },
        {
          "method": "org.eclipse.team.internal.ccvs.ui.operations.RepositoryProviderOperation.execute",
          "source": "RepositoryProviderOperation. java:206"
        },
        {
          "method": "org.eclipse.team.internal.ccvs.ui.operations.RepositoryProviderOperation.execute",
          "source": "RepositoryProviderOperation. java:190"
        },
        {
          "method": "org.eclipse.team.internal.ccvs.ui.operations.CVSOperation.run",
          "source": "CVSOperation.java:79"
        },
        {
          "method": "org.eclipse.team.internal.ui.actions.JobRunnableContext.run",
          "source": "JobRunnableContext.java:146"
        },
        {
          "method": "org.eclipse.team.internal.ui.actions.JobRunnableContext$ResourceJob.runInWorkspace",
          "source": "JobRunnableContext.java:72 "
        },
        {
          "method": "org.eclipse.core.internal.resources.InternalWorkspaceJob.run",
          "source": "InternalWorkspaceJob.java:38"
        },
        {
          "method": "org.eclipse.core.internal.jobs.Worker.run",
          "source": "Worker.java:76"
        }
      ],
      "number": 0,
      "commentIndex": 0,
      "bugId": "99701",
      "date": "2005-06-13T17:46:23+02:00",
      "product": "Platform",
      "component": "CVS",
      "severity": "normal"
    }
  ],
  "groupId": "99701",
  "bugId": "99701",
  "date": "2005-06-13T17:46:23+02:00",
  "product": "Platform",
  "component": "CVS",
  "severity": "normal"
}