{
  "comments": [
    "In Eclipse 2.1.2, \n1. create a new Java program \n2. define 3 int variables in one line\n   int i, j, k;\n\n/*\n * Created on 28-Oct-03\n *\n * To change the template for this generated file go to\n * Window\u0026gt;Preferences\u0026gt;Java\u0026gt;Code Generation\u0026gt;Code and Comments\n */\npackage test;\n\n/**\n * @author fmhwong\n *\n * To change the template for this generated type comment go to\n * Window\u0026gt;Preferences\u0026gt;Java\u0026gt;Code Generation\u0026gt;Code and Comments\n */\npublic class Foo {\n\n \tint i, j, k;\n\t/**\n\t * \n\t */\n\tpublic Foo() {\n\t\tsuper();\n\t\t// TODO Auto-generated constructor stub\n\t}\n\n}\n\n3. From Outline view, select int i, j and k together and click delete from\n   the context menu\n\n4. Press Yes to confirm\n\nAn error occurred while performing this operation. See log for details.\nAssertion failed; Failed to locate j in Foo.java\n\nThe source becomes:\n\n/*\n * Created on 28-Oct-03\n *\n * To change the template for this generated file go to\n * Window\u0026gt;Preferences\u0026gt;Java\u0026gt;Code Generation\u0026gt;Code and Comments\n */\npackage test;\n\n/**\n * @author fmhwong\n *\n * To change the template for this generated type comment go to\n * Window\u0026gt;Preferences\u0026gt;Java\u0026gt;Code Generation\u0026gt;Code and Comments\n */\npublic class Foo {\n\n j, k;\n\t/**\n\t * \n\t */\n\tpublic Foo() {\n\t\tsuper();\n\t\t// TODO Auto-generated constructor stub\n\t}\n\n}\n\n!ENTRY org.eclipse.jdt.ui 4 10001 Oct 28, 2003 10:43:35.245\n!MESSAGE Internal Error\n!STACK 0\njava.lang.reflect.InvocationTargetException: \norg.eclipse.jdt.internal.core.Assert$AssertionFailedException: Assertion \nfailed; F\n        at java.lang.Throwable.\u003cinit\u003e(Throwable.java)\n        at java.lang.Throwable.\u003cinit\u003e(Throwable.java)\n        at org.eclipse.jdt.internal.core.Assert$AssertionFailedException.\u003cinit\u003e\n(Assert.java:95)\n        at org.eclipse.jdt.internal.core.Assert.isTrue(Assert.java)\n        at org.eclipse.jdt.internal.core.DeleteElementsOperation.processElement\n(DeleteElementsOperation.java:120)\n        at org.eclipse.jdt.internal.core.MultiOperation.processElements\n(MultiOperation.java:160)\n        at \norg.eclipse.jdt.internal.core.DeleteElementsOperation.processElements\n(DeleteElementsOperation.java:148)\n        at org.eclipse.jdt.internal.core.MultiOperation.executeOperation\n(MultiOperation.java:90)\n        at org.eclipse.jdt.internal.core.JavaModelOperation.execute\n(JavaModelOperation.java:365)\n        at org.eclipse.jdt.internal.core.JavaModelOperation.run\n(JavaModelOperation.java:684)\n        at org.eclipse.core.internal.resources.Workspace.run\n(Workspace.java:1595)\n        at org.eclipse.jdt.internal.core.JavaElement.runOperation\n(JavaElement.java:543)\n        at org.eclipse.jdt.internal.core.JavaModel.delete(JavaModel.java:115)\n        at \norg.eclipse.jdt.internal.ui.reorg.DeleteSourceReferencesAction.delete\n(DeleteSourceReferencesAction.java:200)\n        at \norg.eclipse.jdt.internal.ui.reorg.DeleteSourceReferencesAction.deleteAll\n(DeleteSourceReferencesAction.java:172)\n        at \norg.eclipse.jdt.internal.ui.reorg.DeleteSourceReferencesAction.access$4\n(DeleteSourceReferencesAction.java:163)\n        at org.eclipse.jdt.internal.ui.reorg.DeleteSourceReferencesAction$2.run\n(DeleteSourceReferencesAction.java:133)\n        at org.eclipse.jdt.internal.core.BatchOperation.executeOperation\n(BatchOperation.java:34)\n        at org.eclipse.jdt.internal.core.JavaModelOperation.execute\n(JavaModelOperation.java:365)\n        at org.eclipse.jdt.internal.core.JavaModelOperation.run\n(JavaModelOperation.java:684)\n        at org.eclipse.core.internal.resources.Workspace.run\n(Workspace.java:1595)\n        at org.eclipse.jdt.core.JavaCore.run(JavaCore.java:2711)\n        at org.eclipse.jdt.internal.ui.reorg.DeleteSourceReferencesAction$1.run\n(DeleteSourceReferencesAction.java:101)\n        at org.eclipse.jface.operation.ModalContext.runInCurrentThread\n(ModalContext.java:302)\n        at org.eclipse.jface.operation.ModalContext.run(ModalContext.java:252)\n        at org.eclipse.jface.window.ApplicationWindow$1.run\n(ApplicationWindow.java:431)\n        at org.eclipse.swt.custom.BusyIndicator.showWhile(BusyIndicator.java)\n        at org.eclipse.jface.window.ApplicationWindow.run\n(ApplicationWindow.java:428)\n        at org.eclipse.ui.internal.WorkbenchWindow.run\n(WorkbenchWindow.java:1385)\n        at \norg.eclipse.jdt.internal.ui.reorg.DeleteSourceReferencesAction.perform\n(DeleteSourceReferencesAction.java:89)\n        at org.eclipse.jdt.internal.ui.reorg.SourceReferenceAction$1.run\n(SourceReferenceAction.java:66)\n        at org.eclipse.swt.custom.BusyIndicator.showWhile(BusyIndicator.java)\n        at org.eclipse.jdt.internal.ui.reorg.SourceReferenceAction.run\n(SourceReferenceAction.java:63)\n        at org.eclipse.jdt.ui.actions.SelectionDispatchAction.dispatchRun\n(SelectionDispatchAction.java:191)\n        at org.eclipse.jdt.ui.actions.SelectionDispatchAction.run\n(SelectionDispatchAction.java:169)\n        at org.eclipse.jdt.internal.ui.reorg.DualReorgAction.run\n(DualReorgAction.java:43)\n        at org.eclipse.jface.action.Action.runWithEvent(Action.java:842)\n        at \norg.eclipse.jface.action.ActionContributionItem.handleWidgetSelection\n(ActionContributionItem.java:456)\n        at org.eclipse.jface.action.ActionContributionItem.handleWidgetEvent\n(ActionContributionItem.java:403)\n        at org.eclipse.jface.action.ActionContributionItem.access$0\n(ActionContributionItem.java:397)\n        at \norg.eclipse.jface.action.ActionContributionItem$ActionListener.handleEvent\n(ActionContributionItem.java:72)\n        at org.eclipse.swt.widgets.EventTable.sendEvent(EventTable.java)\n        at org.eclipse.swt.widgets.Widget.sendEvent(Widget.java)\n        at org.eclipse.swt.widgets.Display.runDeferredEvents(Display.java)\n        at org.eclipse.swt.widgets.Display.readAndDispatch(Display.java)\n        at org.eclipse.ui.internal.Workbench.runEventLoop(Workbench.java:1402)\n        at org.eclipse.ui.internal.Workbench.run(Workbench.java:1385)\n        at org.eclipse.core.internal.boot.InternalBootLoader.run\n(InternalBootLoader.java:858)\n        at org.eclipse.core.boot.BootLoader.run(BootLoader.java:461)\n        at java.lang.reflect.AccessibleObject.invokeL\n(AccessibleObject.java:207)\n        at java.lang.reflect.Method.invoke(Method.java:271)\n        at org.eclipse.core.launcher.Main.basicRun(Main.java:291)\n        at org.eclipse.core.launcher.Main.run(Main.java:747)\n        at org.eclipse.core.launcher.Main.main(Main.java:583)",
    "This got fixed for the 3.0 stream."
  ],
  "commentCreationDates": [
    "2003-10-28T15:53:50+01:00",
    "2003-10-28T17:43:57+01:00"
  ],
  "traces": [
    {
      "exceptionType": "org.eclipse.jdt.internal.core.Assert$AssertionFailedException",
      "message": "Assertion  failed; F",
      "elements": [
        {
          "method": "java.lang.Throwable.\u003cinit\u003e",
          "source": "Throwable.java"
        },
        {
          "method": "java.lang.Throwable.\u003cinit\u003e",
          "source": "Throwable.java"
        },
        {
          "method": "org.eclipse.jdt.internal.core.Assert$AssertionFailedException.\u003cinit\u003e",
          "source": "Assert.java:95"
        },
        {
          "method": "org.eclipse.jdt.internal.core.Assert.isTrue",
          "source": "Assert.java"
        },
        {
          "method": "org.eclipse.jdt.internal.core.DeleteElementsOperation.processElement",
          "source": "DeleteElementsOperation.java:120"
        },
        {
          "method": "org.eclipse.jdt.internal.core.MultiOperation.processElements",
          "source": "MultiOperation.java:160"
        },
        {
          "method": "org.eclipse.jdt.internal.core.DeleteElementsOperation.processElements",
          "source": "DeleteElementsOperation.java:148"
        },
        {
          "method": "org.eclipse.jdt.internal.core.MultiOperation.executeOperation",
          "source": "MultiOperation.java:90"
        },
        {
          "method": "org.eclipse.jdt.internal.core.JavaModelOperation.execute",
          "source": "JavaModelOperation.java:365"
        },
        {
          "method": "org.eclipse.jdt.internal.core.JavaModelOperation.run",
          "source": "JavaModelOperation.java:684"
        },
        {
          "method": "org.eclipse.core.internal.resources.Workspace.run",
          "source": "Workspace.java:1595"
        },
        {
          "method": "org.eclipse.jdt.internal.core.JavaElement.runOperation",
          "source": "JavaElement.java:543"
        },
        {
          "method": "org.eclipse.jdt.internal.core.JavaModel.delete",
          "source": "JavaModel.java:115"
        },
        {
          "method": "org.eclipse.jdt.internal.ui.reorg.DeleteSourceReferencesAction.delete",
          "source": "DeleteSourceReferencesAction.java:200"
        },
        {
          "method": "org.eclipse.jdt.internal.ui.reorg.DeleteSourceReferencesAction.deleteAll",
          "source": "DeleteSourceReferencesAction.java:172"
        },
        {
          "method": "org.eclipse.jdt.internal.ui.reorg.DeleteSourceReferencesAction.access$4",
          "source": "DeleteSourceReferencesAction.java:163"
        },
        {
          "method": "org.eclipse.jdt.internal.ui.reorg.DeleteSourceReferencesAction$2.run",
          "source": "DeleteSourceReferencesAction.java:133"
        },
        {
          "method": "org.eclipse.jdt.internal.core.BatchOperation.executeOperation",
          "source": "BatchOperation.java:34"
        },
        {
          "method": "org.eclipse.jdt.internal.core.JavaModelOperation.execute",
          "source": "JavaModelOperation.java:365"
        },
        {
          "method": "org.eclipse.jdt.internal.core.JavaModelOperation.run",
          "source": "JavaModelOperation.java:684"
        },
        {
          "method": "org.eclipse.core.internal.resources.Workspace.run",
          "source": "Workspace.java:1595"
        },
        {
          "method": "org.eclipse.jdt.core.JavaCore.run",
          "source": "JavaCore.java:2711"
        },
        {
          "method": "org.eclipse.jdt.internal.ui.reorg.DeleteSourceReferencesAction$1.run",
          "source": "DeleteSourceReferencesAction.java:101"
        },
        {
          "method": "org.eclipse.jface.operation.ModalContext.runInCurrentThread",
          "source": "ModalContext.java:302"
        },
        {
          "method": "org.eclipse.jface.operation.ModalContext.run",
          "source": "ModalContext.java:252"
        },
        {
          "method": "org.eclipse.jface.window.ApplicationWindow$1.run",
          "source": "ApplicationWindow.java:431"
        },
        {
          "method": "org.eclipse.swt.custom.BusyIndicator.showWhile",
          "source": "BusyIndicator.java"
        },
        {
          "method": "org.eclipse.jface.window.ApplicationWindow.run",
          "source": "ApplicationWindow.java:428"
        },
        {
          "method": "org.eclipse.ui.internal.WorkbenchWindow.run",
          "source": "WorkbenchWindow.java:1385"
        },
        {
          "method": "org.eclipse.jdt.internal.ui.reorg.DeleteSourceReferencesAction.perform",
          "source": "DeleteSourceReferencesAction.java:89"
        },
        {
          "method": "org.eclipse.jdt.internal.ui.reorg.SourceReferenceAction$1.run",
          "source": "SourceReferenceAction.java:66"
        },
        {
          "method": "org.eclipse.swt.custom.BusyIndicator.showWhile",
          "source": "BusyIndicator.java"
        },
        {
          "method": "org.eclipse.jdt.internal.ui.reorg.SourceReferenceAction.run",
          "source": "SourceReferenceAction.java:63"
        },
        {
          "method": "org.eclipse.jdt.ui.actions.SelectionDispatchAction.dispatchRun",
          "source": "SelectionDispatchAction.java:191"
        },
        {
          "method": "org.eclipse.jdt.ui.actions.SelectionDispatchAction.run",
          "source": "SelectionDispatchAction.java:169"
        },
        {
          "method": "org.eclipse.jdt.internal.ui.reorg.DualReorgAction.run",
          "source": "DualReorgAction.java:43"
        },
        {
          "method": "org.eclipse.jface.action.Action.runWithEvent",
          "source": "Action.java:842"
        },
        {
          "method": "org.eclipse.jface.action.ActionContributionItem.handleWidgetSelection",
          "source": "ActionContributionItem.java:456"
        },
        {
          "method": "org.eclipse.jface.action.ActionContributionItem.handleWidgetEvent",
          "source": "ActionContributionItem.java:403"
        },
        {
          "method": "org.eclipse.jface.action.ActionContributionItem.access$0",
          "source": "ActionContributionItem.java:397"
        },
        {
          "method": "org.eclipse.jface.action.ActionContributionItem$ActionListener.handleEvent",
          "source": "ActionContributionItem.java:72"
        },
        {
          "method": "org.eclipse.swt.widgets.EventTable.sendEvent",
          "source": "EventTable.java"
        },
        {
          "method": "org.eclipse.swt.widgets.Widget.sendEvent",
          "source": "Widget.java"
        },
        {
          "method": "org.eclipse.swt.widgets.Display.runDeferredEvents",
          "source": "Display.java"
        },
        {
          "method": "org.eclipse.swt.widgets.Display.readAndDispatch",
          "source": "Display.java"
        },
        {
          "method": "org.eclipse.ui.internal.Workbench.runEventLoop",
          "source": "Workbench.java:1402"
        },
        {
          "method": "org.eclipse.ui.internal.Workbench.run",
          "source": "Workbench.java:1385"
        },
        {
          "method": "org.eclipse.core.internal.boot.InternalBootLoader.run",
          "source": "InternalBootLoader.java:858"
        },
        {
          "method": "org.eclipse.core.boot.BootLoader.run",
          "source": "BootLoader.java:461"
        },
        {
          "method": "java.lang.reflect.AccessibleObject.invokeL",
          "source": "AccessibleObject.java:207"
        },
        {
          "method": "java.lang.reflect.Method.invoke",
          "source": "Method.java:271"
        },
        {
          "method": "org.eclipse.core.launcher.Main.basicRun",
          "source": "Main.java:291"
        },
        {
          "method": "org.eclipse.core.launcher.Main.run",
          "source": "Main.java:747"
        },
        {
          "method": "org.eclipse.core.launcher.Main.main",
          "source": "Main.java:583"
        }
      ],
      "number": 0,
      "commentIndex": 0,
      "bugId": "45673",
      "date": "2003-10-28T15:53:50+01:00",
      "product": "JDT",
      "component": "UI",
      "severity": "normal"
    }
  ],
  "groupId": "45673",
  "bugId": "45673",
  "date": "2003-10-28T15:53:50+01:00",
  "product": "JDT",
  "component": "UI",
  "severity": "normal"
}